summary_AutomatchType,summary_Abroad,summary_Weight,summary_Title,summary_JobHeadline,summary_Presentation,summary_HiringOrgName,summary_WorkPlaceAddress,summary_WorkPlacePostalCode,summary_WorkPlaceCity,summary_WorkPlaceOtherAddress,summary_WorkPlaceAbroad,summary_WorkPlaceNotStatic,summary_UseWorkPlaceAddressForJoblog,summary_PostingCreated,summary_LastDateApplication,summary_FormattedLastDateApplication,summary_AssignmentStartDate,summary_IsHotjob,summary_IsExternal,summary_Url,summary_Region,summary_Municipality,summary_Country,summary_PostalCode,summary_PostalCodeName,summary_JobAnnouncementType,summary_EmploymentType,summary_WorkHours,summary_OccupationArea,summary_OccupationGroup,summary_Occupation,summary_Location,summary_JoblogWorkTime_WorkHour,summary_JoblogWorkTime_DailyWorkTime,summary_WorkplaceID,summary_OrganisationId,summary_HiringOrgCVR,summary_UserLoggedIn,summary_AnonymousEmployer,summary_ShareUrl,summary_DetailsUrl,summary_JobLogUrl,summary_HasLocationValues,summary_ID,summary_Latitude,summary_Longitude,details_WorkSchedule,details_WorkConditions,details_EmploymentTypes,details_WorkPlace_Name,details_WorkPlace_Address_AddressLine,details_WorkPlace_Address_Country_Id,details_WorkPlace_Address_Country_Name,details_WorkPlace_Address_Municipality_Id,details_WorkPlace_Address_Municipality_Name,details_WorkPlace_Address_Region_Id,details_WorkPlace_Address_Region_Name,details_WorkPlace_Address_PostalCode,details_WorkPlace_Address_City,details_WorkPlace_PhoneNumber_Number,details_WorkPlace_PhoneNumber_Type,details_WorkPlace_PhoneNumber_Description,details_WorkPlace_FaxNumber,details_WorkPlace_Email,details_WorkPlace_WebAddress,details_WorkPlace_Description,details_WorkPlace_Logo,details_WorkPlace_WorkPlaceOrganizationNumber,details_WorkPlace_OrganizationNumber,details_WorkPlace_OrganizationDescription,details_JobPositionPosting_Id,details_JobPositionPosting_HiringOrg_Name,details_JobPositionPosting_HiringOrg_Address_AddressLine,details_JobPositionPosting_HiringOrg_Address_Country_Id,details_JobPositionPosting_HiringOrg_Address_Country_Name,details_JobPositionPosting_HiringOrg_Address_Municipality_Id,details_JobPositionPosting_HiringOrg_Address_Municipality_Name,details_JobPositionPosting_HiringOrg_Address_Region_Id,details_JobPositionPosting_HiringOrg_Address_Region_Name,details_JobPositionPosting_HiringOrg_Address_PostalCode,details_JobPositionPosting_HiringOrg_Address_City,details_JobPositionPosting_HiringOrg_PhoneNumber_Number,details_JobPositionPosting_HiringOrg_PhoneNumber_Type,details_JobPositionPosting_HiringOrg_PhoneNumber_Description,details_JobPositionPosting_HiringOrg_FaxNumber,details_JobPositionPosting_HiringOrg_Email,details_JobPositionPosting_HiringOrg_WebAddress,details_JobPositionPosting_HiringOrg_Description,details_JobPositionPosting_HiringOrg_Logo,details_JobPositionPosting_HiringOrg_WorkPlaceOrganizationNumber,details_JobPositionPosting_HiringOrg_OrganizationNumber,details_JobPositionPosting_HiringOrg_OrganizationDescription,details_JobPositionPosting_RecruitingCompany,details_JobPositionPosting_PublicationStartDate,details_JobPositionPosting_PublicationEndDate,details_JobPositionPosting_JobPositionInformation_PositionTitle,details_JobPositionPosting_JobPositionInformation_Purpose,details_JobPositionPosting_JobPositionInformation_WorkLocation_AddressLine,details_JobPositionPosting_JobPositionInformation_WorkLocation_Country_Id,details_JobPositionPosting_JobPositionInformation_WorkLocation_Country_Name,details_JobPositionPosting_JobPositionInformation_WorkLocation_Municipality_Id,details_JobPositionPosting_JobPositionInformation_WorkLocation_Municipality_Name,details_JobPositionPosting_JobPositionInformation_WorkLocation_Region_Id,details_JobPositionPosting_JobPositionInformation_WorkLocation_Region_Name,details_JobPositionPosting_JobPositionInformation_WorkLocation_PostalCode,details_JobPositionPosting_JobPositionInformation_WorkLocation_City,details_JobPositionPosting_JobPositionInformation_EmploymentType,details_JobPositionPosting_JobPositionInformation_WeeklyWorkHours_TypeId,details_JobPositionPosting_JobPositionInformation_WeeklyWorkHours_TypeName,details_JobPositionPosting_JobPositionInformation_WeeklyWorkHours_Description,details_JobPositionPosting_JobPositionInformation_CompensationDescription,details_JobPositionPosting_JobPositionInformation_NumberToFill,details_JobPositionPosting_JobPositionInformation_DriverLicense,details_JobPositionPosting_JobPositionInformation_Occupation_Name,details_JobPositionPosting_JobPositionInformation_Occupation_DiscoWeb,details_JobPositionPosting_JobPositionInformation_Occupation_AlternateNames,details_JobPositionPosting_JobPositionInformation_Occupation_GroupId,details_JobPositionPosting_JobPositionInformation_Occupation_AreaId,details_JobPositionPosting_JobPositionInformation_IsGovernmentHiring,details_JobPositionPosting_JobPositionInformation_JppContacts,details_JobPositionPosting_JobPositionInformation_EmploymentDate,details_JobPositionPosting_IsRecruitmentOfForeignNationals,details_JobPositionPosting_IsWorkInDenmark,details_JobPositionPosting_IsAnonymousEmployer,details_JobPositionPosting_IsDisabilityFriendly,details_JobPositionPosting_JppType,details_JobPositionPosting_ApplicationDetails_WorkHourMax,details_JobPositionPosting_ApplicationDetails_WorkHourMin,details_JobPositionPosting_ApplicationDetails_DailyWorkTimeWeekend,details_JobPositionPosting_ApplicationDetails_DailyWorkTimeNight,details_JobPositionPosting_ApplicationDetails_DailyWorkTimeEvening,details_JobPositionPosting_ApplicationDetails_DailyWorkTimeDay,details_JobPositionPosting_ApplicationDetails_DailyWorkTimeMorning,details_JobPositionPosting_ApplicationDetails_DailyWorkTimeVarious,details_JobPositionPosting_ApplicationDetails_ReferenceText,details_JobPositionPosting_ApplicationDetails_RemarksToApplicant,details_JobPositionPosting_ApplicationDetails_ByEmail,details_JobPositionPosting_ApplicationDetails_ByPhone,details_JobPositionPosting_ApplicationDetails_ApplyViaUrl,details_JobPositionPosting_ApplicationDetails_ReplyInWriting,details_JobPositionPosting_ApplicationDetails_ApplicationDeadlineDate,details_JobPositionPosting_Status,details_LogoUrl,details_Address,details_ShowMap,details_ShowShareButtonJobLog,details_JobLogUrl,details_JobLogTemplateModel_Identifier,details_JobLogTemplateModel_UseWorkPlaceAddressForJoblog,details_JobLogTemplateModel_Category,details_JobLogTemplateModel_CvCustomerIdentifier,details_JobLogTemplateModel_JobSeekingStatus,details_JobLogTemplateModel_Title,details_JobLogTemplateModel_IsApplicationSourceRequired,details_JobLogTemplateModel_ApplicationSource,details_JobLogTemplateModel_IsWeeklyWorkTimeRequired,details_JobLogTemplateModel_WeeklyWorkTime,details_JobLogTemplateModel_HoursPerWeek,details_JobLogTemplateModel_JobnetJobPostingIdentifier,details_JobLogTemplateModel_JobAdDocument_Title,details_JobLogTemplateModel_JobAdDocument_Identifier,details_JobLogTemplateModel_JobAdDocument_IsDeletedBySystem,details_JobLogTemplateModel_JobAdDocument_IsDeletedByUser,details_JobLogTemplateModel_JobAdFile,details_JobLogTemplateModel_Company_JobLogEntryCategory,details_JobLogTemplateModel_Company_ShowAddressFieldsEvenIfEmpty,details_JobLogTemplateModel_Company_Name,details_JobLogTemplateModel_Company_Address,details_JobLogTemplateModel_Company_Country,details_JobLogTemplateModel_Company_EmploymentAreaID,details_JobLogTemplateModel_Company_PostCode,details_JobLogTemplateModel_Company_IsCountryAndTownAndPostCodeEmpty,details_JobLogTemplateModel_Company_IsTownAndPostCodeEmpty,details_JobLogTemplateModel_Company_IsCountryDanmark,details_JobLogTemplateModel_Company_Town,details_JobLogTemplateModel_Company_ContactPerson,details_JobLogTemplateModel_Company_Phone,details_JobLogTemplateModel_Company_Email,details_JobLogTemplateModel_Company_Latitude,details_JobLogTemplateModel_Company_Longitude,details_JobLogTemplateModel_Company_DailyTravelTimeInMinutes,details_JobLogTemplateModel_Company_DistanceToCompanyInMeters,details_JobLogTemplateModel_Company_IsCreateMode,details_JobLogTemplateModel_TypeOfSubmission,details_JobLogTemplateModel_SubmissionDate,details_JobLogTemplateModel_SubmissionDateFormatted,details_JobLogTemplateModel_SubmissionDateTiks,details_JobLogTemplateModel_IsSubmissionDateRequired,details_JobLogTemplateModel_Status,details_JobLogTemplateModel_DateCreatedFormatted,details_JobLogTemplateModel_DateCreated,details_JobLogTemplateModel_DateModifiedFormatted,details_JobLogTemplateModel_DateModified,details_JobLogTemplateModel_LastModifiedDateTiks,details_JobLogTemplateModel_DateClosed,details_JobLogTemplateModel_JobApplicationDocument_Title,details_JobLogTemplateModel_JobApplicationDocument_Identifier,details_JobLogTemplateModel_JobApplicationDocument_IsDeletedBySystem,details_JobLogTemplateModel_JobApplicationDocument_IsDeletedByUser,details_JobLogTemplateModel_CvDocument_Title,details_JobLogTemplateModel_CvDocument_Identifier,details_JobLogTemplateModel_CvDocument_IsDeletedBySystem,details_JobLogTemplateModel_CvDocument_IsDeletedByUser,details_JobLogTemplateModel_JobApplicationFile,details_JobLogTemplateModel_CvFile,details_JobLogTemplateModel_SubmissionDeadlineDate,details_JobLogTemplateModel_IsPersisted,details_JobLogTemplateModel_ServerValidationErrors,details_JobLogTemplateModel_HasServerValidationErrors,details_JoblogWorkTime_WorkHour,details_JoblogWorkTime_DailyWorkTime,details_Place,details_OpenPrintDialog,details_WorkPlaceInfoText,details_JobCenterContactDetails,details_WorkPlaceDescriptionText,details_FavoriteText,details_IsFavorite,details_ShowFavorite,details_MetaOgTextForSharing,details_DescriptionForSharing,details_TitleForSharing,details_RutePlan,details_FormattedPurpose,details_MapUrl,details_OrganizationNumber,details_ShowSearchJobButton,details_ShowPrint,details_BackToFindWorkButtonUrl,isExternal
0,False,1,Surf & SUP Danmark søger en struktureret og ihærdig eventkoordinator til planlægning og afvikling af forbundets nationale surf events.,Surf & SUP Danmark søger en struktureret og ihærdig eventkoordinator til planlægning og afvikling af forbundets nationale surf events.,"Brænder du for at skabe ekstraordinære og meningsfulde events, og kunne du tænke dig at være en del af surf sportens udvikling i Danmark? Så er du måske Surf &amp; SUP Danmark",Dansk Surf & Rafting Forbund,   ,,,True,False,True,False,2025-01-23T00:00:00,2025-02-17T00:00:00,17. februar 2025,0001-01-01T00:00:00,False,False,https://job.jobnet.dk/CV/FindWork/Details/05d64d78-2a8e-407a-b2cb-2d6c4208b440,,,Danmark,,,Almindelige vilkår,Tidsbegrænset ansættelse,Deltid,"Medie, kultur, turisme, idræt og underholdning","Optræden, forlystelses- og modelarbejde",Eventmanager,,(7 timer ugentligt),"Dag, weekend",1018328387,,34779333,False,False,https://job.jobnet.dk/CV/FindWork/DetailsSocialmedia/05d64d78-2a8e-407a-b2cb-2d6c4208b440,https://job.jobnet.dk/CV/FindWork/Details/05d64d78-2a8e-407a-b2cb-2d6c4208b440,https://job.jobnet.dk/CV/FindWork/Details/05d64d78-2a8e-407a-b2cb-2d6c4208b440,False,05d64d78-2a8e-407a-b2cb-2d6c4208b440,0,0,"{'Id': 1, 'Name': 'Fuldtid'}, {'Id': 16, 'Name': 'Deltid'}","{'Id': 1, 'Name': 'Almindelige vilkår'}, {'Id': 2, 'Name': 'Fleksjob'}, {'Id': 3, 'Name': 'Skånejob'}, {'Id': 4, 'Name': 'Egnet til efterlønnere og seniorer'}, {'Id': 5, 'Name': 'Job med løntilskud'}, {'Id': 6, 'Name': 'Rotationsjob'}, {'Id': 7, 'Name': 'Virksomhedspraktik'}","{'Id': 1, 'Name': 'Fastansættelse'}, {'Id': 16, 'Name': 'Tidsbegrænset ansættelse'}",Dansk Surf & Rafting Forbund,,58,Danmark,0,,0,,,,,0,Primary,,sofie@surfsup.dk,,None,,1018328387,34779333,None,05d64d78-2a8e-407a-b2cb-2d6c4208b440,Dansk Surf & Rafting Forbund,,58,Danmark,0,,0,,,,,0,Primary,,sofie@surfsup.dk,,None,,1018328387,34779333,None,,2025-01-23T00:00:00+01:00,2025-02-17T12:00:00+01:00,Surf & SUP Danmark søger en struktureret og ihærdig eventkoordinator til planlægning og afvikling af forbundets nationale surf events.,"Brænder du for at skabe ekstraordinære og meningsfulde events, og  kunne du tænke dig at være en del af surf sportens udvikling i Danmark?  Så er du måske Surf & SUP Danmarks nye eventkoordinator for forbun dets surf events. 
 Surf & SUP Danmark afvikler 8 årlige surf events fordelt på et Danmarksmesterskab og en serie af events; Danish Shortboard Open, Danish Longboard Open og Danish Junior Surf Tour (U18). De mange events skaber et stærkt aktivitetsfællesskab for både bredden og eliten i det danske surf miljø og konkurrencerne er en integreret del af Surf & SUP Danmarks udvikling og professionalisering af surf sporten. Vores events har fokus på at stimulere en øget tilgang af udøvere til sporten og er samtidig en god brandingplatform for foreninger, atleter, Surf & SUP Danmark og kommercielle samarbejdspartnere. Tilsvarende skabes der stærke fællesskaber i klubberne og blandt selvorganiserede udøvere på tværs af landet, ligesom de dygtigste atleter har en platform, som de kan performe på. 
 Alle events forankres og afvikles som udgangspunkt i et tæt samarbejde med lokale foreninger og ildsjæle, som bidrager til afvikling af den enkelte event. Ved alle events opereres der med en backup weekend jf. risikoen for aflysning ift. bølgeforhold. 
 Dine opgaver 
 Vores surf events indeholder mange forskellige typer arbejdsopgaver og vi søger derfor en eventkoordinator der i samarbejde med de enkelte foreninger kan koordinere indsatsen for de pågældende events. Du vil få det overordnede ansvar for at alle events koordineres, udvikles og planlægges med den enkelte forening. 
 For hver enkelt event får du således ansvaret for at 
 
 facilitere og planlægge samarbejdet med den lokale forening 
 sikre en god kommunikation og SoMe før, under og efter eventen 
 oprette events og administrere tilmeldinger via LiveHeats 
 vurdere bølgeforhold og grundlag for konkurrenceafvikling (i samarbejde med Head Judge) 
 booke eventuelle overnatninger 
 organisere og pakke eventudstyr i samarbejde med surf tour crewet i Klitmøller 
 opbygge eventområde med lokale ildsjæle 
 sikre den sportslige afvikling af eventen 
 skabe synlighed af partnere (og evt. skabe nye partnerskaber) 
 håndtere budget og økonomi 
 evaluere og afrapportere 
 
 Hvad lægger vi vægt på? 
 Det vil være en stor fordel, at du har erfaring med og kendskab til afvikling af events eller andre mindre og større arrangementer. Derudover lægger vi vægt på at: 
 
 Du er initiativrig og har en god energi, som kan bidrage til en god stemning på vores events. 
 Du kan have mange bolde i luften på én gang og holde hovedet koldt i pressede situationer 
 Du har et stort overblik med sans for både detaljer og struktur 
 Du er god til at tage ansvar og samtidig uddelegere opgaver 
 Du er god til at skabe relationer og er løsningsorienteret i dit samarbejde med andre 
 Du trives med både de administrative og praktiske opgaver 
 Du har kendskab til vandsport, herunder surf sporten 
 Det er en fordel, men ikke en nødvendighed, at du har kendskab til kommercielle partnerskaber 
 
 Hvad kan vi tilbyde? 
 Vi tilbyder et sjovt, spændene, udfordrende og lærerigt bi-job i et dynamisk og innovativt idrætsforbund, hvor du vil samarbejde med en masse spændende mennesker og ambitiøse ildsjæle. Med stillingen får du et tæt forhold til både bredden og eliten indenfor surf sporten og du får mulighed for at sætte dit personlige præg på udviklingen og afviklingen af surf events i Danmark. 
 Vi går op i at drive et sundt og bæredygtigt arbejdsmiljø med fokus på at skabe de bedst tænkelige rammer for medarbejderne. Vi arbejder derfor med tillid og høj fleksibilitet som nogle af de vigtigste parametre i vores arbejde, og der ydes stor fleksibilitet. Vi elsker at forfølge gode idéer og ser ikke fejl som et nederlag, men som en mulighed for at vi sammen bliver endnu dygtigere. 
 Praktisk information & ansøgningsfrist 
 Der gives et fast honorar på 26.000 kr. for planlægningen af årets events. Dertil gives der et honorar på 3.000 kr. for hvert afviklet event (samlet op til 50.000 kr.). Arbejdet som eventkoordinator for vores surf events i 2025 er timesat til ca. 200 timer fordelt over eventsæsonen (marts – oktober). 
 Som eventkoordinator har du mulighed for at anvende en kontorplads i Idrættens Hus, Brøndby Stadion 20, 2650 Brøndby, men du er også meget velkommen til at arbejde hjemmefra. I Idrættens Hus vil du have fri adgang til træningscenter. Det er i øvrigt et krav at du har et B kørekort. 
 En kort motiveret ansøgning og CV sendes senest  mandag d. 17. februar  2025 kl. 12:00  til sofie@surfsup.dk. Samtaler forventes afholdt d. 25. februar 2025 med forventet ansættelse kort tid efter. 
 For yderligere information om stillingen kan du kontakte konsulent, Sofie Hammelsvang, på sofie@surfsup.dk eller tlf.: 27 85 98 92.",,58,Danmark,0,,0,,,,16,16,Deltid,None,None,1,"{'DriversLicenceType': 3, 'Name': 'Almindelig bil', 'Description': ''}, {'DriversLicenceType': 11, 'Name': 'Villig til at bruge egen bil', 'Description': ''}",Eventmanager,0,"Bryllupsarrangør, Musikarrangør, 1719, 1720, 1721",0,0,False,"{'Email': 'sofie@surfsup.dk', 'PersonName': 'Sofie Hammelsvang', 'FirstName': 'Sofie', 'LastName': 'Hammelsvang', 'PositionTitle': 'Projektkonsulent', 'PhoneNumbers': [{'Number': '27859892', 'Type': 0, 'Description': 'Primary'}]}",,False,False,False,False,4,7,7,True,False,False,True,False,False,,,sofie@surfsup.dk,,,False,2025-02-17T00:00:00+01:00,7,/CV/FindWork/GetLogo?JobAdId=05d64d78-2a8e-407a-b2cb-2d6c4208b440&Organisation=34779333,",, ",False,False,/CV/Jobseeking/JobLog/CreateJobSearch?JobnetJobPostingIdentifier=05d64d78-2a8e-407a-b2cb-2d6c4208b440&Company.Name=Dansk Surf & Rafting Forbund&SubmissionDeadlineDate=2025-2-17&Title=Surf & SUP Danmark søger en struktureret og ihærdig eventkoordinator til planlægning og afvikling af forbundets nationale surf events.&WeeklyWorkTime=2,00000000-0000-0000-0000-000000000000,False,0,,,Surf & SUP Danmark søger en struktureret og ihærdig eventkoordinator til planlægning og afvikling af forbundets nationale surf events.,True,,True,2,,05d64d78-2a8e-407a-b2cb-2d6c4208b440,,,False,False,,0,False,Dansk Surf & Rafting Forbund,,,,,True,True,False,,Sofie Hammelsvang,27859892,sofie@surfsup.dk,,,,,False,,2025-02-17T00:00:00+01:00,,0,False,0,,,,,0,,,,False,False,,,False,False,,,,False,,False,(7 timer ugentligt),"Dag, weekend",Arbejdspladsen ligger i Danmark,False,Dansk Surf & Rafting Forbund,,None,,False,False,"Brænder du for at skabe ekstraordinære og meningsfulde events, og kunne du tænke dig at være en del af surf sportens udvikling i Danmark? Så er du måske Surf  SUP Danmarks nye eventkoordinator for forbundets surf events.
Surf  SUP Danmark afvikler 8 årlige surf events fordelt på et Danmarksmesterskab og en serie af events; Danish Shortboard Open, D","""Brænder du for at skabe ekstraordinære og meningsfulde events, og kunne du tænke dig at være en del af surf sportens udvikling i Danmark? Så er du måske Surf  SUP Danmarks nye eventkoordinator for forbundets surf events.\nSurf  SUP Danmark afvikler 8 årlige surf events fordelt på et Danmarksmesterskab og en serie af events; Danish Shortboard Open, D""","""Surf \u0026 SUP Danmark søger en struktureret og ihærdig eventkoordinator til planlægning og afvikling af forbundets nationale surf events.""","https://www.google.dk/maps/dir//,,+/","Brænder du for at skabe ekstraordinære og meningsfulde events, og  kunne du tænke dig at være en del af surf sportens udvikling i Danmark?  Så er du måske Surf & SUP Danmarks nye eventkoordinator for forbun dets surf events. 
 Surf & SUP Danmark afvikler 8 årlige surf events fordelt på et Danmarksmesterskab og en serie af events; Danish Shortboard Open, Danish Longboard Open og Danish Junior Surf Tour (U18). De mange events skaber et stærkt aktivitetsfællesskab for både bredden og eliten i det danske surf miljø og konkurrencerne er en integreret del af Surf & SUP Danmarks udvikling og professionalisering af surf sporten. Vores events har fokus på at stimulere en øget tilgang af udøvere til sporten og er samtidig en god brandingplatform for foreninger, atleter, Surf & SUP Danmark og kommercielle samarbejdspartnere. Tilsvarende skabes der stærke fællesskaber i klubberne og blandt selvorganiserede udøvere på tværs af landet, ligesom de dygtigste atleter har en platform, som de kan performe på. 
 Alle events forankres og afvikles som udgangspunkt i et tæt samarbejde med lokale foreninger og ildsjæle, som bidrager til afvikling af den enkelte event. Ved alle events opereres der med en backup weekend jf. risikoen for aflysning ift. bølgeforhold. 
 Dine opgaver 
 Vores surf events indeholder mange forskellige typer arbejdsopgaver og vi søger derfor en eventkoordinator der i samarbejde med de enkelte foreninger kan koordinere indsatsen for de pågældende events. Du vil få det overordnede ansvar for at alle events koordineres, udvikles og planlægges med den enkelte forening. 
 For hver enkelt event får du således ansvaret for at 
 
 facilitere og planlægge samarbejdet med den lokale forening 
 sikre en god kommunikation og SoMe før, under og efter eventen 
 oprette events og administrere tilmeldinger via LiveHeats 
 vurdere bølgeforhold og grundlag for konkurrenceafvikling (i samarbejde med Head Judge) 
 booke eventuelle overnatninger 
 organisere og pakke eventudstyr i samarbejde med surf tour crewet i Klitmøller 
 opbygge eventområde med lokale ildsjæle 
 sikre den sportslige afvikling af eventen 
 skabe synlighed af partnere (og evt. skabe nye partnerskaber) 
 håndtere budget og økonomi 
 evaluere og afrapportere 
 
 Hvad lægger vi vægt på? 
 Det vil være en stor fordel, at du har erfaring med og kendskab til afvikling af events eller andre mindre og større arrangementer. Derudover lægger vi vægt på at: 
 
 Du er initiativrig og har en god energi, som kan bidrage til en god stemning på vores events. 
 Du kan have mange bolde i luften på én gang og holde hovedet koldt i pressede situationer 
 Du har et stort overblik med sans for både detaljer og struktur 
 Du er god til at tage ansvar og samtidig uddelegere opgaver 
 Du er god til at skabe relationer og er løsningsorienteret i dit samarbejde med andre 
 Du trives med både de administrative og praktiske opgaver 
 Du har kendskab til vandsport, herunder surf sporten 
 Det er en fordel, men ikke en nødvendighed, at du har kendskab til kommercielle partnerskaber 
 
 Hvad kan vi tilbyde? 
 Vi tilbyder et sjovt, spændene, udfordrende og lærerigt bi-job i et dynamisk og innovativt idrætsforbund, hvor du vil samarbejde med en masse spændende mennesker og ambitiøse ildsjæle. Med stillingen får du et tæt forhold til både bredden og eliten indenfor surf sporten og du får mulighed for at sætte dit personlige præg på udviklingen og afviklingen af surf events i Danmark. 
 Vi går op i at drive et sundt og bæredygtigt arbejdsmiljø med fokus på at skabe de bedst tænkelige rammer for medarbejderne. Vi arbejder derfor med tillid og høj fleksibilitet som nogle af de vigtigste parametre i vores arbejde, og der ydes stor fleksibilitet. Vi elsker at forfølge gode idéer og ser ikke fejl som et nederlag, men som en mulighed for at vi sammen bliver endnu dygtigere. 
 Praktisk information & ansøgningsfrist 
 Der gives et fast honorar på 26.000 kr. for planlægningen af årets events. Dertil gives der et honorar på 3.000 kr. for hvert afviklet event (samlet op til 50.000 kr.). Arbejdet som eventkoordinator for vores surf events i 2025 er timesat til ca. 200 timer fordelt over eventsæsonen (marts – oktober). 
 Som eventkoordinator har du mulighed for at anvende en kontorplads i Idrættens Hus, Brøndby Stadion 20, 2650 Brøndby, men du er også meget velkommen til at arbejde hjemmefra. I Idrættens Hus vil du have fri adgang til træningscenter. Det er i øvrigt et krav at du har et B kørekort. 
 En kort motiveret ansøgning og CV sendes senest  mandag d. 17. februar  2025 kl. 12:00  til sofie@surfsup.dk. Samtaler forventes afholdt d. 25. februar 2025 med forventet ansættelse kort tid efter. 
 For yderligere information om stillingen kan du kontakte konsulent, Sofie Hammelsvang, på sofie@surfsup.dk eller tlf.: 27 85 98 92.","https://www.google.dk/maps/place/,,+/",34779333,False,False,,False
