summary_AutomatchType,summary_Abroad,summary_Weight,summary_Title,summary_JobHeadline,summary_Presentation,summary_HiringOrgName,summary_WorkPlaceAddress,summary_WorkPlacePostalCode,summary_WorkPlaceCity,summary_WorkPlaceOtherAddress,summary_WorkPlaceAbroad,summary_WorkPlaceNotStatic,summary_UseWorkPlaceAddressForJoblog,summary_PostingCreated,summary_LastDateApplication,summary_FormattedLastDateApplication,summary_AssignmentStartDate,summary_IsHotjob,summary_IsExternal,summary_Url,summary_Region,summary_Municipality,summary_Country,summary_PostalCode,summary_PostalCodeName,summary_JobAnnouncementType,summary_EmploymentType,summary_WorkHours,summary_OccupationArea,summary_OccupationGroup,summary_Occupation,summary_Location_Latitude,summary_Location_Longitude,summary_JoblogWorkTime_WorkHour,summary_JoblogWorkTime_DailyWorkTime,summary_WorkplaceID,summary_OrganisationId,summary_HiringOrgCVR,summary_UserLoggedIn,summary_AnonymousEmployer,summary_ShareUrl,summary_DetailsUrl,summary_JobLogUrl,summary_HasLocationValues,summary_ID,summary_Latitude,summary_Longitude,details_WorkSchedule,details_WorkConditions,details_EmploymentTypes,details_WorkPlace_Name,details_WorkPlace_Address_AddressLine,details_WorkPlace_Address_Country_Id,details_WorkPlace_Address_Country_Name,details_WorkPlace_Address_Municipality_Id,details_WorkPlace_Address_Municipality_Name,details_WorkPlace_Address_Region_Id,details_WorkPlace_Address_Region_Name,details_WorkPlace_Address_PostalCode,details_WorkPlace_Address_City,details_WorkPlace_PhoneNumber_Number,details_WorkPlace_PhoneNumber_Type,details_WorkPlace_PhoneNumber_Description,details_WorkPlace_FaxNumber,details_WorkPlace_Email,details_WorkPlace_WebAddress,details_WorkPlace_Description,details_WorkPlace_Logo,details_WorkPlace_WorkPlaceOrganizationNumber,details_WorkPlace_OrganizationNumber,details_WorkPlace_OrganizationDescription,details_JobPositionPosting_Id,details_JobPositionPosting_HiringOrg_Name,details_JobPositionPosting_HiringOrg_Address_AddressLine,details_JobPositionPosting_HiringOrg_Address_Country_Id,details_JobPositionPosting_HiringOrg_Address_Country_Name,details_JobPositionPosting_HiringOrg_Address_Municipality_Id,details_JobPositionPosting_HiringOrg_Address_Municipality_Name,details_JobPositionPosting_HiringOrg_Address_Region_Id,details_JobPositionPosting_HiringOrg_Address_Region_Name,details_JobPositionPosting_HiringOrg_Address_PostalCode,details_JobPositionPosting_HiringOrg_Address_City,details_JobPositionPosting_HiringOrg_PhoneNumber_Number,details_JobPositionPosting_HiringOrg_PhoneNumber_Type,details_JobPositionPosting_HiringOrg_PhoneNumber_Description,details_JobPositionPosting_HiringOrg_FaxNumber,details_JobPositionPosting_HiringOrg_Email,details_JobPositionPosting_HiringOrg_WebAddress,details_JobPositionPosting_HiringOrg_Description,details_JobPositionPosting_HiringOrg_Logo,details_JobPositionPosting_HiringOrg_WorkPlaceOrganizationNumber,details_JobPositionPosting_HiringOrg_OrganizationNumber,details_JobPositionPosting_HiringOrg_OrganizationDescription,details_JobPositionPosting_RecruitingCompany,details_JobPositionPosting_PublicationStartDate,details_JobPositionPosting_PublicationEndDate,details_JobPositionPosting_JobPositionInformation_PositionTitle,details_JobPositionPosting_JobPositionInformation_Purpose,details_JobPositionPosting_JobPositionInformation_WorkLocation_AddressLine,details_JobPositionPosting_JobPositionInformation_WorkLocation_Country_Id,details_JobPositionPosting_JobPositionInformation_WorkLocation_Country_Name,details_JobPositionPosting_JobPositionInformation_WorkLocation_Municipality_Id,details_JobPositionPosting_JobPositionInformation_WorkLocation_Municipality_Name,details_JobPositionPosting_JobPositionInformation_WorkLocation_Region_Id,details_JobPositionPosting_JobPositionInformation_WorkLocation_Region_Name,details_JobPositionPosting_JobPositionInformation_WorkLocation_PostalCode,details_JobPositionPosting_JobPositionInformation_WorkLocation_City,details_JobPositionPosting_JobPositionInformation_EmploymentType,details_JobPositionPosting_JobPositionInformation_WeeklyWorkHours_TypeId,details_JobPositionPosting_JobPositionInformation_WeeklyWorkHours_TypeName,details_JobPositionPosting_JobPositionInformation_WeeklyWorkHours_Description,details_JobPositionPosting_JobPositionInformation_CompensationDescription,details_JobPositionPosting_JobPositionInformation_NumberToFill,details_JobPositionPosting_JobPositionInformation_DriverLicense,details_JobPositionPosting_JobPositionInformation_Occupation_Name,details_JobPositionPosting_JobPositionInformation_Occupation_DiscoWeb,details_JobPositionPosting_JobPositionInformation_Occupation_AlternateNames,details_JobPositionPosting_JobPositionInformation_Occupation_GroupId,details_JobPositionPosting_JobPositionInformation_Occupation_AreaId,details_JobPositionPosting_JobPositionInformation_IsGovernmentHiring,details_JobPositionPosting_JobPositionInformation_JppContacts,details_JobPositionPosting_JobPositionInformation_EmploymentDate,details_JobPositionPosting_IsRecruitmentOfForeignNationals,details_JobPositionPosting_IsWorkInDenmark,details_JobPositionPosting_IsAnonymousEmployer,details_JobPositionPosting_IsDisabilityFriendly,details_JobPositionPosting_JppType,details_JobPositionPosting_ApplicationDetails_WorkHourMax,details_JobPositionPosting_ApplicationDetails_WorkHourMin,details_JobPositionPosting_ApplicationDetails_DailyWorkTimeWeekend,details_JobPositionPosting_ApplicationDetails_DailyWorkTimeNight,details_JobPositionPosting_ApplicationDetails_DailyWorkTimeEvening,details_JobPositionPosting_ApplicationDetails_DailyWorkTimeDay,details_JobPositionPosting_ApplicationDetails_DailyWorkTimeMorning,details_JobPositionPosting_ApplicationDetails_DailyWorkTimeVarious,details_JobPositionPosting_ApplicationDetails_ReferenceText,details_JobPositionPosting_ApplicationDetails_RemarksToApplicant,details_JobPositionPosting_ApplicationDetails_ByEmail,details_JobPositionPosting_ApplicationDetails_ByPhone,details_JobPositionPosting_ApplicationDetails_ApplyViaUrl,details_JobPositionPosting_ApplicationDetails_ReplyInWriting,details_JobPositionPosting_ApplicationDetails_ApplicationDeadlineDate,details_JobPositionPosting_Status,details_LogoUrl,details_Address,details_ShowMap,details_ShowShareButtonJobLog,details_JobLogUrl,details_JobLogTemplateModel_Identifier,details_JobLogTemplateModel_UseWorkPlaceAddressForJoblog,details_JobLogTemplateModel_Category,details_JobLogTemplateModel_CvCustomerIdentifier,details_JobLogTemplateModel_JobSeekingStatus,details_JobLogTemplateModel_Title,details_JobLogTemplateModel_IsApplicationSourceRequired,details_JobLogTemplateModel_ApplicationSource,details_JobLogTemplateModel_IsWeeklyWorkTimeRequired,details_JobLogTemplateModel_WeeklyWorkTime,details_JobLogTemplateModel_HoursPerWeek,details_JobLogTemplateModel_JobnetJobPostingIdentifier,details_JobLogTemplateModel_JobAdDocument_Title,details_JobLogTemplateModel_JobAdDocument_Identifier,details_JobLogTemplateModel_JobAdDocument_IsDeletedBySystem,details_JobLogTemplateModel_JobAdDocument_IsDeletedByUser,details_JobLogTemplateModel_JobAdFile,details_JobLogTemplateModel_Company_JobLogEntryCategory,details_JobLogTemplateModel_Company_ShowAddressFieldsEvenIfEmpty,details_JobLogTemplateModel_Company_Name,details_JobLogTemplateModel_Company_Address,details_JobLogTemplateModel_Company_Country,details_JobLogTemplateModel_Company_EmploymentAreaID,details_JobLogTemplateModel_Company_PostCode,details_JobLogTemplateModel_Company_IsCountryAndTownAndPostCodeEmpty,details_JobLogTemplateModel_Company_IsTownAndPostCodeEmpty,details_JobLogTemplateModel_Company_IsCountryDanmark,details_JobLogTemplateModel_Company_Town,details_JobLogTemplateModel_Company_ContactPerson,details_JobLogTemplateModel_Company_Phone,details_JobLogTemplateModel_Company_Email,details_JobLogTemplateModel_Company_Latitude,details_JobLogTemplateModel_Company_Longitude,details_JobLogTemplateModel_Company_DailyTravelTimeInMinutes,details_JobLogTemplateModel_Company_DistanceToCompanyInMeters,details_JobLogTemplateModel_Company_IsCreateMode,details_JobLogTemplateModel_TypeOfSubmission,details_JobLogTemplateModel_SubmissionDate,details_JobLogTemplateModel_SubmissionDateFormatted,details_JobLogTemplateModel_SubmissionDateTiks,details_JobLogTemplateModel_IsSubmissionDateRequired,details_JobLogTemplateModel_Status,details_JobLogTemplateModel_DateCreatedFormatted,details_JobLogTemplateModel_DateCreated,details_JobLogTemplateModel_DateModifiedFormatted,details_JobLogTemplateModel_DateModified,details_JobLogTemplateModel_LastModifiedDateTiks,details_JobLogTemplateModel_DateClosed,details_JobLogTemplateModel_JobApplicationDocument_Title,details_JobLogTemplateModel_JobApplicationDocument_Identifier,details_JobLogTemplateModel_JobApplicationDocument_IsDeletedBySystem,details_JobLogTemplateModel_JobApplicationDocument_IsDeletedByUser,details_JobLogTemplateModel_CvDocument_Title,details_JobLogTemplateModel_CvDocument_Identifier,details_JobLogTemplateModel_CvDocument_IsDeletedBySystem,details_JobLogTemplateModel_CvDocument_IsDeletedByUser,details_JobLogTemplateModel_JobApplicationFile,details_JobLogTemplateModel_CvFile,details_JobLogTemplateModel_SubmissionDeadlineDate,details_JobLogTemplateModel_IsPersisted,details_JobLogTemplateModel_ServerValidationErrors,details_JobLogTemplateModel_HasServerValidationErrors,details_JoblogWorkTime_WorkHour,details_JoblogWorkTime_DailyWorkTime,details_Place,details_OpenPrintDialog,details_WorkPlaceInfoText,details_JobCenterContactDetails,details_WorkPlaceDescriptionText,details_FavoriteText,details_IsFavorite,details_ShowFavorite,details_MetaOgTextForSharing,details_DescriptionForSharing,details_TitleForSharing,details_RutePlan,details_FormattedPurpose,details_MapUrl,details_OrganizationNumber,details_ShowSearchJobButton,details_ShowPrint,details_BackToFindWorkButtonUrl,isExternal
0,False,1,"Projektleder, bygge og anlæg","Projektleder, bygge og anlæg","PROJEKTLEDER TIL SJÆLLAND, KT ERHVERVSBYG A/S

KT Erhvervsbyg A/S mangler dig, der har Projektledererfaring, og meget gerne med Erhvervsbyggeri i totalentreprise.&nbsp;
",KT Erhvervsbyg A/S,Ryttervangen 18  ,7323,Give,False,False,False,True,2025-01-26T00:00:00,2025-02-15T23:59:59,15. februar 2025,0001-01-01T00:00:00,False,False,https://job.jobnet.dk/CV/FindWork/Details/0680f023-290c-4fc4-b057-6d04096a298e,Syddanmark,Vejle,Danmark,7323,,Almindelige vilkår,Fastansættelse,Fuldtid,Bygge og anlæg,"Tværgående arbejde, bygge og anlæg",Byggeleder,55.8574,9.271,,Dag,1014319561,,31347327,False,False,https://job.jobnet.dk/CV/FindWork/DetailsSocialmedia/0680f023-290c-4fc4-b057-6d04096a298e,https://job.jobnet.dk/CV/FindWork/Details/0680f023-290c-4fc4-b057-6d04096a298e,https://job.jobnet.dk/CV/FindWork/Details/0680f023-290c-4fc4-b057-6d04096a298e,True,0680f023-290c-4fc4-b057-6d04096a298e,55.8574,9.271,"{'Id': 1, 'Name': 'Fuldtid'}, {'Id': 16, 'Name': 'Deltid'}","{'Id': 1, 'Name': 'Almindelige vilkår'}, {'Id': 2, 'Name': 'Fleksjob'}, {'Id': 3, 'Name': 'Skånejob'}, {'Id': 4, 'Name': 'Egnet til efterlønnere og seniorer'}, {'Id': 5, 'Name': 'Job med løntilskud'}, {'Id': 6, 'Name': 'Rotationsjob'}, {'Id': 7, 'Name': 'Virksomhedspraktik'}","{'Id': 1, 'Name': 'Fastansættelse'}, {'Id': 16, 'Name': 'Tidsbegrænset ansættelse'}",KT Erhvervsbyg A/S,Ryttervangen 18,58,Danmark,630,Vejle,3,Syddanmark,7323,,,0,Primary,,,https://app.jobmatchprofile.com/ftr25s/lemo-recruitment-aps/6psg6g/projektleder-bygge-og-anlag,None,,1014319561,31347327,None,0680f023-290c-4fc4-b057-6d04096a298e,KT Erhvervsbyg A/S,Ryttervangen 18,58,Danmark,630,Vejle,3,Syddanmark,7323,,,0,Primary,,,https://app.jobmatchprofile.com/ftr25s/lemo-recruitment-aps/6psg6g/projektleder-bygge-og-anlag,None,,1014319561,31347327,None,,2025-01-26T00:00:00+01:00,2025-02-15T23:59:59+01:00,"Projektleder, bygge og anlæg","PROJEKTLEDER TIL SJÆLLAND, KT ERHVERVSBYG A/S 
 KT Erhvervsbyg A/S mangler dig, der har Projektledererfaring, og meget gerne med Erhvervsbyggeri i totalentreprise.  
 Kan du håndtere mange forskellige opgaver, informationer etc. i løbet af din arbejdsdag?  
 Så har du lige nu en helt unik mulighed for at bruge din byggefaglighed hos en af de førende aktører indenfor Erhvervsbyggeri i Danmark. 
 Hos KT Erhvervsbyg er vi nemlig meget ambitiøse. Vi ser fortsat en stigende ordrebeholdning og oplever derfor et højt organisatorisk aktivitetsniveau.  
 Vi har gennem tiden specialiseret os i at bygge alle former for erhvervsbyggeri, fra flotte domiciler og førende bilhuse til funktionelle produktions- og lagerfaciliteter.  
 Måske kender du os allerede som vinder af Årets erhvervsbyggeri 2020? Hvis ikke, så får du chancen nu.  
 STILLINGEN  
 Med udgangspunkt fra byggesitet på Sjælland får du mange spændende udfordringer. I samarbejde med vores vores agile projektafdeling i Give arbejder du tæt sammen med vores professionelle team af ingeniører og konstruktører, ligesom du udvikler projektet/projekterne i samarbejde med egen tegnestue eller eksterne arkitekter. Her er der ikke langt fra tanke til handling. 
 Du har dokumenteret erfaring med ledelse af byggeprojekter, hvor du selvstændigt og med succes har haft ansvaret for projekternes fulde gennemførsel. Det er som nævnt ovenfor en fordel, hvis du har arbejdet med byggerier i totalentreprise. 
 Søger du jobbet som Projektleder, ligger din styrke således i at koble flere års praktiske erfaringer med motiverende teamledelse og en ""hands on"" indstilling til at finde gode løsninger i byggeriet.  
 FAGLIGE KVALIFIKATIONER 
 Du har formentlig en videregående uddannelse som bygningskonstruktør eller bygningsingeniøringeniør, meget gerne med en håndværksmæssig baggrund.  
 Du er nysgerrig af natur og er fagligt opsøgende. Hertil er du udpræget løsningsorienteret, og du er god til at skabe og vedligeholde relationer.  
 Du finder det inspirerende og motiverende at være med fra start til slut i et projekt til alles tilfredshed. Og så drives du af din lyst til at skabe resultater i en virksomhed i udvikling.  
 På det personlige plan nyder du godt af din vedholdenhed, der gør dig handlekraftig og giver dig dine meningers mod. Humør og åbenhed er vigtige elementer i din dagligdag, hvor der er plads til eget initiativ. 
 PERSONLIGE KVALIFIKATIONER  
 Du har: 
 
 Evnen til at drive en byggeplads med sikker hånd, så tiden og økonomien holdes på sporet 
 Gode forhandlingsevner og evner at sparre med såvel underentreprenører som bygherrer og rådgivere 
 Sans for økonomi og godt købmandsskab 
 Gode kommunikationsevner i såvel skrift som tale, da dokumentation er en vigtig del i vores projekter 
 Indgående kendskab til AB18 og eventuelt ABT18 
 
 KT ERHVERVSBYG A/S TILBYDER: 
 
 Alsidige arbejdsopgaver og masser af ansvar 
 Et godt og inspirerende arbejdsmiljø med højt til loftet, en uformel positiv tone og fagligt dygtige kolleger 
 Mulighed for faglig og personlig udvikling 
 Mulighed for at blive en del af vores succes og fortsatte vækst 
 Attraktiv gage iht. kvalifikationer  
 
 YDERLIGERERE INFORMATION 
 Rekrutteringsprocessen håndteres af lemo-recruitment ApS. 
 Er du blevet nysgerrig på denne meget spændende mulighed, og ser du et muligt match imellem dine personlige jobønsker og stillingens krav, så kontakt os og lad os starte dialogen. 
 Henvendelser vedrørende stillingen eller  KT ERHVERVSBYG A/S , rettes til lemo-recruitment ApS, Morten Madsen på tlf. +45 2176 0776 eller mail mm@lemo-recruitment.dk 
 ANSØGNING 
 Vi ser frem til hurtigst muligt at modtage din motiverede ansøgning vedlagt CV og relevante bilag. 
 Noter dig venligst at vi holder samtaler løbende, og derfor lukker for stillingen når vi har den rette kandidat. 
 Da diversitet i organisationen vægtes højt, opfordres alle uanset køn, etnicitet, alder etc. til at søge stillingen.  
 Bemærk i øvrigt at eventuelle ansøgninger/CV modtaget uden om vores rekrutteringsportal (f.eks. via mail eller LinkedIn) af hensyn til GDPR ikke besvares, og at disse slettes uden bekræftelse.  
 OBS! Desværre oplever vi også indimellem, at svarmails fra os kan havne i et spamfilter. Vær derfor venligst opmærksom på det, hvis du mod forventning ikke modtager et svar fra os.",Ryttervangen 18,58,Danmark,630,Vejle,3,Syddanmark,7323,,1,1,Fuldtid,None,None,1,,Byggeleder,0,"Projektleder, bygge og anlæg, 819",0,0,False,"{'Email': 'mm@lemo-recruitment.dk', 'PersonName': 'Morten Madsen', 'FirstName': 'Morten', 'LastName': 'Madsen', 'PositionTitle': 'CEO', 'PhoneNumbers': [{'Number': '+4521760776', 'Type': 0, 'Description': 'Primary'}]}",,False,False,False,False,4,,,False,False,False,True,False,False,,,,,https://app.jobmatchprofile.com/ftr25s/lemo-recruitment-aps/6psg6g/projektleder-bygge-og-anlag,False,2025-02-15T23:59:59+01:00,7,/CV/FindWork/GetLogo?JobAdId=0680f023-290c-4fc4-b057-6d04096a298e&Organisation=31347327,"Ryttervangen 18,7323, ",True,False,"/CV/Jobseeking/JobLog/CreateJobSearch?JobnetJobPostingIdentifier=0680f023-290c-4fc4-b057-6d04096a298e&Company.Name=KT Erhvervsbyg A/S&SubmissionDeadlineDate=2025-2-15&Title=Projektleder, bygge og anlæg&WeeklyWorkTime=1",00000000-0000-0000-0000-000000000000,True,0,,,"Projektleder, bygge og anlæg",True,,True,1,,0680f023-290c-4fc4-b057-6d04096a298e,,,False,False,,0,False,KT Erhvervsbyg A/S,Ryttervangen 18,,,7323,False,False,False,,Morten Madsen,+4521760776,mm@lemo-recruitment.dk,,,,,False,,2025-02-15T23:59:59+01:00,,0,False,0,,,,,0,,,,False,False,,,False,False,,,,False,,False,,Dag,Arbejdspladsen ligger i Vejle kommune,False,KT Erhvervsbyg A/S,,None,,False,False,"PROJEKTLEDER TIL SJÆLLAND, KT ERHVERVSBYG A/S

KT Erhvervsbyg A/S mangler dig, der har Projektledererfaring, og meget gerne med Erhvervsbyggeri i totalentreprise.

Kan du håndtere mange forskellige opgaver, informationer etc. i løbet af din arbejdsdag?

Så har du lige nu en helt unik mulighed for at bruge din byggefaglighed hos en af de førende akt","""PROJEKTLEDER TIL SJÆLLAND, KT ERHVERVSBYG A/S\n\nKT Erhvervsbyg A/S mangler dig, der har Projektledererfaring, og meget gerne med Erhvervsbyggeri i totalentreprise.\n\nKan du håndtere mange forskellige opgaver, informationer etc. i løbet af din arbejdsdag?\n\nSå har du lige nu en helt unik mulighed for at bruge din byggefaglighed hos en af de førende akt""","""Projektleder, bygge og anlæg""","https://www.google.dk/maps/dir//Ryttervangen+18,7323,+/","PROJEKTLEDER TIL SJÆLLAND, KT ERHVERVSBYG A/S 
 KT Erhvervsbyg A/S mangler dig, der har Projektledererfaring, og meget gerne med Erhvervsbyggeri i totalentreprise.  
 Kan du håndtere mange forskellige opgaver, informationer etc. i løbet af din arbejdsdag?  
 Så har du lige nu en helt unik mulighed for at bruge din byggefaglighed hos en af de førende aktører indenfor Erhvervsbyggeri i Danmark. 
 Hos KT Erhvervsbyg er vi nemlig meget ambitiøse. Vi ser fortsat en stigende ordrebeholdning og oplever derfor et højt organisatorisk aktivitetsniveau.  
 Vi har gennem tiden specialiseret os i at bygge alle former for erhvervsbyggeri, fra flotte domiciler og førende bilhuse til funktionelle produktions- og lagerfaciliteter.  
 Måske kender du os allerede som vinder af Årets erhvervsbyggeri 2020? Hvis ikke, så får du chancen nu.  
 STILLINGEN  
 Med udgangspunkt fra byggesitet på Sjælland får du mange spændende udfordringer. I samarbejde med vores vores agile projektafdeling i Give arbejder du tæt sammen med vores professionelle team af ingeniører og konstruktører, ligesom du udvikler projektet/projekterne i samarbejde med egen tegnestue eller eksterne arkitekter. Her er der ikke langt fra tanke til handling. 
 Du har dokumenteret erfaring med ledelse af byggeprojekter, hvor du selvstændigt og med succes har haft ansvaret for projekternes fulde gennemførsel. Det er som nævnt ovenfor en fordel, hvis du har arbejdet med byggerier i totalentreprise. 
 Søger du jobbet som Projektleder, ligger din styrke således i at koble flere års praktiske erfaringer med motiverende teamledelse og en ""hands on"" indstilling til at finde gode løsninger i byggeriet.  
 FAGLIGE KVALIFIKATIONER 
 Du har formentlig en videregående uddannelse som bygningskonstruktør eller bygningsingeniøringeniør, meget gerne med en håndværksmæssig baggrund.  
 Du er nysgerrig af natur og er fagligt opsøgende. Hertil er du udpræget løsningsorienteret, og du er god til at skabe og vedligeholde relationer.  
 Du finder det inspirerende og motiverende at være med fra start til slut i et projekt til alles tilfredshed. Og så drives du af din lyst til at skabe resultater i en virksomhed i udvikling.  
 På det personlige plan nyder du godt af din vedholdenhed, der gør dig handlekraftig og giver dig dine meningers mod. Humør og åbenhed er vigtige elementer i din dagligdag, hvor der er plads til eget initiativ. 
 PERSONLIGE KVALIFIKATIONER  
 Du har: 
 
 Evnen til at drive en byggeplads med sikker hånd, så tiden og økonomien holdes på sporet 
 Gode forhandlingsevner og evner at sparre med såvel underentreprenører som bygherrer og rådgivere 
 Sans for økonomi og godt købmandsskab 
 Gode kommunikationsevner i såvel skrift som tale, da dokumentation er en vigtig del i vores projekter 
 Indgående kendskab til AB18 og eventuelt ABT18 
 
 KT ERHVERVSBYG A/S TILBYDER: 
 
 Alsidige arbejdsopgaver og masser af ansvar 
 Et godt og inspirerende arbejdsmiljø med højt til loftet, en uformel positiv tone og fagligt dygtige kolleger 
 Mulighed for faglig og personlig udvikling 
 Mulighed for at blive en del af vores succes og fortsatte vækst 
 Attraktiv gage iht. kvalifikationer  
 
 YDERLIGERERE INFORMATION 
 Rekrutteringsprocessen håndteres af lemo-recruitment ApS. 
 Er du blevet nysgerrig på denne meget spændende mulighed, og ser du et muligt match imellem dine personlige jobønsker og stillingens krav, så kontakt os og lad os starte dialogen. 
 Henvendelser vedrørende stillingen eller  KT ERHVERVSBYG A/S , rettes til lemo-recruitment ApS, Morten Madsen på tlf. +45 2176 0776 eller mail mm@lemo-recruitment.dk 
 ANSØGNING 
 Vi ser frem til hurtigst muligt at modtage din motiverede ansøgning vedlagt CV og relevante bilag. 
 Noter dig venligst at vi holder samtaler løbende, og derfor lukker for stillingen når vi har den rette kandidat. 
 Da diversitet i organisationen vægtes højt, opfordres alle uanset køn, etnicitet, alder etc. til at søge stillingen.  
 Bemærk i øvrigt at eventuelle ansøgninger/CV modtaget uden om vores rekrutteringsportal (f.eks. via mail eller LinkedIn) af hensyn til GDPR ikke besvares, og at disse slettes uden bekræftelse.  
 OBS! Desværre oplever vi også indimellem, at svarmails fra os kan havne i et spamfilter. Vær derfor venligst opmærksom på det, hvis du mod forventning ikke modtager et svar fra os.","https://www.google.dk/maps/place/Ryttervangen+18,7323,+/",31347327,False,False,,False
