summary_AutomatchType,summary_Abroad,summary_Weight,summary_Title,summary_JobHeadline,summary_Presentation,summary_HiringOrgName,summary_WorkPlaceAddress,summary_WorkPlacePostalCode,summary_WorkPlaceCity,summary_WorkPlaceOtherAddress,summary_WorkPlaceAbroad,summary_WorkPlaceNotStatic,summary_UseWorkPlaceAddressForJoblog,summary_PostingCreated,summary_LastDateApplication,summary_FormattedLastDateApplication,summary_AssignmentStartDate,summary_IsHotjob,summary_IsExternal,summary_Url,summary_Region,summary_Municipality,summary_Country,summary_PostalCode,summary_PostalCodeName,summary_JobAnnouncementType,summary_EmploymentType,summary_WorkHours,summary_OccupationArea,summary_OccupationGroup,summary_Occupation,summary_Location_Latitude,summary_Location_Longitude,summary_JoblogWorkTime_WorkHour,summary_JoblogWorkTime_DailyWorkTime,summary_WorkplaceID,summary_OrganisationId,summary_HiringOrgCVR,summary_UserLoggedIn,summary_AnonymousEmployer,summary_ShareUrl,summary_DetailsUrl,summary_JobLogUrl,summary_HasLocationValues,summary_ID,summary_Latitude,summary_Longitude,details_WorkSchedule,details_WorkConditions,details_EmploymentTypes,details_WorkPlace_Name,details_WorkPlace_Address_AddressLine,details_WorkPlace_Address_Country_Id,details_WorkPlace_Address_Country_Name,details_WorkPlace_Address_Municipality_Id,details_WorkPlace_Address_Municipality_Name,details_WorkPlace_Address_Region_Id,details_WorkPlace_Address_Region_Name,details_WorkPlace_Address_PostalCode,details_WorkPlace_Address_City,details_WorkPlace_PhoneNumber_Number,details_WorkPlace_PhoneNumber_Type,details_WorkPlace_PhoneNumber_Description,details_WorkPlace_FaxNumber,details_WorkPlace_Email,details_WorkPlace_WebAddress,details_WorkPlace_Description,details_WorkPlace_Logo,details_WorkPlace_WorkPlaceOrganizationNumber,details_WorkPlace_OrganizationNumber,details_WorkPlace_OrganizationDescription,details_JobPositionPosting_Id,details_JobPositionPosting_HiringOrg_Name,details_JobPositionPosting_HiringOrg_Address_AddressLine,details_JobPositionPosting_HiringOrg_Address_Country_Id,details_JobPositionPosting_HiringOrg_Address_Country_Name,details_JobPositionPosting_HiringOrg_Address_Municipality_Id,details_JobPositionPosting_HiringOrg_Address_Municipality_Name,details_JobPositionPosting_HiringOrg_Address_Region_Id,details_JobPositionPosting_HiringOrg_Address_Region_Name,details_JobPositionPosting_HiringOrg_Address_PostalCode,details_JobPositionPosting_HiringOrg_Address_City,details_JobPositionPosting_HiringOrg_PhoneNumber_Number,details_JobPositionPosting_HiringOrg_PhoneNumber_Type,details_JobPositionPosting_HiringOrg_PhoneNumber_Description,details_JobPositionPosting_HiringOrg_FaxNumber,details_JobPositionPosting_HiringOrg_Email,details_JobPositionPosting_HiringOrg_WebAddress,details_JobPositionPosting_HiringOrg_Description,details_JobPositionPosting_HiringOrg_Logo,details_JobPositionPosting_HiringOrg_WorkPlaceOrganizationNumber,details_JobPositionPosting_HiringOrg_OrganizationNumber,details_JobPositionPosting_HiringOrg_OrganizationDescription,details_JobPositionPosting_RecruitingCompany,details_JobPositionPosting_PublicationStartDate,details_JobPositionPosting_PublicationEndDate,details_JobPositionPosting_JobPositionInformation_PositionTitle,details_JobPositionPosting_JobPositionInformation_Purpose,details_JobPositionPosting_JobPositionInformation_WorkLocation_AddressLine,details_JobPositionPosting_JobPositionInformation_WorkLocation_Country_Id,details_JobPositionPosting_JobPositionInformation_WorkLocation_Country_Name,details_JobPositionPosting_JobPositionInformation_WorkLocation_Municipality_Id,details_JobPositionPosting_JobPositionInformation_WorkLocation_Municipality_Name,details_JobPositionPosting_JobPositionInformation_WorkLocation_Region_Id,details_JobPositionPosting_JobPositionInformation_WorkLocation_Region_Name,details_JobPositionPosting_JobPositionInformation_WorkLocation_PostalCode,details_JobPositionPosting_JobPositionInformation_WorkLocation_City,details_JobPositionPosting_JobPositionInformation_EmploymentType,details_JobPositionPosting_JobPositionInformation_WeeklyWorkHours_TypeId,details_JobPositionPosting_JobPositionInformation_WeeklyWorkHours_TypeName,details_JobPositionPosting_JobPositionInformation_WeeklyWorkHours_Description,details_JobPositionPosting_JobPositionInformation_CompensationDescription,details_JobPositionPosting_JobPositionInformation_NumberToFill,details_JobPositionPosting_JobPositionInformation_DriverLicense,details_JobPositionPosting_JobPositionInformation_Occupation_Name,details_JobPositionPosting_JobPositionInformation_Occupation_DiscoWeb,details_JobPositionPosting_JobPositionInformation_Occupation_AlternateNames,details_JobPositionPosting_JobPositionInformation_Occupation_GroupId,details_JobPositionPosting_JobPositionInformation_Occupation_AreaId,details_JobPositionPosting_JobPositionInformation_IsGovernmentHiring,details_JobPositionPosting_JobPositionInformation_JppContacts,details_JobPositionPosting_JobPositionInformation_EmploymentDate,details_JobPositionPosting_IsRecruitmentOfForeignNationals,details_JobPositionPosting_IsWorkInDenmark,details_JobPositionPosting_IsAnonymousEmployer,details_JobPositionPosting_IsDisabilityFriendly,details_JobPositionPosting_JppType,details_JobPositionPosting_ApplicationDetails_WorkHourMax,details_JobPositionPosting_ApplicationDetails_WorkHourMin,details_JobPositionPosting_ApplicationDetails_DailyWorkTimeWeekend,details_JobPositionPosting_ApplicationDetails_DailyWorkTimeNight,details_JobPositionPosting_ApplicationDetails_DailyWorkTimeEvening,details_JobPositionPosting_ApplicationDetails_DailyWorkTimeDay,details_JobPositionPosting_ApplicationDetails_DailyWorkTimeMorning,details_JobPositionPosting_ApplicationDetails_DailyWorkTimeVarious,details_JobPositionPosting_ApplicationDetails_ReferenceText,details_JobPositionPosting_ApplicationDetails_RemarksToApplicant,details_JobPositionPosting_ApplicationDetails_ByEmail,details_JobPositionPosting_ApplicationDetails_ByPhone,details_JobPositionPosting_ApplicationDetails_ApplyViaUrl,details_JobPositionPosting_ApplicationDetails_ReplyInWriting,details_JobPositionPosting_ApplicationDetails_ApplicationDeadlineDate,details_JobPositionPosting_Status,details_LogoUrl,details_Address,details_ShowMap,details_ShowShareButtonJobLog,details_JobLogUrl,details_JobLogTemplateModel_Identifier,details_JobLogTemplateModel_UseWorkPlaceAddressForJoblog,details_JobLogTemplateModel_Category,details_JobLogTemplateModel_CvCustomerIdentifier,details_JobLogTemplateModel_JobSeekingStatus,details_JobLogTemplateModel_Title,details_JobLogTemplateModel_IsApplicationSourceRequired,details_JobLogTemplateModel_ApplicationSource,details_JobLogTemplateModel_IsWeeklyWorkTimeRequired,details_JobLogTemplateModel_WeeklyWorkTime,details_JobLogTemplateModel_HoursPerWeek,details_JobLogTemplateModel_JobnetJobPostingIdentifier,details_JobLogTemplateModel_JobAdDocument_Title,details_JobLogTemplateModel_JobAdDocument_Identifier,details_JobLogTemplateModel_JobAdDocument_IsDeletedBySystem,details_JobLogTemplateModel_JobAdDocument_IsDeletedByUser,details_JobLogTemplateModel_JobAdFile,details_JobLogTemplateModel_Company_JobLogEntryCategory,details_JobLogTemplateModel_Company_ShowAddressFieldsEvenIfEmpty,details_JobLogTemplateModel_Company_Name,details_JobLogTemplateModel_Company_Address,details_JobLogTemplateModel_Company_Country,details_JobLogTemplateModel_Company_EmploymentAreaID,details_JobLogTemplateModel_Company_PostCode,details_JobLogTemplateModel_Company_IsCountryAndTownAndPostCodeEmpty,details_JobLogTemplateModel_Company_IsTownAndPostCodeEmpty,details_JobLogTemplateModel_Company_IsCountryDanmark,details_JobLogTemplateModel_Company_Town,details_JobLogTemplateModel_Company_ContactPerson,details_JobLogTemplateModel_Company_Phone,details_JobLogTemplateModel_Company_Email,details_JobLogTemplateModel_Company_Latitude,details_JobLogTemplateModel_Company_Longitude,details_JobLogTemplateModel_Company_DailyTravelTimeInMinutes,details_JobLogTemplateModel_Company_DistanceToCompanyInMeters,details_JobLogTemplateModel_Company_IsCreateMode,details_JobLogTemplateModel_TypeOfSubmission,details_JobLogTemplateModel_SubmissionDate,details_JobLogTemplateModel_SubmissionDateFormatted,details_JobLogTemplateModel_SubmissionDateTiks,details_JobLogTemplateModel_IsSubmissionDateRequired,details_JobLogTemplateModel_Status,details_JobLogTemplateModel_DateCreatedFormatted,details_JobLogTemplateModel_DateCreated,details_JobLogTemplateModel_DateModifiedFormatted,details_JobLogTemplateModel_DateModified,details_JobLogTemplateModel_LastModifiedDateTiks,details_JobLogTemplateModel_DateClosed,details_JobLogTemplateModel_JobApplicationDocument_Title,details_JobLogTemplateModel_JobApplicationDocument_Identifier,details_JobLogTemplateModel_JobApplicationDocument_IsDeletedBySystem,details_JobLogTemplateModel_JobApplicationDocument_IsDeletedByUser,details_JobLogTemplateModel_CvDocument_Title,details_JobLogTemplateModel_CvDocument_Identifier,details_JobLogTemplateModel_CvDocument_IsDeletedBySystem,details_JobLogTemplateModel_CvDocument_IsDeletedByUser,details_JobLogTemplateModel_JobApplicationFile,details_JobLogTemplateModel_CvFile,details_JobLogTemplateModel_SubmissionDeadlineDate,details_JobLogTemplateModel_IsPersisted,details_JobLogTemplateModel_ServerValidationErrors,details_JobLogTemplateModel_HasServerValidationErrors,details_JoblogWorkTime_WorkHour,details_JoblogWorkTime_DailyWorkTime,details_Place,details_OpenPrintDialog,details_WorkPlaceInfoText,details_JobCenterContactDetails,details_WorkPlaceDescriptionText,details_FavoriteText,details_IsFavorite,details_ShowFavorite,details_MetaOgTextForSharing,details_DescriptionForSharing,details_TitleForSharing,details_RutePlan,details_FormattedPurpose,details_MapUrl,details_OrganizationNumber,details_ShowSearchJobButton,details_ShowPrint,details_BackToFindWorkButtonUrl,isExternal
0,False,1,Sygeplejerske til Distriktspsykiatrien Holbæk og Kalundborg,Sygeplejerske til Distriktspsykiatrien Holbæk og Kalundborg,"

 

Vi er så heldige at blive opnormeret i forbindelse med IDD og derfor søger vi 1 sygeplejerske til vores F-ACT team i distriktspsykiatrien Holbæk og Kalundborg",Region Sjælland,Rosenvænget 15A  ,4300,Holbæk,True,False,False,False,2025-02-04T08:09:58,2025-02-16T23:59:00,16. februar 2025,0001-01-01T00:00:00,False,False,https://job.jobnet.dk/CV/FindWork/Details/0bf2a065-9062-4153-81e9-e0b16b5dc671,Øvrige Sjælland,Holbæk,Danmark,4300,,Almindelige vilkår,Fastansættelse,Fuldtid,"Sundhed, omsorg og personlig pleje",Sygepleje og jordemoderarbejde,Sygeplejerske,55.7383,11.6999,,,1003290870,,29190658,False,False,https://job.jobnet.dk/CV/FindWork/DetailsSocialmedia/0bf2a065-9062-4153-81e9-e0b16b5dc671,https://job.jobnet.dk/CV/FindWork/Details/0bf2a065-9062-4153-81e9-e0b16b5dc671,https://job.jobnet.dk/CV/FindWork/Details/0bf2a065-9062-4153-81e9-e0b16b5dc671,True,0bf2a065-9062-4153-81e9-e0b16b5dc671,55.7383,11.6999,"{'Id': 1, 'Name': 'Fuldtid'}, {'Id': 16, 'Name': 'Deltid'}","{'Id': 1, 'Name': 'Almindelige vilkår'}, {'Id': 2, 'Name': 'Fleksjob'}, {'Id': 3, 'Name': 'Skånejob'}, {'Id': 4, 'Name': 'Egnet til efterlønnere og seniorer'}, {'Id': 5, 'Name': 'Job med løntilskud'}, {'Id': 6, 'Name': 'Rotationsjob'}, {'Id': 7, 'Name': 'Virksomhedspraktik'}","{'Id': 1, 'Name': 'Fastansættelse'}, {'Id': 16, 'Name': 'Tidsbegrænset ansættelse'}",Region Sjælland,Rosenvænget 15A,58,Danmark,316,Holbæk,4,"Hovedstaden, Sjælland og Bornholm",4300,Stenlille,,0,Primary,,,https://www.regionsjaelland.dk/job-og-uddannelse/jobside?hr=show-job/48251&linkref=67957&locale=da_DK,None,,1003290870,29190658,None,0bf2a065-9062-4153-81e9-e0b16b5dc671,Region Sjælland,Rosenvænget 15A,58,Danmark,316,Holbæk,4,"Hovedstaden, Sjælland og Bornholm",4300,Stenlille,,0,Primary,,,https://www.regionsjaelland.dk/job-og-uddannelse/jobside?hr=show-job/48251&linkref=67957&locale=da_DK,None,,1003290870,29190658,None,,2025-02-04T08:09:58+01:00,2025-02-16T23:59:00+01:00,Sygeplejerske til Distriktspsykiatrien Holbæk og Kalundborg,"Vi er så heldige at blive opnormeret i forbindelse med IDD og derfor søger vi 1 sygeplejerske til vores F-ACT team i distriktspsykiatrien Holbæk og Kalundborg . 
 Stillingen vil være på 37 timer. Vi er åbne overfor et ønske om færre timer. Stillingen er til besættelse pr. 1. april 2025 eller snarest mulig. 
 Vi har igennem de sidste 3 år fået implementeret F-ACT modellen i vores distriktspsykiatri og pr. 1. september 2024 er vi startet med at tilbyde integreret dobbeltdiagnose behandling. I den forbindelse er vi blevet opnormeret og søger derfor 1 ny kollega. Vi skal fortsat arbejde med F-ACT modellen og kombinere rusmiddelbehandling ind i de rammer, vi har. Vi kigger ind i en spændende fremtid med nye tiltag og nye arbejdsopgaver, som løbende vil udvikle sig henover de næste 3 år. 
 F-ACT modellen går ud på at kunne tilbyde en mere fleksibel behandling, hvor vi i højere grad får mulighed for at møde patienten i personens nærmiljø, vi får i højere grad mulighed for at kunne intensivere behandlingen, hvis patienten bliver ustabil og i ustabile faser vil hele teamet løfte opgaven med at stabilisere patienten. Vi arbejder med shares caseload, hvor flere faggrupper varetager opgaver i patientforløbet for at tilbyde en tværfaglig indsats. Vi har et stort fokus på at fremme vores patienters recovery proces. 
 Vores i alt 3 F-ACT teams dækker over det geografiske område Holbæk, Kalundborg og Odsherred kommune. Hvert F-ACT dækker min. 2 kommuner, så du vil også have kollegaer, du ikke sidder fysisk sammen med på daglig basis og derfor vil du opleve at møde teamet virtuelt 4 dage om ugen og en dag om ugen er alle samlet på samme matrikel. Du vil have samtaler i patientens eget hjem, i patientens lokalområde, virtuelle samtaler samt ambulante samtaler. Samarbejde med kommuner, rusmiddelcentre og socialpsykiatrien vægtes højt og vi har stor respekt for hinanden samt nysgerrige på, hvordan vi kan styrke vores samarbejde omkring fælles borgere endnu mere. Du vil være en del af et team bestående af flere faggrupper, som er: overlæge, psykolog, sygeplejersker, pædagog, socialrådgiver, peer medarbejder og sekretærer. 
 Dine kvalifikationer 
 Vi søger en sygeplejerske med erfaring, gerne med specialuddannelse i psykiatrisk sygepleje og gerne med erfaring inden for rusmiddelbehandling. Du skal selvstændigt kunne planlægge og strukturere dit arbejde og samtidig aktivt engagere dig i fællesskabet. Du skal have interesse for at medinddrage patienten, de pårørende og øvrige relevante samarbejdspartnere i behandlingen samt interesse i at arbejde recovery orienteret. 
 Vi tilbyder 
 
 En dynamisk og engageret personalegruppe 
 En arbejdsplads hvor supervision, trivsel og et godt arbejdsmiljø prioriteres højt 
 Gode muligheder for faglig udvikling, kollegial sparring og tværfaglige konferencer 
 Høj grad af selvstændighed og mulighed for at være med til at tilrettelægge din hverdag 
 Plads til forskelligheder og ”højt til loftet” 
 Onboarding: du vil blive modtaget med et introduktionsprogram, mentorordning og planlagte samtaler med nærmeste leder. 
 
 Vi er i en arbejdsplads, hvor vi søger at passe godt på patienterne og på hinanden. I den sammenhæng er det vigtigt, at personalegruppen besidder empati og social forståelse, evner at bevare roen i pressede situationer, prioriterer dialog, hvor smil og humor ofte kan være en god løftestang. 
 Distrikt Nord modtager borgere over 18 år fra Holbæk, Kalundborg og Odsherred kommune til ambulant psykiatrisk behandling. Vi har aktuelt ca. 750 patienter. Personalegruppen er sammensat af sygeplejersker, specialsygeplejersker, overlæger, speciallæger, psykologer, specialpsykologer, socialrådgivere, pædagoger, peer-medarbejdere og lægesekretærer. 
 Yderligere informationer 
 Du er meget velkommen til at komme på et uforpligtende besøg eller ringe og høre nærmere om stillingen hos ledende specialpsykolog Mia Rydahl eller oversygeplejerske Katrine Agnete Runge. Der kan indhentes stillings- og funktionsbeskrivelse for stillingen. 
 Har vi fanget din interesse og lyst til at søge, så send os gerne din ansøgning.  
 Ansøgningsfrist  den 16. februar 2025 
 Samtaler  afholdes den 19. februar 2025 i Distriktspsykiatrien Holbæk 
 Løn og ansættelsesvilkår sker i henhold til gældende overenskomst. Psykiatrien i Region Sjælland indhenter (§22) straffeattest ved alle ny ansættelser. Det er et krav, at du har kørekort. Du kan læse mere om Psykiatrien i Region Sjælland  her . 
 Du bliver en del af Psykiatrien Vest: 
Et hospital i udvikling med ca. 430 ansatte og hovedfunktioner for voksne over 17 år inden for akutmodtagelse, døgn-, og ambulante funktioner. Psykiatrien Vest har specialfunktioner inden for behandling af affektive tilstande, traumatiserede flygtninge, PTSD og oligofreni. Vi har etableret en Fusionsklinik/Steno-diabetes-psykiatrienhed og har partnerskabsaftaler med Holbæk og Slagelse sygehuse. Vi har egen forskningsenhed med en professor i psykoterapi og flere ph.d. studerende. Derudover indgår vi i en del projekter, der skal sikre tættere samarbejde med vores kommuner. Vi arbejder målrettet med at få nedbragt anvendelsen af tvang. Vores ønske er en psykiatri med fokus på recovery, inddragelse af patienter og netværk, faglighed, etik, uddannelse og arbejdsmiljø. Psykiatrien som arbejdsplads   
 I Psykiatrien Region Sjælland kan du gøre en forskel for hele mennesket. Vi skaber håb, vilje og lyst til livet. Du gør en meningsfuld forskel, når du vælger at arbejde i Psykiatrien. Gør karriere i Psykiatrien, hvis du vil redde mere end liv. Se mere på  Jobipsykiatrien.dk  – og læs om udviklingsmuligheder, karriereveje og alt det andet som er rart at vide, når man søger nyt job. 
 Om Psykiatrien 
Psykiatrien Region Sjælland er en behandlingspsykiatri, der består af en række sengeafsnit og ambulante enheder rundt omkring i regionen. Vi varetager psykiatrisk udredning og behandling samt akutforpligtelsen i Region Sjælland.  
 Vi udvikler og formidler en bred vifte af psykiatriske tilbud til regionens borgere, og vi har en anonym rådgivning, som er åben for alle, der har behov for viden eller sparring om psykisk sygdom. Vi forsker bredt med inddragelse af både patienter og pårørende. Vi ser det som en vigtig opgave at uddanne fremtidens medarbejdere, så vi varetager også en stor uddannelsesopgave.",Rosenvænget 15A,58,Danmark,316,Holbæk,4,"Hovedstaden, Sjælland og Bornholm",4300,Stenlille,1,1,Fuldtid,None,None,1,,Sygeplejerske,0,"Lægeassistent, Tekniker inden for respirationsterapi, 6391, 6392, Stråleterapeut, Operationssygeplejerske",0,0,False,"{'Email': 'karun@regionsjaelland.dk', 'PersonName': 'Katrine Runge', 'FirstName': 'Katrine', 'LastName': 'Runge', 'PositionTitle': None, 'PhoneNumbers': [{'Number': '24920749', 'Type': 0, 'Description': 'Primary'}]}, {'Email': 'mryd@regionsjaelland.dk', 'PersonName': 'Mia Rydahl', 'FirstName': 'Mia', 'LastName': 'Rydahl', 'PositionTitle': None, 'PhoneNumbers': [{'Number': '24238646', 'Type': 0, 'Description': 'Primary'}]}",2025-04-01T00:00:00+02:00,False,False,False,False,4,,,False,False,False,False,False,False,,,,,https://www.regionsjaelland.dk/job-og-uddannelse/jobside?hr=show-job/48251&linkref=67957&locale=da_DK,False,2025-02-16T23:59:00+01:00,7,/CV/FindWork/GetLogo?JobAdId=0bf2a065-9062-4153-81e9-e0b16b5dc671&Organisation=29190658,"Rosenvænget 15A,4300, Stenlille",True,False,/CV/Jobseeking/JobLog/CreateJobSearch?JobnetJobPostingIdentifier=0bf2a065-9062-4153-81e9-e0b16b5dc671&Company.Name=Region Sjælland&SubmissionDeadlineDate=2025-2-16&Title=Sygeplejerske til Distriktspsykiatrien Holbæk og Kalundborg&WeeklyWorkTime=1,00000000-0000-0000-0000-000000000000,False,0,,,Sygeplejerske til Distriktspsykiatrien Holbæk og Kalundborg,True,,True,1,,0bf2a065-9062-4153-81e9-e0b16b5dc671,,,False,False,,0,False,Region Sjælland,Rosenvænget 15A,,,4300,False,False,False,Stenlille,Katrine Runge,24920749,karun@regionsjaelland.dk,,,,,False,,2025-02-16T23:59:00+01:00,,0,False,0,,,,,0,,,,False,False,,,False,False,,,,False,,False,,,Arbejdspladsen ligger i Holbæk kommune,False,Region Sjælland,,None,,False,False,"

 

Vi er så heldige at blive opnormeret i forbindelse med IDD og derfor søger vi 1 sygeplejerske til vores F-ACT team i distriktspsykiatrien Holbæk og Kalundborg.

Stillingen vil være på 37 timer. Vi er åbne overfor et ønske om færre timer. Stillingen er til besættelse pr. 1. april 2025 eller snarest mulig.

Vi har igennem de sidste 3 år fået imp","""\n\n \n\nVi er så heldige at blive opnormeret i forbindelse med IDD og derfor søger vi 1 sygeplejerske til vores F-ACT team i distriktspsykiatrien Holbæk og Kalundborg.\n\nStillingen vil være på 37 timer. Vi er åbne overfor et ønske om færre timer. Stillingen er til besættelse pr. 1. april 2025 eller snarest mulig.\n\nVi har igennem de sidste 3 år fået imp""","""Sygeplejerske til Distriktspsykiatrien Holbæk og Kalundborg""","https://www.google.dk/maps/dir//Rosenvænget+15A,4300,+Stenlille/","Vi er så heldige at blive opnormeret i forbindelse med IDD og derfor søger vi 1 sygeplejerske til vores F-ACT team i distriktspsykiatrien Holbæk og Kalundborg . 
 Stillingen vil være på 37 timer. Vi er åbne overfor et ønske om færre timer. Stillingen er til besættelse pr. 1. april 2025 eller snarest mulig. 
 Vi har igennem de sidste 3 år fået implementeret F-ACT modellen i vores distriktspsykiatri og pr. 1. september 2024 er vi startet med at tilbyde integreret dobbeltdiagnose behandling. I den forbindelse er vi blevet opnormeret og søger derfor 1 ny kollega. Vi skal fortsat arbejde med F-ACT modellen og kombinere rusmiddelbehandling ind i de rammer, vi har. Vi kigger ind i en spændende fremtid med nye tiltag og nye arbejdsopgaver, som løbende vil udvikle sig henover de næste 3 år. 
 F-ACT modellen går ud på at kunne tilbyde en mere fleksibel behandling, hvor vi i højere grad får mulighed for at møde patienten i personens nærmiljø, vi får i højere grad mulighed for at kunne intensivere behandlingen, hvis patienten bliver ustabil og i ustabile faser vil hele teamet løfte opgaven med at stabilisere patienten. Vi arbejder med shares caseload, hvor flere faggrupper varetager opgaver i patientforløbet for at tilbyde en tværfaglig indsats. Vi har et stort fokus på at fremme vores patienters recovery proces. 
 Vores i alt 3 F-ACT teams dækker over det geografiske område Holbæk, Kalundborg og Odsherred kommune. Hvert F-ACT dækker min. 2 kommuner, så du vil også have kollegaer, du ikke sidder fysisk sammen med på daglig basis og derfor vil du opleve at møde teamet virtuelt 4 dage om ugen og en dag om ugen er alle samlet på samme matrikel. Du vil have samtaler i patientens eget hjem, i patientens lokalområde, virtuelle samtaler samt ambulante samtaler. Samarbejde med kommuner, rusmiddelcentre og socialpsykiatrien vægtes højt og vi har stor respekt for hinanden samt nysgerrige på, hvordan vi kan styrke vores samarbejde omkring fælles borgere endnu mere. Du vil være en del af et team bestående af flere faggrupper, som er: overlæge, psykolog, sygeplejersker, pædagog, socialrådgiver, peer medarbejder og sekretærer. 
 Dine kvalifikationer 
 Vi søger en sygeplejerske med erfaring, gerne med specialuddannelse i psykiatrisk sygepleje og gerne med erfaring inden for rusmiddelbehandling. Du skal selvstændigt kunne planlægge og strukturere dit arbejde og samtidig aktivt engagere dig i fællesskabet. Du skal have interesse for at medinddrage patienten, de pårørende og øvrige relevante samarbejdspartnere i behandlingen samt interesse i at arbejde recovery orienteret. 
 Vi tilbyder 
 
 En dynamisk og engageret personalegruppe 
 En arbejdsplads hvor supervision, trivsel og et godt arbejdsmiljø prioriteres højt 
 Gode muligheder for faglig udvikling, kollegial sparring og tværfaglige konferencer 
 Høj grad af selvstændighed og mulighed for at være med til at tilrettelægge din hverdag 
 Plads til forskelligheder og ”højt til loftet” 
 Onboarding: du vil blive modtaget med et introduktionsprogram, mentorordning og planlagte samtaler med nærmeste leder. 
 
 Vi er i en arbejdsplads, hvor vi søger at passe godt på patienterne og på hinanden. I den sammenhæng er det vigtigt, at personalegruppen besidder empati og social forståelse, evner at bevare roen i pressede situationer, prioriterer dialog, hvor smil og humor ofte kan være en god løftestang. 
 Distrikt Nord modtager borgere over 18 år fra Holbæk, Kalundborg og Odsherred kommune til ambulant psykiatrisk behandling. Vi har aktuelt ca. 750 patienter. Personalegruppen er sammensat af sygeplejersker, specialsygeplejersker, overlæger, speciallæger, psykologer, specialpsykologer, socialrådgivere, pædagoger, peer-medarbejdere og lægesekretærer. 
 Yderligere informationer 
 Du er meget velkommen til at komme på et uforpligtende besøg eller ringe og høre nærmere om stillingen hos ledende specialpsykolog Mia Rydahl eller oversygeplejerske Katrine Agnete Runge. Der kan indhentes stillings- og funktionsbeskrivelse for stillingen. 
 Har vi fanget din interesse og lyst til at søge, så send os gerne din ansøgning.  
 Ansøgningsfrist  den 16. februar 2025 
 Samtaler  afholdes den 19. februar 2025 i Distriktspsykiatrien Holbæk 
 Løn og ansættelsesvilkår sker i henhold til gældende overenskomst. Psykiatrien i Region Sjælland indhenter (§22) straffeattest ved alle ny ansættelser. Det er et krav, at du har kørekort. Du kan læse mere om Psykiatrien i Region Sjælland  her . 
 Du bliver en del af Psykiatrien Vest: 
Et hospital i udvikling med ca. 430 ansatte og hovedfunktioner for voksne over 17 år inden for akutmodtagelse, døgn-, og ambulante funktioner. Psykiatrien Vest har specialfunktioner inden for behandling af affektive tilstande, traumatiserede flygtninge, PTSD og oligofreni. Vi har etableret en Fusionsklinik/Steno-diabetes-psykiatrienhed og har partnerskabsaftaler med Holbæk og Slagelse sygehuse. Vi har egen forskningsenhed med en professor i psykoterapi og flere ph.d. studerende. Derudover indgår vi i en del projekter, der skal sikre tættere samarbejde med vores kommuner. Vi arbejder målrettet med at få nedbragt anvendelsen af tvang. Vores ønske er en psykiatri med fokus på recovery, inddragelse af patienter og netværk, faglighed, etik, uddannelse og arbejdsmiljø. Psykiatrien som arbejdsplads   
 I Psykiatrien Region Sjælland kan du gøre en forskel for hele mennesket. Vi skaber håb, vilje og lyst til livet. Du gør en meningsfuld forskel, når du vælger at arbejde i Psykiatrien. Gør karriere i Psykiatrien, hvis du vil redde mere end liv. Se mere på  Jobipsykiatrien.dk  – og læs om udviklingsmuligheder, karriereveje og alt det andet som er rart at vide, når man søger nyt job. 
 Om Psykiatrien 
Psykiatrien Region Sjælland er en behandlingspsykiatri, der består af en række sengeafsnit og ambulante enheder rundt omkring i regionen. Vi varetager psykiatrisk udredning og behandling samt akutforpligtelsen i Region Sjælland.  
 Vi udvikler og formidler en bred vifte af psykiatriske tilbud til regionens borgere, og vi har en anonym rådgivning, som er åben for alle, der har behov for viden eller sparring om psykisk sygdom. Vi forsker bredt med inddragelse af både patienter og pårørende. Vi ser det som en vigtig opgave at uddanne fremtidens medarbejdere, så vi varetager også en stor uddannelsesopgave.","https://www.google.dk/maps/place/Rosenvænget+15A,4300,+Stenlille/",29190658,False,False,,False
