summary_AutomatchType,summary_Abroad,summary_Weight,summary_Title,summary_JobHeadline,summary_Presentation,summary_HiringOrgName,summary_WorkPlaceAddress,summary_WorkPlacePostalCode,summary_WorkPlaceCity,summary_WorkPlaceOtherAddress,summary_WorkPlaceAbroad,summary_WorkPlaceNotStatic,summary_UseWorkPlaceAddressForJoblog,summary_PostingCreated,summary_LastDateApplication,summary_FormattedLastDateApplication,summary_AssignmentStartDate,summary_IsHotjob,summary_IsExternal,summary_Url,summary_Region,summary_Municipality,summary_Country,summary_PostalCode,summary_PostalCodeName,summary_JobAnnouncementType,summary_EmploymentType,summary_WorkHours,summary_OccupationArea,summary_OccupationGroup,summary_Occupation,summary_Location_Latitude,summary_Location_Longitude,summary_JoblogWorkTime_WorkHour,summary_JoblogWorkTime_DailyWorkTime,summary_WorkplaceID,summary_OrganisationId,summary_HiringOrgCVR,summary_UserLoggedIn,summary_AnonymousEmployer,summary_ShareUrl,summary_DetailsUrl,summary_JobLogUrl,summary_HasLocationValues,summary_ID,summary_Latitude,summary_Longitude,details_WorkSchedule,details_WorkConditions,details_EmploymentTypes,details_WorkPlace_Name,details_WorkPlace_Address_AddressLine,details_WorkPlace_Address_Country_Id,details_WorkPlace_Address_Country_Name,details_WorkPlace_Address_Municipality_Id,details_WorkPlace_Address_Municipality_Name,details_WorkPlace_Address_Region_Id,details_WorkPlace_Address_Region_Name,details_WorkPlace_Address_PostalCode,details_WorkPlace_Address_City,details_WorkPlace_PhoneNumber_Number,details_WorkPlace_PhoneNumber_Type,details_WorkPlace_PhoneNumber_Description,details_WorkPlace_FaxNumber,details_WorkPlace_Email,details_WorkPlace_WebAddress,details_WorkPlace_Description,details_WorkPlace_Logo,details_WorkPlace_WorkPlaceOrganizationNumber,details_WorkPlace_OrganizationNumber,details_WorkPlace_OrganizationDescription,details_JobPositionPosting_Id,details_JobPositionPosting_HiringOrg_Name,details_JobPositionPosting_HiringOrg_Address_AddressLine,details_JobPositionPosting_HiringOrg_Address_Country_Id,details_JobPositionPosting_HiringOrg_Address_Country_Name,details_JobPositionPosting_HiringOrg_Address_Municipality_Id,details_JobPositionPosting_HiringOrg_Address_Municipality_Name,details_JobPositionPosting_HiringOrg_Address_Region_Id,details_JobPositionPosting_HiringOrg_Address_Region_Name,details_JobPositionPosting_HiringOrg_Address_PostalCode,details_JobPositionPosting_HiringOrg_Address_City,details_JobPositionPosting_HiringOrg_PhoneNumber_Number,details_JobPositionPosting_HiringOrg_PhoneNumber_Type,details_JobPositionPosting_HiringOrg_PhoneNumber_Description,details_JobPositionPosting_HiringOrg_FaxNumber,details_JobPositionPosting_HiringOrg_Email,details_JobPositionPosting_HiringOrg_WebAddress,details_JobPositionPosting_HiringOrg_Description,details_JobPositionPosting_HiringOrg_Logo,details_JobPositionPosting_HiringOrg_WorkPlaceOrganizationNumber,details_JobPositionPosting_HiringOrg_OrganizationNumber,details_JobPositionPosting_HiringOrg_OrganizationDescription,details_JobPositionPosting_RecruitingCompany,details_JobPositionPosting_PublicationStartDate,details_JobPositionPosting_PublicationEndDate,details_JobPositionPosting_JobPositionInformation_PositionTitle,details_JobPositionPosting_JobPositionInformation_Purpose,details_JobPositionPosting_JobPositionInformation_WorkLocation_AddressLine,details_JobPositionPosting_JobPositionInformation_WorkLocation_Country_Id,details_JobPositionPosting_JobPositionInformation_WorkLocation_Country_Name,details_JobPositionPosting_JobPositionInformation_WorkLocation_Municipality_Id,details_JobPositionPosting_JobPositionInformation_WorkLocation_Municipality_Name,details_JobPositionPosting_JobPositionInformation_WorkLocation_Region_Id,details_JobPositionPosting_JobPositionInformation_WorkLocation_Region_Name,details_JobPositionPosting_JobPositionInformation_WorkLocation_PostalCode,details_JobPositionPosting_JobPositionInformation_WorkLocation_City,details_JobPositionPosting_JobPositionInformation_EmploymentType,details_JobPositionPosting_JobPositionInformation_WeeklyWorkHours_TypeId,details_JobPositionPosting_JobPositionInformation_WeeklyWorkHours_TypeName,details_JobPositionPosting_JobPositionInformation_WeeklyWorkHours_Description,details_JobPositionPosting_JobPositionInformation_CompensationDescription,details_JobPositionPosting_JobPositionInformation_NumberToFill,details_JobPositionPosting_JobPositionInformation_DriverLicense,details_JobPositionPosting_JobPositionInformation_Occupation_Name,details_JobPositionPosting_JobPositionInformation_Occupation_DiscoWeb,details_JobPositionPosting_JobPositionInformation_Occupation_AlternateNames,details_JobPositionPosting_JobPositionInformation_Occupation_GroupId,details_JobPositionPosting_JobPositionInformation_Occupation_AreaId,details_JobPositionPosting_JobPositionInformation_IsGovernmentHiring,details_JobPositionPosting_JobPositionInformation_JppContacts,details_JobPositionPosting_JobPositionInformation_EmploymentDate,details_JobPositionPosting_IsRecruitmentOfForeignNationals,details_JobPositionPosting_IsWorkInDenmark,details_JobPositionPosting_IsAnonymousEmployer,details_JobPositionPosting_IsDisabilityFriendly,details_JobPositionPosting_JppType,details_JobPositionPosting_ApplicationDetails_WorkHourMax,details_JobPositionPosting_ApplicationDetails_WorkHourMin,details_JobPositionPosting_ApplicationDetails_DailyWorkTimeWeekend,details_JobPositionPosting_ApplicationDetails_DailyWorkTimeNight,details_JobPositionPosting_ApplicationDetails_DailyWorkTimeEvening,details_JobPositionPosting_ApplicationDetails_DailyWorkTimeDay,details_JobPositionPosting_ApplicationDetails_DailyWorkTimeMorning,details_JobPositionPosting_ApplicationDetails_DailyWorkTimeVarious,details_JobPositionPosting_ApplicationDetails_ReferenceText,details_JobPositionPosting_ApplicationDetails_RemarksToApplicant,details_JobPositionPosting_ApplicationDetails_ByEmail,details_JobPositionPosting_ApplicationDetails_ByPhone,details_JobPositionPosting_ApplicationDetails_ApplyViaUrl,details_JobPositionPosting_ApplicationDetails_ReplyInWriting,details_JobPositionPosting_ApplicationDetails_ApplicationDeadlineDate,details_JobPositionPosting_Status,details_LogoUrl,details_Address,details_ShowMap,details_ShowShareButtonJobLog,details_JobLogUrl,details_JobLogTemplateModel_Identifier,details_JobLogTemplateModel_UseWorkPlaceAddressForJoblog,details_JobLogTemplateModel_Category,details_JobLogTemplateModel_CvCustomerIdentifier,details_JobLogTemplateModel_JobSeekingStatus,details_JobLogTemplateModel_Title,details_JobLogTemplateModel_IsApplicationSourceRequired,details_JobLogTemplateModel_ApplicationSource,details_JobLogTemplateModel_IsWeeklyWorkTimeRequired,details_JobLogTemplateModel_WeeklyWorkTime,details_JobLogTemplateModel_HoursPerWeek,details_JobLogTemplateModel_JobnetJobPostingIdentifier,details_JobLogTemplateModel_JobAdDocument_Title,details_JobLogTemplateModel_JobAdDocument_Identifier,details_JobLogTemplateModel_JobAdDocument_IsDeletedBySystem,details_JobLogTemplateModel_JobAdDocument_IsDeletedByUser,details_JobLogTemplateModel_JobAdFile,details_JobLogTemplateModel_Company_JobLogEntryCategory,details_JobLogTemplateModel_Company_ShowAddressFieldsEvenIfEmpty,details_JobLogTemplateModel_Company_Name,details_JobLogTemplateModel_Company_Address,details_JobLogTemplateModel_Company_Country,details_JobLogTemplateModel_Company_EmploymentAreaID,details_JobLogTemplateModel_Company_PostCode,details_JobLogTemplateModel_Company_IsCountryAndTownAndPostCodeEmpty,details_JobLogTemplateModel_Company_IsTownAndPostCodeEmpty,details_JobLogTemplateModel_Company_IsCountryDanmark,details_JobLogTemplateModel_Company_Town,details_JobLogTemplateModel_Company_ContactPerson,details_JobLogTemplateModel_Company_Phone,details_JobLogTemplateModel_Company_Email,details_JobLogTemplateModel_Company_Latitude,details_JobLogTemplateModel_Company_Longitude,details_JobLogTemplateModel_Company_DailyTravelTimeInMinutes,details_JobLogTemplateModel_Company_DistanceToCompanyInMeters,details_JobLogTemplateModel_Company_IsCreateMode,details_JobLogTemplateModel_TypeOfSubmission,details_JobLogTemplateModel_SubmissionDate,details_JobLogTemplateModel_SubmissionDateFormatted,details_JobLogTemplateModel_SubmissionDateTiks,details_JobLogTemplateModel_IsSubmissionDateRequired,details_JobLogTemplateModel_Status,details_JobLogTemplateModel_DateCreatedFormatted,details_JobLogTemplateModel_DateCreated,details_JobLogTemplateModel_DateModifiedFormatted,details_JobLogTemplateModel_DateModified,details_JobLogTemplateModel_LastModifiedDateTiks,details_JobLogTemplateModel_DateClosed,details_JobLogTemplateModel_JobApplicationDocument_Title,details_JobLogTemplateModel_JobApplicationDocument_Identifier,details_JobLogTemplateModel_JobApplicationDocument_IsDeletedBySystem,details_JobLogTemplateModel_JobApplicationDocument_IsDeletedByUser,details_JobLogTemplateModel_CvDocument_Title,details_JobLogTemplateModel_CvDocument_Identifier,details_JobLogTemplateModel_CvDocument_IsDeletedBySystem,details_JobLogTemplateModel_CvDocument_IsDeletedByUser,details_JobLogTemplateModel_JobApplicationFile,details_JobLogTemplateModel_CvFile,details_JobLogTemplateModel_SubmissionDeadlineDate,details_JobLogTemplateModel_IsPersisted,details_JobLogTemplateModel_ServerValidationErrors,details_JobLogTemplateModel_HasServerValidationErrors,details_JoblogWorkTime_WorkHour,details_JoblogWorkTime_DailyWorkTime,details_Place,details_OpenPrintDialog,details_WorkPlaceInfoText,details_JobCenterContactDetails,details_WorkPlaceDescriptionText,details_FavoriteText,details_IsFavorite,details_ShowFavorite,details_MetaOgTextForSharing,details_DescriptionForSharing,details_TitleForSharing,details_RutePlan,details_FormattedPurpose,details_MapUrl,details_OrganizationNumber,details_ShowSearchJobButton,details_ShowPrint,details_BackToFindWorkButtonUrl,isExternal
0,False,1,Kultur- og litteraturformidlere til AssensBibliotekerne,Kultur- og litteraturformidlere til AssensBibliotekerne,"Er du nysgerrig af natur og optaget af, hvad der sker i litteraturen, kulturen og i samfundet generelt? Og vil du være med til at udvikle biblioteksvæsnet i Assens Kommune? Så har vi et spændende ",Assens Kommune - AssensBibliotekerne,Willemoesgade 2B  ,5610,Assens,False,False,False,True,2025-01-27T10:05:30,2025-02-17T23:59:00,17. februar 2025,0001-01-01T00:00:00,False,False,https://job.jobnet.dk/CV/FindWork/Details/11447913-89f4-4a1d-9a79-ee6260cd04d0,Syddanmark,Assens,Danmark,5610,,Almindelige vilkår,Fastansættelse,Fuldtid,Akademisk arbejde,Bibliotekar- og arkivararbejde,Bibliotekar,55.2917,9.8933,,,1003310287,,29189692,False,False,https://job.jobnet.dk/CV/FindWork/DetailsSocialmedia/11447913-89f4-4a1d-9a79-ee6260cd04d0,https://job.jobnet.dk/CV/FindWork/Details/11447913-89f4-4a1d-9a79-ee6260cd04d0,https://job.jobnet.dk/CV/FindWork/Details/11447913-89f4-4a1d-9a79-ee6260cd04d0,True,11447913-89f4-4a1d-9a79-ee6260cd04d0,55.2917,9.8933,"{'Id': 1, 'Name': 'Fuldtid'}, {'Id': 16, 'Name': 'Deltid'}","{'Id': 1, 'Name': 'Almindelige vilkår'}, {'Id': 2, 'Name': 'Fleksjob'}, {'Id': 3, 'Name': 'Skånejob'}, {'Id': 4, 'Name': 'Egnet til efterlønnere og seniorer'}, {'Id': 5, 'Name': 'Job med løntilskud'}, {'Id': 6, 'Name': 'Rotationsjob'}, {'Id': 7, 'Name': 'Virksomhedspraktik'}","{'Id': 1, 'Name': 'Fastansættelse'}, {'Id': 16, 'Name': 'Tidsbegrænset ansættelse'}",Assens Kommune - AssensBibliotekerne,Willemoesgade 2B,58,Danmark,420,Assens,3,Syddanmark,5610,Assens,,0,Primary,,,https://www.ofir.dk/resultat/Jobannonce.aspx?ofirId=e62c9ebe&action=sendApplicationUrl&utm_source=job.jobnet.dk&utm_medium=referral,None,,1003310287,29189692,None,11447913-89f4-4a1d-9a79-ee6260cd04d0,Assens Kommune - AssensBibliotekerne,Willemoesgade 2B,58,Danmark,420,Assens,3,Syddanmark,5610,Assens,,0,Primary,,,https://www.ofir.dk/resultat/Jobannonce.aspx?ofirId=e62c9ebe&action=sendApplicationUrl&utm_source=job.jobnet.dk&utm_medium=referral,None,,1003310287,29189692,None,,2025-01-27T10:05:30.6156711+01:00,2025-02-17T23:59:00+01:00,Kultur- og litteraturformidlere til AssensBibliotekerne,"Er du nysgerrig af natur og optaget af, hvad der sker i litteraturen, kulturen og i samfundet generelt? Og vil du være med til at udvikle biblioteksvæsnet i Assens Kommune? Så har vi et spændende job til dig! Vi søger nemlig to nye kollegaer, der har lyst til at skabe rum for kulturelle fællesskaber, vidensformidling og læsekultur! I Assens Kommune er visionerne for det gode liv formuleret med ordene:     Det gode liv skaber vi sammen - Et godt og sundt liv får vi især, når vi deler det med nogen. Derfor er fællesskaber vigtige.   Vores børn og unge lykkes - Vores børn og unge er vores fremtid. Derfor giver vi dem de bedste forudsætninger for et godt liv.    Vi passer godt på vores natur og miljø - Vi bidrager til en renere verden til gavn for vores efterkommere. Derfor har vi en grøn og bæredygtig profil.     AssensBibliotekerne byder ind i denne vision, og vi søger to nye kollegaer, der har lyst til at skabe rammer for kulturelle fællesskaber i de enkelte lokalsamfund, fremme dannelse, oplysning og information samt skabe grobund for udvikling af læsekultur.    Den ene stilling er på 30 timer ugentlig, og den anden er på 37 timer ugentlig. Begge stillinger er med tiltrædelse den 1. maj.   Om os   AssensBibliotekerne består af seks biblioteksafdelinger, der dækker hele Assens Kommune og som samarbejder om opgaverne på tværs.   Fælles for alle afdelinger er et ønske om en lokal forankring med et tæt samarbejde med lokale kræfter og institutioner.   Vi har alle et hjerte, der banker for litteratur, kultur og viden.   Jobbeskrivelse   Du kommer til at indgå i tværgående opgaver lokalt og på tværs af alle seks biblioteksafdelinger i kommunen.   Jobbet er alsidigt og arbejdsopgaverne er:     Indgå i bibliotekets daglige drift   Formidlingsopgaver i biblioteket bl.a. via materialeudstillinger og direkte kontakt med borgerne   Koordination af fællesskaber omkring litteratur og andre kulturaktiviteter   Skriftlig formidling, bl.a. tekster til lokalpressen, lokal Facebook-gruppe, plakater, pressemeddelelser og nyhedsbreve   Være med i forskellige arbejdsgrupperne   Primært fokus på den voksne målgruppe     AssensBibliotekernes seks afdelinger er del af lokalsamfundene i de seks centerbyer i Assens Kommune.   Det forventes, at du har lyst og interesse i at indgå i lokale samarbejder om udvikling af aktuelle bibliotekstilbud i lokalområdet.   Vi er et-rums biblioteker, og du vil skulle betjene både børn, unge og voksne.   På nuværende tidspunkt er der en arbejdsdag til kl. 18 om ugen og lørdagsarbejde hver fjerde lørdag.   Der er ca. 3-4 udlånsvagter pr. uge. Der vil tillige være aftenarrangementer efter kl. 18 og enkelte weekendarrangementer.   Vi lægger vægt på, at du har flair for biblioteksdrift og er i besiddelse af viden om og interesse for kultur og litteratur samt samfundsoplysning.   Og at du har lyst til at sætte det i spil, mod på at prøve nye opgaver og er interesseret i at indgå i et fællesskab, hvor vi hjælper hinanden med at skabe spændende biblioteker i tæt dialog og kontakt med brugerne og samarbejdspartnere.   Din profil   Faglig profil     Du skal være uddannet bibliotekar eller have anden relevant uddannelse – og helt afgørende at du har et hjerte for folkebiblioteket   Du har erfaring i og forståelse for arbejdet med bibliotekssystemet Cicero.   Du har en grundlæggende nysgerrighed for, hvad der rører sig i samfundet og i litteraturen   Du kan planlægge, koordinere og afvikle arrangementer og events, og du er en god vært   Du har en flydende pen med blik for den gode historie   Du er i stand til at arbejde procesorienteret og i en kultur, hvor vi prøver tingene af og udvikler løbende.     Personlig profil:     Du har stærke relationelle kompetencer   Du trives på tværs af teams og du sætter dine kompetencer i spil.   Du er imødekommende, lydhør og anerkendende over for såvel borgerne som kollegaerne   Du kan tage initiativ og omsætte tanker til handlinger.   Du kan planlægge og omstille dig, når der er behov for det – i en til tider uforudsigelig hverdag     Derfor skal du vælge os   Vi tilbyder et spændende og attraktivt arbejdsteam med gode muligheder for at sætte dit præg på opgaverne. Der er opgaver, der skal overtages, og der er nye at opdyrke. Du får stor frihed i stillingen og du får dygtige kolleger, der står klar til at hjælpe dig.   Vi er 16 medarbejdere (inkl. de to nye kollegaer) med forskellige fagligheder og baggrunde, fordelt på seks afdelinger i Assens Kommune.   Vi arbejder aktivt for at skabe rum for kulturelle fællesskaber i de enkelte lokalsamfund, fremme dannelse, oplysning og information samt skabe grobund for udvikling af læsekultur.   Biblioteket indgår i et tæt i samarbejde med øvrige offentlige institutioner, foreninger og lokale ildsjæle for at udvikle fremtidens bibliotek.   Løn og ansættelsesvilkår   Løn og ansættelsesvilkår vil være i henhold til gældende overenskomst. Endelig lønfastsættelse sker efter forhandling med den forhandlingsberettigede faglige organisation på baggrund af kvalifikationer.   Der vil blive indhentet privat straffeattest og børneattest og ansættelse sker under forudsætning af, at de ikke viser, at du er uegnet til stillingen. Stillingen er til enhver tid betinget af en tilfredsstillende privat straffeattest og anmærkningsfri børneattest.   Vil du vide mere   Vil du vide mere, kan du finde flere informationer på  assensbib.dk .   Du er også velkommen til at kontakte biblioteksfaglig koordinator Michael Poulsen på telefon 21 83 50 74 eller  mipou@assens.dk  eller biblioteksleder Helle Skaarup på telefon 24 93 43 97 eller  heska@assens.dk       Ansøgning   Klik på ""Ansøg"" nedenfor for at udfylde og sende din ansøgning. Alle felter med * skal udfyldes. Først når du har modtaget en kvittering pr. e-mail, har vi modtaget din ansøgning.   Skriv i ansøgningen, hvilket timeantal, du er interesseret i.   Søg jobbet senest mandag den 17. februar. Ansættelsessamtaler holder vi tirsdag den 4. marts. Er der brug for 2. samtalerunde vil den afholdes tirsdag den 11. marts.   Forud for ansættelse, indhenter vi reference.   Vi ser frem til at høre fra dig! 
 Denne jobannonce blev oprindeligt opslået på  https://www.ofir.dk/ 
 (Den originale annonce kan ses på:  https://www.ofir.dk/showojob?ofirid=e62c9ebe )",Willemoesgade 2B,58,Danmark,420,Assens,3,Syddanmark,5610,Assens,1,1,Fuldtid,None,None,1,,Bibliotekar,0,"Skolebibliotekar, 518",0,0,False,,,False,False,False,False,4,,,False,False,False,False,False,False,,,,,https://www.ofir.dk/resultat/Jobannonce.aspx?ofirId=e62c9ebe&action=sendApplicationUrl&utm_source=job.jobnet.dk&utm_medium=referral,False,2025-02-17T23:59:00+01:00,7,/CV/FindWork/GetLogo?JobAdId=11447913-89f4-4a1d-9a79-ee6260cd04d0&Organisation=29189692,"Willemoesgade 2B,5610, Assens",True,False,/CV/Jobseeking/JobLog/CreateJobSearch?JobnetJobPostingIdentifier=11447913-89f4-4a1d-9a79-ee6260cd04d0&Company.Name=Assens Kommune - AssensBibliotekerne&SubmissionDeadlineDate=2025-2-17&Title=Kultur- og litteraturformidlere til AssensBibliotekerne&WeeklyWorkTime=1,00000000-0000-0000-0000-000000000000,True,0,,,Kultur- og litteraturformidlere til AssensBibliotekerne,True,,True,1,,11447913-89f4-4a1d-9a79-ee6260cd04d0,,,False,False,,0,False,Assens Kommune - AssensBibliotekerne,Willemoesgade 2B,,,5610,False,False,False,Assens,,,,,,,,False,,2025-02-17T23:59:00+01:00,,0,False,0,,,,,0,,,,False,False,,,False,False,,,,False,,False,,,Arbejdspladsen ligger i Assens kommune,False,Assens Kommune - AssensBibliotekerne,,None,,False,False,"Er du nysgerrig af natur og optaget af, hvad der sker i litteraturen, kulturen og i samfundet generelt? Og vil du være med til at udvikle biblioteksvæsnet i Assens Kommune? Så har vi et spændende job til dig! Vi søger nemlig to nye kollegaer, der har lyst til at skabe rum for kulturelle fællesskaber, vidensformidling og læsekultur!I Assens Kommune ","""Er du nysgerrig af natur og optaget af, hvad der sker i litteraturen, kulturen og i samfundet generelt? Og vil du være med til at udvikle biblioteksvæsnet i Assens Kommune? Så har vi et spændende job til dig! Vi søger nemlig to nye kollegaer, der har lyst til at skabe rum for kulturelle fællesskaber, vidensformidling og læsekultur!I Assens Kommune ""","""Kultur- og litteraturformidlere til AssensBibliotekerne""","https://www.google.dk/maps/dir//Willemoesgade+2B,5610,+Assens/","Er du nysgerrig af natur og optaget af, hvad der sker i litteraturen, kulturen og i samfundet generelt? Og vil du være med til at udvikle biblioteksvæsnet i Assens Kommune? Så har vi et spændende job til dig! Vi søger nemlig to nye kollegaer, der har lyst til at skabe rum for kulturelle fællesskaber, vidensformidling og læsekultur! I Assens Kommune er visionerne for det gode liv formuleret med ordene:     Det gode liv skaber vi sammen - Et godt og sundt liv får vi især, når vi deler det med nogen. Derfor er fællesskaber vigtige.   Vores børn og unge lykkes - Vores børn og unge er vores fremtid. Derfor giver vi dem de bedste forudsætninger for et godt liv.    Vi passer godt på vores natur og miljø - Vi bidrager til en renere verden til gavn for vores efterkommere. Derfor har vi en grøn og bæredygtig profil.     AssensBibliotekerne byder ind i denne vision, og vi søger to nye kollegaer, der har lyst til at skabe rammer for kulturelle fællesskaber i de enkelte lokalsamfund, fremme dannelse, oplysning og information samt skabe grobund for udvikling af læsekultur.    Den ene stilling er på 30 timer ugentlig, og den anden er på 37 timer ugentlig. Begge stillinger er med tiltrædelse den 1. maj.   Om os   AssensBibliotekerne består af seks biblioteksafdelinger, der dækker hele Assens Kommune og som samarbejder om opgaverne på tværs.   Fælles for alle afdelinger er et ønske om en lokal forankring med et tæt samarbejde med lokale kræfter og institutioner.   Vi har alle et hjerte, der banker for litteratur, kultur og viden.   Jobbeskrivelse   Du kommer til at indgå i tværgående opgaver lokalt og på tværs af alle seks biblioteksafdelinger i kommunen.   Jobbet er alsidigt og arbejdsopgaverne er:     Indgå i bibliotekets daglige drift   Formidlingsopgaver i biblioteket bl.a. via materialeudstillinger og direkte kontakt med borgerne   Koordination af fællesskaber omkring litteratur og andre kulturaktiviteter   Skriftlig formidling, bl.a. tekster til lokalpressen, lokal Facebook-gruppe, plakater, pressemeddelelser og nyhedsbreve   Være med i forskellige arbejdsgrupperne   Primært fokus på den voksne målgruppe     AssensBibliotekernes seks afdelinger er del af lokalsamfundene i de seks centerbyer i Assens Kommune.   Det forventes, at du har lyst og interesse i at indgå i lokale samarbejder om udvikling af aktuelle bibliotekstilbud i lokalområdet.   Vi er et-rums biblioteker, og du vil skulle betjene både børn, unge og voksne.   På nuværende tidspunkt er der en arbejdsdag til kl. 18 om ugen og lørdagsarbejde hver fjerde lørdag.   Der er ca. 3-4 udlånsvagter pr. uge. Der vil tillige være aftenarrangementer efter kl. 18 og enkelte weekendarrangementer.   Vi lægger vægt på, at du har flair for biblioteksdrift og er i besiddelse af viden om og interesse for kultur og litteratur samt samfundsoplysning.   Og at du har lyst til at sætte det i spil, mod på at prøve nye opgaver og er interesseret i at indgå i et fællesskab, hvor vi hjælper hinanden med at skabe spændende biblioteker i tæt dialog og kontakt med brugerne og samarbejdspartnere.   Din profil   Faglig profil     Du skal være uddannet bibliotekar eller have anden relevant uddannelse – og helt afgørende at du har et hjerte for folkebiblioteket   Du har erfaring i og forståelse for arbejdet med bibliotekssystemet Cicero.   Du har en grundlæggende nysgerrighed for, hvad der rører sig i samfundet og i litteraturen   Du kan planlægge, koordinere og afvikle arrangementer og events, og du er en god vært   Du har en flydende pen med blik for den gode historie   Du er i stand til at arbejde procesorienteret og i en kultur, hvor vi prøver tingene af og udvikler løbende.     Personlig profil:     Du har stærke relationelle kompetencer   Du trives på tværs af teams og du sætter dine kompetencer i spil.   Du er imødekommende, lydhør og anerkendende over for såvel borgerne som kollegaerne   Du kan tage initiativ og omsætte tanker til handlinger.   Du kan planlægge og omstille dig, når der er behov for det – i en til tider uforudsigelig hverdag     Derfor skal du vælge os   Vi tilbyder et spændende og attraktivt arbejdsteam med gode muligheder for at sætte dit præg på opgaverne. Der er opgaver, der skal overtages, og der er nye at opdyrke. Du får stor frihed i stillingen og du får dygtige kolleger, der står klar til at hjælpe dig.   Vi er 16 medarbejdere (inkl. de to nye kollegaer) med forskellige fagligheder og baggrunde, fordelt på seks afdelinger i Assens Kommune.   Vi arbejder aktivt for at skabe rum for kulturelle fællesskaber i de enkelte lokalsamfund, fremme dannelse, oplysning og information samt skabe grobund for udvikling af læsekultur.   Biblioteket indgår i et tæt i samarbejde med øvrige offentlige institutioner, foreninger og lokale ildsjæle for at udvikle fremtidens bibliotek.   Løn og ansættelsesvilkår   Løn og ansættelsesvilkår vil være i henhold til gældende overenskomst. Endelig lønfastsættelse sker efter forhandling med den forhandlingsberettigede faglige organisation på baggrund af kvalifikationer.   Der vil blive indhentet privat straffeattest og børneattest og ansættelse sker under forudsætning af, at de ikke viser, at du er uegnet til stillingen. Stillingen er til enhver tid betinget af en tilfredsstillende privat straffeattest og anmærkningsfri børneattest.   Vil du vide mere   Vil du vide mere, kan du finde flere informationer på  assensbib.dk .   Du er også velkommen til at kontakte biblioteksfaglig koordinator Michael Poulsen på telefon 21 83 50 74 eller  mipou@assens.dk  eller biblioteksleder Helle Skaarup på telefon 24 93 43 97 eller  heska@assens.dk       Ansøgning   Klik på ""Ansøg"" nedenfor for at udfylde og sende din ansøgning. Alle felter med * skal udfyldes. Først når du har modtaget en kvittering pr. e-mail, har vi modtaget din ansøgning.   Skriv i ansøgningen, hvilket timeantal, du er interesseret i.   Søg jobbet senest mandag den 17. februar. Ansættelsessamtaler holder vi tirsdag den 4. marts. Er der brug for 2. samtalerunde vil den afholdes tirsdag den 11. marts.   Forud for ansættelse, indhenter vi reference.   Vi ser frem til at høre fra dig! 
 Denne jobannonce blev oprindeligt opslået på  https://www.ofir.dk/ 
 (Den originale annonce kan ses på:  https://www.ofir.dk/showojob?ofirid=e62c9ebe )","https://www.google.dk/maps/place/Willemoesgade+2B,5610,+Assens/",29189692,False,False,,False
