summary_AutomatchType,summary_Abroad,summary_Weight,summary_Title,summary_JobHeadline,summary_Presentation,summary_HiringOrgName,summary_WorkPlaceAddress,summary_WorkPlacePostalCode,summary_WorkPlaceCity,summary_WorkPlaceOtherAddress,summary_WorkPlaceAbroad,summary_WorkPlaceNotStatic,summary_UseWorkPlaceAddressForJoblog,summary_PostingCreated,summary_LastDateApplication,summary_FormattedLastDateApplication,summary_AssignmentStartDate,summary_IsHotjob,summary_IsExternal,summary_Url,summary_Region,summary_Municipality,summary_Country,summary_PostalCode,summary_PostalCodeName,summary_JobAnnouncementType,summary_EmploymentType,summary_WorkHours,summary_OccupationArea,summary_OccupationGroup,summary_Occupation,summary_Location_Latitude,summary_Location_Longitude,summary_JoblogWorkTime_WorkHour,summary_JoblogWorkTime_DailyWorkTime,summary_WorkplaceID,summary_OrganisationId,summary_HiringOrgCVR,summary_UserLoggedIn,summary_AnonymousEmployer,summary_ShareUrl,summary_DetailsUrl,summary_JobLogUrl,summary_HasLocationValues,summary_ID,summary_Latitude,summary_Longitude,details_WorkSchedule,details_WorkConditions,details_EmploymentTypes,details_WorkPlace_Name,details_WorkPlace_Address_AddressLine,details_WorkPlace_Address_Country_Id,details_WorkPlace_Address_Country_Name,details_WorkPlace_Address_Municipality_Id,details_WorkPlace_Address_Municipality_Name,details_WorkPlace_Address_Region_Id,details_WorkPlace_Address_Region_Name,details_WorkPlace_Address_PostalCode,details_WorkPlace_Address_City,details_WorkPlace_PhoneNumber_Number,details_WorkPlace_PhoneNumber_Type,details_WorkPlace_PhoneNumber_Description,details_WorkPlace_FaxNumber,details_WorkPlace_Email,details_WorkPlace_WebAddress,details_WorkPlace_Description,details_WorkPlace_Logo,details_WorkPlace_WorkPlaceOrganizationNumber,details_WorkPlace_OrganizationNumber,details_WorkPlace_OrganizationDescription,details_JobPositionPosting_Id,details_JobPositionPosting_HiringOrg_Name,details_JobPositionPosting_HiringOrg_Address_AddressLine,details_JobPositionPosting_HiringOrg_Address_Country_Id,details_JobPositionPosting_HiringOrg_Address_Country_Name,details_JobPositionPosting_HiringOrg_Address_Municipality_Id,details_JobPositionPosting_HiringOrg_Address_Municipality_Name,details_JobPositionPosting_HiringOrg_Address_Region_Id,details_JobPositionPosting_HiringOrg_Address_Region_Name,details_JobPositionPosting_HiringOrg_Address_PostalCode,details_JobPositionPosting_HiringOrg_Address_City,details_JobPositionPosting_HiringOrg_PhoneNumber_Number,details_JobPositionPosting_HiringOrg_PhoneNumber_Type,details_JobPositionPosting_HiringOrg_PhoneNumber_Description,details_JobPositionPosting_HiringOrg_FaxNumber,details_JobPositionPosting_HiringOrg_Email,details_JobPositionPosting_HiringOrg_WebAddress,details_JobPositionPosting_HiringOrg_Description,details_JobPositionPosting_HiringOrg_Logo,details_JobPositionPosting_HiringOrg_WorkPlaceOrganizationNumber,details_JobPositionPosting_HiringOrg_OrganizationNumber,details_JobPositionPosting_HiringOrg_OrganizationDescription,details_JobPositionPosting_RecruitingCompany,details_JobPositionPosting_PublicationStartDate,details_JobPositionPosting_PublicationEndDate,details_JobPositionPosting_JobPositionInformation_PositionTitle,details_JobPositionPosting_JobPositionInformation_Purpose,details_JobPositionPosting_JobPositionInformation_WorkLocation_AddressLine,details_JobPositionPosting_JobPositionInformation_WorkLocation_Country_Id,details_JobPositionPosting_JobPositionInformation_WorkLocation_Country_Name,details_JobPositionPosting_JobPositionInformation_WorkLocation_Municipality_Id,details_JobPositionPosting_JobPositionInformation_WorkLocation_Municipality_Name,details_JobPositionPosting_JobPositionInformation_WorkLocation_Region_Id,details_JobPositionPosting_JobPositionInformation_WorkLocation_Region_Name,details_JobPositionPosting_JobPositionInformation_WorkLocation_PostalCode,details_JobPositionPosting_JobPositionInformation_WorkLocation_City,details_JobPositionPosting_JobPositionInformation_EmploymentType,details_JobPositionPosting_JobPositionInformation_WeeklyWorkHours_TypeId,details_JobPositionPosting_JobPositionInformation_WeeklyWorkHours_TypeName,details_JobPositionPosting_JobPositionInformation_WeeklyWorkHours_Description,details_JobPositionPosting_JobPositionInformation_CompensationDescription,details_JobPositionPosting_JobPositionInformation_NumberToFill,details_JobPositionPosting_JobPositionInformation_DriverLicense,details_JobPositionPosting_JobPositionInformation_Occupation_Name,details_JobPositionPosting_JobPositionInformation_Occupation_DiscoWeb,details_JobPositionPosting_JobPositionInformation_Occupation_AlternateNames,details_JobPositionPosting_JobPositionInformation_Occupation_GroupId,details_JobPositionPosting_JobPositionInformation_Occupation_AreaId,details_JobPositionPosting_JobPositionInformation_IsGovernmentHiring,details_JobPositionPosting_JobPositionInformation_JppContacts,details_JobPositionPosting_JobPositionInformation_EmploymentDate,details_JobPositionPosting_IsRecruitmentOfForeignNationals,details_JobPositionPosting_IsWorkInDenmark,details_JobPositionPosting_IsAnonymousEmployer,details_JobPositionPosting_IsDisabilityFriendly,details_JobPositionPosting_JppType,details_JobPositionPosting_ApplicationDetails_WorkHourMax,details_JobPositionPosting_ApplicationDetails_WorkHourMin,details_JobPositionPosting_ApplicationDetails_DailyWorkTimeWeekend,details_JobPositionPosting_ApplicationDetails_DailyWorkTimeNight,details_JobPositionPosting_ApplicationDetails_DailyWorkTimeEvening,details_JobPositionPosting_ApplicationDetails_DailyWorkTimeDay,details_JobPositionPosting_ApplicationDetails_DailyWorkTimeMorning,details_JobPositionPosting_ApplicationDetails_DailyWorkTimeVarious,details_JobPositionPosting_ApplicationDetails_ReferenceText,details_JobPositionPosting_ApplicationDetails_RemarksToApplicant,details_JobPositionPosting_ApplicationDetails_ByEmail,details_JobPositionPosting_ApplicationDetails_ByPhone,details_JobPositionPosting_ApplicationDetails_ApplyViaUrl,details_JobPositionPosting_ApplicationDetails_ReplyInWriting,details_JobPositionPosting_ApplicationDetails_ApplicationDeadlineDate,details_JobPositionPosting_Status,details_LogoUrl,details_Address,details_ShowMap,details_ShowShareButtonJobLog,details_JobLogUrl,details_JobLogTemplateModel_Identifier,details_JobLogTemplateModel_UseWorkPlaceAddressForJoblog,details_JobLogTemplateModel_Category,details_JobLogTemplateModel_CvCustomerIdentifier,details_JobLogTemplateModel_JobSeekingStatus,details_JobLogTemplateModel_Title,details_JobLogTemplateModel_IsApplicationSourceRequired,details_JobLogTemplateModel_ApplicationSource,details_JobLogTemplateModel_IsWeeklyWorkTimeRequired,details_JobLogTemplateModel_WeeklyWorkTime,details_JobLogTemplateModel_HoursPerWeek,details_JobLogTemplateModel_JobnetJobPostingIdentifier,details_JobLogTemplateModel_JobAdDocument_Title,details_JobLogTemplateModel_JobAdDocument_Identifier,details_JobLogTemplateModel_JobAdDocument_IsDeletedBySystem,details_JobLogTemplateModel_JobAdDocument_IsDeletedByUser,details_JobLogTemplateModel_JobAdFile,details_JobLogTemplateModel_Company_JobLogEntryCategory,details_JobLogTemplateModel_Company_ShowAddressFieldsEvenIfEmpty,details_JobLogTemplateModel_Company_Name,details_JobLogTemplateModel_Company_Address,details_JobLogTemplateModel_Company_Country,details_JobLogTemplateModel_Company_EmploymentAreaID,details_JobLogTemplateModel_Company_PostCode,details_JobLogTemplateModel_Company_IsCountryAndTownAndPostCodeEmpty,details_JobLogTemplateModel_Company_IsTownAndPostCodeEmpty,details_JobLogTemplateModel_Company_IsCountryDanmark,details_JobLogTemplateModel_Company_Town,details_JobLogTemplateModel_Company_ContactPerson,details_JobLogTemplateModel_Company_Phone,details_JobLogTemplateModel_Company_Email,details_JobLogTemplateModel_Company_Latitude,details_JobLogTemplateModel_Company_Longitude,details_JobLogTemplateModel_Company_DailyTravelTimeInMinutes,details_JobLogTemplateModel_Company_DistanceToCompanyInMeters,details_JobLogTemplateModel_Company_IsCreateMode,details_JobLogTemplateModel_TypeOfSubmission,details_JobLogTemplateModel_SubmissionDate,details_JobLogTemplateModel_SubmissionDateFormatted,details_JobLogTemplateModel_SubmissionDateTiks,details_JobLogTemplateModel_IsSubmissionDateRequired,details_JobLogTemplateModel_Status,details_JobLogTemplateModel_DateCreatedFormatted,details_JobLogTemplateModel_DateCreated,details_JobLogTemplateModel_DateModifiedFormatted,details_JobLogTemplateModel_DateModified,details_JobLogTemplateModel_LastModifiedDateTiks,details_JobLogTemplateModel_DateClosed,details_JobLogTemplateModel_JobApplicationDocument_Title,details_JobLogTemplateModel_JobApplicationDocument_Identifier,details_JobLogTemplateModel_JobApplicationDocument_IsDeletedBySystem,details_JobLogTemplateModel_JobApplicationDocument_IsDeletedByUser,details_JobLogTemplateModel_CvDocument_Title,details_JobLogTemplateModel_CvDocument_Identifier,details_JobLogTemplateModel_CvDocument_IsDeletedBySystem,details_JobLogTemplateModel_CvDocument_IsDeletedByUser,details_JobLogTemplateModel_JobApplicationFile,details_JobLogTemplateModel_CvFile,details_JobLogTemplateModel_SubmissionDeadlineDate,details_JobLogTemplateModel_IsPersisted,details_JobLogTemplateModel_ServerValidationErrors,details_JobLogTemplateModel_HasServerValidationErrors,details_JoblogWorkTime_WorkHour,details_JoblogWorkTime_DailyWorkTime,details_Place,details_OpenPrintDialog,details_WorkPlaceInfoText,details_JobCenterContactDetails,details_WorkPlaceDescriptionText,details_FavoriteText,details_IsFavorite,details_ShowFavorite,details_MetaOgTextForSharing,details_DescriptionForSharing,details_TitleForSharing,details_RutePlan,details_FormattedPurpose,details_MapUrl,details_OrganizationNumber,details_ShowSearchJobButton,details_ShowPrint,details_BackToFindWorkButtonUrl,isExternal
0,False,1,Marketingmedarbejder,Marketingmedarbejder,"Har du gjort noget komplekst let afkodeligt og markedsført det med interessante resultater? Kender du til målgrupper som regioner og kommuner? Og har du solide kompetencer inden for SEO, SEM, paid ",Hovedkontor Ballerup,Borupvang 5E  ,2750,Ballerup,False,False,False,True,2025-01-16T00:00:00,2025-02-07T23:59:59,7. februar 2025,0001-01-01T00:00:00,False,False,https://job.jobnet.dk/CV/FindWork/Details/1217a22a-99c7-48dd-8747-b611d8634060,Hovedstaden og Bornholm,Ballerup,Danmark,2750,,Almindelige vilkår,Fastansættelse,Fuldtid,"Salg, indkøb og markedsføring",Marketing,Marketingmedarbejder,55.7367,12.3638,,Dag,1002908465,,11394914,False,False,https://job.jobnet.dk/CV/FindWork/DetailsSocialmedia/1217a22a-99c7-48dd-8747-b611d8634060,https://job.jobnet.dk/CV/FindWork/Details/1217a22a-99c7-48dd-8747-b611d8634060,https://job.jobnet.dk/CV/FindWork/Details/1217a22a-99c7-48dd-8747-b611d8634060,True,1217a22a-99c7-48dd-8747-b611d8634060,55.7367,12.3638,"{'Id': 1, 'Name': 'Fuldtid'}, {'Id': 16, 'Name': 'Deltid'}","{'Id': 1, 'Name': 'Almindelige vilkår'}, {'Id': 2, 'Name': 'Fleksjob'}, {'Id': 3, 'Name': 'Skånejob'}, {'Id': 4, 'Name': 'Egnet til efterlønnere og seniorer'}, {'Id': 5, 'Name': 'Job med løntilskud'}, {'Id': 6, 'Name': 'Rotationsjob'}, {'Id': 7, 'Name': 'Virksomhedspraktik'}","{'Id': 1, 'Name': 'Fastansættelse'}, {'Id': 16, 'Name': 'Tidsbegrænset ansættelse'}",Hovedkontor Ballerup,Borupvang 5E,58,Danmark,151,Ballerup,4,"Hovedstaden, Sjælland og Bornholm",2750,,,0,Primary,,,https://app.jobmatchprofile.com/h7qkh1/forenede-care/cpeput/marketingmedarbejder,None,,1002908465,11394914,None,1217a22a-99c7-48dd-8747-b611d8634060,Hovedkontor Ballerup,Borupvang 5E,58,Danmark,151,Ballerup,4,"Hovedstaden, Sjælland og Bornholm",2750,,,0,Primary,,,https://app.jobmatchprofile.com/h7qkh1/forenede-care/cpeput/marketingmedarbejder,None,,1002908465,11394914,None,,2025-01-16T00:00:00+01:00,2025-02-07T23:59:59+01:00,Marketingmedarbejder,"Har du gjort noget komplekst let afkodeligt og markedsført det med interessante resultater? Kender du til målgrupper som regioner og kommuner? Og har du solide kompetencer inden for SEO, SEM, paid og strategisk markedsføring - så glæder vi os til at vende vores muligheder og dine drømme om et godt arbejdsliv med dig. 
   
 Om stillingen 
 Som Forenede Cares kommunikations- og marketingmedarbejder får du vores indsatser på ældre-, social-, og neuroområdet ud over rampen.  
 Du trives med at udarbejde forskellige typer af indhold til hjemmeside og SoMe, og du forstår at versionere, så du skaber sammenhængende brugerrejser til forskellige målgrupper. 
 Du er stærk digitalt. Hotjar- og GA4-indsigter samt Yoast-optimering af WordPress, anden SEO, SEM og paid er dagligt på din to do-liste, og du følger evaluerende og selvstændigt op på dine opgaver. Dels for at lære af erfaringerne, så du kan skabe mere værdi. Dels fordi du synes, det er sjovt at blive skarpere på målgrupper og muligheder. 
 Du skal også synes, det lyder spændende at forme metoder og mål, da stillingen er nyoprettet.  
 Du bliver en vigtig sparringspartner i udarbejdelsen af den kommunikations- og marketingstrategi, som bliver Forenede Cares kompas. Vi glæder os til samarbejdet! 
   
 Vi forestiller os, at du 
 
 Ser fornuft i løbende evaluering - og laver dem selv, så du sikrer, din digitale indsats er værdiskabende 
 Er opfindsom og kreativ - men også struktureret, KPI-drevet og målorienteret 
 Synes, det er spændende at følge med i komplekse, politisk styrede målgruppers færden såvel som den digitale udvikling - og du bruger de indsigter, du løbende får. Ex AI-nysgerrighed og Canva-kompetencer er i dit DNA 
 Ser flere muligheder end begrænsninger, trives med at kommunikation ikke er kunst, men alligevel gør dig umage 
 Vil kunne lide at være vores go to på digital kommunikation og markedsføring 
 
 Vi tilbyder 
 Vores kommunikations- og marketingmedarbejder bliver en del af Forenede Cares stab i Ballerup i vores lille kommunikationsteam. I staben arbejder vi alle dedikeret for at gøre en forskel. Vi værner om et positivt og humoristisk arbejds- samt læringsmiljø. Vi har gode ansættelsesforhold. Udover pension og sundhedssikring har vi en eminent kantineordning. Vi kan godt lide at spise frokost sammen. 
 Der er mulighed for hjemmearbejde tirsdag og torsdag. Stillingen er på 37 timer.  
 Dine opgaver vil blandt andet omfatte 
 
 Vedligeholdelse og kvalitetssikring af vores hjemmeside, dvs. indhold og brugerrejser under alle vores segmenter og undersegmenter, herunder fx SEO, SEM og generel integration  
 Udvikling og drift af alle vores sociale medier, herunder paid 
 Udvikling og kontinuerlig monitorering/understøttelse af lokale SoMe-ambassadører 
 Produktion/bestilling af materialer, fx brochurer, manualer og merch 
 Løbende prioritering af vores indsatser - måske kender du et værktøj, vi slet ikke har taget i brug endnu? Vi glæder os til at høre om det 
 Sparringspartner på Forenede Cares overordnede kommunikationsstrategi - du bidrager med digital vitalitet 
 
 Ansøgningsprocedure 
 
 I stedet for en traditionel ansøgning vil vi hellere modtage eksempler på marketingindsatser, du er særligt stolt af, og som har skabt mærkbare resultater - gerne med relevans for Forenede Care. Start med at beskrive, hvor du ser Forenede Care om ét år med dig ved marketingroret. Har du erfaring med vores interessentlandskab, er det oplagt at nævne det kort 
 Ansøgningsfrist d. 7. februar kl. 12.00 -  Opstart efter aftale 
 Der vil blive afholdt samtaler snarest efter ansøgningsfristen, og derefter vil du få en mindre opgave 
 
 For yderligere information om stillingen, kontakt Ea Ørum, chef for kommunikation og public affairs, på  eaorum@forenede-care.dk  eller telefonnummer 20 52 95 15. 
 Vi opfordrer alle interesserede uanset alder, køn, handicap, race, religion eller etnisk tilhørsforhold, til at søge stillingen. 
 Om Forenede Care 
 Forenede Care A/S er et 100% danskejet familieselskab, der er specialister inden for neuro-, social- og ældreområdet. Forenede Care er en del af Forenede Koncernen, som blev startet af Peer C. Krogh i 1959 med sin cykel, spande og klude. Dengang startede han Forenede Service, og i dag er Forenede en professionel koncern med fire selskaber i Danmark og Sverige og over 11.000 medarbejdere. 
 Hos Forenede Care er vi specialister i professionel omsorg, pleje og rehabilitering. Vi har centre over hele Danmark, som alle er indrettet som hyggelige hjem med plads til kæledyr, grønne planter og fuglekvidder. Som en del af vores historie og udvikling har vi altid fokuseret på at skabe trygge og omsorgsfulde rammer for vores beboere.  
 Vi møder beboerne med overskud, nærvær og engagement, fordi alt, hvad vi gør, handler om deres hverdag. Det er det, som gør os til Forenede. 
 Vil du vide mere om os? Besøg vores hjemmeside på www.forenedecare.dk.",Borupvang 5E,58,Danmark,151,Ballerup,4,"Hovedstaden, Sjælland og Bornholm",2750,,1,1,Fuldtid,None,None,1,,Marketingmedarbejder,0,"Fravalgt 2023-04 Markedsanalytiker, Reklamekoordinator, Reklamekampagneassistent, Fravalgt 2023-04 Prissætningsspecialist, Onlinemarkedsfører, Netværksmarkedsfører, Fravalgt 2023-04 Medlemsbestyrer, Medieplanlægger, Markedsføringsspecialist, Markedsføringsassistent, 3858, 3859, Marketingsassistent, Digital manager, Content Manager, Digital content manager, Brand Manager",0,0,False,"{'Email': 'eaorum@forenede-care.dk', 'PersonName': 'Ea Ørum', 'FirstName': 'Ea', 'LastName': 'Ørum', 'PositionTitle': 'Chef for Kommunikation & Public', 'PhoneNumbers': [{'Number': '(+45)20529515', 'Type': 0, 'Description': 'Primary'}]}",,False,False,False,False,4,,,False,False,False,True,False,False,,,,,https://app.jobmatchprofile.com/h7qkh1/forenede-care/cpeput/marketingmedarbejder,False,2025-02-07T23:59:59+01:00,7,/CV/FindWork/GetLogo?JobAdId=1217a22a-99c7-48dd-8747-b611d8634060&Organisation=11394914,"Borupvang 5E,2750, ",True,False,/CV/Jobseeking/JobLog/CreateJobSearch?JobnetJobPostingIdentifier=1217a22a-99c7-48dd-8747-b611d8634060&Company.Name=Hovedkontor Ballerup&SubmissionDeadlineDate=2025-2-7&Title=Marketingmedarbejder&WeeklyWorkTime=1,00000000-0000-0000-0000-000000000000,True,0,,,Marketingmedarbejder,True,,True,1,,1217a22a-99c7-48dd-8747-b611d8634060,,,False,False,,0,False,Hovedkontor Ballerup,Borupvang 5E,,,2750,False,False,False,,Ea Ørum,(+45)20529515,eaorum@forenede-care.dk,,,,,False,,2025-02-07T23:59:59+01:00,,0,False,0,,,,,0,,,,False,False,,,False,False,,,,False,,False,,Dag,Arbejdspladsen ligger i Ballerup kommune,False,Hovedkontor Ballerup,,None,,False,False,"Har du gjort noget komplekst let afkodeligt og markedsført det med interessante resultater? Kender du til målgrupper som regioner og kommuner? Og har du solide kompetencer inden for SEO, SEM, paid og strategisk markedsføring - så glæder vi os til at vende vores muligheder og dine drømme om et godt arbejdsliv med dig.



Om stillingen

Som Forenede ","""Har du gjort noget komplekst let afkodeligt og markedsført det med interessante resultater? Kender du til målgrupper som regioner og kommuner? Og har du solide kompetencer inden for SEO, SEM, paid og strategisk markedsføring - så glæder vi os til at vende vores muligheder og dine drømme om et godt arbejdsliv med dig.\n\n\n\nOm stillingen\n\nSom Forenede ""","""Marketingmedarbejder""","https://www.google.dk/maps/dir//Borupvang+5E,2750,+/","Har du gjort noget komplekst let afkodeligt og markedsført det med interessante resultater? Kender du til målgrupper som regioner og kommuner? Og har du solide kompetencer inden for SEO, SEM, paid og strategisk markedsføring - så glæder vi os til at vende vores muligheder og dine drømme om et godt arbejdsliv med dig. 
   
 Om stillingen 
 Som Forenede Cares kommunikations- og marketingmedarbejder får du vores indsatser på ældre-, social-, og neuroområdet ud over rampen.  
 Du trives med at udarbejde forskellige typer af indhold til hjemmeside og SoMe, og du forstår at versionere, så du skaber sammenhængende brugerrejser til forskellige målgrupper. 
 Du er stærk digitalt. Hotjar- og GA4-indsigter samt Yoast-optimering af WordPress, anden SEO, SEM og paid er dagligt på din to do-liste, og du følger evaluerende og selvstændigt op på dine opgaver. Dels for at lære af erfaringerne, så du kan skabe mere værdi. Dels fordi du synes, det er sjovt at blive skarpere på målgrupper og muligheder. 
 Du skal også synes, det lyder spændende at forme metoder og mål, da stillingen er nyoprettet.  
 Du bliver en vigtig sparringspartner i udarbejdelsen af den kommunikations- og marketingstrategi, som bliver Forenede Cares kompas. Vi glæder os til samarbejdet! 
   
 Vi forestiller os, at du 
 
 Ser fornuft i løbende evaluering - og laver dem selv, så du sikrer, din digitale indsats er værdiskabende 
 Er opfindsom og kreativ - men også struktureret, KPI-drevet og målorienteret 
 Synes, det er spændende at følge med i komplekse, politisk styrede målgruppers færden såvel som den digitale udvikling - og du bruger de indsigter, du løbende får. Ex AI-nysgerrighed og Canva-kompetencer er i dit DNA 
 Ser flere muligheder end begrænsninger, trives med at kommunikation ikke er kunst, men alligevel gør dig umage 
 Vil kunne lide at være vores go to på digital kommunikation og markedsføring 
 
 Vi tilbyder 
 Vores kommunikations- og marketingmedarbejder bliver en del af Forenede Cares stab i Ballerup i vores lille kommunikationsteam. I staben arbejder vi alle dedikeret for at gøre en forskel. Vi værner om et positivt og humoristisk arbejds- samt læringsmiljø. Vi har gode ansættelsesforhold. Udover pension og sundhedssikring har vi en eminent kantineordning. Vi kan godt lide at spise frokost sammen. 
 Der er mulighed for hjemmearbejde tirsdag og torsdag. Stillingen er på 37 timer.  
 Dine opgaver vil blandt andet omfatte 
 
 Vedligeholdelse og kvalitetssikring af vores hjemmeside, dvs. indhold og brugerrejser under alle vores segmenter og undersegmenter, herunder fx SEO, SEM og generel integration  
 Udvikling og drift af alle vores sociale medier, herunder paid 
 Udvikling og kontinuerlig monitorering/understøttelse af lokale SoMe-ambassadører 
 Produktion/bestilling af materialer, fx brochurer, manualer og merch 
 Løbende prioritering af vores indsatser - måske kender du et værktøj, vi slet ikke har taget i brug endnu? Vi glæder os til at høre om det 
 Sparringspartner på Forenede Cares overordnede kommunikationsstrategi - du bidrager med digital vitalitet 
 
 Ansøgningsprocedure 
 
 I stedet for en traditionel ansøgning vil vi hellere modtage eksempler på marketingindsatser, du er særligt stolt af, og som har skabt mærkbare resultater - gerne med relevans for Forenede Care. Start med at beskrive, hvor du ser Forenede Care om ét år med dig ved marketingroret. Har du erfaring med vores interessentlandskab, er det oplagt at nævne det kort 
 Ansøgningsfrist d. 7. februar kl. 12.00 -  Opstart efter aftale 
 Der vil blive afholdt samtaler snarest efter ansøgningsfristen, og derefter vil du få en mindre opgave 
 
 For yderligere information om stillingen, kontakt Ea Ørum, chef for kommunikation og public affairs, på  eaorum@forenede-care.dk  eller telefonnummer 20 52 95 15. 
 Vi opfordrer alle interesserede uanset alder, køn, handicap, race, religion eller etnisk tilhørsforhold, til at søge stillingen. 
 Om Forenede Care 
 Forenede Care A/S er et 100% danskejet familieselskab, der er specialister inden for neuro-, social- og ældreområdet. Forenede Care er en del af Forenede Koncernen, som blev startet af Peer C. Krogh i 1959 med sin cykel, spande og klude. Dengang startede han Forenede Service, og i dag er Forenede en professionel koncern med fire selskaber i Danmark og Sverige og over 11.000 medarbejdere. 
 Hos Forenede Care er vi specialister i professionel omsorg, pleje og rehabilitering. Vi har centre over hele Danmark, som alle er indrettet som hyggelige hjem med plads til kæledyr, grønne planter og fuglekvidder. Som en del af vores historie og udvikling har vi altid fokuseret på at skabe trygge og omsorgsfulde rammer for vores beboere.  
 Vi møder beboerne med overskud, nærvær og engagement, fordi alt, hvad vi gør, handler om deres hverdag. Det er det, som gør os til Forenede. 
 Vil du vide mere om os? Besøg vores hjemmeside på  www.forenedecare.dk .","https://www.google.dk/maps/place/Borupvang+5E,2750,+/",11394914,False,False,,False
