summary_AutomatchType,summary_Abroad,summary_Weight,summary_Title,summary_JobHeadline,summary_Presentation,summary_HiringOrgName,summary_WorkPlaceAddress,summary_WorkPlacePostalCode,summary_WorkPlaceCity,summary_WorkPlaceOtherAddress,summary_WorkPlaceAbroad,summary_WorkPlaceNotStatic,summary_UseWorkPlaceAddressForJoblog,summary_PostingCreated,summary_LastDateApplication,summary_FormattedLastDateApplication,summary_AssignmentStartDate,summary_IsHotjob,summary_IsExternal,summary_Url,summary_Region,summary_Municipality,summary_Country,summary_PostalCode,summary_PostalCodeName,summary_JobAnnouncementType,summary_EmploymentType,summary_WorkHours,summary_OccupationArea,summary_OccupationGroup,summary_Occupation,summary_Location_Latitude,summary_Location_Longitude,summary_JoblogWorkTime_WorkHour,summary_JoblogWorkTime_DailyWorkTime,summary_WorkplaceID,summary_OrganisationId,summary_HiringOrgCVR,summary_UserLoggedIn,summary_AnonymousEmployer,summary_ShareUrl,summary_DetailsUrl,summary_JobLogUrl,summary_HasLocationValues,summary_ID,summary_Latitude,summary_Longitude,details_WorkSchedule,details_WorkConditions,details_EmploymentTypes,details_WorkPlace_Name,details_WorkPlace_Address_AddressLine,details_WorkPlace_Address_Country_Id,details_WorkPlace_Address_Country_Name,details_WorkPlace_Address_Municipality_Id,details_WorkPlace_Address_Municipality_Name,details_WorkPlace_Address_Region_Id,details_WorkPlace_Address_Region_Name,details_WorkPlace_Address_PostalCode,details_WorkPlace_Address_City,details_WorkPlace_PhoneNumber_Number,details_WorkPlace_PhoneNumber_Type,details_WorkPlace_PhoneNumber_Description,details_WorkPlace_FaxNumber,details_WorkPlace_Email,details_WorkPlace_WebAddress,details_WorkPlace_Description,details_WorkPlace_Logo,details_WorkPlace_WorkPlaceOrganizationNumber,details_WorkPlace_OrganizationNumber,details_WorkPlace_OrganizationDescription,details_JobPositionPosting_Id,details_JobPositionPosting_HiringOrg_Name,details_JobPositionPosting_HiringOrg_Address_AddressLine,details_JobPositionPosting_HiringOrg_Address_Country_Id,details_JobPositionPosting_HiringOrg_Address_Country_Name,details_JobPositionPosting_HiringOrg_Address_Municipality_Id,details_JobPositionPosting_HiringOrg_Address_Municipality_Name,details_JobPositionPosting_HiringOrg_Address_Region_Id,details_JobPositionPosting_HiringOrg_Address_Region_Name,details_JobPositionPosting_HiringOrg_Address_PostalCode,details_JobPositionPosting_HiringOrg_Address_City,details_JobPositionPosting_HiringOrg_PhoneNumber_Number,details_JobPositionPosting_HiringOrg_PhoneNumber_Type,details_JobPositionPosting_HiringOrg_PhoneNumber_Description,details_JobPositionPosting_HiringOrg_FaxNumber,details_JobPositionPosting_HiringOrg_Email,details_JobPositionPosting_HiringOrg_WebAddress,details_JobPositionPosting_HiringOrg_Description,details_JobPositionPosting_HiringOrg_Logo,details_JobPositionPosting_HiringOrg_WorkPlaceOrganizationNumber,details_JobPositionPosting_HiringOrg_OrganizationNumber,details_JobPositionPosting_HiringOrg_OrganizationDescription,details_JobPositionPosting_RecruitingCompany,details_JobPositionPosting_PublicationStartDate,details_JobPositionPosting_PublicationEndDate,details_JobPositionPosting_JobPositionInformation_PositionTitle,details_JobPositionPosting_JobPositionInformation_Purpose,details_JobPositionPosting_JobPositionInformation_WorkLocation_AddressLine,details_JobPositionPosting_JobPositionInformation_WorkLocation_Country_Id,details_JobPositionPosting_JobPositionInformation_WorkLocation_Country_Name,details_JobPositionPosting_JobPositionInformation_WorkLocation_Municipality_Id,details_JobPositionPosting_JobPositionInformation_WorkLocation_Municipality_Name,details_JobPositionPosting_JobPositionInformation_WorkLocation_Region_Id,details_JobPositionPosting_JobPositionInformation_WorkLocation_Region_Name,details_JobPositionPosting_JobPositionInformation_WorkLocation_PostalCode,details_JobPositionPosting_JobPositionInformation_WorkLocation_City,details_JobPositionPosting_JobPositionInformation_EmploymentType,details_JobPositionPosting_JobPositionInformation_WeeklyWorkHours_TypeId,details_JobPositionPosting_JobPositionInformation_WeeklyWorkHours_TypeName,details_JobPositionPosting_JobPositionInformation_WeeklyWorkHours_Description,details_JobPositionPosting_JobPositionInformation_CompensationDescription,details_JobPositionPosting_JobPositionInformation_NumberToFill,details_JobPositionPosting_JobPositionInformation_DriverLicense,details_JobPositionPosting_JobPositionInformation_Occupation_Name,details_JobPositionPosting_JobPositionInformation_Occupation_DiscoWeb,details_JobPositionPosting_JobPositionInformation_Occupation_AlternateNames,details_JobPositionPosting_JobPositionInformation_Occupation_GroupId,details_JobPositionPosting_JobPositionInformation_Occupation_AreaId,details_JobPositionPosting_JobPositionInformation_IsGovernmentHiring,details_JobPositionPosting_JobPositionInformation_JppContacts,details_JobPositionPosting_JobPositionInformation_EmploymentDate,details_JobPositionPosting_IsRecruitmentOfForeignNationals,details_JobPositionPosting_IsWorkInDenmark,details_JobPositionPosting_IsAnonymousEmployer,details_JobPositionPosting_IsDisabilityFriendly,details_JobPositionPosting_JppType,details_JobPositionPosting_ApplicationDetails_WorkHourMax,details_JobPositionPosting_ApplicationDetails_WorkHourMin,details_JobPositionPosting_ApplicationDetails_DailyWorkTimeWeekend,details_JobPositionPosting_ApplicationDetails_DailyWorkTimeNight,details_JobPositionPosting_ApplicationDetails_DailyWorkTimeEvening,details_JobPositionPosting_ApplicationDetails_DailyWorkTimeDay,details_JobPositionPosting_ApplicationDetails_DailyWorkTimeMorning,details_JobPositionPosting_ApplicationDetails_DailyWorkTimeVarious,details_JobPositionPosting_ApplicationDetails_ReferenceText,details_JobPositionPosting_ApplicationDetails_RemarksToApplicant,details_JobPositionPosting_ApplicationDetails_ByEmail,details_JobPositionPosting_ApplicationDetails_ByPhone,details_JobPositionPosting_ApplicationDetails_ApplyViaUrl,details_JobPositionPosting_ApplicationDetails_ReplyInWriting,details_JobPositionPosting_ApplicationDetails_ApplicationDeadlineDate,details_JobPositionPosting_Status,details_LogoUrl,details_Address,details_ShowMap,details_ShowShareButtonJobLog,details_JobLogUrl,details_JobLogTemplateModel_Identifier,details_JobLogTemplateModel_UseWorkPlaceAddressForJoblog,details_JobLogTemplateModel_Category,details_JobLogTemplateModel_CvCustomerIdentifier,details_JobLogTemplateModel_JobSeekingStatus,details_JobLogTemplateModel_Title,details_JobLogTemplateModel_IsApplicationSourceRequired,details_JobLogTemplateModel_ApplicationSource,details_JobLogTemplateModel_IsWeeklyWorkTimeRequired,details_JobLogTemplateModel_WeeklyWorkTime,details_JobLogTemplateModel_HoursPerWeek,details_JobLogTemplateModel_JobnetJobPostingIdentifier,details_JobLogTemplateModel_JobAdDocument_Title,details_JobLogTemplateModel_JobAdDocument_Identifier,details_JobLogTemplateModel_JobAdDocument_IsDeletedBySystem,details_JobLogTemplateModel_JobAdDocument_IsDeletedByUser,details_JobLogTemplateModel_JobAdFile,details_JobLogTemplateModel_Company_JobLogEntryCategory,details_JobLogTemplateModel_Company_ShowAddressFieldsEvenIfEmpty,details_JobLogTemplateModel_Company_Name,details_JobLogTemplateModel_Company_Address,details_JobLogTemplateModel_Company_Country,details_JobLogTemplateModel_Company_EmploymentAreaID,details_JobLogTemplateModel_Company_PostCode,details_JobLogTemplateModel_Company_IsCountryAndTownAndPostCodeEmpty,details_JobLogTemplateModel_Company_IsTownAndPostCodeEmpty,details_JobLogTemplateModel_Company_IsCountryDanmark,details_JobLogTemplateModel_Company_Town,details_JobLogTemplateModel_Company_ContactPerson,details_JobLogTemplateModel_Company_Phone,details_JobLogTemplateModel_Company_Email,details_JobLogTemplateModel_Company_Latitude,details_JobLogTemplateModel_Company_Longitude,details_JobLogTemplateModel_Company_DailyTravelTimeInMinutes,details_JobLogTemplateModel_Company_DistanceToCompanyInMeters,details_JobLogTemplateModel_Company_IsCreateMode,details_JobLogTemplateModel_TypeOfSubmission,details_JobLogTemplateModel_SubmissionDate,details_JobLogTemplateModel_SubmissionDateFormatted,details_JobLogTemplateModel_SubmissionDateTiks,details_JobLogTemplateModel_IsSubmissionDateRequired,details_JobLogTemplateModel_Status,details_JobLogTemplateModel_DateCreatedFormatted,details_JobLogTemplateModel_DateCreated,details_JobLogTemplateModel_DateModifiedFormatted,details_JobLogTemplateModel_DateModified,details_JobLogTemplateModel_LastModifiedDateTiks,details_JobLogTemplateModel_DateClosed,details_JobLogTemplateModel_JobApplicationDocument_Title,details_JobLogTemplateModel_JobApplicationDocument_Identifier,details_JobLogTemplateModel_JobApplicationDocument_IsDeletedBySystem,details_JobLogTemplateModel_JobApplicationDocument_IsDeletedByUser,details_JobLogTemplateModel_CvDocument_Title,details_JobLogTemplateModel_CvDocument_Identifier,details_JobLogTemplateModel_CvDocument_IsDeletedBySystem,details_JobLogTemplateModel_CvDocument_IsDeletedByUser,details_JobLogTemplateModel_JobApplicationFile,details_JobLogTemplateModel_CvFile,details_JobLogTemplateModel_SubmissionDeadlineDate,details_JobLogTemplateModel_IsPersisted,details_JobLogTemplateModel_ServerValidationErrors,details_JobLogTemplateModel_HasServerValidationErrors,details_JoblogWorkTime_WorkHour,details_JoblogWorkTime_DailyWorkTime,details_Place,details_OpenPrintDialog,details_WorkPlaceInfoText,details_JobCenterContactDetails,details_WorkPlaceDescriptionText,details_FavoriteText,details_IsFavorite,details_ShowFavorite,details_MetaOgTextForSharing,details_DescriptionForSharing,details_TitleForSharing,details_RutePlan,details_FormattedPurpose,details_MapUrl,details_OrganizationNumber,details_ShowSearchJobButton,details_ShowPrint,details_BackToFindWorkButtonUrl,isExternal
0,False,1,Hjælper søges til stilling ved 54-årig kvinde – Silkeborg,Hjælper søges til stilling ved 54-årig kvinde – Silkeborg,"OMRÅDE:&nbsp;&nbsp;8600 Silkeborg
Jeg søger 1 fuldtids kvindelige hjælper, med respiratorisk erfaring, til mit fantastiske team.
LIDT OM MIG:Jeg ",Handicapformidlingen Vildbjerg,Privat   ,8600,Silkeborg,True,False,False,False,2025-01-17T00:00:00,2025-02-19T00:00:00,19. februar 2025,0001-01-01T00:00:00,False,False,https://job.jobnet.dk/CV/FindWork/Details/133f47d4-7dc9-4107-8a32-789872540c4b,Midtjylland,Silkeborg,Danmark,8600,,Almindelige vilkår,Fastansættelse,Fuldtid,"Sundhed, omsorg og personlig pleje",Pleje og omsorg,Handicaphjælper,56.1715,9.49,,,1026016297,,34605416,False,False,https://job.jobnet.dk/CV/FindWork/DetailsSocialmedia/133f47d4-7dc9-4107-8a32-789872540c4b,https://job.jobnet.dk/CV/FindWork/Details/133f47d4-7dc9-4107-8a32-789872540c4b,https://job.jobnet.dk/CV/FindWork/Details/133f47d4-7dc9-4107-8a32-789872540c4b,True,133f47d4-7dc9-4107-8a32-789872540c4b,56.1715,9.49,"{'Id': 1, 'Name': 'Fuldtid'}, {'Id': 16, 'Name': 'Deltid'}","{'Id': 1, 'Name': 'Almindelige vilkår'}, {'Id': 2, 'Name': 'Fleksjob'}, {'Id': 3, 'Name': 'Skånejob'}, {'Id': 4, 'Name': 'Egnet til efterlønnere og seniorer'}, {'Id': 5, 'Name': 'Job med løntilskud'}, {'Id': 6, 'Name': 'Rotationsjob'}, {'Id': 7, 'Name': 'Virksomhedspraktik'}","{'Id': 1, 'Name': 'Fastansættelse'}, {'Id': 16, 'Name': 'Tidsbegrænset ansættelse'}",Handicapformidlingen Vildbjerg,Privat,58,Danmark,740,Silkeborg,2,Midtjylland,8600,Silkeborg,,0,Primary,,200890@handicapformidlingen.dk,,None,,1026016297,34605416,None,133f47d4-7dc9-4107-8a32-789872540c4b,Handicapformidlingen Vildbjerg,Privat,58,Danmark,740,Silkeborg,2,Midtjylland,8600,Silkeborg,,0,Primary,,200890@handicapformidlingen.dk,,None,,1026016297,34605416,None,,2025-01-17T00:00:00+01:00,2025-02-19T08:27:00+01:00,Hjælper søges til stilling ved 54-årig kvinde – Silkeborg,"OMRÅDE:   8600 Silkeborg 
 Jeg søger 1 fuldtids kvindelige hjælper, med respiratorisk erfaring, til mit fantastiske team. 
 LIDT OM MIG: Jeg er en kvinde på 54 år, der er bosat i Silkeborg. For fire år siden fik jeg konstateret sygdommen ”Amyotrofisk Lateral Sklerose” ALS. Jeg har mistet funktionen i mine ben og arme. Du skal være mine arme og ben. Med andre ord, du skal hjælpe mig med alt det, jeg selv ville have gjort, hvis jeg kunne. Jeg er kørestols- og respiratorbruger. Jeg trækker ikke selv vejret, og jeg har svært ved at tale og bruger oftest øjenstyret pc som kommunikationsmiddel. Jeg bor i dejlige og naturskønne Silkeborg. Mit nye rækkehus er indrettet efter min livssituation. Brede døre, automatisk døråbner, loftslift og specialindrettet badeværelse. Bemærk, at jeg bor i et ikke-ryger hjem. 
 Et aktivt og selvstændigt liv med familie, venner, udlandsrejser, ture i naturen, have, fitness, biograf og koncerter har altid været vigtigt for mig inden jeg blev syg. Ligesom en stille dag i mit eget selskab eller med min søn også er fantastisk. En hjemmedag med musik, en god bog, film eller en sportskamp (f.eks. NFL) er ikke at fornægte. Jeg forsøger at opretholde så meget normalitet i mit liv som muligt og ønsker at leve et indholds- og oplevelsesrigt liv – bare med nye rammer. Jeg er en meget nysgerrig, open-minded og social anlagt person, og jeg elsker forskellighed og at møde (nye) mennesker. JOBBESKRIVELSE: Jeg har et team, der er kendetegnet ved diversitet, så der opnås en dynamik, og hjælperne kan komplementere hinanden både i plejen og de praktiske opgaver. Vigtigt for mig er, at der tages hensyn til mine rutiner og, at der udvises en omsorgsfuld og hygiejnisk helhedspleje. Til gengæld lover jeg at gøre mit til at tage hensyn til teamets forskelligheder. Et godt arbejdsmiljø med en respektfuld tone og et godt grin er afgørende. Og empati fordres fra alle parter. Alle hjælpere får kursus af Rehabiliteringscenter for Muskelsvind. Ligesom hjemmesygeplejersken hver uge/hver 14. dag vil komme på besøg, og sparre med hjælperne samt mig. 
 Der er forflytninger mellem kørestol, toilet/badestol og seng, og evt. andre forekommende steder. Af hjælpemidler er der loftlift, Turn Aid og glidestykker. 
 Jeg er bevilget døgnhjælp, så mit team af hjælpere skal dække vagter hele døgnet. Det er en fordel, hvis du er bosat i eller i nærheden af Silkeborg. Det vil være en fordel, hvis du har respiratorisk erfaring. 
 Du bliver som handicaphjælper en del af et godt, fleksibelt og nødvendigt team af handicaphjælpere, der i fællesskab dækker alle vagter året rundt. Jobbet foregår i borgerens eget hjem, til fritidsaktiviteter, sociale arrangementer og de udflugter borgeren skulle have lyst til at deltage i. 
 ARBEJDSOPGAVER: 
 
 Personlig pleje, bad og toilet 
 Træning 3-4 gange dagligt 
 Alle respiratoriske opgaver 
 Forflytninger 
 Omlejringer i sengen 
 Lettere rengøring 
 Lettere små praktiske opgaver 
 Kørsel af min Ford Transit med automatgear 
 Ledsagelse ud af huset (ture i skov og v/sø, familie- og vennebesøg, biograf, koncerter, teater, kirke, udflugter, weekendture og ferier i ind- og udland, hospital, tandlæge, osv.) 
 
 KVALIFIKATIONER: 
 
 Kørekort B 
 Du ser muligheder frem for begrænsninger, er omstillingsparat og fleksibel ift. arbejdstider og arbejdssted 
 Proaktiv og kan arbejde selvstændigt 
 Du skal have situationsfornemmelse og kunne trække dig i perioder 
 Kvindelig hjælper 
 Du skal være god til at lære nyt og være indstillet på, at arbejdsgaverne vil ændre sig løbende, da der er tale om en progredierende sygdom 
 Plejeerfaring 
 Respiratorisk erfaring 
 
 PRAKTISKE INFORMATIONER: 
 
 Startdato: Hurtigst muligt 
 Fuldtid 
 Sidste frist for ansøgning: 19.02.2025 
 Afholdelse af samtaler: Løbende 
 Vi forbeholder os retten til at fjerne jobopslag før sidste frist, såfremt de rette kandidater er fundet 
 Hvis ikke du har hørt noget inden sidste frist, må du gå ud fra, at stillingen er besat til anden side 
 Der vil blive indhentet børne- og straffeattest ved ansættelsen 
 
 LØN: Hos pågældende borger aflønnes du med en grundløn på 145,55 kr. eller 148,01 kr. ved minimum tre års anciennitet Desuden gives der tidstillæg aften, nat og weekender. Kig  her  for yderligere information. 
 KONTAKT: Har du lyst til at søge den ledige stilling, skal du sende en skriftlig ansøgning direkte til borger til mail:  200890@handicapformidlingen.dk  – med et billede af dig selv. Spørgsmål vedrørende stillingen skal rettes til konsulent Simon Bastholm på mail:  sb@handicapformidlingen.dk  eller på telefon: 71 999 835 på hverdage mellem kl. 09:00 og 15:00. Ved eventuel henvendelse, oplys da medlemsnummer: 200890. 
 Vi opfordrer alle kvalificerede til at søge – uanset seksuel orientering, etnisk baggrund, religion, handicap eller alder. Vi tror på, at vores forskellighed beriger vores organisation og hjælper med at nå vores mål i fællesskab. HANDICAPFORMIDLINGEN: Handicapformidlingen administrerer hjælperordninger for mennesker med handicap i Danmark. Handicapformidlingen er Danmarks bedste BPA-leverandør – og specialist på området. Læs mere på vores hjemmeside:  www.handicapformidlingen.dk Er du interesseret i at blive ansat i Handicapformidlingen, kan du finde vores ledige jobs  her .",Privat,58,Danmark,740,Silkeborg,2,Midtjylland,8600,Silkeborg,1,1,Fuldtid,None,None,1,"{'DriversLicenceType': 3, 'Name': 'Almindelig bil', 'Description': ''}",Handicaphjælper,0,,0,0,False,"{'Email': 'sb@handicapformidlingen.dk', 'PersonName': 'Simon Bastholm', 'FirstName': 'Simon', 'LastName': 'Bastholm', 'PositionTitle': 'Konsulent', 'PhoneNumbers': [{'Number': '70777333', 'Type': 0, 'Description': 'Primary'}]}",,False,False,False,False,4,,,False,False,False,False,False,False,,,200890@handicapformidlingen.dk,,,False,2025-02-19T00:00:00+01:00,7,/CV/FindWork/GetLogo?JobAdId=133f47d4-7dc9-4107-8a32-789872540c4b&Organisation=34605416,"Privat,8600, Silkeborg",True,False,/CV/Jobseeking/JobLog/CreateJobSearch?JobnetJobPostingIdentifier=133f47d4-7dc9-4107-8a32-789872540c4b&Company.Name=Handicapformidlingen Vildbjerg&SubmissionDeadlineDate=2025-2-19&Title=Hjælper søges til stilling ved 54-årig kvinde – Silkeborg&WeeklyWorkTime=1,00000000-0000-0000-0000-000000000000,False,0,,,Hjælper søges til stilling ved 54-årig kvinde – Silkeborg,True,,True,1,,133f47d4-7dc9-4107-8a32-789872540c4b,,,False,False,,0,False,Handicapformidlingen Vildbjerg,Privat,,,8600,False,False,False,Silkeborg,Simon Bastholm,70777333,sb@handicapformidlingen.dk,,,,,False,,2025-02-19T00:00:00+01:00,,0,False,0,,,,,0,,,,False,False,,,False,False,,,,False,,False,,,Arbejdspladsen ligger i Silkeborg kommune,False,Handicapformidlingen Vildbjerg,,None,,False,False,"OMRÅDE:8600 Silkeborg
Jeg søger 1 fuldtids kvindelige hjælper, med respiratorisk erfaring, til mit fantastiske team.
LIDT OM MIG:Jeg er en kvinde på 54 år, der er bosat i Silkeborg. For fire år siden fik jeg konstateret sygdommen ”Amyotrofisk Lateral Sklerose” ALS. Jeg har mistet funktionen i mine ben og arme. Du skal være mine arme og ben. Med and","""OMRÅDE:8600 Silkeborg\nJeg søger 1 fuldtids kvindelige hjælper, med respiratorisk erfaring, til mit fantastiske team.\nLIDT OM MIG:Jeg er en kvinde på 54 år, der er bosat i Silkeborg. For fire år siden fik jeg konstateret sygdommen ”Amyotrofisk Lateral Sklerose” ALS. Jeg har mistet funktionen i mine ben og arme. Du skal være mine arme og ben. Med and""","""Hjælper søges til stilling ved 54-årig kvinde – Silkeborg""","https://www.google.dk/maps/dir//Privat,8600,+Silkeborg/","OMRÅDE:   8600 Silkeborg 
 Jeg søger 1 fuldtids kvindelige hjælper, med respiratorisk erfaring, til mit fantastiske team. 
 LIDT OM MIG: Jeg er en kvinde på 54 år, der er bosat i Silkeborg. For fire år siden fik jeg konstateret sygdommen ”Amyotrofisk Lateral Sklerose” ALS. Jeg har mistet funktionen i mine ben og arme. Du skal være mine arme og ben. Med andre ord, du skal hjælpe mig med alt det, jeg selv ville have gjort, hvis jeg kunne. Jeg er kørestols- og respiratorbruger. Jeg trækker ikke selv vejret, og jeg har svært ved at tale og bruger oftest øjenstyret pc som kommunikationsmiddel. Jeg bor i dejlige og naturskønne Silkeborg. Mit nye rækkehus er indrettet efter min livssituation. Brede døre, automatisk døråbner, loftslift og specialindrettet badeværelse. Bemærk, at jeg bor i et ikke-ryger hjem. 
 Et aktivt og selvstændigt liv med familie, venner, udlandsrejser, ture i naturen, have, fitness, biograf og koncerter har altid været vigtigt for mig inden jeg blev syg. Ligesom en stille dag i mit eget selskab eller med min søn også er fantastisk. En hjemmedag med musik, en god bog, film eller en sportskamp (f.eks. NFL) er ikke at fornægte. Jeg forsøger at opretholde så meget normalitet i mit liv som muligt og ønsker at leve et indholds- og oplevelsesrigt liv – bare med nye rammer. Jeg er en meget nysgerrig, open-minded og social anlagt person, og jeg elsker forskellighed og at møde (nye) mennesker. JOBBESKRIVELSE: Jeg har et team, der er kendetegnet ved diversitet, så der opnås en dynamik, og hjælperne kan komplementere hinanden både i plejen og de praktiske opgaver. Vigtigt for mig er, at der tages hensyn til mine rutiner og, at der udvises en omsorgsfuld og hygiejnisk helhedspleje. Til gengæld lover jeg at gøre mit til at tage hensyn til teamets forskelligheder. Et godt arbejdsmiljø med en respektfuld tone og et godt grin er afgørende. Og empati fordres fra alle parter. Alle hjælpere får kursus af Rehabiliteringscenter for Muskelsvind. Ligesom hjemmesygeplejersken hver uge/hver 14. dag vil komme på besøg, og sparre med hjælperne samt mig. 
 Der er forflytninger mellem kørestol, toilet/badestol og seng, og evt. andre forekommende steder. Af hjælpemidler er der loftlift, Turn Aid og glidestykker. 
 Jeg er bevilget døgnhjælp, så mit team af hjælpere skal dække vagter hele døgnet. Det er en fordel, hvis du er bosat i eller i nærheden af Silkeborg. Det vil være en fordel, hvis du har respiratorisk erfaring. 
 Du bliver som handicaphjælper en del af et godt, fleksibelt og nødvendigt team af handicaphjælpere, der i fællesskab dækker alle vagter året rundt. Jobbet foregår i borgerens eget hjem, til fritidsaktiviteter, sociale arrangementer og de udflugter borgeren skulle have lyst til at deltage i. 
 ARBEJDSOPGAVER: 
 
 Personlig pleje, bad og toilet 
 Træning 3-4 gange dagligt 
 Alle respiratoriske opgaver 
 Forflytninger 
 Omlejringer i sengen 
 Lettere rengøring 
 Lettere små praktiske opgaver 
 Kørsel af min Ford Transit med automatgear 
 Ledsagelse ud af huset (ture i skov og v/sø, familie- og vennebesøg, biograf, koncerter, teater, kirke, udflugter, weekendture og ferier i ind- og udland, hospital, tandlæge, osv.) 
 
 KVALIFIKATIONER: 
 
 Kørekort B 
 Du ser muligheder frem for begrænsninger, er omstillingsparat og fleksibel ift. arbejdstider og arbejdssted 
 Proaktiv og kan arbejde selvstændigt 
 Du skal have situationsfornemmelse og kunne trække dig i perioder 
 Kvindelig hjælper 
 Du skal være god til at lære nyt og være indstillet på, at arbejdsgaverne vil ændre sig løbende, da der er tale om en progredierende sygdom 
 Plejeerfaring 
 Respiratorisk erfaring 
 
 PRAKTISKE INFORMATIONER: 
 
 Startdato: Hurtigst muligt 
 Fuldtid 
 Sidste frist for ansøgning: 19.02.2025 
 Afholdelse af samtaler: Løbende 
 Vi forbeholder os retten til at fjerne jobopslag før sidste frist, såfremt de rette kandidater er fundet 
 Hvis ikke du har hørt noget inden sidste frist, må du gå ud fra, at stillingen er besat til anden side 
 Der vil blive indhentet børne- og straffeattest ved ansættelsen 
 
 LØN: Hos pågældende borger aflønnes du med en grundløn på 145,55 kr. eller 148,01 kr. ved minimum tre års anciennitet Desuden gives der tidstillæg aften, nat og weekender. Kig  her  for yderligere information. 
 KONTAKT: Har du lyst til at søge den ledige stilling, skal du sende en skriftlig ansøgning direkte til borger til mail:  200890@handicapformidlingen.dk  – med et billede af dig selv. Spørgsmål vedrørende stillingen skal rettes til konsulent Simon Bastholm på mail:  sb@handicapformidlingen.dk  eller på telefon: 71 999 835 på hverdage mellem kl. 09:00 og 15:00. Ved eventuel henvendelse, oplys da medlemsnummer: 200890. 
 Vi opfordrer alle kvalificerede til at søge – uanset seksuel orientering, etnisk baggrund, religion, handicap eller alder. Vi tror på, at vores forskellighed beriger vores organisation og hjælper med at nå vores mål i fællesskab. HANDICAPFORMIDLINGEN: Handicapformidlingen administrerer hjælperordninger for mennesker med handicap i Danmark. Handicapformidlingen er Danmarks bedste BPA-leverandør – og specialist på området. Læs mere på vores hjemmeside:  www.handicapformidlingen.dk Er du interesseret i at blive ansat i Handicapformidlingen, kan du finde vores ledige jobs  her .","https://www.google.dk/maps/place/Privat,8600,+Silkeborg/",34605416,False,False,,False
