summary_AutomatchType,summary_Abroad,summary_Weight,summary_Title,summary_JobHeadline,summary_Presentation,summary_HiringOrgName,summary_WorkPlaceAddress,summary_WorkPlacePostalCode,summary_WorkPlaceCity,summary_WorkPlaceOtherAddress,summary_WorkPlaceAbroad,summary_WorkPlaceNotStatic,summary_UseWorkPlaceAddressForJoblog,summary_PostingCreated,summary_LastDateApplication,summary_FormattedLastDateApplication,summary_AssignmentStartDate,summary_IsHotjob,summary_IsExternal,summary_Url,summary_Region,summary_Municipality,summary_Country,summary_PostalCode,summary_PostalCodeName,summary_JobAnnouncementType,summary_EmploymentType,summary_WorkHours,summary_OccupationArea,summary_OccupationGroup,summary_Occupation,summary_Location_Latitude,summary_Location_Longitude,summary_JoblogWorkTime_WorkHour,summary_JoblogWorkTime_DailyWorkTime,summary_WorkplaceID,summary_OrganisationId,summary_HiringOrgCVR,summary_UserLoggedIn,summary_AnonymousEmployer,summary_ShareUrl,summary_DetailsUrl,summary_JobLogUrl,summary_HasLocationValues,summary_ID,summary_Latitude,summary_Longitude,details_WorkSchedule,details_WorkConditions,details_EmploymentTypes,details_WorkPlace_Name,details_WorkPlace_Address_AddressLine,details_WorkPlace_Address_Country_Id,details_WorkPlace_Address_Country_Name,details_WorkPlace_Address_Municipality_Id,details_WorkPlace_Address_Municipality_Name,details_WorkPlace_Address_Region_Id,details_WorkPlace_Address_Region_Name,details_WorkPlace_Address_PostalCode,details_WorkPlace_Address_City,details_WorkPlace_PhoneNumber_Number,details_WorkPlace_PhoneNumber_Type,details_WorkPlace_PhoneNumber_Description,details_WorkPlace_FaxNumber,details_WorkPlace_Email,details_WorkPlace_WebAddress,details_WorkPlace_Description,details_WorkPlace_Logo,details_WorkPlace_WorkPlaceOrganizationNumber,details_WorkPlace_OrganizationNumber,details_WorkPlace_OrganizationDescription,details_JobPositionPosting_Id,details_JobPositionPosting_HiringOrg_Name,details_JobPositionPosting_HiringOrg_Address_AddressLine,details_JobPositionPosting_HiringOrg_Address_Country_Id,details_JobPositionPosting_HiringOrg_Address_Country_Name,details_JobPositionPosting_HiringOrg_Address_Municipality_Id,details_JobPositionPosting_HiringOrg_Address_Municipality_Name,details_JobPositionPosting_HiringOrg_Address_Region_Id,details_JobPositionPosting_HiringOrg_Address_Region_Name,details_JobPositionPosting_HiringOrg_Address_PostalCode,details_JobPositionPosting_HiringOrg_Address_City,details_JobPositionPosting_HiringOrg_PhoneNumber_Number,details_JobPositionPosting_HiringOrg_PhoneNumber_Type,details_JobPositionPosting_HiringOrg_PhoneNumber_Description,details_JobPositionPosting_HiringOrg_FaxNumber,details_JobPositionPosting_HiringOrg_Email,details_JobPositionPosting_HiringOrg_WebAddress,details_JobPositionPosting_HiringOrg_Description,details_JobPositionPosting_HiringOrg_Logo,details_JobPositionPosting_HiringOrg_WorkPlaceOrganizationNumber,details_JobPositionPosting_HiringOrg_OrganizationNumber,details_JobPositionPosting_HiringOrg_OrganizationDescription,details_JobPositionPosting_RecruitingCompany,details_JobPositionPosting_PublicationStartDate,details_JobPositionPosting_PublicationEndDate,details_JobPositionPosting_JobPositionInformation_PositionTitle,details_JobPositionPosting_JobPositionInformation_Purpose,details_JobPositionPosting_JobPositionInformation_WorkLocation_AddressLine,details_JobPositionPosting_JobPositionInformation_WorkLocation_Country_Id,details_JobPositionPosting_JobPositionInformation_WorkLocation_Country_Name,details_JobPositionPosting_JobPositionInformation_WorkLocation_Municipality_Id,details_JobPositionPosting_JobPositionInformation_WorkLocation_Municipality_Name,details_JobPositionPosting_JobPositionInformation_WorkLocation_Region_Id,details_JobPositionPosting_JobPositionInformation_WorkLocation_Region_Name,details_JobPositionPosting_JobPositionInformation_WorkLocation_PostalCode,details_JobPositionPosting_JobPositionInformation_WorkLocation_City,details_JobPositionPosting_JobPositionInformation_EmploymentType,details_JobPositionPosting_JobPositionInformation_WeeklyWorkHours_TypeId,details_JobPositionPosting_JobPositionInformation_WeeklyWorkHours_TypeName,details_JobPositionPosting_JobPositionInformation_WeeklyWorkHours_Description,details_JobPositionPosting_JobPositionInformation_CompensationDescription,details_JobPositionPosting_JobPositionInformation_NumberToFill,details_JobPositionPosting_JobPositionInformation_DriverLicense,details_JobPositionPosting_JobPositionInformation_Occupation_Name,details_JobPositionPosting_JobPositionInformation_Occupation_DiscoWeb,details_JobPositionPosting_JobPositionInformation_Occupation_AlternateNames,details_JobPositionPosting_JobPositionInformation_Occupation_GroupId,details_JobPositionPosting_JobPositionInformation_Occupation_AreaId,details_JobPositionPosting_JobPositionInformation_IsGovernmentHiring,details_JobPositionPosting_JobPositionInformation_JppContacts,details_JobPositionPosting_JobPositionInformation_EmploymentDate,details_JobPositionPosting_IsRecruitmentOfForeignNationals,details_JobPositionPosting_IsWorkInDenmark,details_JobPositionPosting_IsAnonymousEmployer,details_JobPositionPosting_IsDisabilityFriendly,details_JobPositionPosting_JppType,details_JobPositionPosting_ApplicationDetails_WorkHourMax,details_JobPositionPosting_ApplicationDetails_WorkHourMin,details_JobPositionPosting_ApplicationDetails_DailyWorkTimeWeekend,details_JobPositionPosting_ApplicationDetails_DailyWorkTimeNight,details_JobPositionPosting_ApplicationDetails_DailyWorkTimeEvening,details_JobPositionPosting_ApplicationDetails_DailyWorkTimeDay,details_JobPositionPosting_ApplicationDetails_DailyWorkTimeMorning,details_JobPositionPosting_ApplicationDetails_DailyWorkTimeVarious,details_JobPositionPosting_ApplicationDetails_ReferenceText,details_JobPositionPosting_ApplicationDetails_RemarksToApplicant,details_JobPositionPosting_ApplicationDetails_ByEmail,details_JobPositionPosting_ApplicationDetails_ByPhone,details_JobPositionPosting_ApplicationDetails_ApplyViaUrl,details_JobPositionPosting_ApplicationDetails_ReplyInWriting,details_JobPositionPosting_ApplicationDetails_ApplicationDeadlineDate,details_JobPositionPosting_Status,details_LogoUrl,details_Address,details_ShowMap,details_ShowShareButtonJobLog,details_JobLogUrl,details_JobLogTemplateModel_Identifier,details_JobLogTemplateModel_UseWorkPlaceAddressForJoblog,details_JobLogTemplateModel_Category,details_JobLogTemplateModel_CvCustomerIdentifier,details_JobLogTemplateModel_JobSeekingStatus,details_JobLogTemplateModel_Title,details_JobLogTemplateModel_IsApplicationSourceRequired,details_JobLogTemplateModel_ApplicationSource,details_JobLogTemplateModel_IsWeeklyWorkTimeRequired,details_JobLogTemplateModel_WeeklyWorkTime,details_JobLogTemplateModel_HoursPerWeek,details_JobLogTemplateModel_JobnetJobPostingIdentifier,details_JobLogTemplateModel_JobAdDocument_Title,details_JobLogTemplateModel_JobAdDocument_Identifier,details_JobLogTemplateModel_JobAdDocument_IsDeletedBySystem,details_JobLogTemplateModel_JobAdDocument_IsDeletedByUser,details_JobLogTemplateModel_JobAdFile,details_JobLogTemplateModel_Company_JobLogEntryCategory,details_JobLogTemplateModel_Company_ShowAddressFieldsEvenIfEmpty,details_JobLogTemplateModel_Company_Name,details_JobLogTemplateModel_Company_Address,details_JobLogTemplateModel_Company_Country,details_JobLogTemplateModel_Company_EmploymentAreaID,details_JobLogTemplateModel_Company_PostCode,details_JobLogTemplateModel_Company_IsCountryAndTownAndPostCodeEmpty,details_JobLogTemplateModel_Company_IsTownAndPostCodeEmpty,details_JobLogTemplateModel_Company_IsCountryDanmark,details_JobLogTemplateModel_Company_Town,details_JobLogTemplateModel_Company_ContactPerson,details_JobLogTemplateModel_Company_Phone,details_JobLogTemplateModel_Company_Email,details_JobLogTemplateModel_Company_Latitude,details_JobLogTemplateModel_Company_Longitude,details_JobLogTemplateModel_Company_DailyTravelTimeInMinutes,details_JobLogTemplateModel_Company_DistanceToCompanyInMeters,details_JobLogTemplateModel_Company_IsCreateMode,details_JobLogTemplateModel_TypeOfSubmission,details_JobLogTemplateModel_SubmissionDate,details_JobLogTemplateModel_SubmissionDateFormatted,details_JobLogTemplateModel_SubmissionDateTiks,details_JobLogTemplateModel_IsSubmissionDateRequired,details_JobLogTemplateModel_Status,details_JobLogTemplateModel_DateCreatedFormatted,details_JobLogTemplateModel_DateCreated,details_JobLogTemplateModel_DateModifiedFormatted,details_JobLogTemplateModel_DateModified,details_JobLogTemplateModel_LastModifiedDateTiks,details_JobLogTemplateModel_DateClosed,details_JobLogTemplateModel_JobApplicationDocument_Title,details_JobLogTemplateModel_JobApplicationDocument_Identifier,details_JobLogTemplateModel_JobApplicationDocument_IsDeletedBySystem,details_JobLogTemplateModel_JobApplicationDocument_IsDeletedByUser,details_JobLogTemplateModel_CvDocument_Title,details_JobLogTemplateModel_CvDocument_Identifier,details_JobLogTemplateModel_CvDocument_IsDeletedBySystem,details_JobLogTemplateModel_CvDocument_IsDeletedByUser,details_JobLogTemplateModel_JobApplicationFile,details_JobLogTemplateModel_CvFile,details_JobLogTemplateModel_SubmissionDeadlineDate,details_JobLogTemplateModel_IsPersisted,details_JobLogTemplateModel_ServerValidationErrors,details_JobLogTemplateModel_HasServerValidationErrors,details_JoblogWorkTime_WorkHour,details_JoblogWorkTime_DailyWorkTime,details_Place,details_OpenPrintDialog,details_WorkPlaceInfoText,details_JobCenterContactDetails,details_WorkPlaceDescriptionText,details_FavoriteText,details_IsFavorite,details_ShowFavorite,details_MetaOgTextForSharing,details_DescriptionForSharing,details_TitleForSharing,details_RutePlan,details_FormattedPurpose,details_MapUrl,details_OrganizationNumber,details_ShowSearchJobButton,details_ShowPrint,details_BackToFindWorkButtonUrl,isExternal
0,False,1,Socialpædagoger søges,Socialpædagoger søges,"Camillehusene søger nye kollegaer på 30-37 timer/uge til dag-, aften- og weekendvagter.

Vi søger dig, der vil være med til at gøre verden til en del af Camillehusenes børn og unges l",Gentofte Kommune,"Bank-Mikkelsens Vej 7,9 og 13  ",2820,Gentofte,False,False,False,True,2025-01-20T14:25:00,2025-02-07T23:59:00,7. februar 2025,0001-01-01T00:00:00,False,False,https://job.jobnet.dk/CV/FindWork/Details/1ff18747-732f-473e-9e0a-070a7284d72c,Hovedstaden og Bornholm,Gentofte,Danmark,2820,,Almindelige vilkår,Fastansættelse,Fuldtid,"Pædagogisk, socialt og kirkeligt arbejde",Pædagogisk arbejde,Socialpædagog,55.7515,12.5334,,,1003262352,,19438414,False,False,https://job.jobnet.dk/CV/FindWork/DetailsSocialmedia/1ff18747-732f-473e-9e0a-070a7284d72c,https://job.jobnet.dk/CV/FindWork/Details/1ff18747-732f-473e-9e0a-070a7284d72c,https://job.jobnet.dk/CV/FindWork/Details/1ff18747-732f-473e-9e0a-070a7284d72c,True,1ff18747-732f-473e-9e0a-070a7284d72c,55.7515,12.5334,"{'Id': 1, 'Name': 'Fuldtid'}, {'Id': 16, 'Name': 'Deltid'}","{'Id': 1, 'Name': 'Almindelige vilkår'}, {'Id': 2, 'Name': 'Fleksjob'}, {'Id': 3, 'Name': 'Skånejob'}, {'Id': 4, 'Name': 'Egnet til efterlønnere og seniorer'}, {'Id': 5, 'Name': 'Job med løntilskud'}, {'Id': 6, 'Name': 'Rotationsjob'}, {'Id': 7, 'Name': 'Virksomhedspraktik'}","{'Id': 1, 'Name': 'Fastansættelse'}, {'Id': 16, 'Name': 'Tidsbegrænset ansættelse'}",Gentofte Kommune,"Bank-Mikkelsens Vej 7,9 og 13",58,Danmark,157,Gentofte,4,"Hovedstaden, Sjælland og Bornholm",2820,Gentofte,,0,Primary,,,https://gentofte.hr-on.com/show-job/235527?linkref=263255&locale=da_DK,None,,1003262352,19438414,None,1ff18747-732f-473e-9e0a-070a7284d72c,Gentofte Kommune,"Bank-Mikkelsens Vej 7,9 og 13",58,Danmark,157,Gentofte,4,"Hovedstaden, Sjælland og Bornholm",2820,Gentofte,,0,Primary,,,https://gentofte.hr-on.com/show-job/235527?linkref=263255&locale=da_DK,None,,1003262352,19438414,None,,2025-01-20T14:25:00+01:00,2025-02-07T23:59:00+01:00,Socialpædagoger søges,"Camillehusene søger nye kollegaer på 30-37 timer/uge til dag-, aften- og weekendvagter. 
 Vi søger dig, der vil være med til at gøre verden til en del af Camillehusenes børn og unges liv, samt sikre omsorg og udvikling for børnene og hvor du er med til at understøtte og udvikle den specialpædagogiske praksis med et stærkt afsæt i fagligheden.  
 Hvad er du med til at skabe? 
 Du er med til at gøre Camillehusenes børn og unge til en del af verden, når vi besøger biblioteket, går i teateret eller deltager i Royal run, samt hver dag samarbejder med skoler, forældre, hospitaler, læger og kommuner og mange andre. 
Du skaber struktur og forudsigelighed og styrker børn og unges medbestemmelse og selvstændighed, og du er med til at skabe et kærligt hjem med høj faglighed.  
 Om dig 
Du skal være uddannet pædagog og have et drive og engagement, der gør, at du vil lære samt lære fra dig og bidrage til udviklingen af et velfunderet hjem for børn og unge, med gode muligheder for at forme den rivende udvikling. Du trives i et job, hvor forandring er et vilkår. 
En del af Camillehusenes børn har fuld støtte behov, hvilket betyder, at der vil være perioder i løbet af dagen, hvor barnet har behov for en medarbejder tæt på. Du skal derfor kunne agere i, at du i perioder er alene i arbejdet med barnet, eks. sammen med barnet på dennes værelse for at skabe ro og tryghed. 
 Dine fremtidige kolleger har peget på, at de ønsker følgende af dig: 
 
 Tålmodig og rolig, kan trives i en struktureret og rutinepræget hverdag. Kan arbejde selvstændigt i et skærmet miljø, hvor det er vigtigt at kunne arbejde ud fra low arousal tilgangen. Bevidst om sin egen ageren både psykisk og fysisk, da man tit skal bruge sit eget nervesystem for at kunne regulere Camillehusenes børn og unge. At man har lav stemmeføring og hele tiden er bevidst om sin egen positionering. At man kan reflektere over eget og kollegers arbejde. Tålmodighed i forhold til opbygning af relationer, da dette tager lang tid og er altafgørende i arbejdet. At kunne indgå i et tæt samarbejde med skolen, da dette er altafgørende for barnets daglige trivsel og udvikling.  
 Hvem er vi 
Camillehusene er en døgninstitution for op til 22 børn og unge i alderen 0 - 23 år. Vi er opdelt i tre huse. Vi har pædagoger, social- og sundhedsassistenter, pædagogmedhjælpere og en sygeplejerske ansat. Husene deler aktiviteter og erfaringer på tværs, samt fælles retningslinjer, hvilket giver god synergi og viden på tværs. Børnene og de unge har alle multiple funktionsnedsættelser og nogle har også diagnoser inden for autismespektret, og nogle har epilepsi. De har alle omfattende behov for special- og sundhedsfaglig støtte til at sikre trivsel, udvikling og et godt børne- og ungeliv, herunder også hjælp til personlig pleje. Alle børn og unge går i dagtimerne i eksterne specialskoler eller dagtilbud. 
Nogle af vores børn og unge sidder i kørestol og skal liftes, nogle har sonde og andre bruger hjælpemidler som jogger, gangstativ, m.m. 
 Hvad får du? 
Du får en arbejdsplads med fokus på faglig udvikling, bl.a. skal vi alle i 2025 i gang med neuropædagogisk uddannelse, ligesom vi allerede er i gang med at implementere en feedbackkultur, hvor vi har uddannet 6 medarbejdere som feedbackambassadører. Du får supervision sammen med dine kolleger, personalemøder afholdes hus vis, men du mødes også med dine 60 kolleger til fællesmøder for alle husene. Det er bl.a. på fællesmøder vi arrangerer, hvilke aktiviteter der skal foregå hen over sommeren, når vores børn og unge har ferie. Du får en arbejdsplads, der er åben for innovative idéer både i forhold til aktiviteter, indretning, m.m.   
 Vi bruger ekstern supervision til at gøre dig dygtigere, og du vil gennem arbejdet få stor indsigt i et komplekst fagligt område.  Dette er f.eks. børn og unge uden sprog, udfordrende somatiske lidelser, sjældne diagnoser, forældresamarbejde og samarbejde omkring både det sundhedsfaglige og det specialpædagogiske.  
 Derudover bliver du en del af et større fællesskab i Gentofte kommune, hvor vi tager til DHL løb, har ferieboliger og andre personalegoder.  
 Dine kolleger og ledelse 
Du vil møde fagligt stærke og velfunderede kolleger, der brænder for deres arbejde og alle har børn og unge for øje. 
Dine fremtidige kolleger holder af faglige diskussioner og sparring, og vil rigtig gerne have dig med. 
 Ledelsen består af tre faglige ledere stedfortræder for forstander samt forstander. Ledelsen prioriterer at tage sig tid til medarbejderne og giver plads til ideer. Ledelsen har tillid til medarbejderne og de beslutninger de træffer.  
 Arbejdstid 
Camillehusene er en døgninstitution, derfor vil din arbejdstid være fordelt på alle ugens 7 dage, med weekendarbejde hver anden weekend.  Arbejdstiden ligger hovedsageligt mellem kl. 13.30 og 23. 
 Samtaler 
Der bliver afholdt samtaler løbende 
 Løn og ansættelse 
Lønnen følger gældende overenskomst og bliver forhandlet med relevant faglig organisation. Der indhentes referencer efter aftale samt børne- og straffeattest. 
 Har du spørgsmål vedr. stillingen er du meget velkommen til at ringe eller skrive til Forstander Flemming Klein, telefon 23317610 eller via mail til  flk@gentofte.dk . Eller stedfortræder for forstander Jan Soloy, telefon 20592248 eller via mail til  jsol@gentofte.dk   
 Ansøgningsfrist:  fredag d. 7. februar 2025","Bank-Mikkelsens Vej 7,9 og 13",58,Danmark,157,Gentofte,4,"Hovedstaden, Sjælland og Bornholm",2820,Gentofte,1,1,Fuldtid,None,None,2,,Socialpædagog,0,"Socialpædagog på bosted for voksne, Socialpædagog ved ungdomsinstitution",0,0,False,"{'Email': 'jsol@gentofte.dk', 'PersonName': 'Jan Soloy', 'FirstName': 'Jan', 'LastName': 'Soloy', 'PositionTitle': None, 'PhoneNumbers': [{'Number': '20592248', 'Type': 0, 'Description': 'Primary'}]}, {'Email': 'flk@gentofte.dk', 'PersonName': 'Flemming Klein', 'FirstName': 'Flemming', 'LastName': 'Klein', 'PositionTitle': None, 'PhoneNumbers': [{'Number': '23317610', 'Type': 0, 'Description': 'Primary'}]}",,False,False,False,False,4,,,False,False,False,False,False,False,,,,,https://gentofte.hr-on.com/show-job/235527?linkref=263255&locale=da_DK,False,2025-02-07T23:59:00+01:00,7,/CV/FindWork/GetLogo?JobAdId=1ff18747-732f-473e-9e0a-070a7284d72c&Organisation=19438414,"Bank-Mikkelsens Vej 7,9 og 13,2820, Gentofte",True,False,/CV/Jobseeking/JobLog/CreateJobSearch?JobnetJobPostingIdentifier=1ff18747-732f-473e-9e0a-070a7284d72c&Company.Name=Gentofte Kommune&SubmissionDeadlineDate=2025-2-7&Title=Socialpædagoger søges&WeeklyWorkTime=1,00000000-0000-0000-0000-000000000000,True,0,,,Socialpædagoger søges,True,,True,1,,1ff18747-732f-473e-9e0a-070a7284d72c,,,False,False,,0,False,Gentofte Kommune,"Bank-Mikkelsens Vej 7,9 og 13",,,2820,False,False,False,Gentofte,Jan Soloy,20592248,jsol@gentofte.dk,,,,,False,,2025-02-07T23:59:00+01:00,,0,False,0,,,,,0,,,,False,False,,,False,False,,,,False,,False,,,Arbejdspladsen ligger i Gentofte kommune,False,Gentofte Kommune,,None,,False,False,"Camillehusene søger nye kollegaer på 30-37 timer/uge til dag-, aften- og weekendvagter.

Vi søger dig, der vil være med til at gøre verden til en del af Camillehusenes børn og unges liv, samt sikre omsorg og udvikling for børnene og hvor du er med til at understøtte og udvikle den specialpædagogiske praksis med et stærkt afsæt i fagligheden. 

Hvad","""Camillehusene søger nye kollegaer på 30-37 timer/uge til dag-, aften- og weekendvagter.\n\nVi søger dig, der vil være med til at gøre verden til en del af Camillehusenes børn og unges liv, samt sikre omsorg og udvikling for børnene og hvor du er med til at understøtte og udvikle den specialpædagogiske praksis med et stærkt afsæt i fagligheden. \n\nHvad""","""Socialpædagoger søges""","https://www.google.dk/maps/dir//Bank-Mikkelsens+Vej+7,9+og+13,2820,+Gentofte/","Camillehusene søger nye kollegaer på 30-37 timer/uge til dag-, aften- og weekendvagter. 
 Vi søger dig, der vil være med til at gøre verden til en del af Camillehusenes børn og unges liv, samt sikre omsorg og udvikling for børnene og hvor du er med til at understøtte og udvikle den specialpædagogiske praksis med et stærkt afsæt i fagligheden.  
 Hvad er du med til at skabe? 
 Du er med til at gøre Camillehusenes børn og unge til en del af verden, når vi besøger biblioteket, går i teateret eller deltager i Royal run, samt hver dag samarbejder med skoler, forældre, hospitaler, læger og kommuner og mange andre. 
Du skaber struktur og forudsigelighed og styrker børn og unges medbestemmelse og selvstændighed, og du er med til at skabe et kærligt hjem med høj faglighed.  
 Om dig 
Du skal være uddannet pædagog og have et drive og engagement, der gør, at du vil lære samt lære fra dig og bidrage til udviklingen af et velfunderet hjem for børn og unge, med gode muligheder for at forme den rivende udvikling. Du trives i et job, hvor forandring er et vilkår. 
En del af Camillehusenes børn har fuld støtte behov, hvilket betyder, at der vil være perioder i løbet af dagen, hvor barnet har behov for en medarbejder tæt på. Du skal derfor kunne agere i, at du i perioder er alene i arbejdet med barnet, eks. sammen med barnet på dennes værelse for at skabe ro og tryghed. 
 Dine fremtidige kolleger har peget på, at de ønsker følgende af dig: 
 
 Tålmodig og rolig, kan trives i en struktureret og rutinepræget hverdag. Kan arbejde selvstændigt i et skærmet miljø, hvor det er vigtigt at kunne arbejde ud fra low arousal tilgangen. Bevidst om sin egen ageren både psykisk og fysisk, da man tit skal bruge sit eget nervesystem for at kunne regulere Camillehusenes børn og unge. At man har lav stemmeføring og hele tiden er bevidst om sin egen positionering. At man kan reflektere over eget og kollegers arbejde. Tålmodighed i forhold til opbygning af relationer, da dette tager lang tid og er altafgørende i arbejdet. At kunne indgå i et tæt samarbejde med skolen, da dette er altafgørende for barnets daglige trivsel og udvikling.  
 Hvem er vi 
Camillehusene er en døgninstitution for op til 22 børn og unge i alderen 0 - 23 år. Vi er opdelt i tre huse. Vi har pædagoger, social- og sundhedsassistenter, pædagogmedhjælpere og en sygeplejerske ansat. Husene deler aktiviteter og erfaringer på tværs, samt fælles retningslinjer, hvilket giver god synergi og viden på tværs. Børnene og de unge har alle multiple funktionsnedsættelser og nogle har også diagnoser inden for autismespektret, og nogle har epilepsi. De har alle omfattende behov for special- og sundhedsfaglig støtte til at sikre trivsel, udvikling og et godt børne- og ungeliv, herunder også hjælp til personlig pleje. Alle børn og unge går i dagtimerne i eksterne specialskoler eller dagtilbud. 
Nogle af vores børn og unge sidder i kørestol og skal liftes, nogle har sonde og andre bruger hjælpemidler som jogger, gangstativ, m.m. 
 Hvad får du? 
Du får en arbejdsplads med fokus på faglig udvikling, bl.a. skal vi alle i 2025 i gang med neuropædagogisk uddannelse, ligesom vi allerede er i gang med at implementere en feedbackkultur, hvor vi har uddannet 6 medarbejdere som feedbackambassadører. Du får supervision sammen med dine kolleger, personalemøder afholdes hus vis, men du mødes også med dine 60 kolleger til fællesmøder for alle husene. Det er bl.a. på fællesmøder vi arrangerer, hvilke aktiviteter der skal foregå hen over sommeren, når vores børn og unge har ferie. Du får en arbejdsplads, der er åben for innovative idéer både i forhold til aktiviteter, indretning, m.m.   
 Vi bruger ekstern supervision til at gøre dig dygtigere, og du vil gennem arbejdet få stor indsigt i et komplekst fagligt område.  Dette er f.eks. børn og unge uden sprog, udfordrende somatiske lidelser, sjældne diagnoser, forældresamarbejde og samarbejde omkring både det sundhedsfaglige og det specialpædagogiske.  
 Derudover bliver du en del af et større fællesskab i Gentofte kommune, hvor vi tager til DHL løb, har ferieboliger og andre personalegoder.  
 Dine kolleger og ledelse 
Du vil møde fagligt stærke og velfunderede kolleger, der brænder for deres arbejde og alle har børn og unge for øje. 
Dine fremtidige kolleger holder af faglige diskussioner og sparring, og vil rigtig gerne have dig med. 
 Ledelsen består af tre faglige ledere stedfortræder for forstander samt forstander. Ledelsen prioriterer at tage sig tid til medarbejderne og giver plads til ideer. Ledelsen har tillid til medarbejderne og de beslutninger de træffer.  
 Arbejdstid 
Camillehusene er en døgninstitution, derfor vil din arbejdstid være fordelt på alle ugens 7 dage, med weekendarbejde hver anden weekend.  Arbejdstiden ligger hovedsageligt mellem kl. 13.30 og 23. 
 Samtaler 
Der bliver afholdt samtaler løbende 
 Løn og ansættelse 
Lønnen følger gældende overenskomst og bliver forhandlet med relevant faglig organisation. Der indhentes referencer efter aftale samt børne- og straffeattest. 
 Har du spørgsmål vedr. stillingen er du meget velkommen til at ringe eller skrive til Forstander Flemming Klein, telefon 23317610 eller via mail til  flk@gentofte.dk . Eller stedfortræder for forstander Jan Soloy, telefon 20592248 eller via mail til  jsol@gentofte.dk   
 Ansøgningsfrist:  fredag d. 7. februar 2025","https://www.google.dk/maps/place/Bank-Mikkelsens+Vej+7,9+og+13,2820,+Gentofte/",19438414,False,False,,False
