summary_AutomatchType,summary_Abroad,summary_Weight,summary_Title,summary_JobHeadline,summary_Presentation,summary_HiringOrgName,summary_WorkPlaceAddress,summary_WorkPlacePostalCode,summary_WorkPlaceCity,summary_WorkPlaceOtherAddress,summary_WorkPlaceAbroad,summary_WorkPlaceNotStatic,summary_UseWorkPlaceAddressForJoblog,summary_PostingCreated,summary_LastDateApplication,summary_FormattedLastDateApplication,summary_AssignmentStartDate,summary_IsHotjob,summary_IsExternal,summary_Url,summary_Region,summary_Municipality,summary_Country,summary_PostalCode,summary_PostalCodeName,summary_JobAnnouncementType,summary_EmploymentType,summary_WorkHours,summary_OccupationArea,summary_OccupationGroup,summary_Occupation,summary_Location_Latitude,summary_Location_Longitude,summary_JoblogWorkTime_WorkHour,summary_JoblogWorkTime_DailyWorkTime,summary_WorkplaceID,summary_OrganisationId,summary_HiringOrgCVR,summary_UserLoggedIn,summary_AnonymousEmployer,summary_ShareUrl,summary_DetailsUrl,summary_JobLogUrl,summary_HasLocationValues,summary_ID,summary_Latitude,summary_Longitude,details_WorkSchedule,details_WorkConditions,details_EmploymentTypes,details_WorkPlace_Name,details_WorkPlace_Address_AddressLine,details_WorkPlace_Address_Country_Id,details_WorkPlace_Address_Country_Name,details_WorkPlace_Address_Municipality_Id,details_WorkPlace_Address_Municipality_Name,details_WorkPlace_Address_Region_Id,details_WorkPlace_Address_Region_Name,details_WorkPlace_Address_PostalCode,details_WorkPlace_Address_City,details_WorkPlace_PhoneNumber_Number,details_WorkPlace_PhoneNumber_Type,details_WorkPlace_PhoneNumber_Description,details_WorkPlace_FaxNumber,details_WorkPlace_Email,details_WorkPlace_WebAddress,details_WorkPlace_Description,details_WorkPlace_Logo,details_WorkPlace_WorkPlaceOrganizationNumber,details_WorkPlace_OrganizationNumber,details_WorkPlace_OrganizationDescription,details_JobPositionPosting_Id,details_JobPositionPosting_HiringOrg_Name,details_JobPositionPosting_HiringOrg_Address_AddressLine,details_JobPositionPosting_HiringOrg_Address_Country_Id,details_JobPositionPosting_HiringOrg_Address_Country_Name,details_JobPositionPosting_HiringOrg_Address_Municipality_Id,details_JobPositionPosting_HiringOrg_Address_Municipality_Name,details_JobPositionPosting_HiringOrg_Address_Region_Id,details_JobPositionPosting_HiringOrg_Address_Region_Name,details_JobPositionPosting_HiringOrg_Address_PostalCode,details_JobPositionPosting_HiringOrg_Address_City,details_JobPositionPosting_HiringOrg_PhoneNumber_Number,details_JobPositionPosting_HiringOrg_PhoneNumber_Type,details_JobPositionPosting_HiringOrg_PhoneNumber_Description,details_JobPositionPosting_HiringOrg_FaxNumber,details_JobPositionPosting_HiringOrg_Email,details_JobPositionPosting_HiringOrg_WebAddress,details_JobPositionPosting_HiringOrg_Description,details_JobPositionPosting_HiringOrg_Logo,details_JobPositionPosting_HiringOrg_WorkPlaceOrganizationNumber,details_JobPositionPosting_HiringOrg_OrganizationNumber,details_JobPositionPosting_HiringOrg_OrganizationDescription,details_JobPositionPosting_RecruitingCompany,details_JobPositionPosting_PublicationStartDate,details_JobPositionPosting_PublicationEndDate,details_JobPositionPosting_JobPositionInformation_PositionTitle,details_JobPositionPosting_JobPositionInformation_Purpose,details_JobPositionPosting_JobPositionInformation_WorkLocation_AddressLine,details_JobPositionPosting_JobPositionInformation_WorkLocation_Country_Id,details_JobPositionPosting_JobPositionInformation_WorkLocation_Country_Name,details_JobPositionPosting_JobPositionInformation_WorkLocation_Municipality_Id,details_JobPositionPosting_JobPositionInformation_WorkLocation_Municipality_Name,details_JobPositionPosting_JobPositionInformation_WorkLocation_Region_Id,details_JobPositionPosting_JobPositionInformation_WorkLocation_Region_Name,details_JobPositionPosting_JobPositionInformation_WorkLocation_PostalCode,details_JobPositionPosting_JobPositionInformation_WorkLocation_City,details_JobPositionPosting_JobPositionInformation_EmploymentType,details_JobPositionPosting_JobPositionInformation_WeeklyWorkHours_TypeId,details_JobPositionPosting_JobPositionInformation_WeeklyWorkHours_TypeName,details_JobPositionPosting_JobPositionInformation_WeeklyWorkHours_Description,details_JobPositionPosting_JobPositionInformation_CompensationDescription,details_JobPositionPosting_JobPositionInformation_NumberToFill,details_JobPositionPosting_JobPositionInformation_DriverLicense,details_JobPositionPosting_JobPositionInformation_Occupation_Name,details_JobPositionPosting_JobPositionInformation_Occupation_DiscoWeb,details_JobPositionPosting_JobPositionInformation_Occupation_AlternateNames,details_JobPositionPosting_JobPositionInformation_Occupation_GroupId,details_JobPositionPosting_JobPositionInformation_Occupation_AreaId,details_JobPositionPosting_JobPositionInformation_IsGovernmentHiring,details_JobPositionPosting_JobPositionInformation_JppContacts,details_JobPositionPosting_JobPositionInformation_EmploymentDate,details_JobPositionPosting_IsRecruitmentOfForeignNationals,details_JobPositionPosting_IsWorkInDenmark,details_JobPositionPosting_IsAnonymousEmployer,details_JobPositionPosting_IsDisabilityFriendly,details_JobPositionPosting_JppType,details_JobPositionPosting_ApplicationDetails_WorkHourMax,details_JobPositionPosting_ApplicationDetails_WorkHourMin,details_JobPositionPosting_ApplicationDetails_DailyWorkTimeWeekend,details_JobPositionPosting_ApplicationDetails_DailyWorkTimeNight,details_JobPositionPosting_ApplicationDetails_DailyWorkTimeEvening,details_JobPositionPosting_ApplicationDetails_DailyWorkTimeDay,details_JobPositionPosting_ApplicationDetails_DailyWorkTimeMorning,details_JobPositionPosting_ApplicationDetails_DailyWorkTimeVarious,details_JobPositionPosting_ApplicationDetails_ReferenceText,details_JobPositionPosting_ApplicationDetails_RemarksToApplicant,details_JobPositionPosting_ApplicationDetails_ByEmail,details_JobPositionPosting_ApplicationDetails_ByPhone,details_JobPositionPosting_ApplicationDetails_ApplyViaUrl,details_JobPositionPosting_ApplicationDetails_ReplyInWriting,details_JobPositionPosting_ApplicationDetails_ApplicationDeadlineDate,details_JobPositionPosting_Status,details_LogoUrl,details_Address,details_ShowMap,details_ShowShareButtonJobLog,details_JobLogUrl,details_JobLogTemplateModel_Identifier,details_JobLogTemplateModel_UseWorkPlaceAddressForJoblog,details_JobLogTemplateModel_Category,details_JobLogTemplateModel_CvCustomerIdentifier,details_JobLogTemplateModel_JobSeekingStatus,details_JobLogTemplateModel_Title,details_JobLogTemplateModel_IsApplicationSourceRequired,details_JobLogTemplateModel_ApplicationSource,details_JobLogTemplateModel_IsWeeklyWorkTimeRequired,details_JobLogTemplateModel_WeeklyWorkTime,details_JobLogTemplateModel_HoursPerWeek,details_JobLogTemplateModel_JobnetJobPostingIdentifier,details_JobLogTemplateModel_JobAdDocument_Title,details_JobLogTemplateModel_JobAdDocument_Identifier,details_JobLogTemplateModel_JobAdDocument_IsDeletedBySystem,details_JobLogTemplateModel_JobAdDocument_IsDeletedByUser,details_JobLogTemplateModel_JobAdFile,details_JobLogTemplateModel_Company_JobLogEntryCategory,details_JobLogTemplateModel_Company_ShowAddressFieldsEvenIfEmpty,details_JobLogTemplateModel_Company_Name,details_JobLogTemplateModel_Company_Address,details_JobLogTemplateModel_Company_Country,details_JobLogTemplateModel_Company_EmploymentAreaID,details_JobLogTemplateModel_Company_PostCode,details_JobLogTemplateModel_Company_IsCountryAndTownAndPostCodeEmpty,details_JobLogTemplateModel_Company_IsTownAndPostCodeEmpty,details_JobLogTemplateModel_Company_IsCountryDanmark,details_JobLogTemplateModel_Company_Town,details_JobLogTemplateModel_Company_ContactPerson,details_JobLogTemplateModel_Company_Phone,details_JobLogTemplateModel_Company_Email,details_JobLogTemplateModel_Company_Latitude,details_JobLogTemplateModel_Company_Longitude,details_JobLogTemplateModel_Company_DailyTravelTimeInMinutes,details_JobLogTemplateModel_Company_DistanceToCompanyInMeters,details_JobLogTemplateModel_Company_IsCreateMode,details_JobLogTemplateModel_TypeOfSubmission,details_JobLogTemplateModel_SubmissionDate,details_JobLogTemplateModel_SubmissionDateFormatted,details_JobLogTemplateModel_SubmissionDateTiks,details_JobLogTemplateModel_IsSubmissionDateRequired,details_JobLogTemplateModel_Status,details_JobLogTemplateModel_DateCreatedFormatted,details_JobLogTemplateModel_DateCreated,details_JobLogTemplateModel_DateModifiedFormatted,details_JobLogTemplateModel_DateModified,details_JobLogTemplateModel_LastModifiedDateTiks,details_JobLogTemplateModel_DateClosed,details_JobLogTemplateModel_JobApplicationDocument_Title,details_JobLogTemplateModel_JobApplicationDocument_Identifier,details_JobLogTemplateModel_JobApplicationDocument_IsDeletedBySystem,details_JobLogTemplateModel_JobApplicationDocument_IsDeletedByUser,details_JobLogTemplateModel_CvDocument_Title,details_JobLogTemplateModel_CvDocument_Identifier,details_JobLogTemplateModel_CvDocument_IsDeletedBySystem,details_JobLogTemplateModel_CvDocument_IsDeletedByUser,details_JobLogTemplateModel_JobApplicationFile,details_JobLogTemplateModel_CvFile,details_JobLogTemplateModel_SubmissionDeadlineDate,details_JobLogTemplateModel_IsPersisted,details_JobLogTemplateModel_ServerValidationErrors,details_JobLogTemplateModel_HasServerValidationErrors,details_JoblogWorkTime_WorkHour,details_JoblogWorkTime_DailyWorkTime,details_Place,details_OpenPrintDialog,details_WorkPlaceInfoText,details_JobCenterContactDetails,details_WorkPlaceDescriptionText,details_FavoriteText,details_IsFavorite,details_ShowFavorite,details_MetaOgTextForSharing,details_DescriptionForSharing,details_TitleForSharing,details_RutePlan,details_FormattedPurpose,details_MapUrl,details_OrganizationNumber,details_ShowSearchJobButton,details_ShowPrint,details_BackToFindWorkButtonUrl,isExternal
0,False,1,"Administrativ medarbejder til Skadedyrsteamet, Vejle Kommune","Administrativ medarbejder til Skadedyrsteamet, Vejle Kommune","Er du engageret, struktureret og fleksibel, og brænder du for at yde en sublim service over for vores borgere, så er det måske dig vi søger?Teknik &amp; Miljø, Stabene, søger en",Vejle Kommune,Kirketorvet 22  ,7100,Vejle,False,False,False,True,2025-02-03T12:29:28,2025-02-17T23:59:59,17. februar 2025,0001-01-01T00:00:00,False,False,https://job.jobnet.dk/CV/FindWork/Details/21ecb06a-0d5f-4ab1-b47c-95c770fc2eea,Syddanmark,Vejle,Danmark,7100,,Hotjob,Fastansættelse,Fuldtid,"Kontor, administration, regnskab og finans",Kontor- og sekretærarbejde,Kontormedarbejder,55.6905,9.5066,,,1003342222,,29189900,False,False,https://job.jobnet.dk/CV/FindWork/DetailsSocialmedia/21ecb06a-0d5f-4ab1-b47c-95c770fc2eea,https://job.jobnet.dk/CV/FindWork/Details/21ecb06a-0d5f-4ab1-b47c-95c770fc2eea,https://job.jobnet.dk/CV/FindWork/Details/21ecb06a-0d5f-4ab1-b47c-95c770fc2eea,True,21ecb06a-0d5f-4ab1-b47c-95c770fc2eea,55.6905,9.5066,"{'Id': 1, 'Name': 'Fuldtid'}, {'Id': 16, 'Name': 'Deltid'}","{'Id': 1, 'Name': 'Almindelige vilkår'}, {'Id': 2, 'Name': 'Fleksjob'}, {'Id': 3, 'Name': 'Skånejob'}, {'Id': 4, 'Name': 'Egnet til efterlønnere og seniorer'}, {'Id': 5, 'Name': 'Job med løntilskud'}, {'Id': 6, 'Name': 'Rotationsjob'}, {'Id': 7, 'Name': 'Virksomhedspraktik'}","{'Id': 1, 'Name': 'Fastansættelse'}, {'Id': 16, 'Name': 'Tidsbegrænset ansættelse'}",Vejle Kommune,Kirketorvet 22,58,Danmark,630,Vejle,3,Syddanmark,7100,Vejle,,0,Primary,,,https://www.ofir.dk/resultat/Jobannonce.aspx?ofirId=1c5eff57&action=sendApplicationUrl&utm_source=job.jobnet.dk&utm_medium=referral,None,,1003342222,29189900,None,21ecb06a-0d5f-4ab1-b47c-95c770fc2eea,Vejle Kommune,Kirketorvet 22,58,Danmark,630,Vejle,3,Syddanmark,7100,Vejle,,0,Primary,,,https://www.ofir.dk/resultat/Jobannonce.aspx?ofirId=1c5eff57&action=sendApplicationUrl&utm_source=job.jobnet.dk&utm_medium=referral,None,,1003342222,29189900,None,,2025-02-03T12:29:28.8057081+01:00,2025-02-17T23:59:59+01:00,"Administrativ medarbejder til Skadedyrsteamet, Vejle Kommune","Er du engageret, struktureret og fleksibel, og brænder du for at yde en sublim service over for vores borgere, så er det måske dig vi søger? Teknik & Miljø, Stabene, søger en administrativ kollega til at indgå i vores Skadedyrsteam. Vi er et hold af specialister på hvert vores område, som søger en ny kollega til at bidrage til vores fortsatte faglige udvikling. Samtidig vil du blive lært bredt op i afdelingen, så du får et godt kendskab til flere faglige arbejdsområder.   Om jobbet Dine primære arbejdsopgaver i Skadedyrsteamet vil være: Servicering af borgere Sagsbehandling, dvs. udarbejdelse af håndhævelsesbreve til borgere, mm. Administration i forbindelse med rottebekæmpelse, dvs. koordinering af kommunens samarbejde med andre myndigheder, samarbejdspartnere, kloakmestre, rottebekæmpere mv. om planlægning af bekæmpelse af rotter arbejde med langsigtede planer for kommunens rottebekæmpelse, nedbringelse af resistens og sikring af offentlige institutioner   Føre tilsyn med den kommunale- og private rottebekæmpelse Vi tilbyder dig Et godt arbejdsmiljø. Du vil blive en del af et energisk team, som udover at være meget fagligt kompetente kollegaer også er søde og humoristiske at arbejde sammen med. Du vil opleve, at her er ""højt til loftet"" og opbakning til at bære gode idéer videre. Der er mulighed for at få et stort netværk og for at samarbejde med mennesker med vidt forskellige faglige baggrunde. En af Teknik & Miljøs værdier er at udvikle de rette kompetencer. Hvis du har uudnyttet potentiale vil vi gøre, hvad vi kan for at dyrke og udvikle dette potentiale. Vores arbejdsplads ligger i centrum af Vejle med placering lige ved siden af Vejles banegård. Der er kantine tilknyttet Teknik & Miljø.   Om dig Vi forestiller os, at du Har en allround kontoruddannelse, men dette udelukker ikke, at du kan have en anden faglig baggrund, fx jordbrugsteknolog Er engageret, kvalitetsbevidst, kan lide en travl hverdag, hvor du bevarer fokus og får løst dine opgaver professionelt og til tiden Eventuelt har kendskab til rottebekæmpelse, DriftsWeb og SBSYS Er selvstændig, åben og lydhør Har drive og er omstillingsparat Er god til at indgå i relationer og kan begå dig i en organisation med mange forskellige baggrunde     Om os Vejle Kommune har fuld fart på udviklingen. Vi har en befolkningstilgang på ca. 2000 borgere om året, nye virksomheder flytter til, og flere boliger skyder op. Teknik & Miljø er en effektiv forvaltning, der går foran i den strategiske og fysiske udvikling i kommunen. Desuden udvikler vi hele tiden den måde, vi leverer service til borgerne på. Skadedyrsteamet organiserer Vejle Kommunes skadedyrsbekæmpelse og servicerer navnlig borgere, virksomheder og institutioner, som har observeret rotter på deres ejendom. Teamet hører organisatorisk hjemme i Stabene og er sammensat af kolleger med høj faglig indsigt og som i vidt omfang selvstændigt planlægger og løser deres opgaver.   Ansættelsesvilkår Stillingen er en fuldtidsstilling. Aflønning efter gældende overenskomst. Arbejdsstedet er Vejle Kommune, Teknik & Miljø, Kirketorvet 22 i Vejle – lige overfor banegården og busstationen. Stillingen er til besættelse den 1. april 2025. Vi vil gerne have din ansøgning senest den 17. februar 2025. Vi har 1. runde ansættelsessamtaler i slutningen af uge 8, 2025. Vi opfordrer alle uanset personlig baggrund til at søge.   Mere information Du er meget velkommen til at tage fat i Rasmus Sørensen på tlf. 24 37 31 54  eller afdelingsleder Claus Guldbrand på tlf. 29 29 36 22, hvis du vil vide mere om stillingen.
 Denne jobannonce blev oprindeligt opslået på  https://www.ofir.dk/ 
 (Den originale annonce kan ses på:  https://www.ofir.dk/showojob?ofirid=1c5eff57 )",Kirketorvet 22,58,Danmark,630,Vejle,3,Syddanmark,7100,Vejle,1,1,Fuldtid,None,None,1,,Kontormedarbejder,0,"Kontorassistent, Udvalgssekretær, 3237, 3238, 3239",0,0,False,,,False,False,False,False,4,,,False,False,False,False,False,False,,,,,https://www.ofir.dk/resultat/Jobannonce.aspx?ofirId=1c5eff57&action=sendApplicationUrl&utm_source=job.jobnet.dk&utm_medium=referral,False,2025-02-17T23:59:59+01:00,7,/CV/FindWork/GetLogo?JobAdId=21ecb06a-0d5f-4ab1-b47c-95c770fc2eea&Organisation=29189900,"Kirketorvet 22,7100, Vejle",True,False,"/CV/Jobseeking/JobLog/CreateJobSearch?JobnetJobPostingIdentifier=21ecb06a-0d5f-4ab1-b47c-95c770fc2eea&Company.Name=Vejle Kommune&SubmissionDeadlineDate=2025-2-17&Title=Administrativ medarbejder til Skadedyrsteamet, Vejle Kommune&WeeklyWorkTime=1",00000000-0000-0000-0000-000000000000,True,0,,,"Administrativ medarbejder til Skadedyrsteamet, Vejle Kommune",True,,True,1,,21ecb06a-0d5f-4ab1-b47c-95c770fc2eea,,,False,False,,0,False,Vejle Kommune,Kirketorvet 22,,,7100,False,False,False,Vejle,,,,,,,,False,,2025-02-17T23:59:59+01:00,,0,False,0,,,,,0,,,,False,False,,,False,False,,,,False,,False,,,Arbejdspladsen ligger i Vejle kommune,False,Vejle Kommune,,None,,False,False,"Er du engageret, struktureret og fleksibel, og brænder du for at yde en sublim service over for vores borgere, så er det måske dig vi søger?Teknik  Miljø, Stabene, søger en administrativ kollega til at indgå i vores Skadedyrsteam. Vi er et hold af specialister på hvert vores område, som søger en ny kollega til at bidrage til vores fortsatte faglige","""Er du engageret, struktureret og fleksibel, og brænder du for at yde en sublim service over for vores borgere, så er det måske dig vi søger?Teknik  Miljø, Stabene, søger en administrativ kollega til at indgå i vores Skadedyrsteam. Vi er et hold af specialister på hvert vores område, som søger en ny kollega til at bidrage til vores fortsatte faglige""","""Administrativ medarbejder til Skadedyrsteamet, Vejle Kommune""","https://www.google.dk/maps/dir//Kirketorvet+22,7100,+Vejle/","Er du engageret, struktureret og fleksibel, og brænder du for at yde en sublim service over for vores borgere, så er det måske dig vi søger? Teknik & Miljø, Stabene, søger en administrativ kollega til at indgå i vores Skadedyrsteam. Vi er et hold af specialister på hvert vores område, som søger en ny kollega til at bidrage til vores fortsatte faglige udvikling. Samtidig vil du blive lært bredt op i afdelingen, så du får et godt kendskab til flere faglige arbejdsområder.   Om jobbet Dine primære arbejdsopgaver i Skadedyrsteamet vil være: Servicering af borgere Sagsbehandling, dvs. udarbejdelse af håndhævelsesbreve til borgere, mm. Administration i forbindelse med rottebekæmpelse, dvs. koordinering af kommunens samarbejde med andre myndigheder, samarbejdspartnere, kloakmestre, rottebekæmpere mv. om planlægning af bekæmpelse af rotter arbejde med langsigtede planer for kommunens rottebekæmpelse, nedbringelse af resistens og sikring af offentlige institutioner   Føre tilsyn med den kommunale- og private rottebekæmpelse Vi tilbyder dig Et godt arbejdsmiljø. Du vil blive en del af et energisk team, som udover at være meget fagligt kompetente kollegaer også er søde og humoristiske at arbejde sammen med. Du vil opleve, at her er ""højt til loftet"" og opbakning til at bære gode idéer videre. Der er mulighed for at få et stort netværk og for at samarbejde med mennesker med vidt forskellige faglige baggrunde. En af Teknik & Miljøs værdier er at udvikle de rette kompetencer. Hvis du har uudnyttet potentiale vil vi gøre, hvad vi kan for at dyrke og udvikle dette potentiale. Vores arbejdsplads ligger i centrum af Vejle med placering lige ved siden af Vejles banegård. Der er kantine tilknyttet Teknik & Miljø.   Om dig Vi forestiller os, at du Har en allround kontoruddannelse, men dette udelukker ikke, at du kan have en anden faglig baggrund, fx jordbrugsteknolog Er engageret, kvalitetsbevidst, kan lide en travl hverdag, hvor du bevarer fokus og får løst dine opgaver professionelt og til tiden Eventuelt har kendskab til rottebekæmpelse, DriftsWeb og SBSYS Er selvstændig, åben og lydhør Har drive og er omstillingsparat Er god til at indgå i relationer og kan begå dig i en organisation med mange forskellige baggrunde     Om os Vejle Kommune har fuld fart på udviklingen. Vi har en befolkningstilgang på ca. 2000 borgere om året, nye virksomheder flytter til, og flere boliger skyder op. Teknik & Miljø er en effektiv forvaltning, der går foran i den strategiske og fysiske udvikling i kommunen. Desuden udvikler vi hele tiden den måde, vi leverer service til borgerne på. Skadedyrsteamet organiserer Vejle Kommunes skadedyrsbekæmpelse og servicerer navnlig borgere, virksomheder og institutioner, som har observeret rotter på deres ejendom. Teamet hører organisatorisk hjemme i Stabene og er sammensat af kolleger med høj faglig indsigt og som i vidt omfang selvstændigt planlægger og løser deres opgaver.   Ansættelsesvilkår Stillingen er en fuldtidsstilling. Aflønning efter gældende overenskomst. Arbejdsstedet er Vejle Kommune, Teknik & Miljø, Kirketorvet 22 i Vejle – lige overfor banegården og busstationen. Stillingen er til besættelse den 1. april 2025. Vi vil gerne have din ansøgning senest den 17. februar 2025. Vi har 1. runde ansættelsessamtaler i slutningen af uge 8, 2025. Vi opfordrer alle uanset personlig baggrund til at søge.   Mere information Du er meget velkommen til at tage fat i Rasmus Sørensen på tlf. 24 37 31 54  eller afdelingsleder Claus Guldbrand på tlf. 29 29 36 22, hvis du vil vide mere om stillingen.
 Denne jobannonce blev oprindeligt opslået på  https://www.ofir.dk/ 
 (Den originale annonce kan ses på:  https://www.ofir.dk/showojob?ofirid=1c5eff57 )","https://www.google.dk/maps/place/Kirketorvet+22,7100,+Vejle/",29189900,False,False,,False
