summary_AutomatchType,summary_Abroad,summary_Weight,summary_Title,summary_JobHeadline,summary_Presentation,summary_HiringOrgName,summary_WorkPlaceAddress,summary_WorkPlacePostalCode,summary_WorkPlaceCity,summary_WorkPlaceOtherAddress,summary_WorkPlaceAbroad,summary_WorkPlaceNotStatic,summary_UseWorkPlaceAddressForJoblog,summary_PostingCreated,summary_LastDateApplication,summary_FormattedLastDateApplication,summary_AssignmentStartDate,summary_IsHotjob,summary_IsExternal,summary_Url,summary_Region,summary_Municipality,summary_Country,summary_PostalCode,summary_PostalCodeName,summary_JobAnnouncementType,summary_EmploymentType,summary_WorkHours,summary_OccupationArea,summary_OccupationGroup,summary_Occupation,summary_Location_Latitude,summary_Location_Longitude,summary_JoblogWorkTime_WorkHour,summary_JoblogWorkTime_DailyWorkTime,summary_WorkplaceID,summary_OrganisationId,summary_HiringOrgCVR,summary_UserLoggedIn,summary_AnonymousEmployer,summary_ShareUrl,summary_DetailsUrl,summary_JobLogUrl,summary_HasLocationValues,summary_ID,summary_Latitude,summary_Longitude,details_WorkSchedule,details_WorkConditions,details_EmploymentTypes,details_WorkPlace_Name,details_WorkPlace_Address_AddressLine,details_WorkPlace_Address_Country_Id,details_WorkPlace_Address_Country_Name,details_WorkPlace_Address_Municipality_Id,details_WorkPlace_Address_Municipality_Name,details_WorkPlace_Address_Region_Id,details_WorkPlace_Address_Region_Name,details_WorkPlace_Address_PostalCode,details_WorkPlace_Address_City,details_WorkPlace_PhoneNumber_Number,details_WorkPlace_PhoneNumber_Type,details_WorkPlace_PhoneNumber_Description,details_WorkPlace_FaxNumber,details_WorkPlace_Email,details_WorkPlace_WebAddress,details_WorkPlace_Description,details_WorkPlace_Logo,details_WorkPlace_WorkPlaceOrganizationNumber,details_WorkPlace_OrganizationNumber,details_WorkPlace_OrganizationDescription,details_JobPositionPosting_Id,details_JobPositionPosting_HiringOrg_Name,details_JobPositionPosting_HiringOrg_Address_AddressLine,details_JobPositionPosting_HiringOrg_Address_Country_Id,details_JobPositionPosting_HiringOrg_Address_Country_Name,details_JobPositionPosting_HiringOrg_Address_Municipality_Id,details_JobPositionPosting_HiringOrg_Address_Municipality_Name,details_JobPositionPosting_HiringOrg_Address_Region_Id,details_JobPositionPosting_HiringOrg_Address_Region_Name,details_JobPositionPosting_HiringOrg_Address_PostalCode,details_JobPositionPosting_HiringOrg_Address_City,details_JobPositionPosting_HiringOrg_PhoneNumber_Number,details_JobPositionPosting_HiringOrg_PhoneNumber_Type,details_JobPositionPosting_HiringOrg_PhoneNumber_Description,details_JobPositionPosting_HiringOrg_FaxNumber,details_JobPositionPosting_HiringOrg_Email,details_JobPositionPosting_HiringOrg_WebAddress,details_JobPositionPosting_HiringOrg_Description,details_JobPositionPosting_HiringOrg_Logo,details_JobPositionPosting_HiringOrg_WorkPlaceOrganizationNumber,details_JobPositionPosting_HiringOrg_OrganizationNumber,details_JobPositionPosting_HiringOrg_OrganizationDescription,details_JobPositionPosting_RecruitingCompany,details_JobPositionPosting_PublicationStartDate,details_JobPositionPosting_PublicationEndDate,details_JobPositionPosting_JobPositionInformation_PositionTitle,details_JobPositionPosting_JobPositionInformation_Purpose,details_JobPositionPosting_JobPositionInformation_WorkLocation_AddressLine,details_JobPositionPosting_JobPositionInformation_WorkLocation_Country_Id,details_JobPositionPosting_JobPositionInformation_WorkLocation_Country_Name,details_JobPositionPosting_JobPositionInformation_WorkLocation_Municipality_Id,details_JobPositionPosting_JobPositionInformation_WorkLocation_Municipality_Name,details_JobPositionPosting_JobPositionInformation_WorkLocation_Region_Id,details_JobPositionPosting_JobPositionInformation_WorkLocation_Region_Name,details_JobPositionPosting_JobPositionInformation_WorkLocation_PostalCode,details_JobPositionPosting_JobPositionInformation_WorkLocation_City,details_JobPositionPosting_JobPositionInformation_EmploymentType,details_JobPositionPosting_JobPositionInformation_WeeklyWorkHours_TypeId,details_JobPositionPosting_JobPositionInformation_WeeklyWorkHours_TypeName,details_JobPositionPosting_JobPositionInformation_WeeklyWorkHours_Description,details_JobPositionPosting_JobPositionInformation_CompensationDescription,details_JobPositionPosting_JobPositionInformation_NumberToFill,details_JobPositionPosting_JobPositionInformation_DriverLicense,details_JobPositionPosting_JobPositionInformation_Occupation_Name,details_JobPositionPosting_JobPositionInformation_Occupation_DiscoWeb,details_JobPositionPosting_JobPositionInformation_Occupation_AlternateNames,details_JobPositionPosting_JobPositionInformation_Occupation_GroupId,details_JobPositionPosting_JobPositionInformation_Occupation_AreaId,details_JobPositionPosting_JobPositionInformation_IsGovernmentHiring,details_JobPositionPosting_JobPositionInformation_JppContacts,details_JobPositionPosting_JobPositionInformation_EmploymentDate,details_JobPositionPosting_IsRecruitmentOfForeignNationals,details_JobPositionPosting_IsWorkInDenmark,details_JobPositionPosting_IsAnonymousEmployer,details_JobPositionPosting_IsDisabilityFriendly,details_JobPositionPosting_JppType,details_JobPositionPosting_ApplicationDetails_WorkHourMax,details_JobPositionPosting_ApplicationDetails_WorkHourMin,details_JobPositionPosting_ApplicationDetails_DailyWorkTimeWeekend,details_JobPositionPosting_ApplicationDetails_DailyWorkTimeNight,details_JobPositionPosting_ApplicationDetails_DailyWorkTimeEvening,details_JobPositionPosting_ApplicationDetails_DailyWorkTimeDay,details_JobPositionPosting_ApplicationDetails_DailyWorkTimeMorning,details_JobPositionPosting_ApplicationDetails_DailyWorkTimeVarious,details_JobPositionPosting_ApplicationDetails_ReferenceText,details_JobPositionPosting_ApplicationDetails_RemarksToApplicant,details_JobPositionPosting_ApplicationDetails_ByEmail,details_JobPositionPosting_ApplicationDetails_ByPhone,details_JobPositionPosting_ApplicationDetails_ApplyViaUrl,details_JobPositionPosting_ApplicationDetails_ReplyInWriting,details_JobPositionPosting_ApplicationDetails_ApplicationDeadlineDate,details_JobPositionPosting_Status,details_LogoUrl,details_Address,details_ShowMap,details_ShowShareButtonJobLog,details_JobLogUrl,details_JobLogTemplateModel_Identifier,details_JobLogTemplateModel_UseWorkPlaceAddressForJoblog,details_JobLogTemplateModel_Category,details_JobLogTemplateModel_CvCustomerIdentifier,details_JobLogTemplateModel_JobSeekingStatus,details_JobLogTemplateModel_Title,details_JobLogTemplateModel_IsApplicationSourceRequired,details_JobLogTemplateModel_ApplicationSource,details_JobLogTemplateModel_IsWeeklyWorkTimeRequired,details_JobLogTemplateModel_WeeklyWorkTime,details_JobLogTemplateModel_HoursPerWeek,details_JobLogTemplateModel_JobnetJobPostingIdentifier,details_JobLogTemplateModel_JobAdDocument_Title,details_JobLogTemplateModel_JobAdDocument_Identifier,details_JobLogTemplateModel_JobAdDocument_IsDeletedBySystem,details_JobLogTemplateModel_JobAdDocument_IsDeletedByUser,details_JobLogTemplateModel_JobAdFile,details_JobLogTemplateModel_Company_JobLogEntryCategory,details_JobLogTemplateModel_Company_ShowAddressFieldsEvenIfEmpty,details_JobLogTemplateModel_Company_Name,details_JobLogTemplateModel_Company_Address,details_JobLogTemplateModel_Company_Country,details_JobLogTemplateModel_Company_EmploymentAreaID,details_JobLogTemplateModel_Company_PostCode,details_JobLogTemplateModel_Company_IsCountryAndTownAndPostCodeEmpty,details_JobLogTemplateModel_Company_IsTownAndPostCodeEmpty,details_JobLogTemplateModel_Company_IsCountryDanmark,details_JobLogTemplateModel_Company_Town,details_JobLogTemplateModel_Company_ContactPerson,details_JobLogTemplateModel_Company_Phone,details_JobLogTemplateModel_Company_Email,details_JobLogTemplateModel_Company_Latitude,details_JobLogTemplateModel_Company_Longitude,details_JobLogTemplateModel_Company_DailyTravelTimeInMinutes,details_JobLogTemplateModel_Company_DistanceToCompanyInMeters,details_JobLogTemplateModel_Company_IsCreateMode,details_JobLogTemplateModel_TypeOfSubmission,details_JobLogTemplateModel_SubmissionDate,details_JobLogTemplateModel_SubmissionDateFormatted,details_JobLogTemplateModel_SubmissionDateTiks,details_JobLogTemplateModel_IsSubmissionDateRequired,details_JobLogTemplateModel_Status,details_JobLogTemplateModel_DateCreatedFormatted,details_JobLogTemplateModel_DateCreated,details_JobLogTemplateModel_DateModifiedFormatted,details_JobLogTemplateModel_DateModified,details_JobLogTemplateModel_LastModifiedDateTiks,details_JobLogTemplateModel_DateClosed,details_JobLogTemplateModel_JobApplicationDocument_Title,details_JobLogTemplateModel_JobApplicationDocument_Identifier,details_JobLogTemplateModel_JobApplicationDocument_IsDeletedBySystem,details_JobLogTemplateModel_JobApplicationDocument_IsDeletedByUser,details_JobLogTemplateModel_CvDocument_Title,details_JobLogTemplateModel_CvDocument_Identifier,details_JobLogTemplateModel_CvDocument_IsDeletedBySystem,details_JobLogTemplateModel_CvDocument_IsDeletedByUser,details_JobLogTemplateModel_JobApplicationFile,details_JobLogTemplateModel_CvFile,details_JobLogTemplateModel_SubmissionDeadlineDate,details_JobLogTemplateModel_IsPersisted,details_JobLogTemplateModel_ServerValidationErrors,details_JobLogTemplateModel_HasServerValidationErrors,details_JoblogWorkTime_WorkHour,details_JoblogWorkTime_DailyWorkTime,details_Place,details_OpenPrintDialog,details_WorkPlaceInfoText,details_JobCenterContactDetails,details_WorkPlaceDescriptionText,details_FavoriteText,details_IsFavorite,details_ShowFavorite,details_MetaOgTextForSharing,details_DescriptionForSharing,details_TitleForSharing,details_RutePlan,details_FormattedPurpose,details_MapUrl,details_OrganizationNumber,details_ShowSearchJobButton,details_ShowPrint,details_BackToFindWorkButtonUrl,isExternal
0,False,1,Servicemontør - Husstandsvindmølle,Servicemontør - Husstandsvindmølle,"Servicemontør – Husstandsvindmøller 
Solid Wind Power søger montør til vores serviceafdeling i Skjern, der varetager installation og vedligeholdelse af vores husstandsvindmø",Solid Energy A/S,Stålvej 8  ,6900,Skjern,False,False,False,True,2025-01-16T00:00:00,2025-02-28T00:00:00,28. februar 2025,0001-01-01T00:00:00,False,False,https://job.jobnet.dk/CV/FindWork/Details/2512d2b7-69f1-447a-bbf3-749e105b25a1,Midtjylland,Ringkøbing-Skjern,Danmark,6900,,Almindelige vilkår,Fastansættelse,Fuldtid,"Jern, metal og auto",Montørarbejde,Vindmølleoperatør,55.9909,8.5389,,Dag,1029009771,,43839918,False,False,https://job.jobnet.dk/CV/FindWork/DetailsSocialmedia/2512d2b7-69f1-447a-bbf3-749e105b25a1,https://job.jobnet.dk/CV/FindWork/Details/2512d2b7-69f1-447a-bbf3-749e105b25a1,https://job.jobnet.dk/CV/FindWork/Details/2512d2b7-69f1-447a-bbf3-749e105b25a1,True,2512d2b7-69f1-447a-bbf3-749e105b25a1,55.9909,8.5389,"{'Id': 1, 'Name': 'Fuldtid'}, {'Id': 16, 'Name': 'Deltid'}","{'Id': 1, 'Name': 'Almindelige vilkår'}, {'Id': 2, 'Name': 'Fleksjob'}, {'Id': 3, 'Name': 'Skånejob'}, {'Id': 4, 'Name': 'Egnet til efterlønnere og seniorer'}, {'Id': 5, 'Name': 'Job med løntilskud'}, {'Id': 6, 'Name': 'Rotationsjob'}, {'Id': 7, 'Name': 'Virksomhedspraktik'}","{'Id': 1, 'Name': 'Fastansættelse'}, {'Id': 16, 'Name': 'Tidsbegrænset ansættelse'}",Solid Energy A/S,Stålvej 8,58,Danmark,760,Ringkøbing-Skjern,2,Midtjylland,6900,Skjern,26794861,0,Primary,,mtp@solidproduction.dk,,None,,1029009771,43839918,None,2512d2b7-69f1-447a-bbf3-749e105b25a1,Solid Energy A/S,Stålvej 8,58,Danmark,760,Ringkøbing-Skjern,2,Midtjylland,6900,Skjern,26794861,0,Primary,,mtp@solidproduction.dk,,None,,1029009771,43839918,None,,2025-01-16T00:00:00+01:00,2025-02-28T10:59:39+01:00,Servicemontør - Husstandsvindmølle,"Servicemontør – Husstandsvindmøller  
 Solid Wind Power søger montør til vores serviceafdeling i Skjern, der varetager installation og vedligeholdelse af vores husstandsvindmøller i Danmark og i udlandet. 
 Solid Wind Power 
 Hjemhørende i Skjern, og en af verdens førende leverandører af husstandsvindmøller, med mere end 1000 husstandsvindmøller installeret global og i fortsat vækst. 
 Vores vindmøller understøtter energiomstillingen gennem produktion af grøn strøm, til ejerens egen anvendelse. Vindmøllerne, der er 25m høje, producerer strøm svarende til 20 husstandes årlige elektricitetsforbrug. Møllerne installeres til anvendelse i et bredt segment, fra landbruget og mindre industri til offentlige virksomheder, indland som udland. 
 Husstandsmøllerne fra Solid Wind Power er et kvalitetsprodukt og producerer strøm til en konkurrencedygtig og forudsigelig strømpris, hvilket øger efterspørgslen på vores møller. 
 Produktion af vinger og samling af vores naceller til vores 25kW husstandsvindmøller sker fra vores base i Skjern. Salget til Danmark foregår via vores egen Salgs- & projektafdeling. 
 Med udgangspunkt fra Skjern, fjern-overvåges alle installerede møller. Fra Skjern, planlægges og gennemføres de årlige serviceeftersyn på mere end 400 møller, der primært er placeret i Danmark. Serviceafdelingen forestår ligeledes den daglige kundesupport, transport & installation af solgte møller og gennemfører fejlfinding på møllerne efter behov. 
 Vi har travlt og kunne godt bruge din hjælp til at understøtte og sikre vores fortsatte drift og vækst på serviceområdet. 
 Dine arbejdsopgaver: 
 Med udgangspunkt fra vores base i Skjern, indgår du i et servicehold på to(2)–tre(3) servicemontører, med henblik på at: 
 
 gennemføre og dokumentere service på vores husstandsvindmøller, i henhold til de fastlagte service- & installationsforskrifter, 
 gennemføre mekanisk - og elektrisk reparationsarbejde samt udføre installationer af husstandsvindmøller i Danmark og udland. 
 
 Du får en spændende hverdag i en virksomhed, hvor virksomhedskulturen er uformel, selvstændig og engageret. Du vil få en bred berøringsflade med såvel vores interne organisation, som vores leverandører og kunder. 
 En typisk arbejdsuge kan beskrives således: 
 
 Mandag – onsdag / torsdag, service på vindmøller, kombineret med løsning af fejludkald, der planlægges selvstændigt. Service gennemføres som daglige udkørsler eller som serviceture med overnatning. Du har medindflydelse på perioden for serviceture med overnatning. 
 Fredag, service på vindmøller, kombineret med vedligeholdelsesdag, og forberedelse af efterfølgende serviceuge, herunder klargøring af bil. Deltagelse i servicemøde. 
 
 Ud over dit arbejde som servicemontør, kan der blive mulighed for andre opgaver, alt efter din interesse. Andre opgaver kan f.eks. være at bistå med supervision af service- & installationsopgaver på møller i udlandet. 
 Profil  
 Vi søger en person med god teknisk forståelse, som har gode skriftlige evner i dansk. 
 Du skal kunne arbejde i ”makkerpar” men også selvstændigt med afstemte opgaver og mål. 
 Du har en mekaniker (auto-, lastbil eller traktor) eller and teknisk grunduddannelse. 
 Viden om datanetværk og praktisk erfaring inden for el-tekniske og hydrauliske maskinanlæg er en fordel, men ikke et krav. 
 Du måske allerede erfaring med servicering og vedligeholdelse af vindmøller, og er i øvrigt interesseret i at efteruddanne dig. 
 Du arbejder systematisk med dine opgaver vægter vigtigheden af kvalitet og grundigt servicearbejde i forbindelse med service-, tilkald og ad hoc-opgaver. 
 Du har en fleksibel indstilling til arbejdstiden, du er omstillingsparat, og du er en teamplayer, der trives med at være en del af et selvstændigt servicehold. 
 Du skal kunne begå dig på engelsk tale og som minimum have et kategori B-kørekort, gerne C/CE samt kran og eventuelt truck. 
 Kendskab til vindmøller samt i besiddelse af stort kørekort er ikke et krav, men vil være en fordel. 
 Ansættelsesforhold 
 Vi har ingen præferencer for alder eller køn. Du er ansat under Industriens overenskomst som timelønnet. Løn, forhandles individuelt, og modsvarer dine kvalifikationer.  Til ansættelsesforholdet, tilhører arbejdstelefon, pensionsordning, sundhedssikring samt en aktiv personalforening. Overtidsarbejde og rejse kan forekomme, da visse servicebesøg kræver rejse med overnatning. 
 Ansøgning: 
 For yderligere information kontakt venligst Martin Toft Poulsen, Service på telefon 2679 4861, eller e-mail  mtp@solidenergy.dk , hvortil du også sender din ansøgning. Ansøgning fremsendes som et CV. 
 Vi gennemfører løbende ansættelsessamtaler, så send din ansøgning til os ikke senere end  20. februar 2025 . Vi ønsker stillingen besat hurtigst muligt – men vi venter gerne på den rette. Vi behandler naturligvis din henvendelse og ansøgning fortroligt. 
   
 Vi håber på din interesse og ser frem til at høre fra dig.",Stålvej 8,58,Danmark,760,Ringkøbing-Skjern,2,Midtjylland,6900,Skjern,1,1,Fuldtid,None,None,1,"{'DriversLicenceType': 3, 'Name': 'Almindelig bil', 'Description': ''}, {'DriversLicenceType': 4, 'Name': 'Stor lastbil', 'Description': ''}",Vindmølleoperatør,0,,0,0,False,"{'Email': 'mtp@solidproduction.dk', 'PersonName': 'Martin Poulsen', 'FirstName': 'Martin', 'LastName': 'Poulsen', 'PositionTitle': None, 'PhoneNumbers': [{'Number': '22794861', 'Type': 0, 'Description': 'Primary'}]}",,False,False,False,False,4,,,False,False,False,True,False,False,,,mtp@solidproduction.dk,26794861,,False,2025-02-28T00:00:00+01:00,7,/CV/FindWork/GetLogo?JobAdId=2512d2b7-69f1-447a-bbf3-749e105b25a1&Organisation=43839918,"Stålvej 8,6900, Skjern",True,False,/CV/Jobseeking/JobLog/CreateJobSearch?JobnetJobPostingIdentifier=2512d2b7-69f1-447a-bbf3-749e105b25a1&Company.Name=Solid Energy A/S&SubmissionDeadlineDate=2025-2-28&Title=Servicemontør - Husstandsvindmølle&WeeklyWorkTime=1,00000000-0000-0000-0000-000000000000,True,0,,,Servicemontør - Husstandsvindmølle,True,,True,1,,2512d2b7-69f1-447a-bbf3-749e105b25a1,,,False,False,,0,False,Solid Energy A/S,Stålvej 8,,,6900,False,False,False,Skjern,Martin Poulsen,22794861,mtp@solidproduction.dk,,,,,False,,2025-02-28T00:00:00+01:00,,0,False,0,,,,,0,,,,False,False,,,False,False,,,,False,,False,,Dag,Arbejdspladsen ligger i Ringkøbing-Skjern kommune,False,Solid Energy A/S,,None,,False,False,"Servicemontør – Husstandsvindmøller 
Solid Wind Power søger montør til vores serviceafdeling i Skjern, der varetager installation og vedligeholdelse af vores husstandsvindmøller i Danmark og i udlandet.
Solid Wind Power
Hjemhørende i Skjern, og en af verdens førende leverandører af husstandsvindmøller, med mere end 1000 husstandsvindmøller installe","""Servicemontør – Husstandsvindmøller \nSolid Wind Power søger montør til vores serviceafdeling i Skjern, der varetager installation og vedligeholdelse af vores husstandsvindmøller i Danmark og i udlandet.\nSolid Wind Power\nHjemhørende i Skjern, og en af verdens førende leverandører af husstandsvindmøller, med mere end 1000 husstandsvindmøller installe""","""Servicemontør - Husstandsvindmølle""","https://www.google.dk/maps/dir//Stålvej+8,6900,+Skjern/","Servicemontør – Husstandsvindmøller  
 Solid Wind Power søger montør til vores serviceafdeling i Skjern, der varetager installation og vedligeholdelse af vores husstandsvindmøller i Danmark og i udlandet. 
 Solid Wind Power 
 Hjemhørende i Skjern, og en af verdens førende leverandører af husstandsvindmøller, med mere end 1000 husstandsvindmøller installeret global og i fortsat vækst. 
 Vores vindmøller understøtter energiomstillingen gennem produktion af grøn strøm, til ejerens egen anvendelse. Vindmøllerne, der er 25m høje, producerer strøm svarende til 20 husstandes årlige elektricitetsforbrug. Møllerne installeres til anvendelse i et bredt segment, fra landbruget og mindre industri til offentlige virksomheder, indland som udland. 
 Husstandsmøllerne fra Solid Wind Power er et kvalitetsprodukt og producerer strøm til en konkurrencedygtig og forudsigelig strømpris, hvilket øger efterspørgslen på vores møller. 
 Produktion af vinger og samling af vores naceller til vores 25kW husstandsvindmøller sker fra vores base i Skjern. Salget til Danmark foregår via vores egen Salgs- & projektafdeling. 
 Med udgangspunkt fra Skjern, fjern-overvåges alle installerede møller. Fra Skjern, planlægges og gennemføres de årlige serviceeftersyn på mere end 400 møller, der primært er placeret i Danmark. Serviceafdelingen forestår ligeledes den daglige kundesupport, transport & installation af solgte møller og gennemfører fejlfinding på møllerne efter behov. 
 Vi har travlt og kunne godt bruge din hjælp til at understøtte og sikre vores fortsatte drift og vækst på serviceområdet. 
 Dine arbejdsopgaver: 
 Med udgangspunkt fra vores base i Skjern, indgår du i et servicehold på to(2)–tre(3) servicemontører, med henblik på at: 
 
 gennemføre og dokumentere service på vores husstandsvindmøller, i henhold til de fastlagte service- & installationsforskrifter, 
 gennemføre mekanisk - og elektrisk reparationsarbejde samt udføre installationer af husstandsvindmøller i Danmark og udland. 
 
 Du får en spændende hverdag i en virksomhed, hvor virksomhedskulturen er uformel, selvstændig og engageret. Du vil få en bred berøringsflade med såvel vores interne organisation, som vores leverandører og kunder. 
 En typisk arbejdsuge kan beskrives således: 
 
 Mandag – onsdag / torsdag, service på vindmøller, kombineret med løsning af fejludkald, der planlægges selvstændigt. Service gennemføres som daglige udkørsler eller som serviceture med overnatning. Du har medindflydelse på perioden for serviceture med overnatning. 
 Fredag, service på vindmøller, kombineret med vedligeholdelsesdag, og forberedelse af efterfølgende serviceuge, herunder klargøring af bil. Deltagelse i servicemøde. 
 
 Ud over dit arbejde som servicemontør, kan der blive mulighed for andre opgaver, alt efter din interesse. Andre opgaver kan f.eks. være at bistå med supervision af service- & installationsopgaver på møller i udlandet. 
 Profil  
 Vi søger en person med god teknisk forståelse, som har gode skriftlige evner i dansk. 
 Du skal kunne arbejde i ”makkerpar” men også selvstændigt med afstemte opgaver og mål. 
 Du har en mekaniker (auto-, lastbil eller traktor) eller and teknisk grunduddannelse. 
 Viden om datanetværk og praktisk erfaring inden for el-tekniske og hydrauliske maskinanlæg er en fordel, men ikke et krav. 
 Du måske allerede erfaring med servicering og vedligeholdelse af vindmøller, og er i øvrigt interesseret i at efteruddanne dig. 
 Du arbejder systematisk med dine opgaver vægter vigtigheden af kvalitet og grundigt servicearbejde i forbindelse med service-, tilkald og ad hoc-opgaver. 
 Du har en fleksibel indstilling til arbejdstiden, du er omstillingsparat, og du er en teamplayer, der trives med at være en del af et selvstændigt servicehold. 
 Du skal kunne begå dig på engelsk tale og som minimum have et kategori B-kørekort, gerne C/CE samt kran og eventuelt truck. 
 Kendskab til vindmøller samt i besiddelse af stort kørekort er ikke et krav, men vil være en fordel. 
 Ansættelsesforhold 
 Vi har ingen præferencer for alder eller køn. Du er ansat under Industriens overenskomst som timelønnet. Løn, forhandles individuelt, og modsvarer dine kvalifikationer.  Til ansættelsesforholdet, tilhører arbejdstelefon, pensionsordning, sundhedssikring samt en aktiv personalforening. Overtidsarbejde og rejse kan forekomme, da visse servicebesøg kræver rejse med overnatning. 
 Ansøgning: 
 For yderligere information kontakt venligst Martin Toft Poulsen, Service på telefon 2679 4861, eller e-mail  mtp@solidenergy.dk , hvortil du også sender din ansøgning. Ansøgning fremsendes som et CV. 
 Vi gennemfører løbende ansættelsessamtaler, så send din ansøgning til os ikke senere end  20. februar 2025 . Vi ønsker stillingen besat hurtigst muligt – men vi venter gerne på den rette. Vi behandler naturligvis din henvendelse og ansøgning fortroligt. 
   
 Vi håber på din interesse og ser frem til at høre fra dig.","https://www.google.dk/maps/place/Stålvej+8,6900,+Skjern/",43839918,False,False,,False
