summary_AutomatchType,summary_Abroad,summary_Weight,summary_Title,summary_JobHeadline,summary_Presentation,summary_HiringOrgName,summary_WorkPlaceAddress,summary_WorkPlacePostalCode,summary_WorkPlaceCity,summary_WorkPlaceOtherAddress,summary_WorkPlaceAbroad,summary_WorkPlaceNotStatic,summary_UseWorkPlaceAddressForJoblog,summary_PostingCreated,summary_LastDateApplication,summary_FormattedLastDateApplication,summary_AssignmentStartDate,summary_IsHotjob,summary_IsExternal,summary_Url,summary_Region,summary_Municipality,summary_Country,summary_PostalCode,summary_PostalCodeName,summary_JobAnnouncementType,summary_EmploymentType,summary_WorkHours,summary_OccupationArea,summary_OccupationGroup,summary_Occupation,summary_Location_Latitude,summary_Location_Longitude,summary_JoblogWorkTime_WorkHour,summary_JoblogWorkTime_DailyWorkTime,summary_WorkplaceID,summary_OrganisationId,summary_HiringOrgCVR,summary_UserLoggedIn,summary_AnonymousEmployer,summary_ShareUrl,summary_DetailsUrl,summary_JobLogUrl,summary_HasLocationValues,summary_ID,summary_Latitude,summary_Longitude,details_WorkSchedule,details_WorkConditions,details_EmploymentTypes,details_WorkPlace_Name,details_WorkPlace_Address_AddressLine,details_WorkPlace_Address_Country_Id,details_WorkPlace_Address_Country_Name,details_WorkPlace_Address_Municipality_Id,details_WorkPlace_Address_Municipality_Name,details_WorkPlace_Address_Region_Id,details_WorkPlace_Address_Region_Name,details_WorkPlace_Address_PostalCode,details_WorkPlace_Address_City,details_WorkPlace_PhoneNumber_Number,details_WorkPlace_PhoneNumber_Type,details_WorkPlace_PhoneNumber_Description,details_WorkPlace_FaxNumber,details_WorkPlace_Email,details_WorkPlace_WebAddress,details_WorkPlace_Description,details_WorkPlace_Logo,details_WorkPlace_WorkPlaceOrganizationNumber,details_WorkPlace_OrganizationNumber,details_WorkPlace_OrganizationDescription,details_JobPositionPosting_Id,details_JobPositionPosting_HiringOrg_Name,details_JobPositionPosting_HiringOrg_Address_AddressLine,details_JobPositionPosting_HiringOrg_Address_Country_Id,details_JobPositionPosting_HiringOrg_Address_Country_Name,details_JobPositionPosting_HiringOrg_Address_Municipality_Id,details_JobPositionPosting_HiringOrg_Address_Municipality_Name,details_JobPositionPosting_HiringOrg_Address_Region_Id,details_JobPositionPosting_HiringOrg_Address_Region_Name,details_JobPositionPosting_HiringOrg_Address_PostalCode,details_JobPositionPosting_HiringOrg_Address_City,details_JobPositionPosting_HiringOrg_PhoneNumber_Number,details_JobPositionPosting_HiringOrg_PhoneNumber_Type,details_JobPositionPosting_HiringOrg_PhoneNumber_Description,details_JobPositionPosting_HiringOrg_FaxNumber,details_JobPositionPosting_HiringOrg_Email,details_JobPositionPosting_HiringOrg_WebAddress,details_JobPositionPosting_HiringOrg_Description,details_JobPositionPosting_HiringOrg_Logo,details_JobPositionPosting_HiringOrg_WorkPlaceOrganizationNumber,details_JobPositionPosting_HiringOrg_OrganizationNumber,details_JobPositionPosting_HiringOrg_OrganizationDescription,details_JobPositionPosting_RecruitingCompany,details_JobPositionPosting_PublicationStartDate,details_JobPositionPosting_PublicationEndDate,details_JobPositionPosting_JobPositionInformation_PositionTitle,details_JobPositionPosting_JobPositionInformation_Purpose,details_JobPositionPosting_JobPositionInformation_WorkLocation_AddressLine,details_JobPositionPosting_JobPositionInformation_WorkLocation_Country_Id,details_JobPositionPosting_JobPositionInformation_WorkLocation_Country_Name,details_JobPositionPosting_JobPositionInformation_WorkLocation_Municipality_Id,details_JobPositionPosting_JobPositionInformation_WorkLocation_Municipality_Name,details_JobPositionPosting_JobPositionInformation_WorkLocation_Region_Id,details_JobPositionPosting_JobPositionInformation_WorkLocation_Region_Name,details_JobPositionPosting_JobPositionInformation_WorkLocation_PostalCode,details_JobPositionPosting_JobPositionInformation_WorkLocation_City,details_JobPositionPosting_JobPositionInformation_EmploymentType,details_JobPositionPosting_JobPositionInformation_WeeklyWorkHours_TypeId,details_JobPositionPosting_JobPositionInformation_WeeklyWorkHours_TypeName,details_JobPositionPosting_JobPositionInformation_WeeklyWorkHours_Description,details_JobPositionPosting_JobPositionInformation_CompensationDescription,details_JobPositionPosting_JobPositionInformation_NumberToFill,details_JobPositionPosting_JobPositionInformation_DriverLicense,details_JobPositionPosting_JobPositionInformation_Occupation_Name,details_JobPositionPosting_JobPositionInformation_Occupation_DiscoWeb,details_JobPositionPosting_JobPositionInformation_Occupation_AlternateNames,details_JobPositionPosting_JobPositionInformation_Occupation_GroupId,details_JobPositionPosting_JobPositionInformation_Occupation_AreaId,details_JobPositionPosting_JobPositionInformation_IsGovernmentHiring,details_JobPositionPosting_JobPositionInformation_JppContacts,details_JobPositionPosting_JobPositionInformation_EmploymentDate,details_JobPositionPosting_IsRecruitmentOfForeignNationals,details_JobPositionPosting_IsWorkInDenmark,details_JobPositionPosting_IsAnonymousEmployer,details_JobPositionPosting_IsDisabilityFriendly,details_JobPositionPosting_JppType,details_JobPositionPosting_ApplicationDetails_WorkHourMax,details_JobPositionPosting_ApplicationDetails_WorkHourMin,details_JobPositionPosting_ApplicationDetails_DailyWorkTimeWeekend,details_JobPositionPosting_ApplicationDetails_DailyWorkTimeNight,details_JobPositionPosting_ApplicationDetails_DailyWorkTimeEvening,details_JobPositionPosting_ApplicationDetails_DailyWorkTimeDay,details_JobPositionPosting_ApplicationDetails_DailyWorkTimeMorning,details_JobPositionPosting_ApplicationDetails_DailyWorkTimeVarious,details_JobPositionPosting_ApplicationDetails_ReferenceText,details_JobPositionPosting_ApplicationDetails_RemarksToApplicant,details_JobPositionPosting_ApplicationDetails_ByEmail,details_JobPositionPosting_ApplicationDetails_ByPhone,details_JobPositionPosting_ApplicationDetails_ApplyViaUrl,details_JobPositionPosting_ApplicationDetails_ReplyInWriting,details_JobPositionPosting_ApplicationDetails_ApplicationDeadlineDate,details_JobPositionPosting_Status,details_LogoUrl,details_Address,details_ShowMap,details_ShowShareButtonJobLog,details_JobLogUrl,details_JobLogTemplateModel_Identifier,details_JobLogTemplateModel_UseWorkPlaceAddressForJoblog,details_JobLogTemplateModel_Category,details_JobLogTemplateModel_CvCustomerIdentifier,details_JobLogTemplateModel_JobSeekingStatus,details_JobLogTemplateModel_Title,details_JobLogTemplateModel_IsApplicationSourceRequired,details_JobLogTemplateModel_ApplicationSource,details_JobLogTemplateModel_IsWeeklyWorkTimeRequired,details_JobLogTemplateModel_WeeklyWorkTime,details_JobLogTemplateModel_HoursPerWeek,details_JobLogTemplateModel_JobnetJobPostingIdentifier,details_JobLogTemplateModel_JobAdDocument_Title,details_JobLogTemplateModel_JobAdDocument_Identifier,details_JobLogTemplateModel_JobAdDocument_IsDeletedBySystem,details_JobLogTemplateModel_JobAdDocument_IsDeletedByUser,details_JobLogTemplateModel_JobAdFile,details_JobLogTemplateModel_Company_JobLogEntryCategory,details_JobLogTemplateModel_Company_ShowAddressFieldsEvenIfEmpty,details_JobLogTemplateModel_Company_Name,details_JobLogTemplateModel_Company_Address,details_JobLogTemplateModel_Company_Country,details_JobLogTemplateModel_Company_EmploymentAreaID,details_JobLogTemplateModel_Company_PostCode,details_JobLogTemplateModel_Company_IsCountryAndTownAndPostCodeEmpty,details_JobLogTemplateModel_Company_IsTownAndPostCodeEmpty,details_JobLogTemplateModel_Company_IsCountryDanmark,details_JobLogTemplateModel_Company_Town,details_JobLogTemplateModel_Company_ContactPerson,details_JobLogTemplateModel_Company_Phone,details_JobLogTemplateModel_Company_Email,details_JobLogTemplateModel_Company_Latitude,details_JobLogTemplateModel_Company_Longitude,details_JobLogTemplateModel_Company_DailyTravelTimeInMinutes,details_JobLogTemplateModel_Company_DistanceToCompanyInMeters,details_JobLogTemplateModel_Company_IsCreateMode,details_JobLogTemplateModel_TypeOfSubmission,details_JobLogTemplateModel_SubmissionDate,details_JobLogTemplateModel_SubmissionDateFormatted,details_JobLogTemplateModel_SubmissionDateTiks,details_JobLogTemplateModel_IsSubmissionDateRequired,details_JobLogTemplateModel_Status,details_JobLogTemplateModel_DateCreatedFormatted,details_JobLogTemplateModel_DateCreated,details_JobLogTemplateModel_DateModifiedFormatted,details_JobLogTemplateModel_DateModified,details_JobLogTemplateModel_LastModifiedDateTiks,details_JobLogTemplateModel_DateClosed,details_JobLogTemplateModel_JobApplicationDocument_Title,details_JobLogTemplateModel_JobApplicationDocument_Identifier,details_JobLogTemplateModel_JobApplicationDocument_IsDeletedBySystem,details_JobLogTemplateModel_JobApplicationDocument_IsDeletedByUser,details_JobLogTemplateModel_CvDocument_Title,details_JobLogTemplateModel_CvDocument_Identifier,details_JobLogTemplateModel_CvDocument_IsDeletedBySystem,details_JobLogTemplateModel_CvDocument_IsDeletedByUser,details_JobLogTemplateModel_JobApplicationFile,details_JobLogTemplateModel_CvFile,details_JobLogTemplateModel_SubmissionDeadlineDate,details_JobLogTemplateModel_IsPersisted,details_JobLogTemplateModel_ServerValidationErrors,details_JobLogTemplateModel_HasServerValidationErrors,details_JoblogWorkTime_WorkHour,details_JoblogWorkTime_DailyWorkTime,details_Place,details_OpenPrintDialog,details_WorkPlaceInfoText,details_JobCenterContactDetails,details_WorkPlaceDescriptionText,details_FavoriteText,details_IsFavorite,details_ShowFavorite,details_MetaOgTextForSharing,details_DescriptionForSharing,details_TitleForSharing,details_RutePlan,details_FormattedPurpose,details_MapUrl,details_OrganizationNumber,details_ShowSearchJobButton,details_ShowPrint,details_BackToFindWorkButtonUrl,isExternal
0,False,1,ISS søger kreativ og erfaren kok til personalerestaurant,ISS søger kreativ og erfaren kok til personalerestaurant,Ansøgningsfrist: 10. februar 2025&nbsp;  Er du kreativ og nytænkende i din tilgang til mad? Brænder du for at skabe gastronomiske oplevelser og levere,ISS Facility Services A/S,   ,2900,Hellerup,True,False,False,False,2025-01-15T10:26:41,2025-02-10T23:59:59,10. februar 2025,0001-01-01T00:00:00,False,False,https://job.jobnet.dk/CV/FindWork/Details/2fbf8ca1-d840-4805-8e4c-26adaf0451c9,Hovedstaden og Bornholm,Gentofte,Danmark,2900,,Almindelige vilkår,Fastansættelse,Fuldtid,"Hotel, restauration, køkken, kantine",Køkken- og kantinearbejde,Kok,55.7344,12.5695,,,1002956763,,14406042,False,False,https://job.jobnet.dk/CV/FindWork/DetailsSocialmedia/2fbf8ca1-d840-4805-8e4c-26adaf0451c9,https://job.jobnet.dk/CV/FindWork/Details/2fbf8ca1-d840-4805-8e4c-26adaf0451c9,https://job.jobnet.dk/CV/FindWork/Details/2fbf8ca1-d840-4805-8e4c-26adaf0451c9,True,2fbf8ca1-d840-4805-8e4c-26adaf0451c9,55.7344,12.5695,"{'Id': 1, 'Name': 'Fuldtid'}, {'Id': 16, 'Name': 'Deltid'}","{'Id': 1, 'Name': 'Almindelige vilkår'}, {'Id': 2, 'Name': 'Fleksjob'}, {'Id': 3, 'Name': 'Skånejob'}, {'Id': 4, 'Name': 'Egnet til efterlønnere og seniorer'}, {'Id': 5, 'Name': 'Job med løntilskud'}, {'Id': 6, 'Name': 'Rotationsjob'}, {'Id': 7, 'Name': 'Virksomhedspraktik'}","{'Id': 1, 'Name': 'Fastansættelse'}, {'Id': 16, 'Name': 'Tidsbegrænset ansættelse'}",ISS Facility Services A/S,,58,Danmark,157,Gentofte,4,"Hovedstaden, Sjælland og Bornholm",2900,Hellerup,,0,Primary,,,https://www.ofir.dk/resultat/Jobannonce.aspx?ofirId=2a5ed302&action=sendApplicationUrl&utm_source=job.jobnet.dk&utm_medium=referral,None,,1002956763,14406042,None,2fbf8ca1-d840-4805-8e4c-26adaf0451c9,ISS Facility Services A/S,,58,Danmark,157,Gentofte,4,"Hovedstaden, Sjælland og Bornholm",2900,Hellerup,,0,Primary,,,https://www.ofir.dk/resultat/Jobannonce.aspx?ofirId=2a5ed302&action=sendApplicationUrl&utm_source=job.jobnet.dk&utm_medium=referral,None,,1002956763,14406042,None,,2025-01-15T10:26:41.4662565+01:00,2025-02-10T23:59:59+01:00,ISS søger kreativ og erfaren kok til personalerestaurant,"Ansøgningsfrist:  10. februar 2025      Er du kreativ og nytænkende i din tilgang til mad? Brænder du for at skabe gastronomiske oplevelser og levere service af høj kvalitet til dine gæster? Vil du være en del af et fantastisk team, der har fokus på din faglighed, udvikling og trivsel? Så har vi muligvis en stilling for dig.     Vi søger en dygtig og knivskarp kok til vores personalerestaurant i  Hellerup , som leverer frokost til lokationens ca. 800 dagligt spisende frokostgæster. Du bliver en del af et motiveret og imødekommende team med dygtige og erfarne kokke, der til sammen udgør ca. 16 kolleger.     Teamet har et fælles fokus på at skabe madoplevelser med stor foodpassion, der kræver en nytænkende og kreativ tilgang til råvarer og menuplanlægning. Hertil går vi meget op i faglighed og udvikling og vi vil med glæde lære fra os.   Vi er en dynamisk arbejdsplads, som sammen serverer spændende og velsmagende måltider. Vi benytter friske og lækre råvarer, og inkorporerer spændende elementer i alt, vi laver. Vi tilbyder en spændende og varierende hverdag, hvor vi laver mad til alt fra store arrangementer, til små mindre middage for direktionen. Derudover laver vi mad til fine-dinning arrangementer og temadage flere gange årligt, hvor dine inputs og ideer er meget kærkommen.        Er du vores nye kok?       I denne stilling tilbyder vi dig en hverdag med fokus på at flytte barren for lækker og velsmagende mad. Du kommer derfor til at beskæftige dig med kantinemad på højt niveau, udvikling og service.    Vi forventer, at du er faglært kok og har mod på at skabe fantastiske madoplevelser. Du er villig til at gå den ekstra mil for et resultat, man kan være stolt af.      Vi forventer, du er ivrig efter at bruge din faglighed, kreativitet og foodpassion og brænder for at lave mad fra bunden af høj kvalitet hver dag.   Stillingen er på  37 timer ugentligt.  Mødetiden er  mandag til fredag fra kl. 06.00 – 14.00.  Hver 6. uge er der aftenarbejde, hvilket betyder, at mødetiden i denne uge er  mandag til fredag fra kl. 11:30 – 19:30.   Du skal være forberedt på, at der kan forekomme enkelte aftenarrangementer såsom fine-dining, som kræver en særlig opmærksomhed og indsats.     Som en del af ISS kan vi – i kraft af vores størrelse og vores erfaring – tilbyde dig et netværk af dygtige og kvalitetsbevidste kolleger, og vi vil med glæde hjælpe dig med at sikre dig faglig udvikling og spændende karriemuligheder.    Samtidig vægter vi vores medarbejdere meget højt og tror på, at vejen til succes går gennem udvikling, loyalitet, gensidig tillid og positivt samarbejde.Som person er du udadvendt, og kan tale med vores kunde, når denne henvender sig.   Det skal være vigtigt for dig at levere et højt serviceniveau hver eneste dag. Selv i de travleste perioder, formår du at holde hovedet koldt og forblive fokuseret.     Ansøgning     Send din ansøgning vedlagt CV via nedenstående link senest den  10. februar 2025.  Vi behandler ansøgninger løbende, og indkalder løbende kandidater til samtale.   For yderligere information kan du kontakte  Køkkenchef Nicolai Adler Jensen på e-mail nicolai.adler.jensen@dk.issworld.com     Opstart hurtigst muligt   Why ISS   Since our founding in 1901, ISS has been a people-first company. We recognise the power of diversity, inclusion and belonging and celebrate the differences that make us unique. When everyone is free to be themselves, everyone benefits.     Our people feel safe, respected, represented, and supported as their authentic selves, allowing them to seize opportunities and reach their full potential. We take seriously our obligation to improve lives, make a difference in our communities, and protect our planet - because when we get things right, the world works better. And that is what drives us.     ISS is a Place to Be You.     Be who you are. Become what you want. Be part of something bigger. 
 Denne jobannonce blev oprindeligt opslået på  https://www.ofir.dk/ 
 (Den originale annonce kan ses på:  https://www.ofir.dk/showojob?ofirid=2a5ed302 )",,58,Danmark,157,Gentofte,4,"Hovedstaden, Sjælland og Bornholm",2900,Hellerup,1,1,Fuldtid,None,None,1,,Kok,0,"Diætkok, Privat kok, Kok med speciale i bagværk og kager, Kok i storkøkken, Grillkok, Fiskekok, Skibskok, hovmester, Gastronom, 3165, 3166, 3167, 3168",0,0,False,,,False,False,False,False,4,,,False,False,False,False,False,False,,,,,https://www.ofir.dk/resultat/Jobannonce.aspx?ofirId=2a5ed302&action=sendApplicationUrl&utm_source=job.jobnet.dk&utm_medium=referral,False,2025-02-10T23:59:59+01:00,7,/CV/FindWork/GetLogo?JobAdId=2fbf8ca1-d840-4805-8e4c-26adaf0451c9&Organisation=14406042,",2900, Hellerup",False,False,/CV/Jobseeking/JobLog/CreateJobSearch?JobnetJobPostingIdentifier=2fbf8ca1-d840-4805-8e4c-26adaf0451c9&Company.Name=ISS Facility Services A/S&SubmissionDeadlineDate=2025-2-10&Title=ISS søger kreativ og erfaren kok til personalerestaurant&WeeklyWorkTime=1,00000000-0000-0000-0000-000000000000,False,0,,,ISS søger kreativ og erfaren kok til personalerestaurant,True,,True,1,,2fbf8ca1-d840-4805-8e4c-26adaf0451c9,,,False,False,,0,False,ISS Facility Services A/S,,,,2900,False,False,False,Hellerup,,,,,,,,False,,2025-02-10T23:59:59+01:00,,0,False,0,,,,,0,,,,False,False,,,False,False,,,,False,,False,,,Arbejdspladsen ligger i Gentofte kommune,False,ISS Facility Services A/S,,None,,False,False,"Ansøgningsfrist: 10. februar 2025  Er du kreativ og nytænkende i din tilgang til mad? Brænder du for at skabe gastronomiske oplevelser og levere service af høj kvalitet til dine gæster? Vil du være en del af et fantastisk team, der har fokus på din faglighed, udvikling og trivsel? Så har vi muligvis en stilling for dig.  Vi søger en dygtig og knivs","""Ansøgningsfrist: 10. februar 2025  Er du kreativ og nytænkende i din tilgang til mad? Brænder du for at skabe gastronomiske oplevelser og levere service af høj kvalitet til dine gæster? Vil du være en del af et fantastisk team, der har fokus på din faglighed, udvikling og trivsel? Så har vi muligvis en stilling for dig.  Vi søger en dygtig og knivs""","""ISS søger kreativ og erfaren kok til personalerestaurant""","https://www.google.dk/maps/dir//,2900,+Hellerup/","Ansøgningsfrist:  10. februar 2025      Er du kreativ og nytænkende i din tilgang til mad? Brænder du for at skabe gastronomiske oplevelser og levere service af høj kvalitet til dine gæster? Vil du være en del af et fantastisk team, der har fokus på din faglighed, udvikling og trivsel? Så har vi muligvis en stilling for dig.     Vi søger en dygtig og knivskarp kok til vores personalerestaurant i  Hellerup , som leverer frokost til lokationens ca. 800 dagligt spisende frokostgæster. Du bliver en del af et motiveret og imødekommende team med dygtige og erfarne kokke, der til sammen udgør ca. 16 kolleger.     Teamet har et fælles fokus på at skabe madoplevelser med stor foodpassion, der kræver en nytænkende og kreativ tilgang til råvarer og menuplanlægning. Hertil går vi meget op i faglighed og udvikling og vi vil med glæde lære fra os.   Vi er en dynamisk arbejdsplads, som sammen serverer spændende og velsmagende måltider. Vi benytter friske og lækre råvarer, og inkorporerer spændende elementer i alt, vi laver. Vi tilbyder en spændende og varierende hverdag, hvor vi laver mad til alt fra store arrangementer, til små mindre middage for direktionen. Derudover laver vi mad til fine-dinning arrangementer og temadage flere gange årligt, hvor dine inputs og ideer er meget kærkommen.        Er du vores nye kok?       I denne stilling tilbyder vi dig en hverdag med fokus på at flytte barren for lækker og velsmagende mad. Du kommer derfor til at beskæftige dig med kantinemad på højt niveau, udvikling og service.    Vi forventer, at du er faglært kok og har mod på at skabe fantastiske madoplevelser. Du er villig til at gå den ekstra mil for et resultat, man kan være stolt af.      Vi forventer, du er ivrig efter at bruge din faglighed, kreativitet og foodpassion og brænder for at lave mad fra bunden af høj kvalitet hver dag.   Stillingen er på  37 timer ugentligt.  Mødetiden er  mandag til fredag fra kl. 06.00 – 14.00.  Hver 6. uge er der aftenarbejde, hvilket betyder, at mødetiden i denne uge er  mandag til fredag fra kl. 11:30 – 19:30.   Du skal være forberedt på, at der kan forekomme enkelte aftenarrangementer såsom fine-dining, som kræver en særlig opmærksomhed og indsats.     Som en del af ISS kan vi – i kraft af vores størrelse og vores erfaring – tilbyde dig et netværk af dygtige og kvalitetsbevidste kolleger, og vi vil med glæde hjælpe dig med at sikre dig faglig udvikling og spændende karriemuligheder.    Samtidig vægter vi vores medarbejdere meget højt og tror på, at vejen til succes går gennem udvikling, loyalitet, gensidig tillid og positivt samarbejde.Som person er du udadvendt, og kan tale med vores kunde, når denne henvender sig.   Det skal være vigtigt for dig at levere et højt serviceniveau hver eneste dag. Selv i de travleste perioder, formår du at holde hovedet koldt og forblive fokuseret.     Ansøgning     Send din ansøgning vedlagt CV via nedenstående link senest den  10. februar 2025.  Vi behandler ansøgninger løbende, og indkalder løbende kandidater til samtale.   For yderligere information kan du kontakte  Køkkenchef Nicolai Adler Jensen på e-mail nicolai.adler.jensen@dk.issworld.com     Opstart hurtigst muligt   Why ISS   Since our founding in 1901, ISS has been a people-first company. We recognise the power of diversity, inclusion and belonging and celebrate the differences that make us unique. When everyone is free to be themselves, everyone benefits.     Our people feel safe, respected, represented, and supported as their authentic selves, allowing them to seize opportunities and reach their full potential. We take seriously our obligation to improve lives, make a difference in our communities, and protect our planet - because when we get things right, the world works better. And that is what drives us.     ISS is a Place to Be You.     Be who you are. Become what you want. Be part of something bigger. 
 Denne jobannonce blev oprindeligt opslået på  https://www.ofir.dk/ 
 (Den originale annonce kan ses på:  https://www.ofir.dk/showojob?ofirid=2a5ed302 )","https://www.google.dk/maps/place/,2900,+Hellerup/",14406042,False,False,,False
