summary_AutomatchType,summary_Abroad,summary_Weight,summary_Title,summary_JobHeadline,summary_Presentation,summary_HiringOrgName,summary_WorkPlaceAddress,summary_WorkPlacePostalCode,summary_WorkPlaceCity,summary_WorkPlaceOtherAddress,summary_WorkPlaceAbroad,summary_WorkPlaceNotStatic,summary_UseWorkPlaceAddressForJoblog,summary_PostingCreated,summary_LastDateApplication,summary_FormattedLastDateApplication,summary_AssignmentStartDate,summary_IsHotjob,summary_IsExternal,summary_Url,summary_Region,summary_Municipality,summary_Country,summary_PostalCode,summary_PostalCodeName,summary_JobAnnouncementType,summary_EmploymentType,summary_WorkHours,summary_OccupationArea,summary_OccupationGroup,summary_Occupation,summary_Location_Latitude,summary_Location_Longitude,summary_JoblogWorkTime_WorkHour,summary_JoblogWorkTime_DailyWorkTime,summary_WorkplaceID,summary_OrganisationId,summary_HiringOrgCVR,summary_UserLoggedIn,summary_AnonymousEmployer,summary_ShareUrl,summary_DetailsUrl,summary_JobLogUrl,summary_HasLocationValues,summary_ID,summary_Latitude,summary_Longitude,details_WorkSchedule,details_WorkConditions,details_EmploymentTypes,details_WorkPlace_Name,details_WorkPlace_Address_AddressLine,details_WorkPlace_Address_Country_Id,details_WorkPlace_Address_Country_Name,details_WorkPlace_Address_Municipality_Id,details_WorkPlace_Address_Municipality_Name,details_WorkPlace_Address_Region_Id,details_WorkPlace_Address_Region_Name,details_WorkPlace_Address_PostalCode,details_WorkPlace_Address_City,details_WorkPlace_PhoneNumber_Number,details_WorkPlace_PhoneNumber_Type,details_WorkPlace_PhoneNumber_Description,details_WorkPlace_FaxNumber,details_WorkPlace_Email,details_WorkPlace_WebAddress,details_WorkPlace_Description,details_WorkPlace_Logo,details_WorkPlace_WorkPlaceOrganizationNumber,details_WorkPlace_OrganizationNumber,details_WorkPlace_OrganizationDescription,details_JobPositionPosting_Id,details_JobPositionPosting_HiringOrg_Name,details_JobPositionPosting_HiringOrg_Address_AddressLine,details_JobPositionPosting_HiringOrg_Address_Country_Id,details_JobPositionPosting_HiringOrg_Address_Country_Name,details_JobPositionPosting_HiringOrg_Address_Municipality_Id,details_JobPositionPosting_HiringOrg_Address_Municipality_Name,details_JobPositionPosting_HiringOrg_Address_Region_Id,details_JobPositionPosting_HiringOrg_Address_Region_Name,details_JobPositionPosting_HiringOrg_Address_PostalCode,details_JobPositionPosting_HiringOrg_Address_City,details_JobPositionPosting_HiringOrg_PhoneNumber_Number,details_JobPositionPosting_HiringOrg_PhoneNumber_Type,details_JobPositionPosting_HiringOrg_PhoneNumber_Description,details_JobPositionPosting_HiringOrg_FaxNumber,details_JobPositionPosting_HiringOrg_Email,details_JobPositionPosting_HiringOrg_WebAddress,details_JobPositionPosting_HiringOrg_Description,details_JobPositionPosting_HiringOrg_Logo,details_JobPositionPosting_HiringOrg_WorkPlaceOrganizationNumber,details_JobPositionPosting_HiringOrg_OrganizationNumber,details_JobPositionPosting_HiringOrg_OrganizationDescription,details_JobPositionPosting_RecruitingCompany,details_JobPositionPosting_PublicationStartDate,details_JobPositionPosting_PublicationEndDate,details_JobPositionPosting_JobPositionInformation_PositionTitle,details_JobPositionPosting_JobPositionInformation_Purpose,details_JobPositionPosting_JobPositionInformation_WorkLocation_AddressLine,details_JobPositionPosting_JobPositionInformation_WorkLocation_Country_Id,details_JobPositionPosting_JobPositionInformation_WorkLocation_Country_Name,details_JobPositionPosting_JobPositionInformation_WorkLocation_Municipality_Id,details_JobPositionPosting_JobPositionInformation_WorkLocation_Municipality_Name,details_JobPositionPosting_JobPositionInformation_WorkLocation_Region_Id,details_JobPositionPosting_JobPositionInformation_WorkLocation_Region_Name,details_JobPositionPosting_JobPositionInformation_WorkLocation_PostalCode,details_JobPositionPosting_JobPositionInformation_WorkLocation_City,details_JobPositionPosting_JobPositionInformation_EmploymentType,details_JobPositionPosting_JobPositionInformation_WeeklyWorkHours_TypeId,details_JobPositionPosting_JobPositionInformation_WeeklyWorkHours_TypeName,details_JobPositionPosting_JobPositionInformation_WeeklyWorkHours_Description,details_JobPositionPosting_JobPositionInformation_CompensationDescription,details_JobPositionPosting_JobPositionInformation_NumberToFill,details_JobPositionPosting_JobPositionInformation_DriverLicense,details_JobPositionPosting_JobPositionInformation_Occupation_Name,details_JobPositionPosting_JobPositionInformation_Occupation_DiscoWeb,details_JobPositionPosting_JobPositionInformation_Occupation_AlternateNames,details_JobPositionPosting_JobPositionInformation_Occupation_GroupId,details_JobPositionPosting_JobPositionInformation_Occupation_AreaId,details_JobPositionPosting_JobPositionInformation_IsGovernmentHiring,details_JobPositionPosting_JobPositionInformation_JppContacts,details_JobPositionPosting_JobPositionInformation_EmploymentDate,details_JobPositionPosting_IsRecruitmentOfForeignNationals,details_JobPositionPosting_IsWorkInDenmark,details_JobPositionPosting_IsAnonymousEmployer,details_JobPositionPosting_IsDisabilityFriendly,details_JobPositionPosting_JppType,details_JobPositionPosting_ApplicationDetails_WorkHourMax,details_JobPositionPosting_ApplicationDetails_WorkHourMin,details_JobPositionPosting_ApplicationDetails_DailyWorkTimeWeekend,details_JobPositionPosting_ApplicationDetails_DailyWorkTimeNight,details_JobPositionPosting_ApplicationDetails_DailyWorkTimeEvening,details_JobPositionPosting_ApplicationDetails_DailyWorkTimeDay,details_JobPositionPosting_ApplicationDetails_DailyWorkTimeMorning,details_JobPositionPosting_ApplicationDetails_DailyWorkTimeVarious,details_JobPositionPosting_ApplicationDetails_ReferenceText,details_JobPositionPosting_ApplicationDetails_RemarksToApplicant,details_JobPositionPosting_ApplicationDetails_ByEmail,details_JobPositionPosting_ApplicationDetails_ByPhone,details_JobPositionPosting_ApplicationDetails_ApplyViaUrl,details_JobPositionPosting_ApplicationDetails_ReplyInWriting,details_JobPositionPosting_ApplicationDetails_ApplicationDeadlineDate,details_JobPositionPosting_Status,details_LogoUrl,details_Address,details_ShowMap,details_ShowShareButtonJobLog,details_JobLogUrl,details_JobLogTemplateModel_Identifier,details_JobLogTemplateModel_UseWorkPlaceAddressForJoblog,details_JobLogTemplateModel_Category,details_JobLogTemplateModel_CvCustomerIdentifier,details_JobLogTemplateModel_JobSeekingStatus,details_JobLogTemplateModel_Title,details_JobLogTemplateModel_IsApplicationSourceRequired,details_JobLogTemplateModel_ApplicationSource,details_JobLogTemplateModel_IsWeeklyWorkTimeRequired,details_JobLogTemplateModel_WeeklyWorkTime,details_JobLogTemplateModel_HoursPerWeek,details_JobLogTemplateModel_JobnetJobPostingIdentifier,details_JobLogTemplateModel_JobAdDocument_Title,details_JobLogTemplateModel_JobAdDocument_Identifier,details_JobLogTemplateModel_JobAdDocument_IsDeletedBySystem,details_JobLogTemplateModel_JobAdDocument_IsDeletedByUser,details_JobLogTemplateModel_JobAdFile,details_JobLogTemplateModel_Company_JobLogEntryCategory,details_JobLogTemplateModel_Company_ShowAddressFieldsEvenIfEmpty,details_JobLogTemplateModel_Company_Name,details_JobLogTemplateModel_Company_Address,details_JobLogTemplateModel_Company_Country,details_JobLogTemplateModel_Company_EmploymentAreaID,details_JobLogTemplateModel_Company_PostCode,details_JobLogTemplateModel_Company_IsCountryAndTownAndPostCodeEmpty,details_JobLogTemplateModel_Company_IsTownAndPostCodeEmpty,details_JobLogTemplateModel_Company_IsCountryDanmark,details_JobLogTemplateModel_Company_Town,details_JobLogTemplateModel_Company_ContactPerson,details_JobLogTemplateModel_Company_Phone,details_JobLogTemplateModel_Company_Email,details_JobLogTemplateModel_Company_Latitude,details_JobLogTemplateModel_Company_Longitude,details_JobLogTemplateModel_Company_DailyTravelTimeInMinutes,details_JobLogTemplateModel_Company_DistanceToCompanyInMeters,details_JobLogTemplateModel_Company_IsCreateMode,details_JobLogTemplateModel_TypeOfSubmission,details_JobLogTemplateModel_SubmissionDate,details_JobLogTemplateModel_SubmissionDateFormatted,details_JobLogTemplateModel_SubmissionDateTiks,details_JobLogTemplateModel_IsSubmissionDateRequired,details_JobLogTemplateModel_Status,details_JobLogTemplateModel_DateCreatedFormatted,details_JobLogTemplateModel_DateCreated,details_JobLogTemplateModel_DateModifiedFormatted,details_JobLogTemplateModel_DateModified,details_JobLogTemplateModel_LastModifiedDateTiks,details_JobLogTemplateModel_DateClosed,details_JobLogTemplateModel_JobApplicationDocument_Title,details_JobLogTemplateModel_JobApplicationDocument_Identifier,details_JobLogTemplateModel_JobApplicationDocument_IsDeletedBySystem,details_JobLogTemplateModel_JobApplicationDocument_IsDeletedByUser,details_JobLogTemplateModel_CvDocument_Title,details_JobLogTemplateModel_CvDocument_Identifier,details_JobLogTemplateModel_CvDocument_IsDeletedBySystem,details_JobLogTemplateModel_CvDocument_IsDeletedByUser,details_JobLogTemplateModel_JobApplicationFile,details_JobLogTemplateModel_CvFile,details_JobLogTemplateModel_SubmissionDeadlineDate,details_JobLogTemplateModel_IsPersisted,details_JobLogTemplateModel_ServerValidationErrors,details_JobLogTemplateModel_HasServerValidationErrors,details_JoblogWorkTime_WorkHour,details_JoblogWorkTime_DailyWorkTime,details_Place,details_OpenPrintDialog,details_WorkPlaceInfoText,details_JobCenterContactDetails,details_WorkPlaceDescriptionText,details_FavoriteText,details_IsFavorite,details_ShowFavorite,details_MetaOgTextForSharing,details_DescriptionForSharing,details_TitleForSharing,details_RutePlan,details_FormattedPurpose,details_MapUrl,details_OrganizationNumber,details_ShowSearchJobButton,details_ShowPrint,details_BackToFindWorkButtonUrl,isExternal
0,False,1,Økonomi- og ejendomsadministrator til Søren Enggaard A/S,Økonomi- og ejendomsadministrator til Søren Enggaard A/S,"Er du passioneret omkring ejendomsadministration og økonomi, og klar til at tage ansvar for en spændende portefølje af bolig- og erhvervslejemål? Vil du arbejde i en dynamisk og forretningsorienteret ",MatchMind A/S,Adelgade 9  ,9000,Aalborg,False,False,False,True,2025-02-04T12:36:05,2025-04-01T13:36:05,1. april 2025,0001-01-01T00:00:00,False,False,https://job.jobnet.dk/CV/FindWork/Details/4a4ae1df-389f-4f50-b649-4514ff741850,Nordjylland,Aalborg,Danmark,9000,,Almindelige vilkår,Fastansættelse,Fuldtid,"Rengøring, ejendomsservice og renovation",Ejendomsservice og måleraflæsning,Ejendomsadministrator,57.0517,9.835,,,1009494541,,26993210,False,False,https://job.jobnet.dk/CV/FindWork/DetailsSocialmedia/4a4ae1df-389f-4f50-b649-4514ff741850,https://job.jobnet.dk/CV/FindWork/Details/4a4ae1df-389f-4f50-b649-4514ff741850,https://job.jobnet.dk/CV/FindWork/Details/4a4ae1df-389f-4f50-b649-4514ff741850,True,4a4ae1df-389f-4f50-b649-4514ff741850,57.0517,9.835,"{'Id': 1, 'Name': 'Fuldtid'}, {'Id': 16, 'Name': 'Deltid'}","{'Id': 1, 'Name': 'Almindelige vilkår'}, {'Id': 2, 'Name': 'Fleksjob'}, {'Id': 3, 'Name': 'Skånejob'}, {'Id': 4, 'Name': 'Egnet til efterlønnere og seniorer'}, {'Id': 5, 'Name': 'Job med løntilskud'}, {'Id': 6, 'Name': 'Rotationsjob'}, {'Id': 7, 'Name': 'Virksomhedspraktik'}","{'Id': 1, 'Name': 'Fastansættelse'}, {'Id': 16, 'Name': 'Tidsbegrænset ansættelse'}",MatchMind A/S,Adelgade 9,58,Danmark,851,Aalborg,1,Nordjylland,9000,Aalborg,,0,Primary,,,https://matchmind.dk/ledige-jobs?hr=show-job/238261&linkref=268815&locale=da_DK,None,,1009494541,26993210,None,4a4ae1df-389f-4f50-b649-4514ff741850,MatchMind A/S,Adelgade 9,58,Danmark,851,Aalborg,1,Nordjylland,9000,Aalborg,,0,Primary,,,https://matchmind.dk/ledige-jobs?hr=show-job/238261&linkref=268815&locale=da_DK,None,,1009494541,26993210,None,,2025-02-04T12:36:05+01:00,2025-04-01T13:36:05+02:00,Økonomi- og ejendomsadministrator til Søren Enggaard A/S,"Er du passioneret omkring ejendomsadministration og økonomi, og klar til at tage ansvar for en spændende portefølje af bolig- og erhvervslejemål? Vil du arbejde i en dynamisk og forretningsorienteret virksomhed, hvor dine kompetencer virkelig gør en forskel? Så er det dig, vi leder efter til Søren Enggaard A/S!

 Om stillingen 
 Som økonomi- og ejendomsadministrator hos Søren Enggaard A/S får du en vigtig rolle i den daglige drift af en voksende portefølje af bolig- og erhvervslejemål. Du får et tæt samarbejde med den øvrige organisation og refererer direkte til den administrerende direktør, Carsten Enggaard. Med en portefølje i kraftig vækst vil du opleve et arbejdsmiljø fyldt med udviklingsmuligheder, hvor du samtidig får et indblik i ejendomsudvikling og byggeri, som styrker din faglige profil. 
 Dine ansvarsområder 
 Du får en varieret hverdag med mange spændende opgaver, herunder: 
 
 Håndtering af huslejeopkrævning og økonomisk administration  
 Afstemning af bankkonti, bogføring og registrering af kreditorfakturaer  
 Udarbejdelse af lejeaftaler med fokus på boliglejemål 
 Koordinering af ind- og udflytninger i boliglejemål 
 Udarbejdelse og opkrævning af fælles- og forbrugsregnskaber i samarbejde med eksterne leverandører 
 Løbende dialog og service overfor virksomhedens lejere 
 Diverse ad hoc-opgaver, der sikrer en effektiv drift 
 
 Hvem er du? 
 Vi søger en engageret og struktureret person med et skarpt øje for detaljer og en god forståelse for økonomi. Optimalt set har du en uddannelsesbaggrund inden for ejendomsadministration, men vi hører også gerne fra dig, hvis du har en anden relevant uddannelse og/eller erfaring. Har du erfaring med UNIK Bolig 4, er det et stort plus, men ikke et krav. 
 Det vigtigste er, at du: 
 
 Har en struktureret og selvstændig tilgang til opgaver 
 Er ansvarsbevidst og trives med at tage ejerskab 
 Er positiv, samarbejdsvillig og bidrager til et godt arbejdsmiljø 
 Er fleksibel og omstillingsparat i en virksomhed i konstant udvikling 
 Motiveres af faglig og personlig udvikling 
 
 Vi tilbyder dig 
 Hos Søren Enggaard A/S bliver du en del af en succesfuld virksomhed med en flad struktur og en åben, nærværende ledelsesstil. Du får mulighed for at præge din egen arbejdsdag og udvikle dine kompetencer i takt med virksomhedens vækst. 
 Vi tilbyder: 
 
 En attraktiv lønpakke baseret på dine kvalifikationer 
 Pensionsordning og sundhedsforsikring 
 Et erfarent og engageret team med et stærkt fællesskab 
 En arbejdsplads i konstant udvikling med plads til faglig vækst 
 
 Er du interesseret i at høre mere om jobbet, er du velkommen til at kontakte Sara Rosholm på telefon 30214515 eller mail: sro@matchmind.dk. 
 Vi glæder os til at høre fra dig! 
 Klik på ""Send ansøgning"" til højre, hvis du ønsker at komme i betragtning til dette job. Når du klikker på linket føres du automatisk over i MatchMinds system, hvor din ansøgning, CV og øvrige bilag kan uploades. Vi får automatisk besked, når materialet er uploadet. Det er vigtigt, at du følger denne fremgangsmåde, idet vi på denne måde kan tilbyde en langt bedre sikkerhed og dermed højere beskyttelse af dine personoplysninger, end hvis du eksempelvis sender dokumenterne i en usikret e-mail. Vi har ligeledes brug for dit samtykke til bl.a. at dele dine oplysninger med den virksomhed, vi rekrutterer på vegne af, og dette kan vi sikre ved, at du benytter ovennævnte fremgangsmåde. 
 
 Søren Enggaard A/S beskæftiger sig med køb, salg og udlejning af erhvervs- og boligejendomme samt ejendoms- og projektudvikling. De opfører fremtidsorienterede byggerier med fokus på kvalitet, spændende arkitektur og bæredygtighed kombineret med høje rationelle og funktionelle krav. Koncernen er i dag én af Nordjyllands største ejendomsselskaber. Én af deres styrker er en veluddannet og specialiseret stab af engagerede medarbejdere. Koncernen er velkonsolideret og ejer-ledet. 
 Se mere på  www.soren-enggaard.dk",Adelgade 9,58,Danmark,851,Aalborg,1,Nordjylland,9000,Aalborg,1,1,Fuldtid,None,None,1,,Ejendomsadministrator,0,"Ejendomsleder, 1505, 1506, 1507",0,0,False,"{'Email': 'sro@matchmind.dk', 'PersonName': 'Sara Rosholm', 'FirstName': 'Sara', 'LastName': 'Rosholm', 'PositionTitle': None, 'PhoneNumbers': [{'Number': '70702333', 'Type': 0, 'Description': 'Primary'}]}",,False,False,False,False,4,,,False,False,False,False,False,False,,,,,https://matchmind.dk/ledige-jobs?hr=show-job/238261&linkref=268815&locale=da_DK,False,2025-04-01T13:36:05+02:00,7,/CV/FindWork/GetLogo?JobAdId=4a4ae1df-389f-4f50-b649-4514ff741850&Organisation=26993210,"Adelgade 9,9000, Aalborg",True,False,/CV/Jobseeking/JobLog/CreateJobSearch?JobnetJobPostingIdentifier=4a4ae1df-389f-4f50-b649-4514ff741850&Company.Name=MatchMind A/S&SubmissionDeadlineDate=2025-4-1&Title=Økonomi- og ejendomsadministrator til Søren Enggaard A/S&WeeklyWorkTime=1,00000000-0000-0000-0000-000000000000,True,0,,,Økonomi- og ejendomsadministrator til Søren Enggaard A/S,True,,True,1,,4a4ae1df-389f-4f50-b649-4514ff741850,,,False,False,,0,False,MatchMind A/S,Adelgade 9,,,9000,False,False,False,Aalborg,Sara Rosholm,70702333,sro@matchmind.dk,,,,,False,,2025-04-01T13:36:05+02:00,,0,False,0,,,,,0,,,,False,False,,,False,False,,,,False,,False,,,Arbejdspladsen ligger i Aalborg kommune,False,MatchMind A/S,,None,,False,False,"Er du passioneret omkring ejendomsadministration og økonomi, og klar til at tage ansvar for en spændende portefølje af bolig- og erhvervslejemål? Vil du arbejde i en dynamisk og forretningsorienteret virksomhed, hvor dine kompetencer virkelig gør en forskel? Så er det dig, vi leder efter til Søren Enggaard A/S!

Om stillingen

Som økonomi- og ejend","""Er du passioneret omkring ejendomsadministration og økonomi, og klar til at tage ansvar for en spændende portefølje af bolig- og erhvervslejemål? Vil du arbejde i en dynamisk og forretningsorienteret virksomhed, hvor dine kompetencer virkelig gør en forskel? Så er det dig, vi leder efter til Søren Enggaard A/S!\n\nOm stillingen\n\nSom økonomi- og ejend""","""Økonomi- og ejendomsadministrator til Søren Enggaard A/S""","https://www.google.dk/maps/dir//Adelgade+9,9000,+Aalborg/","Er du passioneret omkring ejendomsadministration og økonomi, og klar til at tage ansvar for en spændende portefølje af bolig- og erhvervslejemål? Vil du arbejde i en dynamisk og forretningsorienteret virksomhed, hvor dine kompetencer virkelig gør en forskel? Så er det dig, vi leder efter til Søren Enggaard A/S!

 Om stillingen 
 Som økonomi- og ejendomsadministrator hos Søren Enggaard A/S får du en vigtig rolle i den daglige drift af en voksende portefølje af bolig- og erhvervslejemål. Du får et tæt samarbejde med den øvrige organisation og refererer direkte til den administrerende direktør, Carsten Enggaard. Med en portefølje i kraftig vækst vil du opleve et arbejdsmiljø fyldt med udviklingsmuligheder, hvor du samtidig får et indblik i ejendomsudvikling og byggeri, som styrker din faglige profil. 
 Dine ansvarsområder 
 Du får en varieret hverdag med mange spændende opgaver, herunder: 
 
 Håndtering af huslejeopkrævning og økonomisk administration  
 Afstemning af bankkonti, bogføring og registrering af kreditorfakturaer  
 Udarbejdelse af lejeaftaler med fokus på boliglejemål 
 Koordinering af ind- og udflytninger i boliglejemål 
 Udarbejdelse og opkrævning af fælles- og forbrugsregnskaber i samarbejde med eksterne leverandører 
 Løbende dialog og service overfor virksomhedens lejere 
 Diverse ad hoc-opgaver, der sikrer en effektiv drift 
 
 Hvem er du? 
 Vi søger en engageret og struktureret person med et skarpt øje for detaljer og en god forståelse for økonomi. Optimalt set har du en uddannelsesbaggrund inden for ejendomsadministration, men vi hører også gerne fra dig, hvis du har en anden relevant uddannelse og/eller erfaring. Har du erfaring med UNIK Bolig 4, er det et stort plus, men ikke et krav. 
 Det vigtigste er, at du: 
 
 Har en struktureret og selvstændig tilgang til opgaver 
 Er ansvarsbevidst og trives med at tage ejerskab 
 Er positiv, samarbejdsvillig og bidrager til et godt arbejdsmiljø 
 Er fleksibel og omstillingsparat i en virksomhed i konstant udvikling 
 Motiveres af faglig og personlig udvikling 
 
 Vi tilbyder dig 
 Hos Søren Enggaard A/S bliver du en del af en succesfuld virksomhed med en flad struktur og en åben, nærværende ledelsesstil. Du får mulighed for at præge din egen arbejdsdag og udvikle dine kompetencer i takt med virksomhedens vækst. 
 Vi tilbyder: 
 
 En attraktiv lønpakke baseret på dine kvalifikationer 
 Pensionsordning og sundhedsforsikring 
 Et erfarent og engageret team med et stærkt fællesskab 
 En arbejdsplads i konstant udvikling med plads til faglig vækst 
 
 Er du interesseret i at høre mere om jobbet, er du velkommen til at kontakte Sara Rosholm på telefon 30214515 eller mail: sro@matchmind.dk. 
 Vi glæder os til at høre fra dig! 
 Klik på ""Send ansøgning"" til højre, hvis du ønsker at komme i betragtning til dette job. Når du klikker på linket føres du automatisk over i MatchMinds system, hvor din ansøgning, CV og øvrige bilag kan uploades. Vi får automatisk besked, når materialet er uploadet. Det er vigtigt, at du følger denne fremgangsmåde, idet vi på denne måde kan tilbyde en langt bedre sikkerhed og dermed højere beskyttelse af dine personoplysninger, end hvis du eksempelvis sender dokumenterne i en usikret e-mail. Vi har ligeledes brug for dit samtykke til bl.a. at dele dine oplysninger med den virksomhed, vi rekrutterer på vegne af, og dette kan vi sikre ved, at du benytter ovennævnte fremgangsmåde. 
 
 Søren Enggaard A/S beskæftiger sig med køb, salg og udlejning af erhvervs- og boligejendomme samt ejendoms- og projektudvikling. De opfører fremtidsorienterede byggerier med fokus på kvalitet, spændende arkitektur og bæredygtighed kombineret med høje rationelle og funktionelle krav. Koncernen er i dag én af Nordjyllands største ejendomsselskaber. Én af deres styrker er en veluddannet og specialiseret stab af engagerede medarbejdere. Koncernen er velkonsolideret og ejer-ledet. 
 Se mere på  www.soren-enggaard.dk","https://www.google.dk/maps/place/Adelgade+9,9000,+Aalborg/",26993210,False,False,,False
