summary_AutomatchType,summary_Abroad,summary_Weight,summary_Title,summary_JobHeadline,summary_Presentation,summary_HiringOrgName,summary_WorkPlaceAddress,summary_WorkPlacePostalCode,summary_WorkPlaceCity,summary_WorkPlaceOtherAddress,summary_WorkPlaceAbroad,summary_WorkPlaceNotStatic,summary_UseWorkPlaceAddressForJoblog,summary_PostingCreated,summary_LastDateApplication,summary_FormattedLastDateApplication,summary_AssignmentStartDate,summary_IsHotjob,summary_IsExternal,summary_Url,summary_Region,summary_Municipality,summary_Country,summary_PostalCode,summary_PostalCodeName,summary_JobAnnouncementType,summary_EmploymentType,summary_WorkHours,summary_OccupationArea,summary_OccupationGroup,summary_Occupation,summary_Location_Latitude,summary_Location_Longitude,summary_JoblogWorkTime_WorkHour,summary_JoblogWorkTime_DailyWorkTime,summary_WorkplaceID,summary_OrganisationId,summary_HiringOrgCVR,summary_UserLoggedIn,summary_AnonymousEmployer,summary_ShareUrl,summary_DetailsUrl,summary_JobLogUrl,summary_HasLocationValues,summary_ID,summary_Latitude,summary_Longitude,details_WorkSchedule,details_WorkConditions,details_EmploymentTypes,details_WorkPlace_Name,details_WorkPlace_Address_AddressLine,details_WorkPlace_Address_Country_Id,details_WorkPlace_Address_Country_Name,details_WorkPlace_Address_Municipality_Id,details_WorkPlace_Address_Municipality_Name,details_WorkPlace_Address_Region_Id,details_WorkPlace_Address_Region_Name,details_WorkPlace_Address_PostalCode,details_WorkPlace_Address_City,details_WorkPlace_PhoneNumber_Number,details_WorkPlace_PhoneNumber_Type,details_WorkPlace_PhoneNumber_Description,details_WorkPlace_FaxNumber,details_WorkPlace_Email,details_WorkPlace_WebAddress,details_WorkPlace_Description,details_WorkPlace_Logo,details_WorkPlace_WorkPlaceOrganizationNumber,details_WorkPlace_OrganizationNumber,details_WorkPlace_OrganizationDescription,details_JobPositionPosting_Id,details_JobPositionPosting_OriginalJppId,details_JobPositionPosting_HiringOrg_Name,details_JobPositionPosting_HiringOrg_Address_AddressLine,details_JobPositionPosting_HiringOrg_Address_Country_Id,details_JobPositionPosting_HiringOrg_Address_Country_Name,details_JobPositionPosting_HiringOrg_Address_Municipality_Id,details_JobPositionPosting_HiringOrg_Address_Municipality_Name,details_JobPositionPosting_HiringOrg_Address_Region_Id,details_JobPositionPosting_HiringOrg_Address_Region_Name,details_JobPositionPosting_HiringOrg_Address_PostalCode,details_JobPositionPosting_HiringOrg_Address_City,details_JobPositionPosting_HiringOrg_PhoneNumber_Number,details_JobPositionPosting_HiringOrg_PhoneNumber_Type,details_JobPositionPosting_HiringOrg_PhoneNumber_Description,details_JobPositionPosting_HiringOrg_FaxNumber,details_JobPositionPosting_HiringOrg_Email,details_JobPositionPosting_HiringOrg_WebAddress,details_JobPositionPosting_HiringOrg_Description,details_JobPositionPosting_HiringOrg_Logo,details_JobPositionPosting_HiringOrg_WorkPlaceOrganizationNumber,details_JobPositionPosting_HiringOrg_OrganizationNumber,details_JobPositionPosting_HiringOrg_OrganizationDescription,details_JobPositionPosting_RecruitingCompany,details_JobPositionPosting_PublicationStartDate,details_JobPositionPosting_PublicationEndDate,details_JobPositionPosting_JobPositionInformation_PositionTitle,details_JobPositionPosting_JobPositionInformation_Purpose,details_JobPositionPosting_JobPositionInformation_WorkLocation_AddressLine,details_JobPositionPosting_JobPositionInformation_WorkLocation_Country_Id,details_JobPositionPosting_JobPositionInformation_WorkLocation_Country_Name,details_JobPositionPosting_JobPositionInformation_WorkLocation_Municipality_Id,details_JobPositionPosting_JobPositionInformation_WorkLocation_Municipality_Name,details_JobPositionPosting_JobPositionInformation_WorkLocation_Region_Id,details_JobPositionPosting_JobPositionInformation_WorkLocation_Region_Name,details_JobPositionPosting_JobPositionInformation_WorkLocation_PostalCode,details_JobPositionPosting_JobPositionInformation_WorkLocation_City,details_JobPositionPosting_JobPositionInformation_EmploymentType,details_JobPositionPosting_JobPositionInformation_WeeklyWorkHours_TypeId,details_JobPositionPosting_JobPositionInformation_WeeklyWorkHours_TypeName,details_JobPositionPosting_JobPositionInformation_WeeklyWorkHours_Description,details_JobPositionPosting_JobPositionInformation_CompensationDescription,details_JobPositionPosting_JobPositionInformation_NumberToFill,details_JobPositionPosting_JobPositionInformation_DriverLicense,details_JobPositionPosting_JobPositionInformation_Occupation_DiscoWeb,details_JobPositionPosting_JobPositionInformation_Occupation_AlternateNames,details_JobPositionPosting_JobPositionInformation_Occupation_GroupId,details_JobPositionPosting_JobPositionInformation_Occupation_AreaId,details_JobPositionPosting_JobPositionInformation_Occupation_Id,details_JobPositionPosting_JobPositionInformation_Occupation_Name,details_JobPositionPosting_JobPositionInformation_IsGovernmentHiring,details_JobPositionPosting_JobPositionInformation_JppContacts,details_JobPositionPosting_JobPositionInformation_EmploymentDate,details_JobPositionPosting_IsRecruitmentOfForeignNationals,details_JobPositionPosting_IsWorkInDenmark,details_JobPositionPosting_IsAnonymousEmployer,details_JobPositionPosting_IsDisabilityFriendly,details_JobPositionPosting_JppType,details_JobPositionPosting_ApplicationDetails_WorkHourMax,details_JobPositionPosting_ApplicationDetails_WorkHourMin,details_JobPositionPosting_ApplicationDetails_DailyWorkTimeWeekend,details_JobPositionPosting_ApplicationDetails_DailyWorkTimeNight,details_JobPositionPosting_ApplicationDetails_DailyWorkTimeEvening,details_JobPositionPosting_ApplicationDetails_DailyWorkTimeDay,details_JobPositionPosting_ApplicationDetails_ReferenceText,details_JobPositionPosting_ApplicationDetails_RemarksToApplicant,details_JobPositionPosting_ApplicationDetails_ByEmail,details_JobPositionPosting_ApplicationDetails_ByPhone,details_JobPositionPosting_ApplicationDetails_ApplyViaUrl,details_JobPositionPosting_ApplicationDetails_ReplyInWriting,details_JobPositionPosting_ApplicationDetails_ApplicationDeadlineDate,details_JobPositionPosting_ContactAuthorityPhoneNumber_Number,details_JobPositionPosting_ContactAuthorityPhoneNumber_Type,details_JobPositionPosting_ContactAuthorityPhoneNumber_Description,details_JobPositionPosting_Status,details_LogoUrl,details_Address,details_ShowMap,details_ShowShareButtonJobLog,details_JobLogUrl,details_JobLogTemplateModel_Identifier,details_JobLogTemplateModel_UseWorkPlaceAddressForJoblog,details_JobLogTemplateModel_Category,details_JobLogTemplateModel_CvCustomerIdentifier,details_JobLogTemplateModel_JobSeekingStatus,details_JobLogTemplateModel_Title,details_JobLogTemplateModel_IsApplicationSourceRequired,details_JobLogTemplateModel_ApplicationSource,details_JobLogTemplateModel_IsWeeklyWorkTimeRequired,details_JobLogTemplateModel_WeeklyWorkTime,details_JobLogTemplateModel_HoursPerWeek,details_JobLogTemplateModel_JobnetJobPostingIdentifier,details_JobLogTemplateModel_JobAdDocument_Title,details_JobLogTemplateModel_JobAdDocument_Identifier,details_JobLogTemplateModel_JobAdDocument_IsDeletedBySystem,details_JobLogTemplateModel_JobAdDocument_IsDeletedByUser,details_JobLogTemplateModel_JobAdFile,details_JobLogTemplateModel_Company_JobLogEntryCategory,details_JobLogTemplateModel_Company_ShowAddressFieldsEvenIfEmpty,details_JobLogTemplateModel_Company_Name,details_JobLogTemplateModel_Company_Address,details_JobLogTemplateModel_Company_Country,details_JobLogTemplateModel_Company_EmploymentAreaID,details_JobLogTemplateModel_Company_PostCode,details_JobLogTemplateModel_Company_IsCountryAndTownAndPostCodeEmpty,details_JobLogTemplateModel_Company_IsTownAndPostCodeEmpty,details_JobLogTemplateModel_Company_IsCountryDanmark,details_JobLogTemplateModel_Company_Town,details_JobLogTemplateModel_Company_ContactPerson,details_JobLogTemplateModel_Company_Phone,details_JobLogTemplateModel_Company_Email,details_JobLogTemplateModel_Company_Latitude,details_JobLogTemplateModel_Company_Longitude,details_JobLogTemplateModel_Company_DailyTravelTimeInMinutes,details_JobLogTemplateModel_Company_DistanceToCompanyInMeters,details_JobLogTemplateModel_Company_IsCreateMode,details_JobLogTemplateModel_TypeOfSubmission,details_JobLogTemplateModel_SubmissionDate,details_JobLogTemplateModel_SubmissionDateFormatted,details_JobLogTemplateModel_SubmissionDateTiks,details_JobLogTemplateModel_IsSubmissionDateRequired,details_JobLogTemplateModel_Status,details_JobLogTemplateModel_DateCreatedFormatted,details_JobLogTemplateModel_DateCreated,details_JobLogTemplateModel_DateModifiedFormatted,details_JobLogTemplateModel_DateModified,details_JobLogTemplateModel_LastModifiedDateTiks,details_JobLogTemplateModel_DateClosed,details_JobLogTemplateModel_JobApplicationDocument_Title,details_JobLogTemplateModel_JobApplicationDocument_Identifier,details_JobLogTemplateModel_JobApplicationDocument_IsDeletedBySystem,details_JobLogTemplateModel_JobApplicationDocument_IsDeletedByUser,details_JobLogTemplateModel_CvDocument_Title,details_JobLogTemplateModel_CvDocument_Identifier,details_JobLogTemplateModel_CvDocument_IsDeletedBySystem,details_JobLogTemplateModel_CvDocument_IsDeletedByUser,details_JobLogTemplateModel_JobApplicationFile,details_JobLogTemplateModel_CvFile,details_JobLogTemplateModel_SubmissionDeadlineDate,details_JobLogTemplateModel_IsPersisted,details_JobLogTemplateModel_ServerValidationErrors,details_JobLogTemplateModel_HasServerValidationErrors,details_JoblogWorkTime_WorkHour,details_JoblogWorkTime_DailyWorkTime,details_Place,details_OpenPrintDialog,details_WorkPlaceInfoText,details_JobCenterContactDetails,details_WorkPlaceDescriptionText,details_FavoriteText,details_IsFavorite,details_ShowFavorite,details_MetaOgTextForSharing,details_DescriptionForSharing,details_TitleForSharing,details_RutePlan,details_FormattedPurpose,details_MapUrl,details_OrganizationNumber,details_ShowSearchJobButton,details_ShowPrint,details_BackToFindWorkButtonUrl,isExternal
0,False,1,Tandplejer med holdånd der ønsker at lære mere søges.,Tandplejer med holdånd der ønsker at lære mere søges.,"Ønsker du dig en støttende chef og patienter du kan give den bedst mulige behandling?  
Ønsker du at lære mere?  Via sparring med ligesindede kollegaer og spændende kurser. 
Du må hel",TANDLÆGE ANDREA GROTH ApS,Vestergade 44,5000,Odense C,False,False,False,True,2022-03-17T00:00:00,2022-05-10T00:00:00,10. maj 2022,0001-01-01T00:00:00,False,False,https://job.jobnet.dk/CV/FindWork/Details/5467247,Syddanmark,Odense,Danmark,5000,,,,Deltid,"Sundhed, omsorg og personlig pleje",Tandklinikarbejde,Tandplejer,55.3953,10.3851,(15 - 30 timer ugentligt),,132600,116348,36538376,False,False,https://job.jobnet.dk/CV/FindWork/DetailsSocialmedia/5467247,https://job.jobnet.dk/CV/FindWork/Details/5467247,https://job.jobnet.dk/CV/FindWork/Details/5467247,True,5467247,55.3953,10.3851,"{'Id': 1, 'Name': 'Fuldtid'}, {'Id': 16, 'Name': 'Deltid'}","{'Id': 1, 'Name': 'Almindelige vilkår'}, {'Id': 2, 'Name': 'Fleksjob'}, {'Id': 3, 'Name': 'Skånejob'}, {'Id': 4, 'Name': 'Egnet til efterlønnere og seniorer'}, {'Id': 5, 'Name': 'Job med løntilskud'}, {'Id': 6, 'Name': 'Rotationsjob'}, {'Id': 7, 'Name': 'Virksomhedspraktik'}","{'Id': 1, 'Name': 'Fastansættelse'}, {'Id': 16, 'Name': 'Tidsbegrænset ansættelse'}",TANDLÆGE ANDREA GROTH ApS,Vestergade 44,58,Danmark,461,Odense,3,Syddanmark,5000,Odense C,,0,Primary,,,,None,,1020143890,36538376,None,5467247,5467247,TANDLÆGE ANDREA GROTH ApS,Vestergade 44,58,Danmark,461,Odense,3,Syddanmark,5000,Odense C,,0,Primary,,,,None,,1020143890,36538376,None,,2022-03-17T00:00:00,2022-05-10T00:00:00,Tandplejer med holdånd der ønsker at lære mere søges.,"Ønsker du dig en støttende chef og patienter du kan give den bedst mulige behandling?   
 Ønsker du at lære mere?  Via sparring med ligesindede kollegaer og spændende kurser.  
 Du må hellere læse videre.  
   
 Om os   
 Vores klinik ligger midt i Odense. Dine kommende kollegaer vil bestå af tandlæge Andrea Groth, tandplejer Maria og tre hjælpsomme klinikassistenter. Vores mål er via empati og høj kompetence, altid at give vores patienter den rette tandbehandling.   
 Vi har en meget åben form for kommunikation både blandt kollegaer, men ligeledes med vores patienter og inddrager altid patienterne i deres behandling. Vi holder ugentligt personalemøde, hvor vi gennemgår aktuelle emner, f.eks patientforløb, endo, pa-behandling, laser eller andet. Vi arbejder tæt sammen med andre faggrupper både på Fyn og andre steder i landet for at sikre patienterne den bedste behandling.  
 Vi holder os orienteret om nyeste og bedste uddannelser i og uden for Danmark på alle felter, OR, endo, laser, kirurgi og andet.  
 Vores teamspirit er vigtig for os, så vi sørger for, at vi altid har sjove ting i kalenderen og hvert år har vi en sommerfest og en julefrokost. Sidste år gik sommerfesten til Sydsverige og julefesten fejrede vi med koncert til QueenMachine med efterfølgende overnatning i Greve.  
 Klinikken har fire lyse rum indrettet med nyere units. Der er ca. 2800 aktive patienter tilknyttet klinikken. Du kommer til at bruge en 940nm diodelaser til behandling og forebyggelse når du er klar. Visionen for klinikken er, at høste gode oplevelser og glade patienter, derfor vægter vi kundetilfredshed meget højt på klinikken, da vi har patienter der har været på klinikken i mere end 50 år og mange nye kommer til. Men vi når det kun hvis vi selv er glade på jobbet.  
   
 Om jobbet   
 Vi søger en ny kollega i en deltidsstilling på 2-4 dage om ugen, der elsker at være tandplejer. Ud over de almindelige tandplejeropgaver tror vi på delegation og gensidig tillid, så himlen er vores begrænsning. Ved behov tilbydes der klinikassistance.  
    
  Vi tilbyder   
 
 Et spændende arbejde i et patientorienteret miljø 
 En arbejdsplads midt i Odense. (Placeret inde i gågaden) 
 Dygtige og venlige kollegaer med drive 
 Rig mulighed for at fremme sin kunnen via kurser og sparring med ligesindede kollegaer 
 Indflydelse på egen dagligdag og patienter 
 Ugentlige personalemøde og skemalagt sparring med tandlægen  
 Sjove og spændende årlige sommerfester og julefrokoster. 
 
   
 Om dig   
 Der lægges vægt på, at du har teamånd og du værner om tandplejerens vigtige funktioner. Kemien på klinikken er vigtigere end årelang erfaring. Arbejdsglæde vægter mere end altid at have ret. Du ser glæden i at arbejde tværfagligt og kommunikerer respektfuldt med høj og lav.  
 Det forventes, at du:  
 
 Er en uddannet tandplejer 
 Prioriterer højt fagligt niveau med ønske om at lære mere 
 Ønsker at give patienterne en positiv tandlægeoplevelse 
 Du har et ønske om at lære mere igennem spændende kurser, som klinikken tilbyder at sende dig på. 
 Det er en fordel, at du har kendskab til DentalSuite, men ikke et krav. 
 Du ønsker at bidrage til din egen såvel som klinikkens udvikling 
 
 Kan du nikke genkendende til det meste af ovenstående?   
 Hvis ja, så er det dig vi mangler hos Odense Dental Klinik.  
   
 Ansøgning   
 For at søge stillingen skal du sende din motiverede ansøgning med CV til  rekruttering@kubeco.dk . Ønsker du at høre mere er du velkommen til at ringe på telefon:  77 34 33 22 .  
   
 Vi glæder os til at høre fra dig!",Vestergade 44,58,Danmark,461,Odense,3,Syddanmark,5000,Odense C,1,16,Deltid,None,None,1,,0,,0,0,0,,False,"{'Id': 7843139, 'Email': 'jebr@kubeco.dk', 'FaxNumber': None, 'PersonName': 'Jens Brinck', 'FirstName': 'Jens', 'LastName': 'Brinck', 'PositionTitle': 'Rekrutteringsansvarlig', 'PhoneNumbers': [{'Number': '77343322', 'Type': 0, 'Description': 'Hovednummer'}]}",,True,False,False,False,4,30,15,False,False,False,False,,,jebr@kubeco.dk,,,False,2022-05-10T00:00:00,,0,Primary,7,/CV/FindWork/GetLogo?JobAdId=5467247&Organisation=36538376,"Vestergade 44,5000, Odense C",True,False,/CV/Jobseeking/JobLog/CreateJobSearch?JobnetJobPostingIdentifier=5467247&Company.Name=TANDLÆGE ANDREA GROTH ApS&SubmissionDeadlineDate=2022-5-10&Title=Tandplejer med holdånd der ønsker at lære mere søges.&WeeklyWorkTime=2,00000000-0000-0000-0000-000000000000,False,0,,,Tandplejer med holdånd der ønsker at lære mere søges.,True,,True,2,,5467247,,,False,False,,0,False,TANDLÆGE ANDREA GROTH ApS,Vestergade 44,,,5000,False,False,False,Odense C,Jens Brinck,77343322,jebr@kubeco.dk,,,,,False,,2022-05-10T00:00:00,,0,False,0,,,,,0,,,,False,False,,,False,False,,,,False,,False,(15 - 30 timer ugentligt),,Arbejdspladsen ligger i Odense kommune,False,TANDLÆGE ANDREA GROTH ApS,,None,,False,False,"&Oslash;nskerdu dig en st&oslash;ttende chef og patienterdukangive den bedst mulige behandling?
&Oslash;nsker du at l&aelig;re mere?Viasparringmedligesindede kollegaer og sp&aelig;ndende kurser.
Du m&aring; hellere l&aelig;se videre.

Om os
Vores klinikliggermidtiOdense. Dine kommende kollegaer vil best&aring; af tandl&aelig;ge Andrea Groth, tandpl","""\u0026Oslash;nskerdu dig en st\u0026oslash;ttende chef og patienterdukangive den bedst mulige behandling?\n\u0026Oslash;nsker du at l\u0026aelig;re mere?Viasparringmedligesindede kollegaer og sp\u0026aelig;ndende kurser.\nDu m\u0026aring; hellere l\u0026aelig;se videre.\n\nOm os\nVores klinikliggermidtiOdense. Dine kommende kollegaer vil best\u0026aring; af tandl\u0026aelig;ge Andrea Groth, tandpl""","""Tandplejer med holdånd der ønsker at lære mere søges.""","https://www.google.dk/maps/dir//Vestergade+44,5000,+Odense+C/","Ønsker du dig en støttende chef og patienter du kan give den bedst mulige behandling?   
 Ønsker du at lære mere?  Via sparring med ligesindede kollegaer og spændende kurser.  
 Du må hellere læse videre.  
   
 Om os   
 Vores klinik ligger midt i Odense. Dine kommende kollegaer vil bestå af tandlæge Andrea Groth, tandplejer Maria og tre hjælpsomme klinikassistenter. Vores mål er via empati og høj kompetence, altid at give vores patienter den rette tandbehandling.   
 Vi har en meget åben form for kommunikation både blandt kollegaer, men ligeledes med vores patienter og inddrager altid patienterne i deres behandling. Vi holder ugentligt personalemøde, hvor vi gennemgår aktuelle emner, f.eks patientforløb, endo, pa-behandling, laser eller andet. Vi arbejder tæt sammen med andre faggrupper både på Fyn og andre steder i landet for at sikre patienterne den bedste behandling.  
 Vi holder os orienteret om nyeste og bedste uddannelser i og uden for Danmark på alle felter, OR, endo, laser, kirurgi og andet.  
 Vores teamspirit er vigtig for os, så vi sørger for, at vi altid har sjove ting i kalenderen og hvert år har vi en sommerfest og en julefrokost. Sidste år gik sommerfesten til Sydsverige og julefesten fejrede vi med koncert til QueenMachine med efterfølgende overnatning i Greve.  
 Klinikken har fire lyse rum indrettet med nyere units. Der er ca. 2800 aktive patienter tilknyttet klinikken. Du kommer til at bruge en 940nm diodelaser til behandling og forebyggelse når du er klar. Visionen for klinikken er, at høste gode oplevelser og glade patienter, derfor vægter vi kundetilfredshed meget højt på klinikken, da vi har patienter der har været på klinikken i mere end 50 år og mange nye kommer til. Men vi når det kun hvis vi selv er glade på jobbet.  
   
 Om jobbet   
 Vi søger en ny kollega i en deltidsstilling på 2-4 dage om ugen, der elsker at være tandplejer. Ud over de almindelige tandplejeropgaver tror vi på delegation og gensidig tillid, så himlen er vores begrænsning. Ved behov tilbydes der klinikassistance.  
    
  Vi tilbyder   
 
 Et spændende arbejde i et patientorienteret miljø 
 En arbejdsplads midt i Odense. (Placeret inde i gågaden) 
 Dygtige og venlige kollegaer med drive 
 Rig mulighed for at fremme sin kunnen via kurser og sparring med ligesindede kollegaer 
 Indflydelse på egen dagligdag og patienter 
 Ugentlige personalemøde og skemalagt sparring med tandlægen  
 Sjove og spændende årlige sommerfester og julefrokoster. 
 
   
 Om dig   
 Der lægges vægt på, at du har teamånd og du værner om tandplejerens vigtige funktioner. Kemien på klinikken er vigtigere end årelang erfaring. Arbejdsglæde vægter mere end altid at have ret. Du ser glæden i at arbejde tværfagligt og kommunikerer respektfuldt med høj og lav.  
 Det forventes, at du:  
 
 Er en uddannet tandplejer 
 Prioriterer højt fagligt niveau med ønske om at lære mere 
 Ønsker at give patienterne en positiv tandlægeoplevelse 
 Du har et ønske om at lære mere igennem spændende kurser, som klinikken tilbyder at sende dig på. 
 Det er en fordel, at du har kendskab til DentalSuite, men ikke et krav. 
 Du ønsker at bidrage til din egen såvel som klinikkens udvikling 
 
 Kan du nikke genkendende til det meste af ovenstående?   
 Hvis ja, så er det dig vi mangler hos Odense Dental Klinik.  
   
 Ansøgning   
 For at søge stillingen skal du sende din motiverede ansøgning med CV til  rekruttering@kubeco.dk . Ønsker du at høre mere er du velkommen til at ringe på telefon:  77 34 33 22 .  
   
 Vi glæder os til at høre fra dig!","https://www.google.dk/maps/place/Vestergade+44,5000,+Odense+C/",36538376,False,False,,False
