summary_AutomatchType,summary_Abroad,summary_Weight,summary_Title,summary_JobHeadline,summary_Presentation,summary_HiringOrgName,summary_WorkPlaceAddress,summary_WorkPlacePostalCode,summary_WorkPlaceCity,summary_WorkPlaceOtherAddress,summary_WorkPlaceAbroad,summary_WorkPlaceNotStatic,summary_UseWorkPlaceAddressForJoblog,summary_PostingCreated,summary_LastDateApplication,summary_FormattedLastDateApplication,summary_AssignmentStartDate,summary_IsHotjob,summary_IsExternal,summary_Url,summary_Region,summary_Municipality,summary_Country,summary_PostalCode,summary_PostalCodeName,summary_JobAnnouncementType,summary_EmploymentType,summary_WorkHours,summary_OccupationArea,summary_OccupationGroup,summary_Occupation,summary_Location_Latitude,summary_Location_Longitude,summary_JoblogWorkTime_WorkHour,summary_JoblogWorkTime_DailyWorkTime,summary_WorkplaceID,summary_OrganisationId,summary_HiringOrgCVR,summary_UserLoggedIn,summary_AnonymousEmployer,summary_ShareUrl,summary_DetailsUrl,summary_JobLogUrl,summary_HasLocationValues,summary_ID,summary_Latitude,summary_Longitude,details_WorkSchedule,details_WorkConditions,details_EmploymentTypes,details_WorkPlace_Name,details_WorkPlace_Address_AddressLine,details_WorkPlace_Address_Country_Id,details_WorkPlace_Address_Country_Name,details_WorkPlace_Address_Municipality_Id,details_WorkPlace_Address_Municipality_Name,details_WorkPlace_Address_Region_Id,details_WorkPlace_Address_Region_Name,details_WorkPlace_Address_PostalCode,details_WorkPlace_Address_City,details_WorkPlace_PhoneNumber_Number,details_WorkPlace_PhoneNumber_Type,details_WorkPlace_PhoneNumber_Description,details_WorkPlace_FaxNumber,details_WorkPlace_Email,details_WorkPlace_WebAddress,details_WorkPlace_Description,details_WorkPlace_Logo,details_WorkPlace_WorkPlaceOrganizationNumber,details_WorkPlace_OrganizationNumber,details_WorkPlace_OrganizationDescription,details_JobPositionPosting_Id,details_JobPositionPosting_OriginalJppId,details_JobPositionPosting_HiringOrg_Name,details_JobPositionPosting_HiringOrg_Address_AddressLine,details_JobPositionPosting_HiringOrg_Address_Country_Id,details_JobPositionPosting_HiringOrg_Address_Country_Name,details_JobPositionPosting_HiringOrg_Address_Municipality_Id,details_JobPositionPosting_HiringOrg_Address_Municipality_Name,details_JobPositionPosting_HiringOrg_Address_Region_Id,details_JobPositionPosting_HiringOrg_Address_Region_Name,details_JobPositionPosting_HiringOrg_Address_PostalCode,details_JobPositionPosting_HiringOrg_Address_City,details_JobPositionPosting_HiringOrg_PhoneNumber_Number,details_JobPositionPosting_HiringOrg_PhoneNumber_Type,details_JobPositionPosting_HiringOrg_PhoneNumber_Description,details_JobPositionPosting_HiringOrg_FaxNumber,details_JobPositionPosting_HiringOrg_Email,details_JobPositionPosting_HiringOrg_WebAddress,details_JobPositionPosting_HiringOrg_Description,details_JobPositionPosting_HiringOrg_Logo,details_JobPositionPosting_HiringOrg_WorkPlaceOrganizationNumber,details_JobPositionPosting_HiringOrg_OrganizationNumber,details_JobPositionPosting_HiringOrg_OrganizationDescription,details_JobPositionPosting_RecruitingCompany,details_JobPositionPosting_PublicationStartDate,details_JobPositionPosting_PublicationEndDate,details_JobPositionPosting_JobPositionInformation_PositionTitle,details_JobPositionPosting_JobPositionInformation_Purpose,details_JobPositionPosting_JobPositionInformation_WorkLocation_AddressLine,details_JobPositionPosting_JobPositionInformation_WorkLocation_Country_Id,details_JobPositionPosting_JobPositionInformation_WorkLocation_Country_Name,details_JobPositionPosting_JobPositionInformation_WorkLocation_Municipality_Id,details_JobPositionPosting_JobPositionInformation_WorkLocation_Municipality_Name,details_JobPositionPosting_JobPositionInformation_WorkLocation_Region_Id,details_JobPositionPosting_JobPositionInformation_WorkLocation_Region_Name,details_JobPositionPosting_JobPositionInformation_WorkLocation_PostalCode,details_JobPositionPosting_JobPositionInformation_WorkLocation_City,details_JobPositionPosting_JobPositionInformation_EmploymentType,details_JobPositionPosting_JobPositionInformation_WeeklyWorkHours_TypeId,details_JobPositionPosting_JobPositionInformation_WeeklyWorkHours_TypeName,details_JobPositionPosting_JobPositionInformation_WeeklyWorkHours_Description,details_JobPositionPosting_JobPositionInformation_CompensationDescription,details_JobPositionPosting_JobPositionInformation_NumberToFill,details_JobPositionPosting_JobPositionInformation_DriverLicense,details_JobPositionPosting_JobPositionInformation_Occupation_DiscoWeb,details_JobPositionPosting_JobPositionInformation_Occupation_AlternateNames,details_JobPositionPosting_JobPositionInformation_Occupation_GroupId,details_JobPositionPosting_JobPositionInformation_Occupation_AreaId,details_JobPositionPosting_JobPositionInformation_Occupation_Id,details_JobPositionPosting_JobPositionInformation_Occupation_Name,details_JobPositionPosting_JobPositionInformation_IsGovernmentHiring,details_JobPositionPosting_JobPositionInformation_JppContacts,details_JobPositionPosting_JobPositionInformation_EmploymentDate,details_JobPositionPosting_IsRecruitmentOfForeignNationals,details_JobPositionPosting_IsWorkInDenmark,details_JobPositionPosting_IsAnonymousEmployer,details_JobPositionPosting_IsDisabilityFriendly,details_JobPositionPosting_JppType,details_JobPositionPosting_ApplicationDetails_WorkHourMax,details_JobPositionPosting_ApplicationDetails_WorkHourMin,details_JobPositionPosting_ApplicationDetails_DailyWorkTimeWeekend,details_JobPositionPosting_ApplicationDetails_DailyWorkTimeNight,details_JobPositionPosting_ApplicationDetails_DailyWorkTimeEvening,details_JobPositionPosting_ApplicationDetails_DailyWorkTimeDay,details_JobPositionPosting_ApplicationDetails_ReferenceText,details_JobPositionPosting_ApplicationDetails_RemarksToApplicant,details_JobPositionPosting_ApplicationDetails_ByEmail,details_JobPositionPosting_ApplicationDetails_ByPhone,details_JobPositionPosting_ApplicationDetails_ApplyViaUrl,details_JobPositionPosting_ApplicationDetails_ReplyInWriting,details_JobPositionPosting_ApplicationDetails_ApplicationDeadlineDate,details_JobPositionPosting_ContactAuthorityPhoneNumber_Number,details_JobPositionPosting_ContactAuthorityPhoneNumber_Type,details_JobPositionPosting_ContactAuthorityPhoneNumber_Description,details_JobPositionPosting_Status,details_LogoUrl,details_Address,details_ShowMap,details_ShowShareButtonJobLog,details_JobLogUrl,details_JobLogTemplateModel_Identifier,details_JobLogTemplateModel_UseWorkPlaceAddressForJoblog,details_JobLogTemplateModel_Category,details_JobLogTemplateModel_CvCustomerIdentifier,details_JobLogTemplateModel_JobSeekingStatus,details_JobLogTemplateModel_Title,details_JobLogTemplateModel_IsApplicationSourceRequired,details_JobLogTemplateModel_ApplicationSource,details_JobLogTemplateModel_IsWeeklyWorkTimeRequired,details_JobLogTemplateModel_WeeklyWorkTime,details_JobLogTemplateModel_HoursPerWeek,details_JobLogTemplateModel_JobnetJobPostingIdentifier,details_JobLogTemplateModel_JobAdDocument_Title,details_JobLogTemplateModel_JobAdDocument_Identifier,details_JobLogTemplateModel_JobAdDocument_IsDeletedBySystem,details_JobLogTemplateModel_JobAdDocument_IsDeletedByUser,details_JobLogTemplateModel_JobAdFile,details_JobLogTemplateModel_Company_JobLogEntryCategory,details_JobLogTemplateModel_Company_ShowAddressFieldsEvenIfEmpty,details_JobLogTemplateModel_Company_Name,details_JobLogTemplateModel_Company_Address,details_JobLogTemplateModel_Company_Country,details_JobLogTemplateModel_Company_EmploymentAreaID,details_JobLogTemplateModel_Company_PostCode,details_JobLogTemplateModel_Company_IsCountryAndTownAndPostCodeEmpty,details_JobLogTemplateModel_Company_IsTownAndPostCodeEmpty,details_JobLogTemplateModel_Company_IsCountryDanmark,details_JobLogTemplateModel_Company_Town,details_JobLogTemplateModel_Company_ContactPerson,details_JobLogTemplateModel_Company_Phone,details_JobLogTemplateModel_Company_Email,details_JobLogTemplateModel_Company_Latitude,details_JobLogTemplateModel_Company_Longitude,details_JobLogTemplateModel_Company_DailyTravelTimeInMinutes,details_JobLogTemplateModel_Company_DistanceToCompanyInMeters,details_JobLogTemplateModel_Company_IsCreateMode,details_JobLogTemplateModel_TypeOfSubmission,details_JobLogTemplateModel_SubmissionDate,details_JobLogTemplateModel_SubmissionDateFormatted,details_JobLogTemplateModel_SubmissionDateTiks,details_JobLogTemplateModel_IsSubmissionDateRequired,details_JobLogTemplateModel_Status,details_JobLogTemplateModel_DateCreatedFormatted,details_JobLogTemplateModel_DateCreated,details_JobLogTemplateModel_DateModifiedFormatted,details_JobLogTemplateModel_DateModified,details_JobLogTemplateModel_LastModifiedDateTiks,details_JobLogTemplateModel_DateClosed,details_JobLogTemplateModel_JobApplicationDocument_Title,details_JobLogTemplateModel_JobApplicationDocument_Identifier,details_JobLogTemplateModel_JobApplicationDocument_IsDeletedBySystem,details_JobLogTemplateModel_JobApplicationDocument_IsDeletedByUser,details_JobLogTemplateModel_CvDocument_Title,details_JobLogTemplateModel_CvDocument_Identifier,details_JobLogTemplateModel_CvDocument_IsDeletedBySystem,details_JobLogTemplateModel_CvDocument_IsDeletedByUser,details_JobLogTemplateModel_JobApplicationFile,details_JobLogTemplateModel_CvFile,details_JobLogTemplateModel_SubmissionDeadlineDate,details_JobLogTemplateModel_IsPersisted,details_JobLogTemplateModel_ServerValidationErrors,details_JobLogTemplateModel_HasServerValidationErrors,details_JoblogWorkTime_WorkHour,details_JoblogWorkTime_DailyWorkTime,details_Place,details_OpenPrintDialog,details_WorkPlaceInfoText,details_JobCenterContactDetails,details_WorkPlaceDescriptionText,details_FavoriteText,details_IsFavorite,details_ShowFavorite,details_MetaOgTextForSharing,details_DescriptionForSharing,details_TitleForSharing,details_RutePlan,details_FormattedPurpose,details_MapUrl,details_OrganizationNumber,details_ShowSearchJobButton,details_ShowPrint,details_BackToFindWorkButtonUrl,isExternal
0,False,1,Kokkeelev eller voksenelev søges,Kokkeelev eller voksenelev søges,Ønsker du at være en del af et dynamisk team med gode arbejdsforhold og godt kammeratskab? Så send din ansøgning til os. Vi beskæftiger omkring 28 faste medarbejdere og mange erfarne løsarbejdere. ,Fjelsted Skov Hotel & Konference I/S,Store Landevej 92,5592,Ejby,False,False,False,True,2022-05-04T00:00:00,2022-06-29T00:00:00,29. juni 2022,0001-01-01T00:00:00,False,False,https://job.jobnet.dk/CV/FindWork/Details/5468581,Syddanmark,Middelfart,Danmark,5592,,,,Fuldtid,Elever,"Hotel, restauration, køkken, kantine ",Kokkeelev,55.4448,9.9876,,"Dag, aften, weekend",85464,79254,32487998,False,False,https://job.jobnet.dk/CV/FindWork/DetailsSocialmedia/5468581,https://job.jobnet.dk/CV/FindWork/Details/5468581,https://job.jobnet.dk/CV/FindWork/Details/5468581,True,5468581,55.4448,9.9876,"{'Id': 1, 'Name': 'Fuldtid'}, {'Id': 16, 'Name': 'Deltid'}","{'Id': 1, 'Name': 'Almindelige vilkår'}, {'Id': 2, 'Name': 'Fleksjob'}, {'Id': 3, 'Name': 'Skånejob'}, {'Id': 4, 'Name': 'Egnet til efterlønnere og seniorer'}, {'Id': 5, 'Name': 'Job med løntilskud'}, {'Id': 6, 'Name': 'Rotationsjob'}, {'Id': 7, 'Name': 'Virksomhedspraktik'}","{'Id': 1, 'Name': 'Fastansættelse'}, {'Id': 16, 'Name': 'Tidsbegrænset ansættelse'}",Fjelsted Skov Hotel & Konference I/S,Store Landevej 92,58,Danmark,410,Middelfart,3,Syddanmark,5592,Ejby,,0,Primary,,,,"Vi har rod i det danske, hjemmelavede køkken. Vi sylter selv, vi røger selv og vi bager selv med egen surdej. Bag kroen har vi vores egne lam og grise som også anvendes i køkkenet. Vores service er i øjenhøjde, men professionel og vi gør alt for at vores gæsters arrangementer lykkes med det bedst opnåelige resultat. Det er vigtigt for os, at værne om fællesskabet på kroen blandt medarbejdere. Vi har 78 dobbeltværelse og 12 plenumlokaler.",85464,1015631224,32487998,"Vi har rod i det danske, hjemmelavede køkken. Vi sylter og røger selv og vi bager selv med egen surdej. Vores service er i øjenhøjde, men professionel og vi gør alt for at vores gæsters arrangementer lykkes med det bedst opnåelige resultat. Det er vigtigt for os, at værne om fællesskabet blandt medarbejdere. Vi har 74 dobbeltværelse og 14 plenumlokaler.",5468581,5468581,Fjelsted Skov Hotel & Konference I/S,Store Landevej 92,58,Danmark,410,Middelfart,3,Syddanmark,5592,Ejby,,0,Primary,,,,"Vi har rod i det danske, hjemmelavede køkken. Vi sylter selv, vi røger selv og vi bager selv med egen surdej. Bag kroen har vi vores egne lam og grise som også anvendes i køkkenet. Vores service er i øjenhøjde, men professionel og vi gør alt for at vores gæsters arrangementer lykkes med det bedst opnåelige resultat. Det er vigtigt for os, at værne om fællesskabet på kroen blandt medarbejdere. Vi har 78 dobbeltværelse og 12 plenumlokaler.",85464,1015631224,32487998,"Vi har rod i det danske, hjemmelavede køkken. Vi sylter og røger selv og vi bager selv med egen surdej. Vores service er i øjenhøjde, men professionel og vi gør alt for at vores gæsters arrangementer lykkes med det bedst opnåelige resultat. Det er vigtigt for os, at værne om fællesskabet blandt medarbejdere. Vi har 74 dobbeltværelse og 14 plenumlokaler.",,2022-05-04T00:00:00,2022-06-29T00:00:00,Kokkeelev eller voksenelev søges,"Ønsker du at være en del af et dynamisk team med gode arbejdsforhold og godt kammeratskab? Så send din ansøgning til os. Vi beskæftiger omkring 28 faste medarbejdere og mange erfarne løsarbejdere. Stemningen hos os er uhøjtidelig, ambitiøs og professionel både hos personalet, men også blandt gæsterne. Vores daglige arbejde er meget alsidigt, idet vi har mange forskellige gæster, heriblandt private og virksomheder. 
   
 Vi har 14 moderne selskabs- og konferencelokaler udsmykket med lokal kunst, hvoraf det største kan rumme 200 konferencedeltagere. Derudover har vi 74 nutidigt indrettede dobbeltværelser til overnattende gæster. 
   
 Vores daglige fokus ligger på konference- og selskabsarrangementer samt vores Café i midten af Fjelsted Skov. Vi laver ærlig, hjemmelavet mad til alle vores gæster. Vi har rod i det danske køkken, men lader os gerne inspirere fra andre køkkener i verden. Vi er placeret i naturlige omgivelser med søer, skove og stier, og i vores folde hygger vores camerounfår og krondyr sig. Vi har netop anlagt en frugt- og bærhave, og vi stiler efter at anvende vores egenproduktion mest muligt i køkkenet. 
   
 Om sommeren har vi mange fritidsgæster fra især Norden, men også fra Tyskland. 
   
 Vi søger en ihærdig og ansvarsbevidst kokkeelev (eventuelt voksenelev), som kan bidrage med kreativitet og stabilitet i vores team. Vi tilbyder et sundt og velfungerende arbejdsmiljø, hvor der lægges vægt på de bløde værdier. Vi vægter vores medarbejderes familieliv højt og udviser gerne fleksibilitet i forbindelse med dit privatliv. Flere af vores medarbejdere har været ansat hos os i mere end 20 år. Vi har i øjeblikket 10 fastansatte kokke og tre elever ansat i køkkenet. Vi har et godt socialt sammenhold på tværs af vores forskellige faggrupper. 
   
 Du kan forvente, at vi engagerer os i dit uddannelsesforløb, og at du løbende vil få feedback på dit daglige arbejde af vores køkkenchef og køkkensouschef samt sparring i forhold til dit skoleforløb og eksamen. 
 Du vil få en fast vagtplan med fri hver anden weekend. Vi arbejder cirka 11 timer per vagt og arbejdstiden er typisk fra kl. 10 – 21. 
   
 Du lønnes efter HORESTAs overenskomst. 
   
 Vi glæder os til at modtage din ansøgning!",Store Landevej 92,58,Danmark,410,Middelfart,3,Syddanmark,5592,Ejby,1,1,Fuldtid,None,None,2,,0,,0,0,0,,False,"{'Id': 7957547, 'Email': 'kok@fjelstedskov.dk', 'FaxNumber': None, 'PersonName': 'Jakob Flarup', 'FirstName': 'Jakob', 'LastName': 'Flarup', 'PositionTitle': 'Køkkenchef', 'PhoneNumbers': [{'Number': '64881660', 'Type': 0, 'Description': 'Hovednummer'}]}",,True,False,False,False,4,,,True,False,True,True,,,kok@fjelstedskov.dk,,,False,2022-06-29T00:00:00,,0,Primary,7,/CV/FindWork/GetLogo?JobAdId=5468581&WorkPlace=85464&Organisation=32487998,"Store Landevej 92,5592, Ejby",True,False,/CV/Jobseeking/JobLog/CreateJobSearch?JobnetJobPostingIdentifier=5468581&Company.Name=Fjelsted Skov Hotel & Konference I/S&SubmissionDeadlineDate=2022-6-29&Title=Kokkeelev eller voksenelev søges&WeeklyWorkTime=1,00000000-0000-0000-0000-000000000000,False,0,,,Kokkeelev eller voksenelev søges,True,,True,1,,5468581,,,False,False,,0,False,Fjelsted Skov Hotel & Konference I/S,Store Landevej 92,,,5592,False,False,False,Ejby,Jakob Flarup,64881660,kok@fjelstedskov.dk,,,,,False,,2022-06-29T00:00:00,,0,False,0,,,,,0,,,,False,False,,,False,False,,,,False,,False,,"Dag, aften, weekend",Arbejdspladsen ligger i Middelfart kommune,False,Fjelsted Skov Hotel & Konference I/S,,"Vi har rod i det danske, hjemmelavede køkken. Vi sylter selv, vi røger selv og vi bager selv med egen surdej. Bag kroen har vi vores egne lam og grise som også anvendes i køkkenet. Vores service er i øjenhøjde, men professionel og vi gør alt for at vores gæsters arrangementer lykkes med det bedst opnåelige resultat. Det er vigtigt for os, at værne om fællesskabet på kroen blandt medarbejdere. Vi har 78 dobbeltværelse og 12 plenumlokaler.",,False,False,"&Oslash;nsker du at v&aelig;re en del af et dynamisk team med gode arbejdsforhold og godt kammeratskab? S&aring; send din ans&oslash;gning til os. Vi besk&aelig;ftiger omkring 28 faste medarbejdere og mange erfarne l&oslash;sarbejdere. Stemningen hos os er uh&oslash;jtidelig, ambiti&oslash;s og professionel b&aring;de hos personalet, men ogs&aring;","""\u0026Oslash;nsker du at v\u0026aelig;re en del af et dynamisk team med gode arbejdsforhold og godt kammeratskab? S\u0026aring; send din ans\u0026oslash;gning til os. Vi besk\u0026aelig;ftiger omkring 28 faste medarbejdere og mange erfarne l\u0026oslash;sarbejdere. Stemningen hos os er uh\u0026oslash;jtidelig, ambiti\u0026oslash;s og professionel b\u0026aring;de hos personalet, men ogs\u0026aring;""","""Kokkeelev eller voksenelev søges""","https://www.google.dk/maps/dir//Store+Landevej+92,5592,+Ejby/","Ønsker du at være en del af et dynamisk team med gode arbejdsforhold og godt kammeratskab? Så send din ansøgning til os. Vi beskæftiger omkring 28 faste medarbejdere og mange erfarne løsarbejdere. Stemningen hos os er uhøjtidelig, ambitiøs og professionel både hos personalet, men også blandt gæsterne. Vores daglige arbejde er meget alsidigt, idet vi har mange forskellige gæster, heriblandt private og virksomheder. 
   
 Vi har 14 moderne selskabs- og konferencelokaler udsmykket med lokal kunst, hvoraf det største kan rumme 200 konferencedeltagere. Derudover har vi 74 nutidigt indrettede dobbeltværelser til overnattende gæster. 
   
 Vores daglige fokus ligger på konference- og selskabsarrangementer samt vores Café i midten af Fjelsted Skov. Vi laver ærlig, hjemmelavet mad til alle vores gæster. Vi har rod i det danske køkken, men lader os gerne inspirere fra andre køkkener i verden. Vi er placeret i naturlige omgivelser med søer, skove og stier, og i vores folde hygger vores camerounfår og krondyr sig. Vi har netop anlagt en frugt- og bærhave, og vi stiler efter at anvende vores egenproduktion mest muligt i køkkenet. 
   
 Om sommeren har vi mange fritidsgæster fra især Norden, men også fra Tyskland. 
   
 Vi søger en ihærdig og ansvarsbevidst kokkeelev (eventuelt voksenelev), som kan bidrage med kreativitet og stabilitet i vores team. Vi tilbyder et sundt og velfungerende arbejdsmiljø, hvor der lægges vægt på de bløde værdier. Vi vægter vores medarbejderes familieliv højt og udviser gerne fleksibilitet i forbindelse med dit privatliv. Flere af vores medarbejdere har været ansat hos os i mere end 20 år. Vi har i øjeblikket 10 fastansatte kokke og tre elever ansat i køkkenet. Vi har et godt socialt sammenhold på tværs af vores forskellige faggrupper. 
   
 Du kan forvente, at vi engagerer os i dit uddannelsesforløb, og at du løbende vil få feedback på dit daglige arbejde af vores køkkenchef og køkkensouschef samt sparring i forhold til dit skoleforløb og eksamen. 
 Du vil få en fast vagtplan med fri hver anden weekend. Vi arbejder cirka 11 timer per vagt og arbejdstiden er typisk fra kl. 10 – 21. 
   
 Du lønnes efter HORESTAs overenskomst. 
   
 Vi glæder os til at modtage din ansøgning!","https://www.google.dk/maps/place/Store+Landevej+92,5592,+Ejby/",32487998,False,False,,False
