summary_AutomatchType,summary_Abroad,summary_Weight,summary_Title,summary_JobHeadline,summary_Presentation,summary_HiringOrgName,summary_WorkPlaceAddress,summary_WorkPlacePostalCode,summary_WorkPlaceCity,summary_WorkPlaceOtherAddress,summary_WorkPlaceAbroad,summary_WorkPlaceNotStatic,summary_UseWorkPlaceAddressForJoblog,summary_PostingCreated,summary_LastDateApplication,summary_FormattedLastDateApplication,summary_AssignmentStartDate,summary_IsHotjob,summary_IsExternal,summary_Url,summary_Region,summary_Municipality,summary_Country,summary_PostalCode,summary_PostalCodeName,summary_JobAnnouncementType,summary_EmploymentType,summary_WorkHours,summary_OccupationArea,summary_OccupationGroup,summary_Occupation,summary_Location_Latitude,summary_Location_Longitude,summary_JoblogWorkTime_WorkHour,summary_JoblogWorkTime_DailyWorkTime,summary_WorkplaceID,summary_OrganisationId,summary_HiringOrgCVR,summary_UserLoggedIn,summary_AnonymousEmployer,summary_ShareUrl,summary_DetailsUrl,summary_JobLogUrl,summary_HasLocationValues,summary_ID,summary_Latitude,summary_Longitude,details_WorkSchedule,details_WorkConditions,details_EmploymentTypes,details_WorkPlace_Name,details_WorkPlace_Address_AddressLine,details_WorkPlace_Address_Country_Id,details_WorkPlace_Address_Country_Name,details_WorkPlace_Address_Municipality_Id,details_WorkPlace_Address_Municipality_Name,details_WorkPlace_Address_Region_Id,details_WorkPlace_Address_Region_Name,details_WorkPlace_Address_PostalCode,details_WorkPlace_Address_City,details_WorkPlace_PhoneNumber_Number,details_WorkPlace_PhoneNumber_Type,details_WorkPlace_PhoneNumber_Description,details_WorkPlace_FaxNumber,details_WorkPlace_Email,details_WorkPlace_WebAddress,details_WorkPlace_Description,details_WorkPlace_Logo,details_WorkPlace_WorkPlaceOrganizationNumber,details_WorkPlace_OrganizationNumber,details_WorkPlace_OrganizationDescription,details_JobPositionPosting_Id,details_JobPositionPosting_OriginalJppId,details_JobPositionPosting_HiringOrg_Name,details_JobPositionPosting_HiringOrg_Address_AddressLine,details_JobPositionPosting_HiringOrg_Address_Country_Id,details_JobPositionPosting_HiringOrg_Address_Country_Name,details_JobPositionPosting_HiringOrg_Address_Municipality_Id,details_JobPositionPosting_HiringOrg_Address_Municipality_Name,details_JobPositionPosting_HiringOrg_Address_Region_Id,details_JobPositionPosting_HiringOrg_Address_Region_Name,details_JobPositionPosting_HiringOrg_Address_PostalCode,details_JobPositionPosting_HiringOrg_Address_City,details_JobPositionPosting_HiringOrg_PhoneNumber_Number,details_JobPositionPosting_HiringOrg_PhoneNumber_Type,details_JobPositionPosting_HiringOrg_PhoneNumber_Description,details_JobPositionPosting_HiringOrg_FaxNumber,details_JobPositionPosting_HiringOrg_Email,details_JobPositionPosting_HiringOrg_WebAddress,details_JobPositionPosting_HiringOrg_Description,details_JobPositionPosting_HiringOrg_Logo,details_JobPositionPosting_HiringOrg_WorkPlaceOrganizationNumber,details_JobPositionPosting_HiringOrg_OrganizationNumber,details_JobPositionPosting_HiringOrg_OrganizationDescription,details_JobPositionPosting_RecruitingCompany,details_JobPositionPosting_PublicationStartDate,details_JobPositionPosting_PublicationEndDate,details_JobPositionPosting_JobPositionInformation_PositionTitle,details_JobPositionPosting_JobPositionInformation_Purpose,details_JobPositionPosting_JobPositionInformation_WorkLocation_AddressLine,details_JobPositionPosting_JobPositionInformation_WorkLocation_Country_Id,details_JobPositionPosting_JobPositionInformation_WorkLocation_Country_Name,details_JobPositionPosting_JobPositionInformation_WorkLocation_Municipality_Id,details_JobPositionPosting_JobPositionInformation_WorkLocation_Municipality_Name,details_JobPositionPosting_JobPositionInformation_WorkLocation_Region_Id,details_JobPositionPosting_JobPositionInformation_WorkLocation_Region_Name,details_JobPositionPosting_JobPositionInformation_WorkLocation_PostalCode,details_JobPositionPosting_JobPositionInformation_WorkLocation_City,details_JobPositionPosting_JobPositionInformation_EmploymentType,details_JobPositionPosting_JobPositionInformation_WeeklyWorkHours_TypeId,details_JobPositionPosting_JobPositionInformation_WeeklyWorkHours_TypeName,details_JobPositionPosting_JobPositionInformation_WeeklyWorkHours_Description,details_JobPositionPosting_JobPositionInformation_CompensationDescription,details_JobPositionPosting_JobPositionInformation_NumberToFill,details_JobPositionPosting_JobPositionInformation_DriverLicense,details_JobPositionPosting_JobPositionInformation_Occupation_DiscoWeb,details_JobPositionPosting_JobPositionInformation_Occupation_AlternateNames,details_JobPositionPosting_JobPositionInformation_Occupation_GroupId,details_JobPositionPosting_JobPositionInformation_Occupation_AreaId,details_JobPositionPosting_JobPositionInformation_Occupation_Id,details_JobPositionPosting_JobPositionInformation_Occupation_Name,details_JobPositionPosting_JobPositionInformation_IsGovernmentHiring,details_JobPositionPosting_JobPositionInformation_JppContacts,details_JobPositionPosting_JobPositionInformation_EmploymentDate,details_JobPositionPosting_IsRecruitmentOfForeignNationals,details_JobPositionPosting_IsWorkInDenmark,details_JobPositionPosting_IsAnonymousEmployer,details_JobPositionPosting_IsDisabilityFriendly,details_JobPositionPosting_JppType,details_JobPositionPosting_ApplicationDetails_WorkHourMax,details_JobPositionPosting_ApplicationDetails_WorkHourMin,details_JobPositionPosting_ApplicationDetails_DailyWorkTimeWeekend,details_JobPositionPosting_ApplicationDetails_DailyWorkTimeNight,details_JobPositionPosting_ApplicationDetails_DailyWorkTimeEvening,details_JobPositionPosting_ApplicationDetails_DailyWorkTimeDay,details_JobPositionPosting_ApplicationDetails_ReferenceText,details_JobPositionPosting_ApplicationDetails_RemarksToApplicant,details_JobPositionPosting_ApplicationDetails_ByEmail,details_JobPositionPosting_ApplicationDetails_ByPhone,details_JobPositionPosting_ApplicationDetails_ApplyViaUrl,details_JobPositionPosting_ApplicationDetails_ReplyInWriting,details_JobPositionPosting_ApplicationDetails_ApplicationDeadlineDate,details_JobPositionPosting_ContactAuthorityPhoneNumber_Number,details_JobPositionPosting_ContactAuthorityPhoneNumber_Type,details_JobPositionPosting_ContactAuthorityPhoneNumber_Description,details_JobPositionPosting_Status,details_LogoUrl,details_Address,details_ShowMap,details_ShowShareButtonJobLog,details_JobLogUrl,details_JobLogTemplateModel_Identifier,details_JobLogTemplateModel_UseWorkPlaceAddressForJoblog,details_JobLogTemplateModel_Category,details_JobLogTemplateModel_CvCustomerIdentifier,details_JobLogTemplateModel_JobSeekingStatus,details_JobLogTemplateModel_Title,details_JobLogTemplateModel_IsApplicationSourceRequired,details_JobLogTemplateModel_ApplicationSource,details_JobLogTemplateModel_IsWeeklyWorkTimeRequired,details_JobLogTemplateModel_WeeklyWorkTime,details_JobLogTemplateModel_HoursPerWeek,details_JobLogTemplateModel_JobnetJobPostingIdentifier,details_JobLogTemplateModel_JobAdDocument_Title,details_JobLogTemplateModel_JobAdDocument_Identifier,details_JobLogTemplateModel_JobAdDocument_IsDeletedBySystem,details_JobLogTemplateModel_JobAdDocument_IsDeletedByUser,details_JobLogTemplateModel_JobAdFile,details_JobLogTemplateModel_Company_JobLogEntryCategory,details_JobLogTemplateModel_Company_ShowAddressFieldsEvenIfEmpty,details_JobLogTemplateModel_Company_Name,details_JobLogTemplateModel_Company_Address,details_JobLogTemplateModel_Company_Country,details_JobLogTemplateModel_Company_EmploymentAreaID,details_JobLogTemplateModel_Company_PostCode,details_JobLogTemplateModel_Company_IsCountryAndTownAndPostCodeEmpty,details_JobLogTemplateModel_Company_IsTownAndPostCodeEmpty,details_JobLogTemplateModel_Company_IsCountryDanmark,details_JobLogTemplateModel_Company_Town,details_JobLogTemplateModel_Company_ContactPerson,details_JobLogTemplateModel_Company_Phone,details_JobLogTemplateModel_Company_Email,details_JobLogTemplateModel_Company_Latitude,details_JobLogTemplateModel_Company_Longitude,details_JobLogTemplateModel_Company_DailyTravelTimeInMinutes,details_JobLogTemplateModel_Company_DistanceToCompanyInMeters,details_JobLogTemplateModel_Company_IsCreateMode,details_JobLogTemplateModel_TypeOfSubmission,details_JobLogTemplateModel_SubmissionDate,details_JobLogTemplateModel_SubmissionDateFormatted,details_JobLogTemplateModel_SubmissionDateTiks,details_JobLogTemplateModel_IsSubmissionDateRequired,details_JobLogTemplateModel_Status,details_JobLogTemplateModel_DateCreatedFormatted,details_JobLogTemplateModel_DateCreated,details_JobLogTemplateModel_DateModifiedFormatted,details_JobLogTemplateModel_DateModified,details_JobLogTemplateModel_LastModifiedDateTiks,details_JobLogTemplateModel_DateClosed,details_JobLogTemplateModel_JobApplicationDocument_Title,details_JobLogTemplateModel_JobApplicationDocument_Identifier,details_JobLogTemplateModel_JobApplicationDocument_IsDeletedBySystem,details_JobLogTemplateModel_JobApplicationDocument_IsDeletedByUser,details_JobLogTemplateModel_CvDocument_Title,details_JobLogTemplateModel_CvDocument_Identifier,details_JobLogTemplateModel_CvDocument_IsDeletedBySystem,details_JobLogTemplateModel_CvDocument_IsDeletedByUser,details_JobLogTemplateModel_JobApplicationFile,details_JobLogTemplateModel_CvFile,details_JobLogTemplateModel_SubmissionDeadlineDate,details_JobLogTemplateModel_IsPersisted,details_JobLogTemplateModel_ServerValidationErrors,details_JobLogTemplateModel_HasServerValidationErrors,details_JoblogWorkTime_WorkHour,details_JoblogWorkTime_DailyWorkTime,details_Place,details_OpenPrintDialog,details_WorkPlaceInfoText,details_JobCenterContactDetails,details_WorkPlaceDescriptionText,details_FavoriteText,details_IsFavorite,details_ShowFavorite,details_MetaOgTextForSharing,details_DescriptionForSharing,details_TitleForSharing,details_RutePlan,details_FormattedPurpose,details_MapUrl,details_OrganizationNumber,details_ShowSearchJobButton,details_ShowPrint,details_BackToFindWorkButtonUrl,isExternal
0,False,1,Spændende stilling som handicaphjælper i Vejle ved 3 årig dreng - weekendvagt,Spændende stilling som handicaphjælper i Vejle ved 3 årig dreng - weekendvagt,"- Brænder du for at arbejde med børn? Så se her:
JobbetVi søger en medarbejder til nyt børneteam i Vejle. Familien bestående af far, mor og deres ",FOCUS PEOPLE A/S,,7100,Vejle,True,False,False,False,2022-03-18T00:00:00,2022-05-12T00:00:00,12. maj 2022,0001-01-01T00:00:00,False,False,https://job.jobnet.dk/CV/FindWork/Details/5482968,Syddanmark,Vejle,Danmark,7100,,,,Deltid,"Sundhed, omsorg og personlig pleje",Pleje og omsorg,Handicaphjælper,55.6905,9.5066,(7 - 14 timer ugentligt),"Dag, aften, weekend",121588,107729,26847060,False,False,https://job.jobnet.dk/CV/FindWork/DetailsSocialmedia/5482968,https://job.jobnet.dk/CV/FindWork/Details/5482968,https://job.jobnet.dk/CV/FindWork/Details/5482968,True,5482968,55.6905,9.5066,"{'Id': 1, 'Name': 'Fuldtid'}, {'Id': 16, 'Name': 'Deltid'}","{'Id': 1, 'Name': 'Almindelige vilkår'}, {'Id': 2, 'Name': 'Fleksjob'}, {'Id': 3, 'Name': 'Skånejob'}, {'Id': 4, 'Name': 'Egnet til efterlønnere og seniorer'}, {'Id': 5, 'Name': 'Job med løntilskud'}, {'Id': 6, 'Name': 'Rotationsjob'}, {'Id': 7, 'Name': 'Virksomhedspraktik'}","{'Id': 1, 'Name': 'Fastansættelse'}, {'Id': 16, 'Name': 'Tidsbegrænset ansættelse'}",FOCUS PEOPLE A/S,Algade 67  1,58,Danmark,410,Middelfart,3,Syddanmark,5500,Middelfart,,0,Primary,,,,"Focus People A/S blev grundlagt i 2002 og ligger i Middelfart. Virksomheden beskæftiger 6 daglige administrative medarbejdere og har tilknyttet mere end 500 faste hjælpere og 2000 freelancere i hele landet. Focus People tilbyder formidling, rekruttering og administration af hjælp i hverdagen til borgere, virksomheder og det offentlige. Et kerneområde for Focus People er samarbejdet med kommuner og regioner indenfor syge-og handicapområdet.",121588,1009410054,26847060,"Focus People A/S blev grundlagt i 2002 og ligger i Middelfart. Virksomheden beskæftiger 6 daglige administrative medarbejdere og har tilknyttet mere end 500 faste hjælpere og 2000 freelancere i hele landet. Focus People tilbyder formidling, rekruttering og administration af hjælp i hverdagen til borgere, virksomheder og det offentlige. Et kerneområde for Focus People er samarbejdet med kommuner og regioner indenfor syge-og handicapområdet.",5482968,5482968,FOCUS PEOPLE A/S,Algade 67  1,58,Danmark,410,Middelfart,3,Syddanmark,5500,Middelfart,,0,Primary,,,,"Focus People A/S blev grundlagt i 2002 og ligger i Middelfart. Virksomheden beskæftiger 6 daglige administrative medarbejdere og har tilknyttet mere end 500 faste hjælpere og 2000 freelancere i hele landet. Focus People tilbyder formidling, rekruttering og administration af hjælp i hverdagen til borgere, virksomheder og det offentlige. Et kerneområde for Focus People er samarbejdet med kommuner og regioner indenfor syge-og handicapområdet.",121588,1009410054,26847060,"Focus People A/S blev grundlagt i 2002 og ligger i Middelfart. Virksomheden beskæftiger 6 daglige administrative medarbejdere og har tilknyttet mere end 500 faste hjælpere og 2000 freelancere i hele landet. Focus People tilbyder formidling, rekruttering og administration af hjælp i hverdagen til borgere, virksomheder og det offentlige. Et kerneområde for Focus People er samarbejdet med kommuner og regioner indenfor syge-og handicapområdet.",,2022-03-18T00:00:00,2022-05-12T00:00:00,Spændende stilling som handicaphjælper i Vejle ved 3 årig dreng - weekendvagt,"- Brænder du for at arbejde med børn? Så se her: 
 Jobbet Vi søger en medarbejder til nyt børneteam i Vejle.  Familien bestående af far, mor og deres lille 3 årig dreng. Familien har behov for pasning i dagtimerne af deres søn. 
 Drengen er født normalt, men med et defekt på immunsystemet. Efter et virus angreb da han var ganske få måneder gammel, er han blevet blind og hjerneskadet. 
 Han får sondeernæring og der trænes sideløbende smagsoplevelser/smagsprøver. 
 I kraft af, at drengen er blind, har han ingen døgnrytme, hvilket betyder han er ofte vågen om natten. Ydermere har en en meget ujævn søvnrytme, og sover som ofte kun 2-3 timer af gangen. 
 Han skal have hjælp til alt pleje, da han ikke kan sidde selv, kravle eller gå.  
 Mor arbejder tirsdag - fredag, og i tidsrummet hvor pasningen foregår, sover far, da han varetager nattevagterne.  
 Drengen beskrives af forældrene som værende en glad og aktiv dreng, der har behov for at skulle aktiveres. Han er nysgerrig på at lære ord, så her forventes der en træning. 
 Han sover ganske lidt, ofte powernaps, og kunsten i samværet med drengen er at læse hans behov, både hvile, men også for aktivitet.  Hjemmet er indrettet med alle de nødvendige hjælpemidler, der er behov for i forbindelse med plejen og pasningen af drengen. 
 Grundig oplæring vil finde sted, inden første selvstændige vagt.  
 Profil Medarbejderen, vi søger, skal vigtigst af alt brænde for at arbejde med små børn. 
 Du skal være indstillet på at lege med drengen, gå ture med ham, ledsage og hjælpe til ved både ridning og i svømmehal (kun på hverdage).  Du skal være omsorgsfuld, nærværende, fleksibel og struktureret. Der er behov for faste rutiner, som du som medarbejder vil skulle hjælpe med at implementere. Du har måske en sundhedfaglig eller pædagogisk udannelse bag dig eller er under uddannelse, og savner en hverdag, hvor der er tid til nærvære og plads til den enkelte. Så er det dig vi mangler. 
 Arbejdstid Der er tale om en fast stilling som weekendvagt. Derudover vil der være mulighed for flere timer ved ferie og sygdom. 
 Familien får dækning følgende dage: 
 Mandag - fredag kl. 06.00-16.00 
 Hver weekend kl. 06.00-20.00 
 Du skal forvente at arbejde hver anden weekend enten i tidsrummet kl. 06.00-13.00 eller kl. 13.00-20.00 lørdag og søndag. 
 Borgerens bopæl Familien bor i Bredballe, Vejle Kommune.  
 Opgaver 
 
 Leg og aktivitet med drengen 
 Omsorg og nærvær 
 Ledsagelse ude af huset 
 Sondeernæring 
 Personlig plejeopgaver 
 
 Løn Lønnen gives efter ansøgerens uddannelse og erfaring efter gældende vikaroverenskomst for faggruppen.  
 Ansættelseskrav Ved ansættelse skal du kunne fremvise en straffeattest og Focus People indhenter børneattest. 
 Ansøgningsfrist Hurtigst muligt. 
 Bemærk venligst, at vi ansætter uafhængigt af ansøgningsfristen, når den rette kandidat er fundet.  
   
 Ansøgning 
 Hvis jobbet lyder interessant for dig, vil vi meget gerne høre fra dig. 
 For at søge jobbet skal du udfylde en ansøgning og sende den til os. Vedhæft gerne et billede, CV og udtalelser fra andre hjælper jobs, hvis du har det. 
 Vi ser frem til at høre fra dig!",,58,Danmark,630,Vejle,3,Syddanmark,7100,Vejle,1,16,Deltid,None,None,1,,0,,0,0,0,,False,"{'Id': 7831602, 'Email': 'lisa.lund@focus-people.dk', 'FaxNumber': None, 'PersonName': 'Lisa Lund', 'FirstName': 'Lisa', 'LastName': 'Lund', 'PositionTitle': 'Teamleder', 'PhoneNumbers': [{'Number': '22333112', 'Type': 0, 'Description': 'Hovednummer'}]}",,False,False,False,False,4,14,7,True,False,True,True,,,lisa.lund@focus-people.dk,,www.focus-people.dk,False,2022-05-12T00:00:00,,0,Primary,7,/CV/FindWork/GetLogo?JobAdId=5482968&WorkPlace=121588&Organisation=26847060,"Algade 67  1,5500, Middelfart",False,False,/CV/Jobseeking/JobLog/CreateJobSearch?JobnetJobPostingIdentifier=5482968&Company.Name=FOCUS PEOPLE A/S&SubmissionDeadlineDate=2022-5-12&Title=Spændende stilling som handicaphjælper i Vejle ved 3 årig dreng - weekendvagt&WeeklyWorkTime=2,00000000-0000-0000-0000-000000000000,False,0,,,Spændende stilling som handicaphjælper i Vejle ved 3 årig dreng - weekendvagt,True,,True,2,,5482968,,,False,False,,0,False,FOCUS PEOPLE A/S,Algade 67  1,,,5500,False,False,False,Middelfart,Lisa Lund,22333112,lisa.lund@focus-people.dk,,,,,False,,2022-05-12T00:00:00,,0,False,0,,,,,0,,,,False,False,,,False,False,,,,False,,False,(7 - 14 timer ugentligt),"Dag, aften, weekend",Arbejdspladsen ligger i Vejle kommune,False,FOCUS PEOPLE A/S,,"Focus People A/S blev grundlagt i 2002 og ligger i Middelfart. Virksomheden beskæftiger 6 daglige administrative medarbejdere og har tilknyttet mere end 500 faste hjælpere og 2000 freelancere i hele landet. Focus People tilbyder formidling, rekruttering og administration af hjælp i hverdagen til borgere, virksomheder og det offentlige. Et kerneområde for Focus People er samarbejdet med kommuner og regioner indenfor syge-og handicapområdet.",,False,False,"- Brænder du for at arbejde med børn? Så se her:
JobbetVi søger en medarbejder til nyt børneteam i Vejle. Familien bestående af far, mor og deres lille 3 årig dreng. Familien har behov for pasning i dagtimerne af deres søn.
Drengen er født normalt, men med et defekt på immunsystemet. Efter et virus angreb da han var ganske få måneder gammel, er han","""- Brænder du for at arbejde med børn? Så se her:\nJobbetVi søger en medarbejder til nyt børneteam i Vejle. Familien bestående af far, mor og deres lille 3 årig dreng. Familien har behov for pasning i dagtimerne af deres søn.\nDrengen er født normalt, men med et defekt på immunsystemet. Efter et virus angreb da han var ganske få måneder gammel, er han""","""Spændende stilling som handicaphjælper i Vejle ved 3 årig dreng - weekendvagt""","https://www.google.dk/maps/dir//Algade+67++1,5500,+Middelfart/","- Brænder du for at arbejde med børn? Så se her: 
 Jobbet Vi søger en medarbejder til nyt børneteam i Vejle.  Familien bestående af far, mor og deres lille 3 årig dreng. Familien har behov for pasning i dagtimerne af deres søn. 
 Drengen er født normalt, men med et defekt på immunsystemet. Efter et virus angreb da han var ganske få måneder gammel, er han blevet blind og hjerneskadet. 
 Han får sondeernæring og der trænes sideløbende smagsoplevelser/smagsprøver. 
 I kraft af, at drengen er blind, har han ingen døgnrytme, hvilket betyder han er ofte vågen om natten. Ydermere har en en meget ujævn søvnrytme, og sover som ofte kun 2-3 timer af gangen. 
 Han skal have hjælp til alt pleje, da han ikke kan sidde selv, kravle eller gå.  
 Mor arbejder tirsdag - fredag, og i tidsrummet hvor pasningen foregår, sover far, da han varetager nattevagterne.  
 Drengen beskrives af forældrene som værende en glad og aktiv dreng, der har behov for at skulle aktiveres. Han er nysgerrig på at lære ord, så her forventes der en træning. 
 Han sover ganske lidt, ofte powernaps, og kunsten i samværet med drengen er at læse hans behov, både hvile, men også for aktivitet.  Hjemmet er indrettet med alle de nødvendige hjælpemidler, der er behov for i forbindelse med plejen og pasningen af drengen. 
 Grundig oplæring vil finde sted, inden første selvstændige vagt.  
 Profil Medarbejderen, vi søger, skal vigtigst af alt brænde for at arbejde med små børn. 
 Du skal være indstillet på at lege med drengen, gå ture med ham, ledsage og hjælpe til ved både ridning og i svømmehal (kun på hverdage).  Du skal være omsorgsfuld, nærværende, fleksibel og struktureret. Der er behov for faste rutiner, som du som medarbejder vil skulle hjælpe med at implementere. Du har måske en sundhedfaglig eller pædagogisk udannelse bag dig eller er under uddannelse, og savner en hverdag, hvor der er tid til nærvære og plads til den enkelte. Så er det dig vi mangler. 
 Arbejdstid Der er tale om en fast stilling som weekendvagt. Derudover vil der være mulighed for flere timer ved ferie og sygdom. 
 Familien får dækning følgende dage: 
 Mandag - fredag kl. 06.00-16.00 
 Hver weekend kl. 06.00-20.00 
 Du skal forvente at arbejde hver anden weekend enten i tidsrummet kl. 06.00-13.00 eller kl. 13.00-20.00 lørdag og søndag. 
 Borgerens bopæl Familien bor i Bredballe, Vejle Kommune.  
 Opgaver 
 
 Leg og aktivitet med drengen 
 Omsorg og nærvær 
 Ledsagelse ude af huset 
 Sondeernæring 
 Personlig plejeopgaver 
 
 Løn Lønnen gives efter ansøgerens uddannelse og erfaring efter gældende vikaroverenskomst for faggruppen.  
 Ansættelseskrav Ved ansættelse skal du kunne fremvise en straffeattest og Focus People indhenter børneattest. 
 Ansøgningsfrist Hurtigst muligt. 
 Bemærk venligst, at vi ansætter uafhængigt af ansøgningsfristen, når den rette kandidat er fundet.  
   
 Ansøgning 
 Hvis jobbet lyder interessant for dig, vil vi meget gerne høre fra dig. 
 For at søge jobbet skal du udfylde en ansøgning og sende den til os. Vedhæft gerne et billede, CV og udtalelser fra andre hjælper jobs, hvis du har det. 
 Vi ser frem til at høre fra dig!","https://www.google.dk/maps/place/Algade+67++1,5500,+Middelfart/",26847060,False,False,,False
