summary_AutomatchType,summary_Abroad,summary_Weight,summary_Title,summary_JobHeadline,summary_Presentation,summary_HiringOrgName,summary_WorkPlaceAddress,summary_WorkPlacePostalCode,summary_WorkPlaceCity,summary_WorkPlaceOtherAddress,summary_WorkPlaceAbroad,summary_WorkPlaceNotStatic,summary_UseWorkPlaceAddressForJoblog,summary_PostingCreated,summary_LastDateApplication,summary_FormattedLastDateApplication,summary_AssignmentStartDate,summary_IsHotjob,summary_IsExternal,summary_Url,summary_Region,summary_Municipality,summary_Country,summary_PostalCode,summary_PostalCodeName,summary_JobAnnouncementType,summary_EmploymentType,summary_WorkHours,summary_OccupationArea,summary_OccupationGroup,summary_Occupation,summary_Location_Latitude,summary_Location_Longitude,summary_JoblogWorkTime_WorkHour,summary_JoblogWorkTime_DailyWorkTime,summary_WorkplaceID,summary_OrganisationId,summary_HiringOrgCVR,summary_UserLoggedIn,summary_AnonymousEmployer,summary_ShareUrl,summary_DetailsUrl,summary_JobLogUrl,summary_HasLocationValues,summary_ID,summary_Latitude,summary_Longitude,details_WorkSchedule,details_WorkConditions,details_EmploymentTypes,details_WorkPlace_Name,details_WorkPlace_Address_AddressLine,details_WorkPlace_Address_Country_Id,details_WorkPlace_Address_Country_Name,details_WorkPlace_Address_Municipality_Id,details_WorkPlace_Address_Municipality_Name,details_WorkPlace_Address_Region_Id,details_WorkPlace_Address_Region_Name,details_WorkPlace_Address_PostalCode,details_WorkPlace_Address_City,details_WorkPlace_PhoneNumber_Number,details_WorkPlace_PhoneNumber_Type,details_WorkPlace_PhoneNumber_Description,details_WorkPlace_FaxNumber,details_WorkPlace_Email,details_WorkPlace_WebAddress,details_WorkPlace_Description,details_WorkPlace_Logo,details_WorkPlace_WorkPlaceOrganizationNumber,details_WorkPlace_OrganizationNumber,details_WorkPlace_OrganizationDescription,details_JobPositionPosting_Id,details_JobPositionPosting_HiringOrg_Name,details_JobPositionPosting_HiringOrg_Address_AddressLine,details_JobPositionPosting_HiringOrg_Address_Country_Id,details_JobPositionPosting_HiringOrg_Address_Country_Name,details_JobPositionPosting_HiringOrg_Address_Municipality_Id,details_JobPositionPosting_HiringOrg_Address_Municipality_Name,details_JobPositionPosting_HiringOrg_Address_Region_Id,details_JobPositionPosting_HiringOrg_Address_Region_Name,details_JobPositionPosting_HiringOrg_Address_PostalCode,details_JobPositionPosting_HiringOrg_Address_City,details_JobPositionPosting_HiringOrg_PhoneNumber_Number,details_JobPositionPosting_HiringOrg_PhoneNumber_Type,details_JobPositionPosting_HiringOrg_PhoneNumber_Description,details_JobPositionPosting_HiringOrg_FaxNumber,details_JobPositionPosting_HiringOrg_Email,details_JobPositionPosting_HiringOrg_WebAddress,details_JobPositionPosting_HiringOrg_Description,details_JobPositionPosting_HiringOrg_Logo,details_JobPositionPosting_HiringOrg_WorkPlaceOrganizationNumber,details_JobPositionPosting_HiringOrg_OrganizationNumber,details_JobPositionPosting_HiringOrg_OrganizationDescription,details_JobPositionPosting_RecruitingCompany,details_JobPositionPosting_PublicationStartDate,details_JobPositionPosting_PublicationEndDate,details_JobPositionPosting_JobPositionInformation_PositionTitle,details_JobPositionPosting_JobPositionInformation_Purpose,details_JobPositionPosting_JobPositionInformation_WorkLocation_AddressLine,details_JobPositionPosting_JobPositionInformation_WorkLocation_Country_Id,details_JobPositionPosting_JobPositionInformation_WorkLocation_Country_Name,details_JobPositionPosting_JobPositionInformation_WorkLocation_Municipality_Id,details_JobPositionPosting_JobPositionInformation_WorkLocation_Municipality_Name,details_JobPositionPosting_JobPositionInformation_WorkLocation_Region_Id,details_JobPositionPosting_JobPositionInformation_WorkLocation_Region_Name,details_JobPositionPosting_JobPositionInformation_WorkLocation_PostalCode,details_JobPositionPosting_JobPositionInformation_WorkLocation_City,details_JobPositionPosting_JobPositionInformation_EmploymentType,details_JobPositionPosting_JobPositionInformation_WeeklyWorkHours_TypeId,details_JobPositionPosting_JobPositionInformation_WeeklyWorkHours_TypeName,details_JobPositionPosting_JobPositionInformation_WeeklyWorkHours_Description,details_JobPositionPosting_JobPositionInformation_CompensationDescription,details_JobPositionPosting_JobPositionInformation_NumberToFill,details_JobPositionPosting_JobPositionInformation_DriverLicense,details_JobPositionPosting_JobPositionInformation_Occupation_Name,details_JobPositionPosting_JobPositionInformation_Occupation_DiscoWeb,details_JobPositionPosting_JobPositionInformation_Occupation_AlternateNames,details_JobPositionPosting_JobPositionInformation_Occupation_GroupId,details_JobPositionPosting_JobPositionInformation_Occupation_AreaId,details_JobPositionPosting_JobPositionInformation_IsGovernmentHiring,details_JobPositionPosting_JobPositionInformation_JppContacts,details_JobPositionPosting_JobPositionInformation_EmploymentDate,details_JobPositionPosting_IsRecruitmentOfForeignNationals,details_JobPositionPosting_IsWorkInDenmark,details_JobPositionPosting_IsAnonymousEmployer,details_JobPositionPosting_IsDisabilityFriendly,details_JobPositionPosting_JppType,details_JobPositionPosting_ApplicationDetails_WorkHourMax,details_JobPositionPosting_ApplicationDetails_WorkHourMin,details_JobPositionPosting_ApplicationDetails_DailyWorkTimeWeekend,details_JobPositionPosting_ApplicationDetails_DailyWorkTimeNight,details_JobPositionPosting_ApplicationDetails_DailyWorkTimeEvening,details_JobPositionPosting_ApplicationDetails_DailyWorkTimeDay,details_JobPositionPosting_ApplicationDetails_DailyWorkTimeMorning,details_JobPositionPosting_ApplicationDetails_DailyWorkTimeVarious,details_JobPositionPosting_ApplicationDetails_ReferenceText,details_JobPositionPosting_ApplicationDetails_RemarksToApplicant,details_JobPositionPosting_ApplicationDetails_ByEmail,details_JobPositionPosting_ApplicationDetails_ByPhone,details_JobPositionPosting_ApplicationDetails_ApplyViaUrl,details_JobPositionPosting_ApplicationDetails_ReplyInWriting,details_JobPositionPosting_ApplicationDetails_ApplicationDeadlineDate,details_JobPositionPosting_Status,details_LogoUrl,details_Address,details_ShowMap,details_ShowShareButtonJobLog,details_JobLogUrl,details_JobLogTemplateModel_Identifier,details_JobLogTemplateModel_UseWorkPlaceAddressForJoblog,details_JobLogTemplateModel_Category,details_JobLogTemplateModel_CvCustomerIdentifier,details_JobLogTemplateModel_JobSeekingStatus,details_JobLogTemplateModel_Title,details_JobLogTemplateModel_IsApplicationSourceRequired,details_JobLogTemplateModel_ApplicationSource,details_JobLogTemplateModel_IsWeeklyWorkTimeRequired,details_JobLogTemplateModel_WeeklyWorkTime,details_JobLogTemplateModel_HoursPerWeek,details_JobLogTemplateModel_JobnetJobPostingIdentifier,details_JobLogTemplateModel_JobAdDocument_Title,details_JobLogTemplateModel_JobAdDocument_Identifier,details_JobLogTemplateModel_JobAdDocument_IsDeletedBySystem,details_JobLogTemplateModel_JobAdDocument_IsDeletedByUser,details_JobLogTemplateModel_JobAdFile,details_JobLogTemplateModel_Company_JobLogEntryCategory,details_JobLogTemplateModel_Company_ShowAddressFieldsEvenIfEmpty,details_JobLogTemplateModel_Company_Name,details_JobLogTemplateModel_Company_Address,details_JobLogTemplateModel_Company_Country,details_JobLogTemplateModel_Company_EmploymentAreaID,details_JobLogTemplateModel_Company_PostCode,details_JobLogTemplateModel_Company_IsCountryAndTownAndPostCodeEmpty,details_JobLogTemplateModel_Company_IsTownAndPostCodeEmpty,details_JobLogTemplateModel_Company_IsCountryDanmark,details_JobLogTemplateModel_Company_Town,details_JobLogTemplateModel_Company_ContactPerson,details_JobLogTemplateModel_Company_Phone,details_JobLogTemplateModel_Company_Email,details_JobLogTemplateModel_Company_Latitude,details_JobLogTemplateModel_Company_Longitude,details_JobLogTemplateModel_Company_DailyTravelTimeInMinutes,details_JobLogTemplateModel_Company_DistanceToCompanyInMeters,details_JobLogTemplateModel_Company_IsCreateMode,details_JobLogTemplateModel_TypeOfSubmission,details_JobLogTemplateModel_SubmissionDate,details_JobLogTemplateModel_SubmissionDateFormatted,details_JobLogTemplateModel_SubmissionDateTiks,details_JobLogTemplateModel_IsSubmissionDateRequired,details_JobLogTemplateModel_Status,details_JobLogTemplateModel_DateCreatedFormatted,details_JobLogTemplateModel_DateCreated,details_JobLogTemplateModel_DateModifiedFormatted,details_JobLogTemplateModel_DateModified,details_JobLogTemplateModel_LastModifiedDateTiks,details_JobLogTemplateModel_DateClosed,details_JobLogTemplateModel_JobApplicationDocument_Title,details_JobLogTemplateModel_JobApplicationDocument_Identifier,details_JobLogTemplateModel_JobApplicationDocument_IsDeletedBySystem,details_JobLogTemplateModel_JobApplicationDocument_IsDeletedByUser,details_JobLogTemplateModel_CvDocument_Title,details_JobLogTemplateModel_CvDocument_Identifier,details_JobLogTemplateModel_CvDocument_IsDeletedBySystem,details_JobLogTemplateModel_CvDocument_IsDeletedByUser,details_JobLogTemplateModel_JobApplicationFile,details_JobLogTemplateModel_CvFile,details_JobLogTemplateModel_SubmissionDeadlineDate,details_JobLogTemplateModel_IsPersisted,details_JobLogTemplateModel_ServerValidationErrors,details_JobLogTemplateModel_HasServerValidationErrors,details_JoblogWorkTime_WorkHour,details_JoblogWorkTime_DailyWorkTime,details_Place,details_OpenPrintDialog,details_WorkPlaceInfoText,details_JobCenterContactDetails,details_WorkPlaceDescriptionText,details_FavoriteText,details_IsFavorite,details_ShowFavorite,details_MetaOgTextForSharing,details_DescriptionForSharing,details_TitleForSharing,details_RutePlan,details_FormattedPurpose,details_MapUrl,details_OrganizationNumber,details_ShowSearchJobButton,details_ShowPrint,details_BackToFindWorkButtonUrl,isExternal
0,False,1,Regnskabsassistent - Bliv en del af vores team i Hillerød,Regnskabsassistent - Bliv en del af vores team i Hillerød,"Drømmer du om at arbejde i en virksomhed, der både giver dig ansvar og sørger for, at du bliver klædt godt på til opgaverne?

Vi søger en regnskabsassistent, der har lyst til en alsidig hver",Dines Jørgensen & Co A/S,Kirsebærallé 9-11  ,3400,Hillerød,False,False,False,True,2025-01-21T10:20:10,2025-03-18T10:20:10,18. marts 2025,0001-01-01T00:00:00,False,False,https://job.jobnet.dk/CV/FindWork/Details/549cccec-2a6e-402f-b381-454850dc16cf,Hovedstaden og Bornholm,Hillerød,Danmark,3400,,Almindelige vilkår,Fastansættelse,Deltid,"Kontor, administration, regnskab og finans",Bogholderi- og regnskabsarbejde,Bogholderi- og regnskabsassistent,55.9212,12.287,(28 - 36 timer ugentligt),,1003182974,,18411830,False,False,https://job.jobnet.dk/CV/FindWork/DetailsSocialmedia/549cccec-2a6e-402f-b381-454850dc16cf,https://job.jobnet.dk/CV/FindWork/Details/549cccec-2a6e-402f-b381-454850dc16cf,https://job.jobnet.dk/CV/FindWork/Details/549cccec-2a6e-402f-b381-454850dc16cf,True,549cccec-2a6e-402f-b381-454850dc16cf,55.9212,12.287,"{'Id': 1, 'Name': 'Fuldtid'}, {'Id': 16, 'Name': 'Deltid'}","{'Id': 1, 'Name': 'Almindelige vilkår'}, {'Id': 2, 'Name': 'Fleksjob'}, {'Id': 3, 'Name': 'Skånejob'}, {'Id': 4, 'Name': 'Egnet til efterlønnere og seniorer'}, {'Id': 5, 'Name': 'Job med løntilskud'}, {'Id': 6, 'Name': 'Rotationsjob'}, {'Id': 7, 'Name': 'Virksomhedspraktik'}","{'Id': 1, 'Name': 'Fastansættelse'}, {'Id': 16, 'Name': 'Tidsbegrænset ansættelse'}",Dines Jørgensen & Co A/S,Kirsebærallé 9-11,58,Danmark,219,Hillerød,4,"Hovedstaden, Sjælland og Bornholm",3400,Hillerød,,0,Primary,,,https://dinesjrgensencoas.hr-on.com/show-job/233277?linkref=263473&locale=da_DK,None,,1003182974,18411830,None,549cccec-2a6e-402f-b381-454850dc16cf,Dines Jørgensen & Co A/S,Kirsebærallé 9-11,58,Danmark,219,Hillerød,4,"Hovedstaden, Sjælland og Bornholm",3400,Hillerød,,0,Primary,,,https://dinesjrgensencoas.hr-on.com/show-job/233277?linkref=263473&locale=da_DK,None,,1003182974,18411830,None,,2025-01-21T10:20:10+01:00,2025-03-18T10:20:10+01:00,Regnskabsassistent - Bliv en del af vores team i Hillerød,"Drømmer du om at arbejde i en virksomhed, der både giver dig ansvar og sørger for, at du bliver klædt godt på til opgaverne? 
 Vi søger en regnskabsassistent, der har lyst til en alsidig hverdag med fokus på økonomi og HR relaterede opgaver.  
 Uanset om du netop har afsluttet din elevuddannelse inden for økonomi eller allerede har gjort dig de første erfaringer som regnskabsassistent, så er denne stilling måske noget for dig! 
 Om jobbet 
 Vi er en rådgivende ingeniørvirksomhed med base i Hillerød, og vi leder efter en kollega til vores regnskabsteam. Stillingen er på  28-30 timer om ugen  med mulighed for fuldtid (36 timer) på sigt. 
 Vi tilbyder en hverdag fyldt med spændende opgaver i et uformelt arbejdsmiljø og med en stor kontaktflade på tværs af  Dines Jørgensen & Co. A/S  og vores datterselskab  DJ Miljø & Geoteknik P/S . 
 Du vil blive en del af et lille, stærkt team bestående af Rikke og Emilie, hvor vi refererer til vores økonomichef, Thomas. Vi ved, at det tager tid at lære nyt – derfor forventer vi ikke, at du kan alt fra starten. Du vil få grundig oplæring til du føler dig tryg i opgaverne og herefter have løbende sparring med hele temaet.   
 Dine opgaver vil blandt andet være: 
 
 Time-/sagsstyring  – tjekke timesedler, fakturering, sagsopfølgning m.m. i Autopilot. 
 Finansopgaver  – bogføring af bilag, afstemninger og opfølgning. 
 Kreditorstyring  – håndtering og betaling af fakturaer. 
 Medarbejderudgifter  – håndtering af bilag og bogføring via Pleo. 
 Moms  – månedlige opgørelser, indberetninger og afstemninger. 
 Månedsafslutning  – afskrivninger, anlægskartotek, hensættelser, afstemninger, personaleopgørelser m.m. 
 Årsafslutning  – klargøring af materiale til revisor. 
 Lønbehandling  – udarbejdelse af løn og afstemning af ferieregnskab i Dataløn. 
 HR relaterede opgaver  – udarbejdelse af ansættelseskontrakter, allonger og andre juridiske dokumenter i HR-ON. 
 Løbende ad hoc:  Optimering og vedligeholdelse af systemer, sikre overholdelse af gældende lovgivning m.m. 
 
 Vi ser frem til at tage springet fra NAV18 til 365 Business Central i løbet af 2025, hvor du skal være med til at gøre overgangen både smidig og succesfuld. 
 Om dig 
 Vi leder efter en kollega, som er struktureret, effektiv og omhyggelig.  
 Vi forestiller os, at du: 
 
 Har en relevant uddannelse inden for økonomi/regnskab og har styr på debet/kredit. 
 Har erfaring med ERP-systemer (kendskab til NAV eller BC365 er en fordel, men ikke et krav). 
 Har erfaring med Excel og Office-pakken. 
 Er nysgerrig, lærenem og interesseret i at optimere arbejdsprocesser. 
 
 
 Personligt er du: 
 
 Detaljeorienteret  – du har øje for, at de små ting også tæller. 
 God til at holde  overblikket , selv når der er mange bolde i luften. 
 En mødestabil  teamplayer , der bidrager med godt humør og hjælpsomhed. 
 Stærk i både  skriftlig  og  mundtlig  dansk. 
 
 Vi kan tilbyde 
 Du bliver en del af en virksomhed, hvor trivsel og faglig udvikling går hånd i hånd. Vi prioriterer samarbejde og et uformelt miljø, hvor der er plads til både seriøse opgaver og grin i løbet af dagen. 
 Vi tilbyder blandt andet: 
 
 Konkurrencedygtig  løn efter kvalifikationer. 
 Sundhedsforsikring  hos Tryg. 
 Pensionsordning  hos Velliv. 
 Frokostordning  mandag til torsdag og morgenbrød hver fredag. 
 Sociale arrangementer  såsom firmafester, sport events og meget andet.   
 Fri kl. 13  hver fredag. 
 
 Ansøgning 
 Vi holder samtaler løbende og stopper rekrutteringen, når vi har fundet den rette kandidat - så tøv ikke med at sende din ansøgning.  
 Startdato aftales sammen, men vi håber, at du kan starte hurtigst muligt.  
 Vil du vide mere om stillingen, er du velkommen til at kontakte teamleder Emilie Kuszcz Nørbygaard på telefon 30 24 11 43 eller  ekn@dj-co.dk . 
 Vi glæder os til at læse din ansøgning!",Kirsebærallé 9-11,58,Danmark,219,Hillerød,4,"Hovedstaden, Sjælland og Bornholm",3400,Hillerød,1,16,Deltid,None,None,1,,Bogholderi- og regnskabsassistent,0,"Bogholderiassistent, 5540, 5541",0,0,False,"{'Email': 'ekn@dj-co.dk', 'PersonName': 'Emilie Nørbygaard', 'FirstName': 'Emilie', 'LastName': 'Nørbygaard', 'PositionTitle': None, 'PhoneNumbers': [{'Number': '30 24 11 43', 'Type': 0, 'Description': 'Primary'}]}",,False,False,False,False,4,36,28,False,False,False,False,False,False,,,,,https://dinesjrgensencoas.hr-on.com/show-job/233277?linkref=263473&locale=da_DK,False,2025-03-18T10:20:10+01:00,7,/CV/FindWork/GetLogo?JobAdId=549cccec-2a6e-402f-b381-454850dc16cf&Organisation=18411830,"Kirsebærallé 9-11,3400, Hillerød",True,False,/CV/Jobseeking/JobLog/CreateJobSearch?JobnetJobPostingIdentifier=549cccec-2a6e-402f-b381-454850dc16cf&Company.Name=Dines Jørgensen & Co A/S&SubmissionDeadlineDate=2025-3-18&Title=Regnskabsassistent - Bliv en del af vores team i Hillerød&WeeklyWorkTime=2,00000000-0000-0000-0000-000000000000,True,0,,,Regnskabsassistent - Bliv en del af vores team i Hillerød,True,,True,2,,549cccec-2a6e-402f-b381-454850dc16cf,,,False,False,,0,False,Dines Jørgensen & Co A/S,Kirsebærallé 9-11,,,3400,False,False,False,Hillerød,Emilie Nørbygaard,30 24 11 43,ekn@dj-co.dk,,,,,False,,2025-03-18T10:20:10+01:00,,0,False,0,,,,,0,,,,False,False,,,False,False,,,,False,,False,(28 - 36 timer ugentligt),,Arbejdspladsen ligger i Hillerød kommune,False,Dines Jørgensen & Co A/S,,None,,False,False,"Drømmer du om at arbejde i en virksomhed, der både giver dig ansvar og sørger for, at du bliver klædt godt på til opgaverne?

Vi søger en regnskabsassistent, der har lyst til en alsidig hverdag med fokus på økonomi og HR relaterede opgaver. 

Uanset om du netop har afsluttet din elevuddannelse inden for økonomi eller allerede har gjort dig de først","""Drømmer du om at arbejde i en virksomhed, der både giver dig ansvar og sørger for, at du bliver klædt godt på til opgaverne?\n\nVi søger en regnskabsassistent, der har lyst til en alsidig hverdag med fokus på økonomi og HR relaterede opgaver. \n\nUanset om du netop har afsluttet din elevuddannelse inden for økonomi eller allerede har gjort dig de først""","""Regnskabsassistent - Bliv en del af vores team i Hillerød""","https://www.google.dk/maps/dir//Kirsebærallé+9-11,3400,+Hillerød/","Drømmer du om at arbejde i en virksomhed, der både giver dig ansvar og sørger for, at du bliver klædt godt på til opgaverne? 
 Vi søger en regnskabsassistent, der har lyst til en alsidig hverdag med fokus på økonomi og HR relaterede opgaver.  
 Uanset om du netop har afsluttet din elevuddannelse inden for økonomi eller allerede har gjort dig de første erfaringer som regnskabsassistent, så er denne stilling måske noget for dig! 
 Om jobbet 
 Vi er en rådgivende ingeniørvirksomhed med base i Hillerød, og vi leder efter en kollega til vores regnskabsteam. Stillingen er på  28-30 timer om ugen  med mulighed for fuldtid (36 timer) på sigt. 
 Vi tilbyder en hverdag fyldt med spændende opgaver i et uformelt arbejdsmiljø og med en stor kontaktflade på tværs af  Dines Jørgensen & Co. A/S  og vores datterselskab  DJ Miljø & Geoteknik P/S . 
 Du vil blive en del af et lille, stærkt team bestående af Rikke og Emilie, hvor vi refererer til vores økonomichef, Thomas. Vi ved, at det tager tid at lære nyt – derfor forventer vi ikke, at du kan alt fra starten. Du vil få grundig oplæring til du føler dig tryg i opgaverne og herefter have løbende sparring med hele temaet.   
 Dine opgaver vil blandt andet være: 
 
 Time-/sagsstyring  – tjekke timesedler, fakturering, sagsopfølgning m.m. i Autopilot. 
 Finansopgaver  – bogføring af bilag, afstemninger og opfølgning. 
 Kreditorstyring  – håndtering og betaling af fakturaer. 
 Medarbejderudgifter  – håndtering af bilag og bogføring via Pleo. 
 Moms  – månedlige opgørelser, indberetninger og afstemninger. 
 Månedsafslutning  – afskrivninger, anlægskartotek, hensættelser, afstemninger, personaleopgørelser m.m. 
 Årsafslutning  – klargøring af materiale til revisor. 
 Lønbehandling  – udarbejdelse af løn og afstemning af ferieregnskab i Dataløn. 
 HR relaterede opgaver  – udarbejdelse af ansættelseskontrakter, allonger og andre juridiske dokumenter i HR-ON. 
 Løbende ad hoc:  Optimering og vedligeholdelse af systemer, sikre overholdelse af gældende lovgivning m.m. 
 
 Vi ser frem til at tage springet fra NAV18 til 365 Business Central i løbet af 2025, hvor du skal være med til at gøre overgangen både smidig og succesfuld. 
 Om dig 
 Vi leder efter en kollega, som er struktureret, effektiv og omhyggelig.  
 Vi forestiller os, at du: 
 
 Har en relevant uddannelse inden for økonomi/regnskab og har styr på debet/kredit. 
 Har erfaring med ERP-systemer (kendskab til NAV eller BC365 er en fordel, men ikke et krav). 
 Har erfaring med Excel og Office-pakken. 
 Er nysgerrig, lærenem og interesseret i at optimere arbejdsprocesser. 
 
 
 Personligt er du: 
 
 Detaljeorienteret  – du har øje for, at de små ting også tæller. 
 God til at holde  overblikket , selv når der er mange bolde i luften. 
 En mødestabil  teamplayer , der bidrager med godt humør og hjælpsomhed. 
 Stærk i både  skriftlig  og  mundtlig  dansk. 
 
 Vi kan tilbyde 
 Du bliver en del af en virksomhed, hvor trivsel og faglig udvikling går hånd i hånd. Vi prioriterer samarbejde og et uformelt miljø, hvor der er plads til både seriøse opgaver og grin i løbet af dagen. 
 Vi tilbyder blandt andet: 
 
 Konkurrencedygtig  løn efter kvalifikationer. 
 Sundhedsforsikring  hos Tryg. 
 Pensionsordning  hos Velliv. 
 Frokostordning  mandag til torsdag og morgenbrød hver fredag. 
 Sociale arrangementer  såsom firmafester, sport events og meget andet.   
 Fri kl. 13  hver fredag. 
 
 Ansøgning 
 Vi holder samtaler løbende og stopper rekrutteringen, når vi har fundet den rette kandidat - så tøv ikke med at sende din ansøgning.  
 Startdato aftales sammen, men vi håber, at du kan starte hurtigst muligt.  
 Vil du vide mere om stillingen, er du velkommen til at kontakte teamleder Emilie Kuszcz Nørbygaard på telefon 30 24 11 43 eller  ekn@dj-co.dk . 
 Vi glæder os til at læse din ansøgning!","https://www.google.dk/maps/place/Kirsebærallé+9-11,3400,+Hillerød/",18411830,False,False,,False
