summary_AutomatchType,summary_Abroad,summary_Weight,summary_Title,summary_JobHeadline,summary_Presentation,summary_HiringOrgName,summary_WorkPlaceAddress,summary_WorkPlacePostalCode,summary_WorkPlaceCity,summary_WorkPlaceOtherAddress,summary_WorkPlaceAbroad,summary_WorkPlaceNotStatic,summary_UseWorkPlaceAddressForJoblog,summary_PostingCreated,summary_LastDateApplication,summary_FormattedLastDateApplication,summary_AssignmentStartDate,summary_IsHotjob,summary_IsExternal,summary_Url,summary_Region,summary_Municipality,summary_Country,summary_PostalCode,summary_PostalCodeName,summary_JobAnnouncementType,summary_EmploymentType,summary_WorkHours,summary_OccupationArea,summary_OccupationGroup,summary_Occupation,summary_Location_Latitude,summary_Location_Longitude,summary_JoblogWorkTime_WorkHour,summary_JoblogWorkTime_DailyWorkTime,summary_WorkplaceID,summary_OrganisationId,summary_HiringOrgCVR,summary_UserLoggedIn,summary_AnonymousEmployer,summary_ShareUrl,summary_DetailsUrl,summary_JobLogUrl,summary_HasLocationValues,summary_ID,summary_Latitude,summary_Longitude,details_WorkSchedule,details_WorkConditions,details_EmploymentTypes,details_WorkPlace_Name,details_WorkPlace_Address_AddressLine,details_WorkPlace_Address_Country_Id,details_WorkPlace_Address_Country_Name,details_WorkPlace_Address_Municipality_Id,details_WorkPlace_Address_Municipality_Name,details_WorkPlace_Address_Region_Id,details_WorkPlace_Address_Region_Name,details_WorkPlace_Address_PostalCode,details_WorkPlace_Address_City,details_WorkPlace_PhoneNumber_Number,details_WorkPlace_PhoneNumber_Type,details_WorkPlace_PhoneNumber_Description,details_WorkPlace_FaxNumber,details_WorkPlace_Email,details_WorkPlace_WebAddress,details_WorkPlace_Description,details_WorkPlace_Logo,details_WorkPlace_WorkPlaceOrganizationNumber,details_WorkPlace_OrganizationNumber,details_WorkPlace_OrganizationDescription,details_JobPositionPosting_Id,details_JobPositionPosting_OriginalJppId,details_JobPositionPosting_HiringOrg_Name,details_JobPositionPosting_HiringOrg_Address_AddressLine,details_JobPositionPosting_HiringOrg_Address_Country_Id,details_JobPositionPosting_HiringOrg_Address_Country_Name,details_JobPositionPosting_HiringOrg_Address_Municipality_Id,details_JobPositionPosting_HiringOrg_Address_Municipality_Name,details_JobPositionPosting_HiringOrg_Address_Region_Id,details_JobPositionPosting_HiringOrg_Address_Region_Name,details_JobPositionPosting_HiringOrg_Address_PostalCode,details_JobPositionPosting_HiringOrg_Address_City,details_JobPositionPosting_HiringOrg_PhoneNumber_Number,details_JobPositionPosting_HiringOrg_PhoneNumber_Type,details_JobPositionPosting_HiringOrg_PhoneNumber_Description,details_JobPositionPosting_HiringOrg_FaxNumber,details_JobPositionPosting_HiringOrg_Email,details_JobPositionPosting_HiringOrg_WebAddress,details_JobPositionPosting_HiringOrg_Description,details_JobPositionPosting_HiringOrg_Logo,details_JobPositionPosting_HiringOrg_WorkPlaceOrganizationNumber,details_JobPositionPosting_HiringOrg_OrganizationNumber,details_JobPositionPosting_HiringOrg_OrganizationDescription,details_JobPositionPosting_RecruitingCompany,details_JobPositionPosting_PublicationStartDate,details_JobPositionPosting_PublicationEndDate,details_JobPositionPosting_JobPositionInformation_PositionTitle,details_JobPositionPosting_JobPositionInformation_Purpose,details_JobPositionPosting_JobPositionInformation_WorkLocation_AddressLine,details_JobPositionPosting_JobPositionInformation_WorkLocation_Country_Id,details_JobPositionPosting_JobPositionInformation_WorkLocation_Country_Name,details_JobPositionPosting_JobPositionInformation_WorkLocation_Municipality_Id,details_JobPositionPosting_JobPositionInformation_WorkLocation_Municipality_Name,details_JobPositionPosting_JobPositionInformation_WorkLocation_Region_Id,details_JobPositionPosting_JobPositionInformation_WorkLocation_Region_Name,details_JobPositionPosting_JobPositionInformation_WorkLocation_PostalCode,details_JobPositionPosting_JobPositionInformation_WorkLocation_City,details_JobPositionPosting_JobPositionInformation_EmploymentType,details_JobPositionPosting_JobPositionInformation_WeeklyWorkHours_TypeId,details_JobPositionPosting_JobPositionInformation_WeeklyWorkHours_TypeName,details_JobPositionPosting_JobPositionInformation_WeeklyWorkHours_Description,details_JobPositionPosting_JobPositionInformation_CompensationDescription,details_JobPositionPosting_JobPositionInformation_NumberToFill,details_JobPositionPosting_JobPositionInformation_DriverLicense,details_JobPositionPosting_JobPositionInformation_Occupation_DiscoWeb,details_JobPositionPosting_JobPositionInformation_Occupation_AlternateNames,details_JobPositionPosting_JobPositionInformation_Occupation_GroupId,details_JobPositionPosting_JobPositionInformation_Occupation_AreaId,details_JobPositionPosting_JobPositionInformation_Occupation_Id,details_JobPositionPosting_JobPositionInformation_Occupation_Name,details_JobPositionPosting_JobPositionInformation_IsGovernmentHiring,details_JobPositionPosting_JobPositionInformation_JppContacts,details_JobPositionPosting_JobPositionInformation_EmploymentDate,details_JobPositionPosting_IsRecruitmentOfForeignNationals,details_JobPositionPosting_IsWorkInDenmark,details_JobPositionPosting_IsAnonymousEmployer,details_JobPositionPosting_IsDisabilityFriendly,details_JobPositionPosting_JppType,details_JobPositionPosting_ApplicationDetails_WorkHourMax,details_JobPositionPosting_ApplicationDetails_WorkHourMin,details_JobPositionPosting_ApplicationDetails_DailyWorkTimeWeekend,details_JobPositionPosting_ApplicationDetails_DailyWorkTimeNight,details_JobPositionPosting_ApplicationDetails_DailyWorkTimeEvening,details_JobPositionPosting_ApplicationDetails_DailyWorkTimeDay,details_JobPositionPosting_ApplicationDetails_ReferenceText,details_JobPositionPosting_ApplicationDetails_RemarksToApplicant,details_JobPositionPosting_ApplicationDetails_ByEmail,details_JobPositionPosting_ApplicationDetails_ByPhone,details_JobPositionPosting_ApplicationDetails_ApplyViaUrl,details_JobPositionPosting_ApplicationDetails_ReplyInWriting,details_JobPositionPosting_ApplicationDetails_ApplicationDeadlineDate,details_JobPositionPosting_ContactAuthorityPhoneNumber_Number,details_JobPositionPosting_ContactAuthorityPhoneNumber_Type,details_JobPositionPosting_ContactAuthorityPhoneNumber_Description,details_JobPositionPosting_Status,details_LogoUrl,details_Address,details_ShowMap,details_ShowShareButtonJobLog,details_JobLogUrl,details_JobLogTemplateModel_Identifier,details_JobLogTemplateModel_UseWorkPlaceAddressForJoblog,details_JobLogTemplateModel_Category,details_JobLogTemplateModel_CvCustomerIdentifier,details_JobLogTemplateModel_JobSeekingStatus,details_JobLogTemplateModel_Title,details_JobLogTemplateModel_IsApplicationSourceRequired,details_JobLogTemplateModel_ApplicationSource,details_JobLogTemplateModel_IsWeeklyWorkTimeRequired,details_JobLogTemplateModel_WeeklyWorkTime,details_JobLogTemplateModel_HoursPerWeek,details_JobLogTemplateModel_JobnetJobPostingIdentifier,details_JobLogTemplateModel_JobAdDocument_Title,details_JobLogTemplateModel_JobAdDocument_Identifier,details_JobLogTemplateModel_JobAdDocument_IsDeletedBySystem,details_JobLogTemplateModel_JobAdDocument_IsDeletedByUser,details_JobLogTemplateModel_JobAdFile,details_JobLogTemplateModel_Company_JobLogEntryCategory,details_JobLogTemplateModel_Company_ShowAddressFieldsEvenIfEmpty,details_JobLogTemplateModel_Company_Name,details_JobLogTemplateModel_Company_Address,details_JobLogTemplateModel_Company_Country,details_JobLogTemplateModel_Company_EmploymentAreaID,details_JobLogTemplateModel_Company_PostCode,details_JobLogTemplateModel_Company_IsCountryAndTownAndPostCodeEmpty,details_JobLogTemplateModel_Company_IsTownAndPostCodeEmpty,details_JobLogTemplateModel_Company_IsCountryDanmark,details_JobLogTemplateModel_Company_Town,details_JobLogTemplateModel_Company_ContactPerson,details_JobLogTemplateModel_Company_Phone,details_JobLogTemplateModel_Company_Email,details_JobLogTemplateModel_Company_Latitude,details_JobLogTemplateModel_Company_Longitude,details_JobLogTemplateModel_Company_DailyTravelTimeInMinutes,details_JobLogTemplateModel_Company_DistanceToCompanyInMeters,details_JobLogTemplateModel_Company_IsCreateMode,details_JobLogTemplateModel_TypeOfSubmission,details_JobLogTemplateModel_SubmissionDate,details_JobLogTemplateModel_SubmissionDateFormatted,details_JobLogTemplateModel_SubmissionDateTiks,details_JobLogTemplateModel_IsSubmissionDateRequired,details_JobLogTemplateModel_Status,details_JobLogTemplateModel_DateCreatedFormatted,details_JobLogTemplateModel_DateCreated,details_JobLogTemplateModel_DateModifiedFormatted,details_JobLogTemplateModel_DateModified,details_JobLogTemplateModel_LastModifiedDateTiks,details_JobLogTemplateModel_DateClosed,details_JobLogTemplateModel_JobApplicationDocument_Title,details_JobLogTemplateModel_JobApplicationDocument_Identifier,details_JobLogTemplateModel_JobApplicationDocument_IsDeletedBySystem,details_JobLogTemplateModel_JobApplicationDocument_IsDeletedByUser,details_JobLogTemplateModel_CvDocument_Title,details_JobLogTemplateModel_CvDocument_Identifier,details_JobLogTemplateModel_CvDocument_IsDeletedBySystem,details_JobLogTemplateModel_CvDocument_IsDeletedByUser,details_JobLogTemplateModel_JobApplicationFile,details_JobLogTemplateModel_CvFile,details_JobLogTemplateModel_SubmissionDeadlineDate,details_JobLogTemplateModel_IsPersisted,details_JobLogTemplateModel_ServerValidationErrors,details_JobLogTemplateModel_HasServerValidationErrors,details_JoblogWorkTime_WorkHour,details_JoblogWorkTime_DailyWorkTime,details_Place,details_OpenPrintDialog,details_WorkPlaceInfoText,details_JobCenterContactDetails,details_WorkPlaceDescriptionText,details_FavoriteText,details_IsFavorite,details_ShowFavorite,details_MetaOgTextForSharing,details_DescriptionForSharing,details_TitleForSharing,details_RutePlan,details_FormattedPurpose,details_MapUrl,details_OrganizationNumber,details_ShowSearchJobButton,details_ShowPrint,details_BackToFindWorkButtonUrl,isExternal
0,False,1,"Overlæge til NSR Anæstesiologisk Afdeling, Næstved Sygehus","Overlæge til NSR Anæstesiologisk Afdeling, Næstved Sygehus","
	
		
			 
		
	


Overlæge til Næstved, Slagelse og Ringsted sygehus Anæstesiologisk Afdeling, Næstved pr. 1. maj 2022 eller snarest derefter.

 

Har du stor interesse for området pe",Region Sjælland,Ringstedgade 61,4700,Næstved,True,False,False,False,2022-05-02T00:00:00,2022-05-22T00:00:00,22. maj 2022,0001-01-01T00:00:00,False,False,https://job.jobnet.dk/CV/FindWork/Details/5520636,Øvrige Sjælland,Næstved,Danmark,4700,,,,Fuldtid,Akademisk arbejde,"Læge, tandlæge og dyrlæge",Læge,55.2365,11.7593,,,61350,57914,29190658,False,False,https://job.jobnet.dk/CV/FindWork/DetailsSocialmedia/5520636,https://job.jobnet.dk/CV/FindWork/Details/5520636,https://job.jobnet.dk/CV/FindWork/Details/5520636,True,5520636,55.2365,11.7593,"{'Id': 1, 'Name': 'Fuldtid'}, {'Id': 16, 'Name': 'Deltid'}","{'Id': 1, 'Name': 'Almindelige vilkår'}, {'Id': 2, 'Name': 'Fleksjob'}, {'Id': 3, 'Name': 'Skånejob'}, {'Id': 4, 'Name': 'Egnet til efterlønnere og seniorer'}, {'Id': 5, 'Name': 'Job med løntilskud'}, {'Id': 6, 'Name': 'Rotationsjob'}, {'Id': 7, 'Name': 'Virksomhedspraktik'}","{'Id': 1, 'Name': 'Fastansættelse'}, {'Id': 16, 'Name': 'Tidsbegrænset ansættelse'}",Region Sjælland,Alleen 15,58,Danmark,340,Sorø,4,"Hovedstaden, Sjælland og Bornholm",4180,Sorø,,0,Primary,,,,None,61350,1003290870,29190658,None,5520636,5520636,Region Sjælland,Alleen 15,58,Danmark,340,Sorø,4,"Hovedstaden, Sjælland og Bornholm",4180,Sorø,,0,Primary,,,,None,61350,1003290870,29190658,None,,2022-05-02T00:00:00,2022-05-22T00:00:00,"Overlæge til NSR Anæstesiologisk Afdeling, Næstved Sygehus","Overlæge til Næstved, Slagelse og Ringsted sygehus Anæstesiologisk Afdeling, Næstved pr. 1. maj 2022 eller snarest derefter. 
   
 Har du stor interesse for området perioperativ medicin? Og ønsker du kontinuerligt at arbejde med optimeringen af elektive patientforløb og forskning? Så er du den helt rigtige kandidat til stillingen som overlæge ved NSR Anæstesiologisk Afdeling, Næstved, og vi vil gerne indbyde dig til en samtale. 
 Vi søger en bredt uddannet og klinisk erfaren anæstesiolog, som vil være med til at videreudvikle afdelingen i forhold til fleksible og individuelt tilpassede patientforløb. Du forventes aktivt at bidrage til afdelingen med dine kompetencer, og evnen til engagement er en vigtig kvalifikation i afdelingen. Vores værdigrundlag er, at vi arbejder for at skabe respektfulde relationer i mødet med patienten og mellem medarbejdere, hvor ordentlighed og tillid er en forudsætning – og så skal det også være sjovt at gå på arbejde. 
 NSR Anæstesiologisk Afdeling er en velfungerende afdeling med 5 afsnit i alt på Næstved og Slagelse sygehuse. Den opslåede stilling er tilknyttet Næstved Sygehus, hvor vi helt overvejende varetager elektive patientforløb indenfor specialerne ortopædkirurgi, urologi og øjensygdomme. For år tilbage har vi afsluttet en længerevarende omstillingsproces fra akutte til elektive patientforløb. Vi har derfor arbejdet målrettet mod at blive det bedste tilbud til regionens elektive patienter. Det har resulteret i, at vi er blandt de tre sygehuse i Danmark, der har den største og fortsat stigende aktivitet indenfor hofte- og knæalloplastikkirurgi. 
 På Næstved Sygehus gennemføres på operationsgangen årligt ca. 7.000 anæstesier, hvor størstedelen er i ambulant regi. Der udføres mange regionale anæstesier og perifere blokade-anlæggelser. Vi forestår derfor oplæring i spinal anlæggelse for yngre læger i introduktionsstilling fra Slagelse matriklen. Hertil kommer specialistfunktioner indenfor anlæggelse af permanente centralvenøse katetre. I afdelingens sammedagskirurgiske afsnit foretages endvidere ca. 4.000 endoskopier, hvoraf nogle er i generel anæstesi, samt anlægger PEG sonder. Beredskabet på Næstved Sygehus varetages ligeledes i afdelingen, og et team bestående af anæstesilæge og -sygeplejerske kan tilkaldes døgnet rundt til de medicinske afdelinger (onkologi, lungemedicin og neurorehabilitering) og skadestuen. 
 Afdelingens overlæger tildeles ansvar for specifikke fagområder efter kvalifikationer og ønsker. Vi håber, at du byder ind med dine kompetencer, interesser og ønsker. Vi råder over en driftig forskningsenhed RCAI (Research Centre of Anaesthesiology and Intensive Care Medicine, der har international bevågenhed, og vil gerne inddrage dig i disse projekter i dit daglige virke i afdelingen. Du kan læse om vores forskningsprojekter her:  http://appraz.dk/index.html . Det er endvidere vigtigt for os, at du har lyst og evner at indgå i et tæt tværfagligt samarbejde med afdelingens dygtige og engagerede operationssygeplejersker, anæstesi- og opvågningssygeplejersker. 
 Lægestaben med tilknytning til operationsgangen på Næstved Sygehus består af 10 speciallæger (heraf 1 specialeansvarlig overlæge) og en afdelingslæge – sidstnævnte stilling er vagtfri. Der er således 9-skiftet tilstedeværelsesvagt. 
 Om afdelingen i øvrigt 
 NSR Anæstesiologisk Afdeling består fysisk af 5 kliniske afsnit inkl. sterilcentralerne på Næstved, Slagelse og Ringsted sygehuse. 
 Slagelse Sygehus er Region Sjællands aktuelt største akutsygehus med varetagelse af 46% af regionens akutte patienter, og NSR Anæstesiologisk Afdeling har akut og elektiv funktion indenfor mave-tarmkirurgi, ortopædkirurgi, gynækologi, obstetrik, pædiatri, intern medicin (kardiologi, endokrinologi, geriatri/neurologi, reumatologi og medicinsk gastroenterologi), radiologi, psykiatri, klinisk kemi, (klinisk immunologi og klinisk mikrobiologi). Den centrale operationsgang i Slagelse varetager anæstesi og operationssygepleje både som sammedagskirurgiske procedurer og under indlæggelse, og der er to opvågningsafsnit i umiddelbar relation til operationsgangen for henholdsvis sammedagskirurgiske og stationære patienter. Det multidisciplinære intensivafsnit er et niveau 2-afsnit, som behandler ca. 1.300 patienter årligt på de aktuelle 6 intensive sengepladser og de 6 intermediære sengepladser. Der er mulighed for dialyse-behandling. Intensiv afsnit varetager endvidere MobiltAkutTeam-funktion med en udgående intensiv sygeplejerske. I afsnittene i Slagelse er to speciallæger og en yngre læge/uddannelseslæge i tilstedeværelsesvagt, og frem til klokken 20 er der på alle ugens dage desuden en ekstra speciallæge i intensivafsnittet. 
 Tværfagligt Smertecenter Næstved er tillige et afsnit i NSR Anæstesiologisk Afdeling. Smertecentret er det største ud af tre smertecentre i regionen og varetager 41% af den samlede patientgruppe. Det har eksisteret i 8 år og er anerkendt for til stadighed at være på forkant indenfor smerteområdet. Der ydes tværfaglig smertebehandling til patienter med kroniske, komplekse og non-maligne smerter gennem årligt 8.500 ambulante kontakter. 
 Kvalifikationer 
 Vi søger derfor en bredt uddannet anæstesiolog, som vil være med til at videreudvikle afdelingen. 
 Du forventes aktivt at kunne bidrage til afdelingen og fagets udvikling. Evnen til at kunne og ville engagere dig er en vigtig kvalifikation, ligesom du også i pressede situationer skal kunne samarbejde konstruktivt med alle relevante samarbejdspartnere. 
 Afhængigt af dine interesseområde aftales opgave- og ansvarsområde i forbindelse med ansættelsen. 
 Du vil blive vurderet i forhold til de syv lægeroller, og ansøgning skal udformes i forhold til dette. Du bedes derfor i ansøgningen - med bedst mulig dokumentation - forholde dig konkret til de syv lægeroller, jf. Sundhedsstyrelsens rapport:  De syv lægeroller, fra maj 2013  
 Løn- og ansættelsesvilkår er efter gældende overenskomst. 
 Yderligere oplysninger kan fås ved henvendelse til ledende overlæge Birgitte Schousboe, 2344 4425. 
 Stillings- og funktionsbeskrivelse kan rekvireres hos ledelseskonsulent Pia van der Watt, 5651 4796. 
 I forbindelse med ansættelse indhentes § 36-børneattest, hvortil samtykke indhentes ved ansættelsessamtale. 
 Ansøgningsfristen er tirsdag 22. maj 2022, og samtaler forventes afholdt i uge 21. Næstved, Slagelse og Ringsted sygehuse  
 Sammen er vi bedst.",Ringstedgade 61,58,Danmark,370,Næstved,4,"Hovedstaden, Sjælland og Bornholm",4700,Næstved,1,1,Fuldtid,None,None,1,,0,,0,0,0,,False,"{'Id': 7951738, 'Email': None, 'FaxNumber': None, 'PersonName': 'Birgitte Schousboe', 'FirstName': 'Birgitte', 'LastName': 'Schousboe', 'PositionTitle': None, 'PhoneNumbers': [{'Number': '23444425', 'Type': 0, 'Description': 'Hovednummer'}]}",2022-07-01T00:00:00,False,False,False,False,4,,,False,False,False,False,,,,,https://www.regionsjaelland.dk/JobOgKarriere/Sider/JobSide.aspx?nr=23701,False,2022-05-22T00:00:00,,0,Primary,7,/CV/FindWork/GetLogo?JobAdId=5520636&WorkPlace=61350&Organisation=29190658,"Ringstedgade 61,4700, Næstved",True,False,"/CV/Jobseeking/JobLog/CreateJobSearch?JobnetJobPostingIdentifier=5520636&Company.Name=Region Sjælland&SubmissionDeadlineDate=2022-5-22&Title=Overlæge til NSR Anæstesiologisk Afdeling, Næstved Sygehus&WeeklyWorkTime=1",00000000-0000-0000-0000-000000000000,False,0,,,"Overlæge til NSR Anæstesiologisk Afdeling, Næstved Sygehus",True,,True,1,,5520636,,,False,False,,0,False,Region Sjælland,Alleen 15,,,4180,False,False,False,Sorø,Birgitte Schousboe,23444425,,,,,,False,,2022-05-22T00:00:00,,0,False,0,,,,,0,,,,False,False,,,False,False,,,,False,,False,,,Arbejdspladsen ligger i Næstved kommune,False,Region Sjælland,,None,,False,False,"Overl&aelig;ge til N&aelig;stved, Slagelse og Ringsted sygehus An&aelig;stesiologisk Afdeling, N&aelig;stved pr. 1. maj 2022 eller snarest derefter.

 

Har du stor interesse for omr&aring;det perioperativ medicin? Og &oslash;nsker du kontinuerligt at arbejde med optimeringen af elektive patientforl&oslash;b og forskning? S&aring; er du den hel","""Overl\u0026aelig;ge til N\u0026aelig;stved, Slagelse og Ringsted sygehus An\u0026aelig;stesiologisk Afdeling, N\u0026aelig;stved pr. 1. maj 2022 eller snarest derefter.\r\n\r\n \r\n\r\nHar du stor interesse for omr\u0026aring;det perioperativ medicin? Og \u0026oslash;nsker du kontinuerligt at arbejde med optimeringen af elektive patientforl\u0026oslash;b og forskning? S\u0026aring; er du den hel""","""Overlæge til NSR Anæstesiologisk Afdeling, Næstved Sygehus""","https://www.google.dk/maps/dir//Ringstedgade+61,4700,+Næstved/","Overlæge til Næstved, Slagelse og Ringsted sygehus Anæstesiologisk Afdeling, Næstved pr. 1. maj 2022 eller snarest derefter. 
   
 Har du stor interesse for området perioperativ medicin? Og ønsker du kontinuerligt at arbejde med optimeringen af elektive patientforløb og forskning? Så er du den helt rigtige kandidat til stillingen som overlæge ved NSR Anæstesiologisk Afdeling, Næstved, og vi vil gerne indbyde dig til en samtale. 
 Vi søger en bredt uddannet og klinisk erfaren anæstesiolog, som vil være med til at videreudvikle afdelingen i forhold til fleksible og individuelt tilpassede patientforløb. Du forventes aktivt at bidrage til afdelingen med dine kompetencer, og evnen til engagement er en vigtig kvalifikation i afdelingen. Vores værdigrundlag er, at vi arbejder for at skabe respektfulde relationer i mødet med patienten og mellem medarbejdere, hvor ordentlighed og tillid er en forudsætning – og så skal det også være sjovt at gå på arbejde. 
 NSR Anæstesiologisk Afdeling er en velfungerende afdeling med 5 afsnit i alt på Næstved og Slagelse sygehuse. Den opslåede stilling er tilknyttet Næstved Sygehus, hvor vi helt overvejende varetager elektive patientforløb indenfor specialerne ortopædkirurgi, urologi og øjensygdomme. For år tilbage har vi afsluttet en længerevarende omstillingsproces fra akutte til elektive patientforløb. Vi har derfor arbejdet målrettet mod at blive det bedste tilbud til regionens elektive patienter. Det har resulteret i, at vi er blandt de tre sygehuse i Danmark, der har den største og fortsat stigende aktivitet indenfor hofte- og knæalloplastikkirurgi. 
 På Næstved Sygehus gennemføres på operationsgangen årligt ca. 7.000 anæstesier, hvor størstedelen er i ambulant regi. Der udføres mange regionale anæstesier og perifere blokade-anlæggelser. Vi forestår derfor oplæring i spinal anlæggelse for yngre læger i introduktionsstilling fra Slagelse matriklen. Hertil kommer specialistfunktioner indenfor anlæggelse af permanente centralvenøse katetre. I afdelingens sammedagskirurgiske afsnit foretages endvidere ca. 4.000 endoskopier, hvoraf nogle er i generel anæstesi, samt anlægger PEG sonder. Beredskabet på Næstved Sygehus varetages ligeledes i afdelingen, og et team bestående af anæstesilæge og -sygeplejerske kan tilkaldes døgnet rundt til de medicinske afdelinger (onkologi, lungemedicin og neurorehabilitering) og skadestuen. 
 Afdelingens overlæger tildeles ansvar for specifikke fagområder efter kvalifikationer og ønsker. Vi håber, at du byder ind med dine kompetencer, interesser og ønsker. Vi råder over en driftig forskningsenhed RCAI (Research Centre of Anaesthesiology and Intensive Care Medicine, der har international bevågenhed, og vil gerne inddrage dig i disse projekter i dit daglige virke i afdelingen. Du kan læse om vores forskningsprojekter her:  http://appraz.dk/index.html . Det er endvidere vigtigt for os, at du har lyst og evner at indgå i et tæt tværfagligt samarbejde med afdelingens dygtige og engagerede operationssygeplejersker, anæstesi- og opvågningssygeplejersker. 
 Lægestaben med tilknytning til operationsgangen på Næstved Sygehus består af 10 speciallæger (heraf 1 specialeansvarlig overlæge) og en afdelingslæge – sidstnævnte stilling er vagtfri. Der er således 9-skiftet tilstedeværelsesvagt. 
 Om afdelingen i øvrigt 
 NSR Anæstesiologisk Afdeling består fysisk af 5 kliniske afsnit inkl. sterilcentralerne på Næstved, Slagelse og Ringsted sygehuse. 
 Slagelse Sygehus er Region Sjællands aktuelt største akutsygehus med varetagelse af 46% af regionens akutte patienter, og NSR Anæstesiologisk Afdeling har akut og elektiv funktion indenfor mave-tarmkirurgi, ortopædkirurgi, gynækologi, obstetrik, pædiatri, intern medicin (kardiologi, endokrinologi, geriatri/neurologi, reumatologi og medicinsk gastroenterologi), radiologi, psykiatri, klinisk kemi, (klinisk immunologi og klinisk mikrobiologi). Den centrale operationsgang i Slagelse varetager anæstesi og operationssygepleje både som sammedagskirurgiske procedurer og under indlæggelse, og der er to opvågningsafsnit i umiddelbar relation til operationsgangen for henholdsvis sammedagskirurgiske og stationære patienter. Det multidisciplinære intensivafsnit er et niveau 2-afsnit, som behandler ca. 1.300 patienter årligt på de aktuelle 6 intensive sengepladser og de 6 intermediære sengepladser. Der er mulighed for dialyse-behandling. Intensiv afsnit varetager endvidere MobiltAkutTeam-funktion med en udgående intensiv sygeplejerske. I afsnittene i Slagelse er to speciallæger og en yngre læge/uddannelseslæge i tilstedeværelsesvagt, og frem til klokken 20 er der på alle ugens dage desuden en ekstra speciallæge i intensivafsnittet. 
 Tværfagligt Smertecenter Næstved er tillige et afsnit i NSR Anæstesiologisk Afdeling. Smertecentret er det største ud af tre smertecentre i regionen og varetager 41% af den samlede patientgruppe. Det har eksisteret i 8 år og er anerkendt for til stadighed at være på forkant indenfor smerteområdet. Der ydes tværfaglig smertebehandling til patienter med kroniske, komplekse og non-maligne smerter gennem årligt 8.500 ambulante kontakter. 
 Kvalifikationer 
 Vi søger derfor en bredt uddannet anæstesiolog, som vil være med til at videreudvikle afdelingen. 
 Du forventes aktivt at kunne bidrage til afdelingen og fagets udvikling. Evnen til at kunne og ville engagere dig er en vigtig kvalifikation, ligesom du også i pressede situationer skal kunne samarbejde konstruktivt med alle relevante samarbejdspartnere. 
 Afhængigt af dine interesseområde aftales opgave- og ansvarsområde i forbindelse med ansættelsen. 
 Du vil blive vurderet i forhold til de syv lægeroller, og ansøgning skal udformes i forhold til dette. Du bedes derfor i ansøgningen - med bedst mulig dokumentation - forholde dig konkret til de syv lægeroller, jf. Sundhedsstyrelsens rapport:  De syv lægeroller, fra maj 2013 
 Løn- og ansættelsesvilkår er efter gældende overenskomst. 
 Yderligere oplysninger kan fås ved henvendelse til ledende overlæge Birgitte Schousboe, 2344 4425. 
 Stillings- og funktionsbeskrivelse kan rekvireres hos ledelseskonsulent Pia van der Watt, 5651 4796. 
 I forbindelse med ansættelse indhentes § 36-børneattest, hvortil samtykke indhentes ved ansættelsessamtale. 
 Ansøgningsfristen er tirsdag 22. maj 2022, og samtaler forventes afholdt i uge 21. Næstved, Slagelse og Ringsted sygehuse  
 Sammen er vi bedst.","https://www.google.dk/maps/place/Ringstedgade+61,4700,+Næstved/",29190658,False,False,,False
