summary_AutomatchType,summary_Abroad,summary_Weight,summary_Title,summary_JobHeadline,summary_Presentation,summary_HiringOrgName,summary_WorkPlaceAddress,summary_WorkPlacePostalCode,summary_WorkPlaceCity,summary_WorkPlaceOtherAddress,summary_WorkPlaceAbroad,summary_WorkPlaceNotStatic,summary_UseWorkPlaceAddressForJoblog,summary_PostingCreated,summary_LastDateApplication,summary_FormattedLastDateApplication,summary_AssignmentStartDate,summary_IsHotjob,summary_IsExternal,summary_Url,summary_Region,summary_Municipality,summary_Country,summary_PostalCode,summary_PostalCodeName,summary_JobAnnouncementType,summary_EmploymentType,summary_WorkHours,summary_OccupationArea,summary_OccupationGroup,summary_Occupation,summary_Location_Latitude,summary_Location_Longitude,summary_JoblogWorkTime_WorkHour,summary_JoblogWorkTime_DailyWorkTime,summary_WorkplaceID,summary_OrganisationId,summary_HiringOrgCVR,summary_UserLoggedIn,summary_AnonymousEmployer,summary_ShareUrl,summary_DetailsUrl,summary_JobLogUrl,summary_HasLocationValues,summary_ID,summary_Latitude,summary_Longitude,details_WorkSchedule,details_WorkConditions,details_EmploymentTypes,details_WorkPlace_Name,details_WorkPlace_Address_AddressLine,details_WorkPlace_Address_Country_Id,details_WorkPlace_Address_Country_Name,details_WorkPlace_Address_Municipality_Id,details_WorkPlace_Address_Municipality_Name,details_WorkPlace_Address_Region_Id,details_WorkPlace_Address_Region_Name,details_WorkPlace_Address_PostalCode,details_WorkPlace_Address_City,details_WorkPlace_PhoneNumber_Number,details_WorkPlace_PhoneNumber_Type,details_WorkPlace_PhoneNumber_Description,details_WorkPlace_FaxNumber,details_WorkPlace_Email,details_WorkPlace_WebAddress,details_WorkPlace_Description,details_WorkPlace_Logo,details_WorkPlace_WorkPlaceOrganizationNumber,details_WorkPlace_OrganizationNumber,details_WorkPlace_OrganizationDescription,details_JobPositionPosting_Id,details_JobPositionPosting_OriginalJppId,details_JobPositionPosting_HiringOrg_Name,details_JobPositionPosting_HiringOrg_Address_AddressLine,details_JobPositionPosting_HiringOrg_Address_Country_Id,details_JobPositionPosting_HiringOrg_Address_Country_Name,details_JobPositionPosting_HiringOrg_Address_Municipality_Id,details_JobPositionPosting_HiringOrg_Address_Municipality_Name,details_JobPositionPosting_HiringOrg_Address_Region_Id,details_JobPositionPosting_HiringOrg_Address_Region_Name,details_JobPositionPosting_HiringOrg_Address_PostalCode,details_JobPositionPosting_HiringOrg_Address_City,details_JobPositionPosting_HiringOrg_PhoneNumber_Number,details_JobPositionPosting_HiringOrg_PhoneNumber_Type,details_JobPositionPosting_HiringOrg_PhoneNumber_Description,details_JobPositionPosting_HiringOrg_FaxNumber,details_JobPositionPosting_HiringOrg_Email,details_JobPositionPosting_HiringOrg_WebAddress,details_JobPositionPosting_HiringOrg_Description,details_JobPositionPosting_HiringOrg_Logo,details_JobPositionPosting_HiringOrg_WorkPlaceOrganizationNumber,details_JobPositionPosting_HiringOrg_OrganizationNumber,details_JobPositionPosting_HiringOrg_OrganizationDescription,details_JobPositionPosting_RecruitingCompany,details_JobPositionPosting_PublicationStartDate,details_JobPositionPosting_PublicationEndDate,details_JobPositionPosting_JobPositionInformation_PositionTitle,details_JobPositionPosting_JobPositionInformation_Purpose,details_JobPositionPosting_JobPositionInformation_WorkLocation_AddressLine,details_JobPositionPosting_JobPositionInformation_WorkLocation_Country_Id,details_JobPositionPosting_JobPositionInformation_WorkLocation_Country_Name,details_JobPositionPosting_JobPositionInformation_WorkLocation_Municipality_Id,details_JobPositionPosting_JobPositionInformation_WorkLocation_Municipality_Name,details_JobPositionPosting_JobPositionInformation_WorkLocation_Region_Id,details_JobPositionPosting_JobPositionInformation_WorkLocation_Region_Name,details_JobPositionPosting_JobPositionInformation_WorkLocation_PostalCode,details_JobPositionPosting_JobPositionInformation_WorkLocation_City,details_JobPositionPosting_JobPositionInformation_EmploymentType,details_JobPositionPosting_JobPositionInformation_WeeklyWorkHours_TypeId,details_JobPositionPosting_JobPositionInformation_WeeklyWorkHours_TypeName,details_JobPositionPosting_JobPositionInformation_WeeklyWorkHours_Description,details_JobPositionPosting_JobPositionInformation_CompensationDescription,details_JobPositionPosting_JobPositionInformation_NumberToFill,details_JobPositionPosting_JobPositionInformation_DriverLicense,details_JobPositionPosting_JobPositionInformation_Occupation_DiscoWeb,details_JobPositionPosting_JobPositionInformation_Occupation_AlternateNames,details_JobPositionPosting_JobPositionInformation_Occupation_GroupId,details_JobPositionPosting_JobPositionInformation_Occupation_AreaId,details_JobPositionPosting_JobPositionInformation_Occupation_Id,details_JobPositionPosting_JobPositionInformation_Occupation_Name,details_JobPositionPosting_JobPositionInformation_IsGovernmentHiring,details_JobPositionPosting_JobPositionInformation_JppContacts,details_JobPositionPosting_JobPositionInformation_EmploymentDate,details_JobPositionPosting_IsRecruitmentOfForeignNationals,details_JobPositionPosting_IsWorkInDenmark,details_JobPositionPosting_IsAnonymousEmployer,details_JobPositionPosting_IsDisabilityFriendly,details_JobPositionPosting_JppType,details_JobPositionPosting_ApplicationDetails_WorkHourMax,details_JobPositionPosting_ApplicationDetails_WorkHourMin,details_JobPositionPosting_ApplicationDetails_DailyWorkTimeWeekend,details_JobPositionPosting_ApplicationDetails_DailyWorkTimeNight,details_JobPositionPosting_ApplicationDetails_DailyWorkTimeEvening,details_JobPositionPosting_ApplicationDetails_DailyWorkTimeDay,details_JobPositionPosting_ApplicationDetails_ReferenceText,details_JobPositionPosting_ApplicationDetails_RemarksToApplicant,details_JobPositionPosting_ApplicationDetails_ByEmail,details_JobPositionPosting_ApplicationDetails_ByPhone,details_JobPositionPosting_ApplicationDetails_ApplyViaUrl,details_JobPositionPosting_ApplicationDetails_ReplyInWriting,details_JobPositionPosting_ApplicationDetails_ApplicationDeadlineDate,details_JobPositionPosting_ContactAuthorityPhoneNumber_Number,details_JobPositionPosting_ContactAuthorityPhoneNumber_Type,details_JobPositionPosting_ContactAuthorityPhoneNumber_Description,details_JobPositionPosting_Status,details_LogoUrl,details_Address,details_ShowMap,details_ShowShareButtonJobLog,details_JobLogUrl,details_JobLogTemplateModel_Identifier,details_JobLogTemplateModel_UseWorkPlaceAddressForJoblog,details_JobLogTemplateModel_Category,details_JobLogTemplateModel_CvCustomerIdentifier,details_JobLogTemplateModel_JobSeekingStatus,details_JobLogTemplateModel_Title,details_JobLogTemplateModel_IsApplicationSourceRequired,details_JobLogTemplateModel_ApplicationSource,details_JobLogTemplateModel_IsWeeklyWorkTimeRequired,details_JobLogTemplateModel_WeeklyWorkTime,details_JobLogTemplateModel_HoursPerWeek,details_JobLogTemplateModel_JobnetJobPostingIdentifier,details_JobLogTemplateModel_JobAdDocument_Title,details_JobLogTemplateModel_JobAdDocument_Identifier,details_JobLogTemplateModel_JobAdDocument_IsDeletedBySystem,details_JobLogTemplateModel_JobAdDocument_IsDeletedByUser,details_JobLogTemplateModel_JobAdFile,details_JobLogTemplateModel_Company_JobLogEntryCategory,details_JobLogTemplateModel_Company_ShowAddressFieldsEvenIfEmpty,details_JobLogTemplateModel_Company_Name,details_JobLogTemplateModel_Company_Address,details_JobLogTemplateModel_Company_Country,details_JobLogTemplateModel_Company_EmploymentAreaID,details_JobLogTemplateModel_Company_PostCode,details_JobLogTemplateModel_Company_IsCountryAndTownAndPostCodeEmpty,details_JobLogTemplateModel_Company_IsTownAndPostCodeEmpty,details_JobLogTemplateModel_Company_IsCountryDanmark,details_JobLogTemplateModel_Company_Town,details_JobLogTemplateModel_Company_ContactPerson,details_JobLogTemplateModel_Company_Phone,details_JobLogTemplateModel_Company_Email,details_JobLogTemplateModel_Company_Latitude,details_JobLogTemplateModel_Company_Longitude,details_JobLogTemplateModel_Company_DailyTravelTimeInMinutes,details_JobLogTemplateModel_Company_DistanceToCompanyInMeters,details_JobLogTemplateModel_Company_IsCreateMode,details_JobLogTemplateModel_TypeOfSubmission,details_JobLogTemplateModel_SubmissionDate,details_JobLogTemplateModel_SubmissionDateFormatted,details_JobLogTemplateModel_SubmissionDateTiks,details_JobLogTemplateModel_IsSubmissionDateRequired,details_JobLogTemplateModel_Status,details_JobLogTemplateModel_DateCreatedFormatted,details_JobLogTemplateModel_DateCreated,details_JobLogTemplateModel_DateModifiedFormatted,details_JobLogTemplateModel_DateModified,details_JobLogTemplateModel_LastModifiedDateTiks,details_JobLogTemplateModel_DateClosed,details_JobLogTemplateModel_JobApplicationDocument_Title,details_JobLogTemplateModel_JobApplicationDocument_Identifier,details_JobLogTemplateModel_JobApplicationDocument_IsDeletedBySystem,details_JobLogTemplateModel_JobApplicationDocument_IsDeletedByUser,details_JobLogTemplateModel_CvDocument_Title,details_JobLogTemplateModel_CvDocument_Identifier,details_JobLogTemplateModel_CvDocument_IsDeletedBySystem,details_JobLogTemplateModel_CvDocument_IsDeletedByUser,details_JobLogTemplateModel_JobApplicationFile,details_JobLogTemplateModel_CvFile,details_JobLogTemplateModel_SubmissionDeadlineDate,details_JobLogTemplateModel_IsPersisted,details_JobLogTemplateModel_ServerValidationErrors,details_JobLogTemplateModel_HasServerValidationErrors,details_JoblogWorkTime_WorkHour,details_JoblogWorkTime_DailyWorkTime,details_Place,details_OpenPrintDialog,details_WorkPlaceInfoText,details_JobCenterContactDetails,details_WorkPlaceDescriptionText,details_FavoriteText,details_IsFavorite,details_ShowFavorite,details_MetaOgTextForSharing,details_DescriptionForSharing,details_TitleForSharing,details_RutePlan,details_FormattedPurpose,details_MapUrl,details_OrganizationNumber,details_ShowSearchJobButton,details_ShowPrint,details_BackToFindWorkButtonUrl,isExternal
0,False,1,Selvstændig controller til samarbejdende og udviklingsorienteret projekt- og videnshus,Selvstændig controller til samarbejdende og udviklingsorienteret projekt- og videnshus,"
Kan du kommunikere komplekse tal, så dine kolleger kan forstå dem? Har du økonomi og pro",Work-live-stay,Innovations Allé 3,7100,Vejle,False,False,False,True,2022-03-15T00:00:00,2022-05-10T00:00:00,10. maj 2022,0001-01-01T00:00:00,False,False,https://job.jobnet.dk/CV/FindWork/Details/5530903,Syddanmark,Vejle,Danmark,7100,,,,Fuldtid,Akademisk arbejde,Økonomi og revision,Økonomicontroller,55.7345,9.5834,,,129746,114043,34744971,False,False,https://job.jobnet.dk/CV/FindWork/DetailsSocialmedia/5530903,https://job.jobnet.dk/CV/FindWork/Details/5530903,https://job.jobnet.dk/CV/FindWork/Details/5530903,True,5530903,55.7345,9.5834,"{'Id': 1, 'Name': 'Fuldtid'}, {'Id': 16, 'Name': 'Deltid'}","{'Id': 1, 'Name': 'Almindelige vilkår'}, {'Id': 2, 'Name': 'Fleksjob'}, {'Id': 3, 'Name': 'Skånejob'}, {'Id': 4, 'Name': 'Egnet til efterlønnere og seniorer'}, {'Id': 5, 'Name': 'Job med løntilskud'}, {'Id': 6, 'Name': 'Rotationsjob'}, {'Id': 7, 'Name': 'Virksomhedspraktik'}","{'Id': 1, 'Name': 'Fastansættelse'}, {'Id': 16, 'Name': 'Tidsbegrænset ansættelse'}",Work-live-stay,Innovations Allé 3,58,Danmark,630,Vejle,3,Syddanmark,7100,Vejle,,0,Primary,,,,None,,1018093843,34744971,None,5530903,5530903,Work-live-stay,Innovations Allé 3,58,Danmark,630,Vejle,3,Syddanmark,7100,Vejle,,0,Primary,,,,None,,1018093843,34744971,None,,2022-03-15T00:00:00,2022-05-10T00:00:00,Selvstændig controller til samarbejdende og udviklingsorienteret projekt- og videnshus,"Kan du kommunikere komplekse tal, så dine kolleger kan forstå dem? Har du økonomi og projektkontrol på rygraden? Og formår du at bevare overblikket og prioritere dine opgaver?   
   
 Så er det måske dig, vi søger, til at tage hånd om vores controlleropgaver i work-live-stay.   
 Som controller hos work-live-stay kommer du til at spille en central rolle i vores overordnede økonomistyring – og særligt i den økonomiske styring og afrapportering af vores projekter.   
 Vores projektportefølge består i høj grad af EU Socialfondsprojekter med kvalificeret arbejdskraft i fokus. I work-live-stay arbejder vi nemlig hårdt for at gøre det let for danske arbejdspladser at tiltrække, modtage og fastholde dansk og international arbejdskraft – til gavn for det danske samfund.  
 Til dagligt vil du referere direkte til foreningens direktør, og have ansvaret for den overordnede økonomistyring i work-live-stay. Derudover er du ansvarlig for regnskabet og for at føre tilsyn med projekternes økonomi. På vores kontor i Vejle bliver du en vigtig spiller på vores hold af dygtige og engagerede medarbejdere, hvor vi alle løfter i flok.  
   
 Dine ansvarsområder:   
 
 
 Ansvar for overordnet økonomistyring i work-live-stay  
 
 
 Ansvar for controlling af projekter i samarbejde med vores program-/projektledere  
 
 
 Sikre overensstemmelse med bevillingsforudsætningerne i projekterne.   
 
 
 Ansvar for at føre tilsyn og styre projekternes økonomiske aspekter   
 
 
 Ansvar for de samlede controlleropgaver, herunder månedlig budgetopfølgning, kontering, regnskabsaflæggelse og halvårlig afrapportering til myndighederne.   
 
 
 Dine opgaver:   
 
 
 Årsrapport, regnskab, budgettering og opfølgning.   
 
 
 Økonomisk afrapportering på projekter  
 
 
 Sparring på udbudsopgaver ifm. udviklingsprojekter.  
 
 
 Ad hoc-regnskabsmæssige projektopgaver.  
 
 
 
 
 Rapportering, herunder også til work-live-stay’s bestyrelse.  
 
 
 Økonomiske beslutningsoplæg og styringsredskaber.  
 
 
 Udarbejdelse af løngrundlag.  
 
 
 Samarbejde med ekstern leverandør af regnskabsydelser  
 
 
 Om dig   
 Vi lægger stor vægt på, at du har erfaring. Ideelt set fra en projektorganisation, der har arbejdet med EU Socialfondsprojekter. Vi ser gerne, at du har arbejdet- og er fortrolig med alle former for controlleropgaver.  
   
 Som person er du en holdspiller, der holder hovedet koldt – selv i pressede situationer. Du formår at bevare overblikket og har øje på detaljerne. Du trives med strategisk ansvar, og er opsøgende, løsningsorienteret og kvalitetsbevidst. Og så forstår du værdien af et stærkt samarbejde, og evner at skabe gode samarbejdsrelationer på tværs af organisationen – både som faglig og social kollega, der bidrager til organisationens kulturelle og faglige udvikling.  
   
 Faglig baggrund og erfaring   
 Vi forventer selvfølgelig ikke, at du kan sætte kryds ved det hele, men det vil være en fordel hvis du:  
 
 
 har erfaring fra en projektdrevet organisation, gerne med EU Socialfondsprojekter.  
 
 
 er analytisk stærk.  
 
 
 har skarp forretningsforståelse.  
 
 
 er struktureret og skaber overblik med sans for både detaljen og kvalitet.  
 
 
 
 
 er resultat- og løsningsorienteret og formår at udfordre sagligt og professionelt.  
 
 
   
 Kan du genkende dig selv i ovenstående? Så er det måske lige dig, vi leder efter som vores næste værdifulde spiller på holdet.  
   
 Vores nuværende controller går på barselsorlov til sommer, og vi vil gerne sikre en stærk overlevering, så derfor søger vi en kollega, som kan tiltræde hurtigst muligt.  
 Stillingen er på 37 timer om ugen og tidsbegrænset i 12 måneder.",Innovations Allé 3,58,Danmark,630,Vejle,3,Syddanmark,7100,Vejle,16,1,Fuldtid,None,None,1,,0,,0,0,0,,False,"{'Id': 7820409, 'Email': None, 'FaxNumber': None, 'PersonName': 'Janni Norsgaard', 'FirstName': 'Janni', 'LastName': 'Norsgaard', 'PositionTitle': None, 'PhoneNumbers': [{'Number': '2834 2959', 'Type': 0, 'Description': 'Hovednummer'}]}, {'Id': 7820410, 'Email': None, 'FaxNumber': None, 'PersonName': 'Iben Hansen', 'FirstName': 'Iben', 'LastName': 'Hansen', 'PositionTitle': None, 'PhoneNumbers': [{'Number': '20308382', 'Type': 0, 'Description': 'Hovednummer'}]}",,False,False,False,False,4,,,False,False,False,False,,,,,https://worklivestay.hr-on.com/show-job/91015,False,2022-05-10T00:00:00,,0,Primary,7,/CV/FindWork/GetLogo?JobAdId=5530903&Organisation=34744971,"Innovations Allé 3,7100, Vejle",True,False,/CV/Jobseeking/JobLog/CreateJobSearch?JobnetJobPostingIdentifier=5530903&Company.Name=Work-live-stay&SubmissionDeadlineDate=2022-5-10&Title=Selvstændig controller til samarbejdende og udviklingsorienteret projekt- og videnshus&WeeklyWorkTime=1,00000000-0000-0000-0000-000000000000,False,0,,,Selvstændig controller til samarbejdende og udviklingsorienteret projekt- og videnshus,True,,True,1,,5530903,,,False,False,,0,False,Work-live-stay,Innovations Allé 3,,,7100,False,False,False,Vejle,Janni Norsgaard,2834 2959,,,,,,False,,2022-05-10T00:00:00,,0,False,0,,,,,0,,,,False,False,,,False,False,,,,False,,False,,,Arbejdspladsen ligger i Vejle kommune,False,Work-live-stay,,None,,False,False,"Kan du kommunikere komplekse tal, s&aring; dine kolleger kan forst&aring; dem? Har du &oslash;konomi og projektkontrol p&aring; rygraden? Og form&aring;r du at bevare overblikket og prioritere dine opgaver? 



 



S&aring; er det m&aring;ske dig, vi s&oslash;ger, til at tage h&aring;nd om vores controlleropgaver i work-live-stay.  


","""Kan du kommunikere komplekse tal, s\u0026aring; dine kolleger kan forst\u0026aring; dem? Har du \u0026oslash;konomi og projektkontrol p\u0026aring; rygraden? Og form\u0026aring;r du at bevare overblikket og prioritere dine opgaver? \r\n\r\n\r\n\r\n \r\n\r\n\r\n\r\nS\u0026aring; er det m\u0026aring;ske dig, vi s\u0026oslash;ger, til at tage h\u0026aring;nd om vores controlleropgaver i work-live-stay.  \r\n\r\n\r\n\r""","""Selvstændig controller til samarbejdende og udviklingsorienteret projekt- og videnshus""","https://www.google.dk/maps/dir//Innovations+Allé+3,7100,+Vejle/","Kan du kommunikere komplekse tal, så dine kolleger kan forstå dem? Har du økonomi og projektkontrol på rygraden? Og formår du at bevare overblikket og prioritere dine opgaver?   
   
 Så er det måske dig, vi søger, til at tage hånd om vores controlleropgaver i work-live-stay.   
 Som controller hos work-live-stay kommer du til at spille en central rolle i vores overordnede økonomistyring – og særligt i den økonomiske styring og afrapportering af vores projekter.   
 Vores projektportefølge består i høj grad af EU Socialfondsprojekter med kvalificeret arbejdskraft i fokus. I work-live-stay arbejder vi nemlig hårdt for at gøre det let for danske arbejdspladser at tiltrække, modtage og fastholde dansk og international arbejdskraft – til gavn for det danske samfund.  
 Til dagligt vil du referere direkte til foreningens direktør, og have ansvaret for den overordnede økonomistyring i work-live-stay. Derudover er du ansvarlig for regnskabet og for at føre tilsyn med projekternes økonomi. På vores kontor i Vejle bliver du en vigtig spiller på vores hold af dygtige og engagerede medarbejdere, hvor vi alle løfter i flok.  
   
 Dine ansvarsområder:   
 
 
 Ansvar for overordnet økonomistyring i work-live-stay  
 
 
 Ansvar for controlling af projekter i samarbejde med vores program-/projektledere  
 
 
 Sikre overensstemmelse med bevillingsforudsætningerne i projekterne.   
 
 
 Ansvar for at føre tilsyn og styre projekternes økonomiske aspekter   
 
 
 Ansvar for de samlede controlleropgaver, herunder månedlig budgetopfølgning, kontering, regnskabsaflæggelse og halvårlig afrapportering til myndighederne.   
 
 
 Dine opgaver:   
 
 
 Årsrapport, regnskab, budgettering og opfølgning.   
 
 
 Økonomisk afrapportering på projekter  
 
 
 Sparring på udbudsopgaver ifm. udviklingsprojekter.  
 
 
 Ad hoc-regnskabsmæssige projektopgaver.  
 
 
 
 
 Rapportering, herunder også til work-live-stay’s bestyrelse.  
 
 
 Økonomiske beslutningsoplæg og styringsredskaber.  
 
 
 Udarbejdelse af løngrundlag.  
 
 
 Samarbejde med ekstern leverandør af regnskabsydelser  
 
 
 Om dig   
 Vi lægger stor vægt på, at du har erfaring. Ideelt set fra en projektorganisation, der har arbejdet med EU Socialfondsprojekter. Vi ser gerne, at du har arbejdet- og er fortrolig med alle former for controlleropgaver.  
   
 Som person er du en holdspiller, der holder hovedet koldt – selv i pressede situationer. Du formår at bevare overblikket og har øje på detaljerne. Du trives med strategisk ansvar, og er opsøgende, løsningsorienteret og kvalitetsbevidst. Og så forstår du værdien af et stærkt samarbejde, og evner at skabe gode samarbejdsrelationer på tværs af organisationen – både som faglig og social kollega, der bidrager til organisationens kulturelle og faglige udvikling.  
   
 Faglig baggrund og erfaring   
 Vi forventer selvfølgelig ikke, at du kan sætte kryds ved det hele, men det vil være en fordel hvis du:  
 
 
 har erfaring fra en projektdrevet organisation, gerne med EU Socialfondsprojekter.  
 
 
 er analytisk stærk.  
 
 
 har skarp forretningsforståelse.  
 
 
 er struktureret og skaber overblik med sans for både detaljen og kvalitet.  
 
 
 
 
 er resultat- og løsningsorienteret og formår at udfordre sagligt og professionelt.  
 
 
   
 Kan du genkende dig selv i ovenstående? Så er det måske lige dig, vi leder efter som vores næste værdifulde spiller på holdet.  
   
 Vores nuværende controller går på barselsorlov til sommer, og vi vil gerne sikre en stærk overlevering, så derfor søger vi en kollega, som kan tiltræde hurtigst muligt.  
 Stillingen er på 37 timer om ugen og tidsbegrænset i 12 måneder.","https://www.google.dk/maps/place/Innovations+Allé+3,7100,+Vejle/",34744971,False,False,,False
