summary_AutomatchType,summary_Abroad,summary_Weight,summary_Title,summary_JobHeadline,summary_Presentation,summary_HiringOrgName,summary_WorkPlaceAddress,summary_WorkPlacePostalCode,summary_WorkPlaceCity,summary_WorkPlaceOtherAddress,summary_WorkPlaceAbroad,summary_WorkPlaceNotStatic,summary_UseWorkPlaceAddressForJoblog,summary_PostingCreated,summary_LastDateApplication,summary_FormattedLastDateApplication,summary_AssignmentStartDate,summary_IsHotjob,summary_IsExternal,summary_Url,summary_Region,summary_Municipality,summary_Country,summary_PostalCode,summary_PostalCodeName,summary_JobAnnouncementType,summary_EmploymentType,summary_WorkHours,summary_OccupationArea,summary_OccupationGroup,summary_Occupation,summary_Location_Latitude,summary_Location_Longitude,summary_JoblogWorkTime_WorkHour,summary_JoblogWorkTime_DailyWorkTime,summary_WorkplaceID,summary_OrganisationId,summary_HiringOrgCVR,summary_UserLoggedIn,summary_AnonymousEmployer,summary_ShareUrl,summary_DetailsUrl,summary_JobLogUrl,summary_HasLocationValues,summary_ID,summary_Latitude,summary_Longitude,details_WorkSchedule,details_WorkConditions,details_EmploymentTypes,details_WorkPlace_Name,details_WorkPlace_Address_AddressLine,details_WorkPlace_Address_Country_Id,details_WorkPlace_Address_Country_Name,details_WorkPlace_Address_Municipality_Id,details_WorkPlace_Address_Municipality_Name,details_WorkPlace_Address_Region_Id,details_WorkPlace_Address_Region_Name,details_WorkPlace_Address_PostalCode,details_WorkPlace_Address_City,details_WorkPlace_PhoneNumber_Number,details_WorkPlace_PhoneNumber_Type,details_WorkPlace_PhoneNumber_Description,details_WorkPlace_FaxNumber,details_WorkPlace_Email,details_WorkPlace_WebAddress,details_WorkPlace_Description,details_WorkPlace_Logo,details_WorkPlace_WorkPlaceOrganizationNumber,details_WorkPlace_OrganizationNumber,details_WorkPlace_OrganizationDescription,details_JobPositionPosting_Id,details_JobPositionPosting_OriginalJppId,details_JobPositionPosting_HiringOrg_Name,details_JobPositionPosting_HiringOrg_Address_AddressLine,details_JobPositionPosting_HiringOrg_Address_Country_Id,details_JobPositionPosting_HiringOrg_Address_Country_Name,details_JobPositionPosting_HiringOrg_Address_Municipality_Id,details_JobPositionPosting_HiringOrg_Address_Municipality_Name,details_JobPositionPosting_HiringOrg_Address_Region_Id,details_JobPositionPosting_HiringOrg_Address_Region_Name,details_JobPositionPosting_HiringOrg_Address_PostalCode,details_JobPositionPosting_HiringOrg_Address_City,details_JobPositionPosting_HiringOrg_PhoneNumber_Number,details_JobPositionPosting_HiringOrg_PhoneNumber_Type,details_JobPositionPosting_HiringOrg_PhoneNumber_Description,details_JobPositionPosting_HiringOrg_FaxNumber,details_JobPositionPosting_HiringOrg_Email,details_JobPositionPosting_HiringOrg_WebAddress,details_JobPositionPosting_HiringOrg_Description,details_JobPositionPosting_HiringOrg_Logo,details_JobPositionPosting_HiringOrg_WorkPlaceOrganizationNumber,details_JobPositionPosting_HiringOrg_OrganizationNumber,details_JobPositionPosting_HiringOrg_OrganizationDescription,details_JobPositionPosting_RecruitingCompany,details_JobPositionPosting_PublicationStartDate,details_JobPositionPosting_PublicationEndDate,details_JobPositionPosting_JobPositionInformation_PositionTitle,details_JobPositionPosting_JobPositionInformation_Purpose,details_JobPositionPosting_JobPositionInformation_WorkLocation_AddressLine,details_JobPositionPosting_JobPositionInformation_WorkLocation_Country_Id,details_JobPositionPosting_JobPositionInformation_WorkLocation_Country_Name,details_JobPositionPosting_JobPositionInformation_WorkLocation_Municipality_Id,details_JobPositionPosting_JobPositionInformation_WorkLocation_Municipality_Name,details_JobPositionPosting_JobPositionInformation_WorkLocation_Region_Id,details_JobPositionPosting_JobPositionInformation_WorkLocation_Region_Name,details_JobPositionPosting_JobPositionInformation_WorkLocation_PostalCode,details_JobPositionPosting_JobPositionInformation_WorkLocation_City,details_JobPositionPosting_JobPositionInformation_EmploymentType,details_JobPositionPosting_JobPositionInformation_WeeklyWorkHours_TypeId,details_JobPositionPosting_JobPositionInformation_WeeklyWorkHours_TypeName,details_JobPositionPosting_JobPositionInformation_WeeklyWorkHours_Description,details_JobPositionPosting_JobPositionInformation_CompensationDescription,details_JobPositionPosting_JobPositionInformation_NumberToFill,details_JobPositionPosting_JobPositionInformation_DriverLicense,details_JobPositionPosting_JobPositionInformation_Occupation_DiscoWeb,details_JobPositionPosting_JobPositionInformation_Occupation_AlternateNames,details_JobPositionPosting_JobPositionInformation_Occupation_GroupId,details_JobPositionPosting_JobPositionInformation_Occupation_AreaId,details_JobPositionPosting_JobPositionInformation_Occupation_Id,details_JobPositionPosting_JobPositionInformation_Occupation_Name,details_JobPositionPosting_JobPositionInformation_IsGovernmentHiring,details_JobPositionPosting_JobPositionInformation_JppContacts,details_JobPositionPosting_JobPositionInformation_EmploymentDate,details_JobPositionPosting_IsRecruitmentOfForeignNationals,details_JobPositionPosting_IsWorkInDenmark,details_JobPositionPosting_IsAnonymousEmployer,details_JobPositionPosting_IsDisabilityFriendly,details_JobPositionPosting_JppType,details_JobPositionPosting_ApplicationDetails_WorkHourMax,details_JobPositionPosting_ApplicationDetails_WorkHourMin,details_JobPositionPosting_ApplicationDetails_DailyWorkTimeWeekend,details_JobPositionPosting_ApplicationDetails_DailyWorkTimeNight,details_JobPositionPosting_ApplicationDetails_DailyWorkTimeEvening,details_JobPositionPosting_ApplicationDetails_DailyWorkTimeDay,details_JobPositionPosting_ApplicationDetails_ReferenceText,details_JobPositionPosting_ApplicationDetails_RemarksToApplicant,details_JobPositionPosting_ApplicationDetails_ByEmail,details_JobPositionPosting_ApplicationDetails_ByPhone,details_JobPositionPosting_ApplicationDetails_ApplyViaUrl,details_JobPositionPosting_ApplicationDetails_ReplyInWriting,details_JobPositionPosting_ApplicationDetails_ApplicationDeadlineDate,details_JobPositionPosting_ContactAuthorityPhoneNumber_Number,details_JobPositionPosting_ContactAuthorityPhoneNumber_Type,details_JobPositionPosting_ContactAuthorityPhoneNumber_Description,details_JobPositionPosting_Status,details_LogoUrl,details_Address,details_ShowMap,details_ShowShareButtonJobLog,details_JobLogUrl,details_JobLogTemplateModel_Identifier,details_JobLogTemplateModel_UseWorkPlaceAddressForJoblog,details_JobLogTemplateModel_Category,details_JobLogTemplateModel_CvCustomerIdentifier,details_JobLogTemplateModel_JobSeekingStatus,details_JobLogTemplateModel_Title,details_JobLogTemplateModel_IsApplicationSourceRequired,details_JobLogTemplateModel_ApplicationSource,details_JobLogTemplateModel_IsWeeklyWorkTimeRequired,details_JobLogTemplateModel_WeeklyWorkTime,details_JobLogTemplateModel_HoursPerWeek,details_JobLogTemplateModel_JobnetJobPostingIdentifier,details_JobLogTemplateModel_JobAdDocument_Title,details_JobLogTemplateModel_JobAdDocument_Identifier,details_JobLogTemplateModel_JobAdDocument_IsDeletedBySystem,details_JobLogTemplateModel_JobAdDocument_IsDeletedByUser,details_JobLogTemplateModel_JobAdFile,details_JobLogTemplateModel_Company_JobLogEntryCategory,details_JobLogTemplateModel_Company_ShowAddressFieldsEvenIfEmpty,details_JobLogTemplateModel_Company_Name,details_JobLogTemplateModel_Company_Address,details_JobLogTemplateModel_Company_Country,details_JobLogTemplateModel_Company_EmploymentAreaID,details_JobLogTemplateModel_Company_PostCode,details_JobLogTemplateModel_Company_IsCountryAndTownAndPostCodeEmpty,details_JobLogTemplateModel_Company_IsTownAndPostCodeEmpty,details_JobLogTemplateModel_Company_IsCountryDanmark,details_JobLogTemplateModel_Company_Town,details_JobLogTemplateModel_Company_ContactPerson,details_JobLogTemplateModel_Company_Phone,details_JobLogTemplateModel_Company_Email,details_JobLogTemplateModel_Company_Latitude,details_JobLogTemplateModel_Company_Longitude,details_JobLogTemplateModel_Company_DailyTravelTimeInMinutes,details_JobLogTemplateModel_Company_DistanceToCompanyInMeters,details_JobLogTemplateModel_Company_IsCreateMode,details_JobLogTemplateModel_TypeOfSubmission,details_JobLogTemplateModel_SubmissionDate,details_JobLogTemplateModel_SubmissionDateFormatted,details_JobLogTemplateModel_SubmissionDateTiks,details_JobLogTemplateModel_IsSubmissionDateRequired,details_JobLogTemplateModel_Status,details_JobLogTemplateModel_DateCreatedFormatted,details_JobLogTemplateModel_DateCreated,details_JobLogTemplateModel_DateModifiedFormatted,details_JobLogTemplateModel_DateModified,details_JobLogTemplateModel_LastModifiedDateTiks,details_JobLogTemplateModel_DateClosed,details_JobLogTemplateModel_JobApplicationDocument_Title,details_JobLogTemplateModel_JobApplicationDocument_Identifier,details_JobLogTemplateModel_JobApplicationDocument_IsDeletedBySystem,details_JobLogTemplateModel_JobApplicationDocument_IsDeletedByUser,details_JobLogTemplateModel_CvDocument_Title,details_JobLogTemplateModel_CvDocument_Identifier,details_JobLogTemplateModel_CvDocument_IsDeletedBySystem,details_JobLogTemplateModel_CvDocument_IsDeletedByUser,details_JobLogTemplateModel_JobApplicationFile,details_JobLogTemplateModel_CvFile,details_JobLogTemplateModel_SubmissionDeadlineDate,details_JobLogTemplateModel_IsPersisted,details_JobLogTemplateModel_ServerValidationErrors,details_JobLogTemplateModel_HasServerValidationErrors,details_JoblogWorkTime_WorkHour,details_JoblogWorkTime_DailyWorkTime,details_Place,details_OpenPrintDialog,details_WorkPlaceInfoText,details_JobCenterContactDetails,details_WorkPlaceDescriptionText,details_FavoriteText,details_IsFavorite,details_ShowFavorite,details_MetaOgTextForSharing,details_DescriptionForSharing,details_TitleForSharing,details_RutePlan,details_FormattedPurpose,details_MapUrl,details_OrganizationNumber,details_ShowSearchJobButton,details_ShowPrint,details_BackToFindWorkButtonUrl,isExternal
0,False,1,Revisor til Dansk Revision – trives du med faglige udfordringer i kombination med et balanceret familieliv?,Revisor til Dansk Revision – trives du med faglige udfordringer i kombination med et balanceret familieliv?," 

For Dansk Revision Wulff & Haaning søger vi en revisor, som ønsker et kvalificeret fagligt modspil på en arbejdsplads med plads til forskellighed. Hos Dansk Revision Wulff & Haaning er de",Asgaard Recruitment,Torvegade 7,9490,Pandrup,True,False,False,False,2022-04-04T00:00:00,2022-05-30T00:00:00,30. maj 2022,0001-01-01T00:00:00,False,False,https://job.jobnet.dk/CV/FindWork/Details/5535253,Nordjylland,Jammerbugt,Danmark,9490,,,,Fuldtid,Akademisk arbejde,Økonomi og revision,Revisor,57.2237,9.6746,,,117443,104553,37046477,False,False,https://job.jobnet.dk/CV/FindWork/DetailsSocialmedia/5535253,https://job.jobnet.dk/CV/FindWork/Details/5535253,https://job.jobnet.dk/CV/FindWork/Details/5535253,True,5535253,57.2237,9.6746,"{'Id': 1, 'Name': 'Fuldtid'}, {'Id': 16, 'Name': 'Deltid'}","{'Id': 1, 'Name': 'Almindelige vilkår'}, {'Id': 2, 'Name': 'Fleksjob'}, {'Id': 3, 'Name': 'Skånejob'}, {'Id': 4, 'Name': 'Egnet til efterlønnere og seniorer'}, {'Id': 5, 'Name': 'Job med løntilskud'}, {'Id': 6, 'Name': 'Rotationsjob'}, {'Id': 7, 'Name': 'Virksomhedspraktik'}","{'Id': 1, 'Name': 'Fastansættelse'}, {'Id': 16, 'Name': 'Tidsbegrænset ansættelse'}",Asgaard Recruitment,Langerak 17,58,Danmark,851,Aalborg,1,Nordjylland,9220,Aalborg Øst,,0,Primary,,,,None,117443,1020684999,37046477,None,5535253,5535253,Asgaard Recruitment,Langerak 17,58,Danmark,851,Aalborg,1,Nordjylland,9220,Aalborg Øst,,0,Primary,,,,None,117443,1020684999,37046477,None,,2022-04-04T00:00:00,2022-05-30T00:00:00,Revisor til Dansk Revision – trives du med faglige udfordringer i kombination med et balanceret familieliv?,"For Dansk Revision Wulff & Haaning søger vi en revisor, som ønsker et kvalificeret fagligt modspil på en arbejdsplads med plads til forskellighed. Hos Dansk Revision Wulff & Haaning er der rum til personlig og faglig udvikling og samtidig et fokus på trivsel samt plads til familieliv og fritidsinteresser. Hos Dansk Revision Wulff & Haaning kan du kombinere et spændende arbejdsliv med tid og overskud til rent faktisk at have et liv. Det tror virksomhedens partnere skaber bedre revision og rådgivning i sidste ende. Med andre ord, Dansk Revision Wulff & Haaning matcher dit ambitionsniveau, uden at du mister balancen mellem arbejdslivet og privatlivet. 
 Hos Dansk Revision Wulff & Haaning er ancienniteten høj. På et tidspunkt er det dog tid til at nyde sit otium og det er lige præcis, hvad en kollega skal. Derfor er vi på vegne af Dansk Revision Wulff & Haaning på udkig efter nye kræfter til kontoret i Pandrup - måske det er dig? 
 Velkommen til Dansk Revision i Pandrup 
 Dansk Revision Wulff & Haaning arbejder for at gøre livet mere enkelt, overskueligt og nemmere for kunderne, som typisk er i SMV-segmentet. Det gøres ved at tage ansvar og være i øjenhøjde med kunderne. Ansvaret er Ikke bare for årsregnskabet, men for alle forhold og aspekter omkring kundernes økonomi. 
 Dansk Revision Wulff & Haaning er en del af Dansk Revision, hvilket er med til at sikre, at den faglige kvalitet er i top og at IT-systemerne altid er tidssvarende. Dansk Revision er en landsdækkende kæde med 29 kontorer og mere end 500 medarbejdere fordelt over hele Danmark.  
 Dansk Revision er ejet af partnere på de enkelte kontorer. Dermed kan virksomheden drage fordel af både den lokale forankring og kendskabet til det lokale erhvervsliv og af samarbejdet mellem fagligt kompetente ejere og medarbejdere i Dansk Revision. Dansk Revision har globalt udsyn og globale kompetencer via  GGI-international . 
 Virksomhedens mål er at tilføre andre virksomheder størst mulig værdi og udbytte gennem løbende økonomisk rådgivning.  
 “Vi sætter en ære i at levere kvalitetsydelser og god service, og altid med kunden i centrum. Vi løser spændende opgaver for kunder omkring Jammerbugt, Vendsyssel og det øvrige Nordjylland.” 
 Christian Haaning, Partner 
 Formidling af tal og udarbejdelse af regnskaber 
 I rollen som revisor er du er med til at sikre gode kundeoplevelser i små og mellemstore ejerledede virksomheder, hvor dit fokus helt naturligt er på opbygning af langvarige relationer.  
 Din portefølje og dine arbejdsopgaver vil i fællesskab blive tilpasset i overensstemmelse med dit erfaringsniveau og din faglige interesse. Kundestørrelserne spænder bredt, så du kan både udleve dit ønske om at fokusere på mindre selvstændige eller mellemstore virksomheder. 
 Dine primære opgaver vil være: 
 
 Selvstændig kundeportefølje og direkte kundekontakt. 
 Medansvar i gennemførsel af revision, gennemgang og diverse erklærings- og revisionsopgaver. 
 Regnskabsudarbejdelse. 
 Skattemæssige opgørelser for selskaber, personlige virksomheder og hovedaktionærer. 
 Rådgivning inden for regnskab, revision, skat og moms. 
 Vidensdeling med kollegaer samt oplæring af nye kollegaer, herunder coaching af trainees. 
 Specialopgaver, herunder omstruktureringer, budgetter og generationsskifter m.v. 
 
 Udover at du skal kunne håndværket, er det essentielt, at du kan lide at arbejde med mennesker, da du vil have tæt samarbejde med både kunder og kollegaer. Du får mulighed for at sparre med kollegaer på kontoret og i hele landet, og alle kunder serviceres i samarbejde med en statsautoriseret revisor. 
 Hos Wulff & Haaning får du et fagligt, familiært og socialt arbejdsmiljø 
 Overarbejde kan ikke helt undgås, men Dansk Revision Wulff & Haaning kvitterer med en pakke som modsvarer dette og en frihed som gør, at dit liv er i balance. Dansk Revision Wulff & Haaning vil gøre alt for at bibeholde dine kompetencer på et højt niveau og understøtte dine faglige drømme og ønsker. 
 Du får otte erfarne og kompetente kollegaer i et fagligt stærkt team på kontoret i Pandrup. Du bliver en del af et miljø med højt til loftet, korte beslutningsprocesser og stor selvstændighed, og hvor humor og en uformel omgangstone bidrager til et inspirerende arbejdsmiljø. Derudover kan du se frem til: 
 
 Alsidige arbejdsopgaver og en udfordrende hverdag. 
 En arbejdsplads med flad organisationsstruktur, hvor du er tæt på en tilgængelig ledelse, og hvor der er kort vej fra tanke til handling. 
 Personlige og tætte kunderelationer og et stærkt kollegialt sammenhold. 
 En humoristisk omgangstone samt fokus på det gode samarbejde og at hjælpe hinanden. 
 En virksomhed, der tror på frihed under ansvar og som vægter ordentlighed. 
 
 Din profil 
 
 Du har næse for revision, og du er uddannet HD-R, cand.merc.aud eller har relevant erfaring indenfor området.  
 Du er en selvstændig teamplayer og drevet af at arbejde mod et fælles mål.  
 Du sætter en ære i at pleje dine kunderelationer og skabe værdi og resultater. 
 Du har en god forretningsforståelse med lysten til at være synlig i forhold til kunderne ved selvstændigt at planlægge, udføre og afslutte opgaverne. 
 Du har gode kommunikationsevner, besidder empati og har altid øje for både helheden og detaljen. 
 Du er stabil og kan se dig selv være hos Dansk Revision Wulff & Haaning i mange år fremadrettet. 
 
 Læs mere  her .",Torvegade 7,58,Danmark,849,Jammerbugt,1,Nordjylland,9490,Pandrup,1,1,Fuldtid,None,None,1,,0,,0,0,0,,False,"{'Id': 7880108, 'Email': None, 'FaxNumber': None, 'PersonName': 'Jens Maagaard', 'FirstName': 'Jens', 'LastName': 'Maagaard', 'PositionTitle': None, 'PhoneNumbers': [{'Number': '+45 30 94 84 81', 'Type': 0, 'Description': 'Hovednummer'}]}",,False,False,False,False,4,,,False,False,False,False,,,,,https://asgaardrecruitment.dk/stillingsopslag/?hr=show-job/91456,False,2022-05-30T00:00:00,,0,Primary,7,/CV/FindWork/GetLogo?JobAdId=5535253&WorkPlace=117443&Organisation=37046477,"Torvegade 7,9490, Pandrup",True,False,/CV/Jobseeking/JobLog/CreateJobSearch?JobnetJobPostingIdentifier=5535253&Company.Name=Asgaard Recruitment&SubmissionDeadlineDate=2022-5-30&Title=Revisor til Dansk Revision – trives du med faglige udfordringer i kombination med et balanceret familieliv?&WeeklyWorkTime=1,00000000-0000-0000-0000-000000000000,False,0,,,Revisor til Dansk Revision – trives du med faglige udfordringer i kombination med et balanceret familieliv?,True,,True,1,,5535253,,,False,False,,0,False,Asgaard Recruitment,Langerak 17,,,9220,False,False,False,Aalborg Øst,Jens Maagaard,+45 30 94 84 81,,,,,,False,,2022-05-30T00:00:00,,0,False,0,,,,,0,,,,False,False,,,False,False,,,,False,,False,,,Arbejdspladsen ligger i Jammerbugt kommune,False,Asgaard Recruitment,,None,,False,False," 

For Dansk Revision Wulff  Haaning s&oslash;ger vi en revisor, som &oslash;nsker et kvalificeret fagligt modspil p&aring; en arbejdsplads med plads til forskellighed. Hos Dansk Revision Wulff  Haaning er der rum til personlig og faglig udvikling og samtidig et fokus p&aring; trivsel samt plads til familieliv og fritidsinteresser. Hos Dansk Revi",""" \r\n\r\nFor Dansk Revision Wulff  Haaning s\u0026oslash;ger vi en revisor, som \u0026oslash;nsker et kvalificeret fagligt modspil p\u0026aring; en arbejdsplads med plads til forskellighed. Hos Dansk Revision Wulff  Haaning er der rum til personlig og faglig udvikling og samtidig et fokus p\u0026aring; trivsel samt plads til familieliv og fritidsinteresser. Hos Dansk Revi""","""Revisor til Dansk Revision – trives du med faglige udfordringer i kombination med et balanceret familieliv?""","https://www.google.dk/maps/dir//Torvegade+7,9490,+Pandrup/","For Dansk Revision Wulff & Haaning søger vi en revisor, som ønsker et kvalificeret fagligt modspil på en arbejdsplads med plads til forskellighed. Hos Dansk Revision Wulff & Haaning er der rum til personlig og faglig udvikling og samtidig et fokus på trivsel samt plads til familieliv og fritidsinteresser. Hos Dansk Revision Wulff & Haaning kan du kombinere et spændende arbejdsliv med tid og overskud til rent faktisk at have et liv. Det tror virksomhedens partnere skaber bedre revision og rådgivning i sidste ende. Med andre ord, Dansk Revision Wulff & Haaning matcher dit ambitionsniveau, uden at du mister balancen mellem arbejdslivet og privatlivet. 
 Hos Dansk Revision Wulff & Haaning er ancienniteten høj. På et tidspunkt er det dog tid til at nyde sit otium og det er lige præcis, hvad en kollega skal. Derfor er vi på vegne af Dansk Revision Wulff & Haaning på udkig efter nye kræfter til kontoret i Pandrup - måske det er dig? 
 Velkommen til Dansk Revision i Pandrup 
 Dansk Revision Wulff & Haaning arbejder for at gøre livet mere enkelt, overskueligt og nemmere for kunderne, som typisk er i SMV-segmentet. Det gøres ved at tage ansvar og være i øjenhøjde med kunderne. Ansvaret er Ikke bare for årsregnskabet, men for alle forhold og aspekter omkring kundernes økonomi. 
 Dansk Revision Wulff & Haaning er en del af Dansk Revision, hvilket er med til at sikre, at den faglige kvalitet er i top og at IT-systemerne altid er tidssvarende. Dansk Revision er en landsdækkende kæde med 29 kontorer og mere end 500 medarbejdere fordelt over hele Danmark.  
 Dansk Revision er ejet af partnere på de enkelte kontorer. Dermed kan virksomheden drage fordel af både den lokale forankring og kendskabet til det lokale erhvervsliv og af samarbejdet mellem fagligt kompetente ejere og medarbejdere i Dansk Revision. Dansk Revision har globalt udsyn og globale kompetencer via  GGI-international . 
 Virksomhedens mål er at tilføre andre virksomheder størst mulig værdi og udbytte gennem løbende økonomisk rådgivning.  
 “Vi sætter en ære i at levere kvalitetsydelser og god service, og altid med kunden i centrum. Vi løser spændende opgaver for kunder omkring Jammerbugt, Vendsyssel og det øvrige Nordjylland.” 
 Christian Haaning, Partner 
 Formidling af tal og udarbejdelse af regnskaber 
 I rollen som revisor er du er med til at sikre gode kundeoplevelser i små og mellemstore ejerledede virksomheder, hvor dit fokus helt naturligt er på opbygning af langvarige relationer.  
 Din portefølje og dine arbejdsopgaver vil i fællesskab blive tilpasset i overensstemmelse med dit erfaringsniveau og din faglige interesse. Kundestørrelserne spænder bredt, så du kan både udleve dit ønske om at fokusere på mindre selvstændige eller mellemstore virksomheder. 
 Dine primære opgaver vil være: 
 
 Selvstændig kundeportefølje og direkte kundekontakt. 
 Medansvar i gennemførsel af revision, gennemgang og diverse erklærings- og revisionsopgaver. 
 Regnskabsudarbejdelse. 
 Skattemæssige opgørelser for selskaber, personlige virksomheder og hovedaktionærer. 
 Rådgivning inden for regnskab, revision, skat og moms. 
 Vidensdeling med kollegaer samt oplæring af nye kollegaer, herunder coaching af trainees. 
 Specialopgaver, herunder omstruktureringer, budgetter og generationsskifter m.v. 
 
 Udover at du skal kunne håndværket, er det essentielt, at du kan lide at arbejde med mennesker, da du vil have tæt samarbejde med både kunder og kollegaer. Du får mulighed for at sparre med kollegaer på kontoret og i hele landet, og alle kunder serviceres i samarbejde med en statsautoriseret revisor. 
 Hos Wulff & Haaning får du et fagligt, familiært og socialt arbejdsmiljø 
 Overarbejde kan ikke helt undgås, men Dansk Revision Wulff & Haaning kvitterer med en pakke som modsvarer dette og en frihed som gør, at dit liv er i balance. Dansk Revision Wulff & Haaning vil gøre alt for at bibeholde dine kompetencer på et højt niveau og understøtte dine faglige drømme og ønsker. 
 Du får otte erfarne og kompetente kollegaer i et fagligt stærkt team på kontoret i Pandrup. Du bliver en del af et miljø med højt til loftet, korte beslutningsprocesser og stor selvstændighed, og hvor humor og en uformel omgangstone bidrager til et inspirerende arbejdsmiljø. Derudover kan du se frem til: 
 
 Alsidige arbejdsopgaver og en udfordrende hverdag. 
 En arbejdsplads med flad organisationsstruktur, hvor du er tæt på en tilgængelig ledelse, og hvor der er kort vej fra tanke til handling. 
 Personlige og tætte kunderelationer og et stærkt kollegialt sammenhold. 
 En humoristisk omgangstone samt fokus på det gode samarbejde og at hjælpe hinanden. 
 En virksomhed, der tror på frihed under ansvar og som vægter ordentlighed. 
 
 Din profil 
 
 Du har næse for revision, og du er uddannet HD-R, cand.merc.aud eller har relevant erfaring indenfor området.  
 Du er en selvstændig teamplayer og drevet af at arbejde mod et fælles mål.  
 Du sætter en ære i at pleje dine kunderelationer og skabe værdi og resultater. 
 Du har en god forretningsforståelse med lysten til at være synlig i forhold til kunderne ved selvstændigt at planlægge, udføre og afslutte opgaverne. 
 Du har gode kommunikationsevner, besidder empati og har altid øje for både helheden og detaljen. 
 Du er stabil og kan se dig selv være hos Dansk Revision Wulff & Haaning i mange år fremadrettet. 
 
 Læs mere  her .","https://www.google.dk/maps/place/Torvegade+7,9490,+Pandrup/",37046477,False,False,,False
