summary_AutomatchType,summary_Abroad,summary_Weight,summary_Title,summary_JobHeadline,summary_Presentation,summary_HiringOrgName,summary_WorkPlaceAddress,summary_WorkPlacePostalCode,summary_WorkPlaceCity,summary_WorkPlaceOtherAddress,summary_WorkPlaceAbroad,summary_WorkPlaceNotStatic,summary_UseWorkPlaceAddressForJoblog,summary_PostingCreated,summary_LastDateApplication,summary_FormattedLastDateApplication,summary_AssignmentStartDate,summary_IsHotjob,summary_IsExternal,summary_Url,summary_Region,summary_Municipality,summary_Country,summary_PostalCode,summary_PostalCodeName,summary_JobAnnouncementType,summary_EmploymentType,summary_WorkHours,summary_OccupationArea,summary_OccupationGroup,summary_Occupation,summary_Location_Latitude,summary_Location_Longitude,summary_JoblogWorkTime_WorkHour,summary_JoblogWorkTime_DailyWorkTime,summary_WorkplaceID,summary_OrganisationId,summary_HiringOrgCVR,summary_UserLoggedIn,summary_AnonymousEmployer,summary_ShareUrl,summary_DetailsUrl,summary_JobLogUrl,summary_HasLocationValues,summary_ID,summary_Latitude,summary_Longitude,details_WorkSchedule,details_WorkConditions,details_EmploymentTypes,details_WorkPlace_Name,details_WorkPlace_Address_AddressLine,details_WorkPlace_Address_Country_Id,details_WorkPlace_Address_Country_Name,details_WorkPlace_Address_Municipality_Id,details_WorkPlace_Address_Municipality_Name,details_WorkPlace_Address_Region_Id,details_WorkPlace_Address_Region_Name,details_WorkPlace_Address_PostalCode,details_WorkPlace_Address_City,details_WorkPlace_PhoneNumber_Number,details_WorkPlace_PhoneNumber_Type,details_WorkPlace_PhoneNumber_Description,details_WorkPlace_FaxNumber,details_WorkPlace_Email,details_WorkPlace_WebAddress,details_WorkPlace_Description,details_WorkPlace_Logo,details_WorkPlace_WorkPlaceOrganizationNumber,details_WorkPlace_OrganizationNumber,details_WorkPlace_OrganizationDescription,details_JobPositionPosting_Id,details_JobPositionPosting_OriginalJppId,details_JobPositionPosting_HiringOrg_Name,details_JobPositionPosting_HiringOrg_Address_AddressLine,details_JobPositionPosting_HiringOrg_Address_Country_Id,details_JobPositionPosting_HiringOrg_Address_Country_Name,details_JobPositionPosting_HiringOrg_Address_Municipality_Id,details_JobPositionPosting_HiringOrg_Address_Municipality_Name,details_JobPositionPosting_HiringOrg_Address_Region_Id,details_JobPositionPosting_HiringOrg_Address_Region_Name,details_JobPositionPosting_HiringOrg_Address_PostalCode,details_JobPositionPosting_HiringOrg_Address_City,details_JobPositionPosting_HiringOrg_PhoneNumber_Number,details_JobPositionPosting_HiringOrg_PhoneNumber_Type,details_JobPositionPosting_HiringOrg_PhoneNumber_Description,details_JobPositionPosting_HiringOrg_FaxNumber,details_JobPositionPosting_HiringOrg_Email,details_JobPositionPosting_HiringOrg_WebAddress,details_JobPositionPosting_HiringOrg_Description,details_JobPositionPosting_HiringOrg_Logo,details_JobPositionPosting_HiringOrg_WorkPlaceOrganizationNumber,details_JobPositionPosting_HiringOrg_OrganizationNumber,details_JobPositionPosting_HiringOrg_OrganizationDescription,details_JobPositionPosting_RecruitingCompany,details_JobPositionPosting_PublicationStartDate,details_JobPositionPosting_PublicationEndDate,details_JobPositionPosting_JobPositionInformation_PositionTitle,details_JobPositionPosting_JobPositionInformation_Purpose,details_JobPositionPosting_JobPositionInformation_WorkLocation_AddressLine,details_JobPositionPosting_JobPositionInformation_WorkLocation_Country_Id,details_JobPositionPosting_JobPositionInformation_WorkLocation_Country_Name,details_JobPositionPosting_JobPositionInformation_WorkLocation_Municipality_Id,details_JobPositionPosting_JobPositionInformation_WorkLocation_Municipality_Name,details_JobPositionPosting_JobPositionInformation_WorkLocation_Region_Id,details_JobPositionPosting_JobPositionInformation_WorkLocation_Region_Name,details_JobPositionPosting_JobPositionInformation_WorkLocation_PostalCode,details_JobPositionPosting_JobPositionInformation_WorkLocation_City,details_JobPositionPosting_JobPositionInformation_EmploymentType,details_JobPositionPosting_JobPositionInformation_WeeklyWorkHours_TypeId,details_JobPositionPosting_JobPositionInformation_WeeklyWorkHours_TypeName,details_JobPositionPosting_JobPositionInformation_WeeklyWorkHours_Description,details_JobPositionPosting_JobPositionInformation_CompensationDescription,details_JobPositionPosting_JobPositionInformation_NumberToFill,details_JobPositionPosting_JobPositionInformation_DriverLicense,details_JobPositionPosting_JobPositionInformation_Occupation_DiscoWeb,details_JobPositionPosting_JobPositionInformation_Occupation_AlternateNames,details_JobPositionPosting_JobPositionInformation_Occupation_GroupId,details_JobPositionPosting_JobPositionInformation_Occupation_AreaId,details_JobPositionPosting_JobPositionInformation_Occupation_Id,details_JobPositionPosting_JobPositionInformation_Occupation_Name,details_JobPositionPosting_JobPositionInformation_IsGovernmentHiring,details_JobPositionPosting_JobPositionInformation_JppContacts,details_JobPositionPosting_JobPositionInformation_EmploymentDate,details_JobPositionPosting_IsRecruitmentOfForeignNationals,details_JobPositionPosting_IsWorkInDenmark,details_JobPositionPosting_IsAnonymousEmployer,details_JobPositionPosting_IsDisabilityFriendly,details_JobPositionPosting_JppType,details_JobPositionPosting_ApplicationDetails_WorkHourMax,details_JobPositionPosting_ApplicationDetails_WorkHourMin,details_JobPositionPosting_ApplicationDetails_DailyWorkTimeWeekend,details_JobPositionPosting_ApplicationDetails_DailyWorkTimeNight,details_JobPositionPosting_ApplicationDetails_DailyWorkTimeEvening,details_JobPositionPosting_ApplicationDetails_DailyWorkTimeDay,details_JobPositionPosting_ApplicationDetails_ReferenceText,details_JobPositionPosting_ApplicationDetails_RemarksToApplicant,details_JobPositionPosting_ApplicationDetails_ByEmail,details_JobPositionPosting_ApplicationDetails_ByPhone,details_JobPositionPosting_ApplicationDetails_ApplyViaUrl,details_JobPositionPosting_ApplicationDetails_ReplyInWriting,details_JobPositionPosting_ApplicationDetails_ApplicationDeadlineDate,details_JobPositionPosting_ContactAuthorityPhoneNumber_Number,details_JobPositionPosting_ContactAuthorityPhoneNumber_Type,details_JobPositionPosting_ContactAuthorityPhoneNumber_Description,details_JobPositionPosting_Status,details_LogoUrl,details_Address,details_ShowMap,details_ShowShareButtonJobLog,details_JobLogUrl,details_JobLogTemplateModel_Identifier,details_JobLogTemplateModel_UseWorkPlaceAddressForJoblog,details_JobLogTemplateModel_Category,details_JobLogTemplateModel_CvCustomerIdentifier,details_JobLogTemplateModel_JobSeekingStatus,details_JobLogTemplateModel_Title,details_JobLogTemplateModel_IsApplicationSourceRequired,details_JobLogTemplateModel_ApplicationSource,details_JobLogTemplateModel_IsWeeklyWorkTimeRequired,details_JobLogTemplateModel_WeeklyWorkTime,details_JobLogTemplateModel_HoursPerWeek,details_JobLogTemplateModel_JobnetJobPostingIdentifier,details_JobLogTemplateModel_JobAdDocument_Title,details_JobLogTemplateModel_JobAdDocument_Identifier,details_JobLogTemplateModel_JobAdDocument_IsDeletedBySystem,details_JobLogTemplateModel_JobAdDocument_IsDeletedByUser,details_JobLogTemplateModel_JobAdFile,details_JobLogTemplateModel_Company_JobLogEntryCategory,details_JobLogTemplateModel_Company_ShowAddressFieldsEvenIfEmpty,details_JobLogTemplateModel_Company_Name,details_JobLogTemplateModel_Company_Address,details_JobLogTemplateModel_Company_Country,details_JobLogTemplateModel_Company_EmploymentAreaID,details_JobLogTemplateModel_Company_PostCode,details_JobLogTemplateModel_Company_IsCountryAndTownAndPostCodeEmpty,details_JobLogTemplateModel_Company_IsTownAndPostCodeEmpty,details_JobLogTemplateModel_Company_IsCountryDanmark,details_JobLogTemplateModel_Company_Town,details_JobLogTemplateModel_Company_ContactPerson,details_JobLogTemplateModel_Company_Phone,details_JobLogTemplateModel_Company_Email,details_JobLogTemplateModel_Company_Latitude,details_JobLogTemplateModel_Company_Longitude,details_JobLogTemplateModel_Company_DailyTravelTimeInMinutes,details_JobLogTemplateModel_Company_DistanceToCompanyInMeters,details_JobLogTemplateModel_Company_IsCreateMode,details_JobLogTemplateModel_TypeOfSubmission,details_JobLogTemplateModel_SubmissionDate,details_JobLogTemplateModel_SubmissionDateFormatted,details_JobLogTemplateModel_SubmissionDateTiks,details_JobLogTemplateModel_IsSubmissionDateRequired,details_JobLogTemplateModel_Status,details_JobLogTemplateModel_DateCreatedFormatted,details_JobLogTemplateModel_DateCreated,details_JobLogTemplateModel_DateModifiedFormatted,details_JobLogTemplateModel_DateModified,details_JobLogTemplateModel_LastModifiedDateTiks,details_JobLogTemplateModel_DateClosed,details_JobLogTemplateModel_JobApplicationDocument_Title,details_JobLogTemplateModel_JobApplicationDocument_Identifier,details_JobLogTemplateModel_JobApplicationDocument_IsDeletedBySystem,details_JobLogTemplateModel_JobApplicationDocument_IsDeletedByUser,details_JobLogTemplateModel_CvDocument_Title,details_JobLogTemplateModel_CvDocument_Identifier,details_JobLogTemplateModel_CvDocument_IsDeletedBySystem,details_JobLogTemplateModel_CvDocument_IsDeletedByUser,details_JobLogTemplateModel_JobApplicationFile,details_JobLogTemplateModel_CvFile,details_JobLogTemplateModel_SubmissionDeadlineDate,details_JobLogTemplateModel_IsPersisted,details_JobLogTemplateModel_ServerValidationErrors,details_JobLogTemplateModel_HasServerValidationErrors,details_JoblogWorkTime_WorkHour,details_JoblogWorkTime_DailyWorkTime,details_Place,details_OpenPrintDialog,details_WorkPlaceInfoText,details_JobCenterContactDetails,details_WorkPlaceDescriptionText,details_FavoriteText,details_IsFavorite,details_ShowFavorite,details_MetaOgTextForSharing,details_DescriptionForSharing,details_TitleForSharing,details_RutePlan,details_FormattedPurpose,details_MapUrl,details_OrganizationNumber,details_ShowSearchJobButton,details_ShowPrint,details_BackToFindWorkButtonUrl,isExternal
0,False,1,VVS-INGENIØR TIL EKAS RÅDGIVENDE INGENIØRER I VEDBÆK,VVS-INGENIØR TIL EKAS RÅDGIVENDE INGENIØRER I VEDBÆK,"Er du en rutineret og selvstændig VVS-specialist, med solid erfaring inden for projektering af bygningsinstallationer og bæredygtige løsninger? Så er det måske dig vi leder efter til EKAS’s dygtige",TEKNIK BUREAUET ApS,Trørødvej 74,2950,Vedbæk,True,False,False,False,2022-05-05T00:00:00,2022-06-30T00:00:00,30. juni 2022,0001-01-01T00:00:00,False,False,https://job.jobnet.dk/CV/FindWork/Details/5548500,Hovedstaden og Bornholm,Rudersdal,Danmark,2950,,,,Fuldtid,Akademisk arbejde,Ingeniørarbejde,Bygningsingeniør,55.8394,12.5444,,Dag,33516,34842,28278306,False,False,https://job.jobnet.dk/CV/FindWork/DetailsSocialmedia/5548500,https://job.jobnet.dk/CV/FindWork/Details/5548500,https://job.jobnet.dk/CV/FindWork/Details/5548500,True,5548500,55.8394,12.5444,"{'Id': 1, 'Name': 'Fuldtid'}, {'Id': 16, 'Name': 'Deltid'}","{'Id': 1, 'Name': 'Almindelige vilkår'}, {'Id': 2, 'Name': 'Fleksjob'}, {'Id': 3, 'Name': 'Skånejob'}, {'Id': 4, 'Name': 'Egnet til efterlønnere og seniorer'}, {'Id': 5, 'Name': 'Job med løntilskud'}, {'Id': 6, 'Name': 'Rotationsjob'}, {'Id': 7, 'Name': 'Virksomhedspraktik'}","{'Id': 1, 'Name': 'Fastansættelse'}, {'Id': 16, 'Name': 'Tidsbegrænset ansættelse'}",TEKNIK BUREAUET ApS,Laustrupvang 4A,58,Danmark,151,Ballerup,4,"Hovedstaden, Sjælland og Bornholm",2750,Ballerup,,0,Primary,,,,None,33516,1010944046,28278306,"Teknik Bureauet er et vikar- og rekrutteringsfirma, som er specialiseret i løsning af opgaver i den teknisk og grafiske branche. Måske dine muligheder for et nyt og spændende job. Bliv optaget fortroligt i vores kandidatbank på vores hjemmeside.",5548500,5548500,TEKNIK BUREAUET ApS,Laustrupvang 4A,58,Danmark,151,Ballerup,4,"Hovedstaden, Sjælland og Bornholm",2750,Ballerup,,0,Primary,,,,None,33516,1010944046,28278306,"Teknik Bureauet er et vikar- og rekrutteringsfirma, som er specialiseret i løsning af opgaver i den teknisk og grafiske branche. Måske dine muligheder for et nyt og spændende job. Bliv optaget fortroligt i vores kandidatbank på vores hjemmeside.",,2022-05-05T00:00:00,2022-06-30T00:00:00,VVS-INGENIØR TIL EKAS RÅDGIVENDE INGENIØRER I VEDBÆK,"Er du en rutineret og selvstændig VVS-specialist, med solid erfaring inden for projektering af bygningsinstallationer og bæredygtige løsninger? Så er det måske dig vi leder efter til EKAS’s dygtige VVS-team. 
 EKAS beskæftiger sig primært med bygningsrenovering for almennyttige boligselskaber og offentlige bygherrer og de har mange spændende opgaver i ordrebogen. Derfor har de brug for at udvide VVS-teamet. 
 VVS-teamet består i dag af 4 dygtige VVS-ingeniører der både løser større opgaver inden for VVS, kloak, ventilation og energioptimering samt andre opgaver såsom tilstandsvurderinger, 1- og 5-års eftersyn samt renoveringer. 
 Du kommer til at arbejde selvstændigt med et eller flere projekter. Du tager initiativet, og du holder struktureret styr på fremdrift, budget og opfølgning. 
 Du skal være bindeled mellem bygherre og entreprenør gennem alle projektets faser og sikre, at de indgåede aftaler overholdes. 
 Den brede berøringsflade skaber en afvekslende hverdag med mange spændende udfordringer både på kontoret og ude i marken. 
 I alt er der 16 ansatte hos EKAS – primært ingeniører og bygningskonstruktører. Der er et godt sammenhold blandt kollegerne og det bliver prioriteret at bruge tid på sociale arrangementer for at styrke teamet yderligere. 
 Omgangstonen er uformel og humoristisk i et løsningsorienteret arbejdsmiljø. Teamet har en stor faglig stolthed med fokus på at være en troværdig og professionel samarbejdspartner. 
 Dine primære arbejdsopgaver 
 
 Projektering og dimensionering af VVS-installationer, kloak, ventilation og energioptimering for bl.a. renoveringsløsninger indenfor husbygning 
 Projektering i AutoCAD + Revit MEP 
 Tilstandsvurdering af større ejendomme, typisk for boligselskaber 
 1- og 5-års eftersyn 
 Byggeledelse og tilsyn 
 
 Din profil 
 
 Du er uddannet VVS-ingeniør, VVS-tekniker eller VVS-installatør 
 Du har solid erfaring med projektering af bygningsinstallationer og bæredygtige løsninger 
 Det er en fordel, hvis du har erfaring med projektledelse 
 Du arbejder selvstændigt og struktureret 
 Du er proaktiv og kan have flere bolde i luften 
 Du er teamplayer og har en faglig stolthed 
 Du har gode sprogkundskaber i dansk og engelsk 
 Du har humor og trives i et kreativt samt afslappet arbejdsmiljø 
 
 Det tilbyder EKAS 
 
 Mange spændende og udfordrende projekter 
 Engagerede og kompetente kollegaer 
 En organisation med en flad ledelsesstruktur 
 En kultur, hvor trivsel og samarbejde prioriteres højt – De har bl.a. fredagsbar en gang om måneden, julefrokost, sommerfest osv. 
 Gode muligheder for personlig udvikling og faglig efteruddannelse 
 Attraktive medarbejderforhold med bl.a. sundhedsforsikring, frugt- og delvis frokostordning, mulighed for massage 1 gang om måneden og betalt internet 
 
 Om EKAS 
 EKAS er et rådgivende ingeniørfirma stiftet af Esben Kirkegaard i 1958. Firmaet er i dag et aktieselskab ejet og ledet af Per Mohr Hansen, Finn Mørck Nielsen og Jens Lauridsen. 
 EKAS primære kvalifikationer er høj faglig kompetence, erfaring, dialog og uvildighed. De stiller hele deres ekspertise til rådighed ved enhver sag – stor som lille. 
 EKAS arbejder for boligforeninger, boligselskaber og private. Deres væsentligste arbejdsområder ligger indenfor den eksisterende bygningsmasse i form af tilstandsvurderinger, renoveringer og ombygninger. Herudover udfører de 1-års og 5-års eftersyn for Byggeskadefonden og forskellige boligselskaber. 
 Ansøgning 
 Søg stillingen online ved at klikke på ansøgningsknappen, hvor du kan uploade din ansøgning og dit CV. 
 Har du spørgsmål er du velkommen til at ringe til HR- & Sales Consultant Birgitte Carlsen på bc@teknikbureauet.dk eller 4144 0925. 
 Vi interviewer løbende til stillingen, så tøv ikke med at sende din ansøgning.",Trørødvej 74,58,Danmark,230,Rudersdal,4,"Hovedstaden, Sjælland og Bornholm",2950,Vedbæk,1,1,Fuldtid,None,None,1,,0,,0,0,0,,False,"{'Id': 7962331, 'Email': 'bc@teknikbureauet.dk', 'FaxNumber': None, 'PersonName': 'Birgitte Carlsen', 'FirstName': 'Birgitte', 'LastName': 'Carlsen', 'PositionTitle': 'HR and Sales Consultant', 'PhoneNumbers': [{'Number': '44440225', 'Type': 0, 'Description': 'Hovednummer'}, {'Number': '41440925', 'Type': 2, 'Description': 'Mobil'}]}",,False,False,False,False,4,,,False,False,False,True,,,,,https://hartmannspt.peopletrust.dk/candidate/?module=candidateweb&page=Job&action=readMore&jobId=1023587,False,2022-06-30T00:00:00,,0,Primary,7,/CV/FindWork/GetLogo?JobAdId=5548500&WorkPlace=33516&Organisation=28278306,"Trørødvej 74,2950, Vedbæk",True,False,/CV/Jobseeking/JobLog/CreateJobSearch?JobnetJobPostingIdentifier=5548500&Company.Name=TEKNIK BUREAUET ApS&SubmissionDeadlineDate=2022-6-30&Title=VVS-INGENIØR TIL EKAS RÅDGIVENDE INGENIØRER I VEDBÆK&WeeklyWorkTime=1,00000000-0000-0000-0000-000000000000,False,0,,,VVS-INGENIØR TIL EKAS RÅDGIVENDE INGENIØRER I VEDBÆK,True,,True,1,,5548500,,,False,False,,0,False,TEKNIK BUREAUET ApS,Laustrupvang 4A,,,2750,False,False,False,Ballerup,Birgitte Carlsen,44440225,bc@teknikbureauet.dk,,,,,False,,2022-06-30T00:00:00,,0,False,0,,,,,0,,,,False,False,,,False,False,,,,False,,False,,Dag,Arbejdspladsen ligger i Rudersdal kommune,False,TEKNIK BUREAUET ApS,,"Teknik Bureauet er et vikar- og rekrutteringsfirma, som er specialiseret i løsning af opgaver i den teknisk og grafiske branche. Måske dine muligheder for et nyt og spændende job. Bliv optaget fortroligt i vores kandidatbank på vores hjemmeside.",,False,False,"Er du en rutineret og selvst&aelig;ndig VVS-specialist, med solid erfaring inden for projektering af bygningsinstallationer og b&aelig;redygtige l&oslash;sninger? S&aring; er det m&aring;ske dig vi leder efter til EKAS&rsquo;s dygtige VVS-team.
EKAS besk&aelig;ftiger sig prim&aelig;rt med bygningsrenovering for almennyttige boligselskaber og offent","""Er du en rutineret og selvst\u0026aelig;ndig VVS-specialist, med solid erfaring inden for projektering af bygningsinstallationer og b\u0026aelig;redygtige l\u0026oslash;sninger? S\u0026aring; er det m\u0026aring;ske dig vi leder efter til EKAS\u0026rsquo;s dygtige VVS-team.\nEKAS besk\u0026aelig;ftiger sig prim\u0026aelig;rt med bygningsrenovering for almennyttige boligselskaber og offent""","""VVS-INGENIØR TIL EKAS RÅDGIVENDE INGENIØRER I VEDBÆK""","https://www.google.dk/maps/dir//Trørødvej+74,2950,+Vedbæk/","Er du en rutineret og selvstændig VVS-specialist, med solid erfaring inden for projektering af bygningsinstallationer og bæredygtige løsninger? Så er det måske dig vi leder efter til EKAS’s dygtige VVS-team. 
 EKAS beskæftiger sig primært med bygningsrenovering for almennyttige boligselskaber og offentlige bygherrer og de har mange spændende opgaver i ordrebogen. Derfor har de brug for at udvide VVS-teamet. 
 VVS-teamet består i dag af 4 dygtige VVS-ingeniører der både løser større opgaver inden for VVS, kloak, ventilation og energioptimering samt andre opgaver såsom tilstandsvurderinger, 1- og 5-års eftersyn samt renoveringer. 
 Du kommer til at arbejde selvstændigt med et eller flere projekter. Du tager initiativet, og du holder struktureret styr på fremdrift, budget og opfølgning. 
 Du skal være bindeled mellem bygherre og entreprenør gennem alle projektets faser og sikre, at de indgåede aftaler overholdes. 
 Den brede berøringsflade skaber en afvekslende hverdag med mange spændende udfordringer både på kontoret og ude i marken. 
 I alt er der 16 ansatte hos EKAS – primært ingeniører og bygningskonstruktører. Der er et godt sammenhold blandt kollegerne og det bliver prioriteret at bruge tid på sociale arrangementer for at styrke teamet yderligere. 
 Omgangstonen er uformel og humoristisk i et løsningsorienteret arbejdsmiljø. Teamet har en stor faglig stolthed med fokus på at være en troværdig og professionel samarbejdspartner. 
 Dine primære arbejdsopgaver 
 
 Projektering og dimensionering af VVS-installationer, kloak, ventilation og energioptimering for bl.a. renoveringsløsninger indenfor husbygning 
 Projektering i AutoCAD + Revit MEP 
 Tilstandsvurdering af større ejendomme, typisk for boligselskaber 
 1- og 5-års eftersyn 
 Byggeledelse og tilsyn 
 
 Din profil 
 
 Du er uddannet VVS-ingeniør, VVS-tekniker eller VVS-installatør 
 Du har solid erfaring med projektering af bygningsinstallationer og bæredygtige løsninger 
 Det er en fordel, hvis du har erfaring med projektledelse 
 Du arbejder selvstændigt og struktureret 
 Du er proaktiv og kan have flere bolde i luften 
 Du er teamplayer og har en faglig stolthed 
 Du har gode sprogkundskaber i dansk og engelsk 
 Du har humor og trives i et kreativt samt afslappet arbejdsmiljø 
 
 Det tilbyder EKAS 
 
 Mange spændende og udfordrende projekter 
 Engagerede og kompetente kollegaer 
 En organisation med en flad ledelsesstruktur 
 En kultur, hvor trivsel og samarbejde prioriteres højt – De har bl.a. fredagsbar en gang om måneden, julefrokost, sommerfest osv. 
 Gode muligheder for personlig udvikling og faglig efteruddannelse 
 Attraktive medarbejderforhold med bl.a. sundhedsforsikring, frugt- og delvis frokostordning, mulighed for massage 1 gang om måneden og betalt internet 
 
 Om EKAS 
 EKAS er et rådgivende ingeniørfirma stiftet af Esben Kirkegaard i 1958. Firmaet er i dag et aktieselskab ejet og ledet af Per Mohr Hansen, Finn Mørck Nielsen og Jens Lauridsen. 
 EKAS primære kvalifikationer er høj faglig kompetence, erfaring, dialog og uvildighed. De stiller hele deres ekspertise til rådighed ved enhver sag – stor som lille. 
 EKAS arbejder for boligforeninger, boligselskaber og private. Deres væsentligste arbejdsområder ligger indenfor den eksisterende bygningsmasse i form af tilstandsvurderinger, renoveringer og ombygninger. Herudover udfører de 1-års og 5-års eftersyn for Byggeskadefonden og forskellige boligselskaber. 
 Ansøgning 
 Søg stillingen online ved at klikke på ansøgningsknappen, hvor du kan uploade din ansøgning og dit CV. 
 Har du spørgsmål er du velkommen til at ringe til HR- & Sales Consultant Birgitte Carlsen på bc@teknikbureauet.dk eller 4144 0925. 
 Vi interviewer løbende til stillingen, så tøv ikke med at sende din ansøgning.","https://www.google.dk/maps/place/Trørødvej+74,2950,+Vedbæk/",28278306,False,False,,False
