summary_AutomatchType,summary_Abroad,summary_Weight,summary_Title,summary_JobHeadline,summary_Presentation,summary_HiringOrgName,summary_WorkPlaceAddress,summary_WorkPlacePostalCode,summary_WorkPlaceCity,summary_WorkPlaceOtherAddress,summary_WorkPlaceAbroad,summary_WorkPlaceNotStatic,summary_UseWorkPlaceAddressForJoblog,summary_PostingCreated,summary_LastDateApplication,summary_FormattedLastDateApplication,summary_AssignmentStartDate,summary_IsHotjob,summary_IsExternal,summary_Url,summary_Region,summary_Municipality,summary_Country,summary_PostalCode,summary_PostalCodeName,summary_JobAnnouncementType,summary_EmploymentType,summary_WorkHours,summary_OccupationArea,summary_OccupationGroup,summary_Occupation,summary_Location_Latitude,summary_Location_Longitude,summary_JoblogWorkTime_WorkHour,summary_JoblogWorkTime_DailyWorkTime,summary_WorkplaceID,summary_OrganisationId,summary_HiringOrgCVR,summary_UserLoggedIn,summary_AnonymousEmployer,summary_ShareUrl,summary_DetailsUrl,summary_JobLogUrl,summary_HasLocationValues,summary_ID,summary_Latitude,summary_Longitude,details_WorkSchedule,details_WorkConditions,details_EmploymentTypes,details_WorkPlace_Name,details_WorkPlace_Address_AddressLine,details_WorkPlace_Address_Country_Id,details_WorkPlace_Address_Country_Name,details_WorkPlace_Address_Municipality_Id,details_WorkPlace_Address_Municipality_Name,details_WorkPlace_Address_Region_Id,details_WorkPlace_Address_Region_Name,details_WorkPlace_Address_PostalCode,details_WorkPlace_Address_City,details_WorkPlace_PhoneNumber_Number,details_WorkPlace_PhoneNumber_Type,details_WorkPlace_PhoneNumber_Description,details_WorkPlace_FaxNumber,details_WorkPlace_Email,details_WorkPlace_WebAddress,details_WorkPlace_Description,details_WorkPlace_Logo,details_WorkPlace_WorkPlaceOrganizationNumber,details_WorkPlace_OrganizationNumber,details_WorkPlace_OrganizationDescription,details_JobPositionPosting_Id,details_JobPositionPosting_OriginalJppId,details_JobPositionPosting_HiringOrg_Name,details_JobPositionPosting_HiringOrg_Address_AddressLine,details_JobPositionPosting_HiringOrg_Address_Country_Id,details_JobPositionPosting_HiringOrg_Address_Country_Name,details_JobPositionPosting_HiringOrg_Address_Municipality_Id,details_JobPositionPosting_HiringOrg_Address_Municipality_Name,details_JobPositionPosting_HiringOrg_Address_Region_Id,details_JobPositionPosting_HiringOrg_Address_Region_Name,details_JobPositionPosting_HiringOrg_Address_PostalCode,details_JobPositionPosting_HiringOrg_Address_City,details_JobPositionPosting_HiringOrg_PhoneNumber_Number,details_JobPositionPosting_HiringOrg_PhoneNumber_Type,details_JobPositionPosting_HiringOrg_PhoneNumber_Description,details_JobPositionPosting_HiringOrg_FaxNumber,details_JobPositionPosting_HiringOrg_Email,details_JobPositionPosting_HiringOrg_WebAddress,details_JobPositionPosting_HiringOrg_Description,details_JobPositionPosting_HiringOrg_Logo,details_JobPositionPosting_HiringOrg_WorkPlaceOrganizationNumber,details_JobPositionPosting_HiringOrg_OrganizationNumber,details_JobPositionPosting_HiringOrg_OrganizationDescription,details_JobPositionPosting_RecruitingCompany,details_JobPositionPosting_PublicationStartDate,details_JobPositionPosting_PublicationEndDate,details_JobPositionPosting_JobPositionInformation_PositionTitle,details_JobPositionPosting_JobPositionInformation_Purpose,details_JobPositionPosting_JobPositionInformation_WorkLocation_AddressLine,details_JobPositionPosting_JobPositionInformation_WorkLocation_Country_Id,details_JobPositionPosting_JobPositionInformation_WorkLocation_Country_Name,details_JobPositionPosting_JobPositionInformation_WorkLocation_Municipality_Id,details_JobPositionPosting_JobPositionInformation_WorkLocation_Municipality_Name,details_JobPositionPosting_JobPositionInformation_WorkLocation_Region_Id,details_JobPositionPosting_JobPositionInformation_WorkLocation_Region_Name,details_JobPositionPosting_JobPositionInformation_WorkLocation_PostalCode,details_JobPositionPosting_JobPositionInformation_WorkLocation_City,details_JobPositionPosting_JobPositionInformation_EmploymentType,details_JobPositionPosting_JobPositionInformation_WeeklyWorkHours_TypeId,details_JobPositionPosting_JobPositionInformation_WeeklyWorkHours_TypeName,details_JobPositionPosting_JobPositionInformation_WeeklyWorkHours_Description,details_JobPositionPosting_JobPositionInformation_CompensationDescription,details_JobPositionPosting_JobPositionInformation_NumberToFill,details_JobPositionPosting_JobPositionInformation_DriverLicense,details_JobPositionPosting_JobPositionInformation_Occupation_DiscoWeb,details_JobPositionPosting_JobPositionInformation_Occupation_AlternateNames,details_JobPositionPosting_JobPositionInformation_Occupation_GroupId,details_JobPositionPosting_JobPositionInformation_Occupation_AreaId,details_JobPositionPosting_JobPositionInformation_Occupation_Id,details_JobPositionPosting_JobPositionInformation_Occupation_Name,details_JobPositionPosting_JobPositionInformation_IsGovernmentHiring,details_JobPositionPosting_JobPositionInformation_JppContacts,details_JobPositionPosting_JobPositionInformation_EmploymentDate,details_JobPositionPosting_IsRecruitmentOfForeignNationals,details_JobPositionPosting_IsWorkInDenmark,details_JobPositionPosting_IsAnonymousEmployer,details_JobPositionPosting_IsDisabilityFriendly,details_JobPositionPosting_JppType,details_JobPositionPosting_ApplicationDetails_WorkHourMax,details_JobPositionPosting_ApplicationDetails_WorkHourMin,details_JobPositionPosting_ApplicationDetails_DailyWorkTimeWeekend,details_JobPositionPosting_ApplicationDetails_DailyWorkTimeNight,details_JobPositionPosting_ApplicationDetails_DailyWorkTimeEvening,details_JobPositionPosting_ApplicationDetails_DailyWorkTimeDay,details_JobPositionPosting_ApplicationDetails_ReferenceText,details_JobPositionPosting_ApplicationDetails_RemarksToApplicant,details_JobPositionPosting_ApplicationDetails_ByEmail,details_JobPositionPosting_ApplicationDetails_ByPhone,details_JobPositionPosting_ApplicationDetails_ApplyViaUrl,details_JobPositionPosting_ApplicationDetails_ReplyInWriting,details_JobPositionPosting_ApplicationDetails_ApplicationDeadlineDate,details_JobPositionPosting_ContactAuthorityPhoneNumber_Number,details_JobPositionPosting_ContactAuthorityPhoneNumber_Type,details_JobPositionPosting_ContactAuthorityPhoneNumber_Description,details_JobPositionPosting_Status,details_LogoUrl,details_Address,details_ShowMap,details_ShowShareButtonJobLog,details_JobLogUrl,details_JobLogTemplateModel_Identifier,details_JobLogTemplateModel_UseWorkPlaceAddressForJoblog,details_JobLogTemplateModel_Category,details_JobLogTemplateModel_CvCustomerIdentifier,details_JobLogTemplateModel_JobSeekingStatus,details_JobLogTemplateModel_Title,details_JobLogTemplateModel_IsApplicationSourceRequired,details_JobLogTemplateModel_ApplicationSource,details_JobLogTemplateModel_IsWeeklyWorkTimeRequired,details_JobLogTemplateModel_WeeklyWorkTime,details_JobLogTemplateModel_HoursPerWeek,details_JobLogTemplateModel_JobnetJobPostingIdentifier,details_JobLogTemplateModel_JobAdDocument_Title,details_JobLogTemplateModel_JobAdDocument_Identifier,details_JobLogTemplateModel_JobAdDocument_IsDeletedBySystem,details_JobLogTemplateModel_JobAdDocument_IsDeletedByUser,details_JobLogTemplateModel_JobAdFile,details_JobLogTemplateModel_Company_JobLogEntryCategory,details_JobLogTemplateModel_Company_ShowAddressFieldsEvenIfEmpty,details_JobLogTemplateModel_Company_Name,details_JobLogTemplateModel_Company_Address,details_JobLogTemplateModel_Company_Country,details_JobLogTemplateModel_Company_EmploymentAreaID,details_JobLogTemplateModel_Company_PostCode,details_JobLogTemplateModel_Company_IsCountryAndTownAndPostCodeEmpty,details_JobLogTemplateModel_Company_IsTownAndPostCodeEmpty,details_JobLogTemplateModel_Company_IsCountryDanmark,details_JobLogTemplateModel_Company_Town,details_JobLogTemplateModel_Company_ContactPerson,details_JobLogTemplateModel_Company_Phone,details_JobLogTemplateModel_Company_Email,details_JobLogTemplateModel_Company_Latitude,details_JobLogTemplateModel_Company_Longitude,details_JobLogTemplateModel_Company_DailyTravelTimeInMinutes,details_JobLogTemplateModel_Company_DistanceToCompanyInMeters,details_JobLogTemplateModel_Company_IsCreateMode,details_JobLogTemplateModel_TypeOfSubmission,details_JobLogTemplateModel_SubmissionDate,details_JobLogTemplateModel_SubmissionDateFormatted,details_JobLogTemplateModel_SubmissionDateTiks,details_JobLogTemplateModel_IsSubmissionDateRequired,details_JobLogTemplateModel_Status,details_JobLogTemplateModel_DateCreatedFormatted,details_JobLogTemplateModel_DateCreated,details_JobLogTemplateModel_DateModifiedFormatted,details_JobLogTemplateModel_DateModified,details_JobLogTemplateModel_LastModifiedDateTiks,details_JobLogTemplateModel_DateClosed,details_JobLogTemplateModel_JobApplicationDocument_Title,details_JobLogTemplateModel_JobApplicationDocument_Identifier,details_JobLogTemplateModel_JobApplicationDocument_IsDeletedBySystem,details_JobLogTemplateModel_JobApplicationDocument_IsDeletedByUser,details_JobLogTemplateModel_CvDocument_Title,details_JobLogTemplateModel_CvDocument_Identifier,details_JobLogTemplateModel_CvDocument_IsDeletedBySystem,details_JobLogTemplateModel_CvDocument_IsDeletedByUser,details_JobLogTemplateModel_JobApplicationFile,details_JobLogTemplateModel_CvFile,details_JobLogTemplateModel_SubmissionDeadlineDate,details_JobLogTemplateModel_IsPersisted,details_JobLogTemplateModel_ServerValidationErrors,details_JobLogTemplateModel_HasServerValidationErrors,details_JoblogWorkTime_WorkHour,details_JoblogWorkTime_DailyWorkTime,details_Place,details_OpenPrintDialog,details_WorkPlaceInfoText,details_JobCenterContactDetails,details_WorkPlaceDescriptionText,details_FavoriteText,details_IsFavorite,details_ShowFavorite,details_MetaOgTextForSharing,details_DescriptionForSharing,details_TitleForSharing,details_RutePlan,details_FormattedPurpose,details_MapUrl,details_OrganizationNumber,details_ShowSearchJobButton,details_ShowPrint,details_BackToFindWorkButtonUrl,isExternal
0,False,1,PRIVAT- OG ERHVERVSRÅDGIVER – ÆRØ med potentiale...,PRIVAT- OG ERHVERVSRÅDGIVER – ÆRØ med potentiale...,"
	med reference til Filialdirektøren 


Store Rise Landevej 10
DK- 5970 Ærøskøbing

www.sparekassen.dk         
",TARGET Headhunting ApS,,5970,Ærøskøbing,True,False,False,False,2022-03-18T00:00:00,2022-05-13T00:00:00,13. maj 2022,0001-01-01T00:00:00,False,False,https://job.jobnet.dk/CV/FindWork/Details/5557109,Syddanmark,Ærø,Danmark,5970,,,,Fuldtid,"Kontor, administration, regnskab og finans",Bank og finans,Bankrådgiver,54.7972,10.336,,,120724,107045,31934990,False,False,https://job.jobnet.dk/CV/FindWork/DetailsSocialmedia/5557109,https://job.jobnet.dk/CV/FindWork/Details/5557109,https://job.jobnet.dk/CV/FindWork/Details/5557109,True,5557109,54.7972,10.336,"{'Id': 1, 'Name': 'Fuldtid'}, {'Id': 16, 'Name': 'Deltid'}","{'Id': 1, 'Name': 'Almindelige vilkår'}, {'Id': 2, 'Name': 'Fleksjob'}, {'Id': 3, 'Name': 'Skånejob'}, {'Id': 4, 'Name': 'Egnet til efterlønnere og seniorer'}, {'Id': 5, 'Name': 'Job med løntilskud'}, {'Id': 6, 'Name': 'Rotationsjob'}, {'Id': 7, 'Name': 'Virksomhedspraktik'}","{'Id': 1, 'Name': 'Fastansættelse'}, {'Id': 16, 'Name': 'Tidsbegrænset ansættelse'}",TARGET Headhunting ApS,Forskerparken 10,58,Danmark,461,Odense,3,Syddanmark,5230,Odense M,,0,Primary,,,,None,120724,1014988420,31934990,None,5557109,5557109,TARGET Headhunting ApS,Forskerparken 10,58,Danmark,461,Odense,3,Syddanmark,5230,Odense M,,0,Primary,,,,None,120724,1014988420,31934990,None,,2022-03-18T00:00:00,2022-05-13T00:00:00,PRIVAT- OG ERHVERVSRÅDGIVER – ÆRØ med potentiale...,"med reference til Filialdirektøren  
 
 Store Rise Landevej 10 
DK- 5970 Ærøskøbing 
 www.sparekassen.dk   
 VIRKSOMHEDEN  
 Rise Sparekasse er i god udvikling og har introduceret en ny visuel identitet og tilgang til strategien, som slår igennem overalt i og uden for Sparekassen. Sparekassen har et klart formål om at  blive Danmarks mest samfundsansvarlige sparekasse . 
 I Rise Sparekasse arbejdes der dagligt på at tilbyde en professionel rådgivning hvor de altid har et brændende ønske om at understøtte initiativer, der hjælper med at forstærke regionen/lokalområderne, hvor et godt familieliv og et sundt erhvervsliv er en del af sparekassens ambition. 
 Gennem en kompetent, proaktiv og åben tilgang kæmpes der for at skabe løsninger, der udløser privat og erhvervsmæssige drømme – altid med en ambition om sund økonomi for alle parter. 
 I dag består Rise Sparekasse af 4 afdelinger fordelt på Rise, Svendborg, Faaborg og Haarby. 
 Sparekassen drives ud fra en ambition om, at kunden skal opleve værdi i sit kundeforhold, samt opleve, at Sparekassen gør en forskel for regionen. Vi måler og dokumenterer dette i handlinger ved, at være i aktiv kontakt med kunderne og bidrage til vækst i lokalområderne. Sparekassen har en organisation, hvor der ikke er langt fra ide til handling. Kunderne værdsætter den personlige og troværdige rådgivning, som virksomheden sætter en ære i at give. 
 Afdelingen i Rise, som denne stillingsprofil omhandler, har 10 medarbejdere i dag. Stillingen her, skal supplere de øvrige medarbejdere. 
 Rise Sparekasse er vokset støt gennem årene, fordi stadig flere kunder vælger Sparekassen, som den foretrukne samarbejdspartner. Udviklingen skyldes ikke mindst, at Sparekassen gør sig umage i at vejlede og rådgive kunderne og bruger tid på, at skabe gode relationer og er garant for en sund og seriøs kreditpolitik. 
 Rise Sparekasse oplever en stor tilgang af nye kunder – både privat og erhverv. For at sikre den videre udvikling leder de nu efter en privat- og erhvervsrådgiver, der skal være med til at sikre fortsat fremdrift og udvikling, samt være den synlige ambassadør for Sparekassen i lokalområdet. 
 STILLINGEN  
 Stillingen refererer til Filialdirektøren Ole L. Jørgensen. 
 Filialen ligger et i meget attraktivt område, hvor der anses at være et meget stort potentiale. Den nye Privat- og erhvervsrådgiver bliver således et vigtigt omdrejningspunkt i forhold til eksisterende kunder og ikke mindst nye kunder, hvor Privat- og Erhvervsrådgiveren vil komme til at spille en vigtig del i sparekassens vækstplaner. 
 Kandidaten skal kunne begå sig på alle niveauer og i netværk og skal tage ansvar og drive hele salgsprocessen. Herudover skal der skabes salgsfremmende aktiviteter via netværket, samt være tovholder på disse. 
 OPGAVEN  
 Den nye Privat- og erhvervsrådgiver skal være en vigtig del af den drivende kraft i afdelingen på både privat og erhvervsområdet, og være med til at fortsætte den positive udvikling koncernen er i og har været gennem en årrække. Fordelingen mellem privat- og erhvervskunder, forventes at være ligeligt fordelt. 
 Med den vækst, som Rise Sparekasse er inde i, samt med de krav, der stilles til en bankvirksomhed i denne størrelse med hensyn til rådgivning, vil hovedopgaverne være at: 
 
 Være ansvarlig for at pleje og udvikle eksisterende kundekreds 
 Udbygge egen kundeportefølje 
 Levere en engageret, kompetent og personlig rådgivning til kundekredsen 
 Være udfarende og have interesse i, at være opsøgende hos virksomheder i lokalområdet og der hvor indgangsvinklen umiddelbart er til stede. 
 Deltage ved målrettede salgsindsatser/kampagner 
 Sikre seriøs opfølgning på alle besøgte kunder 
 Have professionel håndtering af kundeforhold  
 Holde styr på kundernes finansielle arrangementer 
 Deltage i lokalområdets professionelle netværk 
 Være med til at øge kendskabsgraden til pengeinstituttet i lokalområdet 
 
 KANDIDATEN  
 Kandidaten kan i dag sidde i en tilsvarende stilling, der også gerne har andre forretningsområder tilknyttet, men har måske et mindre eller afgrænset ansvar og ønsker at blive ansvarlig for vedligeholdelse og opbygning af ny kundekreds. 
 Der lægges afgørende vægt på, at den nye Privat- og Erhvervsrådgiver er en meget, udadvendt og forretningsorienteret person, som på en lang række områder kan yde et væsentligt bidrag til udviklingen af filialen. 
 
 Kandidaten skal være god til at strukturere problemstillinger og arbejde selvstændigt 
 Gode kommunikations- og samarbejdsevner er afgørende for denne centrale position 
 Evner at tænke logisk og hurtigt tænkende samtidig med at holde styr på detaljerne 
 Kandidaten skal forfølge både kort og langsigtede mål, er forhandlingsvant på topniveau og vant til arbejdsgangene, beslutningsprocesser på højt niveau 
 Kandidaten skal være robust købmand – være handlekraftig – kunne begejstre - have drive /power til at kunne sætte sig igennem 
 
 Den nye Privat- og Erhvervsrådgiver er ligeledes en god ""intern"" sælger, dvs. være i stand til at formidle konkrete budskaber/visioner på en motiverende måde ud til kollegerne. 
 I hovedtræk forventes der:           
 
 at du er åben og imødekommende og vil bidrage med godt humør 
 du er initiativrig og løsningsorienteret 
 en der ser muligheder frem for begrænsninger 
 særdeles gode forhandlings- og kommunikationsevner 
 en der følger sagerne til dørs og får dem afsluttet 
 at du motiveres af en travl hverdag, hvor du selv kan prioritere din indsats 
 
 AKTIVITETER 
 Der må forventes aktiviteter i relation til deltagelse i lokale netværksaktiviteter - også udenfor normal arbejdstid. 
 UDDANNELSE 
 Du har en uddannelse fra den finansielle sektor og måske (ikke afgørende) HD (F)/Cand.merc., suppleret med andre brancherelaterede videreuddannelser. 
 BOPÆL 
 Det forventes, at du enten har bopæl eller tager bopæl på Ærø. 
 GAGEPAKKE 
 Der tilbydes en konkurrencedygtig lønpakke. 
 SPROG  
 Dansk flydende 
 IT  
 Superbruger af MS Office og gerne stort kendskab til div. banksystemer. Kandidaten skal generelt have gode evner til at sætte sig ind i nye IT-systemer.",,58,Danmark,492,Ærø,3,Syddanmark,5970,Ærøskøbing,1,1,Fuldtid,None,None,1,,0,,0,0,0,,False,"{'Id': 7834360, 'Email': None, 'FaxNumber': None, 'PersonName': 'Torben Christensen', 'FirstName': 'Torben', 'LastName': 'Christensen', 'PositionTitle': None, 'PhoneNumbers': [{'Number': '+45 2014 3976', 'Type': 0, 'Description': 'Hovednummer'}]}, {'Id': 7834361, 'Email': None, 'FaxNumber': None, 'PersonName': 'Carsten Gjørtsvang', 'FirstName': 'Carsten', 'LastName': 'Gjørtsvang', 'PositionTitle': None, 'PhoneNumbers': [{'Number': '+45 5140 8960', 'Type': 0, 'Description': 'Hovednummer'}]}",,True,False,False,False,4,,,False,False,False,False,,,,,http://www.targetheadhunting.com/ledige-stillinger/?hr=show-job/93643,False,2022-05-13T00:00:00,,0,Primary,7,/CV/FindWork/GetLogo?JobAdId=5557109&WorkPlace=120724&Organisation=31934990,"Forskerparken 10,5230, Odense M",False,False,/CV/Jobseeking/JobLog/CreateJobSearch?JobnetJobPostingIdentifier=5557109&Company.Name=TARGET Headhunting ApS&SubmissionDeadlineDate=2022-5-13&Title=PRIVAT- OG ERHVERVSRÅDGIVER – ÆRØ med potentiale...&WeeklyWorkTime=1,00000000-0000-0000-0000-000000000000,False,0,,,PRIVAT- OG ERHVERVSRÅDGIVER – ÆRØ med potentiale...,True,,True,1,,5557109,,,False,False,,0,False,TARGET Headhunting ApS,Forskerparken 10,,,5230,False,False,False,Odense M,Torben Christensen,+45 2014 3976,,,,,,False,,2022-05-13T00:00:00,,0,False,0,,,,,0,,,,False,False,,,False,False,,,,False,,False,,,Arbejdspladsen ligger i Ærø kommune,False,TARGET Headhunting ApS,,None,,False,False,"
	med reference til Filialdirekt&oslash;ren 


Store Rise Landevej 10
DK- 5970 &AElig;r&oslash;sk&oslash;bing

www.sparekassen.dk         


VIRKSOMHEDEN 


Rise Sparekasse er i god udvikling og har introduceret en ny visuel identitet og tilgang til strategien, som sl&aring;r igennem overalt i og uden for Sparekassen. Sparekassen har e","""\r\n\tmed reference til Filialdirekt\u0026oslash;ren \r\n\r\n\r\nStore Rise Landevej 10\r\nDK- 5970 \u0026AElig;r\u0026oslash;sk\u0026oslash;bing\r\n\r\nwww.sparekassen.dk         \r\n\r\n\r\nVIRKSOMHEDEN \r\n\r\n\r\nRise Sparekasse er i god udvikling og har introduceret en ny visuel identitet og tilgang til strategien, som sl\u0026aring;r igennem overalt i og uden for Sparekassen. Sparekassen har e""","""PRIVAT- OG ERHVERVSRÅDGIVER – ÆRØ med potentiale...""","https://www.google.dk/maps/dir//Forskerparken+10,5230,+Odense+M/","med reference til Filialdirektøren  
 
 Store Rise Landevej 10 
DK- 5970 Ærøskøbing 
 www.sparekassen.dk   
 VIRKSOMHEDEN  
 Rise Sparekasse er i god udvikling og har introduceret en ny visuel identitet og tilgang til strategien, som slår igennem overalt i og uden for Sparekassen. Sparekassen har et klart formål om at  blive Danmarks mest samfundsansvarlige sparekasse . 
 I Rise Sparekasse arbejdes der dagligt på at tilbyde en professionel rådgivning hvor de altid har et brændende ønske om at understøtte initiativer, der hjælper med at forstærke regionen/lokalområderne, hvor et godt familieliv og et sundt erhvervsliv er en del af sparekassens ambition. 
 Gennem en kompetent, proaktiv og åben tilgang kæmpes der for at skabe løsninger, der udløser privat og erhvervsmæssige drømme – altid med en ambition om sund økonomi for alle parter. 
 I dag består Rise Sparekasse af 4 afdelinger fordelt på Rise, Svendborg, Faaborg og Haarby. 
 Sparekassen drives ud fra en ambition om, at kunden skal opleve værdi i sit kundeforhold, samt opleve, at Sparekassen gør en forskel for regionen. Vi måler og dokumenterer dette i handlinger ved, at være i aktiv kontakt med kunderne og bidrage til vækst i lokalområderne. Sparekassen har en organisation, hvor der ikke er langt fra ide til handling. Kunderne værdsætter den personlige og troværdige rådgivning, som virksomheden sætter en ære i at give. 
 Afdelingen i Rise, som denne stillingsprofil omhandler, har 10 medarbejdere i dag. Stillingen her, skal supplere de øvrige medarbejdere. 
 Rise Sparekasse er vokset støt gennem årene, fordi stadig flere kunder vælger Sparekassen, som den foretrukne samarbejdspartner. Udviklingen skyldes ikke mindst, at Sparekassen gør sig umage i at vejlede og rådgive kunderne og bruger tid på, at skabe gode relationer og er garant for en sund og seriøs kreditpolitik. 
 Rise Sparekasse oplever en stor tilgang af nye kunder – både privat og erhverv. For at sikre den videre udvikling leder de nu efter en privat- og erhvervsrådgiver, der skal være med til at sikre fortsat fremdrift og udvikling, samt være den synlige ambassadør for Sparekassen i lokalområdet. 
 STILLINGEN  
 Stillingen refererer til Filialdirektøren Ole L. Jørgensen. 
 Filialen ligger et i meget attraktivt område, hvor der anses at være et meget stort potentiale. Den nye Privat- og erhvervsrådgiver bliver således et vigtigt omdrejningspunkt i forhold til eksisterende kunder og ikke mindst nye kunder, hvor Privat- og Erhvervsrådgiveren vil komme til at spille en vigtig del i sparekassens vækstplaner. 
 Kandidaten skal kunne begå sig på alle niveauer og i netværk og skal tage ansvar og drive hele salgsprocessen. Herudover skal der skabes salgsfremmende aktiviteter via netværket, samt være tovholder på disse. 
 OPGAVEN  
 Den nye Privat- og erhvervsrådgiver skal være en vigtig del af den drivende kraft i afdelingen på både privat og erhvervsområdet, og være med til at fortsætte den positive udvikling koncernen er i og har været gennem en årrække. Fordelingen mellem privat- og erhvervskunder, forventes at være ligeligt fordelt. 
 Med den vækst, som Rise Sparekasse er inde i, samt med de krav, der stilles til en bankvirksomhed i denne størrelse med hensyn til rådgivning, vil hovedopgaverne være at: 
 
 Være ansvarlig for at pleje og udvikle eksisterende kundekreds 
 Udbygge egen kundeportefølje 
 Levere en engageret, kompetent og personlig rådgivning til kundekredsen 
 Være udfarende og have interesse i, at være opsøgende hos virksomheder i lokalområdet og der hvor indgangsvinklen umiddelbart er til stede. 
 Deltage ved målrettede salgsindsatser/kampagner 
 Sikre seriøs opfølgning på alle besøgte kunder 
 Have professionel håndtering af kundeforhold  
 Holde styr på kundernes finansielle arrangementer 
 Deltage i lokalområdets professionelle netværk 
 Være med til at øge kendskabsgraden til pengeinstituttet i lokalområdet 
 
 KANDIDATEN  
 Kandidaten kan i dag sidde i en tilsvarende stilling, der også gerne har andre forretningsområder tilknyttet, men har måske et mindre eller afgrænset ansvar og ønsker at blive ansvarlig for vedligeholdelse og opbygning af ny kundekreds. 
 Der lægges afgørende vægt på, at den nye Privat- og Erhvervsrådgiver er en meget, udadvendt og forretningsorienteret person, som på en lang række områder kan yde et væsentligt bidrag til udviklingen af filialen. 
 
 Kandidaten skal være god til at strukturere problemstillinger og arbejde selvstændigt 
 Gode kommunikations- og samarbejdsevner er afgørende for denne centrale position 
 Evner at tænke logisk og hurtigt tænkende samtidig med at holde styr på detaljerne 
 Kandidaten skal forfølge både kort og langsigtede mål, er forhandlingsvant på topniveau og vant til arbejdsgangene, beslutningsprocesser på højt niveau 
 Kandidaten skal være robust købmand – være handlekraftig – kunne begejstre - have drive /power til at kunne sætte sig igennem 
 
 Den nye Privat- og Erhvervsrådgiver er ligeledes en god ""intern"" sælger, dvs. være i stand til at formidle konkrete budskaber/visioner på en motiverende måde ud til kollegerne. 
 I hovedtræk forventes der:           
 
 at du er åben og imødekommende og vil bidrage med godt humør 
 du er initiativrig og løsningsorienteret 
 en der ser muligheder frem for begrænsninger 
 særdeles gode forhandlings- og kommunikationsevner 
 en der følger sagerne til dørs og får dem afsluttet 
 at du motiveres af en travl hverdag, hvor du selv kan prioritere din indsats 
 
 AKTIVITETER 
 Der må forventes aktiviteter i relation til deltagelse i lokale netværksaktiviteter - også udenfor normal arbejdstid. 
 UDDANNELSE 
 Du har en uddannelse fra den finansielle sektor og måske (ikke afgørende) HD (F)/Cand.merc., suppleret med andre brancherelaterede videreuddannelser. 
 BOPÆL 
 Det forventes, at du enten har bopæl eller tager bopæl på Ærø. 
 GAGEPAKKE 
 Der tilbydes en konkurrencedygtig lønpakke. 
 SPROG  
 Dansk flydende 
 IT  
 Superbruger af MS Office og gerne stort kendskab til div. banksystemer. Kandidaten skal generelt have gode evner til at sætte sig ind i nye IT-systemer.","https://www.google.dk/maps/place/Forskerparken+10,5230,+Odense+M/",31934990,False,False,,False
