summary_AutomatchType,summary_Abroad,summary_Weight,summary_Title,summary_JobHeadline,summary_Presentation,summary_HiringOrgName,summary_WorkPlaceAddress,summary_WorkPlacePostalCode,summary_WorkPlaceCity,summary_WorkPlaceOtherAddress,summary_WorkPlaceAbroad,summary_WorkPlaceNotStatic,summary_UseWorkPlaceAddressForJoblog,summary_PostingCreated,summary_LastDateApplication,summary_FormattedLastDateApplication,summary_AssignmentStartDate,summary_IsHotjob,summary_IsExternal,summary_Url,summary_Region,summary_Municipality,summary_Country,summary_PostalCode,summary_PostalCodeName,summary_JobAnnouncementType,summary_EmploymentType,summary_WorkHours,summary_OccupationArea,summary_OccupationGroup,summary_Occupation,summary_Location_Latitude,summary_Location_Longitude,summary_JoblogWorkTime_WorkHour,summary_JoblogWorkTime_DailyWorkTime,summary_WorkplaceID,summary_OrganisationId,summary_HiringOrgCVR,summary_UserLoggedIn,summary_AnonymousEmployer,summary_ShareUrl,summary_DetailsUrl,summary_JobLogUrl,summary_HasLocationValues,summary_ID,summary_Latitude,summary_Longitude,details_WorkSchedule,details_WorkConditions,details_EmploymentTypes,details_WorkPlace_Name,details_WorkPlace_Address_AddressLine,details_WorkPlace_Address_Country_Id,details_WorkPlace_Address_Country_Name,details_WorkPlace_Address_Municipality_Id,details_WorkPlace_Address_Municipality_Name,details_WorkPlace_Address_Region_Id,details_WorkPlace_Address_Region_Name,details_WorkPlace_Address_PostalCode,details_WorkPlace_Address_City,details_WorkPlace_PhoneNumber_Number,details_WorkPlace_PhoneNumber_Type,details_WorkPlace_PhoneNumber_Description,details_WorkPlace_FaxNumber,details_WorkPlace_Email,details_WorkPlace_WebAddress,details_WorkPlace_Description,details_WorkPlace_Logo,details_WorkPlace_WorkPlaceOrganizationNumber,details_WorkPlace_OrganizationNumber,details_WorkPlace_OrganizationDescription,details_JobPositionPosting_Id,details_JobPositionPosting_OriginalJppId,details_JobPositionPosting_HiringOrg_Name,details_JobPositionPosting_HiringOrg_Address_AddressLine,details_JobPositionPosting_HiringOrg_Address_Country_Id,details_JobPositionPosting_HiringOrg_Address_Country_Name,details_JobPositionPosting_HiringOrg_Address_Municipality_Id,details_JobPositionPosting_HiringOrg_Address_Municipality_Name,details_JobPositionPosting_HiringOrg_Address_Region_Id,details_JobPositionPosting_HiringOrg_Address_Region_Name,details_JobPositionPosting_HiringOrg_Address_PostalCode,details_JobPositionPosting_HiringOrg_Address_City,details_JobPositionPosting_HiringOrg_PhoneNumber_Number,details_JobPositionPosting_HiringOrg_PhoneNumber_Type,details_JobPositionPosting_HiringOrg_PhoneNumber_Description,details_JobPositionPosting_HiringOrg_FaxNumber,details_JobPositionPosting_HiringOrg_Email,details_JobPositionPosting_HiringOrg_WebAddress,details_JobPositionPosting_HiringOrg_Description,details_JobPositionPosting_HiringOrg_Logo,details_JobPositionPosting_HiringOrg_WorkPlaceOrganizationNumber,details_JobPositionPosting_HiringOrg_OrganizationNumber,details_JobPositionPosting_HiringOrg_OrganizationDescription,details_JobPositionPosting_RecruitingCompany,details_JobPositionPosting_PublicationStartDate,details_JobPositionPosting_PublicationEndDate,details_JobPositionPosting_JobPositionInformation_PositionTitle,details_JobPositionPosting_JobPositionInformation_Purpose,details_JobPositionPosting_JobPositionInformation_WorkLocation_AddressLine,details_JobPositionPosting_JobPositionInformation_WorkLocation_Country_Id,details_JobPositionPosting_JobPositionInformation_WorkLocation_Country_Name,details_JobPositionPosting_JobPositionInformation_WorkLocation_Municipality_Id,details_JobPositionPosting_JobPositionInformation_WorkLocation_Municipality_Name,details_JobPositionPosting_JobPositionInformation_WorkLocation_Region_Id,details_JobPositionPosting_JobPositionInformation_WorkLocation_Region_Name,details_JobPositionPosting_JobPositionInformation_WorkLocation_PostalCode,details_JobPositionPosting_JobPositionInformation_WorkLocation_City,details_JobPositionPosting_JobPositionInformation_EmploymentType,details_JobPositionPosting_JobPositionInformation_WeeklyWorkHours_TypeId,details_JobPositionPosting_JobPositionInformation_WeeklyWorkHours_TypeName,details_JobPositionPosting_JobPositionInformation_WeeklyWorkHours_Description,details_JobPositionPosting_JobPositionInformation_CompensationDescription,details_JobPositionPosting_JobPositionInformation_NumberToFill,details_JobPositionPosting_JobPositionInformation_DriverLicense,details_JobPositionPosting_JobPositionInformation_Occupation_DiscoWeb,details_JobPositionPosting_JobPositionInformation_Occupation_AlternateNames,details_JobPositionPosting_JobPositionInformation_Occupation_GroupId,details_JobPositionPosting_JobPositionInformation_Occupation_AreaId,details_JobPositionPosting_JobPositionInformation_Occupation_Id,details_JobPositionPosting_JobPositionInformation_Occupation_Name,details_JobPositionPosting_JobPositionInformation_IsGovernmentHiring,details_JobPositionPosting_JobPositionInformation_JppContacts,details_JobPositionPosting_JobPositionInformation_EmploymentDate,details_JobPositionPosting_IsRecruitmentOfForeignNationals,details_JobPositionPosting_IsWorkInDenmark,details_JobPositionPosting_IsAnonymousEmployer,details_JobPositionPosting_IsDisabilityFriendly,details_JobPositionPosting_JppType,details_JobPositionPosting_ApplicationDetails_WorkHourMax,details_JobPositionPosting_ApplicationDetails_WorkHourMin,details_JobPositionPosting_ApplicationDetails_DailyWorkTimeWeekend,details_JobPositionPosting_ApplicationDetails_DailyWorkTimeNight,details_JobPositionPosting_ApplicationDetails_DailyWorkTimeEvening,details_JobPositionPosting_ApplicationDetails_DailyWorkTimeDay,details_JobPositionPosting_ApplicationDetails_ReferenceText,details_JobPositionPosting_ApplicationDetails_RemarksToApplicant,details_JobPositionPosting_ApplicationDetails_ByEmail,details_JobPositionPosting_ApplicationDetails_ByPhone,details_JobPositionPosting_ApplicationDetails_ApplyViaUrl,details_JobPositionPosting_ApplicationDetails_ReplyInWriting,details_JobPositionPosting_ApplicationDetails_ApplicationDeadlineDate,details_JobPositionPosting_ContactAuthorityPhoneNumber_Number,details_JobPositionPosting_ContactAuthorityPhoneNumber_Type,details_JobPositionPosting_ContactAuthorityPhoneNumber_Description,details_JobPositionPosting_Status,details_LogoUrl,details_Address,details_ShowMap,details_ShowShareButtonJobLog,details_JobLogUrl,details_JobLogTemplateModel_Identifier,details_JobLogTemplateModel_UseWorkPlaceAddressForJoblog,details_JobLogTemplateModel_Category,details_JobLogTemplateModel_CvCustomerIdentifier,details_JobLogTemplateModel_JobSeekingStatus,details_JobLogTemplateModel_Title,details_JobLogTemplateModel_IsApplicationSourceRequired,details_JobLogTemplateModel_ApplicationSource,details_JobLogTemplateModel_IsWeeklyWorkTimeRequired,details_JobLogTemplateModel_WeeklyWorkTime,details_JobLogTemplateModel_HoursPerWeek,details_JobLogTemplateModel_JobnetJobPostingIdentifier,details_JobLogTemplateModel_JobAdDocument_Title,details_JobLogTemplateModel_JobAdDocument_Identifier,details_JobLogTemplateModel_JobAdDocument_IsDeletedBySystem,details_JobLogTemplateModel_JobAdDocument_IsDeletedByUser,details_JobLogTemplateModel_JobAdFile,details_JobLogTemplateModel_Company_JobLogEntryCategory,details_JobLogTemplateModel_Company_ShowAddressFieldsEvenIfEmpty,details_JobLogTemplateModel_Company_Name,details_JobLogTemplateModel_Company_Address,details_JobLogTemplateModel_Company_Country,details_JobLogTemplateModel_Company_EmploymentAreaID,details_JobLogTemplateModel_Company_PostCode,details_JobLogTemplateModel_Company_IsCountryAndTownAndPostCodeEmpty,details_JobLogTemplateModel_Company_IsTownAndPostCodeEmpty,details_JobLogTemplateModel_Company_IsCountryDanmark,details_JobLogTemplateModel_Company_Town,details_JobLogTemplateModel_Company_ContactPerson,details_JobLogTemplateModel_Company_Phone,details_JobLogTemplateModel_Company_Email,details_JobLogTemplateModel_Company_Latitude,details_JobLogTemplateModel_Company_Longitude,details_JobLogTemplateModel_Company_DailyTravelTimeInMinutes,details_JobLogTemplateModel_Company_DistanceToCompanyInMeters,details_JobLogTemplateModel_Company_IsCreateMode,details_JobLogTemplateModel_TypeOfSubmission,details_JobLogTemplateModel_SubmissionDate,details_JobLogTemplateModel_SubmissionDateFormatted,details_JobLogTemplateModel_SubmissionDateTiks,details_JobLogTemplateModel_IsSubmissionDateRequired,details_JobLogTemplateModel_Status,details_JobLogTemplateModel_DateCreatedFormatted,details_JobLogTemplateModel_DateCreated,details_JobLogTemplateModel_DateModifiedFormatted,details_JobLogTemplateModel_DateModified,details_JobLogTemplateModel_LastModifiedDateTiks,details_JobLogTemplateModel_DateClosed,details_JobLogTemplateModel_JobApplicationDocument_Title,details_JobLogTemplateModel_JobApplicationDocument_Identifier,details_JobLogTemplateModel_JobApplicationDocument_IsDeletedBySystem,details_JobLogTemplateModel_JobApplicationDocument_IsDeletedByUser,details_JobLogTemplateModel_CvDocument_Title,details_JobLogTemplateModel_CvDocument_Identifier,details_JobLogTemplateModel_CvDocument_IsDeletedBySystem,details_JobLogTemplateModel_CvDocument_IsDeletedByUser,details_JobLogTemplateModel_JobApplicationFile,details_JobLogTemplateModel_CvFile,details_JobLogTemplateModel_SubmissionDeadlineDate,details_JobLogTemplateModel_IsPersisted,details_JobLogTemplateModel_ServerValidationErrors,details_JobLogTemplateModel_HasServerValidationErrors,details_JoblogWorkTime_WorkHour,details_JoblogWorkTime_DailyWorkTime,details_Place,details_OpenPrintDialog,details_WorkPlaceInfoText,details_JobCenterContactDetails,details_WorkPlaceDescriptionText,details_FavoriteText,details_IsFavorite,details_ShowFavorite,details_MetaOgTextForSharing,details_DescriptionForSharing,details_TitleForSharing,details_RutePlan,details_FormattedPurpose,details_MapUrl,details_OrganizationNumber,details_ShowSearchJobButton,details_ShowPrint,details_BackToFindWorkButtonUrl,isExternal
0,False,1,Vi søger en ventilationstekniker i Bjerringbro.,Vi søger en ventilationstekniker i Bjerringbro.,"Er du uddannet ventilationstekniker? Har du erfaring med bygningsvedligehold og brænder du for at levere høj kvalitet og service? Så er det måske dig vi mangler!

På grund af øget a",Adecco,,,,False,False,True,False,2022-03-21T00:00:00,2022-05-16T00:00:00,16. maj 2022,0001-01-01T00:00:00,False,False,https://job.jobnet.dk/CV/FindWork/Details/5557818,,,Danmark,2000,,,,Fuldtid,Bygge og anlæg,Vvs og blik,Ventilationstekniker,55.6795,12.5156,,,66770,666,12932375,False,False,https://job.jobnet.dk/CV/FindWork/DetailsSocialmedia/5557818,https://job.jobnet.dk/CV/FindWork/Details/5557818,https://job.jobnet.dk/CV/FindWork/Details/5557818,True,5557818,55.6795,12.5156,"{'Id': 1, 'Name': 'Fuldtid'}, {'Id': 16, 'Name': 'Deltid'}","{'Id': 1, 'Name': 'Almindelige vilkår'}, {'Id': 2, 'Name': 'Fleksjob'}, {'Id': 3, 'Name': 'Skånejob'}, {'Id': 4, 'Name': 'Egnet til efterlønnere og seniorer'}, {'Id': 5, 'Name': 'Job med løntilskud'}, {'Id': 6, 'Name': 'Rotationsjob'}, {'Id': 7, 'Name': 'Virksomhedspraktik'}","{'Id': 1, 'Name': 'Fastansættelse'}, {'Id': 16, 'Name': 'Tidsbegrænset ansættelse'}",Adecco,"Falkoner Alle 1, 4. sal",58,Danmark,101,København,4,"Hovedstaden, Sjælland og Bornholm",2000,Frederiksberg,,0,Primary,,,,None,66770,1003227721,12932375,"Adecco er markedsleder, når det gælder vikar- og rekrutteringsløsninger.
Sådan er det både globalt og lokalt, hvor vi har 12 kontorer fordelt rundt omkring i landet. Dermed er vi både tæt på dig og vores kunder.",5557818,5557818,Adecco,"Falkoner Alle 1, 4. sal",58,Danmark,101,København,4,"Hovedstaden, Sjælland og Bornholm",2000,Frederiksberg,,0,Primary,,,,None,66770,1003227721,12932375,"Adecco er markedsleder, når det gælder vikar- og rekrutteringsløsninger.
Sådan er det både globalt og lokalt, hvor vi har 12 kontorer fordelt rundt omkring i landet. Dermed er vi både tæt på dig og vores kunder.",,2022-03-21T00:00:00,2022-05-16T00:00:00,Vi søger en ventilationstekniker i Bjerringbro.,"Er du uddannet ventilationstekniker? Har du erfaring med bygningsvedligehold og brænder du for at levere høj kvalitet og service? Så er det måske dig vi mangler! 
 På grund af øget aktivitet, har vi brug for en dygtig medarbejder med fast ansættelsessted hos en stor produktionsvirksomhed  i Bjerringbro, Midtjylland . På kontrakten beskæftiger vi cirka 60 dygtige medarbejdere indenfor forskellige fagområder. Vi løser fagtekniske opgaver af høj kvalitet for vores kunde, som vi supporterer med drift og vedligehold af bygninger og teknisk udstyr. 

DINE ARBEJDSOPGAVER 

 Som ventilationstekniker skal du være kunden behjælpelig med en række forebyggende vedligeholdelsesopgaver, akut skadestop, udbedring af fejl og mangler samt mindre opgaver af forskellig karakter 
 Dine opgaver vil bl.a. være: 
 
 Fejlfinding og udbedring på tekniske installationer  
 Vedligeholdelses- og driftsopgaver på kundens faciliteter  
 Løsning og udførsel af afvekslende serviceopgaver og projekter indenfor bygningsdrift  
 Medvirke til at alle indkommende ad hoc-opgaver bliver prioriteret og udført  
 Automatik og styringer til ventilationsanlæg  
 Indregulering af anlæg.  
 Mindre omforandringer af rør og spjæld 
 
 Opgaverne vil typisk være mindre opgaver, som kan vare alt fra få timer til et par dage, og planlægges typisk på ugebasis. Du skal også samarbejde med andre faggrupper, som fx elektrikere, tømrere og VVS'ere. 
 Arbejdsdagen byder på stor alsidighed og en høj grad af selvstændighed i arbejdet, hvor du får mulighed for at bringe din erfaring og store faglighed i spil. 
 Du bliver en del af et erfarent team med fokus på drift og servicering af kundernes behov. Det er teamets ansvar og opgave at hjælpe hinanden med at løse både de planlagte og de akut opståede opgaver, hvor vores kunder skal opleve hurtig og effektiv opgaveløsning i høj kvalitet. 

HVEM ER DU?

 Du er en dygtig ventilationstekniker, som har et skarpt øje for den gode løsning og for at levere en høj kvalitet. Du arbejder selvstændigt, og trives med at tage faglige beslutninger indenfor dit arbejdsområde. 
 
 Uddannet ventilationstekniker, og har praktisk erfaring med at udføre vedligeholdelsesopgaver og fejlsøgning  
 Kendskab til ventilationstekniske installationer, og har gerne kompetencer indenfor styringer og indregulering   
 Erfaring med bygningsservice  
 Har en positiv indstilling og yder en top service til vores kunder, dvs. du er kvalitetsbevidst og har et stort ”servicegen”   
 Selvstændig, pro-aktiv og kan arbejde alene  
 Ansvarsbevidst, struktureret og har altid øje for at finde løsninger, der matcher kundes behov  
 Kan anvende IT som arbejdsværktøj  
 Kommunikerer mundtlig og skriftlig på dansk  
 
 Det er en forudsætning for ansættelsen, at du har gyldigt kørekort til personbil, og at du kan fremvise straffeattest. 

HVAD KAN VI TILBYDE DIG?

 Vi tilbyder dig en spændende stilling i en af Danmarks største virksomheder. Du bliver en del af et forretningsområde i vækst, hvor der er gode muligheder for faglig udvikling og sparring med kompetente kolleger. Derudover får du mange dygtige, gode og sjove kolleger, som vægter team-arbejde højt og som sætter en ære i at hjælpe hinanden. 
 Lønpakken inkluderer overenskomstmæssig ansættelse med pensionsordning og sundhedsforsikring med forskellige behandlingsmuligheder. Derudover får du en række personalegoder i form af ISS Fritid med f.eks. rabatordninger, forskellige firmaarrangementer og mulighed for at leje ferieboliger i ind- og udland. 

ANSØGNING

 Vi glæder os til at høre fra dig og beder dig sende din ansøgning vedlagt CV. Du kan søge på denne hjemmeside ved ""ansøg"". Vi behandler ansøgningerne løbende, så send gerne din ansøgning allerede i dag. 
 For yderligere information om stillingen, kan du fange Nikolaj Holm på +45 38 38 11 48 i tidsrummet 09.00 - 16.00 
Mails er også velkomne på Nikolaj.Holm@adecco.dk",,58,Danmark,9090,,99,Intet fast arbejdssted,,,1,1,Fuldtid,None,None,1,,0,,0,0,0,,False,"{'Id': 7837070, 'Email': None, 'FaxNumber': None, 'PersonName': 'Nikolaj Holm', 'FirstName': 'Nikolaj', 'LastName': 'Holm', 'PositionTitle': None, 'PhoneNumbers': [{'Number': '38381148', 'Type': 0, 'Description': 'Hovednummer'}]}",,False,False,False,False,4,,,False,False,False,False,,,,,https://www.adecco.dk/jobannonce/?ID=93764,False,2022-05-16T00:00:00,,0,Primary,7,/CV/FindWork/GetLogo?JobAdId=5557818&WorkPlace=66770&Organisation=12932375,"Falkoner Alle 1, 4. sal,2000, Frederiksberg",False,False,/CV/Jobseeking/JobLog/CreateJobSearch?JobnetJobPostingIdentifier=5557818&Company.Name=Adecco&SubmissionDeadlineDate=2022-5-16&Title=Vi søger en ventilationstekniker i Bjerringbro.&WeeklyWorkTime=1,00000000-0000-0000-0000-000000000000,False,0,,,Vi søger en ventilationstekniker i Bjerringbro.,True,,True,1,,5557818,,,False,False,,0,False,Adecco,"Falkoner Alle 1, 4. sal",,,2000,False,False,False,Frederiksberg,Nikolaj Holm,38381148,,,,,,False,,2022-05-16T00:00:00,,0,False,0,,,,,0,,,,False,False,,,False,False,,,,False,,False,,,Intet fast arbejdssted,False,Adecco,,"Adecco er markedsleder, når det gælder vikar- og rekrutteringsløsninger.
Sådan er det både globalt og lokalt, hvor vi har 12 kontorer fordelt rundt omkring i landet. Dermed er vi både tæt på dig og vores kunder.",,False,False,"Er du uddannet ventilationstekniker? Har du erfaring med bygningsvedligehold og br&aelig;nder du for at levere h&oslash;j kvalitet og service? S&aring; er det m&aring;ske dig vi mangler!

P&aring; grund af &oslash;get aktivitet, har vi brug for en dygtig medarbejder med fast ans&aelig;ttelsessted hos en stor produktionsvirksomhed i Bjerringbro, M","""Er du uddannet ventilationstekniker? Har du erfaring med bygningsvedligehold og br\u0026aelig;nder du for at levere h\u0026oslash;j kvalitet og service? S\u0026aring; er det m\u0026aring;ske dig vi mangler!\r\n\r\nP\u0026aring; grund af \u0026oslash;get aktivitet, har vi brug for en dygtig medarbejder med fast ans\u0026aelig;ttelsessted hos en stor produktionsvirksomhed i Bjerringbro, M""","""Vi søger en ventilationstekniker i Bjerringbro.""","https://www.google.dk/maps/dir//Falkoner+Alle+1,+4.+sal,2000,+Frederiksberg/","Er du uddannet ventilationstekniker? Har du erfaring med bygningsvedligehold og brænder du for at levere høj kvalitet og service? Så er det måske dig vi mangler! 
 På grund af øget aktivitet, har vi brug for en dygtig medarbejder med fast ansættelsessted hos en stor produktionsvirksomhed  i Bjerringbro, Midtjylland . På kontrakten beskæftiger vi cirka 60 dygtige medarbejdere indenfor forskellige fagområder. Vi løser fagtekniske opgaver af høj kvalitet for vores kunde, som vi supporterer med drift og vedligehold af bygninger og teknisk udstyr. 

DINE ARBEJDSOPGAVER 

 Som ventilationstekniker skal du være kunden behjælpelig med en række forebyggende vedligeholdelsesopgaver, akut skadestop, udbedring af fejl og mangler samt mindre opgaver af forskellig karakter 
 Dine opgaver vil bl.a. være: 
 
 Fejlfinding og udbedring på tekniske installationer  
 Vedligeholdelses- og driftsopgaver på kundens faciliteter  
 Løsning og udførsel af afvekslende serviceopgaver og projekter indenfor bygningsdrift  
 Medvirke til at alle indkommende ad hoc-opgaver bliver prioriteret og udført  
 Automatik og styringer til ventilationsanlæg  
 Indregulering af anlæg.  
 Mindre omforandringer af rør og spjæld 
 
 Opgaverne vil typisk være mindre opgaver, som kan vare alt fra få timer til et par dage, og planlægges typisk på ugebasis. Du skal også samarbejde med andre faggrupper, som fx elektrikere, tømrere og VVS'ere. 
 Arbejdsdagen byder på stor alsidighed og en høj grad af selvstændighed i arbejdet, hvor du får mulighed for at bringe din erfaring og store faglighed i spil. 
 Du bliver en del af et erfarent team med fokus på drift og servicering af kundernes behov. Det er teamets ansvar og opgave at hjælpe hinanden med at løse både de planlagte og de akut opståede opgaver, hvor vores kunder skal opleve hurtig og effektiv opgaveløsning i høj kvalitet. 

HVEM ER DU?

 Du er en dygtig ventilationstekniker, som har et skarpt øje for den gode løsning og for at levere en høj kvalitet. Du arbejder selvstændigt, og trives med at tage faglige beslutninger indenfor dit arbejdsområde. 
 
 Uddannet ventilationstekniker, og har praktisk erfaring med at udføre vedligeholdelsesopgaver og fejlsøgning  
 Kendskab til ventilationstekniske installationer, og har gerne kompetencer indenfor styringer og indregulering   
 Erfaring med bygningsservice  
 Har en positiv indstilling og yder en top service til vores kunder, dvs. du er kvalitetsbevidst og har et stort ”servicegen”   
 Selvstændig, pro-aktiv og kan arbejde alene  
 Ansvarsbevidst, struktureret og har altid øje for at finde løsninger, der matcher kundes behov  
 Kan anvende IT som arbejdsværktøj  
 Kommunikerer mundtlig og skriftlig på dansk  
 
 Det er en forudsætning for ansættelsen, at du har gyldigt kørekort til personbil, og at du kan fremvise straffeattest. 

HVAD KAN VI TILBYDE DIG?

 Vi tilbyder dig en spændende stilling i en af Danmarks største virksomheder. Du bliver en del af et forretningsområde i vækst, hvor der er gode muligheder for faglig udvikling og sparring med kompetente kolleger. Derudover får du mange dygtige, gode og sjove kolleger, som vægter team-arbejde højt og som sætter en ære i at hjælpe hinanden. 
 Lønpakken inkluderer overenskomstmæssig ansættelse med pensionsordning og sundhedsforsikring med forskellige behandlingsmuligheder. Derudover får du en række personalegoder i form af ISS Fritid med f.eks. rabatordninger, forskellige firmaarrangementer og mulighed for at leje ferieboliger i ind- og udland. 

ANSØGNING

 Vi glæder os til at høre fra dig og beder dig sende din ansøgning vedlagt CV. Du kan søge på denne hjemmeside ved ""ansøg"". Vi behandler ansøgningerne løbende, så send gerne din ansøgning allerede i dag. 
 For yderligere information om stillingen, kan du fange Nikolaj Holm på +45 38 38 11 48 i tidsrummet 09.00 - 16.00 
Mails er også velkomne på Nikolaj.Holm@adecco.dk","https://www.google.dk/maps/place/Falkoner+Alle+1,+4.+sal,2000,+Frederiksberg/",12932375,False,False,,False
