summary_AutomatchType,summary_Abroad,summary_Weight,summary_Title,summary_JobHeadline,summary_Presentation,summary_HiringOrgName,summary_WorkPlaceAddress,summary_WorkPlacePostalCode,summary_WorkPlaceCity,summary_WorkPlaceOtherAddress,summary_WorkPlaceAbroad,summary_WorkPlaceNotStatic,summary_UseWorkPlaceAddressForJoblog,summary_PostingCreated,summary_LastDateApplication,summary_FormattedLastDateApplication,summary_AssignmentStartDate,summary_IsHotjob,summary_IsExternal,summary_Url,summary_Region,summary_Municipality,summary_Country,summary_PostalCode,summary_PostalCodeName,summary_JobAnnouncementType,summary_EmploymentType,summary_WorkHours,summary_OccupationArea,summary_OccupationGroup,summary_Occupation,summary_Location_Latitude,summary_Location_Longitude,summary_JoblogWorkTime_WorkHour,summary_JoblogWorkTime_DailyWorkTime,summary_WorkplaceID,summary_OrganisationId,summary_HiringOrgCVR,summary_UserLoggedIn,summary_AnonymousEmployer,summary_ShareUrl,summary_DetailsUrl,summary_JobLogUrl,summary_HasLocationValues,summary_ID,summary_Latitude,summary_Longitude,details_WorkSchedule,details_WorkConditions,details_EmploymentTypes,details_WorkPlace_Name,details_WorkPlace_Address_AddressLine,details_WorkPlace_Address_Country_Id,details_WorkPlace_Address_Country_Name,details_WorkPlace_Address_Municipality_Id,details_WorkPlace_Address_Municipality_Name,details_WorkPlace_Address_Region_Id,details_WorkPlace_Address_Region_Name,details_WorkPlace_Address_PostalCode,details_WorkPlace_Address_City,details_WorkPlace_PhoneNumber_Number,details_WorkPlace_PhoneNumber_Type,details_WorkPlace_PhoneNumber_Description,details_WorkPlace_FaxNumber,details_WorkPlace_Email,details_WorkPlace_WebAddress,details_WorkPlace_Description,details_WorkPlace_Logo,details_WorkPlace_WorkPlaceOrganizationNumber,details_WorkPlace_OrganizationNumber,details_WorkPlace_OrganizationDescription,details_JobPositionPosting_Id,details_JobPositionPosting_OriginalJppId,details_JobPositionPosting_HiringOrg_Name,details_JobPositionPosting_HiringOrg_Address_AddressLine,details_JobPositionPosting_HiringOrg_Address_Country_Id,details_JobPositionPosting_HiringOrg_Address_Country_Name,details_JobPositionPosting_HiringOrg_Address_Municipality_Id,details_JobPositionPosting_HiringOrg_Address_Municipality_Name,details_JobPositionPosting_HiringOrg_Address_Region_Id,details_JobPositionPosting_HiringOrg_Address_Region_Name,details_JobPositionPosting_HiringOrg_Address_PostalCode,details_JobPositionPosting_HiringOrg_Address_City,details_JobPositionPosting_HiringOrg_PhoneNumber_Number,details_JobPositionPosting_HiringOrg_PhoneNumber_Type,details_JobPositionPosting_HiringOrg_PhoneNumber_Description,details_JobPositionPosting_HiringOrg_FaxNumber,details_JobPositionPosting_HiringOrg_Email,details_JobPositionPosting_HiringOrg_WebAddress,details_JobPositionPosting_HiringOrg_Description,details_JobPositionPosting_HiringOrg_Logo,details_JobPositionPosting_HiringOrg_WorkPlaceOrganizationNumber,details_JobPositionPosting_HiringOrg_OrganizationNumber,details_JobPositionPosting_HiringOrg_OrganizationDescription,details_JobPositionPosting_RecruitingCompany,details_JobPositionPosting_PublicationStartDate,details_JobPositionPosting_PublicationEndDate,details_JobPositionPosting_JobPositionInformation_PositionTitle,details_JobPositionPosting_JobPositionInformation_Purpose,details_JobPositionPosting_JobPositionInformation_WorkLocation_AddressLine,details_JobPositionPosting_JobPositionInformation_WorkLocation_Country_Id,details_JobPositionPosting_JobPositionInformation_WorkLocation_Country_Name,details_JobPositionPosting_JobPositionInformation_WorkLocation_Municipality_Id,details_JobPositionPosting_JobPositionInformation_WorkLocation_Municipality_Name,details_JobPositionPosting_JobPositionInformation_WorkLocation_Region_Id,details_JobPositionPosting_JobPositionInformation_WorkLocation_Region_Name,details_JobPositionPosting_JobPositionInformation_WorkLocation_PostalCode,details_JobPositionPosting_JobPositionInformation_WorkLocation_City,details_JobPositionPosting_JobPositionInformation_EmploymentType,details_JobPositionPosting_JobPositionInformation_WeeklyWorkHours_TypeId,details_JobPositionPosting_JobPositionInformation_WeeklyWorkHours_TypeName,details_JobPositionPosting_JobPositionInformation_WeeklyWorkHours_Description,details_JobPositionPosting_JobPositionInformation_CompensationDescription,details_JobPositionPosting_JobPositionInformation_NumberToFill,details_JobPositionPosting_JobPositionInformation_DriverLicense,details_JobPositionPosting_JobPositionInformation_Occupation_DiscoWeb,details_JobPositionPosting_JobPositionInformation_Occupation_AlternateNames,details_JobPositionPosting_JobPositionInformation_Occupation_GroupId,details_JobPositionPosting_JobPositionInformation_Occupation_AreaId,details_JobPositionPosting_JobPositionInformation_Occupation_Id,details_JobPositionPosting_JobPositionInformation_Occupation_Name,details_JobPositionPosting_JobPositionInformation_IsGovernmentHiring,details_JobPositionPosting_JobPositionInformation_JppContacts,details_JobPositionPosting_JobPositionInformation_EmploymentDate,details_JobPositionPosting_IsRecruitmentOfForeignNationals,details_JobPositionPosting_IsWorkInDenmark,details_JobPositionPosting_IsAnonymousEmployer,details_JobPositionPosting_IsDisabilityFriendly,details_JobPositionPosting_JppType,details_JobPositionPosting_ApplicationDetails_WorkHourMax,details_JobPositionPosting_ApplicationDetails_WorkHourMin,details_JobPositionPosting_ApplicationDetails_DailyWorkTimeWeekend,details_JobPositionPosting_ApplicationDetails_DailyWorkTimeNight,details_JobPositionPosting_ApplicationDetails_DailyWorkTimeEvening,details_JobPositionPosting_ApplicationDetails_DailyWorkTimeDay,details_JobPositionPosting_ApplicationDetails_ReferenceText,details_JobPositionPosting_ApplicationDetails_RemarksToApplicant,details_JobPositionPosting_ApplicationDetails_ByEmail,details_JobPositionPosting_ApplicationDetails_ByPhone,details_JobPositionPosting_ApplicationDetails_ApplyViaUrl,details_JobPositionPosting_ApplicationDetails_ReplyInWriting,details_JobPositionPosting_ApplicationDetails_ApplicationDeadlineDate,details_JobPositionPosting_ContactAuthorityPhoneNumber_Number,details_JobPositionPosting_ContactAuthorityPhoneNumber_Type,details_JobPositionPosting_ContactAuthorityPhoneNumber_Description,details_JobPositionPosting_Status,details_LogoUrl,details_Address,details_ShowMap,details_ShowShareButtonJobLog,details_JobLogUrl,details_JobLogTemplateModel_Identifier,details_JobLogTemplateModel_UseWorkPlaceAddressForJoblog,details_JobLogTemplateModel_Category,details_JobLogTemplateModel_CvCustomerIdentifier,details_JobLogTemplateModel_JobSeekingStatus,details_JobLogTemplateModel_Title,details_JobLogTemplateModel_IsApplicationSourceRequired,details_JobLogTemplateModel_ApplicationSource,details_JobLogTemplateModel_IsWeeklyWorkTimeRequired,details_JobLogTemplateModel_WeeklyWorkTime,details_JobLogTemplateModel_HoursPerWeek,details_JobLogTemplateModel_JobnetJobPostingIdentifier,details_JobLogTemplateModel_JobAdDocument_Title,details_JobLogTemplateModel_JobAdDocument_Identifier,details_JobLogTemplateModel_JobAdDocument_IsDeletedBySystem,details_JobLogTemplateModel_JobAdDocument_IsDeletedByUser,details_JobLogTemplateModel_JobAdFile,details_JobLogTemplateModel_Company_JobLogEntryCategory,details_JobLogTemplateModel_Company_ShowAddressFieldsEvenIfEmpty,details_JobLogTemplateModel_Company_Name,details_JobLogTemplateModel_Company_Address,details_JobLogTemplateModel_Company_Country,details_JobLogTemplateModel_Company_EmploymentAreaID,details_JobLogTemplateModel_Company_PostCode,details_JobLogTemplateModel_Company_IsCountryAndTownAndPostCodeEmpty,details_JobLogTemplateModel_Company_IsTownAndPostCodeEmpty,details_JobLogTemplateModel_Company_IsCountryDanmark,details_JobLogTemplateModel_Company_Town,details_JobLogTemplateModel_Company_ContactPerson,details_JobLogTemplateModel_Company_Phone,details_JobLogTemplateModel_Company_Email,details_JobLogTemplateModel_Company_Latitude,details_JobLogTemplateModel_Company_Longitude,details_JobLogTemplateModel_Company_DailyTravelTimeInMinutes,details_JobLogTemplateModel_Company_DistanceToCompanyInMeters,details_JobLogTemplateModel_Company_IsCreateMode,details_JobLogTemplateModel_TypeOfSubmission,details_JobLogTemplateModel_SubmissionDate,details_JobLogTemplateModel_SubmissionDateFormatted,details_JobLogTemplateModel_SubmissionDateTiks,details_JobLogTemplateModel_IsSubmissionDateRequired,details_JobLogTemplateModel_Status,details_JobLogTemplateModel_DateCreatedFormatted,details_JobLogTemplateModel_DateCreated,details_JobLogTemplateModel_DateModifiedFormatted,details_JobLogTemplateModel_DateModified,details_JobLogTemplateModel_LastModifiedDateTiks,details_JobLogTemplateModel_DateClosed,details_JobLogTemplateModel_JobApplicationDocument_Title,details_JobLogTemplateModel_JobApplicationDocument_Identifier,details_JobLogTemplateModel_JobApplicationDocument_IsDeletedBySystem,details_JobLogTemplateModel_JobApplicationDocument_IsDeletedByUser,details_JobLogTemplateModel_CvDocument_Title,details_JobLogTemplateModel_CvDocument_Identifier,details_JobLogTemplateModel_CvDocument_IsDeletedBySystem,details_JobLogTemplateModel_CvDocument_IsDeletedByUser,details_JobLogTemplateModel_JobApplicationFile,details_JobLogTemplateModel_CvFile,details_JobLogTemplateModel_SubmissionDeadlineDate,details_JobLogTemplateModel_IsPersisted,details_JobLogTemplateModel_ServerValidationErrors,details_JobLogTemplateModel_HasServerValidationErrors,details_JoblogWorkTime_WorkHour,details_JoblogWorkTime_DailyWorkTime,details_Place,details_OpenPrintDialog,details_WorkPlaceInfoText,details_JobCenterContactDetails,details_WorkPlaceDescriptionText,details_FavoriteText,details_IsFavorite,details_ShowFavorite,details_MetaOgTextForSharing,details_DescriptionForSharing,details_TitleForSharing,details_RutePlan,details_FormattedPurpose,details_MapUrl,details_OrganizationNumber,details_ShowSearchJobButton,details_ShowPrint,details_BackToFindWorkButtonUrl,isExternal
0,False,1,Professorship in Diversity and Leadership,Professorship in Diversity and Leadership,Copenhagen Business School invites applications for a vacant Professorship in Diversity and Leadership at the Department of Organization.In announcing a professorship in diversity and leader,Copenhagen Business School,Solbjerg Plads 3,2000,Frederiksberg,False,False,False,True,2022-03-25T00:00:00,2022-05-15T00:00:00,15. maj 2022,0001-01-01T00:00:00,False,False,https://job.jobnet.dk/CV/FindWork/Details/5561257,Hovedstaden og Bornholm,Frederiksberg,Danmark,2000,,,,Fuldtid,Akademisk arbejde,"Forskning og universitetsundervisning, samfundsvidenskab ","Professor, samfundsvidenskab",55.6815,12.5304,,,79401,26360,19596915,False,False,https://job.jobnet.dk/CV/FindWork/DetailsSocialmedia/5561257,https://job.jobnet.dk/CV/FindWork/Details/5561257,https://job.jobnet.dk/CV/FindWork/Details/5561257,True,5561257,55.6815,12.5304,"{'Id': 1, 'Name': 'Fuldtid'}, {'Id': 16, 'Name': 'Deltid'}","{'Id': 1, 'Name': 'Almindelige vilkår'}, {'Id': 2, 'Name': 'Fleksjob'}, {'Id': 3, 'Name': 'Skånejob'}, {'Id': 4, 'Name': 'Egnet til efterlønnere og seniorer'}, {'Id': 5, 'Name': 'Job med løntilskud'}, {'Id': 6, 'Name': 'Rotationsjob'}, {'Id': 7, 'Name': 'Virksomhedspraktik'}","{'Id': 1, 'Name': 'Fastansættelse'}, {'Id': 16, 'Name': 'Tidsbegrænset ansættelse'}",Copenhagen Business School,Solbjerg Plads 3,58,Danmark,147,Frederiksberg,4,"Hovedstaden, Sjælland og Bornholm",2000,Frederiksberg,,0,Primary,,,,"CBS er et unikt erhvervsuniversitet med 600 undervisere og forskere, 220 ph.d.'er og 630 administrative medarbejdere. Ca. 19.000 studerende er fordelt på bachelor-, kandidat-, MBA/EMBA-, ph.d.- og Executive-programmer, der udbydes på dansk og engelsk.

Vores videnskabelige medarbejdere tæller internationale eksperter inden for de klassiske forretningsdiscipliner, men også i filosofi, historie, psykologi, sociologi, jura, politik, informationssystemer, kultur og sprog.",79401,1003403332,19596915,None,5561257,5561257,Copenhagen Business School,Solbjerg Plads 3,58,Danmark,147,Frederiksberg,4,"Hovedstaden, Sjælland og Bornholm",2000,Frederiksberg,,0,Primary,,,,"CBS er et unikt erhvervsuniversitet med 600 undervisere og forskere, 220 ph.d.'er og 630 administrative medarbejdere. Ca. 19.000 studerende er fordelt på bachelor-, kandidat-, MBA/EMBA-, ph.d.- og Executive-programmer, der udbydes på dansk og engelsk.

Vores videnskabelige medarbejdere tæller internationale eksperter inden for de klassiske forretningsdiscipliner, men også i filosofi, historie, psykologi, sociologi, jura, politik, informationssystemer, kultur og sprog.",79401,1003403332,19596915,None,,2022-03-25T00:00:00,2022-05-15T00:00:00,Professorship in Diversity and Leadership,"Copenhagen Business School invites applications for a vacant Professorship in Diversity and Leadership at the Department of Organization. In announcing a professorship in diversity and leadership, the department wishes to strengthen the following areas: 1) Research on HRM, diversity and difference, organizational culture, gender and organizations. 2) Collaboration with business and society regarding the impact of diversity and gender in organizations. 3) Teaching in the areas of HRM, diversity management, organization theory, organizational culture and related areas in bachelor, master, and PhD programs Examples of research areas that the professor might cover:  Diversity leadership Leadership in organizations Organization theory Human resource management Organizational culture IOA is a longstanding international department with an ambitious and friendly atmosphere comprising currently around 70 faculty, 35 PhD students, and 11 administrative staff. Pursuing a problem-oriented, business-in-society-approach to studying and theorizing organizations and organizing processes at all levels, our mission is to carry out high quality research and research-based teaching characterized by empirical curiosity, methodological rigor, theoretical depth, and critical thinking. Our research is focused upon organizing processes and their outcomes and driven by an interest in organization and management as a practical, situated, contested and changing matter. This includes studies of private companies, public organizations, professional societies as well as NGOs. We investigate and discuss topics such as change and innovation processes, leadership, work and human resources, public management and governance, project management, institutional dynamics, market creation, expertise and power. Our social-scientific approach includes scholarly traditions such as organization theory, sociology, organizational psychology, science and technology studies, and political economy. We value qualitative methods highly and typically employ case studies, ethnographic methods, or social network analysis. Teaching responsibilities of the Department comprise undergraduate and graduate teaching as well as teaching in post-experience and doctoral education. To fulfill the research requirements of the position, the applicant chosen is expected to be physically present on a regular basis and actively participate in the teaching and research activities of the Department. Responsibilities Teaching and associated examination in existing CBS programs, including Executive Education  Individual and group based research meeting high international standards  Promoting CBS’s academic reputation  Initiating, fund raising and coordinating research projects  Promoting the teaching and research capabilities of Copenhagen Business School and other relevant assignments at Copenhagen Business School  Contributing to the administrative responsibilities of the Department and to CBS-wide tasks  Communicating findings to the public in general and to CBS’s stakeholders in particular, including participating in the public debate.  Research meeting high international standards, including responsibility for the academic development of the relevant discipline  Responsibility for publishing, scientific communication and research-based teaching  Active participation in the regular research activities, such as research seminars, workshops and conferences.  The professor is expected to contribute to the development and application of the research of the department’s research areas and to maintain and strengthen CBS’s international research position. Qualifications Advanced degree in a relevant academic field  Documented teaching qualifications and material for the evaluation of his/her pedagogical level. Please see  guidelines for teaching portfolios . Documented research production at an international level, including publications in internationally recognized journals within relevant fields. Professional proficiency in English (written and spoken) Teaching and research experience within the area of economic and organizational sociology or related areas. Copenhagen Business School has a broad commitment to the excellence, distinctiveness and relevance of its teaching and research programs. Candidates who wish to join us should demonstrate enthusiasm for working in an organization of this type (highlighting, for example, relevant business, educational and dissemination activities). For  further information  please contact: Head of Department Carsten Greve, e-mail  cagr.ioa@cbs.dk   Information about the department may be found at:  www.cbs.dk/en/research/departments-and-centres/department-of-organization Appointment  and salary will be in accordance with the Ministry of Finance’s agreement with the Central Academic Organization. Application Application must be sent via the electronic recruitment system, using the link below. Application must include: 1. A letter of motivation, also specifying which type of position(s) applied for. 2. Proof of qualifications and a full CV. 3. Documentation of relevant, significant, original research at an international level, including publications in the field’s internationally recognized journals and citations in the Social Science Citation Index and/or Google Scholar. 4. Documentation of pedagogical qualifications and teaching experience, including evaluations. 5. Information indicating experience in research management, industry collaboration and international collaboration, external funding of research. 6. A complete, numbered list of publications (indicating titles, co-authors, page numbers and year) with an * marking of the academic productions to be considered during the review. A maximum of 10 publications for review are allowed. Applicants are requested to prioritize their publications in relation to the field of this job advertisement. 7. Copies of the publications marked with an *. Only publications written in English or one of the Scandinavian languages will be taken into consideration. The recruitment committee shortlists minimum two applicants; when possible five or more applicants will be shortlisted. The shortlisted applicants will be assessed by the Assessment Committee. All applicants will be notified of their status in the recruitment process shortly after the application deadline. Copenhagen Business School must receive all application material, including all appendices (see items above), by the application deadline. Details about Copenhagen Business School and the department are available at  www.cbs.dk . Application due: 5/15/2022 Apply WE TRANSFORM SOCIETY WITH BUSINESS CBS is a globally recognised business school with deep roots in the Nordic socio-economic model. We have a broad focus on business and societal challenges of the 21st century. As such we have a full portfolio of high-quality disciplinary and interdisciplinary research and education that has equipped generations of professionals and leaders in the private sector and beyond. Located at Frederiksberg, Denmark, the school has approx. 21.000 full and part-time students, 760 full-time faculty members, 210 PhD students and 680 administrative staff, and a full portfolio of Bachelor, Master’s, MBA/EMBA, PhD and Executive programmes delivered in English and Danish. Our global profile carries the obligation to develop the transformational capabilities of students, graduates and business leaders via our educational activities and opportunities for lifelong learning. Complex challenges call for joint action, and therefore our strategy focuses on strengthening current and starting new partnerships with other sciences, the business community, authorities and civil society.",Solbjerg Plads 3,58,Danmark,147,Frederiksberg,4,"Hovedstaden, Sjælland og Bornholm",2000,Frederiksberg,1,1,Fuldtid,None,None,1,,0,,0,0,0,,True,"{'Id': 7852271, 'Email': 'cagr.ioa@cbs.dk', 'FaxNumber': None, 'PersonName': 'Carsten Greve, e-mail cagr.ioa@cbs.dk Greve', 'FirstName': 'Carsten Greve, e-mail cagr.ioa@cbs.dk', 'LastName': 'Greve', 'PositionTitle': 'Head of Department', 'PhoneNumbers': [{'Number': '38153815', 'Type': 0, 'Description': 'Hovednummer'}]}",2022-09-01T00:00:00,False,True,False,False,4,,,False,False,False,False,,,,,https://candidate.hr-manager.net/ApplicationForm/SinglePageApplicationForm.aspx?cid=1309&departmentId=18998&ProjectId=146402&MediaId=4627,False,2022-05-15T00:00:00,,0,Primary,7,/CV/FindWork/GetLogo?JobAdId=5561257&WorkPlace=79401&Organisation=19596915,"Solbjerg Plads 3,2000, Frederiksberg",True,False,/CV/Jobseeking/JobLog/CreateJobSearch?JobnetJobPostingIdentifier=5561257&Company.Name=Copenhagen Business School&SubmissionDeadlineDate=2022-5-15&Title=Professorship in Diversity and Leadership&WeeklyWorkTime=1,00000000-0000-0000-0000-000000000000,False,0,,,Professorship in Diversity and Leadership,True,,True,1,,5561257,,,False,False,,0,False,Copenhagen Business School,Solbjerg Plads 3,,,2000,False,False,False,Frederiksberg,"Carsten Greve, e-mail cagr.ioa@cbs.dk Greve",38153815,cagr.ioa@cbs.dk,,,,,False,,2022-05-15T00:00:00,,0,False,0,,,,,0,,,,False,False,,,False,False,,,,False,,False,,,Arbejdspladsen ligger i Frederiksberg kommune,False,Copenhagen Business School,,"CBS er et unikt erhvervsuniversitet med 600 undervisere og forskere, 220 ph.d.'er og 630 administrative medarbejdere. Ca. 19.000 studerende er fordelt på bachelor-, kandidat-, MBA/EMBA-, ph.d.- og Executive-programmer, der udbydes på dansk og engelsk.

Vores videnskabelige medarbejdere tæller internationale eksperter inden for de klassiske forretningsdiscipliner, men også i filosofi, historie, psykologi, sociologi, jura, politik, informationssystemer, kultur og sprog.",,False,False,"Copenhagen Business School invites applications for a vacant Professorship in Diversity and Leadership at the Department of Organization.In announcing a professorship in diversity and leadership, the department wishes to strengthen the following areas: 1) Research on HRM, diversity and difference, organizational culture, gender and organizations. 2","""Copenhagen Business School invites applications for a vacant Professorship in Diversity and Leadership at the Department of Organization.In announcing a professorship in diversity and leadership, the department wishes to strengthen the following areas: 1) Research on HRM, diversity and difference, organizational culture, gender and organizations. 2""","""Professorship in Diversity and Leadership""","https://www.google.dk/maps/dir//Solbjerg+Plads+3,2000,+Frederiksberg/","Copenhagen Business School invites applications for a vacant Professorship in Diversity and Leadership at the Department of Organization. In announcing a professorship in diversity and leadership, the department wishes to strengthen the following areas: 1) Research on HRM, diversity and difference, organizational culture, gender and organizations. 2) Collaboration with business and society regarding the impact of diversity and gender in organizations. 3) Teaching in the areas of HRM, diversity management, organization theory, organizational culture and related areas in bachelor, master, and PhD programs Examples of research areas that the professor might cover:  Diversity leadership Leadership in organizations Organization theory Human resource management Organizational culture IOA is a longstanding international department with an ambitious and friendly atmosphere comprising currently around 70 faculty, 35 PhD students, and 11 administrative staff. Pursuing a problem-oriented, business-in-society-approach to studying and theorizing organizations and organizing processes at all levels, our mission is to carry out high quality research and research-based teaching characterized by empirical curiosity, methodological rigor, theoretical depth, and critical thinking. Our research is focused upon organizing processes and their outcomes and driven by an interest in organization and management as a practical, situated, contested and changing matter. This includes studies of private companies, public organizations, professional societies as well as NGOs. We investigate and discuss topics such as change and innovation processes, leadership, work and human resources, public management and governance, project management, institutional dynamics, market creation, expertise and power. Our social-scientific approach includes scholarly traditions such as organization theory, sociology, organizational psychology, science and technology studies, and political economy. We value qualitative methods highly and typically employ case studies, ethnographic methods, or social network analysis. Teaching responsibilities of the Department comprise undergraduate and graduate teaching as well as teaching in post-experience and doctoral education. To fulfill the research requirements of the position, the applicant chosen is expected to be physically present on a regular basis and actively participate in the teaching and research activities of the Department. Responsibilities Teaching and associated examination in existing CBS programs, including Executive Education  Individual and group based research meeting high international standards  Promoting CBS’s academic reputation  Initiating, fund raising and coordinating research projects  Promoting the teaching and research capabilities of Copenhagen Business School and other relevant assignments at Copenhagen Business School  Contributing to the administrative responsibilities of the Department and to CBS-wide tasks  Communicating findings to the public in general and to CBS’s stakeholders in particular, including participating in the public debate.  Research meeting high international standards, including responsibility for the academic development of the relevant discipline  Responsibility for publishing, scientific communication and research-based teaching  Active participation in the regular research activities, such as research seminars, workshops and conferences.  The professor is expected to contribute to the development and application of the research of the department’s research areas and to maintain and strengthen CBS’s international research position. Qualifications Advanced degree in a relevant academic field  Documented teaching qualifications and material for the evaluation of his/her pedagogical level. Please see  guidelines for teaching portfolios . Documented research production at an international level, including publications in internationally recognized journals within relevant fields. Professional proficiency in English (written and spoken) Teaching and research experience within the area of economic and organizational sociology or related areas. Copenhagen Business School has a broad commitment to the excellence, distinctiveness and relevance of its teaching and research programs. Candidates who wish to join us should demonstrate enthusiasm for working in an organization of this type (highlighting, for example, relevant business, educational and dissemination activities). For  further information  please contact: Head of Department Carsten Greve, e-mail  cagr.ioa@cbs.dk   Information about the department may be found at:  www.cbs.dk/en/research/departments-and-centres/department-of-organization Appointment  and salary will be in accordance with the Ministry of Finance’s agreement with the Central Academic Organization. Application Application must be sent via the electronic recruitment system, using the link below. Application must include: 1. A letter of motivation, also specifying which type of position(s) applied for. 2. Proof of qualifications and a full CV. 3. Documentation of relevant, significant, original research at an international level, including publications in the field’s internationally recognized journals and citations in the Social Science Citation Index and/or Google Scholar. 4. Documentation of pedagogical qualifications and teaching experience, including evaluations. 5. Information indicating experience in research management, industry collaboration and international collaboration, external funding of research. 6. A complete, numbered list of publications (indicating titles, co-authors, page numbers and year) with an * marking of the academic productions to be considered during the review. A maximum of 10 publications for review are allowed. Applicants are requested to prioritize their publications in relation to the field of this job advertisement. 7. Copies of the publications marked with an *. Only publications written in English or one of the Scandinavian languages will be taken into consideration. The recruitment committee shortlists minimum two applicants; when possible five or more applicants will be shortlisted. The shortlisted applicants will be assessed by the Assessment Committee. All applicants will be notified of their status in the recruitment process shortly after the application deadline. Copenhagen Business School must receive all application material, including all appendices (see items above), by the application deadline. Details about Copenhagen Business School and the department are available at  www.cbs.dk . Application due: 5/15/2022 Apply WE TRANSFORM SOCIETY WITH BUSINESS CBS is a globally recognised business school with deep roots in the Nordic socio-economic model. We have a broad focus on business and societal challenges of the 21st century. As such we have a full portfolio of high-quality disciplinary and interdisciplinary research and education that has equipped generations of professionals and leaders in the private sector and beyond. Located at Frederiksberg, Denmark, the school has approx. 21.000 full and part-time students, 760 full-time faculty members, 210 PhD students and 680 administrative staff, and a full portfolio of Bachelor, Master’s, MBA/EMBA, PhD and Executive programmes delivered in English and Danish. Our global profile carries the obligation to develop the transformational capabilities of students, graduates and business leaders via our educational activities and opportunities for lifelong learning. Complex challenges call for joint action, and therefore our strategy focuses on strengthening current and starting new partnerships with other sciences, the business community, authorities and civil society.","https://www.google.dk/maps/place/Solbjerg+Plads+3,2000,+Frederiksberg/",19596915,False,False,,False
