summary_AutomatchType,summary_Abroad,summary_Weight,summary_Title,summary_JobHeadline,summary_Presentation,summary_HiringOrgName,summary_WorkPlaceAddress,summary_WorkPlacePostalCode,summary_WorkPlaceCity,summary_WorkPlaceOtherAddress,summary_WorkPlaceAbroad,summary_WorkPlaceNotStatic,summary_UseWorkPlaceAddressForJoblog,summary_PostingCreated,summary_LastDateApplication,summary_FormattedLastDateApplication,summary_AssignmentStartDate,summary_IsHotjob,summary_IsExternal,summary_Url,summary_Region,summary_Municipality,summary_Country,summary_PostalCode,summary_PostalCodeName,summary_JobAnnouncementType,summary_EmploymentType,summary_WorkHours,summary_OccupationArea,summary_OccupationGroup,summary_Occupation,summary_Location_Latitude,summary_Location_Longitude,summary_JoblogWorkTime_WorkHour,summary_JoblogWorkTime_DailyWorkTime,summary_WorkplaceID,summary_OrganisationId,summary_HiringOrgCVR,summary_UserLoggedIn,summary_AnonymousEmployer,summary_ShareUrl,summary_DetailsUrl,summary_JobLogUrl,summary_HasLocationValues,summary_ID,summary_Latitude,summary_Longitude,details_WorkSchedule,details_WorkConditions,details_EmploymentTypes,details_WorkPlace_Name,details_WorkPlace_Address_AddressLine,details_WorkPlace_Address_Country_Id,details_WorkPlace_Address_Country_Name,details_WorkPlace_Address_Municipality_Id,details_WorkPlace_Address_Municipality_Name,details_WorkPlace_Address_Region_Id,details_WorkPlace_Address_Region_Name,details_WorkPlace_Address_PostalCode,details_WorkPlace_Address_City,details_WorkPlace_PhoneNumber_Number,details_WorkPlace_PhoneNumber_Type,details_WorkPlace_PhoneNumber_Description,details_WorkPlace_FaxNumber,details_WorkPlace_Email,details_WorkPlace_WebAddress,details_WorkPlace_Description,details_WorkPlace_Logo,details_WorkPlace_WorkPlaceOrganizationNumber,details_WorkPlace_OrganizationNumber,details_WorkPlace_OrganizationDescription,details_JobPositionPosting_Id,details_JobPositionPosting_OriginalJppId,details_JobPositionPosting_HiringOrg_Name,details_JobPositionPosting_HiringOrg_Address_AddressLine,details_JobPositionPosting_HiringOrg_Address_Country_Id,details_JobPositionPosting_HiringOrg_Address_Country_Name,details_JobPositionPosting_HiringOrg_Address_Municipality_Id,details_JobPositionPosting_HiringOrg_Address_Municipality_Name,details_JobPositionPosting_HiringOrg_Address_Region_Id,details_JobPositionPosting_HiringOrg_Address_Region_Name,details_JobPositionPosting_HiringOrg_Address_PostalCode,details_JobPositionPosting_HiringOrg_Address_City,details_JobPositionPosting_HiringOrg_PhoneNumber_Number,details_JobPositionPosting_HiringOrg_PhoneNumber_Type,details_JobPositionPosting_HiringOrg_PhoneNumber_Description,details_JobPositionPosting_HiringOrg_FaxNumber,details_JobPositionPosting_HiringOrg_Email,details_JobPositionPosting_HiringOrg_WebAddress,details_JobPositionPosting_HiringOrg_Description,details_JobPositionPosting_HiringOrg_Logo,details_JobPositionPosting_HiringOrg_WorkPlaceOrganizationNumber,details_JobPositionPosting_HiringOrg_OrganizationNumber,details_JobPositionPosting_HiringOrg_OrganizationDescription,details_JobPositionPosting_RecruitingCompany,details_JobPositionPosting_PublicationStartDate,details_JobPositionPosting_PublicationEndDate,details_JobPositionPosting_JobPositionInformation_PositionTitle,details_JobPositionPosting_JobPositionInformation_Purpose,details_JobPositionPosting_JobPositionInformation_WorkLocation_AddressLine,details_JobPositionPosting_JobPositionInformation_WorkLocation_Country_Id,details_JobPositionPosting_JobPositionInformation_WorkLocation_Country_Name,details_JobPositionPosting_JobPositionInformation_WorkLocation_Municipality_Id,details_JobPositionPosting_JobPositionInformation_WorkLocation_Municipality_Name,details_JobPositionPosting_JobPositionInformation_WorkLocation_Region_Id,details_JobPositionPosting_JobPositionInformation_WorkLocation_Region_Name,details_JobPositionPosting_JobPositionInformation_WorkLocation_PostalCode,details_JobPositionPosting_JobPositionInformation_WorkLocation_City,details_JobPositionPosting_JobPositionInformation_EmploymentType,details_JobPositionPosting_JobPositionInformation_WeeklyWorkHours_TypeId,details_JobPositionPosting_JobPositionInformation_WeeklyWorkHours_TypeName,details_JobPositionPosting_JobPositionInformation_WeeklyWorkHours_Description,details_JobPositionPosting_JobPositionInformation_CompensationDescription,details_JobPositionPosting_JobPositionInformation_NumberToFill,details_JobPositionPosting_JobPositionInformation_DriverLicense,details_JobPositionPosting_JobPositionInformation_Occupation_DiscoWeb,details_JobPositionPosting_JobPositionInformation_Occupation_AlternateNames,details_JobPositionPosting_JobPositionInformation_Occupation_GroupId,details_JobPositionPosting_JobPositionInformation_Occupation_AreaId,details_JobPositionPosting_JobPositionInformation_Occupation_Id,details_JobPositionPosting_JobPositionInformation_Occupation_Name,details_JobPositionPosting_JobPositionInformation_IsGovernmentHiring,details_JobPositionPosting_JobPositionInformation_JppContacts,details_JobPositionPosting_JobPositionInformation_EmploymentDate,details_JobPositionPosting_IsRecruitmentOfForeignNationals,details_JobPositionPosting_IsWorkInDenmark,details_JobPositionPosting_IsAnonymousEmployer,details_JobPositionPosting_IsDisabilityFriendly,details_JobPositionPosting_JppType,details_JobPositionPosting_ApplicationDetails_WorkHourMax,details_JobPositionPosting_ApplicationDetails_WorkHourMin,details_JobPositionPosting_ApplicationDetails_DailyWorkTimeWeekend,details_JobPositionPosting_ApplicationDetails_DailyWorkTimeNight,details_JobPositionPosting_ApplicationDetails_DailyWorkTimeEvening,details_JobPositionPosting_ApplicationDetails_DailyWorkTimeDay,details_JobPositionPosting_ApplicationDetails_ReferenceText,details_JobPositionPosting_ApplicationDetails_RemarksToApplicant,details_JobPositionPosting_ApplicationDetails_ByEmail,details_JobPositionPosting_ApplicationDetails_ByPhone,details_JobPositionPosting_ApplicationDetails_ApplyViaUrl,details_JobPositionPosting_ApplicationDetails_ReplyInWriting,details_JobPositionPosting_ApplicationDetails_ApplicationDeadlineDate,details_JobPositionPosting_ContactAuthorityPhoneNumber_Number,details_JobPositionPosting_ContactAuthorityPhoneNumber_Type,details_JobPositionPosting_ContactAuthorityPhoneNumber_Description,details_JobPositionPosting_Status,details_LogoUrl,details_Address,details_ShowMap,details_ShowShareButtonJobLog,details_JobLogUrl,details_JobLogTemplateModel_Identifier,details_JobLogTemplateModel_UseWorkPlaceAddressForJoblog,details_JobLogTemplateModel_Category,details_JobLogTemplateModel_CvCustomerIdentifier,details_JobLogTemplateModel_JobSeekingStatus,details_JobLogTemplateModel_Title,details_JobLogTemplateModel_IsApplicationSourceRequired,details_JobLogTemplateModel_ApplicationSource,details_JobLogTemplateModel_IsWeeklyWorkTimeRequired,details_JobLogTemplateModel_WeeklyWorkTime,details_JobLogTemplateModel_HoursPerWeek,details_JobLogTemplateModel_JobnetJobPostingIdentifier,details_JobLogTemplateModel_JobAdDocument_Title,details_JobLogTemplateModel_JobAdDocument_Identifier,details_JobLogTemplateModel_JobAdDocument_IsDeletedBySystem,details_JobLogTemplateModel_JobAdDocument_IsDeletedByUser,details_JobLogTemplateModel_JobAdFile,details_JobLogTemplateModel_Company_JobLogEntryCategory,details_JobLogTemplateModel_Company_ShowAddressFieldsEvenIfEmpty,details_JobLogTemplateModel_Company_Name,details_JobLogTemplateModel_Company_Address,details_JobLogTemplateModel_Company_Country,details_JobLogTemplateModel_Company_EmploymentAreaID,details_JobLogTemplateModel_Company_PostCode,details_JobLogTemplateModel_Company_IsCountryAndTownAndPostCodeEmpty,details_JobLogTemplateModel_Company_IsTownAndPostCodeEmpty,details_JobLogTemplateModel_Company_IsCountryDanmark,details_JobLogTemplateModel_Company_Town,details_JobLogTemplateModel_Company_ContactPerson,details_JobLogTemplateModel_Company_Phone,details_JobLogTemplateModel_Company_Email,details_JobLogTemplateModel_Company_Latitude,details_JobLogTemplateModel_Company_Longitude,details_JobLogTemplateModel_Company_DailyTravelTimeInMinutes,details_JobLogTemplateModel_Company_DistanceToCompanyInMeters,details_JobLogTemplateModel_Company_IsCreateMode,details_JobLogTemplateModel_TypeOfSubmission,details_JobLogTemplateModel_SubmissionDate,details_JobLogTemplateModel_SubmissionDateFormatted,details_JobLogTemplateModel_SubmissionDateTiks,details_JobLogTemplateModel_IsSubmissionDateRequired,details_JobLogTemplateModel_Status,details_JobLogTemplateModel_DateCreatedFormatted,details_JobLogTemplateModel_DateCreated,details_JobLogTemplateModel_DateModifiedFormatted,details_JobLogTemplateModel_DateModified,details_JobLogTemplateModel_LastModifiedDateTiks,details_JobLogTemplateModel_DateClosed,details_JobLogTemplateModel_JobApplicationDocument_Title,details_JobLogTemplateModel_JobApplicationDocument_Identifier,details_JobLogTemplateModel_JobApplicationDocument_IsDeletedBySystem,details_JobLogTemplateModel_JobApplicationDocument_IsDeletedByUser,details_JobLogTemplateModel_CvDocument_Title,details_JobLogTemplateModel_CvDocument_Identifier,details_JobLogTemplateModel_CvDocument_IsDeletedBySystem,details_JobLogTemplateModel_CvDocument_IsDeletedByUser,details_JobLogTemplateModel_JobApplicationFile,details_JobLogTemplateModel_CvFile,details_JobLogTemplateModel_SubmissionDeadlineDate,details_JobLogTemplateModel_IsPersisted,details_JobLogTemplateModel_ServerValidationErrors,details_JobLogTemplateModel_HasServerValidationErrors,details_JoblogWorkTime_WorkHour,details_JoblogWorkTime_DailyWorkTime,details_Place,details_OpenPrintDialog,details_WorkPlaceInfoText,details_JobCenterContactDetails,details_WorkPlaceDescriptionText,details_FavoriteText,details_IsFavorite,details_ShowFavorite,details_MetaOgTextForSharing,details_DescriptionForSharing,details_TitleForSharing,details_RutePlan,details_FormattedPurpose,details_MapUrl,details_OrganizationNumber,details_ShowSearchJobButton,details_ShowPrint,details_BackToFindWorkButtonUrl,isExternal
0,False,1,Ejendomsserviceassistent (pædagogisk pedel) søges,Ejendomsserviceassistent (pædagogisk pedel) søges,"Har du håndværksmæssig erfaring? Er du serviceminded, og arbejder du struktureret og kan danne dig overblik? Kan du li’ at arbejde i et miljø med både unge og voksne? Så er det måske dig vi led",STARTSKUDDETS UDDANNELSES- OG     UDVIKLINGSFOND,Gl Præstøvej 6,4735,Mern,False,False,False,True,2022-03-31T00:00:00,2022-05-26T00:00:00,26. maj 2022,0001-01-01T00:00:00,False,False,https://job.jobnet.dk/CV/FindWork/Details/5566673,Øvrige Sjælland,Vordingborg,Danmark,4735,,,,Fuldtid,"Rengøring, ejendomsservice og renovation",Ejendomsservice og måleraflæsning,Pedel,55.0494,12.0582,,Dag,104117,94740,34595429,False,False,https://job.jobnet.dk/CV/FindWork/DetailsSocialmedia/5566673,https://job.jobnet.dk/CV/FindWork/Details/5566673,https://job.jobnet.dk/CV/FindWork/Details/5566673,True,5566673,55.0494,12.0582,"{'Id': 1, 'Name': 'Fuldtid'}, {'Id': 16, 'Name': 'Deltid'}","{'Id': 1, 'Name': 'Almindelige vilkår'}, {'Id': 2, 'Name': 'Fleksjob'}, {'Id': 3, 'Name': 'Skånejob'}, {'Id': 4, 'Name': 'Egnet til efterlønnere og seniorer'}, {'Id': 5, 'Name': 'Job med løntilskud'}, {'Id': 6, 'Name': 'Rotationsjob'}, {'Id': 7, 'Name': 'Virksomhedspraktik'}","{'Id': 1, 'Name': 'Fastansættelse'}, {'Id': 16, 'Name': 'Tidsbegrænset ansættelse'}",STARTSKUDDETS UDDANNELSES- OG     UDVIKLINGSFOND,Gl Præstøvej 6,58,Danmark,390,Vordingborg,4,"Hovedstaden, Sjælland og Bornholm",4735,Mern,,0,Primary,,,,None,104117,1017742643,34595429,"Startskuddet består af 5 bosteder samt dagskole og erhvervsskole. Dertil kommer mindre kulturhus,
klinik, Kompetencecenter mv. Alle aktiviteter ligger i 3 fonde.
Startskuddets målgruppe er unge fra 12-18(23), der er belastede med psykosociale problemstillinger.",5566673,5566673,STARTSKUDDETS UDDANNELSES- OG     UDVIKLINGSFOND,Gl Præstøvej 6,58,Danmark,390,Vordingborg,4,"Hovedstaden, Sjælland og Bornholm",4735,Mern,,0,Primary,,,,None,104117,1017742643,34595429,"Startskuddet består af 5 bosteder samt dagskole og erhvervsskole. Dertil kommer mindre kulturhus,
klinik, Kompetencecenter mv. Alle aktiviteter ligger i 3 fonde.
Startskuddets målgruppe er unge fra 12-18(23), der er belastede med psykosociale problemstillinger.",,2022-03-31T00:00:00,2022-05-26T00:00:00,Ejendomsserviceassistent (pædagogisk pedel) søges,"Har du håndværksmæssig erfaring? Er du serviceminded, og arbejder du struktureret og kan danne dig overblik? Kan du li’ at arbejde i et miljø med både unge og voksne? Så er det måske dig vi leder efter! Vi søger en alsidig pædagogisk pedel til Fonden Startskuddet pr. 1. juni 2022. Stillingen er en fuldtidsstilling. Bygningerne skal i de kommende år renoveres og ændres, således at basis- og fællesarealer bliver fleksible og moderne læringsmiljøer, og de faglige områder opdateres og ombygges, så de bliver tidssvarende. Vi er allerede i fuld gang med at om- og tilbygge, og vi søger en medarbejder med et godt overblik og et stort servicegen. Du får som udgangspunkt dine egne bygninger - på bosteder i Stubbekøbing området - hvor du skal sikre vedligehold på og omkring, men du indgår også i et team, der sikrer, at Startskuddets bygningsmasse passes, da Startskuddet består af flere bygninger. Vi vægter et godt samarbejde mellem sekretariat, skole og bosted højt, da alle funktioner er lige vigtige og går hånd i hånd, når vi sammen skal omfavne den arbejdsplads, som vi alle ønsker at være en del af. Vores forventninger til dig 
 
 Du har en alsidig håndværkermæssig erfaring 
 Du er engageret og serviceminded og prioriterer et højt kvalitetsniveau 
 Du sætter en ære i at alt er ryddet og i pæn stand 
 Du tager selv initiativ, når du kan se, at noget skal ryddes, udbedres m.v. 
 Du sætter en ære i at yde service over for både beboere/elever og personale 
 Du har humor og kan omgås unge beboere/elever 
 Du er selvstændig, struktureret og formår selv at prioritere dine opgaver 
 Du er omstillingsparat, når der opstår ad hoc opgaver 
 Du er robust, mødestabil og pligtopfyldende 
 Du kan indgå i et samarbejde med tilbudslederne samt de andre pedeller i Startskuddet 
 Du kan indgå i en vagtplan, som bagvagt 
 Du har kørekort 
 
   
 Dine kommende arbejdsområder En stor del at dine opgaver vil den kommende tid gå med om- og tilbygning, i forhold til flytning af inventar, opsætning af inventar m.v. Herudover vil der i forbindelse med den daglige drift bl.a. være opgaver som: 
 
 Servicering af den indvendige og udvendige bygningsdel, herunder reparationer og forbedringer på møbler og andet 
 Opstilling af møbler m.m. til arrangementer 
 Lettere snerydning/saltning 
 Bestilling af diverse varer 
 Kontakt til eksterne samarbejdspartnere og brugere 
 Ad hoc opgaver i samarbejde med tilbudslederne 
 Oprydning både inde og ude på matriklen 
 
   
 Kan du opfylde ovenstående, kan vi til gengæld tilbyde 
 
 En fast fuldtidsstilling 
 En hverdag, hvor du har stor indflydelse på egne arbejdsområder 
 En munter og uformel omgangstone 
 En engageret personalegruppe og glade beboere 
 Et godt arbejdsmiljø med gode rammer 
 
   
 Ansøgning og kontakt         
 Send din ansøgning inkl. CV og dokumentation for uddannelse til linket: https://startskuddet.dk/ansoeg-job/ 
   
 Ansøgningsfrist søndag den 17. april 2022. 
   
 Kontaktperson: Serviceleder Carsten Kjærsgaard - tlf. 25459405 - ck@startskuddet.dk 
   
 Om Startskuddet 
 Vi skaber rum, hvor mennesker udvikler sig. Det gælder i alle vores indsatser, både opholdssteder, botilbud, projekter, skole, uddannelse m.v. at vi hjælper den unge eller voksne til i så høj grad som muligt at være inddraget og have medindflydelse på sin egen situation og udvikling. Alle kan udvikle sig, når rammerne er til det. Med en række forskellige tilbud og indsatser skaber vi en bred vifte af muligheder for personlig, faglig og social udvikling.",Gl Præstøvej 6,58,Danmark,390,Vordingborg,4,"Hovedstaden, Sjælland og Bornholm",4735,Mern,1,1,Fuldtid,None,None,1,"{'DriversLicenceType': 3, 'Name': 'B', 'Description': 'Almindelig bil'}",0,,0,0,0,,False,"{'Id': 7869215, 'Email': 'sofie@startskuddet.dk', 'FaxNumber': None, 'PersonName': 'Sofie Jensen', 'FirstName': 'Sofie', 'LastName': 'Jensen', 'PositionTitle': 'HR Konsulent', 'PhoneNumbers': [{'Number': '55930305', 'Type': 0, 'Description': 'Hovednummer'}]}",2022-06-01T00:00:00,True,False,False,False,4,,,False,False,False,True,,,,,https://startskuddet.dk/ansoeg-job/,False,2022-05-26T00:00:00,,0,Primary,7,/CV/FindWork/GetLogo?JobAdId=5566673&WorkPlace=104117&Organisation=34595429,"Gl Præstøvej 6,4735, Mern",True,False,/CV/Jobseeking/JobLog/CreateJobSearch?JobnetJobPostingIdentifier=5566673&Company.Name=STARTSKUDDETS UDDANNELSES- OG     UDVIKLINGSFOND&SubmissionDeadlineDate=2022-5-26&Title=Ejendomsserviceassistent (pædagogisk pedel) søges&WeeklyWorkTime=1,00000000-0000-0000-0000-000000000000,False,0,,,Ejendomsserviceassistent (pædagogisk pedel) søges,True,,True,1,,5566673,,,False,False,,0,False,STARTSKUDDETS UDDANNELSES- OG     UDVIKLINGSFOND,Gl Præstøvej 6,,,4735,False,False,False,Mern,Sofie Jensen,55930305,sofie@startskuddet.dk,,,,,False,,2022-05-26T00:00:00,,0,False,0,,,,,0,,,,False,False,,,False,False,,,,False,,False,,Dag,Arbejdspladsen ligger i Vordingborg kommune,False,STARTSKUDDETS UDDANNELSES- OG     UDVIKLINGSFOND,,"Startskuddet består af 5 bosteder samt dagskole og erhvervsskole. Dertil kommer mindre kulturhus,
klinik, Kompetencecenter mv. Alle aktiviteter ligger i 3 fonde.
Startskuddets målgruppe er unge fra 12-18(23), der er belastede med psykosociale problemstillinger.",,False,False,"Har du h&aring;ndv&aelig;rksm&aelig;ssig erfaring? Er du serviceminded, og arbejder du struktureret og kan danne dig overblik? Kan du li&rsquo; at arbejde i et milj&oslash; med b&aring;de unge og voksne? S&aring; er det m&aring;ske dig vi leder efter!Vi s&oslash;geren alsidig p&aelig;dagogisk pedel til Fonden Startskuddet pr. 1. juni 2022. Stilling","""Har du h\u0026aring;ndv\u0026aelig;rksm\u0026aelig;ssig erfaring? Er du serviceminded, og arbejder du struktureret og kan danne dig overblik? Kan du li\u0026rsquo; at arbejde i et milj\u0026oslash; med b\u0026aring;de unge og voksne? S\u0026aring; er det m\u0026aring;ske dig vi leder efter!Vi s\u0026oslash;geren alsidig p\u0026aelig;dagogisk pedel til Fonden Startskuddet pr. 1. juni 2022. Stilling""","""Ejendomsserviceassistent (pædagogisk pedel) søges""","https://www.google.dk/maps/dir//Gl+Præstøvej+6,4735,+Mern/","Har du håndværksmæssig erfaring? Er du serviceminded, og arbejder du struktureret og kan danne dig overblik? Kan du li’ at arbejde i et miljø med både unge og voksne? Så er det måske dig vi leder efter! Vi søger en alsidig pædagogisk pedel til Fonden Startskuddet pr. 1. juni 2022. Stillingen er en fuldtidsstilling. Bygningerne skal i de kommende år renoveres og ændres, således at basis- og fællesarealer bliver fleksible og moderne læringsmiljøer, og de faglige områder opdateres og ombygges, så de bliver tidssvarende. Vi er allerede i fuld gang med at om- og tilbygge, og vi søger en medarbejder med et godt overblik og et stort servicegen. Du får som udgangspunkt dine egne bygninger - på bosteder i Stubbekøbing området - hvor du skal sikre vedligehold på og omkring, men du indgår også i et team, der sikrer, at Startskuddets bygningsmasse passes, da Startskuddet består af flere bygninger. Vi vægter et godt samarbejde mellem sekretariat, skole og bosted højt, da alle funktioner er lige vigtige og går hånd i hånd, når vi sammen skal omfavne den arbejdsplads, som vi alle ønsker at være en del af. Vores forventninger til dig 
 
 Du har en alsidig håndværkermæssig erfaring 
 Du er engageret og serviceminded og prioriterer et højt kvalitetsniveau 
 Du sætter en ære i at alt er ryddet og i pæn stand 
 Du tager selv initiativ, når du kan se, at noget skal ryddes, udbedres m.v. 
 Du sætter en ære i at yde service over for både beboere/elever og personale 
 Du har humor og kan omgås unge beboere/elever 
 Du er selvstændig, struktureret og formår selv at prioritere dine opgaver 
 Du er omstillingsparat, når der opstår ad hoc opgaver 
 Du er robust, mødestabil og pligtopfyldende 
 Du kan indgå i et samarbejde med tilbudslederne samt de andre pedeller i Startskuddet 
 Du kan indgå i en vagtplan, som bagvagt 
 Du har kørekort 
 
   
 Dine kommende arbejdsområder En stor del at dine opgaver vil den kommende tid gå med om- og tilbygning, i forhold til flytning af inventar, opsætning af inventar m.v. Herudover vil der i forbindelse med den daglige drift bl.a. være opgaver som: 
 
 Servicering af den indvendige og udvendige bygningsdel, herunder reparationer og forbedringer på møbler og andet 
 Opstilling af møbler m.m. til arrangementer 
 Lettere snerydning/saltning 
 Bestilling af diverse varer 
 Kontakt til eksterne samarbejdspartnere og brugere 
 Ad hoc opgaver i samarbejde med tilbudslederne 
 Oprydning både inde og ude på matriklen 
 
   
 Kan du opfylde ovenstående, kan vi til gengæld tilbyde 
 
 En fast fuldtidsstilling 
 En hverdag, hvor du har stor indflydelse på egne arbejdsområder 
 En munter og uformel omgangstone 
 En engageret personalegruppe og glade beboere 
 Et godt arbejdsmiljø med gode rammer 
 
   
 Ansøgning og kontakt         
 Send din ansøgning inkl. CV og dokumentation for uddannelse til linket:  https://startskuddet.dk/ansoeg-job/ 
   
 Ansøgningsfrist søndag den 17. april 2022. 
   
 Kontaktperson: Serviceleder Carsten Kjærsgaard - tlf. 25459405 - ck@startskuddet.dk 
   
 Om Startskuddet 
 Vi skaber rum, hvor mennesker udvikler sig. Det gælder i alle vores indsatser, både opholdssteder, botilbud, projekter, skole, uddannelse m.v. at vi hjælper den unge eller voksne til i så høj grad som muligt at være inddraget og have medindflydelse på sin egen situation og udvikling. Alle kan udvikle sig, når rammerne er til det. Med en række forskellige tilbud og indsatser skaber vi en bred vifte af muligheder for personlig, faglig og social udvikling.","https://www.google.dk/maps/place/Gl+Præstøvej+6,4735,+Mern/",34595429,False,False,,False
