summary_AutomatchType,summary_Abroad,summary_Weight,summary_Title,summary_JobHeadline,summary_Presentation,summary_HiringOrgName,summary_WorkPlaceAddress,summary_WorkPlacePostalCode,summary_WorkPlaceCity,summary_WorkPlaceOtherAddress,summary_WorkPlaceAbroad,summary_WorkPlaceNotStatic,summary_UseWorkPlaceAddressForJoblog,summary_PostingCreated,summary_LastDateApplication,summary_FormattedLastDateApplication,summary_AssignmentStartDate,summary_IsHotjob,summary_IsExternal,summary_Url,summary_Region,summary_Municipality,summary_Country,summary_PostalCode,summary_PostalCodeName,summary_JobAnnouncementType,summary_EmploymentType,summary_WorkHours,summary_OccupationArea,summary_OccupationGroup,summary_Occupation,summary_Location_Latitude,summary_Location_Longitude,summary_JoblogWorkTime_WorkHour,summary_JoblogWorkTime_DailyWorkTime,summary_WorkplaceID,summary_OrganisationId,summary_HiringOrgCVR,summary_UserLoggedIn,summary_AnonymousEmployer,summary_ShareUrl,summary_DetailsUrl,summary_JobLogUrl,summary_HasLocationValues,summary_ID,summary_Latitude,summary_Longitude,details_WorkSchedule,details_WorkConditions,details_EmploymentTypes,details_WorkPlace_Name,details_WorkPlace_Address_AddressLine,details_WorkPlace_Address_Country_Id,details_WorkPlace_Address_Country_Name,details_WorkPlace_Address_Municipality_Id,details_WorkPlace_Address_Municipality_Name,details_WorkPlace_Address_Region_Id,details_WorkPlace_Address_Region_Name,details_WorkPlace_Address_PostalCode,details_WorkPlace_Address_City,details_WorkPlace_PhoneNumber_Number,details_WorkPlace_PhoneNumber_Type,details_WorkPlace_PhoneNumber_Description,details_WorkPlace_FaxNumber,details_WorkPlace_Email,details_WorkPlace_WebAddress,details_WorkPlace_Description,details_WorkPlace_Logo,details_WorkPlace_WorkPlaceOrganizationNumber,details_WorkPlace_OrganizationNumber,details_WorkPlace_OrganizationDescription,details_JobPositionPosting_Id,details_JobPositionPosting_OriginalJppId,details_JobPositionPosting_HiringOrg_Name,details_JobPositionPosting_HiringOrg_Address_AddressLine,details_JobPositionPosting_HiringOrg_Address_Country_Id,details_JobPositionPosting_HiringOrg_Address_Country_Name,details_JobPositionPosting_HiringOrg_Address_Municipality_Id,details_JobPositionPosting_HiringOrg_Address_Municipality_Name,details_JobPositionPosting_HiringOrg_Address_Region_Id,details_JobPositionPosting_HiringOrg_Address_Region_Name,details_JobPositionPosting_HiringOrg_Address_PostalCode,details_JobPositionPosting_HiringOrg_Address_City,details_JobPositionPosting_HiringOrg_PhoneNumber_Number,details_JobPositionPosting_HiringOrg_PhoneNumber_Type,details_JobPositionPosting_HiringOrg_PhoneNumber_Description,details_JobPositionPosting_HiringOrg_FaxNumber,details_JobPositionPosting_HiringOrg_Email,details_JobPositionPosting_HiringOrg_WebAddress,details_JobPositionPosting_HiringOrg_Description,details_JobPositionPosting_HiringOrg_Logo,details_JobPositionPosting_HiringOrg_WorkPlaceOrganizationNumber,details_JobPositionPosting_HiringOrg_OrganizationNumber,details_JobPositionPosting_HiringOrg_OrganizationDescription,details_JobPositionPosting_RecruitingCompany,details_JobPositionPosting_PublicationStartDate,details_JobPositionPosting_PublicationEndDate,details_JobPositionPosting_JobPositionInformation_PositionTitle,details_JobPositionPosting_JobPositionInformation_Purpose,details_JobPositionPosting_JobPositionInformation_WorkLocation_AddressLine,details_JobPositionPosting_JobPositionInformation_WorkLocation_Country_Id,details_JobPositionPosting_JobPositionInformation_WorkLocation_Country_Name,details_JobPositionPosting_JobPositionInformation_WorkLocation_Municipality_Id,details_JobPositionPosting_JobPositionInformation_WorkLocation_Municipality_Name,details_JobPositionPosting_JobPositionInformation_WorkLocation_Region_Id,details_JobPositionPosting_JobPositionInformation_WorkLocation_Region_Name,details_JobPositionPosting_JobPositionInformation_WorkLocation_PostalCode,details_JobPositionPosting_JobPositionInformation_WorkLocation_City,details_JobPositionPosting_JobPositionInformation_EmploymentType,details_JobPositionPosting_JobPositionInformation_WeeklyWorkHours_TypeId,details_JobPositionPosting_JobPositionInformation_WeeklyWorkHours_TypeName,details_JobPositionPosting_JobPositionInformation_WeeklyWorkHours_Description,details_JobPositionPosting_JobPositionInformation_CompensationDescription,details_JobPositionPosting_JobPositionInformation_NumberToFill,details_JobPositionPosting_JobPositionInformation_DriverLicense,details_JobPositionPosting_JobPositionInformation_Occupation_DiscoWeb,details_JobPositionPosting_JobPositionInformation_Occupation_AlternateNames,details_JobPositionPosting_JobPositionInformation_Occupation_GroupId,details_JobPositionPosting_JobPositionInformation_Occupation_AreaId,details_JobPositionPosting_JobPositionInformation_Occupation_Id,details_JobPositionPosting_JobPositionInformation_Occupation_Name,details_JobPositionPosting_JobPositionInformation_IsGovernmentHiring,details_JobPositionPosting_JobPositionInformation_JppContacts,details_JobPositionPosting_JobPositionInformation_EmploymentDate,details_JobPositionPosting_IsRecruitmentOfForeignNationals,details_JobPositionPosting_IsWorkInDenmark,details_JobPositionPosting_IsAnonymousEmployer,details_JobPositionPosting_IsDisabilityFriendly,details_JobPositionPosting_JppType,details_JobPositionPosting_ApplicationDetails_WorkHourMax,details_JobPositionPosting_ApplicationDetails_WorkHourMin,details_JobPositionPosting_ApplicationDetails_DailyWorkTimeWeekend,details_JobPositionPosting_ApplicationDetails_DailyWorkTimeNight,details_JobPositionPosting_ApplicationDetails_DailyWorkTimeEvening,details_JobPositionPosting_ApplicationDetails_DailyWorkTimeDay,details_JobPositionPosting_ApplicationDetails_ReferenceText,details_JobPositionPosting_ApplicationDetails_RemarksToApplicant,details_JobPositionPosting_ApplicationDetails_ByEmail,details_JobPositionPosting_ApplicationDetails_ByPhone,details_JobPositionPosting_ApplicationDetails_ApplyViaUrl,details_JobPositionPosting_ApplicationDetails_ReplyInWriting,details_JobPositionPosting_ApplicationDetails_ApplicationDeadlineDate,details_JobPositionPosting_ContactAuthorityPhoneNumber_Number,details_JobPositionPosting_ContactAuthorityPhoneNumber_Type,details_JobPositionPosting_ContactAuthorityPhoneNumber_Description,details_JobPositionPosting_Status,details_LogoUrl,details_Address,details_ShowMap,details_ShowShareButtonJobLog,details_JobLogUrl,details_JobLogTemplateModel_Identifier,details_JobLogTemplateModel_UseWorkPlaceAddressForJoblog,details_JobLogTemplateModel_Category,details_JobLogTemplateModel_CvCustomerIdentifier,details_JobLogTemplateModel_JobSeekingStatus,details_JobLogTemplateModel_Title,details_JobLogTemplateModel_IsApplicationSourceRequired,details_JobLogTemplateModel_ApplicationSource,details_JobLogTemplateModel_IsWeeklyWorkTimeRequired,details_JobLogTemplateModel_WeeklyWorkTime,details_JobLogTemplateModel_HoursPerWeek,details_JobLogTemplateModel_JobnetJobPostingIdentifier,details_JobLogTemplateModel_JobAdDocument_Title,details_JobLogTemplateModel_JobAdDocument_Identifier,details_JobLogTemplateModel_JobAdDocument_IsDeletedBySystem,details_JobLogTemplateModel_JobAdDocument_IsDeletedByUser,details_JobLogTemplateModel_JobAdFile,details_JobLogTemplateModel_Company_JobLogEntryCategory,details_JobLogTemplateModel_Company_ShowAddressFieldsEvenIfEmpty,details_JobLogTemplateModel_Company_Name,details_JobLogTemplateModel_Company_Address,details_JobLogTemplateModel_Company_Country,details_JobLogTemplateModel_Company_EmploymentAreaID,details_JobLogTemplateModel_Company_PostCode,details_JobLogTemplateModel_Company_IsCountryAndTownAndPostCodeEmpty,details_JobLogTemplateModel_Company_IsTownAndPostCodeEmpty,details_JobLogTemplateModel_Company_IsCountryDanmark,details_JobLogTemplateModel_Company_Town,details_JobLogTemplateModel_Company_ContactPerson,details_JobLogTemplateModel_Company_Phone,details_JobLogTemplateModel_Company_Email,details_JobLogTemplateModel_Company_Latitude,details_JobLogTemplateModel_Company_Longitude,details_JobLogTemplateModel_Company_DailyTravelTimeInMinutes,details_JobLogTemplateModel_Company_DistanceToCompanyInMeters,details_JobLogTemplateModel_Company_IsCreateMode,details_JobLogTemplateModel_TypeOfSubmission,details_JobLogTemplateModel_SubmissionDate,details_JobLogTemplateModel_SubmissionDateFormatted,details_JobLogTemplateModel_SubmissionDateTiks,details_JobLogTemplateModel_IsSubmissionDateRequired,details_JobLogTemplateModel_Status,details_JobLogTemplateModel_DateCreatedFormatted,details_JobLogTemplateModel_DateCreated,details_JobLogTemplateModel_DateModifiedFormatted,details_JobLogTemplateModel_DateModified,details_JobLogTemplateModel_LastModifiedDateTiks,details_JobLogTemplateModel_DateClosed,details_JobLogTemplateModel_JobApplicationDocument_Title,details_JobLogTemplateModel_JobApplicationDocument_Identifier,details_JobLogTemplateModel_JobApplicationDocument_IsDeletedBySystem,details_JobLogTemplateModel_JobApplicationDocument_IsDeletedByUser,details_JobLogTemplateModel_CvDocument_Title,details_JobLogTemplateModel_CvDocument_Identifier,details_JobLogTemplateModel_CvDocument_IsDeletedBySystem,details_JobLogTemplateModel_CvDocument_IsDeletedByUser,details_JobLogTemplateModel_JobApplicationFile,details_JobLogTemplateModel_CvFile,details_JobLogTemplateModel_SubmissionDeadlineDate,details_JobLogTemplateModel_IsPersisted,details_JobLogTemplateModel_ServerValidationErrors,details_JobLogTemplateModel_HasServerValidationErrors,details_JoblogWorkTime_WorkHour,details_JoblogWorkTime_DailyWorkTime,details_Place,details_OpenPrintDialog,details_WorkPlaceInfoText,details_JobCenterContactDetails,details_WorkPlaceDescriptionText,details_FavoriteText,details_IsFavorite,details_ShowFavorite,details_MetaOgTextForSharing,details_DescriptionForSharing,details_TitleForSharing,details_RutePlan,details_FormattedPurpose,details_MapUrl,details_OrganizationNumber,details_ShowSearchJobButton,details_ShowPrint,details_BackToFindWorkButtonUrl,isExternal
0,False,1,Arbejdsmarkedskonsulenter til Integrationsafdelingen,Arbejdsmarkedskonsulenter til Integrationsafdelingen,"I forbindelse med situationen i Ukraine, som betyder et øget antal flygtninge i kommunen, ønsker vi at styrke vores Integrationsafdeling og indsats med flere medarbejdere.  Vi søger minimu",Sprog- & Integrationscenter,Thorsensvej 11B,4800,Nykøbing F,False,False,False,True,2022-04-05T00:00:00,2022-05-09T00:00:00,9. maj 2022,0001-01-01T00:00:00,False,False,https://job.jobnet.dk/CV/FindWork/Details/5571258,Øvrige Sjælland,Guldborgsund,Danmark,4800,,,,Fuldtid,Akademisk arbejde,Administrativt arbejde,Specialkonsulent,54.7737,11.8693,,,64097,57460,29188599,False,False,https://job.jobnet.dk/CV/FindWork/DetailsSocialmedia/5571258,https://job.jobnet.dk/CV/FindWork/Details/5571258,https://job.jobnet.dk/CV/FindWork/Details/5571258,True,5571258,54.7737,11.8693,"{'Id': 1, 'Name': 'Fuldtid'}, {'Id': 16, 'Name': 'Deltid'}","{'Id': 1, 'Name': 'Almindelige vilkår'}, {'Id': 2, 'Name': 'Fleksjob'}, {'Id': 3, 'Name': 'Skånejob'}, {'Id': 4, 'Name': 'Egnet til efterlønnere og seniorer'}, {'Id': 5, 'Name': 'Job med løntilskud'}, {'Id': 6, 'Name': 'Rotationsjob'}, {'Id': 7, 'Name': 'Virksomhedspraktik'}","{'Id': 1, 'Name': 'Fastansættelse'}, {'Id': 16, 'Name': 'Tidsbegrænset ansættelse'}",Sprog- & Integrationscenter,Thorsensvej 11B,58,Danmark,376,Guldborgsund,4,"Hovedstaden, Sjælland og Bornholm",4800,Nykøbing F,,0,Primary,,,,None,64097,1003302819,29188599,None,5571258,5571258,Sprog- & Integrationscenter,Thorsensvej 11B,58,Danmark,376,Guldborgsund,4,"Hovedstaden, Sjælland og Bornholm",4800,Nykøbing F,,0,Primary,,,,None,64097,1003302819,29188599,None,,2022-04-05T00:00:00,2022-05-09T00:00:00,Arbejdsmarkedskonsulenter til Integrationsafdelingen,"I forbindelse med situationen i Ukraine, som betyder et øget antal flygtninge i kommunen, ønsker vi at styrke vores Integrationsafdeling og indsats med flere medarbejdere.    Vi søger minimum 2 fagligt stærke kollegaer, som er klar til at varetage myndighedsrollen og som sammen med borgeren, ønsker at arbejde målrettet omkring den arbejdsmarkedsmarkedsrettede indsats indenfor i bl.a. Integrationsloven, beskæftigelsesloven m.fl.    Du skal trives med at have mange bolde i luften og med en omskiftelig hverdag, hvor dine arbejdsdage og arbejdsopgaver vil være foranderlige og til tider uforudsigelige.  Du skal være struktureret og kunne arbejde selvstændigt samt have et godt blik for opgaveprioritering.    Du vil blive en del af en afdeling med mange forskelligartede opgaver, som rummer borgerens vej fra ankomst til selvforsørgelse – i tråd med kommunens kerneopgave  ""Vi skal styrke borgerens mulighed for at mestre egen tilværelse og i samarbejde med borgerne, sikre, at alle kan indgå i relevante fællesskaber"".     Om jobbet  Som arbejdsmarkedskonsulent i Integrationsafdelingen er det en forudsætning, at du kan favne flere forskellige målgrupper, at du er rummelig over for alle typer af mennesker, kulturer og opgaver samt at du kan arbejde helhedsorienteret.    Du vil komme til at arbejde med en borgergruppe, hvor kompleksiteten i den enkelte borgers livssituation kan spænde bredt, hvor det er vigtigt at fastholde det jobrettede fokus og bevare troen på, at borgeren kan opnå beskæftigelse eller uddannelse på ordinære eller særlige vilkår.    I Integrationsafdelingen hjælpes borgerne hurtigst muligt til selvforsørgelse gennem beskæftigelse og/eller ordinær uddannelse, bl.a. igennem motiverende samtaler, opfølgning på borgerens forløb og kontrakt, iværksættelse og opfølgning af bl.a. danskuddannelse, mentorindsats og virksomhedsrettede aktiviteter mv.     Stillingens nøgleopgaver:     Fokus på at hjælpe flygtninge- & familiesammenførte i job eller uddannelse   Afholdelse af motiverende jobsamtaler - oftest ved brug af tolk – og med udgangspunkt i ABC-metoden, som metodisk udspringer af empowerment tankegangen   ""Oversættelse"" af lovgivningen til borgerne   Iværksættelse og opfølgning af aktiviteter & tilbud   Udarbejdelse og opfølgning på borgernes kontrakter og forløb   Evt. udarbejdelse og forelæggelse af rehabiliteringsplaner for kommunens rehabiliteringsteam   Koordinerende sagsbehandler for flygtninge og familiesammenførte borgere   Diverse ad hoc opgaver f.eks. i forbindelse med modtagelse af nye borgere fra Ukraine eller andre steder i verden.    Det er vigtigt, du er indstillet på, at ovenstående opgavebeskrivelse ikke er udtømmende samt at det er forventet, at vores indsats løbende skal tilpasses det behov og de opgaver, vi som kommune står overfor.     Dine kompetencer:  Vi forventer, at du:    Er uddannet socialrådgiver/-formidler, gerne med erfaring inden for arbejdsmarkedsområdet og/eller du har relevant myndigheds erfaring inden for integrationsområdet   Vi ser gerne at du er juridisk stærk, har god registreringspraksis samt flair for det administrative arbejde   Har gode kommunikationsevner – såvel skriftligt som mundtligt   Har en motiverende tilgang til opgaveløsningen   Har gode IT tekniske kompetencer og mod på at arbejde i flere forskellige IT-systemer. Vi benytter hovedsageligt Fasit og e-Doc   Er positiv og lægger vægt på at bidrage til god trivsel og et godt arbejdsklima   Har modenhed og styrke til at arbejde med svære sociale problemstillinger   Er en positiv og nysgerrig teamplayer, som kan give og modtage relevant faglig sparring   Er nysgerrig og opsøgende i tilgangen til løsningen af arbejdsopgaver   Er god til at skabe en åben og fordomsfri dialog   Kan indgå i tværfagligt samarbejde såvel internt som eksternt, med mange forskellige faggrupper og evt. frivillige organisationer m.fl.    Integrationsafdelingen er en del af Center for Arbejdsmarked i Guldborgsund Kommune og er fysisk placeret centralt i Nykøbing F. på Sprog & Integrationscentret, Thorsensvej 11, Bygning E.     Vi tilbyder:         En ambitiøs afdeling med en uformel tone, en høj faglighed og en positiv tilgang til opgaveløsningen   Smil og højt humør   En spændende og uforudsigelig hverdag med mange forskelligartede opgaver   Åbenhed for udvikling, nytænkning og indflydelse på arbejdets tilrettelæggelse   Flekstid og mulighed for hjemmearbejde     Ansættelsesvilkår:  Efter gældende overenskomst 37 timer pr. uge.     Stillingerne ønskes besat snarest muligt, hvorfor samtaler og ansættelser sker løbende.     Varighed:  Stillingerne er tidsbegrænsede og løber i en 2-årig periode fra ansættelsestidspunktet, evt. med mulighed for forlængelse.     Mere information:  Har du spørgsmål eller ønsker flere oplysninger, er du velkommen til at kontakte leder Susie Willander på tlf. 2518 0746, konstitueret faglig gruppeleder, Betina Andersen tlf. 2518 0144.    Ansættelsen er betinget af tilfredsstillende børne- og straffeattest.
 Denne jobannonce blev oprindeligt opslået på https://www.ofir.dk/
 (Den originale annonce kan ses på: https://www.ofir.dk/showojob?ofirid=d4842fb2)",Thorsensvej 11B,58,Danmark,376,Guldborgsund,4,"Hovedstaden, Sjælland og Bornholm",4800,Nykøbing F,16,1,Fuldtid,None,None,2,,0,,0,0,0,,False,"{'Id': 7885731, 'Email': None, 'FaxNumber': None, 'PersonName': 'Susie Willander', 'FirstName': 'Susie', 'LastName': 'Willander', 'PositionTitle': None, 'PhoneNumbers': [{'Number': '54731000', 'Type': 0, 'Description': 'Hovednummer'}]}",,False,False,False,False,4,,,False,False,False,False,,,,,https://www.ofir.dk/resultat/Jobannonce.aspx?ofirId=d4842fb2&action=sendApplicationUrl,False,2022-05-09T00:00:00,,0,Primary,7,/CV/FindWork/GetLogo?JobAdId=5571258&WorkPlace=64097&Organisation=29188599,"Thorsensvej 11B,4800, Nykøbing F",True,False,/CV/Jobseeking/JobLog/CreateJobSearch?JobnetJobPostingIdentifier=5571258&Company.Name=Sprog- & Integrationscenter&SubmissionDeadlineDate=2022-5-9&Title=Arbejdsmarkedskonsulenter til Integrationsafdelingen&WeeklyWorkTime=1,00000000-0000-0000-0000-000000000000,False,0,,,Arbejdsmarkedskonsulenter til Integrationsafdelingen,True,,True,1,,5571258,,,False,False,,0,False,Sprog- & Integrationscenter,Thorsensvej 11B,,,4800,False,False,False,Nykøbing F,Susie Willander,54731000,,,,,,False,,2022-05-09T00:00:00,,0,False,0,,,,,0,,,,False,False,,,False,False,,,,False,,False,,,Arbejdspladsen ligger i Guldborgsund kommune,False,Sprog- & Integrationscenter,,None,,False,False,"I forbindelse med situationen i Ukraine, som betyder et øget antal flygtninge i kommunen, ønsker vi at styrke vores Integrationsafdeling og indsats med flere medarbejdere.  Vi søger minimum 2 fagligt stærke kollegaer, som er klar til at varetage myndighedsrollen og som sammen med borgeren, ønsker at arbejde målrettet omkring den arbejdsmarkedsmarke","""I forbindelse med situationen i Ukraine, som betyder et øget antal flygtninge i kommunen, ønsker vi at styrke vores Integrationsafdeling og indsats med flere medarbejdere.  Vi søger minimum 2 fagligt stærke kollegaer, som er klar til at varetage myndighedsrollen og som sammen med borgeren, ønsker at arbejde målrettet omkring den arbejdsmarkedsmarke""","""Arbejdsmarkedskonsulenter til Integrationsafdelingen""","https://www.google.dk/maps/dir//Thorsensvej+11B,4800,+Nykøbing+F/","I forbindelse med situationen i Ukraine, som betyder et øget antal flygtninge i kommunen, ønsker vi at styrke vores Integrationsafdeling og indsats med flere medarbejdere.    Vi søger minimum 2 fagligt stærke kollegaer, som er klar til at varetage myndighedsrollen og som sammen med borgeren, ønsker at arbejde målrettet omkring den arbejdsmarkedsmarkedsrettede indsats indenfor i bl.a. Integrationsloven, beskæftigelsesloven m.fl.    Du skal trives med at have mange bolde i luften og med en omskiftelig hverdag, hvor dine arbejdsdage og arbejdsopgaver vil være foranderlige og til tider uforudsigelige.  Du skal være struktureret og kunne arbejde selvstændigt samt have et godt blik for opgaveprioritering.    Du vil blive en del af en afdeling med mange forskelligartede opgaver, som rummer borgerens vej fra ankomst til selvforsørgelse – i tråd med kommunens kerneopgave  ""Vi skal styrke borgerens mulighed for at mestre egen tilværelse og i samarbejde med borgerne, sikre, at alle kan indgå i relevante fællesskaber"".     Om jobbet  Som arbejdsmarkedskonsulent i Integrationsafdelingen er det en forudsætning, at du kan favne flere forskellige målgrupper, at du er rummelig over for alle typer af mennesker, kulturer og opgaver samt at du kan arbejde helhedsorienteret.    Du vil komme til at arbejde med en borgergruppe, hvor kompleksiteten i den enkelte borgers livssituation kan spænde bredt, hvor det er vigtigt at fastholde det jobrettede fokus og bevare troen på, at borgeren kan opnå beskæftigelse eller uddannelse på ordinære eller særlige vilkår.    I Integrationsafdelingen hjælpes borgerne hurtigst muligt til selvforsørgelse gennem beskæftigelse og/eller ordinær uddannelse, bl.a. igennem motiverende samtaler, opfølgning på borgerens forløb og kontrakt, iværksættelse og opfølgning af bl.a. danskuddannelse, mentorindsats og virksomhedsrettede aktiviteter mv.     Stillingens nøgleopgaver:     Fokus på at hjælpe flygtninge- & familiesammenførte i job eller uddannelse   Afholdelse af motiverende jobsamtaler - oftest ved brug af tolk – og med udgangspunkt i ABC-metoden, som metodisk udspringer af empowerment tankegangen   ""Oversættelse"" af lovgivningen til borgerne   Iværksættelse og opfølgning af aktiviteter & tilbud   Udarbejdelse og opfølgning på borgernes kontrakter og forløb   Evt. udarbejdelse og forelæggelse af rehabiliteringsplaner for kommunens rehabiliteringsteam   Koordinerende sagsbehandler for flygtninge og familiesammenførte borgere   Diverse ad hoc opgaver f.eks. i forbindelse med modtagelse af nye borgere fra Ukraine eller andre steder i verden.    Det er vigtigt, du er indstillet på, at ovenstående opgavebeskrivelse ikke er udtømmende samt at det er forventet, at vores indsats løbende skal tilpasses det behov og de opgaver, vi som kommune står overfor.     Dine kompetencer:  Vi forventer, at du:    Er uddannet socialrådgiver/-formidler, gerne med erfaring inden for arbejdsmarkedsområdet og/eller du har relevant myndigheds erfaring inden for integrationsområdet   Vi ser gerne at du er juridisk stærk, har god registreringspraksis samt flair for det administrative arbejde   Har gode kommunikationsevner – såvel skriftligt som mundtligt   Har en motiverende tilgang til opgaveløsningen   Har gode IT tekniske kompetencer og mod på at arbejde i flere forskellige IT-systemer. Vi benytter hovedsageligt Fasit og e-Doc   Er positiv og lægger vægt på at bidrage til god trivsel og et godt arbejdsklima   Har modenhed og styrke til at arbejde med svære sociale problemstillinger   Er en positiv og nysgerrig teamplayer, som kan give og modtage relevant faglig sparring   Er nysgerrig og opsøgende i tilgangen til løsningen af arbejdsopgaver   Er god til at skabe en åben og fordomsfri dialog   Kan indgå i tværfagligt samarbejde såvel internt som eksternt, med mange forskellige faggrupper og evt. frivillige organisationer m.fl.    Integrationsafdelingen er en del af Center for Arbejdsmarked i Guldborgsund Kommune og er fysisk placeret centralt i Nykøbing F. på Sprog & Integrationscentret, Thorsensvej 11, Bygning E.     Vi tilbyder:         En ambitiøs afdeling med en uformel tone, en høj faglighed og en positiv tilgang til opgaveløsningen   Smil og højt humør   En spændende og uforudsigelig hverdag med mange forskelligartede opgaver   Åbenhed for udvikling, nytænkning og indflydelse på arbejdets tilrettelæggelse   Flekstid og mulighed for hjemmearbejde     Ansættelsesvilkår:  Efter gældende overenskomst 37 timer pr. uge.     Stillingerne ønskes besat snarest muligt, hvorfor samtaler og ansættelser sker løbende.     Varighed:  Stillingerne er tidsbegrænsede og løber i en 2-årig periode fra ansættelsestidspunktet, evt. med mulighed for forlængelse.     Mere information:  Har du spørgsmål eller ønsker flere oplysninger, er du velkommen til at kontakte leder Susie Willander på tlf. 2518 0746, konstitueret faglig gruppeleder, Betina Andersen tlf. 2518 0144.    Ansættelsen er betinget af tilfredsstillende børne- og straffeattest.
 Denne jobannonce blev oprindeligt opslået på  https://www.ofir.dk/ 
 (Den originale annonce kan ses på:  https://www.ofir.dk/showojob?ofirid=d4842fb2 )","https://www.google.dk/maps/place/Thorsensvej+11B,4800,+Nykøbing+F/",29188599,False,False,,False
