summary_AutomatchType,summary_Abroad,summary_Weight,summary_Title,summary_JobHeadline,summary_Presentation,summary_HiringOrgName,summary_WorkPlaceAddress,summary_WorkPlacePostalCode,summary_WorkPlaceCity,summary_WorkPlaceOtherAddress,summary_WorkPlaceAbroad,summary_WorkPlaceNotStatic,summary_UseWorkPlaceAddressForJoblog,summary_PostingCreated,summary_LastDateApplication,summary_FormattedLastDateApplication,summary_AssignmentStartDate,summary_IsHotjob,summary_IsExternal,summary_Url,summary_Region,summary_Municipality,summary_Country,summary_PostalCode,summary_PostalCodeName,summary_JobAnnouncementType,summary_EmploymentType,summary_WorkHours,summary_OccupationArea,summary_OccupationGroup,summary_Occupation,summary_Location_Latitude,summary_Location_Longitude,summary_JoblogWorkTime_WorkHour,summary_JoblogWorkTime_DailyWorkTime,summary_WorkplaceID,summary_OrganisationId,summary_HiringOrgCVR,summary_UserLoggedIn,summary_AnonymousEmployer,summary_ShareUrl,summary_DetailsUrl,summary_JobLogUrl,summary_HasLocationValues,summary_ID,summary_Latitude,summary_Longitude,details_WorkSchedule,details_WorkConditions,details_EmploymentTypes,details_WorkPlace_Name,details_WorkPlace_Address_AddressLine,details_WorkPlace_Address_Country_Id,details_WorkPlace_Address_Country_Name,details_WorkPlace_Address_Municipality_Id,details_WorkPlace_Address_Municipality_Name,details_WorkPlace_Address_Region_Id,details_WorkPlace_Address_Region_Name,details_WorkPlace_Address_PostalCode,details_WorkPlace_Address_City,details_WorkPlace_PhoneNumber_Number,details_WorkPlace_PhoneNumber_Type,details_WorkPlace_PhoneNumber_Description,details_WorkPlace_FaxNumber,details_WorkPlace_Email,details_WorkPlace_WebAddress,details_WorkPlace_Description,details_WorkPlace_Logo,details_WorkPlace_WorkPlaceOrganizationNumber,details_WorkPlace_OrganizationNumber,details_WorkPlace_OrganizationDescription,details_JobPositionPosting_Id,details_JobPositionPosting_OriginalJppId,details_JobPositionPosting_HiringOrg_Name,details_JobPositionPosting_HiringOrg_Address_AddressLine,details_JobPositionPosting_HiringOrg_Address_Country_Id,details_JobPositionPosting_HiringOrg_Address_Country_Name,details_JobPositionPosting_HiringOrg_Address_Municipality_Id,details_JobPositionPosting_HiringOrg_Address_Municipality_Name,details_JobPositionPosting_HiringOrg_Address_Region_Id,details_JobPositionPosting_HiringOrg_Address_Region_Name,details_JobPositionPosting_HiringOrg_Address_PostalCode,details_JobPositionPosting_HiringOrg_Address_City,details_JobPositionPosting_HiringOrg_PhoneNumber_Number,details_JobPositionPosting_HiringOrg_PhoneNumber_Type,details_JobPositionPosting_HiringOrg_PhoneNumber_Description,details_JobPositionPosting_HiringOrg_FaxNumber,details_JobPositionPosting_HiringOrg_Email,details_JobPositionPosting_HiringOrg_WebAddress,details_JobPositionPosting_HiringOrg_Description,details_JobPositionPosting_HiringOrg_Logo,details_JobPositionPosting_HiringOrg_WorkPlaceOrganizationNumber,details_JobPositionPosting_HiringOrg_OrganizationNumber,details_JobPositionPosting_HiringOrg_OrganizationDescription,details_JobPositionPosting_RecruitingCompany,details_JobPositionPosting_PublicationStartDate,details_JobPositionPosting_PublicationEndDate,details_JobPositionPosting_JobPositionInformation_PositionTitle,details_JobPositionPosting_JobPositionInformation_Purpose,details_JobPositionPosting_JobPositionInformation_WorkLocation_AddressLine,details_JobPositionPosting_JobPositionInformation_WorkLocation_Country_Id,details_JobPositionPosting_JobPositionInformation_WorkLocation_Country_Name,details_JobPositionPosting_JobPositionInformation_WorkLocation_Municipality_Id,details_JobPositionPosting_JobPositionInformation_WorkLocation_Municipality_Name,details_JobPositionPosting_JobPositionInformation_WorkLocation_Region_Id,details_JobPositionPosting_JobPositionInformation_WorkLocation_Region_Name,details_JobPositionPosting_JobPositionInformation_WorkLocation_PostalCode,details_JobPositionPosting_JobPositionInformation_WorkLocation_City,details_JobPositionPosting_JobPositionInformation_EmploymentType,details_JobPositionPosting_JobPositionInformation_WeeklyWorkHours_TypeId,details_JobPositionPosting_JobPositionInformation_WeeklyWorkHours_TypeName,details_JobPositionPosting_JobPositionInformation_WeeklyWorkHours_Description,details_JobPositionPosting_JobPositionInformation_CompensationDescription,details_JobPositionPosting_JobPositionInformation_NumberToFill,details_JobPositionPosting_JobPositionInformation_DriverLicense,details_JobPositionPosting_JobPositionInformation_Occupation_DiscoWeb,details_JobPositionPosting_JobPositionInformation_Occupation_AlternateNames,details_JobPositionPosting_JobPositionInformation_Occupation_GroupId,details_JobPositionPosting_JobPositionInformation_Occupation_AreaId,details_JobPositionPosting_JobPositionInformation_Occupation_Id,details_JobPositionPosting_JobPositionInformation_Occupation_Name,details_JobPositionPosting_JobPositionInformation_IsGovernmentHiring,details_JobPositionPosting_JobPositionInformation_JppContacts,details_JobPositionPosting_JobPositionInformation_EmploymentDate,details_JobPositionPosting_IsRecruitmentOfForeignNationals,details_JobPositionPosting_IsWorkInDenmark,details_JobPositionPosting_IsAnonymousEmployer,details_JobPositionPosting_IsDisabilityFriendly,details_JobPositionPosting_JppType,details_JobPositionPosting_ApplicationDetails_WorkHourMax,details_JobPositionPosting_ApplicationDetails_WorkHourMin,details_JobPositionPosting_ApplicationDetails_DailyWorkTimeWeekend,details_JobPositionPosting_ApplicationDetails_DailyWorkTimeNight,details_JobPositionPosting_ApplicationDetails_DailyWorkTimeEvening,details_JobPositionPosting_ApplicationDetails_DailyWorkTimeDay,details_JobPositionPosting_ApplicationDetails_ReferenceText,details_JobPositionPosting_ApplicationDetails_RemarksToApplicant,details_JobPositionPosting_ApplicationDetails_ByEmail,details_JobPositionPosting_ApplicationDetails_ByPhone,details_JobPositionPosting_ApplicationDetails_ApplyViaUrl,details_JobPositionPosting_ApplicationDetails_ReplyInWriting,details_JobPositionPosting_ApplicationDetails_ApplicationDeadlineDate,details_JobPositionPosting_ContactAuthorityPhoneNumber_Number,details_JobPositionPosting_ContactAuthorityPhoneNumber_Type,details_JobPositionPosting_ContactAuthorityPhoneNumber_Description,details_JobPositionPosting_Status,details_LogoUrl,details_Address,details_ShowMap,details_ShowShareButtonJobLog,details_JobLogUrl,details_JobLogTemplateModel_Identifier,details_JobLogTemplateModel_UseWorkPlaceAddressForJoblog,details_JobLogTemplateModel_Category,details_JobLogTemplateModel_CvCustomerIdentifier,details_JobLogTemplateModel_JobSeekingStatus,details_JobLogTemplateModel_Title,details_JobLogTemplateModel_IsApplicationSourceRequired,details_JobLogTemplateModel_ApplicationSource,details_JobLogTemplateModel_IsWeeklyWorkTimeRequired,details_JobLogTemplateModel_WeeklyWorkTime,details_JobLogTemplateModel_HoursPerWeek,details_JobLogTemplateModel_JobnetJobPostingIdentifier,details_JobLogTemplateModel_JobAdDocument_Title,details_JobLogTemplateModel_JobAdDocument_Identifier,details_JobLogTemplateModel_JobAdDocument_IsDeletedBySystem,details_JobLogTemplateModel_JobAdDocument_IsDeletedByUser,details_JobLogTemplateModel_JobAdFile,details_JobLogTemplateModel_Company_JobLogEntryCategory,details_JobLogTemplateModel_Company_ShowAddressFieldsEvenIfEmpty,details_JobLogTemplateModel_Company_Name,details_JobLogTemplateModel_Company_Address,details_JobLogTemplateModel_Company_Country,details_JobLogTemplateModel_Company_EmploymentAreaID,details_JobLogTemplateModel_Company_PostCode,details_JobLogTemplateModel_Company_IsCountryAndTownAndPostCodeEmpty,details_JobLogTemplateModel_Company_IsTownAndPostCodeEmpty,details_JobLogTemplateModel_Company_IsCountryDanmark,details_JobLogTemplateModel_Company_Town,details_JobLogTemplateModel_Company_ContactPerson,details_JobLogTemplateModel_Company_Phone,details_JobLogTemplateModel_Company_Email,details_JobLogTemplateModel_Company_Latitude,details_JobLogTemplateModel_Company_Longitude,details_JobLogTemplateModel_Company_DailyTravelTimeInMinutes,details_JobLogTemplateModel_Company_DistanceToCompanyInMeters,details_JobLogTemplateModel_Company_IsCreateMode,details_JobLogTemplateModel_TypeOfSubmission,details_JobLogTemplateModel_SubmissionDate,details_JobLogTemplateModel_SubmissionDateFormatted,details_JobLogTemplateModel_SubmissionDateTiks,details_JobLogTemplateModel_IsSubmissionDateRequired,details_JobLogTemplateModel_Status,details_JobLogTemplateModel_DateCreatedFormatted,details_JobLogTemplateModel_DateCreated,details_JobLogTemplateModel_DateModifiedFormatted,details_JobLogTemplateModel_DateModified,details_JobLogTemplateModel_LastModifiedDateTiks,details_JobLogTemplateModel_DateClosed,details_JobLogTemplateModel_JobApplicationDocument_Title,details_JobLogTemplateModel_JobApplicationDocument_Identifier,details_JobLogTemplateModel_JobApplicationDocument_IsDeletedBySystem,details_JobLogTemplateModel_JobApplicationDocument_IsDeletedByUser,details_JobLogTemplateModel_CvDocument_Title,details_JobLogTemplateModel_CvDocument_Identifier,details_JobLogTemplateModel_CvDocument_IsDeletedBySystem,details_JobLogTemplateModel_CvDocument_IsDeletedByUser,details_JobLogTemplateModel_JobApplicationFile,details_JobLogTemplateModel_CvFile,details_JobLogTemplateModel_SubmissionDeadlineDate,details_JobLogTemplateModel_IsPersisted,details_JobLogTemplateModel_ServerValidationErrors,details_JobLogTemplateModel_HasServerValidationErrors,details_JoblogWorkTime_WorkHour,details_JoblogWorkTime_DailyWorkTime,details_Place,details_OpenPrintDialog,details_WorkPlaceInfoText,details_JobCenterContactDetails,details_WorkPlaceDescriptionText,details_FavoriteText,details_IsFavorite,details_ShowFavorite,details_MetaOgTextForSharing,details_DescriptionForSharing,details_TitleForSharing,details_RutePlan,details_FormattedPurpose,details_MapUrl,details_OrganizationNumber,details_ShowSearchJobButton,details_ShowPrint,details_BackToFindWorkButtonUrl,isExternal
0,False,1,"Vi søger pædagogiske medarbejdere, uddannede såvel som ikke-uddannede, til vores to nye vores børnehuse i Blovstrød","Vi søger pædagogiske medarbejdere, uddannede såvel som ikke-uddannede, til vores to nye vores børnehuse i Blovstrød","Blovstrød Børnehus i Allerød Kommune er en velfungerende Klynge med en høj social kapital. Vi vægter tværfagligt samarbejde, faglig udvikling og medindflydelse på egen hverdag højt. Vi skaber ",Blovstrød Børnehus,Bjarkesvej 2,3450,Allerød,False,False,False,True,2022-04-05T00:00:00,2022-05-09T00:00:00,9. maj 2022,0001-01-01T00:00:00,False,False,https://job.jobnet.dk/CV/FindWork/Details/5571114,Hovedstaden og Bornholm,Allerød,Danmark,3450,,,,Deltid,"Pædagogisk, socialt og kirkeligt arbejde",Pædagogisk arbejde,Klubmedarbejder,55.8657,12.3299,,,31660,11064,60183112,False,False,https://job.jobnet.dk/CV/FindWork/DetailsSocialmedia/5571114,https://job.jobnet.dk/CV/FindWork/Details/5571114,https://job.jobnet.dk/CV/FindWork/Details/5571114,True,5571114,55.8657,12.3299,"{'Id': 1, 'Name': 'Fuldtid'}, {'Id': 16, 'Name': 'Deltid'}","{'Id': 1, 'Name': 'Almindelige vilkår'}, {'Id': 2, 'Name': 'Fleksjob'}, {'Id': 3, 'Name': 'Skånejob'}, {'Id': 4, 'Name': 'Egnet til efterlønnere og seniorer'}, {'Id': 5, 'Name': 'Job med løntilskud'}, {'Id': 6, 'Name': 'Rotationsjob'}, {'Id': 7, 'Name': 'Virksomhedspraktik'}","{'Id': 1, 'Name': 'Fastansættelse'}, {'Id': 16, 'Name': 'Tidsbegrænset ansættelse'}",Blovstrød Børnehus,Bjarkesvej 2,58,Danmark,201,Allerød,4,"Hovedstaden, Sjælland og Bornholm",3450,Allerød,,0,Primary,,,,None,,1003276005,60183112,None,5571114,5571114,Blovstrød Børnehus,Bjarkesvej 2,58,Danmark,201,Allerød,4,"Hovedstaden, Sjælland og Bornholm",3450,Allerød,,0,Primary,,,,None,,1003276005,60183112,None,,2022-04-05T00:00:00,2022-05-09T00:00:00,"Vi søger pædagogiske medarbejdere, uddannede såvel som ikke-uddannede, til vores to nye vores børnehuse i Blovstrød","Blovstrød Børnehus i Allerød Kommune er en velfungerende Klynge med en høj social kapital. Vi vægter tværfagligt samarbejde, faglig udvikling og medindflydelse på egen hverdag højt. Vi skaber værdi for børnene i hverdagen via fokus på tillid, trivsel, arbejdsfællesskab og faglighed.   Børnehuset består af to huse – Pilelunden, som blev indviet 1. marts 2019 og Bøgelunden den 1. februar 2021. Hvert hus har plads til 150 børn, der er fordelt i mindre grupper. Til hvert af husene er der en pædagogisk leder. Vi arbejder teambaseret på tværs af en vuggestuegruppe og en børnehavegruppe. Vores ældste børnehavebørn kommer i deres egen gruppe det sidste år, før de skal i skole.   Vores daglige åbningstid er fra kl. 7.00 -17.00.   Vi søger:     Pædagogisk personale, uddannet såvel som ikke-uddannet, der har lyst til at arbejde med børn og deltage i institutionens faglige udviklingsretning   Kolleger der gerne vil bidrage med en god og positiv indsats   Initiativrige, nærværende voksne, som er aktivt deltagende sammen med børnene   Inkluderende medarbejdere, som ser børnenes perspektiv og deres potentialer   Ansvarlige ansatte, som er mødestabile og engagerede.     Se/læs eventuelt om vores Fælles børne- og læringssyn : HER Book et kaffemøde, tal med os, se dig omkring i Blovstrød Børnehus og send din ansøgning Så kan  du  blive en del af vores helt unikke proces i den fortsatte udvikling af Blovstrød Børnehus - som er en klyngeinstitution under Allerød Kommune.   Ring til Lone Sommer Hansen på 40 41 36 25. Vi ser frem til at høre fra dig. Allerød Kommune ligger i hjertet af Nordsjælland i en smuk og varieret natur. Kommunen har tæt på 26.000 indbyggere og byder på et aktivt forenings- og erhvervsliv og gode idræts- og fritidsmuligheder. Der er gode transportmuligheder både til og fra kommunen. Der går S-tog hvert 10. minut fra Allerød Station. Kommunen har ca. 2.000 medarbejdere, der arbejder ud fra et fælles værdisæt om åbenhed, respekt og troværdighed. Dialog og samarbejde er nøgleord, der kendetegner god ledelse i Allerød Kommune. Organisationen baserer sig på flade strukturer, stor selvbestemmelse og gode udviklingsmuligheder. Allerød Kommune er en røgfri arbejdsplads med røgfri arbejdstid.     
 Denne jobannonce blev oprindeligt opslået på https://www.ofir.dk/
 (Den originale annonce kan ses på: https://www.ofir.dk/showojob?ofirid=6208cc5a)",Bjarkesvej 2,58,Danmark,201,Allerød,4,"Hovedstaden, Sjælland og Bornholm",3450,Allerød,1,16,Deltid,None,None,1,,0,,0,0,0,,False,"{'Id': 7885363, 'Email': None, 'FaxNumber': None, 'PersonName': 'Lone Sommer Hansen', 'FirstName': 'Lone', 'LastName': 'Sommer Hansen', 'PositionTitle': None, 'PhoneNumbers': [{'Number': '40413625', 'Type': 0, 'Description': 'Hovednummer'}]}",,False,False,False,False,4,,,False,False,False,False,,,,,https://www.ofir.dk/resultat/Jobannonce.aspx?ofirId=6208cc5a&action=sendApplicationUrl,False,2022-05-09T00:00:00,,0,Primary,7,/CV/FindWork/GetLogo?JobAdId=5571114&Organisation=60183112,"Bjarkesvej 2,3450, Allerød",True,False,"/CV/Jobseeking/JobLog/CreateJobSearch?JobnetJobPostingIdentifier=5571114&Company.Name=Blovstrød Børnehus&SubmissionDeadlineDate=2022-5-9&Title=Vi søger pædagogiske medarbejdere, uddannede såvel som ikke-uddannede, til vores to nye vores børnehuse i Blovstrød&WeeklyWorkTime=2",00000000-0000-0000-0000-000000000000,False,0,,,"Vi søger pædagogiske medarbejdere, uddannede såvel som ikke-uddannede, til vores to nye vores børnehuse i Blovstrød",True,,True,2,,5571114,,,False,False,,0,False,Blovstrød Børnehus,Bjarkesvej 2,,,3450,False,False,False,Allerød,Lone Sommer Hansen,40413625,,,,,,False,,2022-05-09T00:00:00,,0,False,0,,,,,0,,,,False,False,,,False,False,,,,False,,False,,,Arbejdspladsen ligger i Allerød kommune,False,Blovstrød Børnehus,,None,,False,False,"Blovstrød Børnehus i Allerød Kommune er en velfungerende Klynge med en høj social kapital. Vi vægter tværfagligt samarbejde, faglig udvikling og medindflydelse på egen hverdag højt. Vi skaber værdi for børnene i hverdagen via fokus på tillid, trivsel, arbejdsfællesskab og faglighed. Børnehuset består af to huse – Pilelunden, som blev indviet 1. mar","""Blovstrød Børnehus i Allerød Kommune er en velfungerende Klynge med en høj social kapital. Vi vægter tværfagligt samarbejde, faglig udvikling og medindflydelse på egen hverdag højt. Vi skaber værdi for børnene i hverdagen via fokus på tillid, trivsel, arbejdsfællesskab og faglighed. Børnehuset består af to huse – Pilelunden, som blev indviet 1. mar""","""Vi søger pædagogiske medarbejdere, uddannede såvel som ikke-uddannede, til vores to nye vores børnehuse i Blovstrød""","https://www.google.dk/maps/dir//Bjarkesvej+2,3450,+Allerød/","Blovstrød Børnehus i Allerød Kommune er en velfungerende Klynge med en høj social kapital. Vi vægter tværfagligt samarbejde, faglig udvikling og medindflydelse på egen hverdag højt. Vi skaber værdi for børnene i hverdagen via fokus på tillid, trivsel, arbejdsfællesskab og faglighed.   Børnehuset består af to huse – Pilelunden, som blev indviet 1. marts 2019 og Bøgelunden den 1. februar 2021. Hvert hus har plads til 150 børn, der er fordelt i mindre grupper. Til hvert af husene er der en pædagogisk leder. Vi arbejder teambaseret på tværs af en vuggestuegruppe og en børnehavegruppe. Vores ældste børnehavebørn kommer i deres egen gruppe det sidste år, før de skal i skole.   Vores daglige åbningstid er fra kl. 7.00 -17.00.   Vi søger:     Pædagogisk personale, uddannet såvel som ikke-uddannet, der har lyst til at arbejde med børn og deltage i institutionens faglige udviklingsretning   Kolleger der gerne vil bidrage med en god og positiv indsats   Initiativrige, nærværende voksne, som er aktivt deltagende sammen med børnene   Inkluderende medarbejdere, som ser børnenes perspektiv og deres potentialer   Ansvarlige ansatte, som er mødestabile og engagerede.     Se/læs eventuelt om vores Fælles børne- og læringssyn : HER Book et kaffemøde, tal med os, se dig omkring i Blovstrød Børnehus og send din ansøgning Så kan  du  blive en del af vores helt unikke proces i den fortsatte udvikling af Blovstrød Børnehus - som er en klyngeinstitution under Allerød Kommune.   Ring til Lone Sommer Hansen på 40 41 36 25. Vi ser frem til at høre fra dig. Allerød Kommune ligger i hjertet af Nordsjælland i en smuk og varieret natur. Kommunen har tæt på 26.000 indbyggere og byder på et aktivt forenings- og erhvervsliv og gode idræts- og fritidsmuligheder. Der er gode transportmuligheder både til og fra kommunen. Der går S-tog hvert 10. minut fra Allerød Station. Kommunen har ca. 2.000 medarbejdere, der arbejder ud fra et fælles værdisæt om åbenhed, respekt og troværdighed. Dialog og samarbejde er nøgleord, der kendetegner god ledelse i Allerød Kommune. Organisationen baserer sig på flade strukturer, stor selvbestemmelse og gode udviklingsmuligheder. Allerød Kommune er en røgfri arbejdsplads med røgfri arbejdstid.     
 Denne jobannonce blev oprindeligt opslået på  https://www.ofir.dk/ 
 (Den originale annonce kan ses på:  https://www.ofir.dk/showojob?ofirid=6208cc5a )","https://www.google.dk/maps/place/Bjarkesvej+2,3450,+Allerød/",60183112,False,False,,False
