summary_AutomatchType,summary_Abroad,summary_Weight,summary_Title,summary_JobHeadline,summary_Presentation,summary_HiringOrgName,summary_WorkPlaceAddress,summary_WorkPlacePostalCode,summary_WorkPlaceCity,summary_WorkPlaceOtherAddress,summary_WorkPlaceAbroad,summary_WorkPlaceNotStatic,summary_UseWorkPlaceAddressForJoblog,summary_PostingCreated,summary_LastDateApplication,summary_FormattedLastDateApplication,summary_AssignmentStartDate,summary_IsHotjob,summary_IsExternal,summary_Url,summary_Region,summary_Municipality,summary_Country,summary_PostalCode,summary_PostalCodeName,summary_JobAnnouncementType,summary_EmploymentType,summary_WorkHours,summary_OccupationArea,summary_OccupationGroup,summary_Occupation,summary_Location_Latitude,summary_Location_Longitude,summary_JoblogWorkTime_WorkHour,summary_JoblogWorkTime_DailyWorkTime,summary_WorkplaceID,summary_OrganisationId,summary_HiringOrgCVR,summary_UserLoggedIn,summary_AnonymousEmployer,summary_ShareUrl,summary_DetailsUrl,summary_JobLogUrl,summary_HasLocationValues,summary_ID,summary_Latitude,summary_Longitude,details_WorkSchedule,details_WorkConditions,details_EmploymentTypes,details_WorkPlace_Name,details_WorkPlace_Address_AddressLine,details_WorkPlace_Address_Country_Id,details_WorkPlace_Address_Country_Name,details_WorkPlace_Address_Municipality_Id,details_WorkPlace_Address_Municipality_Name,details_WorkPlace_Address_Region_Id,details_WorkPlace_Address_Region_Name,details_WorkPlace_Address_PostalCode,details_WorkPlace_Address_City,details_WorkPlace_PhoneNumber_Number,details_WorkPlace_PhoneNumber_Type,details_WorkPlace_PhoneNumber_Description,details_WorkPlace_FaxNumber,details_WorkPlace_Email,details_WorkPlace_WebAddress,details_WorkPlace_Description,details_WorkPlace_Logo,details_WorkPlace_WorkPlaceOrganizationNumber,details_WorkPlace_OrganizationNumber,details_WorkPlace_OrganizationDescription,details_JobPositionPosting_Id,details_JobPositionPosting_OriginalJppId,details_JobPositionPosting_HiringOrg_Name,details_JobPositionPosting_HiringOrg_Address_AddressLine,details_JobPositionPosting_HiringOrg_Address_Country_Id,details_JobPositionPosting_HiringOrg_Address_Country_Name,details_JobPositionPosting_HiringOrg_Address_Municipality_Id,details_JobPositionPosting_HiringOrg_Address_Municipality_Name,details_JobPositionPosting_HiringOrg_Address_Region_Id,details_JobPositionPosting_HiringOrg_Address_Region_Name,details_JobPositionPosting_HiringOrg_Address_PostalCode,details_JobPositionPosting_HiringOrg_Address_City,details_JobPositionPosting_HiringOrg_PhoneNumber_Number,details_JobPositionPosting_HiringOrg_PhoneNumber_Type,details_JobPositionPosting_HiringOrg_PhoneNumber_Description,details_JobPositionPosting_HiringOrg_FaxNumber,details_JobPositionPosting_HiringOrg_Email,details_JobPositionPosting_HiringOrg_WebAddress,details_JobPositionPosting_HiringOrg_Description,details_JobPositionPosting_HiringOrg_Logo,details_JobPositionPosting_HiringOrg_WorkPlaceOrganizationNumber,details_JobPositionPosting_HiringOrg_OrganizationNumber,details_JobPositionPosting_HiringOrg_OrganizationDescription,details_JobPositionPosting_RecruitingCompany,details_JobPositionPosting_PublicationStartDate,details_JobPositionPosting_PublicationEndDate,details_JobPositionPosting_JobPositionInformation_PositionTitle,details_JobPositionPosting_JobPositionInformation_Purpose,details_JobPositionPosting_JobPositionInformation_WorkLocation_AddressLine,details_JobPositionPosting_JobPositionInformation_WorkLocation_Country_Id,details_JobPositionPosting_JobPositionInformation_WorkLocation_Country_Name,details_JobPositionPosting_JobPositionInformation_WorkLocation_Municipality_Id,details_JobPositionPosting_JobPositionInformation_WorkLocation_Municipality_Name,details_JobPositionPosting_JobPositionInformation_WorkLocation_Region_Id,details_JobPositionPosting_JobPositionInformation_WorkLocation_Region_Name,details_JobPositionPosting_JobPositionInformation_WorkLocation_PostalCode,details_JobPositionPosting_JobPositionInformation_WorkLocation_City,details_JobPositionPosting_JobPositionInformation_EmploymentType,details_JobPositionPosting_JobPositionInformation_WeeklyWorkHours_TypeId,details_JobPositionPosting_JobPositionInformation_WeeklyWorkHours_TypeName,details_JobPositionPosting_JobPositionInformation_WeeklyWorkHours_Description,details_JobPositionPosting_JobPositionInformation_CompensationDescription,details_JobPositionPosting_JobPositionInformation_NumberToFill,details_JobPositionPosting_JobPositionInformation_DriverLicense,details_JobPositionPosting_JobPositionInformation_Occupation_DiscoWeb,details_JobPositionPosting_JobPositionInformation_Occupation_AlternateNames,details_JobPositionPosting_JobPositionInformation_Occupation_GroupId,details_JobPositionPosting_JobPositionInformation_Occupation_AreaId,details_JobPositionPosting_JobPositionInformation_Occupation_Id,details_JobPositionPosting_JobPositionInformation_Occupation_Name,details_JobPositionPosting_JobPositionInformation_IsGovernmentHiring,details_JobPositionPosting_JobPositionInformation_JppContacts,details_JobPositionPosting_JobPositionInformation_EmploymentDate,details_JobPositionPosting_IsRecruitmentOfForeignNationals,details_JobPositionPosting_IsWorkInDenmark,details_JobPositionPosting_IsAnonymousEmployer,details_JobPositionPosting_IsDisabilityFriendly,details_JobPositionPosting_JppType,details_JobPositionPosting_ApplicationDetails_WorkHourMax,details_JobPositionPosting_ApplicationDetails_WorkHourMin,details_JobPositionPosting_ApplicationDetails_DailyWorkTimeWeekend,details_JobPositionPosting_ApplicationDetails_DailyWorkTimeNight,details_JobPositionPosting_ApplicationDetails_DailyWorkTimeEvening,details_JobPositionPosting_ApplicationDetails_DailyWorkTimeDay,details_JobPositionPosting_ApplicationDetails_ReferenceText,details_JobPositionPosting_ApplicationDetails_RemarksToApplicant,details_JobPositionPosting_ApplicationDetails_ByEmail,details_JobPositionPosting_ApplicationDetails_ByPhone,details_JobPositionPosting_ApplicationDetails_ApplyViaUrl,details_JobPositionPosting_ApplicationDetails_ReplyInWriting,details_JobPositionPosting_ApplicationDetails_ApplicationDeadlineDate,details_JobPositionPosting_ContactAuthorityPhoneNumber_Number,details_JobPositionPosting_ContactAuthorityPhoneNumber_Type,details_JobPositionPosting_ContactAuthorityPhoneNumber_Description,details_JobPositionPosting_Status,details_LogoUrl,details_Address,details_ShowMap,details_ShowShareButtonJobLog,details_JobLogUrl,details_JobLogTemplateModel_Identifier,details_JobLogTemplateModel_UseWorkPlaceAddressForJoblog,details_JobLogTemplateModel_Category,details_JobLogTemplateModel_CvCustomerIdentifier,details_JobLogTemplateModel_JobSeekingStatus,details_JobLogTemplateModel_Title,details_JobLogTemplateModel_IsApplicationSourceRequired,details_JobLogTemplateModel_ApplicationSource,details_JobLogTemplateModel_IsWeeklyWorkTimeRequired,details_JobLogTemplateModel_WeeklyWorkTime,details_JobLogTemplateModel_HoursPerWeek,details_JobLogTemplateModel_JobnetJobPostingIdentifier,details_JobLogTemplateModel_JobAdDocument_Title,details_JobLogTemplateModel_JobAdDocument_Identifier,details_JobLogTemplateModel_JobAdDocument_IsDeletedBySystem,details_JobLogTemplateModel_JobAdDocument_IsDeletedByUser,details_JobLogTemplateModel_JobAdFile,details_JobLogTemplateModel_Company_JobLogEntryCategory,details_JobLogTemplateModel_Company_ShowAddressFieldsEvenIfEmpty,details_JobLogTemplateModel_Company_Name,details_JobLogTemplateModel_Company_Address,details_JobLogTemplateModel_Company_Country,details_JobLogTemplateModel_Company_EmploymentAreaID,details_JobLogTemplateModel_Company_PostCode,details_JobLogTemplateModel_Company_IsCountryAndTownAndPostCodeEmpty,details_JobLogTemplateModel_Company_IsTownAndPostCodeEmpty,details_JobLogTemplateModel_Company_IsCountryDanmark,details_JobLogTemplateModel_Company_Town,details_JobLogTemplateModel_Company_ContactPerson,details_JobLogTemplateModel_Company_Phone,details_JobLogTemplateModel_Company_Email,details_JobLogTemplateModel_Company_Latitude,details_JobLogTemplateModel_Company_Longitude,details_JobLogTemplateModel_Company_DailyTravelTimeInMinutes,details_JobLogTemplateModel_Company_DistanceToCompanyInMeters,details_JobLogTemplateModel_Company_IsCreateMode,details_JobLogTemplateModel_TypeOfSubmission,details_JobLogTemplateModel_SubmissionDate,details_JobLogTemplateModel_SubmissionDateFormatted,details_JobLogTemplateModel_SubmissionDateTiks,details_JobLogTemplateModel_IsSubmissionDateRequired,details_JobLogTemplateModel_Status,details_JobLogTemplateModel_DateCreatedFormatted,details_JobLogTemplateModel_DateCreated,details_JobLogTemplateModel_DateModifiedFormatted,details_JobLogTemplateModel_DateModified,details_JobLogTemplateModel_LastModifiedDateTiks,details_JobLogTemplateModel_DateClosed,details_JobLogTemplateModel_JobApplicationDocument_Title,details_JobLogTemplateModel_JobApplicationDocument_Identifier,details_JobLogTemplateModel_JobApplicationDocument_IsDeletedBySystem,details_JobLogTemplateModel_JobApplicationDocument_IsDeletedByUser,details_JobLogTemplateModel_CvDocument_Title,details_JobLogTemplateModel_CvDocument_Identifier,details_JobLogTemplateModel_CvDocument_IsDeletedBySystem,details_JobLogTemplateModel_CvDocument_IsDeletedByUser,details_JobLogTemplateModel_JobApplicationFile,details_JobLogTemplateModel_CvFile,details_JobLogTemplateModel_SubmissionDeadlineDate,details_JobLogTemplateModel_IsPersisted,details_JobLogTemplateModel_ServerValidationErrors,details_JobLogTemplateModel_HasServerValidationErrors,details_JoblogWorkTime_WorkHour,details_JoblogWorkTime_DailyWorkTime,details_Place,details_OpenPrintDialog,details_WorkPlaceInfoText,details_JobCenterContactDetails,details_WorkPlaceDescriptionText,details_FavoriteText,details_IsFavorite,details_ShowFavorite,details_MetaOgTextForSharing,details_DescriptionForSharing,details_TitleForSharing,details_RutePlan,details_FormattedPurpose,details_MapUrl,details_OrganizationNumber,details_ShowSearchJobButton,details_ShowPrint,details_BackToFindWorkButtonUrl,isExternal
0,False,1,Associate Professor in Electrical Engineering (Power electronics and EMC),Associate Professor in Electrical Engineering (Power electronics and EMC),"The cross-border region Denmark-Germany is turning into a powerhouse in industrial electronics. Very recently, the Centre for Industrial Electronics (CIE) at University of Southern Denmark (SDU) wa",Syddansk Universitet,Alsion 2,6400,Sønderborg,False,False,False,True,2022-04-07T00:00:00,2022-06-01T00:00:00,1. juni 2022,0001-01-01T00:00:00,False,False,https://job.jobnet.dk/CV/FindWork/Details/5572585,Syddanmark,Odense,Danmark,6400,,,,Fuldtid,Akademisk arbejde,"Forskning og universitetsundervisning, naturvidenskab og teknik ","Lektor, naturvidenskab og teknik",54.913,9.779,,,76179,53622,29283958,False,False,https://job.jobnet.dk/CV/FindWork/DetailsSocialmedia/5572585,https://job.jobnet.dk/CV/FindWork/Details/5572585,https://job.jobnet.dk/CV/FindWork/Details/5572585,True,5572585,54.913,9.779,"{'Id': 1, 'Name': 'Fuldtid'}, {'Id': 16, 'Name': 'Deltid'}","{'Id': 1, 'Name': 'Almindelige vilkår'}, {'Id': 2, 'Name': 'Fleksjob'}, {'Id': 3, 'Name': 'Skånejob'}, {'Id': 4, 'Name': 'Egnet til efterlønnere og seniorer'}, {'Id': 5, 'Name': 'Job med løntilskud'}, {'Id': 6, 'Name': 'Rotationsjob'}, {'Id': 7, 'Name': 'Virksomhedspraktik'}","{'Id': 1, 'Name': 'Fastansættelse'}, {'Id': 16, 'Name': 'Tidsbegrænset ansættelse'}",Syddansk Universitet,Alsion 2,58,Danmark,461,Odense,3,Syddanmark,6400,Sønderborg,,0,Primary,,,http://www.sdu.dk,None,,1008182694,29283958,None,5572585,5572585,Syddansk Universitet,Alsion 2,58,Danmark,461,Odense,3,Syddanmark,6400,Sønderborg,,0,Primary,,,http://www.sdu.dk,None,,1008182694,29283958,None,,2022-04-07T00:00:00,2022-06-01T00:00:00,Associate Professor in Electrical Engineering (Power electronics and EMC),"The cross-border region Denmark-Germany is turning into a powerhouse in industrial electronics. Very recently, the Centre for Industrial Electronics (CIE) at University of Southern Denmark (SDU) was established by a strong partnership between industry, academia and regional authorities. CIE is located at the campus of SDU Sønderborg and surrounded by a vibrant industrial environment. CIE is part of the Department of mechanical and electrical engineering (DME) at the Faculty of Engineering. 
 Job description We are seeking for an innovative and visionary Associate Professor for the SDU Centre for Industrial Electronics in Sønderborg. The section currently has 30 staff including senior (full and associate professors) and junior (assistant professors and Post Docs) academic staff, PhDs and support staff. This is expected to grow to 60 in a few years. The financial foundation for this growth as well as for the development of new research and test laboratories in key disciplines for Industrial Electronics has been secured. On this basis, we strive for unique and excellent value in research, innovation and education. 
 It is our vision that Electrical Engineering at SDU will excel in areas of key relevance for companies in the region of Southern Denmark and beyond. 
 Candidates are thus required to have a proven research record in at least one of the following fields: 
 
  Power electronic systems such as switch-mode power supplies 
  Optimized magnetic circuits/filters for power electronic filter applications 
 EMC optimized design for power electronic systems including electromagnetic simulations 
 
 Qualifications The candidates must have a PhD in engineering or natural sciences. Commensurate with the seniority of the position applied for, we also expect: - An outstanding research and publication track record - Extensive experience with industrial collaboration - A solid record of teaching in the field of electrical engineering  - A solid knowledge of current EMC regulatory requirements 
 Appointment to the positions will be in accordance with the salary agreement between the Ministry of Finance and the Danish Confederation of Professional Associations. Assessment A panel will assess the qualification of the candidate for the described post based on the submitted material, which should include: 
 
 ideas for research and development activities 
 a Curriculum Vitae and statement of motivation 
 an account of significant contributions to the development of Electrical Engineering 
 an account of significant contributions to innovation in Industrial Electronics 
 an account of experience in education and outreach 
 relevant diplomas 
 a list of publications. 
 
 For information about the DME, which encompasses SDU Electrical Engineering please see www.sdu.dk/dme For specific information on section and centre, please visit www.sdu.dk/cie. You are also welcome to contact the Head of the CIE, Professor Thomas Ebel, ebel@sdu.dk ,  +45 93 50 72 05 for further information. 
 Conditions of employment  Employment as an associate professor requires scientific qualifications at PhD level.  
 The successful applicant will be employed in accordance with the agreement between the Ministry of Finance and the Danish Confederation of Professional Associations. Please check links for more information on salary and taxation. 
 The assessment process Read about the Assessment and selection process. Shortlisting may be used.  Application procedure 
 The faculty expects applicants to read How to apply before applying.  
 The application deadline is 01.06.2022. The University wishes our staff to reflect the diversity of society and thus welcomes applications from all qualified candidates regardless of personal background. 
 Further information for international applicants about entering and working in Denmark. 
 Further information about The Faculty of Engineering.",Alsion 2,58,Danmark,461,Odense,3,Syddanmark,6400,Sønderborg,1,1,Fuldtid,None,None,1,,0,,0,0,0,,False,"{'Id': 7890423, 'Email': 'ebel@sdu.dk', 'FaxNumber': None, 'PersonName': 'Thomas Ebel', 'FirstName': 'Thomas', 'LastName': 'Ebel', 'PositionTitle': 'Ikke oplyst', 'PhoneNumbers': [{'Number': '+45 93 50 72 05', 'Type': 0, 'Description': 'Hovednummer'}]}",2022-07-01T00:00:00,False,False,False,False,4,,,False,False,False,False,,,,6550 1000,http://ssl1.peoplexs.com/Peoplexs22/CandidatesPortalNoLogin/ApplicationForm.cfm?CustomerCode=syd1&PortalID=3797&VacatureID=1187928,False,2022-06-01T00:00:00,,0,Primary,7,/CV/FindWork/GetLogo?JobAdId=5572585&Organisation=29283958,"Alsion 2,6400, Sønderborg",True,False,/CV/Jobseeking/JobLog/CreateJobSearch?JobnetJobPostingIdentifier=5572585&Company.Name=Syddansk Universitet&SubmissionDeadlineDate=2022-6-1&Title=Associate Professor in Electrical Engineering (Power electronics and EMC)&WeeklyWorkTime=1,00000000-0000-0000-0000-000000000000,False,0,,,Associate Professor in Electrical Engineering (Power electronics and EMC),True,,True,1,,5572585,,,False,False,,0,False,Syddansk Universitet,Alsion 2,,,6400,False,False,False,Sønderborg,Thomas Ebel,+45 93 50 72 05,ebel@sdu.dk,,,,,False,,2022-06-01T00:00:00,,0,False,0,,,,,0,,,,False,False,,,False,False,,,,False,,False,,,Arbejdspladsen ligger i Odense kommune,False,Syddansk Universitet,,None,,False,False,"The cross-border region Denmark-Germany is turning into a powerhouse in industrial electronics. Very recently, the Centre for Industrial Electronics (CIE) at University of Southern Denmark (SDU) was established by a strong partnership between industry, academia and regional authorities. CIE is located at the campus of SDU Sønderborg and surrounded ","""The cross-border region Denmark-Germany is turning into a powerhouse in industrial electronics. Very recently, the Centre for Industrial Electronics (CIE) at University of Southern Denmark (SDU) was established by a strong partnership between industry, academia and regional authorities. CIE is located at the campus of SDU Sønderborg and surrounded ""","""Associate Professor in Electrical Engineering (Power electronics and EMC)""","https://www.google.dk/maps/dir//Alsion+2,6400,+Sønderborg/","The cross-border region Denmark-Germany is turning into a powerhouse in industrial electronics. Very recently, the Centre for Industrial Electronics (CIE) at University of Southern Denmark (SDU) was established by a strong partnership between industry, academia and regional authorities. CIE is located at the campus of SDU Sønderborg and surrounded by a vibrant industrial environment. CIE is part of the Department of mechanical and electrical engineering (DME) at the Faculty of Engineering. 
 Job description We are seeking for an innovative and visionary Associate Professor for the SDU Centre for Industrial Electronics in Sønderborg. The section currently has 30 staff including senior (full and associate professors) and junior (assistant professors and Post Docs) academic staff, PhDs and support staff. This is expected to grow to 60 in a few years. The financial foundation for this growth as well as for the development of new research and test laboratories in key disciplines for Industrial Electronics has been secured. On this basis, we strive for unique and excellent value in research, innovation and education. 
 It is our vision that Electrical Engineering at SDU will excel in areas of key relevance for companies in the region of Southern Denmark and beyond. 
 Candidates are thus required to have a proven research record in at least one of the following fields: 
 
  Power electronic systems such as switch-mode power supplies 
  Optimized magnetic circuits/filters for power electronic filter applications 
 EMC optimized design for power electronic systems including electromagnetic simulations 
 
 Qualifications The candidates must have a PhD in engineering or natural sciences. Commensurate with the seniority of the position applied for, we also expect: - An outstanding research and publication track record - Extensive experience with industrial collaboration - A solid record of teaching in the field of electrical engineering  - A solid knowledge of current EMC regulatory requirements 
 Appointment to the positions will be in accordance with the salary agreement between the Ministry of Finance and the Danish Confederation of Professional Associations. Assessment A panel will assess the qualification of the candidate for the described post based on the submitted material, which should include: 
 
 ideas for research and development activities 
 a Curriculum Vitae and statement of motivation 
 an account of significant contributions to the development of Electrical Engineering 
 an account of significant contributions to innovation in Industrial Electronics 
 an account of experience in education and outreach 
 relevant diplomas 
 a list of publications. 
 
 For information about the DME, which encompasses SDU Electrical Engineering please see  www.sdu.dk/dme  For specific information on section and centre, please visit  www.sdu.dk/cie . You are also welcome to contact the Head of the CIE, Professor Thomas Ebel, ebel@sdu.dk ,  +45 93 50 72 05 for further information. 
 Conditions of employment  Employment as an associate professor requires scientific qualifications at PhD level.  
 The successful applicant will be employed in accordance with the agreement between the Ministry of Finance and the Danish Confederation of Professional Associations. Please check links for more information on salary and taxation. 
 The assessment process Read about the Assessment and selection process. Shortlisting may be used.  Application procedure 
 The faculty expects applicants to read How to apply before applying.  
 The application deadline is 01.06.2022. The University wishes our staff to reflect the diversity of society and thus welcomes applications from all qualified candidates regardless of personal background. 
 Further information for international applicants about entering and working in Denmark. 
 Further information about The Faculty of Engineering.","https://www.google.dk/maps/place/Alsion+2,6400,+Sønderborg/",29283958,False,False,,False
