summary_AutomatchType,summary_Abroad,summary_Weight,summary_Title,summary_JobHeadline,summary_Presentation,summary_HiringOrgName,summary_WorkPlaceAddress,summary_WorkPlacePostalCode,summary_WorkPlaceCity,summary_WorkPlaceOtherAddress,summary_WorkPlaceAbroad,summary_WorkPlaceNotStatic,summary_UseWorkPlaceAddressForJoblog,summary_PostingCreated,summary_LastDateApplication,summary_FormattedLastDateApplication,summary_AssignmentStartDate,summary_IsHotjob,summary_IsExternal,summary_Url,summary_Region,summary_Municipality,summary_Country,summary_PostalCode,summary_PostalCodeName,summary_JobAnnouncementType,summary_EmploymentType,summary_WorkHours,summary_OccupationArea,summary_OccupationGroup,summary_Occupation,summary_Location_Latitude,summary_Location_Longitude,summary_JoblogWorkTime_WorkHour,summary_JoblogWorkTime_DailyWorkTime,summary_WorkplaceID,summary_OrganisationId,summary_HiringOrgCVR,summary_UserLoggedIn,summary_AnonymousEmployer,summary_ShareUrl,summary_DetailsUrl,summary_JobLogUrl,summary_HasLocationValues,summary_ID,summary_Latitude,summary_Longitude,details_WorkSchedule,details_WorkConditions,details_EmploymentTypes,details_WorkPlace_Name,details_WorkPlace_Address_AddressLine,details_WorkPlace_Address_Country_Id,details_WorkPlace_Address_Country_Name,details_WorkPlace_Address_Municipality_Id,details_WorkPlace_Address_Municipality_Name,details_WorkPlace_Address_Region_Id,details_WorkPlace_Address_Region_Name,details_WorkPlace_Address_PostalCode,details_WorkPlace_Address_City,details_WorkPlace_PhoneNumber_Number,details_WorkPlace_PhoneNumber_Type,details_WorkPlace_PhoneNumber_Description,details_WorkPlace_FaxNumber,details_WorkPlace_Email,details_WorkPlace_WebAddress,details_WorkPlace_Description,details_WorkPlace_Logo,details_WorkPlace_WorkPlaceOrganizationNumber,details_WorkPlace_OrganizationNumber,details_WorkPlace_OrganizationDescription,details_JobPositionPosting_Id,details_JobPositionPosting_OriginalJppId,details_JobPositionPosting_HiringOrg_Name,details_JobPositionPosting_HiringOrg_Address_AddressLine,details_JobPositionPosting_HiringOrg_Address_Country_Id,details_JobPositionPosting_HiringOrg_Address_Country_Name,details_JobPositionPosting_HiringOrg_Address_Municipality_Id,details_JobPositionPosting_HiringOrg_Address_Municipality_Name,details_JobPositionPosting_HiringOrg_Address_Region_Id,details_JobPositionPosting_HiringOrg_Address_Region_Name,details_JobPositionPosting_HiringOrg_Address_PostalCode,details_JobPositionPosting_HiringOrg_Address_City,details_JobPositionPosting_HiringOrg_PhoneNumber_Number,details_JobPositionPosting_HiringOrg_PhoneNumber_Type,details_JobPositionPosting_HiringOrg_PhoneNumber_Description,details_JobPositionPosting_HiringOrg_FaxNumber,details_JobPositionPosting_HiringOrg_Email,details_JobPositionPosting_HiringOrg_WebAddress,details_JobPositionPosting_HiringOrg_Description,details_JobPositionPosting_HiringOrg_Logo,details_JobPositionPosting_HiringOrg_WorkPlaceOrganizationNumber,details_JobPositionPosting_HiringOrg_OrganizationNumber,details_JobPositionPosting_HiringOrg_OrganizationDescription,details_JobPositionPosting_RecruitingCompany,details_JobPositionPosting_PublicationStartDate,details_JobPositionPosting_PublicationEndDate,details_JobPositionPosting_JobPositionInformation_PositionTitle,details_JobPositionPosting_JobPositionInformation_Purpose,details_JobPositionPosting_JobPositionInformation_WorkLocation_AddressLine,details_JobPositionPosting_JobPositionInformation_WorkLocation_Country_Id,details_JobPositionPosting_JobPositionInformation_WorkLocation_Country_Name,details_JobPositionPosting_JobPositionInformation_WorkLocation_Municipality_Id,details_JobPositionPosting_JobPositionInformation_WorkLocation_Municipality_Name,details_JobPositionPosting_JobPositionInformation_WorkLocation_Region_Id,details_JobPositionPosting_JobPositionInformation_WorkLocation_Region_Name,details_JobPositionPosting_JobPositionInformation_WorkLocation_PostalCode,details_JobPositionPosting_JobPositionInformation_WorkLocation_City,details_JobPositionPosting_JobPositionInformation_EmploymentType,details_JobPositionPosting_JobPositionInformation_WeeklyWorkHours_TypeId,details_JobPositionPosting_JobPositionInformation_WeeklyWorkHours_TypeName,details_JobPositionPosting_JobPositionInformation_WeeklyWorkHours_Description,details_JobPositionPosting_JobPositionInformation_CompensationDescription,details_JobPositionPosting_JobPositionInformation_NumberToFill,details_JobPositionPosting_JobPositionInformation_DriverLicense,details_JobPositionPosting_JobPositionInformation_Occupation_DiscoWeb,details_JobPositionPosting_JobPositionInformation_Occupation_AlternateNames,details_JobPositionPosting_JobPositionInformation_Occupation_GroupId,details_JobPositionPosting_JobPositionInformation_Occupation_AreaId,details_JobPositionPosting_JobPositionInformation_Occupation_Id,details_JobPositionPosting_JobPositionInformation_Occupation_Name,details_JobPositionPosting_JobPositionInformation_IsGovernmentHiring,details_JobPositionPosting_JobPositionInformation_JppContacts,details_JobPositionPosting_JobPositionInformation_EmploymentDate,details_JobPositionPosting_IsRecruitmentOfForeignNationals,details_JobPositionPosting_IsWorkInDenmark,details_JobPositionPosting_IsAnonymousEmployer,details_JobPositionPosting_IsDisabilityFriendly,details_JobPositionPosting_JppType,details_JobPositionPosting_ApplicationDetails_WorkHourMax,details_JobPositionPosting_ApplicationDetails_WorkHourMin,details_JobPositionPosting_ApplicationDetails_DailyWorkTimeWeekend,details_JobPositionPosting_ApplicationDetails_DailyWorkTimeNight,details_JobPositionPosting_ApplicationDetails_DailyWorkTimeEvening,details_JobPositionPosting_ApplicationDetails_DailyWorkTimeDay,details_JobPositionPosting_ApplicationDetails_ReferenceText,details_JobPositionPosting_ApplicationDetails_RemarksToApplicant,details_JobPositionPosting_ApplicationDetails_ByEmail,details_JobPositionPosting_ApplicationDetails_ByPhone,details_JobPositionPosting_ApplicationDetails_ApplyViaUrl,details_JobPositionPosting_ApplicationDetails_ReplyInWriting,details_JobPositionPosting_ApplicationDetails_ApplicationDeadlineDate,details_JobPositionPosting_ContactAuthorityPhoneNumber_Number,details_JobPositionPosting_ContactAuthorityPhoneNumber_Type,details_JobPositionPosting_ContactAuthorityPhoneNumber_Description,details_JobPositionPosting_Status,details_LogoUrl,details_Address,details_ShowMap,details_ShowShareButtonJobLog,details_JobLogUrl,details_JobLogTemplateModel_Identifier,details_JobLogTemplateModel_UseWorkPlaceAddressForJoblog,details_JobLogTemplateModel_Category,details_JobLogTemplateModel_CvCustomerIdentifier,details_JobLogTemplateModel_JobSeekingStatus,details_JobLogTemplateModel_Title,details_JobLogTemplateModel_IsApplicationSourceRequired,details_JobLogTemplateModel_ApplicationSource,details_JobLogTemplateModel_IsWeeklyWorkTimeRequired,details_JobLogTemplateModel_WeeklyWorkTime,details_JobLogTemplateModel_HoursPerWeek,details_JobLogTemplateModel_JobnetJobPostingIdentifier,details_JobLogTemplateModel_JobAdDocument_Title,details_JobLogTemplateModel_JobAdDocument_Identifier,details_JobLogTemplateModel_JobAdDocument_IsDeletedBySystem,details_JobLogTemplateModel_JobAdDocument_IsDeletedByUser,details_JobLogTemplateModel_JobAdFile,details_JobLogTemplateModel_Company_JobLogEntryCategory,details_JobLogTemplateModel_Company_ShowAddressFieldsEvenIfEmpty,details_JobLogTemplateModel_Company_Name,details_JobLogTemplateModel_Company_Address,details_JobLogTemplateModel_Company_Country,details_JobLogTemplateModel_Company_EmploymentAreaID,details_JobLogTemplateModel_Company_PostCode,details_JobLogTemplateModel_Company_IsCountryAndTownAndPostCodeEmpty,details_JobLogTemplateModel_Company_IsTownAndPostCodeEmpty,details_JobLogTemplateModel_Company_IsCountryDanmark,details_JobLogTemplateModel_Company_Town,details_JobLogTemplateModel_Company_ContactPerson,details_JobLogTemplateModel_Company_Phone,details_JobLogTemplateModel_Company_Email,details_JobLogTemplateModel_Company_Latitude,details_JobLogTemplateModel_Company_Longitude,details_JobLogTemplateModel_Company_DailyTravelTimeInMinutes,details_JobLogTemplateModel_Company_DistanceToCompanyInMeters,details_JobLogTemplateModel_Company_IsCreateMode,details_JobLogTemplateModel_TypeOfSubmission,details_JobLogTemplateModel_SubmissionDate,details_JobLogTemplateModel_SubmissionDateFormatted,details_JobLogTemplateModel_SubmissionDateTiks,details_JobLogTemplateModel_IsSubmissionDateRequired,details_JobLogTemplateModel_Status,details_JobLogTemplateModel_DateCreatedFormatted,details_JobLogTemplateModel_DateCreated,details_JobLogTemplateModel_DateModifiedFormatted,details_JobLogTemplateModel_DateModified,details_JobLogTemplateModel_LastModifiedDateTiks,details_JobLogTemplateModel_DateClosed,details_JobLogTemplateModel_JobApplicationDocument_Title,details_JobLogTemplateModel_JobApplicationDocument_Identifier,details_JobLogTemplateModel_JobApplicationDocument_IsDeletedBySystem,details_JobLogTemplateModel_JobApplicationDocument_IsDeletedByUser,details_JobLogTemplateModel_CvDocument_Title,details_JobLogTemplateModel_CvDocument_Identifier,details_JobLogTemplateModel_CvDocument_IsDeletedBySystem,details_JobLogTemplateModel_CvDocument_IsDeletedByUser,details_JobLogTemplateModel_JobApplicationFile,details_JobLogTemplateModel_CvFile,details_JobLogTemplateModel_SubmissionDeadlineDate,details_JobLogTemplateModel_IsPersisted,details_JobLogTemplateModel_ServerValidationErrors,details_JobLogTemplateModel_HasServerValidationErrors,details_JoblogWorkTime_WorkHour,details_JoblogWorkTime_DailyWorkTime,details_Place,details_OpenPrintDialog,details_WorkPlaceInfoText,details_JobCenterContactDetails,details_WorkPlaceDescriptionText,details_FavoriteText,details_IsFavorite,details_ShowFavorite,details_MetaOgTextForSharing,details_DescriptionForSharing,details_TitleForSharing,details_RutePlan,details_FormattedPurpose,details_MapUrl,details_OrganizationNumber,details_ShowSearchJobButton,details_ShowPrint,details_BackToFindWorkButtonUrl,isExternal
0,False,1,Systemate søger erfaren Solutions Architect til strategisk rolle,Systemate søger erfaren Solutions Architect til strategisk rolle,"Vær med til at sætte Systemates tekniske agenda

Søger du et dynamisk job med ansvar og indflydelse? Og nyder du at være bindeleddet mellem de tekniske og de kommercielle målsætnin",Systemate A/S,"Tangen 17, 2. sal",8200,Aarhus N,False,False,False,True,2022-04-07T00:00:00,2022-06-02T00:00:00,2. juni 2022,0001-01-01T00:00:00,False,False,https://job.jobnet.dk/CV/FindWork/Details/5572823,Midtjylland,Aarhus,Danmark,8200,,,,Fuldtid,It og teleteknik,"Systemudvikling, programmering og design",IT-arkitekt,56.1956,10.1769,,,136417,119510,25377699,False,False,https://job.jobnet.dk/CV/FindWork/DetailsSocialmedia/5572823,https://job.jobnet.dk/CV/FindWork/Details/5572823,https://job.jobnet.dk/CV/FindWork/Details/5572823,True,5572823,56.1956,10.1769,"{'Id': 1, 'Name': 'Fuldtid'}, {'Id': 16, 'Name': 'Deltid'}","{'Id': 1, 'Name': 'Almindelige vilkår'}, {'Id': 2, 'Name': 'Fleksjob'}, {'Id': 3, 'Name': 'Skånejob'}, {'Id': 4, 'Name': 'Egnet til efterlønnere og seniorer'}, {'Id': 5, 'Name': 'Job med løntilskud'}, {'Id': 6, 'Name': 'Rotationsjob'}, {'Id': 7, 'Name': 'Virksomhedspraktik'}","{'Id': 1, 'Name': 'Fastansættelse'}, {'Id': 16, 'Name': 'Tidsbegrænset ansættelse'}",Systemate A/S,"Tangen 17, 2. sal",58,Danmark,751,Aarhus,2,Midtjylland,8200,Aarhus N,,0,Primary,,,,None,,1007663648,25377699,None,5572823,5572823,Systemate A/S,"Tangen 17, 2. sal",58,Danmark,751,Aarhus,2,Midtjylland,8200,Aarhus N,,0,Primary,,,,None,,1007663648,25377699,None,,2022-04-07T00:00:00,2022-06-02T00:00:00,Systemate søger erfaren Solutions Architect til strategisk rolle,"Vær med til at sætte Systemates tekniske agenda 
 Søger du et dynamisk job med ansvar og indflydelse? Og nyder du at være bindeleddet mellem de tekniske og de kommercielle målsætninger? Hos Systemate søger vi lige nu en dygtig og erfaren Solutions Architect, der vil være med til at sætte den tekniske retning på Systemates nuværende – og fremtidige – softwareprojekter. 
 Jobbet 
 I rollen som Solutions Architect vil du komme til at sætte dit præg på en forskelligartet palette af projekter, både Systemates egne IP’er og især også de løsninger vi laver for vores kunder. I dagligdagen vil du arbejde på tværs af organisationen, hvor du både vil agere teknisk sparringspartner for ledelsen på både strategisk og taktisk niveau, samt arbejde tæt med projektledere, softwareudviklere og kunder. Med andre ord vil du være primus motor i forhold til at sætte agendaen hos Systemate og vores kunder. 
Du skal være komfortabel med at arbejde med løst definerede opgaver, samt at gøre dem mere konkrete gennem udarbejdelse af planer og forsimpling af de komplekse og tekniske beskrivelser. Rollen som Solutions Architect kræver samtidig, at du nyder at tage del i en tæt kundedialog, hvor fokus vil være at finde frem til den bedste løsning for kunden. Du forventes at være i stand til at skabe en tæt, tillidsfuld og langvarig kunderelation, så du let kan sætte dig ind i forretningsgange hos kunden og matche det op imod tekniske løsninger. Som Systemates nye Solutions Architect kræves der, at du er vant til at arbejde selvstændigt, men samtidig at du kan indgå i teams som personen, der sætter den tekniske – og den kommercielle – agenda. 
 Hvem er du? 
 Vi søger en fagligt stærk person, der har erfaring i rollen som Solutions Architect på store og komplekse softwareprojekter. Vi forestiller os, at du har erfaring med tilbudsarbejde, samt er vant til at skulle bidrage på flere projekter samtidig og dermed holde det overordnede overblik. Du har desuden en stærk kommerciel forretningsforståelse og er hurtig til at sætte dig ind i kundernes arbejdsgange og behov. Vi forestiller følgende: 
   
 
 Du har en relevant uddannelse, enten på bachelor- eller kandidatniveau. Evt. i datalogi, ingeniør, ITKO eller lignende 
 Du er udadvendt og bliver ikke slået ud af at skulle stå på forreste række i et salgspitch 
 Du er procesorienteret og analytisk stærk og kan dermed hurtigt gennemskue faldgruber og risici i et givet projekt 
 Du har solid erfaring med Microsoft teknologier (C#, .NET og Azure - sidstnævnte er en klar fordel, men ikke et krav) 
 Du taler og skriver dansk og engelsk på højt niveau 
 
 
 Vi lytter til dine ønsker 
 Ud over at tilbyde dig et job med: 
 
 Stor grad af frihed 
 Faglige kompetente kollegaer 
 Mulighed for at levere et godt stykke arbejde 
 
 Så ved vi også godt, at ingen personer er ens! 
 Dette imødekommer vi fx ved at være meget åbne overfor dit valg af udstyr. Vi tør ikke helt at sige, at du har frit valg, men det er tæt på, så har du konkrete ønsker til PC, skærm, tastatur, headset osv., så sig endelig til. 
 Hvad tilbyder Systemate? 
 Du bliver en del af et dynamisk miljø og en organisationsstruktur, der desuden er åben og uformel. Det betyder i praksis, at også du er med til at afgøre, hvordan Systemate skal se ud i morgen. 
 Vi tilbyder en fast løn- og pensionspakke med sundhedsforsikring, overtidsbetaling, lækker frokostordning i personalerestauranten, frisk frugt, nødder og snacks, frisklavede smoothies, frie læskedrikke, fri kaffe/the, en fyldt slikskuffe, rabat på briller og solbriller og en aktiv personaleforening, der arrangerer alt fra brætspil, LAN party, firmafester/rejser og andre sociale aktiviteter. 
 Hjemmearbejde 
 Hjemmearbejde er kommet for at blive. 
 Hos Systemate elsker vi at møde hinanden på vores flotte kontor for at vidensdele, men nogle opgaver er bedre at tage hjemmefra. 
 Vi er fleksible mht. hjemmearbejde, med ”frihed under ansvar”, hvor man lige sikrer sig, at det også fungerer for sit team og sine kollegaer. 
 Softwareløsninger til Danmarks grønne omstilling 
 Hos Systemate er vi stolte af at have en finger med i spillet, når det drejer sig om at skabe de softwareløsninger, der skal føre Danmark sikkert over målstregen i 2030. Hver dag arbejder vi tæt sammen med vores kunder i bestræbelsen på at skabe fremtidssikrede løsninger til forsyningssektoren. 
 Vi udvikler bl.a. software, der sikrer den balance i elnettet, der i høj grad besværliggøres af de flygtige grønne energikilder. Vi udvikler desuden systemer til prissætning og afregning af elkunder, markedskommunikation på elmarkedet, samt de systemer, der skal håndtere og visualisere de enorme mængder eldata, der vil danne vidensfundamentet for omstillingen til 100% grøn energi. 
 Dagligdagen i Systemate 
 Systemate er et aarhusiansk softwarehus, der har eksisteret i over 20 år. Hos os er der rig mulighed for, at du kan dyrke din faglighed og samtidig blive udfordret på daglig basis. Vi er nemlig en samlet flok på mere end 70 passionerede it- og softwareudviklingsentusiaster, der ikke kunne drømme om at springe over, hvor gærdet er lavest. Og dette holder vi hinanden oppe på. 
 Vi går ind for det gode, gedigne håndværk, og fordybelse i koden prioriteres højt. Når du møder os, vil du opleve en samling åbne og glade mennesker, der aldrig er for fine til et godt grin og en god portion selvironi. 
 Er du blevet nysgerrig? 
 Hvis vi har vakt din interesse på den ene eller den anden måde, vil vi meget gerne høre fra dig. Det gælder, uanset om det er i form af en traditionel ansøgning eller et uformelt opkald. 
 Du skal være velkommen til at give Jan Højgaard Rasmussen et kald på tlf.: 4248 8484 eller sende ham en mail på  jhr@systemate.dk . Han har altid tid til en uforpligtende snak. 
 Du kan også møde ham på  LinkedIn. 
 Ansøgning 
 Du ansøger nemt og uden at skulle bruge meget tid på den traditionelle ansøgning. 
 Du søger stillingen online og vi behandler naturligvis dine informationer i fortrolighed. 
 Vi ønsker at finde den rette kandidat hurtigst muligt, så vi tager ansøgere ind til samtale løbende. 
 Du ansøger nederst på siden. 
 Bliv en del af den grønne omstilling 
 I Danmark har vi store planer for den grønne omstilling. Det betyder, at vi hele tiden spekulerer i, hvordan vi skal komme sikkert og effektivt i mål. Et af de områder, der i øjeblikket udvikler sig med lysets hast, er området for grøn energi. Her går spørgsmålet på, hvordan vi bedst muligt udnytter jordens vedvarende energikilder, nemlig vind-, sol- og vand energi. Danmark er ambitiøse. 
 Faktisk så ambitiøse, at vi har givet os selv en skarp deadline. Danmark kræver nemlig intet mindre end en 70% reduktion i udledningen af drivhusgasser i 2030 sammenlignet med 1990. Foreløbigt har vi opnået de 40% siden 1990. Så selvom vi allerede er godt på vej, har vi alligevel enormt travlt! 
 Verdensmål 
 IT og data er afgørende for at nå klimamålene og Systemate er med til at udvikle løsninger der accelererer den grønne omstilling, og vi bidrager til disse 5 verdensmål. 
 Det er da endnu en god grund til at være stolt af det, vi laver!","Tangen 17, 2. sal",58,Danmark,751,Aarhus,2,Midtjylland,8200,Aarhus N,1,1,Fuldtid,None,None,1,,0,,0,0,0,,False,"{'Id': 7891238, 'Email': None, 'FaxNumber': None, 'PersonName': 'Jan Rasmussen', 'FirstName': 'Jan', 'LastName': 'Rasmussen', 'PositionTitle': None, 'PhoneNumbers': [{'Number': '42 48 84 84', 'Type': 0, 'Description': 'Hovednummer'}]}",,False,False,False,False,4,,,False,False,False,False,,,,,https://systemateas.hr-on.com/show-job/95066,False,2022-06-02T00:00:00,,0,Primary,7,/CV/FindWork/GetLogo?JobAdId=5572823&Organisation=25377699,"Tangen 17, 2. sal,8200, Aarhus N",True,False,/CV/Jobseeking/JobLog/CreateJobSearch?JobnetJobPostingIdentifier=5572823&Company.Name=Systemate A/S&SubmissionDeadlineDate=2022-6-2&Title=Systemate søger erfaren Solutions Architect til strategisk rolle&WeeklyWorkTime=1,00000000-0000-0000-0000-000000000000,False,0,,,Systemate søger erfaren Solutions Architect til strategisk rolle,True,,True,1,,5572823,,,False,False,,0,False,Systemate A/S,"Tangen 17, 2. sal",,,8200,False,False,False,Aarhus N,Jan Rasmussen,42 48 84 84,,,,,,False,,2022-06-02T00:00:00,,0,False,0,,,,,0,,,,False,False,,,False,False,,,,False,,False,,,Arbejdspladsen ligger i Aarhus kommune,False,Systemate A/S,,None,,False,False,"V&aelig;r med til at s&aelig;tte Systemates tekniske agenda

S&oslash;ger du et dynamisk job med ansvar og indflydelse? Og nyder du at v&aelig;re bindeleddet mellem de tekniske og de kommercielle m&aring;ls&aelig;tninger? Hos Systemate s&oslash;ger vi lige nu en dygtig og erfaren Solutions Architect, der vil v&aelig;re med til at s&aelig;tte den ","""V\u0026aelig;r med til at s\u0026aelig;tte Systemates tekniske agenda\r\n\r\nS\u0026oslash;ger du et dynamisk job med ansvar og indflydelse? Og nyder du at v\u0026aelig;re bindeleddet mellem de tekniske og de kommercielle m\u0026aring;ls\u0026aelig;tninger? Hos Systemate s\u0026oslash;ger vi lige nu en dygtig og erfaren Solutions Architect, der vil v\u0026aelig;re med til at s\u0026aelig;tte den ""","""Systemate søger erfaren Solutions Architect til strategisk rolle""","https://www.google.dk/maps/dir//Tangen+17,+2.+sal,8200,+Aarhus+N/","Vær med til at sætte Systemates tekniske agenda 
 Søger du et dynamisk job med ansvar og indflydelse? Og nyder du at være bindeleddet mellem de tekniske og de kommercielle målsætninger? Hos Systemate søger vi lige nu en dygtig og erfaren Solutions Architect, der vil være med til at sætte den tekniske retning på Systemates nuværende – og fremtidige – softwareprojekter. 
 Jobbet 
 I rollen som Solutions Architect vil du komme til at sætte dit præg på en forskelligartet palette af projekter, både Systemates egne IP’er og især også de løsninger vi laver for vores kunder. I dagligdagen vil du arbejde på tværs af organisationen, hvor du både vil agere teknisk sparringspartner for ledelsen på både strategisk og taktisk niveau, samt arbejde tæt med projektledere, softwareudviklere og kunder. Med andre ord vil du være primus motor i forhold til at sætte agendaen hos Systemate og vores kunder. 
Du skal være komfortabel med at arbejde med løst definerede opgaver, samt at gøre dem mere konkrete gennem udarbejdelse af planer og forsimpling af de komplekse og tekniske beskrivelser. Rollen som Solutions Architect kræver samtidig, at du nyder at tage del i en tæt kundedialog, hvor fokus vil være at finde frem til den bedste løsning for kunden. Du forventes at være i stand til at skabe en tæt, tillidsfuld og langvarig kunderelation, så du let kan sætte dig ind i forretningsgange hos kunden og matche det op imod tekniske løsninger. Som Systemates nye Solutions Architect kræves der, at du er vant til at arbejde selvstændigt, men samtidig at du kan indgå i teams som personen, der sætter den tekniske – og den kommercielle – agenda. 
 Hvem er du? 
 Vi søger en fagligt stærk person, der har erfaring i rollen som Solutions Architect på store og komplekse softwareprojekter. Vi forestiller os, at du har erfaring med tilbudsarbejde, samt er vant til at skulle bidrage på flere projekter samtidig og dermed holde det overordnede overblik. Du har desuden en stærk kommerciel forretningsforståelse og er hurtig til at sætte dig ind i kundernes arbejdsgange og behov. Vi forestiller følgende: 
   
 
 Du har en relevant uddannelse, enten på bachelor- eller kandidatniveau. Evt. i datalogi, ingeniør, ITKO eller lignende 
 Du er udadvendt og bliver ikke slået ud af at skulle stå på forreste række i et salgspitch 
 Du er procesorienteret og analytisk stærk og kan dermed hurtigt gennemskue faldgruber og risici i et givet projekt 
 Du har solid erfaring med Microsoft teknologier (C#, .NET og Azure - sidstnævnte er en klar fordel, men ikke et krav) 
 Du taler og skriver dansk og engelsk på højt niveau 
 
 
 Vi lytter til dine ønsker 
 Ud over at tilbyde dig et job med: 
 
 Stor grad af frihed 
 Faglige kompetente kollegaer 
 Mulighed for at levere et godt stykke arbejde 
 
 Så ved vi også godt, at ingen personer er ens! 
 Dette imødekommer vi fx ved at være meget åbne overfor dit valg af udstyr. Vi tør ikke helt at sige, at du har frit valg, men det er tæt på, så har du konkrete ønsker til PC, skærm, tastatur, headset osv., så sig endelig til. 
 Hvad tilbyder Systemate? 
 Du bliver en del af et dynamisk miljø og en organisationsstruktur, der desuden er åben og uformel. Det betyder i praksis, at også du er med til at afgøre, hvordan Systemate skal se ud i morgen. 
 Vi tilbyder en fast løn- og pensionspakke med sundhedsforsikring, overtidsbetaling, lækker frokostordning i personalerestauranten, frisk frugt, nødder og snacks, frisklavede smoothies, frie læskedrikke, fri kaffe/the, en fyldt slikskuffe, rabat på briller og solbriller og en aktiv personaleforening, der arrangerer alt fra brætspil, LAN party, firmafester/rejser og andre sociale aktiviteter. 
 Hjemmearbejde 
 Hjemmearbejde er kommet for at blive. 
 Hos Systemate elsker vi at møde hinanden på vores flotte kontor for at vidensdele, men nogle opgaver er bedre at tage hjemmefra. 
 Vi er fleksible mht. hjemmearbejde, med ”frihed under ansvar”, hvor man lige sikrer sig, at det også fungerer for sit team og sine kollegaer. 
 Softwareløsninger til Danmarks grønne omstilling 
 Hos Systemate er vi stolte af at have en finger med i spillet, når det drejer sig om at skabe de softwareløsninger, der skal føre Danmark sikkert over målstregen i 2030. Hver dag arbejder vi tæt sammen med vores kunder i bestræbelsen på at skabe fremtidssikrede løsninger til forsyningssektoren. 
 Vi udvikler bl.a. software, der sikrer den balance i elnettet, der i høj grad besværliggøres af de flygtige grønne energikilder. Vi udvikler desuden systemer til prissætning og afregning af elkunder, markedskommunikation på elmarkedet, samt de systemer, der skal håndtere og visualisere de enorme mængder eldata, der vil danne vidensfundamentet for omstillingen til 100% grøn energi. 
 Dagligdagen i Systemate 
 Systemate er et aarhusiansk softwarehus, der har eksisteret i over 20 år. Hos os er der rig mulighed for, at du kan dyrke din faglighed og samtidig blive udfordret på daglig basis. Vi er nemlig en samlet flok på mere end 70 passionerede it- og softwareudviklingsentusiaster, der ikke kunne drømme om at springe over, hvor gærdet er lavest. Og dette holder vi hinanden oppe på. 
 Vi går ind for det gode, gedigne håndværk, og fordybelse i koden prioriteres højt. Når du møder os, vil du opleve en samling åbne og glade mennesker, der aldrig er for fine til et godt grin og en god portion selvironi. 
 Er du blevet nysgerrig? 
 Hvis vi har vakt din interesse på den ene eller den anden måde, vil vi meget gerne høre fra dig. Det gælder, uanset om det er i form af en traditionel ansøgning eller et uformelt opkald. 
 Du skal være velkommen til at give Jan Højgaard Rasmussen et kald på tlf.: 4248 8484 eller sende ham en mail på  jhr@systemate.dk . Han har altid tid til en uforpligtende snak. 
 Du kan også møde ham på  LinkedIn. 
 Ansøgning 
 Du ansøger nemt og uden at skulle bruge meget tid på den traditionelle ansøgning. 
 Du søger stillingen online og vi behandler naturligvis dine informationer i fortrolighed. 
 Vi ønsker at finde den rette kandidat hurtigst muligt, så vi tager ansøgere ind til samtale løbende. 
 Du ansøger nederst på siden. 
 Bliv en del af den grønne omstilling 
 I Danmark har vi store planer for den grønne omstilling. Det betyder, at vi hele tiden spekulerer i, hvordan vi skal komme sikkert og effektivt i mål. Et af de områder, der i øjeblikket udvikler sig med lysets hast, er området for grøn energi. Her går spørgsmålet på, hvordan vi bedst muligt udnytter jordens vedvarende energikilder, nemlig vind-, sol- og vand energi. Danmark er ambitiøse. 
 Faktisk så ambitiøse, at vi har givet os selv en skarp deadline. Danmark kræver nemlig intet mindre end en 70% reduktion i udledningen af drivhusgasser i 2030 sammenlignet med 1990. Foreløbigt har vi opnået de 40% siden 1990. Så selvom vi allerede er godt på vej, har vi alligevel enormt travlt! 
 Verdensmål 
 IT og data er afgørende for at nå klimamålene og Systemate er med til at udvikle løsninger der accelererer den grønne omstilling, og vi bidrager til disse 5 verdensmål. 
 Det er da endnu en god grund til at være stolt af det, vi laver!","https://www.google.dk/maps/place/Tangen+17,+2.+sal,8200,+Aarhus+N/",25377699,False,False,,False
