summary_AutomatchType,summary_Abroad,summary_Weight,summary_Title,summary_JobHeadline,summary_Presentation,summary_HiringOrgName,summary_WorkPlaceAddress,summary_WorkPlacePostalCode,summary_WorkPlaceCity,summary_WorkPlaceOtherAddress,summary_WorkPlaceAbroad,summary_WorkPlaceNotStatic,summary_UseWorkPlaceAddressForJoblog,summary_PostingCreated,summary_LastDateApplication,summary_FormattedLastDateApplication,summary_AssignmentStartDate,summary_IsHotjob,summary_IsExternal,summary_Url,summary_Region,summary_Municipality,summary_Country,summary_PostalCode,summary_PostalCodeName,summary_JobAnnouncementType,summary_EmploymentType,summary_WorkHours,summary_OccupationArea,summary_OccupationGroup,summary_Occupation,summary_Location_Latitude,summary_Location_Longitude,summary_JoblogWorkTime_WorkHour,summary_JoblogWorkTime_DailyWorkTime,summary_WorkplaceID,summary_OrganisationId,summary_HiringOrgCVR,summary_UserLoggedIn,summary_AnonymousEmployer,summary_ShareUrl,summary_DetailsUrl,summary_JobLogUrl,summary_HasLocationValues,summary_ID,summary_Latitude,summary_Longitude,details_WorkSchedule,details_WorkConditions,details_EmploymentTypes,details_WorkPlace_Name,details_WorkPlace_Address_AddressLine,details_WorkPlace_Address_Country_Id,details_WorkPlace_Address_Country_Name,details_WorkPlace_Address_Municipality_Id,details_WorkPlace_Address_Municipality_Name,details_WorkPlace_Address_Region_Id,details_WorkPlace_Address_Region_Name,details_WorkPlace_Address_PostalCode,details_WorkPlace_Address_City,details_WorkPlace_PhoneNumber_Number,details_WorkPlace_PhoneNumber_Type,details_WorkPlace_PhoneNumber_Description,details_WorkPlace_FaxNumber,details_WorkPlace_Email,details_WorkPlace_WebAddress,details_WorkPlace_Description,details_WorkPlace_Logo,details_WorkPlace_WorkPlaceOrganizationNumber,details_WorkPlace_OrganizationNumber,details_WorkPlace_OrganizationDescription,details_JobPositionPosting_Id,details_JobPositionPosting_OriginalJppId,details_JobPositionPosting_HiringOrg_Name,details_JobPositionPosting_HiringOrg_Address_AddressLine,details_JobPositionPosting_HiringOrg_Address_Country_Id,details_JobPositionPosting_HiringOrg_Address_Country_Name,details_JobPositionPosting_HiringOrg_Address_Municipality_Id,details_JobPositionPosting_HiringOrg_Address_Municipality_Name,details_JobPositionPosting_HiringOrg_Address_Region_Id,details_JobPositionPosting_HiringOrg_Address_Region_Name,details_JobPositionPosting_HiringOrg_Address_PostalCode,details_JobPositionPosting_HiringOrg_Address_City,details_JobPositionPosting_HiringOrg_PhoneNumber_Number,details_JobPositionPosting_HiringOrg_PhoneNumber_Type,details_JobPositionPosting_HiringOrg_PhoneNumber_Description,details_JobPositionPosting_HiringOrg_FaxNumber,details_JobPositionPosting_HiringOrg_Email,details_JobPositionPosting_HiringOrg_WebAddress,details_JobPositionPosting_HiringOrg_Description,details_JobPositionPosting_HiringOrg_Logo,details_JobPositionPosting_HiringOrg_WorkPlaceOrganizationNumber,details_JobPositionPosting_HiringOrg_OrganizationNumber,details_JobPositionPosting_HiringOrg_OrganizationDescription,details_JobPositionPosting_RecruitingCompany,details_JobPositionPosting_PublicationStartDate,details_JobPositionPosting_PublicationEndDate,details_JobPositionPosting_JobPositionInformation_PositionTitle,details_JobPositionPosting_JobPositionInformation_Purpose,details_JobPositionPosting_JobPositionInformation_WorkLocation_AddressLine,details_JobPositionPosting_JobPositionInformation_WorkLocation_Country_Id,details_JobPositionPosting_JobPositionInformation_WorkLocation_Country_Name,details_JobPositionPosting_JobPositionInformation_WorkLocation_Municipality_Id,details_JobPositionPosting_JobPositionInformation_WorkLocation_Municipality_Name,details_JobPositionPosting_JobPositionInformation_WorkLocation_Region_Id,details_JobPositionPosting_JobPositionInformation_WorkLocation_Region_Name,details_JobPositionPosting_JobPositionInformation_WorkLocation_PostalCode,details_JobPositionPosting_JobPositionInformation_WorkLocation_City,details_JobPositionPosting_JobPositionInformation_EmploymentType,details_JobPositionPosting_JobPositionInformation_WeeklyWorkHours_TypeId,details_JobPositionPosting_JobPositionInformation_WeeklyWorkHours_TypeName,details_JobPositionPosting_JobPositionInformation_WeeklyWorkHours_Description,details_JobPositionPosting_JobPositionInformation_CompensationDescription,details_JobPositionPosting_JobPositionInformation_NumberToFill,details_JobPositionPosting_JobPositionInformation_DriverLicense,details_JobPositionPosting_JobPositionInformation_Occupation_DiscoWeb,details_JobPositionPosting_JobPositionInformation_Occupation_AlternateNames,details_JobPositionPosting_JobPositionInformation_Occupation_GroupId,details_JobPositionPosting_JobPositionInformation_Occupation_AreaId,details_JobPositionPosting_JobPositionInformation_Occupation_Id,details_JobPositionPosting_JobPositionInformation_Occupation_Name,details_JobPositionPosting_JobPositionInformation_IsGovernmentHiring,details_JobPositionPosting_JobPositionInformation_JppContacts,details_JobPositionPosting_JobPositionInformation_EmploymentDate,details_JobPositionPosting_IsRecruitmentOfForeignNationals,details_JobPositionPosting_IsWorkInDenmark,details_JobPositionPosting_IsAnonymousEmployer,details_JobPositionPosting_IsDisabilityFriendly,details_JobPositionPosting_JppType,details_JobPositionPosting_ApplicationDetails_WorkHourMax,details_JobPositionPosting_ApplicationDetails_WorkHourMin,details_JobPositionPosting_ApplicationDetails_DailyWorkTimeWeekend,details_JobPositionPosting_ApplicationDetails_DailyWorkTimeNight,details_JobPositionPosting_ApplicationDetails_DailyWorkTimeEvening,details_JobPositionPosting_ApplicationDetails_DailyWorkTimeDay,details_JobPositionPosting_ApplicationDetails_ReferenceText,details_JobPositionPosting_ApplicationDetails_RemarksToApplicant,details_JobPositionPosting_ApplicationDetails_ByEmail,details_JobPositionPosting_ApplicationDetails_ByPhone,details_JobPositionPosting_ApplicationDetails_ApplyViaUrl,details_JobPositionPosting_ApplicationDetails_ReplyInWriting,details_JobPositionPosting_ApplicationDetails_ApplicationDeadlineDate,details_JobPositionPosting_ContactAuthorityPhoneNumber_Number,details_JobPositionPosting_ContactAuthorityPhoneNumber_Type,details_JobPositionPosting_ContactAuthorityPhoneNumber_Description,details_JobPositionPosting_Status,details_LogoUrl,details_Address,details_ShowMap,details_ShowShareButtonJobLog,details_JobLogUrl,details_JobLogTemplateModel_Identifier,details_JobLogTemplateModel_UseWorkPlaceAddressForJoblog,details_JobLogTemplateModel_Category,details_JobLogTemplateModel_CvCustomerIdentifier,details_JobLogTemplateModel_JobSeekingStatus,details_JobLogTemplateModel_Title,details_JobLogTemplateModel_IsApplicationSourceRequired,details_JobLogTemplateModel_ApplicationSource,details_JobLogTemplateModel_IsWeeklyWorkTimeRequired,details_JobLogTemplateModel_WeeklyWorkTime,details_JobLogTemplateModel_HoursPerWeek,details_JobLogTemplateModel_JobnetJobPostingIdentifier,details_JobLogTemplateModel_JobAdDocument_Title,details_JobLogTemplateModel_JobAdDocument_Identifier,details_JobLogTemplateModel_JobAdDocument_IsDeletedBySystem,details_JobLogTemplateModel_JobAdDocument_IsDeletedByUser,details_JobLogTemplateModel_JobAdFile,details_JobLogTemplateModel_Company_JobLogEntryCategory,details_JobLogTemplateModel_Company_ShowAddressFieldsEvenIfEmpty,details_JobLogTemplateModel_Company_Name,details_JobLogTemplateModel_Company_Address,details_JobLogTemplateModel_Company_Country,details_JobLogTemplateModel_Company_EmploymentAreaID,details_JobLogTemplateModel_Company_PostCode,details_JobLogTemplateModel_Company_IsCountryAndTownAndPostCodeEmpty,details_JobLogTemplateModel_Company_IsTownAndPostCodeEmpty,details_JobLogTemplateModel_Company_IsCountryDanmark,details_JobLogTemplateModel_Company_Town,details_JobLogTemplateModel_Company_ContactPerson,details_JobLogTemplateModel_Company_Phone,details_JobLogTemplateModel_Company_Email,details_JobLogTemplateModel_Company_Latitude,details_JobLogTemplateModel_Company_Longitude,details_JobLogTemplateModel_Company_DailyTravelTimeInMinutes,details_JobLogTemplateModel_Company_DistanceToCompanyInMeters,details_JobLogTemplateModel_Company_IsCreateMode,details_JobLogTemplateModel_TypeOfSubmission,details_JobLogTemplateModel_SubmissionDate,details_JobLogTemplateModel_SubmissionDateFormatted,details_JobLogTemplateModel_SubmissionDateTiks,details_JobLogTemplateModel_IsSubmissionDateRequired,details_JobLogTemplateModel_Status,details_JobLogTemplateModel_DateCreatedFormatted,details_JobLogTemplateModel_DateCreated,details_JobLogTemplateModel_DateModifiedFormatted,details_JobLogTemplateModel_DateModified,details_JobLogTemplateModel_LastModifiedDateTiks,details_JobLogTemplateModel_DateClosed,details_JobLogTemplateModel_JobApplicationDocument_Title,details_JobLogTemplateModel_JobApplicationDocument_Identifier,details_JobLogTemplateModel_JobApplicationDocument_IsDeletedBySystem,details_JobLogTemplateModel_JobApplicationDocument_IsDeletedByUser,details_JobLogTemplateModel_CvDocument_Title,details_JobLogTemplateModel_CvDocument_Identifier,details_JobLogTemplateModel_CvDocument_IsDeletedBySystem,details_JobLogTemplateModel_CvDocument_IsDeletedByUser,details_JobLogTemplateModel_JobApplicationFile,details_JobLogTemplateModel_CvFile,details_JobLogTemplateModel_SubmissionDeadlineDate,details_JobLogTemplateModel_IsPersisted,details_JobLogTemplateModel_ServerValidationErrors,details_JobLogTemplateModel_HasServerValidationErrors,details_JoblogWorkTime_WorkHour,details_JoblogWorkTime_DailyWorkTime,details_Place,details_OpenPrintDialog,details_WorkPlaceInfoText,details_JobCenterContactDetails,details_WorkPlaceDescriptionText,details_FavoriteText,details_IsFavorite,details_ShowFavorite,details_MetaOgTextForSharing,details_DescriptionForSharing,details_TitleForSharing,details_RutePlan,details_FormattedPurpose,details_MapUrl,details_OrganizationNumber,details_ShowSearchJobButton,details_ShowPrint,details_BackToFindWorkButtonUrl,isExternal
0,False,1,Studentermedhjælper til lager og logistik,Studentermedhjælper til lager og logistik,[English job description below]  Vi søger en højt motiveret studentermedhjælper som vil løse praktiske opgaver i vores laboratorier og kontorer. Dette job vil give dig indbli,Dragonfly Therapeutics CPH ApS,Baltorpvej 154,2750,Ballerup,False,False,False,True,2022-05-04T00:00:00,2022-05-11T00:00:00,11. maj 2022,0001-01-01T00:00:00,False,False,https://job.jobnet.dk/CV/FindWork/Details/5572170,Hovedstaden og Bornholm,Ballerup,Danmark,2750,,,,Deltid,Akademisk arbejde,Administrativt arbejde,Studentermedhjælp,55.7295,12.3454,,,0,0,41557958,False,False,https://job.jobnet.dk/CV/FindWork/DetailsSocialmedia/5572170,https://job.jobnet.dk/CV/FindWork/Details/5572170,https://job.jobnet.dk/CV/FindWork/Details/5572170,True,5572170,55.7295,12.3454,"{'Id': 1, 'Name': 'Fuldtid'}, {'Id': 16, 'Name': 'Deltid'}","{'Id': 1, 'Name': 'Almindelige vilkår'}, {'Id': 2, 'Name': 'Fleksjob'}, {'Id': 3, 'Name': 'Skånejob'}, {'Id': 4, 'Name': 'Egnet til efterlønnere og seniorer'}, {'Id': 5, 'Name': 'Job med løntilskud'}, {'Id': 6, 'Name': 'Rotationsjob'}, {'Id': 7, 'Name': 'Virksomhedspraktik'}","{'Id': 1, 'Name': 'Fastansættelse'}, {'Id': 16, 'Name': 'Tidsbegrænset ansættelse'}",Dragonfly Therapeutics CPH ApS,Baltorpvej 154,58,Danmark,151,Ballerup,4,"Hovedstaden, Sjælland og Bornholm",2750,Ballerup,,0,Primary,,,,None,,1026086058,41557958,None,5572170,5572170,Dragonfly Therapeutics CPH ApS,Baltorpvej 154,58,Danmark,151,Ballerup,4,"Hovedstaden, Sjælland og Bornholm",2750,Ballerup,,0,Primary,,,,None,,1026086058,41557958,None,,2022-05-04T00:00:00,2022-05-11T00:00:00,Studentermedhjælper til lager og logistik,"[English job description below]     Vi søger en højt motiveret studentermedhjælper som vil løse praktiske opgaver i vores laboratorier og kontorer. Dette job vil give dig indblik i at drive et laboratorium og sørge for at det er operationsdygtigt.     Stillingen er på mindst 12 timer om ugen fordelt over 3-4 dage mellem kl 13.00-16:00     Dine opgaver:   En typisk arbejdsuge hos Dragonfly Therapeutics, vil se sådan ud:        Varetage og vedligeholde lageret med forbrugsvarer,   Skabe overblik og melde ind til Lab Manager når der skal bestilles varer   Fylde forbrugsvarer op i laboratorierne og kontorerne   Modtage og fordele pakker og post    Forskelligt forefalden arbejde til at støtte driften i laboratorierne        Kvalifikationer:     Studerende med interesse for kemi eller biologi   Du skal have gennemført et førstehjælpskursus   Du skal have et godt overblik og ordenssans, og evne til at have mange ""bolde i luften"" på en gang i et dynamisk miljø hvor vi skifter prioritet ofte   Du skal kunne tale og forstå både dansk og engelsk på højt niveau       Om Dragonfly   Grundlagt i 2015 af Dr. Tyler Jacks, leder af Koch Institute ved MIT, Dr. David Raulet, en af verdens førende eksperter i Natural Killer (NK) cellebiologi, og Bill Haney, en mangeårig Biotech-iværksætter og investor, Dragonfly Therapeutics blev lanceret for at udnytte immunsystemet til banebrydende behandling – især i områder, hvor der ikke findes effektive behandlinger i dag.   Virksomheden udvikler nye førsteklasses terapier designet til at udnytte naturlige dræberceller og andre celler i det medfødte immunsystem, som giver drab af sygdomsfremmende celletyper og give et unikt terapeutisk vindue ud over nuværende terapier til behandling af kræft og kronisk inflammatoriske sygdomme. Besøg venligst vores hjemmeside for detaljer.     Vi tilbyder:   Dragonfly TX er en spændende ung virksomhed, der tilbyder en fantastisk kultur og godt teamwork på tværs af Danmark og USA.   Vores medarbejdere er grundlæggende for vores succes, og vi er fortsat i stand til at tiltrække og fastholde mennesker med forskellig erfaring og baggrund. Vi har en højt ydende, samarbejdskultur præget af respektfulde og forskelligartede teams, der er forpligtet til vores patienters første mission.   Hos Dragonfly får du mulighed for at have indflydelse, arbejde med nogle af de dygtigste forskere i branchen, udvikle din professionelle karriere og bidrage til banebrydende medicin til patienter med akutte udækkede medicinske behov.     Din ansøgning   Send din ansøgning og CV hurtigst muligt til HR ved at benytte knappen ""Send ansøgning""    Vi screener og interviewer løbende til stillingen. For yderligere spørgsmål om stillingen, kontakt venligst Lab Manager Brian Rosenberg på mobil: +45 28114199           Student assistant for logistics and storage room   We are looking for a highly motivated and passionate student worker to assist and support the laboratories and the associated facility. In this job you will get to know how to prepare and facilitate a laboratory.     The position is for minimum 12 hours per week preferably 3-4 days during the work week between 13:00 to 16:00.     Responsibilities:   In a typical week at Dragonfly Therapeutics, you will:       Maintain a clean and organized storage space for Dragonfly   Provide regular inventory reports of lab consumables and office supplies to the lab manager   Stock lab and office supply shelves on a daily basis   Sort and distribute packages upon arrival   Provide general hands-on support to the laboratories        Qualifications:     Student with a chemical/or biological interest   You will be handling big boxes and there will be some lifting and carrying of 20+ kg. loads (not daily)   You have completed a first aid course   You have excellent overview and organizational skills, with the ability to multi-task in a fast-paced environment with changing priorities   You have excellent communication skills in both Danish and English       About Dragonfly   Founded in 2015 by Dr. Tyler Jacks, head of the Koch Institute at MIT, Dr. David Raulet, one of the world's leading experts in Natural Killer (NK) cell biology, and Bill Haney, a longtime tech entrepreneur and investor, Dragonfly Therapeutics was launched to harness the power of the immune system to provide breakthrough treatments for patients – especially in areas where there are no effective treatments, today.     The company develops novel first-in-class therapeutics designed to harness Natural Killer cells and other cells of the innate immune system which can provide direct killing of disease promoting cell types and provide a unique therapeutic window beyond current therapies for treatment of cancer and chronic inflammatory diseases. Please visit our website for details.     We offer:   Dragonfly TX is an exciting young company that offers a fantastic culture and great teamwork across Denmark and US.   Our employees are fundamental to our success, and we continue to be able to attract and retain people with different experiences and backgrounds. We have a high-performing, collaborative culture characterized by respectful and diverse teams who are committed to our patients-first mission.   At Dragonfly, you will have the opportunity to have impact, work with some of the brightest minds in the industry, develop your professional career, and contribute to breakthrough medicines for patients with urgent unmet medical needs.     Your application   Please apply by sending a cover letter and resume as soon as possible – use the link ""Send ansøgning""     We are screening and interviewing for the position on an ongoing basis. For any further questions about the position, please contact Lab Manager Brian Rosenberg on Mobile: +45 28114199       For more info, check out our career site  https://dragonflytx.ofir.com   
 Denne jobannonce blev oprindeligt opslået på https://www.ofir.dk/
 (Den originale annonce kan ses på: https://www.ofir.dk/showojob?ofirid=215d5f6c)",Baltorpvej 154,58,Danmark,151,Ballerup,4,"Hovedstaden, Sjælland og Bornholm",2750,Ballerup,1,16,Deltid,None,None,1,,0,,0,0,0,,False,"{'Id': 7960622, 'Email': None, 'FaxNumber': None, 'PersonName': 'Marianne Kobberø', 'FirstName': 'Marianne', 'LastName': 'Kobberø', 'PositionTitle': None, 'PhoneNumbers': [{'Number': '40826146', 'Type': 0, 'Description': 'Hovednummer'}]}",,False,False,False,False,4,,,False,False,False,False,,,,,https://www.ofir.dk/resultat/Jobannonce.aspx?ofirId=215d5f6c&action=sendApplicationUrl,False,2022-05-11T00:00:00,,0,Primary,7,/CV/FindWork/GetLogo?JobAdId=5572170&Organisation=41557958,"Baltorpvej 154,2750, Ballerup",True,False,/CV/Jobseeking/JobLog/CreateJobSearch?JobnetJobPostingIdentifier=5572170&Company.Name=Dragonfly Therapeutics CPH ApS&SubmissionDeadlineDate=2022-5-11&Title=Studentermedhjælper til lager og logistik&WeeklyWorkTime=2,00000000-0000-0000-0000-000000000000,False,0,,,Studentermedhjælper til lager og logistik,True,,True,2,,5572170,,,False,False,,0,False,Dragonfly Therapeutics CPH ApS,Baltorpvej 154,,,2750,False,False,False,Ballerup,Marianne Kobberø,40826146,,,,,,False,,2022-05-11T00:00:00,,0,False,0,,,,,0,,,,False,False,,,False,False,,,,False,,False,,,Arbejdspladsen ligger i Ballerup kommune,False,Dragonfly Therapeutics CPH ApS,,None,,False,False,[English job description below]  Vi søger en højt motiveret studentermedhjælper som vil løse praktiske opgaver i vores laboratorier og kontorer. Dette job vil give dig indblik i at drive et laboratorium og sørge for at det er operationsdygtigt.  Stillingen er på mindst 12 timer om ugen fordelt over 3-4 dage mellem kl 13.00-16:00  Dine opgaver: En t,"""[English job description below]  Vi søger en højt motiveret studentermedhjælper som vil løse praktiske opgaver i vores laboratorier og kontorer. Dette job vil give dig indblik i at drive et laboratorium og sørge for at det er operationsdygtigt.  Stillingen er på mindst 12 timer om ugen fordelt over 3-4 dage mellem kl 13.00-16:00  Dine opgaver: En t""","""Studentermedhjælper til lager og logistik""","https://www.google.dk/maps/dir//Baltorpvej+154,2750,+Ballerup/","[English job description below]     Vi søger en højt motiveret studentermedhjælper som vil løse praktiske opgaver i vores laboratorier og kontorer. Dette job vil give dig indblik i at drive et laboratorium og sørge for at det er operationsdygtigt.     Stillingen er på mindst 12 timer om ugen fordelt over 3-4 dage mellem kl 13.00-16:00     Dine opgaver:   En typisk arbejdsuge hos Dragonfly Therapeutics, vil se sådan ud:        Varetage og vedligeholde lageret med forbrugsvarer,   Skabe overblik og melde ind til Lab Manager når der skal bestilles varer   Fylde forbrugsvarer op i laboratorierne og kontorerne   Modtage og fordele pakker og post    Forskelligt forefalden arbejde til at støtte driften i laboratorierne        Kvalifikationer:     Studerende med interesse for kemi eller biologi   Du skal have gennemført et førstehjælpskursus   Du skal have et godt overblik og ordenssans, og evne til at have mange ""bolde i luften"" på en gang i et dynamisk miljø hvor vi skifter prioritet ofte   Du skal kunne tale og forstå både dansk og engelsk på højt niveau       Om Dragonfly   Grundlagt i 2015 af Dr. Tyler Jacks, leder af Koch Institute ved MIT, Dr. David Raulet, en af verdens førende eksperter i Natural Killer (NK) cellebiologi, og Bill Haney, en mangeårig Biotech-iværksætter og investor, Dragonfly Therapeutics blev lanceret for at udnytte immunsystemet til banebrydende behandling – især i områder, hvor der ikke findes effektive behandlinger i dag.   Virksomheden udvikler nye førsteklasses terapier designet til at udnytte naturlige dræberceller og andre celler i det medfødte immunsystem, som giver drab af sygdomsfremmende celletyper og give et unikt terapeutisk vindue ud over nuværende terapier til behandling af kræft og kronisk inflammatoriske sygdomme. Besøg venligst vores hjemmeside for detaljer.     Vi tilbyder:   Dragonfly TX er en spændende ung virksomhed, der tilbyder en fantastisk kultur og godt teamwork på tværs af Danmark og USA.   Vores medarbejdere er grundlæggende for vores succes, og vi er fortsat i stand til at tiltrække og fastholde mennesker med forskellig erfaring og baggrund. Vi har en højt ydende, samarbejdskultur præget af respektfulde og forskelligartede teams, der er forpligtet til vores patienters første mission.   Hos Dragonfly får du mulighed for at have indflydelse, arbejde med nogle af de dygtigste forskere i branchen, udvikle din professionelle karriere og bidrage til banebrydende medicin til patienter med akutte udækkede medicinske behov.     Din ansøgning   Send din ansøgning og CV hurtigst muligt til HR ved at benytte knappen ""Send ansøgning""    Vi screener og interviewer løbende til stillingen. For yderligere spørgsmål om stillingen, kontakt venligst Lab Manager Brian Rosenberg på mobil: +45 28114199           Student assistant for logistics and storage room   We are looking for a highly motivated and passionate student worker to assist and support the laboratories and the associated facility. In this job you will get to know how to prepare and facilitate a laboratory.     The position is for minimum 12 hours per week preferably 3-4 days during the work week between 13:00 to 16:00.     Responsibilities:   In a typical week at Dragonfly Therapeutics, you will:       Maintain a clean and organized storage space for Dragonfly   Provide regular inventory reports of lab consumables and office supplies to the lab manager   Stock lab and office supply shelves on a daily basis   Sort and distribute packages upon arrival   Provide general hands-on support to the laboratories        Qualifications:     Student with a chemical/or biological interest   You will be handling big boxes and there will be some lifting and carrying of 20+ kg. loads (not daily)   You have completed a first aid course   You have excellent overview and organizational skills, with the ability to multi-task in a fast-paced environment with changing priorities   You have excellent communication skills in both Danish and English       About Dragonfly   Founded in 2015 by Dr. Tyler Jacks, head of the Koch Institute at MIT, Dr. David Raulet, one of the world's leading experts in Natural Killer (NK) cell biology, and Bill Haney, a longtime tech entrepreneur and investor, Dragonfly Therapeutics was launched to harness the power of the immune system to provide breakthrough treatments for patients – especially in areas where there are no effective treatments, today.     The company develops novel first-in-class therapeutics designed to harness Natural Killer cells and other cells of the innate immune system which can provide direct killing of disease promoting cell types and provide a unique therapeutic window beyond current therapies for treatment of cancer and chronic inflammatory diseases. Please visit our website for details.     We offer:   Dragonfly TX is an exciting young company that offers a fantastic culture and great teamwork across Denmark and US.   Our employees are fundamental to our success, and we continue to be able to attract and retain people with different experiences and backgrounds. We have a high-performing, collaborative culture characterized by respectful and diverse teams who are committed to our patients-first mission.   At Dragonfly, you will have the opportunity to have impact, work with some of the brightest minds in the industry, develop your professional career, and contribute to breakthrough medicines for patients with urgent unmet medical needs.     Your application   Please apply by sending a cover letter and resume as soon as possible – use the link ""Send ansøgning""     We are screening and interviewing for the position on an ongoing basis. For any further questions about the position, please contact Lab Manager Brian Rosenberg on Mobile: +45 28114199       For more info, check out our career site  https://dragonflytx.ofir.com   
 Denne jobannonce blev oprindeligt opslået på  https://www.ofir.dk/ 
 (Den originale annonce kan ses på:  https://www.ofir.dk/showojob?ofirid=215d5f6c )","https://www.google.dk/maps/place/Baltorpvej+154,2750,+Ballerup/",41557958,False,False,,False
