summary_AutomatchType,summary_Abroad,summary_Weight,summary_Title,summary_JobHeadline,summary_Presentation,summary_HiringOrgName,summary_WorkPlaceAddress,summary_WorkPlacePostalCode,summary_WorkPlaceCity,summary_WorkPlaceOtherAddress,summary_WorkPlaceAbroad,summary_WorkPlaceNotStatic,summary_UseWorkPlaceAddressForJoblog,summary_PostingCreated,summary_LastDateApplication,summary_FormattedLastDateApplication,summary_AssignmentStartDate,summary_IsHotjob,summary_IsExternal,summary_Url,summary_Region,summary_Municipality,summary_Country,summary_PostalCode,summary_PostalCodeName,summary_JobAnnouncementType,summary_EmploymentType,summary_WorkHours,summary_OccupationArea,summary_OccupationGroup,summary_Occupation,summary_Location_Latitude,summary_Location_Longitude,summary_JoblogWorkTime_WorkHour,summary_JoblogWorkTime_DailyWorkTime,summary_WorkplaceID,summary_OrganisationId,summary_HiringOrgCVR,summary_UserLoggedIn,summary_AnonymousEmployer,summary_ShareUrl,summary_DetailsUrl,summary_JobLogUrl,summary_HasLocationValues,summary_ID,summary_Latitude,summary_Longitude,details_WorkSchedule,details_WorkConditions,details_EmploymentTypes,details_WorkPlace_Name,details_WorkPlace_Address_AddressLine,details_WorkPlace_Address_Country_Id,details_WorkPlace_Address_Country_Name,details_WorkPlace_Address_Municipality_Id,details_WorkPlace_Address_Municipality_Name,details_WorkPlace_Address_Region_Id,details_WorkPlace_Address_Region_Name,details_WorkPlace_Address_PostalCode,details_WorkPlace_Address_City,details_WorkPlace_PhoneNumber_Number,details_WorkPlace_PhoneNumber_Type,details_WorkPlace_PhoneNumber_Description,details_WorkPlace_FaxNumber,details_WorkPlace_Email,details_WorkPlace_WebAddress,details_WorkPlace_Description,details_WorkPlace_Logo,details_WorkPlace_WorkPlaceOrganizationNumber,details_WorkPlace_OrganizationNumber,details_WorkPlace_OrganizationDescription,details_JobPositionPosting_Id,details_JobPositionPosting_OriginalJppId,details_JobPositionPosting_HiringOrg_Name,details_JobPositionPosting_HiringOrg_Address_AddressLine,details_JobPositionPosting_HiringOrg_Address_Country_Id,details_JobPositionPosting_HiringOrg_Address_Country_Name,details_JobPositionPosting_HiringOrg_Address_Municipality_Id,details_JobPositionPosting_HiringOrg_Address_Municipality_Name,details_JobPositionPosting_HiringOrg_Address_Region_Id,details_JobPositionPosting_HiringOrg_Address_Region_Name,details_JobPositionPosting_HiringOrg_Address_PostalCode,details_JobPositionPosting_HiringOrg_Address_City,details_JobPositionPosting_HiringOrg_PhoneNumber_Number,details_JobPositionPosting_HiringOrg_PhoneNumber_Type,details_JobPositionPosting_HiringOrg_PhoneNumber_Description,details_JobPositionPosting_HiringOrg_FaxNumber,details_JobPositionPosting_HiringOrg_Email,details_JobPositionPosting_HiringOrg_WebAddress,details_JobPositionPosting_HiringOrg_Description,details_JobPositionPosting_HiringOrg_Logo,details_JobPositionPosting_HiringOrg_WorkPlaceOrganizationNumber,details_JobPositionPosting_HiringOrg_OrganizationNumber,details_JobPositionPosting_HiringOrg_OrganizationDescription,details_JobPositionPosting_RecruitingCompany,details_JobPositionPosting_PublicationStartDate,details_JobPositionPosting_PublicationEndDate,details_JobPositionPosting_JobPositionInformation_PositionTitle,details_JobPositionPosting_JobPositionInformation_Purpose,details_JobPositionPosting_JobPositionInformation_WorkLocation_AddressLine,details_JobPositionPosting_JobPositionInformation_WorkLocation_Country_Id,details_JobPositionPosting_JobPositionInformation_WorkLocation_Country_Name,details_JobPositionPosting_JobPositionInformation_WorkLocation_Municipality_Id,details_JobPositionPosting_JobPositionInformation_WorkLocation_Municipality_Name,details_JobPositionPosting_JobPositionInformation_WorkLocation_Region_Id,details_JobPositionPosting_JobPositionInformation_WorkLocation_Region_Name,details_JobPositionPosting_JobPositionInformation_WorkLocation_PostalCode,details_JobPositionPosting_JobPositionInformation_WorkLocation_City,details_JobPositionPosting_JobPositionInformation_EmploymentType,details_JobPositionPosting_JobPositionInformation_WeeklyWorkHours_TypeId,details_JobPositionPosting_JobPositionInformation_WeeklyWorkHours_TypeName,details_JobPositionPosting_JobPositionInformation_WeeklyWorkHours_Description,details_JobPositionPosting_JobPositionInformation_CompensationDescription,details_JobPositionPosting_JobPositionInformation_NumberToFill,details_JobPositionPosting_JobPositionInformation_DriverLicense,details_JobPositionPosting_JobPositionInformation_Occupation_DiscoWeb,details_JobPositionPosting_JobPositionInformation_Occupation_AlternateNames,details_JobPositionPosting_JobPositionInformation_Occupation_GroupId,details_JobPositionPosting_JobPositionInformation_Occupation_AreaId,details_JobPositionPosting_JobPositionInformation_Occupation_Id,details_JobPositionPosting_JobPositionInformation_Occupation_Name,details_JobPositionPosting_JobPositionInformation_IsGovernmentHiring,details_JobPositionPosting_JobPositionInformation_JppContacts,details_JobPositionPosting_JobPositionInformation_EmploymentDate,details_JobPositionPosting_IsRecruitmentOfForeignNationals,details_JobPositionPosting_IsWorkInDenmark,details_JobPositionPosting_IsAnonymousEmployer,details_JobPositionPosting_IsDisabilityFriendly,details_JobPositionPosting_JppType,details_JobPositionPosting_ApplicationDetails_WorkHourMax,details_JobPositionPosting_ApplicationDetails_WorkHourMin,details_JobPositionPosting_ApplicationDetails_DailyWorkTimeWeekend,details_JobPositionPosting_ApplicationDetails_DailyWorkTimeNight,details_JobPositionPosting_ApplicationDetails_DailyWorkTimeEvening,details_JobPositionPosting_ApplicationDetails_DailyWorkTimeDay,details_JobPositionPosting_ApplicationDetails_ReferenceText,details_JobPositionPosting_ApplicationDetails_RemarksToApplicant,details_JobPositionPosting_ApplicationDetails_ByEmail,details_JobPositionPosting_ApplicationDetails_ByPhone,details_JobPositionPosting_ApplicationDetails_ApplyViaUrl,details_JobPositionPosting_ApplicationDetails_ReplyInWriting,details_JobPositionPosting_ApplicationDetails_ApplicationDeadlineDate,details_JobPositionPosting_ContactAuthorityPhoneNumber_Number,details_JobPositionPosting_ContactAuthorityPhoneNumber_Type,details_JobPositionPosting_ContactAuthorityPhoneNumber_Description,details_JobPositionPosting_Status,details_LogoUrl,details_Address,details_ShowMap,details_ShowShareButtonJobLog,details_JobLogUrl,details_JobLogTemplateModel_Identifier,details_JobLogTemplateModel_UseWorkPlaceAddressForJoblog,details_JobLogTemplateModel_Category,details_JobLogTemplateModel_CvCustomerIdentifier,details_JobLogTemplateModel_JobSeekingStatus,details_JobLogTemplateModel_Title,details_JobLogTemplateModel_IsApplicationSourceRequired,details_JobLogTemplateModel_ApplicationSource,details_JobLogTemplateModel_IsWeeklyWorkTimeRequired,details_JobLogTemplateModel_WeeklyWorkTime,details_JobLogTemplateModel_HoursPerWeek,details_JobLogTemplateModel_JobnetJobPostingIdentifier,details_JobLogTemplateModel_JobAdDocument_Title,details_JobLogTemplateModel_JobAdDocument_Identifier,details_JobLogTemplateModel_JobAdDocument_IsDeletedBySystem,details_JobLogTemplateModel_JobAdDocument_IsDeletedByUser,details_JobLogTemplateModel_JobAdFile,details_JobLogTemplateModel_Company_JobLogEntryCategory,details_JobLogTemplateModel_Company_ShowAddressFieldsEvenIfEmpty,details_JobLogTemplateModel_Company_Name,details_JobLogTemplateModel_Company_Address,details_JobLogTemplateModel_Company_Country,details_JobLogTemplateModel_Company_EmploymentAreaID,details_JobLogTemplateModel_Company_PostCode,details_JobLogTemplateModel_Company_IsCountryAndTownAndPostCodeEmpty,details_JobLogTemplateModel_Company_IsTownAndPostCodeEmpty,details_JobLogTemplateModel_Company_IsCountryDanmark,details_JobLogTemplateModel_Company_Town,details_JobLogTemplateModel_Company_ContactPerson,details_JobLogTemplateModel_Company_Phone,details_JobLogTemplateModel_Company_Email,details_JobLogTemplateModel_Company_Latitude,details_JobLogTemplateModel_Company_Longitude,details_JobLogTemplateModel_Company_DailyTravelTimeInMinutes,details_JobLogTemplateModel_Company_DistanceToCompanyInMeters,details_JobLogTemplateModel_Company_IsCreateMode,details_JobLogTemplateModel_TypeOfSubmission,details_JobLogTemplateModel_SubmissionDate,details_JobLogTemplateModel_SubmissionDateFormatted,details_JobLogTemplateModel_SubmissionDateTiks,details_JobLogTemplateModel_IsSubmissionDateRequired,details_JobLogTemplateModel_Status,details_JobLogTemplateModel_DateCreatedFormatted,details_JobLogTemplateModel_DateCreated,details_JobLogTemplateModel_DateModifiedFormatted,details_JobLogTemplateModel_DateModified,details_JobLogTemplateModel_LastModifiedDateTiks,details_JobLogTemplateModel_DateClosed,details_JobLogTemplateModel_JobApplicationDocument_Title,details_JobLogTemplateModel_JobApplicationDocument_Identifier,details_JobLogTemplateModel_JobApplicationDocument_IsDeletedBySystem,details_JobLogTemplateModel_JobApplicationDocument_IsDeletedByUser,details_JobLogTemplateModel_CvDocument_Title,details_JobLogTemplateModel_CvDocument_Identifier,details_JobLogTemplateModel_CvDocument_IsDeletedBySystem,details_JobLogTemplateModel_CvDocument_IsDeletedByUser,details_JobLogTemplateModel_JobApplicationFile,details_JobLogTemplateModel_CvFile,details_JobLogTemplateModel_SubmissionDeadlineDate,details_JobLogTemplateModel_IsPersisted,details_JobLogTemplateModel_ServerValidationErrors,details_JobLogTemplateModel_HasServerValidationErrors,details_JoblogWorkTime_WorkHour,details_JoblogWorkTime_DailyWorkTime,details_Place,details_OpenPrintDialog,details_WorkPlaceInfoText,details_JobCenterContactDetails,details_WorkPlaceDescriptionText,details_FavoriteText,details_IsFavorite,details_ShowFavorite,details_MetaOgTextForSharing,details_DescriptionForSharing,details_TitleForSharing,details_RutePlan,details_FormattedPurpose,details_MapUrl,details_OrganizationNumber,details_ShowSearchJobButton,details_ShowPrint,details_BackToFindWorkButtonUrl,isExternal
0,False,1,Social- og sundhedselever til Assens Kommune,Social- og sundhedselever til Assens Kommune,Leder du efter en uddannelse med gode fremtidsmuligheder? Har du mod på at arbejde med og gøre en forskel for mennesker i mange forskellige livssituationer inden for social- og sundhedsområdet? Og,Assens Kommune - Social- og sundhedshjælperelever,Rådhus Allé 5,5610,Assens,False,False,False,True,2022-05-04T00:00:00,2022-05-11T00:00:00,11. maj 2022,0001-01-01T00:00:00,False,False,https://job.jobnet.dk/CV/FindWork/Details/5573277,Syddanmark,Assens,Danmark,5610,,,,Fuldtid,Elever,"Sundhed, omsorg og personlig pleje",Social- og sundhedsassistentelev,55.2666,9.8928,,,121683,58353,29189692,False,False,https://job.jobnet.dk/CV/FindWork/DetailsSocialmedia/5573277,https://job.jobnet.dk/CV/FindWork/Details/5573277,https://job.jobnet.dk/CV/FindWork/Details/5573277,True,5573277,55.2666,9.8928,"{'Id': 1, 'Name': 'Fuldtid'}, {'Id': 16, 'Name': 'Deltid'}","{'Id': 1, 'Name': 'Almindelige vilkår'}, {'Id': 2, 'Name': 'Fleksjob'}, {'Id': 3, 'Name': 'Skånejob'}, {'Id': 4, 'Name': 'Egnet til efterlønnere og seniorer'}, {'Id': 5, 'Name': 'Job med løntilskud'}, {'Id': 6, 'Name': 'Rotationsjob'}, {'Id': 7, 'Name': 'Virksomhedspraktik'}","{'Id': 1, 'Name': 'Fastansættelse'}, {'Id': 16, 'Name': 'Tidsbegrænset ansættelse'}",Assens Kommune - Social- og sundhedshjælperelever,Rådhus Allé 5,58,Danmark,420,Assens,3,Syddanmark,5610,Assens,,0,Primary,,,,None,,1003310469,29189692,None,5573277,5573277,Assens Kommune - Social- og sundhedshjælperelever,Rådhus Allé 5,58,Danmark,420,Assens,3,Syddanmark,5610,Assens,,0,Primary,,,,None,,1003310469,29189692,None,,2022-05-04T00:00:00,2022-05-11T00:00:00,Social- og sundhedselever til Assens Kommune,"Leder du efter en uddannelse med gode fremtidsmuligheder? Har du mod på at arbejde med og gøre en forskel for mennesker i mange forskellige livssituationer inden for social- og sundhedsområdet? Og er du nysgerrig på læring og personlig udvikling? Så tag uddannelsen som social- og sundhedsassistent eller social- og sundhedshjælper i Assens Kommune og bliv en af fremtidens social- og sundhedshelte.  Hos Assens Kommune søger vi:     Social- og sundhedselever til start på Grundforløb 2 i august 2022   Social- og sundhedsassistentelever til start på hovedforløbet i september 2022   Social- og sundhedsassistentelever til EUX med start august 2022     Om uddannelserne   Grundforløbet tager maks 20 uger, afhængigt af din uddannelsesbaggrund, og er adgangsgivende til Hovedforløbet, uanset om du vælger uddannelsen som social- og sundhedsassistent (SSA) eller social- og sundhedshjælper (SSA). Her får du en grundviden om bl.a. kommunikation, rehabilitering og sundhed.   Social- og sundhedsassistent  Som social- og sundhedsassistentelev uddannes du til at varetage medicinadministration, sygeplejefaglige vurderinger, tilrettelægge og udføre rehabiliterende tiltag og handlinger i tæt samarbejde med andre faglige samarbejdspartnere. Vejledning og kommunikation med borgeren og de pårørende er også en del af uddannelsen. Samtidig arbejder du med velfærdsteknologi og forskellige digitale løsninger.    Uddannelsen varer, efter grundforløbet, 2 år, 8 måneder og 2 uger og veksler mellem skole og praktik. I nogle tilfælde kan uddannelsen afkortes.    Du er garanteret alle praktikpladser i løbet af dit uddannelsesforløb, såvel på ældreområdet, i psykiatrien som i en sygehuspraktik.   Social- og sundhedshjælper  I løbet af uddannelsen som social- og sundhedshjælper lærer du at udføre pleje, omsorg og praktisk hjælp, samt at vejlede borgerne i forhold til at få hverdagen til at fungere. I takt med din udvikling vil du gradvist få flere selvstændige arbejdsopgaver.   Uddannelsen varer 14 måneder og veksler mellem skole og praktik.    Du er garanteret en praktikplads under hele dit uddannelsesforløb, og i Assens Kommune kommer du både ud i en plejebolig og i en hjemmeplejegruppe.    Vi tilbyder dig   Du er under hele uddannelsesforløbet ansat af Assens Kommune, og vi tilbyder dig en alsidig og bred social- og sundhedsuddannelse med:     Engagerede praktikkoordinatorer og kollegaer med høj faglighed og et højt ambitionsniveau   God struktur på uddannelsen og klare aftaler   Et læringsmiljø med masser af personlige udfordringer, udvikling og ansvar   Et godt socialt miljø med øvrige elever og kollegaer   Gode jobmuligheder efter endt uddannelse.     Om dig   Vi lægger vægt på, at du:     Er reflekterende, ansvarlig og initiativrig   Tager ansvar for egen uddannelse og er fagligt nysgerrig   Er mødestabil og ser værdien i at indgå i et praksisfællesskab, hvor vi ’løfter i flok’   Har en god situationsfornemmelse og er empatisk og tillidsvækkende.       VIGTIGT :  			Læs denne vejledning, inden du udfylder ansøgningen, så du får det hele med.     Inden du ansøger om en elevplads som social- og sundhedsassistent, skal du have udarbejdet et optagelsesbrev på Social- og Sundhedsskolen Fyn, som du vedhæfter din ansøgning. Du skal henvende dig på Social- og Sundhedsskolen Fyn for at booke en vejledningstid på   www.sosufyn.dk /  eller telefon 63 10 27 00 tast 1.    Løn- og ansættelsesvilkår   Løn- og ansættelsesvilkår følger gældende overenskomst mellem KL og den forhandlingsberettigede organisation.   Arbejdstiden er 37 timer om ugen. Du skal i nogen omfang påregne skiftende arbejdstider og hjemmeforberedelse i både skole og praktik.   Praktikpladserne er fordelt over hele Assens Kommune. Du skal kunne transportere dig og være på praktikstedet til arbejdstids begyndelse og afslutning, og du skal kunne færdes på cykel.   Du vil blive bedt om at aflevere en straffeattest forud for ansættelse.   Voksenelevløn  Er du over 25 år og opfylder kriterierne, kan du søge om voksenelevløn. Ansøgningsskemaet  skal  vedlægges ansøgningen.   Voksenlærlingeløn  Hvis du er over 25 år, skal du kontakte Jobcentret i din hjemkommune for at undersøge, hvorvidt du er berettiget til voksenlærlingeløn.    Har du spørgsmål?   Hvis du har spørgsmål eller brug for vejledning, er du velkommen til at kontakte Uddannelsesafdelingen i Assens Kommune på www.assens.dk/uddannelsesafdelingen.   Du kan læse mere om uddannelsen på www.assens.dk/elev og på https://www.sosufyn.dk/uddannelser-2/.   Ansættelsesprocessen   Vi glæder os meget til at modtage din ansøgning, så søg gerne allerede nu og senest den 11. maj 2022.   Alle dine oplysninger i ansøgningen afgiver du på tro og love mht. indhold og rigtighed.   Dit materiale behandles af et ansættelsesudvalg, der består af repræsentanter fra hjemmepleje, plejecentre samt uddannelseskoordinatoren. Ansættelsesudvalget læser ansøgninger, vælger kandidater til samtale, afholder samtaler og træffer beslutning om ansættelse.   Ansættelsessamtaler   Vi forventer at afholde samtaler i  uge 25 2022.  Du vil blive indkaldt til samtale via mail, så vær opmærksom på, at mailen kan havne i ""uønsket post"".   Vi glæder os til at høre fra dig!   Du kan kun  søge   stillingen  som elev  ved  at  klikke   på   ansøgningslinket   eller   ved  at  gå  ind   på   www.assens.dk/job  og  søge  via stillingsopslaget. 
 Denne jobannonce blev oprindeligt opslået på https://www.ofir.dk/
 (Den originale annonce kan ses på: https://www.ofir.dk/showojob?ofirid=c7379c85)",Rådhus Allé 5,58,Danmark,420,Assens,3,Syddanmark,5610,Assens,1,1,Fuldtid,None,None,3,,0,,0,0,0,,False,"{'Id': 7962260, 'Email': None, 'FaxNumber': None, 'PersonName': 'Assens Kommune', 'FirstName': 'Assens', 'LastName': 'Kommune', 'PositionTitle': None, 'PhoneNumbers': [{'Number': '64747474', 'Type': 0, 'Description': 'Hovednummer'}]}",,False,False,False,False,4,,,False,False,False,False,,,,,https://www.ofir.dk/resultat/Jobannonce.aspx?ofirId=c7379c85&action=sendApplicationUrl,False,2022-05-11T00:00:00,,0,Primary,7,/CV/FindWork/GetLogo?JobAdId=5573277&Organisation=29189692,"Rådhus Allé 5,5610, Assens",True,False,/CV/Jobseeking/JobLog/CreateJobSearch?JobnetJobPostingIdentifier=5573277&Company.Name=Assens Kommune - Social- og sundhedshjælperelever&SubmissionDeadlineDate=2022-5-11&Title=Social- og sundhedselever til Assens Kommune&WeeklyWorkTime=1,00000000-0000-0000-0000-000000000000,False,0,,,Social- og sundhedselever til Assens Kommune,True,,True,1,,5573277,,,False,False,,0,False,Assens Kommune - Social- og sundhedshjælperelever,Rådhus Allé 5,,,5610,False,False,False,Assens,Assens Kommune,64747474,,,,,,False,,2022-05-11T00:00:00,,0,False,0,,,,,0,,,,False,False,,,False,False,,,,False,,False,,,Arbejdspladsen ligger i Assens kommune,False,Assens Kommune - Social- og sundhedshjælperelever,,None,,False,False,Leder du efter en uddannelse med gode fremtidsmuligheder? Har du mod på at arbejde med og gøre en forskel for mennesker i mange forskellige livssituationer inden for social- og sundhedsområdet? Og er du nysgerrig på læring og personlig udvikling? Så tag uddannelsen som social- og sundhedsassistent eller social- og sundhedshjælper i Assens Kommune o,"""Leder du efter en uddannelse med gode fremtidsmuligheder? Har du mod på at arbejde med og gøre en forskel for mennesker i mange forskellige livssituationer inden for social- og sundhedsområdet? Og er du nysgerrig på læring og personlig udvikling? Så tag uddannelsen som social- og sundhedsassistent eller social- og sundhedshjælper i Assens Kommune o""","""Social- og sundhedselever til Assens Kommune""","https://www.google.dk/maps/dir//Rådhus+Allé+5,5610,+Assens/","Leder du efter en uddannelse med gode fremtidsmuligheder? Har du mod på at arbejde med og gøre en forskel for mennesker i mange forskellige livssituationer inden for social- og sundhedsområdet? Og er du nysgerrig på læring og personlig udvikling? Så tag uddannelsen som social- og sundhedsassistent eller social- og sundhedshjælper i Assens Kommune og bliv en af fremtidens social- og sundhedshelte.  Hos Assens Kommune søger vi:     Social- og sundhedselever til start på Grundforløb 2 i august 2022   Social- og sundhedsassistentelever til start på hovedforløbet i september 2022   Social- og sundhedsassistentelever til EUX med start august 2022     Om uddannelserne   Grundforløbet tager maks 20 uger, afhængigt af din uddannelsesbaggrund, og er adgangsgivende til Hovedforløbet, uanset om du vælger uddannelsen som social- og sundhedsassistent (SSA) eller social- og sundhedshjælper (SSA). Her får du en grundviden om bl.a. kommunikation, rehabilitering og sundhed.   Social- og sundhedsassistent  Som social- og sundhedsassistentelev uddannes du til at varetage medicinadministration, sygeplejefaglige vurderinger, tilrettelægge og udføre rehabiliterende tiltag og handlinger i tæt samarbejde med andre faglige samarbejdspartnere. Vejledning og kommunikation med borgeren og de pårørende er også en del af uddannelsen. Samtidig arbejder du med velfærdsteknologi og forskellige digitale løsninger.    Uddannelsen varer, efter grundforløbet, 2 år, 8 måneder og 2 uger og veksler mellem skole og praktik. I nogle tilfælde kan uddannelsen afkortes.    Du er garanteret alle praktikpladser i løbet af dit uddannelsesforløb, såvel på ældreområdet, i psykiatrien som i en sygehuspraktik.   Social- og sundhedshjælper  I løbet af uddannelsen som social- og sundhedshjælper lærer du at udføre pleje, omsorg og praktisk hjælp, samt at vejlede borgerne i forhold til at få hverdagen til at fungere. I takt med din udvikling vil du gradvist få flere selvstændige arbejdsopgaver.   Uddannelsen varer 14 måneder og veksler mellem skole og praktik.    Du er garanteret en praktikplads under hele dit uddannelsesforløb, og i Assens Kommune kommer du både ud i en plejebolig og i en hjemmeplejegruppe.    Vi tilbyder dig   Du er under hele uddannelsesforløbet ansat af Assens Kommune, og vi tilbyder dig en alsidig og bred social- og sundhedsuddannelse med:     Engagerede praktikkoordinatorer og kollegaer med høj faglighed og et højt ambitionsniveau   God struktur på uddannelsen og klare aftaler   Et læringsmiljø med masser af personlige udfordringer, udvikling og ansvar   Et godt socialt miljø med øvrige elever og kollegaer   Gode jobmuligheder efter endt uddannelse.     Om dig   Vi lægger vægt på, at du:     Er reflekterende, ansvarlig og initiativrig   Tager ansvar for egen uddannelse og er fagligt nysgerrig   Er mødestabil og ser værdien i at indgå i et praksisfællesskab, hvor vi ’løfter i flok’   Har en god situationsfornemmelse og er empatisk og tillidsvækkende.       VIGTIGT :  			Læs denne vejledning, inden du udfylder ansøgningen, så du får det hele med.     Inden du ansøger om en elevplads som social- og sundhedsassistent, skal du have udarbejdet et optagelsesbrev på Social- og Sundhedsskolen Fyn, som du vedhæfter din ansøgning. Du skal henvende dig på Social- og Sundhedsskolen Fyn for at booke en vejledningstid på   www.sosufyn.dk /  eller telefon 63 10 27 00 tast 1.    Løn- og ansættelsesvilkår   Løn- og ansættelsesvilkår følger gældende overenskomst mellem KL og den forhandlingsberettigede organisation.   Arbejdstiden er 37 timer om ugen. Du skal i nogen omfang påregne skiftende arbejdstider og hjemmeforberedelse i både skole og praktik.   Praktikpladserne er fordelt over hele Assens Kommune. Du skal kunne transportere dig og være på praktikstedet til arbejdstids begyndelse og afslutning, og du skal kunne færdes på cykel.   Du vil blive bedt om at aflevere en straffeattest forud for ansættelse.   Voksenelevløn  Er du over 25 år og opfylder kriterierne, kan du søge om voksenelevløn. Ansøgningsskemaet  skal  vedlægges ansøgningen.   Voksenlærlingeløn  Hvis du er over 25 år, skal du kontakte Jobcentret i din hjemkommune for at undersøge, hvorvidt du er berettiget til voksenlærlingeløn.    Har du spørgsmål?   Hvis du har spørgsmål eller brug for vejledning, er du velkommen til at kontakte Uddannelsesafdelingen i Assens Kommune på  www.assens.dk/uddannelsesafdelingen .   Du kan læse mere om uddannelsen på  www.assens.dk/elev  og på  https://www.sosufyn.dk/uddannelser-2/ .   Ansættelsesprocessen   Vi glæder os meget til at modtage din ansøgning, så søg gerne allerede nu og senest den 11. maj 2022.   Alle dine oplysninger i ansøgningen afgiver du på tro og love mht. indhold og rigtighed.   Dit materiale behandles af et ansættelsesudvalg, der består af repræsentanter fra hjemmepleje, plejecentre samt uddannelseskoordinatoren. Ansættelsesudvalget læser ansøgninger, vælger kandidater til samtale, afholder samtaler og træffer beslutning om ansættelse.   Ansættelsessamtaler   Vi forventer at afholde samtaler i  uge 25 2022.  Du vil blive indkaldt til samtale via mail, så vær opmærksom på, at mailen kan havne i ""uønsket post"".   Vi glæder os til at høre fra dig!   Du kan kun  søge   stillingen  som elev  ved  at  klikke   på   ansøgningslinket   eller   ved  at  gå  ind   på   www.assens.dk/job  og  søge  via stillingsopslaget. 
 Denne jobannonce blev oprindeligt opslået på  https://www.ofir.dk/ 
 (Den originale annonce kan ses på:  https://www.ofir.dk/showojob?ofirid=c7379c85 )","https://www.google.dk/maps/place/Rådhus+Allé+5,5610,+Assens/",29189692,False,False,,False
