summary_AutomatchType,summary_Abroad,summary_Weight,summary_Title,summary_JobHeadline,summary_Presentation,summary_HiringOrgName,summary_WorkPlaceAddress,summary_WorkPlacePostalCode,summary_WorkPlaceCity,summary_WorkPlaceOtherAddress,summary_WorkPlaceAbroad,summary_WorkPlaceNotStatic,summary_UseWorkPlaceAddressForJoblog,summary_PostingCreated,summary_LastDateApplication,summary_FormattedLastDateApplication,summary_AssignmentStartDate,summary_IsHotjob,summary_IsExternal,summary_Url,summary_Region,summary_Municipality,summary_Country,summary_PostalCode,summary_PostalCodeName,summary_JobAnnouncementType,summary_EmploymentType,summary_WorkHours,summary_OccupationArea,summary_OccupationGroup,summary_Occupation,summary_Location_Latitude,summary_Location_Longitude,summary_JoblogWorkTime_WorkHour,summary_JoblogWorkTime_DailyWorkTime,summary_WorkplaceID,summary_OrganisationId,summary_HiringOrgCVR,summary_UserLoggedIn,summary_AnonymousEmployer,summary_ShareUrl,summary_DetailsUrl,summary_JobLogUrl,summary_HasLocationValues,summary_ID,summary_Latitude,summary_Longitude,details_WorkSchedule,details_WorkConditions,details_EmploymentTypes,details_WorkPlace_Name,details_WorkPlace_Address_AddressLine,details_WorkPlace_Address_Country_Id,details_WorkPlace_Address_Country_Name,details_WorkPlace_Address_Municipality_Id,details_WorkPlace_Address_Municipality_Name,details_WorkPlace_Address_Region_Id,details_WorkPlace_Address_Region_Name,details_WorkPlace_Address_PostalCode,details_WorkPlace_Address_City,details_WorkPlace_PhoneNumber_Number,details_WorkPlace_PhoneNumber_Type,details_WorkPlace_PhoneNumber_Description,details_WorkPlace_FaxNumber,details_WorkPlace_Email,details_WorkPlace_WebAddress,details_WorkPlace_Description,details_WorkPlace_Logo,details_WorkPlace_WorkPlaceOrganizationNumber,details_WorkPlace_OrganizationNumber,details_WorkPlace_OrganizationDescription,details_JobPositionPosting_Id,details_JobPositionPosting_OriginalJppId,details_JobPositionPosting_HiringOrg_Name,details_JobPositionPosting_HiringOrg_Address_AddressLine,details_JobPositionPosting_HiringOrg_Address_Country_Id,details_JobPositionPosting_HiringOrg_Address_Country_Name,details_JobPositionPosting_HiringOrg_Address_Municipality_Id,details_JobPositionPosting_HiringOrg_Address_Municipality_Name,details_JobPositionPosting_HiringOrg_Address_Region_Id,details_JobPositionPosting_HiringOrg_Address_Region_Name,details_JobPositionPosting_HiringOrg_Address_PostalCode,details_JobPositionPosting_HiringOrg_Address_City,details_JobPositionPosting_HiringOrg_PhoneNumber_Number,details_JobPositionPosting_HiringOrg_PhoneNumber_Type,details_JobPositionPosting_HiringOrg_PhoneNumber_Description,details_JobPositionPosting_HiringOrg_FaxNumber,details_JobPositionPosting_HiringOrg_Email,details_JobPositionPosting_HiringOrg_WebAddress,details_JobPositionPosting_HiringOrg_Description,details_JobPositionPosting_HiringOrg_Logo,details_JobPositionPosting_HiringOrg_WorkPlaceOrganizationNumber,details_JobPositionPosting_HiringOrg_OrganizationNumber,details_JobPositionPosting_HiringOrg_OrganizationDescription,details_JobPositionPosting_RecruitingCompany,details_JobPositionPosting_PublicationStartDate,details_JobPositionPosting_PublicationEndDate,details_JobPositionPosting_JobPositionInformation_PositionTitle,details_JobPositionPosting_JobPositionInformation_Purpose,details_JobPositionPosting_JobPositionInformation_WorkLocation_AddressLine,details_JobPositionPosting_JobPositionInformation_WorkLocation_Country_Id,details_JobPositionPosting_JobPositionInformation_WorkLocation_Country_Name,details_JobPositionPosting_JobPositionInformation_WorkLocation_Municipality_Id,details_JobPositionPosting_JobPositionInformation_WorkLocation_Municipality_Name,details_JobPositionPosting_JobPositionInformation_WorkLocation_Region_Id,details_JobPositionPosting_JobPositionInformation_WorkLocation_Region_Name,details_JobPositionPosting_JobPositionInformation_WorkLocation_PostalCode,details_JobPositionPosting_JobPositionInformation_WorkLocation_City,details_JobPositionPosting_JobPositionInformation_EmploymentType,details_JobPositionPosting_JobPositionInformation_WeeklyWorkHours_TypeId,details_JobPositionPosting_JobPositionInformation_WeeklyWorkHours_TypeName,details_JobPositionPosting_JobPositionInformation_WeeklyWorkHours_Description,details_JobPositionPosting_JobPositionInformation_CompensationDescription,details_JobPositionPosting_JobPositionInformation_NumberToFill,details_JobPositionPosting_JobPositionInformation_DriverLicense,details_JobPositionPosting_JobPositionInformation_Occupation_DiscoWeb,details_JobPositionPosting_JobPositionInformation_Occupation_AlternateNames,details_JobPositionPosting_JobPositionInformation_Occupation_GroupId,details_JobPositionPosting_JobPositionInformation_Occupation_AreaId,details_JobPositionPosting_JobPositionInformation_Occupation_Id,details_JobPositionPosting_JobPositionInformation_Occupation_Name,details_JobPositionPosting_JobPositionInformation_IsGovernmentHiring,details_JobPositionPosting_JobPositionInformation_JppContacts,details_JobPositionPosting_JobPositionInformation_EmploymentDate,details_JobPositionPosting_IsRecruitmentOfForeignNationals,details_JobPositionPosting_IsWorkInDenmark,details_JobPositionPosting_IsAnonymousEmployer,details_JobPositionPosting_IsDisabilityFriendly,details_JobPositionPosting_JppType,details_JobPositionPosting_ApplicationDetails_WorkHourMax,details_JobPositionPosting_ApplicationDetails_WorkHourMin,details_JobPositionPosting_ApplicationDetails_DailyWorkTimeWeekend,details_JobPositionPosting_ApplicationDetails_DailyWorkTimeNight,details_JobPositionPosting_ApplicationDetails_DailyWorkTimeEvening,details_JobPositionPosting_ApplicationDetails_DailyWorkTimeDay,details_JobPositionPosting_ApplicationDetails_ReferenceText,details_JobPositionPosting_ApplicationDetails_RemarksToApplicant,details_JobPositionPosting_ApplicationDetails_ByEmail,details_JobPositionPosting_ApplicationDetails_ByPhone,details_JobPositionPosting_ApplicationDetails_ApplyViaUrl,details_JobPositionPosting_ApplicationDetails_ReplyInWriting,details_JobPositionPosting_ApplicationDetails_ApplicationDeadlineDate,details_JobPositionPosting_ContactAuthorityPhoneNumber_Number,details_JobPositionPosting_ContactAuthorityPhoneNumber_Type,details_JobPositionPosting_ContactAuthorityPhoneNumber_Description,details_JobPositionPosting_Status,details_LogoUrl,details_Address,details_ShowMap,details_ShowShareButtonJobLog,details_JobLogUrl,details_JobLogTemplateModel_Identifier,details_JobLogTemplateModel_UseWorkPlaceAddressForJoblog,details_JobLogTemplateModel_Category,details_JobLogTemplateModel_CvCustomerIdentifier,details_JobLogTemplateModel_JobSeekingStatus,details_JobLogTemplateModel_Title,details_JobLogTemplateModel_IsApplicationSourceRequired,details_JobLogTemplateModel_ApplicationSource,details_JobLogTemplateModel_IsWeeklyWorkTimeRequired,details_JobLogTemplateModel_WeeklyWorkTime,details_JobLogTemplateModel_HoursPerWeek,details_JobLogTemplateModel_JobnetJobPostingIdentifier,details_JobLogTemplateModel_JobAdDocument_Title,details_JobLogTemplateModel_JobAdDocument_Identifier,details_JobLogTemplateModel_JobAdDocument_IsDeletedBySystem,details_JobLogTemplateModel_JobAdDocument_IsDeletedByUser,details_JobLogTemplateModel_JobAdFile,details_JobLogTemplateModel_Company_JobLogEntryCategory,details_JobLogTemplateModel_Company_ShowAddressFieldsEvenIfEmpty,details_JobLogTemplateModel_Company_Name,details_JobLogTemplateModel_Company_Address,details_JobLogTemplateModel_Company_Country,details_JobLogTemplateModel_Company_EmploymentAreaID,details_JobLogTemplateModel_Company_PostCode,details_JobLogTemplateModel_Company_IsCountryAndTownAndPostCodeEmpty,details_JobLogTemplateModel_Company_IsTownAndPostCodeEmpty,details_JobLogTemplateModel_Company_IsCountryDanmark,details_JobLogTemplateModel_Company_Town,details_JobLogTemplateModel_Company_ContactPerson,details_JobLogTemplateModel_Company_Phone,details_JobLogTemplateModel_Company_Email,details_JobLogTemplateModel_Company_Latitude,details_JobLogTemplateModel_Company_Longitude,details_JobLogTemplateModel_Company_DailyTravelTimeInMinutes,details_JobLogTemplateModel_Company_DistanceToCompanyInMeters,details_JobLogTemplateModel_Company_IsCreateMode,details_JobLogTemplateModel_TypeOfSubmission,details_JobLogTemplateModel_SubmissionDate,details_JobLogTemplateModel_SubmissionDateFormatted,details_JobLogTemplateModel_SubmissionDateTiks,details_JobLogTemplateModel_IsSubmissionDateRequired,details_JobLogTemplateModel_Status,details_JobLogTemplateModel_DateCreatedFormatted,details_JobLogTemplateModel_DateCreated,details_JobLogTemplateModel_DateModifiedFormatted,details_JobLogTemplateModel_DateModified,details_JobLogTemplateModel_LastModifiedDateTiks,details_JobLogTemplateModel_DateClosed,details_JobLogTemplateModel_JobApplicationDocument_Title,details_JobLogTemplateModel_JobApplicationDocument_Identifier,details_JobLogTemplateModel_JobApplicationDocument_IsDeletedBySystem,details_JobLogTemplateModel_JobApplicationDocument_IsDeletedByUser,details_JobLogTemplateModel_CvDocument_Title,details_JobLogTemplateModel_CvDocument_Identifier,details_JobLogTemplateModel_CvDocument_IsDeletedBySystem,details_JobLogTemplateModel_CvDocument_IsDeletedByUser,details_JobLogTemplateModel_JobApplicationFile,details_JobLogTemplateModel_CvFile,details_JobLogTemplateModel_SubmissionDeadlineDate,details_JobLogTemplateModel_IsPersisted,details_JobLogTemplateModel_ServerValidationErrors,details_JobLogTemplateModel_HasServerValidationErrors,details_JoblogWorkTime_WorkHour,details_JoblogWorkTime_DailyWorkTime,details_Place,details_OpenPrintDialog,details_WorkPlaceInfoText,details_JobCenterContactDetails,details_WorkPlaceDescriptionText,details_FavoriteText,details_IsFavorite,details_ShowFavorite,details_MetaOgTextForSharing,details_DescriptionForSharing,details_TitleForSharing,details_RutePlan,details_FormattedPurpose,details_MapUrl,details_OrganizationNumber,details_ShowSearchJobButton,details_ShowPrint,details_BackToFindWorkButtonUrl,isExternal
0,False,1,THISE MEJERI SØGER HR KOORDINATOR,THISE MEJERI SØGER HR KOORDINATOR,"Thise søger en HR koordinator til en nyoprettet stilling på mejeriet. Vi forventer, at du har lyst, evner og erfaring med at udføre de basale HRopgaver, herunder at ",THISE MEJERI A.M.B.A.,Sundsørevej 62,7870,Roslev,False,False,False,True,2022-04-11T00:00:00,2022-05-13T00:00:00,13. maj 2022,0001-01-01T00:00:00,False,False,https://job.jobnet.dk/CV/FindWork/Details/5575381,Midtjylland,Skive,Danmark,7870,,,,Fuldtid,Akademisk arbejde,"Organisation, udvikling og rådgivning",HR-konsulent,56.704,9.1268,,,62860,45344,12425694,False,False,https://job.jobnet.dk/CV/FindWork/DetailsSocialmedia/5575381,https://job.jobnet.dk/CV/FindWork/Details/5575381,https://job.jobnet.dk/CV/FindWork/Details/5575381,True,5575381,56.704,9.1268,"{'Id': 1, 'Name': 'Fuldtid'}, {'Id': 16, 'Name': 'Deltid'}","{'Id': 1, 'Name': 'Almindelige vilkår'}, {'Id': 2, 'Name': 'Fleksjob'}, {'Id': 3, 'Name': 'Skånejob'}, {'Id': 4, 'Name': 'Egnet til efterlønnere og seniorer'}, {'Id': 5, 'Name': 'Job med løntilskud'}, {'Id': 6, 'Name': 'Rotationsjob'}, {'Id': 7, 'Name': 'Virksomhedspraktik'}","{'Id': 1, 'Name': 'Fastansættelse'}, {'Id': 16, 'Name': 'Tidsbegrænset ansættelse'}",THISE MEJERI A.M.B.A.,Sundsørevej 62,58,Danmark,779,Skive,2,Midtjylland,7870,Roslev,,0,Primary,,,,Mejeri,62860,1004068348,12425694,None,5575381,5575381,THISE MEJERI A.M.B.A.,Sundsørevej 62,58,Danmark,779,Skive,2,Midtjylland,7870,Roslev,,0,Primary,,,,Mejeri,62860,1004068348,12425694,None,,2022-04-11T00:00:00,2022-05-13T00:00:00,THISE MEJERI SØGER HR KOORDINATOR,"Thise søger en HR koordinator til en nyoprettet stilling på mejeriet.   Vi forventer, at du har lyst, evner og erfaring med at udføre de basale HRopgaver, herunder at drage omsorg for, at de menneskelige relationer udvikler sig til glæde for både medarbejdere og mejeri.       Der er tale om et nyt og højt prioriteret arbejdsområde på Thise Mejeri, hvilket er baggrunden for, at den nyansatte HR-koordinator kommer til at referere direkte til mejeriets administrerende direktør.       Man vil få mulighed for at sætte sit eget præg på, hvorledes HR-funktionen i Thise styrkes.   Ansvarsområder og arbejdsopgaver vil blandt andet omfatte:       Indførelse af et HR-årshjul   Stillingsopslag, -beskrivelser og ansættelseskontrakter   Løn- og arbejdsforhold for timelønnede og funktionærer jvf. overenskomster   Opfølgning på advarsler og eventuelle afskedigelser   HR-politikker for eksempelvis uddannelse, sygefravær, graviditet og seniorordninger   Lederudviklings- og specialistudviklingsforløb i samarbejde med direktionen   Fastholdelse, efteruddannelse og udvikling af medarbejdere   Afholdelse af informative trivselsundersøgelser   Arrangementsansvarlig for interne kurser og møder i chef-, CSR- og teamledergruppen       Facilitator for nye HR-relaterede projekter   Facilitator for specifikke opgaver som:   Nyansættelser og for on boarding forløb   Sikring af strukturerede MUS samtaler til hjælp for især teamlederne   Sikring af godt og struktureret uddannelsesforløb for mejeriets pt 14 lærlinge       FAGLIGE KVALIFIKATIONER    God erfaring med rekruttering og on boarding    Praktisk erfaring med løsning af en lang række opgaver inden for HR-årshjulet, herunder planlægning af hjulet    Solidt kendskab til compliance, GDPR og personalejura    Erfaring med at arbejde i en virksomhed med overenskomster    God til at kommunikere både mundtligt og skriftligt    Erfaring med projektorienterede HR-opgaver, herunder tovholderrollen    Erfaring med uddannelsesadministration, herunder planlægning    Gerne en uddannelse inden for HR, men erfaring og drive er mindst lige så vigtigt       PERSONLIGE KVALIFIKATIONER    Evner at omstille sig til skiftende prioriteter med kort varsel, da opgaver pludselig kan dukke op    Analytisk og struktureret tilgang til opgaveløsningen med solidt overblik    Har fokus på fakta og detaljer    Er drevet af at levere ydelser af høj kvalitet    Imødekommende og opsøgende en god relationsbygger    Er serviceminded og selvkørende OG    Elsker ordentlighed       Nærmere oplysninger kan fås hos adm. direktør, Poul Pedersen (20 20 80 04).   Ansøgningsfrist: Vi afholder samtaler løbende og lukker annoncen, når vi har den rette kandidat. Søg stillingen via www.thise.dk/job       Thise Mejeri er en meget udviklingsorienteret, åben og voksende økologisk fødevarevirksomhed. Der er og har altid været meget kort fra direktionen og ud til alle medarbejdere, hvorfor antallet af administrative medarbejdere er relativt få i Thise, når man tager Thises størrelse med en omsætning på 1,2 mia. kr. om året og med tæt på 300 ansatte i betragtning.       Vi er med ophæng i Thises værdier Økologi, kampgejst og ordentlighed kommet langt uden at have et egentlig HR-funktionsområde. Men det vil nu være ordentligt for virksomhed og medarbejdere, at vi samler ansvaret for de mest basale HR-funktioner i mejeriet i en nyoprettet HR koordinator stilling. 
 Denne jobannonce blev oprindeligt opslået på https://www.ofir.dk/ via https://www.jobmidt.dk/
 (Den originale annonce kan ses på: https://www.ofir.dk/showojob?ofirid=44c428a1)",Sundsørevej 62,58,Danmark,779,Skive,2,Midtjylland,7870,Roslev,1,1,Fuldtid,None,None,1,,0,,0,0,0,,False,"{'Id': 7899797, 'Email': None, 'FaxNumber': None, 'PersonName': 'info@thise.dk info@thise.dk', 'FirstName': 'info@thise.dk', 'LastName': 'info@thise.dk', 'PositionTitle': None, 'PhoneNumbers': [{'Number': '20208004', 'Type': 0, 'Description': 'Hovednummer'}]}",,False,False,False,False,4,,,False,False,False,False,,,,,https://www.ofir.dk/resultat/Jobannonce.aspx?ofirId=44c428a1&action=sendApplicationUrl,False,2022-05-13T00:00:00,,0,Primary,7,/CV/FindWork/GetLogo?JobAdId=5575381&WorkPlace=62860&Organisation=12425694,"Sundsørevej 62,7870, Roslev",True,False,/CV/Jobseeking/JobLog/CreateJobSearch?JobnetJobPostingIdentifier=5575381&Company.Name=THISE MEJERI A.M.B.A.&SubmissionDeadlineDate=2022-5-13&Title=THISE MEJERI SØGER HR KOORDINATOR&WeeklyWorkTime=1,00000000-0000-0000-0000-000000000000,False,0,,,THISE MEJERI SØGER HR KOORDINATOR,True,,True,1,,5575381,,,False,False,,0,False,THISE MEJERI A.M.B.A.,Sundsørevej 62,,,7870,False,False,False,Roslev,info@thise.dk info@thise.dk,20208004,,,,,,False,,2022-05-13T00:00:00,,0,False,0,,,,,0,,,,False,False,,,False,False,,,,False,,False,,,Arbejdspladsen ligger i Skive kommune,False,THISE MEJERI A.M.B.A.,,Mejeri,,False,False,"Thise søger en HR koordinator til en nyoprettet stilling på mejeriet. Vi forventer, at du har lyst, evner og erfaring med at udføre de basale HRopgaver, herunder at drage omsorg for, at de menneskelige relationer udvikler sig til glæde for både medarbejdere og mejeri.   Der er tale om et nyt og højt prioriteret arbejdsområde på Thise Mejeri, hvilke","""Thise søger en HR koordinator til en nyoprettet stilling på mejeriet. Vi forventer, at du har lyst, evner og erfaring med at udføre de basale HRopgaver, herunder at drage omsorg for, at de menneskelige relationer udvikler sig til glæde for både medarbejdere og mejeri.   Der er tale om et nyt og højt prioriteret arbejdsområde på Thise Mejeri, hvilke""","""THISE MEJERI SØGER HR KOORDINATOR""","https://www.google.dk/maps/dir//Sundsørevej+62,7870,+Roslev/","Thise søger en HR koordinator til en nyoprettet stilling på mejeriet.   Vi forventer, at du har lyst, evner og erfaring med at udføre de basale HRopgaver, herunder at drage omsorg for, at de menneskelige relationer udvikler sig til glæde for både medarbejdere og mejeri.       Der er tale om et nyt og højt prioriteret arbejdsområde på Thise Mejeri, hvilket er baggrunden for, at den nyansatte HR-koordinator kommer til at referere direkte til mejeriets administrerende direktør.       Man vil få mulighed for at sætte sit eget præg på, hvorledes HR-funktionen i Thise styrkes.   Ansvarsområder og arbejdsopgaver vil blandt andet omfatte:       Indførelse af et HR-årshjul   Stillingsopslag, -beskrivelser og ansættelseskontrakter   Løn- og arbejdsforhold for timelønnede og funktionærer jvf. overenskomster   Opfølgning på advarsler og eventuelle afskedigelser   HR-politikker for eksempelvis uddannelse, sygefravær, graviditet og seniorordninger   Lederudviklings- og specialistudviklingsforløb i samarbejde med direktionen   Fastholdelse, efteruddannelse og udvikling af medarbejdere   Afholdelse af informative trivselsundersøgelser   Arrangementsansvarlig for interne kurser og møder i chef-, CSR- og teamledergruppen       Facilitator for nye HR-relaterede projekter   Facilitator for specifikke opgaver som:   Nyansættelser og for on boarding forløb   Sikring af strukturerede MUS samtaler til hjælp for især teamlederne   Sikring af godt og struktureret uddannelsesforløb for mejeriets pt 14 lærlinge       FAGLIGE KVALIFIKATIONER    God erfaring med rekruttering og on boarding    Praktisk erfaring med løsning af en lang række opgaver inden for HR-årshjulet, herunder planlægning af hjulet    Solidt kendskab til compliance, GDPR og personalejura    Erfaring med at arbejde i en virksomhed med overenskomster    God til at kommunikere både mundtligt og skriftligt    Erfaring med projektorienterede HR-opgaver, herunder tovholderrollen    Erfaring med uddannelsesadministration, herunder planlægning    Gerne en uddannelse inden for HR, men erfaring og drive er mindst lige så vigtigt       PERSONLIGE KVALIFIKATIONER    Evner at omstille sig til skiftende prioriteter med kort varsel, da opgaver pludselig kan dukke op    Analytisk og struktureret tilgang til opgaveløsningen med solidt overblik    Har fokus på fakta og detaljer    Er drevet af at levere ydelser af høj kvalitet    Imødekommende og opsøgende en god relationsbygger    Er serviceminded og selvkørende OG    Elsker ordentlighed       Nærmere oplysninger kan fås hos adm. direktør, Poul Pedersen (20 20 80 04).   Ansøgningsfrist: Vi afholder samtaler løbende og lukker annoncen, når vi har den rette kandidat. Søg stillingen via  www.thise.dk/job       Thise Mejeri er en meget udviklingsorienteret, åben og voksende økologisk fødevarevirksomhed. Der er og har altid været meget kort fra direktionen og ud til alle medarbejdere, hvorfor antallet af administrative medarbejdere er relativt få i Thise, når man tager Thises størrelse med en omsætning på 1,2 mia. kr. om året og med tæt på 300 ansatte i betragtning.       Vi er med ophæng i Thises værdier Økologi, kampgejst og ordentlighed kommet langt uden at have et egentlig HR-funktionsområde. Men det vil nu være ordentligt for virksomhed og medarbejdere, at vi samler ansvaret for de mest basale HR-funktioner i mejeriet i en nyoprettet HR koordinator stilling. 
 Denne jobannonce blev oprindeligt opslået på  https://www.ofir.dk/  via  https://www.jobmidt.dk/ 
 (Den originale annonce kan ses på:  https://www.ofir.dk/showojob?ofirid=44c428a1 )","https://www.google.dk/maps/place/Sundsørevej+62,7870,+Roslev/",12425694,False,False,,False
