summary_AutomatchType,summary_Abroad,summary_Weight,summary_Title,summary_JobHeadline,summary_Presentation,summary_HiringOrgName,summary_WorkPlaceAddress,summary_WorkPlacePostalCode,summary_WorkPlaceCity,summary_WorkPlaceOtherAddress,summary_WorkPlaceAbroad,summary_WorkPlaceNotStatic,summary_UseWorkPlaceAddressForJoblog,summary_PostingCreated,summary_LastDateApplication,summary_FormattedLastDateApplication,summary_AssignmentStartDate,summary_IsHotjob,summary_IsExternal,summary_Url,summary_Region,summary_Municipality,summary_Country,summary_PostalCode,summary_PostalCodeName,summary_JobAnnouncementType,summary_EmploymentType,summary_WorkHours,summary_OccupationArea,summary_OccupationGroup,summary_Occupation,summary_Location_Latitude,summary_Location_Longitude,summary_JoblogWorkTime_WorkHour,summary_JoblogWorkTime_DailyWorkTime,summary_WorkplaceID,summary_OrganisationId,summary_HiringOrgCVR,summary_UserLoggedIn,summary_AnonymousEmployer,summary_ShareUrl,summary_DetailsUrl,summary_JobLogUrl,summary_HasLocationValues,summary_ID,summary_Latitude,summary_Longitude,details_WorkSchedule,details_WorkConditions,details_EmploymentTypes,details_WorkPlace_Name,details_WorkPlace_Address_AddressLine,details_WorkPlace_Address_Country_Id,details_WorkPlace_Address_Country_Name,details_WorkPlace_Address_Municipality_Id,details_WorkPlace_Address_Municipality_Name,details_WorkPlace_Address_Region_Id,details_WorkPlace_Address_Region_Name,details_WorkPlace_Address_PostalCode,details_WorkPlace_Address_City,details_WorkPlace_PhoneNumber_Number,details_WorkPlace_PhoneNumber_Type,details_WorkPlace_PhoneNumber_Description,details_WorkPlace_FaxNumber,details_WorkPlace_Email,details_WorkPlace_WebAddress,details_WorkPlace_Description,details_WorkPlace_Logo,details_WorkPlace_WorkPlaceOrganizationNumber,details_WorkPlace_OrganizationNumber,details_WorkPlace_OrganizationDescription,details_JobPositionPosting_Id,details_JobPositionPosting_OriginalJppId,details_JobPositionPosting_HiringOrg_Name,details_JobPositionPosting_HiringOrg_Address_AddressLine,details_JobPositionPosting_HiringOrg_Address_Country_Id,details_JobPositionPosting_HiringOrg_Address_Country_Name,details_JobPositionPosting_HiringOrg_Address_Municipality_Id,details_JobPositionPosting_HiringOrg_Address_Municipality_Name,details_JobPositionPosting_HiringOrg_Address_Region_Id,details_JobPositionPosting_HiringOrg_Address_Region_Name,details_JobPositionPosting_HiringOrg_Address_PostalCode,details_JobPositionPosting_HiringOrg_Address_City,details_JobPositionPosting_HiringOrg_PhoneNumber_Number,details_JobPositionPosting_HiringOrg_PhoneNumber_Type,details_JobPositionPosting_HiringOrg_PhoneNumber_Description,details_JobPositionPosting_HiringOrg_FaxNumber,details_JobPositionPosting_HiringOrg_Email,details_JobPositionPosting_HiringOrg_WebAddress,details_JobPositionPosting_HiringOrg_Description,details_JobPositionPosting_HiringOrg_Logo,details_JobPositionPosting_HiringOrg_WorkPlaceOrganizationNumber,details_JobPositionPosting_HiringOrg_OrganizationNumber,details_JobPositionPosting_HiringOrg_OrganizationDescription,details_JobPositionPosting_RecruitingCompany,details_JobPositionPosting_PublicationStartDate,details_JobPositionPosting_PublicationEndDate,details_JobPositionPosting_JobPositionInformation_PositionTitle,details_JobPositionPosting_JobPositionInformation_Purpose,details_JobPositionPosting_JobPositionInformation_WorkLocation_AddressLine,details_JobPositionPosting_JobPositionInformation_WorkLocation_Country_Id,details_JobPositionPosting_JobPositionInformation_WorkLocation_Country_Name,details_JobPositionPosting_JobPositionInformation_WorkLocation_Municipality_Id,details_JobPositionPosting_JobPositionInformation_WorkLocation_Municipality_Name,details_JobPositionPosting_JobPositionInformation_WorkLocation_Region_Id,details_JobPositionPosting_JobPositionInformation_WorkLocation_Region_Name,details_JobPositionPosting_JobPositionInformation_WorkLocation_PostalCode,details_JobPositionPosting_JobPositionInformation_WorkLocation_City,details_JobPositionPosting_JobPositionInformation_EmploymentType,details_JobPositionPosting_JobPositionInformation_WeeklyWorkHours_TypeId,details_JobPositionPosting_JobPositionInformation_WeeklyWorkHours_TypeName,details_JobPositionPosting_JobPositionInformation_WeeklyWorkHours_Description,details_JobPositionPosting_JobPositionInformation_CompensationDescription,details_JobPositionPosting_JobPositionInformation_NumberToFill,details_JobPositionPosting_JobPositionInformation_DriverLicense,details_JobPositionPosting_JobPositionInformation_Occupation_DiscoWeb,details_JobPositionPosting_JobPositionInformation_Occupation_AlternateNames,details_JobPositionPosting_JobPositionInformation_Occupation_GroupId,details_JobPositionPosting_JobPositionInformation_Occupation_AreaId,details_JobPositionPosting_JobPositionInformation_Occupation_Id,details_JobPositionPosting_JobPositionInformation_Occupation_Name,details_JobPositionPosting_JobPositionInformation_IsGovernmentHiring,details_JobPositionPosting_JobPositionInformation_JppContacts,details_JobPositionPosting_JobPositionInformation_EmploymentDate,details_JobPositionPosting_IsRecruitmentOfForeignNationals,details_JobPositionPosting_IsWorkInDenmark,details_JobPositionPosting_IsAnonymousEmployer,details_JobPositionPosting_IsDisabilityFriendly,details_JobPositionPosting_JppType,details_JobPositionPosting_ApplicationDetails_WorkHourMax,details_JobPositionPosting_ApplicationDetails_WorkHourMin,details_JobPositionPosting_ApplicationDetails_DailyWorkTimeWeekend,details_JobPositionPosting_ApplicationDetails_DailyWorkTimeNight,details_JobPositionPosting_ApplicationDetails_DailyWorkTimeEvening,details_JobPositionPosting_ApplicationDetails_DailyWorkTimeDay,details_JobPositionPosting_ApplicationDetails_ReferenceText,details_JobPositionPosting_ApplicationDetails_RemarksToApplicant,details_JobPositionPosting_ApplicationDetails_ByEmail,details_JobPositionPosting_ApplicationDetails_ByPhone,details_JobPositionPosting_ApplicationDetails_ApplyViaUrl,details_JobPositionPosting_ApplicationDetails_ReplyInWriting,details_JobPositionPosting_ApplicationDetails_ApplicationDeadlineDate,details_JobPositionPosting_ContactAuthorityPhoneNumber_Number,details_JobPositionPosting_ContactAuthorityPhoneNumber_Type,details_JobPositionPosting_ContactAuthorityPhoneNumber_Description,details_JobPositionPosting_Status,details_LogoUrl,details_Address,details_ShowMap,details_ShowShareButtonJobLog,details_JobLogUrl,details_JobLogTemplateModel_Identifier,details_JobLogTemplateModel_UseWorkPlaceAddressForJoblog,details_JobLogTemplateModel_Category,details_JobLogTemplateModel_CvCustomerIdentifier,details_JobLogTemplateModel_JobSeekingStatus,details_JobLogTemplateModel_Title,details_JobLogTemplateModel_IsApplicationSourceRequired,details_JobLogTemplateModel_ApplicationSource,details_JobLogTemplateModel_IsWeeklyWorkTimeRequired,details_JobLogTemplateModel_WeeklyWorkTime,details_JobLogTemplateModel_HoursPerWeek,details_JobLogTemplateModel_JobnetJobPostingIdentifier,details_JobLogTemplateModel_JobAdDocument_Title,details_JobLogTemplateModel_JobAdDocument_Identifier,details_JobLogTemplateModel_JobAdDocument_IsDeletedBySystem,details_JobLogTemplateModel_JobAdDocument_IsDeletedByUser,details_JobLogTemplateModel_JobAdFile,details_JobLogTemplateModel_Company_JobLogEntryCategory,details_JobLogTemplateModel_Company_ShowAddressFieldsEvenIfEmpty,details_JobLogTemplateModel_Company_Name,details_JobLogTemplateModel_Company_Address,details_JobLogTemplateModel_Company_Country,details_JobLogTemplateModel_Company_EmploymentAreaID,details_JobLogTemplateModel_Company_PostCode,details_JobLogTemplateModel_Company_IsCountryAndTownAndPostCodeEmpty,details_JobLogTemplateModel_Company_IsTownAndPostCodeEmpty,details_JobLogTemplateModel_Company_IsCountryDanmark,details_JobLogTemplateModel_Company_Town,details_JobLogTemplateModel_Company_ContactPerson,details_JobLogTemplateModel_Company_Phone,details_JobLogTemplateModel_Company_Email,details_JobLogTemplateModel_Company_Latitude,details_JobLogTemplateModel_Company_Longitude,details_JobLogTemplateModel_Company_DailyTravelTimeInMinutes,details_JobLogTemplateModel_Company_DistanceToCompanyInMeters,details_JobLogTemplateModel_Company_IsCreateMode,details_JobLogTemplateModel_TypeOfSubmission,details_JobLogTemplateModel_SubmissionDate,details_JobLogTemplateModel_SubmissionDateFormatted,details_JobLogTemplateModel_SubmissionDateTiks,details_JobLogTemplateModel_IsSubmissionDateRequired,details_JobLogTemplateModel_Status,details_JobLogTemplateModel_DateCreatedFormatted,details_JobLogTemplateModel_DateCreated,details_JobLogTemplateModel_DateModifiedFormatted,details_JobLogTemplateModel_DateModified,details_JobLogTemplateModel_LastModifiedDateTiks,details_JobLogTemplateModel_DateClosed,details_JobLogTemplateModel_JobApplicationDocument_Title,details_JobLogTemplateModel_JobApplicationDocument_Identifier,details_JobLogTemplateModel_JobApplicationDocument_IsDeletedBySystem,details_JobLogTemplateModel_JobApplicationDocument_IsDeletedByUser,details_JobLogTemplateModel_CvDocument_Title,details_JobLogTemplateModel_CvDocument_Identifier,details_JobLogTemplateModel_CvDocument_IsDeletedBySystem,details_JobLogTemplateModel_CvDocument_IsDeletedByUser,details_JobLogTemplateModel_JobApplicationFile,details_JobLogTemplateModel_CvFile,details_JobLogTemplateModel_SubmissionDeadlineDate,details_JobLogTemplateModel_IsPersisted,details_JobLogTemplateModel_ServerValidationErrors,details_JobLogTemplateModel_HasServerValidationErrors,details_JoblogWorkTime_WorkHour,details_JoblogWorkTime_DailyWorkTime,details_Place,details_OpenPrintDialog,details_WorkPlaceInfoText,details_JobCenterContactDetails,details_WorkPlaceDescriptionText,details_FavoriteText,details_IsFavorite,details_ShowFavorite,details_MetaOgTextForSharing,details_DescriptionForSharing,details_TitleForSharing,details_RutePlan,details_FormattedPurpose,details_MapUrl,details_OrganizationNumber,details_ShowSearchJobButton,details_ShowPrint,details_BackToFindWorkButtonUrl,isExternal
0,False,1,Kok til Les Trois Cochons,Kok til Les Trois Cochons," På Les Trois Cochons har vi rygende travlt med gæster fra ind- og udland. Derfor er vi altid på udkig efter dygtige kokke, der kan få køkkenet til at spille på travle dage og træffe gode beslutnin",COFOCO FOOD ApS - Les Trois Cochons,Værnedamsvej 10,1619,København V,False,False,False,True,2022-05-04T00:00:00,2022-05-12T00:00:00,12. maj 2022,0001-01-01T00:00:00,False,False,https://job.jobnet.dk/CV/FindWork/Details/5575012,Hovedstaden og Bornholm,København,Danmark,1619,,,,Fuldtid,"Hotel, restauration, køkken, kantine ",Køkken- og kantinearbejde,Kok,55.6737,12.5501,,,0,0,33961944,False,False,https://job.jobnet.dk/CV/FindWork/DetailsSocialmedia/5575012,https://job.jobnet.dk/CV/FindWork/Details/5575012,https://job.jobnet.dk/CV/FindWork/Details/5575012,True,5575012,55.6737,12.5501,"{'Id': 1, 'Name': 'Fuldtid'}, {'Id': 16, 'Name': 'Deltid'}","{'Id': 1, 'Name': 'Almindelige vilkår'}, {'Id': 2, 'Name': 'Fleksjob'}, {'Id': 3, 'Name': 'Skånejob'}, {'Id': 4, 'Name': 'Egnet til efterlønnere og seniorer'}, {'Id': 5, 'Name': 'Job med løntilskud'}, {'Id': 6, 'Name': 'Rotationsjob'}, {'Id': 7, 'Name': 'Virksomhedspraktik'}","{'Id': 1, 'Name': 'Fastansættelse'}, {'Id': 16, 'Name': 'Tidsbegrænset ansættelse'}",COFOCO FOOD ApS - Les Trois Cochons,Værnedamsvej 10,58,Danmark,101,København,4,"Hovedstaden, Sjælland og Bornholm",1619,København V,,0,Primary,,,,None,,1017186635,33961944,None,5575012,5575012,COFOCO FOOD ApS - Les Trois Cochons,Værnedamsvej 10,58,Danmark,101,København,4,"Hovedstaden, Sjælland og Bornholm",1619,København V,,0,Primary,,,,None,,1017186635,33961944,None,,2022-05-04T00:00:00,2022-05-12T00:00:00,Kok til Les Trois Cochons,"På Les Trois Cochons har vi rygende travlt med gæster fra ind- og udland. Derfor er vi altid på udkig efter dygtige kokke, der kan få køkkenet til at spille på travle dage og træffe gode beslutninger.     Les Trois Cochons er som at besøge Paris for en stund. På tallerkenen finder du gode franske råvarer og specialiteter kombineret med køkkenets flair for det klassiske håndværk. Les Trois Cochons serverer morgenmad, frokost og aftensmad.     Hvis du er ansvarsfuld, beslutningsdygtig og effektiv i dit arbejde, når det kommer til mad, så vil vi gerne høre fra dig!     Vi forventer, at du i stillingen som faglært kok:     Har et højt fagligt niveau   Er kvalitetsbevidst på alt, hvad der forlader køkkenet   Er løsningsorienteret   Har en positiv attitude   Brænder for dit fag, og leverer det bedste resultat – hver gang – til stor glæde for vores gæster       Til gengæld tilbyder vi dig:     En spændende og udfordrende hverdag   At du bliver del af et ungt og energisk team   Fokus på din udvikling og det motiverende arbejdsmiljø   God løn   Gode ansættelsesforhold       Ydermere er Les Trois Cochons en arbejdsplads med højt til loftet, hvor der er grobund for venskaber, sjove oplevelser og personlig udvikling. Vi lægger stor vægt på at have et godt arbejdsmiljø og levere en god madoplevelse for vores gæster. Derfor er det vigtigt, at vi har det sjovt, at der er god stemning, og vi hygger os.     Så hvis du i samarbejde med os ønsker at bane vejen for din succes og din karriere, så skriv til os og fortæl hvorfor du søger jobbet hos os og lidt om dine forventninger til din kommende arbejdsplads.     Stillingen skal besættes hurtigt muligt, og vi vil derfor indkalde relevante kandidater til samtale løbende. Send din ansøgning via knappen ""Send ansøgning""     Vi ser frem til at høre fra dig!     Læs mere om Les Trois Cochons     Såfremt du har spørgsmål, er du velkommen til at kontakte:     Marcus Faurby Stengaard   marcus@cofoco.dk    Tlf.: 26709868     Ansøgningsfrist:   Snarest muligt 
 Denne jobannonce blev oprindeligt opslået på https://www.ofir.dk/
 (Den originale annonce kan ses på: https://www.ofir.dk/showojob?ofirid=b6d14bb3)",Værnedamsvej 10,58,Danmark,101,København,4,"Hovedstaden, Sjælland og Bornholm",1619,København V,1,1,Fuldtid,None,None,1,,0,,0,0,0,,False,"{'Id': 7961548, 'Email': None, 'FaxNumber': None, 'PersonName': 'Kenneth Brewaeys', 'FirstName': 'Kenneth', 'LastName': 'Brewaeys', 'PositionTitle': None, 'PhoneNumbers': [{'Number': '+4531375028', 'Type': 0, 'Description': 'Hovednummer'}]}",,False,False,False,False,4,,,False,False,False,False,,,,,https://www.ofir.dk/resultat/Jobannonce.aspx?ofirId=b6d14bb3&action=sendApplicationUrl,False,2022-05-12T00:00:00,,0,Primary,7,/CV/FindWork/GetLogo?JobAdId=5575012&Organisation=33961944,"Værnedamsvej 10,1619, København V",True,False,/CV/Jobseeking/JobLog/CreateJobSearch?JobnetJobPostingIdentifier=5575012&Company.Name=COFOCO FOOD ApS - Les Trois Cochons&SubmissionDeadlineDate=2022-5-12&Title=Kok til Les Trois Cochons&WeeklyWorkTime=1,00000000-0000-0000-0000-000000000000,False,0,,,Kok til Les Trois Cochons,True,,True,1,,5575012,,,False,False,,0,False,COFOCO FOOD ApS - Les Trois Cochons,Værnedamsvej 10,,,1619,False,False,False,København V,Kenneth Brewaeys,+4531375028,,,,,,False,,2022-05-12T00:00:00,,0,False,0,,,,,0,,,,False,False,,,False,False,,,,False,,False,,,Arbejdspladsen ligger i København kommune,False,COFOCO FOOD ApS - Les Trois Cochons,,None,,False,False,"På Les Trois Cochons har vi rygende travlt med gæster fra ind- og udland. Derfor er vi altid på udkig efter dygtige kokke, der kan få køkkenet til at spille på travle dage og træffe gode beslutninger.  Les Trois Cochons er som at besøge Paris for en stund. På tallerkenen finder du gode franske råvarer og specialiteter kombineret med køkkenets flair","""På Les Trois Cochons har vi rygende travlt med gæster fra ind- og udland. Derfor er vi altid på udkig efter dygtige kokke, der kan få køkkenet til at spille på travle dage og træffe gode beslutninger.  Les Trois Cochons er som at besøge Paris for en stund. På tallerkenen finder du gode franske råvarer og specialiteter kombineret med køkkenets flair""","""Kok til Les Trois Cochons""","https://www.google.dk/maps/dir//Værnedamsvej+10,1619,+København+V/","På Les Trois Cochons har vi rygende travlt med gæster fra ind- og udland. Derfor er vi altid på udkig efter dygtige kokke, der kan få køkkenet til at spille på travle dage og træffe gode beslutninger.     Les Trois Cochons er som at besøge Paris for en stund. På tallerkenen finder du gode franske råvarer og specialiteter kombineret med køkkenets flair for det klassiske håndværk. Les Trois Cochons serverer morgenmad, frokost og aftensmad.     Hvis du er ansvarsfuld, beslutningsdygtig og effektiv i dit arbejde, når det kommer til mad, så vil vi gerne høre fra dig!     Vi forventer, at du i stillingen som faglært kok:     Har et højt fagligt niveau   Er kvalitetsbevidst på alt, hvad der forlader køkkenet   Er løsningsorienteret   Har en positiv attitude   Brænder for dit fag, og leverer det bedste resultat – hver gang – til stor glæde for vores gæster       Til gengæld tilbyder vi dig:     En spændende og udfordrende hverdag   At du bliver del af et ungt og energisk team   Fokus på din udvikling og det motiverende arbejdsmiljø   God løn   Gode ansættelsesforhold       Ydermere er Les Trois Cochons en arbejdsplads med højt til loftet, hvor der er grobund for venskaber, sjove oplevelser og personlig udvikling. Vi lægger stor vægt på at have et godt arbejdsmiljø og levere en god madoplevelse for vores gæster. Derfor er det vigtigt, at vi har det sjovt, at der er god stemning, og vi hygger os.     Så hvis du i samarbejde med os ønsker at bane vejen for din succes og din karriere, så skriv til os og fortæl hvorfor du søger jobbet hos os og lidt om dine forventninger til din kommende arbejdsplads.     Stillingen skal besættes hurtigt muligt, og vi vil derfor indkalde relevante kandidater til samtale løbende. Send din ansøgning via knappen ""Send ansøgning""     Vi ser frem til at høre fra dig!     Læs mere om Les Trois Cochons     Såfremt du har spørgsmål, er du velkommen til at kontakte:     Marcus Faurby Stengaard   marcus@cofoco.dk    Tlf.: 26709868     Ansøgningsfrist:   Snarest muligt 
 Denne jobannonce blev oprindeligt opslået på  https://www.ofir.dk/ 
 (Den originale annonce kan ses på:  https://www.ofir.dk/showojob?ofirid=b6d14bb3 )","https://www.google.dk/maps/place/Værnedamsvej+10,1619,+København+V/",33961944,False,False,,False
