summary_AutomatchType,summary_Abroad,summary_Weight,summary_Title,summary_JobHeadline,summary_Presentation,summary_HiringOrgName,summary_WorkPlaceAddress,summary_WorkPlacePostalCode,summary_WorkPlaceCity,summary_WorkPlaceOtherAddress,summary_WorkPlaceAbroad,summary_WorkPlaceNotStatic,summary_UseWorkPlaceAddressForJoblog,summary_PostingCreated,summary_LastDateApplication,summary_FormattedLastDateApplication,summary_AssignmentStartDate,summary_IsHotjob,summary_IsExternal,summary_Url,summary_Region,summary_Municipality,summary_Country,summary_PostalCode,summary_PostalCodeName,summary_JobAnnouncementType,summary_EmploymentType,summary_WorkHours,summary_OccupationArea,summary_OccupationGroup,summary_Occupation,summary_Location_Latitude,summary_Location_Longitude,summary_JoblogWorkTime_WorkHour,summary_JoblogWorkTime_DailyWorkTime,summary_WorkplaceID,summary_OrganisationId,summary_HiringOrgCVR,summary_UserLoggedIn,summary_AnonymousEmployer,summary_ShareUrl,summary_DetailsUrl,summary_JobLogUrl,summary_HasLocationValues,summary_ID,summary_Latitude,summary_Longitude,details_WorkSchedule,details_WorkConditions,details_EmploymentTypes,details_WorkPlace_Name,details_WorkPlace_Address_AddressLine,details_WorkPlace_Address_Country_Id,details_WorkPlace_Address_Country_Name,details_WorkPlace_Address_Municipality_Id,details_WorkPlace_Address_Municipality_Name,details_WorkPlace_Address_Region_Id,details_WorkPlace_Address_Region_Name,details_WorkPlace_Address_PostalCode,details_WorkPlace_Address_City,details_WorkPlace_PhoneNumber_Number,details_WorkPlace_PhoneNumber_Type,details_WorkPlace_PhoneNumber_Description,details_WorkPlace_FaxNumber,details_WorkPlace_Email,details_WorkPlace_WebAddress,details_WorkPlace_Description,details_WorkPlace_Logo,details_WorkPlace_WorkPlaceOrganizationNumber,details_WorkPlace_OrganizationNumber,details_WorkPlace_OrganizationDescription,details_JobPositionPosting_Id,details_JobPositionPosting_OriginalJppId,details_JobPositionPosting_HiringOrg_Name,details_JobPositionPosting_HiringOrg_Address_AddressLine,details_JobPositionPosting_HiringOrg_Address_Country_Id,details_JobPositionPosting_HiringOrg_Address_Country_Name,details_JobPositionPosting_HiringOrg_Address_Municipality_Id,details_JobPositionPosting_HiringOrg_Address_Municipality_Name,details_JobPositionPosting_HiringOrg_Address_Region_Id,details_JobPositionPosting_HiringOrg_Address_Region_Name,details_JobPositionPosting_HiringOrg_Address_PostalCode,details_JobPositionPosting_HiringOrg_Address_City,details_JobPositionPosting_HiringOrg_PhoneNumber_Number,details_JobPositionPosting_HiringOrg_PhoneNumber_Type,details_JobPositionPosting_HiringOrg_PhoneNumber_Description,details_JobPositionPosting_HiringOrg_FaxNumber,details_JobPositionPosting_HiringOrg_Email,details_JobPositionPosting_HiringOrg_WebAddress,details_JobPositionPosting_HiringOrg_Description,details_JobPositionPosting_HiringOrg_Logo,details_JobPositionPosting_HiringOrg_WorkPlaceOrganizationNumber,details_JobPositionPosting_HiringOrg_OrganizationNumber,details_JobPositionPosting_HiringOrg_OrganizationDescription,details_JobPositionPosting_RecruitingCompany,details_JobPositionPosting_PublicationStartDate,details_JobPositionPosting_PublicationEndDate,details_JobPositionPosting_JobPositionInformation_PositionTitle,details_JobPositionPosting_JobPositionInformation_Purpose,details_JobPositionPosting_JobPositionInformation_WorkLocation_AddressLine,details_JobPositionPosting_JobPositionInformation_WorkLocation_Country_Id,details_JobPositionPosting_JobPositionInformation_WorkLocation_Country_Name,details_JobPositionPosting_JobPositionInformation_WorkLocation_Municipality_Id,details_JobPositionPosting_JobPositionInformation_WorkLocation_Municipality_Name,details_JobPositionPosting_JobPositionInformation_WorkLocation_Region_Id,details_JobPositionPosting_JobPositionInformation_WorkLocation_Region_Name,details_JobPositionPosting_JobPositionInformation_WorkLocation_PostalCode,details_JobPositionPosting_JobPositionInformation_WorkLocation_City,details_JobPositionPosting_JobPositionInformation_EmploymentType,details_JobPositionPosting_JobPositionInformation_WeeklyWorkHours_TypeId,details_JobPositionPosting_JobPositionInformation_WeeklyWorkHours_TypeName,details_JobPositionPosting_JobPositionInformation_WeeklyWorkHours_Description,details_JobPositionPosting_JobPositionInformation_CompensationDescription,details_JobPositionPosting_JobPositionInformation_NumberToFill,details_JobPositionPosting_JobPositionInformation_DriverLicense,details_JobPositionPosting_JobPositionInformation_Occupation_DiscoWeb,details_JobPositionPosting_JobPositionInformation_Occupation_AlternateNames,details_JobPositionPosting_JobPositionInformation_Occupation_GroupId,details_JobPositionPosting_JobPositionInformation_Occupation_AreaId,details_JobPositionPosting_JobPositionInformation_Occupation_Id,details_JobPositionPosting_JobPositionInformation_Occupation_Name,details_JobPositionPosting_JobPositionInformation_IsGovernmentHiring,details_JobPositionPosting_JobPositionInformation_JppContacts,details_JobPositionPosting_JobPositionInformation_EmploymentDate,details_JobPositionPosting_IsRecruitmentOfForeignNationals,details_JobPositionPosting_IsWorkInDenmark,details_JobPositionPosting_IsAnonymousEmployer,details_JobPositionPosting_IsDisabilityFriendly,details_JobPositionPosting_JppType,details_JobPositionPosting_ApplicationDetails_WorkHourMax,details_JobPositionPosting_ApplicationDetails_WorkHourMin,details_JobPositionPosting_ApplicationDetails_DailyWorkTimeWeekend,details_JobPositionPosting_ApplicationDetails_DailyWorkTimeNight,details_JobPositionPosting_ApplicationDetails_DailyWorkTimeEvening,details_JobPositionPosting_ApplicationDetails_DailyWorkTimeDay,details_JobPositionPosting_ApplicationDetails_ReferenceText,details_JobPositionPosting_ApplicationDetails_RemarksToApplicant,details_JobPositionPosting_ApplicationDetails_ByEmail,details_JobPositionPosting_ApplicationDetails_ByPhone,details_JobPositionPosting_ApplicationDetails_ApplyViaUrl,details_JobPositionPosting_ApplicationDetails_ReplyInWriting,details_JobPositionPosting_ApplicationDetails_ApplicationDeadlineDate,details_JobPositionPosting_ContactAuthorityPhoneNumber_Number,details_JobPositionPosting_ContactAuthorityPhoneNumber_Type,details_JobPositionPosting_ContactAuthorityPhoneNumber_Description,details_JobPositionPosting_Status,details_LogoUrl,details_Address,details_ShowMap,details_ShowShareButtonJobLog,details_JobLogUrl,details_JobLogTemplateModel_Identifier,details_JobLogTemplateModel_UseWorkPlaceAddressForJoblog,details_JobLogTemplateModel_Category,details_JobLogTemplateModel_CvCustomerIdentifier,details_JobLogTemplateModel_JobSeekingStatus,details_JobLogTemplateModel_Title,details_JobLogTemplateModel_IsApplicationSourceRequired,details_JobLogTemplateModel_ApplicationSource,details_JobLogTemplateModel_IsWeeklyWorkTimeRequired,details_JobLogTemplateModel_WeeklyWorkTime,details_JobLogTemplateModel_HoursPerWeek,details_JobLogTemplateModel_JobnetJobPostingIdentifier,details_JobLogTemplateModel_JobAdDocument_Title,details_JobLogTemplateModel_JobAdDocument_Identifier,details_JobLogTemplateModel_JobAdDocument_IsDeletedBySystem,details_JobLogTemplateModel_JobAdDocument_IsDeletedByUser,details_JobLogTemplateModel_JobAdFile,details_JobLogTemplateModel_Company_JobLogEntryCategory,details_JobLogTemplateModel_Company_ShowAddressFieldsEvenIfEmpty,details_JobLogTemplateModel_Company_Name,details_JobLogTemplateModel_Company_Address,details_JobLogTemplateModel_Company_Country,details_JobLogTemplateModel_Company_EmploymentAreaID,details_JobLogTemplateModel_Company_PostCode,details_JobLogTemplateModel_Company_IsCountryAndTownAndPostCodeEmpty,details_JobLogTemplateModel_Company_IsTownAndPostCodeEmpty,details_JobLogTemplateModel_Company_IsCountryDanmark,details_JobLogTemplateModel_Company_Town,details_JobLogTemplateModel_Company_ContactPerson,details_JobLogTemplateModel_Company_Phone,details_JobLogTemplateModel_Company_Email,details_JobLogTemplateModel_Company_Latitude,details_JobLogTemplateModel_Company_Longitude,details_JobLogTemplateModel_Company_DailyTravelTimeInMinutes,details_JobLogTemplateModel_Company_DistanceToCompanyInMeters,details_JobLogTemplateModel_Company_IsCreateMode,details_JobLogTemplateModel_TypeOfSubmission,details_JobLogTemplateModel_SubmissionDate,details_JobLogTemplateModel_SubmissionDateFormatted,details_JobLogTemplateModel_SubmissionDateTiks,details_JobLogTemplateModel_IsSubmissionDateRequired,details_JobLogTemplateModel_Status,details_JobLogTemplateModel_DateCreatedFormatted,details_JobLogTemplateModel_DateCreated,details_JobLogTemplateModel_DateModifiedFormatted,details_JobLogTemplateModel_DateModified,details_JobLogTemplateModel_LastModifiedDateTiks,details_JobLogTemplateModel_DateClosed,details_JobLogTemplateModel_JobApplicationDocument_Title,details_JobLogTemplateModel_JobApplicationDocument_Identifier,details_JobLogTemplateModel_JobApplicationDocument_IsDeletedBySystem,details_JobLogTemplateModel_JobApplicationDocument_IsDeletedByUser,details_JobLogTemplateModel_CvDocument_Title,details_JobLogTemplateModel_CvDocument_Identifier,details_JobLogTemplateModel_CvDocument_IsDeletedBySystem,details_JobLogTemplateModel_CvDocument_IsDeletedByUser,details_JobLogTemplateModel_JobApplicationFile,details_JobLogTemplateModel_CvFile,details_JobLogTemplateModel_SubmissionDeadlineDate,details_JobLogTemplateModel_IsPersisted,details_JobLogTemplateModel_ServerValidationErrors,details_JobLogTemplateModel_HasServerValidationErrors,details_JoblogWorkTime_WorkHour,details_JoblogWorkTime_DailyWorkTime,details_Place,details_OpenPrintDialog,details_WorkPlaceInfoText,details_JobCenterContactDetails,details_WorkPlaceDescriptionText,details_FavoriteText,details_IsFavorite,details_ShowFavorite,details_MetaOgTextForSharing,details_DescriptionForSharing,details_TitleForSharing,details_RutePlan,details_FormattedPurpose,details_MapUrl,details_OrganizationNumber,details_ShowSearchJobButton,details_ShowPrint,details_BackToFindWorkButtonUrl,isExternal
0,False,1,Rekrutteringskonsulent i graduateforløb,Rekrutteringskonsulent i graduateforløb,"Rekrutteringskonsulent i et Graduateforløb
Full time / Capax Recruitment / Danmark
Vil du være rekrutteringskonsulent i et Graduateforløb fra august 2022? Kunne du tænke dig at ar",CAPAX RECRUITMENT ApS,Orient Plads 1,2150,Nordhavn,False,False,False,True,2022-04-12T00:00:00,2022-06-07T00:00:00,7. juni 2022,0001-01-01T00:00:00,False,False,https://job.jobnet.dk/CV/FindWork/Details/5576781,Hovedstaden og Bornholm,København,Danmark,2150,,,,Fuldtid,Akademisk arbejde,"Organisation, udvikling og rådgivning","Researcher, rekruttering",55.7111,12.5953,,Dag,90669,83825,33079974,False,False,https://job.jobnet.dk/CV/FindWork/DetailsSocialmedia/5576781,https://job.jobnet.dk/CV/FindWork/Details/5576781,https://job.jobnet.dk/CV/FindWork/Details/5576781,True,5576781,55.7111,12.5953,"{'Id': 1, 'Name': 'Fuldtid'}, {'Id': 16, 'Name': 'Deltid'}","{'Id': 1, 'Name': 'Almindelige vilkår'}, {'Id': 2, 'Name': 'Fleksjob'}, {'Id': 3, 'Name': 'Skånejob'}, {'Id': 4, 'Name': 'Egnet til efterlønnere og seniorer'}, {'Id': 5, 'Name': 'Job med løntilskud'}, {'Id': 6, 'Name': 'Rotationsjob'}, {'Id': 7, 'Name': 'Virksomhedspraktik'}","{'Id': 1, 'Name': 'Fastansættelse'}, {'Id': 16, 'Name': 'Tidsbegrænset ansættelse'}",CAPAX RECRUITMENT ApS,Orient Plads 1,58,Danmark,101,København,4,"Hovedstaden, Sjælland og Bornholm",2150,Nordhavn,,0,Primary,,,,"Capax Recruitment er den førende konsulent- og rekrutteringsvirksomhed inden for ingeniør og IT-specialister i Danmark. Capax er eksperter i headhunting af ingeniører, tekniske eksperter samt mellemledere.",90669,1016251875,33079974,"Capax Recruitment helps Danish companies find talented engineers and IT-specialists abroad. Through our recruitment teams of Danish and local recruitment specialists, we are able to find even the most demanding profiles. 

Our mission is to be the best at recruting specialists from abroad to Danish companies. This is a mission statement which obligates",5576781,5576781,CAPAX RECRUITMENT ApS,Orient Plads 1,58,Danmark,101,København,4,"Hovedstaden, Sjælland og Bornholm",2150,Nordhavn,,0,Primary,,,,"Capax Recruitment er den førende konsulent- og rekrutteringsvirksomhed inden for ingeniør og IT-specialister i Danmark. Capax er eksperter i headhunting af ingeniører, tekniske eksperter samt mellemledere.",90669,1016251875,33079974,"Capax Recruitment helps Danish companies find talented engineers and IT-specialists abroad. Through our recruitment teams of Danish and local recruitment specialists, we are able to find even the most demanding profiles. 

Our mission is to be the best at recruting specialists from abroad to Danish companies. This is a mission statement which obligates",,2022-04-12T00:00:00,2022-06-07T00:00:00,Rekrutteringskonsulent i graduateforløb,"Rekrutteringskonsulent i et Graduateforløb 
 Full time / Capax Recruitment / Danmark 
 Vil du være rekrutteringskonsulent i et Graduateforløb fra august 2022? Kunne du tænke dig at arbejde med et af erhvervslivets største udfordringer – nemlig rekruttering af nye medarbejdere? Brænder du for at matche kandidater og virksomheder? Så er du måske den kollega, vi søger til at blive en del af vores team hos Capax Recruitment. Hos Capax søger vi nye graduates med opstart d. 1. august, som vil være en del af vores unge og ambitiøse team af kollegaer, og som vil med på en spændende udviklingsrejse ind i rekrutteringsbranchen. I stillingen som Graduate, vil du komme til at arbejde med headhunting af IT & tech specialister til store danske og internationale virksomheder og konsulenthuse. 
 Vores Graduate-program 
 Graduate-programmet hos Capax forløber sig over 12 måneder, og formålet er at give dig kompetencer, der gør dig til en selvstændig rekrutteringskonsulent med ansvar for dine egne rekrutteringsopgaver og kunder. 
 Gennem forløbet bliver du introduceret til værktøjer og opgaver i tech-verdenen, der giver dig en stærk forståelse for hele rekrutteringsprocessen samt et unikt branchekendskab. Hos os er arbejdstempoet højt og læringskurven stejl, og du vil derfor hurtigt få ansvarsområder som en Rekrutteringskonsulent og dermed blive medansvarlig på igangværende samt nye rekrutteringsopgaver. 
 Når programmet afsluttes, vil du have opbygget solide rekrutteringskompetencer med stærk indsigt i konsulentrollen, og du vil samtidig være trænet i at håndtere dine egne kunder og rekrutteringsprocesser fra A-Z. Sidst i programmet vil du desuden blive certificeret inden for et personlighedstestværktøj, så du bliver i stand til at give testfeedback til både dine kandidater og kunder. 
 I Capax værdsættes vidensdeling højt og indgår som en naturlig del af hverdagen. Du vil derfor som Graduate blive tilknyttet en teamleder og løbende modtage faglig sparring og feedback, som er med til at understøtte din læring og udvikle dine kompetencer mod en fremtidig konsulentrolle. Vidensdeling er samtidig et fast punkt på månedsmøder, hvor nye emner løbende tages op og diskuteres i plenum. Foruden vidensdeling i fællesskab og 1:1 med din teamleder, vil der også være direkte sparring og daglig dialog med andre dygtige kolleger, der har siddet med lignende faglige udfordringer, som du selv måtte opleve. 
 Moduler 
 Graduate-programmet består af forskellige læringsprocesser opdelt i tre moduler. 
 Modul 1 – Search & selection 
 
 Udarbejde searchstrategier i samarbejde med seniorkonsulenten 
 Search i diverse databaser 
 Skrive stillingsopslag og publicere disse på relevante medier 
 Telefoninterviews med kandidater 
 Deltage på opstartsmøder hos kunden sammen med seniorkonsulenterne 
 
 Modul 2 – Jobprofil & kandidatpræsentation 
 
 Indlede skriftlige og telefoniske dialoger 
 Udvælge og screene kandidater 
 Deltage i personlige interviews sammen med seniorkonsulenterne 
 
 Modul 3 – Test af kandidater/Personlige interviews/Client advisory 
 
 Vurdere profiler og udforme kandidatpræsentationer 
 Deltage på kundemøder sammen med konsulenterne 
 
 Hvilke forestillinger har vi om dig? 
 Vi forestiller os, at du lige har færdiggjort din kandidatuddannelse inden for HRM, kommunikation, psykologi eller lignende relevant uddannelse. Tidligere erfaring med rekruttering er ikke et krav, men det er derimod essentielt, at du har en nysgerrig interesse for rekruttering – og at du har både motivationen og lysten til at lære og udvikle dig som rekrutteringskonsulent. 
 Som person er du udadvendt, struktureret og trives i et dynamisk arbejdsmiljø, hvor det falder dig naturligt at etablere nye relationer. Da arbejdspresset ofte er højt pga. deadlines med kunder, er det vigtigt at du også er handlekraftig og resultatorienteret. 
 Om Capax Recruitment 
 Capax er et ambitiøst konsulenthus med fokus på vækst, og vi har to år i træk modtaget Børsens Gazellepris. På nuværende tidspunkt er vi 20 medarbejdere, heraf 15 konsulenter. Vi har et ungt arbejdsmiljø, hvor alle har mulighed for at bidrage med inputs, og det er samtidig essentielt, at vores medarbejdere føler ejerskab og ansvar for deres projekter. Hos Capax er det vigtigt, at vores medarbejdere trives og arbejdsmiljøet er tiltalende. Vores lækre frokost fra Cofoco bliver nydt i fællesskab i køkkenet eller på terrassen, og vi hygger til morgenmad hver mandag. Foruden at samles om de daglige måltider, gør vi også meget ud af at prioritere sociale arrangementer og et stærkt sammenhold, bl.a. gennem månedlige fredagsbarer, diverse aktivitetsdage, julefrokoster og strategiture. Vores kontor er placeret i hjertet af Nordhavn i et moderniseret pakhus, blot 50 meter fra Orientkaj metro, med udsigt over vandet. Stemningen er forstærket af de store arbejdsrum, højt til loftet og åbne kontorlandskaber. 
 Praktisk information Vi holder opstart for graduates af flere omgange, hvorfor du har mulighed for at startet d. 1. august 2022. Skulle du have interesse for at arbejde hos os på deltid inden graduateforløbet starter, er der også mulighed for det som juniorkonsulent. 
 Har du yderligere spørgsmål til stillingen, er du velkommen til at kontakte Iben Trier på mail itr@capax.dk. For yderligere information om Capax, er du velkommen til at læse nærmere på vores hjemmeside: www.capax.dk. 
 Ansøgning 
 Synes du, at ovenstående lyder spændende, og ønsker du at prøve kræfter med en stilling, hvor du vil blive fagligt udfordret og udvikle dine kompetencer med raketfart? – så send os din ansøgning, CV samt karakterbevis via dette link. 
 Vi indkalder løbende til samtaler, så send gerne din ansøgning hurtigst muligt.",Orient Plads 1,58,Danmark,101,København,4,"Hovedstaden, Sjælland og Bornholm",2150,Nordhavn,1,1,Fuldtid,None,None,1,,0,,0,0,0,,False,"{'Id': 7904999, 'Email': 'itr@capaxrecruitment.com', 'FaxNumber': None, 'PersonName': 'Iben Trier', 'FirstName': 'Iben', 'LastName': 'Trier', 'PositionTitle': None, 'PhoneNumbers': []}",,False,False,False,False,4,,,False,False,False,True,,,,,https://capaxrecruitment.dk/project/kickstart-din-karriere-inden-for-headhunting/,True,2022-06-07T00:00:00,,0,Primary,7,/CV/FindWork/GetLogo?JobAdId=5576781&WorkPlace=90669&Organisation=33079974,"Orient Plads 1,2150, Nordhavn",True,False,/CV/Jobseeking/JobLog/CreateJobSearch?JobnetJobPostingIdentifier=5576781&Company.Name=CAPAX RECRUITMENT ApS&SubmissionDeadlineDate=2022-6-7&Title=Rekrutteringskonsulent i graduateforløb&WeeklyWorkTime=1,00000000-0000-0000-0000-000000000000,False,0,,,Rekrutteringskonsulent i graduateforløb,True,,True,1,,5576781,,,False,False,,0,False,CAPAX RECRUITMENT ApS,Orient Plads 1,,,2150,False,False,False,Nordhavn,Iben Trier,,itr@capaxrecruitment.com,,,,,False,,2022-06-07T00:00:00,,0,False,0,,,,,0,,,,False,False,,,False,False,,,,False,,False,,Dag,Arbejdspladsen ligger i København kommune,False,CAPAX RECRUITMENT ApS,,"Capax Recruitment er den førende konsulent- og rekrutteringsvirksomhed inden for ingeniør og IT-specialister i Danmark. Capax er eksperter i headhunting af ingeniører, tekniske eksperter samt mellemledere.",,False,False,"Rekrutteringskonsulent i et Graduateforl&oslash;b
Full time / Capax Recruitment / Danmark
Vil du v&aelig;re rekrutteringskonsulent i et Graduateforl&oslash;b fra august 2022? Kunne du t&aelig;nke dig at arbejde med et af erhvervslivets st&oslash;rste udfordringer &ndash; nemlig rekruttering af nye medarbejdere? Br&aelig;nder du for at matche kandid","""Rekrutteringskonsulent i et Graduateforl\u0026oslash;b\nFull time / Capax Recruitment / Danmark\nVil du v\u0026aelig;re rekrutteringskonsulent i et Graduateforl\u0026oslash;b fra august 2022? Kunne du t\u0026aelig;nke dig at arbejde med et af erhvervslivets st\u0026oslash;rste udfordringer \u0026ndash; nemlig rekruttering af nye medarbejdere? Br\u0026aelig;nder du for at matche kandid""","""Rekrutteringskonsulent i graduateforløb""","https://www.google.dk/maps/dir//Orient+Plads+1,2150,+Nordhavn/","Rekrutteringskonsulent i et Graduateforløb 
 Full time / Capax Recruitment / Danmark 
 Vil du være rekrutteringskonsulent i et Graduateforløb fra august 2022? Kunne du tænke dig at arbejde med et af erhvervslivets største udfordringer – nemlig rekruttering af nye medarbejdere? Brænder du for at matche kandidater og virksomheder? Så er du måske den kollega, vi søger til at blive en del af vores team hos Capax Recruitment. Hos Capax søger vi nye graduates med opstart d. 1. august, som vil være en del af vores unge og ambitiøse team af kollegaer, og som vil med på en spændende udviklingsrejse ind i rekrutteringsbranchen. I stillingen som Graduate, vil du komme til at arbejde med headhunting af IT & tech specialister til store danske og internationale virksomheder og konsulenthuse. 
 Vores Graduate-program 
 Graduate-programmet hos Capax forløber sig over 12 måneder, og formålet er at give dig kompetencer, der gør dig til en selvstændig rekrutteringskonsulent med ansvar for dine egne rekrutteringsopgaver og kunder. 
 Gennem forløbet bliver du introduceret til værktøjer og opgaver i tech-verdenen, der giver dig en stærk forståelse for hele rekrutteringsprocessen samt et unikt branchekendskab. Hos os er arbejdstempoet højt og læringskurven stejl, og du vil derfor hurtigt få ansvarsområder som en Rekrutteringskonsulent og dermed blive medansvarlig på igangværende samt nye rekrutteringsopgaver. 
 Når programmet afsluttes, vil du have opbygget solide rekrutteringskompetencer med stærk indsigt i konsulentrollen, og du vil samtidig være trænet i at håndtere dine egne kunder og rekrutteringsprocesser fra A-Z. Sidst i programmet vil du desuden blive certificeret inden for et personlighedstestværktøj, så du bliver i stand til at give testfeedback til både dine kandidater og kunder. 
 I Capax værdsættes vidensdeling højt og indgår som en naturlig del af hverdagen. Du vil derfor som Graduate blive tilknyttet en teamleder og løbende modtage faglig sparring og feedback, som er med til at understøtte din læring og udvikle dine kompetencer mod en fremtidig konsulentrolle. Vidensdeling er samtidig et fast punkt på månedsmøder, hvor nye emner løbende tages op og diskuteres i plenum. Foruden vidensdeling i fællesskab og 1:1 med din teamleder, vil der også være direkte sparring og daglig dialog med andre dygtige kolleger, der har siddet med lignende faglige udfordringer, som du selv måtte opleve. 
 Moduler 
 Graduate-programmet består af forskellige læringsprocesser opdelt i tre moduler. 
 Modul 1 – Search & selection 
 
 Udarbejde searchstrategier i samarbejde med seniorkonsulenten 
 Search i diverse databaser 
 Skrive stillingsopslag og publicere disse på relevante medier 
 Telefoninterviews med kandidater 
 Deltage på opstartsmøder hos kunden sammen med seniorkonsulenterne 
 
 Modul 2 – Jobprofil & kandidatpræsentation 
 
 Indlede skriftlige og telefoniske dialoger 
 Udvælge og screene kandidater 
 Deltage i personlige interviews sammen med seniorkonsulenterne 
 
 Modul 3 – Test af kandidater/Personlige interviews/Client advisory 
 
 Vurdere profiler og udforme kandidatpræsentationer 
 Deltage på kundemøder sammen med konsulenterne 
 
 Hvilke forestillinger har vi om dig? 
 Vi forestiller os, at du lige har færdiggjort din kandidatuddannelse inden for HRM, kommunikation, psykologi eller lignende relevant uddannelse. Tidligere erfaring med rekruttering er ikke et krav, men det er derimod essentielt, at du har en nysgerrig interesse for rekruttering – og at du har både motivationen og lysten til at lære og udvikle dig som rekrutteringskonsulent. 
 Som person er du udadvendt, struktureret og trives i et dynamisk arbejdsmiljø, hvor det falder dig naturligt at etablere nye relationer. Da arbejdspresset ofte er højt pga. deadlines med kunder, er det vigtigt at du også er handlekraftig og resultatorienteret. 
 Om Capax Recruitment 
 Capax er et ambitiøst konsulenthus med fokus på vækst, og vi har to år i træk modtaget Børsens Gazellepris. På nuværende tidspunkt er vi 20 medarbejdere, heraf 15 konsulenter. Vi har et ungt arbejdsmiljø, hvor alle har mulighed for at bidrage med inputs, og det er samtidig essentielt, at vores medarbejdere føler ejerskab og ansvar for deres projekter. Hos Capax er det vigtigt, at vores medarbejdere trives og arbejdsmiljøet er tiltalende. Vores lækre frokost fra Cofoco bliver nydt i fællesskab i køkkenet eller på terrassen, og vi hygger til morgenmad hver mandag. Foruden at samles om de daglige måltider, gør vi også meget ud af at prioritere sociale arrangementer og et stærkt sammenhold, bl.a. gennem månedlige fredagsbarer, diverse aktivitetsdage, julefrokoster og strategiture. Vores kontor er placeret i hjertet af Nordhavn i et moderniseret pakhus, blot 50 meter fra Orientkaj metro, med udsigt over vandet. Stemningen er forstærket af de store arbejdsrum, højt til loftet og åbne kontorlandskaber. 
 Praktisk information Vi holder opstart for graduates af flere omgange, hvorfor du har mulighed for at startet d. 1. august 2022. Skulle du have interesse for at arbejde hos os på deltid inden graduateforløbet starter, er der også mulighed for det som juniorkonsulent. 
 Har du yderligere spørgsmål til stillingen, er du velkommen til at kontakte Iben Trier på mail itr@capax.dk. For yderligere information om Capax, er du velkommen til at læse nærmere på vores hjemmeside:  www.capax.dk . 
 Ansøgning 
 Synes du, at ovenstående lyder spændende, og ønsker du at prøve kræfter med en stilling, hvor du vil blive fagligt udfordret og udvikle dine kompetencer med raketfart? – så send os din ansøgning, CV samt karakterbevis via dette link. 
 Vi indkalder løbende til samtaler, så send gerne din ansøgning hurtigst muligt.","https://www.google.dk/maps/place/Orient+Plads+1,2150,+Nordhavn/",33079974,False,False,,False
