summary_AutomatchType,summary_Abroad,summary_Weight,summary_Title,summary_JobHeadline,summary_Presentation,summary_HiringOrgName,summary_WorkPlaceAddress,summary_WorkPlacePostalCode,summary_WorkPlaceCity,summary_WorkPlaceOtherAddress,summary_WorkPlaceAbroad,summary_WorkPlaceNotStatic,summary_UseWorkPlaceAddressForJoblog,summary_PostingCreated,summary_LastDateApplication,summary_FormattedLastDateApplication,summary_AssignmentStartDate,summary_IsHotjob,summary_IsExternal,summary_Url,summary_Region,summary_Municipality,summary_Country,summary_PostalCode,summary_PostalCodeName,summary_JobAnnouncementType,summary_EmploymentType,summary_WorkHours,summary_OccupationArea,summary_OccupationGroup,summary_Occupation,summary_Location_Latitude,summary_Location_Longitude,summary_JoblogWorkTime_WorkHour,summary_JoblogWorkTime_DailyWorkTime,summary_WorkplaceID,summary_OrganisationId,summary_HiringOrgCVR,summary_UserLoggedIn,summary_AnonymousEmployer,summary_ShareUrl,summary_DetailsUrl,summary_JobLogUrl,summary_HasLocationValues,summary_ID,summary_Latitude,summary_Longitude,details_WorkSchedule,details_WorkConditions,details_EmploymentTypes,details_WorkPlace_Name,details_WorkPlace_Address_AddressLine,details_WorkPlace_Address_Country_Id,details_WorkPlace_Address_Country_Name,details_WorkPlace_Address_Municipality_Id,details_WorkPlace_Address_Municipality_Name,details_WorkPlace_Address_Region_Id,details_WorkPlace_Address_Region_Name,details_WorkPlace_Address_PostalCode,details_WorkPlace_Address_City,details_WorkPlace_PhoneNumber_Number,details_WorkPlace_PhoneNumber_Type,details_WorkPlace_PhoneNumber_Description,details_WorkPlace_FaxNumber,details_WorkPlace_Email,details_WorkPlace_WebAddress,details_WorkPlace_Description,details_WorkPlace_Logo,details_WorkPlace_WorkPlaceOrganizationNumber,details_WorkPlace_OrganizationNumber,details_WorkPlace_OrganizationDescription,details_JobPositionPosting_Id,details_JobPositionPosting_OriginalJppId,details_JobPositionPosting_HiringOrg_Name,details_JobPositionPosting_HiringOrg_Address_AddressLine,details_JobPositionPosting_HiringOrg_Address_Country_Id,details_JobPositionPosting_HiringOrg_Address_Country_Name,details_JobPositionPosting_HiringOrg_Address_Municipality_Id,details_JobPositionPosting_HiringOrg_Address_Municipality_Name,details_JobPositionPosting_HiringOrg_Address_Region_Id,details_JobPositionPosting_HiringOrg_Address_Region_Name,details_JobPositionPosting_HiringOrg_Address_PostalCode,details_JobPositionPosting_HiringOrg_Address_City,details_JobPositionPosting_HiringOrg_PhoneNumber_Number,details_JobPositionPosting_HiringOrg_PhoneNumber_Type,details_JobPositionPosting_HiringOrg_PhoneNumber_Description,details_JobPositionPosting_HiringOrg_FaxNumber,details_JobPositionPosting_HiringOrg_Email,details_JobPositionPosting_HiringOrg_WebAddress,details_JobPositionPosting_HiringOrg_Description,details_JobPositionPosting_HiringOrg_Logo,details_JobPositionPosting_HiringOrg_WorkPlaceOrganizationNumber,details_JobPositionPosting_HiringOrg_OrganizationNumber,details_JobPositionPosting_HiringOrg_OrganizationDescription,details_JobPositionPosting_RecruitingCompany,details_JobPositionPosting_PublicationStartDate,details_JobPositionPosting_PublicationEndDate,details_JobPositionPosting_JobPositionInformation_PositionTitle,details_JobPositionPosting_JobPositionInformation_Purpose,details_JobPositionPosting_JobPositionInformation_WorkLocation_AddressLine,details_JobPositionPosting_JobPositionInformation_WorkLocation_Country_Id,details_JobPositionPosting_JobPositionInformation_WorkLocation_Country_Name,details_JobPositionPosting_JobPositionInformation_WorkLocation_Municipality_Id,details_JobPositionPosting_JobPositionInformation_WorkLocation_Municipality_Name,details_JobPositionPosting_JobPositionInformation_WorkLocation_Region_Id,details_JobPositionPosting_JobPositionInformation_WorkLocation_Region_Name,details_JobPositionPosting_JobPositionInformation_WorkLocation_PostalCode,details_JobPositionPosting_JobPositionInformation_WorkLocation_City,details_JobPositionPosting_JobPositionInformation_EmploymentType,details_JobPositionPosting_JobPositionInformation_WeeklyWorkHours_TypeId,details_JobPositionPosting_JobPositionInformation_WeeklyWorkHours_TypeName,details_JobPositionPosting_JobPositionInformation_WeeklyWorkHours_Description,details_JobPositionPosting_JobPositionInformation_CompensationDescription,details_JobPositionPosting_JobPositionInformation_NumberToFill,details_JobPositionPosting_JobPositionInformation_DriverLicense,details_JobPositionPosting_JobPositionInformation_Occupation_DiscoWeb,details_JobPositionPosting_JobPositionInformation_Occupation_AlternateNames,details_JobPositionPosting_JobPositionInformation_Occupation_GroupId,details_JobPositionPosting_JobPositionInformation_Occupation_AreaId,details_JobPositionPosting_JobPositionInformation_Occupation_Id,details_JobPositionPosting_JobPositionInformation_Occupation_Name,details_JobPositionPosting_JobPositionInformation_IsGovernmentHiring,details_JobPositionPosting_JobPositionInformation_JppContacts,details_JobPositionPosting_JobPositionInformation_EmploymentDate,details_JobPositionPosting_IsRecruitmentOfForeignNationals,details_JobPositionPosting_IsWorkInDenmark,details_JobPositionPosting_IsAnonymousEmployer,details_JobPositionPosting_IsDisabilityFriendly,details_JobPositionPosting_JppType,details_JobPositionPosting_ApplicationDetails_WorkHourMax,details_JobPositionPosting_ApplicationDetails_WorkHourMin,details_JobPositionPosting_ApplicationDetails_DailyWorkTimeWeekend,details_JobPositionPosting_ApplicationDetails_DailyWorkTimeNight,details_JobPositionPosting_ApplicationDetails_DailyWorkTimeEvening,details_JobPositionPosting_ApplicationDetails_DailyWorkTimeDay,details_JobPositionPosting_ApplicationDetails_ReferenceText,details_JobPositionPosting_ApplicationDetails_RemarksToApplicant,details_JobPositionPosting_ApplicationDetails_ByEmail,details_JobPositionPosting_ApplicationDetails_ByPhone,details_JobPositionPosting_ApplicationDetails_ApplyViaUrl,details_JobPositionPosting_ApplicationDetails_ReplyInWriting,details_JobPositionPosting_ApplicationDetails_ApplicationDeadlineDate,details_JobPositionPosting_ContactAuthorityPhoneNumber_Number,details_JobPositionPosting_ContactAuthorityPhoneNumber_Type,details_JobPositionPosting_ContactAuthorityPhoneNumber_Description,details_JobPositionPosting_Status,details_LogoUrl,details_Address,details_ShowMap,details_ShowShareButtonJobLog,details_JobLogUrl,details_JobLogTemplateModel_Identifier,details_JobLogTemplateModel_UseWorkPlaceAddressForJoblog,details_JobLogTemplateModel_Category,details_JobLogTemplateModel_CvCustomerIdentifier,details_JobLogTemplateModel_JobSeekingStatus,details_JobLogTemplateModel_Title,details_JobLogTemplateModel_IsApplicationSourceRequired,details_JobLogTemplateModel_ApplicationSource,details_JobLogTemplateModel_IsWeeklyWorkTimeRequired,details_JobLogTemplateModel_WeeklyWorkTime,details_JobLogTemplateModel_HoursPerWeek,details_JobLogTemplateModel_JobnetJobPostingIdentifier,details_JobLogTemplateModel_JobAdDocument_Title,details_JobLogTemplateModel_JobAdDocument_Identifier,details_JobLogTemplateModel_JobAdDocument_IsDeletedBySystem,details_JobLogTemplateModel_JobAdDocument_IsDeletedByUser,details_JobLogTemplateModel_JobAdFile,details_JobLogTemplateModel_Company_JobLogEntryCategory,details_JobLogTemplateModel_Company_ShowAddressFieldsEvenIfEmpty,details_JobLogTemplateModel_Company_Name,details_JobLogTemplateModel_Company_Address,details_JobLogTemplateModel_Company_Country,details_JobLogTemplateModel_Company_EmploymentAreaID,details_JobLogTemplateModel_Company_PostCode,details_JobLogTemplateModel_Company_IsCountryAndTownAndPostCodeEmpty,details_JobLogTemplateModel_Company_IsTownAndPostCodeEmpty,details_JobLogTemplateModel_Company_IsCountryDanmark,details_JobLogTemplateModel_Company_Town,details_JobLogTemplateModel_Company_ContactPerson,details_JobLogTemplateModel_Company_Phone,details_JobLogTemplateModel_Company_Email,details_JobLogTemplateModel_Company_Latitude,details_JobLogTemplateModel_Company_Longitude,details_JobLogTemplateModel_Company_DailyTravelTimeInMinutes,details_JobLogTemplateModel_Company_DistanceToCompanyInMeters,details_JobLogTemplateModel_Company_IsCreateMode,details_JobLogTemplateModel_TypeOfSubmission,details_JobLogTemplateModel_SubmissionDate,details_JobLogTemplateModel_SubmissionDateFormatted,details_JobLogTemplateModel_SubmissionDateTiks,details_JobLogTemplateModel_IsSubmissionDateRequired,details_JobLogTemplateModel_Status,details_JobLogTemplateModel_DateCreatedFormatted,details_JobLogTemplateModel_DateCreated,details_JobLogTemplateModel_DateModifiedFormatted,details_JobLogTemplateModel_DateModified,details_JobLogTemplateModel_LastModifiedDateTiks,details_JobLogTemplateModel_DateClosed,details_JobLogTemplateModel_JobApplicationDocument_Title,details_JobLogTemplateModel_JobApplicationDocument_Identifier,details_JobLogTemplateModel_JobApplicationDocument_IsDeletedBySystem,details_JobLogTemplateModel_JobApplicationDocument_IsDeletedByUser,details_JobLogTemplateModel_CvDocument_Title,details_JobLogTemplateModel_CvDocument_Identifier,details_JobLogTemplateModel_CvDocument_IsDeletedBySystem,details_JobLogTemplateModel_CvDocument_IsDeletedByUser,details_JobLogTemplateModel_JobApplicationFile,details_JobLogTemplateModel_CvFile,details_JobLogTemplateModel_SubmissionDeadlineDate,details_JobLogTemplateModel_IsPersisted,details_JobLogTemplateModel_ServerValidationErrors,details_JobLogTemplateModel_HasServerValidationErrors,details_JoblogWorkTime_WorkHour,details_JoblogWorkTime_DailyWorkTime,details_Place,details_OpenPrintDialog,details_WorkPlaceInfoText,details_JobCenterContactDetails,details_WorkPlaceDescriptionText,details_FavoriteText,details_IsFavorite,details_ShowFavorite,details_MetaOgTextForSharing,details_DescriptionForSharing,details_TitleForSharing,details_RutePlan,details_FormattedPurpose,details_MapUrl,details_OrganizationNumber,details_ShowSearchJobButton,details_ShowPrint,details_BackToFindWorkButtonUrl,isExternal
0,False,1,"Kokke og Souschefer søges til kantiner i KBH, der laver mad med mening","Kokke og Souschefer søges til kantiner i KBH, der laver mad med mening","Coor søger Kokke og Souschefer til vores FOOD by Coor division, til vores kunder i København: Bygningsstyrelsen samt Politiet, Kriminalforsorgen og den centrale Anklagemyndighed (PKA).
Lyder",COOR SERVICE MANAGEMENT A/S,,1218,København K,True,False,False,False,2022-04-12T00:00:00,2022-05-12T00:00:00,12. maj 2022,0001-01-01T00:00:00,False,False,https://job.jobnet.dk/CV/FindWork/Details/5577106,Hovedstaden og Bornholm,København,Danmark,1218,,,,Fuldtid,"Hotel, restauration, køkken, kantine ",Køkken- og kantinearbejde,Kok,55.6761,12.5804,,"Dag, aften",114307,102026,10683548,False,False,https://job.jobnet.dk/CV/FindWork/DetailsSocialmedia/5577106,https://job.jobnet.dk/CV/FindWork/Details/5577106,https://job.jobnet.dk/CV/FindWork/Details/5577106,True,5577106,55.6761,12.5804,"{'Id': 1, 'Name': 'Fuldtid'}, {'Id': 16, 'Name': 'Deltid'}","{'Id': 1, 'Name': 'Almindelige vilkår'}, {'Id': 2, 'Name': 'Fleksjob'}, {'Id': 3, 'Name': 'Skånejob'}, {'Id': 4, 'Name': 'Egnet til efterlønnere og seniorer'}, {'Id': 5, 'Name': 'Job med løntilskud'}, {'Id': 6, 'Name': 'Rotationsjob'}, {'Id': 7, 'Name': 'Virksomhedspraktik'}","{'Id': 1, 'Name': 'Fastansættelse'}, {'Id': 16, 'Name': 'Tidsbegrænset ansættelse'}",COOR SERVICE MANAGEMENT A/S,Hørkær 12A,58,Danmark,163,Herlev,4,"Hovedstaden, Sjælland og Bornholm",2730,Herlev,,0,Primary,,,,None,114307,1003832327,10683548,"Coor er en ledende nordisk facility management-leverandør, både inden for integrerede og komplekse serviceløsninger (IFM) og single services. Coor tilbyder serviceydelser som interne services (soft FM), ejendomsservice (hard FM) og strategisk rådgivning i form af innovation og udvikling af services. Ved at udføre, lede, udvikle og effektivisere kundernes servicevirksomheder, understøtter Coor kundernes kerneforretning samt skaber merværdi over tid. Vi kalder det smart service – SERVICE med IQ.",5577106,5577106,COOR SERVICE MANAGEMENT A/S,Hørkær 12A,58,Danmark,163,Herlev,4,"Hovedstaden, Sjælland og Bornholm",2730,Herlev,,0,Primary,,,,None,114307,1003832327,10683548,"Coor er en ledende nordisk facility management-leverandør, både inden for integrerede og komplekse serviceløsninger (IFM) og single services. Coor tilbyder serviceydelser som interne services (soft FM), ejendomsservice (hard FM) og strategisk rådgivning i form af innovation og udvikling af services. Ved at udføre, lede, udvikle og effektivisere kundernes servicevirksomheder, understøtter Coor kundernes kerneforretning samt skaber merværdi over tid. Vi kalder det smart service – SERVICE med IQ.",,2022-04-12T00:00:00,2022-05-12T00:00:00,"Kokke og Souschefer søges til kantiner i KBH, der laver mad med mening","Coor søger Kokke og Souschefer til vores FOOD by Coor division, til vores kunder i København: Bygningsstyrelsen samt Politiet, Kriminalforsorgen og den centrale Anklagemyndighed (PKA). 
 Lyder det som noget for dig? Så kom og bliv del af en kantine bemandet af madlavningsnørder, der bruger lokale råvarer, fokuserer på bæredygtighed og insisterer på at lave mad fra bunden. 
 Lokale råvarer og høj kvalitet 
 I samarbejde med resten af holdet laver du kvalitetsmad til en af vores kunders kantiner i Købehavn. Vi tror på, at vores mad skal emme af friskhed, ansvarlighed og kreative nuancer. 
 Vi sørger naturligvis for, at du bliver lært grundigt op i vores arbejdsgange og -metoder af erfarne kolleger. 
 Mindre madspild, mere kreativitet - dit kommende job i Coor's FOOD by Coor division 
 Vi søger både Kokke og Souschefer. 
 Om du tilbereder en salat med årstidens grøntsager eller nørkler med de gode udskæringer på kalven, så er det altid med kreativitet, omhyggelighed og reduktion af madspild i fokus. 
 Det bliver blandt andet dig, der:  
 
 forbereder kødprodukter fra bunden, fx frisk medister eller udskæring af hele dyr 
 tilbereder friske salater af sæsonens grønt 
 hjemmeryger varer 
 langtidstilbereder supper og gryderetter 
 
 Faktisk er det umuligt at liste det hele op – vi vil gerne undgå kassetænkningen, så bliv ikke overrasket, hvis du en dag skal lave økologisk polentapizza med ærter og burrata eller selv får en kreativ idé inden for de rammer, vi har aftalt med kunden. 
 Hvis du ansættes som Souschef, så vil du, sammen med Køkkenchefen, også komme til at 
 
 lede slagets gang i kantinen 
 sikre medarbejdernes trivsel  
 håndtere budget og fakturering 
 sætte jeres hold af kokke, catere og øvrigt køkkenpersonale 
 
 Men vi skræddersyer gerne opgaverne til dig, og du kan som Souschef derfor også tage mere over på kontakten til kunden. Det afhænger alt sammen af dine kompetencer. 
 Arbejdssted og tid 
 Arbejdssted: I en af vores kantiner i København enten hos vores kunde Bygningsstyrelsen eller Politiet, Kriminalforsorgen og den centrale Anklagemyndighed. 
 Arbejdsstid: 37 timer ugentligt mandag til fredag. Arbejdstiden er placeret mellem 06.00-16.00. Der kan forekomme enkelte aftenarrangementer, og du skal derfor være indstillet på at arbejde uden for den normale arbejdstid, ved behov. 
 Start: Hurtigst muligt, efter nærmere aftale. 
 Hvad kan Coor tilbyde mig? 
 Hos Coor får du en fantastisk arbejdsplads med en masse gode kollegaer. Udover det får du: 
 
 løn i henhold til gældende overenskomst for området og efter dine kvalifikationer samt ansvaret i jobbet 
 en god pensionsordning 
 sundhedsforsikring, som betyder, at du hurtigt kan få behandling hos fx fysioterapeut, kiropraktor mv. 
 feriehusordning (lejlighed i Spanien og sommerhuse i Danmark) 
 en personaleforening, som tilbyder billetter til attraktive priser samt Logbuy rabatordning (elektronik, tøj, restauranter mv.) 
 
 I Coor bliver du også en del af en virksomhed med 
 
 mulighed for at tale med din leder, hvis du har behov for fx ændring af din arbejdstid/arbejdssted, så I sammen kan forsøge at finde nye løsninger 
 plads til dine idéer, fordi vi har en udbredt forbedringskultur 
 høj grad af diversitet og hjælpsomme kollegaer 
 et trygt og sikkert arbejdsmiljø hvor vi arbejder aktivt med at forebygge arbejdsulykker 
 fokus på din trivsel, udvikling og uddannelse. I Coor er der mange karrieremuligheder, og dette job kan evt., på sigt, være springbrættet til andre spændende muligheder i Coor 
 
 Dine kvalifikationer - Du har gode ideer til både smag og minimering af madspild  
 Vi ser gerne, at du er en nørd ligesom os, og at du er gastronomisk velfunderet. Du holder dig opdateret på de nyeste trends i madverdenen: brænder for økologi, bruger sæsonens råvarer og tænker kreativt i forhold til smag, præsentation, minimering af madspild og brugen af hele dyr.  
 Samtidig har du gerne et godt kundetække, flair for mersalg, du er en teamplayer og god til at kommunikere med dine kollegaer og kunden. 
 Derudover har du: 
 
 minimum 2 års erfaring fra kantinebranchen 
 en faglært kokkeuddannelse 
 kørekort (der kan forekomme transport af mad i Coor bil) 
 
 Du har mulighed for at blive PET-sikkerhedsgodkendt, som er en forudsætning for ansættelse. 
 Særlige krav til  dig, hvis du søger jobbet som Souschef 
 Ud over ovenstående kvalifikationer, så er det et krav at du som Souschef i Coor har: 
 
 ledelseserfaring fra en lignende stilling og at du er empatisk, involverende og nyder at gå forrest, så du passer ind i vores ” passion for people ” tankegang 
 sans for økonomi og administration i høj nok grad til, at du kan varetage de dele af jobbet med hjælp fra vores backoffice – god mad gør det ikke alene 
 
 Lyder det som noget for dig? 
 Så send din ansøgning/CV hurtigst muligt via coor.dk under ""Ledige stillinger"". Notér i din ansøgning/dit CV, om du søger som Kok eller Souschef eller begge dele. 
 Bemærk:  Det er ikke muligt at søge stillingen via e-mail, da alle ansøgninger skal uploades via den grønne knap ”Send ansøgning” i stillingsannoncen i vores rekrutteringssystem. Ansøgninger som modtages på mail, vil blive slettet grundet GDPR og korrekt håndtering af personfølsomme data. 
 Har du spørgsmål, er du velkommen til at kontakte os. Se hvordan i den grå boks til højre i annoncen. 
 Vil du vide mere? 
 Hvis du er nysgerrig på at vide mere, kan du læse om Coor her:  www.coor.dk  og om FOOD by Coor her:  https://www.foodbycoor.dk/ 
 Vi glæder os til at høre fra dig!",,58,Danmark,101,København,4,"Hovedstaden, Sjælland og Bornholm",1218,København K,1,1,Fuldtid,None,None,4,"{'DriversLicenceType': 3, 'Name': 'B', 'Description': 'Almindelig bil'}",0,,0,0,0,,False,"{'Id': 7906423, 'Email': 'Christian.Pedersen@coor.com', 'FaxNumber': None, 'PersonName': 'Christian Pedersen', 'FirstName': 'Christian', 'LastName': 'Pedersen', 'PositionTitle': 'Kundechef', 'PhoneNumbers': [{'Number': '+4527872407', 'Type': 0, 'Description': 'Hovednummer'}]}",,False,False,False,False,4,,,False,False,True,True,211491248,,,,,True,2022-05-12T00:00:00,,0,Primary,7,/CV/FindWork/GetLogo?JobAdId=5577106&WorkPlace=114307&Organisation=10683548,"Hørkær 12A,2730, Herlev",False,False,"/CV/Jobseeking/JobLog/CreateJobSearch?JobnetJobPostingIdentifier=5577106&Company.Name=COOR SERVICE MANAGEMENT A/S&SubmissionDeadlineDate=2022-5-12&Title=Kokke og Souschefer søges til kantiner i KBH, der laver mad med mening&WeeklyWorkTime=1",00000000-0000-0000-0000-000000000000,False,0,,,"Kokke og Souschefer søges til kantiner i KBH, der laver mad med mening",True,,True,1,,5577106,,,False,False,,0,False,COOR SERVICE MANAGEMENT A/S,Hørkær 12A,,,2730,False,False,False,Herlev,Christian Pedersen,+4527872407,christian.pedersen@coor.com,,,,,False,,2022-05-12T00:00:00,,0,False,0,,,,,0,,,,False,False,,,False,False,,,,False,,False,,"Dag, aften",Arbejdspladsen ligger i København kommune,False,COOR SERVICE MANAGEMENT A/S,,"Coor er en ledende nordisk facility management-leverandør, både inden for integrerede og komplekse serviceløsninger (IFM) og single services. Coor tilbyder serviceydelser som interne services (soft FM), ejendomsservice (hard FM) og strategisk rådgivning i form af innovation og udvikling af services. Ved at udføre, lede, udvikle og effektivisere kundernes servicevirksomheder, understøtter Coor kundernes kerneforretning samt skaber merværdi over tid. Vi kalder det smart service – SERVICE med IQ.",,False,False,"Coor s&oslash;ger Kokke og Souschefer til vores FOOD by Coor division, til vores kunder i K&oslash;benhavn: Bygningsstyrelsen samt Politiet, Kriminalforsorgen og den centrale Anklagemyndighed (PKA).
Lyder det som noget for dig? S&aring; kom og bliv del af en kantine bemandet af madlavningsn&oslash;rder, der bruger lokale r&aring;varer, fokuserer p&","""Coor s\u0026oslash;ger Kokke og Souschefer til vores FOOD by Coor division, til vores kunder i K\u0026oslash;benhavn: Bygningsstyrelsen samt Politiet, Kriminalforsorgen og den centrale Anklagemyndighed (PKA).\nLyder det som noget for dig? S\u0026aring; kom og bliv del af en kantine bemandet af madlavningsn\u0026oslash;rder, der bruger lokale r\u0026aring;varer, fokuserer p\u0026""","""Kokke og Souschefer søges til kantiner i KBH, der laver mad med mening""","https://www.google.dk/maps/dir//Hørkær+12A,2730,+Herlev/","Coor søger Kokke og Souschefer til vores FOOD by Coor division, til vores kunder i København: Bygningsstyrelsen samt Politiet, Kriminalforsorgen og den centrale Anklagemyndighed (PKA). 
 Lyder det som noget for dig? Så kom og bliv del af en kantine bemandet af madlavningsnørder, der bruger lokale råvarer, fokuserer på bæredygtighed og insisterer på at lave mad fra bunden. 
 Lokale råvarer og høj kvalitet 
 I samarbejde med resten af holdet laver du kvalitetsmad til en af vores kunders kantiner i Købehavn. Vi tror på, at vores mad skal emme af friskhed, ansvarlighed og kreative nuancer. 
 Vi sørger naturligvis for, at du bliver lært grundigt op i vores arbejdsgange og -metoder af erfarne kolleger. 
 Mindre madspild, mere kreativitet - dit kommende job i Coor's FOOD by Coor division 
 Vi søger både Kokke og Souschefer. 
 Om du tilbereder en salat med årstidens grøntsager eller nørkler med de gode udskæringer på kalven, så er det altid med kreativitet, omhyggelighed og reduktion af madspild i fokus. 
 Det bliver blandt andet dig, der:  
 
 forbereder kødprodukter fra bunden, fx frisk medister eller udskæring af hele dyr 
 tilbereder friske salater af sæsonens grønt 
 hjemmeryger varer 
 langtidstilbereder supper og gryderetter 
 
 Faktisk er det umuligt at liste det hele op – vi vil gerne undgå kassetænkningen, så bliv ikke overrasket, hvis du en dag skal lave økologisk polentapizza med ærter og burrata eller selv får en kreativ idé inden for de rammer, vi har aftalt med kunden. 
 Hvis du ansættes som Souschef, så vil du, sammen med Køkkenchefen, også komme til at 
 
 lede slagets gang i kantinen 
 sikre medarbejdernes trivsel  
 håndtere budget og fakturering 
 sætte jeres hold af kokke, catere og øvrigt køkkenpersonale 
 
 Men vi skræddersyer gerne opgaverne til dig, og du kan som Souschef derfor også tage mere over på kontakten til kunden. Det afhænger alt sammen af dine kompetencer. 
 Arbejdssted og tid 
 Arbejdssted: I en af vores kantiner i København enten hos vores kunde Bygningsstyrelsen eller Politiet, Kriminalforsorgen og den centrale Anklagemyndighed. 
 Arbejdsstid: 37 timer ugentligt mandag til fredag. Arbejdstiden er placeret mellem 06.00-16.00. Der kan forekomme enkelte aftenarrangementer, og du skal derfor være indstillet på at arbejde uden for den normale arbejdstid, ved behov. 
 Start: Hurtigst muligt, efter nærmere aftale. 
 Hvad kan Coor tilbyde mig? 
 Hos Coor får du en fantastisk arbejdsplads med en masse gode kollegaer. Udover det får du: 
 
 løn i henhold til gældende overenskomst for området og efter dine kvalifikationer samt ansvaret i jobbet 
 en god pensionsordning 
 sundhedsforsikring, som betyder, at du hurtigt kan få behandling hos fx fysioterapeut, kiropraktor mv. 
 feriehusordning (lejlighed i Spanien og sommerhuse i Danmark) 
 en personaleforening, som tilbyder billetter til attraktive priser samt Logbuy rabatordning (elektronik, tøj, restauranter mv.) 
 
 I Coor bliver du også en del af en virksomhed med 
 
 mulighed for at tale med din leder, hvis du har behov for fx ændring af din arbejdstid/arbejdssted, så I sammen kan forsøge at finde nye løsninger 
 plads til dine idéer, fordi vi har en udbredt forbedringskultur 
 høj grad af diversitet og hjælpsomme kollegaer 
 et trygt og sikkert arbejdsmiljø hvor vi arbejder aktivt med at forebygge arbejdsulykker 
 fokus på din trivsel, udvikling og uddannelse. I Coor er der mange karrieremuligheder, og dette job kan evt., på sigt, være springbrættet til andre spændende muligheder i Coor 
 
 Dine kvalifikationer - Du har gode ideer til både smag og minimering af madspild  
 Vi ser gerne, at du er en nørd ligesom os, og at du er gastronomisk velfunderet. Du holder dig opdateret på de nyeste trends i madverdenen: brænder for økologi, bruger sæsonens råvarer og tænker kreativt i forhold til smag, præsentation, minimering af madspild og brugen af hele dyr.  
 Samtidig har du gerne et godt kundetække, flair for mersalg, du er en teamplayer og god til at kommunikere med dine kollegaer og kunden. 
 Derudover har du: 
 
 minimum 2 års erfaring fra kantinebranchen 
 en faglært kokkeuddannelse 
 kørekort (der kan forekomme transport af mad i Coor bil) 
 
 Du har mulighed for at blive PET-sikkerhedsgodkendt, som er en forudsætning for ansættelse. 
 Særlige krav til  dig, hvis du søger jobbet som Souschef 
 Ud over ovenstående kvalifikationer, så er det et krav at du som Souschef i Coor har: 
 
 ledelseserfaring fra en lignende stilling og at du er empatisk, involverende og nyder at gå forrest, så du passer ind i vores ” passion for people ” tankegang 
 sans for økonomi og administration i høj nok grad til, at du kan varetage de dele af jobbet med hjælp fra vores backoffice – god mad gør det ikke alene 
 
 Lyder det som noget for dig? 
 Så send din ansøgning/CV hurtigst muligt via coor.dk under ""Ledige stillinger"". Notér i din ansøgning/dit CV, om du søger som Kok eller Souschef eller begge dele. 
 Bemærk:  Det er ikke muligt at søge stillingen via e-mail, da alle ansøgninger skal uploades via den grønne knap ”Send ansøgning” i stillingsannoncen i vores rekrutteringssystem. Ansøgninger som modtages på mail, vil blive slettet grundet GDPR og korrekt håndtering af personfølsomme data. 
 Har du spørgsmål, er du velkommen til at kontakte os. Se hvordan i den grå boks til højre i annoncen. 
 Vil du vide mere? 
 Hvis du er nysgerrig på at vide mere, kan du læse om Coor her:  www.coor.dk  og om FOOD by Coor her:  https://www.foodbycoor.dk/ 
 Vi glæder os til at høre fra dig!","https://www.google.dk/maps/place/Hørkær+12A,2730,+Herlev/",10683548,False,False,,False
