summary_AutomatchType,summary_Abroad,summary_Weight,summary_Title,summary_JobHeadline,summary_Presentation,summary_HiringOrgName,summary_WorkPlaceAddress,summary_WorkPlacePostalCode,summary_WorkPlaceCity,summary_WorkPlaceOtherAddress,summary_WorkPlaceAbroad,summary_WorkPlaceNotStatic,summary_UseWorkPlaceAddressForJoblog,summary_PostingCreated,summary_LastDateApplication,summary_FormattedLastDateApplication,summary_AssignmentStartDate,summary_IsHotjob,summary_IsExternal,summary_Url,summary_Region,summary_Municipality,summary_Country,summary_PostalCode,summary_PostalCodeName,summary_JobAnnouncementType,summary_EmploymentType,summary_WorkHours,summary_OccupationArea,summary_OccupationGroup,summary_Occupation,summary_Location_Latitude,summary_Location_Longitude,summary_JoblogWorkTime_WorkHour,summary_JoblogWorkTime_DailyWorkTime,summary_WorkplaceID,summary_OrganisationId,summary_HiringOrgCVR,summary_UserLoggedIn,summary_AnonymousEmployer,summary_ShareUrl,summary_DetailsUrl,summary_JobLogUrl,summary_HasLocationValues,summary_ID,summary_Latitude,summary_Longitude,details_WorkSchedule,details_WorkConditions,details_EmploymentTypes,details_WorkPlace_Name,details_WorkPlace_Address_AddressLine,details_WorkPlace_Address_Country_Id,details_WorkPlace_Address_Country_Name,details_WorkPlace_Address_Municipality_Id,details_WorkPlace_Address_Municipality_Name,details_WorkPlace_Address_Region_Id,details_WorkPlace_Address_Region_Name,details_WorkPlace_Address_PostalCode,details_WorkPlace_Address_City,details_WorkPlace_PhoneNumber_Number,details_WorkPlace_PhoneNumber_Type,details_WorkPlace_PhoneNumber_Description,details_WorkPlace_FaxNumber,details_WorkPlace_Email,details_WorkPlace_WebAddress,details_WorkPlace_Description,details_WorkPlace_Logo,details_WorkPlace_WorkPlaceOrganizationNumber,details_WorkPlace_OrganizationNumber,details_WorkPlace_OrganizationDescription,details_JobPositionPosting_Id,details_JobPositionPosting_OriginalJppId,details_JobPositionPosting_HiringOrg_Name,details_JobPositionPosting_HiringOrg_Address_AddressLine,details_JobPositionPosting_HiringOrg_Address_Country_Id,details_JobPositionPosting_HiringOrg_Address_Country_Name,details_JobPositionPosting_HiringOrg_Address_Municipality_Id,details_JobPositionPosting_HiringOrg_Address_Municipality_Name,details_JobPositionPosting_HiringOrg_Address_Region_Id,details_JobPositionPosting_HiringOrg_Address_Region_Name,details_JobPositionPosting_HiringOrg_Address_PostalCode,details_JobPositionPosting_HiringOrg_Address_City,details_JobPositionPosting_HiringOrg_PhoneNumber_Number,details_JobPositionPosting_HiringOrg_PhoneNumber_Type,details_JobPositionPosting_HiringOrg_PhoneNumber_Description,details_JobPositionPosting_HiringOrg_FaxNumber,details_JobPositionPosting_HiringOrg_Email,details_JobPositionPosting_HiringOrg_WebAddress,details_JobPositionPosting_HiringOrg_Description,details_JobPositionPosting_HiringOrg_Logo,details_JobPositionPosting_HiringOrg_WorkPlaceOrganizationNumber,details_JobPositionPosting_HiringOrg_OrganizationNumber,details_JobPositionPosting_HiringOrg_OrganizationDescription,details_JobPositionPosting_RecruitingCompany,details_JobPositionPosting_PublicationStartDate,details_JobPositionPosting_PublicationEndDate,details_JobPositionPosting_JobPositionInformation_PositionTitle,details_JobPositionPosting_JobPositionInformation_Purpose,details_JobPositionPosting_JobPositionInformation_WorkLocation_AddressLine,details_JobPositionPosting_JobPositionInformation_WorkLocation_Country_Id,details_JobPositionPosting_JobPositionInformation_WorkLocation_Country_Name,details_JobPositionPosting_JobPositionInformation_WorkLocation_Municipality_Id,details_JobPositionPosting_JobPositionInformation_WorkLocation_Municipality_Name,details_JobPositionPosting_JobPositionInformation_WorkLocation_Region_Id,details_JobPositionPosting_JobPositionInformation_WorkLocation_Region_Name,details_JobPositionPosting_JobPositionInformation_WorkLocation_PostalCode,details_JobPositionPosting_JobPositionInformation_WorkLocation_City,details_JobPositionPosting_JobPositionInformation_EmploymentType,details_JobPositionPosting_JobPositionInformation_WeeklyWorkHours_TypeId,details_JobPositionPosting_JobPositionInformation_WeeklyWorkHours_TypeName,details_JobPositionPosting_JobPositionInformation_WeeklyWorkHours_Description,details_JobPositionPosting_JobPositionInformation_CompensationDescription,details_JobPositionPosting_JobPositionInformation_NumberToFill,details_JobPositionPosting_JobPositionInformation_DriverLicense,details_JobPositionPosting_JobPositionInformation_Occupation_DiscoWeb,details_JobPositionPosting_JobPositionInformation_Occupation_AlternateNames,details_JobPositionPosting_JobPositionInformation_Occupation_GroupId,details_JobPositionPosting_JobPositionInformation_Occupation_AreaId,details_JobPositionPosting_JobPositionInformation_Occupation_Id,details_JobPositionPosting_JobPositionInformation_Occupation_Name,details_JobPositionPosting_JobPositionInformation_IsGovernmentHiring,details_JobPositionPosting_JobPositionInformation_JppContacts,details_JobPositionPosting_JobPositionInformation_EmploymentDate,details_JobPositionPosting_IsRecruitmentOfForeignNationals,details_JobPositionPosting_IsWorkInDenmark,details_JobPositionPosting_IsAnonymousEmployer,details_JobPositionPosting_IsDisabilityFriendly,details_JobPositionPosting_JppType,details_JobPositionPosting_ApplicationDetails_WorkHourMax,details_JobPositionPosting_ApplicationDetails_WorkHourMin,details_JobPositionPosting_ApplicationDetails_DailyWorkTimeWeekend,details_JobPositionPosting_ApplicationDetails_DailyWorkTimeNight,details_JobPositionPosting_ApplicationDetails_DailyWorkTimeEvening,details_JobPositionPosting_ApplicationDetails_DailyWorkTimeDay,details_JobPositionPosting_ApplicationDetails_ReferenceText,details_JobPositionPosting_ApplicationDetails_RemarksToApplicant,details_JobPositionPosting_ApplicationDetails_ByEmail,details_JobPositionPosting_ApplicationDetails_ByPhone,details_JobPositionPosting_ApplicationDetails_ApplyViaUrl,details_JobPositionPosting_ApplicationDetails_ReplyInWriting,details_JobPositionPosting_ApplicationDetails_ApplicationDeadlineDate,details_JobPositionPosting_ContactAuthorityPhoneNumber_Number,details_JobPositionPosting_ContactAuthorityPhoneNumber_Type,details_JobPositionPosting_ContactAuthorityPhoneNumber_Description,details_JobPositionPosting_Status,details_LogoUrl,details_Address,details_ShowMap,details_ShowShareButtonJobLog,details_JobLogUrl,details_JobLogTemplateModel_Identifier,details_JobLogTemplateModel_UseWorkPlaceAddressForJoblog,details_JobLogTemplateModel_Category,details_JobLogTemplateModel_CvCustomerIdentifier,details_JobLogTemplateModel_JobSeekingStatus,details_JobLogTemplateModel_Title,details_JobLogTemplateModel_IsApplicationSourceRequired,details_JobLogTemplateModel_ApplicationSource,details_JobLogTemplateModel_IsWeeklyWorkTimeRequired,details_JobLogTemplateModel_WeeklyWorkTime,details_JobLogTemplateModel_HoursPerWeek,details_JobLogTemplateModel_JobnetJobPostingIdentifier,details_JobLogTemplateModel_JobAdDocument_Title,details_JobLogTemplateModel_JobAdDocument_Identifier,details_JobLogTemplateModel_JobAdDocument_IsDeletedBySystem,details_JobLogTemplateModel_JobAdDocument_IsDeletedByUser,details_JobLogTemplateModel_JobAdFile,details_JobLogTemplateModel_Company_JobLogEntryCategory,details_JobLogTemplateModel_Company_ShowAddressFieldsEvenIfEmpty,details_JobLogTemplateModel_Company_Name,details_JobLogTemplateModel_Company_Address,details_JobLogTemplateModel_Company_Country,details_JobLogTemplateModel_Company_EmploymentAreaID,details_JobLogTemplateModel_Company_PostCode,details_JobLogTemplateModel_Company_IsCountryAndTownAndPostCodeEmpty,details_JobLogTemplateModel_Company_IsTownAndPostCodeEmpty,details_JobLogTemplateModel_Company_IsCountryDanmark,details_JobLogTemplateModel_Company_Town,details_JobLogTemplateModel_Company_ContactPerson,details_JobLogTemplateModel_Company_Phone,details_JobLogTemplateModel_Company_Email,details_JobLogTemplateModel_Company_Latitude,details_JobLogTemplateModel_Company_Longitude,details_JobLogTemplateModel_Company_DailyTravelTimeInMinutes,details_JobLogTemplateModel_Company_DistanceToCompanyInMeters,details_JobLogTemplateModel_Company_IsCreateMode,details_JobLogTemplateModel_TypeOfSubmission,details_JobLogTemplateModel_SubmissionDate,details_JobLogTemplateModel_SubmissionDateFormatted,details_JobLogTemplateModel_SubmissionDateTiks,details_JobLogTemplateModel_IsSubmissionDateRequired,details_JobLogTemplateModel_Status,details_JobLogTemplateModel_DateCreatedFormatted,details_JobLogTemplateModel_DateCreated,details_JobLogTemplateModel_DateModifiedFormatted,details_JobLogTemplateModel_DateModified,details_JobLogTemplateModel_LastModifiedDateTiks,details_JobLogTemplateModel_DateClosed,details_JobLogTemplateModel_JobApplicationDocument_Title,details_JobLogTemplateModel_JobApplicationDocument_Identifier,details_JobLogTemplateModel_JobApplicationDocument_IsDeletedBySystem,details_JobLogTemplateModel_JobApplicationDocument_IsDeletedByUser,details_JobLogTemplateModel_CvDocument_Title,details_JobLogTemplateModel_CvDocument_Identifier,details_JobLogTemplateModel_CvDocument_IsDeletedBySystem,details_JobLogTemplateModel_CvDocument_IsDeletedByUser,details_JobLogTemplateModel_JobApplicationFile,details_JobLogTemplateModel_CvFile,details_JobLogTemplateModel_SubmissionDeadlineDate,details_JobLogTemplateModel_IsPersisted,details_JobLogTemplateModel_ServerValidationErrors,details_JobLogTemplateModel_HasServerValidationErrors,details_JoblogWorkTime_WorkHour,details_JoblogWorkTime_DailyWorkTime,details_Place,details_OpenPrintDialog,details_WorkPlaceInfoText,details_JobCenterContactDetails,details_WorkPlaceDescriptionText,details_FavoriteText,details_IsFavorite,details_ShowFavorite,details_MetaOgTextForSharing,details_DescriptionForSharing,details_TitleForSharing,details_RutePlan,details_FormattedPurpose,details_MapUrl,details_OrganizationNumber,details_ShowSearchJobButton,details_ShowPrint,details_BackToFindWorkButtonUrl,isExternal
0,False,1,"Brænder du for en solid sagsbehandling af erhvervsbyggesager, og er du god til dialog med virksomheder og borgere?","Brænder du for en solid sagsbehandling af erhvervsbyggesager, og er du god til dialog med virksomheder og borgere?","Vi søger en erfaren byggesagsbehandler, der kan fuldende vores stærke byggesagsteam og udføre byggesagsbehandling af høj kvalitet. Du vil indgå i Team Erhverv, hvor vi tilbyder et alsidigt og fleks",Byg,Hvidovrevej 278,2650,Hvidovre,False,False,False,True,2022-04-19T00:00:00,2022-05-17T00:00:00,17. maj 2022,0001-01-01T00:00:00,False,False,https://job.jobnet.dk/CV/FindWork/Details/5577004,Hovedstaden og Bornholm,Hvidovre,Danmark,2650,,,,Fuldtid,Akademisk arbejde,"Arkitektarbejde, design og planlægning ",Byggesagsbehandler,55.6428,12.4776,,,5340,1869,55606617,False,False,https://job.jobnet.dk/CV/FindWork/DetailsSocialmedia/5577004,https://job.jobnet.dk/CV/FindWork/Details/5577004,https://job.jobnet.dk/CV/FindWork/Details/5577004,True,5577004,55.6428,12.4776,"{'Id': 1, 'Name': 'Fuldtid'}, {'Id': 16, 'Name': 'Deltid'}","{'Id': 1, 'Name': 'Almindelige vilkår'}, {'Id': 2, 'Name': 'Fleksjob'}, {'Id': 3, 'Name': 'Skånejob'}, {'Id': 4, 'Name': 'Egnet til efterlønnere og seniorer'}, {'Id': 5, 'Name': 'Job med løntilskud'}, {'Id': 6, 'Name': 'Rotationsjob'}, {'Id': 7, 'Name': 'Virksomhedspraktik'}","{'Id': 1, 'Name': 'Fastansættelse'}, {'Id': 16, 'Name': 'Tidsbegrænset ansættelse'}",Byg,Hvidovrevej 278,58,Danmark,167,Hvidovre,4,"Hovedstaden, Sjælland og Bornholm",2650,Hvidovre,,0,Primary,,,,None,5340,1003267810,55606617,None,5577004,5577004,Byg,Hvidovrevej 278,58,Danmark,167,Hvidovre,4,"Hovedstaden, Sjælland og Bornholm",2650,Hvidovre,,0,Primary,,,,None,5340,1003267810,55606617,None,,2022-04-19T00:00:00,2022-05-17T00:00:00,"Brænder du for en solid sagsbehandling af erhvervsbyggesager, og er du god til dialog med virksomheder og borgere?","Vi søger en erfaren byggesagsbehandler, der kan fuldende vores stærke byggesagsteam og udføre byggesagsbehandling af høj kvalitet. Du vil indgå i Team Erhverv, hvor vi tilbyder et alsidigt og fleksibelt job i et godt arbejdsklima.    Hvidovre udvikler sig   Hvidovre Kommune er blandt højdespringerne i årets rapporter fra DI Byggeri og SMV Danmark om byggesagsbehandling, og vi har et stort ønske om at skabe en endnu bedre by, hvor vi griber mulig­hederne, bygger videre på de opnåede erfaringer og tænker nyt i vores håndtering af byggesagerne.    Vi vil være ambitiøse og gode samarbejdspart­nere for dem, der ønsker at etablere sig i Hvidovre.   Vi oplever i disse år, at flere og flere ønsker at bo og drive virksomhed i Hvidovre. Mange virksomheder vil gerne udvide og samtidig kommer der nye til.    Det skaber travlhed i byggeriet både i bolig- og erhvervsområderne. Der er altså en masse spændende opgaver til dig.     Hvidovre Kommune er tæt bebygget og har samtidig Avedøre Holme, som er et af Danmarks største erhvervsområder. Hvidovre Kommune har en spændende ambition om at udvikle et af Nordeuropas største erhvervsområder ’Holmene’ med ni nye øer med mange nye virksomheder og rekreative områder.    Hvis du vil være en del af denne spændende udvikling og sætte præg på retningen inden for byggesagsområdet i et tæt samarbejde med dine kolleger, så send os din ansøgning.   Om stillingen og opgaverne   Stillingen er tilknyttet byggesagsteamet i Center for Plan og Miljø. Byggesagsteamet behandler både erhvervssager og private byggesager, typisk enfamiliehuse.    Du vil i udgangspunktet være tilknyttet arbejdet med erhvervsbyggesager. Vi har fokus på oplæring i funktionen, hvis der er behov for det i lyset af dine kompetencer.    Teamet består af 10 byggesagsbehandlere, tre administrative medarbejdere og en leder.    Vi arbejder med byggesager, matrikelsager, lokalplansdispensationer samt øvrige administrative byggesager og forespørgsler. Vi har hele tiden ambitionen om at levere den bedste service.    Det gør vi ved at arbejde sammen på tværs af hele centeret, så både plan- og miljøforhold indgår i sagsbehandlingen.   Vi forventer at du      har erfaring med byggesagsbehandling fra anden kommune, herunder byggesagsbehandling af komplekst byggeri    har en relevant uddannelsesmæssig baggrund (f.eks. arkitekt, bygningskonstruktør, ingeniør eller tilsvarende)   kender til lovgrundlaget – særligt byggeloven, bygningsreglementet og planloven – og kunne håndhæve lovgivningen, herunder ved påbud   kan administrere de lokale planbestemmelser og foretage helhedsvurderinger    kan føre tilsyn med små og større byggerier   kan håndtere aktindsigtssager   kan skrive breve og indstillinger til politiske udvalg i et kortfattet, tydeligt og forståeligt sprog.     Ud over kendskab til regelgrundlaget inden for byggesagsbehandling ser vi gerne, at du også har et godt kendskab til offentlighedsloven og forvaltningsloven mv.   Vi forventer desuden, at du har:     interesse og flair for byggeriet og de tilknyttede juridiske problemstillinger   byggeteknisk viden    en veludviklet situationsfornemmelse og politisk tæft   selvindsigt og god forståelse af, hvornår du skal inddrage andre i opgaveløsningen   ordenssans og overblik   en god evne til at kommunikere – både mundtligt og skriftligt   imødekommende og dialogorienteret overfor borgerne og dine samarbejdspartnere   selvstændighed      Vi tilbyder     et afvekslende, fleksibelt og udviklende job, hvor du kan arbejde med mange spændende byggefaglige opgaver   selvstændigt opgaveansvar og stor grad af indflydelse på egne opgaver   tværfagligt miljø og en bred kontaktflade   gode muligheder for personlig og faglig kompetenceudvikling. Mulighed for hjemmearbejde når opgaven tillader det   arbejde i en spændende offentlig forvaltning med gode og dygtige kollegaer og plads til den enkelte.     Der er ca. 45 ansatte i Center for Plan og Miljø. Vi er organiseret i fire teams: Byg, Plan, Gis & Data og Klima & Miljø. Vi sidder på samme adresse og har i det daglige et tæt samarbejde på kryds og tværs. Vi har én centerchef og én leder af hvert team.   Løn- og ansættelsesvilkår   Det er en fuldtidsstilling med ansættelse pr. 15. august 2022. Ansættelsen sker i henhold til gældende overenskomst og efter forhandling med den forhandlingsberettigede organisation.   Ansøgningsfristen er den 20. maj 2022   Vi forventer at holde 1. og eventuelt 2. samtalerunde i uge 21 og 22. Stillingen er til besættelse pr. 15. august 2022.   Har du spørgsmål, er du velkommen til at kontakte leder af Byg i Center for Plan og Miljø, Mette Justesen på tlf.:  9137 0448 efter den 18. april.     Har du faglige spørgsmål til byggesagsbehandlingen, så tøv ikke med at kontakte Steffen Kuld Hansen på tlf.: 2741 2545 efter den 18. april.   Du kan læse mere om Hvidovre Kommune på www.hvidovre.dk, og du kan læse vores boligpolitik her       
 Denne jobannonce blev oprindeligt opslået på https://www.ofir.dk/
 (Den originale annonce kan ses på: https://www.ofir.dk/showojob?ofirid=e647e688)",Hvidovrevej 278,58,Danmark,167,Hvidovre,4,"Hovedstaden, Sjælland og Bornholm",2650,Hvidovre,1,1,Fuldtid,None,None,1,,0,,0,0,0,,False,"{'Id': 7912273, 'Email': None, 'FaxNumber': None, 'PersonName': 'Steffen Kuld Hansen', 'FirstName': 'Steffen', 'LastName': 'Kuld Hansen', 'PositionTitle': None, 'PhoneNumbers': [{'Number': '36393573', 'Type': 0, 'Description': 'Hovednummer'}]}",,False,False,False,False,4,,,False,False,False,False,,,,,https://www.ofir.dk/resultat/Jobannonce.aspx?ofirId=e647e688&action=sendApplicationUrl,False,2022-05-17T00:00:00,,0,Primary,7,/CV/FindWork/GetLogo?JobAdId=5577004&WorkPlace=5340&Organisation=55606617,"Hvidovrevej 278,2650, Hvidovre",True,False,"/CV/Jobseeking/JobLog/CreateJobSearch?JobnetJobPostingIdentifier=5577004&Company.Name=Byg&SubmissionDeadlineDate=2022-5-17&Title=Brænder du for en solid sagsbehandling af erhvervsbyggesager, og er du god til dialog med virksomheder og borgere?&WeeklyWorkTime=1",00000000-0000-0000-0000-000000000000,False,0,,,"Brænder du for en solid sagsbehandling af erhvervsbyggesager, og er du god til dialog med virksomheder og borgere?",True,,True,1,,5577004,,,False,False,,0,False,Byg,Hvidovrevej 278,,,2650,False,False,False,Hvidovre,Steffen Kuld Hansen,36393573,,,,,,False,,2022-05-17T00:00:00,,0,False,0,,,,,0,,,,False,False,,,False,False,,,,False,,False,,,Arbejdspladsen ligger i Hvidovre kommune,False,Byg,,None,,False,False,"Vi søger en erfaren byggesagsbehandler, der kan fuldende vores stærke byggesagsteam og udføre byggesagsbehandling af høj kvalitet. Du vil indgå i Team Erhverv, hvor vi tilbyder et alsidigt og fleksibelt job i et godt arbejdsklima.  Hvidovre udvikler sig Hvidovre Kommune er blandt højdespringerne i årets rapporter fra DI Byggeri og SMV Danmark om by","""Vi søger en erfaren byggesagsbehandler, der kan fuldende vores stærke byggesagsteam og udføre byggesagsbehandling af høj kvalitet. Du vil indgå i Team Erhverv, hvor vi tilbyder et alsidigt og fleksibelt job i et godt arbejdsklima.  Hvidovre udvikler sig Hvidovre Kommune er blandt højdespringerne i årets rapporter fra DI Byggeri og SMV Danmark om by""","""Brænder du for en solid sagsbehandling af erhvervsbyggesager, og er du god til dialog med virksomheder og borgere?""","https://www.google.dk/maps/dir//Hvidovrevej+278,2650,+Hvidovre/","Vi søger en erfaren byggesagsbehandler, der kan fuldende vores stærke byggesagsteam og udføre byggesagsbehandling af høj kvalitet. Du vil indgå i Team Erhverv, hvor vi tilbyder et alsidigt og fleksibelt job i et godt arbejdsklima.    Hvidovre udvikler sig   Hvidovre Kommune er blandt højdespringerne i årets rapporter fra DI Byggeri og SMV Danmark om byggesagsbehandling, og vi har et stort ønske om at skabe en endnu bedre by, hvor vi griber mulig­hederne, bygger videre på de opnåede erfaringer og tænker nyt i vores håndtering af byggesagerne.    Vi vil være ambitiøse og gode samarbejdspart­nere for dem, der ønsker at etablere sig i Hvidovre.   Vi oplever i disse år, at flere og flere ønsker at bo og drive virksomhed i Hvidovre. Mange virksomheder vil gerne udvide og samtidig kommer der nye til.    Det skaber travlhed i byggeriet både i bolig- og erhvervsområderne. Der er altså en masse spændende opgaver til dig.     Hvidovre Kommune er tæt bebygget og har samtidig Avedøre Holme, som er et af Danmarks største erhvervsområder. Hvidovre Kommune har en spændende ambition om at udvikle et af Nordeuropas største erhvervsområder ’Holmene’ med ni nye øer med mange nye virksomheder og rekreative områder.    Hvis du vil være en del af denne spændende udvikling og sætte præg på retningen inden for byggesagsområdet i et tæt samarbejde med dine kolleger, så send os din ansøgning.   Om stillingen og opgaverne   Stillingen er tilknyttet byggesagsteamet i Center for Plan og Miljø. Byggesagsteamet behandler både erhvervssager og private byggesager, typisk enfamiliehuse.    Du vil i udgangspunktet være tilknyttet arbejdet med erhvervsbyggesager. Vi har fokus på oplæring i funktionen, hvis der er behov for det i lyset af dine kompetencer.    Teamet består af 10 byggesagsbehandlere, tre administrative medarbejdere og en leder.    Vi arbejder med byggesager, matrikelsager, lokalplansdispensationer samt øvrige administrative byggesager og forespørgsler. Vi har hele tiden ambitionen om at levere den bedste service.    Det gør vi ved at arbejde sammen på tværs af hele centeret, så både plan- og miljøforhold indgår i sagsbehandlingen.   Vi forventer at du      har erfaring med byggesagsbehandling fra anden kommune, herunder byggesagsbehandling af komplekst byggeri    har en relevant uddannelsesmæssig baggrund (f.eks. arkitekt, bygningskonstruktør, ingeniør eller tilsvarende)   kender til lovgrundlaget – særligt byggeloven, bygningsreglementet og planloven – og kunne håndhæve lovgivningen, herunder ved påbud   kan administrere de lokale planbestemmelser og foretage helhedsvurderinger    kan føre tilsyn med små og større byggerier   kan håndtere aktindsigtssager   kan skrive breve og indstillinger til politiske udvalg i et kortfattet, tydeligt og forståeligt sprog.     Ud over kendskab til regelgrundlaget inden for byggesagsbehandling ser vi gerne, at du også har et godt kendskab til offentlighedsloven og forvaltningsloven mv.   Vi forventer desuden, at du har:     interesse og flair for byggeriet og de tilknyttede juridiske problemstillinger   byggeteknisk viden    en veludviklet situationsfornemmelse og politisk tæft   selvindsigt og god forståelse af, hvornår du skal inddrage andre i opgaveløsningen   ordenssans og overblik   en god evne til at kommunikere – både mundtligt og skriftligt   imødekommende og dialogorienteret overfor borgerne og dine samarbejdspartnere   selvstændighed      Vi tilbyder     et afvekslende, fleksibelt og udviklende job, hvor du kan arbejde med mange spændende byggefaglige opgaver   selvstændigt opgaveansvar og stor grad af indflydelse på egne opgaver   tværfagligt miljø og en bred kontaktflade   gode muligheder for personlig og faglig kompetenceudvikling. Mulighed for hjemmearbejde når opgaven tillader det   arbejde i en spændende offentlig forvaltning med gode og dygtige kollegaer og plads til den enkelte.     Der er ca. 45 ansatte i Center for Plan og Miljø. Vi er organiseret i fire teams: Byg, Plan, Gis & Data og Klima & Miljø. Vi sidder på samme adresse og har i det daglige et tæt samarbejde på kryds og tværs. Vi har én centerchef og én leder af hvert team.   Løn- og ansættelsesvilkår   Det er en fuldtidsstilling med ansættelse pr. 15. august 2022. Ansættelsen sker i henhold til gældende overenskomst og efter forhandling med den forhandlingsberettigede organisation.   Ansøgningsfristen er den 20. maj 2022   Vi forventer at holde 1. og eventuelt 2. samtalerunde i uge 21 og 22. Stillingen er til besættelse pr. 15. august 2022.   Har du spørgsmål, er du velkommen til at kontakte leder af Byg i Center for Plan og Miljø, Mette Justesen på tlf.:  9137 0448 efter den 18. april.     Har du faglige spørgsmål til byggesagsbehandlingen, så tøv ikke med at kontakte Steffen Kuld Hansen på tlf.: 2741 2545 efter den 18. april.   Du kan læse mere om Hvidovre Kommune på  www.hvidovre.dk , og du kan læse vores boligpolitik her       
 Denne jobannonce blev oprindeligt opslået på  https://www.ofir.dk/ 
 (Den originale annonce kan ses på:  https://www.ofir.dk/showojob?ofirid=e647e688 )","https://www.google.dk/maps/place/Hvidovrevej+278,2650,+Hvidovre/",55606617,False,False,,False
