summary_AutomatchType,summary_Abroad,summary_Weight,summary_Title,summary_JobHeadline,summary_Presentation,summary_HiringOrgName,summary_WorkPlaceAddress,summary_WorkPlacePostalCode,summary_WorkPlaceCity,summary_WorkPlaceOtherAddress,summary_WorkPlaceAbroad,summary_WorkPlaceNotStatic,summary_UseWorkPlaceAddressForJoblog,summary_PostingCreated,summary_LastDateApplication,summary_FormattedLastDateApplication,summary_AssignmentStartDate,summary_IsHotjob,summary_IsExternal,summary_Url,summary_Region,summary_Municipality,summary_Country,summary_PostalCode,summary_PostalCodeName,summary_JobAnnouncementType,summary_EmploymentType,summary_WorkHours,summary_OccupationArea,summary_OccupationGroup,summary_Occupation,summary_Location_Latitude,summary_Location_Longitude,summary_JoblogWorkTime_WorkHour,summary_JoblogWorkTime_DailyWorkTime,summary_WorkplaceID,summary_OrganisationId,summary_HiringOrgCVR,summary_UserLoggedIn,summary_AnonymousEmployer,summary_ShareUrl,summary_DetailsUrl,summary_JobLogUrl,summary_HasLocationValues,summary_ID,summary_Latitude,summary_Longitude,details_WorkSchedule,details_WorkConditions,details_EmploymentTypes,details_WorkPlace_Name,details_WorkPlace_Address_AddressLine,details_WorkPlace_Address_Country_Id,details_WorkPlace_Address_Country_Name,details_WorkPlace_Address_Municipality_Id,details_WorkPlace_Address_Municipality_Name,details_WorkPlace_Address_Region_Id,details_WorkPlace_Address_Region_Name,details_WorkPlace_Address_PostalCode,details_WorkPlace_Address_City,details_WorkPlace_PhoneNumber_Number,details_WorkPlace_PhoneNumber_Type,details_WorkPlace_PhoneNumber_Description,details_WorkPlace_FaxNumber,details_WorkPlace_Email,details_WorkPlace_WebAddress,details_WorkPlace_Description,details_WorkPlace_Logo,details_WorkPlace_WorkPlaceOrganizationNumber,details_WorkPlace_OrganizationNumber,details_WorkPlace_OrganizationDescription,details_JobPositionPosting_Id,details_JobPositionPosting_OriginalJppId,details_JobPositionPosting_HiringOrg_Name,details_JobPositionPosting_HiringOrg_Address_AddressLine,details_JobPositionPosting_HiringOrg_Address_Country_Id,details_JobPositionPosting_HiringOrg_Address_Country_Name,details_JobPositionPosting_HiringOrg_Address_Municipality_Id,details_JobPositionPosting_HiringOrg_Address_Municipality_Name,details_JobPositionPosting_HiringOrg_Address_Region_Id,details_JobPositionPosting_HiringOrg_Address_Region_Name,details_JobPositionPosting_HiringOrg_Address_PostalCode,details_JobPositionPosting_HiringOrg_Address_City,details_JobPositionPosting_HiringOrg_PhoneNumber_Number,details_JobPositionPosting_HiringOrg_PhoneNumber_Type,details_JobPositionPosting_HiringOrg_PhoneNumber_Description,details_JobPositionPosting_HiringOrg_FaxNumber,details_JobPositionPosting_HiringOrg_Email,details_JobPositionPosting_HiringOrg_WebAddress,details_JobPositionPosting_HiringOrg_Description,details_JobPositionPosting_HiringOrg_Logo,details_JobPositionPosting_HiringOrg_WorkPlaceOrganizationNumber,details_JobPositionPosting_HiringOrg_OrganizationNumber,details_JobPositionPosting_HiringOrg_OrganizationDescription,details_JobPositionPosting_RecruitingCompany,details_JobPositionPosting_PublicationStartDate,details_JobPositionPosting_PublicationEndDate,details_JobPositionPosting_JobPositionInformation_PositionTitle,details_JobPositionPosting_JobPositionInformation_Purpose,details_JobPositionPosting_JobPositionInformation_WorkLocation_AddressLine,details_JobPositionPosting_JobPositionInformation_WorkLocation_Country_Id,details_JobPositionPosting_JobPositionInformation_WorkLocation_Country_Name,details_JobPositionPosting_JobPositionInformation_WorkLocation_Municipality_Id,details_JobPositionPosting_JobPositionInformation_WorkLocation_Municipality_Name,details_JobPositionPosting_JobPositionInformation_WorkLocation_Region_Id,details_JobPositionPosting_JobPositionInformation_WorkLocation_Region_Name,details_JobPositionPosting_JobPositionInformation_WorkLocation_PostalCode,details_JobPositionPosting_JobPositionInformation_WorkLocation_City,details_JobPositionPosting_JobPositionInformation_EmploymentType,details_JobPositionPosting_JobPositionInformation_WeeklyWorkHours_TypeId,details_JobPositionPosting_JobPositionInformation_WeeklyWorkHours_TypeName,details_JobPositionPosting_JobPositionInformation_WeeklyWorkHours_Description,details_JobPositionPosting_JobPositionInformation_CompensationDescription,details_JobPositionPosting_JobPositionInformation_NumberToFill,details_JobPositionPosting_JobPositionInformation_DriverLicense,details_JobPositionPosting_JobPositionInformation_Occupation_DiscoWeb,details_JobPositionPosting_JobPositionInformation_Occupation_AlternateNames,details_JobPositionPosting_JobPositionInformation_Occupation_GroupId,details_JobPositionPosting_JobPositionInformation_Occupation_AreaId,details_JobPositionPosting_JobPositionInformation_Occupation_Id,details_JobPositionPosting_JobPositionInformation_Occupation_Name,details_JobPositionPosting_JobPositionInformation_IsGovernmentHiring,details_JobPositionPosting_JobPositionInformation_JppContacts,details_JobPositionPosting_JobPositionInformation_EmploymentDate,details_JobPositionPosting_IsRecruitmentOfForeignNationals,details_JobPositionPosting_IsWorkInDenmark,details_JobPositionPosting_IsAnonymousEmployer,details_JobPositionPosting_IsDisabilityFriendly,details_JobPositionPosting_JppType,details_JobPositionPosting_ApplicationDetails_WorkHourMax,details_JobPositionPosting_ApplicationDetails_WorkHourMin,details_JobPositionPosting_ApplicationDetails_DailyWorkTimeWeekend,details_JobPositionPosting_ApplicationDetails_DailyWorkTimeNight,details_JobPositionPosting_ApplicationDetails_DailyWorkTimeEvening,details_JobPositionPosting_ApplicationDetails_DailyWorkTimeDay,details_JobPositionPosting_ApplicationDetails_ReferenceText,details_JobPositionPosting_ApplicationDetails_RemarksToApplicant,details_JobPositionPosting_ApplicationDetails_ByEmail,details_JobPositionPosting_ApplicationDetails_ByPhone,details_JobPositionPosting_ApplicationDetails_ApplyViaUrl,details_JobPositionPosting_ApplicationDetails_ReplyInWriting,details_JobPositionPosting_ApplicationDetails_ApplicationDeadlineDate,details_JobPositionPosting_ContactAuthorityPhoneNumber_Number,details_JobPositionPosting_ContactAuthorityPhoneNumber_Type,details_JobPositionPosting_ContactAuthorityPhoneNumber_Description,details_JobPositionPosting_Status,details_LogoUrl,details_Address,details_ShowMap,details_ShowShareButtonJobLog,details_JobLogUrl,details_JobLogTemplateModel_Identifier,details_JobLogTemplateModel_UseWorkPlaceAddressForJoblog,details_JobLogTemplateModel_Category,details_JobLogTemplateModel_CvCustomerIdentifier,details_JobLogTemplateModel_JobSeekingStatus,details_JobLogTemplateModel_Title,details_JobLogTemplateModel_IsApplicationSourceRequired,details_JobLogTemplateModel_ApplicationSource,details_JobLogTemplateModel_IsWeeklyWorkTimeRequired,details_JobLogTemplateModel_WeeklyWorkTime,details_JobLogTemplateModel_HoursPerWeek,details_JobLogTemplateModel_JobnetJobPostingIdentifier,details_JobLogTemplateModel_JobAdDocument_Title,details_JobLogTemplateModel_JobAdDocument_Identifier,details_JobLogTemplateModel_JobAdDocument_IsDeletedBySystem,details_JobLogTemplateModel_JobAdDocument_IsDeletedByUser,details_JobLogTemplateModel_JobAdFile,details_JobLogTemplateModel_Company_JobLogEntryCategory,details_JobLogTemplateModel_Company_ShowAddressFieldsEvenIfEmpty,details_JobLogTemplateModel_Company_Name,details_JobLogTemplateModel_Company_Address,details_JobLogTemplateModel_Company_Country,details_JobLogTemplateModel_Company_EmploymentAreaID,details_JobLogTemplateModel_Company_PostCode,details_JobLogTemplateModel_Company_IsCountryAndTownAndPostCodeEmpty,details_JobLogTemplateModel_Company_IsTownAndPostCodeEmpty,details_JobLogTemplateModel_Company_IsCountryDanmark,details_JobLogTemplateModel_Company_Town,details_JobLogTemplateModel_Company_ContactPerson,details_JobLogTemplateModel_Company_Phone,details_JobLogTemplateModel_Company_Email,details_JobLogTemplateModel_Company_Latitude,details_JobLogTemplateModel_Company_Longitude,details_JobLogTemplateModel_Company_DailyTravelTimeInMinutes,details_JobLogTemplateModel_Company_DistanceToCompanyInMeters,details_JobLogTemplateModel_Company_IsCreateMode,details_JobLogTemplateModel_TypeOfSubmission,details_JobLogTemplateModel_SubmissionDate,details_JobLogTemplateModel_SubmissionDateFormatted,details_JobLogTemplateModel_SubmissionDateTiks,details_JobLogTemplateModel_IsSubmissionDateRequired,details_JobLogTemplateModel_Status,details_JobLogTemplateModel_DateCreatedFormatted,details_JobLogTemplateModel_DateCreated,details_JobLogTemplateModel_DateModifiedFormatted,details_JobLogTemplateModel_DateModified,details_JobLogTemplateModel_LastModifiedDateTiks,details_JobLogTemplateModel_DateClosed,details_JobLogTemplateModel_JobApplicationDocument_Title,details_JobLogTemplateModel_JobApplicationDocument_Identifier,details_JobLogTemplateModel_JobApplicationDocument_IsDeletedBySystem,details_JobLogTemplateModel_JobApplicationDocument_IsDeletedByUser,details_JobLogTemplateModel_CvDocument_Title,details_JobLogTemplateModel_CvDocument_Identifier,details_JobLogTemplateModel_CvDocument_IsDeletedBySystem,details_JobLogTemplateModel_CvDocument_IsDeletedByUser,details_JobLogTemplateModel_JobApplicationFile,details_JobLogTemplateModel_CvFile,details_JobLogTemplateModel_SubmissionDeadlineDate,details_JobLogTemplateModel_IsPersisted,details_JobLogTemplateModel_ServerValidationErrors,details_JobLogTemplateModel_HasServerValidationErrors,details_JoblogWorkTime_WorkHour,details_JoblogWorkTime_DailyWorkTime,details_Place,details_OpenPrintDialog,details_WorkPlaceInfoText,details_JobCenterContactDetails,details_WorkPlaceDescriptionText,details_FavoriteText,details_IsFavorite,details_ShowFavorite,details_MetaOgTextForSharing,details_DescriptionForSharing,details_TitleForSharing,details_RutePlan,details_FormattedPurpose,details_MapUrl,details_OrganizationNumber,details_ShowSearchJobButton,details_ShowPrint,details_BackToFindWorkButtonUrl,isExternal
0,False,1,Dagplejer til distrikt Nymarken og til distrikt Marslev,Dagplejer til distrikt Nymarken og til distrikt Marslev,"Kerteminde Kommune søger en dagplejer til distrikt Nymarken og en dagplejer til distrikt MarslevHar du lyst til at arbejde pædagogisk med de små, i de vigtigste år af deres ",Kerteminde Kommune,Lindøalleen 51,5330,Munkebo,False,False,False,True,2022-04-19T00:00:00,2022-05-24T00:00:00,24. maj 2022,0001-01-01T00:00:00,False,False,https://job.jobnet.dk/CV/FindWork/Details/5578848,Syddanmark,Kerteminde,Danmark,5330,,,,Fuldtid,"Pædagogisk, socialt og kirkeligt arbejde",Børnepasning,Dagplejer,55.4588,10.5567,,,0,57822,29189706,False,False,https://job.jobnet.dk/CV/FindWork/DetailsSocialmedia/5578848,https://job.jobnet.dk/CV/FindWork/Details/5578848,https://job.jobnet.dk/CV/FindWork/Details/5578848,True,5578848,55.4588,10.5567,"{'Id': 1, 'Name': 'Fuldtid'}, {'Id': 16, 'Name': 'Deltid'}","{'Id': 1, 'Name': 'Almindelige vilkår'}, {'Id': 2, 'Name': 'Fleksjob'}, {'Id': 3, 'Name': 'Skånejob'}, {'Id': 4, 'Name': 'Egnet til efterlønnere og seniorer'}, {'Id': 5, 'Name': 'Job med løntilskud'}, {'Id': 6, 'Name': 'Rotationsjob'}, {'Id': 7, 'Name': 'Virksomhedspraktik'}","{'Id': 1, 'Name': 'Fastansættelse'}, {'Id': 16, 'Name': 'Tidsbegrænset ansættelse'}",Kerteminde Kommune,Lindøalleen 51,58,Danmark,440,Kerteminde,3,Syddanmark,5330,Munkebo,,0,Primary,,,,None,,1016976055,29189706,None,5578848,5578848,Kerteminde Kommune,Lindøalleen 51,58,Danmark,440,Kerteminde,3,Syddanmark,5330,Munkebo,,0,Primary,,,,None,,1016976055,29189706,None,,2022-04-19T00:00:00,2022-05-24T00:00:00,Dagplejer til distrikt Nymarken og til distrikt Marslev,"Kerteminde Kommune søger en dagplejer til distrikt Nymarken og en dagplejer til distrikt Marslev Har du lyst til at arbejde pædagogisk med de små, i de vigtigste år af deres liv, så er denne stilling måske lige noget for dig. Dagplejen i Nymarken og i Marslev søger omsorgsfulde og nærværende dagplejere med hjerte for de yngste. Arbejdstiden for dagplejere er 48 timer om ugen, fleksibelt tilrettelagt mellem kl. 6-18, og du vil modtage op til 4 børn i alderen 0 – 3,1 år. Stillingerne er faste og på fuldtid med tiltrædelse 15. august 2022. Som dagplejer bliver du en del af et godt netværk, og selvom jobbet er selvstændigt, står du ikke alene. Du vil deltage i kurser og få støtte og rådgivning af såvel kollegaer som pædagogisk leder og dagplejekoordinator, ligesom du vil indgå i en gruppe af dagplejere, som mødes i legestue hver anden uge. Vi arbejder ud fra den styrkede læreplan, hvor vi vægter de nære relationer, hvor vi kan fremme børnenes trivsel, læring, udvikling og dannelse gennem pædagogiske læringsmiljøer, hvor legen er grundlæggende, og hvor der tages udgangspunkt i børneperspektivet. Vi forventer, at: du er et rummeligt menneske og kan skabe omsorg og nærvær i relationen til børnene du er positiv og anerkendende i din tilgang til andre mennesker du er moden og ansvarlig du kan arbejde professionelt og selvstændigt du kan se det enkelte barns behov og planlægge din praksis ud fra det du er indstillet på et godt, åbent og fleksibelt samarbejde med børn, forældre, kollegaer og ledelse du er villig til at benytte en del af din bolig, så dette bliver et udviklende og foranderligt læringsmiljø du vil og kan samarbejde tværfagligt, når der er behov for det du har bopæl i distrikt Nymarken/Marslev og omegn din familie er indstillet på, at du arbejder i eget hjem Vil tilbyder:  Et tæt samarbejde med vores dygtige dagplejere og Nymarkens Børnehus/Marslev Børnehus Et spændende og afvekslende arbejde Et arbejde med ansvar og indflydelse på hverdagen En arbejdsplads med mulighed for faglig og personlig udvikling Sparring og videndeling med kollegaer, dagplejekoordinator og pædagogisk leder Samarbejde med forskellige faggrupper Kurser for dagplejere Legetøj, aktivitetsmaterialer og udstyr i form af barnevogn, pusleplads og andet Praktikdage hos en erfaren dagplejer Hvis du er interesseret i at høre mere, kommer vi gerne ud til dig til en uforpligtende snak om mulighederne for at oprette en dagpleje i dit hjem. For yderligere oplysninger omkring stillingen kan du kontakte: Dagplejekoordinator Eva Holm Mail: eho@kerteminde.dk Telefon: 23 46 37 71 Pædagogisk leder Nymarkens Børnehus Anette Larsen Mail: anl@kerteminde.dk Telefon: 24 91 94 26 Du kan også læse mere om dagplejen på hjemmesiden Nymarken: https://nymarken.aula.dk/ Marslev: https://marslev.aula.dk/ Løn- og ansættelsesvilkår efter gældende overenskomst med FOA. Ansøgningsfrist er søndag den 19/6, men der vil fra den 1. juni blive afholdt samtaler i eget hjem med evt. interesserede dagplejere. Stillingen kan kun søges elektronisk. Kerteminde Kommune betragter mangfoldighed som en styrke og opfordrer derfor alle uanset alder, køn, religion eller etnisk tilhørsforhold til at søge ledige stillinger. 
 Denne jobannonce blev oprindeligt opslået på https://www.ofir.dk/
 (Den originale annonce kan ses på: https://www.ofir.dk/showojob?ofirid=e53b638d)",Lindøalleen 51,58,Danmark,440,Kerteminde,3,Syddanmark,5330,Munkebo,1,1,Fuldtid,None,None,1,,0,,0,0,0,,False,"{'Id': 7914020, 'Email': None, 'FaxNumber': None, 'PersonName': 'Rekrutteringsansvarlig Rekrutteringsansvarlig', 'FirstName': 'Rekrutteringsansvarlig', 'LastName': 'Rekrutteringsansvarlig', 'PositionTitle': None, 'PhoneNumbers': [{'Number': '65151515', 'Type': 0, 'Description': 'Hovednummer'}]}",,False,False,False,False,4,,,False,False,False,False,,,,,https://www.ofir.dk/resultat/Jobannonce.aspx?ofirId=e53b638d&action=sendApplicationUrl,False,2022-05-24T00:00:00,,0,Primary,7,/CV/FindWork/GetLogo?JobAdId=5578848&Organisation=29189706,"Lindøalleen 51,5330, Munkebo",True,False,/CV/Jobseeking/JobLog/CreateJobSearch?JobnetJobPostingIdentifier=5578848&Company.Name=Kerteminde Kommune&SubmissionDeadlineDate=2022-5-24&Title=Dagplejer til distrikt Nymarken og til distrikt Marslev&WeeklyWorkTime=1,00000000-0000-0000-0000-000000000000,False,0,,,Dagplejer til distrikt Nymarken og til distrikt Marslev,True,,True,1,,5578848,,,False,False,,0,False,Kerteminde Kommune,Lindøalleen 51,,,5330,False,False,False,Munkebo,Rekrutteringsansvarlig Rekrutteringsansvarlig,65151515,,,,,,False,,2022-05-24T00:00:00,,0,False,0,,,,,0,,,,False,False,,,False,False,,,,False,,False,,,Arbejdspladsen ligger i Kerteminde kommune,False,Kerteminde Kommune,,None,,False,False,"Kerteminde Kommune søger en dagplejer til distrikt Nymarken og en dagplejer til distrikt MarslevHar du lyst til at arbejde pædagogisk med de små, i de vigtigste år af deres liv, så er denne stilling måske lige noget for dig.Dagplejen i Nymarken og i Marslev søger omsorgsfulde og nærværende dagplejere med hjerte for de yngste.Arbejdstiden for dagple","""Kerteminde Kommune søger en dagplejer til distrikt Nymarken og en dagplejer til distrikt MarslevHar du lyst til at arbejde pædagogisk med de små, i de vigtigste år af deres liv, så er denne stilling måske lige noget for dig.Dagplejen i Nymarken og i Marslev søger omsorgsfulde og nærværende dagplejere med hjerte for de yngste.Arbejdstiden for dagple""","""Dagplejer til distrikt Nymarken og til distrikt Marslev""","https://www.google.dk/maps/dir//Lindøalleen+51,5330,+Munkebo/","Kerteminde Kommune søger en dagplejer til distrikt Nymarken og en dagplejer til distrikt Marslev Har du lyst til at arbejde pædagogisk med de små, i de vigtigste år af deres liv, så er denne stilling måske lige noget for dig. Dagplejen i Nymarken og i Marslev søger omsorgsfulde og nærværende dagplejere med hjerte for de yngste. Arbejdstiden for dagplejere er 48 timer om ugen, fleksibelt tilrettelagt mellem kl. 6-18, og du vil modtage op til 4 børn i alderen 0 – 3,1 år. Stillingerne er faste og på fuldtid med tiltrædelse 15. august 2022. Som dagplejer bliver du en del af et godt netværk, og selvom jobbet er selvstændigt, står du ikke alene. Du vil deltage i kurser og få støtte og rådgivning af såvel kollegaer som pædagogisk leder og dagplejekoordinator, ligesom du vil indgå i en gruppe af dagplejere, som mødes i legestue hver anden uge. Vi arbejder ud fra den styrkede læreplan, hvor vi vægter de nære relationer, hvor vi kan fremme børnenes trivsel, læring, udvikling og dannelse gennem pædagogiske læringsmiljøer, hvor legen er grundlæggende, og hvor der tages udgangspunkt i børneperspektivet. Vi forventer, at: du er et rummeligt menneske og kan skabe omsorg og nærvær i relationen til børnene du er positiv og anerkendende i din tilgang til andre mennesker du er moden og ansvarlig du kan arbejde professionelt og selvstændigt du kan se det enkelte barns behov og planlægge din praksis ud fra det du er indstillet på et godt, åbent og fleksibelt samarbejde med børn, forældre, kollegaer og ledelse du er villig til at benytte en del af din bolig, så dette bliver et udviklende og foranderligt læringsmiljø du vil og kan samarbejde tværfagligt, når der er behov for det du har bopæl i distrikt Nymarken/Marslev og omegn din familie er indstillet på, at du arbejder i eget hjem Vil tilbyder:  Et tæt samarbejde med vores dygtige dagplejere og Nymarkens Børnehus/Marslev Børnehus Et spændende og afvekslende arbejde Et arbejde med ansvar og indflydelse på hverdagen En arbejdsplads med mulighed for faglig og personlig udvikling Sparring og videndeling med kollegaer, dagplejekoordinator og pædagogisk leder Samarbejde med forskellige faggrupper Kurser for dagplejere Legetøj, aktivitetsmaterialer og udstyr i form af barnevogn, pusleplads og andet Praktikdage hos en erfaren dagplejer Hvis du er interesseret i at høre mere, kommer vi gerne ud til dig til en uforpligtende snak om mulighederne for at oprette en dagpleje i dit hjem. For yderligere oplysninger omkring stillingen kan du kontakte: Dagplejekoordinator Eva Holm Mail: eho@kerteminde.dk Telefon: 23 46 37 71 Pædagogisk leder Nymarkens Børnehus Anette Larsen Mail: anl@kerteminde.dk Telefon: 24 91 94 26 Du kan også læse mere om dagplejen på hjemmesiden Nymarken:  https://nymarken.aula.dk/ Marslev:  https://marslev.aula.dk/ Løn- og ansættelsesvilkår efter gældende overenskomst med FOA. Ansøgningsfrist er søndag den 19/6, men der vil fra den 1. juni blive afholdt samtaler i eget hjem med evt. interesserede dagplejere. Stillingen kan kun søges elektronisk. Kerteminde Kommune betragter mangfoldighed som en styrke og opfordrer derfor alle uanset alder, køn, religion eller etnisk tilhørsforhold til at søge ledige stillinger. 
 Denne jobannonce blev oprindeligt opslået på  https://www.ofir.dk/ 
 (Den originale annonce kan ses på:  https://www.ofir.dk/showojob?ofirid=e53b638d )","https://www.google.dk/maps/place/Lindøalleen+51,5330,+Munkebo/",29189706,False,False,,False
