summary_AutomatchType,summary_Abroad,summary_Weight,summary_Title,summary_JobHeadline,summary_Presentation,summary_HiringOrgName,summary_WorkPlaceAddress,summary_WorkPlacePostalCode,summary_WorkPlaceCity,summary_WorkPlaceOtherAddress,summary_WorkPlaceAbroad,summary_WorkPlaceNotStatic,summary_UseWorkPlaceAddressForJoblog,summary_PostingCreated,summary_LastDateApplication,summary_FormattedLastDateApplication,summary_AssignmentStartDate,summary_IsHotjob,summary_IsExternal,summary_Url,summary_Region,summary_Municipality,summary_Country,summary_PostalCode,summary_PostalCodeName,summary_JobAnnouncementType,summary_EmploymentType,summary_WorkHours,summary_OccupationArea,summary_OccupationGroup,summary_Occupation,summary_Location_Latitude,summary_Location_Longitude,summary_JoblogWorkTime_WorkHour,summary_JoblogWorkTime_DailyWorkTime,summary_WorkplaceID,summary_OrganisationId,summary_HiringOrgCVR,summary_UserLoggedIn,summary_AnonymousEmployer,summary_ShareUrl,summary_DetailsUrl,summary_JobLogUrl,summary_HasLocationValues,summary_ID,summary_Latitude,summary_Longitude,details_WorkSchedule,details_WorkConditions,details_EmploymentTypes,details_WorkPlace_Name,details_WorkPlace_Address_AddressLine,details_WorkPlace_Address_Country_Id,details_WorkPlace_Address_Country_Name,details_WorkPlace_Address_Municipality_Id,details_WorkPlace_Address_Municipality_Name,details_WorkPlace_Address_Region_Id,details_WorkPlace_Address_Region_Name,details_WorkPlace_Address_PostalCode,details_WorkPlace_Address_City,details_WorkPlace_PhoneNumber_Number,details_WorkPlace_PhoneNumber_Type,details_WorkPlace_PhoneNumber_Description,details_WorkPlace_FaxNumber,details_WorkPlace_Email,details_WorkPlace_WebAddress,details_WorkPlace_Description,details_WorkPlace_Logo,details_WorkPlace_WorkPlaceOrganizationNumber,details_WorkPlace_OrganizationNumber,details_WorkPlace_OrganizationDescription,details_JobPositionPosting_Id,details_JobPositionPosting_OriginalJppId,details_JobPositionPosting_HiringOrg_Name,details_JobPositionPosting_HiringOrg_Address_AddressLine,details_JobPositionPosting_HiringOrg_Address_Country_Id,details_JobPositionPosting_HiringOrg_Address_Country_Name,details_JobPositionPosting_HiringOrg_Address_Municipality_Id,details_JobPositionPosting_HiringOrg_Address_Municipality_Name,details_JobPositionPosting_HiringOrg_Address_Region_Id,details_JobPositionPosting_HiringOrg_Address_Region_Name,details_JobPositionPosting_HiringOrg_Address_PostalCode,details_JobPositionPosting_HiringOrg_Address_City,details_JobPositionPosting_HiringOrg_PhoneNumber_Number,details_JobPositionPosting_HiringOrg_PhoneNumber_Type,details_JobPositionPosting_HiringOrg_PhoneNumber_Description,details_JobPositionPosting_HiringOrg_FaxNumber,details_JobPositionPosting_HiringOrg_Email,details_JobPositionPosting_HiringOrg_WebAddress,details_JobPositionPosting_HiringOrg_Description,details_JobPositionPosting_HiringOrg_Logo,details_JobPositionPosting_HiringOrg_WorkPlaceOrganizationNumber,details_JobPositionPosting_HiringOrg_OrganizationNumber,details_JobPositionPosting_HiringOrg_OrganizationDescription,details_JobPositionPosting_RecruitingCompany,details_JobPositionPosting_PublicationStartDate,details_JobPositionPosting_PublicationEndDate,details_JobPositionPosting_JobPositionInformation_PositionTitle,details_JobPositionPosting_JobPositionInformation_Purpose,details_JobPositionPosting_JobPositionInformation_WorkLocation_AddressLine,details_JobPositionPosting_JobPositionInformation_WorkLocation_Country_Id,details_JobPositionPosting_JobPositionInformation_WorkLocation_Country_Name,details_JobPositionPosting_JobPositionInformation_WorkLocation_Municipality_Id,details_JobPositionPosting_JobPositionInformation_WorkLocation_Municipality_Name,details_JobPositionPosting_JobPositionInformation_WorkLocation_Region_Id,details_JobPositionPosting_JobPositionInformation_WorkLocation_Region_Name,details_JobPositionPosting_JobPositionInformation_WorkLocation_PostalCode,details_JobPositionPosting_JobPositionInformation_WorkLocation_City,details_JobPositionPosting_JobPositionInformation_EmploymentType,details_JobPositionPosting_JobPositionInformation_WeeklyWorkHours_TypeId,details_JobPositionPosting_JobPositionInformation_WeeklyWorkHours_TypeName,details_JobPositionPosting_JobPositionInformation_WeeklyWorkHours_Description,details_JobPositionPosting_JobPositionInformation_CompensationDescription,details_JobPositionPosting_JobPositionInformation_NumberToFill,details_JobPositionPosting_JobPositionInformation_DriverLicense,details_JobPositionPosting_JobPositionInformation_Occupation_DiscoWeb,details_JobPositionPosting_JobPositionInformation_Occupation_AlternateNames,details_JobPositionPosting_JobPositionInformation_Occupation_GroupId,details_JobPositionPosting_JobPositionInformation_Occupation_AreaId,details_JobPositionPosting_JobPositionInformation_Occupation_Id,details_JobPositionPosting_JobPositionInformation_Occupation_Name,details_JobPositionPosting_JobPositionInformation_IsGovernmentHiring,details_JobPositionPosting_JobPositionInformation_JppContacts,details_JobPositionPosting_JobPositionInformation_EmploymentDate,details_JobPositionPosting_IsRecruitmentOfForeignNationals,details_JobPositionPosting_IsWorkInDenmark,details_JobPositionPosting_IsAnonymousEmployer,details_JobPositionPosting_IsDisabilityFriendly,details_JobPositionPosting_JppType,details_JobPositionPosting_ApplicationDetails_WorkHourMax,details_JobPositionPosting_ApplicationDetails_WorkHourMin,details_JobPositionPosting_ApplicationDetails_DailyWorkTimeWeekend,details_JobPositionPosting_ApplicationDetails_DailyWorkTimeNight,details_JobPositionPosting_ApplicationDetails_DailyWorkTimeEvening,details_JobPositionPosting_ApplicationDetails_DailyWorkTimeDay,details_JobPositionPosting_ApplicationDetails_ReferenceText,details_JobPositionPosting_ApplicationDetails_RemarksToApplicant,details_JobPositionPosting_ApplicationDetails_ByEmail,details_JobPositionPosting_ApplicationDetails_ByPhone,details_JobPositionPosting_ApplicationDetails_ApplyViaUrl,details_JobPositionPosting_ApplicationDetails_ReplyInWriting,details_JobPositionPosting_ApplicationDetails_ApplicationDeadlineDate,details_JobPositionPosting_ContactAuthorityPhoneNumber_Number,details_JobPositionPosting_ContactAuthorityPhoneNumber_Type,details_JobPositionPosting_ContactAuthorityPhoneNumber_Description,details_JobPositionPosting_Status,details_LogoUrl,details_Address,details_ShowMap,details_ShowShareButtonJobLog,details_JobLogUrl,details_JobLogTemplateModel_Identifier,details_JobLogTemplateModel_UseWorkPlaceAddressForJoblog,details_JobLogTemplateModel_Category,details_JobLogTemplateModel_CvCustomerIdentifier,details_JobLogTemplateModel_JobSeekingStatus,details_JobLogTemplateModel_Title,details_JobLogTemplateModel_IsApplicationSourceRequired,details_JobLogTemplateModel_ApplicationSource,details_JobLogTemplateModel_IsWeeklyWorkTimeRequired,details_JobLogTemplateModel_WeeklyWorkTime,details_JobLogTemplateModel_HoursPerWeek,details_JobLogTemplateModel_JobnetJobPostingIdentifier,details_JobLogTemplateModel_JobAdDocument_Title,details_JobLogTemplateModel_JobAdDocument_Identifier,details_JobLogTemplateModel_JobAdDocument_IsDeletedBySystem,details_JobLogTemplateModel_JobAdDocument_IsDeletedByUser,details_JobLogTemplateModel_JobAdFile,details_JobLogTemplateModel_Company_JobLogEntryCategory,details_JobLogTemplateModel_Company_ShowAddressFieldsEvenIfEmpty,details_JobLogTemplateModel_Company_Name,details_JobLogTemplateModel_Company_Address,details_JobLogTemplateModel_Company_Country,details_JobLogTemplateModel_Company_EmploymentAreaID,details_JobLogTemplateModel_Company_PostCode,details_JobLogTemplateModel_Company_IsCountryAndTownAndPostCodeEmpty,details_JobLogTemplateModel_Company_IsTownAndPostCodeEmpty,details_JobLogTemplateModel_Company_IsCountryDanmark,details_JobLogTemplateModel_Company_Town,details_JobLogTemplateModel_Company_ContactPerson,details_JobLogTemplateModel_Company_Phone,details_JobLogTemplateModel_Company_Email,details_JobLogTemplateModel_Company_Latitude,details_JobLogTemplateModel_Company_Longitude,details_JobLogTemplateModel_Company_DailyTravelTimeInMinutes,details_JobLogTemplateModel_Company_DistanceToCompanyInMeters,details_JobLogTemplateModel_Company_IsCreateMode,details_JobLogTemplateModel_TypeOfSubmission,details_JobLogTemplateModel_SubmissionDate,details_JobLogTemplateModel_SubmissionDateFormatted,details_JobLogTemplateModel_SubmissionDateTiks,details_JobLogTemplateModel_IsSubmissionDateRequired,details_JobLogTemplateModel_Status,details_JobLogTemplateModel_DateCreatedFormatted,details_JobLogTemplateModel_DateCreated,details_JobLogTemplateModel_DateModifiedFormatted,details_JobLogTemplateModel_DateModified,details_JobLogTemplateModel_LastModifiedDateTiks,details_JobLogTemplateModel_DateClosed,details_JobLogTemplateModel_JobApplicationDocument_Title,details_JobLogTemplateModel_JobApplicationDocument_Identifier,details_JobLogTemplateModel_JobApplicationDocument_IsDeletedBySystem,details_JobLogTemplateModel_JobApplicationDocument_IsDeletedByUser,details_JobLogTemplateModel_CvDocument_Title,details_JobLogTemplateModel_CvDocument_Identifier,details_JobLogTemplateModel_CvDocument_IsDeletedBySystem,details_JobLogTemplateModel_CvDocument_IsDeletedByUser,details_JobLogTemplateModel_JobApplicationFile,details_JobLogTemplateModel_CvFile,details_JobLogTemplateModel_SubmissionDeadlineDate,details_JobLogTemplateModel_IsPersisted,details_JobLogTemplateModel_ServerValidationErrors,details_JobLogTemplateModel_HasServerValidationErrors,details_JoblogWorkTime_WorkHour,details_JoblogWorkTime_DailyWorkTime,details_Place,details_OpenPrintDialog,details_WorkPlaceInfoText,details_JobCenterContactDetails,details_WorkPlaceDescriptionText,details_FavoriteText,details_IsFavorite,details_ShowFavorite,details_MetaOgTextForSharing,details_DescriptionForSharing,details_TitleForSharing,details_RutePlan,details_FormattedPurpose,details_MapUrl,details_OrganizationNumber,details_ShowSearchJobButton,details_ShowPrint,details_BackToFindWorkButtonUrl,isExternal
0,False,1,GEODIS søger en speditørelev i verdensklasse! ,GEODIS søger en speditørelev i verdensklasse! ,"Har du interesse for spedition, shipping og fortoldning, og kunne du tænke dig nye udfordringer i et internationalt miljø? Så har vi den helt rigtige elevstilling til dig!
Er du klar",GEODIS Denmark A/S,Oliefabriksvej 29-43,2770,Kastrup,False,False,False,True,2022-04-18T00:00:00,2022-05-31T00:00:00,31. maj 2022,0001-01-01T00:00:00,False,False,https://job.jobnet.dk/CV/FindWork/Details/5578414,Hovedstaden og Bornholm,Tårnby,Danmark,2770,,,,Fuldtid,Elever,"Kontor, administration, regnskab og finans",Speditørelev,55.6269,12.5937,,,143621,125393,35451714,False,False,https://job.jobnet.dk/CV/FindWork/DetailsSocialmedia/5578414,https://job.jobnet.dk/CV/FindWork/Details/5578414,https://job.jobnet.dk/CV/FindWork/Details/5578414,True,5578414,55.6269,12.5937,"{'Id': 1, 'Name': 'Fuldtid'}, {'Id': 16, 'Name': 'Deltid'}","{'Id': 1, 'Name': 'Almindelige vilkår'}, {'Id': 2, 'Name': 'Fleksjob'}, {'Id': 3, 'Name': 'Skånejob'}, {'Id': 4, 'Name': 'Egnet til efterlønnere og seniorer'}, {'Id': 5, 'Name': 'Job med løntilskud'}, {'Id': 6, 'Name': 'Rotationsjob'}, {'Id': 7, 'Name': 'Virksomhedspraktik'}","{'Id': 1, 'Name': 'Fastansættelse'}, {'Id': 16, 'Name': 'Tidsbegrænset ansættelse'}",GEODIS Denmark A/S,Oliefabriksvej 29-43,58,Danmark,185,Tårnby,4,"Hovedstaden, Sjælland og Bornholm",2770,Kastrup,,0,Primary,,,,None,,1003045760,35451714,None,5578414,5578414,GEODIS Denmark A/S,Oliefabriksvej 29-43,58,Danmark,185,Tårnby,4,"Hovedstaden, Sjælland og Bornholm",2770,Kastrup,,0,Primary,,,,None,,1003045760,35451714,None,,2022-04-18T00:00:00,2022-05-31T00:00:00,GEODIS søger en speditørelev i verdensklasse!,"Har du interesse for spedition, shipping og fortoldning, og kunne du tænke dig nye udfordringer i et internationalt miljø? Så har vi den helt rigtige elevstilling til dig! 
 Er du klar til en ny karriere? 
 Hvis du har mod på at starte et karriereforløb i en af de førende internationale transport- og logistikvirksomheder, vil du som elev i vores toldafdeling, komme til at arbejde tæt sammen med nogle spændende og meget kompetente kollegaer. I toldafdelingen, er ingen dage ens, og selvom vi har mange bolde i luften, er der stadig plads til udvikling og læring. Du vil blive en del af en branche med fuld fart på, og hvor vi har et stort ansvar for, at godsforsendelserne kommer afsted til tiden. Vi arbejder i toldområdet både med fortoldning inden for luft-, sø- og vejtransport.  
 ”Der er aldrig to dage, som elev i GEODIS, der er ens. Alle afdelinger er så forskellige - der er diverse ting og systemer, som går igen, men én gennemgående ting er ansvaret og respekten som man allerede som elev har mulighed for at påtage sig. Her er så mange lærerige udfordringer, og man stopper aldrig med sin udvikling. 
 Hvis man godt kan lide ansvar, en anderledes hverdag, og er klar til udfordringer, så er en elevplads i GEODIS, helt sikkert noget der kan anbefales! Allerede fra start bliver man sat direkte ind i operationen, og får sine fingre i klaveret. Ingen kedelige bøger, og lange afleveringer her! 
 Nikoline, Elev hos GEODIS 
  Fokus på dig og din udvikling 
 For os er din udvikling utrolig vigtig. Derfor vil du også blive udfordret med en stejl læringskurve i et komplet uddannelsesforløb med fokus på told. Vi har i GEODIS et stort fokus på din personlige udvikling, og du vil få tilknyttet en mentor, som løbende vil være med til spare, vejlede og sikre de optimale rammer for dig. Vi er i toldafdelingen et lille team på 4 medarbejdere, som alle har vores arbejdsplads i København. 
  Vi tilbyder dig 
 
 En spændende, fleksibel og udfordrende uddannelse i et dynamisk miljø 
 En international arbejdsplads 
 Et selvstændigt job i et godt og velfungerende team 
 
  Vi forventer, at du 
 
 Har et stort engagement og gå-på-mod 
 Er en god teamplayer 
 Er fleksibel og har et godt humør 
 
   Dit uddannelsesforløb 
 Vi har tilrettelagt et uddannelsesforløb, som er med til at sikre, at du som elev får en god og solid uddannelse hos GEODIS. I løbet af de næste 18-24 måneder, vil der undervejs være ca. 10 ugers teoretisk skoleophold på Roskilde handelsskole, og den praktiske del af uddannelsen, vil være på kontoret i København, Kastrup (Ca. 10 min fra Tårnby st.). For at du kan komme i betragtning som speditørelev til toldafdelingen, er det obligatorisk, at et af dine valgfag er ""Told"". Du vil blive en del af en uddannelsesplan, hvor du selvfølgelig også vil få kendskab og praktisk erfaring i GEODIS’ øvrige driftsafdelinger. I GEODIS prioriterer vi vores elevuddannelser højt, og vi har et stort fokus på din trivsel og læringskurve. 
   Hvordan kan jeg komme i betragtning til at blive toldspeditørelev hos GEODIS… 
 
 Hvis du har en HHX, EUX evt. EUX-Business eller en EUD-S med fagretning ´kontor´ 
 En EUD-S uddannelse skal gennemføres af elever, der i forvejen har en studentereksamen (HF, STX, HTX). 
 Det kan også være via et grundforløb (HG2, HGV, HGS) fra en handelsskole, hvor der øverst på beviset skal stå ´Spedition og shipping´. 
 Er du over 25 år, skal du have en realkompetencevurdering, hvis du følger en EUD-S eller en EUX-uddannelse 
 
   Oscar på 25 år fortæller om sine muligheder efter endt speditøruddannelse; 
 ”Jeg er 25 år gammel, og har været i spedition og shipping branchen i lige omkring 4 år. Når du er færdig med speditøruddannelsen, kan du bruge den til virkelig meget andet end bare at være speditør… eksempelvis som transportkøber, arbejde i eventbranchen, internationale tøjhuse og andre store virksomheder, du kan sidde i sales og sælge fragtløsninger… der er virkelig mange jobmuligheder… Heldigvis er uddannelsen ikke så lang, så det er noget man godt kan springe ud i, og så er det meget hands-on allerede fra start. 
 Kontorarbejde lyder måske ikke så attraktivt, men det er virkelig fedt at sidde i et team med kompetente og sjove kollegaer, at blive udfordret, kunne spare og komme med nye ideer - og alle inputs bliver taget godt imod… det har egentlig overrasket mig meget, hvor glad jeg er blevet for kontorarbejde, for det var ikke det jeg lige havde forestillet mig og planlagt inden jeg gik ind i speditionsbranchen - men du skal selvfølgelig have et flair for logistik, og synes det er sjovt. 
 Jeg synes er fedt at arbejde for GEODIS, fordi der er så mange internationale karrieremuligheder, og så arbejder vi i GEODIS med nogle af de bedste It-systemer i verden… alle er virkelig imødekommende og så er der fokus på dig og din udvikling.” 
  Oscar, Speditør hos GEODIS 
   Vi har fokus på dig 
 Vi har stort fokus på vores medarbejdere, og måler ugentligt arbejdsmoralen og medarbejdertilfredsheden via Winningtemp, hvor mere end 90 % af vores medarbejdere deltager. GEODIS er ligeledes certificeret i Investors In People, hvilket stiller store krav til os som organisation. GEODIS stræber efter at være den bedste og mest attraktive arbejdsplads gennem et godt kollegialt fællesskab, fleksibilitet og gode karrieremuligheder på tværs af både organisationen og landegrænser. 
 Gode personalegoder 
 
 Geo-dag og masser af sjove, kulturelle og sociale aktiviteter 
 God frokostordning 
 Fleksibel arbejdsplads med mulighed for hjemmearbejde Etc. 
 
  Vi søger dig, som ønsker at arbejde efter vores værdier – Passion, Trust, Innovation, Solidarity & Committment. 
 
  Løn: Efter kvalifikationer 
 Ansøgningsfrist: D. 31. maj, 2022 
 Arbejdssted: Oliefabriksvej 29-43, 2770 Kastrup 
 Tiltrædelse: Opstart efter aftale. Vi holder løbende samtaler. 
 
  Har du evt. spørgsmål til stillingen, er du velkommen til at kontakte Thomas Andersen: 
 Kontaktperson: 
 Thomas Andersen, Luftfragt Import Manager - CPH 
 thomas.andersen@geodis.com 
 Vidste du at… 
 GEODIS Group er ejet af SNCF logistics, en industriel og kommerciel organisation ejet af den franske republik og baseret i Paris. SNCF er nr. 1 for logistik og transport i Frankrig, nr. 4. i Europa og nr. 8. på verdensplan. GEODIS er grundlagt i 1904, og er en traditionsrig organisation med stærke værdier. GEODIS har mere end 41.000 medarbejdere fordelt i 168 nationaliteter. Vi ser os selv som værende den stærkeste vækstpartner for vores kunder, hvilket vi sikrer gennem den nyeste teknologi og viden, grøn bæredygtighed og stor diversitet. 
 Vil du kan finde meget mere information om GEODIS på www.geodis.dk. 
  Vi glæder os til at byde dig velkommen i GEODIS familien! 
 Sådan ansøger du 
 GEODIS søger en speditørelev i verdensklasse! - GEODIS Danmark A/S",Oliefabriksvej 29-43,58,Danmark,185,Tårnby,4,"Hovedstaden, Sjælland og Bornholm",2770,Kastrup,1,1,Fuldtid,None,None,1,,0,,0,0,0,,False,"{'Id': 7913274, 'Email': 'jesper.jensen@geodis.com', 'FaxNumber': None, 'PersonName': 'Jesper Werther Jensen', 'FirstName': 'Jesper Werther', 'LastName': 'Jensen', 'PositionTitle': None, 'PhoneNumbers': [{'Number': '26821891', 'Type': 0, 'Description': 'Hovednummer'}]}",,False,False,False,False,4,,,False,False,False,False,,,,26821891,https://job.ff.geodis.com/jobs/1716662-geodis-soger-en-speditorelev-i-verdensklasse,False,2022-05-31T00:00:00,,0,Primary,7,/CV/FindWork/GetLogo?JobAdId=5578414&Organisation=35451714,"Oliefabriksvej 29-43,2770, Kastrup",True,False,/CV/Jobseeking/JobLog/CreateJobSearch?JobnetJobPostingIdentifier=5578414&Company.Name=GEODIS Denmark A/S&SubmissionDeadlineDate=2022-5-31&Title=GEODIS søger en speditørelev i verdensklasse!&WeeklyWorkTime=1,00000000-0000-0000-0000-000000000000,False,0,,,GEODIS søger en speditørelev i verdensklasse!,True,,True,1,,5578414,,,False,False,,0,False,GEODIS Denmark A/S,Oliefabriksvej 29-43,,,2770,False,False,False,Kastrup,Jesper Werther Jensen,26821891,jesper.jensen@geodis.com,,,,,False,,2022-05-31T00:00:00,,0,False,0,,,,,0,,,,False,False,,,False,False,,,,False,,False,,,Arbejdspladsen ligger i Tårnby kommune,False,GEODIS Denmark A/S,,None,,False,False,"Har du interesse for spedition, shipping og fortoldning, og kunne du tænke dig nye udfordringer i et internationalt miljø? Så har vi den helt rigtige elevstilling til dig!
Er du klar til en ny karriere? 
Hvis du har mod på at starte et karriereforløb i en af de førende internationale transport- og logistikvirksomheder, vil du som elev i vores tolda","""Har du interesse for spedition, shipping og fortoldning, og kunne du tænke dig nye udfordringer i et internationalt miljø? Så har vi den helt rigtige elevstilling til dig!\nEr du klar til en ny karriere? \nHvis du har mod på at starte et karriereforløb i en af de førende internationale transport- og logistikvirksomheder, vil du som elev i vores tolda""","""GEODIS søger en speditørelev i verdensklasse!""","https://www.google.dk/maps/dir//Oliefabriksvej+29-43,2770,+Kastrup/","Har du interesse for spedition, shipping og fortoldning, og kunne du tænke dig nye udfordringer i et internationalt miljø? Så har vi den helt rigtige elevstilling til dig! 
 Er du klar til en ny karriere? 
 Hvis du har mod på at starte et karriereforløb i en af de førende internationale transport- og logistikvirksomheder, vil du som elev i vores toldafdeling, komme til at arbejde tæt sammen med nogle spændende og meget kompetente kollegaer. I toldafdelingen, er ingen dage ens, og selvom vi har mange bolde i luften, er der stadig plads til udvikling og læring. Du vil blive en del af en branche med fuld fart på, og hvor vi har et stort ansvar for, at godsforsendelserne kommer afsted til tiden. Vi arbejder i toldområdet både med fortoldning inden for luft-, sø- og vejtransport.  
 ”Der er aldrig to dage, som elev i GEODIS, der er ens. Alle afdelinger er så forskellige - der er diverse ting og systemer, som går igen, men én gennemgående ting er ansvaret og respekten som man allerede som elev har mulighed for at påtage sig. Her er så mange lærerige udfordringer, og man stopper aldrig med sin udvikling. 
 Hvis man godt kan lide ansvar, en anderledes hverdag, og er klar til udfordringer, så er en elevplads i GEODIS, helt sikkert noget der kan anbefales! Allerede fra start bliver man sat direkte ind i operationen, og får sine fingre i klaveret. Ingen kedelige bøger, og lange afleveringer her! 
 Nikoline, Elev hos GEODIS 
  Fokus på dig og din udvikling 
 For os er din udvikling utrolig vigtig. Derfor vil du også blive udfordret med en stejl læringskurve i et komplet uddannelsesforløb med fokus på told. Vi har i GEODIS et stort fokus på din personlige udvikling, og du vil få tilknyttet en mentor, som løbende vil være med til spare, vejlede og sikre de optimale rammer for dig. Vi er i toldafdelingen et lille team på 4 medarbejdere, som alle har vores arbejdsplads i København. 
  Vi tilbyder dig 
 
 En spændende, fleksibel og udfordrende uddannelse i et dynamisk miljø 
 En international arbejdsplads 
 Et selvstændigt job i et godt og velfungerende team 
 
  Vi forventer, at du 
 
 Har et stort engagement og gå-på-mod 
 Er en god teamplayer 
 Er fleksibel og har et godt humør 
 
   Dit uddannelsesforløb 
 Vi har tilrettelagt et uddannelsesforløb, som er med til at sikre, at du som elev får en god og solid uddannelse hos GEODIS. I løbet af de næste 18-24 måneder, vil der undervejs være ca. 10 ugers teoretisk skoleophold på Roskilde handelsskole, og den praktiske del af uddannelsen, vil være på kontoret i København, Kastrup (Ca. 10 min fra Tårnby st.). For at du kan komme i betragtning som speditørelev til toldafdelingen, er det obligatorisk, at et af dine valgfag er ""Told"". Du vil blive en del af en uddannelsesplan, hvor du selvfølgelig også vil få kendskab og praktisk erfaring i GEODIS’ øvrige driftsafdelinger. I GEODIS prioriterer vi vores elevuddannelser højt, og vi har et stort fokus på din trivsel og læringskurve. 
   Hvordan kan jeg komme i betragtning til at blive toldspeditørelev hos GEODIS… 
 
 Hvis du har en HHX, EUX evt. EUX-Business eller en EUD-S med fagretning ´kontor´ 
 En EUD-S uddannelse skal gennemføres af elever, der i forvejen har en studentereksamen (HF, STX, HTX). 
 Det kan også være via et grundforløb (HG2, HGV, HGS) fra en handelsskole, hvor der øverst på beviset skal stå ´Spedition og shipping´. 
 Er du over 25 år, skal du have en realkompetencevurdering, hvis du følger en EUD-S eller en EUX-uddannelse 
 
   Oscar på 25 år fortæller om sine muligheder efter endt speditøruddannelse; 
 ”Jeg er 25 år gammel, og har været i spedition og shipping branchen i lige omkring 4 år. Når du er færdig med speditøruddannelsen, kan du bruge den til virkelig meget andet end bare at være speditør… eksempelvis som transportkøber, arbejde i eventbranchen, internationale tøjhuse og andre store virksomheder, du kan sidde i sales og sælge fragtløsninger… der er virkelig mange jobmuligheder… Heldigvis er uddannelsen ikke så lang, så det er noget man godt kan springe ud i, og så er det meget hands-on allerede fra start. 
 Kontorarbejde lyder måske ikke så attraktivt, men det er virkelig fedt at sidde i et team med kompetente og sjove kollegaer, at blive udfordret, kunne spare og komme med nye ideer - og alle inputs bliver taget godt imod… det har egentlig overrasket mig meget, hvor glad jeg er blevet for kontorarbejde, for det var ikke det jeg lige havde forestillet mig og planlagt inden jeg gik ind i speditionsbranchen - men du skal selvfølgelig have et flair for logistik, og synes det er sjovt. 
 Jeg synes er fedt at arbejde for GEODIS, fordi der er så mange internationale karrieremuligheder, og så arbejder vi i GEODIS med nogle af de bedste It-systemer i verden… alle er virkelig imødekommende og så er der fokus på dig og din udvikling.” 
  Oscar, Speditør hos GEODIS 
   Vi har fokus på dig 
 Vi har stort fokus på vores medarbejdere, og måler ugentligt arbejdsmoralen og medarbejdertilfredsheden via Winningtemp, hvor mere end 90 % af vores medarbejdere deltager. GEODIS er ligeledes certificeret i Investors In People, hvilket stiller store krav til os som organisation. GEODIS stræber efter at være den bedste og mest attraktive arbejdsplads gennem et godt kollegialt fællesskab, fleksibilitet og gode karrieremuligheder på tværs af både organisationen og landegrænser. 
 Gode personalegoder 
 
 Geo-dag og masser af sjove, kulturelle og sociale aktiviteter 
 God frokostordning 
 Fleksibel arbejdsplads med mulighed for hjemmearbejde Etc. 
 
  Vi søger dig, som ønsker at arbejde efter vores værdier – Passion, Trust, Innovation, Solidarity & Committment. 
 
  Løn: Efter kvalifikationer 
 Ansøgningsfrist: D. 31. maj, 2022 
 Arbejdssted: Oliefabriksvej 29-43, 2770 Kastrup 
 Tiltrædelse: Opstart efter aftale. Vi holder løbende samtaler. 
 
  Har du evt. spørgsmål til stillingen, er du velkommen til at kontakte Thomas Andersen: 
 Kontaktperson: 
 Thomas Andersen, Luftfragt Import Manager - CPH 
 thomas.andersen@geodis.com 
 Vidste du at… 
 GEODIS Group er ejet af SNCF logistics, en industriel og kommerciel organisation ejet af den franske republik og baseret i Paris. SNCF er nr. 1 for logistik og transport i Frankrig, nr. 4. i Europa og nr. 8. på verdensplan. GEODIS er grundlagt i 1904, og er en traditionsrig organisation med stærke værdier. GEODIS har mere end 41.000 medarbejdere fordelt i 168 nationaliteter. Vi ser os selv som værende den stærkeste vækstpartner for vores kunder, hvilket vi sikrer gennem den nyeste teknologi og viden, grøn bæredygtighed og stor diversitet. 
 Vil du kan finde meget mere information om GEODIS på  www.geodis.dk . 
  Vi glæder os til at byde dig velkommen i GEODIS familien! 
 Sådan ansøger du 
 GEODIS søger en speditørelev i verdensklasse! - GEODIS Danmark A/S","https://www.google.dk/maps/place/Oliefabriksvej+29-43,2770,+Kastrup/",35451714,False,False,,False
