summary_AutomatchType,summary_Abroad,summary_Weight,summary_Title,summary_JobHeadline,summary_Presentation,summary_HiringOrgName,summary_WorkPlaceAddress,summary_WorkPlacePostalCode,summary_WorkPlaceCity,summary_WorkPlaceOtherAddress,summary_WorkPlaceAbroad,summary_WorkPlaceNotStatic,summary_UseWorkPlaceAddressForJoblog,summary_PostingCreated,summary_LastDateApplication,summary_FormattedLastDateApplication,summary_AssignmentStartDate,summary_IsHotjob,summary_IsExternal,summary_Url,summary_Region,summary_Municipality,summary_Country,summary_PostalCode,summary_PostalCodeName,summary_JobAnnouncementType,summary_EmploymentType,summary_WorkHours,summary_OccupationArea,summary_OccupationGroup,summary_Occupation,summary_Location_Latitude,summary_Location_Longitude,summary_JoblogWorkTime_WorkHour,summary_JoblogWorkTime_DailyWorkTime,summary_WorkplaceID,summary_OrganisationId,summary_HiringOrgCVR,summary_UserLoggedIn,summary_AnonymousEmployer,summary_ShareUrl,summary_DetailsUrl,summary_JobLogUrl,summary_HasLocationValues,summary_ID,summary_Latitude,summary_Longitude,details_WorkSchedule,details_WorkConditions,details_EmploymentTypes,details_WorkPlace_Name,details_WorkPlace_Address_AddressLine,details_WorkPlace_Address_Country_Id,details_WorkPlace_Address_Country_Name,details_WorkPlace_Address_Municipality_Id,details_WorkPlace_Address_Municipality_Name,details_WorkPlace_Address_Region_Id,details_WorkPlace_Address_Region_Name,details_WorkPlace_Address_PostalCode,details_WorkPlace_Address_City,details_WorkPlace_PhoneNumber_Number,details_WorkPlace_PhoneNumber_Type,details_WorkPlace_PhoneNumber_Description,details_WorkPlace_FaxNumber,details_WorkPlace_Email,details_WorkPlace_WebAddress,details_WorkPlace_Description,details_WorkPlace_Logo,details_WorkPlace_WorkPlaceOrganizationNumber,details_WorkPlace_OrganizationNumber,details_WorkPlace_OrganizationDescription,details_JobPositionPosting_Id,details_JobPositionPosting_OriginalJppId,details_JobPositionPosting_HiringOrg_Name,details_JobPositionPosting_HiringOrg_Address_AddressLine,details_JobPositionPosting_HiringOrg_Address_Country_Id,details_JobPositionPosting_HiringOrg_Address_Country_Name,details_JobPositionPosting_HiringOrg_Address_Municipality_Id,details_JobPositionPosting_HiringOrg_Address_Municipality_Name,details_JobPositionPosting_HiringOrg_Address_Region_Id,details_JobPositionPosting_HiringOrg_Address_Region_Name,details_JobPositionPosting_HiringOrg_Address_PostalCode,details_JobPositionPosting_HiringOrg_Address_City,details_JobPositionPosting_HiringOrg_PhoneNumber_Number,details_JobPositionPosting_HiringOrg_PhoneNumber_Type,details_JobPositionPosting_HiringOrg_PhoneNumber_Description,details_JobPositionPosting_HiringOrg_FaxNumber,details_JobPositionPosting_HiringOrg_Email,details_JobPositionPosting_HiringOrg_WebAddress,details_JobPositionPosting_HiringOrg_Description,details_JobPositionPosting_HiringOrg_Logo,details_JobPositionPosting_HiringOrg_WorkPlaceOrganizationNumber,details_JobPositionPosting_HiringOrg_OrganizationNumber,details_JobPositionPosting_HiringOrg_OrganizationDescription,details_JobPositionPosting_RecruitingCompany,details_JobPositionPosting_PublicationStartDate,details_JobPositionPosting_PublicationEndDate,details_JobPositionPosting_JobPositionInformation_PositionTitle,details_JobPositionPosting_JobPositionInformation_Purpose,details_JobPositionPosting_JobPositionInformation_WorkLocation_AddressLine,details_JobPositionPosting_JobPositionInformation_WorkLocation_Country_Id,details_JobPositionPosting_JobPositionInformation_WorkLocation_Country_Name,details_JobPositionPosting_JobPositionInformation_WorkLocation_Municipality_Id,details_JobPositionPosting_JobPositionInformation_WorkLocation_Municipality_Name,details_JobPositionPosting_JobPositionInformation_WorkLocation_Region_Id,details_JobPositionPosting_JobPositionInformation_WorkLocation_Region_Name,details_JobPositionPosting_JobPositionInformation_WorkLocation_PostalCode,details_JobPositionPosting_JobPositionInformation_WorkLocation_City,details_JobPositionPosting_JobPositionInformation_EmploymentType,details_JobPositionPosting_JobPositionInformation_WeeklyWorkHours_TypeId,details_JobPositionPosting_JobPositionInformation_WeeklyWorkHours_TypeName,details_JobPositionPosting_JobPositionInformation_WeeklyWorkHours_Description,details_JobPositionPosting_JobPositionInformation_CompensationDescription,details_JobPositionPosting_JobPositionInformation_NumberToFill,details_JobPositionPosting_JobPositionInformation_DriverLicense,details_JobPositionPosting_JobPositionInformation_Occupation_DiscoWeb,details_JobPositionPosting_JobPositionInformation_Occupation_AlternateNames,details_JobPositionPosting_JobPositionInformation_Occupation_GroupId,details_JobPositionPosting_JobPositionInformation_Occupation_AreaId,details_JobPositionPosting_JobPositionInformation_Occupation_Id,details_JobPositionPosting_JobPositionInformation_Occupation_Name,details_JobPositionPosting_JobPositionInformation_IsGovernmentHiring,details_JobPositionPosting_JobPositionInformation_JppContacts,details_JobPositionPosting_JobPositionInformation_EmploymentDate,details_JobPositionPosting_IsRecruitmentOfForeignNationals,details_JobPositionPosting_IsWorkInDenmark,details_JobPositionPosting_IsAnonymousEmployer,details_JobPositionPosting_IsDisabilityFriendly,details_JobPositionPosting_JppType,details_JobPositionPosting_ApplicationDetails_WorkHourMax,details_JobPositionPosting_ApplicationDetails_WorkHourMin,details_JobPositionPosting_ApplicationDetails_DailyWorkTimeWeekend,details_JobPositionPosting_ApplicationDetails_DailyWorkTimeNight,details_JobPositionPosting_ApplicationDetails_DailyWorkTimeEvening,details_JobPositionPosting_ApplicationDetails_DailyWorkTimeDay,details_JobPositionPosting_ApplicationDetails_ReferenceText,details_JobPositionPosting_ApplicationDetails_RemarksToApplicant,details_JobPositionPosting_ApplicationDetails_ByEmail,details_JobPositionPosting_ApplicationDetails_ByPhone,details_JobPositionPosting_ApplicationDetails_ApplyViaUrl,details_JobPositionPosting_ApplicationDetails_ReplyInWriting,details_JobPositionPosting_ApplicationDetails_ApplicationDeadlineDate,details_JobPositionPosting_ContactAuthorityPhoneNumber_Number,details_JobPositionPosting_ContactAuthorityPhoneNumber_Type,details_JobPositionPosting_ContactAuthorityPhoneNumber_Description,details_JobPositionPosting_Status,details_LogoUrl,details_Address,details_ShowMap,details_ShowShareButtonJobLog,details_JobLogUrl,details_JobLogTemplateModel_Identifier,details_JobLogTemplateModel_UseWorkPlaceAddressForJoblog,details_JobLogTemplateModel_Category,details_JobLogTemplateModel_CvCustomerIdentifier,details_JobLogTemplateModel_JobSeekingStatus,details_JobLogTemplateModel_Title,details_JobLogTemplateModel_IsApplicationSourceRequired,details_JobLogTemplateModel_ApplicationSource,details_JobLogTemplateModel_IsWeeklyWorkTimeRequired,details_JobLogTemplateModel_WeeklyWorkTime,details_JobLogTemplateModel_HoursPerWeek,details_JobLogTemplateModel_JobnetJobPostingIdentifier,details_JobLogTemplateModel_JobAdDocument_Title,details_JobLogTemplateModel_JobAdDocument_Identifier,details_JobLogTemplateModel_JobAdDocument_IsDeletedBySystem,details_JobLogTemplateModel_JobAdDocument_IsDeletedByUser,details_JobLogTemplateModel_JobAdFile,details_JobLogTemplateModel_Company_JobLogEntryCategory,details_JobLogTemplateModel_Company_ShowAddressFieldsEvenIfEmpty,details_JobLogTemplateModel_Company_Name,details_JobLogTemplateModel_Company_Address,details_JobLogTemplateModel_Company_Country,details_JobLogTemplateModel_Company_EmploymentAreaID,details_JobLogTemplateModel_Company_PostCode,details_JobLogTemplateModel_Company_IsCountryAndTownAndPostCodeEmpty,details_JobLogTemplateModel_Company_IsTownAndPostCodeEmpty,details_JobLogTemplateModel_Company_IsCountryDanmark,details_JobLogTemplateModel_Company_Town,details_JobLogTemplateModel_Company_ContactPerson,details_JobLogTemplateModel_Company_Phone,details_JobLogTemplateModel_Company_Email,details_JobLogTemplateModel_Company_Latitude,details_JobLogTemplateModel_Company_Longitude,details_JobLogTemplateModel_Company_DailyTravelTimeInMinutes,details_JobLogTemplateModel_Company_DistanceToCompanyInMeters,details_JobLogTemplateModel_Company_IsCreateMode,details_JobLogTemplateModel_TypeOfSubmission,details_JobLogTemplateModel_SubmissionDate,details_JobLogTemplateModel_SubmissionDateFormatted,details_JobLogTemplateModel_SubmissionDateTiks,details_JobLogTemplateModel_IsSubmissionDateRequired,details_JobLogTemplateModel_Status,details_JobLogTemplateModel_DateCreatedFormatted,details_JobLogTemplateModel_DateCreated,details_JobLogTemplateModel_DateModifiedFormatted,details_JobLogTemplateModel_DateModified,details_JobLogTemplateModel_LastModifiedDateTiks,details_JobLogTemplateModel_DateClosed,details_JobLogTemplateModel_JobApplicationDocument_Title,details_JobLogTemplateModel_JobApplicationDocument_Identifier,details_JobLogTemplateModel_JobApplicationDocument_IsDeletedBySystem,details_JobLogTemplateModel_JobApplicationDocument_IsDeletedByUser,details_JobLogTemplateModel_CvDocument_Title,details_JobLogTemplateModel_CvDocument_Identifier,details_JobLogTemplateModel_CvDocument_IsDeletedBySystem,details_JobLogTemplateModel_CvDocument_IsDeletedByUser,details_JobLogTemplateModel_JobApplicationFile,details_JobLogTemplateModel_CvFile,details_JobLogTemplateModel_SubmissionDeadlineDate,details_JobLogTemplateModel_IsPersisted,details_JobLogTemplateModel_ServerValidationErrors,details_JobLogTemplateModel_HasServerValidationErrors,details_JoblogWorkTime_WorkHour,details_JoblogWorkTime_DailyWorkTime,details_Place,details_OpenPrintDialog,details_WorkPlaceInfoText,details_JobCenterContactDetails,details_WorkPlaceDescriptionText,details_FavoriteText,details_IsFavorite,details_ShowFavorite,details_MetaOgTextForSharing,details_DescriptionForSharing,details_TitleForSharing,details_RutePlan,details_FormattedPurpose,details_MapUrl,details_OrganizationNumber,details_ShowSearchJobButton,details_ShowPrint,details_BackToFindWorkButtonUrl,isExternal
0,False,1,Talentfuld og alsidig souschef med forretningsforståelse og drivkraft søges til Porsborgs Gastro Bar.,Talentfuld og alsidig souschef med forretningsforståelse og drivkraft søges til Porsborgs Gastro Bar.,"Hos Porsborgs sigter vi stadig højere, og leder netop nu efter den helt rette souschef, som kan og vil bidrage til den videre udvikling af forretningen og madprofilen sammen med vores fantastiske t",Porsborgs Gastrobar IVS,Jedsted Klostervej 36,6771,Gredstedbro,False,False,False,True,2022-04-19T00:00:00,2022-06-14T00:00:00,14. juni 2022,0001-01-01T00:00:00,False,False,https://job.jobnet.dk/CV/FindWork/Details/5579129,Syddanmark,Esbjerg,Danmark,6771,,,,Fuldtid,Ledelse,"Hotel, køkken og restaurant","Souschef, køkken",55.3911,8.726,,"Dag, aften, weekend",139106,121743,39168693,False,False,https://job.jobnet.dk/CV/FindWork/DetailsSocialmedia/5579129,https://job.jobnet.dk/CV/FindWork/Details/5579129,https://job.jobnet.dk/CV/FindWork/Details/5579129,True,5579129,55.3911,8.726,"{'Id': 1, 'Name': 'Fuldtid'}, {'Id': 16, 'Name': 'Deltid'}","{'Id': 1, 'Name': 'Almindelige vilkår'}, {'Id': 2, 'Name': 'Fleksjob'}, {'Id': 3, 'Name': 'Skånejob'}, {'Id': 4, 'Name': 'Egnet til efterlønnere og seniorer'}, {'Id': 5, 'Name': 'Job med løntilskud'}, {'Id': 6, 'Name': 'Rotationsjob'}, {'Id': 7, 'Name': 'Virksomhedspraktik'}","{'Id': 1, 'Name': 'Fastansættelse'}, {'Id': 16, 'Name': 'Tidsbegrænset ansættelse'}",Porsborgs Gastrobar IVS,Jedsted Klostervej 36,58,Danmark,561,Esbjerg,3,Syddanmark,6771,Gredstedbro,,0,Primary,,,,None,,1023126997,39168693,None,5579129,5579129,Porsborgs Gastrobar IVS,Jedsted Klostervej 36,58,Danmark,561,Esbjerg,3,Syddanmark,6771,Gredstedbro,,0,Primary,,,,None,,1023126997,39168693,None,,2022-04-19T00:00:00,2022-06-14T00:00:00,Talentfuld og alsidig souschef med forretningsforståelse og drivkraft søges til Porsborgs Gastro Bar.,"Hos Porsborgs sigter vi stadig højere, og leder netop nu efter den helt rette souschef, som kan og vil bidrage til den videre udvikling af forretningen og madprofilen sammen med vores fantastiske team. 
 Hos Porsborgs elsker vi mad, drikke og mennesker og har gjort det til vores levevej. Vi er en innovativ gastrovirksomhed, som med en sammensætning af mange forskellige profiler og kompetencer, hver dag skaber gode oplevelser for egne gæster i vores egne forretninger samt sunde forretninger og glade gæster for vores samarbejdspartnere og kunder. 
 Vi er kommet langt siden starten i 2018, men vi ser stadig os selv som en iværksættervirksomhed – stadig i rivende udvikling. Her er både højt til loftet og kort vej fra ønske til handling. 
 Lokationer og faciliteterHos Porsborgs Gastro Bar søger vi en dygtig souschef:  
 Vi driver en restaurant i hjertet af Ribe, som kan bespise op til 60 personer af gangen, samt udeservering i sommerhalvåret. Stilen er afslappet, imødekommende og med årstiden som omdrejningspunkt for menuen. Maden serveres som delemad – vi serverer til bordet, og ikke til “manden”. Køkkenet er lille, effektivt og meget personligt. 
 Hos Porsborgs elsker vi mad, drikke og mennesker og har gjort det til vores levevej. Vi er en innovativ gastrovirksomhed, som med en sammensætning af mange forskellige profiler og kompetencer, hver dag skaber gode oplevelser for egne gæster i vores egne forretninger samt sunde forretninger og glade gæster for vores samarbejdspartnere og kunder. 
 Vi er kommet langt siden starten i 2018, men vi ser stadig os selv som en iværksættervirksomhed – stadig i rivende udvikling. Her er både højt til loftet og kort vej fra ønske til handling. 
   Din rolle som souschef 
 Du kommer til at favne bredt, og sammen med køkkenchefen, danner du den madmæssige grundstamme hos Porsborgs. Du er personen der får service til at glide glat, du den naturlige leder i køkkenet og dine kollegaer kan altid regne med dig. Du er den person, som forstår at arbejde med og eksekvere på de linjer som køkkenchefen har lagt. Din primære gang vil være hos Porsborgs Gastro Bar hvor vi leverer klassiske restaurations oplevelser, men du vil også til tider spille en rolle i vores større centralkøkken hvorfra vores catering- og selskabsløsninger eksekveres. 
 Teamet 
 Du vil indgå i et team, pt. bestående af  5 kokke og kokkeelever, hvor forventningen er, at teamet skal yderligere opbygges og udvides. Dertil et kompetent tjenerteam indeholdende både erfaring og talent, som ledes af Restaurantchef Peter Olsen. 
 Udover køkkenchefen vil du have en mere udviklingsmæssig sparring i Partner & Gastronomisk Udvikler Rasmus Errebo. 
 I Selskabs & Catering regi vil du have vores erfarne F&B Manager, Dorthe Oksen, ved din side til en uvurderlig aflastning omkring salg, koordinering og praktik. 
 Ansvarsområder 
 
 Klassisk produktion, og produktionsplanlægning, af madløsninger og menuer sammen med den madmæssige ledelse 
 Fortsat opbygning af et team under en paraply i vækst og udvikling 
 Økonomisk medansvar for indkøb og produktion 
 Personalemæssigt medansvar for køkkenpersonale 
 
 Vi tilbyder 
 
 At du bliver en del af en spændende og ambitiøs gastrovirksomhed i fortsat udvikling 
 Et alsidigt job hvor to dage som regel ikke er ens 
 Afveksling i mellem afviklingsvagter og opbakningsvagter 
 Et job med stor selvstændighed og indflydelse 
 Gode kollegaer med mange forskellige baggrunde 
 En platform som på bedste vis sikrer at du kan performe 
 Et stærkt og etableret navn i markedet 
 
 Løn: Vi tilbyder en attraktiv lønpakke som inkluderer pension. 
 Hvem er du 
 
 Du er udlært kok – med fokus på kvalitet, godt håndværk og detaljer 
 Du har besiddet lignende stillinger i minimum 1 år.  
 Du er struktureret og finder tilfredshed i at skabe fornuftige arbejdsgange for optimal drift af dit køkken 
 Du har kørekort 
 Du trives i et travlt og hurtigt omskifteligt miljø 
 Du har en indbygget evne til at se flere muligheder og løsninger end begrænsninger og problemer 
 Du er ansvarsbevidst, fleksibel og effektiv 
 Du har godt humør, god energi og er en teamplayer 
 Du er i besiddelse af gode kommunikationsevner både på dansk og engelsk 
 Du har godt overblik og trives med mange bolde i luf 
 
 Tiltrædelse 
 Vi ønsker stillingen besat snarest, men finder det vigtigere at finde de rette. Ansøgningerne behandles løbende, ligesom vi indkalder til samtaler løbende. 
 Lidt om fremtiden 
 Hos Porsborgs har vi et stort ønske om at etablere os i flere byer i Danmark. I rollen som souschef vil du på mange måder bidrage til at vi opnår dette via dit høje niveau og evner til at samarbejde på tværs af holdet. Ligeledes er det et udpræget ønske fra ledelsens side, at de bærende kræfter i vores virksomhed har lyst til at udvikle sig sammen med os. Hvis dit DNA indeholder entreprenør- og iværksætterblod, har vi platformen og vil altid gerne have flere, rigtige, mennesker med på rejsen.",Jedsted Klostervej 36,58,Danmark,561,Esbjerg,3,Syddanmark,6771,Gredstedbro,1,1,Fuldtid,None,None,1,"{'DriversLicenceType': 11, 'Name': 'A10', 'Description': 'Villig til at bruge egen bil i jobbet'}, {'DriversLicenceType': 3, 'Name': 'B', 'Description': 'Almindelig bil'}",0,,0,0,0,,False,"{'Id': 7914780, 'Email': 'bjarne@fintflot.dk', 'FaxNumber': None, 'PersonName': 'Bjarne Christensen', 'FirstName': 'Bjarne', 'LastName': 'Christensen', 'PositionTitle': 'Ejer', 'PhoneNumbers': [{'Number': '71747884', 'Type': 0, 'Description': 'Hovednummer'}]}",,True,False,False,False,4,,,True,False,True,True,,,,,https://hr.foodforward.dk/job/talentfuld-og-alsidig-souschef-med-forretningsforstaaelse-og-drivkraft-soeges-til-porsborgs-gastro-bar/,True,2022-06-14T00:00:00,,0,Primary,7,/CV/FindWork/GetLogo?JobAdId=5579129&Organisation=39168693,"Jedsted Klostervej 36,6771, Gredstedbro",True,False,/CV/Jobseeking/JobLog/CreateJobSearch?JobnetJobPostingIdentifier=5579129&Company.Name=Porsborgs Gastrobar IVS&SubmissionDeadlineDate=2022-6-14&Title=Talentfuld og alsidig souschef med forretningsforståelse og drivkraft søges til Porsborgs Gastro Bar.&WeeklyWorkTime=1,00000000-0000-0000-0000-000000000000,False,0,,,Talentfuld og alsidig souschef med forretningsforståelse og drivkraft søges til Porsborgs Gastro Bar.,True,,True,1,,5579129,,,False,False,,0,False,Porsborgs Gastrobar IVS,Jedsted Klostervej 36,,,6771,False,False,False,Gredstedbro,Bjarne Christensen,71747884,bjarne@fintflot.dk,,,,,False,,2022-06-14T00:00:00,,0,False,0,,,,,0,,,,False,False,,,False,False,,,,False,,False,,"Dag, aften, weekend",Arbejdspladsen ligger i Esbjerg kommune,False,Porsborgs Gastrobar IVS,,None,,False,False,"Hos Porsborgs sigter vi stadig højere, og leder netop nu efter den helt rette souschef, som kan og vil bidrage til den videre udvikling af forretningen og madprofilen sammen med vores fantastiske team.
Hos Porsborgs elsker vi mad, drikke og mennesker og har gjort det til vores levevej. Vi er en innovativ gastrovirksomhed, som med en sammensætning a","""Hos Porsborgs sigter vi stadig højere, og leder netop nu efter den helt rette souschef, som kan og vil bidrage til den videre udvikling af forretningen og madprofilen sammen med vores fantastiske team.\nHos Porsborgs elsker vi mad, drikke og mennesker og har gjort det til vores levevej. Vi er en innovativ gastrovirksomhed, som med en sammensætning a""","""Talentfuld og alsidig souschef med forretningsforståelse og drivkraft søges til Porsborgs Gastro Bar.""","https://www.google.dk/maps/dir//Jedsted+Klostervej+36,6771,+Gredstedbro/","Hos Porsborgs sigter vi stadig højere, og leder netop nu efter den helt rette souschef, som kan og vil bidrage til den videre udvikling af forretningen og madprofilen sammen med vores fantastiske team. 
 Hos Porsborgs elsker vi mad, drikke og mennesker og har gjort det til vores levevej. Vi er en innovativ gastrovirksomhed, som med en sammensætning af mange forskellige profiler og kompetencer, hver dag skaber gode oplevelser for egne gæster i vores egne forretninger samt sunde forretninger og glade gæster for vores samarbejdspartnere og kunder. 
 Vi er kommet langt siden starten i 2018, men vi ser stadig os selv som en iværksættervirksomhed – stadig i rivende udvikling. Her er både højt til loftet og kort vej fra ønske til handling. 
 Lokationer og faciliteterHos Porsborgs Gastro Bar søger vi en dygtig souschef:  
 Vi driver en restaurant i hjertet af Ribe, som kan bespise op til 60 personer af gangen, samt udeservering i sommerhalvåret. Stilen er afslappet, imødekommende og med årstiden som omdrejningspunkt for menuen. Maden serveres som delemad – vi serverer til bordet, og ikke til “manden”. Køkkenet er lille, effektivt og meget personligt. 
 Hos Porsborgs elsker vi mad, drikke og mennesker og har gjort det til vores levevej. Vi er en innovativ gastrovirksomhed, som med en sammensætning af mange forskellige profiler og kompetencer, hver dag skaber gode oplevelser for egne gæster i vores egne forretninger samt sunde forretninger og glade gæster for vores samarbejdspartnere og kunder. 
 Vi er kommet langt siden starten i 2018, men vi ser stadig os selv som en iværksættervirksomhed – stadig i rivende udvikling. Her er både højt til loftet og kort vej fra ønske til handling. 
   Din rolle som souschef 
 Du kommer til at favne bredt, og sammen med køkkenchefen, danner du den madmæssige grundstamme hos Porsborgs. Du er personen der får service til at glide glat, du den naturlige leder i køkkenet og dine kollegaer kan altid regne med dig. Du er den person, som forstår at arbejde med og eksekvere på de linjer som køkkenchefen har lagt. Din primære gang vil være hos Porsborgs Gastro Bar hvor vi leverer klassiske restaurations oplevelser, men du vil også til tider spille en rolle i vores større centralkøkken hvorfra vores catering- og selskabsløsninger eksekveres. 
 Teamet 
 Du vil indgå i et team, pt. bestående af  5 kokke og kokkeelever, hvor forventningen er, at teamet skal yderligere opbygges og udvides. Dertil et kompetent tjenerteam indeholdende både erfaring og talent, som ledes af Restaurantchef Peter Olsen. 
 Udover køkkenchefen vil du have en mere udviklingsmæssig sparring i Partner & Gastronomisk Udvikler Rasmus Errebo. 
 I Selskabs & Catering regi vil du have vores erfarne F&B Manager, Dorthe Oksen, ved din side til en uvurderlig aflastning omkring salg, koordinering og praktik. 
 Ansvarsområder 
 
 Klassisk produktion, og produktionsplanlægning, af madløsninger og menuer sammen med den madmæssige ledelse 
 Fortsat opbygning af et team under en paraply i vækst og udvikling 
 Økonomisk medansvar for indkøb og produktion 
 Personalemæssigt medansvar for køkkenpersonale 
 
 Vi tilbyder 
 
 At du bliver en del af en spændende og ambitiøs gastrovirksomhed i fortsat udvikling 
 Et alsidigt job hvor to dage som regel ikke er ens 
 Afveksling i mellem afviklingsvagter og opbakningsvagter 
 Et job med stor selvstændighed og indflydelse 
 Gode kollegaer med mange forskellige baggrunde 
 En platform som på bedste vis sikrer at du kan performe 
 Et stærkt og etableret navn i markedet 
 
 Løn: Vi tilbyder en attraktiv lønpakke som inkluderer pension. 
 Hvem er du 
 
 Du er udlært kok – med fokus på kvalitet, godt håndværk og detaljer 
 Du har besiddet lignende stillinger i minimum 1 år.  
 Du er struktureret og finder tilfredshed i at skabe fornuftige arbejdsgange for optimal drift af dit køkken 
 Du har kørekort 
 Du trives i et travlt og hurtigt omskifteligt miljø 
 Du har en indbygget evne til at se flere muligheder og løsninger end begrænsninger og problemer 
 Du er ansvarsbevidst, fleksibel og effektiv 
 Du har godt humør, god energi og er en teamplayer 
 Du er i besiddelse af gode kommunikationsevner både på dansk og engelsk 
 Du har godt overblik og trives med mange bolde i luf 
 
 Tiltrædelse 
 Vi ønsker stillingen besat snarest, men finder det vigtigere at finde de rette. Ansøgningerne behandles løbende, ligesom vi indkalder til samtaler løbende. 
 Lidt om fremtiden 
 Hos Porsborgs har vi et stort ønske om at etablere os i flere byer i Danmark. I rollen som souschef vil du på mange måder bidrage til at vi opnår dette via dit høje niveau og evner til at samarbejde på tværs af holdet. Ligeledes er det et udpræget ønske fra ledelsens side, at de bærende kræfter i vores virksomhed har lyst til at udvikle sig sammen med os. Hvis dit DNA indeholder entreprenør- og iværksætterblod, har vi platformen og vil altid gerne have flere, rigtige, mennesker med på rejsen.","https://www.google.dk/maps/place/Jedsted+Klostervej+36,6771,+Gredstedbro/",39168693,False,False,,False
