summary_AutomatchType,summary_Abroad,summary_Weight,summary_Title,summary_JobHeadline,summary_Presentation,summary_HiringOrgName,summary_WorkPlaceAddress,summary_WorkPlacePostalCode,summary_WorkPlaceCity,summary_WorkPlaceOtherAddress,summary_WorkPlaceAbroad,summary_WorkPlaceNotStatic,summary_UseWorkPlaceAddressForJoblog,summary_PostingCreated,summary_LastDateApplication,summary_FormattedLastDateApplication,summary_AssignmentStartDate,summary_IsHotjob,summary_IsExternal,summary_Url,summary_Region,summary_Municipality,summary_Country,summary_PostalCode,summary_PostalCodeName,summary_JobAnnouncementType,summary_EmploymentType,summary_WorkHours,summary_OccupationArea,summary_OccupationGroup,summary_Occupation,summary_Location_Latitude,summary_Location_Longitude,summary_JoblogWorkTime_WorkHour,summary_JoblogWorkTime_DailyWorkTime,summary_WorkplaceID,summary_OrganisationId,summary_HiringOrgCVR,summary_UserLoggedIn,summary_AnonymousEmployer,summary_ShareUrl,summary_DetailsUrl,summary_JobLogUrl,summary_HasLocationValues,summary_ID,summary_Latitude,summary_Longitude,details_WorkSchedule,details_WorkConditions,details_EmploymentTypes,details_WorkPlace_Name,details_WorkPlace_Address_AddressLine,details_WorkPlace_Address_Country_Id,details_WorkPlace_Address_Country_Name,details_WorkPlace_Address_Municipality_Id,details_WorkPlace_Address_Municipality_Name,details_WorkPlace_Address_Region_Id,details_WorkPlace_Address_Region_Name,details_WorkPlace_Address_PostalCode,details_WorkPlace_Address_City,details_WorkPlace_PhoneNumber_Number,details_WorkPlace_PhoneNumber_Type,details_WorkPlace_PhoneNumber_Description,details_WorkPlace_FaxNumber,details_WorkPlace_Email,details_WorkPlace_WebAddress,details_WorkPlace_Description,details_WorkPlace_Logo,details_WorkPlace_WorkPlaceOrganizationNumber,details_WorkPlace_OrganizationNumber,details_WorkPlace_OrganizationDescription,details_JobPositionPosting_Id,details_JobPositionPosting_OriginalJppId,details_JobPositionPosting_HiringOrg_Name,details_JobPositionPosting_HiringOrg_Address_AddressLine,details_JobPositionPosting_HiringOrg_Address_Country_Id,details_JobPositionPosting_HiringOrg_Address_Country_Name,details_JobPositionPosting_HiringOrg_Address_Municipality_Id,details_JobPositionPosting_HiringOrg_Address_Municipality_Name,details_JobPositionPosting_HiringOrg_Address_Region_Id,details_JobPositionPosting_HiringOrg_Address_Region_Name,details_JobPositionPosting_HiringOrg_Address_PostalCode,details_JobPositionPosting_HiringOrg_Address_City,details_JobPositionPosting_HiringOrg_PhoneNumber_Number,details_JobPositionPosting_HiringOrg_PhoneNumber_Type,details_JobPositionPosting_HiringOrg_PhoneNumber_Description,details_JobPositionPosting_HiringOrg_FaxNumber,details_JobPositionPosting_HiringOrg_Email,details_JobPositionPosting_HiringOrg_WebAddress,details_JobPositionPosting_HiringOrg_Description,details_JobPositionPosting_HiringOrg_Logo,details_JobPositionPosting_HiringOrg_WorkPlaceOrganizationNumber,details_JobPositionPosting_HiringOrg_OrganizationNumber,details_JobPositionPosting_HiringOrg_OrganizationDescription,details_JobPositionPosting_RecruitingCompany,details_JobPositionPosting_PublicationStartDate,details_JobPositionPosting_PublicationEndDate,details_JobPositionPosting_JobPositionInformation_PositionTitle,details_JobPositionPosting_JobPositionInformation_Purpose,details_JobPositionPosting_JobPositionInformation_WorkLocation_AddressLine,details_JobPositionPosting_JobPositionInformation_WorkLocation_Country_Id,details_JobPositionPosting_JobPositionInformation_WorkLocation_Country_Name,details_JobPositionPosting_JobPositionInformation_WorkLocation_Municipality_Id,details_JobPositionPosting_JobPositionInformation_WorkLocation_Municipality_Name,details_JobPositionPosting_JobPositionInformation_WorkLocation_Region_Id,details_JobPositionPosting_JobPositionInformation_WorkLocation_Region_Name,details_JobPositionPosting_JobPositionInformation_WorkLocation_PostalCode,details_JobPositionPosting_JobPositionInformation_WorkLocation_City,details_JobPositionPosting_JobPositionInformation_EmploymentType,details_JobPositionPosting_JobPositionInformation_WeeklyWorkHours_TypeId,details_JobPositionPosting_JobPositionInformation_WeeklyWorkHours_TypeName,details_JobPositionPosting_JobPositionInformation_WeeklyWorkHours_Description,details_JobPositionPosting_JobPositionInformation_CompensationDescription,details_JobPositionPosting_JobPositionInformation_NumberToFill,details_JobPositionPosting_JobPositionInformation_DriverLicense,details_JobPositionPosting_JobPositionInformation_Occupation_DiscoWeb,details_JobPositionPosting_JobPositionInformation_Occupation_AlternateNames,details_JobPositionPosting_JobPositionInformation_Occupation_GroupId,details_JobPositionPosting_JobPositionInformation_Occupation_AreaId,details_JobPositionPosting_JobPositionInformation_Occupation_Id,details_JobPositionPosting_JobPositionInformation_Occupation_Name,details_JobPositionPosting_JobPositionInformation_IsGovernmentHiring,details_JobPositionPosting_JobPositionInformation_JppContacts,details_JobPositionPosting_JobPositionInformation_EmploymentDate,details_JobPositionPosting_IsRecruitmentOfForeignNationals,details_JobPositionPosting_IsWorkInDenmark,details_JobPositionPosting_IsAnonymousEmployer,details_JobPositionPosting_IsDisabilityFriendly,details_JobPositionPosting_JppType,details_JobPositionPosting_ApplicationDetails_WorkHourMax,details_JobPositionPosting_ApplicationDetails_WorkHourMin,details_JobPositionPosting_ApplicationDetails_DailyWorkTimeWeekend,details_JobPositionPosting_ApplicationDetails_DailyWorkTimeNight,details_JobPositionPosting_ApplicationDetails_DailyWorkTimeEvening,details_JobPositionPosting_ApplicationDetails_DailyWorkTimeDay,details_JobPositionPosting_ApplicationDetails_ReferenceText,details_JobPositionPosting_ApplicationDetails_RemarksToApplicant,details_JobPositionPosting_ApplicationDetails_ByEmail,details_JobPositionPosting_ApplicationDetails_ByPhone,details_JobPositionPosting_ApplicationDetails_ApplyViaUrl,details_JobPositionPosting_ApplicationDetails_ReplyInWriting,details_JobPositionPosting_ApplicationDetails_ApplicationDeadlineDate,details_JobPositionPosting_ContactAuthorityPhoneNumber_Number,details_JobPositionPosting_ContactAuthorityPhoneNumber_Type,details_JobPositionPosting_ContactAuthorityPhoneNumber_Description,details_JobPositionPosting_Status,details_LogoUrl,details_Address,details_ShowMap,details_ShowShareButtonJobLog,details_JobLogUrl,details_JobLogTemplateModel_Identifier,details_JobLogTemplateModel_UseWorkPlaceAddressForJoblog,details_JobLogTemplateModel_Category,details_JobLogTemplateModel_CvCustomerIdentifier,details_JobLogTemplateModel_JobSeekingStatus,details_JobLogTemplateModel_Title,details_JobLogTemplateModel_IsApplicationSourceRequired,details_JobLogTemplateModel_ApplicationSource,details_JobLogTemplateModel_IsWeeklyWorkTimeRequired,details_JobLogTemplateModel_WeeklyWorkTime,details_JobLogTemplateModel_HoursPerWeek,details_JobLogTemplateModel_JobnetJobPostingIdentifier,details_JobLogTemplateModel_JobAdDocument_Title,details_JobLogTemplateModel_JobAdDocument_Identifier,details_JobLogTemplateModel_JobAdDocument_IsDeletedBySystem,details_JobLogTemplateModel_JobAdDocument_IsDeletedByUser,details_JobLogTemplateModel_JobAdFile,details_JobLogTemplateModel_Company_JobLogEntryCategory,details_JobLogTemplateModel_Company_ShowAddressFieldsEvenIfEmpty,details_JobLogTemplateModel_Company_Name,details_JobLogTemplateModel_Company_Address,details_JobLogTemplateModel_Company_Country,details_JobLogTemplateModel_Company_EmploymentAreaID,details_JobLogTemplateModel_Company_PostCode,details_JobLogTemplateModel_Company_IsCountryAndTownAndPostCodeEmpty,details_JobLogTemplateModel_Company_IsTownAndPostCodeEmpty,details_JobLogTemplateModel_Company_IsCountryDanmark,details_JobLogTemplateModel_Company_Town,details_JobLogTemplateModel_Company_ContactPerson,details_JobLogTemplateModel_Company_Phone,details_JobLogTemplateModel_Company_Email,details_JobLogTemplateModel_Company_Latitude,details_JobLogTemplateModel_Company_Longitude,details_JobLogTemplateModel_Company_DailyTravelTimeInMinutes,details_JobLogTemplateModel_Company_DistanceToCompanyInMeters,details_JobLogTemplateModel_Company_IsCreateMode,details_JobLogTemplateModel_TypeOfSubmission,details_JobLogTemplateModel_SubmissionDate,details_JobLogTemplateModel_SubmissionDateFormatted,details_JobLogTemplateModel_SubmissionDateTiks,details_JobLogTemplateModel_IsSubmissionDateRequired,details_JobLogTemplateModel_Status,details_JobLogTemplateModel_DateCreatedFormatted,details_JobLogTemplateModel_DateCreated,details_JobLogTemplateModel_DateModifiedFormatted,details_JobLogTemplateModel_DateModified,details_JobLogTemplateModel_LastModifiedDateTiks,details_JobLogTemplateModel_DateClosed,details_JobLogTemplateModel_JobApplicationDocument_Title,details_JobLogTemplateModel_JobApplicationDocument_Identifier,details_JobLogTemplateModel_JobApplicationDocument_IsDeletedBySystem,details_JobLogTemplateModel_JobApplicationDocument_IsDeletedByUser,details_JobLogTemplateModel_CvDocument_Title,details_JobLogTemplateModel_CvDocument_Identifier,details_JobLogTemplateModel_CvDocument_IsDeletedBySystem,details_JobLogTemplateModel_CvDocument_IsDeletedByUser,details_JobLogTemplateModel_JobApplicationFile,details_JobLogTemplateModel_CvFile,details_JobLogTemplateModel_SubmissionDeadlineDate,details_JobLogTemplateModel_IsPersisted,details_JobLogTemplateModel_ServerValidationErrors,details_JobLogTemplateModel_HasServerValidationErrors,details_JoblogWorkTime_WorkHour,details_JoblogWorkTime_DailyWorkTime,details_Place,details_OpenPrintDialog,details_WorkPlaceInfoText,details_JobCenterContactDetails,details_WorkPlaceDescriptionText,details_FavoriteText,details_IsFavorite,details_ShowFavorite,details_MetaOgTextForSharing,details_DescriptionForSharing,details_TitleForSharing,details_RutePlan,details_FormattedPurpose,details_MapUrl,details_OrganizationNumber,details_ShowSearchJobButton,details_ShowPrint,details_BackToFindWorkButtonUrl,isExternal
0,False,1,Livredder til herreafdelingen til Odense Kommunes svømmehaller,Livredder til herreafdelingen til Odense Kommunes svømmehaller,"Forstår du værdiskabelse? Kan du holde fokus på kunden? Vil du være en del af et team, der kan eksekvere og bekæmpe kompleksitet i vores hverdag? Hvis ja er du måske vores nye livredder i Odense K",Odense Kommune,"Israels Plads 3, Bolbro",5200,Odense V,False,False,False,True,2022-04-20T00:00:00,2022-05-11T00:00:00,11. maj 2022,0001-01-01T00:00:00,False,False,https://job.jobnet.dk/CV/FindWork/Details/5579680,Syddanmark,Odense,Danmark,5200,,,,Fuldtid,"Vagt, sikkerhed og overvågning",Politi- og redningsarbejde,Livredder,55.3982,10.3482,,,65456,11911,35209115,False,False,https://job.jobnet.dk/CV/FindWork/DetailsSocialmedia/5579680,https://job.jobnet.dk/CV/FindWork/Details/5579680,https://job.jobnet.dk/CV/FindWork/Details/5579680,True,5579680,55.3982,10.3482,"{'Id': 1, 'Name': 'Fuldtid'}, {'Id': 16, 'Name': 'Deltid'}","{'Id': 1, 'Name': 'Almindelige vilkår'}, {'Id': 2, 'Name': 'Fleksjob'}, {'Id': 3, 'Name': 'Skånejob'}, {'Id': 4, 'Name': 'Egnet til efterlønnere og seniorer'}, {'Id': 5, 'Name': 'Job med løntilskud'}, {'Id': 6, 'Name': 'Rotationsjob'}, {'Id': 7, 'Name': 'Virksomhedspraktik'}","{'Id': 1, 'Name': 'Fastansættelse'}, {'Id': 16, 'Name': 'Tidsbegrænset ansættelse'}",Odense Kommune,"Israels Plads 3, Bolbro",58,Danmark,461,Odense,3,Syddanmark,5200,Odense V,,0,Primary,,,,"Odense Idrætspark er en kommunal institution og består af 2 idrætshaller, gymnastikhal,fodboldstadion, atletikstadion, 2 ishaller, cyklebane, cricketstadion, 5 svømmehaller og 1 friluftsbad.

Idrætsanlæggene anvendes til afholdelse af nationale og internationale idrætsarrangementer samt til daglig træning for bl.a. eliteidrætten i Odense.",65456,1003315332,35209115,None,5579680,5579680,Odense Kommune,"Israels Plads 3, Bolbro",58,Danmark,461,Odense,3,Syddanmark,5200,Odense V,,0,Primary,,,,"Odense Idrætspark er en kommunal institution og består af 2 idrætshaller, gymnastikhal,fodboldstadion, atletikstadion, 2 ishaller, cyklebane, cricketstadion, 5 svømmehaller og 1 friluftsbad.

Idrætsanlæggene anvendes til afholdelse af nationale og internationale idrætsarrangementer samt til daglig træning for bl.a. eliteidrætten i Odense.",65456,1003315332,35209115,None,,2022-04-20T00:00:00,2022-05-11T00:00:00,Livredder til herreafdelingen til Odense Kommunes svømmehaller,"Forstår du værdiskabelse? Kan du holde fokus på kunden? Vil du være en del af et team, der kan eksekvere og bekæmpe kompleksitet i vores hverdag? Hvis ja er du måske vores nye livredder i Odense Kommunes svømmehaller.  Vi søger en livredder til herreafdelingen i svømmehallerne i Odense. Om jobbet  Der er tale om stilling til herreafdelingen. Dine arbejdsopgaver er: opsyn ved vores bassiner at yde service overfor vores mange gæster rengøring af faciliteter i samarbejde med dine kollegaer at sørge for daglige vandprøver Vi har åbent 365 dage om året, og vores åbningstider på hverdage er kl. 5.30 til 22.00. Du skal derfor være indstillet på at indgå i en turnusplan for weekender & helligdage. Om dig  Hvem er du? En smilende og imødekommende person, som: er ansvarsbevidst, serviceminded og fleksibel vægter godt samarbejde og er en udpræget teamplayer Vi ser gerne, at du har erfaring som livredder. Hvis ikke skal vi nok få dig det lært, hvis du er den rigtige person. Vi forventer, at du allerede har eller kan bestå erhvervslivredderprøven at du indgår i vagtplan med skiftende vagter at du er kvalitetsbevidst, ”selvkørende” og nyder at få noget fra hånden at du er selvstændig og kan prioritere at du trives i en organisation, hvor tillid altid vinder over kontrol Vi tilbyder en grundig oplæring i jobbet at vi både tør stille krav til dig og vise dig tillid en uformel og tillidsvækkende omgangsform mulighed for at holde dig i form i arbejdstiden og vedligeholde din færdigheder som livredder. løbende uddannelse og opgradering i førstehjælp Løn- og ansættelsesvilkår Stillingen er på gennemsnitlig 37 timer om ugen, og er til besættelse 1. juli 2022 eller hurtigst muligt. Løn- og ansættelsesvilkår i henhold til gældende overenskomst mellem KL og den forhandlingsberettigede organisation. Vil du vide mere? Eventuelle spørgsmål kan stiles til funktionsleder Lars Christensen på  larch@odense.dk  eller på 29118622.  Det praktiske Ansøgningsfrist er den 11. maj 2022. Samtaler forventes afholdt den 24. maj 2022.   Om os I By- og Kulturforvaltningen arbejder vi med alt fra byudvikling, kulturelle begivenheder, drift af kommunens ejendomme, veje og parker til lokalplaner, affaldsplanlægning og erhvervsudvikling. Vi er derfor mange forskellige slags ansatte. Biologer, rengøringsassistenter, ingeniører og vejmænd arbejder sammen om at skabe de bedste rammer for byen og understøtte en bæredygtige fremtid for Odense.   Med vores brede opgaveportefølje spiller vi i By- og Kulturforvaltningen en helt central rolle i Odenses udvikling mod at blive en storby med omtanke og i at sikre de bedste rammer for velfærden. Vores fælles mål i forvaltningen er at skabe bæredygtige løsninger for Odense, der fremmer økonomisk vækst og menneskelig værdi. Med andre ord arbejder vi for at gøre en forskel for borgerne i Odense. Som medarbejder i By- og Kulturforvaltningen er du med til at gøre den forskel, som er så vigtig for velfærden – uanset om du drømmer om at gøre forskellen for den enkelte borger i hverdagen eller for os alle sammen for fremtiden.  Svømmehallerne i Odense er en del af Fritid og Folkeoplysning, som driver ni idrætsanlæg beliggende på Israels Plads i Odense V samt fem svømmehaller, et friluftsbad og et havnebad spredt i Odense Kommune. Fritid og Folkeoplysning står for udvikling, drift og gode oplevelser i byens idrætspark og svømmeanlæg. Fritid og Folkeoplysning skaber desuden rammer og muligheder for fritidslivet med henblik på, at flest mulige borgere motiveres og inspireres til at deltage i aktiviteter og fællesskaber.","Israels Plads 3, Bolbro",58,Danmark,461,Odense,3,Syddanmark,5200,Odense V,1,1,Fuldtid,None,None,1,,0,,0,0,0,,False,"{'Id': 7916972, 'Email': None, 'FaxNumber': None, 'PersonName': 'Lars Christensen', 'FirstName': 'Lars', 'LastName': 'Christensen', 'PositionTitle': None, 'PhoneNumbers': [{'Number': '29118622', 'Type': 2, 'Description': 'Mobil'}]}",2022-07-01T00:00:00,False,False,False,False,4,,,False,False,False,False,,,,,https://odense.emply.net/recruitment/vacancyApply.aspx?publishingId=521c94a3-aa65-41b2-9c45-44e8bcb1f864,False,2022-05-11T00:00:00,,0,Primary,7,/CV/FindWork/GetLogo?JobAdId=5579680&WorkPlace=65456&Organisation=35209115,"Israels Plads 3, Bolbro,5200, Odense V",True,False,/CV/Jobseeking/JobLog/CreateJobSearch?JobnetJobPostingIdentifier=5579680&Company.Name=Odense Kommune&SubmissionDeadlineDate=2022-5-11&Title=Livredder til herreafdelingen til Odense Kommunes svømmehaller&WeeklyWorkTime=1,00000000-0000-0000-0000-000000000000,False,0,,,Livredder til herreafdelingen til Odense Kommunes svømmehaller,True,,True,1,,5579680,,,False,False,,0,False,Odense Kommune,"Israels Plads 3, Bolbro",,,5200,False,False,False,Odense V,Lars Christensen,29118622,,,,,,False,,2022-05-11T00:00:00,,0,False,0,,,,,0,,,,False,False,,,False,False,,,,False,,False,,,Arbejdspladsen ligger i Odense kommune,False,Odense Kommune,,"Odense Idrætspark er en kommunal institution og består af 2 idrætshaller, gymnastikhal,fodboldstadion, atletikstadion, 2 ishaller, cyklebane, cricketstadion, 5 svømmehaller og 1 friluftsbad.

Idrætsanlæggene anvendes til afholdelse af nationale og internationale idrætsarrangementer samt til daglig træning for bl.a. eliteidrætten i Odense.",,False,False,"Forst&aring;r du v&aelig;rdiskabelse? Kan du holde fokus p&aring; kunden? Vil du v&aelig;re en del af et team, der kan eksekvere og bek&aelig;mpe kompleksitet i vores hverdag? Hvis ja er du m&aring;ske vores nye livredder i Odense Kommunes sv&oslash;mmehaller.Vi s&oslash;ger en livredder til herreafdelingen i sv&oslash;mmehallerne i Odense.Om jobbe","""Forst\u0026aring;r du v\u0026aelig;rdiskabelse? Kan du holde fokus p\u0026aring; kunden? Vil du v\u0026aelig;re en del af et team, der kan eksekvere og bek\u0026aelig;mpe kompleksitet i vores hverdag? Hvis ja er du m\u0026aring;ske vores nye livredder i Odense Kommunes sv\u0026oslash;mmehaller.Vi s\u0026oslash;ger en livredder til herreafdelingen i sv\u0026oslash;mmehallerne i Odense.Om jobbe""","""Livredder til herreafdelingen til Odense Kommunes svømmehaller""","https://www.google.dk/maps/dir//Israels+Plads+3,+Bolbro,5200,+Odense+V/","Forstår du værdiskabelse? Kan du holde fokus på kunden? Vil du være en del af et team, der kan eksekvere og bekæmpe kompleksitet i vores hverdag? Hvis ja er du måske vores nye livredder i Odense Kommunes svømmehaller.  Vi søger en livredder til herreafdelingen i svømmehallerne i Odense. Om jobbet  Der er tale om stilling til herreafdelingen. Dine arbejdsopgaver er: opsyn ved vores bassiner at yde service overfor vores mange gæster rengøring af faciliteter i samarbejde med dine kollegaer at sørge for daglige vandprøver Vi har åbent 365 dage om året, og vores åbningstider på hverdage er kl. 5.30 til 22.00. Du skal derfor være indstillet på at indgå i en turnusplan for weekender & helligdage. Om dig  Hvem er du? En smilende og imødekommende person, som: er ansvarsbevidst, serviceminded og fleksibel vægter godt samarbejde og er en udpræget teamplayer Vi ser gerne, at du har erfaring som livredder. Hvis ikke skal vi nok få dig det lært, hvis du er den rigtige person. Vi forventer, at du allerede har eller kan bestå erhvervslivredderprøven at du indgår i vagtplan med skiftende vagter at du er kvalitetsbevidst, ”selvkørende” og nyder at få noget fra hånden at du er selvstændig og kan prioritere at du trives i en organisation, hvor tillid altid vinder over kontrol Vi tilbyder en grundig oplæring i jobbet at vi både tør stille krav til dig og vise dig tillid en uformel og tillidsvækkende omgangsform mulighed for at holde dig i form i arbejdstiden og vedligeholde din færdigheder som livredder. løbende uddannelse og opgradering i førstehjælp Løn- og ansættelsesvilkår Stillingen er på gennemsnitlig 37 timer om ugen, og er til besættelse 1. juli 2022 eller hurtigst muligt. Løn- og ansættelsesvilkår i henhold til gældende overenskomst mellem KL og den forhandlingsberettigede organisation. Vil du vide mere? Eventuelle spørgsmål kan stiles til funktionsleder Lars Christensen på  larch@odense.dk  eller på 29118622.  Det praktiske Ansøgningsfrist er den 11. maj 2022. Samtaler forventes afholdt den 24. maj 2022.   Om os I By- og Kulturforvaltningen arbejder vi med alt fra byudvikling, kulturelle begivenheder, drift af kommunens ejendomme, veje og parker til lokalplaner, affaldsplanlægning og erhvervsudvikling. Vi er derfor mange forskellige slags ansatte. Biologer, rengøringsassistenter, ingeniører og vejmænd arbejder sammen om at skabe de bedste rammer for byen og understøtte en bæredygtige fremtid for Odense.   Med vores brede opgaveportefølje spiller vi i By- og Kulturforvaltningen en helt central rolle i Odenses udvikling mod at blive en storby med omtanke og i at sikre de bedste rammer for velfærden. Vores fælles mål i forvaltningen er at skabe bæredygtige løsninger for Odense, der fremmer økonomisk vækst og menneskelig værdi. Med andre ord arbejder vi for at gøre en forskel for borgerne i Odense. Som medarbejder i By- og Kulturforvaltningen er du med til at gøre den forskel, som er så vigtig for velfærden – uanset om du drømmer om at gøre forskellen for den enkelte borger i hverdagen eller for os alle sammen for fremtiden.  Svømmehallerne i Odense er en del af Fritid og Folkeoplysning, som driver ni idrætsanlæg beliggende på Israels Plads i Odense V samt fem svømmehaller, et friluftsbad og et havnebad spredt i Odense Kommune. Fritid og Folkeoplysning står for udvikling, drift og gode oplevelser i byens idrætspark og svømmeanlæg. Fritid og Folkeoplysning skaber desuden rammer og muligheder for fritidslivet med henblik på, at flest mulige borgere motiveres og inspireres til at deltage i aktiviteter og fællesskaber.","https://www.google.dk/maps/place/Israels+Plads+3,+Bolbro,5200,+Odense+V/",35209115,False,False,,False
