summary_AutomatchType,summary_Abroad,summary_Weight,summary_Title,summary_JobHeadline,summary_Presentation,summary_HiringOrgName,summary_WorkPlaceAddress,summary_WorkPlacePostalCode,summary_WorkPlaceCity,summary_WorkPlaceOtherAddress,summary_WorkPlaceAbroad,summary_WorkPlaceNotStatic,summary_UseWorkPlaceAddressForJoblog,summary_PostingCreated,summary_LastDateApplication,summary_FormattedLastDateApplication,summary_AssignmentStartDate,summary_IsHotjob,summary_IsExternal,summary_Url,summary_Region,summary_Municipality,summary_Country,summary_PostalCode,summary_PostalCodeName,summary_JobAnnouncementType,summary_EmploymentType,summary_WorkHours,summary_OccupationArea,summary_OccupationGroup,summary_Occupation,summary_Location_Latitude,summary_Location_Longitude,summary_JoblogWorkTime_WorkHour,summary_JoblogWorkTime_DailyWorkTime,summary_WorkplaceID,summary_OrganisationId,summary_HiringOrgCVR,summary_UserLoggedIn,summary_AnonymousEmployer,summary_ShareUrl,summary_DetailsUrl,summary_JobLogUrl,summary_HasLocationValues,summary_ID,summary_Latitude,summary_Longitude,details_WorkSchedule,details_WorkConditions,details_EmploymentTypes,details_WorkPlace_Name,details_WorkPlace_Address_AddressLine,details_WorkPlace_Address_Country_Id,details_WorkPlace_Address_Country_Name,details_WorkPlace_Address_Municipality_Id,details_WorkPlace_Address_Municipality_Name,details_WorkPlace_Address_Region_Id,details_WorkPlace_Address_Region_Name,details_WorkPlace_Address_PostalCode,details_WorkPlace_Address_City,details_WorkPlace_PhoneNumber_Number,details_WorkPlace_PhoneNumber_Type,details_WorkPlace_PhoneNumber_Description,details_WorkPlace_FaxNumber,details_WorkPlace_Email,details_WorkPlace_WebAddress,details_WorkPlace_Description,details_WorkPlace_Logo,details_WorkPlace_WorkPlaceOrganizationNumber,details_WorkPlace_OrganizationNumber,details_WorkPlace_OrganizationDescription,details_JobPositionPosting_Id,details_JobPositionPosting_OriginalJppId,details_JobPositionPosting_HiringOrg_Name,details_JobPositionPosting_HiringOrg_Address_AddressLine,details_JobPositionPosting_HiringOrg_Address_Country_Id,details_JobPositionPosting_HiringOrg_Address_Country_Name,details_JobPositionPosting_HiringOrg_Address_Municipality_Id,details_JobPositionPosting_HiringOrg_Address_Municipality_Name,details_JobPositionPosting_HiringOrg_Address_Region_Id,details_JobPositionPosting_HiringOrg_Address_Region_Name,details_JobPositionPosting_HiringOrg_Address_PostalCode,details_JobPositionPosting_HiringOrg_Address_City,details_JobPositionPosting_HiringOrg_PhoneNumber_Number,details_JobPositionPosting_HiringOrg_PhoneNumber_Type,details_JobPositionPosting_HiringOrg_PhoneNumber_Description,details_JobPositionPosting_HiringOrg_FaxNumber,details_JobPositionPosting_HiringOrg_Email,details_JobPositionPosting_HiringOrg_WebAddress,details_JobPositionPosting_HiringOrg_Description,details_JobPositionPosting_HiringOrg_Logo,details_JobPositionPosting_HiringOrg_WorkPlaceOrganizationNumber,details_JobPositionPosting_HiringOrg_OrganizationNumber,details_JobPositionPosting_HiringOrg_OrganizationDescription,details_JobPositionPosting_RecruitingCompany,details_JobPositionPosting_PublicationStartDate,details_JobPositionPosting_PublicationEndDate,details_JobPositionPosting_JobPositionInformation_PositionTitle,details_JobPositionPosting_JobPositionInformation_Purpose,details_JobPositionPosting_JobPositionInformation_WorkLocation_AddressLine,details_JobPositionPosting_JobPositionInformation_WorkLocation_Country_Id,details_JobPositionPosting_JobPositionInformation_WorkLocation_Country_Name,details_JobPositionPosting_JobPositionInformation_WorkLocation_Municipality_Id,details_JobPositionPosting_JobPositionInformation_WorkLocation_Municipality_Name,details_JobPositionPosting_JobPositionInformation_WorkLocation_Region_Id,details_JobPositionPosting_JobPositionInformation_WorkLocation_Region_Name,details_JobPositionPosting_JobPositionInformation_WorkLocation_PostalCode,details_JobPositionPosting_JobPositionInformation_WorkLocation_City,details_JobPositionPosting_JobPositionInformation_EmploymentType,details_JobPositionPosting_JobPositionInformation_WeeklyWorkHours_TypeId,details_JobPositionPosting_JobPositionInformation_WeeklyWorkHours_TypeName,details_JobPositionPosting_JobPositionInformation_WeeklyWorkHours_Description,details_JobPositionPosting_JobPositionInformation_CompensationDescription,details_JobPositionPosting_JobPositionInformation_NumberToFill,details_JobPositionPosting_JobPositionInformation_DriverLicense,details_JobPositionPosting_JobPositionInformation_Occupation_DiscoWeb,details_JobPositionPosting_JobPositionInformation_Occupation_AlternateNames,details_JobPositionPosting_JobPositionInformation_Occupation_GroupId,details_JobPositionPosting_JobPositionInformation_Occupation_AreaId,details_JobPositionPosting_JobPositionInformation_Occupation_Id,details_JobPositionPosting_JobPositionInformation_Occupation_Name,details_JobPositionPosting_JobPositionInformation_IsGovernmentHiring,details_JobPositionPosting_JobPositionInformation_JppContacts,details_JobPositionPosting_JobPositionInformation_EmploymentDate,details_JobPositionPosting_IsRecruitmentOfForeignNationals,details_JobPositionPosting_IsWorkInDenmark,details_JobPositionPosting_IsAnonymousEmployer,details_JobPositionPosting_IsDisabilityFriendly,details_JobPositionPosting_JppType,details_JobPositionPosting_ApplicationDetails_WorkHourMax,details_JobPositionPosting_ApplicationDetails_WorkHourMin,details_JobPositionPosting_ApplicationDetails_DailyWorkTimeWeekend,details_JobPositionPosting_ApplicationDetails_DailyWorkTimeNight,details_JobPositionPosting_ApplicationDetails_DailyWorkTimeEvening,details_JobPositionPosting_ApplicationDetails_DailyWorkTimeDay,details_JobPositionPosting_ApplicationDetails_ReferenceText,details_JobPositionPosting_ApplicationDetails_RemarksToApplicant,details_JobPositionPosting_ApplicationDetails_ByEmail,details_JobPositionPosting_ApplicationDetails_ByPhone,details_JobPositionPosting_ApplicationDetails_ApplyViaUrl,details_JobPositionPosting_ApplicationDetails_ReplyInWriting,details_JobPositionPosting_ApplicationDetails_ApplicationDeadlineDate,details_JobPositionPosting_ContactAuthorityPhoneNumber_Number,details_JobPositionPosting_ContactAuthorityPhoneNumber_Type,details_JobPositionPosting_ContactAuthorityPhoneNumber_Description,details_JobPositionPosting_Status,details_LogoUrl,details_Address,details_ShowMap,details_ShowShareButtonJobLog,details_JobLogUrl,details_JobLogTemplateModel_Identifier,details_JobLogTemplateModel_UseWorkPlaceAddressForJoblog,details_JobLogTemplateModel_Category,details_JobLogTemplateModel_CvCustomerIdentifier,details_JobLogTemplateModel_JobSeekingStatus,details_JobLogTemplateModel_Title,details_JobLogTemplateModel_IsApplicationSourceRequired,details_JobLogTemplateModel_ApplicationSource,details_JobLogTemplateModel_IsWeeklyWorkTimeRequired,details_JobLogTemplateModel_WeeklyWorkTime,details_JobLogTemplateModel_HoursPerWeek,details_JobLogTemplateModel_JobnetJobPostingIdentifier,details_JobLogTemplateModel_JobAdDocument_Title,details_JobLogTemplateModel_JobAdDocument_Identifier,details_JobLogTemplateModel_JobAdDocument_IsDeletedBySystem,details_JobLogTemplateModel_JobAdDocument_IsDeletedByUser,details_JobLogTemplateModel_JobAdFile,details_JobLogTemplateModel_Company_JobLogEntryCategory,details_JobLogTemplateModel_Company_ShowAddressFieldsEvenIfEmpty,details_JobLogTemplateModel_Company_Name,details_JobLogTemplateModel_Company_Address,details_JobLogTemplateModel_Company_Country,details_JobLogTemplateModel_Company_EmploymentAreaID,details_JobLogTemplateModel_Company_PostCode,details_JobLogTemplateModel_Company_IsCountryAndTownAndPostCodeEmpty,details_JobLogTemplateModel_Company_IsTownAndPostCodeEmpty,details_JobLogTemplateModel_Company_IsCountryDanmark,details_JobLogTemplateModel_Company_Town,details_JobLogTemplateModel_Company_ContactPerson,details_JobLogTemplateModel_Company_Phone,details_JobLogTemplateModel_Company_Email,details_JobLogTemplateModel_Company_Latitude,details_JobLogTemplateModel_Company_Longitude,details_JobLogTemplateModel_Company_DailyTravelTimeInMinutes,details_JobLogTemplateModel_Company_DistanceToCompanyInMeters,details_JobLogTemplateModel_Company_IsCreateMode,details_JobLogTemplateModel_TypeOfSubmission,details_JobLogTemplateModel_SubmissionDate,details_JobLogTemplateModel_SubmissionDateFormatted,details_JobLogTemplateModel_SubmissionDateTiks,details_JobLogTemplateModel_IsSubmissionDateRequired,details_JobLogTemplateModel_Status,details_JobLogTemplateModel_DateCreatedFormatted,details_JobLogTemplateModel_DateCreated,details_JobLogTemplateModel_DateModifiedFormatted,details_JobLogTemplateModel_DateModified,details_JobLogTemplateModel_LastModifiedDateTiks,details_JobLogTemplateModel_DateClosed,details_JobLogTemplateModel_JobApplicationDocument_Title,details_JobLogTemplateModel_JobApplicationDocument_Identifier,details_JobLogTemplateModel_JobApplicationDocument_IsDeletedBySystem,details_JobLogTemplateModel_JobApplicationDocument_IsDeletedByUser,details_JobLogTemplateModel_CvDocument_Title,details_JobLogTemplateModel_CvDocument_Identifier,details_JobLogTemplateModel_CvDocument_IsDeletedBySystem,details_JobLogTemplateModel_CvDocument_IsDeletedByUser,details_JobLogTemplateModel_JobApplicationFile,details_JobLogTemplateModel_CvFile,details_JobLogTemplateModel_SubmissionDeadlineDate,details_JobLogTemplateModel_IsPersisted,details_JobLogTemplateModel_ServerValidationErrors,details_JobLogTemplateModel_HasServerValidationErrors,details_JoblogWorkTime_WorkHour,details_JoblogWorkTime_DailyWorkTime,details_Place,details_OpenPrintDialog,details_WorkPlaceInfoText,details_JobCenterContactDetails,details_WorkPlaceDescriptionText,details_FavoriteText,details_IsFavorite,details_ShowFavorite,details_MetaOgTextForSharing,details_DescriptionForSharing,details_TitleForSharing,details_RutePlan,details_FormattedPurpose,details_MapUrl,details_OrganizationNumber,details_ShowSearchJobButton,details_ShowPrint,details_BackToFindWorkButtonUrl,isExternal
0,False,1,Struktureret og selvkørende regnskabsansvarlig søges til international virksomhed i København,Struktureret og selvkørende regnskabsansvarlig søges til international virksomhed i København,"Beskrivelse Brænder du for at sidde med ansvaret for en bæredygtig virksomheds økonomifunktion? Formår du at arbejde på både det operationelle og overordnede plan, mens du s",Proselection,Hammerensgade 1,1267,København K,False,False,False,True,2022-04-21T00:00:00,2022-05-26T00:00:00,26. maj 2022,0001-01-01T00:00:00,False,False,https://job.jobnet.dk/CV/FindWork/Details/5580329,Hovedstaden og Bornholm,København,Danmark,1267,,,,Fuldtid,"Kontor, administration, regnskab og finans",Bogholderi- og regnskabsarbejde,Bogholderi- og regnskabsassistent,55.6884,12.5901,,,79486,73990,32087132,False,False,https://job.jobnet.dk/CV/FindWork/DetailsSocialmedia/5580329,https://job.jobnet.dk/CV/FindWork/Details/5580329,https://job.jobnet.dk/CV/FindWork/Details/5580329,True,5580329,55.6884,12.5901,"{'Id': 1, 'Name': 'Fuldtid'}, {'Id': 16, 'Name': 'Deltid'}","{'Id': 1, 'Name': 'Almindelige vilkår'}, {'Id': 2, 'Name': 'Fleksjob'}, {'Id': 3, 'Name': 'Skånejob'}, {'Id': 4, 'Name': 'Egnet til efterlønnere og seniorer'}, {'Id': 5, 'Name': 'Job med løntilskud'}, {'Id': 6, 'Name': 'Rotationsjob'}, {'Id': 7, 'Name': 'Virksomhedspraktik'}","{'Id': 1, 'Name': 'Fastansættelse'}, {'Id': 16, 'Name': 'Tidsbegrænset ansættelse'}",Proselection,Hammerensgade 1,58,Danmark,101,København,4,"Hovedstaden, Sjælland og Bornholm",1267,København K,,0,Primary,,,,"ProSelection ApS er et rektrutteringsbureau,der formidler job inden for regnskab og økonomi.",79486,1015175733,32087132,None,5580329,5580329,Proselection,Hammerensgade 1,58,Danmark,101,København,4,"Hovedstaden, Sjælland og Bornholm",1267,København K,,0,Primary,,,,"ProSelection ApS er et rektrutteringsbureau,der formidler job inden for regnskab og økonomi.",79486,1015175733,32087132,None,,2022-04-21T00:00:00,2022-05-26T00:00:00,Struktureret og selvkørende regnskabsansvarlig søges til international virksomhed i København,"Beskrivelse   Brænder du for at sidde med ansvaret for en bæredygtig virksomheds økonomifunktion? Formår du at arbejde på både det operationelle og overordnede plan, mens du samtidig har styr på detaljerne? Så søg denne stilling.   Som regnskabsansvarlig får du ansvar for økonomifunktionen fra a-z, og du vil referere til deres Nordic director. Du får en spændende hverdag med opgaver, der spænder vidt - lige fra ansvaret for det daglige bogholderi til budgettering og rapportering. Du vil få hjælp til nogle af de meget rutineprægede bogholderiopgaver fra et eksternt bogholderifirma et par gange om ugen. Der er stor mulighed for at sætte dit eget præg på både processer og arbejdsgange. Din hverdag vil foregå i et behageligt og moderne miljø, hvor der er højt til loftet. Virksomheden prioriterer gode personaleforhold, hvilket blandt andet ses på virksomhedens høje medarbejderanciennitet.   Dine opgaver vil blandt andet omfatte:   Arbejdsopgaver     Måneds- og kvartalsafslutninger   Kreditor- og debitorstyring   Lønadministration for timelønnede og funktionærer   Klargøring af materiale til revision   Daglig afstemning af bank   Likviditetsbudgettering   Ansvarlig for den månedlige og kvartalsvise rapportering   Identificere og videregive information, der er vigtig for den månedlige finansielle rapportering   Analysere og optimere omsætning og balance   Identificere og implementere forbedringer af arbejdsmetoder og procedurer   Ad hoc-opgaver     Om virksomheden   Virksomheden er en bæredygtig familieejet hollandsk virksomhed, hvis historie går tilbage til 1888, og som i dag er professionelt drevet uden indflydelse fra familien. Virksomheden producerer high-end senge på egen fabrik i Holland og har aktiviteter i 25 lande. Der er fra virksomhedens side stort fokus på design, kvalitet og ikke mindst bæredygtighed. Virksomheden vil i 2030 være 100 % cirkulære i alle processer. De har også stort fokus på produktionen, hvorfor de kun producerer senge til hver enkelt kunde i stedet for at have en stor lagerbeholdning. Virksomheden beskæftiger i dag ca. 400 medarbejdere, hvoraf 12 arbejder ud fra det nordiske kontor i København. Der tilbydes gode personaleforhold i form af blandt andet pension, sundhedsforsikring sociale arrangementer. Virksomhedens medarbejdere trives i uformelt og familiært miljø, som er blevet opbygget via medarbejdernes høje anciennitet.   Personlige kompetencer   Du har et struktureret og analytisk blik for opgaverne og er i stand til selvstændigt og proaktivt at arbejde på både det operationelle og overordnede plan. Herudover er du samarbejdsorienteret og god til at kommunikere. Du formår også at være forbedringsorienteret og have blik for detaljerne samtidig med, at du sikrer at komme i mål med alle dine opgaver. Ligeledes er du løsningsorienteret og omstillingsparat i din måde at arbejde på.   IT-kompetencer   Du har gerne erfaring med Dynamics AX   Uddannelse & Erfaring   Erfaring fra lignende stillinger er vigtigere end uddannelse   Sprog   Dansk og lettere engelsk i skrift og tale   Kontaktpersoner   Nicoline Kjær & Søren B. Christiansen   Ansøgningsproces   Som udgangspunkt er vi mest interesseret i et CV, hvor hver enkel ansættelse er beskrevet med arbejdsopgaver og resultater. Ønsker du at sende både en ansøgning og et CV, skal du lægge dem i ét dokument.   ProSelection garanterer fuld diskretion og vil aldrig videregive dine oplysninger uden, at du har givet dit samtykke, og du har hørt nærmere om virksomheden.    Vi indkalder løbende udvalgte kandidater til interview hos ProSelection. 
 Denne jobannonce blev oprindeligt opslået på https://www.ofir.dk/
 (Den originale annonce kan ses på: https://www.ofir.dk/showojob?ofirid=b16b551b)",Hammerensgade 1,58,Danmark,101,København,4,"Hovedstaden, Sjælland og Bornholm",1267,København K,1,1,Fuldtid,None,None,1,,0,,0,0,0,,False,"{'Id': 7919667, 'Email': None, 'FaxNumber': None, 'PersonName': 'Proselection Proselection', 'FirstName': 'Proselection', 'LastName': 'Proselection', 'PositionTitle': None, 'PhoneNumbers': [{'Number': '70227079', 'Type': 0, 'Description': 'Hovednummer'}]}",,False,False,False,False,4,,,False,False,False,False,,,,,https://www.ofir.dk/resultat/Jobannonce.aspx?ofirId=b16b551b&action=sendApplicationUrl,False,2022-05-26T00:00:00,,0,Primary,7,/CV/FindWork/GetLogo?JobAdId=5580329&WorkPlace=79486&Organisation=32087132,"Hammerensgade 1,1267, København K",True,False,/CV/Jobseeking/JobLog/CreateJobSearch?JobnetJobPostingIdentifier=5580329&Company.Name=Proselection&SubmissionDeadlineDate=2022-5-26&Title=Struktureret og selvkørende regnskabsansvarlig søges til international virksomhed i København&WeeklyWorkTime=1,00000000-0000-0000-0000-000000000000,False,0,,,Struktureret og selvkørende regnskabsansvarlig søges til international virksomhed i København,True,,True,1,,5580329,,,False,False,,0,False,Proselection,Hammerensgade 1,,,1267,False,False,False,København K,Proselection Proselection,70227079,,,,,,False,,2022-05-26T00:00:00,,0,False,0,,,,,0,,,,False,False,,,False,False,,,,False,,False,,,Arbejdspladsen ligger i København kommune,False,Proselection,,"ProSelection ApS er et rektrutteringsbureau,der formidler job inden for regnskab og økonomi.",,False,False,"Beskrivelse Brænder du for at sidde med ansvaret for en bæredygtig virksomheds økonomifunktion? Formår du at arbejde på både det operationelle og overordnede plan, mens du samtidig har styr på detaljerne? Så søg denne stilling. Som regnskabsansvarlig får du ansvar for økonomifunktionen fra a-z, og du vil referere til deres Nordic director. Du får e","""Beskrivelse Brænder du for at sidde med ansvaret for en bæredygtig virksomheds økonomifunktion? Formår du at arbejde på både det operationelle og overordnede plan, mens du samtidig har styr på detaljerne? Så søg denne stilling. Som regnskabsansvarlig får du ansvar for økonomifunktionen fra a-z, og du vil referere til deres Nordic director. Du får e""","""Struktureret og selvkørende regnskabsansvarlig søges til international virksomhed i København""","https://www.google.dk/maps/dir//Hammerensgade+1,1267,+København+K/","Beskrivelse   Brænder du for at sidde med ansvaret for en bæredygtig virksomheds økonomifunktion? Formår du at arbejde på både det operationelle og overordnede plan, mens du samtidig har styr på detaljerne? Så søg denne stilling.   Som regnskabsansvarlig får du ansvar for økonomifunktionen fra a-z, og du vil referere til deres Nordic director. Du får en spændende hverdag med opgaver, der spænder vidt - lige fra ansvaret for det daglige bogholderi til budgettering og rapportering. Du vil få hjælp til nogle af de meget rutineprægede bogholderiopgaver fra et eksternt bogholderifirma et par gange om ugen. Der er stor mulighed for at sætte dit eget præg på både processer og arbejdsgange. Din hverdag vil foregå i et behageligt og moderne miljø, hvor der er højt til loftet. Virksomheden prioriterer gode personaleforhold, hvilket blandt andet ses på virksomhedens høje medarbejderanciennitet.   Dine opgaver vil blandt andet omfatte:   Arbejdsopgaver     Måneds- og kvartalsafslutninger   Kreditor- og debitorstyring   Lønadministration for timelønnede og funktionærer   Klargøring af materiale til revision   Daglig afstemning af bank   Likviditetsbudgettering   Ansvarlig for den månedlige og kvartalsvise rapportering   Identificere og videregive information, der er vigtig for den månedlige finansielle rapportering   Analysere og optimere omsætning og balance   Identificere og implementere forbedringer af arbejdsmetoder og procedurer   Ad hoc-opgaver     Om virksomheden   Virksomheden er en bæredygtig familieejet hollandsk virksomhed, hvis historie går tilbage til 1888, og som i dag er professionelt drevet uden indflydelse fra familien. Virksomheden producerer high-end senge på egen fabrik i Holland og har aktiviteter i 25 lande. Der er fra virksomhedens side stort fokus på design, kvalitet og ikke mindst bæredygtighed. Virksomheden vil i 2030 være 100 % cirkulære i alle processer. De har også stort fokus på produktionen, hvorfor de kun producerer senge til hver enkelt kunde i stedet for at have en stor lagerbeholdning. Virksomheden beskæftiger i dag ca. 400 medarbejdere, hvoraf 12 arbejder ud fra det nordiske kontor i København. Der tilbydes gode personaleforhold i form af blandt andet pension, sundhedsforsikring sociale arrangementer. Virksomhedens medarbejdere trives i uformelt og familiært miljø, som er blevet opbygget via medarbejdernes høje anciennitet.   Personlige kompetencer   Du har et struktureret og analytisk blik for opgaverne og er i stand til selvstændigt og proaktivt at arbejde på både det operationelle og overordnede plan. Herudover er du samarbejdsorienteret og god til at kommunikere. Du formår også at være forbedringsorienteret og have blik for detaljerne samtidig med, at du sikrer at komme i mål med alle dine opgaver. Ligeledes er du løsningsorienteret og omstillingsparat i din måde at arbejde på.   IT-kompetencer   Du har gerne erfaring med Dynamics AX   Uddannelse & Erfaring   Erfaring fra lignende stillinger er vigtigere end uddannelse   Sprog   Dansk og lettere engelsk i skrift og tale   Kontaktpersoner   Nicoline Kjær & Søren B. Christiansen   Ansøgningsproces   Som udgangspunkt er vi mest interesseret i et CV, hvor hver enkel ansættelse er beskrevet med arbejdsopgaver og resultater. Ønsker du at sende både en ansøgning og et CV, skal du lægge dem i ét dokument.   ProSelection garanterer fuld diskretion og vil aldrig videregive dine oplysninger uden, at du har givet dit samtykke, og du har hørt nærmere om virksomheden.    Vi indkalder løbende udvalgte kandidater til interview hos ProSelection. 
 Denne jobannonce blev oprindeligt opslået på  https://www.ofir.dk/ 
 (Den originale annonce kan ses på:  https://www.ofir.dk/showojob?ofirid=b16b551b )","https://www.google.dk/maps/place/Hammerensgade+1,1267,+København+K/",32087132,False,False,,False
