summary_AutomatchType,summary_Abroad,summary_Weight,summary_Title,summary_JobHeadline,summary_Presentation,summary_HiringOrgName,summary_WorkPlaceAddress,summary_WorkPlacePostalCode,summary_WorkPlaceCity,summary_WorkPlaceOtherAddress,summary_WorkPlaceAbroad,summary_WorkPlaceNotStatic,summary_UseWorkPlaceAddressForJoblog,summary_PostingCreated,summary_LastDateApplication,summary_FormattedLastDateApplication,summary_AssignmentStartDate,summary_IsHotjob,summary_IsExternal,summary_Url,summary_Region,summary_Municipality,summary_Country,summary_PostalCode,summary_PostalCodeName,summary_JobAnnouncementType,summary_EmploymentType,summary_WorkHours,summary_OccupationArea,summary_OccupationGroup,summary_Occupation,summary_Location_Latitude,summary_Location_Longitude,summary_JoblogWorkTime_WorkHour,summary_JoblogWorkTime_DailyWorkTime,summary_WorkplaceID,summary_OrganisationId,summary_HiringOrgCVR,summary_UserLoggedIn,summary_AnonymousEmployer,summary_ShareUrl,summary_DetailsUrl,summary_JobLogUrl,summary_HasLocationValues,summary_ID,summary_Latitude,summary_Longitude,details_WorkSchedule,details_WorkConditions,details_EmploymentTypes,details_WorkPlace_Name,details_WorkPlace_Address_AddressLine,details_WorkPlace_Address_Country_Id,details_WorkPlace_Address_Country_Name,details_WorkPlace_Address_Municipality_Id,details_WorkPlace_Address_Municipality_Name,details_WorkPlace_Address_Region_Id,details_WorkPlace_Address_Region_Name,details_WorkPlace_Address_PostalCode,details_WorkPlace_Address_City,details_WorkPlace_PhoneNumber_Number,details_WorkPlace_PhoneNumber_Type,details_WorkPlace_PhoneNumber_Description,details_WorkPlace_FaxNumber,details_WorkPlace_Email,details_WorkPlace_WebAddress,details_WorkPlace_Description,details_WorkPlace_Logo,details_WorkPlace_WorkPlaceOrganizationNumber,details_WorkPlace_OrganizationNumber,details_WorkPlace_OrganizationDescription,details_JobPositionPosting_Id,details_JobPositionPosting_OriginalJppId,details_JobPositionPosting_HiringOrg_Name,details_JobPositionPosting_HiringOrg_Address_AddressLine,details_JobPositionPosting_HiringOrg_Address_Country_Id,details_JobPositionPosting_HiringOrg_Address_Country_Name,details_JobPositionPosting_HiringOrg_Address_Municipality_Id,details_JobPositionPosting_HiringOrg_Address_Municipality_Name,details_JobPositionPosting_HiringOrg_Address_Region_Id,details_JobPositionPosting_HiringOrg_Address_Region_Name,details_JobPositionPosting_HiringOrg_Address_PostalCode,details_JobPositionPosting_HiringOrg_Address_City,details_JobPositionPosting_HiringOrg_PhoneNumber_Number,details_JobPositionPosting_HiringOrg_PhoneNumber_Type,details_JobPositionPosting_HiringOrg_PhoneNumber_Description,details_JobPositionPosting_HiringOrg_FaxNumber,details_JobPositionPosting_HiringOrg_Email,details_JobPositionPosting_HiringOrg_WebAddress,details_JobPositionPosting_HiringOrg_Description,details_JobPositionPosting_HiringOrg_Logo,details_JobPositionPosting_HiringOrg_WorkPlaceOrganizationNumber,details_JobPositionPosting_HiringOrg_OrganizationNumber,details_JobPositionPosting_HiringOrg_OrganizationDescription,details_JobPositionPosting_RecruitingCompany,details_JobPositionPosting_PublicationStartDate,details_JobPositionPosting_PublicationEndDate,details_JobPositionPosting_JobPositionInformation_PositionTitle,details_JobPositionPosting_JobPositionInformation_Purpose,details_JobPositionPosting_JobPositionInformation_WorkLocation_AddressLine,details_JobPositionPosting_JobPositionInformation_WorkLocation_Country_Id,details_JobPositionPosting_JobPositionInformation_WorkLocation_Country_Name,details_JobPositionPosting_JobPositionInformation_WorkLocation_Municipality_Id,details_JobPositionPosting_JobPositionInformation_WorkLocation_Municipality_Name,details_JobPositionPosting_JobPositionInformation_WorkLocation_Region_Id,details_JobPositionPosting_JobPositionInformation_WorkLocation_Region_Name,details_JobPositionPosting_JobPositionInformation_WorkLocation_PostalCode,details_JobPositionPosting_JobPositionInformation_WorkLocation_City,details_JobPositionPosting_JobPositionInformation_EmploymentType,details_JobPositionPosting_JobPositionInformation_WeeklyWorkHours_TypeId,details_JobPositionPosting_JobPositionInformation_WeeklyWorkHours_TypeName,details_JobPositionPosting_JobPositionInformation_WeeklyWorkHours_Description,details_JobPositionPosting_JobPositionInformation_CompensationDescription,details_JobPositionPosting_JobPositionInformation_NumberToFill,details_JobPositionPosting_JobPositionInformation_DriverLicense,details_JobPositionPosting_JobPositionInformation_Occupation_DiscoWeb,details_JobPositionPosting_JobPositionInformation_Occupation_AlternateNames,details_JobPositionPosting_JobPositionInformation_Occupation_GroupId,details_JobPositionPosting_JobPositionInformation_Occupation_AreaId,details_JobPositionPosting_JobPositionInformation_Occupation_Id,details_JobPositionPosting_JobPositionInformation_Occupation_Name,details_JobPositionPosting_JobPositionInformation_IsGovernmentHiring,details_JobPositionPosting_JobPositionInformation_JppContacts,details_JobPositionPosting_JobPositionInformation_EmploymentDate,details_JobPositionPosting_IsRecruitmentOfForeignNationals,details_JobPositionPosting_IsWorkInDenmark,details_JobPositionPosting_IsAnonymousEmployer,details_JobPositionPosting_IsDisabilityFriendly,details_JobPositionPosting_JppType,details_JobPositionPosting_ApplicationDetails_WorkHourMax,details_JobPositionPosting_ApplicationDetails_WorkHourMin,details_JobPositionPosting_ApplicationDetails_DailyWorkTimeWeekend,details_JobPositionPosting_ApplicationDetails_DailyWorkTimeNight,details_JobPositionPosting_ApplicationDetails_DailyWorkTimeEvening,details_JobPositionPosting_ApplicationDetails_DailyWorkTimeDay,details_JobPositionPosting_ApplicationDetails_ReferenceText,details_JobPositionPosting_ApplicationDetails_RemarksToApplicant,details_JobPositionPosting_ApplicationDetails_ByEmail,details_JobPositionPosting_ApplicationDetails_ByPhone,details_JobPositionPosting_ApplicationDetails_ApplyViaUrl,details_JobPositionPosting_ApplicationDetails_ReplyInWriting,details_JobPositionPosting_ApplicationDetails_ApplicationDeadlineDate,details_JobPositionPosting_ContactAuthorityPhoneNumber_Number,details_JobPositionPosting_ContactAuthorityPhoneNumber_Type,details_JobPositionPosting_ContactAuthorityPhoneNumber_Description,details_JobPositionPosting_Status,details_LogoUrl,details_Address,details_ShowMap,details_ShowShareButtonJobLog,details_JobLogUrl,details_JobLogTemplateModel_Identifier,details_JobLogTemplateModel_UseWorkPlaceAddressForJoblog,details_JobLogTemplateModel_Category,details_JobLogTemplateModel_CvCustomerIdentifier,details_JobLogTemplateModel_JobSeekingStatus,details_JobLogTemplateModel_Title,details_JobLogTemplateModel_IsApplicationSourceRequired,details_JobLogTemplateModel_ApplicationSource,details_JobLogTemplateModel_IsWeeklyWorkTimeRequired,details_JobLogTemplateModel_WeeklyWorkTime,details_JobLogTemplateModel_HoursPerWeek,details_JobLogTemplateModel_JobnetJobPostingIdentifier,details_JobLogTemplateModel_JobAdDocument_Title,details_JobLogTemplateModel_JobAdDocument_Identifier,details_JobLogTemplateModel_JobAdDocument_IsDeletedBySystem,details_JobLogTemplateModel_JobAdDocument_IsDeletedByUser,details_JobLogTemplateModel_JobAdFile,details_JobLogTemplateModel_Company_JobLogEntryCategory,details_JobLogTemplateModel_Company_ShowAddressFieldsEvenIfEmpty,details_JobLogTemplateModel_Company_Name,details_JobLogTemplateModel_Company_Address,details_JobLogTemplateModel_Company_Country,details_JobLogTemplateModel_Company_EmploymentAreaID,details_JobLogTemplateModel_Company_PostCode,details_JobLogTemplateModel_Company_IsCountryAndTownAndPostCodeEmpty,details_JobLogTemplateModel_Company_IsTownAndPostCodeEmpty,details_JobLogTemplateModel_Company_IsCountryDanmark,details_JobLogTemplateModel_Company_Town,details_JobLogTemplateModel_Company_ContactPerson,details_JobLogTemplateModel_Company_Phone,details_JobLogTemplateModel_Company_Email,details_JobLogTemplateModel_Company_Latitude,details_JobLogTemplateModel_Company_Longitude,details_JobLogTemplateModel_Company_DailyTravelTimeInMinutes,details_JobLogTemplateModel_Company_DistanceToCompanyInMeters,details_JobLogTemplateModel_Company_IsCreateMode,details_JobLogTemplateModel_TypeOfSubmission,details_JobLogTemplateModel_SubmissionDate,details_JobLogTemplateModel_SubmissionDateFormatted,details_JobLogTemplateModel_SubmissionDateTiks,details_JobLogTemplateModel_IsSubmissionDateRequired,details_JobLogTemplateModel_Status,details_JobLogTemplateModel_DateCreatedFormatted,details_JobLogTemplateModel_DateCreated,details_JobLogTemplateModel_DateModifiedFormatted,details_JobLogTemplateModel_DateModified,details_JobLogTemplateModel_LastModifiedDateTiks,details_JobLogTemplateModel_DateClosed,details_JobLogTemplateModel_JobApplicationDocument_Title,details_JobLogTemplateModel_JobApplicationDocument_Identifier,details_JobLogTemplateModel_JobApplicationDocument_IsDeletedBySystem,details_JobLogTemplateModel_JobApplicationDocument_IsDeletedByUser,details_JobLogTemplateModel_CvDocument_Title,details_JobLogTemplateModel_CvDocument_Identifier,details_JobLogTemplateModel_CvDocument_IsDeletedBySystem,details_JobLogTemplateModel_CvDocument_IsDeletedByUser,details_JobLogTemplateModel_JobApplicationFile,details_JobLogTemplateModel_CvFile,details_JobLogTemplateModel_SubmissionDeadlineDate,details_JobLogTemplateModel_IsPersisted,details_JobLogTemplateModel_ServerValidationErrors,details_JobLogTemplateModel_HasServerValidationErrors,details_JoblogWorkTime_WorkHour,details_JoblogWorkTime_DailyWorkTime,details_Place,details_OpenPrintDialog,details_WorkPlaceInfoText,details_JobCenterContactDetails,details_WorkPlaceDescriptionText,details_FavoriteText,details_IsFavorite,details_ShowFavorite,details_MetaOgTextForSharing,details_DescriptionForSharing,details_TitleForSharing,details_RutePlan,details_FormattedPurpose,details_MapUrl,details_OrganizationNumber,details_ShowSearchJobButton,details_ShowPrint,details_BackToFindWorkButtonUrl,isExternal
0,False,1,Sagsbehandler til vejmyndighed og arrangementstilladelser til afdelingen Trafik & Anlæg,Sagsbehandler til vejmyndighed og arrangementstilladelser til afdelingen Trafik & Anlæg,"  Vi søger en sagsbehandler til vejmyndighedsopgaver og til at administrere kommunens vejarealer og pladser i forhold til private arrangører, som ønsker at benytte arealerne til boder, ",Trafik & Anlæg,Skelbækvej 2,6200,Aabenraa,False,False,False,True,2022-05-04T00:00:00,2022-05-11T00:00:00,11. maj 2022,0001-01-01T00:00:00,False,False,https://job.jobnet.dk/CV/FindWork/Details/5580163,Syddanmark,Aabenraa,Danmark,6200,,,,Fuldtid,Undervisning og vejledning,Vejledning,"Sagsbehandler, kommunal",55.0235,9.4223,,,65412,54663,29189854,False,False,https://job.jobnet.dk/CV/FindWork/DetailsSocialmedia/5580163,https://job.jobnet.dk/CV/FindWork/Details/5580163,https://job.jobnet.dk/CV/FindWork/Details/5580163,True,5580163,55.0235,9.4223,"{'Id': 1, 'Name': 'Fuldtid'}, {'Id': 16, 'Name': 'Deltid'}","{'Id': 1, 'Name': 'Almindelige vilkår'}, {'Id': 2, 'Name': 'Fleksjob'}, {'Id': 3, 'Name': 'Skånejob'}, {'Id': 4, 'Name': 'Egnet til efterlønnere og seniorer'}, {'Id': 5, 'Name': 'Job med løntilskud'}, {'Id': 6, 'Name': 'Rotationsjob'}, {'Id': 7, 'Name': 'Virksomhedspraktik'}","{'Id': 1, 'Name': 'Fastansættelse'}, {'Id': 16, 'Name': 'Tidsbegrænset ansættelse'}",Trafik & Anlæg,Skelbækvej 2,58,Danmark,580,Aabenraa,3,Syddanmark,6200,Aabenraa,,0,Primary,,,,Udbetaling af sociale ydelser.,65412,1013430493,29189854,None,5580163,5580163,Trafik & Anlæg,Skelbækvej 2,58,Danmark,580,Aabenraa,3,Syddanmark,6200,Aabenraa,,0,Primary,,,,Udbetaling af sociale ydelser.,65412,1013430493,29189854,None,,2022-05-04T00:00:00,2022-05-11T00:00:00,Sagsbehandler til vejmyndighed og arrangementstilladelser til afdelingen Trafik & Anlæg,"Vi søger en sagsbehandler til vejmyndighedsopgaver og til at administrere kommunens vejarealer og pladser i forhold til private arrangører, som ønsker at benytte arealerne til boder, motionsløb og andre eve nts.   Aabenraa Kommune summer af aktivitet  Der er stor efterspørgsel på brug af kommunens vejarealer og pladser til udeservering, salgsboder, byfester m.m. Kommunens mange foreninger, virksomheder og borgere gennemfører arrangementer som kræver forskellige tilladelser, og som kan have afledte trafikale virkninger.   Mange ansøgere skal guides til at få overblik over de nødvendige tilladelser til deres arrangementer, og hvordan disse indhentes.    Vi har stor travlhed på vejmyndighedsområdet – også som følge af Tour de France, som kører gennem kommunen d. 3. juli. Det giver stor aktivitet på veje og pladser langs cykelruten.   Din rolle som medarbejder i vejmyndigheden  Du kan på en systematisk, saglig og serviceorienteret måde træffe de nødvendige afgørelser om anvendelse af kommunens vejarealer og pladser. Du kan stå fast, når et arrangement ikke kan opnå tilladelse, men er grundlæggende medspiller på at få ansøgers arrangement i mål og dermed skabe aktivitet i Aabenraa Kommune.    I rollen som medarbejder i vejmyndigheden har du en god evne til at begrunde afgørelserne og til skriftlig og mundtlig formidling af lovgivning og kommunens retningslinjer for arealanvendelse.    Arrangementer ansøges og behandles i forvaltningssystemet NFOA (Net Forvaltning Offentlige Arrangementer), hvorfra også andre myndigheder høres om det ansøgte arrangement. Du kommer derfor til at anvende NFOA på daglig basis.   Trafik & Anlæg løser en mængde forskellige opgaver som vejmyndighed, og dem kommer du også til at bidrage til løsningen af. Det gælder også formulering af forskellige politikker og administrative retningslinjer for vejmyndighedens opgaver.   Internt i forvaltningen samarbejder du ubesværet på tværs af afdelinger, herunder ikke mindst med kommunens entreprenørfunktion samt kolleger fra kultur, fritids- og planområderne.   Politiet er en vigtig, ekstern samarbejdspart for dig, når det drejer sig om regulering af trafik i forbindelse med arrangementer m.m., og generelt i forbindelse med mange vejmyndighedsopgaver.   Vi forventer, at du     har en uddannelse som teknisk designer eller lignende   har nogle års erfaring med løsning af vejmyndighedsopgaver og arrangementsansøgninger   har gennemført kurset ""Vejen som arbejdsplads – trin I"" (og gerne Trin II)   kender til Færdselsloven og regler for skiltning på vejarealer   er systematisk, og kan overskue mange igangværende opgaver på samme tid   kan argumentere præcist for dine afgørelser, både skriftligt og mundtligt   er serviceminded, men kan også stå fast når ansøgninger ikke kan imødekommes   er god til at finde løsninger sammen med borgere, virksomheder og kolleger   har let ved at anvende forskellige it-systemer, og lærer hurtigt de nye systemer at kende     Løn- og ansættelsesvilkår  Stillingen er en fuldtidsstilling. Vi ønsker, at vores nye kollega tiltræder senest 1. juli 2022. Arbejdsstedet er Aabenraa Rådhus, Skelbækvej 2, 6200 Aabenraa.   Løn- og ansættelsesvilkår sker efter gældende overenskomst.     Yderligere oplysninger  Spørgsmål til stillingen rettes til afdelingschef Jesper Juhl Kristensen på tlf. 2154 1904 eller Teamleder Keld Rysgaard på tlf. 7376 7322.   Ansøgning  Send din ansøgning, CV og relevante bilag som Word eller PDF via linket senest den 11. maj 2022.   Vi forventer at holde samtaler i uge 20-21, 2022. I forbindelse med samtalen skal du lave en skriveprøve.   Hvis du overvejer, hvordan det ville være at flytte til Aabenraa Kommune, kontakt vores bosætningsteam på tilflytter@aabenraa.dk og tlf. +45 2946 5641.   
 Denne jobannonce blev oprindeligt opslået på https://www.ofir.dk/
 (Den originale annonce kan ses på: https://www.ofir.dk/showojob?ofirid=fa08b767)",Skelbækvej 2,58,Danmark,580,Aabenraa,3,Syddanmark,6200,Aabenraa,1,1,Fuldtid,None,None,1,,0,,0,0,0,,False,"{'Id': 7961607, 'Email': None, 'FaxNumber': None, 'PersonName': 'Jesper Juhl Kristensen', 'FirstName': 'Jesper', 'LastName': 'Juhl Kristensen', 'PositionTitle': None, 'PhoneNumbers': [{'Number': '21541904', 'Type': 0, 'Description': 'Hovednummer'}]}",,False,False,False,False,4,,,False,False,False,False,,,,,https://www.ofir.dk/resultat/Jobannonce.aspx?ofirId=fa08b767&action=sendApplicationUrl,False,2022-05-11T00:00:00,,0,Primary,7,/CV/FindWork/GetLogo?JobAdId=5580163&WorkPlace=65412&Organisation=29189854,"Skelbækvej 2,6200, Aabenraa",True,False,/CV/Jobseeking/JobLog/CreateJobSearch?JobnetJobPostingIdentifier=5580163&Company.Name=Trafik & Anlæg&SubmissionDeadlineDate=2022-5-11&Title=Sagsbehandler til vejmyndighed og arrangementstilladelser til afdelingen Trafik & Anlæg&WeeklyWorkTime=1,00000000-0000-0000-0000-000000000000,False,0,,,Sagsbehandler til vejmyndighed og arrangementstilladelser til afdelingen Trafik & Anlæg,True,,True,1,,5580163,,,False,False,,0,False,Trafik & Anlæg,Skelbækvej 2,,,6200,False,False,False,Aabenraa,Jesper Juhl Kristensen,21541904,,,,,,False,,2022-05-11T00:00:00,,0,False,0,,,,,0,,,,False,False,,,False,False,,,,False,,False,,,Arbejdspladsen ligger i Aabenraa kommune,False,Trafik & Anlæg,,Udbetaling af sociale ydelser.,,False,False," Vi søger en sagsbehandler til vejmyndighedsopgaver og til at administrere kommunens vejarealer og pladser i forhold til private arrangører, som ønsker at benytte arealerne til boder, motionsløb og andre events. Aabenraa Kommune summer af aktivitet Der er stor efterspørgsel på brug af kommunens vejarealer og pladser til udeservering, salgsboder, by",""" Vi søger en sagsbehandler til vejmyndighedsopgaver og til at administrere kommunens vejarealer og pladser i forhold til private arrangører, som ønsker at benytte arealerne til boder, motionsløb og andre events. Aabenraa Kommune summer af aktivitet Der er stor efterspørgsel på brug af kommunens vejarealer og pladser til udeservering, salgsboder, by""","""Sagsbehandler til vejmyndighed og arrangementstilladelser til afdelingen Trafik \u0026 Anlæg""","https://www.google.dk/maps/dir//Skelbækvej+2,6200,+Aabenraa/","Vi søger en sagsbehandler til vejmyndighedsopgaver og til at administrere kommunens vejarealer og pladser i forhold til private arrangører, som ønsker at benytte arealerne til boder, motionsløb og andre eve nts.   Aabenraa Kommune summer af aktivitet  Der er stor efterspørgsel på brug af kommunens vejarealer og pladser til udeservering, salgsboder, byfester m.m. Kommunens mange foreninger, virksomheder og borgere gennemfører arrangementer som kræver forskellige tilladelser, og som kan have afledte trafikale virkninger.   Mange ansøgere skal guides til at få overblik over de nødvendige tilladelser til deres arrangementer, og hvordan disse indhentes.    Vi har stor travlhed på vejmyndighedsområdet – også som følge af Tour de France, som kører gennem kommunen d. 3. juli. Det giver stor aktivitet på veje og pladser langs cykelruten.   Din rolle som medarbejder i vejmyndigheden  Du kan på en systematisk, saglig og serviceorienteret måde træffe de nødvendige afgørelser om anvendelse af kommunens vejarealer og pladser. Du kan stå fast, når et arrangement ikke kan opnå tilladelse, men er grundlæggende medspiller på at få ansøgers arrangement i mål og dermed skabe aktivitet i Aabenraa Kommune.    I rollen som medarbejder i vejmyndigheden har du en god evne til at begrunde afgørelserne og til skriftlig og mundtlig formidling af lovgivning og kommunens retningslinjer for arealanvendelse.    Arrangementer ansøges og behandles i forvaltningssystemet NFOA (Net Forvaltning Offentlige Arrangementer), hvorfra også andre myndigheder høres om det ansøgte arrangement. Du kommer derfor til at anvende NFOA på daglig basis.   Trafik & Anlæg løser en mængde forskellige opgaver som vejmyndighed, og dem kommer du også til at bidrage til løsningen af. Det gælder også formulering af forskellige politikker og administrative retningslinjer for vejmyndighedens opgaver.   Internt i forvaltningen samarbejder du ubesværet på tværs af afdelinger, herunder ikke mindst med kommunens entreprenørfunktion samt kolleger fra kultur, fritids- og planområderne.   Politiet er en vigtig, ekstern samarbejdspart for dig, når det drejer sig om regulering af trafik i forbindelse med arrangementer m.m., og generelt i forbindelse med mange vejmyndighedsopgaver.   Vi forventer, at du     har en uddannelse som teknisk designer eller lignende   har nogle års erfaring med løsning af vejmyndighedsopgaver og arrangementsansøgninger   har gennemført kurset ""Vejen som arbejdsplads – trin I"" (og gerne Trin II)   kender til Færdselsloven og regler for skiltning på vejarealer   er systematisk, og kan overskue mange igangværende opgaver på samme tid   kan argumentere præcist for dine afgørelser, både skriftligt og mundtligt   er serviceminded, men kan også stå fast når ansøgninger ikke kan imødekommes   er god til at finde løsninger sammen med borgere, virksomheder og kolleger   har let ved at anvende forskellige it-systemer, og lærer hurtigt de nye systemer at kende     Løn- og ansættelsesvilkår  Stillingen er en fuldtidsstilling. Vi ønsker, at vores nye kollega tiltræder senest 1. juli 2022. Arbejdsstedet er Aabenraa Rådhus, Skelbækvej 2, 6200 Aabenraa.   Løn- og ansættelsesvilkår sker efter gældende overenskomst.     Yderligere oplysninger  Spørgsmål til stillingen rettes til afdelingschef Jesper Juhl Kristensen på tlf. 2154 1904 eller Teamleder Keld Rysgaard på tlf. 7376 7322.   Ansøgning  Send din ansøgning, CV og relevante bilag som Word eller PDF via linket senest den 11. maj 2022.   Vi forventer at holde samtaler i uge 20-21, 2022. I forbindelse med samtalen skal du lave en skriveprøve.   Hvis du overvejer, hvordan det ville være at flytte til Aabenraa Kommune, kontakt vores bosætningsteam på tilflytter@aabenraa.dk og tlf. +45 2946 5641.   
 Denne jobannonce blev oprindeligt opslået på  https://www.ofir.dk/ 
 (Den originale annonce kan ses på:  https://www.ofir.dk/showojob?ofirid=fa08b767 )","https://www.google.dk/maps/place/Skelbækvej+2,6200,+Aabenraa/",29189854,False,False,,False
