summary_AutomatchType,summary_Abroad,summary_Weight,summary_Title,summary_JobHeadline,summary_Presentation,summary_HiringOrgName,summary_WorkPlaceAddress,summary_WorkPlacePostalCode,summary_WorkPlaceCity,summary_WorkPlaceOtherAddress,summary_WorkPlaceAbroad,summary_WorkPlaceNotStatic,summary_UseWorkPlaceAddressForJoblog,summary_PostingCreated,summary_LastDateApplication,summary_FormattedLastDateApplication,summary_AssignmentStartDate,summary_IsHotjob,summary_IsExternal,summary_Url,summary_Region,summary_Municipality,summary_Country,summary_PostalCode,summary_PostalCodeName,summary_JobAnnouncementType,summary_EmploymentType,summary_WorkHours,summary_OccupationArea,summary_OccupationGroup,summary_Occupation,summary_Location_Latitude,summary_Location_Longitude,summary_JoblogWorkTime_WorkHour,summary_JoblogWorkTime_DailyWorkTime,summary_WorkplaceID,summary_OrganisationId,summary_HiringOrgCVR,summary_UserLoggedIn,summary_AnonymousEmployer,summary_ShareUrl,summary_DetailsUrl,summary_JobLogUrl,summary_HasLocationValues,summary_ID,summary_Latitude,summary_Longitude,details_WorkSchedule,details_WorkConditions,details_EmploymentTypes,details_WorkPlace_Name,details_WorkPlace_Address_AddressLine,details_WorkPlace_Address_Country_Id,details_WorkPlace_Address_Country_Name,details_WorkPlace_Address_Municipality_Id,details_WorkPlace_Address_Municipality_Name,details_WorkPlace_Address_Region_Id,details_WorkPlace_Address_Region_Name,details_WorkPlace_Address_PostalCode,details_WorkPlace_Address_City,details_WorkPlace_PhoneNumber_Number,details_WorkPlace_PhoneNumber_Type,details_WorkPlace_PhoneNumber_Description,details_WorkPlace_FaxNumber,details_WorkPlace_Email,details_WorkPlace_WebAddress,details_WorkPlace_Description,details_WorkPlace_Logo,details_WorkPlace_WorkPlaceOrganizationNumber,details_WorkPlace_OrganizationNumber,details_WorkPlace_OrganizationDescription,details_JobPositionPosting_Id,details_JobPositionPosting_OriginalJppId,details_JobPositionPosting_HiringOrg_Name,details_JobPositionPosting_HiringOrg_Address_AddressLine,details_JobPositionPosting_HiringOrg_Address_Country_Id,details_JobPositionPosting_HiringOrg_Address_Country_Name,details_JobPositionPosting_HiringOrg_Address_Municipality_Id,details_JobPositionPosting_HiringOrg_Address_Municipality_Name,details_JobPositionPosting_HiringOrg_Address_Region_Id,details_JobPositionPosting_HiringOrg_Address_Region_Name,details_JobPositionPosting_HiringOrg_Address_PostalCode,details_JobPositionPosting_HiringOrg_Address_City,details_JobPositionPosting_HiringOrg_PhoneNumber_Number,details_JobPositionPosting_HiringOrg_PhoneNumber_Type,details_JobPositionPosting_HiringOrg_PhoneNumber_Description,details_JobPositionPosting_HiringOrg_FaxNumber,details_JobPositionPosting_HiringOrg_Email,details_JobPositionPosting_HiringOrg_WebAddress,details_JobPositionPosting_HiringOrg_Description,details_JobPositionPosting_HiringOrg_Logo,details_JobPositionPosting_HiringOrg_WorkPlaceOrganizationNumber,details_JobPositionPosting_HiringOrg_OrganizationNumber,details_JobPositionPosting_HiringOrg_OrganizationDescription,details_JobPositionPosting_RecruitingCompany,details_JobPositionPosting_PublicationStartDate,details_JobPositionPosting_PublicationEndDate,details_JobPositionPosting_JobPositionInformation_PositionTitle,details_JobPositionPosting_JobPositionInformation_Purpose,details_JobPositionPosting_JobPositionInformation_WorkLocation_AddressLine,details_JobPositionPosting_JobPositionInformation_WorkLocation_Country_Id,details_JobPositionPosting_JobPositionInformation_WorkLocation_Country_Name,details_JobPositionPosting_JobPositionInformation_WorkLocation_Municipality_Id,details_JobPositionPosting_JobPositionInformation_WorkLocation_Municipality_Name,details_JobPositionPosting_JobPositionInformation_WorkLocation_Region_Id,details_JobPositionPosting_JobPositionInformation_WorkLocation_Region_Name,details_JobPositionPosting_JobPositionInformation_WorkLocation_PostalCode,details_JobPositionPosting_JobPositionInformation_WorkLocation_City,details_JobPositionPosting_JobPositionInformation_EmploymentType,details_JobPositionPosting_JobPositionInformation_WeeklyWorkHours_TypeId,details_JobPositionPosting_JobPositionInformation_WeeklyWorkHours_TypeName,details_JobPositionPosting_JobPositionInformation_WeeklyWorkHours_Description,details_JobPositionPosting_JobPositionInformation_CompensationDescription,details_JobPositionPosting_JobPositionInformation_NumberToFill,details_JobPositionPosting_JobPositionInformation_DriverLicense,details_JobPositionPosting_JobPositionInformation_Occupation_DiscoWeb,details_JobPositionPosting_JobPositionInformation_Occupation_AlternateNames,details_JobPositionPosting_JobPositionInformation_Occupation_GroupId,details_JobPositionPosting_JobPositionInformation_Occupation_AreaId,details_JobPositionPosting_JobPositionInformation_Occupation_Id,details_JobPositionPosting_JobPositionInformation_Occupation_Name,details_JobPositionPosting_JobPositionInformation_IsGovernmentHiring,details_JobPositionPosting_JobPositionInformation_JppContacts,details_JobPositionPosting_JobPositionInformation_EmploymentDate,details_JobPositionPosting_IsRecruitmentOfForeignNationals,details_JobPositionPosting_IsWorkInDenmark,details_JobPositionPosting_IsAnonymousEmployer,details_JobPositionPosting_IsDisabilityFriendly,details_JobPositionPosting_JppType,details_JobPositionPosting_ApplicationDetails_WorkHourMax,details_JobPositionPosting_ApplicationDetails_WorkHourMin,details_JobPositionPosting_ApplicationDetails_DailyWorkTimeWeekend,details_JobPositionPosting_ApplicationDetails_DailyWorkTimeNight,details_JobPositionPosting_ApplicationDetails_DailyWorkTimeEvening,details_JobPositionPosting_ApplicationDetails_DailyWorkTimeDay,details_JobPositionPosting_ApplicationDetails_ReferenceText,details_JobPositionPosting_ApplicationDetails_RemarksToApplicant,details_JobPositionPosting_ApplicationDetails_ByEmail,details_JobPositionPosting_ApplicationDetails_ByPhone,details_JobPositionPosting_ApplicationDetails_ApplyViaUrl,details_JobPositionPosting_ApplicationDetails_ReplyInWriting,details_JobPositionPosting_ApplicationDetails_ApplicationDeadlineDate,details_JobPositionPosting_ContactAuthorityPhoneNumber_Number,details_JobPositionPosting_ContactAuthorityPhoneNumber_Type,details_JobPositionPosting_ContactAuthorityPhoneNumber_Description,details_JobPositionPosting_Status,details_LogoUrl,details_Address,details_ShowMap,details_ShowShareButtonJobLog,details_JobLogUrl,details_JobLogTemplateModel_Identifier,details_JobLogTemplateModel_UseWorkPlaceAddressForJoblog,details_JobLogTemplateModel_Category,details_JobLogTemplateModel_CvCustomerIdentifier,details_JobLogTemplateModel_JobSeekingStatus,details_JobLogTemplateModel_Title,details_JobLogTemplateModel_IsApplicationSourceRequired,details_JobLogTemplateModel_ApplicationSource,details_JobLogTemplateModel_IsWeeklyWorkTimeRequired,details_JobLogTemplateModel_WeeklyWorkTime,details_JobLogTemplateModel_HoursPerWeek,details_JobLogTemplateModel_JobnetJobPostingIdentifier,details_JobLogTemplateModel_JobAdDocument_Title,details_JobLogTemplateModel_JobAdDocument_Identifier,details_JobLogTemplateModel_JobAdDocument_IsDeletedBySystem,details_JobLogTemplateModel_JobAdDocument_IsDeletedByUser,details_JobLogTemplateModel_JobAdFile,details_JobLogTemplateModel_Company_JobLogEntryCategory,details_JobLogTemplateModel_Company_ShowAddressFieldsEvenIfEmpty,details_JobLogTemplateModel_Company_Name,details_JobLogTemplateModel_Company_Address,details_JobLogTemplateModel_Company_Country,details_JobLogTemplateModel_Company_EmploymentAreaID,details_JobLogTemplateModel_Company_PostCode,details_JobLogTemplateModel_Company_IsCountryAndTownAndPostCodeEmpty,details_JobLogTemplateModel_Company_IsTownAndPostCodeEmpty,details_JobLogTemplateModel_Company_IsCountryDanmark,details_JobLogTemplateModel_Company_Town,details_JobLogTemplateModel_Company_ContactPerson,details_JobLogTemplateModel_Company_Phone,details_JobLogTemplateModel_Company_Email,details_JobLogTemplateModel_Company_Latitude,details_JobLogTemplateModel_Company_Longitude,details_JobLogTemplateModel_Company_DailyTravelTimeInMinutes,details_JobLogTemplateModel_Company_DistanceToCompanyInMeters,details_JobLogTemplateModel_Company_IsCreateMode,details_JobLogTemplateModel_TypeOfSubmission,details_JobLogTemplateModel_SubmissionDate,details_JobLogTemplateModel_SubmissionDateFormatted,details_JobLogTemplateModel_SubmissionDateTiks,details_JobLogTemplateModel_IsSubmissionDateRequired,details_JobLogTemplateModel_Status,details_JobLogTemplateModel_DateCreatedFormatted,details_JobLogTemplateModel_DateCreated,details_JobLogTemplateModel_DateModifiedFormatted,details_JobLogTemplateModel_DateModified,details_JobLogTemplateModel_LastModifiedDateTiks,details_JobLogTemplateModel_DateClosed,details_JobLogTemplateModel_JobApplicationDocument_Title,details_JobLogTemplateModel_JobApplicationDocument_Identifier,details_JobLogTemplateModel_JobApplicationDocument_IsDeletedBySystem,details_JobLogTemplateModel_JobApplicationDocument_IsDeletedByUser,details_JobLogTemplateModel_CvDocument_Title,details_JobLogTemplateModel_CvDocument_Identifier,details_JobLogTemplateModel_CvDocument_IsDeletedBySystem,details_JobLogTemplateModel_CvDocument_IsDeletedByUser,details_JobLogTemplateModel_JobApplicationFile,details_JobLogTemplateModel_CvFile,details_JobLogTemplateModel_SubmissionDeadlineDate,details_JobLogTemplateModel_IsPersisted,details_JobLogTemplateModel_ServerValidationErrors,details_JobLogTemplateModel_HasServerValidationErrors,details_JoblogWorkTime_WorkHour,details_JoblogWorkTime_DailyWorkTime,details_Place,details_OpenPrintDialog,details_WorkPlaceInfoText,details_JobCenterContactDetails,details_WorkPlaceDescriptionText,details_FavoriteText,details_IsFavorite,details_ShowFavorite,details_MetaOgTextForSharing,details_DescriptionForSharing,details_TitleForSharing,details_RutePlan,details_FormattedPurpose,details_MapUrl,details_OrganizationNumber,details_ShowSearchJobButton,details_ShowPrint,details_BackToFindWorkButtonUrl,isExternal
0,False,1,Frisk SSH/SSA søges til fast aftenvagt på plejehjemmet Kirsebærhaven,Frisk SSH/SSA søges til fast aftenvagt på plejehjemmet Kirsebærhaven,Af medarbejderne beskrives Kirsebærhaven som en arbejdsplads:  	med plads til forskellighed 	med dejlig natur i baghaven 	hvor man hjælper hinanden hv,Kolding Kommune - Plejehjemmet Kirsebærhaven,Kirsebærvej 4,6000,Kolding,False,False,False,True,2022-04-21T00:00:00,2022-05-19T00:00:00,19. maj 2022,0001-01-01T00:00:00,False,False,https://job.jobnet.dk/CV/FindWork/Details/5580943,Syddanmark,Kolding,Danmark,6000,,,,Deltid,"Sundhed, omsorg og personlig pleje",Pleje og omsorg,Social- og sundhedshjælper,55.517,9.4872,,,63351,57559,29189897,False,False,https://job.jobnet.dk/CV/FindWork/DetailsSocialmedia/5580943,https://job.jobnet.dk/CV/FindWork/Details/5580943,https://job.jobnet.dk/CV/FindWork/Details/5580943,True,5580943,55.517,9.4872,"{'Id': 1, 'Name': 'Fuldtid'}, {'Id': 16, 'Name': 'Deltid'}","{'Id': 1, 'Name': 'Almindelige vilkår'}, {'Id': 2, 'Name': 'Fleksjob'}, {'Id': 3, 'Name': 'Skånejob'}, {'Id': 4, 'Name': 'Egnet til efterlønnere og seniorer'}, {'Id': 5, 'Name': 'Job med løntilskud'}, {'Id': 6, 'Name': 'Rotationsjob'}, {'Id': 7, 'Name': 'Virksomhedspraktik'}","{'Id': 1, 'Name': 'Fastansættelse'}, {'Id': 16, 'Name': 'Tidsbegrænset ansættelse'}",Kolding Kommune - Plejehjemmet Kirsebærhaven,Kirsebærvej 4,58,Danmark,621,Kolding,3,Syddanmark,6000,Kolding,,0,Primary,,,,None,63351,1010522559,29189897,None,5580943,5580943,Kolding Kommune - Plejehjemmet Kirsebærhaven,Kirsebærvej 4,58,Danmark,621,Kolding,3,Syddanmark,6000,Kolding,,0,Primary,,,,None,63351,1010522559,29189897,None,,2022-04-21T00:00:00,2022-05-19T00:00:00,Frisk SSH/SSA søges til fast aftenvagt på plejehjemmet Kirsebærhaven,"Af medarbejderne beskrives Kirsebærhaven som en arbejdsplads:     med plads til forskellighed   med dejlig natur i baghaven   hvor man hjælper hinanden hvis det brænder på   med en lydhør ledelse, der ikke er bange for, at give en hånd med i pressede situationer   med en god personaleforening         Vi søger en kollega som:     Er uddannet SSH/SSA   Kan arbejde selvstændigt og trives som aftenvagt   Kan planlægge og strukturer dit arbejde ud fra de behov og opgaver, der er primært er i eget hus men med et øje på hele Kirsebærhaven.   Kan tage udgangspunkt i den enkelte beboers ressourcer og behov, gribe ""stjernestunder"" når de opstår.   Er en person med positiv indstilling til arbejdet, som viser glæde og begejstring i hverdagen.   Er i besiddelse af en dejlig smittende humor, og kan skabe gode relationer til borgere, pårørende og kollegaer på tværs af uddannelse og kompetencer.   Tør være nysgerrig på, hvordan andre tilgår opgaverne, uden at altid have svaret på, hvordan det skal gøres. Du tør sætte dig selv i spil.   Ønsker at være en del af en arbejdsplads, hvor vi støtter hinanden og vægter den anerkendende kommunikation højt.         Vi kan tilbyde:   Kirsebærhaven er et dejligt plejehjem beliggende i den nordlige del af Kolding by med skoven som nærmeste nabo. Der bor 66 borgere fordelt på 9 leve-bo-miljøer/huse. Der udover har vi et stort fælleshus, hvor bl.a. administrationen er placeret.         Et plejehjem med en stor gruppe engagerede frivillige, der støtter op om aktiviteter til beboerne.      Vi tør udfordre hinanden og ledelsen med en gensidig respekt, da dette skaber dynamik og kreative løsninger for borgerne.   En synlig ledelse   Vi arbejder ud fra vi et ""Et Kirsebærhaven"" og hjælper hinanden på tværs af uddannelse, vagtlag og bo enheder.   Vi dokumenterer i Nexus   Vi arbejder dagligt med Velfærdsteknologi, carendo stol og Sekoia skærme.   En veletableret personaleforening som arrangerer flere årlige arrangementer.   Sundhedsordning, der omfatter alle kommunens medarbejdere.              Så har du lyst til, at blive en del af en dejlig arbejdsplads og tager du udgangspunkt i borgerens centrum, så skal du søge stillingen, som aftenvagt hos os på Kirsebærhaven.       Vi arbejder ud fra Senior-, Sundheds- og Fritidsforvaltningens vision: ""Selvværd og sammenhæng i alt hvad vi siger og gør.""  Vi sætter dagligt de 5 leveregler i spil:      Tal et sprog alle mennesker forstår    Alt inden for din radar er dit ansvar     Det er borgerens plan/aftale    Sæt fællesskabet i spil    Gå borgeren i møde.      Du kan læse mere om visionen, levereglerne og Senior-, Sundheds- og Fritidsforvaltningen       Vil du vide mere?   Så kontakt gerne gruppeleder Anette Bonnesen på tlf. 2496 3781 eller plejehjemsleder Tina Faarborg Mikkelsen på tlf. 2388 4532.   Du er også velkommen til, at lave en aftale og komme forbi til en kop kaffe og se din kommende arbejdsplads.       Arbejdssted:  Kirsebærhaven, Kirsebærvej 4, 6000 Kolding.       Tiltrædelse:  Hurtigst muligt       Samtalerne finder sted løbende.       Løn:  Lønnen bliver fastsat efter principperne i ny løn i h.t. stillingens funktioner og ansøgerens kvalifikationer.       Ansøgning sendes elektronisk via knappen ""Ansøg"".    Forud for ansættelse indhenter Kolding Kommune straffeattest/børneattest, når loven kræver det, eller stillingen i øvrigt berettiger til det. 
 Denne jobannonce blev oprindeligt opslået på https://www.ofir.dk/
 (Den originale annonce kan ses på: https://www.ofir.dk/showojob?ofirid=5c698037)",Kirsebærvej 4,58,Danmark,621,Kolding,3,Syddanmark,6000,Kolding,1,16,Deltid,None,None,1,,0,,0,0,0,,False,"{'Id': 7922078, 'Email': None, 'FaxNumber': None, 'PersonName': 'Anette Bonnesen', 'FirstName': 'Anette', 'LastName': 'Bonnesen', 'PositionTitle': None, 'PhoneNumbers': [{'Number': '79798003', 'Type': 0, 'Description': 'Hovednummer'}]}",,False,False,False,False,4,,,False,False,False,False,,,,,https://www.ofir.dk/resultat/Jobannonce.aspx?ofirId=5c698037&action=sendApplicationUrl,False,2022-05-19T00:00:00,,0,Primary,7,/CV/FindWork/GetLogo?JobAdId=5580943&WorkPlace=63351&Organisation=29189897,"Kirsebærvej 4,6000, Kolding",True,False,/CV/Jobseeking/JobLog/CreateJobSearch?JobnetJobPostingIdentifier=5580943&Company.Name=Kolding Kommune - Plejehjemmet Kirsebærhaven&SubmissionDeadlineDate=2022-5-19&Title=Frisk SSH/SSA søges til fast aftenvagt på plejehjemmet Kirsebærhaven&WeeklyWorkTime=2,00000000-0000-0000-0000-000000000000,False,0,,,Frisk SSH/SSA søges til fast aftenvagt på plejehjemmet Kirsebærhaven,True,,True,2,,5580943,,,False,False,,0,False,Kolding Kommune - Plejehjemmet Kirsebærhaven,Kirsebærvej 4,,,6000,False,False,False,Kolding,Anette Bonnesen,79798003,,,,,,False,,2022-05-19T00:00:00,,0,False,0,,,,,0,,,,False,False,,,False,False,,,,False,,False,,,Arbejdspladsen ligger i Kolding kommune,False,Kolding Kommune - Plejehjemmet Kirsebærhaven,,None,,False,False,"Af medarbejderne beskrives Kirsebærhaven som en arbejdsplads:  	med plads til forskellighed 	med dejlig natur i baghaven 	hvor man hjælper hinanden hvis det brænder på 	med en lydhør ledelse, der ikke er bange for, at give en hånd med i pressede situationer 	med en god personaleforening    Vi søger en kollega som:  	Er uddannet SSH/SSA 	Kan arbejde","""Af medarbejderne beskrives Kirsebærhaven som en arbejdsplads:  \tmed plads til forskellighed \tmed dejlig natur i baghaven \thvor man hjælper hinanden hvis det brænder på \tmed en lydhør ledelse, der ikke er bange for, at give en hånd med i pressede situationer \tmed en god personaleforening    Vi søger en kollega som:  \tEr uddannet SSH/SSA \tKan arbejde""","""Frisk SSH/SSA søges til fast aftenvagt på plejehjemmet Kirsebærhaven""","https://www.google.dk/maps/dir//Kirsebærvej+4,6000,+Kolding/","Af medarbejderne beskrives Kirsebærhaven som en arbejdsplads:     med plads til forskellighed   med dejlig natur i baghaven   hvor man hjælper hinanden hvis det brænder på   med en lydhør ledelse, der ikke er bange for, at give en hånd med i pressede situationer   med en god personaleforening         Vi søger en kollega som:     Er uddannet SSH/SSA   Kan arbejde selvstændigt og trives som aftenvagt   Kan planlægge og strukturer dit arbejde ud fra de behov og opgaver, der er primært er i eget hus men med et øje på hele Kirsebærhaven.   Kan tage udgangspunkt i den enkelte beboers ressourcer og behov, gribe ""stjernestunder"" når de opstår.   Er en person med positiv indstilling til arbejdet, som viser glæde og begejstring i hverdagen.   Er i besiddelse af en dejlig smittende humor, og kan skabe gode relationer til borgere, pårørende og kollegaer på tværs af uddannelse og kompetencer.   Tør være nysgerrig på, hvordan andre tilgår opgaverne, uden at altid have svaret på, hvordan det skal gøres. Du tør sætte dig selv i spil.   Ønsker at være en del af en arbejdsplads, hvor vi støtter hinanden og vægter den anerkendende kommunikation højt.         Vi kan tilbyde:   Kirsebærhaven er et dejligt plejehjem beliggende i den nordlige del af Kolding by med skoven som nærmeste nabo. Der bor 66 borgere fordelt på 9 leve-bo-miljøer/huse. Der udover har vi et stort fælleshus, hvor bl.a. administrationen er placeret.         Et plejehjem med en stor gruppe engagerede frivillige, der støtter op om aktiviteter til beboerne.      Vi tør udfordre hinanden og ledelsen med en gensidig respekt, da dette skaber dynamik og kreative løsninger for borgerne.   En synlig ledelse   Vi arbejder ud fra vi et ""Et Kirsebærhaven"" og hjælper hinanden på tværs af uddannelse, vagtlag og bo enheder.   Vi dokumenterer i Nexus   Vi arbejder dagligt med Velfærdsteknologi, carendo stol og Sekoia skærme.   En veletableret personaleforening som arrangerer flere årlige arrangementer.   Sundhedsordning, der omfatter alle kommunens medarbejdere.              Så har du lyst til, at blive en del af en dejlig arbejdsplads og tager du udgangspunkt i borgerens centrum, så skal du søge stillingen, som aftenvagt hos os på Kirsebærhaven.       Vi arbejder ud fra Senior-, Sundheds- og Fritidsforvaltningens vision: ""Selvværd og sammenhæng i alt hvad vi siger og gør.""  Vi sætter dagligt de 5 leveregler i spil:      Tal et sprog alle mennesker forstår    Alt inden for din radar er dit ansvar     Det er borgerens plan/aftale    Sæt fællesskabet i spil    Gå borgeren i møde.      Du kan læse mere om visionen, levereglerne og Senior-, Sundheds- og Fritidsforvaltningen       Vil du vide mere?   Så kontakt gerne gruppeleder Anette Bonnesen på tlf. 2496 3781 eller plejehjemsleder Tina Faarborg Mikkelsen på tlf. 2388 4532.   Du er også velkommen til, at lave en aftale og komme forbi til en kop kaffe og se din kommende arbejdsplads.       Arbejdssted:  Kirsebærhaven, Kirsebærvej 4, 6000 Kolding.       Tiltrædelse:  Hurtigst muligt       Samtalerne finder sted løbende.       Løn:  Lønnen bliver fastsat efter principperne i ny løn i h.t. stillingens funktioner og ansøgerens kvalifikationer.       Ansøgning sendes elektronisk via knappen ""Ansøg"".    Forud for ansættelse indhenter Kolding Kommune straffeattest/børneattest, når loven kræver det, eller stillingen i øvrigt berettiger til det. 
 Denne jobannonce blev oprindeligt opslået på  https://www.ofir.dk/ 
 (Den originale annonce kan ses på:  https://www.ofir.dk/showojob?ofirid=5c698037 )","https://www.google.dk/maps/place/Kirsebærvej+4,6000,+Kolding/",29189897,False,False,,False
