summary_AutomatchType,summary_Abroad,summary_Weight,summary_Title,summary_JobHeadline,summary_Presentation,summary_HiringOrgName,summary_WorkPlaceAddress,summary_WorkPlacePostalCode,summary_WorkPlaceCity,summary_WorkPlaceOtherAddress,summary_WorkPlaceAbroad,summary_WorkPlaceNotStatic,summary_UseWorkPlaceAddressForJoblog,summary_PostingCreated,summary_LastDateApplication,summary_FormattedLastDateApplication,summary_AssignmentStartDate,summary_IsHotjob,summary_IsExternal,summary_Url,summary_Region,summary_Municipality,summary_Country,summary_PostalCode,summary_PostalCodeName,summary_JobAnnouncementType,summary_EmploymentType,summary_WorkHours,summary_OccupationArea,summary_OccupationGroup,summary_Occupation,summary_Location_Latitude,summary_Location_Longitude,summary_JoblogWorkTime_WorkHour,summary_JoblogWorkTime_DailyWorkTime,summary_WorkplaceID,summary_OrganisationId,summary_HiringOrgCVR,summary_UserLoggedIn,summary_AnonymousEmployer,summary_ShareUrl,summary_DetailsUrl,summary_JobLogUrl,summary_HasLocationValues,summary_ID,summary_Latitude,summary_Longitude,details_WorkSchedule,details_WorkConditions,details_EmploymentTypes,details_WorkPlace_Name,details_WorkPlace_Address_AddressLine,details_WorkPlace_Address_Country_Id,details_WorkPlace_Address_Country_Name,details_WorkPlace_Address_Municipality_Id,details_WorkPlace_Address_Municipality_Name,details_WorkPlace_Address_Region_Id,details_WorkPlace_Address_Region_Name,details_WorkPlace_Address_PostalCode,details_WorkPlace_Address_City,details_WorkPlace_PhoneNumber_Number,details_WorkPlace_PhoneNumber_Type,details_WorkPlace_PhoneNumber_Description,details_WorkPlace_FaxNumber,details_WorkPlace_Email,details_WorkPlace_WebAddress,details_WorkPlace_Description,details_WorkPlace_Logo,details_WorkPlace_WorkPlaceOrganizationNumber,details_WorkPlace_OrganizationNumber,details_WorkPlace_OrganizationDescription,details_JobPositionPosting_Id,details_JobPositionPosting_OriginalJppId,details_JobPositionPosting_HiringOrg_Name,details_JobPositionPosting_HiringOrg_Address_AddressLine,details_JobPositionPosting_HiringOrg_Address_Country_Id,details_JobPositionPosting_HiringOrg_Address_Country_Name,details_JobPositionPosting_HiringOrg_Address_Municipality_Id,details_JobPositionPosting_HiringOrg_Address_Municipality_Name,details_JobPositionPosting_HiringOrg_Address_Region_Id,details_JobPositionPosting_HiringOrg_Address_Region_Name,details_JobPositionPosting_HiringOrg_Address_PostalCode,details_JobPositionPosting_HiringOrg_Address_City,details_JobPositionPosting_HiringOrg_PhoneNumber_Number,details_JobPositionPosting_HiringOrg_PhoneNumber_Type,details_JobPositionPosting_HiringOrg_PhoneNumber_Description,details_JobPositionPosting_HiringOrg_FaxNumber,details_JobPositionPosting_HiringOrg_Email,details_JobPositionPosting_HiringOrg_WebAddress,details_JobPositionPosting_HiringOrg_Description,details_JobPositionPosting_HiringOrg_Logo,details_JobPositionPosting_HiringOrg_WorkPlaceOrganizationNumber,details_JobPositionPosting_HiringOrg_OrganizationNumber,details_JobPositionPosting_HiringOrg_OrganizationDescription,details_JobPositionPosting_RecruitingCompany,details_JobPositionPosting_PublicationStartDate,details_JobPositionPosting_PublicationEndDate,details_JobPositionPosting_JobPositionInformation_PositionTitle,details_JobPositionPosting_JobPositionInformation_Purpose,details_JobPositionPosting_JobPositionInformation_WorkLocation_AddressLine,details_JobPositionPosting_JobPositionInformation_WorkLocation_Country_Id,details_JobPositionPosting_JobPositionInformation_WorkLocation_Country_Name,details_JobPositionPosting_JobPositionInformation_WorkLocation_Municipality_Id,details_JobPositionPosting_JobPositionInformation_WorkLocation_Municipality_Name,details_JobPositionPosting_JobPositionInformation_WorkLocation_Region_Id,details_JobPositionPosting_JobPositionInformation_WorkLocation_Region_Name,details_JobPositionPosting_JobPositionInformation_WorkLocation_PostalCode,details_JobPositionPosting_JobPositionInformation_WorkLocation_City,details_JobPositionPosting_JobPositionInformation_EmploymentType,details_JobPositionPosting_JobPositionInformation_WeeklyWorkHours_TypeId,details_JobPositionPosting_JobPositionInformation_WeeklyWorkHours_TypeName,details_JobPositionPosting_JobPositionInformation_WeeklyWorkHours_Description,details_JobPositionPosting_JobPositionInformation_CompensationDescription,details_JobPositionPosting_JobPositionInformation_NumberToFill,details_JobPositionPosting_JobPositionInformation_DriverLicense,details_JobPositionPosting_JobPositionInformation_Occupation_DiscoWeb,details_JobPositionPosting_JobPositionInformation_Occupation_AlternateNames,details_JobPositionPosting_JobPositionInformation_Occupation_GroupId,details_JobPositionPosting_JobPositionInformation_Occupation_AreaId,details_JobPositionPosting_JobPositionInformation_Occupation_Id,details_JobPositionPosting_JobPositionInformation_Occupation_Name,details_JobPositionPosting_JobPositionInformation_IsGovernmentHiring,details_JobPositionPosting_JobPositionInformation_JppContacts,details_JobPositionPosting_JobPositionInformation_EmploymentDate,details_JobPositionPosting_IsRecruitmentOfForeignNationals,details_JobPositionPosting_IsWorkInDenmark,details_JobPositionPosting_IsAnonymousEmployer,details_JobPositionPosting_IsDisabilityFriendly,details_JobPositionPosting_JppType,details_JobPositionPosting_ApplicationDetails_WorkHourMax,details_JobPositionPosting_ApplicationDetails_WorkHourMin,details_JobPositionPosting_ApplicationDetails_DailyWorkTimeWeekend,details_JobPositionPosting_ApplicationDetails_DailyWorkTimeNight,details_JobPositionPosting_ApplicationDetails_DailyWorkTimeEvening,details_JobPositionPosting_ApplicationDetails_DailyWorkTimeDay,details_JobPositionPosting_ApplicationDetails_ReferenceText,details_JobPositionPosting_ApplicationDetails_RemarksToApplicant,details_JobPositionPosting_ApplicationDetails_ByEmail,details_JobPositionPosting_ApplicationDetails_ByPhone,details_JobPositionPosting_ApplicationDetails_ApplyViaUrl,details_JobPositionPosting_ApplicationDetails_ReplyInWriting,details_JobPositionPosting_ApplicationDetails_ApplicationDeadlineDate,details_JobPositionPosting_ContactAuthorityPhoneNumber_Number,details_JobPositionPosting_ContactAuthorityPhoneNumber_Type,details_JobPositionPosting_ContactAuthorityPhoneNumber_Description,details_JobPositionPosting_Status,details_LogoUrl,details_Address,details_ShowMap,details_ShowShareButtonJobLog,details_JobLogUrl,details_JobLogTemplateModel_Identifier,details_JobLogTemplateModel_UseWorkPlaceAddressForJoblog,details_JobLogTemplateModel_Category,details_JobLogTemplateModel_CvCustomerIdentifier,details_JobLogTemplateModel_JobSeekingStatus,details_JobLogTemplateModel_Title,details_JobLogTemplateModel_IsApplicationSourceRequired,details_JobLogTemplateModel_ApplicationSource,details_JobLogTemplateModel_IsWeeklyWorkTimeRequired,details_JobLogTemplateModel_WeeklyWorkTime,details_JobLogTemplateModel_HoursPerWeek,details_JobLogTemplateModel_JobnetJobPostingIdentifier,details_JobLogTemplateModel_JobAdDocument_Title,details_JobLogTemplateModel_JobAdDocument_Identifier,details_JobLogTemplateModel_JobAdDocument_IsDeletedBySystem,details_JobLogTemplateModel_JobAdDocument_IsDeletedByUser,details_JobLogTemplateModel_JobAdFile,details_JobLogTemplateModel_Company_JobLogEntryCategory,details_JobLogTemplateModel_Company_ShowAddressFieldsEvenIfEmpty,details_JobLogTemplateModel_Company_Name,details_JobLogTemplateModel_Company_Address,details_JobLogTemplateModel_Company_Country,details_JobLogTemplateModel_Company_EmploymentAreaID,details_JobLogTemplateModel_Company_PostCode,details_JobLogTemplateModel_Company_IsCountryAndTownAndPostCodeEmpty,details_JobLogTemplateModel_Company_IsTownAndPostCodeEmpty,details_JobLogTemplateModel_Company_IsCountryDanmark,details_JobLogTemplateModel_Company_Town,details_JobLogTemplateModel_Company_ContactPerson,details_JobLogTemplateModel_Company_Phone,details_JobLogTemplateModel_Company_Email,details_JobLogTemplateModel_Company_Latitude,details_JobLogTemplateModel_Company_Longitude,details_JobLogTemplateModel_Company_DailyTravelTimeInMinutes,details_JobLogTemplateModel_Company_DistanceToCompanyInMeters,details_JobLogTemplateModel_Company_IsCreateMode,details_JobLogTemplateModel_TypeOfSubmission,details_JobLogTemplateModel_SubmissionDate,details_JobLogTemplateModel_SubmissionDateFormatted,details_JobLogTemplateModel_SubmissionDateTiks,details_JobLogTemplateModel_IsSubmissionDateRequired,details_JobLogTemplateModel_Status,details_JobLogTemplateModel_DateCreatedFormatted,details_JobLogTemplateModel_DateCreated,details_JobLogTemplateModel_DateModifiedFormatted,details_JobLogTemplateModel_DateModified,details_JobLogTemplateModel_LastModifiedDateTiks,details_JobLogTemplateModel_DateClosed,details_JobLogTemplateModel_JobApplicationDocument_Title,details_JobLogTemplateModel_JobApplicationDocument_Identifier,details_JobLogTemplateModel_JobApplicationDocument_IsDeletedBySystem,details_JobLogTemplateModel_JobApplicationDocument_IsDeletedByUser,details_JobLogTemplateModel_CvDocument_Title,details_JobLogTemplateModel_CvDocument_Identifier,details_JobLogTemplateModel_CvDocument_IsDeletedBySystem,details_JobLogTemplateModel_CvDocument_IsDeletedByUser,details_JobLogTemplateModel_JobApplicationFile,details_JobLogTemplateModel_CvFile,details_JobLogTemplateModel_SubmissionDeadlineDate,details_JobLogTemplateModel_IsPersisted,details_JobLogTemplateModel_ServerValidationErrors,details_JobLogTemplateModel_HasServerValidationErrors,details_JoblogWorkTime_WorkHour,details_JoblogWorkTime_DailyWorkTime,details_Place,details_OpenPrintDialog,details_WorkPlaceInfoText,details_JobCenterContactDetails,details_WorkPlaceDescriptionText,details_FavoriteText,details_IsFavorite,details_ShowFavorite,details_MetaOgTextForSharing,details_DescriptionForSharing,details_TitleForSharing,details_RutePlan,details_FormattedPurpose,details_MapUrl,details_OrganizationNumber,details_ShowSearchJobButton,details_ShowPrint,details_BackToFindWorkButtonUrl,isExternal
0,False,1,Socialrådgiver til specialiseret rehabilitering,Socialrådgiver til specialiseret rehabilitering,"Ringstedhave Neurorehabiliteringscenter har 20 pladser til borgere med erhvervet hjerneskade med behov for specialiseret neurorehabilitering.

Vi får henvist borgere fra landets kommuner, og",Ringstedhave Neurorehabiliteringscenter,Ole Hansens Vej 7,4100,Ringsted,False,False,False,True,2022-04-21T00:00:00,2022-05-13T00:00:00,13. maj 2022,0001-01-01T00:00:00,False,False,https://job.jobnet.dk/CV/FindWork/Details/5580442,Øvrige Sjælland,Ringsted,Danmark,4100,,,,Deltid,"Pædagogisk, socialt og kirkeligt arbejde",Socialrådgivning mv.,Socialrådgiver,55.4464,11.782,,,139488,96905,36150513,False,False,https://job.jobnet.dk/CV/FindWork/DetailsSocialmedia/5580442,https://job.jobnet.dk/CV/FindWork/Details/5580442,https://job.jobnet.dk/CV/FindWork/Details/5580442,True,5580442,55.4464,11.782,"{'Id': 1, 'Name': 'Fuldtid'}, {'Id': 16, 'Name': 'Deltid'}","{'Id': 1, 'Name': 'Almindelige vilkår'}, {'Id': 2, 'Name': 'Fleksjob'}, {'Id': 3, 'Name': 'Skånejob'}, {'Id': 4, 'Name': 'Egnet til efterlønnere og seniorer'}, {'Id': 5, 'Name': 'Job med løntilskud'}, {'Id': 6, 'Name': 'Rotationsjob'}, {'Id': 7, 'Name': 'Virksomhedspraktik'}","{'Id': 1, 'Name': 'Fastansættelse'}, {'Id': 16, 'Name': 'Tidsbegrænset ansættelse'}",Ringstedhave Neurorehabiliteringscenter,Ole Hansens Vej 7,58,Danmark,329,Ringsted,4,"Hovedstaden, Sjælland og Bornholm",4100,Ringsted,,0,Primary,,ringstedhave@forenede-care.dk,www.ringstedhave.dk,None,,1023351125,36150513,None,5580442,5580442,Ringstedhave Neurorehabiliteringscenter,Ole Hansens Vej 7,58,Danmark,329,Ringsted,4,"Hovedstaden, Sjælland og Bornholm",4100,Ringsted,,0,Primary,,ringstedhave@forenede-care.dk,www.ringstedhave.dk,None,,1023351125,36150513,None,,2022-04-21T00:00:00,2022-05-13T00:00:00,Socialrådgiver til specialiseret rehabilitering,"Ringstedhave Neurorehabiliteringscenter har 20 pladser til borgere med erhvervet hjerneskade med behov for specialiseret neurorehabilitering. 
 Vi får henvist borgere fra landets kommuner, og det er derfor vores kunde og samarbejdspartner. 
 Den specialiserede rehabilitering foregår i alle døgnets timer med stor vægt på det tværfaglige samarbejde. Målet for træningen er, at borgeren skal opnå så stor selvstændighed i hverdagen som muligt. 
   
 Om jobbet 
 Vi får brug for endnu en socialrådgiver til vores døgnpladser for voksne med erhvervet hjerneskade iht SEL § 107 og Sundhedslov § 140. 
 Dine opgaver bliver blandt andet at hjælpe borgerne med problemstillinger så som økonomi/budget, forsikringer, diverse ansøgninger, værgemål, boligsituation ved udskrivelse. 
 Du vil også skulle foretage vurdering af arbejdsevne. 
 Du og din socialrådgiverkollega vil fordele borgerforløbene mellem jer, således, at der er tilknyttet en socialrådgiver på alle borgere. 
 Som socialrådgiver vil du blive en del af et tværfagligt team bestående af fysioterapeuter, ergoterapeuter, logopæder, neuropsykologer, sygeplejersker og SSA´ere. 
 Du vil skulle indgå i beslutninger, møder og vurderinger m.m. i forbindelse med rehabiliteringsforløbene. 
 Der vil være behov for din faglige ekspertise til borgere/pårørende såvel som til dine kollegaer i det daglige. 
 Som socialrådgiver på Ringstedhave skal du kunne arbejde selvstændigt og struktureret. Du skal kunne bevare overblikket og træffe beslutninger, som ikke altid er i overensstemmelse med borgers/pårørendes forventninger. Det er vigtigt, at du kan have ""den svære samtale"" og stadig kunne indgyde tillid hos borger/pårørende. 
 Vi dokumenterer i KMD Nexus, og det er ikke et krav at du kender systemet, da vi gerne oplærer dig. 
   
 Krav til dig 
 Du er uddannet socialrådgiver 
 Du har flere års erfaring med beskæftigelsesområdet, herunder arbejdsevnevurdering/afklaring 
 Du er skriftlig stærk og vant til at dokumentere, analysere og sammenfatte 
 Du kender rollen som tovholder/mødeleder 
 Du er vant til at identificere og løse problemstillinger 
 Du kan fungere i en hverdag, hvor udfordringer kan ændre din planlagte dag 
 Du kan forholde dig roligt og anerkendende i tilgangen til borgere og pårørende 
 Du er bekendt med at samarbejde eksternt 
   
 Det er naturligvis en fordel, hvis du har kendskab til arbejdet med borgere med kognitive udfordringer, eksempelvis i forbindelse med senhjerneskade. 
 Har du ikke det, bliver du grundigt introduceret til de retningslinjer vi arbejder efter, og til den daglige rehabiliterende tilgang i alle faggrupper. 
   
 Du får 
 En spændende stilling inden for specialiseret neurorehabilitering for borgere med erhvervet hjerneskade 
 Indgående oplæring 
 Vidensdeling, sparring og supervision i hverdagen både mono og tværfagligt 
 Stærkt tværfagligt sammenhold og en spændende og alsidig hverdag med fys, ergo, neurospsyk, plejegruppe, logopæder og socialrådgiver 
 Kreative og udviklingsorienterede kollegaer 
 Et arbejde hvor faglighed og evidensbaseret praksis vægtes højt 
 Et hus med veletableret intern og ekstern mødestruktur 
 Faglig ansvarlighed 
 Hvis du har spørgsmål, eller gerne vil høre mere om vores hus og den stilling vi søger en medarbejder til, så er du velkommen til at kontakte én af vores socialrådgivere; Linda Colberg Møller, tlf. 2014 1911 eller Nicoline Hansen, tlf. 2447 6672. 
 Læs mere om retningslinjer for specialiseret rehabilitering her:  Anbefalinger for tværsektorielle forløb for voksne med erhvervet hjerneskade (sst.dk) 
 Læs mere om Ringstedhave her:  https://www.ringstedhave.dk/ 
   
 Ansættelsesvilkår 
 Stillingen er på 30 timer ugentligt, mødetid mandag - fredag og med selvtilrettelæggende arbejdstid 
 Stillingen er til besættelse 1. juni 2022 
 Ansøgningsfrist 13. maj 2022 
 Samtaler forventes afholdt i uge 20.",Ole Hansens Vej 7,58,Danmark,329,Ringsted,4,"Hovedstaden, Sjælland og Bornholm",4100,Ringsted,1,16,Deltid,None,None,1,,0,,0,0,0,,False,"{'Id': 7920220, 'Email': 'dilm@forenede-care.dk', 'FaxNumber': None, 'PersonName': 'Diana Lundin Mühlerwirth', 'FirstName': 'Diana', 'LastName': 'Lundin Mühlerwirth', 'PositionTitle': 'Kontorkoordinator', 'PhoneNumbers': []}",,False,False,False,False,4,,,False,False,False,False,,,,,https://app.jobmatchprofile.com/h7qkh7/ringstedhave/h6twma/socialradgiver-til-specialiseret-rehabiliteri,False,2022-05-13T00:00:00,,0,Primary,7,/CV/FindWork/GetLogo?JobAdId=5580442&Organisation=36150513,"Ole Hansens Vej 7,4100, Ringsted",True,False,/CV/Jobseeking/JobLog/CreateJobSearch?JobnetJobPostingIdentifier=5580442&Company.Name=Ringstedhave Neurorehabiliteringscenter&SubmissionDeadlineDate=2022-5-13&Title=Socialrådgiver til specialiseret rehabilitering&WeeklyWorkTime=2,00000000-0000-0000-0000-000000000000,False,0,,,Socialrådgiver til specialiseret rehabilitering,True,,True,2,,5580442,,,False,False,,0,False,Ringstedhave Neurorehabiliteringscenter,Ole Hansens Vej 7,,,4100,False,False,False,Ringsted,Diana Lundin Mühlerwirth,,dilm@forenede-care.dk,,,,,False,,2022-05-13T00:00:00,,0,False,0,,,,,0,,,,False,False,,,False,False,,,,False,,False,,,Arbejdspladsen ligger i Ringsted kommune,False,Ringstedhave Neurorehabiliteringscenter,,None,,False,False,"Ringstedhave Neurorehabiliteringscenter har 20 pladser til borgere med erhvervet hjerneskade med behov for specialiseret neurorehabilitering.

Vi får henvist borgere fra landets kommuner, og det er derfor vores kunde og samarbejdspartner.

Den specialiserede rehabilitering foregår i alle døgnets timer med stor vægt på det tværfaglige samarbejde","""Ringstedhave Neurorehabiliteringscenter har 20 pladser til borgere med erhvervet hjerneskade med behov for specialiseret neurorehabilitering.\r\n\r\nVi får henvist borgere fra landets kommuner, og det er derfor vores kunde og samarbejdspartner.\r\n\r\nDen specialiserede rehabilitering foregår i alle døgnets timer med stor vægt på det tværfaglige samarbejde""","""Socialrådgiver til specialiseret rehabilitering""","https://www.google.dk/maps/dir//Ole+Hansens+Vej+7,4100,+Ringsted/","Ringstedhave Neurorehabiliteringscenter har 20 pladser til borgere med erhvervet hjerneskade med behov for specialiseret neurorehabilitering. 
 Vi får henvist borgere fra landets kommuner, og det er derfor vores kunde og samarbejdspartner. 
 Den specialiserede rehabilitering foregår i alle døgnets timer med stor vægt på det tværfaglige samarbejde. Målet for træningen er, at borgeren skal opnå så stor selvstændighed i hverdagen som muligt. 
   
 Om jobbet 
 Vi får brug for endnu en socialrådgiver til vores døgnpladser for voksne med erhvervet hjerneskade iht SEL § 107 og Sundhedslov § 140. 
 Dine opgaver bliver blandt andet at hjælpe borgerne med problemstillinger så som økonomi/budget, forsikringer, diverse ansøgninger, værgemål, boligsituation ved udskrivelse. 
 Du vil også skulle foretage vurdering af arbejdsevne. 
 Du og din socialrådgiverkollega vil fordele borgerforløbene mellem jer, således, at der er tilknyttet en socialrådgiver på alle borgere. 
 Som socialrådgiver vil du blive en del af et tværfagligt team bestående af fysioterapeuter, ergoterapeuter, logopæder, neuropsykologer, sygeplejersker og SSA´ere. 
 Du vil skulle indgå i beslutninger, møder og vurderinger m.m. i forbindelse med rehabiliteringsforløbene. 
 Der vil være behov for din faglige ekspertise til borgere/pårørende såvel som til dine kollegaer i det daglige. 
 Som socialrådgiver på Ringstedhave skal du kunne arbejde selvstændigt og struktureret. Du skal kunne bevare overblikket og træffe beslutninger, som ikke altid er i overensstemmelse med borgers/pårørendes forventninger. Det er vigtigt, at du kan have ""den svære samtale"" og stadig kunne indgyde tillid hos borger/pårørende. 
 Vi dokumenterer i KMD Nexus, og det er ikke et krav at du kender systemet, da vi gerne oplærer dig. 
   
 Krav til dig 
 Du er uddannet socialrådgiver 
 Du har flere års erfaring med beskæftigelsesområdet, herunder arbejdsevnevurdering/afklaring 
 Du er skriftlig stærk og vant til at dokumentere, analysere og sammenfatte 
 Du kender rollen som tovholder/mødeleder 
 Du er vant til at identificere og løse problemstillinger 
 Du kan fungere i en hverdag, hvor udfordringer kan ændre din planlagte dag 
 Du kan forholde dig roligt og anerkendende i tilgangen til borgere og pårørende 
 Du er bekendt med at samarbejde eksternt 
   
 Det er naturligvis en fordel, hvis du har kendskab til arbejdet med borgere med kognitive udfordringer, eksempelvis i forbindelse med senhjerneskade. 
 Har du ikke det, bliver du grundigt introduceret til de retningslinjer vi arbejder efter, og til den daglige rehabiliterende tilgang i alle faggrupper. 
   
 Du får 
 En spændende stilling inden for specialiseret neurorehabilitering for borgere med erhvervet hjerneskade 
 Indgående oplæring 
 Vidensdeling, sparring og supervision i hverdagen både mono og tværfagligt 
 Stærkt tværfagligt sammenhold og en spændende og alsidig hverdag med fys, ergo, neurospsyk, plejegruppe, logopæder og socialrådgiver 
 Kreative og udviklingsorienterede kollegaer 
 Et arbejde hvor faglighed og evidensbaseret praksis vægtes højt 
 Et hus med veletableret intern og ekstern mødestruktur 
 Faglig ansvarlighed 
 Hvis du har spørgsmål, eller gerne vil høre mere om vores hus og den stilling vi søger en medarbejder til, så er du velkommen til at kontakte én af vores socialrådgivere; Linda Colberg Møller, tlf. 2014 1911 eller Nicoline Hansen, tlf. 2447 6672. 
 Læs mere om retningslinjer for specialiseret rehabilitering her:  Anbefalinger for tværsektorielle forløb for voksne med erhvervet hjerneskade (sst.dk) 
 Læs mere om Ringstedhave her:  https://www.ringstedhave.dk/ 
   
 Ansættelsesvilkår 
 Stillingen er på 30 timer ugentligt, mødetid mandag - fredag og med selvtilrettelæggende arbejdstid 
 Stillingen er til besættelse 1. juni 2022 
 Ansøgningsfrist 13. maj 2022 
 Samtaler forventes afholdt i uge 20.","https://www.google.dk/maps/place/Ole+Hansens+Vej+7,4100,+Ringsted/",36150513,False,False,,False
