summary_AutomatchType,summary_Abroad,summary_Weight,summary_Title,summary_JobHeadline,summary_Presentation,summary_HiringOrgName,summary_WorkPlaceAddress,summary_WorkPlacePostalCode,summary_WorkPlaceCity,summary_WorkPlaceOtherAddress,summary_WorkPlaceAbroad,summary_WorkPlaceNotStatic,summary_UseWorkPlaceAddressForJoblog,summary_PostingCreated,summary_LastDateApplication,summary_FormattedLastDateApplication,summary_AssignmentStartDate,summary_IsHotjob,summary_IsExternal,summary_Url,summary_Region,summary_Municipality,summary_Country,summary_PostalCode,summary_PostalCodeName,summary_JobAnnouncementType,summary_EmploymentType,summary_WorkHours,summary_OccupationArea,summary_OccupationGroup,summary_Occupation,summary_Location_Latitude,summary_Location_Longitude,summary_JoblogWorkTime_WorkHour,summary_JoblogWorkTime_DailyWorkTime,summary_WorkplaceID,summary_OrganisationId,summary_HiringOrgCVR,summary_UserLoggedIn,summary_AnonymousEmployer,summary_ShareUrl,summary_DetailsUrl,summary_JobLogUrl,summary_HasLocationValues,summary_ID,summary_Latitude,summary_Longitude,details_WorkSchedule,details_WorkConditions,details_EmploymentTypes,details_WorkPlace_Name,details_WorkPlace_Address_AddressLine,details_WorkPlace_Address_Country_Id,details_WorkPlace_Address_Country_Name,details_WorkPlace_Address_Municipality_Id,details_WorkPlace_Address_Municipality_Name,details_WorkPlace_Address_Region_Id,details_WorkPlace_Address_Region_Name,details_WorkPlace_Address_PostalCode,details_WorkPlace_Address_City,details_WorkPlace_PhoneNumber_Number,details_WorkPlace_PhoneNumber_Type,details_WorkPlace_PhoneNumber_Description,details_WorkPlace_FaxNumber,details_WorkPlace_Email,details_WorkPlace_WebAddress,details_WorkPlace_Description,details_WorkPlace_Logo,details_WorkPlace_WorkPlaceOrganizationNumber,details_WorkPlace_OrganizationNumber,details_WorkPlace_OrganizationDescription,details_JobPositionPosting_Id,details_JobPositionPosting_OriginalJppId,details_JobPositionPosting_HiringOrg_Name,details_JobPositionPosting_HiringOrg_Address_AddressLine,details_JobPositionPosting_HiringOrg_Address_Country_Id,details_JobPositionPosting_HiringOrg_Address_Country_Name,details_JobPositionPosting_HiringOrg_Address_Municipality_Id,details_JobPositionPosting_HiringOrg_Address_Municipality_Name,details_JobPositionPosting_HiringOrg_Address_Region_Id,details_JobPositionPosting_HiringOrg_Address_Region_Name,details_JobPositionPosting_HiringOrg_Address_PostalCode,details_JobPositionPosting_HiringOrg_Address_City,details_JobPositionPosting_HiringOrg_PhoneNumber_Number,details_JobPositionPosting_HiringOrg_PhoneNumber_Type,details_JobPositionPosting_HiringOrg_PhoneNumber_Description,details_JobPositionPosting_HiringOrg_FaxNumber,details_JobPositionPosting_HiringOrg_Email,details_JobPositionPosting_HiringOrg_WebAddress,details_JobPositionPosting_HiringOrg_Description,details_JobPositionPosting_HiringOrg_Logo,details_JobPositionPosting_HiringOrg_WorkPlaceOrganizationNumber,details_JobPositionPosting_HiringOrg_OrganizationNumber,details_JobPositionPosting_HiringOrg_OrganizationDescription,details_JobPositionPosting_RecruitingCompany,details_JobPositionPosting_PublicationStartDate,details_JobPositionPosting_PublicationEndDate,details_JobPositionPosting_JobPositionInformation_PositionTitle,details_JobPositionPosting_JobPositionInformation_Purpose,details_JobPositionPosting_JobPositionInformation_WorkLocation_AddressLine,details_JobPositionPosting_JobPositionInformation_WorkLocation_Country_Id,details_JobPositionPosting_JobPositionInformation_WorkLocation_Country_Name,details_JobPositionPosting_JobPositionInformation_WorkLocation_Municipality_Id,details_JobPositionPosting_JobPositionInformation_WorkLocation_Municipality_Name,details_JobPositionPosting_JobPositionInformation_WorkLocation_Region_Id,details_JobPositionPosting_JobPositionInformation_WorkLocation_Region_Name,details_JobPositionPosting_JobPositionInformation_WorkLocation_PostalCode,details_JobPositionPosting_JobPositionInformation_WorkLocation_City,details_JobPositionPosting_JobPositionInformation_EmploymentType,details_JobPositionPosting_JobPositionInformation_WeeklyWorkHours_TypeId,details_JobPositionPosting_JobPositionInformation_WeeklyWorkHours_TypeName,details_JobPositionPosting_JobPositionInformation_WeeklyWorkHours_Description,details_JobPositionPosting_JobPositionInformation_CompensationDescription,details_JobPositionPosting_JobPositionInformation_NumberToFill,details_JobPositionPosting_JobPositionInformation_DriverLicense,details_JobPositionPosting_JobPositionInformation_Occupation_DiscoWeb,details_JobPositionPosting_JobPositionInformation_Occupation_AlternateNames,details_JobPositionPosting_JobPositionInformation_Occupation_GroupId,details_JobPositionPosting_JobPositionInformation_Occupation_AreaId,details_JobPositionPosting_JobPositionInformation_Occupation_Id,details_JobPositionPosting_JobPositionInformation_Occupation_Name,details_JobPositionPosting_JobPositionInformation_IsGovernmentHiring,details_JobPositionPosting_JobPositionInformation_JppContacts,details_JobPositionPosting_JobPositionInformation_EmploymentDate,details_JobPositionPosting_IsRecruitmentOfForeignNationals,details_JobPositionPosting_IsWorkInDenmark,details_JobPositionPosting_IsAnonymousEmployer,details_JobPositionPosting_IsDisabilityFriendly,details_JobPositionPosting_JppType,details_JobPositionPosting_ApplicationDetails_WorkHourMax,details_JobPositionPosting_ApplicationDetails_WorkHourMin,details_JobPositionPosting_ApplicationDetails_DailyWorkTimeWeekend,details_JobPositionPosting_ApplicationDetails_DailyWorkTimeNight,details_JobPositionPosting_ApplicationDetails_DailyWorkTimeEvening,details_JobPositionPosting_ApplicationDetails_DailyWorkTimeDay,details_JobPositionPosting_ApplicationDetails_ReferenceText,details_JobPositionPosting_ApplicationDetails_RemarksToApplicant,details_JobPositionPosting_ApplicationDetails_ByEmail,details_JobPositionPosting_ApplicationDetails_ByPhone,details_JobPositionPosting_ApplicationDetails_ApplyViaUrl,details_JobPositionPosting_ApplicationDetails_ReplyInWriting,details_JobPositionPosting_ApplicationDetails_ApplicationDeadlineDate,details_JobPositionPosting_ContactAuthorityPhoneNumber_Number,details_JobPositionPosting_ContactAuthorityPhoneNumber_Type,details_JobPositionPosting_ContactAuthorityPhoneNumber_Description,details_JobPositionPosting_Status,details_LogoUrl,details_Address,details_ShowMap,details_ShowShareButtonJobLog,details_JobLogUrl,details_JobLogTemplateModel_Identifier,details_JobLogTemplateModel_UseWorkPlaceAddressForJoblog,details_JobLogTemplateModel_Category,details_JobLogTemplateModel_CvCustomerIdentifier,details_JobLogTemplateModel_JobSeekingStatus,details_JobLogTemplateModel_Title,details_JobLogTemplateModel_IsApplicationSourceRequired,details_JobLogTemplateModel_ApplicationSource,details_JobLogTemplateModel_IsWeeklyWorkTimeRequired,details_JobLogTemplateModel_WeeklyWorkTime,details_JobLogTemplateModel_HoursPerWeek,details_JobLogTemplateModel_JobnetJobPostingIdentifier,details_JobLogTemplateModel_JobAdDocument_Title,details_JobLogTemplateModel_JobAdDocument_Identifier,details_JobLogTemplateModel_JobAdDocument_IsDeletedBySystem,details_JobLogTemplateModel_JobAdDocument_IsDeletedByUser,details_JobLogTemplateModel_JobAdFile,details_JobLogTemplateModel_Company_JobLogEntryCategory,details_JobLogTemplateModel_Company_ShowAddressFieldsEvenIfEmpty,details_JobLogTemplateModel_Company_Name,details_JobLogTemplateModel_Company_Address,details_JobLogTemplateModel_Company_Country,details_JobLogTemplateModel_Company_EmploymentAreaID,details_JobLogTemplateModel_Company_PostCode,details_JobLogTemplateModel_Company_IsCountryAndTownAndPostCodeEmpty,details_JobLogTemplateModel_Company_IsTownAndPostCodeEmpty,details_JobLogTemplateModel_Company_IsCountryDanmark,details_JobLogTemplateModel_Company_Town,details_JobLogTemplateModel_Company_ContactPerson,details_JobLogTemplateModel_Company_Phone,details_JobLogTemplateModel_Company_Email,details_JobLogTemplateModel_Company_Latitude,details_JobLogTemplateModel_Company_Longitude,details_JobLogTemplateModel_Company_DailyTravelTimeInMinutes,details_JobLogTemplateModel_Company_DistanceToCompanyInMeters,details_JobLogTemplateModel_Company_IsCreateMode,details_JobLogTemplateModel_TypeOfSubmission,details_JobLogTemplateModel_SubmissionDate,details_JobLogTemplateModel_SubmissionDateFormatted,details_JobLogTemplateModel_SubmissionDateTiks,details_JobLogTemplateModel_IsSubmissionDateRequired,details_JobLogTemplateModel_Status,details_JobLogTemplateModel_DateCreatedFormatted,details_JobLogTemplateModel_DateCreated,details_JobLogTemplateModel_DateModifiedFormatted,details_JobLogTemplateModel_DateModified,details_JobLogTemplateModel_LastModifiedDateTiks,details_JobLogTemplateModel_DateClosed,details_JobLogTemplateModel_JobApplicationDocument_Title,details_JobLogTemplateModel_JobApplicationDocument_Identifier,details_JobLogTemplateModel_JobApplicationDocument_IsDeletedBySystem,details_JobLogTemplateModel_JobApplicationDocument_IsDeletedByUser,details_JobLogTemplateModel_CvDocument_Title,details_JobLogTemplateModel_CvDocument_Identifier,details_JobLogTemplateModel_CvDocument_IsDeletedBySystem,details_JobLogTemplateModel_CvDocument_IsDeletedByUser,details_JobLogTemplateModel_JobApplicationFile,details_JobLogTemplateModel_CvFile,details_JobLogTemplateModel_SubmissionDeadlineDate,details_JobLogTemplateModel_IsPersisted,details_JobLogTemplateModel_ServerValidationErrors,details_JobLogTemplateModel_HasServerValidationErrors,details_JoblogWorkTime_WorkHour,details_JoblogWorkTime_DailyWorkTime,details_Place,details_OpenPrintDialog,details_WorkPlaceInfoText,details_JobCenterContactDetails,details_WorkPlaceDescriptionText,details_FavoriteText,details_IsFavorite,details_ShowFavorite,details_MetaOgTextForSharing,details_DescriptionForSharing,details_TitleForSharing,details_RutePlan,details_FormattedPurpose,details_MapUrl,details_OrganizationNumber,details_ShowSearchJobButton,details_ShowPrint,details_BackToFindWorkButtonUrl,isExternal
0,False,1,Kommunikationskonsulent med forståelse for digital infrastruktur og forskning,Kommunikationskonsulent med forståelse for digital infrastruktur og forskning,"Kan du formidle teknisk indhold på en letforståelig og engagerende måde? Kan du skabe struktur og overblik på webindhold? Kan du opsøge de gode historier internt og eksternt og sørge for, at de kommer",Danmarks Tekniske Universitet,Anker Engelunds Vej 101,2800,Kongens Lyngby,True,False,False,False,2022-04-22T00:00:00,2022-05-20T00:00:00,20. maj 2022,0001-01-01T00:00:00,False,False,https://job.jobnet.dk/CV/FindWork/Details/5581267,Hovedstaden og Bornholm,Lyngby-Taarbæk,Danmark,2800,,,,Fuldtid,Akademisk arbejde,Kommunikation og erhvervssprogligt arbejde,Kommunikationskonsulent,55.7859,12.5241,,,83955,66175,30060946,False,False,https://job.jobnet.dk/CV/FindWork/DetailsSocialmedia/5581267,https://job.jobnet.dk/CV/FindWork/Details/5581267,https://job.jobnet.dk/CV/FindWork/Details/5581267,True,5581267,55.7859,12.5241,"{'Id': 1, 'Name': 'Fuldtid'}, {'Id': 16, 'Name': 'Deltid'}","{'Id': 1, 'Name': 'Almindelige vilkår'}, {'Id': 2, 'Name': 'Fleksjob'}, {'Id': 3, 'Name': 'Skånejob'}, {'Id': 4, 'Name': 'Egnet til efterlønnere og seniorer'}, {'Id': 5, 'Name': 'Job med løntilskud'}, {'Id': 6, 'Name': 'Rotationsjob'}, {'Id': 7, 'Name': 'Virksomhedspraktik'}","{'Id': 1, 'Name': 'Fastansættelse'}, {'Id': 16, 'Name': 'Tidsbegrænset ansættelse'}",Danmarks Tekniske Universitet,Anker Engelunds Vej 101,58,Danmark,159,Gladsaxe,4,"Hovedstaden, Sjælland og Bornholm",2800,Kongens Lyngby,,0,Primary,,,,None,83955,1003403265,30060946,None,5581267,5581267,Danmarks Tekniske Universitet,Anker Engelunds Vej 101,58,Danmark,159,Gladsaxe,4,"Hovedstaden, Sjælland og Bornholm",2800,Kongens Lyngby,,0,Primary,,,,None,83955,1003403265,30060946,None,,2022-04-22T00:00:00,2022-05-20T00:00:00,Kommunikationskonsulent med forståelse for digital infrastruktur og forskning,"Kan du formidle teknisk indhold på en letforståelig og engagerende måde? Kan du skabe struktur og overblik på webindhold? Kan du opsøge de gode historier internt og eksternt og sørge for, at de kommer ud på vores forskellige platforme?  
 
 Så er nedenstående stilling måske noget for dig!  
 
 Danish e-infrastructure Cooperation (DeiC) er det nationale samarbejde med og mellem universiteterne om levering af digital forskningsinfrastruktur. DeiC's hovedopgaver er levering af Forskningsnettet og tilhørende tjenester, supercomputere, datalagring og data management-tjenester. DeiC koordinerer infrastrukturen og repræsenterer universiteterne i internationale organisationer. Vi formidler viden om international udvikling og muligheder til samarbejdet, og understøtter myndighederne omkring blandt andet strategiudvikling og -implementering.  
 
 Vi søger en kommunikationskonsulent, der har teknisk forståelse, erfaring med formidling på forskellige platforme og medier, og som kan fortælle de gode historier på dansk og engelsk.  
 
 Du vil indgå i et lille kommunikationsteam, hvor der samarbejdes på kryds og tværs om en række forskellige kommunikationsopgaver i tæt forbindelse med sekretariatet og DeiC's teknisk-faglige teams. Kommunikationsteamet består af yderligere to personer og en tilknyttet webudvikler.  
 
 Dine væsentligste opgaver 
 Du bliver den primære ansvarlige for kommunikation for området med forskningsnet og tjenester og datamanagement i samarbejde med de relevante parter  
 Du skal aktivt medvirke til at formidle resultater og historier fra DeiC's deltagelse i internationale projekter og aktiviteter, herunder samarbejde med internationale kolleger i projekterne  
 Du producerer og opdaterer indhold på vores digitale medier, hjemmeside, nyhedsbrev og SoMe i samarbejde med det øvrige kommunikationsteam  
 Du er med til at sikre, at DeiC's eksterne kommunikation er professionel, struktureret og engagerende.  
 
 
 Vi forventer, at du 
 Har en relevant akademisk uddannelse inden for kommunikationsområdet på bachelor- eller kandidatniveau. Du må gerne have nogle års praktisk erfaring på området.  
 Kan sætte dig ind i og formidle teknisk tunge emner i et letforståeligt sprog. Måske har du allerede kendskab til IT-branchen eller forskningsverdenen  
 Har dokumenteret erfaring med formidling på dansk og engelsk, og også meget gerne med forskningsformidling og/eller information om digital infrastruktur  
 Har erfaring med informationsarkitektur og opsætning af informationsstruktur og navigering på websites, SEO og informationsflow  
 Kan lide en hverdag med mange forskellige aktiviteter, hvor du arbejder selvstændigt, tager initiativ og ansvar og følger aktiviteterne til dørs  
 Arbejder godt sammen med mange mennesker med forskellig faglig baggrund og aktivt tager kontakt til alle relevante parter i forbindelse med dine historier og opgaver.  
 
 
 DeiC 
 
 DeiC er en juridisk enhed under Uddannelses- og Forskningsministeriet, hvor alle medarbejdere er ansat på Danmarks Tekniske Universitet (DTU), der varetager en række administrative funktioner for os. Vi er en lille organisation med under 20 ansatte og er fysisk placeret på kontorer på henholdsvis DTU, Aarhus Universitet og enkelte andre lokationer. Vi er vant til at arbejde sammen på tværs via digitale platforme.  
 
 Du bliver en del af DeiC's sekretariat, der består af administrationen og kommunikationsteamet.  
 
 Løn og ansættelsesvilkår 
 
 Løn- og ansættelsesvilkår i henhold til overenskomst for akademikere i staten. Du indplaceres i henhold til dine kvalifikationer.  
 
 Stillingen er på 37 timer og ønskes besat hurtigst muligt.  
 
 Arbejdssted er i DeiCs lokaler på DTU Campus i Lyngby.  
 
 Ansøgning og kontakt 
 
 Vi skal modtage din online ansøgning senest den 30. maj 2022. Åbn linket ""Ansøg online"", hvor du udfylder ansøgningsformularen samt vedhæfter motiveret ansøgning, CV og eksamensbeviser.  
 
 Ønsker du flere oplysninger om stillingen, er du velkommen til at kontakte direktør Gitte Kudsk, på telefon 24 80 12 07.  
 
 Du kan læse nærmere om DeiC på vores hjemmeside: https://www.deic.dk/  
 
 Alle interesserede uanset alder, køn, handicap, race, religion eller etnisk tilhørsforhold, opfordres til at søge stillingen.  
 
 Teknologi for mennesker 
 
 DTU udvikler teknologi for mennesker. Med vores forskning og uddannelser i international topklasse er vi med til at skabe en bedre verden, og vi bidrager til løsningen af de globale udfordringer formuleret i FN's 17 verdensmål for en bæredygtig udvikling. H.C. Ørsted grundlagde DTU i 1829 med en klar vision om at udvikle og nyttiggøre naturvidenskab og teknisk videnskab til gavn for samfundet. Den vision lever den dag i dag. DTU har 13.400 studerende og 5.800 ansatte. Vi arbejder i en international atmosfære og har et inkluderende, udviklende og uformelt arbejdsmiljø. DTU har campusser i hele Danmark og i Grønland og samarbejder med de bedste universiteter verden over.",Anker Engelunds Vej 101,58,Danmark,173,Lyngby-Taarbæk,4,"Hovedstaden, Sjælland og Bornholm",2800,Kongens Lyngby,1,1,Fuldtid,None,None,1,,0,,0,0,0,,True,"{'Id': 7923369, 'Email': None, 'FaxNumber': None, 'PersonName': 'Gitte Kudsk', 'FirstName': 'Gitte', 'LastName': 'Kudsk', 'PositionTitle': 'Direktør', 'PhoneNumbers': [{'Number': '24 80 12 07', 'Type': 2, 'Description': 'Mobil'}]}",,True,False,False,False,4,,,False,False,False,False,,,,,https://www.dtu.dk/om-dtu/job-og-karriere/ledige-stillinger/job?id=96756a73-59c5-4d66-bb36-5b46dc475f52,False,2022-05-20T00:00:00,,0,Primary,7,/CV/FindWork/GetLogo?JobAdId=5581267&WorkPlace=83955&Organisation=30060946,"Anker Engelunds Vej 101,2800, Kongens Lyngby",True,False,/CV/Jobseeking/JobLog/CreateJobSearch?JobnetJobPostingIdentifier=5581267&Company.Name=Danmarks Tekniske Universitet&SubmissionDeadlineDate=2022-5-20&Title=Kommunikationskonsulent med forståelse for digital infrastruktur og forskning&WeeklyWorkTime=1,00000000-0000-0000-0000-000000000000,False,0,,,Kommunikationskonsulent med forståelse for digital infrastruktur og forskning,True,,True,1,,5581267,,,False,False,,0,False,Danmarks Tekniske Universitet,Anker Engelunds Vej 101,,,2800,False,False,False,Kongens Lyngby,Gitte Kudsk,24 80 12 07,,,,,,False,,2022-05-20T00:00:00,,0,False,0,,,,,0,,,,False,False,,,False,False,,,,False,,False,,,Arbejdspladsen ligger i Lyngby-Taarbæk kommune,False,Danmarks Tekniske Universitet,,None,,False,False,"Kan du formidle teknisk indhold på en letforståelig og engagerende måde? Kan du skabe struktur og overblik på webindhold? Kan du opsøge de gode historier internt og eksternt og sørge for, at de kommer ud på vores forskellige platforme? 

 Så er nedenstående stilling måske noget for dig! 

 Danish e-infrastructure Cooperation (DeiC) er det natio","""Kan du formidle teknisk indhold på en letforståelig og engagerende måde? Kan du skabe struktur og overblik på webindhold? Kan du opsøge de gode historier internt og eksternt og sørge for, at de kommer ud på vores forskellige platforme? \r\n\r\n Så er nedenstående stilling måske noget for dig! \r\n\r\n Danish e-infrastructure Cooperation (DeiC) er det natio""","""Kommunikationskonsulent med forståelse for digital infrastruktur og forskning""","https://www.google.dk/maps/dir//Anker+Engelunds+Vej+101,2800,+Kongens+Lyngby/","Kan du formidle teknisk indhold på en letforståelig og engagerende måde? Kan du skabe struktur og overblik på webindhold? Kan du opsøge de gode historier internt og eksternt og sørge for, at de kommer ud på vores forskellige platforme?  
 
 Så er nedenstående stilling måske noget for dig!  
 
 Danish e-infrastructure Cooperation (DeiC) er det nationale samarbejde med og mellem universiteterne om levering af digital forskningsinfrastruktur. DeiC's hovedopgaver er levering af Forskningsnettet og tilhørende tjenester, supercomputere, datalagring og data management-tjenester. DeiC koordinerer infrastrukturen og repræsenterer universiteterne i internationale organisationer. Vi formidler viden om international udvikling og muligheder til samarbejdet, og understøtter myndighederne omkring blandt andet strategiudvikling og -implementering.  
 
 Vi søger en kommunikationskonsulent, der har teknisk forståelse, erfaring med formidling på forskellige platforme og medier, og som kan fortælle de gode historier på dansk og engelsk.  
 
 Du vil indgå i et lille kommunikationsteam, hvor der samarbejdes på kryds og tværs om en række forskellige kommunikationsopgaver i tæt forbindelse med sekretariatet og DeiC's teknisk-faglige teams. Kommunikationsteamet består af yderligere to personer og en tilknyttet webudvikler.  
 
 Dine væsentligste opgaver 
 Du bliver den primære ansvarlige for kommunikation for området med forskningsnet og tjenester og datamanagement i samarbejde med de relevante parter  
 Du skal aktivt medvirke til at formidle resultater og historier fra DeiC's deltagelse i internationale projekter og aktiviteter, herunder samarbejde med internationale kolleger i projekterne  
 Du producerer og opdaterer indhold på vores digitale medier, hjemmeside, nyhedsbrev og SoMe i samarbejde med det øvrige kommunikationsteam  
 Du er med til at sikre, at DeiC's eksterne kommunikation er professionel, struktureret og engagerende.  
 
 
 Vi forventer, at du 
 Har en relevant akademisk uddannelse inden for kommunikationsområdet på bachelor- eller kandidatniveau. Du må gerne have nogle års praktisk erfaring på området.  
 Kan sætte dig ind i og formidle teknisk tunge emner i et letforståeligt sprog. Måske har du allerede kendskab til IT-branchen eller forskningsverdenen  
 Har dokumenteret erfaring med formidling på dansk og engelsk, og også meget gerne med forskningsformidling og/eller information om digital infrastruktur  
 Har erfaring med informationsarkitektur og opsætning af informationsstruktur og navigering på websites, SEO og informationsflow  
 Kan lide en hverdag med mange forskellige aktiviteter, hvor du arbejder selvstændigt, tager initiativ og ansvar og følger aktiviteterne til dørs  
 Arbejder godt sammen med mange mennesker med forskellig faglig baggrund og aktivt tager kontakt til alle relevante parter i forbindelse med dine historier og opgaver.  
 
 
 DeiC 
 
 DeiC er en juridisk enhed under Uddannelses- og Forskningsministeriet, hvor alle medarbejdere er ansat på Danmarks Tekniske Universitet (DTU), der varetager en række administrative funktioner for os. Vi er en lille organisation med under 20 ansatte og er fysisk placeret på kontorer på henholdsvis DTU, Aarhus Universitet og enkelte andre lokationer. Vi er vant til at arbejde sammen på tværs via digitale platforme.  
 
 Du bliver en del af DeiC's sekretariat, der består af administrationen og kommunikationsteamet.  
 
 Løn og ansættelsesvilkår 
 
 Løn- og ansættelsesvilkår i henhold til overenskomst for akademikere i staten. Du indplaceres i henhold til dine kvalifikationer.  
 
 Stillingen er på 37 timer og ønskes besat hurtigst muligt.  
 
 Arbejdssted er i DeiCs lokaler på DTU Campus i Lyngby.  
 
 Ansøgning og kontakt 
 
 Vi skal modtage din online ansøgning senest den 30. maj 2022. Åbn linket ""Ansøg online"", hvor du udfylder ansøgningsformularen samt vedhæfter motiveret ansøgning, CV og eksamensbeviser.  
 
 Ønsker du flere oplysninger om stillingen, er du velkommen til at kontakte direktør Gitte Kudsk, på telefon 24 80 12 07.  
 
 Du kan læse nærmere om DeiC på vores hjemmeside:  https://www.deic.dk/   
 
 Alle interesserede uanset alder, køn, handicap, race, religion eller etnisk tilhørsforhold, opfordres til at søge stillingen.  
 
 Teknologi for mennesker 
 
 DTU udvikler teknologi for mennesker. Med vores forskning og uddannelser i international topklasse er vi med til at skabe en bedre verden, og vi bidrager til løsningen af de globale udfordringer formuleret i FN's 17 verdensmål for en bæredygtig udvikling. H.C. Ørsted grundlagde DTU i 1829 med en klar vision om at udvikle og nyttiggøre naturvidenskab og teknisk videnskab til gavn for samfundet. Den vision lever den dag i dag. DTU har 13.400 studerende og 5.800 ansatte. Vi arbejder i en international atmosfære og har et inkluderende, udviklende og uformelt arbejdsmiljø. DTU har campusser i hele Danmark og i Grønland og samarbejder med de bedste universiteter verden over.","https://www.google.dk/maps/place/Anker+Engelunds+Vej+101,2800,+Kongens+Lyngby/",30060946,False,False,,False
