summary_AutomatchType,summary_Abroad,summary_Weight,summary_Title,summary_JobHeadline,summary_Presentation,summary_HiringOrgName,summary_WorkPlaceAddress,summary_WorkPlacePostalCode,summary_WorkPlaceCity,summary_WorkPlaceOtherAddress,summary_WorkPlaceAbroad,summary_WorkPlaceNotStatic,summary_UseWorkPlaceAddressForJoblog,summary_PostingCreated,summary_LastDateApplication,summary_FormattedLastDateApplication,summary_AssignmentStartDate,summary_IsHotjob,summary_IsExternal,summary_Url,summary_Region,summary_Municipality,summary_Country,summary_PostalCode,summary_PostalCodeName,summary_JobAnnouncementType,summary_EmploymentType,summary_WorkHours,summary_OccupationArea,summary_OccupationGroup,summary_Occupation,summary_Location_Latitude,summary_Location_Longitude,summary_JoblogWorkTime_WorkHour,summary_JoblogWorkTime_DailyWorkTime,summary_WorkplaceID,summary_OrganisationId,summary_HiringOrgCVR,summary_UserLoggedIn,summary_AnonymousEmployer,summary_ShareUrl,summary_DetailsUrl,summary_JobLogUrl,summary_HasLocationValues,summary_ID,summary_Latitude,summary_Longitude,details_WorkSchedule,details_WorkConditions,details_EmploymentTypes,details_WorkPlace_Name,details_WorkPlace_Address_AddressLine,details_WorkPlace_Address_Country_Id,details_WorkPlace_Address_Country_Name,details_WorkPlace_Address_Municipality_Id,details_WorkPlace_Address_Municipality_Name,details_WorkPlace_Address_Region_Id,details_WorkPlace_Address_Region_Name,details_WorkPlace_Address_PostalCode,details_WorkPlace_Address_City,details_WorkPlace_PhoneNumber_Number,details_WorkPlace_PhoneNumber_Type,details_WorkPlace_PhoneNumber_Description,details_WorkPlace_FaxNumber,details_WorkPlace_Email,details_WorkPlace_WebAddress,details_WorkPlace_Description,details_WorkPlace_Logo,details_WorkPlace_WorkPlaceOrganizationNumber,details_WorkPlace_OrganizationNumber,details_WorkPlace_OrganizationDescription,details_JobPositionPosting_Id,details_JobPositionPosting_OriginalJppId,details_JobPositionPosting_HiringOrg_Name,details_JobPositionPosting_HiringOrg_Address_AddressLine,details_JobPositionPosting_HiringOrg_Address_Country_Id,details_JobPositionPosting_HiringOrg_Address_Country_Name,details_JobPositionPosting_HiringOrg_Address_Municipality_Id,details_JobPositionPosting_HiringOrg_Address_Municipality_Name,details_JobPositionPosting_HiringOrg_Address_Region_Id,details_JobPositionPosting_HiringOrg_Address_Region_Name,details_JobPositionPosting_HiringOrg_Address_PostalCode,details_JobPositionPosting_HiringOrg_Address_City,details_JobPositionPosting_HiringOrg_PhoneNumber_Number,details_JobPositionPosting_HiringOrg_PhoneNumber_Type,details_JobPositionPosting_HiringOrg_PhoneNumber_Description,details_JobPositionPosting_HiringOrg_FaxNumber,details_JobPositionPosting_HiringOrg_Email,details_JobPositionPosting_HiringOrg_WebAddress,details_JobPositionPosting_HiringOrg_Description,details_JobPositionPosting_HiringOrg_Logo,details_JobPositionPosting_HiringOrg_WorkPlaceOrganizationNumber,details_JobPositionPosting_HiringOrg_OrganizationNumber,details_JobPositionPosting_HiringOrg_OrganizationDescription,details_JobPositionPosting_RecruitingCompany,details_JobPositionPosting_PublicationStartDate,details_JobPositionPosting_PublicationEndDate,details_JobPositionPosting_JobPositionInformation_PositionTitle,details_JobPositionPosting_JobPositionInformation_Purpose,details_JobPositionPosting_JobPositionInformation_WorkLocation_AddressLine,details_JobPositionPosting_JobPositionInformation_WorkLocation_Country_Id,details_JobPositionPosting_JobPositionInformation_WorkLocation_Country_Name,details_JobPositionPosting_JobPositionInformation_WorkLocation_Municipality_Id,details_JobPositionPosting_JobPositionInformation_WorkLocation_Municipality_Name,details_JobPositionPosting_JobPositionInformation_WorkLocation_Region_Id,details_JobPositionPosting_JobPositionInformation_WorkLocation_Region_Name,details_JobPositionPosting_JobPositionInformation_WorkLocation_PostalCode,details_JobPositionPosting_JobPositionInformation_WorkLocation_City,details_JobPositionPosting_JobPositionInformation_EmploymentType,details_JobPositionPosting_JobPositionInformation_WeeklyWorkHours_TypeId,details_JobPositionPosting_JobPositionInformation_WeeklyWorkHours_TypeName,details_JobPositionPosting_JobPositionInformation_WeeklyWorkHours_Description,details_JobPositionPosting_JobPositionInformation_CompensationDescription,details_JobPositionPosting_JobPositionInformation_NumberToFill,details_JobPositionPosting_JobPositionInformation_DriverLicense,details_JobPositionPosting_JobPositionInformation_Occupation_DiscoWeb,details_JobPositionPosting_JobPositionInformation_Occupation_AlternateNames,details_JobPositionPosting_JobPositionInformation_Occupation_GroupId,details_JobPositionPosting_JobPositionInformation_Occupation_AreaId,details_JobPositionPosting_JobPositionInformation_Occupation_Id,details_JobPositionPosting_JobPositionInformation_Occupation_Name,details_JobPositionPosting_JobPositionInformation_IsGovernmentHiring,details_JobPositionPosting_JobPositionInformation_JppContacts,details_JobPositionPosting_JobPositionInformation_EmploymentDate,details_JobPositionPosting_IsRecruitmentOfForeignNationals,details_JobPositionPosting_IsWorkInDenmark,details_JobPositionPosting_IsAnonymousEmployer,details_JobPositionPosting_IsDisabilityFriendly,details_JobPositionPosting_JppType,details_JobPositionPosting_ApplicationDetails_WorkHourMax,details_JobPositionPosting_ApplicationDetails_WorkHourMin,details_JobPositionPosting_ApplicationDetails_DailyWorkTimeWeekend,details_JobPositionPosting_ApplicationDetails_DailyWorkTimeNight,details_JobPositionPosting_ApplicationDetails_DailyWorkTimeEvening,details_JobPositionPosting_ApplicationDetails_DailyWorkTimeDay,details_JobPositionPosting_ApplicationDetails_ReferenceText,details_JobPositionPosting_ApplicationDetails_RemarksToApplicant,details_JobPositionPosting_ApplicationDetails_ByEmail,details_JobPositionPosting_ApplicationDetails_ByPhone,details_JobPositionPosting_ApplicationDetails_ApplyViaUrl,details_JobPositionPosting_ApplicationDetails_ReplyInWriting,details_JobPositionPosting_ApplicationDetails_ApplicationDeadlineDate,details_JobPositionPosting_ContactAuthorityPhoneNumber_Number,details_JobPositionPosting_ContactAuthorityPhoneNumber_Type,details_JobPositionPosting_ContactAuthorityPhoneNumber_Description,details_JobPositionPosting_Status,details_LogoUrl,details_Address,details_ShowMap,details_ShowShareButtonJobLog,details_JobLogUrl,details_JobLogTemplateModel_Identifier,details_JobLogTemplateModel_UseWorkPlaceAddressForJoblog,details_JobLogTemplateModel_Category,details_JobLogTemplateModel_CvCustomerIdentifier,details_JobLogTemplateModel_JobSeekingStatus,details_JobLogTemplateModel_Title,details_JobLogTemplateModel_IsApplicationSourceRequired,details_JobLogTemplateModel_ApplicationSource,details_JobLogTemplateModel_IsWeeklyWorkTimeRequired,details_JobLogTemplateModel_WeeklyWorkTime,details_JobLogTemplateModel_HoursPerWeek,details_JobLogTemplateModel_JobnetJobPostingIdentifier,details_JobLogTemplateModel_JobAdDocument_Title,details_JobLogTemplateModel_JobAdDocument_Identifier,details_JobLogTemplateModel_JobAdDocument_IsDeletedBySystem,details_JobLogTemplateModel_JobAdDocument_IsDeletedByUser,details_JobLogTemplateModel_JobAdFile,details_JobLogTemplateModel_Company_JobLogEntryCategory,details_JobLogTemplateModel_Company_ShowAddressFieldsEvenIfEmpty,details_JobLogTemplateModel_Company_Name,details_JobLogTemplateModel_Company_Address,details_JobLogTemplateModel_Company_Country,details_JobLogTemplateModel_Company_EmploymentAreaID,details_JobLogTemplateModel_Company_PostCode,details_JobLogTemplateModel_Company_IsCountryAndTownAndPostCodeEmpty,details_JobLogTemplateModel_Company_IsTownAndPostCodeEmpty,details_JobLogTemplateModel_Company_IsCountryDanmark,details_JobLogTemplateModel_Company_Town,details_JobLogTemplateModel_Company_ContactPerson,details_JobLogTemplateModel_Company_Phone,details_JobLogTemplateModel_Company_Email,details_JobLogTemplateModel_Company_Latitude,details_JobLogTemplateModel_Company_Longitude,details_JobLogTemplateModel_Company_DailyTravelTimeInMinutes,details_JobLogTemplateModel_Company_DistanceToCompanyInMeters,details_JobLogTemplateModel_Company_IsCreateMode,details_JobLogTemplateModel_TypeOfSubmission,details_JobLogTemplateModel_SubmissionDate,details_JobLogTemplateModel_SubmissionDateFormatted,details_JobLogTemplateModel_SubmissionDateTiks,details_JobLogTemplateModel_IsSubmissionDateRequired,details_JobLogTemplateModel_Status,details_JobLogTemplateModel_DateCreatedFormatted,details_JobLogTemplateModel_DateCreated,details_JobLogTemplateModel_DateModifiedFormatted,details_JobLogTemplateModel_DateModified,details_JobLogTemplateModel_LastModifiedDateTiks,details_JobLogTemplateModel_DateClosed,details_JobLogTemplateModel_JobApplicationDocument_Title,details_JobLogTemplateModel_JobApplicationDocument_Identifier,details_JobLogTemplateModel_JobApplicationDocument_IsDeletedBySystem,details_JobLogTemplateModel_JobApplicationDocument_IsDeletedByUser,details_JobLogTemplateModel_CvDocument_Title,details_JobLogTemplateModel_CvDocument_Identifier,details_JobLogTemplateModel_CvDocument_IsDeletedBySystem,details_JobLogTemplateModel_CvDocument_IsDeletedByUser,details_JobLogTemplateModel_JobApplicationFile,details_JobLogTemplateModel_CvFile,details_JobLogTemplateModel_SubmissionDeadlineDate,details_JobLogTemplateModel_IsPersisted,details_JobLogTemplateModel_ServerValidationErrors,details_JobLogTemplateModel_HasServerValidationErrors,details_JoblogWorkTime_WorkHour,details_JoblogWorkTime_DailyWorkTime,details_Place,details_OpenPrintDialog,details_WorkPlaceInfoText,details_JobCenterContactDetails,details_WorkPlaceDescriptionText,details_FavoriteText,details_IsFavorite,details_ShowFavorite,details_MetaOgTextForSharing,details_DescriptionForSharing,details_TitleForSharing,details_RutePlan,details_FormattedPurpose,details_MapUrl,details_OrganizationNumber,details_ShowSearchJobButton,details_ShowPrint,details_BackToFindWorkButtonUrl,isExternal
0,False,1,Hands-on Økonomichef til en vækstvirksomhed,Hands-on Økonomichef til en vækstvirksomhed,"Intelligent Systems søger en Økonomichef i en nyetableret stilling. Vi har så godt gang i forretningen, at vi ønsker at etablere en mere dedikeret økonomifunktion.
Du skal kunne lide at etab",INTELLIGENT SYSTEMS A/S,Havnevej 11,9560,Hadsund,False,False,False,True,2022-04-22T00:00:00,2022-06-17T00:00:00,17. juni 2022,0001-01-01T00:00:00,False,False,https://job.jobnet.dk/CV/FindWork/Details/5581888,Nordjylland,Mariagerfjord,Danmark,9560,,,,Fuldtid,Ledelse,Økonomi og finansiering,Økonomichef,56.7138,10.1135,,,59246,58612,29394733,False,False,https://job.jobnet.dk/CV/FindWork/DetailsSocialmedia/5581888,https://job.jobnet.dk/CV/FindWork/Details/5581888,https://job.jobnet.dk/CV/FindWork/Details/5581888,True,5581888,56.7138,10.1135,"{'Id': 1, 'Name': 'Fuldtid'}, {'Id': 16, 'Name': 'Deltid'}","{'Id': 1, 'Name': 'Almindelige vilkår'}, {'Id': 2, 'Name': 'Fleksjob'}, {'Id': 3, 'Name': 'Skånejob'}, {'Id': 4, 'Name': 'Egnet til efterlønnere og seniorer'}, {'Id': 5, 'Name': 'Job med løntilskud'}, {'Id': 6, 'Name': 'Rotationsjob'}, {'Id': 7, 'Name': 'Virksomhedspraktik'}","{'Id': 1, 'Name': 'Fastansættelse'}, {'Id': 16, 'Name': 'Tidsbegrænset ansættelse'}",INTELLIGENT SYSTEMS A/S,Havnevej 11,58,Danmark,846,Mariagerfjord,1,Nordjylland,9560,Hadsund,,0,Primary,,,,"Intelligent Systems er eksperter indenfor softwareudvikling til automatiserede logistikløsninger, f.eks. til bagagesortering i lufthavne, fuldautomatiske lager- og distributionscentre og automatiseret logistik til hospitaler.",59246,1012062970,29394733,"Intelligent Systems er eksperter indenfor softwareudvikling til automatiserede logistikløsninger, f.eks. til bagagesortering i lufthavne, fuldautomatiske lager- og distributionscentre og automatiseret logistik til hospitaler.",5581888,5581888,INTELLIGENT SYSTEMS A/S,Havnevej 11,58,Danmark,846,Mariagerfjord,1,Nordjylland,9560,Hadsund,,0,Primary,,,,"Intelligent Systems er eksperter indenfor softwareudvikling til automatiserede logistikløsninger, f.eks. til bagagesortering i lufthavne, fuldautomatiske lager- og distributionscentre og automatiseret logistik til hospitaler.",59246,1012062970,29394733,"Intelligent Systems er eksperter indenfor softwareudvikling til automatiserede logistikløsninger, f.eks. til bagagesortering i lufthavne, fuldautomatiske lager- og distributionscentre og automatiseret logistik til hospitaler.",,2022-04-22T00:00:00,2022-06-17T00:00:00,Hands-on Økonomichef til en vækstvirksomhed,"Intelligent Systems søger en Økonomichef i en nyetableret stilling. Vi har så godt gang i forretningen, at vi ønsker at etablere en mere dedikeret økonomifunktion. 
 Du skal kunne lide at etablere de rette systemer og processer, der understøtter et stigende krav til handlekraft baseret økonomisk indsigt og transparens.  
 Du skal være indstillet på at være både udførende og strategisk udviklende for funktionen. Du skal også kunne se det udfordrende i at bidrage til udviklingen af et selskab i vækst og bidrage til udvikling af organisationen fra at være en mindre virksomhed, hvor man typisk har haft mere end en kasket på, til en virksomhed, der kan skalere til det flerdobbelte på få år. Du bliver en vigtig brik i at skabe overblik/indsigt i, at vi får en rentabel vækst. 
 Vi går snart i gang med implementeringen af et nyt økonomisystem, som du får muligheden for at præge, og du vil også blive systemejer af ERP-løsningen. 
 Jobbet Jobbet kan beskrives som en Hands-on Økonomichef. Du skal også selv være udøvende indenfor bogholderi, økonomiopgaver samt controlling. Du er derfor en rigtig talknuser, der sætter en ære i kvalitet til rette tid. Du har god fornemmelse for balancen mellem detalje, og hvornår der skal fokuseres på de større linjer. 
 Dine opgaver bliver varierede, og det er vigtigt, at du kan og vil tage ansvar for følgende opgaver, der vil have Økonomichef karakter: 
 
 Udarbejdelse af ledelsesrapportering, herunder månedsregnskab, likviditets-forecast, rapporter og KPI-dashboard til ledelsen. 
 Deltage aktivt i implementeringen af ERP-systemet, så det understøtter virksomhedens forretningsmodel og strategi. 
 Etablere en forbedret praksis for tidsregistrering. 
 Udvikle og drive budget- og forecast processer og dertilhørende værktøjer. 
 Udarbejde business case-analyser til ledelse og bestyrelse. 
 Være en del af ledergruppen og strategisk udvikling. 
 Ansvarlig for udarbejdelse af årsregnskabet, herunder samarbejde med revisor. 
 Være en aktiv del af sikre at Intelligent Systems excellerer i datadrevne beslutninger ved at etablere optimale processer og systemer - timely transparency. 
 
 Andre vigtige opgaver, der mere har karakter af hands-on bogføring, controlling, mv. og kan omfatte: 
 
 Bogføring af ind- og udbetalinger, debitor- og kreditorfakturaer samt afstemning af bankkonti. 
 Løn og personalegoder 
 Vedligeholdelse og udvikling af vores guidelines og fælles kommunikation vedr. budget og regnskabsprocesser 
 
 Du trives i et omskifteligt miljø, der til tider kan være påvirket af travlhed, og du kan holde flere opgaver i gang samtidig. Du er en medspiller med gode samarbejdsevner og bidrager fagligt såvel som socialt i et team. 
 Holdånd Vi lever efter frihed under ansvar, og den store fleksibilitet gør det lettere for os at balancere fritid og arbejdsliv. Vores flade organisationen giver plads til højt til loftet og det er vigtigt, at vi har også har det sjovt. Vi er agile og tilpasser os situationen, så vi tænker kreativt og finder altid løsninger. 
 Vi afholder ofte sociale arrangementer, både i teams og samlet. Det giver en god dynamik, om det er en fælles løbetur, sociale arrangementer med diverse temaer eller den ugentlige fredagsøl.  
 Ud over udfordrende arbejdsopgaver og høj grad af fleksibilitet, kan vi også tilbyde en god frokostordning, sundhedsforsikring samt pensionsordning. 
 Bliv en del af Intelligent Systems holdet Du har erfaring fra en lignende rolle, eller muligvis ser du dette som det næste naturlige skridt i din karriere. Det er en fordel, hvis du har erfaring med MS D365 Business Central samt med etablering i ledelsesrapportering via Power BI. En forståelse for data, som en værdifuld asset og et ønske om at udvikle i arbejdet med data er væsentlig for et match.  
 Du er imødekommende og kan begå dig både på dansk og engelsk i skrift og tale. Det primære arbejdssted bliver Hadsund, men der kan også være dage, hvor der arbejdes i Aalborg. 
 Vi indkalder løbende kandidater til samtale, og vi glæder os til at modtage din ansøgning og CV på job@intelligentsystems.dk. 
 Har du spørgsmål til stillingen,   er du velkommen til at kontakte Niki Nicolas Grigoriou på 2045 6039 
 Om Intelligent Systems Intelligent Systems er førende eksperter indenfor softwareudvikling til automatiserede logistikløsninger og er internationalt kendt. 80-90% af opgaver er internationale opgaver for store danske og internationale kunder og partnere. Der bliver løst opgaver på alle kontinenter undtagen Antarktis.  
 Intelligent Systems har som mål at demokratisere automatisering og robotteknologi – og gøre det nemt at anvende robotter og digitalisering, så fabrikker, produktion, lager og distributionscentre bliver “smarte” og fuldautomatiske. 
 Intelligent Systems har taget nogle store skridt og kerneforretningen vokser, hvor vi både er underleverandør for verdens største fabrikanter af automatiseret logistik-turnkey-løsninger, og leverandør til flere af de største danske industrivirksomheder. 
 Vi er placeret i Hadsund samt Aalborg og er mere end 50 medarbejdere og stadig flere på vej ind.",Havnevej 11,58,Danmark,846,Mariagerfjord,1,Nordjylland,9560,Hadsund,1,1,Fuldtid,None,None,1,"{'DriversLicenceType': 11, 'Name': 'A10', 'Description': 'Villig til at bruge egen bil i jobbet'}, {'DriversLicenceType': 3, 'Name': 'B', 'Description': 'Almindelig bil'}",0,,0,0,0,,False,"{'Id': 7925932, 'Email': 'job@intelligentsystems.dk', 'FaxNumber': None, 'PersonName': 'Niki Grigoriou', 'FirstName': 'Niki', 'LastName': 'Grigoriou', 'PositionTitle': 'CEO', 'PhoneNumbers': []}",,False,False,False,False,4,,,False,False,False,False,,,job@intelligentsystems.dk,,,False,2022-06-17T00:00:00,,0,Primary,7,/CV/FindWork/GetLogo?JobAdId=5581888&WorkPlace=59246&Organisation=29394733,"Havnevej 11,9560, Hadsund",True,False,/CV/Jobseeking/JobLog/CreateJobSearch?JobnetJobPostingIdentifier=5581888&Company.Name=INTELLIGENT SYSTEMS A/S&SubmissionDeadlineDate=2022-6-17&Title=Hands-on Økonomichef til en vækstvirksomhed&WeeklyWorkTime=1,00000000-0000-0000-0000-000000000000,False,0,,,Hands-on Økonomichef til en vækstvirksomhed,True,,True,1,,5581888,,,False,False,,0,False,INTELLIGENT SYSTEMS A/S,Havnevej 11,,,9560,False,False,False,Hadsund,Niki Grigoriou,,job@intelligentsystems.dk,,,,,False,,2022-06-17T00:00:00,,0,False,0,,,,,0,,,,False,False,,,False,False,,,,False,,False,,,Arbejdspladsen ligger i Mariagerfjord kommune,False,INTELLIGENT SYSTEMS A/S,,"Intelligent Systems er eksperter indenfor softwareudvikling til automatiserede logistikløsninger, f.eks. til bagagesortering i lufthavne, fuldautomatiske lager- og distributionscentre og automatiseret logistik til hospitaler.",,False,False,"Intelligent Systems s&oslash;ger en &Oslash;konomichef i en nyetableret stilling. Vi har s&aring; godt gang i forretningen, at vi &oslash;nsker at etablere en mere dedikeret &oslash;konomifunktion.
Du skal kunne lide at etablere de rette systemer og processer, der underst&oslash;tter et stigende krav til handlekraft baseret &oslash;konomisk indsigt","""Intelligent Systems s\u0026oslash;ger en \u0026Oslash;konomichef i en nyetableret stilling. Vi har s\u0026aring; godt gang i forretningen, at vi \u0026oslash;nsker at etablere en mere dedikeret \u0026oslash;konomifunktion.\nDu skal kunne lide at etablere de rette systemer og processer, der underst\u0026oslash;tter et stigende krav til handlekraft baseret \u0026oslash;konomisk indsigt""","""Hands-on Økonomichef til en vækstvirksomhed""","https://www.google.dk/maps/dir//Havnevej+11,9560,+Hadsund/","Intelligent Systems søger en Økonomichef i en nyetableret stilling. Vi har så godt gang i forretningen, at vi ønsker at etablere en mere dedikeret økonomifunktion. 
 Du skal kunne lide at etablere de rette systemer og processer, der understøtter et stigende krav til handlekraft baseret økonomisk indsigt og transparens.  
 Du skal være indstillet på at være både udførende og strategisk udviklende for funktionen. Du skal også kunne se det udfordrende i at bidrage til udviklingen af et selskab i vækst og bidrage til udvikling af organisationen fra at være en mindre virksomhed, hvor man typisk har haft mere end en kasket på, til en virksomhed, der kan skalere til det flerdobbelte på få år. Du bliver en vigtig brik i at skabe overblik/indsigt i, at vi får en rentabel vækst. 
 Vi går snart i gang med implementeringen af et nyt økonomisystem, som du får muligheden for at præge, og du vil også blive systemejer af ERP-løsningen. 
 Jobbet Jobbet kan beskrives som en Hands-on Økonomichef. Du skal også selv være udøvende indenfor bogholderi, økonomiopgaver samt controlling. Du er derfor en rigtig talknuser, der sætter en ære i kvalitet til rette tid. Du har god fornemmelse for balancen mellem detalje, og hvornår der skal fokuseres på de større linjer. 
 Dine opgaver bliver varierede, og det er vigtigt, at du kan og vil tage ansvar for følgende opgaver, der vil have Økonomichef karakter: 
 
 Udarbejdelse af ledelsesrapportering, herunder månedsregnskab, likviditets-forecast, rapporter og KPI-dashboard til ledelsen. 
 Deltage aktivt i implementeringen af ERP-systemet, så det understøtter virksomhedens forretningsmodel og strategi. 
 Etablere en forbedret praksis for tidsregistrering. 
 Udvikle og drive budget- og forecast processer og dertilhørende værktøjer. 
 Udarbejde business case-analyser til ledelse og bestyrelse. 
 Være en del af ledergruppen og strategisk udvikling. 
 Ansvarlig for udarbejdelse af årsregnskabet, herunder samarbejde med revisor. 
 Være en aktiv del af sikre at Intelligent Systems excellerer i datadrevne beslutninger ved at etablere optimale processer og systemer - timely transparency. 
 
 Andre vigtige opgaver, der mere har karakter af hands-on bogføring, controlling, mv. og kan omfatte: 
 
 Bogføring af ind- og udbetalinger, debitor- og kreditorfakturaer samt afstemning af bankkonti. 
 Løn og personalegoder 
 Vedligeholdelse og udvikling af vores guidelines og fælles kommunikation vedr. budget og regnskabsprocesser 
 
 Du trives i et omskifteligt miljø, der til tider kan være påvirket af travlhed, og du kan holde flere opgaver i gang samtidig. Du er en medspiller med gode samarbejdsevner og bidrager fagligt såvel som socialt i et team. 
 Holdånd Vi lever efter frihed under ansvar, og den store fleksibilitet gør det lettere for os at balancere fritid og arbejdsliv. Vores flade organisationen giver plads til højt til loftet og det er vigtigt, at vi har også har det sjovt. Vi er agile og tilpasser os situationen, så vi tænker kreativt og finder altid løsninger. 
 Vi afholder ofte sociale arrangementer, både i teams og samlet. Det giver en god dynamik, om det er en fælles løbetur, sociale arrangementer med diverse temaer eller den ugentlige fredagsøl.  
 Ud over udfordrende arbejdsopgaver og høj grad af fleksibilitet, kan vi også tilbyde en god frokostordning, sundhedsforsikring samt pensionsordning. 
 Bliv en del af Intelligent Systems holdet Du har erfaring fra en lignende rolle, eller muligvis ser du dette som det næste naturlige skridt i din karriere. Det er en fordel, hvis du har erfaring med MS D365 Business Central samt med etablering i ledelsesrapportering via Power BI. En forståelse for data, som en værdifuld asset og et ønske om at udvikle i arbejdet med data er væsentlig for et match.  
 Du er imødekommende og kan begå dig både på dansk og engelsk i skrift og tale. Det primære arbejdssted bliver Hadsund, men der kan også være dage, hvor der arbejdes i Aalborg. 
 Vi indkalder løbende kandidater til samtale, og vi glæder os til at modtage din ansøgning og CV på job@intelligentsystems.dk. 
 Har du spørgsmål til stillingen,   er du velkommen til at kontakte Niki Nicolas Grigoriou på 2045 6039 
 Om Intelligent Systems Intelligent Systems er førende eksperter indenfor softwareudvikling til automatiserede logistikløsninger og er internationalt kendt. 80-90% af opgaver er internationale opgaver for store danske og internationale kunder og partnere. Der bliver løst opgaver på alle kontinenter undtagen Antarktis.  
 Intelligent Systems har som mål at demokratisere automatisering og robotteknologi – og gøre det nemt at anvende robotter og digitalisering, så fabrikker, produktion, lager og distributionscentre bliver “smarte” og fuldautomatiske. 
 Intelligent Systems har taget nogle store skridt og kerneforretningen vokser, hvor vi både er underleverandør for verdens største fabrikanter af automatiseret logistik-turnkey-løsninger, og leverandør til flere af de største danske industrivirksomheder. 
 Vi er placeret i Hadsund samt Aalborg og er mere end 50 medarbejdere og stadig flere på vej ind.","https://www.google.dk/maps/place/Havnevej+11,9560,+Hadsund/",29394733,False,False,,False
