summary_AutomatchType,summary_Abroad,summary_Weight,summary_Title,summary_JobHeadline,summary_Presentation,summary_HiringOrgName,summary_WorkPlaceAddress,summary_WorkPlacePostalCode,summary_WorkPlaceCity,summary_WorkPlaceOtherAddress,summary_WorkPlaceAbroad,summary_WorkPlaceNotStatic,summary_UseWorkPlaceAddressForJoblog,summary_PostingCreated,summary_LastDateApplication,summary_FormattedLastDateApplication,summary_AssignmentStartDate,summary_IsHotjob,summary_IsExternal,summary_Url,summary_Region,summary_Municipality,summary_Country,summary_PostalCode,summary_PostalCodeName,summary_JobAnnouncementType,summary_EmploymentType,summary_WorkHours,summary_OccupationArea,summary_OccupationGroup,summary_Occupation,summary_Location_Latitude,summary_Location_Longitude,summary_JoblogWorkTime_WorkHour,summary_JoblogWorkTime_DailyWorkTime,summary_WorkplaceID,summary_OrganisationId,summary_HiringOrgCVR,summary_UserLoggedIn,summary_AnonymousEmployer,summary_ShareUrl,summary_DetailsUrl,summary_JobLogUrl,summary_HasLocationValues,summary_ID,summary_Latitude,summary_Longitude,details_WorkSchedule,details_WorkConditions,details_EmploymentTypes,details_WorkPlace_Name,details_WorkPlace_Address_AddressLine,details_WorkPlace_Address_Country_Id,details_WorkPlace_Address_Country_Name,details_WorkPlace_Address_Municipality_Id,details_WorkPlace_Address_Municipality_Name,details_WorkPlace_Address_Region_Id,details_WorkPlace_Address_Region_Name,details_WorkPlace_Address_PostalCode,details_WorkPlace_Address_City,details_WorkPlace_PhoneNumber_Number,details_WorkPlace_PhoneNumber_Type,details_WorkPlace_PhoneNumber_Description,details_WorkPlace_FaxNumber,details_WorkPlace_Email,details_WorkPlace_WebAddress,details_WorkPlace_Description,details_WorkPlace_Logo,details_WorkPlace_WorkPlaceOrganizationNumber,details_WorkPlace_OrganizationNumber,details_WorkPlace_OrganizationDescription,details_JobPositionPosting_Id,details_JobPositionPosting_OriginalJppId,details_JobPositionPosting_HiringOrg_Name,details_JobPositionPosting_HiringOrg_Address_AddressLine,details_JobPositionPosting_HiringOrg_Address_Country_Id,details_JobPositionPosting_HiringOrg_Address_Country_Name,details_JobPositionPosting_HiringOrg_Address_Municipality_Id,details_JobPositionPosting_HiringOrg_Address_Municipality_Name,details_JobPositionPosting_HiringOrg_Address_Region_Id,details_JobPositionPosting_HiringOrg_Address_Region_Name,details_JobPositionPosting_HiringOrg_Address_PostalCode,details_JobPositionPosting_HiringOrg_Address_City,details_JobPositionPosting_HiringOrg_PhoneNumber_Number,details_JobPositionPosting_HiringOrg_PhoneNumber_Type,details_JobPositionPosting_HiringOrg_PhoneNumber_Description,details_JobPositionPosting_HiringOrg_FaxNumber,details_JobPositionPosting_HiringOrg_Email,details_JobPositionPosting_HiringOrg_WebAddress,details_JobPositionPosting_HiringOrg_Description,details_JobPositionPosting_HiringOrg_Logo,details_JobPositionPosting_HiringOrg_WorkPlaceOrganizationNumber,details_JobPositionPosting_HiringOrg_OrganizationNumber,details_JobPositionPosting_HiringOrg_OrganizationDescription,details_JobPositionPosting_RecruitingCompany,details_JobPositionPosting_PublicationStartDate,details_JobPositionPosting_PublicationEndDate,details_JobPositionPosting_JobPositionInformation_PositionTitle,details_JobPositionPosting_JobPositionInformation_Purpose,details_JobPositionPosting_JobPositionInformation_WorkLocation_AddressLine,details_JobPositionPosting_JobPositionInformation_WorkLocation_Country_Id,details_JobPositionPosting_JobPositionInformation_WorkLocation_Country_Name,details_JobPositionPosting_JobPositionInformation_WorkLocation_Municipality_Id,details_JobPositionPosting_JobPositionInformation_WorkLocation_Municipality_Name,details_JobPositionPosting_JobPositionInformation_WorkLocation_Region_Id,details_JobPositionPosting_JobPositionInformation_WorkLocation_Region_Name,details_JobPositionPosting_JobPositionInformation_WorkLocation_PostalCode,details_JobPositionPosting_JobPositionInformation_WorkLocation_City,details_JobPositionPosting_JobPositionInformation_EmploymentType,details_JobPositionPosting_JobPositionInformation_WeeklyWorkHours_TypeId,details_JobPositionPosting_JobPositionInformation_WeeklyWorkHours_TypeName,details_JobPositionPosting_JobPositionInformation_WeeklyWorkHours_Description,details_JobPositionPosting_JobPositionInformation_CompensationDescription,details_JobPositionPosting_JobPositionInformation_NumberToFill,details_JobPositionPosting_JobPositionInformation_DriverLicense,details_JobPositionPosting_JobPositionInformation_Occupation_DiscoWeb,details_JobPositionPosting_JobPositionInformation_Occupation_AlternateNames,details_JobPositionPosting_JobPositionInformation_Occupation_GroupId,details_JobPositionPosting_JobPositionInformation_Occupation_AreaId,details_JobPositionPosting_JobPositionInformation_Occupation_Id,details_JobPositionPosting_JobPositionInformation_Occupation_Name,details_JobPositionPosting_JobPositionInformation_IsGovernmentHiring,details_JobPositionPosting_JobPositionInformation_JppContacts,details_JobPositionPosting_JobPositionInformation_EmploymentDate,details_JobPositionPosting_IsRecruitmentOfForeignNationals,details_JobPositionPosting_IsWorkInDenmark,details_JobPositionPosting_IsAnonymousEmployer,details_JobPositionPosting_IsDisabilityFriendly,details_JobPositionPosting_JppType,details_JobPositionPosting_ApplicationDetails_WorkHourMax,details_JobPositionPosting_ApplicationDetails_WorkHourMin,details_JobPositionPosting_ApplicationDetails_DailyWorkTimeWeekend,details_JobPositionPosting_ApplicationDetails_DailyWorkTimeNight,details_JobPositionPosting_ApplicationDetails_DailyWorkTimeEvening,details_JobPositionPosting_ApplicationDetails_DailyWorkTimeDay,details_JobPositionPosting_ApplicationDetails_ReferenceText,details_JobPositionPosting_ApplicationDetails_RemarksToApplicant,details_JobPositionPosting_ApplicationDetails_ByEmail,details_JobPositionPosting_ApplicationDetails_ByPhone,details_JobPositionPosting_ApplicationDetails_ApplyViaUrl,details_JobPositionPosting_ApplicationDetails_ReplyInWriting,details_JobPositionPosting_ApplicationDetails_ApplicationDeadlineDate,details_JobPositionPosting_ContactAuthorityPhoneNumber_Number,details_JobPositionPosting_ContactAuthorityPhoneNumber_Type,details_JobPositionPosting_ContactAuthorityPhoneNumber_Description,details_JobPositionPosting_Status,details_LogoUrl,details_Address,details_ShowMap,details_ShowShareButtonJobLog,details_JobLogUrl,details_JobLogTemplateModel_Identifier,details_JobLogTemplateModel_UseWorkPlaceAddressForJoblog,details_JobLogTemplateModel_Category,details_JobLogTemplateModel_CvCustomerIdentifier,details_JobLogTemplateModel_JobSeekingStatus,details_JobLogTemplateModel_Title,details_JobLogTemplateModel_IsApplicationSourceRequired,details_JobLogTemplateModel_ApplicationSource,details_JobLogTemplateModel_IsWeeklyWorkTimeRequired,details_JobLogTemplateModel_WeeklyWorkTime,details_JobLogTemplateModel_HoursPerWeek,details_JobLogTemplateModel_JobnetJobPostingIdentifier,details_JobLogTemplateModel_JobAdDocument_Title,details_JobLogTemplateModel_JobAdDocument_Identifier,details_JobLogTemplateModel_JobAdDocument_IsDeletedBySystem,details_JobLogTemplateModel_JobAdDocument_IsDeletedByUser,details_JobLogTemplateModel_JobAdFile,details_JobLogTemplateModel_Company_JobLogEntryCategory,details_JobLogTemplateModel_Company_ShowAddressFieldsEvenIfEmpty,details_JobLogTemplateModel_Company_Name,details_JobLogTemplateModel_Company_Address,details_JobLogTemplateModel_Company_Country,details_JobLogTemplateModel_Company_EmploymentAreaID,details_JobLogTemplateModel_Company_PostCode,details_JobLogTemplateModel_Company_IsCountryAndTownAndPostCodeEmpty,details_JobLogTemplateModel_Company_IsTownAndPostCodeEmpty,details_JobLogTemplateModel_Company_IsCountryDanmark,details_JobLogTemplateModel_Company_Town,details_JobLogTemplateModel_Company_ContactPerson,details_JobLogTemplateModel_Company_Phone,details_JobLogTemplateModel_Company_Email,details_JobLogTemplateModel_Company_Latitude,details_JobLogTemplateModel_Company_Longitude,details_JobLogTemplateModel_Company_DailyTravelTimeInMinutes,details_JobLogTemplateModel_Company_DistanceToCompanyInMeters,details_JobLogTemplateModel_Company_IsCreateMode,details_JobLogTemplateModel_TypeOfSubmission,details_JobLogTemplateModel_SubmissionDate,details_JobLogTemplateModel_SubmissionDateFormatted,details_JobLogTemplateModel_SubmissionDateTiks,details_JobLogTemplateModel_IsSubmissionDateRequired,details_JobLogTemplateModel_Status,details_JobLogTemplateModel_DateCreatedFormatted,details_JobLogTemplateModel_DateCreated,details_JobLogTemplateModel_DateModifiedFormatted,details_JobLogTemplateModel_DateModified,details_JobLogTemplateModel_LastModifiedDateTiks,details_JobLogTemplateModel_DateClosed,details_JobLogTemplateModel_JobApplicationDocument_Title,details_JobLogTemplateModel_JobApplicationDocument_Identifier,details_JobLogTemplateModel_JobApplicationDocument_IsDeletedBySystem,details_JobLogTemplateModel_JobApplicationDocument_IsDeletedByUser,details_JobLogTemplateModel_CvDocument_Title,details_JobLogTemplateModel_CvDocument_Identifier,details_JobLogTemplateModel_CvDocument_IsDeletedBySystem,details_JobLogTemplateModel_CvDocument_IsDeletedByUser,details_JobLogTemplateModel_JobApplicationFile,details_JobLogTemplateModel_CvFile,details_JobLogTemplateModel_SubmissionDeadlineDate,details_JobLogTemplateModel_IsPersisted,details_JobLogTemplateModel_ServerValidationErrors,details_JobLogTemplateModel_HasServerValidationErrors,details_JoblogWorkTime_WorkHour,details_JoblogWorkTime_DailyWorkTime,details_Place,details_OpenPrintDialog,details_WorkPlaceInfoText,details_JobCenterContactDetails,details_WorkPlaceDescriptionText,details_FavoriteText,details_IsFavorite,details_ShowFavorite,details_MetaOgTextForSharing,details_DescriptionForSharing,details_TitleForSharing,details_RutePlan,details_FormattedPurpose,details_MapUrl,details_OrganizationNumber,details_ShowSearchJobButton,details_ShowPrint,details_BackToFindWorkButtonUrl,isExternal
0,False,1,"Kirketjener Taksigelseskirken, Østerbro","Kirketjener Taksigelseskirken, Østerbro","Taksigelseskirken søger en engageret kirketjener, der ønsker at tage del i at videreudvikle den lokale folkekirke. Taksigelseskirken er en spændende bykirke lige ved Vibenshus Metro. Vi har mange b",TAKSIGELSESKIRKENS KONTOR,Jagtvej 165,2100,København Ø,False,False,False,True,2022-04-25T00:00:00,2022-05-12T00:00:00,12. maj 2022,0001-01-01T00:00:00,False,False,https://job.jobnet.dk/CV/FindWork/Details/5582554,Hovedstaden og Bornholm,København,Danmark,2100,,,,Fuldtid,"Pædagogisk, socialt og kirkeligt arbejde",Religiøst arbejde,Kirketjener,55.7054,12.5608,,"Dag, aften, weekend",144117,125792,66083810,False,False,https://job.jobnet.dk/CV/FindWork/DetailsSocialmedia/5582554,https://job.jobnet.dk/CV/FindWork/Details/5582554,https://job.jobnet.dk/CV/FindWork/Details/5582554,True,5582554,55.7054,12.5608,"{'Id': 1, 'Name': 'Fuldtid'}, {'Id': 16, 'Name': 'Deltid'}","{'Id': 1, 'Name': 'Almindelige vilkår'}, {'Id': 2, 'Name': 'Fleksjob'}, {'Id': 3, 'Name': 'Skånejob'}, {'Id': 4, 'Name': 'Egnet til efterlønnere og seniorer'}, {'Id': 5, 'Name': 'Job med løntilskud'}, {'Id': 6, 'Name': 'Rotationsjob'}, {'Id': 7, 'Name': 'Virksomhedspraktik'}","{'Id': 1, 'Name': 'Fastansættelse'}, {'Id': 16, 'Name': 'Tidsbegrænset ansættelse'}",TAKSIGELSESKIRKENS KONTOR,Jagtvej 165,58,Danmark,101,København,4,"Hovedstaden, Sjælland og Bornholm",2100,København Ø,,0,Primary,,,,None,,1002224808,66083810,None,5582554,5582554,TAKSIGELSESKIRKENS KONTOR,Jagtvej 165,58,Danmark,101,København,4,"Hovedstaden, Sjælland og Bornholm",2100,København Ø,,0,Primary,,,,None,,1002224808,66083810,None,,2022-04-25T00:00:00,2022-05-12T00:00:00,"Kirketjener Taksigelseskirken, Østerbro","Taksigelseskirken søger en engageret kirketjener, der ønsker at tage del i at videreudvikle den lokale folkekirke. Taksigelseskirken er en spændende bykirke lige ved Vibenshus Metro. Vi har mange børnefamilier og ældre brugere af kirken, men også et stort koncertpublikum og pop-up events. 
 Kirkens nuværende kirketjener har igennem de sidste mange år serviceret kirkens brugere på bedste vis, men ønsker nu at gå på pension. Vi er derfor på udkik efter en positiv, servicemindet person, der gerne løser alle forhåndenværende kirketjeneropgaver i samarbejde med kollegaer og daglig leder. 
 Det primære arbejdssted vil være i Taksigelseskirken, som samarbejder med Lundehus kirken, hvor der også er ansat en kirketjener. I vil kunne samarbejde og sparre omkring opgaverne. Derudover er der en daglig leder for begge kirker, samt tre præster, to organister, en kordegn og to kirke- og kulturmedarbejdere. Kirketjeneren skal arbejde sammen med alle ansatte. 
 Stillingen er en fuldtidsstilling på 37 timer om ugen med én fast ugentlig fridag og én løs fridag. 
 Stillingen ønskes besat pr 1. august 2022. 
 Vi forventer at du: 
 
 er udadvendt og kan tale med mange forskellige mennesker. Du skal være en god ambassadør for kirken. 
 føler ansvarlighed og kan arbejde selvstændigt samt bevare overblikket, når der er travlt. 
 har hænderne skruet rigtig på til praktiske opgaver herunder også rengøring, der er en stor del af din hverdag. 
 kan betjene kirkens tekniske installationer efter grundig oplæring. 
 har erfaring med IT på brugerniveau. 
 kan stå for administrative opgaver i forbindelse med udlejning af lokaler. 
 kan formulere dig i såvel skrift som tale. 
 straffeattest og børneattest skal vises. 
 
 Vi tilbyder: 
 
 en selvstændig arbejdsdag med selvstændige ansvarsområder. 
 en personalegruppe bestående af mange forskellige faggrupper, som alle hjælper hinanden og er loyale.   
 god oplæring med den nuværende kirketjener og daglig leder 
 godt samarbejde med kirkens øvrige ansatte samt menighedsrådets kirkeværge og kontaktperson. 
 et aktivt sogn med mange forskellige aktiviteter og lyst til at gå i nye retninger. 
 stillingen indeholder skiftende og fleksible arbejdstider. Bemærk, at du er forpligtet til at deltage ved kirkens gudstjenester og kirkelige handlinger i højtider, hvilket også indebærer weekend- og aftenarbejde. 
 
   
 Løn- og ansættelsesvilkår: 
 Ansættelsen er omfattet af Fællesoverenskomsten mellem Finansministeriet og Offentligt Ansattes Organisationer (OAO-S) samt organisationsaftale mellem Kirkeministeriet og Danmarks Kirketjenerforening og det tilhørende protokollat for kirketjenere. Aftalerne kan ses på  www.folkekirkenspersonale.dk 
 Årslønnen aftales inden for intervallet 282.420,25 - 364.174,40 kr. Aftale om indplacering i lønintervallet indgås mellem menighedsrådet og Danmarks Kirketjenerforening. Der er rådighedsforpligtelse knyttet til stillingen. Rådighedstillægget udgør årligt 26.651,44. Desuden ydes et OK18-tillæg på 1.247,51 kr. årligt. Alle forannævnte beløb er niveau pr. 1. april 2022. 
 Ud over lønnen ydes arbejdsgiverbetalt pensionsbidrag på op til 15 %. 
 Nuværende tjenestemandsansatte kirketjenere har ret til at bevare deres tjenestemandsstatus ved ansættelse med direkte overgang fra hidtidig stilling. Der skal i så fald ske en klassificering af stillingen. 
 Hvis du ikke allerede har gennemgået den obligatoriske 5 ugers uddannelse for kirketjenere, skal den gennemføres inden 2 år efter ansættelsen. Se cirkulære om uddannelseskrav for kirkefunktionærer på  www.folkekirkenspersonale.dk . 
 Der vil blive indhentet børneattest og referencer i forbindelse med ansættelsen, og der er en prøvetid på 3 måneder. 
 Vil du vide mere? 
 Nærmere oplysninger om stillingen kan fås ved henvendelse til daglig leder Mette Lyshøj Ulrikkeholm på telefon 30 66 77 14 eller mail  mlul@km.dk . 
 Ansøgningen med relevante bilag sendes på mail til:  7054fortrolig@sogn.dk  som én samlet pdf-fil, og skal være menighedsrådet i hænde senest torsdag, den 12. maj kl. 12.00. 
 Ansættelsessamtaler forventes at finde sted den 24. maj og den 2. juni. 
 Taksigelseskirken.dk",Jagtvej 165,58,Danmark,101,København,4,"Hovedstaden, Sjælland og Bornholm",2100,København Ø,1,1,Fuldtid,None,None,1,,0,,0,0,0,,True,"{'Id': 7942072, 'Email': 'mlul@km.dk', 'FaxNumber': None, 'PersonName': 'Mette Ulrikkeholm', 'FirstName': 'Mette', 'LastName': 'Ulrikkeholm', 'PositionTitle': 'Daglig leder', 'PhoneNumbers': [{'Number': '30667714', 'Type': 0, 'Description': 'Hovednummer'}, {'Number': '30667714', 'Type': 2, 'Description': 'Mobil'}]}",2022-06-24T00:00:00,False,False,False,False,4,,,True,False,True,True,,,7054fortrolig@sogn.dk,,,False,2022-05-12T00:00:00,,0,Primary,7,/CV/FindWork/GetLogo?JobAdId=5582554&Organisation=66083810,"Jagtvej 165,2100, København Ø",True,False,"/CV/Jobseeking/JobLog/CreateJobSearch?JobnetJobPostingIdentifier=5582554&Company.Name=TAKSIGELSESKIRKENS KONTOR&SubmissionDeadlineDate=2022-5-12&Title=Kirketjener Taksigelseskirken, Østerbro&WeeklyWorkTime=1",00000000-0000-0000-0000-000000000000,False,0,,,"Kirketjener Taksigelseskirken, Østerbro",True,,True,1,,5582554,,,False,False,,0,False,TAKSIGELSESKIRKENS KONTOR,Jagtvej 165,,,2100,False,False,False,København Ø,Mette Ulrikkeholm,30667714,mlul@km.dk,,,,,False,,2022-05-12T00:00:00,,0,False,0,,,,,0,,,,False,False,,,False,False,,,,False,,False,,"Dag, aften, weekend",Arbejdspladsen ligger i København kommune,False,TAKSIGELSESKIRKENS KONTOR,,None,,False,False,"Taksigelseskirken s&oslash;ger en engageret kirketjener, der &oslash;nsker at tage del i at videreudvikle den lokale folkekirke. Taksigelseskirken er en sp&aelig;ndende bykirke lige ved Vibenshus Metro. Vi har mange b&oslash;rnefamilier og &aelig;ldre brugere af kirken, men ogs&aring; et stort koncertpublikum og pop-up events.
Kirkens nuv&aelig;ren","""Taksigelseskirken s\u0026oslash;ger en engageret kirketjener, der \u0026oslash;nsker at tage del i at videreudvikle den lokale folkekirke. Taksigelseskirken er en sp\u0026aelig;ndende bykirke lige ved Vibenshus Metro. Vi har mange b\u0026oslash;rnefamilier og \u0026aelig;ldre brugere af kirken, men ogs\u0026aring; et stort koncertpublikum og pop-up events.\nKirkens nuv\u0026aelig;ren""","""Kirketjener Taksigelseskirken, Østerbro""","https://www.google.dk/maps/dir//Jagtvej+165,2100,+København+Ø/","Taksigelseskirken søger en engageret kirketjener, der ønsker at tage del i at videreudvikle den lokale folkekirke. Taksigelseskirken er en spændende bykirke lige ved Vibenshus Metro. Vi har mange børnefamilier og ældre brugere af kirken, men også et stort koncertpublikum og pop-up events. 
 Kirkens nuværende kirketjener har igennem de sidste mange år serviceret kirkens brugere på bedste vis, men ønsker nu at gå på pension. Vi er derfor på udkik efter en positiv, servicemindet person, der gerne løser alle forhåndenværende kirketjeneropgaver i samarbejde med kollegaer og daglig leder. 
 Det primære arbejdssted vil være i Taksigelseskirken, som samarbejder med Lundehus kirken, hvor der også er ansat en kirketjener. I vil kunne samarbejde og sparre omkring opgaverne. Derudover er der en daglig leder for begge kirker, samt tre præster, to organister, en kordegn og to kirke- og kulturmedarbejdere. Kirketjeneren skal arbejde sammen med alle ansatte. 
 Stillingen er en fuldtidsstilling på 37 timer om ugen med én fast ugentlig fridag og én løs fridag. 
 Stillingen ønskes besat pr 1. august 2022. 
 Vi forventer at du: 
 
 er udadvendt og kan tale med mange forskellige mennesker. Du skal være en god ambassadør for kirken. 
 føler ansvarlighed og kan arbejde selvstændigt samt bevare overblikket, når der er travlt. 
 har hænderne skruet rigtig på til praktiske opgaver herunder også rengøring, der er en stor del af din hverdag. 
 kan betjene kirkens tekniske installationer efter grundig oplæring. 
 har erfaring med IT på brugerniveau. 
 kan stå for administrative opgaver i forbindelse med udlejning af lokaler. 
 kan formulere dig i såvel skrift som tale. 
 straffeattest og børneattest skal vises. 
 
 Vi tilbyder: 
 
 en selvstændig arbejdsdag med selvstændige ansvarsområder. 
 en personalegruppe bestående af mange forskellige faggrupper, som alle hjælper hinanden og er loyale.   
 god oplæring med den nuværende kirketjener og daglig leder 
 godt samarbejde med kirkens øvrige ansatte samt menighedsrådets kirkeværge og kontaktperson. 
 et aktivt sogn med mange forskellige aktiviteter og lyst til at gå i nye retninger. 
 stillingen indeholder skiftende og fleksible arbejdstider. Bemærk, at du er forpligtet til at deltage ved kirkens gudstjenester og kirkelige handlinger i højtider, hvilket også indebærer weekend- og aftenarbejde. 
 
   
 Løn- og ansættelsesvilkår: 
 Ansættelsen er omfattet af Fællesoverenskomsten mellem Finansministeriet og Offentligt Ansattes Organisationer (OAO-S) samt organisationsaftale mellem Kirkeministeriet og Danmarks Kirketjenerforening og det tilhørende protokollat for kirketjenere. Aftalerne kan ses på  www.folkekirkenspersonale.dk 
 Årslønnen aftales inden for intervallet 282.420,25 - 364.174,40 kr. Aftale om indplacering i lønintervallet indgås mellem menighedsrådet og Danmarks Kirketjenerforening. Der er rådighedsforpligtelse knyttet til stillingen. Rådighedstillægget udgør årligt 26.651,44. Desuden ydes et OK18-tillæg på 1.247,51 kr. årligt. Alle forannævnte beløb er niveau pr. 1. april 2022. 
 Ud over lønnen ydes arbejdsgiverbetalt pensionsbidrag på op til 15 %. 
 Nuværende tjenestemandsansatte kirketjenere har ret til at bevare deres tjenestemandsstatus ved ansættelse med direkte overgang fra hidtidig stilling. Der skal i så fald ske en klassificering af stillingen. 
 Hvis du ikke allerede har gennemgået den obligatoriske 5 ugers uddannelse for kirketjenere, skal den gennemføres inden 2 år efter ansættelsen. Se cirkulære om uddannelseskrav for kirkefunktionærer på  www.folkekirkenspersonale.dk . 
 Der vil blive indhentet børneattest og referencer i forbindelse med ansættelsen, og der er en prøvetid på 3 måneder. 
 Vil du vide mere? 
 Nærmere oplysninger om stillingen kan fås ved henvendelse til daglig leder Mette Lyshøj Ulrikkeholm på telefon 30 66 77 14 eller mail  mlul@km.dk . 
 Ansøgningen med relevante bilag sendes på mail til:  7054fortrolig@sogn.dk  som én samlet pdf-fil, og skal være menighedsrådet i hænde senest torsdag, den 12. maj kl. 12.00. 
 Ansættelsessamtaler forventes at finde sted den 24. maj og den 2. juni. 
 Taksigelseskirken.dk","https://www.google.dk/maps/place/Jagtvej+165,2100,+København+Ø/",66083810,False,False,,False
