summary_AutomatchType,summary_Abroad,summary_Weight,summary_Title,summary_JobHeadline,summary_Presentation,summary_HiringOrgName,summary_WorkPlaceAddress,summary_WorkPlacePostalCode,summary_WorkPlaceCity,summary_WorkPlaceOtherAddress,summary_WorkPlaceAbroad,summary_WorkPlaceNotStatic,summary_UseWorkPlaceAddressForJoblog,summary_PostingCreated,summary_LastDateApplication,summary_FormattedLastDateApplication,summary_AssignmentStartDate,summary_IsHotjob,summary_IsExternal,summary_Url,summary_Region,summary_Municipality,summary_Country,summary_PostalCode,summary_PostalCodeName,summary_JobAnnouncementType,summary_EmploymentType,summary_WorkHours,summary_OccupationArea,summary_OccupationGroup,summary_Occupation,summary_Location_Latitude,summary_Location_Longitude,summary_JoblogWorkTime_WorkHour,summary_JoblogWorkTime_DailyWorkTime,summary_WorkplaceID,summary_OrganisationId,summary_HiringOrgCVR,summary_UserLoggedIn,summary_AnonymousEmployer,summary_ShareUrl,summary_DetailsUrl,summary_JobLogUrl,summary_HasLocationValues,summary_ID,summary_Latitude,summary_Longitude,details_WorkSchedule,details_WorkConditions,details_EmploymentTypes,details_WorkPlace_Name,details_WorkPlace_Address_AddressLine,details_WorkPlace_Address_Country_Id,details_WorkPlace_Address_Country_Name,details_WorkPlace_Address_Municipality_Id,details_WorkPlace_Address_Municipality_Name,details_WorkPlace_Address_Region_Id,details_WorkPlace_Address_Region_Name,details_WorkPlace_Address_PostalCode,details_WorkPlace_Address_City,details_WorkPlace_PhoneNumber_Number,details_WorkPlace_PhoneNumber_Type,details_WorkPlace_PhoneNumber_Description,details_WorkPlace_FaxNumber,details_WorkPlace_Email,details_WorkPlace_WebAddress,details_WorkPlace_Description,details_WorkPlace_Logo,details_WorkPlace_WorkPlaceOrganizationNumber,details_WorkPlace_OrganizationNumber,details_WorkPlace_OrganizationDescription,details_JobPositionPosting_Id,details_JobPositionPosting_OriginalJppId,details_JobPositionPosting_HiringOrg_Name,details_JobPositionPosting_HiringOrg_Address_AddressLine,details_JobPositionPosting_HiringOrg_Address_Country_Id,details_JobPositionPosting_HiringOrg_Address_Country_Name,details_JobPositionPosting_HiringOrg_Address_Municipality_Id,details_JobPositionPosting_HiringOrg_Address_Municipality_Name,details_JobPositionPosting_HiringOrg_Address_Region_Id,details_JobPositionPosting_HiringOrg_Address_Region_Name,details_JobPositionPosting_HiringOrg_Address_PostalCode,details_JobPositionPosting_HiringOrg_Address_City,details_JobPositionPosting_HiringOrg_PhoneNumber_Number,details_JobPositionPosting_HiringOrg_PhoneNumber_Type,details_JobPositionPosting_HiringOrg_PhoneNumber_Description,details_JobPositionPosting_HiringOrg_FaxNumber,details_JobPositionPosting_HiringOrg_Email,details_JobPositionPosting_HiringOrg_WebAddress,details_JobPositionPosting_HiringOrg_Description,details_JobPositionPosting_HiringOrg_Logo,details_JobPositionPosting_HiringOrg_WorkPlaceOrganizationNumber,details_JobPositionPosting_HiringOrg_OrganizationNumber,details_JobPositionPosting_HiringOrg_OrganizationDescription,details_JobPositionPosting_RecruitingCompany_Name,details_JobPositionPosting_RecruitingCompany_Address_AddressLine,details_JobPositionPosting_RecruitingCompany_Address_Country_Id,details_JobPositionPosting_RecruitingCompany_Address_Country_Name,details_JobPositionPosting_RecruitingCompany_Address_Municipality_Id,details_JobPositionPosting_RecruitingCompany_Address_Municipality_Name,details_JobPositionPosting_RecruitingCompany_Address_Region_Id,details_JobPositionPosting_RecruitingCompany_Address_Region_Name,details_JobPositionPosting_RecruitingCompany_Address_PostalCode,details_JobPositionPosting_RecruitingCompany_Address_City,details_JobPositionPosting_RecruitingCompany_PhoneNumber_Number,details_JobPositionPosting_RecruitingCompany_PhoneNumber_Type,details_JobPositionPosting_RecruitingCompany_PhoneNumber_Description,details_JobPositionPosting_RecruitingCompany_FaxNumber,details_JobPositionPosting_RecruitingCompany_Email,details_JobPositionPosting_RecruitingCompany_WebAddress,details_JobPositionPosting_RecruitingCompany_Description,details_JobPositionPosting_RecruitingCompany_Logo,details_JobPositionPosting_RecruitingCompany_WorkPlaceOrganizationNumber,details_JobPositionPosting_RecruitingCompany_OrganizationNumber,details_JobPositionPosting_RecruitingCompany_OrganizationDescription,details_JobPositionPosting_PublicationStartDate,details_JobPositionPosting_PublicationEndDate,details_JobPositionPosting_JobPositionInformation_PositionTitle,details_JobPositionPosting_JobPositionInformation_Purpose,details_JobPositionPosting_JobPositionInformation_WorkLocation_AddressLine,details_JobPositionPosting_JobPositionInformation_WorkLocation_Country_Id,details_JobPositionPosting_JobPositionInformation_WorkLocation_Country_Name,details_JobPositionPosting_JobPositionInformation_WorkLocation_Municipality_Id,details_JobPositionPosting_JobPositionInformation_WorkLocation_Municipality_Name,details_JobPositionPosting_JobPositionInformation_WorkLocation_Region_Id,details_JobPositionPosting_JobPositionInformation_WorkLocation_Region_Name,details_JobPositionPosting_JobPositionInformation_WorkLocation_PostalCode,details_JobPositionPosting_JobPositionInformation_WorkLocation_City,details_JobPositionPosting_JobPositionInformation_EmploymentType,details_JobPositionPosting_JobPositionInformation_WeeklyWorkHours_TypeId,details_JobPositionPosting_JobPositionInformation_WeeklyWorkHours_TypeName,details_JobPositionPosting_JobPositionInformation_WeeklyWorkHours_Description,details_JobPositionPosting_JobPositionInformation_CompensationDescription,details_JobPositionPosting_JobPositionInformation_NumberToFill,details_JobPositionPosting_JobPositionInformation_DriverLicense,details_JobPositionPosting_JobPositionInformation_Occupation_DiscoWeb,details_JobPositionPosting_JobPositionInformation_Occupation_AlternateNames,details_JobPositionPosting_JobPositionInformation_Occupation_GroupId,details_JobPositionPosting_JobPositionInformation_Occupation_AreaId,details_JobPositionPosting_JobPositionInformation_Occupation_Id,details_JobPositionPosting_JobPositionInformation_Occupation_Name,details_JobPositionPosting_JobPositionInformation_IsGovernmentHiring,details_JobPositionPosting_JobPositionInformation_JppContacts,details_JobPositionPosting_JobPositionInformation_EmploymentDate,details_JobPositionPosting_IsRecruitmentOfForeignNationals,details_JobPositionPosting_IsWorkInDenmark,details_JobPositionPosting_IsAnonymousEmployer,details_JobPositionPosting_IsDisabilityFriendly,details_JobPositionPosting_JppType,details_JobPositionPosting_ApplicationDetails_WorkHourMax,details_JobPositionPosting_ApplicationDetails_WorkHourMin,details_JobPositionPosting_ApplicationDetails_DailyWorkTimeWeekend,details_JobPositionPosting_ApplicationDetails_DailyWorkTimeNight,details_JobPositionPosting_ApplicationDetails_DailyWorkTimeEvening,details_JobPositionPosting_ApplicationDetails_DailyWorkTimeDay,details_JobPositionPosting_ApplicationDetails_ReferenceText,details_JobPositionPosting_ApplicationDetails_RemarksToApplicant,details_JobPositionPosting_ApplicationDetails_ByEmail,details_JobPositionPosting_ApplicationDetails_ByPhone,details_JobPositionPosting_ApplicationDetails_ApplyViaUrl,details_JobPositionPosting_ApplicationDetails_ReplyInWriting,details_JobPositionPosting_ApplicationDetails_ApplicationDeadlineDate,details_JobPositionPosting_ContactAuthorityPhoneNumber_Number,details_JobPositionPosting_ContactAuthorityPhoneNumber_Type,details_JobPositionPosting_ContactAuthorityPhoneNumber_Description,details_JobPositionPosting_Status,details_LogoUrl,details_Address,details_ShowMap,details_ShowShareButtonJobLog,details_JobLogUrl,details_JobLogTemplateModel_Identifier,details_JobLogTemplateModel_UseWorkPlaceAddressForJoblog,details_JobLogTemplateModel_Category,details_JobLogTemplateModel_CvCustomerIdentifier,details_JobLogTemplateModel_JobSeekingStatus,details_JobLogTemplateModel_Title,details_JobLogTemplateModel_IsApplicationSourceRequired,details_JobLogTemplateModel_ApplicationSource,details_JobLogTemplateModel_IsWeeklyWorkTimeRequired,details_JobLogTemplateModel_WeeklyWorkTime,details_JobLogTemplateModel_HoursPerWeek,details_JobLogTemplateModel_JobnetJobPostingIdentifier,details_JobLogTemplateModel_JobAdDocument_Title,details_JobLogTemplateModel_JobAdDocument_Identifier,details_JobLogTemplateModel_JobAdDocument_IsDeletedBySystem,details_JobLogTemplateModel_JobAdDocument_IsDeletedByUser,details_JobLogTemplateModel_JobAdFile,details_JobLogTemplateModel_Company_JobLogEntryCategory,details_JobLogTemplateModel_Company_ShowAddressFieldsEvenIfEmpty,details_JobLogTemplateModel_Company_Name,details_JobLogTemplateModel_Company_Address,details_JobLogTemplateModel_Company_Country,details_JobLogTemplateModel_Company_EmploymentAreaID,details_JobLogTemplateModel_Company_PostCode,details_JobLogTemplateModel_Company_IsCountryAndTownAndPostCodeEmpty,details_JobLogTemplateModel_Company_IsTownAndPostCodeEmpty,details_JobLogTemplateModel_Company_IsCountryDanmark,details_JobLogTemplateModel_Company_Town,details_JobLogTemplateModel_Company_ContactPerson,details_JobLogTemplateModel_Company_Phone,details_JobLogTemplateModel_Company_Email,details_JobLogTemplateModel_Company_Latitude,details_JobLogTemplateModel_Company_Longitude,details_JobLogTemplateModel_Company_DailyTravelTimeInMinutes,details_JobLogTemplateModel_Company_DistanceToCompanyInMeters,details_JobLogTemplateModel_Company_IsCreateMode,details_JobLogTemplateModel_TypeOfSubmission,details_JobLogTemplateModel_SubmissionDate,details_JobLogTemplateModel_SubmissionDateFormatted,details_JobLogTemplateModel_SubmissionDateTiks,details_JobLogTemplateModel_IsSubmissionDateRequired,details_JobLogTemplateModel_Status,details_JobLogTemplateModel_DateCreatedFormatted,details_JobLogTemplateModel_DateCreated,details_JobLogTemplateModel_DateModifiedFormatted,details_JobLogTemplateModel_DateModified,details_JobLogTemplateModel_LastModifiedDateTiks,details_JobLogTemplateModel_DateClosed,details_JobLogTemplateModel_JobApplicationDocument_Title,details_JobLogTemplateModel_JobApplicationDocument_Identifier,details_JobLogTemplateModel_JobApplicationDocument_IsDeletedBySystem,details_JobLogTemplateModel_JobApplicationDocument_IsDeletedByUser,details_JobLogTemplateModel_CvDocument_Title,details_JobLogTemplateModel_CvDocument_Identifier,details_JobLogTemplateModel_CvDocument_IsDeletedBySystem,details_JobLogTemplateModel_CvDocument_IsDeletedByUser,details_JobLogTemplateModel_JobApplicationFile,details_JobLogTemplateModel_CvFile,details_JobLogTemplateModel_SubmissionDeadlineDate,details_JobLogTemplateModel_IsPersisted,details_JobLogTemplateModel_ServerValidationErrors,details_JobLogTemplateModel_HasServerValidationErrors,details_JoblogWorkTime_WorkHour,details_JoblogWorkTime_DailyWorkTime,details_Place,details_OpenPrintDialog,details_WorkPlaceInfoText,details_JobCenterContactDetails,details_WorkPlaceDescriptionText,details_FavoriteText,details_IsFavorite,details_ShowFavorite,details_MetaOgTextForSharing,details_DescriptionForSharing,details_TitleForSharing,details_RutePlan,details_FormattedPurpose,details_MapUrl,details_OrganizationNumber,details_ShowSearchJobButton,details_ShowPrint,details_BackToFindWorkButtonUrl,isExternal
0,False,1,Softwareudvikler,Softwareudvikler,"Om osGUS Nordic ApS et partnerfirma til GUS GROUP, der dækker en stor del af Europa. Vores software system, GUS OS-Suite, blev i Tyskland udnævnt til årets ERP-system 2012, og i 2015 blev ",GUS NORDIC ApS,C. E. Christiansens Vej 46,4930,Maribo,False,False,False,True,2022-04-25T00:00:00,2022-06-20T00:00:00,20. juni 2022,0001-01-01T00:00:00,False,False,https://job.jobnet.dk/CV/FindWork/Details/5582593,Øvrige Sjælland,Lolland,Danmark,4930,,,,Fuldtid,It og teleteknik,"Systemudvikling, programmering og design","Softwareudvikler, backend",54.7796,11.5138,,,110278,98987,34461597,False,False,https://job.jobnet.dk/CV/FindWork/DetailsSocialmedia/5582593,https://job.jobnet.dk/CV/FindWork/Details/5582593,https://job.jobnet.dk/CV/FindWork/Details/5582593,True,5582593,54.7796,11.5138,"{'Id': 1, 'Name': 'Fuldtid'}, {'Id': 16, 'Name': 'Deltid'}","{'Id': 1, 'Name': 'Almindelige vilkår'}, {'Id': 2, 'Name': 'Fleksjob'}, {'Id': 3, 'Name': 'Skånejob'}, {'Id': 4, 'Name': 'Egnet til efterlønnere og seniorer'}, {'Id': 5, 'Name': 'Job med løntilskud'}, {'Id': 6, 'Name': 'Rotationsjob'}, {'Id': 7, 'Name': 'Virksomhedspraktik'}","{'Id': 1, 'Name': 'Fastansættelse'}, {'Id': 16, 'Name': 'Tidsbegrænset ansættelse'}",GUS NORDIC ApS,C. E. Christiansens Vej 46,58,Danmark,360,Lolland,4,"Hovedstaden, Sjælland og Bornholm",4930,Maribo,,0,Primary,,,,None,110278,1017553670,34461597,None,5582593,5582593,GUS NORDIC ApS,C. E. Christiansens Vej 46,58,Danmark,360,Lolland,4,"Hovedstaden, Sjælland og Bornholm",4930,Maribo,,0,Primary,,,,None,110278,1017553670,34461597,None,Jobcenter Lolland,Lillievej 4,0,,0,,0,,4900,Nakskov,54676767,0,Primary,546773636,,,None,,,36000,None,2022-04-25T00:00:00,2022-06-20T00:00:00,Softwareudvikler,"Om os GUS Nordic ApS et partnerfirma til GUS GROUP, der dækker en stor del af Europa. Vores software system, GUS OS-Suite, blev i Tyskland udnævnt til årets ERP-system 2012, og i 2015 blev det kåret som det mest innovative ERP-system på CeBIT-messen i Hannover. I Danmark er vi ligeledes godt med og er blevet kåret til adskillige gazeller, hvoraf den seneste kåring var i 2021. Vi udbyder et effektivt og brugervenligt ERP-system samt andre services til virksomheder indenfor logistik, transport og procesindustrien. GUS Nordic ApS udvikler, supporter og markedsfører egne softwareprodukter til dokumentbehandling, logistik, toldbehandling samt life-science. Vores dagligdag byder på alsidige udfordringer, som foregår i et uformelt arbejdsmiljø blandt gode kollegaer i Maribo. Vores pauser går med afslapning, samtaler, måske lidt for mange jokes og meget højlydte grin ved foosball-bordet, når der kæmpes om æren og prestige. Det er heller ikke uset at man en fredag bliver til en bajer eller fem efter arbejdstiden. Vi tilbyder 
 
 Et spændende job, der giver mulighed for at arbejde tæt sammen med de største virksomheder i Danmark. Det er bl.a. denne form for samarbejde. der gør os til de absolut bedste i branchen. 
 Gode arbejdsforhold i fælles kontorer, hvor der føres en åben, ofte direkte og uformel tone. 
 Gode muligheder for faglig udvikling af flere grunde – vi er specialister i det, vi laver og er gode til at lære fra os, samt vi også er i tæt kontakt og samarbejde med nogle af Danmarks bedste virksomheder i hver sit felt. 
 Gode muligheder for personlig udvikling i et helt unikt team, der har kreativitet, kompetence, godt humør samt interne jokes højest oppe på piedestalen. 
 En rolig opstarts- og tilvænningsperiode, hvor du får lov at mærke dig i omgivelserne og gøre dig bekendt med opgaverne. 
 37-timers arbejdsuge. 
 Ansættelse hurtigst muligt. 
 
Forventninger/kvalifikationer 
 
 Grundlæggende kendskab til OOP. 
 Fordel med kendskab til Java, C# og VB. 
 MSSQL, Sybase SQL, Oracle. 
 God til mundtlig og skriftlig kommunikation på både dansk og engelsk. 
 Kvalitetsbevidst, udadvendt og serviceminded. 
 Teamplayer med en positiv indstilling. 
 Du skal kunne kommunikere med kollegaer og kunder i hverdagen. 
 Du skal helst kunne håndtere flere bolde i luften på én gang og hurtigt kunne omstille dine prioriteter efter behov. 
 Kørekort til bil. 
 
Minimumskrav til uddannelse Datamatiker Da vi leder efter tech-savvy kollegaer, er det et kæmpe plus, hvis du generelt har tidligere arbejdserfaring med IT. Derudover leder vi ligeledes efter erfarne folk fra samtlige brancher, som vi arbejder med herunder handel og transport, logistik, procesindustrien, lager, m.m. Grundlæggende, hvad vi beder om fra dig som ny medarbejder efter endt prøveperiode, er, at du skal kunne arbejde struktureret, organiseret og selvstændigt med kundespecifikke opgaver, hvor din forståelse for workflow, processer, og evnen til at sætte dig ind i kundernes forretning, er essentiel. Vi hjælper altid hinanden på vej i den retning, og selvom der kan forekomme uforudsete forhindringer, så sigter vi efter kontinuerligt at forbedre vores egne samt vores kunders arbejdsprocesser. Derfor starter alt med en selv, og vi fokuserer derfor også meget på egen udvikling. Du vil blive en del af en dynamisk og spændende virksomhed i vækst, hvor vi er et team af ildsjæle, der brænder for det, vi laver, og du kommer med garanti til at lære noget nyt og spændende i GUS Nordic. Hverdagen er travl, men den krydres med godt humør og positive kollegaer. Vi ønsker en ny medarbejder, som kan træde ind i teamet og gøre sin del for at bidrage til fælles succes. Hvis du er interesseret, så send ansøgning og CV, mærket “IT-Konsulent”, inklusive relevante eksamensbeviser og anbefalinger til tb@gusnordic.com, tlf. +45 88 87 24 63.",C. E. Christiansens Vej 46,58,Danmark,360,Lolland,4,"Hovedstaden, Sjælland og Bornholm",4930,Maribo,1,1,Fuldtid,None,None,1,,0,,0,0,0,,False,"{'Id': 7928672, 'Email': 'tb@gusnordic.com', 'FaxNumber': None, 'PersonName': 'Gus Nordic', 'FirstName': 'Gus', 'LastName': 'Nordic', 'PositionTitle': '.', 'PhoneNumbers': [{'Number': '88872463', 'Type': 0, 'Description': 'Hovednummer'}]}",,False,False,False,False,4,,,False,False,False,False,,,tb@gusnordic.com,,,True,2022-06-20T00:00:00,,0,Primary,7,/CV/FindWork/GetLogo?JobAdId=5582593&WorkPlace=110278&Organisation=34461597,"C. E. Christiansens Vej 46,4930, Maribo",True,False,/CV/Jobseeking/JobLog/CreateJobSearch?JobnetJobPostingIdentifier=5582593&Company.Name=GUS NORDIC ApS&SubmissionDeadlineDate=2022-6-20&Title=Softwareudvikler&WeeklyWorkTime=1,00000000-0000-0000-0000-000000000000,False,0,,,Softwareudvikler,True,,True,1,,5582593,,,False,False,,0,False,GUS NORDIC ApS,C. E. Christiansens Vej 46,,,4930,False,False,False,Maribo,Gus Nordic,88872463,tb@gusnordic.com,,,,,False,,2022-06-20T00:00:00,,0,False,0,,,,,0,,,,False,False,,,False,False,,,,False,,False,,,Arbejdspladsen ligger i Lolland kommune,False,GUS NORDIC ApS,Kontakt Jobcenter Lolland på telefon 54676767,None,,False,False,"Om osGUS Nordic ApS et partnerfirma til GUS GROUP, der d&aelig;kker en stor del af Europa. Vores software system, GUS OS-Suite, blev i Tyskland udn&aelig;vnt til &aring;rets ERP-system 2012, og i 2015 blev det k&aring;ret som det mest innovative ERP-system p&aring; CeBIT-messen i Hannover. I Danmark er vi ligeledes godt med og er blevet k&aring;ret","""Om osGUS Nordic ApS et partnerfirma til GUS GROUP, der d\u0026aelig;kker en stor del af Europa. Vores software system, GUS OS-Suite, blev i Tyskland udn\u0026aelig;vnt til \u0026aring;rets ERP-system 2012, og i 2015 blev det k\u0026aring;ret som det mest innovative ERP-system p\u0026aring; CeBIT-messen i Hannover. I Danmark er vi ligeledes godt med og er blevet k\u0026aring;ret""","""Softwareudvikler""","https://www.google.dk/maps/dir//C.+E.+Christiansens+Vej+46,4930,+Maribo/","Om os GUS Nordic ApS et partnerfirma til GUS GROUP, der dækker en stor del af Europa. Vores software system, GUS OS-Suite, blev i Tyskland udnævnt til årets ERP-system 2012, og i 2015 blev det kåret som det mest innovative ERP-system på CeBIT-messen i Hannover. I Danmark er vi ligeledes godt med og er blevet kåret til adskillige gazeller, hvoraf den seneste kåring var i 2021. Vi udbyder et effektivt og brugervenligt ERP-system samt andre services til virksomheder indenfor logistik, transport og procesindustrien. GUS Nordic ApS udvikler, supporter og markedsfører egne softwareprodukter til dokumentbehandling, logistik, toldbehandling samt life-science. Vores dagligdag byder på alsidige udfordringer, som foregår i et uformelt arbejdsmiljø blandt gode kollegaer i Maribo. Vores pauser går med afslapning, samtaler, måske lidt for mange jokes og meget højlydte grin ved foosball-bordet, når der kæmpes om æren og prestige. Det er heller ikke uset at man en fredag bliver til en bajer eller fem efter arbejdstiden. Vi tilbyder 
 
 Et spændende job, der giver mulighed for at arbejde tæt sammen med de største virksomheder i Danmark. Det er bl.a. denne form for samarbejde. der gør os til de absolut bedste i branchen. 
 Gode arbejdsforhold i fælles kontorer, hvor der føres en åben, ofte direkte og uformel tone. 
 Gode muligheder for faglig udvikling af flere grunde – vi er specialister i det, vi laver og er gode til at lære fra os, samt vi også er i tæt kontakt og samarbejde med nogle af Danmarks bedste virksomheder i hver sit felt. 
 Gode muligheder for personlig udvikling i et helt unikt team, der har kreativitet, kompetence, godt humør samt interne jokes højest oppe på piedestalen. 
 En rolig opstarts- og tilvænningsperiode, hvor du får lov at mærke dig i omgivelserne og gøre dig bekendt med opgaverne. 
 37-timers arbejdsuge. 
 Ansættelse hurtigst muligt. 
 
Forventninger/kvalifikationer 
 
 Grundlæggende kendskab til OOP. 
 Fordel med kendskab til Java, C# og VB. 
 MSSQL, Sybase SQL, Oracle. 
 God til mundtlig og skriftlig kommunikation på både dansk og engelsk. 
 Kvalitetsbevidst, udadvendt og serviceminded. 
 Teamplayer med en positiv indstilling. 
 Du skal kunne kommunikere med kollegaer og kunder i hverdagen. 
 Du skal helst kunne håndtere flere bolde i luften på én gang og hurtigt kunne omstille dine prioriteter efter behov. 
 Kørekort til bil. 
 
Minimumskrav til uddannelse Datamatiker Da vi leder efter tech-savvy kollegaer, er det et kæmpe plus, hvis du generelt har tidligere arbejdserfaring med IT. Derudover leder vi ligeledes efter erfarne folk fra samtlige brancher, som vi arbejder med herunder handel og transport, logistik, procesindustrien, lager, m.m. Grundlæggende, hvad vi beder om fra dig som ny medarbejder efter endt prøveperiode, er, at du skal kunne arbejde struktureret, organiseret og selvstændigt med kundespecifikke opgaver, hvor din forståelse for workflow, processer, og evnen til at sætte dig ind i kundernes forretning, er essentiel. Vi hjælper altid hinanden på vej i den retning, og selvom der kan forekomme uforudsete forhindringer, så sigter vi efter kontinuerligt at forbedre vores egne samt vores kunders arbejdsprocesser. Derfor starter alt med en selv, og vi fokuserer derfor også meget på egen udvikling. Du vil blive en del af en dynamisk og spændende virksomhed i vækst, hvor vi er et team af ildsjæle, der brænder for det, vi laver, og du kommer med garanti til at lære noget nyt og spændende i GUS Nordic. Hverdagen er travl, men den krydres med godt humør og positive kollegaer. Vi ønsker en ny medarbejder, som kan træde ind i teamet og gøre sin del for at bidrage til fælles succes. Hvis du er interesseret, så send ansøgning og CV, mærket “IT-Konsulent”, inklusive relevante eksamensbeviser og anbefalinger til tb@gusnordic.com, tlf. +45 88 87 24 63.","https://www.google.dk/maps/place/C.+E.+Christiansens+Vej+46,4930,+Maribo/",34461597,False,False,,False
