summary_AutomatchType,summary_Abroad,summary_Weight,summary_Title,summary_JobHeadline,summary_Presentation,summary_HiringOrgName,summary_WorkPlaceAddress,summary_WorkPlacePostalCode,summary_WorkPlaceCity,summary_WorkPlaceOtherAddress,summary_WorkPlaceAbroad,summary_WorkPlaceNotStatic,summary_UseWorkPlaceAddressForJoblog,summary_PostingCreated,summary_LastDateApplication,summary_FormattedLastDateApplication,summary_AssignmentStartDate,summary_IsHotjob,summary_IsExternal,summary_Url,summary_Region,summary_Municipality,summary_Country,summary_PostalCode,summary_PostalCodeName,summary_JobAnnouncementType,summary_EmploymentType,summary_WorkHours,summary_OccupationArea,summary_OccupationGroup,summary_Occupation,summary_Location_Latitude,summary_Location_Longitude,summary_JoblogWorkTime_WorkHour,summary_JoblogWorkTime_DailyWorkTime,summary_WorkplaceID,summary_OrganisationId,summary_HiringOrgCVR,summary_UserLoggedIn,summary_AnonymousEmployer,summary_ShareUrl,summary_DetailsUrl,summary_JobLogUrl,summary_HasLocationValues,summary_ID,summary_Latitude,summary_Longitude,details_WorkSchedule,details_WorkConditions,details_EmploymentTypes,details_WorkPlace_Name,details_WorkPlace_Address_AddressLine,details_WorkPlace_Address_Country_Id,details_WorkPlace_Address_Country_Name,details_WorkPlace_Address_Municipality_Id,details_WorkPlace_Address_Municipality_Name,details_WorkPlace_Address_Region_Id,details_WorkPlace_Address_Region_Name,details_WorkPlace_Address_PostalCode,details_WorkPlace_Address_City,details_WorkPlace_PhoneNumber_Number,details_WorkPlace_PhoneNumber_Type,details_WorkPlace_PhoneNumber_Description,details_WorkPlace_FaxNumber,details_WorkPlace_Email,details_WorkPlace_WebAddress,details_WorkPlace_Description,details_WorkPlace_Logo,details_WorkPlace_WorkPlaceOrganizationNumber,details_WorkPlace_OrganizationNumber,details_WorkPlace_OrganizationDescription,details_JobPositionPosting_Id,details_JobPositionPosting_OriginalJppId,details_JobPositionPosting_HiringOrg_Name,details_JobPositionPosting_HiringOrg_Address_AddressLine,details_JobPositionPosting_HiringOrg_Address_Country_Id,details_JobPositionPosting_HiringOrg_Address_Country_Name,details_JobPositionPosting_HiringOrg_Address_Municipality_Id,details_JobPositionPosting_HiringOrg_Address_Municipality_Name,details_JobPositionPosting_HiringOrg_Address_Region_Id,details_JobPositionPosting_HiringOrg_Address_Region_Name,details_JobPositionPosting_HiringOrg_Address_PostalCode,details_JobPositionPosting_HiringOrg_Address_City,details_JobPositionPosting_HiringOrg_PhoneNumber_Number,details_JobPositionPosting_HiringOrg_PhoneNumber_Type,details_JobPositionPosting_HiringOrg_PhoneNumber_Description,details_JobPositionPosting_HiringOrg_FaxNumber,details_JobPositionPosting_HiringOrg_Email,details_JobPositionPosting_HiringOrg_WebAddress,details_JobPositionPosting_HiringOrg_Description,details_JobPositionPosting_HiringOrg_Logo,details_JobPositionPosting_HiringOrg_WorkPlaceOrganizationNumber,details_JobPositionPosting_HiringOrg_OrganizationNumber,details_JobPositionPosting_HiringOrg_OrganizationDescription,details_JobPositionPosting_RecruitingCompany,details_JobPositionPosting_PublicationStartDate,details_JobPositionPosting_PublicationEndDate,details_JobPositionPosting_JobPositionInformation_PositionTitle,details_JobPositionPosting_JobPositionInformation_Purpose,details_JobPositionPosting_JobPositionInformation_WorkLocation_AddressLine,details_JobPositionPosting_JobPositionInformation_WorkLocation_Country_Id,details_JobPositionPosting_JobPositionInformation_WorkLocation_Country_Name,details_JobPositionPosting_JobPositionInformation_WorkLocation_Municipality_Id,details_JobPositionPosting_JobPositionInformation_WorkLocation_Municipality_Name,details_JobPositionPosting_JobPositionInformation_WorkLocation_Region_Id,details_JobPositionPosting_JobPositionInformation_WorkLocation_Region_Name,details_JobPositionPosting_JobPositionInformation_WorkLocation_PostalCode,details_JobPositionPosting_JobPositionInformation_WorkLocation_City,details_JobPositionPosting_JobPositionInformation_EmploymentType,details_JobPositionPosting_JobPositionInformation_WeeklyWorkHours_TypeId,details_JobPositionPosting_JobPositionInformation_WeeklyWorkHours_TypeName,details_JobPositionPosting_JobPositionInformation_WeeklyWorkHours_Description,details_JobPositionPosting_JobPositionInformation_CompensationDescription,details_JobPositionPosting_JobPositionInformation_NumberToFill,details_JobPositionPosting_JobPositionInformation_DriverLicense,details_JobPositionPosting_JobPositionInformation_Occupation_DiscoWeb,details_JobPositionPosting_JobPositionInformation_Occupation_AlternateNames,details_JobPositionPosting_JobPositionInformation_Occupation_GroupId,details_JobPositionPosting_JobPositionInformation_Occupation_AreaId,details_JobPositionPosting_JobPositionInformation_Occupation_Id,details_JobPositionPosting_JobPositionInformation_Occupation_Name,details_JobPositionPosting_JobPositionInformation_IsGovernmentHiring,details_JobPositionPosting_JobPositionInformation_JppContacts,details_JobPositionPosting_JobPositionInformation_EmploymentDate,details_JobPositionPosting_IsRecruitmentOfForeignNationals,details_JobPositionPosting_IsWorkInDenmark,details_JobPositionPosting_IsAnonymousEmployer,details_JobPositionPosting_IsDisabilityFriendly,details_JobPositionPosting_JppType,details_JobPositionPosting_ApplicationDetails_WorkHourMax,details_JobPositionPosting_ApplicationDetails_WorkHourMin,details_JobPositionPosting_ApplicationDetails_DailyWorkTimeWeekend,details_JobPositionPosting_ApplicationDetails_DailyWorkTimeNight,details_JobPositionPosting_ApplicationDetails_DailyWorkTimeEvening,details_JobPositionPosting_ApplicationDetails_DailyWorkTimeDay,details_JobPositionPosting_ApplicationDetails_ReferenceText,details_JobPositionPosting_ApplicationDetails_RemarksToApplicant,details_JobPositionPosting_ApplicationDetails_ByEmail,details_JobPositionPosting_ApplicationDetails_ByPhone,details_JobPositionPosting_ApplicationDetails_ApplyViaUrl,details_JobPositionPosting_ApplicationDetails_ReplyInWriting,details_JobPositionPosting_ApplicationDetails_ApplicationDeadlineDate,details_JobPositionPosting_ContactAuthorityPhoneNumber_Number,details_JobPositionPosting_ContactAuthorityPhoneNumber_Type,details_JobPositionPosting_ContactAuthorityPhoneNumber_Description,details_JobPositionPosting_Status,details_LogoUrl,details_Address,details_ShowMap,details_ShowShareButtonJobLog,details_JobLogUrl,details_JobLogTemplateModel_Identifier,details_JobLogTemplateModel_UseWorkPlaceAddressForJoblog,details_JobLogTemplateModel_Category,details_JobLogTemplateModel_CvCustomerIdentifier,details_JobLogTemplateModel_JobSeekingStatus,details_JobLogTemplateModel_Title,details_JobLogTemplateModel_IsApplicationSourceRequired,details_JobLogTemplateModel_ApplicationSource,details_JobLogTemplateModel_IsWeeklyWorkTimeRequired,details_JobLogTemplateModel_WeeklyWorkTime,details_JobLogTemplateModel_HoursPerWeek,details_JobLogTemplateModel_JobnetJobPostingIdentifier,details_JobLogTemplateModel_JobAdDocument_Title,details_JobLogTemplateModel_JobAdDocument_Identifier,details_JobLogTemplateModel_JobAdDocument_IsDeletedBySystem,details_JobLogTemplateModel_JobAdDocument_IsDeletedByUser,details_JobLogTemplateModel_JobAdFile,details_JobLogTemplateModel_Company_JobLogEntryCategory,details_JobLogTemplateModel_Company_ShowAddressFieldsEvenIfEmpty,details_JobLogTemplateModel_Company_Name,details_JobLogTemplateModel_Company_Address,details_JobLogTemplateModel_Company_Country,details_JobLogTemplateModel_Company_EmploymentAreaID,details_JobLogTemplateModel_Company_PostCode,details_JobLogTemplateModel_Company_IsCountryAndTownAndPostCodeEmpty,details_JobLogTemplateModel_Company_IsTownAndPostCodeEmpty,details_JobLogTemplateModel_Company_IsCountryDanmark,details_JobLogTemplateModel_Company_Town,details_JobLogTemplateModel_Company_ContactPerson,details_JobLogTemplateModel_Company_Phone,details_JobLogTemplateModel_Company_Email,details_JobLogTemplateModel_Company_Latitude,details_JobLogTemplateModel_Company_Longitude,details_JobLogTemplateModel_Company_DailyTravelTimeInMinutes,details_JobLogTemplateModel_Company_DistanceToCompanyInMeters,details_JobLogTemplateModel_Company_IsCreateMode,details_JobLogTemplateModel_TypeOfSubmission,details_JobLogTemplateModel_SubmissionDate,details_JobLogTemplateModel_SubmissionDateFormatted,details_JobLogTemplateModel_SubmissionDateTiks,details_JobLogTemplateModel_IsSubmissionDateRequired,details_JobLogTemplateModel_Status,details_JobLogTemplateModel_DateCreatedFormatted,details_JobLogTemplateModel_DateCreated,details_JobLogTemplateModel_DateModifiedFormatted,details_JobLogTemplateModel_DateModified,details_JobLogTemplateModel_LastModifiedDateTiks,details_JobLogTemplateModel_DateClosed,details_JobLogTemplateModel_JobApplicationDocument_Title,details_JobLogTemplateModel_JobApplicationDocument_Identifier,details_JobLogTemplateModel_JobApplicationDocument_IsDeletedBySystem,details_JobLogTemplateModel_JobApplicationDocument_IsDeletedByUser,details_JobLogTemplateModel_CvDocument_Title,details_JobLogTemplateModel_CvDocument_Identifier,details_JobLogTemplateModel_CvDocument_IsDeletedBySystem,details_JobLogTemplateModel_CvDocument_IsDeletedByUser,details_JobLogTemplateModel_JobApplicationFile,details_JobLogTemplateModel_CvFile,details_JobLogTemplateModel_SubmissionDeadlineDate,details_JobLogTemplateModel_IsPersisted,details_JobLogTemplateModel_ServerValidationErrors,details_JobLogTemplateModel_HasServerValidationErrors,details_JoblogWorkTime_WorkHour,details_JoblogWorkTime_DailyWorkTime,details_Place,details_OpenPrintDialog,details_WorkPlaceInfoText,details_JobCenterContactDetails,details_WorkPlaceDescriptionText,details_FavoriteText,details_IsFavorite,details_ShowFavorite,details_MetaOgTextForSharing,details_DescriptionForSharing,details_TitleForSharing,details_RutePlan,details_FormattedPurpose,details_MapUrl,details_OrganizationNumber,details_ShowSearchJobButton,details_ShowPrint,details_BackToFindWorkButtonUrl,isExternal
0,False,1,IT Systemadministrator og Supporter,IT Systemadministrator og Supporter," 

Har du profilen, der brænder for at sikre en stabil og sikker IT-platform gennem drift, vedligehold og udvikling af driftskritisk infrastruktur og applikationer, samtidig med at du er v",Samn Forsyning,Alrøvej 11,8700,Horsens,False,False,False,True,2022-04-27T00:00:00,2022-06-22T00:00:00,22. juni 2022,0001-01-01T00:00:00,False,False,https://job.jobnet.dk/CV/FindWork/Details/5584568,Midtjylland,Horsens,Danmark,8700,,,,Fuldtid,It og teleteknik,"Drift, support og netværk",Systemadministrator,55.8549,9.8546,,,0,0,38222589,False,False,https://job.jobnet.dk/CV/FindWork/DetailsSocialmedia/5584568,https://job.jobnet.dk/CV/FindWork/Details/5584568,https://job.jobnet.dk/CV/FindWork/Details/5584568,True,5584568,55.8549,9.8546,"{'Id': 1, 'Name': 'Fuldtid'}, {'Id': 16, 'Name': 'Deltid'}","{'Id': 1, 'Name': 'Almindelige vilkår'}, {'Id': 2, 'Name': 'Fleksjob'}, {'Id': 3, 'Name': 'Skånejob'}, {'Id': 4, 'Name': 'Egnet til efterlønnere og seniorer'}, {'Id': 5, 'Name': 'Job med løntilskud'}, {'Id': 6, 'Name': 'Rotationsjob'}, {'Id': 7, 'Name': 'Virksomhedspraktik'}","{'Id': 1, 'Name': 'Fastansættelse'}, {'Id': 16, 'Name': 'Tidsbegrænset ansættelse'}",Samn Forsyning,Alrøvej 11,58,Danmark,615,Horsens,2,Midtjylland,8700,Horsens,,0,Primary,,,,None,,1021970626,38222589,None,5584568,5584568,Samn Forsyning,Alrøvej 11,58,Danmark,615,Horsens,2,Midtjylland,8700,Horsens,,0,Primary,,,,None,,1021970626,38222589,None,,2022-04-27T00:00:00,2022-06-22T00:00:00,IT Systemadministrator og Supporter,"Har du profilen, der brænder for at sikre en stabil og sikker IT-platform gennem drift, vedligehold og udvikling af driftskritisk infrastruktur og applikationer, samtidig med at du er vild med at hjælpe dine kolleger med alle typer IT-udfordringer? Så har du en unik mulighed for at blive en del af en Samn Forsyning. 
   
 Vi har over de seneste år skabt en sikker og stabil IT-platform, som danner grundlaget for at blive endnu bedre. Vi har egen serverdrift og ønsker løbende optimering af vores miljø. Du skal sammen med den IT Fagansvarlige varetage professionel daglig systemdrift. 
 Sideløbende, supporteres ca. 100 kolleger i Samn Forsyning, hvor relationer og forståelse for den enkeltes behov er essentielt. 
 I stillingen som IT Systemadministrator og Supporter vil dine primære opgaver være: 
 
 Vedligeholdelse og sikre driften af IT og telefoni 
 Fejlfinding og problemløsning af infrastrukturtjenester 
 Strømline og automatisere daglige driftsopgaver 
 Implementere infrastrukturopgaver, f.eks. udrulning af hardware eller opdateringer 
 Daglig brugersupport herunder opsætning og IT-assistance 
 Producere og vedligeholde dokumentation og vejledninger 
 Drive egne IT-projekter fra A-Z, f.eks. implementering af nye IT-sikkerhedstiltag 
 Du fungerer som bro mellem interne specialister, leverandører og forretningen i forbindelse med udviklingsopgaver, hvor IT indgår. 
 
 Vi tilbyder et afvekslende arbejde, hvor du den ene dag vedligeholder AD, opdaterer sikkerhedspakker eller vedligeholder servere og den næste dag supporterer med fejlretning, brugersupport eller oplæring af kolleger. 
 Du får en stor berøringsflade blandt dygtige og specialiserede kolleger med hvert deres kompetenceområde. Det er derfor vigtigt, du har gode kommunikationsevner, er udadvendt og formidler IT nemt og forståeligt på alle niveauer. 
 Mere om dig 
 Personligt har du et positivt, selvstændigt drive, god gennemslagskraft og trives med selvledelse. Du er ikke bange for at springe ud i nye opgaver, som du endnu ikke kender til bunds. Du har et godt overblik, arbejder struktureret, kan selv prioritere din tid og har fokus på at sikre ejerskab i forretningen. Du er tillidsskabende og lyttende og giver din mening til kende, og du bidrager gerne med nye ideer. 
 Du har som minimum en faglig IT-uddannelse, suppleret med en grundlæggende ITIL og en projektlederuddannelse, der sikrer en ensartet strukturel løsning af opgaverne. 
 Hos Samn Forsyning får du … 
 Et ansvarsfuldt job med mange spændende udfordringer og faglig sparring samt mulighed for deltagelse i relevante netværk og diverse temadage. Du bliver en del af en afdeling med god stemning, hvor vi hjælper hinanden, og du altid kan regne med dine kolleger. Vores omgangstone er åben og uformel, og vi har et godt arbejdsklima. 
 Hos os er organisationsstrukturen flad, og det betyder, at der ikke er langt fra tanke til handling og korte beslutningsprocesser. Vi har et højt ambitions- og vidensniveau, og der er derfor også gode muligheder for faglig og personlig udvikling. 
 Ansættelsesvilkår 
 Løn efter forhandling, inkl. pension samt sundhedsforsikring, 37 timer inkl. frokost samt mulighed for hjemmearbejde. Du ansættes i henhold til gældende overenskomst mellem KL og din organisation. 
 Klar til at ansøge? 
 Vi glæder os til at modtage en kort motiveret ansøgning og CV hurtigst muligt ved at trykke ""ANSØG"" herunder. Alle henvendelser behandles fortroligt og med diskretion. 
 Vi vurderer ansøgningerne løbende og indkalder derfor også løbende kandidater til samtale. 
 Har du spørgsmål, er du velkommen til at kontakte: 
 
 Anne Ellegaard, Kundechef ved Samn Forsyning: 7626 8710 /  ael@samn.dk 
 Anders Andresen, IT Fagansvarlig ved Samn Forsyning: 7626 8739 /  ama@samn.dk 
 
 Hvem er vi? 
 Samn Forsyning ApS er et fælles selskab mellem Horsens Vand A/S og Odder Spildevand A/S. Samn Forsyning ApS varetager alle opgaver inden for drift, anlæg og projektering, håndtering af regnvand, spildevand og drikkevand samt udvikling af miljøforbedrende løsninger inden for området. 
 Selskabet beskæftiger på nuværende tidspunkt 100 medarbejdere. Her er vi et samlet et stærkt hold af kompetente og dygtige medarbejdere 
 Læs mere på  www.samn.dk",Alrøvej 11,58,Danmark,615,Horsens,2,Midtjylland,8700,Horsens,1,1,Fuldtid,None,None,1,,0,,0,0,0,,False,"{'Id': 7936913, 'Email': None, 'FaxNumber': None, 'PersonName': 'Anne Ellegaard', 'FirstName': 'Anne', 'LastName': 'Ellegaard', 'PositionTitle': None, 'PhoneNumbers': [{'Number': '25 94 60 06', 'Type': 0, 'Description': 'Hovednummer'}]}",,False,False,False,False,4,,,False,False,False,False,,,,,https://indkom.dk/job?hr=show-job/96098,False,2022-06-22T00:00:00,,0,Primary,7,/CV/FindWork/GetLogo?JobAdId=5584568&Organisation=38222589,"Alrøvej 11,8700, Horsens",True,False,/CV/Jobseeking/JobLog/CreateJobSearch?JobnetJobPostingIdentifier=5584568&Company.Name=Samn Forsyning&SubmissionDeadlineDate=2022-6-22&Title=IT Systemadministrator og Supporter&WeeklyWorkTime=1,00000000-0000-0000-0000-000000000000,False,0,,,IT Systemadministrator og Supporter,True,,True,1,,5584568,,,False,False,,0,False,Samn Forsyning,Alrøvej 11,,,8700,False,False,False,Horsens,Anne Ellegaard,25 94 60 06,,,,,,False,,2022-06-22T00:00:00,,0,False,0,,,,,0,,,,False,False,,,False,False,,,,False,,False,,,Arbejdspladsen ligger i Horsens kommune,False,Samn Forsyning,,None,,False,False,"Har du profilen, der br&aelig;nder for at sikre en stabil og sikker IT-platform gennem drift, vedligehold og udvikling af driftskritisk infrastruktur og applikationer, samtidig med at du er vild med at hj&aelig;lpe dine kolleger med alle typer IT-udfordringer? S&aring; har du en unik mulighed for at blive en del af en Samn Forsyning.

 

Vi har","""Har du profilen, der br\u0026aelig;nder for at sikre en stabil og sikker IT-platform gennem drift, vedligehold og udvikling af driftskritisk infrastruktur og applikationer, samtidig med at du er vild med at hj\u0026aelig;lpe dine kolleger med alle typer IT-udfordringer? S\u0026aring; har du en unik mulighed for at blive en del af en Samn Forsyning.\r\n\r\n \r\n\r\nVi har""","""IT Systemadministrator og Supporter""","https://www.google.dk/maps/dir//Alrøvej+11,8700,+Horsens/","Har du profilen, der brænder for at sikre en stabil og sikker IT-platform gennem drift, vedligehold og udvikling af driftskritisk infrastruktur og applikationer, samtidig med at du er vild med at hjælpe dine kolleger med alle typer IT-udfordringer? Så har du en unik mulighed for at blive en del af en Samn Forsyning. 
   
 Vi har over de seneste år skabt en sikker og stabil IT-platform, som danner grundlaget for at blive endnu bedre. Vi har egen serverdrift og ønsker løbende optimering af vores miljø. Du skal sammen med den IT Fagansvarlige varetage professionel daglig systemdrift. 
 Sideløbende, supporteres ca. 100 kolleger i Samn Forsyning, hvor relationer og forståelse for den enkeltes behov er essentielt. 
 I stillingen som IT Systemadministrator og Supporter vil dine primære opgaver være: 
 
 Vedligeholdelse og sikre driften af IT og telefoni 
 Fejlfinding og problemløsning af infrastrukturtjenester 
 Strømline og automatisere daglige driftsopgaver 
 Implementere infrastrukturopgaver, f.eks. udrulning af hardware eller opdateringer 
 Daglig brugersupport herunder opsætning og IT-assistance 
 Producere og vedligeholde dokumentation og vejledninger 
 Drive egne IT-projekter fra A-Z, f.eks. implementering af nye IT-sikkerhedstiltag 
 Du fungerer som bro mellem interne specialister, leverandører og forretningen i forbindelse med udviklingsopgaver, hvor IT indgår. 
 
 Vi tilbyder et afvekslende arbejde, hvor du den ene dag vedligeholder AD, opdaterer sikkerhedspakker eller vedligeholder servere og den næste dag supporterer med fejlretning, brugersupport eller oplæring af kolleger. 
 Du får en stor berøringsflade blandt dygtige og specialiserede kolleger med hvert deres kompetenceområde. Det er derfor vigtigt, du har gode kommunikationsevner, er udadvendt og formidler IT nemt og forståeligt på alle niveauer. 
 Mere om dig 
 Personligt har du et positivt, selvstændigt drive, god gennemslagskraft og trives med selvledelse. Du er ikke bange for at springe ud i nye opgaver, som du endnu ikke kender til bunds. Du har et godt overblik, arbejder struktureret, kan selv prioritere din tid og har fokus på at sikre ejerskab i forretningen. Du er tillidsskabende og lyttende og giver din mening til kende, og du bidrager gerne med nye ideer. 
 Du har som minimum en faglig IT-uddannelse, suppleret med en grundlæggende ITIL og en projektlederuddannelse, der sikrer en ensartet strukturel løsning af opgaverne. 
 Hos Samn Forsyning får du … 
 Et ansvarsfuldt job med mange spændende udfordringer og faglig sparring samt mulighed for deltagelse i relevante netværk og diverse temadage. Du bliver en del af en afdeling med god stemning, hvor vi hjælper hinanden, og du altid kan regne med dine kolleger. Vores omgangstone er åben og uformel, og vi har et godt arbejdsklima. 
 Hos os er organisationsstrukturen flad, og det betyder, at der ikke er langt fra tanke til handling og korte beslutningsprocesser. Vi har et højt ambitions- og vidensniveau, og der er derfor også gode muligheder for faglig og personlig udvikling. 
 Ansættelsesvilkår 
 Løn efter forhandling, inkl. pension samt sundhedsforsikring, 37 timer inkl. frokost samt mulighed for hjemmearbejde. Du ansættes i henhold til gældende overenskomst mellem KL og din organisation. 
 Klar til at ansøge? 
 Vi glæder os til at modtage en kort motiveret ansøgning og CV hurtigst muligt ved at trykke ""ANSØG"" herunder. Alle henvendelser behandles fortroligt og med diskretion. 
 Vi vurderer ansøgningerne løbende og indkalder derfor også løbende kandidater til samtale. 
 Har du spørgsmål, er du velkommen til at kontakte: 
 
 Anne Ellegaard, Kundechef ved Samn Forsyning: 7626 8710 /  ael@samn.dk 
 Anders Andresen, IT Fagansvarlig ved Samn Forsyning: 7626 8739 /  ama@samn.dk 
 
 Hvem er vi? 
 Samn Forsyning ApS er et fælles selskab mellem Horsens Vand A/S og Odder Spildevand A/S. Samn Forsyning ApS varetager alle opgaver inden for drift, anlæg og projektering, håndtering af regnvand, spildevand og drikkevand samt udvikling af miljøforbedrende løsninger inden for området. 
 Selskabet beskæftiger på nuværende tidspunkt 100 medarbejdere. Her er vi et samlet et stærkt hold af kompetente og dygtige medarbejdere 
 Læs mere på  www.samn.dk","https://www.google.dk/maps/place/Alrøvej+11,8700,+Horsens/",38222589,False,False,,False
