summary_AutomatchType,summary_Abroad,summary_Weight,summary_Title,summary_JobHeadline,summary_Presentation,summary_HiringOrgName,summary_WorkPlaceAddress,summary_WorkPlacePostalCode,summary_WorkPlaceCity,summary_WorkPlaceOtherAddress,summary_WorkPlaceAbroad,summary_WorkPlaceNotStatic,summary_UseWorkPlaceAddressForJoblog,summary_PostingCreated,summary_LastDateApplication,summary_FormattedLastDateApplication,summary_AssignmentStartDate,summary_IsHotjob,summary_IsExternal,summary_Url,summary_Region,summary_Municipality,summary_Country,summary_PostalCode,summary_PostalCodeName,summary_JobAnnouncementType,summary_EmploymentType,summary_WorkHours,summary_OccupationArea,summary_OccupationGroup,summary_Occupation,summary_Location_Latitude,summary_Location_Longitude,summary_JoblogWorkTime_WorkHour,summary_JoblogWorkTime_DailyWorkTime,summary_WorkplaceID,summary_OrganisationId,summary_HiringOrgCVR,summary_UserLoggedIn,summary_AnonymousEmployer,summary_ShareUrl,summary_DetailsUrl,summary_JobLogUrl,summary_HasLocationValues,summary_ID,summary_Latitude,summary_Longitude,details_WorkSchedule,details_WorkConditions,details_EmploymentTypes,details_WorkPlace_Name,details_WorkPlace_Address_AddressLine,details_WorkPlace_Address_Country_Id,details_WorkPlace_Address_Country_Name,details_WorkPlace_Address_Municipality_Id,details_WorkPlace_Address_Municipality_Name,details_WorkPlace_Address_Region_Id,details_WorkPlace_Address_Region_Name,details_WorkPlace_Address_PostalCode,details_WorkPlace_Address_City,details_WorkPlace_PhoneNumber_Number,details_WorkPlace_PhoneNumber_Type,details_WorkPlace_PhoneNumber_Description,details_WorkPlace_FaxNumber,details_WorkPlace_Email,details_WorkPlace_WebAddress,details_WorkPlace_Description,details_WorkPlace_Logo,details_WorkPlace_WorkPlaceOrganizationNumber,details_WorkPlace_OrganizationNumber,details_WorkPlace_OrganizationDescription,details_JobPositionPosting_Id,details_JobPositionPosting_OriginalJppId,details_JobPositionPosting_HiringOrg_Name,details_JobPositionPosting_HiringOrg_Address_AddressLine,details_JobPositionPosting_HiringOrg_Address_Country_Id,details_JobPositionPosting_HiringOrg_Address_Country_Name,details_JobPositionPosting_HiringOrg_Address_Municipality_Id,details_JobPositionPosting_HiringOrg_Address_Municipality_Name,details_JobPositionPosting_HiringOrg_Address_Region_Id,details_JobPositionPosting_HiringOrg_Address_Region_Name,details_JobPositionPosting_HiringOrg_Address_PostalCode,details_JobPositionPosting_HiringOrg_Address_City,details_JobPositionPosting_HiringOrg_PhoneNumber_Number,details_JobPositionPosting_HiringOrg_PhoneNumber_Type,details_JobPositionPosting_HiringOrg_PhoneNumber_Description,details_JobPositionPosting_HiringOrg_FaxNumber,details_JobPositionPosting_HiringOrg_Email,details_JobPositionPosting_HiringOrg_WebAddress,details_JobPositionPosting_HiringOrg_Description,details_JobPositionPosting_HiringOrg_Logo,details_JobPositionPosting_HiringOrg_WorkPlaceOrganizationNumber,details_JobPositionPosting_HiringOrg_OrganizationNumber,details_JobPositionPosting_HiringOrg_OrganizationDescription,details_JobPositionPosting_RecruitingCompany,details_JobPositionPosting_PublicationStartDate,details_JobPositionPosting_PublicationEndDate,details_JobPositionPosting_JobPositionInformation_PositionTitle,details_JobPositionPosting_JobPositionInformation_Purpose,details_JobPositionPosting_JobPositionInformation_WorkLocation_AddressLine,details_JobPositionPosting_JobPositionInformation_WorkLocation_Country_Id,details_JobPositionPosting_JobPositionInformation_WorkLocation_Country_Name,details_JobPositionPosting_JobPositionInformation_WorkLocation_Municipality_Id,details_JobPositionPosting_JobPositionInformation_WorkLocation_Municipality_Name,details_JobPositionPosting_JobPositionInformation_WorkLocation_Region_Id,details_JobPositionPosting_JobPositionInformation_WorkLocation_Region_Name,details_JobPositionPosting_JobPositionInformation_WorkLocation_PostalCode,details_JobPositionPosting_JobPositionInformation_WorkLocation_City,details_JobPositionPosting_JobPositionInformation_EmploymentType,details_JobPositionPosting_JobPositionInformation_WeeklyWorkHours_TypeId,details_JobPositionPosting_JobPositionInformation_WeeklyWorkHours_TypeName,details_JobPositionPosting_JobPositionInformation_WeeklyWorkHours_Description,details_JobPositionPosting_JobPositionInformation_CompensationDescription,details_JobPositionPosting_JobPositionInformation_NumberToFill,details_JobPositionPosting_JobPositionInformation_DriverLicense,details_JobPositionPosting_JobPositionInformation_Occupation_DiscoWeb,details_JobPositionPosting_JobPositionInformation_Occupation_AlternateNames,details_JobPositionPosting_JobPositionInformation_Occupation_GroupId,details_JobPositionPosting_JobPositionInformation_Occupation_AreaId,details_JobPositionPosting_JobPositionInformation_Occupation_Id,details_JobPositionPosting_JobPositionInformation_Occupation_Name,details_JobPositionPosting_JobPositionInformation_IsGovernmentHiring,details_JobPositionPosting_JobPositionInformation_JppContacts,details_JobPositionPosting_JobPositionInformation_EmploymentDate,details_JobPositionPosting_IsRecruitmentOfForeignNationals,details_JobPositionPosting_IsWorkInDenmark,details_JobPositionPosting_IsAnonymousEmployer,details_JobPositionPosting_IsDisabilityFriendly,details_JobPositionPosting_JppType,details_JobPositionPosting_ApplicationDetails_WorkHourMax,details_JobPositionPosting_ApplicationDetails_WorkHourMin,details_JobPositionPosting_ApplicationDetails_DailyWorkTimeWeekend,details_JobPositionPosting_ApplicationDetails_DailyWorkTimeNight,details_JobPositionPosting_ApplicationDetails_DailyWorkTimeEvening,details_JobPositionPosting_ApplicationDetails_DailyWorkTimeDay,details_JobPositionPosting_ApplicationDetails_ReferenceText,details_JobPositionPosting_ApplicationDetails_RemarksToApplicant,details_JobPositionPosting_ApplicationDetails_ByEmail,details_JobPositionPosting_ApplicationDetails_ByPhone,details_JobPositionPosting_ApplicationDetails_ApplyViaUrl,details_JobPositionPosting_ApplicationDetails_ReplyInWriting,details_JobPositionPosting_ApplicationDetails_ApplicationDeadlineDate,details_JobPositionPosting_ContactAuthorityPhoneNumber_Number,details_JobPositionPosting_ContactAuthorityPhoneNumber_Type,details_JobPositionPosting_ContactAuthorityPhoneNumber_Description,details_JobPositionPosting_Status,details_LogoUrl,details_Address,details_ShowMap,details_ShowShareButtonJobLog,details_JobLogUrl,details_JobLogTemplateModel_Identifier,details_JobLogTemplateModel_UseWorkPlaceAddressForJoblog,details_JobLogTemplateModel_Category,details_JobLogTemplateModel_CvCustomerIdentifier,details_JobLogTemplateModel_JobSeekingStatus,details_JobLogTemplateModel_Title,details_JobLogTemplateModel_IsApplicationSourceRequired,details_JobLogTemplateModel_ApplicationSource,details_JobLogTemplateModel_IsWeeklyWorkTimeRequired,details_JobLogTemplateModel_WeeklyWorkTime,details_JobLogTemplateModel_HoursPerWeek,details_JobLogTemplateModel_JobnetJobPostingIdentifier,details_JobLogTemplateModel_JobAdDocument_Title,details_JobLogTemplateModel_JobAdDocument_Identifier,details_JobLogTemplateModel_JobAdDocument_IsDeletedBySystem,details_JobLogTemplateModel_JobAdDocument_IsDeletedByUser,details_JobLogTemplateModel_JobAdFile,details_JobLogTemplateModel_Company_JobLogEntryCategory,details_JobLogTemplateModel_Company_ShowAddressFieldsEvenIfEmpty,details_JobLogTemplateModel_Company_Name,details_JobLogTemplateModel_Company_Address,details_JobLogTemplateModel_Company_Country,details_JobLogTemplateModel_Company_EmploymentAreaID,details_JobLogTemplateModel_Company_PostCode,details_JobLogTemplateModel_Company_IsCountryAndTownAndPostCodeEmpty,details_JobLogTemplateModel_Company_IsTownAndPostCodeEmpty,details_JobLogTemplateModel_Company_IsCountryDanmark,details_JobLogTemplateModel_Company_Town,details_JobLogTemplateModel_Company_ContactPerson,details_JobLogTemplateModel_Company_Phone,details_JobLogTemplateModel_Company_Email,details_JobLogTemplateModel_Company_Latitude,details_JobLogTemplateModel_Company_Longitude,details_JobLogTemplateModel_Company_DailyTravelTimeInMinutes,details_JobLogTemplateModel_Company_DistanceToCompanyInMeters,details_JobLogTemplateModel_Company_IsCreateMode,details_JobLogTemplateModel_TypeOfSubmission,details_JobLogTemplateModel_SubmissionDate,details_JobLogTemplateModel_SubmissionDateFormatted,details_JobLogTemplateModel_SubmissionDateTiks,details_JobLogTemplateModel_IsSubmissionDateRequired,details_JobLogTemplateModel_Status,details_JobLogTemplateModel_DateCreatedFormatted,details_JobLogTemplateModel_DateCreated,details_JobLogTemplateModel_DateModifiedFormatted,details_JobLogTemplateModel_DateModified,details_JobLogTemplateModel_LastModifiedDateTiks,details_JobLogTemplateModel_DateClosed,details_JobLogTemplateModel_JobApplicationDocument_Title,details_JobLogTemplateModel_JobApplicationDocument_Identifier,details_JobLogTemplateModel_JobApplicationDocument_IsDeletedBySystem,details_JobLogTemplateModel_JobApplicationDocument_IsDeletedByUser,details_JobLogTemplateModel_CvDocument_Title,details_JobLogTemplateModel_CvDocument_Identifier,details_JobLogTemplateModel_CvDocument_IsDeletedBySystem,details_JobLogTemplateModel_CvDocument_IsDeletedByUser,details_JobLogTemplateModel_JobApplicationFile,details_JobLogTemplateModel_CvFile,details_JobLogTemplateModel_SubmissionDeadlineDate,details_JobLogTemplateModel_IsPersisted,details_JobLogTemplateModel_ServerValidationErrors,details_JobLogTemplateModel_HasServerValidationErrors,details_JoblogWorkTime_WorkHour,details_JoblogWorkTime_DailyWorkTime,details_Place,details_OpenPrintDialog,details_WorkPlaceInfoText,details_JobCenterContactDetails,details_WorkPlaceDescriptionText,details_FavoriteText,details_IsFavorite,details_ShowFavorite,details_MetaOgTextForSharing,details_DescriptionForSharing,details_TitleForSharing,details_RutePlan,details_FormattedPurpose,details_MapUrl,details_OrganizationNumber,details_ShowSearchJobButton,details_ShowPrint,details_BackToFindWorkButtonUrl,isExternal
0,False,1,"Afdelingsleder til Aktivitets- og Læringstilbud Bakkevænget, Postens Vej","Afdelingsleder til Aktivitets- og Læringstilbud Bakkevænget, Postens Vej","Tænker du en lederopgave, hvor du er tæt på ledelsen af kerneopgaven – i et velfungerende dagtilbud? Hvor der er kompetente medarbejdere, der ønsker og indgår i en åben og kval",Vejle Kommune,H.O. Wildenskovsvej 10,7080,Børkop,False,False,False,True,2022-04-29T00:00:00,2022-05-14T00:00:00,14. maj 2022,0001-01-01T00:00:00,False,False,https://job.jobnet.dk/CV/FindWork/Details/5584305,Syddanmark,Vejle,Danmark,7080,,,,Fuldtid,Ledelse,"Administration, strategi og personale",Afdelingsleder,55.6689,9.6827,,,0,48580,29189900,False,False,https://job.jobnet.dk/CV/FindWork/DetailsSocialmedia/5584305,https://job.jobnet.dk/CV/FindWork/Details/5584305,https://job.jobnet.dk/CV/FindWork/Details/5584305,True,5584305,55.6689,9.6827,"{'Id': 1, 'Name': 'Fuldtid'}, {'Id': 16, 'Name': 'Deltid'}","{'Id': 1, 'Name': 'Almindelige vilkår'}, {'Id': 2, 'Name': 'Fleksjob'}, {'Id': 3, 'Name': 'Skånejob'}, {'Id': 4, 'Name': 'Egnet til efterlønnere og seniorer'}, {'Id': 5, 'Name': 'Job med løntilskud'}, {'Id': 6, 'Name': 'Rotationsjob'}, {'Id': 7, 'Name': 'Virksomhedspraktik'}","{'Id': 1, 'Name': 'Fastansættelse'}, {'Id': 16, 'Name': 'Tidsbegrænset ansættelse'}",Vejle Kommune,H.O. Wildenskovsvej 10,58,Danmark,630,Vejle,3,Syddanmark,7080,Børkop,,0,Primary,,,,None,,1003333996,29189900,None,5584305,5584305,Vejle Kommune,H.O. Wildenskovsvej 10,58,Danmark,630,Vejle,3,Syddanmark,7080,Børkop,,0,Primary,,,,None,,1003333996,29189900,None,,2022-04-29T00:00:00,2022-05-14T00:00:00,"Afdelingsleder til Aktivitets- og Læringstilbud Bakkevænget, Postens Vej","Tænker du en lederopgave, hvor du er tæt på ledelsen af kerneopgaven – i et velfungerende dagtilbud? Hvor der er kompetente medarbejdere, der ønsker og indgår i en åben og kvalificerende dialog? Kerneopgaven på Postens vej er ""Herre i eget hus – et liv i læring"".  Kan du genkende værdi i at ledelse foregår i et forpligtende fællesskab? Hos os hedder det Ledelse på tværs.  Har du din ledelsesopmærksomhed på at faglighed og samarbejde er hinandens forudsætninger for at lykkes med udvikling af det pædagogiske arbejde? Måske er det dig vi søger som afdelingsleder til Aktivitets- og Læringstilbuddet Bakkevænget på Postens Vej!   Om jobbet Bakkevænget et Aktivitets- og Læringstilbud, hvor der kommer ca. 100 borgere. De pædagogiske tilbud spænder vidt fra udeliv, kreativitet, cafe, bevægelse, musik, sang, udvikling af kommunikative færdigheder - en bred palet, som er under stadig udvikling. Vi ønsker etablering af et brugerråd, hvor borgerne inddrages med synspunkter omkring udviklingen af Bakkevænget. Her er muligheden for ledelse i praksis med at bidrage til at gøre en forskel i udviklingen af det unikke pædagogiske tilbud til borgerne og en eftertragtet arbejdsplads for medarbejderne. Derfor er det måske dig – hvis du er målrettet på: at skabe resultater at spille hinanden gode at tegne fremtiden at du vil noget Ledelsen af det pædagogiske arbejde hviler på et fagligt fundament af LA2, KRAP, neuropædagogik, sanseintegration og inddragelse af bevægelse i hverdagen. Cafe drift og udvikling af denne er en prioritet. Vi ønsker at udvikle læringsperspektivet på dagtilbuddet. Det vægtes, at der er nærledelse, hvor medarbejderne har et tæt samarbejde med ledelsen. Vi ønsker, at du er erfaren leder og gerne med lederuddannelse eller vilje til at tage diplomuddannelse i ledelse. Vi ser gerne, at du har kurser inden for nogle af de faglige områder, som det pædagogiske fundament hviler på eller vilje til at få viden om disse. Hvis du tænker ""jeg er fra specialskoleområdet – er de mon interesseret?"". JA! Vi er interesserede i ansøgere med mange forskellige baggrunde.   Tiltrædelse 1. juli 2022   Vi forventer af dig: at du kan lede den pædagogiske faglighed med øje for kompetencer, ressourcer og muligheder at du har erfaring med ledelse af dokumentationsarbejdet og borgernes indsatsmål og delmål at du har praksiserfaring med udvikling af fælles kultur og kan understøtte den videre udvikling i at være et fælles aktivitets- og læringstilbud, der har et stærkt samarbejde med døgn at du har erfaring med at det opleves, at du skaber retning, er tydelig, synlig og nærværende i din ledelse at du har erfaring med at styre økonomien inden for de udmeldte budgetter at du har fået tilbagemelding på, at du kan skabe motivation og arbejdsglæde Postens Vejs kerneopgave  ""Herre i eget hus – et liv i læring"" , hvor de centrale områder er udvikling af borgernes egen stemme for at fremme selvbestemmelse, selvstændighed, kommunikation og sociale netværk. Det vil have betydning, at du har fået feed back på at kunne skabe mening i udvikling af det pædagogiske arbejde, hvor borgernes kompetencer udvikles.   Vi tilbyder dig: Bakkevænget er et hus med engagerede medarbejdere, der har fokus på at gøre en forskel for borgerne i det pædagogiske arbejde, hvor der er fokus på det gode psykiske arbejdsmiljø Et ledelsesfællesskab med et velfungerende samarbejde – hvor vi har lang erfaring med at udfordre og hjælpe på tværs Gode muligheder for faglig og personlig udvikling Hvis du har kompetencer som VISO specialist inden for Autisme med udviklingshæmning – kan vi drøfte om disse kompetencer vil kunne anvendes   Ansættelsesvilkår Løn- og ansættelsesvilkår efter gældende overenskomst med relevant faglig organisation efter aftalerne om ny løn.   Om os Postens Vej er et botilbud og Aktivitets & Læringstilbud for voksne borgere med nedsat psykisk og fysisk funktionsevne og forskellige gennemgribende udviklingsforstyrrelser som f.eks. ADHD og autisme. Nogle borgere har omfattende udfordringer på baggrund af epilepsi. Der bor 95 borgere og der er 4 aflastningspladser. Borgerne bor i 6 huse. Bakkevænget er Aktivitets & Læringstilbud for borgerne fra Postens Vej samt andre centre og hjemmeboende. Tilbuddene ligger inden for gåafstand. Der er på Postens Vej samlet ansat ca. 250 medarbejdere. I ledelsen er vi 9 engagerede ledere med forskellige kompetencer, som vi gerne sætter i spil på tværs af Postens Vej.   Flere oplysninger Du er velkommen til at ringe til centerleder Hanne P Frandsen på 22 84 18 26 for en dialog om stillingen og mulighed for at vi gensidigt kan danne os et førstehåndsindtryk d. 4.5. kl 11:00-13:00, d. 10.5 kl. 14:30:16:00 og alternativt er du velkommen til at maile til hfsen@vejle.dk, så finder vi et tidspunkt, der passer. Du kan se vores præsentationsfilm og læse mere om os på Postensvej.vejle.dk samt få indblik i hverdagen på Facebook siderne  Postensvej  og  Cafe Keller .   Ansøgningsfrist Ansøgningsfrist d. 14.5. Første samtale forventes afholdt d. 17.5 – anden samtale forventes afholdt d. 23.5 og der er d. 18.5 om formiddagen eksternt møde med en konsulent omkring personprofil analyse. Der kommer svar d. 16.5 om du bliver inviteret til samtale.   Profilanalyse Du må forberede dig på at vi benytter personprofilanalyse og cases i forbindelse med ansættelsen. Send din ansøgning Vi foretrækker, at du søger stillingen online ved at bruge knappen ""Send ansøgning"". Husk at vedhæfte din ansøgning og CV samt andre relevante bilag. Når du har sendt ansøgningen, modtager du en e-mail som kvittering. Vær opmærksom på, at mailen kan være placeret i din mappe Uønsket post. Vejle Kommune opfordrer alle til at søge stillingen uanset køn, alder, etnisk baggrund, handicap m.v. Overvejer du at flytte til Vejle? Så kan du få hjælp til bosætning. Se mere på www.vejle.dk/tilflytter.
 Denne jobannonce blev oprindeligt opslået på https://www.ofir.dk/
 (Den originale annonce kan ses på: https://www.ofir.dk/showojob?ofirid=e1e8fb54)",H.O. Wildenskovsvej 10,58,Danmark,630,Vejle,3,Syddanmark,7080,Børkop,1,1,Fuldtid,None,None,1,,0,,0,0,0,,False,"{'Id': 7945057, 'Email': None, 'FaxNumber': None, 'PersonName': 'Hanne Petersen Frandsen', 'FirstName': 'Hanne', 'LastName': 'Petersen Frandsen', 'PositionTitle': None, 'PhoneNumbers': [{'Number': '76810000', 'Type': 0, 'Description': 'Hovednummer'}]}",,False,False,False,False,4,,,False,False,False,False,,,,,https://www.ofir.dk/resultat/Jobannonce.aspx?ofirId=e1e8fb54&action=sendApplicationUrl,False,2022-05-14T00:00:00,,0,Primary,7,/CV/FindWork/GetLogo?JobAdId=5584305&Organisation=29189900,"H.O. Wildenskovsvej 10,7080, Børkop",True,False,"/CV/Jobseeking/JobLog/CreateJobSearch?JobnetJobPostingIdentifier=5584305&Company.Name=Vejle Kommune&SubmissionDeadlineDate=2022-5-14&Title=Afdelingsleder til Aktivitets- og Læringstilbud Bakkevænget, Postens Vej&WeeklyWorkTime=1",00000000-0000-0000-0000-000000000000,False,0,,,"Afdelingsleder til Aktivitets- og Læringstilbud Bakkevænget, Postens Vej",True,,True,1,,5584305,,,False,False,,0,False,Vejle Kommune,H.O. Wildenskovsvej 10,,,7080,False,False,False,Børkop,Hanne Petersen Frandsen,76810000,,,,,,False,,2022-05-14T00:00:00,,0,False,0,,,,,0,,,,False,False,,,False,False,,,,False,,False,,,Arbejdspladsen ligger i Vejle kommune,False,Vejle Kommune,,None,,False,False,"Tænker du en lederopgave, hvor du er tæt på ledelsen af kerneopgaven – i et velfungerende dagtilbud? Hvor der er kompetente medarbejdere, der ønsker og indgår i en åben og kvalificerende dialog?Kerneopgaven på Postens vej er  Herre i eget hus – et liv i læring . Kan du genkende værdi i at ledelse foregår i et forpligtende fællesskab? Hos os hedder ","""Tænker du en lederopgave, hvor du er tæt på ledelsen af kerneopgaven – i et velfungerende dagtilbud? Hvor der er kompetente medarbejdere, der ønsker og indgår i en åben og kvalificerende dialog?Kerneopgaven på Postens vej er  Herre i eget hus – et liv i læring . Kan du genkende værdi i at ledelse foregår i et forpligtende fællesskab? Hos os hedder ""","""Afdelingsleder til Aktivitets- og Læringstilbud Bakkevænget, Postens Vej""","https://www.google.dk/maps/dir//H.O.+Wildenskovsvej+10,7080,+Børkop/","Tænker du en lederopgave, hvor du er tæt på ledelsen af kerneopgaven – i et velfungerende dagtilbud? Hvor der er kompetente medarbejdere, der ønsker og indgår i en åben og kvalificerende dialog? Kerneopgaven på Postens vej er ""Herre i eget hus – et liv i læring"".  Kan du genkende værdi i at ledelse foregår i et forpligtende fællesskab? Hos os hedder det Ledelse på tværs.  Har du din ledelsesopmærksomhed på at faglighed og samarbejde er hinandens forudsætninger for at lykkes med udvikling af det pædagogiske arbejde? Måske er det dig vi søger som afdelingsleder til Aktivitets- og Læringstilbuddet Bakkevænget på Postens Vej!   Om jobbet Bakkevænget et Aktivitets- og Læringstilbud, hvor der kommer ca. 100 borgere. De pædagogiske tilbud spænder vidt fra udeliv, kreativitet, cafe, bevægelse, musik, sang, udvikling af kommunikative færdigheder - en bred palet, som er under stadig udvikling. Vi ønsker etablering af et brugerråd, hvor borgerne inddrages med synspunkter omkring udviklingen af Bakkevænget. Her er muligheden for ledelse i praksis med at bidrage til at gøre en forskel i udviklingen af det unikke pædagogiske tilbud til borgerne og en eftertragtet arbejdsplads for medarbejderne. Derfor er det måske dig – hvis du er målrettet på: at skabe resultater at spille hinanden gode at tegne fremtiden at du vil noget Ledelsen af det pædagogiske arbejde hviler på et fagligt fundament af LA2, KRAP, neuropædagogik, sanseintegration og inddragelse af bevægelse i hverdagen. Cafe drift og udvikling af denne er en prioritet. Vi ønsker at udvikle læringsperspektivet på dagtilbuddet. Det vægtes, at der er nærledelse, hvor medarbejderne har et tæt samarbejde med ledelsen. Vi ønsker, at du er erfaren leder og gerne med lederuddannelse eller vilje til at tage diplomuddannelse i ledelse. Vi ser gerne, at du har kurser inden for nogle af de faglige områder, som det pædagogiske fundament hviler på eller vilje til at få viden om disse. Hvis du tænker ""jeg er fra specialskoleområdet – er de mon interesseret?"". JA! Vi er interesserede i ansøgere med mange forskellige baggrunde.   Tiltrædelse 1. juli 2022   Vi forventer af dig: at du kan lede den pædagogiske faglighed med øje for kompetencer, ressourcer og muligheder at du har erfaring med ledelse af dokumentationsarbejdet og borgernes indsatsmål og delmål at du har praksiserfaring med udvikling af fælles kultur og kan understøtte den videre udvikling i at være et fælles aktivitets- og læringstilbud, der har et stærkt samarbejde med døgn at du har erfaring med at det opleves, at du skaber retning, er tydelig, synlig og nærværende i din ledelse at du har erfaring med at styre økonomien inden for de udmeldte budgetter at du har fået tilbagemelding på, at du kan skabe motivation og arbejdsglæde Postens Vejs kerneopgave  ""Herre i eget hus – et liv i læring"" , hvor de centrale områder er udvikling af borgernes egen stemme for at fremme selvbestemmelse, selvstændighed, kommunikation og sociale netværk. Det vil have betydning, at du har fået feed back på at kunne skabe mening i udvikling af det pædagogiske arbejde, hvor borgernes kompetencer udvikles.   Vi tilbyder dig: Bakkevænget er et hus med engagerede medarbejdere, der har fokus på at gøre en forskel for borgerne i det pædagogiske arbejde, hvor der er fokus på det gode psykiske arbejdsmiljø Et ledelsesfællesskab med et velfungerende samarbejde – hvor vi har lang erfaring med at udfordre og hjælpe på tværs Gode muligheder for faglig og personlig udvikling Hvis du har kompetencer som VISO specialist inden for Autisme med udviklingshæmning – kan vi drøfte om disse kompetencer vil kunne anvendes   Ansættelsesvilkår Løn- og ansættelsesvilkår efter gældende overenskomst med relevant faglig organisation efter aftalerne om ny løn.   Om os Postens Vej er et botilbud og Aktivitets & Læringstilbud for voksne borgere med nedsat psykisk og fysisk funktionsevne og forskellige gennemgribende udviklingsforstyrrelser som f.eks. ADHD og autisme. Nogle borgere har omfattende udfordringer på baggrund af epilepsi. Der bor 95 borgere og der er 4 aflastningspladser. Borgerne bor i 6 huse. Bakkevænget er Aktivitets & Læringstilbud for borgerne fra Postens Vej samt andre centre og hjemmeboende. Tilbuddene ligger inden for gåafstand. Der er på Postens Vej samlet ansat ca. 250 medarbejdere. I ledelsen er vi 9 engagerede ledere med forskellige kompetencer, som vi gerne sætter i spil på tværs af Postens Vej.   Flere oplysninger Du er velkommen til at ringe til centerleder Hanne P Frandsen på 22 84 18 26 for en dialog om stillingen og mulighed for at vi gensidigt kan danne os et førstehåndsindtryk d. 4.5. kl 11:00-13:00, d. 10.5 kl. 14:30:16:00 og alternativt er du velkommen til at maile til hfsen@vejle.dk, så finder vi et tidspunkt, der passer. Du kan se vores præsentationsfilm og læse mere om os på Postensvej.vejle.dk samt få indblik i hverdagen på Facebook siderne  Postensvej  og  Cafe Keller .   Ansøgningsfrist Ansøgningsfrist d. 14.5. Første samtale forventes afholdt d. 17.5 – anden samtale forventes afholdt d. 23.5 og der er d. 18.5 om formiddagen eksternt møde med en konsulent omkring personprofil analyse. Der kommer svar d. 16.5 om du bliver inviteret til samtale.   Profilanalyse Du må forberede dig på at vi benytter personprofilanalyse og cases i forbindelse med ansættelsen. Send din ansøgning Vi foretrækker, at du søger stillingen online ved at bruge knappen ""Send ansøgning"". Husk at vedhæfte din ansøgning og CV samt andre relevante bilag. Når du har sendt ansøgningen, modtager du en e-mail som kvittering. Vær opmærksom på, at mailen kan være placeret i din mappe Uønsket post. Vejle Kommune opfordrer alle til at søge stillingen uanset køn, alder, etnisk baggrund, handicap m.v. Overvejer du at flytte til Vejle? Så kan du få hjælp til bosætning. Se mere på  www.vejle.dk/tilflytter .
 Denne jobannonce blev oprindeligt opslået på  https://www.ofir.dk/ 
 (Den originale annonce kan ses på:  https://www.ofir.dk/showojob?ofirid=e1e8fb54 )","https://www.google.dk/maps/place/H.O.+Wildenskovsvej+10,7080,+Børkop/",29189900,False,False,,False
