summary_AutomatchType,summary_Abroad,summary_Weight,summary_Title,summary_JobHeadline,summary_Presentation,summary_HiringOrgName,summary_WorkPlaceAddress,summary_WorkPlacePostalCode,summary_WorkPlaceCity,summary_WorkPlaceOtherAddress,summary_WorkPlaceAbroad,summary_WorkPlaceNotStatic,summary_UseWorkPlaceAddressForJoblog,summary_PostingCreated,summary_LastDateApplication,summary_FormattedLastDateApplication,summary_AssignmentStartDate,summary_IsHotjob,summary_IsExternal,summary_Url,summary_Region,summary_Municipality,summary_Country,summary_PostalCode,summary_PostalCodeName,summary_JobAnnouncementType,summary_EmploymentType,summary_WorkHours,summary_OccupationArea,summary_OccupationGroup,summary_Occupation,summary_Location_Latitude,summary_Location_Longitude,summary_JoblogWorkTime_WorkHour,summary_JoblogWorkTime_DailyWorkTime,summary_WorkplaceID,summary_OrganisationId,summary_HiringOrgCVR,summary_UserLoggedIn,summary_AnonymousEmployer,summary_ShareUrl,summary_DetailsUrl,summary_JobLogUrl,summary_HasLocationValues,summary_ID,summary_Latitude,summary_Longitude,details_WorkSchedule,details_WorkConditions,details_EmploymentTypes,details_WorkPlace_Name,details_WorkPlace_Address_AddressLine,details_WorkPlace_Address_Country_Id,details_WorkPlace_Address_Country_Name,details_WorkPlace_Address_Municipality_Id,details_WorkPlace_Address_Municipality_Name,details_WorkPlace_Address_Region_Id,details_WorkPlace_Address_Region_Name,details_WorkPlace_Address_PostalCode,details_WorkPlace_Address_City,details_WorkPlace_PhoneNumber_Number,details_WorkPlace_PhoneNumber_Type,details_WorkPlace_PhoneNumber_Description,details_WorkPlace_FaxNumber,details_WorkPlace_Email,details_WorkPlace_WebAddress,details_WorkPlace_Description,details_WorkPlace_Logo,details_WorkPlace_WorkPlaceOrganizationNumber,details_WorkPlace_OrganizationNumber,details_WorkPlace_OrganizationDescription,details_JobPositionPosting_Id,details_JobPositionPosting_OriginalJppId,details_JobPositionPosting_HiringOrg_Name,details_JobPositionPosting_HiringOrg_Address_AddressLine,details_JobPositionPosting_HiringOrg_Address_Country_Id,details_JobPositionPosting_HiringOrg_Address_Country_Name,details_JobPositionPosting_HiringOrg_Address_Municipality_Id,details_JobPositionPosting_HiringOrg_Address_Municipality_Name,details_JobPositionPosting_HiringOrg_Address_Region_Id,details_JobPositionPosting_HiringOrg_Address_Region_Name,details_JobPositionPosting_HiringOrg_Address_PostalCode,details_JobPositionPosting_HiringOrg_Address_City,details_JobPositionPosting_HiringOrg_PhoneNumber_Number,details_JobPositionPosting_HiringOrg_PhoneNumber_Type,details_JobPositionPosting_HiringOrg_PhoneNumber_Description,details_JobPositionPosting_HiringOrg_FaxNumber,details_JobPositionPosting_HiringOrg_Email,details_JobPositionPosting_HiringOrg_WebAddress,details_JobPositionPosting_HiringOrg_Description,details_JobPositionPosting_HiringOrg_Logo,details_JobPositionPosting_HiringOrg_WorkPlaceOrganizationNumber,details_JobPositionPosting_HiringOrg_OrganizationNumber,details_JobPositionPosting_HiringOrg_OrganizationDescription,details_JobPositionPosting_RecruitingCompany,details_JobPositionPosting_PublicationStartDate,details_JobPositionPosting_PublicationEndDate,details_JobPositionPosting_JobPositionInformation_PositionTitle,details_JobPositionPosting_JobPositionInformation_Purpose,details_JobPositionPosting_JobPositionInformation_WorkLocation_AddressLine,details_JobPositionPosting_JobPositionInformation_WorkLocation_Country_Id,details_JobPositionPosting_JobPositionInformation_WorkLocation_Country_Name,details_JobPositionPosting_JobPositionInformation_WorkLocation_Municipality_Id,details_JobPositionPosting_JobPositionInformation_WorkLocation_Municipality_Name,details_JobPositionPosting_JobPositionInformation_WorkLocation_Region_Id,details_JobPositionPosting_JobPositionInformation_WorkLocation_Region_Name,details_JobPositionPosting_JobPositionInformation_WorkLocation_PostalCode,details_JobPositionPosting_JobPositionInformation_WorkLocation_City,details_JobPositionPosting_JobPositionInformation_EmploymentType,details_JobPositionPosting_JobPositionInformation_WeeklyWorkHours_TypeId,details_JobPositionPosting_JobPositionInformation_WeeklyWorkHours_TypeName,details_JobPositionPosting_JobPositionInformation_WeeklyWorkHours_Description,details_JobPositionPosting_JobPositionInformation_CompensationDescription,details_JobPositionPosting_JobPositionInformation_NumberToFill,details_JobPositionPosting_JobPositionInformation_DriverLicense,details_JobPositionPosting_JobPositionInformation_Occupation_DiscoWeb,details_JobPositionPosting_JobPositionInformation_Occupation_AlternateNames,details_JobPositionPosting_JobPositionInformation_Occupation_GroupId,details_JobPositionPosting_JobPositionInformation_Occupation_AreaId,details_JobPositionPosting_JobPositionInformation_Occupation_Id,details_JobPositionPosting_JobPositionInformation_Occupation_Name,details_JobPositionPosting_JobPositionInformation_IsGovernmentHiring,details_JobPositionPosting_JobPositionInformation_JppContacts,details_JobPositionPosting_JobPositionInformation_EmploymentDate,details_JobPositionPosting_IsRecruitmentOfForeignNationals,details_JobPositionPosting_IsWorkInDenmark,details_JobPositionPosting_IsAnonymousEmployer,details_JobPositionPosting_IsDisabilityFriendly,details_JobPositionPosting_JppType,details_JobPositionPosting_ApplicationDetails_WorkHourMax,details_JobPositionPosting_ApplicationDetails_WorkHourMin,details_JobPositionPosting_ApplicationDetails_DailyWorkTimeWeekend,details_JobPositionPosting_ApplicationDetails_DailyWorkTimeNight,details_JobPositionPosting_ApplicationDetails_DailyWorkTimeEvening,details_JobPositionPosting_ApplicationDetails_DailyWorkTimeDay,details_JobPositionPosting_ApplicationDetails_ReferenceText,details_JobPositionPosting_ApplicationDetails_RemarksToApplicant,details_JobPositionPosting_ApplicationDetails_ByEmail,details_JobPositionPosting_ApplicationDetails_ByPhone,details_JobPositionPosting_ApplicationDetails_ApplyViaUrl,details_JobPositionPosting_ApplicationDetails_ReplyInWriting,details_JobPositionPosting_ApplicationDetails_ApplicationDeadlineDate,details_JobPositionPosting_ContactAuthorityPhoneNumber_Number,details_JobPositionPosting_ContactAuthorityPhoneNumber_Type,details_JobPositionPosting_ContactAuthorityPhoneNumber_Description,details_JobPositionPosting_Status,details_LogoUrl,details_Address,details_ShowMap,details_ShowShareButtonJobLog,details_JobLogUrl,details_JobLogTemplateModel_Identifier,details_JobLogTemplateModel_UseWorkPlaceAddressForJoblog,details_JobLogTemplateModel_Category,details_JobLogTemplateModel_CvCustomerIdentifier,details_JobLogTemplateModel_JobSeekingStatus,details_JobLogTemplateModel_Title,details_JobLogTemplateModel_IsApplicationSourceRequired,details_JobLogTemplateModel_ApplicationSource,details_JobLogTemplateModel_IsWeeklyWorkTimeRequired,details_JobLogTemplateModel_WeeklyWorkTime,details_JobLogTemplateModel_HoursPerWeek,details_JobLogTemplateModel_JobnetJobPostingIdentifier,details_JobLogTemplateModel_JobAdDocument_Title,details_JobLogTemplateModel_JobAdDocument_Identifier,details_JobLogTemplateModel_JobAdDocument_IsDeletedBySystem,details_JobLogTemplateModel_JobAdDocument_IsDeletedByUser,details_JobLogTemplateModel_JobAdFile,details_JobLogTemplateModel_Company_JobLogEntryCategory,details_JobLogTemplateModel_Company_ShowAddressFieldsEvenIfEmpty,details_JobLogTemplateModel_Company_Name,details_JobLogTemplateModel_Company_Address,details_JobLogTemplateModel_Company_Country,details_JobLogTemplateModel_Company_EmploymentAreaID,details_JobLogTemplateModel_Company_PostCode,details_JobLogTemplateModel_Company_IsCountryAndTownAndPostCodeEmpty,details_JobLogTemplateModel_Company_IsTownAndPostCodeEmpty,details_JobLogTemplateModel_Company_IsCountryDanmark,details_JobLogTemplateModel_Company_Town,details_JobLogTemplateModel_Company_ContactPerson,details_JobLogTemplateModel_Company_Phone,details_JobLogTemplateModel_Company_Email,details_JobLogTemplateModel_Company_Latitude,details_JobLogTemplateModel_Company_Longitude,details_JobLogTemplateModel_Company_DailyTravelTimeInMinutes,details_JobLogTemplateModel_Company_DistanceToCompanyInMeters,details_JobLogTemplateModel_Company_IsCreateMode,details_JobLogTemplateModel_TypeOfSubmission,details_JobLogTemplateModel_SubmissionDate,details_JobLogTemplateModel_SubmissionDateFormatted,details_JobLogTemplateModel_SubmissionDateTiks,details_JobLogTemplateModel_IsSubmissionDateRequired,details_JobLogTemplateModel_Status,details_JobLogTemplateModel_DateCreatedFormatted,details_JobLogTemplateModel_DateCreated,details_JobLogTemplateModel_DateModifiedFormatted,details_JobLogTemplateModel_DateModified,details_JobLogTemplateModel_LastModifiedDateTiks,details_JobLogTemplateModel_DateClosed,details_JobLogTemplateModel_JobApplicationDocument_Title,details_JobLogTemplateModel_JobApplicationDocument_Identifier,details_JobLogTemplateModel_JobApplicationDocument_IsDeletedBySystem,details_JobLogTemplateModel_JobApplicationDocument_IsDeletedByUser,details_JobLogTemplateModel_CvDocument_Title,details_JobLogTemplateModel_CvDocument_Identifier,details_JobLogTemplateModel_CvDocument_IsDeletedBySystem,details_JobLogTemplateModel_CvDocument_IsDeletedByUser,details_JobLogTemplateModel_JobApplicationFile,details_JobLogTemplateModel_CvFile,details_JobLogTemplateModel_SubmissionDeadlineDate,details_JobLogTemplateModel_IsPersisted,details_JobLogTemplateModel_ServerValidationErrors,details_JobLogTemplateModel_HasServerValidationErrors,details_JoblogWorkTime_WorkHour,details_JoblogWorkTime_DailyWorkTime,details_Place,details_OpenPrintDialog,details_WorkPlaceInfoText,details_JobCenterContactDetails,details_WorkPlaceDescriptionText,details_FavoriteText,details_IsFavorite,details_ShowFavorite,details_MetaOgTextForSharing,details_DescriptionForSharing,details_TitleForSharing,details_RutePlan,details_FormattedPurpose,details_MapUrl,details_OrganizationNumber,details_ShowSearchJobButton,details_ShowPrint,details_BackToFindWorkButtonUrl,isExternal
0,False,1,Sagsbehandlere til Persondatas virtuelle enhed,Sagsbehandlere til Persondatas virtuelle enhed,"Vil du være med til at skabe fundamentet for finansieringen af det danske velfærdssamfund? Og trives du i en myndighedsrolle, hvor du bl.a. med tillidsbaseret dialog og faglighed er med til at sik","Skatteforvaltningen, Fredericia",Centerhavn 23,7000,Fredericia,False,False,False,True,2022-04-28T00:00:00,2022-05-22T00:00:00,22. maj 2022,0001-01-01T00:00:00,False,False,https://job.jobnet.dk/CV/FindWork/Details/5585880,Syddanmark,Fredericia,Danmark,7000,,,,Fuldtid,Akademisk arbejde,Administrativt arbejde,Fuldmægtig,55.5582,9.7434,,,115711,6998,19552101,False,False,https://job.jobnet.dk/CV/FindWork/DetailsSocialmedia/5585880,https://job.jobnet.dk/CV/FindWork/Details/5585880,https://job.jobnet.dk/CV/FindWork/Details/5585880,True,5585880,55.5582,9.7434,"{'Id': 1, 'Name': 'Fuldtid'}, {'Id': 16, 'Name': 'Deltid'}","{'Id': 1, 'Name': 'Almindelige vilkår'}, {'Id': 2, 'Name': 'Fleksjob'}, {'Id': 3, 'Name': 'Skånejob'}, {'Id': 4, 'Name': 'Egnet til efterlønnere og seniorer'}, {'Id': 5, 'Name': 'Job med løntilskud'}, {'Id': 6, 'Name': 'Rotationsjob'}, {'Id': 7, 'Name': 'Virksomhedspraktik'}","{'Id': 1, 'Name': 'Fastansættelse'}, {'Id': 16, 'Name': 'Tidsbegrænset ansættelse'}","Skatteforvaltningen, Fredericia",Centerhavn 23,58,Danmark,607,Fredericia,3,Syddanmark,7000,Fredericia,72376890,0,Primary,,,,None,115711,1004969235,19552101,"Skatteforvaltningen varetager en vigtig samfundsopgave. Vi opkræver hvert år de ca. 950 mia. kr. i skatter og afgifter, som er fundamentet for finansieringen af det danske samfund. Hos os får du derfor mulighed for at tage ansvar for en vigtig opgave og gøre en forskel. Vi har brug for ansatte med mange forskellige faglige kompetencer, og bredden i opgaverne giver også den enkelte mulighed for at få faglige udfordringer og udvikle sig. 

Er du vores nye kollega?",5585880,5585880,"Skatteforvaltningen, Fredericia",Centerhavn 23,58,Danmark,607,Fredericia,3,Syddanmark,7000,Fredericia,72376890,0,Primary,,,,None,115711,1004969235,19552101,"Skatteforvaltningen varetager en vigtig samfundsopgave. Vi opkræver hvert år de ca. 950 mia. kr. i skatter og afgifter, som er fundamentet for finansieringen af det danske samfund. Hos os får du derfor mulighed for at tage ansvar for en vigtig opgave og gøre en forskel. Vi har brug for ansatte med mange forskellige faglige kompetencer, og bredden i opgaverne giver også den enkelte mulighed for at få faglige udfordringer og udvikle sig. 

Er du vores nye kollega?",,2022-04-28T00:00:00,2022-05-22T00:00:00,Sagsbehandlere til Persondatas virtuelle enhed,"Vil du være med til at skabe fundamentet for finansieringen af det danske velfærdssamfund? Og trives du i en myndighedsrolle, hvor du bl.a. med tillidsbaseret dialog og faglighed er med til at sikre, at borgerne betaler den korrekte skat til tiden? Så er du måske vores nye kollega i Persondata?    Højt specialiserede medarbejdere, vil du være en del af vores team?    I Persondata har vi ansvaret for at understøtte korrekte indberetninger fra tredjepart til brug for Skattestyrelsens digitale processer, som fx årsopgørelsen, samt at bidrage til den løbende udvikling af en effektiv administration på personområdet. Konkret arbejder vi med driftsopgaver, service og kontrol inden for eKapital, eIndkomst og PAL/PAF.     Medarbejdere til enheden Persondata 7 - eKapitalområdet  eKapital modtager årligt mere end 130 mio. indberetninger om tredjepartsdata fra pengeinstitutter, pensionsselskaber og fagforeninger. Enheden er også involveret i modtagelse af data fra   deleøkonomiske platforme. Skattestyrelsen bruger de modtagne data bl.a. til at udstille i borgerens TastSelv og samtidig understøtter data afregningen af personskat. eKapitalområdet understøtter på udvalgte områder derudover Skattestyrelsens udveksling af data til udlandet.    Du vil blive en del af en enhed på omkring 25 – 30 medarbejdere, som er meget engagerede i deres arbejde og for hvem det gode kollegaskab er en selvfølgelighed. Opgaverne på eKapitalområdet spænder vidt – fra blankethåndtering til at bidrage med forretningsmæssig viden, som kan understøtte udvikling af nye systemer. Opgavesammensætningen betyder, at eKapital har et tæt samarbejde med den øvrige del af Skattestyrelsen.   Som medarbejder i eKapital skal du yde support til de virksomheder, der skal indberette tredjepartsdata til Skattestyrelsen. Supporten sker både telefonisk og skriftligt. Vi håndterer spørgsmål af såvel teknisk karakter som spørgsmål omhandlende indberetningspligter.   Vi har fokus på, at spørgsmålene fra vores indberettere kan give os ny viden til, hvordan vi på forkant kan understøtte deres del af opgaven. Så derfor er bl.a. den telefoniske kontakt med vores indberettere en ”gylden kilde”, til at vi kan løse vores opgave endnu bedre fremadrettet.   Hvis du vil vide mere om eKapital, kan du se nærmere på www.skat.dk/eKapital, som er vores vindue til indberetterne.   Stor faglighed og flair for tekst og tal  Vi søger medarbejdere, som bidrager til, at fællesskabet når sit mål. Du ser værdien i at samarbejde både internt i enheden og på tværs i organisationen. Derudover har du interesse i / evnerne til at kaste dig over nye områder og er god til at sætte dig ind i nye som gamle bekendtgørelser. Dertil kan du gennemskue hvordan ny lovgivning påvirker vores arbejdsopgaver, ikke alene ved indsigt i den materielle del, men på sigt også hvordan den vil påvirke vores administrative opgaver.   Du har flair for at se på tal med analytiske øjne og er interesseret i at jonglere med bl.a. regneark, når der er brug for det. Samtidig er du god til at formulere dig i skrift og tale, såvel på dansk som på engelsk.   Vi forestiller os, at du for eksempel har en professionsbachelor i skat, professionsbachelor med fokus på administrative, økonomiske og/eller juridiske områder, diplomuddannelse, finansøkonom eller erfaring fra den finansielle sektor eller revisionsbranchen. Du kan også være uddannet cand.merc.(jur.) eller HD (R).   Som person forestiller vi os, at du er serviceminded og løsningsorienteret, og at du samtidig er tydelig i din kommunikation i forhold til såvel kunder som kolleger.   Persondata 7 – en virtuel enhed  Persondata 7 er en virtuel enhed, foreløbig som et pilotprojekt frem til december 2023. Det betyder, at hjemmearbejde er vores normale. Vi arbejder hjemme fire dage om ugen og har en dag, hvor vi møder fysisk ind i vores nye lækre lokaler i Fredericia. Du er daglig i tæt kontakt med dine kolleger, møder og vidensdeling falder os naturligt via teams.    Det at arbejde virtuelt, kræver ekstraordinær fokus på brugen af digitale værktøjer. Blæk, print og blyanter, - er der ikke så meget af som tidligere.   Ansøgning og kontakt  　  Send din ansøgning, cv, dokumentation for uddannelse samt yderligere relevant materiale senest den 22. maj 2022 via linket ”Søg stillingen”.    Vi forventer at afholde første runde samtaler løbende. Hvis du går videre, skal du afsætte tid til udfyldelse af en personprofilanalyse samt en logisk test inden anden runde samtale, som afholdes 10. eller 13. juni 2022. Der vil forud for ansættelsen blive indhentet en straffeattest samt referencer.   Ansættelsesområdet vil være i Skatteministeriet med tilhørende institutioner. Den fysiske arbejdsplads er Skattecenter Fredericia, Vendersgade 74, 7000 Fredericia.    Ønsker du yderligere oplysninger, er du velkommen til at kontakte funktionsleder Jette Haastrup Christiansen på telefon 72 37 68 90 eller via MS Teams.   Du bliver ansat på overenskomstvilkår i henhold til enhver tid gældende overenskomst for akademikere i staten (AC), overenskomst for kontorfunktionærer, laboranter og It-medarbejdere (HK) eller overenskomst for Fuldmægtige m.fl. (DTS) i Skatteministeriet.    Tiltrædelse pr. 15. august 2022 eller efter individuel aftale. 　     Skattestyrelsen opfordrer alle kvalificerede uanset alder, køn, religion eller etnisk tilhørsforhold til at søge stillingen.",Centerhavn 23,58,Danmark,607,Fredericia,3,Syddanmark,7000,Fredericia,1,1,Fuldtid,None,None,3,,0,,0,0,0,,False,"{'Id': 7941953, 'Email': None, 'FaxNumber': None, 'PersonName': 'Jette Haastrup Christiansen', 'FirstName': 'Jette Haastrup', 'LastName': 'Christiansen', 'PositionTitle': None, 'PhoneNumbers': [{'Number': '72376890', 'Type': 0, 'Description': 'Hovednummer'}]}",2022-08-15T00:00:00,False,False,False,False,4,,,False,False,False,False,,,,,https://candidate.hr-manager.net/ApplicationInit.aspx?cid=5001&ProjectId=155692&DepartmentId=9408&MediaId=2872&SkipAdvertisement=true,False,2022-05-22T00:00:00,,0,Primary,7,/CV/FindWork/GetLogo?JobAdId=5585880&WorkPlace=115711&Organisation=19552101,"Centerhavn 23,7000, Fredericia",True,False,"/CV/Jobseeking/JobLog/CreateJobSearch?JobnetJobPostingIdentifier=5585880&Company.Name=Skatteforvaltningen, Fredericia&SubmissionDeadlineDate=2022-5-22&Title=Sagsbehandlere til Persondatas virtuelle enhed&WeeklyWorkTime=1",00000000-0000-0000-0000-000000000000,False,0,,,Sagsbehandlere til Persondatas virtuelle enhed,True,,True,1,,5585880,,,False,False,,0,False,"Skatteforvaltningen, Fredericia",Centerhavn 23,,,7000,False,False,False,Fredericia,Jette Haastrup Christiansen,72376890,,,,,,False,,2022-05-22T00:00:00,,0,False,0,,,,,0,,,,False,False,,,False,False,,,,False,,False,,,Arbejdspladsen ligger i Fredericia kommune,False,"Skatteforvaltningen, Fredericia",,"Skatteforvaltningen varetager en vigtig samfundsopgave. Vi opkræver hvert år de ca. 950 mia. kr. i skatter og afgifter, som er fundamentet for finansieringen af det danske samfund. Hos os får du derfor mulighed for at tage ansvar for en vigtig opgave og gøre en forskel. Vi har brug for ansatte med mange forskellige faglige kompetencer, og bredden i opgaverne giver også den enkelte mulighed for at få faglige udfordringer og udvikle sig. 

Er du vores nye kollega?",,False,False,"Vil du være med til at skabe fundamentet for finansieringen af det danske velfærdssamfund? Og trives du i en myndighedsrolle, hvor du bl.a. med tillidsbaseret dialog og faglighed er med til at sikre, at borgerne betaler den korrekte skat til tiden? Så er du måske vores nye kollega i Persondata?   Højt specialiserede medarbejdere, vil du være en del","""Vil du være med til at skabe fundamentet for finansieringen af det danske velfærdssamfund? Og trives du i en myndighedsrolle, hvor du bl.a. med tillidsbaseret dialog og faglighed er med til at sikre, at borgerne betaler den korrekte skat til tiden? Så er du måske vores nye kollega i Persondata?   Højt specialiserede medarbejdere, vil du være en del""","""Sagsbehandlere til Persondatas virtuelle enhed""","https://www.google.dk/maps/dir//Centerhavn+23,7000,+Fredericia/","Vil du være med til at skabe fundamentet for finansieringen af det danske velfærdssamfund? Og trives du i en myndighedsrolle, hvor du bl.a. med tillidsbaseret dialog og faglighed er med til at sikre, at borgerne betaler den korrekte skat til tiden? Så er du måske vores nye kollega i Persondata?    Højt specialiserede medarbejdere, vil du være en del af vores team?    I Persondata har vi ansvaret for at understøtte korrekte indberetninger fra tredjepart til brug for Skattestyrelsens digitale processer, som fx årsopgørelsen, samt at bidrage til den løbende udvikling af en effektiv administration på personområdet. Konkret arbejder vi med driftsopgaver, service og kontrol inden for eKapital, eIndkomst og PAL/PAF.     Medarbejdere til enheden Persondata 7 - eKapitalområdet  eKapital modtager årligt mere end 130 mio. indberetninger om tredjepartsdata fra pengeinstitutter, pensionsselskaber og fagforeninger. Enheden er også involveret i modtagelse af data fra   deleøkonomiske platforme. Skattestyrelsen bruger de modtagne data bl.a. til at udstille i borgerens TastSelv og samtidig understøtter data afregningen af personskat. eKapitalområdet understøtter på udvalgte områder derudover Skattestyrelsens udveksling af data til udlandet.    Du vil blive en del af en enhed på omkring 25 – 30 medarbejdere, som er meget engagerede i deres arbejde og for hvem det gode kollegaskab er en selvfølgelighed. Opgaverne på eKapitalområdet spænder vidt – fra blankethåndtering til at bidrage med forretningsmæssig viden, som kan understøtte udvikling af nye systemer. Opgavesammensætningen betyder, at eKapital har et tæt samarbejde med den øvrige del af Skattestyrelsen.   Som medarbejder i eKapital skal du yde support til de virksomheder, der skal indberette tredjepartsdata til Skattestyrelsen. Supporten sker både telefonisk og skriftligt. Vi håndterer spørgsmål af såvel teknisk karakter som spørgsmål omhandlende indberetningspligter.   Vi har fokus på, at spørgsmålene fra vores indberettere kan give os ny viden til, hvordan vi på forkant kan understøtte deres del af opgaven. Så derfor er bl.a. den telefoniske kontakt med vores indberettere en ”gylden kilde”, til at vi kan løse vores opgave endnu bedre fremadrettet.   Hvis du vil vide mere om eKapital, kan du se nærmere på  www.skat.dk/eKapital , som er vores vindue til indberetterne.   Stor faglighed og flair for tekst og tal  Vi søger medarbejdere, som bidrager til, at fællesskabet når sit mål. Du ser værdien i at samarbejde både internt i enheden og på tværs i organisationen. Derudover har du interesse i / evnerne til at kaste dig over nye områder og er god til at sætte dig ind i nye som gamle bekendtgørelser. Dertil kan du gennemskue hvordan ny lovgivning påvirker vores arbejdsopgaver, ikke alene ved indsigt i den materielle del, men på sigt også hvordan den vil påvirke vores administrative opgaver.   Du har flair for at se på tal med analytiske øjne og er interesseret i at jonglere med bl.a. regneark, når der er brug for det. Samtidig er du god til at formulere dig i skrift og tale, såvel på dansk som på engelsk.   Vi forestiller os, at du for eksempel har en professionsbachelor i skat, professionsbachelor med fokus på administrative, økonomiske og/eller juridiske områder, diplomuddannelse, finansøkonom eller erfaring fra den finansielle sektor eller revisionsbranchen. Du kan også være uddannet cand.merc.(jur.) eller HD (R).   Som person forestiller vi os, at du er serviceminded og løsningsorienteret, og at du samtidig er tydelig i din kommunikation i forhold til såvel kunder som kolleger.   Persondata 7 – en virtuel enhed  Persondata 7 er en virtuel enhed, foreløbig som et pilotprojekt frem til december 2023. Det betyder, at hjemmearbejde er vores normale. Vi arbejder hjemme fire dage om ugen og har en dag, hvor vi møder fysisk ind i vores nye lækre lokaler i Fredericia. Du er daglig i tæt kontakt med dine kolleger, møder og vidensdeling falder os naturligt via teams.    Det at arbejde virtuelt, kræver ekstraordinær fokus på brugen af digitale værktøjer. Blæk, print og blyanter, - er der ikke så meget af som tidligere.   Ansøgning og kontakt  　  Send din ansøgning, cv, dokumentation for uddannelse samt yderligere relevant materiale senest den 22. maj 2022 via linket ”Søg stillingen”.    Vi forventer at afholde første runde samtaler løbende. Hvis du går videre, skal du afsætte tid til udfyldelse af en personprofilanalyse samt en logisk test inden anden runde samtale, som afholdes 10. eller 13. juni 2022. Der vil forud for ansættelsen blive indhentet en straffeattest samt referencer.   Ansættelsesområdet vil være i Skatteministeriet med tilhørende institutioner. Den fysiske arbejdsplads er Skattecenter Fredericia, Vendersgade 74, 7000 Fredericia.    Ønsker du yderligere oplysninger, er du velkommen til at kontakte funktionsleder Jette Haastrup Christiansen på telefon 72 37 68 90 eller via MS Teams.   Du bliver ansat på overenskomstvilkår i henhold til enhver tid gældende overenskomst for akademikere i staten (AC), overenskomst for kontorfunktionærer, laboranter og It-medarbejdere (HK) eller overenskomst for Fuldmægtige m.fl. (DTS) i Skatteministeriet.    Tiltrædelse pr. 15. august 2022 eller efter individuel aftale. 　     Skattestyrelsen opfordrer alle kvalificerede uanset alder, køn, religion eller etnisk tilhørsforhold til at søge stillingen.","https://www.google.dk/maps/place/Centerhavn+23,7000,+Fredericia/",19552101,False,False,,False
