summary_AutomatchType,summary_Abroad,summary_Weight,summary_Title,summary_JobHeadline,summary_Presentation,summary_HiringOrgName,summary_WorkPlaceAddress,summary_WorkPlacePostalCode,summary_WorkPlaceCity,summary_WorkPlaceOtherAddress,summary_WorkPlaceAbroad,summary_WorkPlaceNotStatic,summary_UseWorkPlaceAddressForJoblog,summary_PostingCreated,summary_LastDateApplication,summary_FormattedLastDateApplication,summary_AssignmentStartDate,summary_IsHotjob,summary_IsExternal,summary_Url,summary_Region,summary_Municipality,summary_Country,summary_PostalCode,summary_PostalCodeName,summary_JobAnnouncementType,summary_EmploymentType,summary_WorkHours,summary_OccupationArea,summary_OccupationGroup,summary_Occupation,summary_Location_Latitude,summary_Location_Longitude,summary_JoblogWorkTime_WorkHour,summary_JoblogWorkTime_DailyWorkTime,summary_WorkplaceID,summary_OrganisationId,summary_HiringOrgCVR,summary_UserLoggedIn,summary_AnonymousEmployer,summary_ShareUrl,summary_DetailsUrl,summary_JobLogUrl,summary_HasLocationValues,summary_ID,summary_Latitude,summary_Longitude,details_WorkSchedule,details_WorkConditions,details_EmploymentTypes,details_WorkPlace_Name,details_WorkPlace_Address_AddressLine,details_WorkPlace_Address_Country_Id,details_WorkPlace_Address_Country_Name,details_WorkPlace_Address_Municipality_Id,details_WorkPlace_Address_Municipality_Name,details_WorkPlace_Address_Region_Id,details_WorkPlace_Address_Region_Name,details_WorkPlace_Address_PostalCode,details_WorkPlace_Address_City,details_WorkPlace_PhoneNumber_Number,details_WorkPlace_PhoneNumber_Type,details_WorkPlace_PhoneNumber_Description,details_WorkPlace_FaxNumber,details_WorkPlace_Email,details_WorkPlace_WebAddress,details_WorkPlace_Description,details_WorkPlace_Logo,details_WorkPlace_WorkPlaceOrganizationNumber,details_WorkPlace_OrganizationNumber,details_WorkPlace_OrganizationDescription,details_JobPositionPosting_Id,details_JobPositionPosting_OriginalJppId,details_JobPositionPosting_HiringOrg_Name,details_JobPositionPosting_HiringOrg_Address_AddressLine,details_JobPositionPosting_HiringOrg_Address_Country_Id,details_JobPositionPosting_HiringOrg_Address_Country_Name,details_JobPositionPosting_HiringOrg_Address_Municipality_Id,details_JobPositionPosting_HiringOrg_Address_Municipality_Name,details_JobPositionPosting_HiringOrg_Address_Region_Id,details_JobPositionPosting_HiringOrg_Address_Region_Name,details_JobPositionPosting_HiringOrg_Address_PostalCode,details_JobPositionPosting_HiringOrg_Address_City,details_JobPositionPosting_HiringOrg_PhoneNumber_Number,details_JobPositionPosting_HiringOrg_PhoneNumber_Type,details_JobPositionPosting_HiringOrg_PhoneNumber_Description,details_JobPositionPosting_HiringOrg_FaxNumber,details_JobPositionPosting_HiringOrg_Email,details_JobPositionPosting_HiringOrg_WebAddress,details_JobPositionPosting_HiringOrg_Description,details_JobPositionPosting_HiringOrg_Logo,details_JobPositionPosting_HiringOrg_WorkPlaceOrganizationNumber,details_JobPositionPosting_HiringOrg_OrganizationNumber,details_JobPositionPosting_HiringOrg_OrganizationDescription,details_JobPositionPosting_RecruitingCompany,details_JobPositionPosting_PublicationStartDate,details_JobPositionPosting_PublicationEndDate,details_JobPositionPosting_JobPositionInformation_PositionTitle,details_JobPositionPosting_JobPositionInformation_Purpose,details_JobPositionPosting_JobPositionInformation_WorkLocation_AddressLine,details_JobPositionPosting_JobPositionInformation_WorkLocation_Country_Id,details_JobPositionPosting_JobPositionInformation_WorkLocation_Country_Name,details_JobPositionPosting_JobPositionInformation_WorkLocation_Municipality_Id,details_JobPositionPosting_JobPositionInformation_WorkLocation_Municipality_Name,details_JobPositionPosting_JobPositionInformation_WorkLocation_Region_Id,details_JobPositionPosting_JobPositionInformation_WorkLocation_Region_Name,details_JobPositionPosting_JobPositionInformation_WorkLocation_PostalCode,details_JobPositionPosting_JobPositionInformation_WorkLocation_City,details_JobPositionPosting_JobPositionInformation_EmploymentType,details_JobPositionPosting_JobPositionInformation_WeeklyWorkHours_TypeId,details_JobPositionPosting_JobPositionInformation_WeeklyWorkHours_TypeName,details_JobPositionPosting_JobPositionInformation_WeeklyWorkHours_Description,details_JobPositionPosting_JobPositionInformation_CompensationDescription,details_JobPositionPosting_JobPositionInformation_NumberToFill,details_JobPositionPosting_JobPositionInformation_DriverLicense,details_JobPositionPosting_JobPositionInformation_Occupation_DiscoWeb,details_JobPositionPosting_JobPositionInformation_Occupation_AlternateNames,details_JobPositionPosting_JobPositionInformation_Occupation_GroupId,details_JobPositionPosting_JobPositionInformation_Occupation_AreaId,details_JobPositionPosting_JobPositionInformation_Occupation_Id,details_JobPositionPosting_JobPositionInformation_Occupation_Name,details_JobPositionPosting_JobPositionInformation_IsGovernmentHiring,details_JobPositionPosting_JobPositionInformation_JppContacts,details_JobPositionPosting_JobPositionInformation_EmploymentDate,details_JobPositionPosting_IsRecruitmentOfForeignNationals,details_JobPositionPosting_IsWorkInDenmark,details_JobPositionPosting_IsAnonymousEmployer,details_JobPositionPosting_IsDisabilityFriendly,details_JobPositionPosting_JppType,details_JobPositionPosting_ApplicationDetails_WorkHourMax,details_JobPositionPosting_ApplicationDetails_WorkHourMin,details_JobPositionPosting_ApplicationDetails_DailyWorkTimeWeekend,details_JobPositionPosting_ApplicationDetails_DailyWorkTimeNight,details_JobPositionPosting_ApplicationDetails_DailyWorkTimeEvening,details_JobPositionPosting_ApplicationDetails_DailyWorkTimeDay,details_JobPositionPosting_ApplicationDetails_ReferenceText,details_JobPositionPosting_ApplicationDetails_RemarksToApplicant,details_JobPositionPosting_ApplicationDetails_ByEmail,details_JobPositionPosting_ApplicationDetails_ByPhone,details_JobPositionPosting_ApplicationDetails_ApplyViaUrl,details_JobPositionPosting_ApplicationDetails_ReplyInWriting,details_JobPositionPosting_ApplicationDetails_ApplicationDeadlineDate,details_JobPositionPosting_ContactAuthorityPhoneNumber_Number,details_JobPositionPosting_ContactAuthorityPhoneNumber_Type,details_JobPositionPosting_ContactAuthorityPhoneNumber_Description,details_JobPositionPosting_Status,details_LogoUrl,details_Address,details_ShowMap,details_ShowShareButtonJobLog,details_JobLogUrl,details_JobLogTemplateModel_Identifier,details_JobLogTemplateModel_UseWorkPlaceAddressForJoblog,details_JobLogTemplateModel_Category,details_JobLogTemplateModel_CvCustomerIdentifier,details_JobLogTemplateModel_JobSeekingStatus,details_JobLogTemplateModel_Title,details_JobLogTemplateModel_IsApplicationSourceRequired,details_JobLogTemplateModel_ApplicationSource,details_JobLogTemplateModel_IsWeeklyWorkTimeRequired,details_JobLogTemplateModel_WeeklyWorkTime,details_JobLogTemplateModel_HoursPerWeek,details_JobLogTemplateModel_JobnetJobPostingIdentifier,details_JobLogTemplateModel_JobAdDocument_Title,details_JobLogTemplateModel_JobAdDocument_Identifier,details_JobLogTemplateModel_JobAdDocument_IsDeletedBySystem,details_JobLogTemplateModel_JobAdDocument_IsDeletedByUser,details_JobLogTemplateModel_JobAdFile,details_JobLogTemplateModel_Company_JobLogEntryCategory,details_JobLogTemplateModel_Company_ShowAddressFieldsEvenIfEmpty,details_JobLogTemplateModel_Company_Name,details_JobLogTemplateModel_Company_Address,details_JobLogTemplateModel_Company_Country,details_JobLogTemplateModel_Company_EmploymentAreaID,details_JobLogTemplateModel_Company_PostCode,details_JobLogTemplateModel_Company_IsCountryAndTownAndPostCodeEmpty,details_JobLogTemplateModel_Company_IsTownAndPostCodeEmpty,details_JobLogTemplateModel_Company_IsCountryDanmark,details_JobLogTemplateModel_Company_Town,details_JobLogTemplateModel_Company_ContactPerson,details_JobLogTemplateModel_Company_Phone,details_JobLogTemplateModel_Company_Email,details_JobLogTemplateModel_Company_Latitude,details_JobLogTemplateModel_Company_Longitude,details_JobLogTemplateModel_Company_DailyTravelTimeInMinutes,details_JobLogTemplateModel_Company_DistanceToCompanyInMeters,details_JobLogTemplateModel_Company_IsCreateMode,details_JobLogTemplateModel_TypeOfSubmission,details_JobLogTemplateModel_SubmissionDate,details_JobLogTemplateModel_SubmissionDateFormatted,details_JobLogTemplateModel_SubmissionDateTiks,details_JobLogTemplateModel_IsSubmissionDateRequired,details_JobLogTemplateModel_Status,details_JobLogTemplateModel_DateCreatedFormatted,details_JobLogTemplateModel_DateCreated,details_JobLogTemplateModel_DateModifiedFormatted,details_JobLogTemplateModel_DateModified,details_JobLogTemplateModel_LastModifiedDateTiks,details_JobLogTemplateModel_DateClosed,details_JobLogTemplateModel_JobApplicationDocument_Title,details_JobLogTemplateModel_JobApplicationDocument_Identifier,details_JobLogTemplateModel_JobApplicationDocument_IsDeletedBySystem,details_JobLogTemplateModel_JobApplicationDocument_IsDeletedByUser,details_JobLogTemplateModel_CvDocument_Title,details_JobLogTemplateModel_CvDocument_Identifier,details_JobLogTemplateModel_CvDocument_IsDeletedBySystem,details_JobLogTemplateModel_CvDocument_IsDeletedByUser,details_JobLogTemplateModel_JobApplicationFile,details_JobLogTemplateModel_CvFile,details_JobLogTemplateModel_SubmissionDeadlineDate,details_JobLogTemplateModel_IsPersisted,details_JobLogTemplateModel_ServerValidationErrors,details_JobLogTemplateModel_HasServerValidationErrors,details_JoblogWorkTime_WorkHour,details_JoblogWorkTime_DailyWorkTime,details_Place,details_OpenPrintDialog,details_WorkPlaceInfoText,details_JobCenterContactDetails,details_WorkPlaceDescriptionText,details_FavoriteText,details_IsFavorite,details_ShowFavorite,details_MetaOgTextForSharing,details_DescriptionForSharing,details_TitleForSharing,details_RutePlan,details_FormattedPurpose,details_MapUrl,details_OrganizationNumber,details_ShowSearchJobButton,details_ShowPrint,details_BackToFindWorkButtonUrl,isExternal
0,False,1,Økonomimedarbejder til Økonomiservice - Regnskab (HK),Økonomimedarbejder til Økonomiservice - Regnskab (HK),"Vil du være med til at sikre, at SDU / Syddansk Universitet også i fremtiden har en god og kompetent økonomistyring? Vil og kan du deltage i fortsættelsen af arbejdet med digitalisering af arbejdsg",Syddansk Universitet,Campusvej 55,5230,Odense M,False,False,False,True,2022-04-29T00:00:00,2022-05-15T00:00:00,15. maj 2022,0001-01-01T00:00:00,False,False,https://job.jobnet.dk/CV/FindWork/Details/5586939,Syddanmark,Odense,Danmark,5230,,,,Fuldtid,"Kontor, administration, regnskab og finans",Bogholderi- og regnskabsarbejde,Bogholder,55.3686,10.4282,,,115928,53622,29283958,False,False,https://job.jobnet.dk/CV/FindWork/DetailsSocialmedia/5586939,https://job.jobnet.dk/CV/FindWork/Details/5586939,https://job.jobnet.dk/CV/FindWork/Details/5586939,True,5586939,55.3686,10.4282,"{'Id': 1, 'Name': 'Fuldtid'}, {'Id': 16, 'Name': 'Deltid'}","{'Id': 1, 'Name': 'Almindelige vilkår'}, {'Id': 2, 'Name': 'Fleksjob'}, {'Id': 3, 'Name': 'Skånejob'}, {'Id': 4, 'Name': 'Egnet til efterlønnere og seniorer'}, {'Id': 5, 'Name': 'Job med løntilskud'}, {'Id': 6, 'Name': 'Rotationsjob'}, {'Id': 7, 'Name': 'Virksomhedspraktik'}","{'Id': 1, 'Name': 'Fastansættelse'}, {'Id': 16, 'Name': 'Tidsbegrænset ansættelse'}",Syddansk Universitet,Campusvej 55,58,Danmark,461,Odense,3,Syddanmark,5230,Odense M,,0,Primary,,,,None,,1003403113,29283958,None,5586939,5586939,Syddansk Universitet,Campusvej 55,58,Danmark,461,Odense,3,Syddanmark,5230,Odense M,,0,Primary,,,,None,,1003403113,29283958,None,,2022-04-29T00:00:00,2022-05-15T00:00:00,Økonomimedarbejder til Økonomiservice - Regnskab (HK),"Vil du være med til at sikre, at SDU / Syddansk Universitet også i fremtiden har en god og kompetent økonomistyring? Vil og kan du deltage i fortsættelsen af arbejdet med digitalisering af arbejdsgangene? Har du lyst til at deltage i udviklingen af kompetencerne hos de mange medarbejdere på SDU, der arbejder med økonomisk administration? 
 Så er du måske vores nye økonomimedarbejder (HK) i Økonomiservice - Regnskab. 
 Om jobbet 
 Vores kommende medarbejder ansættes i Regnskab, der er en af fem afdelinger i Økonomiservice, som er SDU’s centrale økonomifunktion. 
 Regnskab består af tre kontorer/teams, der til sammen varetager SDU’s centrale debitor- og kreditorbogholderi samt rejsekontor. Vi er ti medarbejdere i Regnskab. 
 Du skal være indstillet på at kunne komme til at arbejde med alle de opgaver, som ligger i Regnskab, heriblandt med følgende: 
 
 Behandling - herunder kontering og bogføring - af ind- og udbetalinger på SDU’s bankkonti. 
 Afstemning af vores 30 bankkonti. 
 Efterbehandling (controlling) af SDU’s salgsfakturaer. 
 Rykkerprocedure vedr. SDU’s salgsfakturaer. 
 Support og rådgivning til de mere end 100 medarbejdere i SDU’s decentrale enheder, der arbejder med økonomisk administration. Support og rådgivning vedrører bl.a. SDU´s regelsæt og anvendelsen af vores økonomiske it-systemer. 
 
 Økonomiservice arbejder bevidst med digitalisering og papirløs administration. Det er nødvendigt, at du kan og vil deltage i udviklingen af Regnskab, så vores opgaveløsning til hver en tid er præget af effektivitet og god service. 
 Der er tale om en fast stilling på 37 timer pr. uge med flextid og betalt frokostpause. Som et forsøg er der mulighed for at arbejde hjemmefra to dage om ugen. 
 Kvalifikationskrav 
 Vi har følgende forventninger til dine kvalifikationer: 
 
 Du skal have en kontoruddannelse. 
 Det vil være en fordel - men ingen betingelse - hvis du har kendskab til arbejdet i en økonomiafdeling i en stor offentlig virksomhed. 
 Det vil være en fordel, hvis du kan begå dig mundtlig og skriftligt på engelsk, idet vi ofte er i dialog med udenlandske samarbejdspartnere. 
 Dit arbejde skal være præget af omhyggelighed og ordentlighed. 
 Du skal være indstillet på at arbejde i et team, da vi sidder op til fem medarbejdere på et kontor, som indbyrdes koordinerer planlægningen af arbejdsopgaverne. 
 Du skal kunne yde support og rådgivning til mange forskellige kolleger på SDU. 
 Du skal være interesseret i at deltage i udviklingen af kompetencerne hos de mere end hundrede medarbejdere på SDU, der arbejder med økonomisk administration. Aktiviteterne kan foregå både ved fysisk tilstedeværelse og via Teams eller Zoom. 
 Du skal være indstillet på at deltage i udviklingen af Økonomiservice, så vi indfrier målene om digitalisering og papirløs administration. 
 Der må meget gerne være gemt lidt af en detektiv gemt i dig, idet vi ofte skal bruge noget tid på at afklare hvem, der har indbetalt et beløb til SDU. 
 Du skal være parat til at kunne arbejde samtidigt med flere af arbejdsopgaverne i Regnskab, heriblandt også deltage i sagsbehandlingen af rejser og udlæg. 
 
 Om SDU og Økonomiservice 
 SDU har 26.000 studerende, 4.000 ansatte og en årlig omsætning på knap 3,3 milliarder kroner. 
 Du kan læse mere om Økonomiservice og Regnskab på  https://www.sdu.dk/da/om_sdu/faellesomraadet/oekonomiservice . 
 Yderligere oplysninger 
 Yderligere oplysninger om jobbet kan fås hos regnskabschef Jens V. Kierkegaard (tlf. 6550 2911, e-mail jvk@sdu.dk) eller kontorfuldmægtig Karin Truelsegaard (tlf. 6550 2955, e-mail katr@sdu.dk). 
 Ansøgning, løn og ansættelsesforhold 
 Ansøgningsfristen er søndag den 15. maj 2022, kl. 23:59 
 Vi afholder samtaler i Odense den 19. eller 20. maj 2022. Ansættelse pr. 1. juli 2022 eller efter aftale (gerne tidligere). 
 Tjenestestedet er Odense.  
 Ansættelse finder sted i henhold til overenskomst mellem Finansministeriet og HK/STAT. 
   
 Ansøgning skal indeholde følgebrev, CV og eksamensbevis. Alle dokumenter i forbindelse med ansøgning bør ikke indeholde CPR-nummer – i så fald skal CPR-nummer overstreges. 
 Alle vedhæftede filer skal være i Adobe PDF format. 
 Følgebrev og CV må max. fylde 5 Mb.  
 Vejledning i forbindelse med ansøgning findes  her . 
 Syddansk Universitet ønsker at afspejle det omgivende samfund og opfordrer derfor alle uanset personlig baggrund til at søge stillingen.",Campusvej 55,58,Danmark,461,Odense,3,Syddanmark,5230,Odense M,1,1,Fuldtid,None,None,1,,0,,0,0,0,,True,"{'Id': 7945643, 'Email': 'jvk@sdu.dk', 'FaxNumber': None, 'PersonName': 'Jens V. Kierkegaard', 'FirstName': 'Jens V.', 'LastName': 'Kierkegaard', 'PositionTitle': 'Regnskabschef', 'PhoneNumbers': [{'Number': '65501000', 'Type': 0, 'Description': 'Hovednummer'}]}",,False,False,False,False,4,,,False,False,False,False,22/27418,,,,https://fa-eosd-saasfaprod1.fa.ocs.oraclecloud.com/hcmUI/CandidateExperience/da/sites/CX_1001/requisitions/preview/472,False,2022-05-15T00:00:00,,0,Primary,7,/CV/FindWork/GetLogo?JobAdId=5586939&Organisation=29283958,"Campusvej 55,5230, Odense M",True,False,/CV/Jobseeking/JobLog/CreateJobSearch?JobnetJobPostingIdentifier=5586939&Company.Name=Syddansk Universitet&SubmissionDeadlineDate=2022-5-15&Title=Økonomimedarbejder til Økonomiservice - Regnskab (HK)&WeeklyWorkTime=1,00000000-0000-0000-0000-000000000000,False,0,,,Økonomimedarbejder til Økonomiservice - Regnskab (HK),True,,True,1,,5586939,,,False,False,,0,False,Syddansk Universitet,Campusvej 55,,,5230,False,False,False,Odense M,Jens V. Kierkegaard,65501000,jvk@sdu.dk,,,,,False,,2022-05-15T00:00:00,,0,False,0,,,,,0,,,,False,False,,,False,False,,,,False,,False,,,Arbejdspladsen ligger i Odense kommune,False,Syddansk Universitet,,None,,False,False,"Vil du v&aelig;re med til at sikre, at SDU / Syddansk Universitet ogs&aring; i fremtiden har en god og kompetent &oslash;konomistyring? Vil og kan du deltage i forts&aelig;ttelsen af arbejdet med digitalisering af arbejdsgangene? Har du lyst til at deltage i udviklingen af kompetencerne hos de mange medarbejdere p&aring; SDU, der arbejder med &osla","""Vil du v\u0026aelig;re med til at sikre, at SDU / Syddansk Universitet ogs\u0026aring; i fremtiden har en god og kompetent \u0026oslash;konomistyring? Vil og kan du deltage i forts\u0026aelig;ttelsen af arbejdet med digitalisering af arbejdsgangene? Har du lyst til at deltage i udviklingen af kompetencerne hos de mange medarbejdere p\u0026aring; SDU, der arbejder med \u0026osla""","""Økonomimedarbejder til Økonomiservice - Regnskab (HK)""","https://www.google.dk/maps/dir//Campusvej+55,5230,+Odense+M/","Vil du være med til at sikre, at SDU / Syddansk Universitet også i fremtiden har en god og kompetent økonomistyring? Vil og kan du deltage i fortsættelsen af arbejdet med digitalisering af arbejdsgangene? Har du lyst til at deltage i udviklingen af kompetencerne hos de mange medarbejdere på SDU, der arbejder med økonomisk administration? 
 Så er du måske vores nye økonomimedarbejder (HK) i Økonomiservice - Regnskab. 
 Om jobbet 
 Vores kommende medarbejder ansættes i Regnskab, der er en af fem afdelinger i Økonomiservice, som er SDU’s centrale økonomifunktion. 
 Regnskab består af tre kontorer/teams, der til sammen varetager SDU’s centrale debitor- og kreditorbogholderi samt rejsekontor. Vi er ti medarbejdere i Regnskab. 
 Du skal være indstillet på at kunne komme til at arbejde med alle de opgaver, som ligger i Regnskab, heriblandt med følgende: 
 
 Behandling - herunder kontering og bogføring - af ind- og udbetalinger på SDU’s bankkonti. 
 Afstemning af vores 30 bankkonti. 
 Efterbehandling (controlling) af SDU’s salgsfakturaer. 
 Rykkerprocedure vedr. SDU’s salgsfakturaer. 
 Support og rådgivning til de mere end 100 medarbejdere i SDU’s decentrale enheder, der arbejder med økonomisk administration. Support og rådgivning vedrører bl.a. SDU´s regelsæt og anvendelsen af vores økonomiske it-systemer. 
 
 Økonomiservice arbejder bevidst med digitalisering og papirløs administration. Det er nødvendigt, at du kan og vil deltage i udviklingen af Regnskab, så vores opgaveløsning til hver en tid er præget af effektivitet og god service. 
 Der er tale om en fast stilling på 37 timer pr. uge med flextid og betalt frokostpause. Som et forsøg er der mulighed for at arbejde hjemmefra to dage om ugen. 
 Kvalifikationskrav 
 Vi har følgende forventninger til dine kvalifikationer: 
 
 Du skal have en kontoruddannelse. 
 Det vil være en fordel - men ingen betingelse - hvis du har kendskab til arbejdet i en økonomiafdeling i en stor offentlig virksomhed. 
 Det vil være en fordel, hvis du kan begå dig mundtlig og skriftligt på engelsk, idet vi ofte er i dialog med udenlandske samarbejdspartnere. 
 Dit arbejde skal være præget af omhyggelighed og ordentlighed. 
 Du skal være indstillet på at arbejde i et team, da vi sidder op til fem medarbejdere på et kontor, som indbyrdes koordinerer planlægningen af arbejdsopgaverne. 
 Du skal kunne yde support og rådgivning til mange forskellige kolleger på SDU. 
 Du skal være interesseret i at deltage i udviklingen af kompetencerne hos de mere end hundrede medarbejdere på SDU, der arbejder med økonomisk administration. Aktiviteterne kan foregå både ved fysisk tilstedeværelse og via Teams eller Zoom. 
 Du skal være indstillet på at deltage i udviklingen af Økonomiservice, så vi indfrier målene om digitalisering og papirløs administration. 
 Der må meget gerne være gemt lidt af en detektiv gemt i dig, idet vi ofte skal bruge noget tid på at afklare hvem, der har indbetalt et beløb til SDU. 
 Du skal være parat til at kunne arbejde samtidigt med flere af arbejdsopgaverne i Regnskab, heriblandt også deltage i sagsbehandlingen af rejser og udlæg. 
 
 Om SDU og Økonomiservice 
 SDU har 26.000 studerende, 4.000 ansatte og en årlig omsætning på knap 3,3 milliarder kroner. 
 Du kan læse mere om Økonomiservice og Regnskab på  https://www.sdu.dk/da/om_sdu/faellesomraadet/oekonomiservice . 
 Yderligere oplysninger 
 Yderligere oplysninger om jobbet kan fås hos regnskabschef Jens V. Kierkegaard (tlf. 6550 2911, e-mail jvk@sdu.dk) eller kontorfuldmægtig Karin Truelsegaard (tlf. 6550 2955, e-mail katr@sdu.dk). 
 Ansøgning, løn og ansættelsesforhold 
 Ansøgningsfristen er søndag den 15. maj 2022, kl. 23:59 
 Vi afholder samtaler i Odense den 19. eller 20. maj 2022. Ansættelse pr. 1. juli 2022 eller efter aftale (gerne tidligere). 
 Tjenestestedet er Odense.  
 Ansættelse finder sted i henhold til overenskomst mellem Finansministeriet og HK/STAT. 
   
 Ansøgning skal indeholde følgebrev, CV og eksamensbevis. Alle dokumenter i forbindelse med ansøgning bør ikke indeholde CPR-nummer – i så fald skal CPR-nummer overstreges. 
 Alle vedhæftede filer skal være i Adobe PDF format. 
 Følgebrev og CV må max. fylde 5 Mb.  
 Vejledning i forbindelse med ansøgning findes  her . 
 Syddansk Universitet ønsker at afspejle det omgivende samfund og opfordrer derfor alle uanset personlig baggrund til at søge stillingen.","https://www.google.dk/maps/place/Campusvej+55,5230,+Odense+M/",29283958,False,False,,False
