summary_AutomatchType,summary_Abroad,summary_Weight,summary_Title,summary_JobHeadline,summary_Presentation,summary_HiringOrgName,summary_WorkPlaceAddress,summary_WorkPlacePostalCode,summary_WorkPlaceCity,summary_WorkPlaceOtherAddress,summary_WorkPlaceAbroad,summary_WorkPlaceNotStatic,summary_UseWorkPlaceAddressForJoblog,summary_PostingCreated,summary_LastDateApplication,summary_FormattedLastDateApplication,summary_AssignmentStartDate,summary_IsHotjob,summary_IsExternal,summary_Url,summary_Region,summary_Municipality,summary_Country,summary_PostalCode,summary_PostalCodeName,summary_JobAnnouncementType,summary_EmploymentType,summary_WorkHours,summary_OccupationArea,summary_OccupationGroup,summary_Occupation,summary_Location_Latitude,summary_Location_Longitude,summary_JoblogWorkTime_WorkHour,summary_JoblogWorkTime_DailyWorkTime,summary_WorkplaceID,summary_OrganisationId,summary_HiringOrgCVR,summary_UserLoggedIn,summary_AnonymousEmployer,summary_ShareUrl,summary_DetailsUrl,summary_JobLogUrl,summary_HasLocationValues,summary_ID,summary_Latitude,summary_Longitude,details_WorkSchedule,details_WorkConditions,details_EmploymentTypes,details_WorkPlace_Name,details_WorkPlace_Address_AddressLine,details_WorkPlace_Address_Country_Id,details_WorkPlace_Address_Country_Name,details_WorkPlace_Address_Municipality_Id,details_WorkPlace_Address_Municipality_Name,details_WorkPlace_Address_Region_Id,details_WorkPlace_Address_Region_Name,details_WorkPlace_Address_PostalCode,details_WorkPlace_Address_City,details_WorkPlace_PhoneNumber_Number,details_WorkPlace_PhoneNumber_Type,details_WorkPlace_PhoneNumber_Description,details_WorkPlace_FaxNumber,details_WorkPlace_Email,details_WorkPlace_WebAddress,details_WorkPlace_Description,details_WorkPlace_Logo,details_WorkPlace_WorkPlaceOrganizationNumber,details_WorkPlace_OrganizationNumber,details_WorkPlace_OrganizationDescription,details_JobPositionPosting_Id,details_JobPositionPosting_OriginalJppId,details_JobPositionPosting_HiringOrg_Name,details_JobPositionPosting_HiringOrg_Address_AddressLine,details_JobPositionPosting_HiringOrg_Address_Country_Id,details_JobPositionPosting_HiringOrg_Address_Country_Name,details_JobPositionPosting_HiringOrg_Address_Municipality_Id,details_JobPositionPosting_HiringOrg_Address_Municipality_Name,details_JobPositionPosting_HiringOrg_Address_Region_Id,details_JobPositionPosting_HiringOrg_Address_Region_Name,details_JobPositionPosting_HiringOrg_Address_PostalCode,details_JobPositionPosting_HiringOrg_Address_City,details_JobPositionPosting_HiringOrg_PhoneNumber_Number,details_JobPositionPosting_HiringOrg_PhoneNumber_Type,details_JobPositionPosting_HiringOrg_PhoneNumber_Description,details_JobPositionPosting_HiringOrg_FaxNumber,details_JobPositionPosting_HiringOrg_Email,details_JobPositionPosting_HiringOrg_WebAddress,details_JobPositionPosting_HiringOrg_Description,details_JobPositionPosting_HiringOrg_Logo,details_JobPositionPosting_HiringOrg_WorkPlaceOrganizationNumber,details_JobPositionPosting_HiringOrg_OrganizationNumber,details_JobPositionPosting_HiringOrg_OrganizationDescription,details_JobPositionPosting_RecruitingCompany,details_JobPositionPosting_PublicationStartDate,details_JobPositionPosting_PublicationEndDate,details_JobPositionPosting_JobPositionInformation_PositionTitle,details_JobPositionPosting_JobPositionInformation_Purpose,details_JobPositionPosting_JobPositionInformation_WorkLocation_AddressLine,details_JobPositionPosting_JobPositionInformation_WorkLocation_Country_Id,details_JobPositionPosting_JobPositionInformation_WorkLocation_Country_Name,details_JobPositionPosting_JobPositionInformation_WorkLocation_Municipality_Id,details_JobPositionPosting_JobPositionInformation_WorkLocation_Municipality_Name,details_JobPositionPosting_JobPositionInformation_WorkLocation_Region_Id,details_JobPositionPosting_JobPositionInformation_WorkLocation_Region_Name,details_JobPositionPosting_JobPositionInformation_WorkLocation_PostalCode,details_JobPositionPosting_JobPositionInformation_WorkLocation_City,details_JobPositionPosting_JobPositionInformation_EmploymentType,details_JobPositionPosting_JobPositionInformation_WeeklyWorkHours_TypeId,details_JobPositionPosting_JobPositionInformation_WeeklyWorkHours_TypeName,details_JobPositionPosting_JobPositionInformation_WeeklyWorkHours_Description,details_JobPositionPosting_JobPositionInformation_CompensationDescription,details_JobPositionPosting_JobPositionInformation_NumberToFill,details_JobPositionPosting_JobPositionInformation_DriverLicense,details_JobPositionPosting_JobPositionInformation_Occupation_DiscoWeb,details_JobPositionPosting_JobPositionInformation_Occupation_AlternateNames,details_JobPositionPosting_JobPositionInformation_Occupation_GroupId,details_JobPositionPosting_JobPositionInformation_Occupation_AreaId,details_JobPositionPosting_JobPositionInformation_Occupation_Id,details_JobPositionPosting_JobPositionInformation_Occupation_Name,details_JobPositionPosting_JobPositionInformation_IsGovernmentHiring,details_JobPositionPosting_JobPositionInformation_JppContacts,details_JobPositionPosting_JobPositionInformation_EmploymentDate,details_JobPositionPosting_IsRecruitmentOfForeignNationals,details_JobPositionPosting_IsWorkInDenmark,details_JobPositionPosting_IsAnonymousEmployer,details_JobPositionPosting_IsDisabilityFriendly,details_JobPositionPosting_JppType,details_JobPositionPosting_ApplicationDetails_WorkHourMax,details_JobPositionPosting_ApplicationDetails_WorkHourMin,details_JobPositionPosting_ApplicationDetails_DailyWorkTimeWeekend,details_JobPositionPosting_ApplicationDetails_DailyWorkTimeNight,details_JobPositionPosting_ApplicationDetails_DailyWorkTimeEvening,details_JobPositionPosting_ApplicationDetails_DailyWorkTimeDay,details_JobPositionPosting_ApplicationDetails_ReferenceText,details_JobPositionPosting_ApplicationDetails_RemarksToApplicant,details_JobPositionPosting_ApplicationDetails_ByEmail,details_JobPositionPosting_ApplicationDetails_ByPhone,details_JobPositionPosting_ApplicationDetails_ApplyViaUrl,details_JobPositionPosting_ApplicationDetails_ReplyInWriting,details_JobPositionPosting_ApplicationDetails_ApplicationDeadlineDate,details_JobPositionPosting_ContactAuthorityPhoneNumber_Number,details_JobPositionPosting_ContactAuthorityPhoneNumber_Type,details_JobPositionPosting_ContactAuthorityPhoneNumber_Description,details_JobPositionPosting_Status,details_LogoUrl,details_Address,details_ShowMap,details_ShowShareButtonJobLog,details_JobLogUrl,details_JobLogTemplateModel_Identifier,details_JobLogTemplateModel_UseWorkPlaceAddressForJoblog,details_JobLogTemplateModel_Category,details_JobLogTemplateModel_CvCustomerIdentifier,details_JobLogTemplateModel_JobSeekingStatus,details_JobLogTemplateModel_Title,details_JobLogTemplateModel_IsApplicationSourceRequired,details_JobLogTemplateModel_ApplicationSource,details_JobLogTemplateModel_IsWeeklyWorkTimeRequired,details_JobLogTemplateModel_WeeklyWorkTime,details_JobLogTemplateModel_HoursPerWeek,details_JobLogTemplateModel_JobnetJobPostingIdentifier,details_JobLogTemplateModel_JobAdDocument_Title,details_JobLogTemplateModel_JobAdDocument_Identifier,details_JobLogTemplateModel_JobAdDocument_IsDeletedBySystem,details_JobLogTemplateModel_JobAdDocument_IsDeletedByUser,details_JobLogTemplateModel_JobAdFile,details_JobLogTemplateModel_Company_JobLogEntryCategory,details_JobLogTemplateModel_Company_ShowAddressFieldsEvenIfEmpty,details_JobLogTemplateModel_Company_Name,details_JobLogTemplateModel_Company_Address,details_JobLogTemplateModel_Company_Country,details_JobLogTemplateModel_Company_EmploymentAreaID,details_JobLogTemplateModel_Company_PostCode,details_JobLogTemplateModel_Company_IsCountryAndTownAndPostCodeEmpty,details_JobLogTemplateModel_Company_IsTownAndPostCodeEmpty,details_JobLogTemplateModel_Company_IsCountryDanmark,details_JobLogTemplateModel_Company_Town,details_JobLogTemplateModel_Company_ContactPerson,details_JobLogTemplateModel_Company_Phone,details_JobLogTemplateModel_Company_Email,details_JobLogTemplateModel_Company_Latitude,details_JobLogTemplateModel_Company_Longitude,details_JobLogTemplateModel_Company_DailyTravelTimeInMinutes,details_JobLogTemplateModel_Company_DistanceToCompanyInMeters,details_JobLogTemplateModel_Company_IsCreateMode,details_JobLogTemplateModel_TypeOfSubmission,details_JobLogTemplateModel_SubmissionDate,details_JobLogTemplateModel_SubmissionDateFormatted,details_JobLogTemplateModel_SubmissionDateTiks,details_JobLogTemplateModel_IsSubmissionDateRequired,details_JobLogTemplateModel_Status,details_JobLogTemplateModel_DateCreatedFormatted,details_JobLogTemplateModel_DateCreated,details_JobLogTemplateModel_DateModifiedFormatted,details_JobLogTemplateModel_DateModified,details_JobLogTemplateModel_LastModifiedDateTiks,details_JobLogTemplateModel_DateClosed,details_JobLogTemplateModel_JobApplicationDocument_Title,details_JobLogTemplateModel_JobApplicationDocument_Identifier,details_JobLogTemplateModel_JobApplicationDocument_IsDeletedBySystem,details_JobLogTemplateModel_JobApplicationDocument_IsDeletedByUser,details_JobLogTemplateModel_CvDocument_Title,details_JobLogTemplateModel_CvDocument_Identifier,details_JobLogTemplateModel_CvDocument_IsDeletedBySystem,details_JobLogTemplateModel_CvDocument_IsDeletedByUser,details_JobLogTemplateModel_JobApplicationFile,details_JobLogTemplateModel_CvFile,details_JobLogTemplateModel_SubmissionDeadlineDate,details_JobLogTemplateModel_IsPersisted,details_JobLogTemplateModel_ServerValidationErrors,details_JobLogTemplateModel_HasServerValidationErrors,details_JoblogWorkTime_WorkHour,details_JoblogWorkTime_DailyWorkTime,details_Place,details_OpenPrintDialog,details_WorkPlaceInfoText,details_JobCenterContactDetails,details_WorkPlaceDescriptionText,details_FavoriteText,details_IsFavorite,details_ShowFavorite,details_MetaOgTextForSharing,details_DescriptionForSharing,details_TitleForSharing,details_RutePlan,details_FormattedPurpose,details_MapUrl,details_OrganizationNumber,details_ShowSearchJobButton,details_ShowPrint,details_BackToFindWorkButtonUrl,isExternal
0,False,1,Erfaren specialkonsulent til ledelses- og organisationsudvikling på Ældre- og Sundhedsområdet,Erfaren specialkonsulent til ledelses- og organisationsudvikling på Ældre- og Sundhedsområdet,Brænder du for ledelse af sundheds- og ældreområdet? Vil du være med til at udvikle fremtidens ældre- og sundhedsområde i tværorganisatoriske sammenhænge og understøtte tværgående ledelse? ,Udvikling og Administration (SOÆ),Hvidovrevej 278,2650,Hvidovre,False,False,False,True,2022-04-29T00:00:00,2022-05-20T00:00:00,20. maj 2022,0001-01-01T00:00:00,False,False,https://job.jobnet.dk/CV/FindWork/Details/5587003,Hovedstaden og Bornholm,Hvidovre,Danmark,2650,,,,Fuldtid,Akademisk arbejde,Administrativt arbejde,Specialkonsulent,55.6428,12.4776,,,5340,1869,55606617,False,False,https://job.jobnet.dk/CV/FindWork/DetailsSocialmedia/5587003,https://job.jobnet.dk/CV/FindWork/Details/5587003,https://job.jobnet.dk/CV/FindWork/Details/5587003,True,5587003,55.6428,12.4776,"{'Id': 1, 'Name': 'Fuldtid'}, {'Id': 16, 'Name': 'Deltid'}","{'Id': 1, 'Name': 'Almindelige vilkår'}, {'Id': 2, 'Name': 'Fleksjob'}, {'Id': 3, 'Name': 'Skånejob'}, {'Id': 4, 'Name': 'Egnet til efterlønnere og seniorer'}, {'Id': 5, 'Name': 'Job med løntilskud'}, {'Id': 6, 'Name': 'Rotationsjob'}, {'Id': 7, 'Name': 'Virksomhedspraktik'}","{'Id': 1, 'Name': 'Fastansættelse'}, {'Id': 16, 'Name': 'Tidsbegrænset ansættelse'}",Udvikling og Administration (SOÆ),Hvidovrevej 278,58,Danmark,167,Hvidovre,4,"Hovedstaden, Sjælland og Bornholm",2650,Hvidovre,,0,Primary,,,,None,5340,1003267810,55606617,None,5587003,5587003,Udvikling og Administration (SOÆ),Hvidovrevej 278,58,Danmark,167,Hvidovre,4,"Hovedstaden, Sjælland og Bornholm",2650,Hvidovre,,0,Primary,,,,None,5340,1003267810,55606617,None,,2022-04-29T00:00:00,2022-05-20T00:00:00,Erfaren specialkonsulent til ledelses- og organisationsudvikling på Ældre- og Sundhedsområdet,"Brænder du for ledelse af sundheds- og ældreområdet? Vil du være med til at udvikle fremtidens ældre- og sundhedsområde i tværorganisatoriske sammenhænge og understøtte tværgående ledelse? Så er det dig, vi har brug for som vores nye kollega i Udvikling & Administration.   Hvem leder vi efter?  Du brænder for ledelses- og organisationsudvikling og har fingeren på pulsen i forhold til aktuelle tendenser indenfor ledelse og sundheds- og ældreområdet.     Vi søger en erfaren specialkonsulent til en spændende og udviklende stilling i vores konsulent-team, hvor du vil komme til at løse en bred vifte af opgaver inden for projektledelse, procesledelse, politik- og strategiudvikling, udarbejdelse af politiske sager og sekretariatsbetjening af udvalg.    Dine opgaver varierer over tid og tilpasses dine kompetencer og erfaringer. En gennemgående opgave bliver at understøtte de i alt 47 ledere i Center for Sundhed & Ældre blandt andet i deres mellemledernetværk og i forbindelse med lederseminarer.    Hvem er du?  Du har en relevant kandidatuddannelse og flere års erfaring med ledelses- og organisationsudvikling i en politisk kontekst. Du har solid erfaring med at facilitere udviklings- og implementeringsprocesser, og du trives i rollen som ansvarlig for at sikre, at processer og projekter kommer godt i mål.    Du kommunikerer godt i både skrift og i tale, uanset målgruppen. Du arbejder selvstændigt, er god til at få øje på nye løsninger, og du er vedholdende og målrettet, når opgaverne kræver det. Som person er du nysgerrig, opsøgende og er god til at danne relationer med mange forskellige faggrupper. Du bidrager med god energi, også i vores interne udviklingsprocesser, og måderne, vi løser dem på.    Hvem er vi?  Udvikling & Administration består af et konsulent-team, et IT-team og et administrativt team. Vores formål er at bidrage til at skabe de bedste betingelser for, at de decentrale enheder i Center for Sundhed og Ældre i Hvidovre Kommune lykkes med opgaverne ud fra gældende politikker og retningslinjer.    Ud over Udvikling & Administration er der i Center for Sundhed og Ældre tre plejecentre, hjemmepleje, sygepleje, genoptræning og rehabilitering, Visitationen samt Sundhed og Forebyggelse. Vores fælles kerneopgave er at sikre pleje og omsorg til borgerne ud fra en strategi om, at vi gør det bedst, når vi gør det sammen.   Du kan se mere om os her.   Hvad kan vi tilbyde?  Vi er ambitiøse og har et uhøjtideligt arbejdsfællesskab. Vi tror på, at vi udvikler os gennem relevant kompetenceudvikling, via opgaverne og ved at indgå i tværfaglige teams, i sparring og dialog. Vores ambition er at samarbejde bredt og på tværs om at koble strategier og politikker sammen og finde de mest optimale løsninger.    Der er ansøgningsfrist den 20. maj 2022. Vi forventer at holde ansættelsessamtaler den 2. juni 2022.   Yderligere oplysninger  Vil du vide mere, så er du velkommen til at kontakte konstitueret leder af Udvikling & Administration Mette Rosengaard på mail qro@hvidovre.dk eller på telefon 41850000. 
 Denne jobannonce blev oprindeligt opslået på https://www.ofir.dk/
 (Den originale annonce kan ses på: https://www.ofir.dk/showojob?ofirid=91eaefee)",Hvidovrevej 278,58,Danmark,167,Hvidovre,4,"Hovedstaden, Sjælland og Bornholm",2650,Hvidovre,1,1,Fuldtid,None,None,1,,0,,0,0,0,,False,"{'Id': 7945717, 'Email': None, 'FaxNumber': None, 'PersonName': 'Mette Rosengaard', 'FirstName': 'Mette', 'LastName': 'Rosengaard', 'PositionTitle': None, 'PhoneNumbers': [{'Number': '36393821', 'Type': 0, 'Description': 'Hovednummer'}]}",,False,False,False,False,4,,,False,False,False,False,,,,,https://www.ofir.dk/resultat/Jobannonce.aspx?ofirId=91eaefee&action=sendApplicationUrl,False,2022-05-20T00:00:00,,0,Primary,7,/CV/FindWork/GetLogo?JobAdId=5587003&WorkPlace=5340&Organisation=55606617,"Hvidovrevej 278,2650, Hvidovre",True,False,/CV/Jobseeking/JobLog/CreateJobSearch?JobnetJobPostingIdentifier=5587003&Company.Name=Udvikling og Administration (SOÆ)&SubmissionDeadlineDate=2022-5-20&Title=Erfaren specialkonsulent til ledelses- og organisationsudvikling på Ældre- og Sundhedsområdet&WeeklyWorkTime=1,00000000-0000-0000-0000-000000000000,False,0,,,Erfaren specialkonsulent til ledelses- og organisationsudvikling på Ældre- og Sundhedsområdet,True,,True,1,,5587003,,,False,False,,0,False,Udvikling og Administration (SOÆ),Hvidovrevej 278,,,2650,False,False,False,Hvidovre,Mette Rosengaard,36393821,,,,,,False,,2022-05-20T00:00:00,,0,False,0,,,,,0,,,,False,False,,,False,False,,,,False,,False,,,Arbejdspladsen ligger i Hvidovre kommune,False,Udvikling og Administration (SOÆ),,None,,False,False,"Brænder du for ledelse af sundheds- og ældreområdet? Vil du være med til at udvikle fremtidens ældre- og sundhedsområde i tværorganisatoriske sammenhænge og understøtte tværgående ledelse? Så er det dig, vi har brug for som vores nye kollega i Udvikling & Administration. Hvem leder vi efter? Du brænder for ledelses- og organisationsudvikling og har","""Brænder du for ledelse af sundheds- og ældreområdet? Vil du være med til at udvikle fremtidens ældre- og sundhedsområde i tværorganisatoriske sammenhænge og understøtte tværgående ledelse? Så er det dig, vi har brug for som vores nye kollega i Udvikling \u0026 Administration. Hvem leder vi efter? Du brænder for ledelses- og organisationsudvikling og har""","""Erfaren specialkonsulent til ledelses- og organisationsudvikling på Ældre- og Sundhedsområdet""","https://www.google.dk/maps/dir//Hvidovrevej+278,2650,+Hvidovre/","Brænder du for ledelse af sundheds- og ældreområdet? Vil du være med til at udvikle fremtidens ældre- og sundhedsområde i tværorganisatoriske sammenhænge og understøtte tværgående ledelse? Så er det dig, vi har brug for som vores nye kollega i Udvikling & Administration.   Hvem leder vi efter?  Du brænder for ledelses- og organisationsudvikling og har fingeren på pulsen i forhold til aktuelle tendenser indenfor ledelse og sundheds- og ældreområdet.     Vi søger en erfaren specialkonsulent til en spændende og udviklende stilling i vores konsulent-team, hvor du vil komme til at løse en bred vifte af opgaver inden for projektledelse, procesledelse, politik- og strategiudvikling, udarbejdelse af politiske sager og sekretariatsbetjening af udvalg.    Dine opgaver varierer over tid og tilpasses dine kompetencer og erfaringer. En gennemgående opgave bliver at understøtte de i alt 47 ledere i Center for Sundhed & Ældre blandt andet i deres mellemledernetværk og i forbindelse med lederseminarer.    Hvem er du?  Du har en relevant kandidatuddannelse og flere års erfaring med ledelses- og organisationsudvikling i en politisk kontekst. Du har solid erfaring med at facilitere udviklings- og implementeringsprocesser, og du trives i rollen som ansvarlig for at sikre, at processer og projekter kommer godt i mål.    Du kommunikerer godt i både skrift og i tale, uanset målgruppen. Du arbejder selvstændigt, er god til at få øje på nye løsninger, og du er vedholdende og målrettet, når opgaverne kræver det. Som person er du nysgerrig, opsøgende og er god til at danne relationer med mange forskellige faggrupper. Du bidrager med god energi, også i vores interne udviklingsprocesser, og måderne, vi løser dem på.    Hvem er vi?  Udvikling & Administration består af et konsulent-team, et IT-team og et administrativt team. Vores formål er at bidrage til at skabe de bedste betingelser for, at de decentrale enheder i Center for Sundhed og Ældre i Hvidovre Kommune lykkes med opgaverne ud fra gældende politikker og retningslinjer.    Ud over Udvikling & Administration er der i Center for Sundhed og Ældre tre plejecentre, hjemmepleje, sygepleje, genoptræning og rehabilitering, Visitationen samt Sundhed og Forebyggelse. Vores fælles kerneopgave er at sikre pleje og omsorg til borgerne ud fra en strategi om, at vi gør det bedst, når vi gør det sammen.   Du kan se mere om os her.   Hvad kan vi tilbyde?  Vi er ambitiøse og har et uhøjtideligt arbejdsfællesskab. Vi tror på, at vi udvikler os gennem relevant kompetenceudvikling, via opgaverne og ved at indgå i tværfaglige teams, i sparring og dialog. Vores ambition er at samarbejde bredt og på tværs om at koble strategier og politikker sammen og finde de mest optimale løsninger.    Der er ansøgningsfrist den 20. maj 2022. Vi forventer at holde ansættelsessamtaler den 2. juni 2022.   Yderligere oplysninger  Vil du vide mere, så er du velkommen til at kontakte konstitueret leder af Udvikling & Administration Mette Rosengaard på mail qro@hvidovre.dk eller på telefon 41850000. 
 Denne jobannonce blev oprindeligt opslået på  https://www.ofir.dk/ 
 (Den originale annonce kan ses på:  https://www.ofir.dk/showojob?ofirid=91eaefee )","https://www.google.dk/maps/place/Hvidovrevej+278,2650,+Hvidovre/",55606617,False,False,,False
