summary_AutomatchType,summary_Abroad,summary_Weight,summary_Title,summary_JobHeadline,summary_Presentation,summary_HiringOrgName,summary_WorkPlaceAddress,summary_WorkPlacePostalCode,summary_WorkPlaceCity,summary_WorkPlaceOtherAddress,summary_WorkPlaceAbroad,summary_WorkPlaceNotStatic,summary_UseWorkPlaceAddressForJoblog,summary_PostingCreated,summary_LastDateApplication,summary_FormattedLastDateApplication,summary_AssignmentStartDate,summary_IsHotjob,summary_IsExternal,summary_Url,summary_Region,summary_Municipality,summary_Country,summary_PostalCode,summary_PostalCodeName,summary_JobAnnouncementType,summary_EmploymentType,summary_WorkHours,summary_OccupationArea,summary_OccupationGroup,summary_Occupation,summary_Location_Latitude,summary_Location_Longitude,summary_JoblogWorkTime_WorkHour,summary_JoblogWorkTime_DailyWorkTime,summary_WorkplaceID,summary_OrganisationId,summary_HiringOrgCVR,summary_UserLoggedIn,summary_AnonymousEmployer,summary_ShareUrl,summary_DetailsUrl,summary_JobLogUrl,summary_HasLocationValues,summary_ID,summary_Latitude,summary_Longitude,details_WorkSchedule,details_WorkConditions,details_EmploymentTypes,details_WorkPlace_Name,details_WorkPlace_Address_AddressLine,details_WorkPlace_Address_Country_Id,details_WorkPlace_Address_Country_Name,details_WorkPlace_Address_Municipality_Id,details_WorkPlace_Address_Municipality_Name,details_WorkPlace_Address_Region_Id,details_WorkPlace_Address_Region_Name,details_WorkPlace_Address_PostalCode,details_WorkPlace_Address_City,details_WorkPlace_PhoneNumber_Number,details_WorkPlace_PhoneNumber_Type,details_WorkPlace_PhoneNumber_Description,details_WorkPlace_FaxNumber,details_WorkPlace_Email,details_WorkPlace_WebAddress,details_WorkPlace_Description,details_WorkPlace_Logo,details_WorkPlace_WorkPlaceOrganizationNumber,details_WorkPlace_OrganizationNumber,details_WorkPlace_OrganizationDescription,details_JobPositionPosting_Id,details_JobPositionPosting_OriginalJppId,details_JobPositionPosting_HiringOrg_Name,details_JobPositionPosting_HiringOrg_Address_AddressLine,details_JobPositionPosting_HiringOrg_Address_Country_Id,details_JobPositionPosting_HiringOrg_Address_Country_Name,details_JobPositionPosting_HiringOrg_Address_Municipality_Id,details_JobPositionPosting_HiringOrg_Address_Municipality_Name,details_JobPositionPosting_HiringOrg_Address_Region_Id,details_JobPositionPosting_HiringOrg_Address_Region_Name,details_JobPositionPosting_HiringOrg_Address_PostalCode,details_JobPositionPosting_HiringOrg_Address_City,details_JobPositionPosting_HiringOrg_PhoneNumber_Number,details_JobPositionPosting_HiringOrg_PhoneNumber_Type,details_JobPositionPosting_HiringOrg_PhoneNumber_Description,details_JobPositionPosting_HiringOrg_FaxNumber,details_JobPositionPosting_HiringOrg_Email,details_JobPositionPosting_HiringOrg_WebAddress,details_JobPositionPosting_HiringOrg_Description,details_JobPositionPosting_HiringOrg_Logo,details_JobPositionPosting_HiringOrg_WorkPlaceOrganizationNumber,details_JobPositionPosting_HiringOrg_OrganizationNumber,details_JobPositionPosting_HiringOrg_OrganizationDescription,details_JobPositionPosting_RecruitingCompany,details_JobPositionPosting_PublicationStartDate,details_JobPositionPosting_PublicationEndDate,details_JobPositionPosting_JobPositionInformation_PositionTitle,details_JobPositionPosting_JobPositionInformation_Purpose,details_JobPositionPosting_JobPositionInformation_WorkLocation_AddressLine,details_JobPositionPosting_JobPositionInformation_WorkLocation_Country_Id,details_JobPositionPosting_JobPositionInformation_WorkLocation_Country_Name,details_JobPositionPosting_JobPositionInformation_WorkLocation_Municipality_Id,details_JobPositionPosting_JobPositionInformation_WorkLocation_Municipality_Name,details_JobPositionPosting_JobPositionInformation_WorkLocation_Region_Id,details_JobPositionPosting_JobPositionInformation_WorkLocation_Region_Name,details_JobPositionPosting_JobPositionInformation_WorkLocation_PostalCode,details_JobPositionPosting_JobPositionInformation_WorkLocation_City,details_JobPositionPosting_JobPositionInformation_EmploymentType,details_JobPositionPosting_JobPositionInformation_WeeklyWorkHours_TypeId,details_JobPositionPosting_JobPositionInformation_WeeklyWorkHours_TypeName,details_JobPositionPosting_JobPositionInformation_WeeklyWorkHours_Description,details_JobPositionPosting_JobPositionInformation_CompensationDescription,details_JobPositionPosting_JobPositionInformation_NumberToFill,details_JobPositionPosting_JobPositionInformation_DriverLicense,details_JobPositionPosting_JobPositionInformation_Occupation_DiscoWeb,details_JobPositionPosting_JobPositionInformation_Occupation_AlternateNames,details_JobPositionPosting_JobPositionInformation_Occupation_GroupId,details_JobPositionPosting_JobPositionInformation_Occupation_AreaId,details_JobPositionPosting_JobPositionInformation_Occupation_Id,details_JobPositionPosting_JobPositionInformation_Occupation_Name,details_JobPositionPosting_JobPositionInformation_IsGovernmentHiring,details_JobPositionPosting_JobPositionInformation_JppContacts,details_JobPositionPosting_JobPositionInformation_EmploymentDate,details_JobPositionPosting_IsRecruitmentOfForeignNationals,details_JobPositionPosting_IsWorkInDenmark,details_JobPositionPosting_IsAnonymousEmployer,details_JobPositionPosting_IsDisabilityFriendly,details_JobPositionPosting_JppType,details_JobPositionPosting_ApplicationDetails_WorkHourMax,details_JobPositionPosting_ApplicationDetails_WorkHourMin,details_JobPositionPosting_ApplicationDetails_DailyWorkTimeWeekend,details_JobPositionPosting_ApplicationDetails_DailyWorkTimeNight,details_JobPositionPosting_ApplicationDetails_DailyWorkTimeEvening,details_JobPositionPosting_ApplicationDetails_DailyWorkTimeDay,details_JobPositionPosting_ApplicationDetails_ReferenceText,details_JobPositionPosting_ApplicationDetails_RemarksToApplicant,details_JobPositionPosting_ApplicationDetails_ByEmail,details_JobPositionPosting_ApplicationDetails_ByPhone,details_JobPositionPosting_ApplicationDetails_ApplyViaUrl,details_JobPositionPosting_ApplicationDetails_ReplyInWriting,details_JobPositionPosting_ApplicationDetails_ApplicationDeadlineDate,details_JobPositionPosting_ContactAuthorityPhoneNumber_Number,details_JobPositionPosting_ContactAuthorityPhoneNumber_Type,details_JobPositionPosting_ContactAuthorityPhoneNumber_Description,details_JobPositionPosting_Status,details_LogoUrl,details_Address,details_ShowMap,details_ShowShareButtonJobLog,details_JobLogUrl,details_JobLogTemplateModel_Identifier,details_JobLogTemplateModel_UseWorkPlaceAddressForJoblog,details_JobLogTemplateModel_Category,details_JobLogTemplateModel_CvCustomerIdentifier,details_JobLogTemplateModel_JobSeekingStatus,details_JobLogTemplateModel_Title,details_JobLogTemplateModel_IsApplicationSourceRequired,details_JobLogTemplateModel_ApplicationSource,details_JobLogTemplateModel_IsWeeklyWorkTimeRequired,details_JobLogTemplateModel_WeeklyWorkTime,details_JobLogTemplateModel_HoursPerWeek,details_JobLogTemplateModel_JobnetJobPostingIdentifier,details_JobLogTemplateModel_JobAdDocument_Title,details_JobLogTemplateModel_JobAdDocument_Identifier,details_JobLogTemplateModel_JobAdDocument_IsDeletedBySystem,details_JobLogTemplateModel_JobAdDocument_IsDeletedByUser,details_JobLogTemplateModel_JobAdFile,details_JobLogTemplateModel_Company_JobLogEntryCategory,details_JobLogTemplateModel_Company_ShowAddressFieldsEvenIfEmpty,details_JobLogTemplateModel_Company_Name,details_JobLogTemplateModel_Company_Address,details_JobLogTemplateModel_Company_Country,details_JobLogTemplateModel_Company_EmploymentAreaID,details_JobLogTemplateModel_Company_PostCode,details_JobLogTemplateModel_Company_IsCountryAndTownAndPostCodeEmpty,details_JobLogTemplateModel_Company_IsTownAndPostCodeEmpty,details_JobLogTemplateModel_Company_IsCountryDanmark,details_JobLogTemplateModel_Company_Town,details_JobLogTemplateModel_Company_ContactPerson,details_JobLogTemplateModel_Company_Phone,details_JobLogTemplateModel_Company_Email,details_JobLogTemplateModel_Company_Latitude,details_JobLogTemplateModel_Company_Longitude,details_JobLogTemplateModel_Company_DailyTravelTimeInMinutes,details_JobLogTemplateModel_Company_DistanceToCompanyInMeters,details_JobLogTemplateModel_Company_IsCreateMode,details_JobLogTemplateModel_TypeOfSubmission,details_JobLogTemplateModel_SubmissionDate,details_JobLogTemplateModel_SubmissionDateFormatted,details_JobLogTemplateModel_SubmissionDateTiks,details_JobLogTemplateModel_IsSubmissionDateRequired,details_JobLogTemplateModel_Status,details_JobLogTemplateModel_DateCreatedFormatted,details_JobLogTemplateModel_DateCreated,details_JobLogTemplateModel_DateModifiedFormatted,details_JobLogTemplateModel_DateModified,details_JobLogTemplateModel_LastModifiedDateTiks,details_JobLogTemplateModel_DateClosed,details_JobLogTemplateModel_JobApplicationDocument_Title,details_JobLogTemplateModel_JobApplicationDocument_Identifier,details_JobLogTemplateModel_JobApplicationDocument_IsDeletedBySystem,details_JobLogTemplateModel_JobApplicationDocument_IsDeletedByUser,details_JobLogTemplateModel_CvDocument_Title,details_JobLogTemplateModel_CvDocument_Identifier,details_JobLogTemplateModel_CvDocument_IsDeletedBySystem,details_JobLogTemplateModel_CvDocument_IsDeletedByUser,details_JobLogTemplateModel_JobApplicationFile,details_JobLogTemplateModel_CvFile,details_JobLogTemplateModel_SubmissionDeadlineDate,details_JobLogTemplateModel_IsPersisted,details_JobLogTemplateModel_ServerValidationErrors,details_JobLogTemplateModel_HasServerValidationErrors,details_JoblogWorkTime_WorkHour,details_JoblogWorkTime_DailyWorkTime,details_Place,details_OpenPrintDialog,details_WorkPlaceInfoText,details_JobCenterContactDetails,details_WorkPlaceDescriptionText,details_FavoriteText,details_IsFavorite,details_ShowFavorite,details_MetaOgTextForSharing,details_DescriptionForSharing,details_TitleForSharing,details_RutePlan,details_FormattedPurpose,details_MapUrl,details_OrganizationNumber,details_ShowSearchJobButton,details_ShowPrint,details_BackToFindWorkButtonUrl,isExternal
0,False,1,Informationssikkerhedskoordinator til Datatilsynet ,Informationssikkerhedskoordinator til Datatilsynet ,"Har du erfaring med implementering og drift af informationssikkerhed, baseret på ISO27001, gerne fra en statslig myndighed og har du lyst til at bruge den på at styrke Datatilsynets interne it- og",Datatilsynet,Carl Jacobsens Vej 35,2500,Valby,False,False,False,True,2022-04-29T00:00:00,2022-05-22T00:00:00,22. maj 2022,0001-01-01T00:00:00,False,False,https://job.jobnet.dk/CV/FindWork/Details/5587244,Hovedstaden og Bornholm,København,Danmark,2500,,,,Fuldtid,It og teleteknik,Tværgående it-arbejde,IT-konsulent,55.6551,12.5126,,,71922,67727,11883729,False,False,https://job.jobnet.dk/CV/FindWork/DetailsSocialmedia/5587244,https://job.jobnet.dk/CV/FindWork/Details/5587244,https://job.jobnet.dk/CV/FindWork/Details/5587244,True,5587244,55.6551,12.5126,"{'Id': 1, 'Name': 'Fuldtid'}, {'Id': 16, 'Name': 'Deltid'}","{'Id': 1, 'Name': 'Almindelige vilkår'}, {'Id': 2, 'Name': 'Fleksjob'}, {'Id': 3, 'Name': 'Skånejob'}, {'Id': 4, 'Name': 'Egnet til efterlønnere og seniorer'}, {'Id': 5, 'Name': 'Job med løntilskud'}, {'Id': 6, 'Name': 'Rotationsjob'}, {'Id': 7, 'Name': 'Virksomhedspraktik'}","{'Id': 1, 'Name': 'Fastansættelse'}, {'Id': 16, 'Name': 'Tidsbegrænset ansættelse'}",Datatilsynet,Carl Jacobsens Vej 35,58,Danmark,101,København,4,"Hovedstaden, Sjælland og Bornholm",2500,Valby,29493254,0,Primary,,jhj@datatilsynet.dk,,"Om Datatilsynet

Datatilsynet er den centrale, uafhængige tilsynsmyndighed på databeskyttelsesområdet, der fører tilsyn med overholdelse af reglerne for behandling af personoplysninger. Vi rådgiver og vejleder, behandler klagesager og gennemfører tilsyn hos myndigheder og virksomheder, ligesom vi også deltager i internationalt arbejde, bl.a. i EU. Datatilsynet består af omkring 60 medarbejdere (jurister, it-sikkerhedskonsulenter, kontorfunktionærer og studentermedhjælpere m.fl.).",71922,1003389171,11883729,"Datatilsynet er den centrale, uafhængige tilsynsmyndighed på databeskyttelsesområdet, der fører tilsyn med overholdelse af reglerne for behandling af personoplysninger. Vi rådgiver og vejleder, behandler klagesager og gennemfører tilsyn hos myndigheder og virksomheder, ligesom vi også deltager i internationalt arbejde, bl.a. i EU. Datatilsynet består af omkring 60 medarbejdere (jurister, it-sikkerhedskonsulenter, kontorfunktionærer og studentermedhjælpere m.fl.).",5587244,5587244,Datatilsynet,Carl Jacobsens Vej 35,58,Danmark,101,København,4,"Hovedstaden, Sjælland og Bornholm",2500,Valby,29493254,0,Primary,,jhj@datatilsynet.dk,,"Om Datatilsynet

Datatilsynet er den centrale, uafhængige tilsynsmyndighed på databeskyttelsesområdet, der fører tilsyn med overholdelse af reglerne for behandling af personoplysninger. Vi rådgiver og vejleder, behandler klagesager og gennemfører tilsyn hos myndigheder og virksomheder, ligesom vi også deltager i internationalt arbejde, bl.a. i EU. Datatilsynet består af omkring 60 medarbejdere (jurister, it-sikkerhedskonsulenter, kontorfunktionærer og studentermedhjælpere m.fl.).",71922,1003389171,11883729,"Datatilsynet er den centrale, uafhængige tilsynsmyndighed på databeskyttelsesområdet, der fører tilsyn med overholdelse af reglerne for behandling af personoplysninger. Vi rådgiver og vejleder, behandler klagesager og gennemfører tilsyn hos myndigheder og virksomheder, ligesom vi også deltager i internationalt arbejde, bl.a. i EU. Datatilsynet består af omkring 60 medarbejdere (jurister, it-sikkerhedskonsulenter, kontorfunktionærer og studentermedhjælpere m.fl.).",,2022-04-29T00:00:00,2022-05-22T00:00:00,Informationssikkerhedskoordinator til Datatilsynet,"Har du erfaring med implementering og drift af informationssikkerhed, baseret på ISO27001, gerne fra en statslig myndighed og har du lyst til at bruge den på at styrke Datatilsynets interne it- og informationssikkerhed? Så er du måske vores nye kollega, som vil varetage de daglige opgaver med at drive vores ISMS.   Om stillingen   Vi tilbyder en stilling tæt på ledelsen i en myndighed med stor samfundsmæssig betydning. Du får mulighed for at udvikle dig fagligt og personligt i et uformelt og udviklingsorienteret miljø præget af høj faglighed, engagement, arbejdsglæde og samarbejde på tværs.   Du vil som informationssikkerhedskoordinator, med reference til Datatilsynets it-ansvarlige primært arbejde med udvikling og drift af Datatilsynets interne it- og informationssikkerhed.   Dine arbejdsopgaver omfatter bl.a. at:     udarbejde, implementere og vedligeholde interne politikker og retningslinjer, procedurer og vejledninger om informationssikkerhed, herunder sikkerhedscirkulæret,   dokumentere overholdelse af ovennævnte retningslinjer mv.,    deltage i risikovurdering og -håndtering   omsætte ISO-standarder til operationelle og effektive, procedurer, der efterleves i praksis i det daglige arbejde,    drive organisationens udvikling på ISMS-området, herunder gennemførsel og rapportering af årlige interne audits,   deltage i ministerielle ERFA-grupper og andre netværk   følge op på samt dokumentere interne sikkerhedsbrud,    udvikle og gennemføre tilbagevendende awareness-kampagner for dine kolleger,    gennemføre og følge op på diverse modenhedsmålinger og risikovurderinger     Om dig   Vi har brug for en kollega, der har lyst til at tage ansvar, og som har et solidt fagligt fundament.    Vi vægter indstilling og erfaring over uddannelse, men vi forventer, at du har erfaring med informationssikkerhed, meget gerne i offentlige organisationer og suppleret med relevante certificeringer.   Vi har brug for en kollega med en stærk organisatorisk forståelse, højt abstraktionsniveau samt gode skriftlige og mundtlige kommunikationsevner, så du kan rådgive og vejlede internt om informationssikkerhed og formidle tekniske og forretningsmæssige budskaber på en sådan måde, at de matcher modtagerens behov.  Du skal kunne lide at kommunikere præcist og målgruppeorienteret, f.eks. er du god til at udarbejde vejledninger til dine kollegaer om konkrete it- eller informationssikkerhedsforanstaltninger og skarpe beslutningsoplæg, bl.a. i form af notater og præsentationer til Datatilsynets direktør og øvrige ledelsesgruppe mv.   Vi lægger vægt på, at du har dokumenteret erfaring med informationssikkerhed baseret på ISO 27001 samt kendskab til GDPR og at du kan organisere og lede dine egne opgaver. Du evner at styre processer og bringe dem i mål, du tager initiativ og sætter en ære i at få tingene gjort færdigt. Endvidere vil du skulle indgå i projekter som sikkerhedsrådgiver.   Vi lægger endvidere vægt på, at du har stor teknologiforståelse, er meget udviklingsorienteret og allerede følger nysgerrigt med i den teknologiske udvikling, ligesom du har appetit på hele tiden at øge dine kompetencer.   Herudover lægger vi vægt på, at du som person:     er udadvendt, engageret, proaktiv, handlekraftig og fleksibel   kan skabe og bevare overblikket - også i pressede situationer,   trives med forandringer og har mod på selv at drive forandringsprocesser,   arbejder selvstændigt inden for fastlagte rammer, og resultatorienteret i din opgaveløsning,   er grundig, vedholdende og følger opgaver helt til dørs,   trives med at overholde deadlines,    har god analytisk sans,   har sans for dokumentation og er omhyggelig med løbende at opdatere den dokumentation, du har ansvar for,   har gode samarbejdsevner, lyst til at indgå i nye relationer og trives med at være opsøgende bredt i organisationen     Løn- og ansættelsesvilkår    Ansættelsesområdet er Datatilsynet, og stillingen besættes på overenskomstvilkår.    Du vil blive ansat efter gældende overenskomst. Der vil herudover kunne aftales tillæg afhængig af erfaring og kvalifikationer.     Det er en forudsætning for ansættelsen, at du i forbindelse med samtalen giver dit samtykke til, at Datatilsynet må indhente og vurdere oplysninger om dig i det Centrale Kriminalregister.    Det er en forudsætning for din ansættelse, at du kan opnå og opretholde en sikkerhedsgodkendelse.    Ansøgning og øvrige oplysninger   Har du lyst til at blive en del af Datatilsynet, skal du søge stillingen elektronisk på Datatilsynets hjemmeside.   Ud over din ansøgning bedes du vedhæfte CV, relevante eksamenspapirer med karakterer og eventuelle udtalelser fra tidligere arbejdsgivere.     Ansøgningsfristen er  senest søndag den 22. maj 2022.    Vi indkalder løbende til samtale. Der indgår en skriftlig case-opgave i forbindelse med samtalen.",Carl Jacobsens Vej 35,58,Danmark,101,København,4,"Hovedstaden, Sjælland og Bornholm",2500,Valby,1,1,Fuldtid,None,None,1,,0,,0,0,0,,False,"{'Id': 7946619, 'Email': 'jhj@datatilsynet.dk', 'FaxNumber': None, 'PersonName': 'Jan Hjelvang', 'FirstName': 'Jan', 'LastName': 'Hjelvang', 'PositionTitle': 'It-ansvarlig og it-koordinator', 'PhoneNumbers': [{'Number': '29493254', 'Type': 0, 'Description': 'Hovednummer'}]}",,False,False,False,False,4,,,False,False,False,False,,,,,https://candidate.hr-manager.net/ApplicationInit.aspx?cid=5001&ProjectId=155772&DepartmentId=10055&MediaId=3369&SkipAdvertisement=true,False,2022-05-22T00:00:00,,0,Primary,7,/CV/FindWork/GetLogo?JobAdId=5587244&WorkPlace=71922&Organisation=11883729,"Carl Jacobsens Vej 35,2500, Valby",True,False,/CV/Jobseeking/JobLog/CreateJobSearch?JobnetJobPostingIdentifier=5587244&Company.Name=Datatilsynet&SubmissionDeadlineDate=2022-5-22&Title=Informationssikkerhedskoordinator til Datatilsynet&WeeklyWorkTime=1,00000000-0000-0000-0000-000000000000,False,0,,,Informationssikkerhedskoordinator til Datatilsynet,True,,True,1,,5587244,,,False,False,,0,False,Datatilsynet,Carl Jacobsens Vej 35,,,2500,False,False,False,Valby,Jan Hjelvang,29493254,jhj@datatilsynet.dk,,,,,False,,2022-05-22T00:00:00,,0,False,0,,,,,0,,,,False,False,,,False,False,,,,False,,False,,,Arbejdspladsen ligger i København kommune,False,Datatilsynet,,"Om Datatilsynet

Datatilsynet er den centrale, uafhængige tilsynsmyndighed på databeskyttelsesområdet, der fører tilsyn med overholdelse af reglerne for behandling af personoplysninger. Vi rådgiver og vejleder, behandler klagesager og gennemfører tilsyn hos myndigheder og virksomheder, ligesom vi også deltager i internationalt arbejde, bl.a. i EU. Datatilsynet består af omkring 60 medarbejdere (jurister, it-sikkerhedskonsulenter, kontorfunktionærer og studentermedhjælpere m.fl.).",,False,False,"Har du erfaring med implementering og drift af informationssikkerhed, baseret på ISO27001, gerne fra en statslig myndighed og har du lyst til at bruge den på at styrke Datatilsynets interne it- og informationssikkerhed? Så er du måske vores nye kollega, som vil varetage de daglige opgaver med at drive vores ISMS.  Om stillingen  Vi tilbyder en stil","""Har du erfaring med implementering og drift af informationssikkerhed, baseret på ISO27001, gerne fra en statslig myndighed og har du lyst til at bruge den på at styrke Datatilsynets interne it- og informationssikkerhed? Så er du måske vores nye kollega, som vil varetage de daglige opgaver med at drive vores ISMS.  Om stillingen  Vi tilbyder en stil""","""Informationssikkerhedskoordinator til Datatilsynet""","https://www.google.dk/maps/dir//Carl+Jacobsens+Vej+35,2500,+Valby/","Har du erfaring med implementering og drift af informationssikkerhed, baseret på ISO27001, gerne fra en statslig myndighed og har du lyst til at bruge den på at styrke Datatilsynets interne it- og informationssikkerhed? Så er du måske vores nye kollega, som vil varetage de daglige opgaver med at drive vores ISMS.   Om stillingen   Vi tilbyder en stilling tæt på ledelsen i en myndighed med stor samfundsmæssig betydning. Du får mulighed for at udvikle dig fagligt og personligt i et uformelt og udviklingsorienteret miljø præget af høj faglighed, engagement, arbejdsglæde og samarbejde på tværs.   Du vil som informationssikkerhedskoordinator, med reference til Datatilsynets it-ansvarlige primært arbejde med udvikling og drift af Datatilsynets interne it- og informationssikkerhed.   Dine arbejdsopgaver omfatter bl.a. at:     udarbejde, implementere og vedligeholde interne politikker og retningslinjer, procedurer og vejledninger om informationssikkerhed, herunder sikkerhedscirkulæret,   dokumentere overholdelse af ovennævnte retningslinjer mv.,    deltage i risikovurdering og -håndtering   omsætte ISO-standarder til operationelle og effektive, procedurer, der efterleves i praksis i det daglige arbejde,    drive organisationens udvikling på ISMS-området, herunder gennemførsel og rapportering af årlige interne audits,   deltage i ministerielle ERFA-grupper og andre netværk   følge op på samt dokumentere interne sikkerhedsbrud,    udvikle og gennemføre tilbagevendende awareness-kampagner for dine kolleger,    gennemføre og følge op på diverse modenhedsmålinger og risikovurderinger     Om dig   Vi har brug for en kollega, der har lyst til at tage ansvar, og som har et solidt fagligt fundament.    Vi vægter indstilling og erfaring over uddannelse, men vi forventer, at du har erfaring med informationssikkerhed, meget gerne i offentlige organisationer og suppleret med relevante certificeringer.   Vi har brug for en kollega med en stærk organisatorisk forståelse, højt abstraktionsniveau samt gode skriftlige og mundtlige kommunikationsevner, så du kan rådgive og vejlede internt om informationssikkerhed og formidle tekniske og forretningsmæssige budskaber på en sådan måde, at de matcher modtagerens behov.  Du skal kunne lide at kommunikere præcist og målgruppeorienteret, f.eks. er du god til at udarbejde vejledninger til dine kollegaer om konkrete it- eller informationssikkerhedsforanstaltninger og skarpe beslutningsoplæg, bl.a. i form af notater og præsentationer til Datatilsynets direktør og øvrige ledelsesgruppe mv.   Vi lægger vægt på, at du har dokumenteret erfaring med informationssikkerhed baseret på ISO 27001 samt kendskab til GDPR og at du kan organisere og lede dine egne opgaver. Du evner at styre processer og bringe dem i mål, du tager initiativ og sætter en ære i at få tingene gjort færdigt. Endvidere vil du skulle indgå i projekter som sikkerhedsrådgiver.   Vi lægger endvidere vægt på, at du har stor teknologiforståelse, er meget udviklingsorienteret og allerede følger nysgerrigt med i den teknologiske udvikling, ligesom du har appetit på hele tiden at øge dine kompetencer.   Herudover lægger vi vægt på, at du som person:     er udadvendt, engageret, proaktiv, handlekraftig og fleksibel   kan skabe og bevare overblikket - også i pressede situationer,   trives med forandringer og har mod på selv at drive forandringsprocesser,   arbejder selvstændigt inden for fastlagte rammer, og resultatorienteret i din opgaveløsning,   er grundig, vedholdende og følger opgaver helt til dørs,   trives med at overholde deadlines,    har god analytisk sans,   har sans for dokumentation og er omhyggelig med løbende at opdatere den dokumentation, du har ansvar for,   har gode samarbejdsevner, lyst til at indgå i nye relationer og trives med at være opsøgende bredt i organisationen     Løn- og ansættelsesvilkår    Ansættelsesområdet er Datatilsynet, og stillingen besættes på overenskomstvilkår.    Du vil blive ansat efter gældende overenskomst. Der vil herudover kunne aftales tillæg afhængig af erfaring og kvalifikationer.     Det er en forudsætning for ansættelsen, at du i forbindelse med samtalen giver dit samtykke til, at Datatilsynet må indhente og vurdere oplysninger om dig i det Centrale Kriminalregister.    Det er en forudsætning for din ansættelse, at du kan opnå og opretholde en sikkerhedsgodkendelse.    Ansøgning og øvrige oplysninger   Har du lyst til at blive en del af Datatilsynet, skal du søge stillingen elektronisk på Datatilsynets hjemmeside.   Ud over din ansøgning bedes du vedhæfte CV, relevante eksamenspapirer med karakterer og eventuelle udtalelser fra tidligere arbejdsgivere.     Ansøgningsfristen er  senest søndag den 22. maj 2022.    Vi indkalder løbende til samtale. Der indgår en skriftlig case-opgave i forbindelse med samtalen.","https://www.google.dk/maps/place/Carl+Jacobsens+Vej+35,2500,+Valby/",11883729,False,False,,False
