summary_AutomatchType,summary_Abroad,summary_Weight,summary_Title,summary_JobHeadline,summary_Presentation,summary_HiringOrgName,summary_WorkPlaceAddress,summary_WorkPlacePostalCode,summary_WorkPlaceCity,summary_WorkPlaceOtherAddress,summary_WorkPlaceAbroad,summary_WorkPlaceNotStatic,summary_UseWorkPlaceAddressForJoblog,summary_PostingCreated,summary_LastDateApplication,summary_FormattedLastDateApplication,summary_AssignmentStartDate,summary_IsHotjob,summary_IsExternal,summary_Url,summary_Region,summary_Municipality,summary_Country,summary_PostalCode,summary_PostalCodeName,summary_JobAnnouncementType,summary_EmploymentType,summary_WorkHours,summary_OccupationArea,summary_OccupationGroup,summary_Occupation,summary_Location_Latitude,summary_Location_Longitude,summary_JoblogWorkTime_WorkHour,summary_JoblogWorkTime_DailyWorkTime,summary_WorkplaceID,summary_OrganisationId,summary_HiringOrgCVR,summary_UserLoggedIn,summary_AnonymousEmployer,summary_ShareUrl,summary_DetailsUrl,summary_JobLogUrl,summary_HasLocationValues,summary_ID,summary_Latitude,summary_Longitude,details_WorkSchedule,details_WorkConditions,details_EmploymentTypes,details_WorkPlace_Name,details_WorkPlace_Address_AddressLine,details_WorkPlace_Address_Country_Id,details_WorkPlace_Address_Country_Name,details_WorkPlace_Address_Municipality_Id,details_WorkPlace_Address_Municipality_Name,details_WorkPlace_Address_Region_Id,details_WorkPlace_Address_Region_Name,details_WorkPlace_Address_PostalCode,details_WorkPlace_Address_City,details_WorkPlace_PhoneNumber_Number,details_WorkPlace_PhoneNumber_Type,details_WorkPlace_PhoneNumber_Description,details_WorkPlace_FaxNumber,details_WorkPlace_Email,details_WorkPlace_WebAddress,details_WorkPlace_Description,details_WorkPlace_Logo,details_WorkPlace_WorkPlaceOrganizationNumber,details_WorkPlace_OrganizationNumber,details_WorkPlace_OrganizationDescription,details_JobPositionPosting_Id,details_JobPositionPosting_OriginalJppId,details_JobPositionPosting_HiringOrg_Name,details_JobPositionPosting_HiringOrg_Address_AddressLine,details_JobPositionPosting_HiringOrg_Address_Country_Id,details_JobPositionPosting_HiringOrg_Address_Country_Name,details_JobPositionPosting_HiringOrg_Address_Municipality_Id,details_JobPositionPosting_HiringOrg_Address_Municipality_Name,details_JobPositionPosting_HiringOrg_Address_Region_Id,details_JobPositionPosting_HiringOrg_Address_Region_Name,details_JobPositionPosting_HiringOrg_Address_PostalCode,details_JobPositionPosting_HiringOrg_Address_City,details_JobPositionPosting_HiringOrg_PhoneNumber_Number,details_JobPositionPosting_HiringOrg_PhoneNumber_Type,details_JobPositionPosting_HiringOrg_PhoneNumber_Description,details_JobPositionPosting_HiringOrg_FaxNumber,details_JobPositionPosting_HiringOrg_Email,details_JobPositionPosting_HiringOrg_WebAddress,details_JobPositionPosting_HiringOrg_Description,details_JobPositionPosting_HiringOrg_Logo,details_JobPositionPosting_HiringOrg_WorkPlaceOrganizationNumber,details_JobPositionPosting_HiringOrg_OrganizationNumber,details_JobPositionPosting_HiringOrg_OrganizationDescription,details_JobPositionPosting_RecruitingCompany,details_JobPositionPosting_PublicationStartDate,details_JobPositionPosting_PublicationEndDate,details_JobPositionPosting_JobPositionInformation_PositionTitle,details_JobPositionPosting_JobPositionInformation_Purpose,details_JobPositionPosting_JobPositionInformation_WorkLocation_AddressLine,details_JobPositionPosting_JobPositionInformation_WorkLocation_Country_Id,details_JobPositionPosting_JobPositionInformation_WorkLocation_Country_Name,details_JobPositionPosting_JobPositionInformation_WorkLocation_Municipality_Id,details_JobPositionPosting_JobPositionInformation_WorkLocation_Municipality_Name,details_JobPositionPosting_JobPositionInformation_WorkLocation_Region_Id,details_JobPositionPosting_JobPositionInformation_WorkLocation_Region_Name,details_JobPositionPosting_JobPositionInformation_WorkLocation_PostalCode,details_JobPositionPosting_JobPositionInformation_WorkLocation_City,details_JobPositionPosting_JobPositionInformation_EmploymentType,details_JobPositionPosting_JobPositionInformation_WeeklyWorkHours_TypeId,details_JobPositionPosting_JobPositionInformation_WeeklyWorkHours_TypeName,details_JobPositionPosting_JobPositionInformation_WeeklyWorkHours_Description,details_JobPositionPosting_JobPositionInformation_CompensationDescription,details_JobPositionPosting_JobPositionInformation_NumberToFill,details_JobPositionPosting_JobPositionInformation_DriverLicense,details_JobPositionPosting_JobPositionInformation_Occupation_DiscoWeb,details_JobPositionPosting_JobPositionInformation_Occupation_AlternateNames,details_JobPositionPosting_JobPositionInformation_Occupation_GroupId,details_JobPositionPosting_JobPositionInformation_Occupation_AreaId,details_JobPositionPosting_JobPositionInformation_Occupation_Id,details_JobPositionPosting_JobPositionInformation_Occupation_Name,details_JobPositionPosting_JobPositionInformation_IsGovernmentHiring,details_JobPositionPosting_JobPositionInformation_JppContacts,details_JobPositionPosting_JobPositionInformation_EmploymentDate,details_JobPositionPosting_IsRecruitmentOfForeignNationals,details_JobPositionPosting_IsWorkInDenmark,details_JobPositionPosting_IsAnonymousEmployer,details_JobPositionPosting_IsDisabilityFriendly,details_JobPositionPosting_JppType,details_JobPositionPosting_ApplicationDetails_WorkHourMax,details_JobPositionPosting_ApplicationDetails_WorkHourMin,details_JobPositionPosting_ApplicationDetails_DailyWorkTimeWeekend,details_JobPositionPosting_ApplicationDetails_DailyWorkTimeNight,details_JobPositionPosting_ApplicationDetails_DailyWorkTimeEvening,details_JobPositionPosting_ApplicationDetails_DailyWorkTimeDay,details_JobPositionPosting_ApplicationDetails_ReferenceText,details_JobPositionPosting_ApplicationDetails_RemarksToApplicant,details_JobPositionPosting_ApplicationDetails_ByEmail,details_JobPositionPosting_ApplicationDetails_ByPhone,details_JobPositionPosting_ApplicationDetails_ApplyViaUrl,details_JobPositionPosting_ApplicationDetails_ReplyInWriting,details_JobPositionPosting_ApplicationDetails_ApplicationDeadlineDate,details_JobPositionPosting_ContactAuthorityPhoneNumber_Number,details_JobPositionPosting_ContactAuthorityPhoneNumber_Type,details_JobPositionPosting_ContactAuthorityPhoneNumber_Description,details_JobPositionPosting_Status,details_LogoUrl,details_Address,details_ShowMap,details_ShowShareButtonJobLog,details_JobLogUrl,details_JobLogTemplateModel_Identifier,details_JobLogTemplateModel_UseWorkPlaceAddressForJoblog,details_JobLogTemplateModel_Category,details_JobLogTemplateModel_CvCustomerIdentifier,details_JobLogTemplateModel_JobSeekingStatus,details_JobLogTemplateModel_Title,details_JobLogTemplateModel_IsApplicationSourceRequired,details_JobLogTemplateModel_ApplicationSource,details_JobLogTemplateModel_IsWeeklyWorkTimeRequired,details_JobLogTemplateModel_WeeklyWorkTime,details_JobLogTemplateModel_HoursPerWeek,details_JobLogTemplateModel_JobnetJobPostingIdentifier,details_JobLogTemplateModel_JobAdDocument_Title,details_JobLogTemplateModel_JobAdDocument_Identifier,details_JobLogTemplateModel_JobAdDocument_IsDeletedBySystem,details_JobLogTemplateModel_JobAdDocument_IsDeletedByUser,details_JobLogTemplateModel_JobAdFile,details_JobLogTemplateModel_Company_JobLogEntryCategory,details_JobLogTemplateModel_Company_ShowAddressFieldsEvenIfEmpty,details_JobLogTemplateModel_Company_Name,details_JobLogTemplateModel_Company_Address,details_JobLogTemplateModel_Company_Country,details_JobLogTemplateModel_Company_EmploymentAreaID,details_JobLogTemplateModel_Company_PostCode,details_JobLogTemplateModel_Company_IsCountryAndTownAndPostCodeEmpty,details_JobLogTemplateModel_Company_IsTownAndPostCodeEmpty,details_JobLogTemplateModel_Company_IsCountryDanmark,details_JobLogTemplateModel_Company_Town,details_JobLogTemplateModel_Company_ContactPerson,details_JobLogTemplateModel_Company_Phone,details_JobLogTemplateModel_Company_Email,details_JobLogTemplateModel_Company_Latitude,details_JobLogTemplateModel_Company_Longitude,details_JobLogTemplateModel_Company_DailyTravelTimeInMinutes,details_JobLogTemplateModel_Company_DistanceToCompanyInMeters,details_JobLogTemplateModel_Company_IsCreateMode,details_JobLogTemplateModel_TypeOfSubmission,details_JobLogTemplateModel_SubmissionDate,details_JobLogTemplateModel_SubmissionDateFormatted,details_JobLogTemplateModel_SubmissionDateTiks,details_JobLogTemplateModel_IsSubmissionDateRequired,details_JobLogTemplateModel_Status,details_JobLogTemplateModel_DateCreatedFormatted,details_JobLogTemplateModel_DateCreated,details_JobLogTemplateModel_DateModifiedFormatted,details_JobLogTemplateModel_DateModified,details_JobLogTemplateModel_LastModifiedDateTiks,details_JobLogTemplateModel_DateClosed,details_JobLogTemplateModel_JobApplicationDocument_Title,details_JobLogTemplateModel_JobApplicationDocument_Identifier,details_JobLogTemplateModel_JobApplicationDocument_IsDeletedBySystem,details_JobLogTemplateModel_JobApplicationDocument_IsDeletedByUser,details_JobLogTemplateModel_CvDocument_Title,details_JobLogTemplateModel_CvDocument_Identifier,details_JobLogTemplateModel_CvDocument_IsDeletedBySystem,details_JobLogTemplateModel_CvDocument_IsDeletedByUser,details_JobLogTemplateModel_JobApplicationFile,details_JobLogTemplateModel_CvFile,details_JobLogTemplateModel_SubmissionDeadlineDate,details_JobLogTemplateModel_IsPersisted,details_JobLogTemplateModel_ServerValidationErrors,details_JobLogTemplateModel_HasServerValidationErrors,details_JoblogWorkTime_WorkHour,details_JoblogWorkTime_DailyWorkTime,details_Place,details_OpenPrintDialog,details_WorkPlaceInfoText,details_JobCenterContactDetails,details_WorkPlaceDescriptionText,details_FavoriteText,details_IsFavorite,details_ShowFavorite,details_MetaOgTextForSharing,details_DescriptionForSharing,details_TitleForSharing,details_RutePlan,details_FormattedPurpose,details_MapUrl,details_OrganizationNumber,details_ShowSearchJobButton,details_ShowPrint,details_BackToFindWorkButtonUrl,isExternal
0,False,1,Herstedvester Skole søger lærer til specialklasse - gruppeordning,Herstedvester Skole søger lærer til specialklasse - gruppeordning,Herstedvester Skole søger lærer til specialklasse - gruppeordning  Brænder du for at skabe stærke børnefællesskaber og bidrage til et meningsfuldt liv for børn i specialklasser? ,Herstedvester Skole,Herstedvestervej 44,2620,Albertslund,False,False,False,True,2022-05-02T00:00:00,2022-06-05T00:00:00,5. juni 2022,0001-01-01T00:00:00,False,False,https://job.jobnet.dk/CV/FindWork/Details/5588045,Hovedstaden og Bornholm,Albertslund,Danmark,2620,,,,Fuldtid,Undervisning og vejledning,Undervisning i grundskoler,Folkeskolelærer,55.6695,12.3407,,,4942,6199,66137112,False,False,https://job.jobnet.dk/CV/FindWork/DetailsSocialmedia/5588045,https://job.jobnet.dk/CV/FindWork/Details/5588045,https://job.jobnet.dk/CV/FindWork/Details/5588045,True,5588045,55.6695,12.3407,"{'Id': 1, 'Name': 'Fuldtid'}, {'Id': 16, 'Name': 'Deltid'}","{'Id': 1, 'Name': 'Almindelige vilkår'}, {'Id': 2, 'Name': 'Fleksjob'}, {'Id': 3, 'Name': 'Skånejob'}, {'Id': 4, 'Name': 'Egnet til efterlønnere og seniorer'}, {'Id': 5, 'Name': 'Job med løntilskud'}, {'Id': 6, 'Name': 'Rotationsjob'}, {'Id': 7, 'Name': 'Virksomhedspraktik'}","{'Id': 1, 'Name': 'Fastansættelse'}, {'Id': 16, 'Name': 'Tidsbegrænset ansættelse'}",Herstedvester Skole,Herstedvestervej 44,58,Danmark,165,Albertslund,4,"Hovedstaden, Sjælland og Bornholm",2620,Albertslund,,0,Primary,,,,None,,1003266711,66137112,None,5588045,5588045,Herstedvester Skole,Herstedvestervej 44,58,Danmark,165,Albertslund,4,"Hovedstaden, Sjælland og Bornholm",2620,Albertslund,,0,Primary,,,,None,,1003266711,66137112,None,,2022-05-02T00:00:00,2022-06-05T00:00:00,Herstedvester Skole søger lærer til specialklasse - gruppeordning,"Herstedvester Skole søger lærer til specialklasse - gruppeordning    Brænder du for at skabe stærke børnefællesskaber og bidrage til et meningsfuldt liv for børn i specialklasser?    På Herstedvester Skole søger vi en lærer med gode specialpædagogiske kompetencer, som arbejder med inkluderende læringsfælleskaber, som går forrest og søger at skabe rammer for at det enkelte barn kan lykkes. I vores gruppeordning er man altid 2 voksne, hvorfor det er vigtigt, at teamsamarbejde betragtes som en styrke og en nødvendighed for at skabe de bedst mulige rammer for elevernes læring og trivsel.     Vores målgruppe er børn med generelle indlæringsvanskeligheder, kendetegnet ved at den kognitive vurdering er, at barnet er langt under gennemsnittet i forhold til sin aldersgruppe eller vanskeligheder svarende hertil.   På nuværende tidspunkt har vi 4 grupper, med plads til 10 elever i hver. De enkelte grupper råder over deres egne klasselokaler. De er indrettet med mulighed for forskellige aktiviteter og med forskelligartede materialer til rådighed.     Eleverne undervises i de fleste af folkeskolelovens fag, men på et individuelt tilrettelagt niveau og differentieret i forhold til deres styrker.  Al undervisning foregår i et miljø der er præget af selvindsigt, hensyntagen og respekt. Gennem dialog søger vi at få vores elever til, at reflektere over deres muligheder og potentialer for herigennem at udvikle sig socialt. Eleverne skal lære at udtrykke meninger og at lytte til og respektere andres.    Vi forventer, at du  •    Har relevant uddannelse indenfor det specialpædagogiske område  •    Har erfaring med elever som er kognitivt udfordret  •    Kan skabe legitimitet i din rolle og facilitere processer, hvor antagelser og mulige løsningsmodeller efterprøves i praksis  •    Bidrager til elevernes læring og trivsel  •    Er struktureret både i arbejdsform og dokumentation  •    Synes, at samarbejde og fælles indsats er en vigtig del af dit arbejde  •    Indarbejder evaluering som løbende cirkulær proces    Vi kan tilbyde dig  •    En lærerstilling som byder på mange forskelligartede opgaver i tæt sparring med ledelsen og kollegaer  •    Et udviklende og spændende samarbejde med PPR  •    Engagerede og dygtige kolleger  •    Mangfoldighed i elevgrupper  •    En uforudsigelig hverdag med højt til loftet og hvor humor vægtes højt  •    En skole, der har fokus på faglighed, trivsel og udvikling af det gode læringsmiljø for alle elever    Om Herstedvester Skole  Vores overordnede strategiske fokusområder er Faglighed, Trivsel og Attraktiv Skole – og vores fokusområder i dette skoleår er bl.a. trivsel, teamsamarbejde - både årgangsteam og fagteam, og forældresamarbejde. Vores ambition er, at alle vores distriktsbørn starter og bliver på Herstedvester Skole, at de trives og udvikler sig både fagligt og socialt. Vi gør os umage og er stolte af vores skole. Vi har høje positive forventninger til hinanden, er ambitiøse og seriøse på vores skoles, elevers og hinandens vegne – og griner lidt engang imellem. Der er højt til loftet og plads til uenighed, men der stilles krav til ordentlighed, tonen og sprogbruget. Vi har ca. 830 elever og 100 medarbejdere – mange engagerede og kompetente. Vi har en meget konstruktiv, engageret og op bakkende skolebestyrelse og forældregruppe, der samtidig også har krav og forventninger til os.     For yderligere oplysninger om stillingen/skolen er du velkommen til at ringe eller skrive til skoleleder Yasar Cakmak på tlf.40302404 eller yca@albertslund.dk eller afdelingsleder Gitte Hildebrand Mikkelsen på tlf. 20963081 eller mail gitte.hildebrand.mikkelsen@albertslund.dk    Ansøgning bilagt eksamensbevis, CV mv. sendes til xxxxx  Ansættelsessamtalerne afholdes løbende.   Tiltrædelse 1. august 2022   Løn- og ansættelsesforhold  Stillingen er en overenskomststilling, og aflønning sker efter gældende overenskomst. Inden evt. ansættelse vil der blive indhentet referencer samt børneattest.    I Albertslund Kommune er højt til loftet, langt mellem væggene – og plads til det skæve. Vi  har gensidig initiativpligt. Gennem forpligtende dialog skaber vi i fællesskab gode og  fleksible rammer for arbejdet i skolen – hele tiden med kerneopgaven i centrum.    I Albertslund Kommune er vi ambitiøse på alle børns vegne. Vi lægger vægt på, at børnene  trives i fællesskaber. Derfor prioriterer vi læring, fordybelse og dannelse højt - sammen  med udvikling af de sociale kompetencer.    I Albertslund Kommune skal alle børn have mulighed for at udfolde deres personlige  kompetencer – og udleve deres passion. De voksne opmuntrer børnene og de unge til at  forfølge deres mål – også de mest ambitiøse. Børnenes læring og udvikling foregår både  inden for og uden for institutionernes mure. I naturen. Sammen med andre.    Velkommen til Albertslund – byen for børnene, det grønne og fællesskabet!    Lønindplacering sker efter forhandling mellem kommunen og den forhandlingsberettigede organisation.     Det er en del af Albertslund Kommunes ansættelsespolitik at fremme mangfoldighed og ligestilling.    Det er en forudsætning for din ansættelse i Albertslund Kommune, at du har en gyldig arbejds- og opholdstilladelse.     Albertslund Kommune har røgfri arbejdstid.
 Denne jobannonce blev oprindeligt opslået på https://www.ofir.dk/
 (Den originale annonce kan ses på: https://www.ofir.dk/showojob?ofirid=5f97c01c)",Herstedvestervej 44,58,Danmark,165,Albertslund,4,"Hovedstaden, Sjælland og Bornholm",2620,Albertslund,1,1,Fuldtid,None,None,1,,0,,0,0,0,,False,"{'Id': 7952125, 'Email': None, 'FaxNumber': None, 'PersonName': 'Gitte Mikkelsen', 'FirstName': 'Gitte', 'LastName': 'Mikkelsen', 'PositionTitle': None, 'PhoneNumbers': [{'Number': '43686868', 'Type': 0, 'Description': 'Hovednummer'}]}",,False,False,False,False,4,,,False,False,False,False,,,,,https://www.ofir.dk/resultat/Jobannonce.aspx?ofirId=5f97c01c&action=sendApplicationUrl,False,2022-06-05T00:00:00,,0,Primary,7,/CV/FindWork/GetLogo?JobAdId=5588045&Organisation=66137112,"Herstedvestervej 44,2620, Albertslund",True,False,/CV/Jobseeking/JobLog/CreateJobSearch?JobnetJobPostingIdentifier=5588045&Company.Name=Herstedvester Skole&SubmissionDeadlineDate=2022-6-5&Title=Herstedvester Skole søger lærer til specialklasse - gruppeordning&WeeklyWorkTime=1,00000000-0000-0000-0000-000000000000,False,0,,,Herstedvester Skole søger lærer til specialklasse - gruppeordning,True,,True,1,,5588045,,,False,False,,0,False,Herstedvester Skole,Herstedvestervej 44,,,2620,False,False,False,Albertslund,Gitte Mikkelsen,43686868,,,,,,False,,2022-06-05T00:00:00,,0,False,0,,,,,0,,,,False,False,,,False,False,,,,False,,False,,,Arbejdspladsen ligger i Albertslund kommune,False,Herstedvester Skole,,None,,False,False,"Herstedvester Skole søger lærer til specialklasse - gruppeordning  Brænder du for at skabe stærke børnefællesskaber og bidrage til et meningsfuldt liv for børn i specialklasser?  På Herstedvester Skole søger vi en lærer med gode specialpædagogiske kompetencer, som arbejder med inkluderende læringsfælleskaber, som går forrest og søger at skabe ramme","""Herstedvester Skole søger lærer til specialklasse - gruppeordning  Brænder du for at skabe stærke børnefællesskaber og bidrage til et meningsfuldt liv for børn i specialklasser?  På Herstedvester Skole søger vi en lærer med gode specialpædagogiske kompetencer, som arbejder med inkluderende læringsfælleskaber, som går forrest og søger at skabe ramme""","""Herstedvester Skole søger lærer til specialklasse - gruppeordning""","https://www.google.dk/maps/dir//Herstedvestervej+44,2620,+Albertslund/","Herstedvester Skole søger lærer til specialklasse - gruppeordning    Brænder du for at skabe stærke børnefællesskaber og bidrage til et meningsfuldt liv for børn i specialklasser?    På Herstedvester Skole søger vi en lærer med gode specialpædagogiske kompetencer, som arbejder med inkluderende læringsfælleskaber, som går forrest og søger at skabe rammer for at det enkelte barn kan lykkes. I vores gruppeordning er man altid 2 voksne, hvorfor det er vigtigt, at teamsamarbejde betragtes som en styrke og en nødvendighed for at skabe de bedst mulige rammer for elevernes læring og trivsel.     Vores målgruppe er børn med generelle indlæringsvanskeligheder, kendetegnet ved at den kognitive vurdering er, at barnet er langt under gennemsnittet i forhold til sin aldersgruppe eller vanskeligheder svarende hertil.   På nuværende tidspunkt har vi 4 grupper, med plads til 10 elever i hver. De enkelte grupper råder over deres egne klasselokaler. De er indrettet med mulighed for forskellige aktiviteter og med forskelligartede materialer til rådighed.     Eleverne undervises i de fleste af folkeskolelovens fag, men på et individuelt tilrettelagt niveau og differentieret i forhold til deres styrker.  Al undervisning foregår i et miljø der er præget af selvindsigt, hensyntagen og respekt. Gennem dialog søger vi at få vores elever til, at reflektere over deres muligheder og potentialer for herigennem at udvikle sig socialt. Eleverne skal lære at udtrykke meninger og at lytte til og respektere andres.    Vi forventer, at du  •    Har relevant uddannelse indenfor det specialpædagogiske område  •    Har erfaring med elever som er kognitivt udfordret  •    Kan skabe legitimitet i din rolle og facilitere processer, hvor antagelser og mulige løsningsmodeller efterprøves i praksis  •    Bidrager til elevernes læring og trivsel  •    Er struktureret både i arbejdsform og dokumentation  •    Synes, at samarbejde og fælles indsats er en vigtig del af dit arbejde  •    Indarbejder evaluering som løbende cirkulær proces    Vi kan tilbyde dig  •    En lærerstilling som byder på mange forskelligartede opgaver i tæt sparring med ledelsen og kollegaer  •    Et udviklende og spændende samarbejde med PPR  •    Engagerede og dygtige kolleger  •    Mangfoldighed i elevgrupper  •    En uforudsigelig hverdag med højt til loftet og hvor humor vægtes højt  •    En skole, der har fokus på faglighed, trivsel og udvikling af det gode læringsmiljø for alle elever    Om Herstedvester Skole  Vores overordnede strategiske fokusområder er Faglighed, Trivsel og Attraktiv Skole – og vores fokusområder i dette skoleår er bl.a. trivsel, teamsamarbejde - både årgangsteam og fagteam, og forældresamarbejde. Vores ambition er, at alle vores distriktsbørn starter og bliver på Herstedvester Skole, at de trives og udvikler sig både fagligt og socialt. Vi gør os umage og er stolte af vores skole. Vi har høje positive forventninger til hinanden, er ambitiøse og seriøse på vores skoles, elevers og hinandens vegne – og griner lidt engang imellem. Der er højt til loftet og plads til uenighed, men der stilles krav til ordentlighed, tonen og sprogbruget. Vi har ca. 830 elever og 100 medarbejdere – mange engagerede og kompetente. Vi har en meget konstruktiv, engageret og op bakkende skolebestyrelse og forældregruppe, der samtidig også har krav og forventninger til os.     For yderligere oplysninger om stillingen/skolen er du velkommen til at ringe eller skrive til skoleleder Yasar Cakmak på tlf.40302404 eller yca@albertslund.dk eller afdelingsleder Gitte Hildebrand Mikkelsen på tlf. 20963081 eller mail gitte.hildebrand.mikkelsen@albertslund.dk    Ansøgning bilagt eksamensbevis, CV mv. sendes til xxxxx  Ansættelsessamtalerne afholdes løbende.   Tiltrædelse 1. august 2022   Løn- og ansættelsesforhold  Stillingen er en overenskomststilling, og aflønning sker efter gældende overenskomst. Inden evt. ansættelse vil der blive indhentet referencer samt børneattest.    I Albertslund Kommune er højt til loftet, langt mellem væggene – og plads til det skæve. Vi  har gensidig initiativpligt. Gennem forpligtende dialog skaber vi i fællesskab gode og  fleksible rammer for arbejdet i skolen – hele tiden med kerneopgaven i centrum.    I Albertslund Kommune er vi ambitiøse på alle børns vegne. Vi lægger vægt på, at børnene  trives i fællesskaber. Derfor prioriterer vi læring, fordybelse og dannelse højt - sammen  med udvikling af de sociale kompetencer.    I Albertslund Kommune skal alle børn have mulighed for at udfolde deres personlige  kompetencer – og udleve deres passion. De voksne opmuntrer børnene og de unge til at  forfølge deres mål – også de mest ambitiøse. Børnenes læring og udvikling foregår både  inden for og uden for institutionernes mure. I naturen. Sammen med andre.    Velkommen til Albertslund – byen for børnene, det grønne og fællesskabet!    Lønindplacering sker efter forhandling mellem kommunen og den forhandlingsberettigede organisation.     Det er en del af Albertslund Kommunes ansættelsespolitik at fremme mangfoldighed og ligestilling.    Det er en forudsætning for din ansættelse i Albertslund Kommune, at du har en gyldig arbejds- og opholdstilladelse.     Albertslund Kommune har røgfri arbejdstid.
 Denne jobannonce blev oprindeligt opslået på  https://www.ofir.dk/ 
 (Den originale annonce kan ses på:  https://www.ofir.dk/showojob?ofirid=5f97c01c )","https://www.google.dk/maps/place/Herstedvestervej+44,2620,+Albertslund/",66137112,False,False,,False
