summary_AutomatchType,summary_Abroad,summary_Weight,summary_Title,summary_JobHeadline,summary_Presentation,summary_HiringOrgName,summary_WorkPlaceAddress,summary_WorkPlacePostalCode,summary_WorkPlaceCity,summary_WorkPlaceOtherAddress,summary_WorkPlaceAbroad,summary_WorkPlaceNotStatic,summary_UseWorkPlaceAddressForJoblog,summary_PostingCreated,summary_LastDateApplication,summary_FormattedLastDateApplication,summary_AssignmentStartDate,summary_IsHotjob,summary_IsExternal,summary_Url,summary_Region,summary_Municipality,summary_Country,summary_PostalCode,summary_PostalCodeName,summary_JobAnnouncementType,summary_EmploymentType,summary_WorkHours,summary_OccupationArea,summary_OccupationGroup,summary_Occupation,summary_Location_Latitude,summary_Location_Longitude,summary_JoblogWorkTime_WorkHour,summary_JoblogWorkTime_DailyWorkTime,summary_WorkplaceID,summary_OrganisationId,summary_HiringOrgCVR,summary_UserLoggedIn,summary_AnonymousEmployer,summary_ShareUrl,summary_DetailsUrl,summary_JobLogUrl,summary_HasLocationValues,summary_ID,summary_Latitude,summary_Longitude,details_WorkSchedule,details_WorkConditions,details_EmploymentTypes,details_WorkPlace_Name,details_WorkPlace_Address_AddressLine,details_WorkPlace_Address_Country_Id,details_WorkPlace_Address_Country_Name,details_WorkPlace_Address_Municipality_Id,details_WorkPlace_Address_Municipality_Name,details_WorkPlace_Address_Region_Id,details_WorkPlace_Address_Region_Name,details_WorkPlace_Address_PostalCode,details_WorkPlace_Address_City,details_WorkPlace_PhoneNumber_Number,details_WorkPlace_PhoneNumber_Type,details_WorkPlace_PhoneNumber_Description,details_WorkPlace_FaxNumber,details_WorkPlace_Email,details_WorkPlace_WebAddress,details_WorkPlace_Description,details_WorkPlace_Logo,details_WorkPlace_WorkPlaceOrganizationNumber,details_WorkPlace_OrganizationNumber,details_WorkPlace_OrganizationDescription,details_JobPositionPosting_Id,details_JobPositionPosting_OriginalJppId,details_JobPositionPosting_HiringOrg_Name,details_JobPositionPosting_HiringOrg_Address_AddressLine,details_JobPositionPosting_HiringOrg_Address_Country_Id,details_JobPositionPosting_HiringOrg_Address_Country_Name,details_JobPositionPosting_HiringOrg_Address_Municipality_Id,details_JobPositionPosting_HiringOrg_Address_Municipality_Name,details_JobPositionPosting_HiringOrg_Address_Region_Id,details_JobPositionPosting_HiringOrg_Address_Region_Name,details_JobPositionPosting_HiringOrg_Address_PostalCode,details_JobPositionPosting_HiringOrg_Address_City,details_JobPositionPosting_HiringOrg_PhoneNumber_Number,details_JobPositionPosting_HiringOrg_PhoneNumber_Type,details_JobPositionPosting_HiringOrg_PhoneNumber_Description,details_JobPositionPosting_HiringOrg_FaxNumber,details_JobPositionPosting_HiringOrg_Email,details_JobPositionPosting_HiringOrg_WebAddress,details_JobPositionPosting_HiringOrg_Description,details_JobPositionPosting_HiringOrg_Logo,details_JobPositionPosting_HiringOrg_WorkPlaceOrganizationNumber,details_JobPositionPosting_HiringOrg_OrganizationNumber,details_JobPositionPosting_HiringOrg_OrganizationDescription,details_JobPositionPosting_RecruitingCompany,details_JobPositionPosting_PublicationStartDate,details_JobPositionPosting_PublicationEndDate,details_JobPositionPosting_JobPositionInformation_PositionTitle,details_JobPositionPosting_JobPositionInformation_Purpose,details_JobPositionPosting_JobPositionInformation_WorkLocation_AddressLine,details_JobPositionPosting_JobPositionInformation_WorkLocation_Country_Id,details_JobPositionPosting_JobPositionInformation_WorkLocation_Country_Name,details_JobPositionPosting_JobPositionInformation_WorkLocation_Municipality_Id,details_JobPositionPosting_JobPositionInformation_WorkLocation_Municipality_Name,details_JobPositionPosting_JobPositionInformation_WorkLocation_Region_Id,details_JobPositionPosting_JobPositionInformation_WorkLocation_Region_Name,details_JobPositionPosting_JobPositionInformation_WorkLocation_PostalCode,details_JobPositionPosting_JobPositionInformation_WorkLocation_City,details_JobPositionPosting_JobPositionInformation_EmploymentType,details_JobPositionPosting_JobPositionInformation_WeeklyWorkHours_TypeId,details_JobPositionPosting_JobPositionInformation_WeeklyWorkHours_TypeName,details_JobPositionPosting_JobPositionInformation_WeeklyWorkHours_Description,details_JobPositionPosting_JobPositionInformation_CompensationDescription,details_JobPositionPosting_JobPositionInformation_NumberToFill,details_JobPositionPosting_JobPositionInformation_DriverLicense,details_JobPositionPosting_JobPositionInformation_Occupation_DiscoWeb,details_JobPositionPosting_JobPositionInformation_Occupation_AlternateNames,details_JobPositionPosting_JobPositionInformation_Occupation_GroupId,details_JobPositionPosting_JobPositionInformation_Occupation_AreaId,details_JobPositionPosting_JobPositionInformation_Occupation_Id,details_JobPositionPosting_JobPositionInformation_Occupation_Name,details_JobPositionPosting_JobPositionInformation_IsGovernmentHiring,details_JobPositionPosting_JobPositionInformation_JppContacts,details_JobPositionPosting_JobPositionInformation_EmploymentDate,details_JobPositionPosting_IsRecruitmentOfForeignNationals,details_JobPositionPosting_IsWorkInDenmark,details_JobPositionPosting_IsAnonymousEmployer,details_JobPositionPosting_IsDisabilityFriendly,details_JobPositionPosting_JppType,details_JobPositionPosting_ApplicationDetails_WorkHourMax,details_JobPositionPosting_ApplicationDetails_WorkHourMin,details_JobPositionPosting_ApplicationDetails_DailyWorkTimeWeekend,details_JobPositionPosting_ApplicationDetails_DailyWorkTimeNight,details_JobPositionPosting_ApplicationDetails_DailyWorkTimeEvening,details_JobPositionPosting_ApplicationDetails_DailyWorkTimeDay,details_JobPositionPosting_ApplicationDetails_ReferenceText,details_JobPositionPosting_ApplicationDetails_RemarksToApplicant,details_JobPositionPosting_ApplicationDetails_ByEmail,details_JobPositionPosting_ApplicationDetails_ByPhone,details_JobPositionPosting_ApplicationDetails_ApplyViaUrl,details_JobPositionPosting_ApplicationDetails_ReplyInWriting,details_JobPositionPosting_ApplicationDetails_ApplicationDeadlineDate,details_JobPositionPosting_ContactAuthorityPhoneNumber_Number,details_JobPositionPosting_ContactAuthorityPhoneNumber_Type,details_JobPositionPosting_ContactAuthorityPhoneNumber_Description,details_JobPositionPosting_Status,details_LogoUrl,details_Address,details_ShowMap,details_ShowShareButtonJobLog,details_JobLogUrl,details_JobLogTemplateModel_Identifier,details_JobLogTemplateModel_UseWorkPlaceAddressForJoblog,details_JobLogTemplateModel_Category,details_JobLogTemplateModel_CvCustomerIdentifier,details_JobLogTemplateModel_JobSeekingStatus,details_JobLogTemplateModel_Title,details_JobLogTemplateModel_IsApplicationSourceRequired,details_JobLogTemplateModel_ApplicationSource,details_JobLogTemplateModel_IsWeeklyWorkTimeRequired,details_JobLogTemplateModel_WeeklyWorkTime,details_JobLogTemplateModel_HoursPerWeek,details_JobLogTemplateModel_JobnetJobPostingIdentifier,details_JobLogTemplateModel_JobAdDocument_Title,details_JobLogTemplateModel_JobAdDocument_Identifier,details_JobLogTemplateModel_JobAdDocument_IsDeletedBySystem,details_JobLogTemplateModel_JobAdDocument_IsDeletedByUser,details_JobLogTemplateModel_JobAdFile,details_JobLogTemplateModel_Company_JobLogEntryCategory,details_JobLogTemplateModel_Company_ShowAddressFieldsEvenIfEmpty,details_JobLogTemplateModel_Company_Name,details_JobLogTemplateModel_Company_Address,details_JobLogTemplateModel_Company_Country,details_JobLogTemplateModel_Company_EmploymentAreaID,details_JobLogTemplateModel_Company_PostCode,details_JobLogTemplateModel_Company_IsCountryAndTownAndPostCodeEmpty,details_JobLogTemplateModel_Company_IsTownAndPostCodeEmpty,details_JobLogTemplateModel_Company_IsCountryDanmark,details_JobLogTemplateModel_Company_Town,details_JobLogTemplateModel_Company_ContactPerson,details_JobLogTemplateModel_Company_Phone,details_JobLogTemplateModel_Company_Email,details_JobLogTemplateModel_Company_Latitude,details_JobLogTemplateModel_Company_Longitude,details_JobLogTemplateModel_Company_DailyTravelTimeInMinutes,details_JobLogTemplateModel_Company_DistanceToCompanyInMeters,details_JobLogTemplateModel_Company_IsCreateMode,details_JobLogTemplateModel_TypeOfSubmission,details_JobLogTemplateModel_SubmissionDate,details_JobLogTemplateModel_SubmissionDateFormatted,details_JobLogTemplateModel_SubmissionDateTiks,details_JobLogTemplateModel_IsSubmissionDateRequired,details_JobLogTemplateModel_Status,details_JobLogTemplateModel_DateCreatedFormatted,details_JobLogTemplateModel_DateCreated,details_JobLogTemplateModel_DateModifiedFormatted,details_JobLogTemplateModel_DateModified,details_JobLogTemplateModel_LastModifiedDateTiks,details_JobLogTemplateModel_DateClosed,details_JobLogTemplateModel_JobApplicationDocument_Title,details_JobLogTemplateModel_JobApplicationDocument_Identifier,details_JobLogTemplateModel_JobApplicationDocument_IsDeletedBySystem,details_JobLogTemplateModel_JobApplicationDocument_IsDeletedByUser,details_JobLogTemplateModel_CvDocument_Title,details_JobLogTemplateModel_CvDocument_Identifier,details_JobLogTemplateModel_CvDocument_IsDeletedBySystem,details_JobLogTemplateModel_CvDocument_IsDeletedByUser,details_JobLogTemplateModel_JobApplicationFile,details_JobLogTemplateModel_CvFile,details_JobLogTemplateModel_SubmissionDeadlineDate,details_JobLogTemplateModel_IsPersisted,details_JobLogTemplateModel_ServerValidationErrors,details_JobLogTemplateModel_HasServerValidationErrors,details_JoblogWorkTime_WorkHour,details_JoblogWorkTime_DailyWorkTime,details_Place,details_OpenPrintDialog,details_WorkPlaceInfoText,details_JobCenterContactDetails,details_WorkPlaceDescriptionText,details_FavoriteText,details_IsFavorite,details_ShowFavorite,details_MetaOgTextForSharing,details_DescriptionForSharing,details_TitleForSharing,details_RutePlan,details_FormattedPurpose,details_MapUrl,details_OrganizationNumber,details_ShowSearchJobButton,details_ShowPrint,details_BackToFindWorkButtonUrl,isExternal
0,False,1,Job- og Integrationskonsulenter i front -med stærke koordineringskompetencer og lyst til at gå lidt længere i indsatsen (midlertidige stillinger),Job- og Integrationskonsulenter i front -med stærke koordineringskompetencer og lyst til at gå lidt længere i indsatsen (midlertidige stillinger),"Arbejdssted: Social- og Arbejdsmarkedsforvaltningen, Integrationsområdet, som har til huse på Dieselvej 6, 6000 Kolding Arbejdstid: 37 timer ugentligt. ",Kolding Kommune - Social- og Arbejdsmarkedsforvaltningen SAF,Nicolaiplads 6,6000,Kolding,False,False,False,True,2022-05-04T00:00:00,2022-05-25T00:00:00,25. maj 2022,0001-01-01T00:00:00,False,False,https://job.jobnet.dk/CV/FindWork/Details/5589781,Syddanmark,Kolding,Danmark,6000,,,,Fuldtid,Ledelse,"Administration, strategi og personale",Leder af offentlig forvaltning,55.4909,9.4715,,,57949,57559,29189897,False,False,https://job.jobnet.dk/CV/FindWork/DetailsSocialmedia/5589781,https://job.jobnet.dk/CV/FindWork/Details/5589781,https://job.jobnet.dk/CV/FindWork/Details/5589781,True,5589781,55.4909,9.4715,"{'Id': 1, 'Name': 'Fuldtid'}, {'Id': 16, 'Name': 'Deltid'}","{'Id': 1, 'Name': 'Almindelige vilkår'}, {'Id': 2, 'Name': 'Fleksjob'}, {'Id': 3, 'Name': 'Skånejob'}, {'Id': 4, 'Name': 'Egnet til efterlønnere og seniorer'}, {'Id': 5, 'Name': 'Job med løntilskud'}, {'Id': 6, 'Name': 'Rotationsjob'}, {'Id': 7, 'Name': 'Virksomhedspraktik'}","{'Id': 1, 'Name': 'Fastansættelse'}, {'Id': 16, 'Name': 'Tidsbegrænset ansættelse'}",Kolding Kommune - Social- og Arbejdsmarkedsforvaltningen SAF,Nicolaiplads 6,58,Danmark,621,Kolding,3,Syddanmark,6000,Kolding,,0,Primary,,,,None,57949,1003340140,29189897,None,5589781,5589781,Kolding Kommune - Social- og Arbejdsmarkedsforvaltningen SAF,Nicolaiplads 6,58,Danmark,621,Kolding,3,Syddanmark,6000,Kolding,,0,Primary,,,,None,57949,1003340140,29189897,None,,2022-05-04T00:00:00,2022-05-25T00:00:00,Job- og Integrationskonsulenter i front -med stærke koordineringskompetencer og lyst til at gå lidt længere i indsatsen (midlertidige stillinger),"Arbejdssted:  Social- og Arbejdsmarkedsforvaltningen, Integrationsområdet, som har til huse på Dieselvej 6, 6000 Kolding   Arbejdstid:  37 timer ugentligt.   Stillinger:  4 midlertidige stillinger (6mdr. med mulighed for forlængelse)   I Kolding står vi - som resten af landet - over for en stor opgave med at hjælpe de fordrevne ukrainere med bosætning og job. Der er mange, der gerne vil hjælpe ukrainerne både i civilsamfundet og i erhvervslivet. Vi skal hjælpe de ukrainske familier, så børnene får et godt afsæt i skole og daginstitution, og de voksne kommer i arbejde hurtigst muligt.   Mange virksomheder står på spring for at hjælpe ukrainerne, og arbejdsmarkedet buldrer derudaf. Vi oplever, at nogle ukrainerne kan bidrage på arbejdsmarkedet forholdsvist hurtigt, hvor andre har brug for forskellig hjælp og støtte, inden de er klar. Uddannelsesinstitutionerne melder også ind med tilbud om opkvalificering og står klar til et samarbejde på tværs for netop at sikre, at ukrainerne står med de kompetencer, der efterspørges på arbejdsmarkedet. Sidst men ikke mindst så udvikles mange gode værktøjer til at hjælpe ukrainerne med CV og jobsøgning på digitale platforme.   Handling, fleksibilitet og koordination er nøgleord   Kan du se dig selv stå helt i front for at sikre, at den plan, der bliver lagt for den enkelte ukrainer, bliver udmøntet? Og at det bliver en plan, som er skabt i fællesskab mellem dig som konsulent, jobrådgiveren på området og den enkelte ukrainer? I så fald så har vi et nytænkt og super spændende job med rig mulighed for at gøre en stor forskel og skabe synlige resultater.   Jobbet kræver dit udsyn og din bredde i din viden og erfaring - både i forhold til det virksomhederne kalder på, men også i samarbejdet med uddannelsesinstitutionerne, øvrige offentlige forvaltninger, skole, dagtilbud, frivillighed og interne tilbud. Har du lyst til at sikre koordinering for gruppen af ukrainere, så den enkelte oplever at blive hjulpet bedst muligt ud på arbejdsmarkedet, så er det her stillingen for dig.   Måske har du erfaring fra beskæftigelsesområdet som jobkonsulent, virksomhedskonsulent eller myndighedsrådgiver og drømmer om et job med mere masser af handling og koordinering af indsatser, fordi du ved, at det vil gøre en forskel.   Et nyt team – du bliver ikke alene   I Kolding har vi besluttet at oprette et specialteam/task force, som arbejder helt i front med integrationsopgaven for de fordrevne ukrainere. Vi vil arbejde for, at den enkelte møder så få personer som muligt, og at vi har fokus på at skabe de gode løsninger sammen med borgeren. Opgaven er stor, da Kolding kan forvente at modtage knap 1600 ukrainere, hvoraf de 500-700 vil være i den arbejdsdygtige alder. Derfor skal der sikres et tæt samarbejde i et team omkring opgaven, så vi effektivt og kvalificeret kan trække af hurtigt.   Din opgave kræver, at du har udsyn ud mod arbejdsmarkedet og formår at arbejde med hurtig omsætning af kandidater til de jobs, der efterspørges arbejdskraft til. Du skal sammen med teamet kunne reagere på manglende kompetencer og sammen med uddannelsesinstitutionerne kunne etablere de opkvalificeringsforløb, der kan være behov for, evt. i kombination med danskuddannelse. Det kræver et konstant overblik over de kompetencer, som er i gruppen af ukrainere, og her er brugen af CV det centrale omdrejningspunkt. Derudover kræver opgaven, at du sammen med de medarbejdere, der arbejder med boligplacering, sikrer en smidig overgang til arbejdet med integrationsplanen. En plan, som du sammen jobrådgiveren på området og borgeren, skal sikre bliver realiseret. Opgaven kræver et tæt samspil med jobrådgiveren på integrationsområdet. Det er alfa og omega, at borgeren oplever så få kontaktpersoner, som overhovedet muligt (se illustration)   Dine opgaver:     Tage over efter boligplaceringsteamet   Være en del af udarbejdelsen af planen (integrationskontrakten) for borgeren sammen med jobrådgiveren. En plan som er målrettet mod arbejdsmarkedet og afstemt med aktører – eks. sprogskolen, virksomheden, osv.   Sikre fremdrift, smidige overgange, udvikling/læring og sammenhæng i planen.   Gribe de henvendelser der kommer fra de virksomheder, der efterspørger ukrainere   Være opdateret på de digitale platforme der kan motivere og inspirere borgerens egen jobsøgning herunder CV udarbejdelse – et vigtigt fokus er stille borgeren godt til at hjælpe sig selv.    Sammen med jobcentrets uddannelseskoordinator skitsere behovet for opkvalificering, og i samarbejde med uddannelsesinstitutionerne tilrettelægge korte opkvalificeringsforløb, herunder sproglig opkvalificering   Holde dig opdateret over de kompetencer gruppen af ukrainere besidder, så de kan sættes i spil ude på arbejdsmarkedet   Være klar til at hjælpe med at løse forskellige udfordringer som hindrer den enkelte i at tage sig et arbejde, såsom mødetider, transport, udfordringer i forhold til at børnene skal i skole og daginstitution.     Hvilke krav har vi til dine kompetencer:     Du er stærk på koordinering, og det falder dig let ved at opbygge relationer   Du har interesse for og erfaring med at arbejde med andre kulturer   Du er vant til at begå dig i samspillet med lokale virksomheder   Du har kendskab til uddannelsesområdet og formår at gå i dialog om aktuelle behov for opkvalificering   Du har evt. kendskab til de kommunale forvaltninger, og hvor du kan trække på ressourcepersoner   Du formår at arbejde tværfagligt og at samarbejde med forskellige ressourcepersoner   Du har kendskab til civilsamfundet og dets aktører og formår at trække dem ind i opgaven   Du kan lide at arbejde i et team, der forventes at trække i samme retning for den bedste løsning af opgaven   Du har flair for IT og kan begå dig i de digitale værktøjer.     Vi kan tilbyde dig en arbejdsplads:     hvor vi ved, at vi skaber de bedste resultater i samarbejde med borgeren   hvor vi er optaget af gøre hinanden dygtigere hver dag – det betyder, at vi deler viden og afleverer undren og kritik respektfuldt og konstruktivt   hvor vi ved, at ingen kan lykkes alene – hverken som individ eller som kommune. Vi lykkes kun sammen på tværs af kommunen og i samspil med virksomheder, uddannelsesinstitutioner og civilsamfund   hvor vi ved, at der er direkte sammenhæng imellem medarbejdernes trivsel – borgernes oplevelse af vores indsats – de resultater, vi skal skabe.     Det praktiske   Timetal: 37 timer pr. uge (midlertidigt 6 mdr. med mulighed for forlængelse)   Ansættelsesstart: Vi ansætter løbende i takt med, at behovet stiger.   Ansættelsessamtaler: Vi holder ansættelsessamtaler løbende efter ansøgningsfristens udløb.   Lønvilkår: ansættelse efter gældende overenskomst   Ansøgningsfrist: Den 25. maj 2022   Spørgsmål i øvrigt til stillingerne kan rettes til:   Afdelingsleder: Britt Wendelboe Hansen, Tlf: 79794771 Mobil:30347533 Mail: brwe@kolding.dk   Afdelingsleder: Stefan G. B. Nielsen, Tlf: 79796207 Mobil: 21585599 Mail: stbn@kolding.dk      Forud for ansættelse indhenter Kolding Kommune straffeattest/børneattest, når loven kræver det, eller stillingen i øvrigt berettiger til det. 
 Denne jobannonce blev oprindeligt opslået på https://www.ofir.dk/
 (Den originale annonce kan ses på: https://www.ofir.dk/showojob?ofirid=5c6e3615)",Nicolaiplads 6,58,Danmark,621,Kolding,3,Syddanmark,6000,Kolding,16,1,Fuldtid,None,None,1,,0,,0,0,0,,False,"{'Id': 7957175, 'Email': None, 'FaxNumber': None, 'PersonName': 'Stefan Grevelund Brinch Nielsen', 'FirstName': 'Stefan', 'LastName': 'Grevelund Brinch Nielsen', 'PositionTitle': None, 'PhoneNumbers': [{'Number': '79796207', 'Type': 0, 'Description': 'Hovednummer'}]}",,False,False,False,False,4,,,False,False,False,False,,,,,https://www.ofir.dk/resultat/Jobannonce.aspx?ofirId=5c6e3615&action=sendApplicationUrl,False,2022-05-25T00:00:00,,0,Primary,7,/CV/FindWork/GetLogo?JobAdId=5589781&WorkPlace=57949&Organisation=29189897,"Nicolaiplads 6,6000, Kolding",True,False,/CV/Jobseeking/JobLog/CreateJobSearch?JobnetJobPostingIdentifier=5589781&Company.Name=Kolding Kommune - Social- og Arbejdsmarkedsforvaltningen SAF&SubmissionDeadlineDate=2022-5-25&Title=Job- og Integrationskonsulenter i front -med stærke koordineringskompetencer og lyst til at gå lidt længere i indsatsen (midlertidige stillinger)&WeeklyWorkTime=1,00000000-0000-0000-0000-000000000000,False,0,,,Job- og Integrationskonsulenter i front -med stærke koordineringskompetencer og lyst til at gå lidt længere i indsatsen (midlertidige stillinger),True,,True,1,,5589781,,,False,False,,0,False,Kolding Kommune - Social- og Arbejdsmarkedsforvaltningen SAF,Nicolaiplads 6,,,6000,False,False,False,Kolding,Stefan Grevelund Brinch Nielsen,79796207,,,,,,False,,2022-05-25T00:00:00,,0,False,0,,,,,0,,,,False,False,,,False,False,,,,False,,False,,,Arbejdspladsen ligger i Kolding kommune,False,Kolding Kommune - Social- og Arbejdsmarkedsforvaltningen SAF,,None,,False,False,"Arbejdssted: Social- og Arbejdsmarkedsforvaltningen, Integrationsområdet, som har til huse på Dieselvej 6, 6000 Kolding Arbejdstid: 37 timer ugentligt. Stillinger: 4 midlertidige stillinger (6mdr. med mulighed for forlængelse) I Kolding står vi - som resten af landet - over for en stor opgave med at hjælpe de fordrevne ukrainere med bosætning og jo","""Arbejdssted: Social- og Arbejdsmarkedsforvaltningen, Integrationsområdet, som har til huse på Dieselvej 6, 6000 Kolding Arbejdstid: 37 timer ugentligt. Stillinger: 4 midlertidige stillinger (6mdr. med mulighed for forlængelse) I Kolding står vi - som resten af landet - over for en stor opgave med at hjælpe de fordrevne ukrainere med bosætning og jo""","""Job- og Integrationskonsulenter i front -med stærke koordineringskompetencer og lyst til at gå lidt længere i indsatsen (midlertidige stillinger)""","https://www.google.dk/maps/dir//Nicolaiplads+6,6000,+Kolding/","Arbejdssted:  Social- og Arbejdsmarkedsforvaltningen, Integrationsområdet, som har til huse på Dieselvej 6, 6000 Kolding   Arbejdstid:  37 timer ugentligt.   Stillinger:  4 midlertidige stillinger (6mdr. med mulighed for forlængelse)   I Kolding står vi - som resten af landet - over for en stor opgave med at hjælpe de fordrevne ukrainere med bosætning og job. Der er mange, der gerne vil hjælpe ukrainerne både i civilsamfundet og i erhvervslivet. Vi skal hjælpe de ukrainske familier, så børnene får et godt afsæt i skole og daginstitution, og de voksne kommer i arbejde hurtigst muligt.   Mange virksomheder står på spring for at hjælpe ukrainerne, og arbejdsmarkedet buldrer derudaf. Vi oplever, at nogle ukrainerne kan bidrage på arbejdsmarkedet forholdsvist hurtigt, hvor andre har brug for forskellig hjælp og støtte, inden de er klar. Uddannelsesinstitutionerne melder også ind med tilbud om opkvalificering og står klar til et samarbejde på tværs for netop at sikre, at ukrainerne står med de kompetencer, der efterspørges på arbejdsmarkedet. Sidst men ikke mindst så udvikles mange gode værktøjer til at hjælpe ukrainerne med CV og jobsøgning på digitale platforme.   Handling, fleksibilitet og koordination er nøgleord   Kan du se dig selv stå helt i front for at sikre, at den plan, der bliver lagt for den enkelte ukrainer, bliver udmøntet? Og at det bliver en plan, som er skabt i fællesskab mellem dig som konsulent, jobrådgiveren på området og den enkelte ukrainer? I så fald så har vi et nytænkt og super spændende job med rig mulighed for at gøre en stor forskel og skabe synlige resultater.   Jobbet kræver dit udsyn og din bredde i din viden og erfaring - både i forhold til det virksomhederne kalder på, men også i samarbejdet med uddannelsesinstitutionerne, øvrige offentlige forvaltninger, skole, dagtilbud, frivillighed og interne tilbud. Har du lyst til at sikre koordinering for gruppen af ukrainere, så den enkelte oplever at blive hjulpet bedst muligt ud på arbejdsmarkedet, så er det her stillingen for dig.   Måske har du erfaring fra beskæftigelsesområdet som jobkonsulent, virksomhedskonsulent eller myndighedsrådgiver og drømmer om et job med mere masser af handling og koordinering af indsatser, fordi du ved, at det vil gøre en forskel.   Et nyt team – du bliver ikke alene   I Kolding har vi besluttet at oprette et specialteam/task force, som arbejder helt i front med integrationsopgaven for de fordrevne ukrainere. Vi vil arbejde for, at den enkelte møder så få personer som muligt, og at vi har fokus på at skabe de gode løsninger sammen med borgeren. Opgaven er stor, da Kolding kan forvente at modtage knap 1600 ukrainere, hvoraf de 500-700 vil være i den arbejdsdygtige alder. Derfor skal der sikres et tæt samarbejde i et team omkring opgaven, så vi effektivt og kvalificeret kan trække af hurtigt.   Din opgave kræver, at du har udsyn ud mod arbejdsmarkedet og formår at arbejde med hurtig omsætning af kandidater til de jobs, der efterspørges arbejdskraft til. Du skal sammen med teamet kunne reagere på manglende kompetencer og sammen med uddannelsesinstitutionerne kunne etablere de opkvalificeringsforløb, der kan være behov for, evt. i kombination med danskuddannelse. Det kræver et konstant overblik over de kompetencer, som er i gruppen af ukrainere, og her er brugen af CV det centrale omdrejningspunkt. Derudover kræver opgaven, at du sammen med de medarbejdere, der arbejder med boligplacering, sikrer en smidig overgang til arbejdet med integrationsplanen. En plan, som du sammen jobrådgiveren på området og borgeren, skal sikre bliver realiseret. Opgaven kræver et tæt samspil med jobrådgiveren på integrationsområdet. Det er alfa og omega, at borgeren oplever så få kontaktpersoner, som overhovedet muligt (se illustration)   Dine opgaver:     Tage over efter boligplaceringsteamet   Være en del af udarbejdelsen af planen (integrationskontrakten) for borgeren sammen med jobrådgiveren. En plan som er målrettet mod arbejdsmarkedet og afstemt med aktører – eks. sprogskolen, virksomheden, osv.   Sikre fremdrift, smidige overgange, udvikling/læring og sammenhæng i planen.   Gribe de henvendelser der kommer fra de virksomheder, der efterspørger ukrainere   Være opdateret på de digitale platforme der kan motivere og inspirere borgerens egen jobsøgning herunder CV udarbejdelse – et vigtigt fokus er stille borgeren godt til at hjælpe sig selv.    Sammen med jobcentrets uddannelseskoordinator skitsere behovet for opkvalificering, og i samarbejde med uddannelsesinstitutionerne tilrettelægge korte opkvalificeringsforløb, herunder sproglig opkvalificering   Holde dig opdateret over de kompetencer gruppen af ukrainere besidder, så de kan sættes i spil ude på arbejdsmarkedet   Være klar til at hjælpe med at løse forskellige udfordringer som hindrer den enkelte i at tage sig et arbejde, såsom mødetider, transport, udfordringer i forhold til at børnene skal i skole og daginstitution.     Hvilke krav har vi til dine kompetencer:     Du er stærk på koordinering, og det falder dig let ved at opbygge relationer   Du har interesse for og erfaring med at arbejde med andre kulturer   Du er vant til at begå dig i samspillet med lokale virksomheder   Du har kendskab til uddannelsesområdet og formår at gå i dialog om aktuelle behov for opkvalificering   Du har evt. kendskab til de kommunale forvaltninger, og hvor du kan trække på ressourcepersoner   Du formår at arbejde tværfagligt og at samarbejde med forskellige ressourcepersoner   Du har kendskab til civilsamfundet og dets aktører og formår at trække dem ind i opgaven   Du kan lide at arbejde i et team, der forventes at trække i samme retning for den bedste løsning af opgaven   Du har flair for IT og kan begå dig i de digitale værktøjer.     Vi kan tilbyde dig en arbejdsplads:     hvor vi ved, at vi skaber de bedste resultater i samarbejde med borgeren   hvor vi er optaget af gøre hinanden dygtigere hver dag – det betyder, at vi deler viden og afleverer undren og kritik respektfuldt og konstruktivt   hvor vi ved, at ingen kan lykkes alene – hverken som individ eller som kommune. Vi lykkes kun sammen på tværs af kommunen og i samspil med virksomheder, uddannelsesinstitutioner og civilsamfund   hvor vi ved, at der er direkte sammenhæng imellem medarbejdernes trivsel – borgernes oplevelse af vores indsats – de resultater, vi skal skabe.     Det praktiske   Timetal: 37 timer pr. uge (midlertidigt 6 mdr. med mulighed for forlængelse)   Ansættelsesstart: Vi ansætter løbende i takt med, at behovet stiger.   Ansættelsessamtaler: Vi holder ansættelsessamtaler løbende efter ansøgningsfristens udløb.   Lønvilkår: ansættelse efter gældende overenskomst   Ansøgningsfrist: Den 25. maj 2022   Spørgsmål i øvrigt til stillingerne kan rettes til:   Afdelingsleder: Britt Wendelboe Hansen, Tlf: 79794771 Mobil:30347533 Mail: brwe@kolding.dk   Afdelingsleder: Stefan G. B. Nielsen, Tlf: 79796207 Mobil: 21585599 Mail: stbn@kolding.dk      Forud for ansættelse indhenter Kolding Kommune straffeattest/børneattest, når loven kræver det, eller stillingen i øvrigt berettiger til det. 
 Denne jobannonce blev oprindeligt opslået på  https://www.ofir.dk/ 
 (Den originale annonce kan ses på:  https://www.ofir.dk/showojob?ofirid=5c6e3615 )","https://www.google.dk/maps/place/Nicolaiplads+6,6000,+Kolding/",29189897,False,False,,False
