summary_AutomatchType,summary_Abroad,summary_Weight,summary_Title,summary_JobHeadline,summary_Presentation,summary_HiringOrgName,summary_WorkPlaceAddress,summary_WorkPlacePostalCode,summary_WorkPlaceCity,summary_WorkPlaceOtherAddress,summary_WorkPlaceAbroad,summary_WorkPlaceNotStatic,summary_UseWorkPlaceAddressForJoblog,summary_PostingCreated,summary_LastDateApplication,summary_FormattedLastDateApplication,summary_AssignmentStartDate,summary_IsHotjob,summary_IsExternal,summary_Url,summary_Region,summary_Municipality,summary_Country,summary_PostalCode,summary_PostalCodeName,summary_JobAnnouncementType,summary_EmploymentType,summary_WorkHours,summary_OccupationArea,summary_OccupationGroup,summary_Occupation,summary_Location_Latitude,summary_Location_Longitude,summary_JoblogWorkTime_WorkHour,summary_JoblogWorkTime_DailyWorkTime,summary_WorkplaceID,summary_OrganisationId,summary_HiringOrgCVR,summary_UserLoggedIn,summary_AnonymousEmployer,summary_ShareUrl,summary_DetailsUrl,summary_JobLogUrl,summary_HasLocationValues,summary_ID,summary_Latitude,summary_Longitude,details_WorkSchedule,details_WorkConditions,details_EmploymentTypes,details_WorkPlace_Name,details_WorkPlace_Address_AddressLine,details_WorkPlace_Address_Country_Id,details_WorkPlace_Address_Country_Name,details_WorkPlace_Address_Municipality_Id,details_WorkPlace_Address_Municipality_Name,details_WorkPlace_Address_Region_Id,details_WorkPlace_Address_Region_Name,details_WorkPlace_Address_PostalCode,details_WorkPlace_Address_City,details_WorkPlace_PhoneNumber_Number,details_WorkPlace_PhoneNumber_Type,details_WorkPlace_PhoneNumber_Description,details_WorkPlace_FaxNumber,details_WorkPlace_Email,details_WorkPlace_WebAddress,details_WorkPlace_Description,details_WorkPlace_Logo,details_WorkPlace_WorkPlaceOrganizationNumber,details_WorkPlace_OrganizationNumber,details_WorkPlace_OrganizationDescription,details_JobPositionPosting_Id,details_JobPositionPosting_OriginalJppId,details_JobPositionPosting_HiringOrg_Name,details_JobPositionPosting_HiringOrg_Address_AddressLine,details_JobPositionPosting_HiringOrg_Address_Country_Id,details_JobPositionPosting_HiringOrg_Address_Country_Name,details_JobPositionPosting_HiringOrg_Address_Municipality_Id,details_JobPositionPosting_HiringOrg_Address_Municipality_Name,details_JobPositionPosting_HiringOrg_Address_Region_Id,details_JobPositionPosting_HiringOrg_Address_Region_Name,details_JobPositionPosting_HiringOrg_Address_PostalCode,details_JobPositionPosting_HiringOrg_Address_City,details_JobPositionPosting_HiringOrg_PhoneNumber_Number,details_JobPositionPosting_HiringOrg_PhoneNumber_Type,details_JobPositionPosting_HiringOrg_PhoneNumber_Description,details_JobPositionPosting_HiringOrg_FaxNumber,details_JobPositionPosting_HiringOrg_Email,details_JobPositionPosting_HiringOrg_WebAddress,details_JobPositionPosting_HiringOrg_Description,details_JobPositionPosting_HiringOrg_Logo,details_JobPositionPosting_HiringOrg_WorkPlaceOrganizationNumber,details_JobPositionPosting_HiringOrg_OrganizationNumber,details_JobPositionPosting_HiringOrg_OrganizationDescription,details_JobPositionPosting_RecruitingCompany,details_JobPositionPosting_PublicationStartDate,details_JobPositionPosting_PublicationEndDate,details_JobPositionPosting_JobPositionInformation_PositionTitle,details_JobPositionPosting_JobPositionInformation_Purpose,details_JobPositionPosting_JobPositionInformation_WorkLocation_AddressLine,details_JobPositionPosting_JobPositionInformation_WorkLocation_Country_Id,details_JobPositionPosting_JobPositionInformation_WorkLocation_Country_Name,details_JobPositionPosting_JobPositionInformation_WorkLocation_Municipality_Id,details_JobPositionPosting_JobPositionInformation_WorkLocation_Municipality_Name,details_JobPositionPosting_JobPositionInformation_WorkLocation_Region_Id,details_JobPositionPosting_JobPositionInformation_WorkLocation_Region_Name,details_JobPositionPosting_JobPositionInformation_WorkLocation_PostalCode,details_JobPositionPosting_JobPositionInformation_WorkLocation_City,details_JobPositionPosting_JobPositionInformation_EmploymentType,details_JobPositionPosting_JobPositionInformation_WeeklyWorkHours_TypeId,details_JobPositionPosting_JobPositionInformation_WeeklyWorkHours_TypeName,details_JobPositionPosting_JobPositionInformation_WeeklyWorkHours_Description,details_JobPositionPosting_JobPositionInformation_CompensationDescription,details_JobPositionPosting_JobPositionInformation_NumberToFill,details_JobPositionPosting_JobPositionInformation_DriverLicense,details_JobPositionPosting_JobPositionInformation_Occupation_DiscoWeb,details_JobPositionPosting_JobPositionInformation_Occupation_AlternateNames,details_JobPositionPosting_JobPositionInformation_Occupation_GroupId,details_JobPositionPosting_JobPositionInformation_Occupation_AreaId,details_JobPositionPosting_JobPositionInformation_Occupation_Id,details_JobPositionPosting_JobPositionInformation_Occupation_Name,details_JobPositionPosting_JobPositionInformation_IsGovernmentHiring,details_JobPositionPosting_JobPositionInformation_JppContacts,details_JobPositionPosting_JobPositionInformation_EmploymentDate,details_JobPositionPosting_IsRecruitmentOfForeignNationals,details_JobPositionPosting_IsWorkInDenmark,details_JobPositionPosting_IsAnonymousEmployer,details_JobPositionPosting_IsDisabilityFriendly,details_JobPositionPosting_JppType,details_JobPositionPosting_ApplicationDetails_WorkHourMax,details_JobPositionPosting_ApplicationDetails_WorkHourMin,details_JobPositionPosting_ApplicationDetails_DailyWorkTimeWeekend,details_JobPositionPosting_ApplicationDetails_DailyWorkTimeNight,details_JobPositionPosting_ApplicationDetails_DailyWorkTimeEvening,details_JobPositionPosting_ApplicationDetails_DailyWorkTimeDay,details_JobPositionPosting_ApplicationDetails_ReferenceText,details_JobPositionPosting_ApplicationDetails_RemarksToApplicant,details_JobPositionPosting_ApplicationDetails_ByEmail,details_JobPositionPosting_ApplicationDetails_ByPhone,details_JobPositionPosting_ApplicationDetails_ApplyViaUrl,details_JobPositionPosting_ApplicationDetails_ReplyInWriting,details_JobPositionPosting_ApplicationDetails_ApplicationDeadlineDate,details_JobPositionPosting_ContactAuthorityPhoneNumber_Number,details_JobPositionPosting_ContactAuthorityPhoneNumber_Type,details_JobPositionPosting_ContactAuthorityPhoneNumber_Description,details_JobPositionPosting_Status,details_LogoUrl,details_Address,details_ShowMap,details_ShowShareButtonJobLog,details_JobLogUrl,details_JobLogTemplateModel_Identifier,details_JobLogTemplateModel_UseWorkPlaceAddressForJoblog,details_JobLogTemplateModel_Category,details_JobLogTemplateModel_CvCustomerIdentifier,details_JobLogTemplateModel_JobSeekingStatus,details_JobLogTemplateModel_Title,details_JobLogTemplateModel_IsApplicationSourceRequired,details_JobLogTemplateModel_ApplicationSource,details_JobLogTemplateModel_IsWeeklyWorkTimeRequired,details_JobLogTemplateModel_WeeklyWorkTime,details_JobLogTemplateModel_HoursPerWeek,details_JobLogTemplateModel_JobnetJobPostingIdentifier,details_JobLogTemplateModel_JobAdDocument_Title,details_JobLogTemplateModel_JobAdDocument_Identifier,details_JobLogTemplateModel_JobAdDocument_IsDeletedBySystem,details_JobLogTemplateModel_JobAdDocument_IsDeletedByUser,details_JobLogTemplateModel_JobAdFile,details_JobLogTemplateModel_Company_JobLogEntryCategory,details_JobLogTemplateModel_Company_ShowAddressFieldsEvenIfEmpty,details_JobLogTemplateModel_Company_Name,details_JobLogTemplateModel_Company_Address,details_JobLogTemplateModel_Company_Country,details_JobLogTemplateModel_Company_EmploymentAreaID,details_JobLogTemplateModel_Company_PostCode,details_JobLogTemplateModel_Company_IsCountryAndTownAndPostCodeEmpty,details_JobLogTemplateModel_Company_IsTownAndPostCodeEmpty,details_JobLogTemplateModel_Company_IsCountryDanmark,details_JobLogTemplateModel_Company_Town,details_JobLogTemplateModel_Company_ContactPerson,details_JobLogTemplateModel_Company_Phone,details_JobLogTemplateModel_Company_Email,details_JobLogTemplateModel_Company_Latitude,details_JobLogTemplateModel_Company_Longitude,details_JobLogTemplateModel_Company_DailyTravelTimeInMinutes,details_JobLogTemplateModel_Company_DistanceToCompanyInMeters,details_JobLogTemplateModel_Company_IsCreateMode,details_JobLogTemplateModel_TypeOfSubmission,details_JobLogTemplateModel_SubmissionDate,details_JobLogTemplateModel_SubmissionDateFormatted,details_JobLogTemplateModel_SubmissionDateTiks,details_JobLogTemplateModel_IsSubmissionDateRequired,details_JobLogTemplateModel_Status,details_JobLogTemplateModel_DateCreatedFormatted,details_JobLogTemplateModel_DateCreated,details_JobLogTemplateModel_DateModifiedFormatted,details_JobLogTemplateModel_DateModified,details_JobLogTemplateModel_LastModifiedDateTiks,details_JobLogTemplateModel_DateClosed,details_JobLogTemplateModel_JobApplicationDocument_Title,details_JobLogTemplateModel_JobApplicationDocument_Identifier,details_JobLogTemplateModel_JobApplicationDocument_IsDeletedBySystem,details_JobLogTemplateModel_JobApplicationDocument_IsDeletedByUser,details_JobLogTemplateModel_CvDocument_Title,details_JobLogTemplateModel_CvDocument_Identifier,details_JobLogTemplateModel_CvDocument_IsDeletedBySystem,details_JobLogTemplateModel_CvDocument_IsDeletedByUser,details_JobLogTemplateModel_JobApplicationFile,details_JobLogTemplateModel_CvFile,details_JobLogTemplateModel_SubmissionDeadlineDate,details_JobLogTemplateModel_IsPersisted,details_JobLogTemplateModel_ServerValidationErrors,details_JobLogTemplateModel_HasServerValidationErrors,details_JoblogWorkTime_WorkHour,details_JoblogWorkTime_DailyWorkTime,details_Place,details_OpenPrintDialog,details_WorkPlaceInfoText,details_JobCenterContactDetails,details_WorkPlaceDescriptionText,details_FavoriteText,details_IsFavorite,details_ShowFavorite,details_MetaOgTextForSharing,details_DescriptionForSharing,details_TitleForSharing,details_RutePlan,details_FormattedPurpose,details_MapUrl,details_OrganizationNumber,details_ShowSearchJobButton,details_ShowPrint,details_BackToFindWorkButtonUrl,isExternal
0,False,1,"En synlig og dygtig pædagog søges til lækkert, privat dagtilbud","En synlig og dygtig pædagog søges til lækkert, privat dagtilbud","Vil du afprøve de glædegivende rammer og muligheder, der er i et lille, privat dagtilbud? Har du lyst til at være del af et professionelt læringsfællesskab, hvor nærvær, imødeko",Børnehuset ved Den Kongelige Porcelænsfabrik,Virginiavej 7,2000,Frederiksberg,False,False,False,True,2022-05-03T00:00:00,2022-05-24T00:00:00,24. maj 2022,0001-01-01T00:00:00,False,False,https://job.jobnet.dk/CV/FindWork/Details/5589478,Hovedstaden og Bornholm,Frederiksberg,Danmark,2000,,,,Fuldtid,"Pædagogisk, socialt og kirkeligt arbejde",Pædagogisk arbejde,Pædagog,55.6786,12.525,,,11442,12544,25273214,False,False,https://job.jobnet.dk/CV/FindWork/DetailsSocialmedia/5589478,https://job.jobnet.dk/CV/FindWork/Details/5589478,https://job.jobnet.dk/CV/FindWork/Details/5589478,True,5589478,55.6786,12.525,"{'Id': 1, 'Name': 'Fuldtid'}, {'Id': 16, 'Name': 'Deltid'}","{'Id': 1, 'Name': 'Almindelige vilkår'}, {'Id': 2, 'Name': 'Fleksjob'}, {'Id': 3, 'Name': 'Skånejob'}, {'Id': 4, 'Name': 'Egnet til efterlønnere og seniorer'}, {'Id': 5, 'Name': 'Job med løntilskud'}, {'Id': 6, 'Name': 'Rotationsjob'}, {'Id': 7, 'Name': 'Virksomhedspraktik'}","{'Id': 1, 'Name': 'Fastansættelse'}, {'Id': 16, 'Name': 'Tidsbegrænset ansættelse'}",Børnehuset ved Den Kongelige Porcelænsfabrik,Virginiavej 7,58,Danmark,147,Frederiksberg,4,"Hovedstaden, Sjælland og Bornholm",2000,Frederiksberg,,0,Primary,,,,Allerød,,1003019221,25273214,None,5589478,5589478,Børnehuset ved Den Kongelige Porcelænsfabrik,Virginiavej 7,58,Danmark,147,Frederiksberg,4,"Hovedstaden, Sjælland og Bornholm",2000,Frederiksberg,,0,Primary,,,,Allerød,,1003019221,25273214,None,,2022-05-03T00:00:00,2022-05-24T00:00:00,"En synlig og dygtig pædagog søges til lækkert, privat dagtilbud","Vil du afprøve de glædegivende rammer og muligheder, der er i et lille, privat dagtilbud?   Har du lyst til at være del af et professionelt læringsfællesskab, hvor nærvær, imødekommenhed og livsglæde er et dagligt omdrejningspunkt?   Brænder du for den høje faglighed og den gode kvalitet i relations arbejdet?   Er du stolt af din profession og vil du det pædagogiske arbejde med børn, forældre og kolleger?   Vil du være med til at øge respekten for dit fag?   Ser du muligheder og udviklingspotentialer frem for begrænsninger og ulemper?   Er du engageret og er du glad for at gå på arbejde?   Er du synligt dygtig? Beslutningsdygtig, agerende rollemodel, refleksiv. I sprog og handlinger?     Vi søger en pædagog, som  kan berige   vores kultur  omkring det kollegiale samarbejde samt det viden- og værdibårne arbejde omkring børn og forældre.   Vi søger en pædagog, som  vil  arbejdet med børn og som  vil  det engagerede arbejde i et lille dagtilbud, som er afhængig af, at alle ansatte bærer og løfter dagtilbuddets opgaver.   Vi søger en pædagog, som  har kompetence  til at facilitere læring og udvikling for børn.   Vi søger en pædagog, som er  god til at formidle og kommunikere  anerkendende og inspirerende i hverdag, ved samtaler og ved refleksionsmøder. Både verbalt og skriftligt.   Vi søger en pædagog, som på inspirerende vis  kan gå foran  ift. tænkning og praksis ift. børn, forældre og kolleger.     Vi forventer, at du aktivt kan arbejde med:     Dialog - åbne spørgsmål og rummelighed.   At se muligheder - ikke begrænsninger.   Udvikling og konstant foranderlighed - ikke stilstand, men faglig udvikling.   At ville noget med mennesker - vi brænder for at gøre en forskel.   Kreativitet - fordi vi er nysgerrige.   Eksperimenterende - vi prøver tanker og ideer af. Også dine.   Out of the Box - vi er et privat dagtilbud, mere frie og uafhængige - og vi kan li’ det!   Begejstring og livsglæde - flow, glæde og positive sindstilstande værdsættes og skabes.   Nærværende og synlig ledelse – en leder med ’hands on’ praksis, og hvor alle spiller hinanden gode, byder ind; viser engagement og arbejdsglæde.       Læs mere om os, vore værdier, praksis o.a. på vores hjemmeside: www.virginiavej7.dk     Selve stillingen:   Vi søger en pædagog i enten børnehave eller vuggestue, så hvad end du brænder for, så send en ansøgning, da vi vil se på, hvem du er og hvad du kan berige os med, da vi søger det helt rigtige match.     Vi har både en fast stilling, vi søger besat, men også en barselsstilling med eventuel mulighed for forlængelse.     Vi vil helst ansætte en uddannet pædagog, men er åbne ift. ansættelse af en ikke-uddannet medhjælper (måske du er uddannet inden for et andet felt e.a.).     Vi er i gang med at skalere op ift. antallet af ansatte (pga. minimumsnormeringerne) og kan måske bruge dine kvalifikationer (alligevel).     Stillingen søges besat snarest muligt, og ses gerne værende på minimum 35 t/uge.     Ansøgningsfrist m.v.:   Hvis du er den, vi søger og har du yderligere spørgsmål, er du velkommen til at kontakte Børnehusets daglige leder Anne Marie van der Brugge på tlf.: 71 99 19 73 eller mail leder@virginiavej7.dk      Ansøgninger skal sendes ved at trykke på knappen ""Send ansøgning""  senest d. 23. maj 2022.     Vi vil indkalde til samtaler løbende.     Løn- og ansættelsesvilkår er i henhold til gældende overenskomst.     Vi ser frem til at modtage din ansøgning og CV.     Se mere på vores ansøgersite:  https://ldd.ofir.com   
 Denne jobannonce blev oprindeligt opslået på https://www.ofir.dk/
 (Den originale annonce kan ses på: https://www.ofir.dk/showojob?ofirid=162fffea)",Virginiavej 7,58,Danmark,147,Frederiksberg,4,"Hovedstaden, Sjælland og Bornholm",2000,Frederiksberg,16,1,Fuldtid,None,None,1,,0,,0,0,0,,False,"{'Id': 7957089, 'Email': None, 'FaxNumber': None, 'PersonName': 'Anne Marie van der Brugge', 'FirstName': 'Anne', 'LastName': 'Marie van der Brugge', 'PositionTitle': None, 'PhoneNumbers': [{'Number': '71991973', 'Type': 0, 'Description': 'Hovednummer'}]}",,False,False,False,False,4,,,False,False,False,False,,,,,https://www.ofir.dk/resultat/Jobannonce.aspx?ofirId=162fffea&action=sendApplicationUrl,False,2022-05-24T00:00:00,,0,Primary,7,/CV/FindWork/GetLogo?JobAdId=5589478&Organisation=25273214,"Virginiavej 7,2000, Frederiksberg",True,False,"/CV/Jobseeking/JobLog/CreateJobSearch?JobnetJobPostingIdentifier=5589478&Company.Name=Børnehuset ved Den Kongelige Porcelænsfabrik&SubmissionDeadlineDate=2022-5-24&Title=En synlig og dygtig pædagog søges til lækkert, privat dagtilbud&WeeklyWorkTime=1",00000000-0000-0000-0000-000000000000,False,0,,,"En synlig og dygtig pædagog søges til lækkert, privat dagtilbud",True,,True,1,,5589478,,,False,False,,0,False,Børnehuset ved Den Kongelige Porcelænsfabrik,Virginiavej 7,,,2000,False,False,False,Frederiksberg,Anne Marie van der Brugge,71991973,,,,,,False,,2022-05-24T00:00:00,,0,False,0,,,,,0,,,,False,False,,,False,False,,,,False,,False,,,Arbejdspladsen ligger i Frederiksberg kommune,False,Børnehuset ved Den Kongelige Porcelænsfabrik,,Allerød,,False,False,"Vil du afprøve de glædegivende rammer og muligheder, der er i et lille, privat dagtilbud? Har du lyst til at være del af et professionelt læringsfællesskab, hvor nærvær, imødekommenhed og livsglæde er et dagligt omdrejningspunkt? Brænder du for den høje faglighed og den gode kvalitet i relations arbejdet? Er du stolt af din profession og vil du det","""Vil du afprøve de glædegivende rammer og muligheder, der er i et lille, privat dagtilbud? Har du lyst til at være del af et professionelt læringsfællesskab, hvor nærvær, imødekommenhed og livsglæde er et dagligt omdrejningspunkt? Brænder du for den høje faglighed og den gode kvalitet i relations arbejdet? Er du stolt af din profession og vil du det""","""En synlig og dygtig pædagog søges til lækkert, privat dagtilbud""","https://www.google.dk/maps/dir//Virginiavej+7,2000,+Frederiksberg/","Vil du afprøve de glædegivende rammer og muligheder, der er i et lille, privat dagtilbud?   Har du lyst til at være del af et professionelt læringsfællesskab, hvor nærvær, imødekommenhed og livsglæde er et dagligt omdrejningspunkt?   Brænder du for den høje faglighed og den gode kvalitet i relations arbejdet?   Er du stolt af din profession og vil du det pædagogiske arbejde med børn, forældre og kolleger?   Vil du være med til at øge respekten for dit fag?   Ser du muligheder og udviklingspotentialer frem for begrænsninger og ulemper?   Er du engageret og er du glad for at gå på arbejde?   Er du synligt dygtig? Beslutningsdygtig, agerende rollemodel, refleksiv. I sprog og handlinger?     Vi søger en pædagog, som  kan berige   vores kultur  omkring det kollegiale samarbejde samt det viden- og værdibårne arbejde omkring børn og forældre.   Vi søger en pædagog, som  vil  arbejdet med børn og som  vil  det engagerede arbejde i et lille dagtilbud, som er afhængig af, at alle ansatte bærer og løfter dagtilbuddets opgaver.   Vi søger en pædagog, som  har kompetence  til at facilitere læring og udvikling for børn.   Vi søger en pædagog, som er  god til at formidle og kommunikere  anerkendende og inspirerende i hverdag, ved samtaler og ved refleksionsmøder. Både verbalt og skriftligt.   Vi søger en pædagog, som på inspirerende vis  kan gå foran  ift. tænkning og praksis ift. børn, forældre og kolleger.     Vi forventer, at du aktivt kan arbejde med:     Dialog - åbne spørgsmål og rummelighed.   At se muligheder - ikke begrænsninger.   Udvikling og konstant foranderlighed - ikke stilstand, men faglig udvikling.   At ville noget med mennesker - vi brænder for at gøre en forskel.   Kreativitet - fordi vi er nysgerrige.   Eksperimenterende - vi prøver tanker og ideer af. Også dine.   Out of the Box - vi er et privat dagtilbud, mere frie og uafhængige - og vi kan li’ det!   Begejstring og livsglæde - flow, glæde og positive sindstilstande værdsættes og skabes.   Nærværende og synlig ledelse – en leder med ’hands on’ praksis, og hvor alle spiller hinanden gode, byder ind; viser engagement og arbejdsglæde.       Læs mere om os, vore værdier, praksis o.a. på vores hjemmeside:  www.virginiavej7.dk     Selve stillingen:   Vi søger en pædagog i enten børnehave eller vuggestue, så hvad end du brænder for, så send en ansøgning, da vi vil se på, hvem du er og hvad du kan berige os med, da vi søger det helt rigtige match.     Vi har både en fast stilling, vi søger besat, men også en barselsstilling med eventuel mulighed for forlængelse.     Vi vil helst ansætte en uddannet pædagog, men er åbne ift. ansættelse af en ikke-uddannet medhjælper (måske du er uddannet inden for et andet felt e.a.).     Vi er i gang med at skalere op ift. antallet af ansatte (pga. minimumsnormeringerne) og kan måske bruge dine kvalifikationer (alligevel).     Stillingen søges besat snarest muligt, og ses gerne værende på minimum 35 t/uge.     Ansøgningsfrist m.v.:   Hvis du er den, vi søger og har du yderligere spørgsmål, er du velkommen til at kontakte Børnehusets daglige leder Anne Marie van der Brugge på tlf.: 71 99 19 73 eller mail leder@virginiavej7.dk      Ansøgninger skal sendes ved at trykke på knappen ""Send ansøgning""  senest d. 23. maj 2022.     Vi vil indkalde til samtaler løbende.     Løn- og ansættelsesvilkår er i henhold til gældende overenskomst.     Vi ser frem til at modtage din ansøgning og CV.     Se mere på vores ansøgersite:  https://ldd.ofir.com   
 Denne jobannonce blev oprindeligt opslået på  https://www.ofir.dk/ 
 (Den originale annonce kan ses på:  https://www.ofir.dk/showojob?ofirid=162fffea )","https://www.google.dk/maps/place/Virginiavej+7,2000,+Frederiksberg/",25273214,False,False,,False
