summary_AutomatchType,summary_Abroad,summary_Weight,summary_Title,summary_JobHeadline,summary_Presentation,summary_HiringOrgName,summary_WorkPlaceAddress,summary_WorkPlacePostalCode,summary_WorkPlaceCity,summary_WorkPlaceOtherAddress,summary_WorkPlaceAbroad,summary_WorkPlaceNotStatic,summary_UseWorkPlaceAddressForJoblog,summary_PostingCreated,summary_LastDateApplication,summary_FormattedLastDateApplication,summary_AssignmentStartDate,summary_IsHotjob,summary_IsExternal,summary_Url,summary_Region,summary_Municipality,summary_Country,summary_PostalCode,summary_PostalCodeName,summary_JobAnnouncementType,summary_EmploymentType,summary_WorkHours,summary_OccupationArea,summary_OccupationGroup,summary_Occupation,summary_Location_Latitude,summary_Location_Longitude,summary_JoblogWorkTime_WorkHour,summary_JoblogWorkTime_DailyWorkTime,summary_WorkplaceID,summary_OrganisationId,summary_HiringOrgCVR,summary_UserLoggedIn,summary_AnonymousEmployer,summary_ShareUrl,summary_DetailsUrl,summary_JobLogUrl,summary_HasLocationValues,summary_ID,summary_Latitude,summary_Longitude,details_WorkSchedule,details_WorkConditions,details_EmploymentTypes,details_WorkPlace_Name,details_WorkPlace_Address_AddressLine,details_WorkPlace_Address_Country_Id,details_WorkPlace_Address_Country_Name,details_WorkPlace_Address_Municipality_Id,details_WorkPlace_Address_Municipality_Name,details_WorkPlace_Address_Region_Id,details_WorkPlace_Address_Region_Name,details_WorkPlace_Address_PostalCode,details_WorkPlace_Address_City,details_WorkPlace_PhoneNumber_Number,details_WorkPlace_PhoneNumber_Type,details_WorkPlace_PhoneNumber_Description,details_WorkPlace_FaxNumber,details_WorkPlace_Email,details_WorkPlace_WebAddress,details_WorkPlace_Description,details_WorkPlace_Logo,details_WorkPlace_WorkPlaceOrganizationNumber,details_WorkPlace_OrganizationNumber,details_WorkPlace_OrganizationDescription,details_JobPositionPosting_Id,details_JobPositionPosting_OriginalJppId,details_JobPositionPosting_HiringOrg_Name,details_JobPositionPosting_HiringOrg_Address_AddressLine,details_JobPositionPosting_HiringOrg_Address_Country_Id,details_JobPositionPosting_HiringOrg_Address_Country_Name,details_JobPositionPosting_HiringOrg_Address_Municipality_Id,details_JobPositionPosting_HiringOrg_Address_Municipality_Name,details_JobPositionPosting_HiringOrg_Address_Region_Id,details_JobPositionPosting_HiringOrg_Address_Region_Name,details_JobPositionPosting_HiringOrg_Address_PostalCode,details_JobPositionPosting_HiringOrg_Address_City,details_JobPositionPosting_HiringOrg_PhoneNumber_Number,details_JobPositionPosting_HiringOrg_PhoneNumber_Type,details_JobPositionPosting_HiringOrg_PhoneNumber_Description,details_JobPositionPosting_HiringOrg_FaxNumber,details_JobPositionPosting_HiringOrg_Email,details_JobPositionPosting_HiringOrg_WebAddress,details_JobPositionPosting_HiringOrg_Description,details_JobPositionPosting_HiringOrg_Logo,details_JobPositionPosting_HiringOrg_WorkPlaceOrganizationNumber,details_JobPositionPosting_HiringOrg_OrganizationNumber,details_JobPositionPosting_HiringOrg_OrganizationDescription,details_JobPositionPosting_RecruitingCompany,details_JobPositionPosting_PublicationStartDate,details_JobPositionPosting_PublicationEndDate,details_JobPositionPosting_JobPositionInformation_PositionTitle,details_JobPositionPosting_JobPositionInformation_Purpose,details_JobPositionPosting_JobPositionInformation_WorkLocation_AddressLine,details_JobPositionPosting_JobPositionInformation_WorkLocation_Country_Id,details_JobPositionPosting_JobPositionInformation_WorkLocation_Country_Name,details_JobPositionPosting_JobPositionInformation_WorkLocation_Municipality_Id,details_JobPositionPosting_JobPositionInformation_WorkLocation_Municipality_Name,details_JobPositionPosting_JobPositionInformation_WorkLocation_Region_Id,details_JobPositionPosting_JobPositionInformation_WorkLocation_Region_Name,details_JobPositionPosting_JobPositionInformation_WorkLocation_PostalCode,details_JobPositionPosting_JobPositionInformation_WorkLocation_City,details_JobPositionPosting_JobPositionInformation_EmploymentType,details_JobPositionPosting_JobPositionInformation_WeeklyWorkHours_TypeId,details_JobPositionPosting_JobPositionInformation_WeeklyWorkHours_TypeName,details_JobPositionPosting_JobPositionInformation_WeeklyWorkHours_Description,details_JobPositionPosting_JobPositionInformation_CompensationDescription,details_JobPositionPosting_JobPositionInformation_NumberToFill,details_JobPositionPosting_JobPositionInformation_DriverLicense,details_JobPositionPosting_JobPositionInformation_Occupation_DiscoWeb,details_JobPositionPosting_JobPositionInformation_Occupation_AlternateNames,details_JobPositionPosting_JobPositionInformation_Occupation_GroupId,details_JobPositionPosting_JobPositionInformation_Occupation_AreaId,details_JobPositionPosting_JobPositionInformation_Occupation_Id,details_JobPositionPosting_JobPositionInformation_Occupation_Name,details_JobPositionPosting_JobPositionInformation_IsGovernmentHiring,details_JobPositionPosting_JobPositionInformation_JppContacts,details_JobPositionPosting_JobPositionInformation_EmploymentDate,details_JobPositionPosting_IsRecruitmentOfForeignNationals,details_JobPositionPosting_IsWorkInDenmark,details_JobPositionPosting_IsAnonymousEmployer,details_JobPositionPosting_IsDisabilityFriendly,details_JobPositionPosting_JppType,details_JobPositionPosting_ApplicationDetails_WorkHourMax,details_JobPositionPosting_ApplicationDetails_WorkHourMin,details_JobPositionPosting_ApplicationDetails_DailyWorkTimeWeekend,details_JobPositionPosting_ApplicationDetails_DailyWorkTimeNight,details_JobPositionPosting_ApplicationDetails_DailyWorkTimeEvening,details_JobPositionPosting_ApplicationDetails_DailyWorkTimeDay,details_JobPositionPosting_ApplicationDetails_ReferenceText,details_JobPositionPosting_ApplicationDetails_RemarksToApplicant,details_JobPositionPosting_ApplicationDetails_ByEmail,details_JobPositionPosting_ApplicationDetails_ByPhone,details_JobPositionPosting_ApplicationDetails_ApplyViaUrl,details_JobPositionPosting_ApplicationDetails_ReplyInWriting,details_JobPositionPosting_ApplicationDetails_ApplicationDeadlineDate,details_JobPositionPosting_ContactAuthorityPhoneNumber_Number,details_JobPositionPosting_ContactAuthorityPhoneNumber_Type,details_JobPositionPosting_ContactAuthorityPhoneNumber_Description,details_JobPositionPosting_Status,details_LogoUrl,details_Address,details_ShowMap,details_ShowShareButtonJobLog,details_JobLogUrl,details_JobLogTemplateModel_Identifier,details_JobLogTemplateModel_UseWorkPlaceAddressForJoblog,details_JobLogTemplateModel_Category,details_JobLogTemplateModel_CvCustomerIdentifier,details_JobLogTemplateModel_JobSeekingStatus,details_JobLogTemplateModel_Title,details_JobLogTemplateModel_IsApplicationSourceRequired,details_JobLogTemplateModel_ApplicationSource,details_JobLogTemplateModel_IsWeeklyWorkTimeRequired,details_JobLogTemplateModel_WeeklyWorkTime,details_JobLogTemplateModel_HoursPerWeek,details_JobLogTemplateModel_JobnetJobPostingIdentifier,details_JobLogTemplateModel_JobAdDocument_Title,details_JobLogTemplateModel_JobAdDocument_Identifier,details_JobLogTemplateModel_JobAdDocument_IsDeletedBySystem,details_JobLogTemplateModel_JobAdDocument_IsDeletedByUser,details_JobLogTemplateModel_JobAdFile,details_JobLogTemplateModel_Company_JobLogEntryCategory,details_JobLogTemplateModel_Company_ShowAddressFieldsEvenIfEmpty,details_JobLogTemplateModel_Company_Name,details_JobLogTemplateModel_Company_Address,details_JobLogTemplateModel_Company_Country,details_JobLogTemplateModel_Company_EmploymentAreaID,details_JobLogTemplateModel_Company_PostCode,details_JobLogTemplateModel_Company_IsCountryAndTownAndPostCodeEmpty,details_JobLogTemplateModel_Company_IsTownAndPostCodeEmpty,details_JobLogTemplateModel_Company_IsCountryDanmark,details_JobLogTemplateModel_Company_Town,details_JobLogTemplateModel_Company_ContactPerson,details_JobLogTemplateModel_Company_Phone,details_JobLogTemplateModel_Company_Email,details_JobLogTemplateModel_Company_Latitude,details_JobLogTemplateModel_Company_Longitude,details_JobLogTemplateModel_Company_DailyTravelTimeInMinutes,details_JobLogTemplateModel_Company_DistanceToCompanyInMeters,details_JobLogTemplateModel_Company_IsCreateMode,details_JobLogTemplateModel_TypeOfSubmission,details_JobLogTemplateModel_SubmissionDate,details_JobLogTemplateModel_SubmissionDateFormatted,details_JobLogTemplateModel_SubmissionDateTiks,details_JobLogTemplateModel_IsSubmissionDateRequired,details_JobLogTemplateModel_Status,details_JobLogTemplateModel_DateCreatedFormatted,details_JobLogTemplateModel_DateCreated,details_JobLogTemplateModel_DateModifiedFormatted,details_JobLogTemplateModel_DateModified,details_JobLogTemplateModel_LastModifiedDateTiks,details_JobLogTemplateModel_DateClosed,details_JobLogTemplateModel_JobApplicationDocument_Title,details_JobLogTemplateModel_JobApplicationDocument_Identifier,details_JobLogTemplateModel_JobApplicationDocument_IsDeletedBySystem,details_JobLogTemplateModel_JobApplicationDocument_IsDeletedByUser,details_JobLogTemplateModel_CvDocument_Title,details_JobLogTemplateModel_CvDocument_Identifier,details_JobLogTemplateModel_CvDocument_IsDeletedBySystem,details_JobLogTemplateModel_CvDocument_IsDeletedByUser,details_JobLogTemplateModel_JobApplicationFile,details_JobLogTemplateModel_CvFile,details_JobLogTemplateModel_SubmissionDeadlineDate,details_JobLogTemplateModel_IsPersisted,details_JobLogTemplateModel_ServerValidationErrors,details_JobLogTemplateModel_HasServerValidationErrors,details_JoblogWorkTime_WorkHour,details_JoblogWorkTime_DailyWorkTime,details_Place,details_OpenPrintDialog,details_WorkPlaceInfoText,details_JobCenterContactDetails,details_WorkPlaceDescriptionText,details_FavoriteText,details_IsFavorite,details_ShowFavorite,details_MetaOgTextForSharing,details_DescriptionForSharing,details_TitleForSharing,details_RutePlan,details_FormattedPurpose,details_MapUrl,details_OrganizationNumber,details_ShowSearchJobButton,details_ShowPrint,details_BackToFindWorkButtonUrl,isExternal
0,False,1,Ferieafløsere - Plejehjemmet Sofiegården,Ferieafløsere - Plejehjemmet Sofiegården,"Vi kan tilbyde:  	Introduktion til en spændende hverdag på en travl arbejdsplads 	Et spændende job, hvor ikke to dage er ens 	Dygtige og engagerede kolleger,",Plejeboliger Sofiegården,Sælsager 84,9000,Aalborg,False,False,False,True,2022-05-04T00:00:00,2022-06-08T00:00:00,8. juni 2022,0001-01-01T00:00:00,False,False,https://job.jobnet.dk/CV/FindWork/Details/5589321,Nordjylland,Aalborg,Danmark,9000,,,,Fuldtid,"Transport, post, lager- og maskinførerarbejde",Postarbejde,Postfunktionær,57.0231,9.8816,,,73277,58491,29189420,False,False,https://job.jobnet.dk/CV/FindWork/DetailsSocialmedia/5589321,https://job.jobnet.dk/CV/FindWork/Details/5589321,https://job.jobnet.dk/CV/FindWork/Details/5589321,True,5589321,57.0231,9.8816,"{'Id': 1, 'Name': 'Fuldtid'}, {'Id': 16, 'Name': 'Deltid'}","{'Id': 1, 'Name': 'Almindelige vilkår'}, {'Id': 2, 'Name': 'Fleksjob'}, {'Id': 3, 'Name': 'Skånejob'}, {'Id': 4, 'Name': 'Egnet til efterlønnere og seniorer'}, {'Id': 5, 'Name': 'Job med løntilskud'}, {'Id': 6, 'Name': 'Rotationsjob'}, {'Id': 7, 'Name': 'Virksomhedspraktik'}","{'Id': 1, 'Name': 'Fastansættelse'}, {'Id': 16, 'Name': 'Tidsbegrænset ansættelse'}",Plejeboliger Sofiegården,Sælsager 84,58,Danmark,851,Aalborg,1,Nordjylland,9000,Aalborg,,0,Primary,,,,"Sofiegården er et somatisk plejehjem med 50 boliger, fordelt på 4 boenheder.
Huset er forholdsvis nyt, bygget i 1999.",,1008784422,29189420,None,5589321,5589321,Plejeboliger Sofiegården,Sælsager 84,58,Danmark,851,Aalborg,1,Nordjylland,9000,Aalborg,,0,Primary,,,,"Sofiegården er et somatisk plejehjem med 50 boliger, fordelt på 4 boenheder.
Huset er forholdsvis nyt, bygget i 1999.",,1008784422,29189420,None,,2022-05-04T00:00:00,2022-06-08T00:00:00,Ferieafløsere - Plejehjemmet Sofiegården,"Vi kan tilbyde:     Introduktion til en spændende hverdag på en travl arbejdsplads   Et spændende job, hvor ikke to dage er ens   Dygtige og engagerede kolleger, som vil støtte og vejlede dig i dagligdagens opgaver   Kursus i forflytning inden start   Stor mulighed for at udnytte dine faglige, såvel som personlige kompetencer   Ansættelseskvote, som matcher dine ønsker     Lidt om stillingen og din nye arbejdsplads:     Ferieafløsere i blandede vagter med weekendarbejde hver 2. weekend   Stillingerne er fra uge 26 eller 27 til evt. studiestart, eller dog til og med uge 37   Mulighed for evt. studiejob efterfølgende   Vi vurderer løbende de indkomne ansøgninger     Dine primære opgaver vil være:     Daglig pleje og praktiske opgaver i forhold til serviceloven til den enkelte beboer og fællesskabet i boenheden   Sygeplejestuderende kan, hvis de er længere end 4. semester få mulighed for at arbejde med Sundhedsloven   Bidrage til et godt arbejdsmiljø     Faglige kompetencer:     Meget gerne studerende indenfor sundhedssektoren f.eks. sygepleje, fysio, ergo eller medicinstuderende   Gerne erfaring indenfor ældreplejen fra tidligere job f.eks. ferieafløsning mm. men ikke et krav   Du kan også være ude og samle erfaring indenfor ældresektoren med henblik på at uddanne dig indenfor området.     Personlige kompetencer:     Du skal være omstillingsparat med fokus på kerneopgaven   Du skal være mødestabil, psykisk robust og ""ville"" os   Kan bidrage med et godt humør og en positiv indstilling   Du er ansvarsbevidst og god til at samarbejde med mange forskellige på tværs af faglighed   Du er tydelig, ansvarsfuld og handlekraftig   Du er omsorgsfuld og udviser nærvær i mødet med borgerne     Arbejdsstedets adresse: Plejehjemmet Sofiegården Sælsager 84 9000 Aalborg Vil du vide mere? Du er velkommen til at kontakte assisterende Plejehjemsleder Jeannett Holland Jeppesen på tlf.  9982 3931 eller Plejehjemsleder Birgitte Biegel Christensen på tlf. 9982 3930. Løn- og ansættelsesvilkår Efter gældende overenskomst mellem KL og den forhandlingsberettigede organisation. Forud for endelig ansættelse skal der foreligge en straffeattest og indhentes referencer. På Aalborg Kommunes hjemmeside kan du læse om kommunens struktur, politikker, målsætninger og meget mere. Aalborg Kommune Personalepolitik: 4 for fællesskabet (aalborg.dk) Læs mere om Senior- og Omsorgs vision og strategiske ledelsesudvikling Bliv klogere på Senior- og Omsorgs vision Frihedsbrevet skal sætte organisationens fulde potentiale fri (aalborg.dk) Send ansøgning Du sender din ansøgning ved at trykke på knappen ""Send ansøgning"" og udfylde den formular, som kommer frem. Det er også muligt at vedhæfte bilag som f.eks. ansøgning og CV i begrænset omfang. I Aalborg Kommune tror vi på, at mangfoldighed skaber værdi, og vi bruger det potentiale, der ligger i forskelligheden til at løse vores kerneopgave endnu bedre. Vi behandler alle vores medarbejdere ligeværdigt, og opfordrer alle til at søge stillingen – uanset alder, køn, religion, handicap eller etnisk tilhørsforhold.  
 Denne jobannonce blev oprindeligt opslået på https://www.ofir.dk/
 (Den originale annonce kan ses på: https://www.ofir.dk/showojob?ofirid=de5882b7)",Sælsager 84,58,Danmark,851,Aalborg,1,Nordjylland,9000,Aalborg,16,1,Fuldtid,None,None,1,,0,,0,0,0,,False,"{'Id': 7959374, 'Email': None, 'FaxNumber': None, 'PersonName': 'Anne Kristensen', 'FirstName': 'Anne', 'LastName': 'Kristensen', 'PositionTitle': None, 'PhoneNumbers': [{'Number': '99823931', 'Type': 0, 'Description': 'Hovednummer'}]}",,False,False,False,False,4,,,False,False,False,False,,,,,https://www.ofir.dk/resultat/Jobannonce.aspx?ofirId=de5882b7&action=sendApplicationUrl,False,2022-06-08T00:00:00,,0,Primary,7,/CV/FindWork/GetLogo?JobAdId=5589321&Organisation=29189420,"Sælsager 84,9000, Aalborg",True,False,/CV/Jobseeking/JobLog/CreateJobSearch?JobnetJobPostingIdentifier=5589321&Company.Name=Plejeboliger Sofiegården&SubmissionDeadlineDate=2022-6-8&Title=Ferieafløsere - Plejehjemmet Sofiegården&WeeklyWorkTime=1,00000000-0000-0000-0000-000000000000,False,0,,,Ferieafløsere - Plejehjemmet Sofiegården,True,,True,1,,5589321,,,False,False,,0,False,Plejeboliger Sofiegården,Sælsager 84,,,9000,False,False,False,Aalborg,Anne Kristensen,99823931,,,,,,False,,2022-06-08T00:00:00,,0,False,0,,,,,0,,,,False,False,,,False,False,,,,False,,False,,,Arbejdspladsen ligger i Aalborg kommune,False,Plejeboliger Sofiegården,,"Sofiegården er et somatisk plejehjem med 50 boliger, fordelt på 4 boenheder.
Huset er forholdsvis nyt, bygget i 1999.",,False,False,"Vi kan tilbyde:  	Introduktion til en spændende hverdag på en travl arbejdsplads 	Et spændende job, hvor ikke to dage er ens 	Dygtige og engagerede kolleger, som vil støtte og vejlede dig i dagligdagens opgaver 	Kursus i forflytning inden start 	Stor mulighed for at udnytte dine faglige, såvel som personlige kompetencer 	Ansættelseskvote, som match","""Vi kan tilbyde:  \tIntroduktion til en spændende hverdag på en travl arbejdsplads \tEt spændende job, hvor ikke to dage er ens \tDygtige og engagerede kolleger, som vil støtte og vejlede dig i dagligdagens opgaver \tKursus i forflytning inden start \tStor mulighed for at udnytte dine faglige, såvel som personlige kompetencer \tAnsættelseskvote, som match""","""Ferieafløsere - Plejehjemmet Sofiegården""","https://www.google.dk/maps/dir//Sælsager+84,9000,+Aalborg/","Vi kan tilbyde:     Introduktion til en spændende hverdag på en travl arbejdsplads   Et spændende job, hvor ikke to dage er ens   Dygtige og engagerede kolleger, som vil støtte og vejlede dig i dagligdagens opgaver   Kursus i forflytning inden start   Stor mulighed for at udnytte dine faglige, såvel som personlige kompetencer   Ansættelseskvote, som matcher dine ønsker     Lidt om stillingen og din nye arbejdsplads:     Ferieafløsere i blandede vagter med weekendarbejde hver 2. weekend   Stillingerne er fra uge 26 eller 27 til evt. studiestart, eller dog til og med uge 37   Mulighed for evt. studiejob efterfølgende   Vi vurderer løbende de indkomne ansøgninger     Dine primære opgaver vil være:     Daglig pleje og praktiske opgaver i forhold til serviceloven til den enkelte beboer og fællesskabet i boenheden   Sygeplejestuderende kan, hvis de er længere end 4. semester få mulighed for at arbejde med Sundhedsloven   Bidrage til et godt arbejdsmiljø     Faglige kompetencer:     Meget gerne studerende indenfor sundhedssektoren f.eks. sygepleje, fysio, ergo eller medicinstuderende   Gerne erfaring indenfor ældreplejen fra tidligere job f.eks. ferieafløsning mm. men ikke et krav   Du kan også være ude og samle erfaring indenfor ældresektoren med henblik på at uddanne dig indenfor området.     Personlige kompetencer:     Du skal være omstillingsparat med fokus på kerneopgaven   Du skal være mødestabil, psykisk robust og ""ville"" os   Kan bidrage med et godt humør og en positiv indstilling   Du er ansvarsbevidst og god til at samarbejde med mange forskellige på tværs af faglighed   Du er tydelig, ansvarsfuld og handlekraftig   Du er omsorgsfuld og udviser nærvær i mødet med borgerne     Arbejdsstedets adresse: Plejehjemmet Sofiegården Sælsager 84 9000 Aalborg Vil du vide mere? Du er velkommen til at kontakte assisterende Plejehjemsleder Jeannett Holland Jeppesen på tlf.  9982 3931 eller Plejehjemsleder Birgitte Biegel Christensen på tlf. 9982 3930. Løn- og ansættelsesvilkår Efter gældende overenskomst mellem KL og den forhandlingsberettigede organisation. Forud for endelig ansættelse skal der foreligge en straffeattest og indhentes referencer. På Aalborg Kommunes hjemmeside kan du læse om kommunens struktur, politikker, målsætninger og meget mere. Aalborg Kommune Personalepolitik: 4 for fællesskabet (aalborg.dk) Læs mere om Senior- og Omsorgs vision og strategiske ledelsesudvikling Bliv klogere på Senior- og Omsorgs vision Frihedsbrevet skal sætte organisationens fulde potentiale fri (aalborg.dk) Send ansøgning Du sender din ansøgning ved at trykke på knappen ""Send ansøgning"" og udfylde den formular, som kommer frem. Det er også muligt at vedhæfte bilag som f.eks. ansøgning og CV i begrænset omfang. I Aalborg Kommune tror vi på, at mangfoldighed skaber værdi, og vi bruger det potentiale, der ligger i forskelligheden til at løse vores kerneopgave endnu bedre. Vi behandler alle vores medarbejdere ligeværdigt, og opfordrer alle til at søge stillingen – uanset alder, køn, religion, handicap eller etnisk tilhørsforhold.  
 Denne jobannonce blev oprindeligt opslået på  https://www.ofir.dk/ 
 (Den originale annonce kan ses på:  https://www.ofir.dk/showojob?ofirid=de5882b7 )","https://www.google.dk/maps/place/Sælsager+84,9000,+Aalborg/",29189420,False,False,,False
