summary_AutomatchType,summary_Abroad,summary_Weight,summary_Title,summary_JobHeadline,summary_Presentation,summary_HiringOrgName,summary_WorkPlaceAddress,summary_WorkPlacePostalCode,summary_WorkPlaceCity,summary_WorkPlaceOtherAddress,summary_WorkPlaceAbroad,summary_WorkPlaceNotStatic,summary_UseWorkPlaceAddressForJoblog,summary_PostingCreated,summary_LastDateApplication,summary_FormattedLastDateApplication,summary_AssignmentStartDate,summary_IsHotjob,summary_IsExternal,summary_Url,summary_Region,summary_Municipality,summary_Country,summary_PostalCode,summary_PostalCodeName,summary_JobAnnouncementType,summary_EmploymentType,summary_WorkHours,summary_OccupationArea,summary_OccupationGroup,summary_Occupation,summary_Location_Latitude,summary_Location_Longitude,summary_JoblogWorkTime_WorkHour,summary_JoblogWorkTime_DailyWorkTime,summary_WorkplaceID,summary_OrganisationId,summary_HiringOrgCVR,summary_UserLoggedIn,summary_AnonymousEmployer,summary_ShareUrl,summary_DetailsUrl,summary_JobLogUrl,summary_HasLocationValues,summary_ID,summary_Latitude,summary_Longitude,details_WorkSchedule,details_WorkConditions,details_EmploymentTypes,details_WorkPlace_Name,details_WorkPlace_Address_AddressLine,details_WorkPlace_Address_Country_Id,details_WorkPlace_Address_Country_Name,details_WorkPlace_Address_Municipality_Id,details_WorkPlace_Address_Municipality_Name,details_WorkPlace_Address_Region_Id,details_WorkPlace_Address_Region_Name,details_WorkPlace_Address_PostalCode,details_WorkPlace_Address_City,details_WorkPlace_PhoneNumber_Number,details_WorkPlace_PhoneNumber_Type,details_WorkPlace_PhoneNumber_Description,details_WorkPlace_FaxNumber,details_WorkPlace_Email,details_WorkPlace_WebAddress,details_WorkPlace_Description,details_WorkPlace_Logo,details_WorkPlace_WorkPlaceOrganizationNumber,details_WorkPlace_OrganizationNumber,details_WorkPlace_OrganizationDescription,details_JobPositionPosting_Id,details_JobPositionPosting_OriginalJppId,details_JobPositionPosting_HiringOrg_Name,details_JobPositionPosting_HiringOrg_Address_AddressLine,details_JobPositionPosting_HiringOrg_Address_Country_Id,details_JobPositionPosting_HiringOrg_Address_Country_Name,details_JobPositionPosting_HiringOrg_Address_Municipality_Id,details_JobPositionPosting_HiringOrg_Address_Municipality_Name,details_JobPositionPosting_HiringOrg_Address_Region_Id,details_JobPositionPosting_HiringOrg_Address_Region_Name,details_JobPositionPosting_HiringOrg_Address_PostalCode,details_JobPositionPosting_HiringOrg_Address_City,details_JobPositionPosting_HiringOrg_PhoneNumber_Number,details_JobPositionPosting_HiringOrg_PhoneNumber_Type,details_JobPositionPosting_HiringOrg_PhoneNumber_Description,details_JobPositionPosting_HiringOrg_FaxNumber,details_JobPositionPosting_HiringOrg_Email,details_JobPositionPosting_HiringOrg_WebAddress,details_JobPositionPosting_HiringOrg_Description,details_JobPositionPosting_HiringOrg_Logo,details_JobPositionPosting_HiringOrg_WorkPlaceOrganizationNumber,details_JobPositionPosting_HiringOrg_OrganizationNumber,details_JobPositionPosting_HiringOrg_OrganizationDescription,details_JobPositionPosting_RecruitingCompany,details_JobPositionPosting_PublicationStartDate,details_JobPositionPosting_PublicationEndDate,details_JobPositionPosting_JobPositionInformation_PositionTitle,details_JobPositionPosting_JobPositionInformation_Purpose,details_JobPositionPosting_JobPositionInformation_WorkLocation_AddressLine,details_JobPositionPosting_JobPositionInformation_WorkLocation_Country_Id,details_JobPositionPosting_JobPositionInformation_WorkLocation_Country_Name,details_JobPositionPosting_JobPositionInformation_WorkLocation_Municipality_Id,details_JobPositionPosting_JobPositionInformation_WorkLocation_Municipality_Name,details_JobPositionPosting_JobPositionInformation_WorkLocation_Region_Id,details_JobPositionPosting_JobPositionInformation_WorkLocation_Region_Name,details_JobPositionPosting_JobPositionInformation_WorkLocation_PostalCode,details_JobPositionPosting_JobPositionInformation_WorkLocation_City,details_JobPositionPosting_JobPositionInformation_EmploymentType,details_JobPositionPosting_JobPositionInformation_WeeklyWorkHours_TypeId,details_JobPositionPosting_JobPositionInformation_WeeklyWorkHours_TypeName,details_JobPositionPosting_JobPositionInformation_WeeklyWorkHours_Description,details_JobPositionPosting_JobPositionInformation_CompensationDescription,details_JobPositionPosting_JobPositionInformation_NumberToFill,details_JobPositionPosting_JobPositionInformation_DriverLicense,details_JobPositionPosting_JobPositionInformation_Occupation_DiscoWeb,details_JobPositionPosting_JobPositionInformation_Occupation_AlternateNames,details_JobPositionPosting_JobPositionInformation_Occupation_GroupId,details_JobPositionPosting_JobPositionInformation_Occupation_AreaId,details_JobPositionPosting_JobPositionInformation_Occupation_Id,details_JobPositionPosting_JobPositionInformation_Occupation_Name,details_JobPositionPosting_JobPositionInformation_IsGovernmentHiring,details_JobPositionPosting_JobPositionInformation_JppContacts,details_JobPositionPosting_JobPositionInformation_EmploymentDate,details_JobPositionPosting_IsRecruitmentOfForeignNationals,details_JobPositionPosting_IsWorkInDenmark,details_JobPositionPosting_IsAnonymousEmployer,details_JobPositionPosting_IsDisabilityFriendly,details_JobPositionPosting_JppType,details_JobPositionPosting_ApplicationDetails_WorkHourMax,details_JobPositionPosting_ApplicationDetails_WorkHourMin,details_JobPositionPosting_ApplicationDetails_DailyWorkTimeWeekend,details_JobPositionPosting_ApplicationDetails_DailyWorkTimeNight,details_JobPositionPosting_ApplicationDetails_DailyWorkTimeEvening,details_JobPositionPosting_ApplicationDetails_DailyWorkTimeDay,details_JobPositionPosting_ApplicationDetails_ReferenceText,details_JobPositionPosting_ApplicationDetails_RemarksToApplicant,details_JobPositionPosting_ApplicationDetails_ByEmail,details_JobPositionPosting_ApplicationDetails_ByPhone,details_JobPositionPosting_ApplicationDetails_ApplyViaUrl,details_JobPositionPosting_ApplicationDetails_ReplyInWriting,details_JobPositionPosting_ApplicationDetails_ApplicationDeadlineDate,details_JobPositionPosting_ContactAuthorityPhoneNumber_Number,details_JobPositionPosting_ContactAuthorityPhoneNumber_Type,details_JobPositionPosting_ContactAuthorityPhoneNumber_Description,details_JobPositionPosting_Status,details_LogoUrl,details_Address,details_ShowMap,details_ShowShareButtonJobLog,details_JobLogUrl,details_JobLogTemplateModel_Identifier,details_JobLogTemplateModel_UseWorkPlaceAddressForJoblog,details_JobLogTemplateModel_Category,details_JobLogTemplateModel_CvCustomerIdentifier,details_JobLogTemplateModel_JobSeekingStatus,details_JobLogTemplateModel_Title,details_JobLogTemplateModel_IsApplicationSourceRequired,details_JobLogTemplateModel_ApplicationSource,details_JobLogTemplateModel_IsWeeklyWorkTimeRequired,details_JobLogTemplateModel_WeeklyWorkTime,details_JobLogTemplateModel_HoursPerWeek,details_JobLogTemplateModel_JobnetJobPostingIdentifier,details_JobLogTemplateModel_JobAdDocument_Title,details_JobLogTemplateModel_JobAdDocument_Identifier,details_JobLogTemplateModel_JobAdDocument_IsDeletedBySystem,details_JobLogTemplateModel_JobAdDocument_IsDeletedByUser,details_JobLogTemplateModel_JobAdFile,details_JobLogTemplateModel_Company_JobLogEntryCategory,details_JobLogTemplateModel_Company_ShowAddressFieldsEvenIfEmpty,details_JobLogTemplateModel_Company_Name,details_JobLogTemplateModel_Company_Address,details_JobLogTemplateModel_Company_Country,details_JobLogTemplateModel_Company_EmploymentAreaID,details_JobLogTemplateModel_Company_PostCode,details_JobLogTemplateModel_Company_IsCountryAndTownAndPostCodeEmpty,details_JobLogTemplateModel_Company_IsTownAndPostCodeEmpty,details_JobLogTemplateModel_Company_IsCountryDanmark,details_JobLogTemplateModel_Company_Town,details_JobLogTemplateModel_Company_ContactPerson,details_JobLogTemplateModel_Company_Phone,details_JobLogTemplateModel_Company_Email,details_JobLogTemplateModel_Company_Latitude,details_JobLogTemplateModel_Company_Longitude,details_JobLogTemplateModel_Company_DailyTravelTimeInMinutes,details_JobLogTemplateModel_Company_DistanceToCompanyInMeters,details_JobLogTemplateModel_Company_IsCreateMode,details_JobLogTemplateModel_TypeOfSubmission,details_JobLogTemplateModel_SubmissionDate,details_JobLogTemplateModel_SubmissionDateFormatted,details_JobLogTemplateModel_SubmissionDateTiks,details_JobLogTemplateModel_IsSubmissionDateRequired,details_JobLogTemplateModel_Status,details_JobLogTemplateModel_DateCreatedFormatted,details_JobLogTemplateModel_DateCreated,details_JobLogTemplateModel_DateModifiedFormatted,details_JobLogTemplateModel_DateModified,details_JobLogTemplateModel_LastModifiedDateTiks,details_JobLogTemplateModel_DateClosed,details_JobLogTemplateModel_JobApplicationDocument_Title,details_JobLogTemplateModel_JobApplicationDocument_Identifier,details_JobLogTemplateModel_JobApplicationDocument_IsDeletedBySystem,details_JobLogTemplateModel_JobApplicationDocument_IsDeletedByUser,details_JobLogTemplateModel_CvDocument_Title,details_JobLogTemplateModel_CvDocument_Identifier,details_JobLogTemplateModel_CvDocument_IsDeletedBySystem,details_JobLogTemplateModel_CvDocument_IsDeletedByUser,details_JobLogTemplateModel_JobApplicationFile,details_JobLogTemplateModel_CvFile,details_JobLogTemplateModel_SubmissionDeadlineDate,details_JobLogTemplateModel_IsPersisted,details_JobLogTemplateModel_ServerValidationErrors,details_JobLogTemplateModel_HasServerValidationErrors,details_JoblogWorkTime_WorkHour,details_JoblogWorkTime_DailyWorkTime,details_Place,details_OpenPrintDialog,details_WorkPlaceInfoText,details_JobCenterContactDetails,details_WorkPlaceDescriptionText,details_FavoriteText,details_IsFavorite,details_ShowFavorite,details_MetaOgTextForSharing,details_DescriptionForSharing,details_TitleForSharing,details_RutePlan,details_FormattedPurpose,details_MapUrl,details_OrganizationNumber,details_ShowSearchJobButton,details_ShowPrint,details_BackToFindWorkButtonUrl,isExternal
0,False,1,"Hvidovre Kommune, Center for Trafik og Ejendomme (TOE) søger en konsulent til at understøtte centret med politiske og organisatoriske opgaver","Hvidovre Kommune, Center for Trafik og Ejendomme (TOE) søger en konsulent til at understøtte centret med politiske og organisatoriske opgaver","Opgaver Konsulentopgaverne i Center for Trafik og Ejendomme er typisk tværgående og mangeartede, og de daglige opgaver udføres i tæt samarbejde med mange forskellige faglighe",Center for Trafik og Ejendomme,Høvedstensvej 45,2650,Hvidovre,False,False,False,True,2022-05-05T00:00:00,2022-05-29T00:00:00,29. maj 2022,0001-01-01T00:00:00,False,False,https://job.jobnet.dk/CV/FindWork/Details/5590470,Hovedstaden og Bornholm,Hvidovre,Danmark,2650,,,,Fuldtid,"Kontor, administration, regnskab og finans",Kontor- og sekretærarbejde,Kontorfuldmægtig,55.6428,12.4642,,,5340,1869,55606617,False,False,https://job.jobnet.dk/CV/FindWork/DetailsSocialmedia/5590470,https://job.jobnet.dk/CV/FindWork/Details/5590470,https://job.jobnet.dk/CV/FindWork/Details/5590470,True,5590470,55.6428,12.4642,"{'Id': 1, 'Name': 'Fuldtid'}, {'Id': 16, 'Name': 'Deltid'}","{'Id': 1, 'Name': 'Almindelige vilkår'}, {'Id': 2, 'Name': 'Fleksjob'}, {'Id': 3, 'Name': 'Skånejob'}, {'Id': 4, 'Name': 'Egnet til efterlønnere og seniorer'}, {'Id': 5, 'Name': 'Job med løntilskud'}, {'Id': 6, 'Name': 'Rotationsjob'}, {'Id': 7, 'Name': 'Virksomhedspraktik'}","{'Id': 1, 'Name': 'Fastansættelse'}, {'Id': 16, 'Name': 'Tidsbegrænset ansættelse'}",Center for Trafik og Ejendomme,Høvedstensvej 45,58,Danmark,167,Hvidovre,4,"Hovedstaden, Sjælland og Bornholm",2650,Hvidovre,,0,Primary,,,,None,5340,1003267810,55606617,None,5590470,5590470,Center for Trafik og Ejendomme,Høvedstensvej 45,58,Danmark,167,Hvidovre,4,"Hovedstaden, Sjælland og Bornholm",2650,Hvidovre,,0,Primary,,,,None,5340,1003267810,55606617,None,,2022-05-05T00:00:00,2022-05-29T00:00:00,"Hvidovre Kommune, Center for Trafik og Ejendomme (TOE) søger en konsulent til at understøtte centret med politiske og organisatoriske opgaver","Opgaver  Konsulentopgaverne i Center for Trafik og Ejendomme er typisk tværgående og mangeartede, og de daglige opgaver udføres i tæt samarbejde med mange forskellige fagligheder internt i centret og med kommunens øvrige centre.   Du indgår i team Drift og Udvikling, hvor I hjælper hinanden på tværs i teamet. Du står som udgangspunkt for ledelsesbetjeningen i tæt samarbejde med centerchefen.   Dine opgaver spænder bredt med følgende kerneopgaver:     Du understøtter centerchefen og ledergruppen med dagsordener, notater og svar til borgere, politikere og direktionen   Du kvalitetssikrer sprog, indhold, procedurer og formalia i ovenstående leverancer   Du er projektleder på centerets tværgående udviklingsprojekter   Du er sekretær ved CenterMED møder   Du udfører mindre ad hoc-opgaver i samarbejde med kollegaer i team Drift og Udvikling     Om dig     Du er god til at opbygge stærke relationer på tværs af forskelligheder   Du har stærke skriftlige kompetencer og kan formidle klart og enkelt   Du har gode samarbejdsevner, god situationsfornemmelse og er handlekraftig - og agerer gerne som tovholder i samarbejdsprocesser   Du kan bevare overblikket i forhold til deadlines og mange samtidige opgaver, fordi du arbejder metodisk og struktureret med dine opgaver   Du har erfaring fra lignende job fra anden offentlig institution - gerne på de tekniske områder   Du kan anvende Microsoft Office-pakken på højt niveau som en del af opgaveløsningen, især Word og PPT og gerne også Excel. Du har kendskab til arkiveringspraksis i offentlige forvaltninger   Du er initiativrig og har mod på at blive udfordret   Du har humoristisk sans og trives i et uformelt arbejdsmiljø     Vi tilbyder  Du bliver én ud af ca. 380 medarbejdere i TOE. Du indgår i det tværgående team, Drift og Udvikling, bestående af 6 medarbejdere, heraf 1 elev.   Vi tilbyder en spændende og udfordrende hverdag i et udviklings- og handlingsorienteret center, hvor ingen dage er ens. Vi har et godt og uformelt arbejdsmiljø, hvor vi har respekt for hinanden og vores forskellige fagligheder.     En arbejdsplads, hvor der er plads til gode ideer og initiativer   En arbejdsplads, hvor vi har fokus på trivsel og sundhed   Gode muligheder for udvikling af kompetencer   Stor frihed og tilsvarende ansvar   Samarbejde med gode og engagerede kollegaer   Mulighed for flekstid, afhængig af opgave   Mulighed for hjemmearbejde, afhængig af opgave   En attraktiv pensionsordning     Arbejdstiden er 37 timer ugentligt inkl. frokostpause.   Ansøgning skal være os i hænde senest den 29. maj. Samtaler afholdes umiddelbart herefter med henblik på ansættelse snarest muligt.   Vil du høre mere om jobbet eller har spørgsmål hertil, kan du kontakte centerchef Anne B Pallesen på mobil nr. 36393524.   Ved ansøgning bedes du benytte kommunens rekrutteringssystem, som kan tilgås fra kommunens hjemmeside. 
 Denne jobannonce blev oprindeligt opslået på https://www.ofir.dk/
 (Den originale annonce kan ses på: https://www.ofir.dk/showojob?ofirid=873ecfdd)",Høvedstensvej 45,58,Danmark,167,Hvidovre,4,"Hovedstaden, Sjælland og Bornholm",2650,Hvidovre,1,1,Fuldtid,None,None,1,,0,,0,0,0,,False,"{'Id': 7964539, 'Email': None, 'FaxNumber': None, 'PersonName': 'Anne Bodil Pallesen', 'FirstName': 'Anne', 'LastName': 'Bodil Pallesen', 'PositionTitle': None, 'PhoneNumbers': [{'Number': '36393524', 'Type': 0, 'Description': 'Hovednummer'}]}",,False,False,False,False,4,,,False,False,False,False,,,,,https://www.ofir.dk/resultat/Jobannonce.aspx?ofirId=873ecfdd&action=sendApplicationUrl,False,2022-05-29T00:00:00,,0,Primary,7,/CV/FindWork/GetLogo?JobAdId=5590470&WorkPlace=5340&Organisation=55606617,"Høvedstensvej 45,2650, Hvidovre",True,False,"/CV/Jobseeking/JobLog/CreateJobSearch?JobnetJobPostingIdentifier=5590470&Company.Name=Center for Trafik og Ejendomme&SubmissionDeadlineDate=2022-5-29&Title=Hvidovre Kommune, Center for Trafik og Ejendomme (TOE) søger en konsulent til at understøtte centret med politiske og organisatoriske opgaver&WeeklyWorkTime=1",00000000-0000-0000-0000-000000000000,False,0,,,"Hvidovre Kommune, Center for Trafik og Ejendomme (TOE) søger en konsulent til at understøtte centret med politiske og organisatoriske opgaver",True,,True,1,,5590470,,,False,False,,0,False,Center for Trafik og Ejendomme,Høvedstensvej 45,,,2650,False,False,False,Hvidovre,Anne Bodil Pallesen,36393524,,,,,,False,,2022-05-29T00:00:00,,0,False,0,,,,,0,,,,False,False,,,False,False,,,,False,,False,,,Arbejdspladsen ligger i Hvidovre kommune,False,Center for Trafik og Ejendomme,,None,,False,False,"Opgaver Konsulentopgaverne i Center for Trafik og Ejendomme er typisk tværgående og mangeartede, og de daglige opgaver udføres i tæt samarbejde med mange forskellige fagligheder internt i centret og med kommunens øvrige centre. Du indgår i team Drift og Udvikling, hvor I hjælper hinanden på tværs i teamet. Du står som udgangspunkt for ledelsesbetje","""Opgaver Konsulentopgaverne i Center for Trafik og Ejendomme er typisk tværgående og mangeartede, og de daglige opgaver udføres i tæt samarbejde med mange forskellige fagligheder internt i centret og med kommunens øvrige centre. Du indgår i team Drift og Udvikling, hvor I hjælper hinanden på tværs i teamet. Du står som udgangspunkt for ledelsesbetje""","""Hvidovre Kommune, Center for Trafik og Ejendomme (TOE) søger en konsulent til at understøtte centret med politiske og organisatoriske opgaver""","https://www.google.dk/maps/dir//Høvedstensvej+45,2650,+Hvidovre/","Opgaver  Konsulentopgaverne i Center for Trafik og Ejendomme er typisk tværgående og mangeartede, og de daglige opgaver udføres i tæt samarbejde med mange forskellige fagligheder internt i centret og med kommunens øvrige centre.   Du indgår i team Drift og Udvikling, hvor I hjælper hinanden på tværs i teamet. Du står som udgangspunkt for ledelsesbetjeningen i tæt samarbejde med centerchefen.   Dine opgaver spænder bredt med følgende kerneopgaver:     Du understøtter centerchefen og ledergruppen med dagsordener, notater og svar til borgere, politikere og direktionen   Du kvalitetssikrer sprog, indhold, procedurer og formalia i ovenstående leverancer   Du er projektleder på centerets tværgående udviklingsprojekter   Du er sekretær ved CenterMED møder   Du udfører mindre ad hoc-opgaver i samarbejde med kollegaer i team Drift og Udvikling     Om dig     Du er god til at opbygge stærke relationer på tværs af forskelligheder   Du har stærke skriftlige kompetencer og kan formidle klart og enkelt   Du har gode samarbejdsevner, god situationsfornemmelse og er handlekraftig - og agerer gerne som tovholder i samarbejdsprocesser   Du kan bevare overblikket i forhold til deadlines og mange samtidige opgaver, fordi du arbejder metodisk og struktureret med dine opgaver   Du har erfaring fra lignende job fra anden offentlig institution - gerne på de tekniske områder   Du kan anvende Microsoft Office-pakken på højt niveau som en del af opgaveløsningen, især Word og PPT og gerne også Excel. Du har kendskab til arkiveringspraksis i offentlige forvaltninger   Du er initiativrig og har mod på at blive udfordret   Du har humoristisk sans og trives i et uformelt arbejdsmiljø     Vi tilbyder  Du bliver én ud af ca. 380 medarbejdere i TOE. Du indgår i det tværgående team, Drift og Udvikling, bestående af 6 medarbejdere, heraf 1 elev.   Vi tilbyder en spændende og udfordrende hverdag i et udviklings- og handlingsorienteret center, hvor ingen dage er ens. Vi har et godt og uformelt arbejdsmiljø, hvor vi har respekt for hinanden og vores forskellige fagligheder.     En arbejdsplads, hvor der er plads til gode ideer og initiativer   En arbejdsplads, hvor vi har fokus på trivsel og sundhed   Gode muligheder for udvikling af kompetencer   Stor frihed og tilsvarende ansvar   Samarbejde med gode og engagerede kollegaer   Mulighed for flekstid, afhængig af opgave   Mulighed for hjemmearbejde, afhængig af opgave   En attraktiv pensionsordning     Arbejdstiden er 37 timer ugentligt inkl. frokostpause.   Ansøgning skal være os i hænde senest den 29. maj. Samtaler afholdes umiddelbart herefter med henblik på ansættelse snarest muligt.   Vil du høre mere om jobbet eller har spørgsmål hertil, kan du kontakte centerchef Anne B Pallesen på mobil nr. 36393524.   Ved ansøgning bedes du benytte kommunens rekrutteringssystem, som kan tilgås fra kommunens hjemmeside. 
 Denne jobannonce blev oprindeligt opslået på  https://www.ofir.dk/ 
 (Den originale annonce kan ses på:  https://www.ofir.dk/showojob?ofirid=873ecfdd )","https://www.google.dk/maps/place/Høvedstensvej+45,2650,+Hvidovre/",55606617,False,False,,False
