summary_AutomatchType,summary_Abroad,summary_Weight,summary_Title,summary_JobHeadline,summary_Presentation,summary_HiringOrgName,summary_WorkPlaceAddress,summary_WorkPlacePostalCode,summary_WorkPlaceCity,summary_WorkPlaceOtherAddress,summary_WorkPlaceAbroad,summary_WorkPlaceNotStatic,summary_UseWorkPlaceAddressForJoblog,summary_PostingCreated,summary_LastDateApplication,summary_FormattedLastDateApplication,summary_AssignmentStartDate,summary_IsHotjob,summary_IsExternal,summary_Url,summary_Region,summary_Municipality,summary_Country,summary_PostalCode,summary_PostalCodeName,summary_JobAnnouncementType,summary_EmploymentType,summary_WorkHours,summary_OccupationArea,summary_OccupationGroup,summary_Occupation,summary_Location_Latitude,summary_Location_Longitude,summary_JoblogWorkTime_WorkHour,summary_JoblogWorkTime_DailyWorkTime,summary_WorkplaceID,summary_OrganisationId,summary_HiringOrgCVR,summary_UserLoggedIn,summary_AnonymousEmployer,summary_ShareUrl,summary_DetailsUrl,summary_JobLogUrl,summary_HasLocationValues,summary_ID,summary_Latitude,summary_Longitude,details_WorkSchedule,details_WorkConditions,details_EmploymentTypes,details_WorkPlace_Name,details_WorkPlace_Address_AddressLine,details_WorkPlace_Address_Country_Id,details_WorkPlace_Address_Country_Name,details_WorkPlace_Address_Municipality_Id,details_WorkPlace_Address_Municipality_Name,details_WorkPlace_Address_Region_Id,details_WorkPlace_Address_Region_Name,details_WorkPlace_Address_PostalCode,details_WorkPlace_Address_City,details_WorkPlace_PhoneNumber_Number,details_WorkPlace_PhoneNumber_Type,details_WorkPlace_PhoneNumber_Description,details_WorkPlace_FaxNumber,details_WorkPlace_Email,details_WorkPlace_WebAddress,details_WorkPlace_Description,details_WorkPlace_Logo,details_WorkPlace_WorkPlaceOrganizationNumber,details_WorkPlace_OrganizationNumber,details_WorkPlace_OrganizationDescription,details_JobPositionPosting_Id,details_JobPositionPosting_OriginalJppId,details_JobPositionPosting_HiringOrg_Name,details_JobPositionPosting_HiringOrg_Address_AddressLine,details_JobPositionPosting_HiringOrg_Address_Country_Id,details_JobPositionPosting_HiringOrg_Address_Country_Name,details_JobPositionPosting_HiringOrg_Address_Municipality_Id,details_JobPositionPosting_HiringOrg_Address_Municipality_Name,details_JobPositionPosting_HiringOrg_Address_Region_Id,details_JobPositionPosting_HiringOrg_Address_Region_Name,details_JobPositionPosting_HiringOrg_Address_PostalCode,details_JobPositionPosting_HiringOrg_Address_City,details_JobPositionPosting_HiringOrg_PhoneNumber_Number,details_JobPositionPosting_HiringOrg_PhoneNumber_Type,details_JobPositionPosting_HiringOrg_PhoneNumber_Description,details_JobPositionPosting_HiringOrg_FaxNumber,details_JobPositionPosting_HiringOrg_Email,details_JobPositionPosting_HiringOrg_WebAddress,details_JobPositionPosting_HiringOrg_Description,details_JobPositionPosting_HiringOrg_Logo,details_JobPositionPosting_HiringOrg_WorkPlaceOrganizationNumber,details_JobPositionPosting_HiringOrg_OrganizationNumber,details_JobPositionPosting_HiringOrg_OrganizationDescription,details_JobPositionPosting_RecruitingCompany,details_JobPositionPosting_PublicationStartDate,details_JobPositionPosting_PublicationEndDate,details_JobPositionPosting_JobPositionInformation_PositionTitle,details_JobPositionPosting_JobPositionInformation_Purpose,details_JobPositionPosting_JobPositionInformation_WorkLocation_AddressLine,details_JobPositionPosting_JobPositionInformation_WorkLocation_Country_Id,details_JobPositionPosting_JobPositionInformation_WorkLocation_Country_Name,details_JobPositionPosting_JobPositionInformation_WorkLocation_Municipality_Id,details_JobPositionPosting_JobPositionInformation_WorkLocation_Municipality_Name,details_JobPositionPosting_JobPositionInformation_WorkLocation_Region_Id,details_JobPositionPosting_JobPositionInformation_WorkLocation_Region_Name,details_JobPositionPosting_JobPositionInformation_WorkLocation_PostalCode,details_JobPositionPosting_JobPositionInformation_WorkLocation_City,details_JobPositionPosting_JobPositionInformation_EmploymentType,details_JobPositionPosting_JobPositionInformation_WeeklyWorkHours_TypeId,details_JobPositionPosting_JobPositionInformation_WeeklyWorkHours_TypeName,details_JobPositionPosting_JobPositionInformation_WeeklyWorkHours_Description,details_JobPositionPosting_JobPositionInformation_CompensationDescription,details_JobPositionPosting_JobPositionInformation_NumberToFill,details_JobPositionPosting_JobPositionInformation_DriverLicense,details_JobPositionPosting_JobPositionInformation_Occupation_DiscoWeb,details_JobPositionPosting_JobPositionInformation_Occupation_AlternateNames,details_JobPositionPosting_JobPositionInformation_Occupation_GroupId,details_JobPositionPosting_JobPositionInformation_Occupation_AreaId,details_JobPositionPosting_JobPositionInformation_Occupation_Id,details_JobPositionPosting_JobPositionInformation_Occupation_Name,details_JobPositionPosting_JobPositionInformation_IsGovernmentHiring,details_JobPositionPosting_JobPositionInformation_JppContacts,details_JobPositionPosting_JobPositionInformation_EmploymentDate,details_JobPositionPosting_IsRecruitmentOfForeignNationals,details_JobPositionPosting_IsWorkInDenmark,details_JobPositionPosting_IsAnonymousEmployer,details_JobPositionPosting_IsDisabilityFriendly,details_JobPositionPosting_JppType,details_JobPositionPosting_ApplicationDetails_WorkHourMax,details_JobPositionPosting_ApplicationDetails_WorkHourMin,details_JobPositionPosting_ApplicationDetails_DailyWorkTimeWeekend,details_JobPositionPosting_ApplicationDetails_DailyWorkTimeNight,details_JobPositionPosting_ApplicationDetails_DailyWorkTimeEvening,details_JobPositionPosting_ApplicationDetails_DailyWorkTimeDay,details_JobPositionPosting_ApplicationDetails_ReferenceText,details_JobPositionPosting_ApplicationDetails_RemarksToApplicant,details_JobPositionPosting_ApplicationDetails_ByEmail,details_JobPositionPosting_ApplicationDetails_ByPhone,details_JobPositionPosting_ApplicationDetails_ApplyViaUrl,details_JobPositionPosting_ApplicationDetails_ReplyInWriting,details_JobPositionPosting_ApplicationDetails_ApplicationDeadlineDate,details_JobPositionPosting_ContactAuthorityPhoneNumber_Number,details_JobPositionPosting_ContactAuthorityPhoneNumber_Type,details_JobPositionPosting_ContactAuthorityPhoneNumber_Description,details_JobPositionPosting_Status,details_LogoUrl,details_Address,details_ShowMap,details_ShowShareButtonJobLog,details_JobLogUrl,details_JobLogTemplateModel_Identifier,details_JobLogTemplateModel_UseWorkPlaceAddressForJoblog,details_JobLogTemplateModel_Category,details_JobLogTemplateModel_CvCustomerIdentifier,details_JobLogTemplateModel_JobSeekingStatus,details_JobLogTemplateModel_Title,details_JobLogTemplateModel_IsApplicationSourceRequired,details_JobLogTemplateModel_ApplicationSource,details_JobLogTemplateModel_IsWeeklyWorkTimeRequired,details_JobLogTemplateModel_WeeklyWorkTime,details_JobLogTemplateModel_HoursPerWeek,details_JobLogTemplateModel_JobnetJobPostingIdentifier,details_JobLogTemplateModel_JobAdDocument_Title,details_JobLogTemplateModel_JobAdDocument_Identifier,details_JobLogTemplateModel_JobAdDocument_IsDeletedBySystem,details_JobLogTemplateModel_JobAdDocument_IsDeletedByUser,details_JobLogTemplateModel_JobAdFile,details_JobLogTemplateModel_Company_JobLogEntryCategory,details_JobLogTemplateModel_Company_ShowAddressFieldsEvenIfEmpty,details_JobLogTemplateModel_Company_Name,details_JobLogTemplateModel_Company_Address,details_JobLogTemplateModel_Company_Country,details_JobLogTemplateModel_Company_EmploymentAreaID,details_JobLogTemplateModel_Company_PostCode,details_JobLogTemplateModel_Company_IsCountryAndTownAndPostCodeEmpty,details_JobLogTemplateModel_Company_IsTownAndPostCodeEmpty,details_JobLogTemplateModel_Company_IsCountryDanmark,details_JobLogTemplateModel_Company_Town,details_JobLogTemplateModel_Company_ContactPerson,details_JobLogTemplateModel_Company_Phone,details_JobLogTemplateModel_Company_Email,details_JobLogTemplateModel_Company_Latitude,details_JobLogTemplateModel_Company_Longitude,details_JobLogTemplateModel_Company_DailyTravelTimeInMinutes,details_JobLogTemplateModel_Company_DistanceToCompanyInMeters,details_JobLogTemplateModel_Company_IsCreateMode,details_JobLogTemplateModel_TypeOfSubmission,details_JobLogTemplateModel_SubmissionDate,details_JobLogTemplateModel_SubmissionDateFormatted,details_JobLogTemplateModel_SubmissionDateTiks,details_JobLogTemplateModel_IsSubmissionDateRequired,details_JobLogTemplateModel_Status,details_JobLogTemplateModel_DateCreatedFormatted,details_JobLogTemplateModel_DateCreated,details_JobLogTemplateModel_DateModifiedFormatted,details_JobLogTemplateModel_DateModified,details_JobLogTemplateModel_LastModifiedDateTiks,details_JobLogTemplateModel_DateClosed,details_JobLogTemplateModel_JobApplicationDocument_Title,details_JobLogTemplateModel_JobApplicationDocument_Identifier,details_JobLogTemplateModel_JobApplicationDocument_IsDeletedBySystem,details_JobLogTemplateModel_JobApplicationDocument_IsDeletedByUser,details_JobLogTemplateModel_CvDocument_Title,details_JobLogTemplateModel_CvDocument_Identifier,details_JobLogTemplateModel_CvDocument_IsDeletedBySystem,details_JobLogTemplateModel_CvDocument_IsDeletedByUser,details_JobLogTemplateModel_JobApplicationFile,details_JobLogTemplateModel_CvFile,details_JobLogTemplateModel_SubmissionDeadlineDate,details_JobLogTemplateModel_IsPersisted,details_JobLogTemplateModel_ServerValidationErrors,details_JobLogTemplateModel_HasServerValidationErrors,details_JoblogWorkTime_WorkHour,details_JoblogWorkTime_DailyWorkTime,details_Place,details_OpenPrintDialog,details_WorkPlaceInfoText,details_JobCenterContactDetails,details_WorkPlaceDescriptionText,details_FavoriteText,details_IsFavorite,details_ShowFavorite,details_MetaOgTextForSharing,details_DescriptionForSharing,details_TitleForSharing,details_RutePlan,details_FormattedPurpose,details_MapUrl,details_OrganizationNumber,details_ShowSearchJobButton,details_ShowPrint,details_BackToFindWorkButtonUrl,isExternal
0,False,1,Pædagog søges til Motorik-børnehuset Rådyrvej,Pædagog søges til Motorik-børnehuset Rådyrvej,Vil du være med til at skabe udviklende læringsmiljøer med fokus på børns motorik? Motorik-børnehuset Rådyrvej søger en pædagog på 30 timer ugentligt pr. 01.06.2022 ,Sønderborg Kommune - Motorik-børnehuset Rådyrvej,Rådhustorvet 10,6400,Sønderborg,False,False,False,True,2022-05-05T00:00:00,2022-05-19T00:00:00,19. maj 2022,0001-01-01T00:00:00,False,False,https://job.jobnet.dk/CV/FindWork/Details/5591307,Syddanmark,Sønderborg,Danmark,6400,,,,Deltid,"Pædagogisk, socialt og kirkeligt arbejde",Pædagogisk arbejde,Pædagog,54.9088,9.7889,,,57950,54278,29189773,False,False,https://job.jobnet.dk/CV/FindWork/DetailsSocialmedia/5591307,https://job.jobnet.dk/CV/FindWork/Details/5591307,https://job.jobnet.dk/CV/FindWork/Details/5591307,True,5591307,54.9088,9.7889,"{'Id': 1, 'Name': 'Fuldtid'}, {'Id': 16, 'Name': 'Deltid'}","{'Id': 1, 'Name': 'Almindelige vilkår'}, {'Id': 2, 'Name': 'Fleksjob'}, {'Id': 3, 'Name': 'Skånejob'}, {'Id': 4, 'Name': 'Egnet til efterlønnere og seniorer'}, {'Id': 5, 'Name': 'Job med løntilskud'}, {'Id': 6, 'Name': 'Rotationsjob'}, {'Id': 7, 'Name': 'Virksomhedspraktik'}","{'Id': 1, 'Name': 'Fastansættelse'}, {'Id': 16, 'Name': 'Tidsbegrænset ansættelse'}",Sønderborg Kommune - Motorik-børnehuset Rådyrvej,Rådhustorvet 10,58,Danmark,540,Sønderborg,3,Syddanmark,6400,Sønderborg,,0,Primary,,,,kommune,57950,1003326485,29189773,None,5591307,5591307,Sønderborg Kommune - Motorik-børnehuset Rådyrvej,Rådhustorvet 10,58,Danmark,540,Sønderborg,3,Syddanmark,6400,Sønderborg,,0,Primary,,,,kommune,57950,1003326485,29189773,None,,2022-05-05T00:00:00,2022-05-19T00:00:00,Pædagog søges til Motorik-børnehuset Rådyrvej,"Vil du være med til at skabe udviklende læringsmiljøer med fokus på børns motorik?   Motorik-børnehuset Rådyrvej søger en pædagog på 30 timer ugentligt pr. 01.06.2022 eller hurtigst muligt.   Dagtilbud Sønderborg City består af 12 afdelinger placeret i midtbyen. City har en mangfoldighed af familier.   Dagtilbuddet ønsker at målrette vores tilbud til de forskellige børnefamilier, der bor i vores område.   Der er valgt en bestyrelse i området, som består af forældre- og personalerepræsentanter fra alle afdelinger.   Dagtilbuddet er ledet af en dagtilbudsleder og en souschef samt 12 daglige pædagogiske ledere. Denne ledelses organisering tager højde for den kompleksitet, der er i forskelligheden i ledelsesfordringer i vore afdelinger, således at der både sikres sikker drift, organisations- og pædagogfaglig udvikling.   Den styrkede pædagogiske læreplan målrettes til lokale forhold, personalets styrker og kompetencer bringes i spil.   Der lægges stor vægt på forældreinvolvering i forhold til børnenes læring, trivsel, udvikling og dannelse.   Vi har valgt, at vi vil arbejde projektorganiseret i forhold til de godkendte politiske mål samt egne indsatsområder på tværs af afdelingerne med daglig pædagogisk leder som projektleder.   Vi er et område med et stort ambitionsniveau i forhold til personaleudvikling, dette ses som en styrke i forhold til den alsidige viden, der genereres og bringes i spil i området.   Dagtilbud Sønderborg City's vision: ""Vi skaber dagtilbud i verdensklasse""   Dagtilbud i Sønderborg kommune vil primært i 2022 have fokus på:     Kerneopgaven: Børnenes ret til en god dag i et udviklende miljø.   Børn i udsatte positioner - Tidlig indsats, udsathed.   Substantiel ledelse.   Den styrkede pædagogiske læreplan (læringsmiljøer, evalueringskultur)   Det tværfaglige samarbejde.     Motorik-børnehuset Rådyrvej er en integreret institution normeret til 12 vuggestuebørn og 62 børnehavebørn, derudover er der tilknyttet 20 dagpljebørn. Børnene er fordelt på 4 grupper, en vuggestue, en gruppe med de mindste børnehavebørn og to grupper med de ældste børn. Institutionen har en motorikprofil, hvor børnene hver dag skal tilbydes læringsmiljøer der understøtter deres motoriske udvikling.   Vi søger en pædagog     Der vil arbejde ud fra en motorik profil og kan byde ind fagligt   Der vil arbejde i en integreret institution med børn i 0-6 års alderen   Der har sin pædagogiske faglighed i orden   Der har gode kommunikationsevner og er anerkendende i relation til børn, forældre og kollegaer   Der er udviklingsorienteret og vil være med til at implementere den styrked pædagogiske læreplan   Der har et godt overblik og vil bidrage både i det store og lille fællesskab   Der har et positivt livssyn og vil bidrage til et godt arbejdsmiljø     Vi tilbyder     Et hus med faglighed og et godt engagement   Stor indflydelse på arbejdet og aktiviteter på gruppen og i huset   En god forældregruppe der bakker op omkring institutionen   Et hus med et godt rart arbejdsmiljø     Ved ansættelse vil der blive indhentet straffe– og børneattest. Løn og ansættelse ifølge gældende overenskomst.   Har du spørgsmål til stillingen eller ønsker at se institutionen, er du velkommen til at kontakte daglig pædagogisk leder Lars Vandborg Skov, tlf. 24636457 eller på mail lvsk@sonderborg.dk   Ansøgningsfrist er 19. maj 2022   Ansættelsessamtaler holdes d. 24. maj 2022. 
 Denne jobannonce blev oprindeligt opslået på https://www.ofir.dk/
 (Den originale annonce kan ses på: https://www.ofir.dk/showojob?ofirid=bc0ec736)",Rådhustorvet 10,58,Danmark,540,Sønderborg,3,Syddanmark,6400,Sønderborg,1,16,Deltid,None,None,1,,0,,0,0,0,,False,"{'Id': 7962511, 'Email': None, 'FaxNumber': None, 'PersonName': 'Lars Vandborg Skov', 'FirstName': 'Lars', 'LastName': 'Vandborg Skov', 'PositionTitle': None, 'PhoneNumbers': [{'Number': '88726400', 'Type': 0, 'Description': 'Hovednummer'}]}",,False,False,False,False,4,,,False,False,False,False,,,,,https://www.ofir.dk/resultat/Jobannonce.aspx?ofirId=bc0ec736&action=sendApplicationUrl,False,2022-05-19T00:00:00,,0,Primary,7,/CV/FindWork/GetLogo?JobAdId=5591307&WorkPlace=57950&Organisation=29189773,"Rådhustorvet 10,6400, Sønderborg",True,False,/CV/Jobseeking/JobLog/CreateJobSearch?JobnetJobPostingIdentifier=5591307&Company.Name=Sønderborg Kommune - Motorik-børnehuset Rådyrvej&SubmissionDeadlineDate=2022-5-19&Title=Pædagog søges til Motorik-børnehuset Rådyrvej&WeeklyWorkTime=2,00000000-0000-0000-0000-000000000000,False,0,,,Pædagog søges til Motorik-børnehuset Rådyrvej,True,,True,2,,5591307,,,False,False,,0,False,Sønderborg Kommune - Motorik-børnehuset Rådyrvej,Rådhustorvet 10,,,6400,False,False,False,Sønderborg,Lars Vandborg Skov,88726400,,,,,,False,,2022-05-19T00:00:00,,0,False,0,,,,,0,,,,False,False,,,False,False,,,,False,,False,,,Arbejdspladsen ligger i Sønderborg kommune,False,Sønderborg Kommune - Motorik-børnehuset Rådyrvej,,kommune,,False,False,Vil du være med til at skabe udviklende læringsmiljøer med fokus på børns motorik? Motorik-børnehuset Rådyrvej søger en pædagog på 30 timer ugentligt pr. 01.06.2022 eller hurtigst muligt. Dagtilbud Sønderborg City består af 12 afdelinger placeret i midtbyen. City har en mangfoldighed af familier. Dagtilbuddet ønsker at målrette vores tilbud til de ,"""Vil du være med til at skabe udviklende læringsmiljøer med fokus på børns motorik? Motorik-børnehuset Rådyrvej søger en pædagog på 30 timer ugentligt pr. 01.06.2022 eller hurtigst muligt. Dagtilbud Sønderborg City består af 12 afdelinger placeret i midtbyen. City har en mangfoldighed af familier. Dagtilbuddet ønsker at målrette vores tilbud til de ""","""Pædagog søges til Motorik-børnehuset Rådyrvej""","https://www.google.dk/maps/dir//Rådhustorvet+10,6400,+Sønderborg/","Vil du være med til at skabe udviklende læringsmiljøer med fokus på børns motorik?   Motorik-børnehuset Rådyrvej søger en pædagog på 30 timer ugentligt pr. 01.06.2022 eller hurtigst muligt.   Dagtilbud Sønderborg City består af 12 afdelinger placeret i midtbyen. City har en mangfoldighed af familier.   Dagtilbuddet ønsker at målrette vores tilbud til de forskellige børnefamilier, der bor i vores område.   Der er valgt en bestyrelse i området, som består af forældre- og personalerepræsentanter fra alle afdelinger.   Dagtilbuddet er ledet af en dagtilbudsleder og en souschef samt 12 daglige pædagogiske ledere. Denne ledelses organisering tager højde for den kompleksitet, der er i forskelligheden i ledelsesfordringer i vore afdelinger, således at der både sikres sikker drift, organisations- og pædagogfaglig udvikling.   Den styrkede pædagogiske læreplan målrettes til lokale forhold, personalets styrker og kompetencer bringes i spil.   Der lægges stor vægt på forældreinvolvering i forhold til børnenes læring, trivsel, udvikling og dannelse.   Vi har valgt, at vi vil arbejde projektorganiseret i forhold til de godkendte politiske mål samt egne indsatsområder på tværs af afdelingerne med daglig pædagogisk leder som projektleder.   Vi er et område med et stort ambitionsniveau i forhold til personaleudvikling, dette ses som en styrke i forhold til den alsidige viden, der genereres og bringes i spil i området.   Dagtilbud Sønderborg City's vision: ""Vi skaber dagtilbud i verdensklasse""   Dagtilbud i Sønderborg kommune vil primært i 2022 have fokus på:     Kerneopgaven: Børnenes ret til en god dag i et udviklende miljø.   Børn i udsatte positioner - Tidlig indsats, udsathed.   Substantiel ledelse.   Den styrkede pædagogiske læreplan (læringsmiljøer, evalueringskultur)   Det tværfaglige samarbejde.     Motorik-børnehuset Rådyrvej er en integreret institution normeret til 12 vuggestuebørn og 62 børnehavebørn, derudover er der tilknyttet 20 dagpljebørn. Børnene er fordelt på 4 grupper, en vuggestue, en gruppe med de mindste børnehavebørn og to grupper med de ældste børn. Institutionen har en motorikprofil, hvor børnene hver dag skal tilbydes læringsmiljøer der understøtter deres motoriske udvikling.   Vi søger en pædagog     Der vil arbejde ud fra en motorik profil og kan byde ind fagligt   Der vil arbejde i en integreret institution med børn i 0-6 års alderen   Der har sin pædagogiske faglighed i orden   Der har gode kommunikationsevner og er anerkendende i relation til børn, forældre og kollegaer   Der er udviklingsorienteret og vil være med til at implementere den styrked pædagogiske læreplan   Der har et godt overblik og vil bidrage både i det store og lille fællesskab   Der har et positivt livssyn og vil bidrage til et godt arbejdsmiljø     Vi tilbyder     Et hus med faglighed og et godt engagement   Stor indflydelse på arbejdet og aktiviteter på gruppen og i huset   En god forældregruppe der bakker op omkring institutionen   Et hus med et godt rart arbejdsmiljø     Ved ansættelse vil der blive indhentet straffe– og børneattest. Løn og ansættelse ifølge gældende overenskomst.   Har du spørgsmål til stillingen eller ønsker at se institutionen, er du velkommen til at kontakte daglig pædagogisk leder Lars Vandborg Skov, tlf. 24636457 eller på mail lvsk@sonderborg.dk   Ansøgningsfrist er 19. maj 2022   Ansættelsessamtaler holdes d. 24. maj 2022. 
 Denne jobannonce blev oprindeligt opslået på  https://www.ofir.dk/ 
 (Den originale annonce kan ses på:  https://www.ofir.dk/showojob?ofirid=bc0ec736 )","https://www.google.dk/maps/place/Rådhustorvet+10,6400,+Sønderborg/",29189773,False,False,,False
