summary_AutomatchType,summary_Abroad,summary_Weight,summary_Title,summary_JobHeadline,summary_Presentation,summary_HiringOrgName,summary_WorkPlaceAddress,summary_WorkPlacePostalCode,summary_WorkPlaceCity,summary_WorkPlaceOtherAddress,summary_WorkPlaceAbroad,summary_WorkPlaceNotStatic,summary_UseWorkPlaceAddressForJoblog,summary_PostingCreated,summary_LastDateApplication,summary_FormattedLastDateApplication,summary_AssignmentStartDate,summary_IsHotjob,summary_IsExternal,summary_Url,summary_Region,summary_Municipality,summary_Country,summary_PostalCode,summary_PostalCodeName,summary_JobAnnouncementType,summary_EmploymentType,summary_WorkHours,summary_OccupationArea,summary_OccupationGroup,summary_Occupation,summary_Location_Latitude,summary_Location_Longitude,summary_JoblogWorkTime_WorkHour,summary_JoblogWorkTime_DailyWorkTime,summary_WorkplaceID,summary_OrganisationId,summary_HiringOrgCVR,summary_UserLoggedIn,summary_AnonymousEmployer,summary_ShareUrl,summary_DetailsUrl,summary_JobLogUrl,summary_HasLocationValues,summary_ID,summary_Latitude,summary_Longitude,details_WorkSchedule,details_WorkConditions,details_EmploymentTypes,details_WorkPlace_Name,details_WorkPlace_Address_AddressLine,details_WorkPlace_Address_Country_Id,details_WorkPlace_Address_Country_Name,details_WorkPlace_Address_Municipality_Id,details_WorkPlace_Address_Municipality_Name,details_WorkPlace_Address_Region_Id,details_WorkPlace_Address_Region_Name,details_WorkPlace_Address_PostalCode,details_WorkPlace_Address_City,details_WorkPlace_PhoneNumber_Number,details_WorkPlace_PhoneNumber_Type,details_WorkPlace_PhoneNumber_Description,details_WorkPlace_FaxNumber,details_WorkPlace_Email,details_WorkPlace_WebAddress,details_WorkPlace_Description,details_WorkPlace_Logo,details_WorkPlace_WorkPlaceOrganizationNumber,details_WorkPlace_OrganizationNumber,details_WorkPlace_OrganizationDescription,details_JobPositionPosting_Id,details_JobPositionPosting_OriginalJppId,details_JobPositionPosting_HiringOrg_Name,details_JobPositionPosting_HiringOrg_Address_AddressLine,details_JobPositionPosting_HiringOrg_Address_Country_Id,details_JobPositionPosting_HiringOrg_Address_Country_Name,details_JobPositionPosting_HiringOrg_Address_Municipality_Id,details_JobPositionPosting_HiringOrg_Address_Municipality_Name,details_JobPositionPosting_HiringOrg_Address_Region_Id,details_JobPositionPosting_HiringOrg_Address_Region_Name,details_JobPositionPosting_HiringOrg_Address_PostalCode,details_JobPositionPosting_HiringOrg_Address_City,details_JobPositionPosting_HiringOrg_PhoneNumber_Number,details_JobPositionPosting_HiringOrg_PhoneNumber_Type,details_JobPositionPosting_HiringOrg_PhoneNumber_Description,details_JobPositionPosting_HiringOrg_FaxNumber,details_JobPositionPosting_HiringOrg_Email,details_JobPositionPosting_HiringOrg_WebAddress,details_JobPositionPosting_HiringOrg_Description,details_JobPositionPosting_HiringOrg_Logo,details_JobPositionPosting_HiringOrg_WorkPlaceOrganizationNumber,details_JobPositionPosting_HiringOrg_OrganizationNumber,details_JobPositionPosting_HiringOrg_OrganizationDescription,details_JobPositionPosting_RecruitingCompany,details_JobPositionPosting_PublicationStartDate,details_JobPositionPosting_PublicationEndDate,details_JobPositionPosting_JobPositionInformation_PositionTitle,details_JobPositionPosting_JobPositionInformation_Purpose,details_JobPositionPosting_JobPositionInformation_WorkLocation_AddressLine,details_JobPositionPosting_JobPositionInformation_WorkLocation_Country_Id,details_JobPositionPosting_JobPositionInformation_WorkLocation_Country_Name,details_JobPositionPosting_JobPositionInformation_WorkLocation_Municipality_Id,details_JobPositionPosting_JobPositionInformation_WorkLocation_Municipality_Name,details_JobPositionPosting_JobPositionInformation_WorkLocation_Region_Id,details_JobPositionPosting_JobPositionInformation_WorkLocation_Region_Name,details_JobPositionPosting_JobPositionInformation_WorkLocation_PostalCode,details_JobPositionPosting_JobPositionInformation_WorkLocation_City,details_JobPositionPosting_JobPositionInformation_EmploymentType,details_JobPositionPosting_JobPositionInformation_WeeklyWorkHours_TypeId,details_JobPositionPosting_JobPositionInformation_WeeklyWorkHours_TypeName,details_JobPositionPosting_JobPositionInformation_WeeklyWorkHours_Description,details_JobPositionPosting_JobPositionInformation_CompensationDescription,details_JobPositionPosting_JobPositionInformation_NumberToFill,details_JobPositionPosting_JobPositionInformation_DriverLicense,details_JobPositionPosting_JobPositionInformation_Occupation_DiscoWeb,details_JobPositionPosting_JobPositionInformation_Occupation_AlternateNames,details_JobPositionPosting_JobPositionInformation_Occupation_GroupId,details_JobPositionPosting_JobPositionInformation_Occupation_AreaId,details_JobPositionPosting_JobPositionInformation_Occupation_Id,details_JobPositionPosting_JobPositionInformation_Occupation_Name,details_JobPositionPosting_JobPositionInformation_IsGovernmentHiring,details_JobPositionPosting_JobPositionInformation_JppContacts,details_JobPositionPosting_JobPositionInformation_EmploymentDate,details_JobPositionPosting_IsRecruitmentOfForeignNationals,details_JobPositionPosting_IsWorkInDenmark,details_JobPositionPosting_IsAnonymousEmployer,details_JobPositionPosting_IsDisabilityFriendly,details_JobPositionPosting_JppType,details_JobPositionPosting_ApplicationDetails_WorkHourMax,details_JobPositionPosting_ApplicationDetails_WorkHourMin,details_JobPositionPosting_ApplicationDetails_DailyWorkTimeWeekend,details_JobPositionPosting_ApplicationDetails_DailyWorkTimeNight,details_JobPositionPosting_ApplicationDetails_DailyWorkTimeEvening,details_JobPositionPosting_ApplicationDetails_DailyWorkTimeDay,details_JobPositionPosting_ApplicationDetails_ReferenceText,details_JobPositionPosting_ApplicationDetails_RemarksToApplicant,details_JobPositionPosting_ApplicationDetails_ByEmail,details_JobPositionPosting_ApplicationDetails_ByPhone,details_JobPositionPosting_ApplicationDetails_ApplyViaUrl,details_JobPositionPosting_ApplicationDetails_ReplyInWriting,details_JobPositionPosting_ApplicationDetails_ApplicationDeadlineDate,details_JobPositionPosting_ContactAuthorityPhoneNumber_Number,details_JobPositionPosting_ContactAuthorityPhoneNumber_Type,details_JobPositionPosting_ContactAuthorityPhoneNumber_Description,details_JobPositionPosting_Status,details_LogoUrl,details_Address,details_ShowMap,details_ShowShareButtonJobLog,details_JobLogUrl,details_JobLogTemplateModel_Identifier,details_JobLogTemplateModel_UseWorkPlaceAddressForJoblog,details_JobLogTemplateModel_Category,details_JobLogTemplateModel_CvCustomerIdentifier,details_JobLogTemplateModel_JobSeekingStatus,details_JobLogTemplateModel_Title,details_JobLogTemplateModel_IsApplicationSourceRequired,details_JobLogTemplateModel_ApplicationSource,details_JobLogTemplateModel_IsWeeklyWorkTimeRequired,details_JobLogTemplateModel_WeeklyWorkTime,details_JobLogTemplateModel_HoursPerWeek,details_JobLogTemplateModel_JobnetJobPostingIdentifier,details_JobLogTemplateModel_JobAdDocument_Title,details_JobLogTemplateModel_JobAdDocument_Identifier,details_JobLogTemplateModel_JobAdDocument_IsDeletedBySystem,details_JobLogTemplateModel_JobAdDocument_IsDeletedByUser,details_JobLogTemplateModel_JobAdFile,details_JobLogTemplateModel_Company_JobLogEntryCategory,details_JobLogTemplateModel_Company_ShowAddressFieldsEvenIfEmpty,details_JobLogTemplateModel_Company_Name,details_JobLogTemplateModel_Company_Address,details_JobLogTemplateModel_Company_Country,details_JobLogTemplateModel_Company_EmploymentAreaID,details_JobLogTemplateModel_Company_PostCode,details_JobLogTemplateModel_Company_IsCountryAndTownAndPostCodeEmpty,details_JobLogTemplateModel_Company_IsTownAndPostCodeEmpty,details_JobLogTemplateModel_Company_IsCountryDanmark,details_JobLogTemplateModel_Company_Town,details_JobLogTemplateModel_Company_ContactPerson,details_JobLogTemplateModel_Company_Phone,details_JobLogTemplateModel_Company_Email,details_JobLogTemplateModel_Company_Latitude,details_JobLogTemplateModel_Company_Longitude,details_JobLogTemplateModel_Company_DailyTravelTimeInMinutes,details_JobLogTemplateModel_Company_DistanceToCompanyInMeters,details_JobLogTemplateModel_Company_IsCreateMode,details_JobLogTemplateModel_TypeOfSubmission,details_JobLogTemplateModel_SubmissionDate,details_JobLogTemplateModel_SubmissionDateFormatted,details_JobLogTemplateModel_SubmissionDateTiks,details_JobLogTemplateModel_IsSubmissionDateRequired,details_JobLogTemplateModel_Status,details_JobLogTemplateModel_DateCreatedFormatted,details_JobLogTemplateModel_DateCreated,details_JobLogTemplateModel_DateModifiedFormatted,details_JobLogTemplateModel_DateModified,details_JobLogTemplateModel_LastModifiedDateTiks,details_JobLogTemplateModel_DateClosed,details_JobLogTemplateModel_JobApplicationDocument_Title,details_JobLogTemplateModel_JobApplicationDocument_Identifier,details_JobLogTemplateModel_JobApplicationDocument_IsDeletedBySystem,details_JobLogTemplateModel_JobApplicationDocument_IsDeletedByUser,details_JobLogTemplateModel_CvDocument_Title,details_JobLogTemplateModel_CvDocument_Identifier,details_JobLogTemplateModel_CvDocument_IsDeletedBySystem,details_JobLogTemplateModel_CvDocument_IsDeletedByUser,details_JobLogTemplateModel_JobApplicationFile,details_JobLogTemplateModel_CvFile,details_JobLogTemplateModel_SubmissionDeadlineDate,details_JobLogTemplateModel_IsPersisted,details_JobLogTemplateModel_ServerValidationErrors,details_JobLogTemplateModel_HasServerValidationErrors,details_JoblogWorkTime_WorkHour,details_JoblogWorkTime_DailyWorkTime,details_Place,details_OpenPrintDialog,details_WorkPlaceInfoText,details_JobCenterContactDetails,details_WorkPlaceDescriptionText,details_FavoriteText,details_IsFavorite,details_ShowFavorite,details_MetaOgTextForSharing,details_DescriptionForSharing,details_TitleForSharing,details_RutePlan,details_FormattedPurpose,details_MapUrl,details_OrganizationNumber,details_ShowSearchJobButton,details_ShowPrint,details_BackToFindWorkButtonUrl,isExternal
0,False,1,Spændende og udfordrende stilling som udbudskonsulent i Herning,Spændende og udfordrende stilling som udbudskonsulent i Herning,"Brænder du for at arbejde med offentligt indkøb, og motiverer det dig at bruge din faglighed til at rådgive om og facilitere udbud og indkøb? Vi leder efter en ny udbudskonsulent, som har","Skatteforvaltningen, Herning",Brændgårdvej 10,7400,Herning,False,False,False,True,2022-05-05T00:00:00,2022-05-22T00:00:00,22. maj 2022,0001-01-01T00:00:00,False,False,https://job.jobnet.dk/CV/FindWork/Details/5591262,Midtjylland,Herning,Danmark,7400,,,,Fuldtid,Akademisk arbejde,Administrativt arbejde,Fuldmægtig,56.1503,8.9679,,,115703,6998,19552101,False,False,https://job.jobnet.dk/CV/FindWork/DetailsSocialmedia/5591262,https://job.jobnet.dk/CV/FindWork/Details/5591262,https://job.jobnet.dk/CV/FindWork/Details/5591262,True,5591262,56.1503,8.9679,"{'Id': 1, 'Name': 'Fuldtid'}, {'Id': 16, 'Name': 'Deltid'}","{'Id': 1, 'Name': 'Almindelige vilkår'}, {'Id': 2, 'Name': 'Fleksjob'}, {'Id': 3, 'Name': 'Skånejob'}, {'Id': 4, 'Name': 'Egnet til efterlønnere og seniorer'}, {'Id': 5, 'Name': 'Job med løntilskud'}, {'Id': 6, 'Name': 'Rotationsjob'}, {'Id': 7, 'Name': 'Virksomhedspraktik'}","{'Id': 1, 'Name': 'Fastansættelse'}, {'Id': 16, 'Name': 'Tidsbegrænset ansættelse'}","Skatteforvaltningen, Herning",Brændgårdvej 10,58,Danmark,657,Herning,2,Midtjylland,7400,Herning,72371929,0,Primary,,,,None,115703,1003388977,19552101,"Skatteforvaltningen varetager en vigtig samfundsopgave. Vi opkræver hvert år de ca. 950 mia. kr. i skatter og afgifter, som er fundamentet for finansieringen af det danske samfund. Hos os får du derfor mulighed for at tage ansvar for en vigtig opgave og gøre en forskel. Vi har brug for ansatte med mange forskellige faglige kompetencer, og bredden i opgaverne giver også den enkelte mulighed for at få faglige udfordringer og udvikle sig. 

Er du vores nye kollega?",5591262,5591262,"Skatteforvaltningen, Herning",Brændgårdvej 10,58,Danmark,657,Herning,2,Midtjylland,7400,Herning,72371929,0,Primary,,,,None,115703,1003388977,19552101,"Skatteforvaltningen varetager en vigtig samfundsopgave. Vi opkræver hvert år de ca. 950 mia. kr. i skatter og afgifter, som er fundamentet for finansieringen af det danske samfund. Hos os får du derfor mulighed for at tage ansvar for en vigtig opgave og gøre en forskel. Vi har brug for ansatte med mange forskellige faglige kompetencer, og bredden i opgaverne giver også den enkelte mulighed for at få faglige udfordringer og udvikle sig. 

Er du vores nye kollega?",,2022-05-05T00:00:00,2022-05-22T00:00:00,Spændende og udfordrende stilling som udbudskonsulent i Herning,"Brænder du for at arbejde med offentligt indkøb, og motiverer det dig at bruge din faglighed til at rådgive om og facilitere udbud og indkøb?  Vi leder efter en ny udbudskonsulent, som har en kommerciel forståelse, gode kommunikationsevner og personlig gennemslagskraft.   Stillingen er placeret i kontoret, Indkøb og Udbud hos Administrations- og Servicestyrelsen.   Til vores kontor for Indkøb og Udbud i Administrations- og Servicestyrelsen søger vi en udbudskonsulent, som skal være med til at sikre, at aftalerne indgås indenfor de juridiske rammer, og at Skatteministeriets koncern får de bedste aftaler til de bedste priser.   Gennemførelse af EU-udbud:  Du bliver en del af den service, vi yder til de øvrige styrelser i Skatteministeriets koncern vedr. rådgivning, anvendelse af centrale indkøbsaftaler samt gennemførelse af konkurrenceudsættelse herunder EU-udbud.   Vi forestiller os, at dine opgaver hovedsageligt vil ligge inden for følgende områder:     Vejlede kunder om indkøbsmuligheder i henhold til ”Cirkulære om indkøb i staten”   Indkøb på markedsmæssige vilkår herunder tilbudsindhentninger   Miniudbud og tildeling via SKI og ØS aftaler   Ad hoc opgaver i forbindelse med udbud bl.a. udbudsjuridisk rådgivning   Projektleder og ansvarlig for udbudsprocesser   Foretage indkøbsanalyser af områder, der skal konkurrenceudsættes   Afdække markedet gennem markedsdialog   Udarbejde kravspecifikationer i samarbejde med nedsatte arbejdsgrupper   Notatskrivning og sagsfremstillinger til ledelsen   Dokumentere involvering og godkendelse i henhold til gældende processer     Opgavernes art vil afhænge af dine erfaringer med offentlige indkøb og udbud. Du skal påregne at størstedelen af dine opgaver vil have karakter af indkøb under udbudsgrænsen.   Kommerciel og faglig stærk udbudskonsulent  Vi ser gerne, at du har en uddannelsesmæssig baggrund som cand.merc.jur., men dette er ikke et krav. Flere års erfaring med offentligt indkøb og gennemførelse af EU-udbud vil blive prioriteret. Det vigtigste er, at du har både et juridisk og et kommercielt fokus i gennemførelsen af indkøb, ligesom ansvarlighed i opgaveløsningen er vigtig.   Du trives med at levere en høj grad af service og at sætte interne kunder og brugere i fokus. Du har et tværorganisatorisk helhedsperspektiv for den bedste opgaveløsning og bidrager som kollega til den gode stemning.   Du er engageret, serviceminded og løsningsorienteret. Som kommunikator er du modtagerorienteret og både mundtligt og skriftligt god til at formulere og formidle kernen i sagen til forskellige faggrupper.   Du trives med løbende at have gang i flere forskelligartede opgaver.   Hvis du, ud over at kunne nikke til ovenstående, af natur er robust og i besiddelse af et godt humør samtidig med, at du trives med et højt tempo, er det dig, vi mangler i vores team.   Indkøb og Udbud – dit nye kontor  Kontoret er Skatteforvaltningens centrale indkøbsenhed bestående af 18 engagerede medarbejdere. Vi gennemfører indkøb og udbud på tværs af koncernen. Kontoret har til formål at sikre, at indkøb gennemføres således, at Statens indkøbspolitik og gældende udbudslovgivning overholdes, og at vi køber kommercielt fordelagtigt ind. Vi indkøber for ca. 1 mia. kr. årligt og indgik i 2021 ca. 156 kontrakter. Kontoret består af et udbudsteam, et indkøbsteam og et kontraktstyringsteam, der arbejder tæt sammen om at løse de koncernfælles indkøbs- og udbudsopgaver af alle varer og tjenesteydelser med undtagelse af IT.   Holdånd og stærkt fagligt miljø  Efter en grundig introduktion kan du se frem til en hverdag i en dynamisk organisation, hvor der er fokus på at løfte i flok, hvor der er gode muligheder for at lære nyt, og hvor du vil gøre en forskel sammen med faglig dygtige kollegaer. Det kræver engagement og indsats. Lyder det som dig, vil vi glæde os til at modtage din ansøgning.   Ansøgning og kontakt  Ansøgning med CV og eksamensbevis bedes sendt via linket ”Søg stillingen” senest den 22. maj 2022. Spørgsmål besvares gerne af kontorchef Anette Christiansen på tlf. nr. 72 37 19 29.   Vi holder første runde samtaler i uge 21 og 22. Der kan indgå en logik test og en personanalyse i ansættelsesforløbet. Anden runde samtale er planlagt til uge 23.   Forventet tiltrædelse er 1. august eller snarest muligt.   Du bliver ansat på overenskomstvilkår i henhold til enhver tid gældende overenskomst for akademikere i staten (AC), overenskomst for kontorfunktionærer, laboranter og It-medarbejdere (HK) eller overenskomst for Fuldmægtige m.fl. (DTS) i Skatteministeriet.   Der vil forud for ansættelsen blive trukket referencer og indhentet straffeattest.   Du bliver ansat i Skatteministeriet med tilhørende institutioner. Dit arbejdssted bliver Brændgårdvej 10, 7400 Herning.   Administrations- og Servicestyrelsen opfordrer alle kvalificerede uanset alder, køn, religion eller etnisk tilhørsforhold til at søge stillingen.",Brændgårdvej 10,58,Danmark,657,Herning,2,Midtjylland,7400,Herning,1,1,Fuldtid,None,None,1,,0,,0,0,0,,False,"{'Id': 7962346, 'Email': None, 'FaxNumber': None, 'PersonName': 'Anette Christiansen', 'FirstName': 'Anette', 'LastName': 'Christiansen', 'PositionTitle': None, 'PhoneNumbers': [{'Number': '72371929', 'Type': 0, 'Description': 'Hovednummer'}]}",2022-08-01T00:00:00,False,False,False,False,4,,,False,False,False,False,,,,,https://candidate.hr-manager.net/ApplicationInit.aspx?cid=5001&ProjectId=155956&DepartmentId=9413&MediaId=2872&SkipAdvertisement=true,False,2022-05-22T00:00:00,,0,Primary,7,/CV/FindWork/GetLogo?JobAdId=5591262&WorkPlace=115703&Organisation=19552101,"Brændgårdvej 10,7400, Herning",True,False,"/CV/Jobseeking/JobLog/CreateJobSearch?JobnetJobPostingIdentifier=5591262&Company.Name=Skatteforvaltningen, Herning&SubmissionDeadlineDate=2022-5-22&Title=Spændende og udfordrende stilling som udbudskonsulent i Herning&WeeklyWorkTime=1",00000000-0000-0000-0000-000000000000,False,0,,,Spændende og udfordrende stilling som udbudskonsulent i Herning,True,,True,1,,5591262,,,False,False,,0,False,"Skatteforvaltningen, Herning",Brændgårdvej 10,,,7400,False,False,False,Herning,Anette Christiansen,72371929,,,,,,False,,2022-05-22T00:00:00,,0,False,0,,,,,0,,,,False,False,,,False,False,,,,False,,False,,,Arbejdspladsen ligger i Herning kommune,False,"Skatteforvaltningen, Herning",,"Skatteforvaltningen varetager en vigtig samfundsopgave. Vi opkræver hvert år de ca. 950 mia. kr. i skatter og afgifter, som er fundamentet for finansieringen af det danske samfund. Hos os får du derfor mulighed for at tage ansvar for en vigtig opgave og gøre en forskel. Vi har brug for ansatte med mange forskellige faglige kompetencer, og bredden i opgaverne giver også den enkelte mulighed for at få faglige udfordringer og udvikle sig. 

Er du vores nye kollega?",,False,False,"Brænder du for at arbejde med offentligt indkøb, og motiverer det dig at bruge din faglighed til at rådgive om og facilitere udbud og indkøb? Vi leder efter en ny udbudskonsulent, som har en kommerciel forståelse, gode kommunikationsevner og personlig gennemslagskraft. Stillingen er placeret i kontoret, Indkøb og Udbud hos Administrations- og Servi","""Brænder du for at arbejde med offentligt indkøb, og motiverer det dig at bruge din faglighed til at rådgive om og facilitere udbud og indkøb? Vi leder efter en ny udbudskonsulent, som har en kommerciel forståelse, gode kommunikationsevner og personlig gennemslagskraft. Stillingen er placeret i kontoret, Indkøb og Udbud hos Administrations- og Servi""","""Spændende og udfordrende stilling som udbudskonsulent i Herning""","https://www.google.dk/maps/dir//Brændgårdvej+10,7400,+Herning/","Brænder du for at arbejde med offentligt indkøb, og motiverer det dig at bruge din faglighed til at rådgive om og facilitere udbud og indkøb?  Vi leder efter en ny udbudskonsulent, som har en kommerciel forståelse, gode kommunikationsevner og personlig gennemslagskraft.   Stillingen er placeret i kontoret, Indkøb og Udbud hos Administrations- og Servicestyrelsen.   Til vores kontor for Indkøb og Udbud i Administrations- og Servicestyrelsen søger vi en udbudskonsulent, som skal være med til at sikre, at aftalerne indgås indenfor de juridiske rammer, og at Skatteministeriets koncern får de bedste aftaler til de bedste priser.   Gennemførelse af EU-udbud:  Du bliver en del af den service, vi yder til de øvrige styrelser i Skatteministeriets koncern vedr. rådgivning, anvendelse af centrale indkøbsaftaler samt gennemførelse af konkurrenceudsættelse herunder EU-udbud.   Vi forestiller os, at dine opgaver hovedsageligt vil ligge inden for følgende områder:     Vejlede kunder om indkøbsmuligheder i henhold til ”Cirkulære om indkøb i staten”   Indkøb på markedsmæssige vilkår herunder tilbudsindhentninger   Miniudbud og tildeling via SKI og ØS aftaler   Ad hoc opgaver i forbindelse med udbud bl.a. udbudsjuridisk rådgivning   Projektleder og ansvarlig for udbudsprocesser   Foretage indkøbsanalyser af områder, der skal konkurrenceudsættes   Afdække markedet gennem markedsdialog   Udarbejde kravspecifikationer i samarbejde med nedsatte arbejdsgrupper   Notatskrivning og sagsfremstillinger til ledelsen   Dokumentere involvering og godkendelse i henhold til gældende processer     Opgavernes art vil afhænge af dine erfaringer med offentlige indkøb og udbud. Du skal påregne at størstedelen af dine opgaver vil have karakter af indkøb under udbudsgrænsen.   Kommerciel og faglig stærk udbudskonsulent  Vi ser gerne, at du har en uddannelsesmæssig baggrund som cand.merc.jur., men dette er ikke et krav. Flere års erfaring med offentligt indkøb og gennemførelse af EU-udbud vil blive prioriteret. Det vigtigste er, at du har både et juridisk og et kommercielt fokus i gennemførelsen af indkøb, ligesom ansvarlighed i opgaveløsningen er vigtig.   Du trives med at levere en høj grad af service og at sætte interne kunder og brugere i fokus. Du har et tværorganisatorisk helhedsperspektiv for den bedste opgaveløsning og bidrager som kollega til den gode stemning.   Du er engageret, serviceminded og løsningsorienteret. Som kommunikator er du modtagerorienteret og både mundtligt og skriftligt god til at formulere og formidle kernen i sagen til forskellige faggrupper.   Du trives med løbende at have gang i flere forskelligartede opgaver.   Hvis du, ud over at kunne nikke til ovenstående, af natur er robust og i besiddelse af et godt humør samtidig med, at du trives med et højt tempo, er det dig, vi mangler i vores team.   Indkøb og Udbud – dit nye kontor  Kontoret er Skatteforvaltningens centrale indkøbsenhed bestående af 18 engagerede medarbejdere. Vi gennemfører indkøb og udbud på tværs af koncernen. Kontoret har til formål at sikre, at indkøb gennemføres således, at Statens indkøbspolitik og gældende udbudslovgivning overholdes, og at vi køber kommercielt fordelagtigt ind. Vi indkøber for ca. 1 mia. kr. årligt og indgik i 2021 ca. 156 kontrakter. Kontoret består af et udbudsteam, et indkøbsteam og et kontraktstyringsteam, der arbejder tæt sammen om at løse de koncernfælles indkøbs- og udbudsopgaver af alle varer og tjenesteydelser med undtagelse af IT.   Holdånd og stærkt fagligt miljø  Efter en grundig introduktion kan du se frem til en hverdag i en dynamisk organisation, hvor der er fokus på at løfte i flok, hvor der er gode muligheder for at lære nyt, og hvor du vil gøre en forskel sammen med faglig dygtige kollegaer. Det kræver engagement og indsats. Lyder det som dig, vil vi glæde os til at modtage din ansøgning.   Ansøgning og kontakt  Ansøgning med CV og eksamensbevis bedes sendt via linket ”Søg stillingen” senest den 22. maj 2022. Spørgsmål besvares gerne af kontorchef Anette Christiansen på tlf. nr. 72 37 19 29.   Vi holder første runde samtaler i uge 21 og 22. Der kan indgå en logik test og en personanalyse i ansættelsesforløbet. Anden runde samtale er planlagt til uge 23.   Forventet tiltrædelse er 1. august eller snarest muligt.   Du bliver ansat på overenskomstvilkår i henhold til enhver tid gældende overenskomst for akademikere i staten (AC), overenskomst for kontorfunktionærer, laboranter og It-medarbejdere (HK) eller overenskomst for Fuldmægtige m.fl. (DTS) i Skatteministeriet.   Der vil forud for ansættelsen blive trukket referencer og indhentet straffeattest.   Du bliver ansat i Skatteministeriet med tilhørende institutioner. Dit arbejdssted bliver Brændgårdvej 10, 7400 Herning.   Administrations- og Servicestyrelsen opfordrer alle kvalificerede uanset alder, køn, religion eller etnisk tilhørsforhold til at søge stillingen.","https://www.google.dk/maps/place/Brændgårdvej+10,7400,+Herning/",19552101,False,False,,False
