summary_AutomatchType,summary_Abroad,summary_Weight,summary_Title,summary_JobHeadline,summary_Presentation,summary_HiringOrgName,summary_WorkPlaceAddress,summary_WorkPlacePostalCode,summary_WorkPlaceCity,summary_WorkPlaceOtherAddress,summary_WorkPlaceAbroad,summary_WorkPlaceNotStatic,summary_UseWorkPlaceAddressForJoblog,summary_PostingCreated,summary_LastDateApplication,summary_FormattedLastDateApplication,summary_AssignmentStartDate,summary_IsHotjob,summary_IsExternal,summary_Url,summary_Region,summary_Municipality,summary_Country,summary_PostalCode,summary_PostalCodeName,summary_JobAnnouncementType,summary_EmploymentType,summary_WorkHours,summary_OccupationArea,summary_OccupationGroup,summary_Occupation,summary_Location_Latitude,summary_Location_Longitude,summary_JoblogWorkTime_WorkHour,summary_JoblogWorkTime_DailyWorkTime,summary_WorkplaceID,summary_OrganisationId,summary_HiringOrgCVR,summary_UserLoggedIn,summary_AnonymousEmployer,summary_ShareUrl,summary_DetailsUrl,summary_JobLogUrl,summary_HasLocationValues,summary_ID,summary_Latitude,summary_Longitude,details_WorkSchedule,details_WorkConditions,details_EmploymentTypes,details_WorkPlace_Name,details_WorkPlace_Address_AddressLine,details_WorkPlace_Address_Country_Id,details_WorkPlace_Address_Country_Name,details_WorkPlace_Address_Municipality_Id,details_WorkPlace_Address_Municipality_Name,details_WorkPlace_Address_Region_Id,details_WorkPlace_Address_Region_Name,details_WorkPlace_Address_PostalCode,details_WorkPlace_Address_City,details_WorkPlace_PhoneNumber_Number,details_WorkPlace_PhoneNumber_Type,details_WorkPlace_PhoneNumber_Description,details_WorkPlace_FaxNumber,details_WorkPlace_Email,details_WorkPlace_WebAddress,details_WorkPlace_Description,details_WorkPlace_Logo,details_WorkPlace_WorkPlaceOrganizationNumber,details_WorkPlace_OrganizationNumber,details_WorkPlace_OrganizationDescription,details_JobPositionPosting_Id,details_JobPositionPosting_OriginalJppId,details_JobPositionPosting_HiringOrg_Name,details_JobPositionPosting_HiringOrg_Address_AddressLine,details_JobPositionPosting_HiringOrg_Address_Country_Id,details_JobPositionPosting_HiringOrg_Address_Country_Name,details_JobPositionPosting_HiringOrg_Address_Municipality_Id,details_JobPositionPosting_HiringOrg_Address_Municipality_Name,details_JobPositionPosting_HiringOrg_Address_Region_Id,details_JobPositionPosting_HiringOrg_Address_Region_Name,details_JobPositionPosting_HiringOrg_Address_PostalCode,details_JobPositionPosting_HiringOrg_Address_City,details_JobPositionPosting_HiringOrg_PhoneNumber_Number,details_JobPositionPosting_HiringOrg_PhoneNumber_Type,details_JobPositionPosting_HiringOrg_PhoneNumber_Description,details_JobPositionPosting_HiringOrg_FaxNumber,details_JobPositionPosting_HiringOrg_Email,details_JobPositionPosting_HiringOrg_WebAddress,details_JobPositionPosting_HiringOrg_Description,details_JobPositionPosting_HiringOrg_Logo,details_JobPositionPosting_HiringOrg_WorkPlaceOrganizationNumber,details_JobPositionPosting_HiringOrg_OrganizationNumber,details_JobPositionPosting_HiringOrg_OrganizationDescription,details_JobPositionPosting_RecruitingCompany,details_JobPositionPosting_PublicationStartDate,details_JobPositionPosting_PublicationEndDate,details_JobPositionPosting_JobPositionInformation_PositionTitle,details_JobPositionPosting_JobPositionInformation_Purpose,details_JobPositionPosting_JobPositionInformation_WorkLocation_AddressLine,details_JobPositionPosting_JobPositionInformation_WorkLocation_Country_Id,details_JobPositionPosting_JobPositionInformation_WorkLocation_Country_Name,details_JobPositionPosting_JobPositionInformation_WorkLocation_Municipality_Id,details_JobPositionPosting_JobPositionInformation_WorkLocation_Municipality_Name,details_JobPositionPosting_JobPositionInformation_WorkLocation_Region_Id,details_JobPositionPosting_JobPositionInformation_WorkLocation_Region_Name,details_JobPositionPosting_JobPositionInformation_WorkLocation_PostalCode,details_JobPositionPosting_JobPositionInformation_WorkLocation_City,details_JobPositionPosting_JobPositionInformation_EmploymentType,details_JobPositionPosting_JobPositionInformation_WeeklyWorkHours_TypeId,details_JobPositionPosting_JobPositionInformation_WeeklyWorkHours_TypeName,details_JobPositionPosting_JobPositionInformation_WeeklyWorkHours_Description,details_JobPositionPosting_JobPositionInformation_CompensationDescription,details_JobPositionPosting_JobPositionInformation_NumberToFill,details_JobPositionPosting_JobPositionInformation_DriverLicense,details_JobPositionPosting_JobPositionInformation_Occupation_DiscoWeb,details_JobPositionPosting_JobPositionInformation_Occupation_AlternateNames,details_JobPositionPosting_JobPositionInformation_Occupation_GroupId,details_JobPositionPosting_JobPositionInformation_Occupation_AreaId,details_JobPositionPosting_JobPositionInformation_Occupation_Id,details_JobPositionPosting_JobPositionInformation_Occupation_Name,details_JobPositionPosting_JobPositionInformation_IsGovernmentHiring,details_JobPositionPosting_JobPositionInformation_JppContacts,details_JobPositionPosting_JobPositionInformation_EmploymentDate,details_JobPositionPosting_IsRecruitmentOfForeignNationals,details_JobPositionPosting_IsWorkInDenmark,details_JobPositionPosting_IsAnonymousEmployer,details_JobPositionPosting_IsDisabilityFriendly,details_JobPositionPosting_JppType,details_JobPositionPosting_ApplicationDetails_WorkHourMax,details_JobPositionPosting_ApplicationDetails_WorkHourMin,details_JobPositionPosting_ApplicationDetails_DailyWorkTimeWeekend,details_JobPositionPosting_ApplicationDetails_DailyWorkTimeNight,details_JobPositionPosting_ApplicationDetails_DailyWorkTimeEvening,details_JobPositionPosting_ApplicationDetails_DailyWorkTimeDay,details_JobPositionPosting_ApplicationDetails_ReferenceText,details_JobPositionPosting_ApplicationDetails_RemarksToApplicant,details_JobPositionPosting_ApplicationDetails_ByEmail,details_JobPositionPosting_ApplicationDetails_ByPhone,details_JobPositionPosting_ApplicationDetails_ApplyViaUrl,details_JobPositionPosting_ApplicationDetails_ReplyInWriting,details_JobPositionPosting_ApplicationDetails_ApplicationDeadlineDate,details_JobPositionPosting_ContactAuthorityPhoneNumber_Number,details_JobPositionPosting_ContactAuthorityPhoneNumber_Type,details_JobPositionPosting_ContactAuthorityPhoneNumber_Description,details_JobPositionPosting_Status,details_LogoUrl,details_Address,details_ShowMap,details_ShowShareButtonJobLog,details_JobLogUrl,details_JobLogTemplateModel_Identifier,details_JobLogTemplateModel_UseWorkPlaceAddressForJoblog,details_JobLogTemplateModel_Category,details_JobLogTemplateModel_CvCustomerIdentifier,details_JobLogTemplateModel_JobSeekingStatus,details_JobLogTemplateModel_Title,details_JobLogTemplateModel_IsApplicationSourceRequired,details_JobLogTemplateModel_ApplicationSource,details_JobLogTemplateModel_IsWeeklyWorkTimeRequired,details_JobLogTemplateModel_WeeklyWorkTime,details_JobLogTemplateModel_HoursPerWeek,details_JobLogTemplateModel_JobnetJobPostingIdentifier,details_JobLogTemplateModel_JobAdDocument_Title,details_JobLogTemplateModel_JobAdDocument_Identifier,details_JobLogTemplateModel_JobAdDocument_IsDeletedBySystem,details_JobLogTemplateModel_JobAdDocument_IsDeletedByUser,details_JobLogTemplateModel_JobAdFile,details_JobLogTemplateModel_Company_JobLogEntryCategory,details_JobLogTemplateModel_Company_ShowAddressFieldsEvenIfEmpty,details_JobLogTemplateModel_Company_Name,details_JobLogTemplateModel_Company_Address,details_JobLogTemplateModel_Company_Country,details_JobLogTemplateModel_Company_EmploymentAreaID,details_JobLogTemplateModel_Company_PostCode,details_JobLogTemplateModel_Company_IsCountryAndTownAndPostCodeEmpty,details_JobLogTemplateModel_Company_IsTownAndPostCodeEmpty,details_JobLogTemplateModel_Company_IsCountryDanmark,details_JobLogTemplateModel_Company_Town,details_JobLogTemplateModel_Company_ContactPerson,details_JobLogTemplateModel_Company_Phone,details_JobLogTemplateModel_Company_Email,details_JobLogTemplateModel_Company_Latitude,details_JobLogTemplateModel_Company_Longitude,details_JobLogTemplateModel_Company_DailyTravelTimeInMinutes,details_JobLogTemplateModel_Company_DistanceToCompanyInMeters,details_JobLogTemplateModel_Company_IsCreateMode,details_JobLogTemplateModel_TypeOfSubmission,details_JobLogTemplateModel_SubmissionDate,details_JobLogTemplateModel_SubmissionDateFormatted,details_JobLogTemplateModel_SubmissionDateTiks,details_JobLogTemplateModel_IsSubmissionDateRequired,details_JobLogTemplateModel_Status,details_JobLogTemplateModel_DateCreatedFormatted,details_JobLogTemplateModel_DateCreated,details_JobLogTemplateModel_DateModifiedFormatted,details_JobLogTemplateModel_DateModified,details_JobLogTemplateModel_LastModifiedDateTiks,details_JobLogTemplateModel_DateClosed,details_JobLogTemplateModel_JobApplicationDocument_Title,details_JobLogTemplateModel_JobApplicationDocument_Identifier,details_JobLogTemplateModel_JobApplicationDocument_IsDeletedBySystem,details_JobLogTemplateModel_JobApplicationDocument_IsDeletedByUser,details_JobLogTemplateModel_CvDocument_Title,details_JobLogTemplateModel_CvDocument_Identifier,details_JobLogTemplateModel_CvDocument_IsDeletedBySystem,details_JobLogTemplateModel_CvDocument_IsDeletedByUser,details_JobLogTemplateModel_JobApplicationFile,details_JobLogTemplateModel_CvFile,details_JobLogTemplateModel_SubmissionDeadlineDate,details_JobLogTemplateModel_IsPersisted,details_JobLogTemplateModel_ServerValidationErrors,details_JobLogTemplateModel_HasServerValidationErrors,details_JoblogWorkTime_WorkHour,details_JoblogWorkTime_DailyWorkTime,details_Place,details_OpenPrintDialog,details_WorkPlaceInfoText,details_JobCenterContactDetails,details_WorkPlaceDescriptionText,details_FavoriteText,details_IsFavorite,details_ShowFavorite,details_MetaOgTextForSharing,details_DescriptionForSharing,details_TitleForSharing,details_RutePlan,details_FormattedPurpose,details_MapUrl,details_OrganizationNumber,details_ShowSearchJobButton,details_ShowPrint,details_BackToFindWorkButtonUrl,isExternal
0,False,1,Studieadjunkter med fokus på undervisning på bacheloruddannelsen på Arkitektskolen Aarhus,Studieadjunkter med fokus på undervisning på bacheloruddannelsen på Arkitektskolen Aarhus,"Arkitektskolen Aarhus opslår et antal stillinger som studieadjunkt. Der er tale om fuldtidsstillinger med fokus på undervisning på skolens tidligste studietrin.
Arkitektskolen uddanner arkit",Arkitektskolen Aarhus,Exners Plads 7,8000,Aarhus C,False,False,False,True,2022-05-06T00:00:00,2022-06-03T00:00:00,3. juni 2022,0001-01-01T00:00:00,False,False,https://job.jobnet.dk/CV/FindWork/Details/5592715,Midtjylland,Aarhus,Danmark,8000,,,,Fuldtid,Akademisk arbejde,"Forskning og universitetsundervisning, naturvidenskab og teknik ",Adjunkt,56.1529,10.1921,,,77635,72420,27120717,False,False,https://job.jobnet.dk/CV/FindWork/DetailsSocialmedia/5592715,https://job.jobnet.dk/CV/FindWork/Details/5592715,https://job.jobnet.dk/CV/FindWork/Details/5592715,True,5592715,56.1529,10.1921,"{'Id': 1, 'Name': 'Fuldtid'}, {'Id': 16, 'Name': 'Deltid'}","{'Id': 1, 'Name': 'Almindelige vilkår'}, {'Id': 2, 'Name': 'Fleksjob'}, {'Id': 3, 'Name': 'Skånejob'}, {'Id': 4, 'Name': 'Egnet til efterlønnere og seniorer'}, {'Id': 5, 'Name': 'Job med løntilskud'}, {'Id': 6, 'Name': 'Rotationsjob'}, {'Id': 7, 'Name': 'Virksomhedspraktik'}","{'Id': 1, 'Name': 'Fastansættelse'}, {'Id': 16, 'Name': 'Tidsbegrænset ansættelse'}",Arkitektskolen Aarhus,Exners Plads 7,58,Danmark,751,Aarhus,2,Midtjylland,8000,Aarhus C,,0,Primary,,,,None,77635,1003405062,27120717,None,5592715,5592715,Arkitektskolen Aarhus,Exners Plads 7,58,Danmark,751,Aarhus,2,Midtjylland,8000,Aarhus C,,0,Primary,,,,None,77635,1003405062,27120717,None,,2022-05-06T00:00:00,2022-06-03T00:00:00,Studieadjunkter med fokus på undervisning på bacheloruddannelsen på Arkitektskolen Aarhus,"Arkitektskolen Aarhus opslår et antal stillinger som studieadjunkt. Der er tale om fuldtidsstillinger med fokus på undervisning på skolens tidligste studietrin. 
 Arkitektskolen uddanner arkitekter på højeste niveau og er blandt en af Europas mest ansete arkitektskoler. Skolens fundament har rod i en skandinavisk arkitekturtradition, hvor social ansvarlighed, rumlig forståelse og håndværk vægtes højt. Og den position ønsker vi at styrke yderligere. 
 Vi søger derfor undervisere, der kan bidrage til at udvikle uddannelsen med udgangspunkt i skolens pædagogik og didaktik indenfor den overordnede vision ”Engaging through Architecture”. 
 Ansøgere til stillingen forventes at deltage i videreudviklingen af arkitektuddannelsen og sikre det begrebslige, arkitektfaglige og metodiske grundlag. Dette grundlag sikrer skolens studerende en god og fagligt ambitiøs start på uddannelsen og er forudsætningen for, at Arkitektskolen Aarhus også i fremtiden kan uddanne stærke kandidater. 
 Vi ønsker stillingerne besat fra den 1. oktober 2022 eller hurtigst muligt derefter. 
 Stillingerne 
 Studieadjunkturer er tidsubegrænsede undervisningsstillinger på fuld tid med arbejdssted på Arkitektskolen Aarhus og indbefatter: 
 
 Undervisning på bacheloruddannelsens tidligste studietrin i samarbejde med skolens uddannelseschef, uddannelseskoordinatorer og videnskabelige medarbejdere. 
 Udvikling af undervisning, herunder kurser og forelæsninger. 
 Deltagelse i generelle opgaver til gavn for institutionen som helhed, herunder bedømmelser, optag af nye studerende samt andre udviklingsprojekter på institutionsniveau. 
 
 Ved ansættelse som studieadjunkt fastsættes der en studieadjunktperiode på op til seks år, hvorinden for studieadjunkten skal indstille sig til bedømmelse af sine undervisningsmæssige kvalifikationer. Er bedømmelsen positiv, overgår studieadjunkten ved udløbet af studieadjunktperioden til ansættelse som studielektor. 
 Løn og ansættelsesvilkår efter AC-fællesoverenskomsten. 
 Dine kvalifikationer 
 Arkitektskolen søger medarbejdere med høj faglighed, gode pædagogiske kompetencer samt evner og lyst til samarbejde. Et anvendeligt netværk i undervisningssammenhæng og relevant undervisningserfaring forventes hos ansøgere. 
 Det forventes ligeledes, at ansøgere har sproglige forudsætninger for at kunne varetage undervisning på dansk og engelsk og kan formulere sig klart inden for fagområdet på de to sprog i både skrift og tale. 
 Ansøgere skal derudover kunne dokumentere: 
 
 Afgang fra en anerkendt arkitektuddannelse 
 Akademisk eller praktisk erfaring med arkitektfaget i form af projekter baseret på undersøgende udviklingsprocesser 
 Undervisningserfaring inden for fagområdet 
 Gode formidlings- og samarbejdsevner 
 
 Hvad vi tilbyder 
 På Arkitektskolen Aarhus tilbyder vi et kreativt og innovativt forsknings- og undervisningsmiljø. Som arkitekturinstitution har vi en lang tradition for at dyrke en lokal tilgang til arkitekturen, samtidig med at vi også har et stærkt internationalt fokus. 
 Vi er lige flyttet ind i Danmarks første nybyggede arkitektskole i hjertet af Aarhus med stærkt udvidede værkstedsfaciliteter, som bidrager til at styrke vores praksisorienterede undervisning og mulighederne for at eksperimentere med materialer og byggetekniske løsninger.  Se de nye faciliteter 
 Som ansat på Arkitektskolen Aarhus vil du komme til at indgå i mange kollegiale sammenhænge, både i større og mindre grupper. Vi tror på, at vi med gensidig anerkendelse og fokus på samarbejde kan skabe de bedste rammer for en attraktiv og levende arbejdsplads. 
 Yderligere Information 
 Spørgsmål om stillingen kan rettes til uddannelseschef Rasmus Grønbæk Hansen på +45 8936 0237 eller  rh@aarch.dk . 
 Ansøgningsfrist og ansættelsesprocedure 
 Ansøgningsfristen er fredag den 3. juni 2022 kl. 12.00, hvor ansøgningen skal være modtaget digitalt via arkitektskolens hjemmeside. 
 Sammen med din ansøgning skal du uploade: 
 
 Kopi af bevis for beståede eksaminer på kandidatniveau 
 CV 
 Portfolio med udvalgte eksempler på din professionelle, kunstneriske, akademiske og undervisningsbaserede praksis (Max 20 MB) 
 
 I forbindelse med samtalen kan der blive indhentet referencer på den kandidat, som vi forventer at tilbyde ansættelse til. 
 Alle interesserede opfordres til at søge stillingen uanset køn, race, religion eller etnisk tilhørsforhold. 
 Bemærk venligst, at stillingen bliver slået op og vil blive besat i overensstemmelse med forskningsministeriets  Bekendtgørelse af 12. april 2019 om ansættelse af kunstnerisk og videnskabeligt personale ved de videregående kunstneriske uddannelsesinstitutioner på Uddannelses- og Forskningsministeriets område. 
 Shortlisting 
 Arkitektskolen Aarhus benytter sig af shortlisting. Shortlisting betyder, at kun de ansøgere, der ud fra en samlet vurdering bedst matcher arkitektskolens behov, sendes videre til en faglig bedømmelse. Sorteringen sker i henhold til opslagets formelle og faglige krav til ansøgerne. Alle ansøgere vil blive informeret om, hvorvidt deres ansøgning er blevet shortlistet til bedømmelse. 
 Derefter vil et bedømmelsesudvalg gennemgå de udvalgte ansøgere i relation til den specifikke stilling. 
 Vores vision 
 På Arkitektskolen Aarhus mener vi, at arkitektur skal påvirke verden og skabe bæredygtige rammer for de mennesker, der lever i den. Derfor uddanner vi arkitekter, der med nye ideer og relevante løsninger kan skabe værdi for fællesskabet i en foranderlig verden. En verden, der i stigende grad udfordrer os til at tænke kreativt for at eksistere, for at bo og for at trives. 
 Vi gør det ved at arbejde tæt sammen med andre faggrupper, ved at omfavne nye teknologier, ved at vove eksperimentet og ved konstant at tilegne os nye færdigheder. 
 Igennem vores kunstneriske tilgang finder vi nye veje. Gennem videnskabelige undersøgelser finder vi nye svar. Og gennem praktisk udførelse bliver vores teoretiske viden til faglig kunnen. 
 Vores ambition er at være en skandinavisk eliteinstitution for arkitekturudvikling. Vi vil uddanne de bedste arkitekter ved at optage de mest egnede – de mest talentfulde og motiverede studerende. 
 Vi tager ansvar for og engagerer os i det samfund, vi er en del af. 
 Engaging through Architecture 
 Læs mere om skolen på aarch.dk",Exners Plads 7,58,Danmark,751,Aarhus,2,Midtjylland,8000,Aarhus C,1,1,Fuldtid,None,None,1,,0,,0,0,0,,True,"{'Id': 7967651, 'Email': 'rgh@aarch.dk', 'FaxNumber': None, 'PersonName': 'Rasmus Grønbæk Hansen', 'FirstName': 'Rasmus Grønbæk', 'LastName': 'Hansen', 'PositionTitle': 'Uddannelseschef', 'PhoneNumbers': [{'Number': '89360237', 'Type': 0, 'Description': 'Hovednummer'}]}",2022-07-02T00:00:00,False,False,False,False,4,,,False,False,False,False,,,,,https://aarch.dk/studieadjunkter-med-fokus-paa-undervisning-paa-bacheloruddannelsen-paa-arkitektskolen-aarhus/,False,2022-06-03T00:00:00,,0,Primary,7,/CV/FindWork/GetLogo?JobAdId=5592715&WorkPlace=77635&Organisation=27120717,"Exners Plads 7,8000, Aarhus C",True,False,/CV/Jobseeking/JobLog/CreateJobSearch?JobnetJobPostingIdentifier=5592715&Company.Name=Arkitektskolen Aarhus&SubmissionDeadlineDate=2022-6-3&Title=Studieadjunkter med fokus på undervisning på bacheloruddannelsen på Arkitektskolen Aarhus&WeeklyWorkTime=1,00000000-0000-0000-0000-000000000000,False,0,,,Studieadjunkter med fokus på undervisning på bacheloruddannelsen på Arkitektskolen Aarhus,True,,True,1,,5592715,,,False,False,,0,False,Arkitektskolen Aarhus,Exners Plads 7,,,8000,False,False,False,Aarhus C,Rasmus Grønbæk Hansen,89360237,rgh@aarch.dk,,,,,False,,2022-06-03T00:00:00,,0,False,0,,,,,0,,,,False,False,,,False,False,,,,False,,False,,,Arbejdspladsen ligger i Aarhus kommune,False,Arkitektskolen Aarhus,,None,,False,False,"Arkitektskolen Aarhus opsl&aring;r et antal stillinger som studieadjunkt. Der er tale om fuldtidsstillinger med fokus p&aring; undervisning p&aring; skolens tidligste studietrin.
Arkitektskolen uddanner arkitekter p&aring; h&oslash;jeste niveau og er blandt en af Europas mest ansete arkitektskoler. Skolens fundament har rod i en skandinavisk arkite","""Arkitektskolen Aarhus opsl\u0026aring;r et antal stillinger som studieadjunkt. Der er tale om fuldtidsstillinger med fokus p\u0026aring; undervisning p\u0026aring; skolens tidligste studietrin.\nArkitektskolen uddanner arkitekter p\u0026aring; h\u0026oslash;jeste niveau og er blandt en af Europas mest ansete arkitektskoler. Skolens fundament har rod i en skandinavisk arkite""","""Studieadjunkter med fokus på undervisning på bacheloruddannelsen på Arkitektskolen Aarhus""","https://www.google.dk/maps/dir//Exners+Plads+7,8000,+Aarhus+C/","Arkitektskolen Aarhus opslår et antal stillinger som studieadjunkt. Der er tale om fuldtidsstillinger med fokus på undervisning på skolens tidligste studietrin. 
 Arkitektskolen uddanner arkitekter på højeste niveau og er blandt en af Europas mest ansete arkitektskoler. Skolens fundament har rod i en skandinavisk arkitekturtradition, hvor social ansvarlighed, rumlig forståelse og håndværk vægtes højt. Og den position ønsker vi at styrke yderligere. 
 Vi søger derfor undervisere, der kan bidrage til at udvikle uddannelsen med udgangspunkt i skolens pædagogik og didaktik indenfor den overordnede vision ”Engaging through Architecture”. 
 Ansøgere til stillingen forventes at deltage i videreudviklingen af arkitektuddannelsen og sikre det begrebslige, arkitektfaglige og metodiske grundlag. Dette grundlag sikrer skolens studerende en god og fagligt ambitiøs start på uddannelsen og er forudsætningen for, at Arkitektskolen Aarhus også i fremtiden kan uddanne stærke kandidater. 
 Vi ønsker stillingerne besat fra den 1. oktober 2022 eller hurtigst muligt derefter. 
 Stillingerne 
 Studieadjunkturer er tidsubegrænsede undervisningsstillinger på fuld tid med arbejdssted på Arkitektskolen Aarhus og indbefatter: 
 
 Undervisning på bacheloruddannelsens tidligste studietrin i samarbejde med skolens uddannelseschef, uddannelseskoordinatorer og videnskabelige medarbejdere. 
 Udvikling af undervisning, herunder kurser og forelæsninger. 
 Deltagelse i generelle opgaver til gavn for institutionen som helhed, herunder bedømmelser, optag af nye studerende samt andre udviklingsprojekter på institutionsniveau. 
 
 Ved ansættelse som studieadjunkt fastsættes der en studieadjunktperiode på op til seks år, hvorinden for studieadjunkten skal indstille sig til bedømmelse af sine undervisningsmæssige kvalifikationer. Er bedømmelsen positiv, overgår studieadjunkten ved udløbet af studieadjunktperioden til ansættelse som studielektor. 
 Løn og ansættelsesvilkår efter AC-fællesoverenskomsten. 
 Dine kvalifikationer 
 Arkitektskolen søger medarbejdere med høj faglighed, gode pædagogiske kompetencer samt evner og lyst til samarbejde. Et anvendeligt netværk i undervisningssammenhæng og relevant undervisningserfaring forventes hos ansøgere. 
 Det forventes ligeledes, at ansøgere har sproglige forudsætninger for at kunne varetage undervisning på dansk og engelsk og kan formulere sig klart inden for fagområdet på de to sprog i både skrift og tale. 
 Ansøgere skal derudover kunne dokumentere: 
 
 Afgang fra en anerkendt arkitektuddannelse 
 Akademisk eller praktisk erfaring med arkitektfaget i form af projekter baseret på undersøgende udviklingsprocesser 
 Undervisningserfaring inden for fagområdet 
 Gode formidlings- og samarbejdsevner 
 
 Hvad vi tilbyder 
 På Arkitektskolen Aarhus tilbyder vi et kreativt og innovativt forsknings- og undervisningsmiljø. Som arkitekturinstitution har vi en lang tradition for at dyrke en lokal tilgang til arkitekturen, samtidig med at vi også har et stærkt internationalt fokus. 
 Vi er lige flyttet ind i Danmarks første nybyggede arkitektskole i hjertet af Aarhus med stærkt udvidede værkstedsfaciliteter, som bidrager til at styrke vores praksisorienterede undervisning og mulighederne for at eksperimentere med materialer og byggetekniske løsninger.  Se de nye faciliteter 
 Som ansat på Arkitektskolen Aarhus vil du komme til at indgå i mange kollegiale sammenhænge, både i større og mindre grupper. Vi tror på, at vi med gensidig anerkendelse og fokus på samarbejde kan skabe de bedste rammer for en attraktiv og levende arbejdsplads. 
 Yderligere Information 
 Spørgsmål om stillingen kan rettes til uddannelseschef Rasmus Grønbæk Hansen på +45 8936 0237 eller  rh@aarch.dk . 
 Ansøgningsfrist og ansættelsesprocedure 
 Ansøgningsfristen er fredag den 3. juni 2022 kl. 12.00, hvor ansøgningen skal være modtaget digitalt via arkitektskolens hjemmeside. 
 Sammen med din ansøgning skal du uploade: 
 
 Kopi af bevis for beståede eksaminer på kandidatniveau 
 CV 
 Portfolio med udvalgte eksempler på din professionelle, kunstneriske, akademiske og undervisningsbaserede praksis (Max 20 MB) 
 
 I forbindelse med samtalen kan der blive indhentet referencer på den kandidat, som vi forventer at tilbyde ansættelse til. 
 Alle interesserede opfordres til at søge stillingen uanset køn, race, religion eller etnisk tilhørsforhold. 
 Bemærk venligst, at stillingen bliver slået op og vil blive besat i overensstemmelse med forskningsministeriets  Bekendtgørelse af 12. april 2019 om ansættelse af kunstnerisk og videnskabeligt personale ved de videregående kunstneriske uddannelsesinstitutioner på Uddannelses- og Forskningsministeriets område. 
 Shortlisting 
 Arkitektskolen Aarhus benytter sig af shortlisting. Shortlisting betyder, at kun de ansøgere, der ud fra en samlet vurdering bedst matcher arkitektskolens behov, sendes videre til en faglig bedømmelse. Sorteringen sker i henhold til opslagets formelle og faglige krav til ansøgerne. Alle ansøgere vil blive informeret om, hvorvidt deres ansøgning er blevet shortlistet til bedømmelse. 
 Derefter vil et bedømmelsesudvalg gennemgå de udvalgte ansøgere i relation til den specifikke stilling. 
 Vores vision 
 På Arkitektskolen Aarhus mener vi, at arkitektur skal påvirke verden og skabe bæredygtige rammer for de mennesker, der lever i den. Derfor uddanner vi arkitekter, der med nye ideer og relevante løsninger kan skabe værdi for fællesskabet i en foranderlig verden. En verden, der i stigende grad udfordrer os til at tænke kreativt for at eksistere, for at bo og for at trives. 
 Vi gør det ved at arbejde tæt sammen med andre faggrupper, ved at omfavne nye teknologier, ved at vove eksperimentet og ved konstant at tilegne os nye færdigheder. 
 Igennem vores kunstneriske tilgang finder vi nye veje. Gennem videnskabelige undersøgelser finder vi nye svar. Og gennem praktisk udførelse bliver vores teoretiske viden til faglig kunnen. 
 Vores ambition er at være en skandinavisk eliteinstitution for arkitekturudvikling. Vi vil uddanne de bedste arkitekter ved at optage de mest egnede – de mest talentfulde og motiverede studerende. 
 Vi tager ansvar for og engagerer os i det samfund, vi er en del af. 
 Engaging through Architecture 
 Læs mere om skolen på aarch.dk","https://www.google.dk/maps/place/Exners+Plads+7,8000,+Aarhus+C/",27120717,False,False,,False
