summary_AutomatchType,summary_Abroad,summary_Weight,summary_Title,summary_JobHeadline,summary_Presentation,summary_HiringOrgName,summary_WorkPlaceAddress,summary_WorkPlacePostalCode,summary_WorkPlaceCity,summary_WorkPlaceOtherAddress,summary_WorkPlaceAbroad,summary_WorkPlaceNotStatic,summary_UseWorkPlaceAddressForJoblog,summary_PostingCreated,summary_LastDateApplication,summary_FormattedLastDateApplication,summary_AssignmentStartDate,summary_IsHotjob,summary_IsExternal,summary_Url,summary_Region,summary_Municipality,summary_Country,summary_PostalCode,summary_PostalCodeName,summary_JobAnnouncementType,summary_EmploymentType,summary_WorkHours,summary_OccupationArea,summary_OccupationGroup,summary_Occupation,summary_Location_Latitude,summary_Location_Longitude,summary_JoblogWorkTime_WorkHour,summary_JoblogWorkTime_DailyWorkTime,summary_WorkplaceID,summary_OrganisationId,summary_HiringOrgCVR,summary_UserLoggedIn,summary_AnonymousEmployer,summary_ShareUrl,summary_DetailsUrl,summary_JobLogUrl,summary_HasLocationValues,summary_ID,summary_Latitude,summary_Longitude,details_WorkSchedule,details_WorkConditions,details_EmploymentTypes,details_WorkPlace_Name,details_WorkPlace_Address_AddressLine,details_WorkPlace_Address_Country_Id,details_WorkPlace_Address_Country_Name,details_WorkPlace_Address_Municipality_Id,details_WorkPlace_Address_Municipality_Name,details_WorkPlace_Address_Region_Id,details_WorkPlace_Address_Region_Name,details_WorkPlace_Address_PostalCode,details_WorkPlace_Address_City,details_WorkPlace_PhoneNumber_Number,details_WorkPlace_PhoneNumber_Type,details_WorkPlace_PhoneNumber_Description,details_WorkPlace_FaxNumber,details_WorkPlace_Email,details_WorkPlace_WebAddress,details_WorkPlace_Description,details_WorkPlace_Logo,details_WorkPlace_WorkPlaceOrganizationNumber,details_WorkPlace_OrganizationNumber,details_WorkPlace_OrganizationDescription,details_JobPositionPosting_Id,details_JobPositionPosting_OriginalJppId,details_JobPositionPosting_HiringOrg_Name,details_JobPositionPosting_HiringOrg_Address_AddressLine,details_JobPositionPosting_HiringOrg_Address_Country_Id,details_JobPositionPosting_HiringOrg_Address_Country_Name,details_JobPositionPosting_HiringOrg_Address_Municipality_Id,details_JobPositionPosting_HiringOrg_Address_Municipality_Name,details_JobPositionPosting_HiringOrg_Address_Region_Id,details_JobPositionPosting_HiringOrg_Address_Region_Name,details_JobPositionPosting_HiringOrg_Address_PostalCode,details_JobPositionPosting_HiringOrg_Address_City,details_JobPositionPosting_HiringOrg_PhoneNumber_Number,details_JobPositionPosting_HiringOrg_PhoneNumber_Type,details_JobPositionPosting_HiringOrg_PhoneNumber_Description,details_JobPositionPosting_HiringOrg_FaxNumber,details_JobPositionPosting_HiringOrg_Email,details_JobPositionPosting_HiringOrg_WebAddress,details_JobPositionPosting_HiringOrg_Description,details_JobPositionPosting_HiringOrg_Logo,details_JobPositionPosting_HiringOrg_WorkPlaceOrganizationNumber,details_JobPositionPosting_HiringOrg_OrganizationNumber,details_JobPositionPosting_HiringOrg_OrganizationDescription,details_JobPositionPosting_RecruitingCompany,details_JobPositionPosting_PublicationStartDate,details_JobPositionPosting_PublicationEndDate,details_JobPositionPosting_JobPositionInformation_PositionTitle,details_JobPositionPosting_JobPositionInformation_Purpose,details_JobPositionPosting_JobPositionInformation_WorkLocation_AddressLine,details_JobPositionPosting_JobPositionInformation_WorkLocation_Country_Id,details_JobPositionPosting_JobPositionInformation_WorkLocation_Country_Name,details_JobPositionPosting_JobPositionInformation_WorkLocation_Municipality_Id,details_JobPositionPosting_JobPositionInformation_WorkLocation_Municipality_Name,details_JobPositionPosting_JobPositionInformation_WorkLocation_Region_Id,details_JobPositionPosting_JobPositionInformation_WorkLocation_Region_Name,details_JobPositionPosting_JobPositionInformation_WorkLocation_PostalCode,details_JobPositionPosting_JobPositionInformation_WorkLocation_City,details_JobPositionPosting_JobPositionInformation_EmploymentType,details_JobPositionPosting_JobPositionInformation_WeeklyWorkHours_TypeId,details_JobPositionPosting_JobPositionInformation_WeeklyWorkHours_TypeName,details_JobPositionPosting_JobPositionInformation_WeeklyWorkHours_Description,details_JobPositionPosting_JobPositionInformation_CompensationDescription,details_JobPositionPosting_JobPositionInformation_NumberToFill,details_JobPositionPosting_JobPositionInformation_DriverLicense,details_JobPositionPosting_JobPositionInformation_Occupation_DiscoWeb,details_JobPositionPosting_JobPositionInformation_Occupation_AlternateNames,details_JobPositionPosting_JobPositionInformation_Occupation_GroupId,details_JobPositionPosting_JobPositionInformation_Occupation_AreaId,details_JobPositionPosting_JobPositionInformation_Occupation_Id,details_JobPositionPosting_JobPositionInformation_Occupation_Name,details_JobPositionPosting_JobPositionInformation_IsGovernmentHiring,details_JobPositionPosting_JobPositionInformation_JppContacts,details_JobPositionPosting_JobPositionInformation_EmploymentDate,details_JobPositionPosting_IsRecruitmentOfForeignNationals,details_JobPositionPosting_IsWorkInDenmark,details_JobPositionPosting_IsAnonymousEmployer,details_JobPositionPosting_IsDisabilityFriendly,details_JobPositionPosting_JppType,details_JobPositionPosting_ApplicationDetails_WorkHourMax,details_JobPositionPosting_ApplicationDetails_WorkHourMin,details_JobPositionPosting_ApplicationDetails_DailyWorkTimeWeekend,details_JobPositionPosting_ApplicationDetails_DailyWorkTimeNight,details_JobPositionPosting_ApplicationDetails_DailyWorkTimeEvening,details_JobPositionPosting_ApplicationDetails_DailyWorkTimeDay,details_JobPositionPosting_ApplicationDetails_ReferenceText,details_JobPositionPosting_ApplicationDetails_RemarksToApplicant,details_JobPositionPosting_ApplicationDetails_ByEmail,details_JobPositionPosting_ApplicationDetails_ByPhone,details_JobPositionPosting_ApplicationDetails_ApplyViaUrl,details_JobPositionPosting_ApplicationDetails_ReplyInWriting,details_JobPositionPosting_ApplicationDetails_ApplicationDeadlineDate,details_JobPositionPosting_ContactAuthorityPhoneNumber_Number,details_JobPositionPosting_ContactAuthorityPhoneNumber_Type,details_JobPositionPosting_ContactAuthorityPhoneNumber_Description,details_JobPositionPosting_Status,details_LogoUrl,details_Address,details_ShowMap,details_ShowShareButtonJobLog,details_JobLogUrl,details_JobLogTemplateModel_Identifier,details_JobLogTemplateModel_UseWorkPlaceAddressForJoblog,details_JobLogTemplateModel_Category,details_JobLogTemplateModel_CvCustomerIdentifier,details_JobLogTemplateModel_JobSeekingStatus,details_JobLogTemplateModel_Title,details_JobLogTemplateModel_IsApplicationSourceRequired,details_JobLogTemplateModel_ApplicationSource,details_JobLogTemplateModel_IsWeeklyWorkTimeRequired,details_JobLogTemplateModel_WeeklyWorkTime,details_JobLogTemplateModel_HoursPerWeek,details_JobLogTemplateModel_JobnetJobPostingIdentifier,details_JobLogTemplateModel_JobAdDocument_Title,details_JobLogTemplateModel_JobAdDocument_Identifier,details_JobLogTemplateModel_JobAdDocument_IsDeletedBySystem,details_JobLogTemplateModel_JobAdDocument_IsDeletedByUser,details_JobLogTemplateModel_JobAdFile,details_JobLogTemplateModel_Company_JobLogEntryCategory,details_JobLogTemplateModel_Company_ShowAddressFieldsEvenIfEmpty,details_JobLogTemplateModel_Company_Name,details_JobLogTemplateModel_Company_Address,details_JobLogTemplateModel_Company_Country,details_JobLogTemplateModel_Company_EmploymentAreaID,details_JobLogTemplateModel_Company_PostCode,details_JobLogTemplateModel_Company_IsCountryAndTownAndPostCodeEmpty,details_JobLogTemplateModel_Company_IsTownAndPostCodeEmpty,details_JobLogTemplateModel_Company_IsCountryDanmark,details_JobLogTemplateModel_Company_Town,details_JobLogTemplateModel_Company_ContactPerson,details_JobLogTemplateModel_Company_Phone,details_JobLogTemplateModel_Company_Email,details_JobLogTemplateModel_Company_Latitude,details_JobLogTemplateModel_Company_Longitude,details_JobLogTemplateModel_Company_DailyTravelTimeInMinutes,details_JobLogTemplateModel_Company_DistanceToCompanyInMeters,details_JobLogTemplateModel_Company_IsCreateMode,details_JobLogTemplateModel_TypeOfSubmission,details_JobLogTemplateModel_SubmissionDate,details_JobLogTemplateModel_SubmissionDateFormatted,details_JobLogTemplateModel_SubmissionDateTiks,details_JobLogTemplateModel_IsSubmissionDateRequired,details_JobLogTemplateModel_Status,details_JobLogTemplateModel_DateCreatedFormatted,details_JobLogTemplateModel_DateCreated,details_JobLogTemplateModel_DateModifiedFormatted,details_JobLogTemplateModel_DateModified,details_JobLogTemplateModel_LastModifiedDateTiks,details_JobLogTemplateModel_DateClosed,details_JobLogTemplateModel_JobApplicationDocument_Title,details_JobLogTemplateModel_JobApplicationDocument_Identifier,details_JobLogTemplateModel_JobApplicationDocument_IsDeletedBySystem,details_JobLogTemplateModel_JobApplicationDocument_IsDeletedByUser,details_JobLogTemplateModel_CvDocument_Title,details_JobLogTemplateModel_CvDocument_Identifier,details_JobLogTemplateModel_CvDocument_IsDeletedBySystem,details_JobLogTemplateModel_CvDocument_IsDeletedByUser,details_JobLogTemplateModel_JobApplicationFile,details_JobLogTemplateModel_CvFile,details_JobLogTemplateModel_SubmissionDeadlineDate,details_JobLogTemplateModel_IsPersisted,details_JobLogTemplateModel_ServerValidationErrors,details_JobLogTemplateModel_HasServerValidationErrors,details_JoblogWorkTime_WorkHour,details_JoblogWorkTime_DailyWorkTime,details_Place,details_OpenPrintDialog,details_WorkPlaceInfoText,details_JobCenterContactDetails,details_WorkPlaceDescriptionText,details_FavoriteText,details_IsFavorite,details_ShowFavorite,details_MetaOgTextForSharing,details_DescriptionForSharing,details_TitleForSharing,details_RutePlan,details_FormattedPurpose,details_MapUrl,details_OrganizationNumber,details_ShowSearchJobButton,details_ShowPrint,details_BackToFindWorkButtonUrl,isExternal
0,False,1,LindbergHR søger erfaren regnskabskonsulent med +4 års erfaring - til stilling hos BDO,LindbergHR søger erfaren regnskabskonsulent med +4 års erfaring - til stilling hos BDO,"BDO er en af Danmarks største rådgivnings- og revisionsvirksomhed og servicerer både danske og internationale kunder.  Virksomheden er kendetegnet ved høj jobtilfredshed, tillid, fleksibilitet og s",LINDBERGHR ApS,,1561,København V,True,False,False,False,2022-05-06T00:00:00,2022-07-01T00:00:00,1. juli 2022,0001-01-01T00:00:00,False,False,https://job.jobnet.dk/CV/FindWork/Details/5592782,Hovedstaden og Bornholm,København,Danmark,1561,,,,Fuldtid,"Kontor, administration, regnskab og finans",Bogholderi- og regnskabsarbejde,Bogholderi- og regnskabsassistent,55.6609,12.5624,,,102970,93780,34226555,False,False,https://job.jobnet.dk/CV/FindWork/DetailsSocialmedia/5592782,https://job.jobnet.dk/CV/FindWork/Details/5592782,https://job.jobnet.dk/CV/FindWork/Details/5592782,True,5592782,55.6609,12.5624,"{'Id': 1, 'Name': 'Fuldtid'}, {'Id': 16, 'Name': 'Deltid'}","{'Id': 1, 'Name': 'Almindelige vilkår'}, {'Id': 2, 'Name': 'Fleksjob'}, {'Id': 3, 'Name': 'Skånejob'}, {'Id': 4, 'Name': 'Egnet til efterlønnere og seniorer'}, {'Id': 5, 'Name': 'Job med løntilskud'}, {'Id': 6, 'Name': 'Rotationsjob'}, {'Id': 7, 'Name': 'Virksomhedspraktik'}","{'Id': 1, 'Name': 'Fastansættelse'}, {'Id': 16, 'Name': 'Tidsbegrænset ansættelse'}",LINDBERGHR ApS,Egå Havvej 21,58,Danmark,751,Aarhus,2,Midtjylland,8250,Egå,,0,Primary,,,,None,102970,1017469734,34226555,None,5592782,5592782,LINDBERGHR ApS,Egå Havvej 21,58,Danmark,751,Aarhus,2,Midtjylland,8250,Egå,,0,Primary,,,,None,102970,1017469734,34226555,None,,2022-05-06T00:00:00,2022-07-01T00:00:00,LindbergHR søger erfaren regnskabskonsulent med +4 års erfaring - til stilling hos BDO,"BDO er en af Danmarks største rådgivnings- og revisionsvirksomhed og servicerer både danske og internationale kunder.  Virksomheden er kendetegnet ved høj jobtilfredshed, tillid, fleksibilitet og spændende arbejdsopgaver. 
 BDO har mere end 1200 medarbejdere i Danmark, heraf 116 placeret på kontoret på Havneholmen. 
 Om jobbet: 
 Du indgår i et mindre team af seks hjælpsomme og dygtige kolleger, hvor I samarbejder om at servicere kunder inden for bogføring, afstemning, controlling, opstilling af regnskaber mv. 
 Din nærmeste leder sidder også med lignende arbejdsopgaver, og hun tilsigter, at du løbende får opgaver, der udfordrer dig i tilstrækkelig grad. Som nyansat i BDO vil du også få en mentor tilknyttet, som du kan sparre med. 
 Arbejdsopgaverne vil bl.a. være: 
 
 Controlling og udfærdige månedsafslutning for kunderne 
 Udfærdige ledelsesrapportering til kundernes brug 
 Løbende dialog med- og rådgivning af kunderne 
 Optimering af såvel interne som eksterne arbejdsprocesser 
 Afstemninger og klargøring af regnskabstal til revisor 
 Regnskabsopstilling og skatteberegning 
 Oplæring, sparring og coaching af yngre kolleger 
 
 Faglige kvalifikationer: 
 
 Du har minimum fire års erfaring, (medregn eventuel elevtid) og er formentlig regnskabsuddannet. Det kunne også være, du har erfaring som revisor, økonomaassistent, controller eller lignende 
 Såfremt du har erfaring med den eksterne rolle - hvor du udfører arbejdsopgaverne på vegne af kunder, vil det være en fordel – men bemærk: det er IKKE et krav 
 Du har erfaring med bogføring, debitorer, kreditorer, moms, løn, rapportering mv. 
 Du er erfaren bruger af Excel 
 Du har muligvis erfaring med oplæring af medarbejdere 
 Du er velformuleret på dansk og engelsk – såvel mundtligt som skriftligt 
 
 Personlige egenskaber: 
 
 Du kan holde overblik over mange forskellige opgaver og deadlines 
 Du kan opretholde en høj kvalitet i arbejdet, også når der er travlt 
 Du sætter en ære i at levere god service med et smil til dine kunder og kolleger 
 Du arbejder systematisk, struktureret og selvstændigt, men forstår vigtigheden af at samarbejde med dine kolleger 
 Du følger op på dine arbejdsopgaver og sikrer, at tingene bliver løst 
 Du har lyst til at lære fra dig - og gerne tage hånd om kollegaer, der er mindre erfarne end dig 
 
 Du tilbydes: 
 
 En attraktiv virksomhed med gode kolleger og en leder der uddelegerer ansvar og giver plads til, at du selv løser opgaverne, og forventer at du siger til, hvis du har behov for sparring og/eller hjælp 
 Stillingen er som udgangspunkt på 37 timer og du får betaling for evt. overarbejde. BDO er IKKE en arbejdsplads, hvor du får en større stjerne af ´at sidde og hænge mange timer´. Det er din indstilling, dit gå på mod og de resultater, du skaber, du vurderes på 
 For at sikre samarbejde og læring vil arbejdet som udgangspunkt foregå på arbejdspladsen, men der er mulighed for hjemmearbejde, i den udstrækning arbejdsopgaverne tillader dette og med hensyntagen til samarbejdet med dine kollegaer 
 Du planlægger selv dine arbejdsopgaver, og du har stor fleksibilitet i forhold til arbejdstid – vi forventer omvendt også at fleksibiliteten er gensidig - da der indimellem kan blive behov for fleksibilitet fra dig i perioder med spidsbelastning 
 En attraktiv kantineordning, sundhedsforsikring, fri parkering mv. 
 
 Arbejdspladsens beliggenhed:  Havneholmen 29, 1561 København V. 
 Ansættelsestidspunkt:  Snarest – men vi har tid til at vente på den rette kandidat. 
 Ansøgningsfrist:  
 Kandidater indkaldes løbende til interview, hvorfor du venligst bedes fremsende din ansøgning snarest. Alle ansøgninger behandles med fuld diskretion. 
 Vil du vide mere? 
 På vegne af BDO varetager LindbergHR rekrutteringsprocessen. Du er meget velkommen til at kontakte Carsten Lindberg Hartvigsen fra LindbergHR på tlf. 41813400, såfremt du har konkrete spørgsmål til stillingen. 
 Hvordan kommer du videre? 
 Upload straks dit CV og evt. en ansøgning via nedenstående link: 
 https://www.lindberghr.dk/stillinger/?hr=show-job%2F90474%26locale%3Dda_DK 
 Vi ser frem til at høre fra dig og beder dig oplyse i din ansøgning, hvor du har set vores annonce. 
 Indkomne ansøgninger vil løbende blive gennemgået, og annoncen vil blive slettet, når stillingen er besat.",,58,Danmark,101,København,4,"Hovedstaden, Sjælland og Bornholm",1561,København V,1,1,Fuldtid,None,None,1,,0,,0,0,0,,False,"{'Id': 7967773, 'Email': None, 'FaxNumber': None, 'PersonName': 'Carsten Lindberg Hartvigsen', 'FirstName': 'Carsten Lindberg', 'LastName': 'Hartvigsen', 'PositionTitle': 'Direktør / Indehaver', 'PhoneNumbers': [{'Number': '41813400', 'Type': 0, 'Description': 'Hovednummer'}]}",,False,False,False,False,4,,,False,False,False,False,,,,,https://www.lindberghr.dk/stillinger/?hr=show-job%2F90474%26locale%3Dda_DK,False,2022-07-01T00:00:00,,0,Primary,7,/CV/FindWork/GetLogo?JobAdId=5592782&WorkPlace=102970&Organisation=34226555,"Egå Havvej 21,8250, Egå",False,False,/CV/Jobseeking/JobLog/CreateJobSearch?JobnetJobPostingIdentifier=5592782&Company.Name=LINDBERGHR ApS&SubmissionDeadlineDate=2022-7-1&Title=LindbergHR søger erfaren regnskabskonsulent med +4 års erfaring - til stilling hos BDO&WeeklyWorkTime=1,00000000-0000-0000-0000-000000000000,False,0,,,LindbergHR søger erfaren regnskabskonsulent med +4 års erfaring - til stilling hos BDO,True,,True,1,,5592782,,,False,False,,0,False,LINDBERGHR ApS,Egå Havvej 21,,,8250,False,False,False,Egå,Carsten Lindberg Hartvigsen,41813400,,,,,,False,,2022-07-01T00:00:00,,0,False,0,,,,,0,,,,False,False,,,False,False,,,,False,,False,,,Arbejdspladsen ligger i København kommune,False,LINDBERGHR ApS,,None,,False,False,"BDO er en af Danmarks st&oslash;rste r&aring;dgivnings- og revisionsvirksomhed og servicerer b&aring;de danske og internationale kunder. Virksomheden er kendetegnet ved h&oslash;j jobtilfredshed, tillid, fleksibilitet og sp&aelig;ndende arbejdsopgaver.
BDO har mere end 1200 medarbejdere i Danmark, heraf 116 placeret p&aring; kontoret p&aring; Havne","""BDO er en af Danmarks st\u0026oslash;rste r\u0026aring;dgivnings- og revisionsvirksomhed og servicerer b\u0026aring;de danske og internationale kunder. Virksomheden er kendetegnet ved h\u0026oslash;j jobtilfredshed, tillid, fleksibilitet og sp\u0026aelig;ndende arbejdsopgaver.\nBDO har mere end 1200 medarbejdere i Danmark, heraf 116 placeret p\u0026aring; kontoret p\u0026aring; Havne""","""LindbergHR søger erfaren regnskabskonsulent med +4 års erfaring - til stilling hos BDO""","https://www.google.dk/maps/dir//Egå+Havvej+21,8250,+Egå/","BDO er en af Danmarks største rådgivnings- og revisionsvirksomhed og servicerer både danske og internationale kunder.  Virksomheden er kendetegnet ved høj jobtilfredshed, tillid, fleksibilitet og spændende arbejdsopgaver. 
 BDO har mere end 1200 medarbejdere i Danmark, heraf 116 placeret på kontoret på Havneholmen. 
 Om jobbet: 
 Du indgår i et mindre team af seks hjælpsomme og dygtige kolleger, hvor I samarbejder om at servicere kunder inden for bogføring, afstemning, controlling, opstilling af regnskaber mv. 
 Din nærmeste leder sidder også med lignende arbejdsopgaver, og hun tilsigter, at du løbende får opgaver, der udfordrer dig i tilstrækkelig grad. Som nyansat i BDO vil du også få en mentor tilknyttet, som du kan sparre med. 
 Arbejdsopgaverne vil bl.a. være: 
 
 Controlling og udfærdige månedsafslutning for kunderne 
 Udfærdige ledelsesrapportering til kundernes brug 
 Løbende dialog med- og rådgivning af kunderne 
 Optimering af såvel interne som eksterne arbejdsprocesser 
 Afstemninger og klargøring af regnskabstal til revisor 
 Regnskabsopstilling og skatteberegning 
 Oplæring, sparring og coaching af yngre kolleger 
 
 Faglige kvalifikationer: 
 
 Du har minimum fire års erfaring, (medregn eventuel elevtid) og er formentlig regnskabsuddannet. Det kunne også være, du har erfaring som revisor, økonomaassistent, controller eller lignende 
 Såfremt du har erfaring med den eksterne rolle - hvor du udfører arbejdsopgaverne på vegne af kunder, vil det være en fordel – men bemærk: det er IKKE et krav 
 Du har erfaring med bogføring, debitorer, kreditorer, moms, løn, rapportering mv. 
 Du er erfaren bruger af Excel 
 Du har muligvis erfaring med oplæring af medarbejdere 
 Du er velformuleret på dansk og engelsk – såvel mundtligt som skriftligt 
 
 Personlige egenskaber: 
 
 Du kan holde overblik over mange forskellige opgaver og deadlines 
 Du kan opretholde en høj kvalitet i arbejdet, også når der er travlt 
 Du sætter en ære i at levere god service med et smil til dine kunder og kolleger 
 Du arbejder systematisk, struktureret og selvstændigt, men forstår vigtigheden af at samarbejde med dine kolleger 
 Du følger op på dine arbejdsopgaver og sikrer, at tingene bliver løst 
 Du har lyst til at lære fra dig - og gerne tage hånd om kollegaer, der er mindre erfarne end dig 
 
 Du tilbydes: 
 
 En attraktiv virksomhed med gode kolleger og en leder der uddelegerer ansvar og giver plads til, at du selv løser opgaverne, og forventer at du siger til, hvis du har behov for sparring og/eller hjælp 
 Stillingen er som udgangspunkt på 37 timer og du får betaling for evt. overarbejde. BDO er IKKE en arbejdsplads, hvor du får en større stjerne af ´at sidde og hænge mange timer´. Det er din indstilling, dit gå på mod og de resultater, du skaber, du vurderes på 
 For at sikre samarbejde og læring vil arbejdet som udgangspunkt foregå på arbejdspladsen, men der er mulighed for hjemmearbejde, i den udstrækning arbejdsopgaverne tillader dette og med hensyntagen til samarbejdet med dine kollegaer 
 Du planlægger selv dine arbejdsopgaver, og du har stor fleksibilitet i forhold til arbejdstid – vi forventer omvendt også at fleksibiliteten er gensidig - da der indimellem kan blive behov for fleksibilitet fra dig i perioder med spidsbelastning 
 En attraktiv kantineordning, sundhedsforsikring, fri parkering mv. 
 
 Arbejdspladsens beliggenhed:  Havneholmen 29, 1561 København V. 
 Ansættelsestidspunkt:  Snarest – men vi har tid til at vente på den rette kandidat. 
 Ansøgningsfrist:  
 Kandidater indkaldes løbende til interview, hvorfor du venligst bedes fremsende din ansøgning snarest. Alle ansøgninger behandles med fuld diskretion. 
 Vil du vide mere? 
 På vegne af BDO varetager LindbergHR rekrutteringsprocessen. Du er meget velkommen til at kontakte Carsten Lindberg Hartvigsen fra LindbergHR på tlf. 41813400, såfremt du har konkrete spørgsmål til stillingen. 
 Hvordan kommer du videre? 
 Upload straks dit CV og evt. en ansøgning via nedenstående link: 
 https://www.lindberghr.dk/stillinger/?hr=show-job%2F90474%26locale%3Dda_DK 
 Vi ser frem til at høre fra dig og beder dig oplyse i din ansøgning, hvor du har set vores annonce. 
 Indkomne ansøgninger vil løbende blive gennemgået, og annoncen vil blive slettet, når stillingen er besat.","https://www.google.dk/maps/place/Egå+Havvej+21,8250,+Egå/",34226555,False,False,,False
