summary_AutomatchType,summary_Abroad,summary_Weight,summary_Title,summary_JobHeadline,summary_Presentation,summary_HiringOrgName,summary_WorkPlaceAddress,summary_WorkPlacePostalCode,summary_WorkPlaceCity,summary_WorkPlaceOtherAddress,summary_WorkPlaceAbroad,summary_WorkPlaceNotStatic,summary_UseWorkPlaceAddressForJoblog,summary_PostingCreated,summary_LastDateApplication,summary_FormattedLastDateApplication,summary_AssignmentStartDate,summary_IsHotjob,summary_IsExternal,summary_Url,summary_Region,summary_Municipality,summary_Country,summary_PostalCode,summary_PostalCodeName,summary_JobAnnouncementType,summary_EmploymentType,summary_WorkHours,summary_OccupationArea,summary_OccupationGroup,summary_Occupation,summary_Location_Latitude,summary_Location_Longitude,summary_JoblogWorkTime_WorkHour,summary_JoblogWorkTime_DailyWorkTime,summary_WorkplaceID,summary_OrganisationId,summary_HiringOrgCVR,summary_UserLoggedIn,summary_AnonymousEmployer,summary_ShareUrl,summary_DetailsUrl,summary_JobLogUrl,summary_HasLocationValues,summary_ID,summary_Latitude,summary_Longitude,details_WorkSchedule,details_WorkConditions,details_EmploymentTypes,details_WorkPlace_Name,details_WorkPlace_Address_AddressLine,details_WorkPlace_Address_Country_Id,details_WorkPlace_Address_Country_Name,details_WorkPlace_Address_Municipality_Id,details_WorkPlace_Address_Municipality_Name,details_WorkPlace_Address_Region_Id,details_WorkPlace_Address_Region_Name,details_WorkPlace_Address_PostalCode,details_WorkPlace_Address_City,details_WorkPlace_PhoneNumber_Number,details_WorkPlace_PhoneNumber_Type,details_WorkPlace_PhoneNumber_Description,details_WorkPlace_FaxNumber,details_WorkPlace_Email,details_WorkPlace_WebAddress,details_WorkPlace_Description,details_WorkPlace_Logo,details_WorkPlace_WorkPlaceOrganizationNumber,details_WorkPlace_OrganizationNumber,details_WorkPlace_OrganizationDescription,details_JobPositionPosting_Id,details_JobPositionPosting_OriginalJppId,details_JobPositionPosting_HiringOrg_Name,details_JobPositionPosting_HiringOrg_Address_AddressLine,details_JobPositionPosting_HiringOrg_Address_Country_Id,details_JobPositionPosting_HiringOrg_Address_Country_Name,details_JobPositionPosting_HiringOrg_Address_Municipality_Id,details_JobPositionPosting_HiringOrg_Address_Municipality_Name,details_JobPositionPosting_HiringOrg_Address_Region_Id,details_JobPositionPosting_HiringOrg_Address_Region_Name,details_JobPositionPosting_HiringOrg_Address_PostalCode,details_JobPositionPosting_HiringOrg_Address_City,details_JobPositionPosting_HiringOrg_PhoneNumber_Number,details_JobPositionPosting_HiringOrg_PhoneNumber_Type,details_JobPositionPosting_HiringOrg_PhoneNumber_Description,details_JobPositionPosting_HiringOrg_FaxNumber,details_JobPositionPosting_HiringOrg_Email,details_JobPositionPosting_HiringOrg_WebAddress,details_JobPositionPosting_HiringOrg_Description,details_JobPositionPosting_HiringOrg_Logo,details_JobPositionPosting_HiringOrg_WorkPlaceOrganizationNumber,details_JobPositionPosting_HiringOrg_OrganizationNumber,details_JobPositionPosting_HiringOrg_OrganizationDescription,details_JobPositionPosting_RecruitingCompany,details_JobPositionPosting_PublicationStartDate,details_JobPositionPosting_PublicationEndDate,details_JobPositionPosting_JobPositionInformation_PositionTitle,details_JobPositionPosting_JobPositionInformation_Purpose,details_JobPositionPosting_JobPositionInformation_WorkLocation_AddressLine,details_JobPositionPosting_JobPositionInformation_WorkLocation_Country_Id,details_JobPositionPosting_JobPositionInformation_WorkLocation_Country_Name,details_JobPositionPosting_JobPositionInformation_WorkLocation_Municipality_Id,details_JobPositionPosting_JobPositionInformation_WorkLocation_Municipality_Name,details_JobPositionPosting_JobPositionInformation_WorkLocation_Region_Id,details_JobPositionPosting_JobPositionInformation_WorkLocation_Region_Name,details_JobPositionPosting_JobPositionInformation_WorkLocation_PostalCode,details_JobPositionPosting_JobPositionInformation_WorkLocation_City,details_JobPositionPosting_JobPositionInformation_EmploymentType,details_JobPositionPosting_JobPositionInformation_WeeklyWorkHours_TypeId,details_JobPositionPosting_JobPositionInformation_WeeklyWorkHours_TypeName,details_JobPositionPosting_JobPositionInformation_WeeklyWorkHours_Description,details_JobPositionPosting_JobPositionInformation_CompensationDescription,details_JobPositionPosting_JobPositionInformation_NumberToFill,details_JobPositionPosting_JobPositionInformation_DriverLicense,details_JobPositionPosting_JobPositionInformation_Occupation_DiscoWeb,details_JobPositionPosting_JobPositionInformation_Occupation_AlternateNames,details_JobPositionPosting_JobPositionInformation_Occupation_GroupId,details_JobPositionPosting_JobPositionInformation_Occupation_AreaId,details_JobPositionPosting_JobPositionInformation_Occupation_Id,details_JobPositionPosting_JobPositionInformation_Occupation_Name,details_JobPositionPosting_JobPositionInformation_IsGovernmentHiring,details_JobPositionPosting_JobPositionInformation_JppContacts,details_JobPositionPosting_JobPositionInformation_EmploymentDate,details_JobPositionPosting_IsRecruitmentOfForeignNationals,details_JobPositionPosting_IsWorkInDenmark,details_JobPositionPosting_IsAnonymousEmployer,details_JobPositionPosting_IsDisabilityFriendly,details_JobPositionPosting_JppType,details_JobPositionPosting_ApplicationDetails_WorkHourMax,details_JobPositionPosting_ApplicationDetails_WorkHourMin,details_JobPositionPosting_ApplicationDetails_DailyWorkTimeWeekend,details_JobPositionPosting_ApplicationDetails_DailyWorkTimeNight,details_JobPositionPosting_ApplicationDetails_DailyWorkTimeEvening,details_JobPositionPosting_ApplicationDetails_DailyWorkTimeDay,details_JobPositionPosting_ApplicationDetails_ReferenceText,details_JobPositionPosting_ApplicationDetails_RemarksToApplicant,details_JobPositionPosting_ApplicationDetails_ByEmail,details_JobPositionPosting_ApplicationDetails_ByPhone,details_JobPositionPosting_ApplicationDetails_ApplyViaUrl,details_JobPositionPosting_ApplicationDetails_ReplyInWriting,details_JobPositionPosting_ApplicationDetails_ApplicationDeadlineDate,details_JobPositionPosting_ContactAuthorityPhoneNumber_Number,details_JobPositionPosting_ContactAuthorityPhoneNumber_Type,details_JobPositionPosting_ContactAuthorityPhoneNumber_Description,details_JobPositionPosting_Status,details_LogoUrl,details_Address,details_ShowMap,details_ShowShareButtonJobLog,details_JobLogUrl,details_JobLogTemplateModel_Identifier,details_JobLogTemplateModel_UseWorkPlaceAddressForJoblog,details_JobLogTemplateModel_Category,details_JobLogTemplateModel_CvCustomerIdentifier,details_JobLogTemplateModel_JobSeekingStatus,details_JobLogTemplateModel_Title,details_JobLogTemplateModel_IsApplicationSourceRequired,details_JobLogTemplateModel_ApplicationSource,details_JobLogTemplateModel_IsWeeklyWorkTimeRequired,details_JobLogTemplateModel_WeeklyWorkTime,details_JobLogTemplateModel_HoursPerWeek,details_JobLogTemplateModel_JobnetJobPostingIdentifier,details_JobLogTemplateModel_JobAdDocument_Title,details_JobLogTemplateModel_JobAdDocument_Identifier,details_JobLogTemplateModel_JobAdDocument_IsDeletedBySystem,details_JobLogTemplateModel_JobAdDocument_IsDeletedByUser,details_JobLogTemplateModel_JobAdFile,details_JobLogTemplateModel_Company_JobLogEntryCategory,details_JobLogTemplateModel_Company_ShowAddressFieldsEvenIfEmpty,details_JobLogTemplateModel_Company_Name,details_JobLogTemplateModel_Company_Address,details_JobLogTemplateModel_Company_Country,details_JobLogTemplateModel_Company_EmploymentAreaID,details_JobLogTemplateModel_Company_PostCode,details_JobLogTemplateModel_Company_IsCountryAndTownAndPostCodeEmpty,details_JobLogTemplateModel_Company_IsTownAndPostCodeEmpty,details_JobLogTemplateModel_Company_IsCountryDanmark,details_JobLogTemplateModel_Company_Town,details_JobLogTemplateModel_Company_ContactPerson,details_JobLogTemplateModel_Company_Phone,details_JobLogTemplateModel_Company_Email,details_JobLogTemplateModel_Company_Latitude,details_JobLogTemplateModel_Company_Longitude,details_JobLogTemplateModel_Company_DailyTravelTimeInMinutes,details_JobLogTemplateModel_Company_DistanceToCompanyInMeters,details_JobLogTemplateModel_Company_IsCreateMode,details_JobLogTemplateModel_TypeOfSubmission,details_JobLogTemplateModel_SubmissionDate,details_JobLogTemplateModel_SubmissionDateFormatted,details_JobLogTemplateModel_SubmissionDateTiks,details_JobLogTemplateModel_IsSubmissionDateRequired,details_JobLogTemplateModel_Status,details_JobLogTemplateModel_DateCreatedFormatted,details_JobLogTemplateModel_DateCreated,details_JobLogTemplateModel_DateModifiedFormatted,details_JobLogTemplateModel_DateModified,details_JobLogTemplateModel_LastModifiedDateTiks,details_JobLogTemplateModel_DateClosed,details_JobLogTemplateModel_JobApplicationDocument_Title,details_JobLogTemplateModel_JobApplicationDocument_Identifier,details_JobLogTemplateModel_JobApplicationDocument_IsDeletedBySystem,details_JobLogTemplateModel_JobApplicationDocument_IsDeletedByUser,details_JobLogTemplateModel_CvDocument_Title,details_JobLogTemplateModel_CvDocument_Identifier,details_JobLogTemplateModel_CvDocument_IsDeletedBySystem,details_JobLogTemplateModel_CvDocument_IsDeletedByUser,details_JobLogTemplateModel_JobApplicationFile,details_JobLogTemplateModel_CvFile,details_JobLogTemplateModel_SubmissionDeadlineDate,details_JobLogTemplateModel_IsPersisted,details_JobLogTemplateModel_ServerValidationErrors,details_JobLogTemplateModel_HasServerValidationErrors,details_JoblogWorkTime_WorkHour,details_JoblogWorkTime_DailyWorkTime,details_Place,details_OpenPrintDialog,details_WorkPlaceInfoText,details_JobCenterContactDetails,details_WorkPlaceDescriptionText,details_FavoriteText,details_IsFavorite,details_ShowFavorite,details_MetaOgTextForSharing,details_DescriptionForSharing,details_TitleForSharing,details_RutePlan,details_FormattedPurpose,details_MapUrl,details_OrganizationNumber,details_ShowSearchJobButton,details_ShowPrint,details_BackToFindWorkButtonUrl,isExternal
0,False,1,UngAalborg søger en teamleder til vores aktivitetshuse,UngAalborg søger en teamleder til vores aktivitetshuse,"Du har nu muligheden for at blive teamleder for fire af UngAalborgs Aktivitetshuse: UngAalborg Cross, UngAalborg Skate, Sejlflod Aktivitetshus og UngAalborg Knallertkøreskole. UngA",Aalborg Ungdomsskole,Kjellerups Torv 5,9000,Aalborg,False,False,False,True,2022-05-09T00:00:00,2022-06-01T00:00:00,1. juni 2022,0001-01-01T00:00:00,False,False,https://job.jobnet.dk/CV/FindWork/Details/5593410,Nordjylland,Aalborg,Danmark,9000,,,,Fuldtid,Ledelse,Sundhedsområdet,"Teamleder, sundhed",57.0464,9.9316,,,61996,58491,29189420,False,False,https://job.jobnet.dk/CV/FindWork/DetailsSocialmedia/5593410,https://job.jobnet.dk/CV/FindWork/Details/5593410,https://job.jobnet.dk/CV/FindWork/Details/5593410,True,5593410,57.0464,9.9316,"{'Id': 1, 'Name': 'Fuldtid'}, {'Id': 16, 'Name': 'Deltid'}","{'Id': 1, 'Name': 'Almindelige vilkår'}, {'Id': 2, 'Name': 'Fleksjob'}, {'Id': 3, 'Name': 'Skånejob'}, {'Id': 4, 'Name': 'Egnet til efterlønnere og seniorer'}, {'Id': 5, 'Name': 'Job med løntilskud'}, {'Id': 6, 'Name': 'Rotationsjob'}, {'Id': 7, 'Name': 'Virksomhedspraktik'}","{'Id': 1, 'Name': 'Fastansættelse'}, {'Id': 16, 'Name': 'Tidsbegrænset ansættelse'}",Aalborg Ungdomsskole,Kjellerups Torv 5,58,Danmark,851,Aalborg,1,Nordjylland,9000,Aalborg,,0,Primary,,,,None,,1011345537,29189420,None,5593410,5593410,Aalborg Ungdomsskole,Kjellerups Torv 5,58,Danmark,851,Aalborg,1,Nordjylland,9000,Aalborg,,0,Primary,,,,None,,1011345537,29189420,None,,2022-05-09T00:00:00,2022-06-01T00:00:00,UngAalborg søger en teamleder til vores aktivitetshuse,"Du har nu muligheden for at blive teamleder for fire af UngAalborgs Aktivitetshuse: UngAalborg Cross, UngAalborg Skate, Sejlflod Aktivitetshus og UngAalborg Knallertkøreskole.  UngAalborg søger en oprigtig og tillidsskabende person, som kan lede på det der virker og koordinere disse aktivitetshuse, som er organiseret under Klubber, Skoletilbud og Fritidstilbud. Vi har brug for en teamleder med en stærk personlighed, som skal være omdrejningspunktet for børn og unges aktiviteter i samarbejde med kollegaer i andre afdelinger i UngAalborg samt relevante samarbejdspartnere i Aalborg Kommune. Du er dermed en vigtig primus motor for det gode ungeliv gennem aktiviteter, positive fællesskaber og leg og det er altafgørende, at du besidder en høj grad af relationskompetence. Kan du motivere unge til at deltage i sunde, motiverende og lærerige aktiviteter? Kan du motivere voksne til at lave fede aktiviteter med og for de unge? Giver netop dette arbejde dig energi, så kan du gøre en forskel for mange unge i Aalborg Kommune - og du bør læse videre. Formålet og opgaven I UngAalborg har vi brug for en teamleder med en stærk personlighed, der gennem sine ledelseskompetencer, skabe følgeskab og medvirke til unges udvikling af et positivt selvbillede og mangfoldigt perspektiv på fremtiden, samt styrke de unges deltagelsesmuligheder lokalt og globalt i samfundet. Du skal lede mod en bæredygtig organisation og tilgå medarbejdere og kollegaer på en kreativ, motiverende og nærværende facon. Den centrale opgave er at understøtte og sikre samarbejdet på tværs, internt samt eksternt i organisationen gennem UngAalborgs vision og kerneopgave. Deriblandt at etablere og styrke fritidshold, lede, koordinere og sparre  med medarbejderne, samt sikre at Aktivitetshusenes kompetencer er synlige og tilgængelige for alle på UngAalborg samarbejdsplatforme, heriblandt skoler, ungdomsuddannelser, klubber, fritidscentrene m.m. Formålet med UngAalborgs Aktivitetshuse er at give de unge en platform, hvor de kan få lov til, med en aktiv og legende tilgang, at udvikle sig i fællesskab med andre unge. Aktivitetshusene er ligeledes et rum for diversitet, dannelsesprocesser, sundhed samt unges livsmestring.  I Sejlflod Aktivitetshus vil du varetage ansvaret for hele processen i huset, fra den første kontakt med brugerne til facilitering af aktiviteten. Man vil have ansvaret for den daglige drift af bygninger og inventar på de enkelte huse.  Se mere på UngAalborg Aktivitetshuse Om organisationen I UngAalborg har vi ca. 14.000 unge i vores målgruppe, 13-19 år, der alle skal have mulighed for at opleve og deltage i meningsfyldte fællesskaber, samt møde fritidstilbud af høj kvalitet med fokus på nærvær og engagement. I UngAalborg er vi optaget af arbejdet med ""det fælles tredje"". Vores aktiviteter er aldrig målet, men midlet til mere fællesskab, større selvtillid og de unges positive selvbillede. UngAalborg er organiseret under Børn og Unge i Aalborg Kommune.  Vi kan tilbyde dig:     Et job i en dynamisk organisation, hvor arbejdsglæde og tillid er i højsædet.   Muligheder for udvikling af kompetencer.   Et tæt samarbejde i et stærk, tværfaglig og nytænkende hold af teamledere i afdelingen for Klubber, fritid og skoletilbud og i resten af UngAalborg.   En del af et velfungerende lederteam, hvor vi forpligter os til en fælles kurs gennem et professionelt samspil mellem mennesker og på tværs af organisationen.   Højt til loftet, humor og plads til fejl!     Det er et perfekt match, hvis du:     Er fleksibel og kvalitetsbevidst, og hvor den gode relation er bærende i det ledelsesmæssige arbejde.   Har drive, er opsøgende og kan inspirere medarbejdere til at være deltagende, visionære og nysgerrige.   Er modig, nysgerrig og løsningsorienteret - også når det er svært.   Har flair og forståelse for vigtigheden af den lokale forankring og hvilken betydning, det har for de unge i nærmiljøet.   Kan arbejde selvstændigt i sit ansvarsområde og har gode formidlingsevner.   Kan arbejde med skiftende arbejdstider, heri weekender og aftenarbejde, samt være aktiv deltagende på fritidshold og i aktivitetshusene.    Kan planlægge, koordinere og facilitere kreative processer, samt sikre opfølgning på årshjul både for helheden og det enkelte aktivitetshus.   Har erfaring og faglighed, som understøtter bevægelse, leg og idræt.   Har erfaring med ledelse og har det godt med at skabe succes gennem andre.   Har en diplom i ledelse, er påbegyndt en eller ønsker at tage en uddannelse i ledelse.    Du kan læse mere om UngAalborg på www.ungaalborg.dk Løn og ansættelsesvilkår Stillingen er en fuldtidsstilling på 37 timer ugentligt og skal besættes pr. 1. august 2022.  Løn og ansættelse er efter gældende overenskomst.  Arbejdsstedet er med udgangspunkt fra UngAalborgs hovedkontor i Nordkraft (KUL), Kjellerups Torv 5, 9000 Aalborg. Men det vil være et krav, at der prioriteres fast tilstedeværelse i de enkelte aktivitetshuse. Der er ansøgningsfrist onsdag den 1. juni 2022. 1. samtale afholdes torsdag den 9. juni 2022 og evt. 2. samtale mandag den 13. juni 2022. Ved 2. samtale vil du få stillet en opgave. Du kan få yderlige oplysninger om stillingen ved at kontakte afdelingsleder for Klubber, skoletilbud og fritidstilbud: Torben Jespersen Nielsen på tlf.: 9352 0913 eller mail: toni-skole@aalborg.dk. Hvis du er nysgerrig på hvilke områder/lokationer opgaverne bl.a. skal løses på, vil der torsdag den 19. maj, være mulighed for at besøge UngAalborg Crossbane. Gl. Hvorupvej 137, 9400. Nørresundby kl. 16:30-17:30 og Sejlflod Aktivitetshus, Vigen 47, 9280 Storvorde kl. 18:00-19:00. Tilmelding til rundvisning foretages via mail til Rikke Wulff på mail rkw-skole@aalborg.dk  Tilstede vil være afdelingsleder Torben J. Nielsen, som vil vise rundt og besvare spørgsmål.  Forud for endelig ansættelse indhentes der relevante referencer samt straffe- og børneattest. Send ansøgning Du sender din ansøgning ved at trykke på knappen ""Send ansøgning"" og udfylde den formular, som kommer frem. Det er også muligt at vedhæfte bilag som f.eks. ansøgning og CV i begrænset omfang. I Aalborg Kommune tror vi på, at mangfoldighed skaber værdi, og vi bruger det potentiale, der ligger i forskelligheden til at løse vores kerneopgave endnu bedre. Vi behandler alle vores medarbejdere ligeværdigt, og opfordrer alle til at søge stillingen – uanset alder, køn, religion, handicap eller etnisk tilhørsforhold.  Vores arbejdsplads – kom med på en fantastisk rejse Som medarbejder i Aalborg Kommune bliver du en del af et stærkt fællesskab, der tæller 16.000 kollegaer og som hver dag udvikler sig sammen for at skabe de bedste resultater for borgere, virksomheder og foreninger.    Vores kommune – i rivende udvikling Aalborg vokser hvert år med flere end 1000 nye indbyggere og takket være et handlekraftigt fællesskab, der gør tingene sammen, er der de sidste årtier blevet skabt tusinder af nye arbejds- og studiepladser samt et rigt kultur- og fritidsliv. 
 Denne jobannonce blev oprindeligt opslået på https://www.ofir.dk/
 (Den originale annonce kan ses på: https://www.ofir.dk/showojob?ofirid=0e1963c0)",Kjellerups Torv 5,58,Danmark,851,Aalborg,1,Nordjylland,9000,Aalborg,1,1,Fuldtid,None,None,1,,0,,0,0,0,,False,"{'Id': 7971831, 'Email': None, 'FaxNumber': None, 'PersonName': 'Torben Jespersen Nielsen', 'FirstName': 'Torben', 'LastName': 'Jespersen Nielsen', 'PositionTitle': None, 'PhoneNumbers': [{'Number': '93520913', 'Type': 0, 'Description': 'Hovednummer'}]}",,False,False,False,False,4,,,False,False,False,False,,,,,https://www.ofir.dk/resultat/Jobannonce.aspx?ofirId=0e1963c0&action=sendApplicationUrl,False,2022-06-01T00:00:00,,0,Primary,7,/CV/FindWork/GetLogo?JobAdId=5593410&Organisation=29189420,"Kjellerups Torv 5,9000, Aalborg",True,False,/CV/Jobseeking/JobLog/CreateJobSearch?JobnetJobPostingIdentifier=5593410&Company.Name=Aalborg Ungdomsskole&SubmissionDeadlineDate=2022-6-1&Title=UngAalborg søger en teamleder til vores aktivitetshuse&WeeklyWorkTime=1,00000000-0000-0000-0000-000000000000,False,0,,,UngAalborg søger en teamleder til vores aktivitetshuse,True,,True,1,,5593410,,,False,False,,0,False,Aalborg Ungdomsskole,Kjellerups Torv 5,,,9000,False,False,False,Aalborg,Torben Jespersen Nielsen,93520913,,,,,,False,,2022-06-01T00:00:00,,0,False,0,,,,,0,,,,False,False,,,False,False,,,,False,,False,,,Arbejdspladsen ligger i Aalborg kommune,False,Aalborg Ungdomsskole,,None,,False,False,"Du har nu muligheden for at blive teamleder for fire af UngAalborgs Aktivitetshuse: UngAalborg Cross, UngAalborg Skate, Sejlflod Aktivitetshus og UngAalborg Knallertkøreskole. UngAalborg søger en oprigtig og tillidsskabende person, som kan lede på det der virker og koordinere disse aktivitetshuse, som er organiseret under Klubber, Skoletilbud og Fr","""Du har nu muligheden for at blive teamleder for fire af UngAalborgs Aktivitetshuse: UngAalborg Cross, UngAalborg Skate, Sejlflod Aktivitetshus og UngAalborg Knallertkøreskole. UngAalborg søger en oprigtig og tillidsskabende person, som kan lede på det der virker og koordinere disse aktivitetshuse, som er organiseret under Klubber, Skoletilbud og Fr""","""UngAalborg søger en teamleder til vores aktivitetshuse""","https://www.google.dk/maps/dir//Kjellerups+Torv+5,9000,+Aalborg/","Du har nu muligheden for at blive teamleder for fire af UngAalborgs Aktivitetshuse: UngAalborg Cross, UngAalborg Skate, Sejlflod Aktivitetshus og UngAalborg Knallertkøreskole.  UngAalborg søger en oprigtig og tillidsskabende person, som kan lede på det der virker og koordinere disse aktivitetshuse, som er organiseret under Klubber, Skoletilbud og Fritidstilbud. Vi har brug for en teamleder med en stærk personlighed, som skal være omdrejningspunktet for børn og unges aktiviteter i samarbejde med kollegaer i andre afdelinger i UngAalborg samt relevante samarbejdspartnere i Aalborg Kommune. Du er dermed en vigtig primus motor for det gode ungeliv gennem aktiviteter, positive fællesskaber og leg og det er altafgørende, at du besidder en høj grad af relationskompetence. Kan du motivere unge til at deltage i sunde, motiverende og lærerige aktiviteter? Kan du motivere voksne til at lave fede aktiviteter med og for de unge? Giver netop dette arbejde dig energi, så kan du gøre en forskel for mange unge i Aalborg Kommune - og du bør læse videre. Formålet og opgaven I UngAalborg har vi brug for en teamleder med en stærk personlighed, der gennem sine ledelseskompetencer, skabe følgeskab og medvirke til unges udvikling af et positivt selvbillede og mangfoldigt perspektiv på fremtiden, samt styrke de unges deltagelsesmuligheder lokalt og globalt i samfundet. Du skal lede mod en bæredygtig organisation og tilgå medarbejdere og kollegaer på en kreativ, motiverende og nærværende facon. Den centrale opgave er at understøtte og sikre samarbejdet på tværs, internt samt eksternt i organisationen gennem UngAalborgs vision og kerneopgave. Deriblandt at etablere og styrke fritidshold, lede, koordinere og sparre  med medarbejderne, samt sikre at Aktivitetshusenes kompetencer er synlige og tilgængelige for alle på UngAalborg samarbejdsplatforme, heriblandt skoler, ungdomsuddannelser, klubber, fritidscentrene m.m. Formålet med UngAalborgs Aktivitetshuse er at give de unge en platform, hvor de kan få lov til, med en aktiv og legende tilgang, at udvikle sig i fællesskab med andre unge. Aktivitetshusene er ligeledes et rum for diversitet, dannelsesprocesser, sundhed samt unges livsmestring.  I Sejlflod Aktivitetshus vil du varetage ansvaret for hele processen i huset, fra den første kontakt med brugerne til facilitering af aktiviteten. Man vil have ansvaret for den daglige drift af bygninger og inventar på de enkelte huse.  Se mere på UngAalborg Aktivitetshuse Om organisationen I UngAalborg har vi ca. 14.000 unge i vores målgruppe, 13-19 år, der alle skal have mulighed for at opleve og deltage i meningsfyldte fællesskaber, samt møde fritidstilbud af høj kvalitet med fokus på nærvær og engagement. I UngAalborg er vi optaget af arbejdet med ""det fælles tredje"". Vores aktiviteter er aldrig målet, men midlet til mere fællesskab, større selvtillid og de unges positive selvbillede. UngAalborg er organiseret under Børn og Unge i Aalborg Kommune.  Vi kan tilbyde dig:     Et job i en dynamisk organisation, hvor arbejdsglæde og tillid er i højsædet.   Muligheder for udvikling af kompetencer.   Et tæt samarbejde i et stærk, tværfaglig og nytænkende hold af teamledere i afdelingen for Klubber, fritid og skoletilbud og i resten af UngAalborg.   En del af et velfungerende lederteam, hvor vi forpligter os til en fælles kurs gennem et professionelt samspil mellem mennesker og på tværs af organisationen.   Højt til loftet, humor og plads til fejl!     Det er et perfekt match, hvis du:     Er fleksibel og kvalitetsbevidst, og hvor den gode relation er bærende i det ledelsesmæssige arbejde.   Har drive, er opsøgende og kan inspirere medarbejdere til at være deltagende, visionære og nysgerrige.   Er modig, nysgerrig og løsningsorienteret - også når det er svært.   Har flair og forståelse for vigtigheden af den lokale forankring og hvilken betydning, det har for de unge i nærmiljøet.   Kan arbejde selvstændigt i sit ansvarsområde og har gode formidlingsevner.   Kan arbejde med skiftende arbejdstider, heri weekender og aftenarbejde, samt være aktiv deltagende på fritidshold og i aktivitetshusene.    Kan planlægge, koordinere og facilitere kreative processer, samt sikre opfølgning på årshjul både for helheden og det enkelte aktivitetshus.   Har erfaring og faglighed, som understøtter bevægelse, leg og idræt.   Har erfaring med ledelse og har det godt med at skabe succes gennem andre.   Har en diplom i ledelse, er påbegyndt en eller ønsker at tage en uddannelse i ledelse.    Du kan læse mere om UngAalborg på  www.ungaalborg.dk Løn og ansættelsesvilkår Stillingen er en fuldtidsstilling på 37 timer ugentligt og skal besættes pr. 1. august 2022.  Løn og ansættelse er efter gældende overenskomst.  Arbejdsstedet er med udgangspunkt fra UngAalborgs hovedkontor i Nordkraft (KUL), Kjellerups Torv 5, 9000 Aalborg. Men det vil være et krav, at der prioriteres fast tilstedeværelse i de enkelte aktivitetshuse. Der er ansøgningsfrist onsdag den 1. juni 2022. 1. samtale afholdes torsdag den 9. juni 2022 og evt. 2. samtale mandag den 13. juni 2022. Ved 2. samtale vil du få stillet en opgave. Du kan få yderlige oplysninger om stillingen ved at kontakte afdelingsleder for Klubber, skoletilbud og fritidstilbud: Torben Jespersen Nielsen på tlf.: 9352 0913 eller mail: toni-skole@aalborg.dk. Hvis du er nysgerrig på hvilke områder/lokationer opgaverne bl.a. skal løses på, vil der torsdag den 19. maj, være mulighed for at besøge UngAalborg Crossbane. Gl. Hvorupvej 137, 9400. Nørresundby kl. 16:30-17:30 og Sejlflod Aktivitetshus, Vigen 47, 9280 Storvorde kl. 18:00-19:00. Tilmelding til rundvisning foretages via mail til Rikke Wulff på mail rkw-skole@aalborg.dk  Tilstede vil være afdelingsleder Torben J. Nielsen, som vil vise rundt og besvare spørgsmål.  Forud for endelig ansættelse indhentes der relevante referencer samt straffe- og børneattest. Send ansøgning Du sender din ansøgning ved at trykke på knappen ""Send ansøgning"" og udfylde den formular, som kommer frem. Det er også muligt at vedhæfte bilag som f.eks. ansøgning og CV i begrænset omfang. I Aalborg Kommune tror vi på, at mangfoldighed skaber værdi, og vi bruger det potentiale, der ligger i forskelligheden til at løse vores kerneopgave endnu bedre. Vi behandler alle vores medarbejdere ligeværdigt, og opfordrer alle til at søge stillingen – uanset alder, køn, religion, handicap eller etnisk tilhørsforhold.  Vores arbejdsplads – kom med på en fantastisk rejse Som medarbejder i Aalborg Kommune bliver du en del af et stærkt fællesskab, der tæller 16.000 kollegaer og som hver dag udvikler sig sammen for at skabe de bedste resultater for borgere, virksomheder og foreninger.    Vores kommune – i rivende udvikling Aalborg vokser hvert år med flere end 1000 nye indbyggere og takket være et handlekraftigt fællesskab, der gør tingene sammen, er der de sidste årtier blevet skabt tusinder af nye arbejds- og studiepladser samt et rigt kultur- og fritidsliv. 
 Denne jobannonce blev oprindeligt opslået på  https://www.ofir.dk/ 
 (Den originale annonce kan ses på:  https://www.ofir.dk/showojob?ofirid=0e1963c0 )","https://www.google.dk/maps/place/Kjellerups+Torv+5,9000,+Aalborg/",29189420,False,False,,False
