summary_AutomatchType,summary_Abroad,summary_Weight,summary_Title,summary_JobHeadline,summary_Presentation,summary_HiringOrgName,summary_WorkPlaceAddress,summary_WorkPlacePostalCode,summary_WorkPlaceCity,summary_WorkPlaceOtherAddress,summary_WorkPlaceAbroad,summary_WorkPlaceNotStatic,summary_UseWorkPlaceAddressForJoblog,summary_PostingCreated,summary_LastDateApplication,summary_FormattedLastDateApplication,summary_AssignmentStartDate,summary_IsHotjob,summary_IsExternal,summary_Url,summary_Region,summary_Municipality,summary_Country,summary_PostalCode,summary_PostalCodeName,summary_JobAnnouncementType,summary_EmploymentType,summary_WorkHours,summary_OccupationArea,summary_OccupationGroup,summary_Occupation,summary_Location_Latitude,summary_Location_Longitude,summary_JoblogWorkTime_WorkHour,summary_JoblogWorkTime_DailyWorkTime,summary_WorkplaceID,summary_OrganisationId,summary_HiringOrgCVR,summary_UserLoggedIn,summary_AnonymousEmployer,summary_ShareUrl,summary_DetailsUrl,summary_JobLogUrl,summary_HasLocationValues,summary_ID,summary_Latitude,summary_Longitude,details_WorkSchedule,details_WorkConditions,details_EmploymentTypes,details_WorkPlace_Name,details_WorkPlace_Address_AddressLine,details_WorkPlace_Address_Country_Id,details_WorkPlace_Address_Country_Name,details_WorkPlace_Address_Municipality_Id,details_WorkPlace_Address_Municipality_Name,details_WorkPlace_Address_Region_Id,details_WorkPlace_Address_Region_Name,details_WorkPlace_Address_PostalCode,details_WorkPlace_Address_City,details_WorkPlace_PhoneNumber_Number,details_WorkPlace_PhoneNumber_Type,details_WorkPlace_PhoneNumber_Description,details_WorkPlace_FaxNumber,details_WorkPlace_Email,details_WorkPlace_WebAddress,details_WorkPlace_Description,details_WorkPlace_Logo,details_WorkPlace_WorkPlaceOrganizationNumber,details_WorkPlace_OrganizationNumber,details_WorkPlace_OrganizationDescription,details_JobPositionPosting_Id,details_JobPositionPosting_OriginalJppId,details_JobPositionPosting_HiringOrg_Name,details_JobPositionPosting_HiringOrg_Address_AddressLine,details_JobPositionPosting_HiringOrg_Address_Country_Id,details_JobPositionPosting_HiringOrg_Address_Country_Name,details_JobPositionPosting_HiringOrg_Address_Municipality_Id,details_JobPositionPosting_HiringOrg_Address_Municipality_Name,details_JobPositionPosting_HiringOrg_Address_Region_Id,details_JobPositionPosting_HiringOrg_Address_Region_Name,details_JobPositionPosting_HiringOrg_Address_PostalCode,details_JobPositionPosting_HiringOrg_Address_City,details_JobPositionPosting_HiringOrg_PhoneNumber_Number,details_JobPositionPosting_HiringOrg_PhoneNumber_Type,details_JobPositionPosting_HiringOrg_PhoneNumber_Description,details_JobPositionPosting_HiringOrg_FaxNumber,details_JobPositionPosting_HiringOrg_Email,details_JobPositionPosting_HiringOrg_WebAddress,details_JobPositionPosting_HiringOrg_Description,details_JobPositionPosting_HiringOrg_Logo,details_JobPositionPosting_HiringOrg_WorkPlaceOrganizationNumber,details_JobPositionPosting_HiringOrg_OrganizationNumber,details_JobPositionPosting_HiringOrg_OrganizationDescription,details_JobPositionPosting_RecruitingCompany,details_JobPositionPosting_PublicationStartDate,details_JobPositionPosting_PublicationEndDate,details_JobPositionPosting_JobPositionInformation_PositionTitle,details_JobPositionPosting_JobPositionInformation_Purpose,details_JobPositionPosting_JobPositionInformation_WorkLocation_AddressLine,details_JobPositionPosting_JobPositionInformation_WorkLocation_Country_Id,details_JobPositionPosting_JobPositionInformation_WorkLocation_Country_Name,details_JobPositionPosting_JobPositionInformation_WorkLocation_Municipality_Id,details_JobPositionPosting_JobPositionInformation_WorkLocation_Municipality_Name,details_JobPositionPosting_JobPositionInformation_WorkLocation_Region_Id,details_JobPositionPosting_JobPositionInformation_WorkLocation_Region_Name,details_JobPositionPosting_JobPositionInformation_WorkLocation_PostalCode,details_JobPositionPosting_JobPositionInformation_WorkLocation_City,details_JobPositionPosting_JobPositionInformation_EmploymentType,details_JobPositionPosting_JobPositionInformation_WeeklyWorkHours_TypeId,details_JobPositionPosting_JobPositionInformation_WeeklyWorkHours_TypeName,details_JobPositionPosting_JobPositionInformation_WeeklyWorkHours_Description,details_JobPositionPosting_JobPositionInformation_CompensationDescription,details_JobPositionPosting_JobPositionInformation_NumberToFill,details_JobPositionPosting_JobPositionInformation_DriverLicense,details_JobPositionPosting_JobPositionInformation_Occupation_DiscoWeb,details_JobPositionPosting_JobPositionInformation_Occupation_AlternateNames,details_JobPositionPosting_JobPositionInformation_Occupation_GroupId,details_JobPositionPosting_JobPositionInformation_Occupation_AreaId,details_JobPositionPosting_JobPositionInformation_Occupation_Id,details_JobPositionPosting_JobPositionInformation_Occupation_Name,details_JobPositionPosting_JobPositionInformation_IsGovernmentHiring,details_JobPositionPosting_JobPositionInformation_JppContacts,details_JobPositionPosting_JobPositionInformation_EmploymentDate,details_JobPositionPosting_IsRecruitmentOfForeignNationals,details_JobPositionPosting_IsWorkInDenmark,details_JobPositionPosting_IsAnonymousEmployer,details_JobPositionPosting_IsDisabilityFriendly,details_JobPositionPosting_JppType,details_JobPositionPosting_ApplicationDetails_WorkHourMax,details_JobPositionPosting_ApplicationDetails_WorkHourMin,details_JobPositionPosting_ApplicationDetails_DailyWorkTimeWeekend,details_JobPositionPosting_ApplicationDetails_DailyWorkTimeNight,details_JobPositionPosting_ApplicationDetails_DailyWorkTimeEvening,details_JobPositionPosting_ApplicationDetails_DailyWorkTimeDay,details_JobPositionPosting_ApplicationDetails_ReferenceText,details_JobPositionPosting_ApplicationDetails_RemarksToApplicant,details_JobPositionPosting_ApplicationDetails_ByEmail,details_JobPositionPosting_ApplicationDetails_ByPhone,details_JobPositionPosting_ApplicationDetails_ApplyViaUrl,details_JobPositionPosting_ApplicationDetails_ReplyInWriting,details_JobPositionPosting_ApplicationDetails_ApplicationDeadlineDate,details_JobPositionPosting_ContactAuthorityPhoneNumber_Number,details_JobPositionPosting_ContactAuthorityPhoneNumber_Type,details_JobPositionPosting_ContactAuthorityPhoneNumber_Description,details_JobPositionPosting_Status,details_LogoUrl,details_Address,details_ShowMap,details_ShowShareButtonJobLog,details_JobLogUrl,details_JobLogTemplateModel_Identifier,details_JobLogTemplateModel_UseWorkPlaceAddressForJoblog,details_JobLogTemplateModel_Category,details_JobLogTemplateModel_CvCustomerIdentifier,details_JobLogTemplateModel_JobSeekingStatus,details_JobLogTemplateModel_Title,details_JobLogTemplateModel_IsApplicationSourceRequired,details_JobLogTemplateModel_ApplicationSource,details_JobLogTemplateModel_IsWeeklyWorkTimeRequired,details_JobLogTemplateModel_WeeklyWorkTime,details_JobLogTemplateModel_HoursPerWeek,details_JobLogTemplateModel_JobnetJobPostingIdentifier,details_JobLogTemplateModel_JobAdDocument_Title,details_JobLogTemplateModel_JobAdDocument_Identifier,details_JobLogTemplateModel_JobAdDocument_IsDeletedBySystem,details_JobLogTemplateModel_JobAdDocument_IsDeletedByUser,details_JobLogTemplateModel_JobAdFile,details_JobLogTemplateModel_Company_JobLogEntryCategory,details_JobLogTemplateModel_Company_ShowAddressFieldsEvenIfEmpty,details_JobLogTemplateModel_Company_Name,details_JobLogTemplateModel_Company_Address,details_JobLogTemplateModel_Company_Country,details_JobLogTemplateModel_Company_EmploymentAreaID,details_JobLogTemplateModel_Company_PostCode,details_JobLogTemplateModel_Company_IsCountryAndTownAndPostCodeEmpty,details_JobLogTemplateModel_Company_IsTownAndPostCodeEmpty,details_JobLogTemplateModel_Company_IsCountryDanmark,details_JobLogTemplateModel_Company_Town,details_JobLogTemplateModel_Company_ContactPerson,details_JobLogTemplateModel_Company_Phone,details_JobLogTemplateModel_Company_Email,details_JobLogTemplateModel_Company_Latitude,details_JobLogTemplateModel_Company_Longitude,details_JobLogTemplateModel_Company_DailyTravelTimeInMinutes,details_JobLogTemplateModel_Company_DistanceToCompanyInMeters,details_JobLogTemplateModel_Company_IsCreateMode,details_JobLogTemplateModel_TypeOfSubmission,details_JobLogTemplateModel_SubmissionDate,details_JobLogTemplateModel_SubmissionDateFormatted,details_JobLogTemplateModel_SubmissionDateTiks,details_JobLogTemplateModel_IsSubmissionDateRequired,details_JobLogTemplateModel_Status,details_JobLogTemplateModel_DateCreatedFormatted,details_JobLogTemplateModel_DateCreated,details_JobLogTemplateModel_DateModifiedFormatted,details_JobLogTemplateModel_DateModified,details_JobLogTemplateModel_LastModifiedDateTiks,details_JobLogTemplateModel_DateClosed,details_JobLogTemplateModel_JobApplicationDocument_Title,details_JobLogTemplateModel_JobApplicationDocument_Identifier,details_JobLogTemplateModel_JobApplicationDocument_IsDeletedBySystem,details_JobLogTemplateModel_JobApplicationDocument_IsDeletedByUser,details_JobLogTemplateModel_CvDocument_Title,details_JobLogTemplateModel_CvDocument_Identifier,details_JobLogTemplateModel_CvDocument_IsDeletedBySystem,details_JobLogTemplateModel_CvDocument_IsDeletedByUser,details_JobLogTemplateModel_JobApplicationFile,details_JobLogTemplateModel_CvFile,details_JobLogTemplateModel_SubmissionDeadlineDate,details_JobLogTemplateModel_IsPersisted,details_JobLogTemplateModel_ServerValidationErrors,details_JobLogTemplateModel_HasServerValidationErrors,details_JoblogWorkTime_WorkHour,details_JoblogWorkTime_DailyWorkTime,details_Place,details_OpenPrintDialog,details_WorkPlaceInfoText,details_JobCenterContactDetails,details_WorkPlaceDescriptionText,details_FavoriteText,details_IsFavorite,details_ShowFavorite,details_MetaOgTextForSharing,details_DescriptionForSharing,details_TitleForSharing,details_RutePlan,details_FormattedPurpose,details_MapUrl,details_OrganizationNumber,details_ShowSearchJobButton,details_ShowPrint,details_BackToFindWorkButtonUrl,isExternal
0,False,1,Hedegårdenes Skole i Roskilde søger matematik- og fysik/kemilærer til udskolingen,Hedegårdenes Skole i Roskilde søger matematik- og fysik/kemilærer til udskolingen,"Skolen har et stærkt og udviklingsorienteret naturfagligt team, som ser frem til en ny kollega! Vores forventninger til dig, udover at du er relationskompetent og fagligt velfunderet",Roskilde Kommune - Hedegårdenes Skole,Københavnsvej 34,4000,Roskilde,False,False,False,True,2022-05-09T00:00:00,2022-05-30T00:00:00,30. maj 2022,0001-01-01T00:00:00,False,False,https://job.jobnet.dk/CV/FindWork/Details/5594219,Øvrige Sjælland,Roskilde,Danmark,4000,,,,Fuldtid,Undervisning og vejledning,Undervisning i grundskoler,Folkeskolelærer,55.6409,12.1016,,,86432,59552,29189404,False,False,https://job.jobnet.dk/CV/FindWork/DetailsSocialmedia/5594219,https://job.jobnet.dk/CV/FindWork/Details/5594219,https://job.jobnet.dk/CV/FindWork/Details/5594219,True,5594219,55.6409,12.1016,"{'Id': 1, 'Name': 'Fuldtid'}, {'Id': 16, 'Name': 'Deltid'}","{'Id': 1, 'Name': 'Almindelige vilkår'}, {'Id': 2, 'Name': 'Fleksjob'}, {'Id': 3, 'Name': 'Skånejob'}, {'Id': 4, 'Name': 'Egnet til efterlønnere og seniorer'}, {'Id': 5, 'Name': 'Job med løntilskud'}, {'Id': 6, 'Name': 'Rotationsjob'}, {'Id': 7, 'Name': 'Virksomhedspraktik'}","{'Id': 1, 'Name': 'Fastansættelse'}, {'Id': 16, 'Name': 'Tidsbegrænset ansættelse'}",Roskilde Kommune - Hedegårdenes Skole,Københavnsvej 34,58,Danmark,265,Roskilde,4,"Hovedstaden, Sjælland og Bornholm",4000,Roskilde,,0,Primary,,,,None,,1014769427,29189404,None,5594219,5594219,Roskilde Kommune - Hedegårdenes Skole,Københavnsvej 34,58,Danmark,265,Roskilde,4,"Hovedstaden, Sjælland og Bornholm",4000,Roskilde,,0,Primary,,,,None,,1014769427,29189404,None,,2022-05-09T00:00:00,2022-05-30T00:00:00,Hedegårdenes Skole i Roskilde søger matematik- og fysik/kemilærer til udskolingen,"Skolen har et stærkt og udviklingsorienteret naturfagligt team, som ser frem til en ny kollega!   Vores forventninger til dig, udover at du er relationskompetent og fagligt velfunderet er at du….     Kan føre til prøve i matematik.   Kan teamsamarbejde med kolleger og samarbejde med forældrene.   Med engagement og anerkendelse kan skabe et trygt læringsmiljø for eleverne.   Er åben og ærlig, både når det går godt, og når det er svært.   Er idérig, selvstændig og udviklingsorienteret.     Til gengæld kan vi tilbyde:     Høj grad af fleksibilitet i arbejdslivet med rige muligheder for at præge egen hverdag samt muligheder for personlig udvikling.   En arbejdsplads med fokus på balance mellem arbejdsliv og privatliv.   Mentorordning for nye lærere uanset erfaring.   En synlig og tydelig ledelse, der med forventning ser frem til nye samarbejdsrelationer.   Fokus på faglig udvikling i fagene – blandt andet igennem struktureret fagudvalgsarbejde.   En skole med høj trivsel både blandt børn og voksne.   En åben og uformel omgangstone.   Et miljø, der værdsætter nye pædagogiske initiativer og gode fællesoplevelser – både faglige og sociale!   Ca. 440 fantastiske børn med forskellige behov.     Skoleprofil  Hedegårdenes Skole er en skole med en givende mangfoldighed i både medarbejder og børnegruppen. Vi ser det som vores kerneopgave hele tiden at kunne tilbyde børnene de bedste læringsmuligheder, og det gør vi igennem et struktureret arbejde både med udvikling af det sociale fællesskab og med en stærk fokus på og monitorering af elevernes faglige resultater.   Skolen er en 112 år gammel byskole centralt placeret i Roskilde (10 min gang fra stationen). Skolen er renoveret igennem de sidste 10 år og har gode faglokaler og udearealer -  herunder fysik/kemi og idrætsfaciliteter.  Skolen er præget af lyst og vilje til samarbejde og udvikling, og vi arbejder kontinuerligt med elevernes alsidige udvikling og den fortsatte trivsel på alle niveauer både hos børn og voksne.   Ansættelsesprocedure  Vi skal have modtaget din ansøgning senest onsdag d. 30. maj kl. 12.00  Ansøgning skal sendes via det aktive link i annoncen.  Samtaler afholdes mandag d. 31. maj fra kl. 16.00.  Tiltrædelse 1.8.22.   Der indhentes børne- og straffeattest ved ansættelse.  Der vil efter nærmere aftale blive indhentet referencer.   Løn og ansættelsesvilkår  Stillingen er som udgangspunkt en fuldtidsstilling. Løn og ansættelsesvilkår fastsættes efter gældende overenskomst.   Yderligere oplysninger  Ønsker du yderligere oplysninger om stillingen, kan du kontakte skoleleder Morten Naumann 46314 223/3084 1175 eller viceskoleleder Søren Østergaard 4631 4224/2840 1480 
 Denne jobannonce blev oprindeligt opslået på https://www.ofir.dk/
 (Den originale annonce kan ses på: https://www.ofir.dk/showojob?ofirid=7389bc80)",Københavnsvej 34,58,Danmark,265,Roskilde,4,"Hovedstaden, Sjælland og Bornholm",4000,Roskilde,1,1,Fuldtid,None,None,1,,0,,0,0,0,,False,"{'Id': 7972958, 'Email': None, 'FaxNumber': None, 'PersonName': 'Roskilde Kommune', 'FirstName': 'Roskilde', 'LastName': 'Kommune', 'PositionTitle': None, 'PhoneNumbers': [{'Number': '46313000', 'Type': 0, 'Description': 'Hovednummer'}]}",,False,False,False,False,4,,,False,False,False,False,,,,,https://www.ofir.dk/resultat/Jobannonce.aspx?ofirId=7389bc80&action=sendApplicationUrl,False,2022-05-30T00:00:00,,0,Primary,7,/CV/FindWork/GetLogo?JobAdId=5594219&Organisation=29189404,"Københavnsvej 34,4000, Roskilde",True,False,/CV/Jobseeking/JobLog/CreateJobSearch?JobnetJobPostingIdentifier=5594219&Company.Name=Roskilde Kommune - Hedegårdenes Skole&SubmissionDeadlineDate=2022-5-30&Title=Hedegårdenes Skole i Roskilde søger matematik- og fysik/kemilærer til udskolingen&WeeklyWorkTime=1,00000000-0000-0000-0000-000000000000,False,0,,,Hedegårdenes Skole i Roskilde søger matematik- og fysik/kemilærer til udskolingen,True,,True,1,,5594219,,,False,False,,0,False,Roskilde Kommune - Hedegårdenes Skole,Københavnsvej 34,,,4000,False,False,False,Roskilde,Roskilde Kommune,46313000,,,,,,False,,2022-05-30T00:00:00,,0,False,0,,,,,0,,,,False,False,,,False,False,,,,False,,False,,,Arbejdspladsen ligger i Roskilde kommune,False,Roskilde Kommune - Hedegårdenes Skole,,None,,False,False,"Skolen har et stærkt og udviklingsorienteret naturfagligt team, som ser frem til en ny kollega! Vores forventninger til dig, udover at du er relationskompetent og fagligt velfunderet er at du….  	Kan føre til prøve i matematik. 	Kan teamsamarbejde med kolleger og samarbejde med forældrene. 	Med engagement og anerkendelse kan skabe et trygt læringsm","""Skolen har et stærkt og udviklingsorienteret naturfagligt team, som ser frem til en ny kollega! Vores forventninger til dig, udover at du er relationskompetent og fagligt velfunderet er at du….  \tKan føre til prøve i matematik. \tKan teamsamarbejde med kolleger og samarbejde med forældrene. \tMed engagement og anerkendelse kan skabe et trygt læringsm""","""Hedegårdenes Skole i Roskilde søger matematik- og fysik/kemilærer til udskolingen""","https://www.google.dk/maps/dir//Københavnsvej+34,4000,+Roskilde/","Skolen har et stærkt og udviklingsorienteret naturfagligt team, som ser frem til en ny kollega!   Vores forventninger til dig, udover at du er relationskompetent og fagligt velfunderet er at du….     Kan føre til prøve i matematik.   Kan teamsamarbejde med kolleger og samarbejde med forældrene.   Med engagement og anerkendelse kan skabe et trygt læringsmiljø for eleverne.   Er åben og ærlig, både når det går godt, og når det er svært.   Er idérig, selvstændig og udviklingsorienteret.     Til gengæld kan vi tilbyde:     Høj grad af fleksibilitet i arbejdslivet med rige muligheder for at præge egen hverdag samt muligheder for personlig udvikling.   En arbejdsplads med fokus på balance mellem arbejdsliv og privatliv.   Mentorordning for nye lærere uanset erfaring.   En synlig og tydelig ledelse, der med forventning ser frem til nye samarbejdsrelationer.   Fokus på faglig udvikling i fagene – blandt andet igennem struktureret fagudvalgsarbejde.   En skole med høj trivsel både blandt børn og voksne.   En åben og uformel omgangstone.   Et miljø, der værdsætter nye pædagogiske initiativer og gode fællesoplevelser – både faglige og sociale!   Ca. 440 fantastiske børn med forskellige behov.     Skoleprofil  Hedegårdenes Skole er en skole med en givende mangfoldighed i både medarbejder og børnegruppen. Vi ser det som vores kerneopgave hele tiden at kunne tilbyde børnene de bedste læringsmuligheder, og det gør vi igennem et struktureret arbejde både med udvikling af det sociale fællesskab og med en stærk fokus på og monitorering af elevernes faglige resultater.   Skolen er en 112 år gammel byskole centralt placeret i Roskilde (10 min gang fra stationen). Skolen er renoveret igennem de sidste 10 år og har gode faglokaler og udearealer -  herunder fysik/kemi og idrætsfaciliteter.  Skolen er præget af lyst og vilje til samarbejde og udvikling, og vi arbejder kontinuerligt med elevernes alsidige udvikling og den fortsatte trivsel på alle niveauer både hos børn og voksne.   Ansættelsesprocedure  Vi skal have modtaget din ansøgning senest onsdag d. 30. maj kl. 12.00  Ansøgning skal sendes via det aktive link i annoncen.  Samtaler afholdes mandag d. 31. maj fra kl. 16.00.  Tiltrædelse 1.8.22.   Der indhentes børne- og straffeattest ved ansættelse.  Der vil efter nærmere aftale blive indhentet referencer.   Løn og ansættelsesvilkår  Stillingen er som udgangspunkt en fuldtidsstilling. Løn og ansættelsesvilkår fastsættes efter gældende overenskomst.   Yderligere oplysninger  Ønsker du yderligere oplysninger om stillingen, kan du kontakte skoleleder Morten Naumann 46314 223/3084 1175 eller viceskoleleder Søren Østergaard 4631 4224/2840 1480 
 Denne jobannonce blev oprindeligt opslået på  https://www.ofir.dk/ 
 (Den originale annonce kan ses på:  https://www.ofir.dk/showojob?ofirid=7389bc80 )","https://www.google.dk/maps/place/Københavnsvej+34,4000,+Roskilde/",29189404,False,False,,False
