summary_AutomatchType,summary_Abroad,summary_Weight,summary_Title,summary_JobHeadline,summary_Presentation,summary_HiringOrgName,summary_WorkPlaceAddress,summary_WorkPlacePostalCode,summary_WorkPlaceCity,summary_WorkPlaceOtherAddress,summary_WorkPlaceAbroad,summary_WorkPlaceNotStatic,summary_UseWorkPlaceAddressForJoblog,summary_PostingCreated,summary_LastDateApplication,summary_FormattedLastDateApplication,summary_AssignmentStartDate,summary_IsHotjob,summary_IsExternal,summary_Url,summary_Region,summary_Municipality,summary_Country,summary_PostalCode,summary_PostalCodeName,summary_JobAnnouncementType,summary_EmploymentType,summary_WorkHours,summary_OccupationArea,summary_OccupationGroup,summary_Occupation,summary_Location_Latitude,summary_Location_Longitude,summary_JoblogWorkTime_WorkHour,summary_JoblogWorkTime_DailyWorkTime,summary_WorkplaceID,summary_OrganisationId,summary_HiringOrgCVR,summary_UserLoggedIn,summary_AnonymousEmployer,summary_ShareUrl,summary_DetailsUrl,summary_JobLogUrl,summary_HasLocationValues,summary_ID,summary_Latitude,summary_Longitude,details_WorkSchedule,details_WorkConditions,details_EmploymentTypes,details_WorkPlace_Name,details_WorkPlace_Address_AddressLine,details_WorkPlace_Address_Country_Id,details_WorkPlace_Address_Country_Name,details_WorkPlace_Address_Municipality_Id,details_WorkPlace_Address_Municipality_Name,details_WorkPlace_Address_Region_Id,details_WorkPlace_Address_Region_Name,details_WorkPlace_Address_PostalCode,details_WorkPlace_Address_City,details_WorkPlace_PhoneNumber_Number,details_WorkPlace_PhoneNumber_Type,details_WorkPlace_PhoneNumber_Description,details_WorkPlace_FaxNumber,details_WorkPlace_Email,details_WorkPlace_WebAddress,details_WorkPlace_Description,details_WorkPlace_Logo,details_WorkPlace_WorkPlaceOrganizationNumber,details_WorkPlace_OrganizationNumber,details_WorkPlace_OrganizationDescription,details_JobPositionPosting_Id,details_JobPositionPosting_HiringOrg_Name,details_JobPositionPosting_HiringOrg_Address_AddressLine,details_JobPositionPosting_HiringOrg_Address_Country_Id,details_JobPositionPosting_HiringOrg_Address_Country_Name,details_JobPositionPosting_HiringOrg_Address_Municipality_Id,details_JobPositionPosting_HiringOrg_Address_Municipality_Name,details_JobPositionPosting_HiringOrg_Address_Region_Id,details_JobPositionPosting_HiringOrg_Address_Region_Name,details_JobPositionPosting_HiringOrg_Address_PostalCode,details_JobPositionPosting_HiringOrg_Address_City,details_JobPositionPosting_HiringOrg_PhoneNumber_Number,details_JobPositionPosting_HiringOrg_PhoneNumber_Type,details_JobPositionPosting_HiringOrg_PhoneNumber_Description,details_JobPositionPosting_HiringOrg_FaxNumber,details_JobPositionPosting_HiringOrg_Email,details_JobPositionPosting_HiringOrg_WebAddress,details_JobPositionPosting_HiringOrg_Description,details_JobPositionPosting_HiringOrg_Logo,details_JobPositionPosting_HiringOrg_WorkPlaceOrganizationNumber,details_JobPositionPosting_HiringOrg_OrganizationNumber,details_JobPositionPosting_HiringOrg_OrganizationDescription,details_JobPositionPosting_RecruitingCompany,details_JobPositionPosting_PublicationStartDate,details_JobPositionPosting_PublicationEndDate,details_JobPositionPosting_JobPositionInformation_PositionTitle,details_JobPositionPosting_JobPositionInformation_Purpose,details_JobPositionPosting_JobPositionInformation_WorkLocation_AddressLine,details_JobPositionPosting_JobPositionInformation_WorkLocation_Country_Id,details_JobPositionPosting_JobPositionInformation_WorkLocation_Country_Name,details_JobPositionPosting_JobPositionInformation_WorkLocation_Municipality_Id,details_JobPositionPosting_JobPositionInformation_WorkLocation_Municipality_Name,details_JobPositionPosting_JobPositionInformation_WorkLocation_Region_Id,details_JobPositionPosting_JobPositionInformation_WorkLocation_Region_Name,details_JobPositionPosting_JobPositionInformation_WorkLocation_PostalCode,details_JobPositionPosting_JobPositionInformation_WorkLocation_City,details_JobPositionPosting_JobPositionInformation_EmploymentType,details_JobPositionPosting_JobPositionInformation_WeeklyWorkHours_TypeId,details_JobPositionPosting_JobPositionInformation_WeeklyWorkHours_TypeName,details_JobPositionPosting_JobPositionInformation_WeeklyWorkHours_Description,details_JobPositionPosting_JobPositionInformation_CompensationDescription,details_JobPositionPosting_JobPositionInformation_NumberToFill,details_JobPositionPosting_JobPositionInformation_DriverLicense,details_JobPositionPosting_JobPositionInformation_Occupation_Name,details_JobPositionPosting_JobPositionInformation_Occupation_DiscoWeb,details_JobPositionPosting_JobPositionInformation_Occupation_AlternateNames,details_JobPositionPosting_JobPositionInformation_Occupation_GroupId,details_JobPositionPosting_JobPositionInformation_Occupation_AreaId,details_JobPositionPosting_JobPositionInformation_IsGovernmentHiring,details_JobPositionPosting_JobPositionInformation_JppContacts,details_JobPositionPosting_JobPositionInformation_EmploymentDate,details_JobPositionPosting_IsRecruitmentOfForeignNationals,details_JobPositionPosting_IsWorkInDenmark,details_JobPositionPosting_IsAnonymousEmployer,details_JobPositionPosting_IsDisabilityFriendly,details_JobPositionPosting_JppType,details_JobPositionPosting_ApplicationDetails_WorkHourMax,details_JobPositionPosting_ApplicationDetails_WorkHourMin,details_JobPositionPosting_ApplicationDetails_DailyWorkTimeWeekend,details_JobPositionPosting_ApplicationDetails_DailyWorkTimeNight,details_JobPositionPosting_ApplicationDetails_DailyWorkTimeEvening,details_JobPositionPosting_ApplicationDetails_DailyWorkTimeDay,details_JobPositionPosting_ApplicationDetails_DailyWorkTimeMorning,details_JobPositionPosting_ApplicationDetails_DailyWorkTimeVarious,details_JobPositionPosting_ApplicationDetails_ReferenceText,details_JobPositionPosting_ApplicationDetails_RemarksToApplicant,details_JobPositionPosting_ApplicationDetails_ByEmail,details_JobPositionPosting_ApplicationDetails_ByPhone,details_JobPositionPosting_ApplicationDetails_ApplyViaUrl,details_JobPositionPosting_ApplicationDetails_ReplyInWriting,details_JobPositionPosting_ApplicationDetails_ApplicationDeadlineDate,details_JobPositionPosting_Status,details_LogoUrl,details_Address,details_ShowMap,details_ShowShareButtonJobLog,details_JobLogUrl,details_JobLogTemplateModel_Identifier,details_JobLogTemplateModel_UseWorkPlaceAddressForJoblog,details_JobLogTemplateModel_Category,details_JobLogTemplateModel_CvCustomerIdentifier,details_JobLogTemplateModel_JobSeekingStatus,details_JobLogTemplateModel_Title,details_JobLogTemplateModel_IsApplicationSourceRequired,details_JobLogTemplateModel_ApplicationSource,details_JobLogTemplateModel_IsWeeklyWorkTimeRequired,details_JobLogTemplateModel_WeeklyWorkTime,details_JobLogTemplateModel_HoursPerWeek,details_JobLogTemplateModel_JobnetJobPostingIdentifier,details_JobLogTemplateModel_JobAdDocument_Title,details_JobLogTemplateModel_JobAdDocument_Identifier,details_JobLogTemplateModel_JobAdDocument_IsDeletedBySystem,details_JobLogTemplateModel_JobAdDocument_IsDeletedByUser,details_JobLogTemplateModel_JobAdFile,details_JobLogTemplateModel_Company_JobLogEntryCategory,details_JobLogTemplateModel_Company_ShowAddressFieldsEvenIfEmpty,details_JobLogTemplateModel_Company_Name,details_JobLogTemplateModel_Company_Address,details_JobLogTemplateModel_Company_Country,details_JobLogTemplateModel_Company_EmploymentAreaID,details_JobLogTemplateModel_Company_PostCode,details_JobLogTemplateModel_Company_IsCountryAndTownAndPostCodeEmpty,details_JobLogTemplateModel_Company_IsTownAndPostCodeEmpty,details_JobLogTemplateModel_Company_IsCountryDanmark,details_JobLogTemplateModel_Company_Town,details_JobLogTemplateModel_Company_ContactPerson,details_JobLogTemplateModel_Company_Phone,details_JobLogTemplateModel_Company_Email,details_JobLogTemplateModel_Company_Latitude,details_JobLogTemplateModel_Company_Longitude,details_JobLogTemplateModel_Company_DailyTravelTimeInMinutes,details_JobLogTemplateModel_Company_DistanceToCompanyInMeters,details_JobLogTemplateModel_Company_IsCreateMode,details_JobLogTemplateModel_TypeOfSubmission,details_JobLogTemplateModel_SubmissionDate,details_JobLogTemplateModel_SubmissionDateFormatted,details_JobLogTemplateModel_SubmissionDateTiks,details_JobLogTemplateModel_IsSubmissionDateRequired,details_JobLogTemplateModel_Status,details_JobLogTemplateModel_DateCreatedFormatted,details_JobLogTemplateModel_DateCreated,details_JobLogTemplateModel_DateModifiedFormatted,details_JobLogTemplateModel_DateModified,details_JobLogTemplateModel_LastModifiedDateTiks,details_JobLogTemplateModel_DateClosed,details_JobLogTemplateModel_JobApplicationDocument_Title,details_JobLogTemplateModel_JobApplicationDocument_Identifier,details_JobLogTemplateModel_JobApplicationDocument_IsDeletedBySystem,details_JobLogTemplateModel_JobApplicationDocument_IsDeletedByUser,details_JobLogTemplateModel_CvDocument_Title,details_JobLogTemplateModel_CvDocument_Identifier,details_JobLogTemplateModel_CvDocument_IsDeletedBySystem,details_JobLogTemplateModel_CvDocument_IsDeletedByUser,details_JobLogTemplateModel_JobApplicationFile,details_JobLogTemplateModel_CvFile,details_JobLogTemplateModel_SubmissionDeadlineDate,details_JobLogTemplateModel_IsPersisted,details_JobLogTemplateModel_ServerValidationErrors,details_JobLogTemplateModel_HasServerValidationErrors,details_JoblogWorkTime_WorkHour,details_JoblogWorkTime_DailyWorkTime,details_Place,details_OpenPrintDialog,details_WorkPlaceInfoText,details_JobCenterContactDetails,details_WorkPlaceDescriptionText,details_FavoriteText,details_IsFavorite,details_ShowFavorite,details_MetaOgTextForSharing,details_DescriptionForSharing,details_TitleForSharing,details_RutePlan,details_FormattedPurpose,details_MapUrl,details_OrganizationNumber,details_ShowSearchJobButton,details_ShowPrint,details_BackToFindWorkButtonUrl,isExternal
0,False,1,Postdoc in Neuroimmunology and Cell Therapy with bioinformatic expertise,Postdoc in Neuroimmunology and Cell Therapy with bioinformatic expertise,"We are seeking an independent and self-driven&nbsp;postdoc&nbsp;to lead our Neuroimmunology and cell therapy projects at the Department of Molecular Medicine, SDU.
The full-time position is ",Syddansk Universitet,Campusvej 55  ,5230,Odense M,False,False,False,True,2025-01-27T00:00:00,2025-02-25T00:00:00,25. februar 2025,0001-01-01T00:00:00,False,False,https://job.jobnet.dk/CV/FindWork/Details/58ba8ec4-0774-4cf0-979a-d9d27bb8661c,Syddanmark,Odense,Danmark,5230,,Almindelige vilkår,Tidsbegrænset ansættelse,Fuldtid,Akademisk arbejde,"Forskning og universitetsundervisning, sundhedsvidenskab","Post doc., sundhedsvidenskab",55.3786,10.4114,,,1003403113,,29283958,False,False,https://job.jobnet.dk/CV/FindWork/DetailsSocialmedia/58ba8ec4-0774-4cf0-979a-d9d27bb8661c,https://job.jobnet.dk/CV/FindWork/Details/58ba8ec4-0774-4cf0-979a-d9d27bb8661c,https://job.jobnet.dk/CV/FindWork/Details/58ba8ec4-0774-4cf0-979a-d9d27bb8661c,True,58ba8ec4-0774-4cf0-979a-d9d27bb8661c,55.3786,10.4114,"{'Id': 1, 'Name': 'Fuldtid'}, {'Id': 16, 'Name': 'Deltid'}","{'Id': 1, 'Name': 'Almindelige vilkår'}, {'Id': 2, 'Name': 'Fleksjob'}, {'Id': 3, 'Name': 'Skånejob'}, {'Id': 4, 'Name': 'Egnet til efterlønnere og seniorer'}, {'Id': 5, 'Name': 'Job med løntilskud'}, {'Id': 6, 'Name': 'Rotationsjob'}, {'Id': 7, 'Name': 'Virksomhedspraktik'}","{'Id': 1, 'Name': 'Fastansættelse'}, {'Id': 16, 'Name': 'Tidsbegrænset ansættelse'}",Syddansk Universitet,Campusvej 55,58,Danmark,461,Odense,3,Syddanmark,5230,Odense M,,0,Primary,,,https://www.sdu.dk/en/om-sdu/job-sdu,None,,1003403113,29283958,None,58ba8ec4-0774-4cf0-979a-d9d27bb8661c,Syddansk Universitet,Campusvej 55,58,Danmark,461,Odense,3,Syddanmark,5230,Odense M,,0,Primary,,,https://www.sdu.dk/en/om-sdu/job-sdu,None,,1003403113,29283958,None,,2025-01-27T00:00:00+01:00,2025-02-25T23:59:00+01:00,Postdoc in Neuroimmunology and Cell Therapy with bioinformatic expertise,"We are seeking an independent and self-driven postdoc to lead our Neuroimmunology and cell therapy projects at the Department of Molecular Medicine, SDU. 
 The full-time position is available in the Laboratory of Associate Professor Agnieszka Wlodarczyk from April 1, 2025, or as soon as possible thereafter and for a period of one year with the possibility of extension for two or more years. 
 A strong emphasis of this position is on bioinformatics, multiomics data integration, and programming, complemented by expertise in wet lab experiments (in vitro and in vivo). 
 Key responsibilities 
 
 Design research projects and prepare grant applications to secure funding. 
 Plan, conduct, and oversee experiments that establish new assays in collaboration with other members of the group. 
 Supervise and mentor PhD students and technicians. 
 Independently develop and employ state-of-the-art bioinformatic pipelines to analyze and integrate complex multiomics datasets. 
 Perform and report quantitative bioanalysis of both human and rodent samples. 
 Plan and perform in vitro and in vivo validation experiments as needed to complement omics data. 
 Conduct collaborative research and interact with a broad network of colleagues and external partners. 
 Support research and development activities within the group and engage in teaching as required. 
 
 Expectations of qualifications 
 
 PhD in Life Sciences  (Bioinformatics, Biotechnology, Immunology, Biomedicine, Biochemistry, Pharmaceutical Sciences, or a related field). 
 Demonstrated proficiency in multiomics analysis and programming, supported by scientific publications. 
 Preferably some hands-on experience with basic molecular biology techniques and rodent models. 
 Strong drive, creativity, quality mindset, and problem-solving skills, with a flair for team coordination. 
 Positive, curious, and cooperative approach to building fruitful relationships with colleagues and partners. 
 
 Qualifications not required but considered advantages 
 
 Background in Neuroimmunology and/or Cell Therapy 
 FELASA B Certificate, experience with rodent models 
 Experience in tissue sectioning, immunostaining, confocal microscopy, and Python-based bioimage analysis 
 Familiarity with spatial transcriptomics as well as stem cell culture and differentiation toward neurons or microglia 
 
 The Department of Molecular Medicine (IMM) 
 IMM’s mission is to generate new knowledge about human body function and disease mechanisms, thereby contributing to improved human health. Our department hosts an interdisciplinary group of experts in cancer biology, neurobiology, inflammation, and genomics, all in close proximity to Odense University Hospital. This collaborative environment fosters translational research aimed at developing novel therapies. 
 We offer 
 
 An Exciting Work Environment:  Join a positive and collaborative team where you can tackle stimulating research challenges alongside supportive colleagues. 
 High-Impact, Multidisciplinary Research:  Contribute to projects with genuine potential for clinical translation, leveraging diverse expertise across the department. 
 Flexible Contract and Growth Opportunities:  The position is available immediately for 1 year, with the possibility of an extension for 2 or more years. 
 State-of-the-Art Facilities:  Gain access to cutting-edge equipment for molecular biology, imaging, and data analysis. 
 A competitive salary and social benefits  (e.g. health coverage, parental leave, social security etc.) The successful applicant for the postdoc position will be employed in accordance with the agreement between the Danish Ministry of Finance and AC (the Danish Confederation of Professional Associations). 
 
 About the Wlodarczyk Group 
 The Wlodarczyk Group focuses on understanding and harnessing naturally occurring protective and regenerative molecular processes to develop innovative therapies for neurological diseases such as progressive multiple sclerosis, dementia, and stroke. We employ state-of-the-art molecular biology techniques—including multiomics, cell culture, and in vivo rodent models—and have access to unique human tissue samples. 
 Further Information 
 For inquiries, please contact Associate Prof. Agnieszka Wlodarczyk at awlodarczyk@health.sdu.dk. 
 Application deadline 
 February 25, 2025, at 23.59 hrs. CET 
 Appointment, salary etc. 
 A position as postdoc is a fixed-term academic position. The position can be filled for a period of up to 4 years at the same university. Employment stops automatically at the end of the period.  
 The successful applicant will be employed in accordance with the agreement on salaried postdoc between the Ministry of Finance and AC (the Danish Confederation of Professional Associations).  
 Application 
 Applications must be submitted electronically using the link “ Apply now ” - see below. 
 We strongly recommend that you read  How to apply for a position at SDU  before you apply. 
 Only applications written in English will be accepted for evaluation. 
 The application must include (as PDF files) (please note that the application (the motivation letter) and CV must not exceed 10 MB in total): 
 
 A motivation letter describing your research interests, qualifications (including a brief description of your PhD), and motivation for applying the project in this call (max one page). 
 A CV including personal contact information, education, work/research experience and relevant skills. 
 A List of publications and manuscripts. 
 Up to 3 recent publications 
 Copies of recent certificates (Ph.D. and Master) 
 Employment reference.  
 
 Shortlisting may be used in the recruitment process. Living and working in Denmark 
 Foreign applicants will be offered  Danish language training   as part of the employment. 
 The  International Staff Office  (ISO) at SDU provides a variety of services for new employees, guests and people who are considering applying for a job at the University of Southern Denmark. 
 The University wishes our staff to reflect the diversity of society and thus welcomes applications from all qualified candidates regardless of personal background.",Campusvej 55,58,Danmark,461,Odense,3,Syddanmark,5230,Odense M,16,1,Fuldtid,None,None,1,,"Post doc., sundhedsvidenskab",0,,0,0,True,,,True,True,False,False,4,,,False,False,False,False,False,False,,,,,https://www.sdu.dk/en/om-sdu/job-sdu,False,2025-02-25T00:00:00+01:00,7,/CV/FindWork/GetLogo?JobAdId=58ba8ec4-0774-4cf0-979a-d9d27bb8661c&Organisation=29283958,"Campusvej 55,5230, Odense M",True,False,/CV/Jobseeking/JobLog/CreateJobSearch?JobnetJobPostingIdentifier=58ba8ec4-0774-4cf0-979a-d9d27bb8661c&Company.Name=Syddansk Universitet&SubmissionDeadlineDate=2025-2-25&Title=Postdoc in Neuroimmunology and Cell Therapy with bioinformatic expertise&WeeklyWorkTime=1,00000000-0000-0000-0000-000000000000,True,0,,,Postdoc in Neuroimmunology and Cell Therapy with bioinformatic expertise,True,,True,1,,58ba8ec4-0774-4cf0-979a-d9d27bb8661c,,,False,False,,0,False,Syddansk Universitet,Campusvej 55,,,5230,False,False,False,Odense M,,,,,,,,False,,2025-02-25T00:00:00+01:00,,0,False,0,,,,,0,,,,False,False,,,False,False,,,,False,,False,,,Arbejdspladsen ligger i Odense kommune,False,Syddansk Universitet,,None,,False,False,"We are seeking an independent and self-drivenpostdocto lead our Neuroimmunology and cell therapy projects at the Department of Molecular Medicine, SDU.
The full-time position is available in the Laboratory of Associate Professor Agnieszka Wlodarczyk from April 1, 2025, or as soon as possible thereafter and for a period of one year with the possibil","""We are seeking an independent and self-drivenpostdocto lead our Neuroimmunology and cell therapy projects at the Department of Molecular Medicine, SDU.\nThe full-time position is available in the Laboratory of Associate Professor Agnieszka Wlodarczyk from April 1, 2025, or as soon as possible thereafter and for a period of one year with the possibil""","""Postdoc in Neuroimmunology and Cell Therapy with bioinformatic expertise""","https://www.google.dk/maps/dir//Campusvej+55,5230,+Odense+M/","We are seeking an independent and self-driven postdoc to lead our Neuroimmunology and cell therapy projects at the Department of Molecular Medicine, SDU. 
 The full-time position is available in the Laboratory of Associate Professor Agnieszka Wlodarczyk from April 1, 2025, or as soon as possible thereafter and for a period of one year with the possibility of extension for two or more years. 
 A strong emphasis of this position is on bioinformatics, multiomics data integration, and programming, complemented by expertise in wet lab experiments (in vitro and in vivo). 
 Key responsibilities 
 
 Design research projects and prepare grant applications to secure funding. 
 Plan, conduct, and oversee experiments that establish new assays in collaboration with other members of the group. 
 Supervise and mentor PhD students and technicians. 
 Independently develop and employ state-of-the-art bioinformatic pipelines to analyze and integrate complex multiomics datasets. 
 Perform and report quantitative bioanalysis of both human and rodent samples. 
 Plan and perform in vitro and in vivo validation experiments as needed to complement omics data. 
 Conduct collaborative research and interact with a broad network of colleagues and external partners. 
 Support research and development activities within the group and engage in teaching as required. 
 
 Expectations of qualifications 
 
 PhD in Life Sciences  (Bioinformatics, Biotechnology, Immunology, Biomedicine, Biochemistry, Pharmaceutical Sciences, or a related field). 
 Demonstrated proficiency in multiomics analysis and programming, supported by scientific publications. 
 Preferably some hands-on experience with basic molecular biology techniques and rodent models. 
 Strong drive, creativity, quality mindset, and problem-solving skills, with a flair for team coordination. 
 Positive, curious, and cooperative approach to building fruitful relationships with colleagues and partners. 
 
 Qualifications not required but considered advantages 
 
 Background in Neuroimmunology and/or Cell Therapy 
 FELASA B Certificate, experience with rodent models 
 Experience in tissue sectioning, immunostaining, confocal microscopy, and Python-based bioimage analysis 
 Familiarity with spatial transcriptomics as well as stem cell culture and differentiation toward neurons or microglia 
 
 The Department of Molecular Medicine (IMM) 
 IMM’s mission is to generate new knowledge about human body function and disease mechanisms, thereby contributing to improved human health. Our department hosts an interdisciplinary group of experts in cancer biology, neurobiology, inflammation, and genomics, all in close proximity to Odense University Hospital. This collaborative environment fosters translational research aimed at developing novel therapies. 
 We offer 
 
 An Exciting Work Environment:  Join a positive and collaborative team where you can tackle stimulating research challenges alongside supportive colleagues. 
 High-Impact, Multidisciplinary Research:  Contribute to projects with genuine potential for clinical translation, leveraging diverse expertise across the department. 
 Flexible Contract and Growth Opportunities:  The position is available immediately for 1 year, with the possibility of an extension for 2 or more years. 
 State-of-the-Art Facilities:  Gain access to cutting-edge equipment for molecular biology, imaging, and data analysis. 
 A competitive salary and social benefits  (e.g. health coverage, parental leave, social security etc.) The successful applicant for the postdoc position will be employed in accordance with the agreement between the Danish Ministry of Finance and AC (the Danish Confederation of Professional Associations). 
 
 About the Wlodarczyk Group 
 The Wlodarczyk Group focuses on understanding and harnessing naturally occurring protective and regenerative molecular processes to develop innovative therapies for neurological diseases such as progressive multiple sclerosis, dementia, and stroke. We employ state-of-the-art molecular biology techniques—including multiomics, cell culture, and in vivo rodent models—and have access to unique human tissue samples. 
 Further Information 
 For inquiries, please contact Associate Prof. Agnieszka Wlodarczyk at awlodarczyk@health.sdu.dk. 
 Application deadline 
 February 25, 2025, at 23.59 hrs. CET 
 Appointment, salary etc. 
 A position as postdoc is a fixed-term academic position. The position can be filled for a period of up to 4 years at the same university. Employment stops automatically at the end of the period.  
 The successful applicant will be employed in accordance with the agreement on salaried postdoc between the Ministry of Finance and AC (the Danish Confederation of Professional Associations).  
 Application 
 Applications must be submitted electronically using the link “ Apply now ” - see below. 
 We strongly recommend that you read  How to apply for a position at SDU  before you apply. 
 Only applications written in English will be accepted for evaluation. 
 The application must include (as PDF files) (please note that the application (the motivation letter) and CV must not exceed 10 MB in total): 
 
 A motivation letter describing your research interests, qualifications (including a brief description of your PhD), and motivation for applying the project in this call (max one page). 
 A CV including personal contact information, education, work/research experience and relevant skills. 
 A List of publications and manuscripts. 
 Up to 3 recent publications 
 Copies of recent certificates (Ph.D. and Master) 
 Employment reference.  
 
 Shortlisting may be used in the recruitment process. Living and working in Denmark 
 Foreign applicants will be offered  Danish language training  as part of the employment. 
 The  International Staff Office  (ISO) at SDU provides a variety of services for new employees, guests and people who are considering applying for a job at the University of Southern Denmark. 
 The University wishes our staff to reflect the diversity of society and thus welcomes applications from all qualified candidates regardless of personal background.","https://www.google.dk/maps/place/Campusvej+55,5230,+Odense+M/",29283958,False,False,,False
