summary_AutomatchType,summary_Abroad,summary_Weight,summary_Title,summary_JobHeadline,summary_Presentation,summary_HiringOrgName,summary_WorkPlaceAddress,summary_WorkPlacePostalCode,summary_WorkPlaceCity,summary_WorkPlaceOtherAddress,summary_WorkPlaceAbroad,summary_WorkPlaceNotStatic,summary_UseWorkPlaceAddressForJoblog,summary_PostingCreated,summary_LastDateApplication,summary_FormattedLastDateApplication,summary_AssignmentStartDate,summary_IsHotjob,summary_IsExternal,summary_Url,summary_Region,summary_Municipality,summary_Country,summary_PostalCode,summary_PostalCodeName,summary_JobAnnouncementType,summary_EmploymentType,summary_WorkHours,summary_OccupationArea,summary_OccupationGroup,summary_Occupation,summary_Location_Latitude,summary_Location_Longitude,summary_JoblogWorkTime_WorkHour,summary_JoblogWorkTime_DailyWorkTime,summary_WorkplaceID,summary_OrganisationId,summary_HiringOrgCVR,summary_UserLoggedIn,summary_AnonymousEmployer,summary_ShareUrl,summary_DetailsUrl,summary_JobLogUrl,summary_HasLocationValues,summary_ID,summary_Latitude,summary_Longitude,details_WorkSchedule,details_WorkConditions,details_EmploymentTypes,details_WorkPlace_Name,details_WorkPlace_Address_AddressLine,details_WorkPlace_Address_Country_Id,details_WorkPlace_Address_Country_Name,details_WorkPlace_Address_Municipality_Id,details_WorkPlace_Address_Municipality_Name,details_WorkPlace_Address_Region_Id,details_WorkPlace_Address_Region_Name,details_WorkPlace_Address_PostalCode,details_WorkPlace_Address_City,details_WorkPlace_PhoneNumber_Number,details_WorkPlace_PhoneNumber_Type,details_WorkPlace_PhoneNumber_Description,details_WorkPlace_FaxNumber,details_WorkPlace_Email,details_WorkPlace_WebAddress,details_WorkPlace_Description,details_WorkPlace_Logo,details_WorkPlace_WorkPlaceOrganizationNumber,details_WorkPlace_OrganizationNumber,details_WorkPlace_OrganizationDescription,details_JobPositionPosting_Id,details_JobPositionPosting_HiringOrg_Name,details_JobPositionPosting_HiringOrg_Address_AddressLine,details_JobPositionPosting_HiringOrg_Address_Country_Id,details_JobPositionPosting_HiringOrg_Address_Country_Name,details_JobPositionPosting_HiringOrg_Address_Municipality_Id,details_JobPositionPosting_HiringOrg_Address_Municipality_Name,details_JobPositionPosting_HiringOrg_Address_Region_Id,details_JobPositionPosting_HiringOrg_Address_Region_Name,details_JobPositionPosting_HiringOrg_Address_PostalCode,details_JobPositionPosting_HiringOrg_Address_City,details_JobPositionPosting_HiringOrg_PhoneNumber_Number,details_JobPositionPosting_HiringOrg_PhoneNumber_Type,details_JobPositionPosting_HiringOrg_PhoneNumber_Description,details_JobPositionPosting_HiringOrg_FaxNumber,details_JobPositionPosting_HiringOrg_Email,details_JobPositionPosting_HiringOrg_WebAddress,details_JobPositionPosting_HiringOrg_Description,details_JobPositionPosting_HiringOrg_Logo,details_JobPositionPosting_HiringOrg_WorkPlaceOrganizationNumber,details_JobPositionPosting_HiringOrg_OrganizationNumber,details_JobPositionPosting_HiringOrg_OrganizationDescription,details_JobPositionPosting_RecruitingCompany,details_JobPositionPosting_PublicationStartDate,details_JobPositionPosting_PublicationEndDate,details_JobPositionPosting_JobPositionInformation_PositionTitle,details_JobPositionPosting_JobPositionInformation_Purpose,details_JobPositionPosting_JobPositionInformation_WorkLocation_AddressLine,details_JobPositionPosting_JobPositionInformation_WorkLocation_Country_Id,details_JobPositionPosting_JobPositionInformation_WorkLocation_Country_Name,details_JobPositionPosting_JobPositionInformation_WorkLocation_Municipality_Id,details_JobPositionPosting_JobPositionInformation_WorkLocation_Municipality_Name,details_JobPositionPosting_JobPositionInformation_WorkLocation_Region_Id,details_JobPositionPosting_JobPositionInformation_WorkLocation_Region_Name,details_JobPositionPosting_JobPositionInformation_WorkLocation_PostalCode,details_JobPositionPosting_JobPositionInformation_WorkLocation_City,details_JobPositionPosting_JobPositionInformation_EmploymentType,details_JobPositionPosting_JobPositionInformation_WeeklyWorkHours_TypeId,details_JobPositionPosting_JobPositionInformation_WeeklyWorkHours_TypeName,details_JobPositionPosting_JobPositionInformation_WeeklyWorkHours_Description,details_JobPositionPosting_JobPositionInformation_CompensationDescription,details_JobPositionPosting_JobPositionInformation_NumberToFill,details_JobPositionPosting_JobPositionInformation_DriverLicense,details_JobPositionPosting_JobPositionInformation_Occupation_Name,details_JobPositionPosting_JobPositionInformation_Occupation_DiscoWeb,details_JobPositionPosting_JobPositionInformation_Occupation_AlternateNames,details_JobPositionPosting_JobPositionInformation_Occupation_GroupId,details_JobPositionPosting_JobPositionInformation_Occupation_AreaId,details_JobPositionPosting_JobPositionInformation_IsGovernmentHiring,details_JobPositionPosting_JobPositionInformation_JppContacts,details_JobPositionPosting_JobPositionInformation_EmploymentDate,details_JobPositionPosting_IsRecruitmentOfForeignNationals,details_JobPositionPosting_IsWorkInDenmark,details_JobPositionPosting_IsAnonymousEmployer,details_JobPositionPosting_IsDisabilityFriendly,details_JobPositionPosting_JppType,details_JobPositionPosting_ApplicationDetails_WorkHourMax,details_JobPositionPosting_ApplicationDetails_WorkHourMin,details_JobPositionPosting_ApplicationDetails_DailyWorkTimeWeekend,details_JobPositionPosting_ApplicationDetails_DailyWorkTimeNight,details_JobPositionPosting_ApplicationDetails_DailyWorkTimeEvening,details_JobPositionPosting_ApplicationDetails_DailyWorkTimeDay,details_JobPositionPosting_ApplicationDetails_DailyWorkTimeMorning,details_JobPositionPosting_ApplicationDetails_DailyWorkTimeVarious,details_JobPositionPosting_ApplicationDetails_ReferenceText,details_JobPositionPosting_ApplicationDetails_RemarksToApplicant,details_JobPositionPosting_ApplicationDetails_ByEmail,details_JobPositionPosting_ApplicationDetails_ByPhone,details_JobPositionPosting_ApplicationDetails_ApplyViaUrl,details_JobPositionPosting_ApplicationDetails_ReplyInWriting,details_JobPositionPosting_ApplicationDetails_ApplicationDeadlineDate,details_JobPositionPosting_Status,details_LogoUrl,details_Address,details_ShowMap,details_ShowShareButtonJobLog,details_JobLogUrl,details_JobLogTemplateModel_Identifier,details_JobLogTemplateModel_UseWorkPlaceAddressForJoblog,details_JobLogTemplateModel_Category,details_JobLogTemplateModel_CvCustomerIdentifier,details_JobLogTemplateModel_JobSeekingStatus,details_JobLogTemplateModel_Title,details_JobLogTemplateModel_IsApplicationSourceRequired,details_JobLogTemplateModel_ApplicationSource,details_JobLogTemplateModel_IsWeeklyWorkTimeRequired,details_JobLogTemplateModel_WeeklyWorkTime,details_JobLogTemplateModel_HoursPerWeek,details_JobLogTemplateModel_JobnetJobPostingIdentifier,details_JobLogTemplateModel_JobAdDocument_Title,details_JobLogTemplateModel_JobAdDocument_Identifier,details_JobLogTemplateModel_JobAdDocument_IsDeletedBySystem,details_JobLogTemplateModel_JobAdDocument_IsDeletedByUser,details_JobLogTemplateModel_JobAdFile,details_JobLogTemplateModel_Company_JobLogEntryCategory,details_JobLogTemplateModel_Company_ShowAddressFieldsEvenIfEmpty,details_JobLogTemplateModel_Company_Name,details_JobLogTemplateModel_Company_Address,details_JobLogTemplateModel_Company_Country,details_JobLogTemplateModel_Company_EmploymentAreaID,details_JobLogTemplateModel_Company_PostCode,details_JobLogTemplateModel_Company_IsCountryAndTownAndPostCodeEmpty,details_JobLogTemplateModel_Company_IsTownAndPostCodeEmpty,details_JobLogTemplateModel_Company_IsCountryDanmark,details_JobLogTemplateModel_Company_Town,details_JobLogTemplateModel_Company_ContactPerson,details_JobLogTemplateModel_Company_Phone,details_JobLogTemplateModel_Company_Email,details_JobLogTemplateModel_Company_Latitude,details_JobLogTemplateModel_Company_Longitude,details_JobLogTemplateModel_Company_DailyTravelTimeInMinutes,details_JobLogTemplateModel_Company_DistanceToCompanyInMeters,details_JobLogTemplateModel_Company_IsCreateMode,details_JobLogTemplateModel_TypeOfSubmission,details_JobLogTemplateModel_SubmissionDate,details_JobLogTemplateModel_SubmissionDateFormatted,details_JobLogTemplateModel_SubmissionDateTiks,details_JobLogTemplateModel_IsSubmissionDateRequired,details_JobLogTemplateModel_Status,details_JobLogTemplateModel_DateCreatedFormatted,details_JobLogTemplateModel_DateCreated,details_JobLogTemplateModel_DateModifiedFormatted,details_JobLogTemplateModel_DateModified,details_JobLogTemplateModel_LastModifiedDateTiks,details_JobLogTemplateModel_DateClosed,details_JobLogTemplateModel_JobApplicationDocument_Title,details_JobLogTemplateModel_JobApplicationDocument_Identifier,details_JobLogTemplateModel_JobApplicationDocument_IsDeletedBySystem,details_JobLogTemplateModel_JobApplicationDocument_IsDeletedByUser,details_JobLogTemplateModel_CvDocument_Title,details_JobLogTemplateModel_CvDocument_Identifier,details_JobLogTemplateModel_CvDocument_IsDeletedBySystem,details_JobLogTemplateModel_CvDocument_IsDeletedByUser,details_JobLogTemplateModel_JobApplicationFile,details_JobLogTemplateModel_CvFile,details_JobLogTemplateModel_SubmissionDeadlineDate,details_JobLogTemplateModel_IsPersisted,details_JobLogTemplateModel_ServerValidationErrors,details_JobLogTemplateModel_HasServerValidationErrors,details_JoblogWorkTime_WorkHour,details_JoblogWorkTime_DailyWorkTime,details_Place,details_OpenPrintDialog,details_WorkPlaceInfoText,details_JobCenterContactDetails,details_WorkPlaceDescriptionText,details_FavoriteText,details_IsFavorite,details_ShowFavorite,details_MetaOgTextForSharing,details_DescriptionForSharing,details_TitleForSharing,details_RutePlan,details_FormattedPurpose,details_MapUrl,details_OrganizationNumber,details_ShowSearchJobButton,details_ShowPrint,details_BackToFindWorkButtonUrl,isExternal
0,False,1,Pædagog søges til Børnehuset Firkløveret,Pædagog søges til Børnehuset Firkløveret,Har du det sorte bælte - eller i hvert fald interesse i at arbejde med børnehavebørn? Så er det måske dig vi søger til vores dejlige børnehave med tiltrædelse den 1. maj 2025. Stillingen er på 37 t,Køge Kommune,Nylandsvej 115-117  ,4600,Køge,False,False,False,True,2025-02-05T07:12:00,2025-04-02T00:00:00,2. april 2025,0001-01-01T00:00:00,False,False,https://job.jobnet.dk/CV/FindWork/Details/67098ca1-8e28-4e6e-90e5-4d59776ba379,Øvrige Sjælland,Køge,Danmark,4600,,Almindelige vilkår,Fastansættelse,Fuldtid,"Pædagogisk, socialt og kirkeligt arbejde",Pædagogisk arbejde,Pædagog,55.4553,12.2201,,,1017918458,,29189374,False,False,https://job.jobnet.dk/CV/FindWork/DetailsSocialmedia/67098ca1-8e28-4e6e-90e5-4d59776ba379,https://job.jobnet.dk/CV/FindWork/Details/67098ca1-8e28-4e6e-90e5-4d59776ba379,https://job.jobnet.dk/CV/FindWork/Details/67098ca1-8e28-4e6e-90e5-4d59776ba379,True,67098ca1-8e28-4e6e-90e5-4d59776ba379,55.4553,12.2201,"{'Id': 1, 'Name': 'Fuldtid'}, {'Id': 16, 'Name': 'Deltid'}","{'Id': 1, 'Name': 'Almindelige vilkår'}, {'Id': 2, 'Name': 'Fleksjob'}, {'Id': 3, 'Name': 'Skånejob'}, {'Id': 4, 'Name': 'Egnet til efterlønnere og seniorer'}, {'Id': 5, 'Name': 'Job med løntilskud'}, {'Id': 6, 'Name': 'Rotationsjob'}, {'Id': 7, 'Name': 'Virksomhedspraktik'}","{'Id': 1, 'Name': 'Fastansættelse'}, {'Id': 16, 'Name': 'Tidsbegrænset ansættelse'}",Køge Kommune,Nylandsvej 115-117,58,Danmark,259,Køge,4,"Hovedstaden, Sjælland og Bornholm",4600,Køge,,0,Primary,,,https://www.koege.dk/om-koege-kommune/job-hos-os/ledige-stillinger?hr=show-job/238646&linkref=268798&locale=da_DK,None,,1017918458,29189374,None,67098ca1-8e28-4e6e-90e5-4d59776ba379,Køge Kommune,Nylandsvej 115-117,58,Danmark,259,Køge,4,"Hovedstaden, Sjælland og Bornholm",4600,Køge,,0,Primary,,,https://www.koege.dk/om-koege-kommune/job-hos-os/ledige-stillinger?hr=show-job/238646&linkref=268798&locale=da_DK,None,,1017918458,29189374,None,,2025-02-05T07:12:00+01:00,2025-04-02T08:12:00+02:00,Pædagog søges til Børnehuset Firkløveret,"Har du det sorte bælte - eller i hvert fald interesse i at arbejde med børnehavebørn? Så er det måske dig vi søger til vores dejlige børnehave med tiltrædelse den 1. maj 2025. Stillingen er på 37 timer jf. Trepartsaftalen om fuldtid. Dog tager vi gerne hensyn til individuelle behov og ønsker.   Det er en fast stilling og du vil blive en del af en gruppe på ca. 22 glade børn i alderen 3-6 år og to skønne stuekollegaer. Vi deler dagligt børnegruppen op i mindre grupper på stuen, men arbejder også med aldersopdelte grupper på tværs af stuerne i børnehaven. Måske har du særlig interesse i de ældste børnehavebørn? 
 Vi, Køge Kommune, er blandt de første kommuner, der permanent indfører betalt forberedelsestid til pædagoger. Det betyder, at vi opretholder normeringen, mens du og dine kollegaer forbereder jer. Forberedelsestiden giver dig mulighed for at reflektere over praksis, planlægge pædagogiske aktiviteter og styrke kvaliteten i det daglige arbejde – uden at det går ud over tiden med børnene. 
 Vi tror på, at når du har tid til faglig forberedelse og fordybelse, skaber det både arbejdsglæde for dig og bedre vilkår for børnene. 
 Børnehuset Firkløveret er et integreret dagtilbud med naturprofil, det betyder at vi alle nyder at være ude og at vi bl.a. har modtaget ”det grønne flag” 8 år i træk. Vi er en del af Område Asgård/Kirstinedal i Køge Kommune. Firkløveret består af 4 vuggestuegrupper, 3 børnehavegrupper og vi er normeret til i alt 117 børn.  
 Som et led i den forebyggende indsats i Børnehuset Firkløveret har vi iværksat et udviklingsforløb for det pædagogiske personale målrettet børns følelsesmæssige og sociale udvikling.  
 Projektet (solskinstid) startede vi med i marts 2024 og afsluttes i sommeren 2025. Dette projekt vil du også, som ny pædagog i Børnehuset Firkløveret, blive en del af. 
 Vi lægger vægt på at være en personalegruppe, der har en positiv, anerkendende og ressource-orienteret tilgang til arbejdet, menneskelig rummelighed, samt evner til at se muligheder og turde gribe dem. Vi brænder for arbejdet og agerer i et udviklende miljø, med fokus på faglighed, engagement og glæde. Vi er optaget af at skabe god trivsel, læring, dannelse og udvikling hos alle børn og arbejder bl.a. med tidlig indsats, børnefællesskaber, natur, børneyoga og kontinuerlig udvikling af vores læringsmiljøer.  
 Vi søger en uddannet pædagog, som  
 - brænder for at arbejde med børnehavebørn 
 - kan og vil opdele børnene i mindre grupper 
 - kan lide at være ude i al slags vejr og være aktiv sammen med og i naturen 
 - er energisk, spontan og kan se muligheder både på den korte og lange bane 
 - kan holde hovedet koldt og har overblikket i en til tider travl hverdag 
 - er fysisk og psykisk robust 
 - har gode samarbejdskompetencer samt kan give og tage imod fagligt indspark 
 - er aktiv, engageret og kan reflektere åbent over egen og husets pædagogiske praksis  
 - har energi og vilje til at indgå i et berigende samarbejde med personale, forældre, børn, og øvrige samarbejdspartnere 
 - er mødestabil 
 - er god til at udtrykke sig fagligt i både skrift og tale 
   
 Hvis du har spørgsmål til stillingen eller ønsker at komme på besøg, er du velkommen til at kontakte dagtilbudsleder Britta Lodahl, tlf. 56 67 63 30 / 29 34 71 34 eller afdelingsleder Stine Glyholt, tlf. 56 67 63 30 / 20 20 55 35 
 Vi foretrækker, at du sender din ansøgning online. Klik på ”Søg stillingen” og vedhæft din ansøgning og dit CV. 
 Læs mere om Køge Kommune på  www.koege.dk 
 Køge Kommune ønsker at fremme ligestillingen mellem mænd og kvinder uanset etnisk baggrund. Vi opfordrer derfor personer med dansk og anden etnisk baggrund at søge stillingen.",Nylandsvej 115-117,58,Danmark,259,Køge,4,"Hovedstaden, Sjælland og Bornholm",4600,Køge,1,1,Fuldtid,None,None,1,,Pædagog,0,"Rytmikpædagog, 854, 855, 856",0,0,False,"{'Email': 'britta.lodahl@koege.dk', 'PersonName': 'Britta Lodahl', 'FirstName': 'Britta', 'LastName': 'Lodahl', 'PositionTitle': None, 'PhoneNumbers': [{'Number': '56676330', 'Type': 0, 'Description': 'Primary'}]}",2025-05-01T00:00:00+02:00,False,False,False,False,4,,,False,False,False,False,False,False,,,,,https://www.koege.dk/om-koege-kommune/job-hos-os/ledige-stillinger?hr=show-job/238646&linkref=268798&locale=da_DK,False,2025-04-02T00:00:00+02:00,7,/CV/FindWork/GetLogo?JobAdId=67098ca1-8e28-4e6e-90e5-4d59776ba379&Organisation=29189374,"Nylandsvej 115-117,4600, Køge",True,False,/CV/Jobseeking/JobLog/CreateJobSearch?JobnetJobPostingIdentifier=67098ca1-8e28-4e6e-90e5-4d59776ba379&Company.Name=Køge Kommune&SubmissionDeadlineDate=2025-4-2&Title=Pædagog søges til Børnehuset Firkløveret&WeeklyWorkTime=1,00000000-0000-0000-0000-000000000000,True,0,,,Pædagog søges til Børnehuset Firkløveret,True,,True,1,,67098ca1-8e28-4e6e-90e5-4d59776ba379,,,False,False,,0,False,Køge Kommune,Nylandsvej 115-117,,,4600,False,False,False,Køge,Britta Lodahl,56676330,britta.lodahl@koege.dk,,,,,False,,2025-04-02T00:00:00+02:00,,0,False,0,,,,,0,,,,False,False,,,False,False,,,,False,,False,,,Arbejdspladsen ligger i Køge kommune,False,Køge Kommune,,None,,False,False,Har du det sorte bælte - eller i hvert fald interesse i at arbejde med børnehavebørn? Så er det måske dig vi søger til vores dejlige børnehave med tiltrædelse den 1. maj 2025. Stillingen er på 37 timer jf. Trepartsaftalen om fuldtid. Dog tager vi gerne hensyn til individuelle behov og ønsker. Det er en fast stilling og du vil blive en del af en gru,"""Har du det sorte bælte - eller i hvert fald interesse i at arbejde med børnehavebørn? Så er det måske dig vi søger til vores dejlige børnehave med tiltrædelse den 1. maj 2025. Stillingen er på 37 timer jf. Trepartsaftalen om fuldtid. Dog tager vi gerne hensyn til individuelle behov og ønsker. Det er en fast stilling og du vil blive en del af en gru""","""Pædagog søges til Børnehuset Firkløveret""","https://www.google.dk/maps/dir//Nylandsvej+115-117,4600,+Køge/","Har du det sorte bælte - eller i hvert fald interesse i at arbejde med børnehavebørn? Så er det måske dig vi søger til vores dejlige børnehave med tiltrædelse den 1. maj 2025. Stillingen er på 37 timer jf. Trepartsaftalen om fuldtid. Dog tager vi gerne hensyn til individuelle behov og ønsker.   Det er en fast stilling og du vil blive en del af en gruppe på ca. 22 glade børn i alderen 3-6 år og to skønne stuekollegaer. Vi deler dagligt børnegruppen op i mindre grupper på stuen, men arbejder også med aldersopdelte grupper på tværs af stuerne i børnehaven. Måske har du særlig interesse i de ældste børnehavebørn? 
 Vi, Køge Kommune, er blandt de første kommuner, der permanent indfører betalt forberedelsestid til pædagoger. Det betyder, at vi opretholder normeringen, mens du og dine kollegaer forbereder jer. Forberedelsestiden giver dig mulighed for at reflektere over praksis, planlægge pædagogiske aktiviteter og styrke kvaliteten i det daglige arbejde – uden at det går ud over tiden med børnene. 
 Vi tror på, at når du har tid til faglig forberedelse og fordybelse, skaber det både arbejdsglæde for dig og bedre vilkår for børnene. 
 Børnehuset Firkløveret er et integreret dagtilbud med naturprofil, det betyder at vi alle nyder at være ude og at vi bl.a. har modtaget ”det grønne flag” 8 år i træk. Vi er en del af Område Asgård/Kirstinedal i Køge Kommune. Firkløveret består af 4 vuggestuegrupper, 3 børnehavegrupper og vi er normeret til i alt 117 børn.  
 Som et led i den forebyggende indsats i Børnehuset Firkløveret har vi iværksat et udviklingsforløb for det pædagogiske personale målrettet børns følelsesmæssige og sociale udvikling.  
 Projektet (solskinstid) startede vi med i marts 2024 og afsluttes i sommeren 2025. Dette projekt vil du også, som ny pædagog i Børnehuset Firkløveret, blive en del af. 
 Vi lægger vægt på at være en personalegruppe, der har en positiv, anerkendende og ressource-orienteret tilgang til arbejdet, menneskelig rummelighed, samt evner til at se muligheder og turde gribe dem. Vi brænder for arbejdet og agerer i et udviklende miljø, med fokus på faglighed, engagement og glæde. Vi er optaget af at skabe god trivsel, læring, dannelse og udvikling hos alle børn og arbejder bl.a. med tidlig indsats, børnefællesskaber, natur, børneyoga og kontinuerlig udvikling af vores læringsmiljøer.  
 Vi søger en uddannet pædagog, som  
 - brænder for at arbejde med børnehavebørn 
 - kan og vil opdele børnene i mindre grupper 
 - kan lide at være ude i al slags vejr og være aktiv sammen med og i naturen 
 - er energisk, spontan og kan se muligheder både på den korte og lange bane 
 - kan holde hovedet koldt og har overblikket i en til tider travl hverdag 
 - er fysisk og psykisk robust 
 - har gode samarbejdskompetencer samt kan give og tage imod fagligt indspark 
 - er aktiv, engageret og kan reflektere åbent over egen og husets pædagogiske praksis  
 - har energi og vilje til at indgå i et berigende samarbejde med personale, forældre, børn, og øvrige samarbejdspartnere 
 - er mødestabil 
 - er god til at udtrykke sig fagligt i både skrift og tale 
   
 Hvis du har spørgsmål til stillingen eller ønsker at komme på besøg, er du velkommen til at kontakte dagtilbudsleder Britta Lodahl, tlf. 56 67 63 30 / 29 34 71 34 eller afdelingsleder Stine Glyholt, tlf. 56 67 63 30 / 20 20 55 35 
 Vi foretrækker, at du sender din ansøgning online. Klik på ”Søg stillingen” og vedhæft din ansøgning og dit CV. 
 Læs mere om Køge Kommune på  www.koege.dk 
 Køge Kommune ønsker at fremme ligestillingen mellem mænd og kvinder uanset etnisk baggrund. Vi opfordrer derfor personer med dansk og anden etnisk baggrund at søge stillingen.","https://www.google.dk/maps/place/Nylandsvej+115-117,4600,+Køge/",29189374,False,False,,False
