summary_AutomatchType,summary_Abroad,summary_Weight,summary_Title,summary_JobHeadline,summary_Presentation,summary_HiringOrgName,summary_WorkPlaceAddress,summary_WorkPlacePostalCode,summary_WorkPlaceCity,summary_WorkPlaceOtherAddress,summary_WorkPlaceAbroad,summary_WorkPlaceNotStatic,summary_UseWorkPlaceAddressForJoblog,summary_PostingCreated,summary_LastDateApplication,summary_FormattedLastDateApplication,summary_AssignmentStartDate,summary_IsHotjob,summary_IsExternal,summary_Url,summary_Region,summary_Municipality,summary_Country,summary_PostalCode,summary_PostalCodeName,summary_JobAnnouncementType,summary_EmploymentType,summary_WorkHours,summary_OccupationArea,summary_OccupationGroup,summary_Occupation,summary_Location_Latitude,summary_Location_Longitude,summary_JoblogWorkTime_WorkHour,summary_JoblogWorkTime_DailyWorkTime,summary_WorkplaceID,summary_OrganisationId,summary_HiringOrgCVR,summary_UserLoggedIn,summary_AnonymousEmployer,summary_ShareUrl,summary_DetailsUrl,summary_JobLogUrl,summary_HasLocationValues,summary_ID,summary_Latitude,summary_Longitude,details_WorkSchedule,details_WorkConditions,details_EmploymentTypes,details_WorkPlace_Name,details_WorkPlace_Address_AddressLine,details_WorkPlace_Address_Country_Id,details_WorkPlace_Address_Country_Name,details_WorkPlace_Address_Municipality_Id,details_WorkPlace_Address_Municipality_Name,details_WorkPlace_Address_Region_Id,details_WorkPlace_Address_Region_Name,details_WorkPlace_Address_PostalCode,details_WorkPlace_Address_City,details_WorkPlace_PhoneNumber_Number,details_WorkPlace_PhoneNumber_Type,details_WorkPlace_PhoneNumber_Description,details_WorkPlace_FaxNumber,details_WorkPlace_Email,details_WorkPlace_WebAddress,details_WorkPlace_Description,details_WorkPlace_Logo,details_WorkPlace_WorkPlaceOrganizationNumber,details_WorkPlace_OrganizationNumber,details_WorkPlace_OrganizationDescription,details_JobPositionPosting_Id,details_JobPositionPosting_HiringOrg_Name,details_JobPositionPosting_HiringOrg_Address_AddressLine,details_JobPositionPosting_HiringOrg_Address_Country_Id,details_JobPositionPosting_HiringOrg_Address_Country_Name,details_JobPositionPosting_HiringOrg_Address_Municipality_Id,details_JobPositionPosting_HiringOrg_Address_Municipality_Name,details_JobPositionPosting_HiringOrg_Address_Region_Id,details_JobPositionPosting_HiringOrg_Address_Region_Name,details_JobPositionPosting_HiringOrg_Address_PostalCode,details_JobPositionPosting_HiringOrg_Address_City,details_JobPositionPosting_HiringOrg_PhoneNumber_Number,details_JobPositionPosting_HiringOrg_PhoneNumber_Type,details_JobPositionPosting_HiringOrg_PhoneNumber_Description,details_JobPositionPosting_HiringOrg_FaxNumber,details_JobPositionPosting_HiringOrg_Email,details_JobPositionPosting_HiringOrg_WebAddress,details_JobPositionPosting_HiringOrg_Description,details_JobPositionPosting_HiringOrg_Logo,details_JobPositionPosting_HiringOrg_WorkPlaceOrganizationNumber,details_JobPositionPosting_HiringOrg_OrganizationNumber,details_JobPositionPosting_HiringOrg_OrganizationDescription,details_JobPositionPosting_RecruitingCompany,details_JobPositionPosting_PublicationStartDate,details_JobPositionPosting_PublicationEndDate,details_JobPositionPosting_JobPositionInformation_PositionTitle,details_JobPositionPosting_JobPositionInformation_Purpose,details_JobPositionPosting_JobPositionInformation_WorkLocation_AddressLine,details_JobPositionPosting_JobPositionInformation_WorkLocation_Country_Id,details_JobPositionPosting_JobPositionInformation_WorkLocation_Country_Name,details_JobPositionPosting_JobPositionInformation_WorkLocation_Municipality_Id,details_JobPositionPosting_JobPositionInformation_WorkLocation_Municipality_Name,details_JobPositionPosting_JobPositionInformation_WorkLocation_Region_Id,details_JobPositionPosting_JobPositionInformation_WorkLocation_Region_Name,details_JobPositionPosting_JobPositionInformation_WorkLocation_PostalCode,details_JobPositionPosting_JobPositionInformation_WorkLocation_City,details_JobPositionPosting_JobPositionInformation_EmploymentType,details_JobPositionPosting_JobPositionInformation_WeeklyWorkHours_TypeId,details_JobPositionPosting_JobPositionInformation_WeeklyWorkHours_TypeName,details_JobPositionPosting_JobPositionInformation_WeeklyWorkHours_Description,details_JobPositionPosting_JobPositionInformation_CompensationDescription,details_JobPositionPosting_JobPositionInformation_NumberToFill,details_JobPositionPosting_JobPositionInformation_DriverLicense,details_JobPositionPosting_JobPositionInformation_Occupation_Name,details_JobPositionPosting_JobPositionInformation_Occupation_DiscoWeb,details_JobPositionPosting_JobPositionInformation_Occupation_AlternateNames,details_JobPositionPosting_JobPositionInformation_Occupation_GroupId,details_JobPositionPosting_JobPositionInformation_Occupation_AreaId,details_JobPositionPosting_JobPositionInformation_IsGovernmentHiring,details_JobPositionPosting_JobPositionInformation_JppContacts,details_JobPositionPosting_JobPositionInformation_EmploymentDate,details_JobPositionPosting_IsRecruitmentOfForeignNationals,details_JobPositionPosting_IsWorkInDenmark,details_JobPositionPosting_IsAnonymousEmployer,details_JobPositionPosting_IsDisabilityFriendly,details_JobPositionPosting_JppType,details_JobPositionPosting_ApplicationDetails_WorkHourMax,details_JobPositionPosting_ApplicationDetails_WorkHourMin,details_JobPositionPosting_ApplicationDetails_DailyWorkTimeWeekend,details_JobPositionPosting_ApplicationDetails_DailyWorkTimeNight,details_JobPositionPosting_ApplicationDetails_DailyWorkTimeEvening,details_JobPositionPosting_ApplicationDetails_DailyWorkTimeDay,details_JobPositionPosting_ApplicationDetails_DailyWorkTimeMorning,details_JobPositionPosting_ApplicationDetails_DailyWorkTimeVarious,details_JobPositionPosting_ApplicationDetails_ReferenceText,details_JobPositionPosting_ApplicationDetails_RemarksToApplicant,details_JobPositionPosting_ApplicationDetails_ByEmail,details_JobPositionPosting_ApplicationDetails_ByPhone,details_JobPositionPosting_ApplicationDetails_ApplyViaUrl,details_JobPositionPosting_ApplicationDetails_ReplyInWriting,details_JobPositionPosting_ApplicationDetails_ApplicationDeadlineDate,details_JobPositionPosting_Status,details_LogoUrl,details_Address,details_ShowMap,details_ShowShareButtonJobLog,details_JobLogUrl,details_JobLogTemplateModel_Identifier,details_JobLogTemplateModel_UseWorkPlaceAddressForJoblog,details_JobLogTemplateModel_Category,details_JobLogTemplateModel_CvCustomerIdentifier,details_JobLogTemplateModel_JobSeekingStatus,details_JobLogTemplateModel_Title,details_JobLogTemplateModel_IsApplicationSourceRequired,details_JobLogTemplateModel_ApplicationSource,details_JobLogTemplateModel_IsWeeklyWorkTimeRequired,details_JobLogTemplateModel_WeeklyWorkTime,details_JobLogTemplateModel_HoursPerWeek,details_JobLogTemplateModel_JobnetJobPostingIdentifier,details_JobLogTemplateModel_JobAdDocument_Title,details_JobLogTemplateModel_JobAdDocument_Identifier,details_JobLogTemplateModel_JobAdDocument_IsDeletedBySystem,details_JobLogTemplateModel_JobAdDocument_IsDeletedByUser,details_JobLogTemplateModel_JobAdFile,details_JobLogTemplateModel_Company_JobLogEntryCategory,details_JobLogTemplateModel_Company_ShowAddressFieldsEvenIfEmpty,details_JobLogTemplateModel_Company_Name,details_JobLogTemplateModel_Company_Address,details_JobLogTemplateModel_Company_Country,details_JobLogTemplateModel_Company_EmploymentAreaID,details_JobLogTemplateModel_Company_PostCode,details_JobLogTemplateModel_Company_IsCountryAndTownAndPostCodeEmpty,details_JobLogTemplateModel_Company_IsTownAndPostCodeEmpty,details_JobLogTemplateModel_Company_IsCountryDanmark,details_JobLogTemplateModel_Company_Town,details_JobLogTemplateModel_Company_ContactPerson,details_JobLogTemplateModel_Company_Phone,details_JobLogTemplateModel_Company_Email,details_JobLogTemplateModel_Company_Latitude,details_JobLogTemplateModel_Company_Longitude,details_JobLogTemplateModel_Company_DailyTravelTimeInMinutes,details_JobLogTemplateModel_Company_DistanceToCompanyInMeters,details_JobLogTemplateModel_Company_IsCreateMode,details_JobLogTemplateModel_TypeOfSubmission,details_JobLogTemplateModel_SubmissionDate,details_JobLogTemplateModel_SubmissionDateFormatted,details_JobLogTemplateModel_SubmissionDateTiks,details_JobLogTemplateModel_IsSubmissionDateRequired,details_JobLogTemplateModel_Status,details_JobLogTemplateModel_DateCreatedFormatted,details_JobLogTemplateModel_DateCreated,details_JobLogTemplateModel_DateModifiedFormatted,details_JobLogTemplateModel_DateModified,details_JobLogTemplateModel_LastModifiedDateTiks,details_JobLogTemplateModel_DateClosed,details_JobLogTemplateModel_JobApplicationDocument_Title,details_JobLogTemplateModel_JobApplicationDocument_Identifier,details_JobLogTemplateModel_JobApplicationDocument_IsDeletedBySystem,details_JobLogTemplateModel_JobApplicationDocument_IsDeletedByUser,details_JobLogTemplateModel_CvDocument_Title,details_JobLogTemplateModel_CvDocument_Identifier,details_JobLogTemplateModel_CvDocument_IsDeletedBySystem,details_JobLogTemplateModel_CvDocument_IsDeletedByUser,details_JobLogTemplateModel_JobApplicationFile,details_JobLogTemplateModel_CvFile,details_JobLogTemplateModel_SubmissionDeadlineDate,details_JobLogTemplateModel_IsPersisted,details_JobLogTemplateModel_ServerValidationErrors,details_JobLogTemplateModel_HasServerValidationErrors,details_JoblogWorkTime_WorkHour,details_JoblogWorkTime_DailyWorkTime,details_Place,details_OpenPrintDialog,details_WorkPlaceInfoText,details_JobCenterContactDetails,details_WorkPlaceDescriptionText,details_FavoriteText,details_IsFavorite,details_ShowFavorite,details_MetaOgTextForSharing,details_DescriptionForSharing,details_TitleForSharing,details_RutePlan,details_FormattedPurpose,details_MapUrl,details_OrganizationNumber,details_ShowSearchJobButton,details_ShowPrint,details_BackToFindWorkButtonUrl,isExternal
0,False,1,Skoleleder til Haarby Skole og SFO,Skoleleder til Haarby Skole og SFO,"Er du ambitiøs og fællesskabsorienteret? Har du fokus på udvikling af høj faglighed, trivsel og deltagelsesmuligheder for alle? Vil du lede i samarbejde med dit ledelsesteam, tillidsvalgte, skoleb",Assens Kommune - Haarby Skole,Sportsvej 16  ,5683,Haarby,False,False,False,True,2025-01-24T00:00:00,2025-02-16T23:59:00,16. februar 2025,0001-01-01T00:00:00,False,False,https://job.jobnet.dk/CV/FindWork/Details/6a0377bb-a4c4-4210-a288-9f9834f1eafa,Syddanmark,Assens,Danmark,5683,,Almindelige vilkår,Fastansættelse,Fuldtid,Ledelse,Undervisning og forskning,Skoleleder,55.1893,10.0703,,,1003312345,,29189692,False,False,https://job.jobnet.dk/CV/FindWork/DetailsSocialmedia/6a0377bb-a4c4-4210-a288-9f9834f1eafa,https://job.jobnet.dk/CV/FindWork/Details/6a0377bb-a4c4-4210-a288-9f9834f1eafa,https://job.jobnet.dk/CV/FindWork/Details/6a0377bb-a4c4-4210-a288-9f9834f1eafa,True,6a0377bb-a4c4-4210-a288-9f9834f1eafa,55.1893,10.0703,"{'Id': 1, 'Name': 'Fuldtid'}, {'Id': 16, 'Name': 'Deltid'}","{'Id': 1, 'Name': 'Almindelige vilkår'}, {'Id': 2, 'Name': 'Fleksjob'}, {'Id': 3, 'Name': 'Skånejob'}, {'Id': 4, 'Name': 'Egnet til efterlønnere og seniorer'}, {'Id': 5, 'Name': 'Job med løntilskud'}, {'Id': 6, 'Name': 'Rotationsjob'}, {'Id': 7, 'Name': 'Virksomhedspraktik'}","{'Id': 1, 'Name': 'Fastansættelse'}, {'Id': 16, 'Name': 'Tidsbegrænset ansættelse'}",Assens Kommune - Haarby Skole,Sportsvej 16,58,Danmark,420,Assens,3,Syddanmark,5683,Haarby,,0,Primary,,,https://www.ofir.dk/resultat/Jobannonce.aspx?ofirId=ea319c13&action=sendApplicationUrl&utm_source=job.jobnet.dk&utm_medium=referral,None,,1003312345,29189692,None,6a0377bb-a4c4-4210-a288-9f9834f1eafa,Assens Kommune - Haarby Skole,Sportsvej 16,58,Danmark,420,Assens,3,Syddanmark,5683,Haarby,,0,Primary,,,https://www.ofir.dk/resultat/Jobannonce.aspx?ofirId=ea319c13&action=sendApplicationUrl&utm_source=job.jobnet.dk&utm_medium=referral,None,,1003312345,29189692,None,,2025-01-24T00:00:00+01:00,2025-02-16T23:59:00+01:00,Skoleleder til Haarby Skole og SFO,"Er du ambitiøs og fællesskabsorienteret? Har du fokus på udvikling af høj faglighed, trivsel og deltagelsesmuligheder for alle? Vil du lede i samarbejde med dit ledelsesteam, tillidsvalgte, skolebestyrelse m.fl.? Så står vi klar til at byde dig velkommen til Haarby – et godt sted at leve og vokse op! Vi søger en skoleleder, der sammen med os har høje og positive forventninger til alle vores børn og unge på Haarby Skole. Vi ved, at netop dét er afgørende for at lykkes og komme godt videre i ungdomslivet.   Stillingen er med tiltrædelse den 1. april 2025.   Haarby Skole og SFO   Haarby Skole ligger i landsbyen Haarby omgivet af smuk natur. Skolen har et tæt samarbejde med dagtilbuddet, Børnehuset Haarby, som ligger ’lige rundt om hjørnet’.   Haarby Skole og SFO er kendetegnet ved en høj grad af samarbejde mellem lærere og pædagoger.   Vi er aktuelt særligt optagede af at skabe bedre trivsel for både medarbejdere og elever.   Vi ønsker at etablere gode og trygge arbejds- og læringsmiljøer, som understøtter arbejdet med at skabe inkluderende læringsmiljøer med deltagelsesmuligheder for alle børn og unge.   Som skoleleder vil dine opgaver være alsidige. I den første periode vil der særligt være fokus på:     at fortsætte arbejdet med at øge arbejdstrivslen og det gode læringsmiljø for børn og voksne   at få Mangfoldige Børne- og Ungefællesskaber til at leve i den daglige praksis på Haarby Skole og SFO     Forandringen skal kobles sammen med frihedsdagsordenen og folkeskolens kvalitetsprogram på en meningsfuld måde på skolen.   Vi ønsker at udvikle inkluderende læringsmiljøer, hvor alle børn kan være en del af fællesskabet på skolen.   Ønsker til vores nye skoleleder   Det er afgørende for os, at du har erfaring med skoleledelse og kan samarbejde, lede, sætte retning, motivere og skabe følgeskab hos medarbejdere, forældre og elever.   Ligeledes er det vigtigt, at du er nysgerrig, imødekommende og respektfuld overfor skolens kulturer og de gode traditioner, der kendetegner vores skole.   Vores elevråd ønsker sig en skoleleder, som er en rollemodel – en som går op i børns medindflydelse samt er imødekommende og synlig på skolen.   Du trives med at navigere, søge indflydelse og være leder i en politisk styret organisation. Du ser det som naturligt at samarbejde op, ned og til siden.   Du er god til at omsætte politiske beslutninger i praksis på en måde, som giver mening for både børn og voksne.   Du er uddannet lærer, gerne med ledelseserfaring fra en skole og gerne med en diplom-eller masteruddannelse i ledelse.   Vi tilbyder   Et spændende lederjob med mange forskellige opgaver – lige fra forandrings- og strategisk ledelse til mere administrative og driftsmæssige opgaver.   Ledelse er noget, vi gør sammen. Din viceskoleleder er relativ nyansat i sin første lederstilling. Du skal sammen med ham skabe et kompetent og ligeværdigt ledelsesteam, som er præget af en tillidsfuld ledelsesstil og et forpligtende samarbejde, hvor du respekterer din ledelsesmakkers eget råderum og ansvar.   På skolen har vi 41 engagerede og dygtige medarbejdere, som er optagede af det gode læringsmiljø og af at bidrage positivt ind i et professionelt samarbejde.   Vi har en aktiv Skolebestyrelse, der byder ind, deltager og kommer med vigtige perspektiver til skolens udvikling. Vigtigst af alt har vi ca. 320 skønne, glade og dygtige elever, der på hver sin måde bidrager til et fagligt, kreativt og mangfoldigt børnefællesskab.   I Assens Kommune er vi optaget af at lede på måder, som giver følgeskab. Øverst på dagsordenen står arbejdet med Mangfoldige Børne- og Ungefællesskaber. Vi skal udvikle skolerne, så alle børn får mulighed for at være en del af de fællesskaber, der er på deres distriktsskole. Dette sker også i samarbejde med lederne i dagtilbud, skole- og dagtilbudskonsulenter og vores gode samarbejdspartnere i PPR og Familieafdelingen.   Du bliver en del af et en rigtig god ledergruppe. Der er et godt samarbejde mellem lederne, som støtter og sparre med hinanden. Dit decentrale ledelsesrum respekteres samtidig med, at du har en hånd i ryggen og ikke kommer til at føle dig alene. Du bliver desuden tilknyttet en mentor fra skoleledergruppen.   Som skoleleder refererer du til skole- og dagtilbudschefen, som også står til rådighed med sparring om ledelsesopgaven og er en del af ledelsesteamet med dig og de øvrige ledere i Assens.   Løn og ansættelsesforhold   Stillingen er en tjenestemandsstilling. Løn og ansættelsesforhold sker i henhold til gældende overenskomst og ud fra reglerne om lokal løndannelse.   Vi gør opmærksom på, at børne- og straffeattest indhentes, inden ansættelse kan finde sted.   Vil du vide mere   Hvis du ønsker yderligere information, er du velkommen til at kontakte viceskoleleder Christian Hjære Jensen på tlf. 23 81 62 72 eller chef for Dagtilbud og Skole, Espen Fossar Andersen på tlf. 20 13 09 77.   Du er meget velkommen til at komme forbi til en kop kaffe til en snak og besøge skolen. Du kan også besøge vores hjemmeside  https://www.haarbyskole.dk/ , hvor du kan læse mere om os.   Ansættelsesprocessen vil forløbe således:     Søndag den 16. februar kl. 23.59: Ansøgningsfrist   Mandag den 17. februar: Ansættelsesudvalget udvælger kandidater til 1. samtale, som får besked samme dag.   Onsdag den 19. februar: Første samtalerunde i tidsrummet kl. 9-13   Onsdag den 26. februar: Anden samtalerunde i tidsrummet kl. 10-13. Der bliver stillet en relevant case i forbindelse med anden samtale.     Som led i rekrutteringsprocessen foretages der mellem første og anden samtale en personprofilanalyse med efterfølgende personlig tilbagemelding (forventeligt 24. februar).   Vi glæder os til at høre fra dig! 
 Denne jobannonce blev oprindeligt opslået på  https://www.ofir.dk/ 
 (Den originale annonce kan ses på:  https://www.ofir.dk/showojob?ofirid=ea319c13 )",Sportsvej 16,58,Danmark,420,Assens,3,Syddanmark,5683,Haarby,1,1,Fuldtid,None,None,1,,Skoleleder,0,"Daglig leder af videregående uddannelsesinstitution, Specialskoleleder, Skoleleder på gymnasialt niveau, Fravalgt 2023-04 Leder af videregående uddannelsesinstitution, Leder af en undervisningsinstitution, 2210, Vicerektor",0,0,False,,,False,False,False,False,4,,,False,False,False,False,False,False,,,,,https://www.ofir.dk/resultat/Jobannonce.aspx?ofirId=ea319c13&action=sendApplicationUrl&utm_source=job.jobnet.dk&utm_medium=referral,False,2025-02-16T23:59:00+01:00,7,/CV/FindWork/GetLogo?JobAdId=6a0377bb-a4c4-4210-a288-9f9834f1eafa&Organisation=29189692,"Sportsvej 16,5683, Haarby",True,False,/CV/Jobseeking/JobLog/CreateJobSearch?JobnetJobPostingIdentifier=6a0377bb-a4c4-4210-a288-9f9834f1eafa&Company.Name=Assens Kommune - Haarby Skole&SubmissionDeadlineDate=2025-2-16&Title=Skoleleder til Haarby Skole og SFO&WeeklyWorkTime=1,00000000-0000-0000-0000-000000000000,True,0,,,Skoleleder til Haarby Skole og SFO,True,,True,1,,6a0377bb-a4c4-4210-a288-9f9834f1eafa,,,False,False,,0,False,Assens Kommune - Haarby Skole,Sportsvej 16,,,5683,False,False,False,Haarby,,,,,,,,False,,2025-02-16T23:59:00+01:00,,0,False,0,,,,,0,,,,False,False,,,False,False,,,,False,,False,,,Arbejdspladsen ligger i Assens kommune,False,Assens Kommune - Haarby Skole,,None,,False,False,"Er du ambitiøs og fællesskabsorienteret? Har du fokus på udvikling af høj faglighed, trivsel og deltagelsesmuligheder for alle? Vil du lede i samarbejde med dit ledelsesteam, tillidsvalgte, skolebestyrelse m.fl.? Så står vi klar til at byde dig velkommen til Haarby – et godt sted at leve og vokse op!Vi søger en skoleleder, der sammen med os har høj","""Er du ambitiøs og fællesskabsorienteret? Har du fokus på udvikling af høj faglighed, trivsel og deltagelsesmuligheder for alle? Vil du lede i samarbejde med dit ledelsesteam, tillidsvalgte, skolebestyrelse m.fl.? Så står vi klar til at byde dig velkommen til Haarby – et godt sted at leve og vokse op!Vi søger en skoleleder, der sammen med os har høj""","""Skoleleder til Haarby Skole og SFO""","https://www.google.dk/maps/dir//Sportsvej+16,5683,+Haarby/","Er du ambitiøs og fællesskabsorienteret? Har du fokus på udvikling af høj faglighed, trivsel og deltagelsesmuligheder for alle? Vil du lede i samarbejde med dit ledelsesteam, tillidsvalgte, skolebestyrelse m.fl.? Så står vi klar til at byde dig velkommen til Haarby – et godt sted at leve og vokse op! Vi søger en skoleleder, der sammen med os har høje og positive forventninger til alle vores børn og unge på Haarby Skole. Vi ved, at netop dét er afgørende for at lykkes og komme godt videre i ungdomslivet.   Stillingen er med tiltrædelse den 1. april 2025.   Haarby Skole og SFO   Haarby Skole ligger i landsbyen Haarby omgivet af smuk natur. Skolen har et tæt samarbejde med dagtilbuddet, Børnehuset Haarby, som ligger ’lige rundt om hjørnet’.   Haarby Skole og SFO er kendetegnet ved en høj grad af samarbejde mellem lærere og pædagoger.   Vi er aktuelt særligt optagede af at skabe bedre trivsel for både medarbejdere og elever.   Vi ønsker at etablere gode og trygge arbejds- og læringsmiljøer, som understøtter arbejdet med at skabe inkluderende læringsmiljøer med deltagelsesmuligheder for alle børn og unge.   Som skoleleder vil dine opgaver være alsidige. I den første periode vil der særligt være fokus på:     at fortsætte arbejdet med at øge arbejdstrivslen og det gode læringsmiljø for børn og voksne   at få Mangfoldige Børne- og Ungefællesskaber til at leve i den daglige praksis på Haarby Skole og SFO     Forandringen skal kobles sammen med frihedsdagsordenen og folkeskolens kvalitetsprogram på en meningsfuld måde på skolen.   Vi ønsker at udvikle inkluderende læringsmiljøer, hvor alle børn kan være en del af fællesskabet på skolen.   Ønsker til vores nye skoleleder   Det er afgørende for os, at du har erfaring med skoleledelse og kan samarbejde, lede, sætte retning, motivere og skabe følgeskab hos medarbejdere, forældre og elever.   Ligeledes er det vigtigt, at du er nysgerrig, imødekommende og respektfuld overfor skolens kulturer og de gode traditioner, der kendetegner vores skole.   Vores elevråd ønsker sig en skoleleder, som er en rollemodel – en som går op i børns medindflydelse samt er imødekommende og synlig på skolen.   Du trives med at navigere, søge indflydelse og være leder i en politisk styret organisation. Du ser det som naturligt at samarbejde op, ned og til siden.   Du er god til at omsætte politiske beslutninger i praksis på en måde, som giver mening for både børn og voksne.   Du er uddannet lærer, gerne med ledelseserfaring fra en skole og gerne med en diplom-eller masteruddannelse i ledelse.   Vi tilbyder   Et spændende lederjob med mange forskellige opgaver – lige fra forandrings- og strategisk ledelse til mere administrative og driftsmæssige opgaver.   Ledelse er noget, vi gør sammen. Din viceskoleleder er relativ nyansat i sin første lederstilling. Du skal sammen med ham skabe et kompetent og ligeværdigt ledelsesteam, som er præget af en tillidsfuld ledelsesstil og et forpligtende samarbejde, hvor du respekterer din ledelsesmakkers eget råderum og ansvar.   På skolen har vi 41 engagerede og dygtige medarbejdere, som er optagede af det gode læringsmiljø og af at bidrage positivt ind i et professionelt samarbejde.   Vi har en aktiv Skolebestyrelse, der byder ind, deltager og kommer med vigtige perspektiver til skolens udvikling. Vigtigst af alt har vi ca. 320 skønne, glade og dygtige elever, der på hver sin måde bidrager til et fagligt, kreativt og mangfoldigt børnefællesskab.   I Assens Kommune er vi optaget af at lede på måder, som giver følgeskab. Øverst på dagsordenen står arbejdet med Mangfoldige Børne- og Ungefællesskaber. Vi skal udvikle skolerne, så alle børn får mulighed for at være en del af de fællesskaber, der er på deres distriktsskole. Dette sker også i samarbejde med lederne i dagtilbud, skole- og dagtilbudskonsulenter og vores gode samarbejdspartnere i PPR og Familieafdelingen.   Du bliver en del af et en rigtig god ledergruppe. Der er et godt samarbejde mellem lederne, som støtter og sparre med hinanden. Dit decentrale ledelsesrum respekteres samtidig med, at du har en hånd i ryggen og ikke kommer til at føle dig alene. Du bliver desuden tilknyttet en mentor fra skoleledergruppen.   Som skoleleder refererer du til skole- og dagtilbudschefen, som også står til rådighed med sparring om ledelsesopgaven og er en del af ledelsesteamet med dig og de øvrige ledere i Assens.   Løn og ansættelsesforhold   Stillingen er en tjenestemandsstilling. Løn og ansættelsesforhold sker i henhold til gældende overenskomst og ud fra reglerne om lokal løndannelse.   Vi gør opmærksom på, at børne- og straffeattest indhentes, inden ansættelse kan finde sted.   Vil du vide mere   Hvis du ønsker yderligere information, er du velkommen til at kontakte viceskoleleder Christian Hjære Jensen på tlf. 23 81 62 72 eller chef for Dagtilbud og Skole, Espen Fossar Andersen på tlf. 20 13 09 77.   Du er meget velkommen til at komme forbi til en kop kaffe til en snak og besøge skolen. Du kan også besøge vores hjemmeside  https://www.haarbyskole.dk/ , hvor du kan læse mere om os.   Ansættelsesprocessen vil forløbe således:     Søndag den 16. februar kl. 23.59: Ansøgningsfrist   Mandag den 17. februar: Ansættelsesudvalget udvælger kandidater til 1. samtale, som får besked samme dag.   Onsdag den 19. februar: Første samtalerunde i tidsrummet kl. 9-13   Onsdag den 26. februar: Anden samtalerunde i tidsrummet kl. 10-13. Der bliver stillet en relevant case i forbindelse med anden samtale.     Som led i rekrutteringsprocessen foretages der mellem første og anden samtale en personprofilanalyse med efterfølgende personlig tilbagemelding (forventeligt 24. februar).   Vi glæder os til at høre fra dig! 
 Denne jobannonce blev oprindeligt opslået på  https://www.ofir.dk/ 
 (Den originale annonce kan ses på:  https://www.ofir.dk/showojob?ofirid=ea319c13 )","https://www.google.dk/maps/place/Sportsvej+16,5683,+Haarby/",29189692,False,False,,False
