summary_AutomatchType,summary_Abroad,summary_Weight,summary_Title,summary_JobHeadline,summary_Presentation,summary_HiringOrgName,summary_WorkPlaceAddress,summary_WorkPlacePostalCode,summary_WorkPlaceCity,summary_WorkPlaceOtherAddress,summary_WorkPlaceAbroad,summary_WorkPlaceNotStatic,summary_UseWorkPlaceAddressForJoblog,summary_PostingCreated,summary_LastDateApplication,summary_FormattedLastDateApplication,summary_AssignmentStartDate,summary_IsHotjob,summary_IsExternal,summary_Url,summary_Region,summary_Municipality,summary_Country,summary_PostalCode,summary_PostalCodeName,summary_JobAnnouncementType,summary_EmploymentType,summary_WorkHours,summary_OccupationArea,summary_OccupationGroup,summary_Occupation,summary_Location_Latitude,summary_Location_Longitude,summary_JoblogWorkTime_WorkHour,summary_JoblogWorkTime_DailyWorkTime,summary_WorkplaceID,summary_OrganisationId,summary_HiringOrgCVR,summary_UserLoggedIn,summary_AnonymousEmployer,summary_ShareUrl,summary_DetailsUrl,summary_JobLogUrl,summary_HasLocationValues,summary_ID,summary_Latitude,summary_Longitude,details_WorkSchedule,details_WorkConditions,details_EmploymentTypes,details_WorkPlace_Name,details_WorkPlace_Address_AddressLine,details_WorkPlace_Address_Country_Id,details_WorkPlace_Address_Country_Name,details_WorkPlace_Address_Municipality_Id,details_WorkPlace_Address_Municipality_Name,details_WorkPlace_Address_Region_Id,details_WorkPlace_Address_Region_Name,details_WorkPlace_Address_PostalCode,details_WorkPlace_Address_City,details_WorkPlace_PhoneNumber_Number,details_WorkPlace_PhoneNumber_Type,details_WorkPlace_PhoneNumber_Description,details_WorkPlace_FaxNumber,details_WorkPlace_Email,details_WorkPlace_WebAddress,details_WorkPlace_Description,details_WorkPlace_Logo,details_WorkPlace_WorkPlaceOrganizationNumber,details_WorkPlace_OrganizationNumber,details_WorkPlace_OrganizationDescription,details_JobPositionPosting_Id,details_JobPositionPosting_HiringOrg_Name,details_JobPositionPosting_HiringOrg_Address_AddressLine,details_JobPositionPosting_HiringOrg_Address_Country_Id,details_JobPositionPosting_HiringOrg_Address_Country_Name,details_JobPositionPosting_HiringOrg_Address_Municipality_Id,details_JobPositionPosting_HiringOrg_Address_Municipality_Name,details_JobPositionPosting_HiringOrg_Address_Region_Id,details_JobPositionPosting_HiringOrg_Address_Region_Name,details_JobPositionPosting_HiringOrg_Address_PostalCode,details_JobPositionPosting_HiringOrg_Address_City,details_JobPositionPosting_HiringOrg_PhoneNumber_Number,details_JobPositionPosting_HiringOrg_PhoneNumber_Type,details_JobPositionPosting_HiringOrg_PhoneNumber_Description,details_JobPositionPosting_HiringOrg_FaxNumber,details_JobPositionPosting_HiringOrg_Email,details_JobPositionPosting_HiringOrg_WebAddress,details_JobPositionPosting_HiringOrg_Description,details_JobPositionPosting_HiringOrg_Logo,details_JobPositionPosting_HiringOrg_WorkPlaceOrganizationNumber,details_JobPositionPosting_HiringOrg_OrganizationNumber,details_JobPositionPosting_HiringOrg_OrganizationDescription,details_JobPositionPosting_RecruitingCompany,details_JobPositionPosting_PublicationStartDate,details_JobPositionPosting_PublicationEndDate,details_JobPositionPosting_JobPositionInformation_PositionTitle,details_JobPositionPosting_JobPositionInformation_Purpose,details_JobPositionPosting_JobPositionInformation_WorkLocation_AddressLine,details_JobPositionPosting_JobPositionInformation_WorkLocation_Country_Id,details_JobPositionPosting_JobPositionInformation_WorkLocation_Country_Name,details_JobPositionPosting_JobPositionInformation_WorkLocation_Municipality_Id,details_JobPositionPosting_JobPositionInformation_WorkLocation_Municipality_Name,details_JobPositionPosting_JobPositionInformation_WorkLocation_Region_Id,details_JobPositionPosting_JobPositionInformation_WorkLocation_Region_Name,details_JobPositionPosting_JobPositionInformation_WorkLocation_PostalCode,details_JobPositionPosting_JobPositionInformation_WorkLocation_City,details_JobPositionPosting_JobPositionInformation_EmploymentType,details_JobPositionPosting_JobPositionInformation_WeeklyWorkHours_TypeId,details_JobPositionPosting_JobPositionInformation_WeeklyWorkHours_TypeName,details_JobPositionPosting_JobPositionInformation_WeeklyWorkHours_Description,details_JobPositionPosting_JobPositionInformation_CompensationDescription,details_JobPositionPosting_JobPositionInformation_NumberToFill,details_JobPositionPosting_JobPositionInformation_DriverLicense,details_JobPositionPosting_JobPositionInformation_Occupation_Name,details_JobPositionPosting_JobPositionInformation_Occupation_DiscoWeb,details_JobPositionPosting_JobPositionInformation_Occupation_AlternateNames,details_JobPositionPosting_JobPositionInformation_Occupation_GroupId,details_JobPositionPosting_JobPositionInformation_Occupation_AreaId,details_JobPositionPosting_JobPositionInformation_IsGovernmentHiring,details_JobPositionPosting_JobPositionInformation_JppContacts,details_JobPositionPosting_JobPositionInformation_EmploymentDate,details_JobPositionPosting_IsRecruitmentOfForeignNationals,details_JobPositionPosting_IsWorkInDenmark,details_JobPositionPosting_IsAnonymousEmployer,details_JobPositionPosting_IsDisabilityFriendly,details_JobPositionPosting_JppType,details_JobPositionPosting_ApplicationDetails_WorkHourMax,details_JobPositionPosting_ApplicationDetails_WorkHourMin,details_JobPositionPosting_ApplicationDetails_DailyWorkTimeWeekend,details_JobPositionPosting_ApplicationDetails_DailyWorkTimeNight,details_JobPositionPosting_ApplicationDetails_DailyWorkTimeEvening,details_JobPositionPosting_ApplicationDetails_DailyWorkTimeDay,details_JobPositionPosting_ApplicationDetails_DailyWorkTimeMorning,details_JobPositionPosting_ApplicationDetails_DailyWorkTimeVarious,details_JobPositionPosting_ApplicationDetails_ReferenceText,details_JobPositionPosting_ApplicationDetails_RemarksToApplicant,details_JobPositionPosting_ApplicationDetails_ByEmail,details_JobPositionPosting_ApplicationDetails_ByPhone,details_JobPositionPosting_ApplicationDetails_ApplyViaUrl,details_JobPositionPosting_ApplicationDetails_ReplyInWriting,details_JobPositionPosting_ApplicationDetails_ApplicationDeadlineDate,details_JobPositionPosting_Status,details_LogoUrl,details_Address,details_ShowMap,details_ShowShareButtonJobLog,details_JobLogUrl,details_JobLogTemplateModel_Identifier,details_JobLogTemplateModel_UseWorkPlaceAddressForJoblog,details_JobLogTemplateModel_Category,details_JobLogTemplateModel_CvCustomerIdentifier,details_JobLogTemplateModel_JobSeekingStatus,details_JobLogTemplateModel_Title,details_JobLogTemplateModel_IsApplicationSourceRequired,details_JobLogTemplateModel_ApplicationSource,details_JobLogTemplateModel_IsWeeklyWorkTimeRequired,details_JobLogTemplateModel_WeeklyWorkTime,details_JobLogTemplateModel_HoursPerWeek,details_JobLogTemplateModel_JobnetJobPostingIdentifier,details_JobLogTemplateModel_JobAdDocument_Title,details_JobLogTemplateModel_JobAdDocument_Identifier,details_JobLogTemplateModel_JobAdDocument_IsDeletedBySystem,details_JobLogTemplateModel_JobAdDocument_IsDeletedByUser,details_JobLogTemplateModel_JobAdFile,details_JobLogTemplateModel_Company_JobLogEntryCategory,details_JobLogTemplateModel_Company_ShowAddressFieldsEvenIfEmpty,details_JobLogTemplateModel_Company_Name,details_JobLogTemplateModel_Company_Address,details_JobLogTemplateModel_Company_Country,details_JobLogTemplateModel_Company_EmploymentAreaID,details_JobLogTemplateModel_Company_PostCode,details_JobLogTemplateModel_Company_IsCountryAndTownAndPostCodeEmpty,details_JobLogTemplateModel_Company_IsTownAndPostCodeEmpty,details_JobLogTemplateModel_Company_IsCountryDanmark,details_JobLogTemplateModel_Company_Town,details_JobLogTemplateModel_Company_ContactPerson,details_JobLogTemplateModel_Company_Phone,details_JobLogTemplateModel_Company_Email,details_JobLogTemplateModel_Company_Latitude,details_JobLogTemplateModel_Company_Longitude,details_JobLogTemplateModel_Company_DailyTravelTimeInMinutes,details_JobLogTemplateModel_Company_DistanceToCompanyInMeters,details_JobLogTemplateModel_Company_IsCreateMode,details_JobLogTemplateModel_TypeOfSubmission,details_JobLogTemplateModel_SubmissionDate,details_JobLogTemplateModel_SubmissionDateFormatted,details_JobLogTemplateModel_SubmissionDateTiks,details_JobLogTemplateModel_IsSubmissionDateRequired,details_JobLogTemplateModel_Status,details_JobLogTemplateModel_DateCreatedFormatted,details_JobLogTemplateModel_DateCreated,details_JobLogTemplateModel_DateModifiedFormatted,details_JobLogTemplateModel_DateModified,details_JobLogTemplateModel_LastModifiedDateTiks,details_JobLogTemplateModel_DateClosed,details_JobLogTemplateModel_JobApplicationDocument_Title,details_JobLogTemplateModel_JobApplicationDocument_Identifier,details_JobLogTemplateModel_JobApplicationDocument_IsDeletedBySystem,details_JobLogTemplateModel_JobApplicationDocument_IsDeletedByUser,details_JobLogTemplateModel_CvDocument_Title,details_JobLogTemplateModel_CvDocument_Identifier,details_JobLogTemplateModel_CvDocument_IsDeletedBySystem,details_JobLogTemplateModel_CvDocument_IsDeletedByUser,details_JobLogTemplateModel_JobApplicationFile,details_JobLogTemplateModel_CvFile,details_JobLogTemplateModel_SubmissionDeadlineDate,details_JobLogTemplateModel_IsPersisted,details_JobLogTemplateModel_ServerValidationErrors,details_JobLogTemplateModel_HasServerValidationErrors,details_JoblogWorkTime_WorkHour,details_JoblogWorkTime_DailyWorkTime,details_Place,details_OpenPrintDialog,details_WorkPlaceInfoText,details_JobCenterContactDetails,details_WorkPlaceDescriptionText,details_FavoriteText,details_IsFavorite,details_ShowFavorite,details_MetaOgTextForSharing,details_DescriptionForSharing,details_TitleForSharing,details_RutePlan,details_FormattedPurpose,details_MapUrl,details_OrganizationNumber,details_ShowSearchJobButton,details_ShowPrint,details_BackToFindWorkButtonUrl,isExternal
0,False,1,"Pædagogmedhjælper(e) (eller PAU’ere) søges til Ny institution på Amager, med udflytterdel","Pædagogmedhjælper(e) (eller PAU’ere) søges til Ny institution på Amager, med udflytterdel","Klyngen LUMIX udvider og søger derfor pædagogmedhjælpere/PAU’ere, (30-35 timer pr. uge), pr. 1. marts 2025 (eller snarest derefter). 
Har du lyst til at være med i opstarten",Børnehuset Høstgildvej,Høstgildevej 2  ,2300,København S,False,False,False,True,2025-01-23T00:00:00,2025-02-07T00:00:00,7. februar 2025,0001-01-01T00:00:00,False,False,https://job.jobnet.dk/CV/FindWork/Details/721a0cb2-5cfe-432f-a7af-6bf7326edbf8,Hovedstaden og Bornholm,København,Danmark,2300,,Hotjob,Fastansættelse,Fuldtid,"Pædagogisk, socialt og kirkeligt arbejde",Pædagogisk arbejde,Pædagogmedhjælper,55.6736,12.6554,,Dag,1031012402,,31868076,False,False,https://job.jobnet.dk/CV/FindWork/DetailsSocialmedia/721a0cb2-5cfe-432f-a7af-6bf7326edbf8,https://job.jobnet.dk/CV/FindWork/Details/721a0cb2-5cfe-432f-a7af-6bf7326edbf8,https://job.jobnet.dk/CV/FindWork/Details/721a0cb2-5cfe-432f-a7af-6bf7326edbf8,True,721a0cb2-5cfe-432f-a7af-6bf7326edbf8,55.6736,12.6554,"{'Id': 1, 'Name': 'Fuldtid'}, {'Id': 16, 'Name': 'Deltid'}","{'Id': 1, 'Name': 'Almindelige vilkår'}, {'Id': 2, 'Name': 'Fleksjob'}, {'Id': 3, 'Name': 'Skånejob'}, {'Id': 4, 'Name': 'Egnet til efterlønnere og seniorer'}, {'Id': 5, 'Name': 'Job med løntilskud'}, {'Id': 6, 'Name': 'Rotationsjob'}, {'Id': 7, 'Name': 'Virksomhedspraktik'}","{'Id': 1, 'Name': 'Fastansættelse'}, {'Id': 16, 'Name': 'Tidsbegrænset ansættelse'}",Børnehuset Høstgildvej,Høstgildevej 2,58,Danmark,101,København,4,"Hovedstaden, Sjælland og Bornholm",2300,,,0,Primary,,rasknu@kk.kk,,None,,1031012402,31868076,None,721a0cb2-5cfe-432f-a7af-6bf7326edbf8,Børnehuset Høstgildvej,Høstgildevej 2,58,Danmark,101,København,4,"Hovedstaden, Sjælland og Bornholm",2300,,,0,Primary,,rasknu@kk.kk,,None,,1031012402,31868076,None,,2025-01-23T00:00:00+01:00,2025-02-07T23:14:32+01:00,"Pædagogmedhjælper(e) (eller PAU’ere) søges til Ny institution på Amager, med udflytterdel","Klyngen LUMIX udvider og søger derfor pædagogmedhjælpere/PAU’ere, (30-35 timer pr. uge), pr. 1. marts 2025 (eller snarest derefter).  
 Har du lyst til at være med i opstarten af ny institution, sammen med os i den selvejende Klynge LUMIX, er det måske dig vi mangler😊! 
 Den 10. februar 2025 åbner vi dørene for de første børn og deres forældre, til vores nyopstartede institution med udflytterdel, på Høstgildevej 2 på Amager. 
 Institutionen på Høstgildevej har vi valgt, midlertidigt at kalde  ”Børnehuset Høstgildevej” , men det er meningen at vi finder på et sjovere og mere børnevenligt navn, inden længe. 
 Når institutionen er fuldt belagt, engang til sommer, vil den bestå af 3 vuggestuegrupper på Høstgildevej, samt 2 udflytter børnehavegrupper i Solrød Strand (Yderholmvej 25). Institutionen er fortrinsvis målrettet børn og forældre fra Ørestaden, men andre kan naturligvis også skrive sig op. 
 Vi starter op i februar på den ”faste adresse” på Høstgildevej, med en børnehavegruppe. Første marts starter vi op med en vuggestuegruppe og i takt med at institutionen vokser, vil vi så småt begynde at tage udflytterdelen i brug i Solrød Strand. Tidligt afleverede børnehavebørn, møder ind i Institutionen og Busopsamlingen vil være lige i nærheden. Vi starter den første stue op med 4 dygtige pædagoger, 1 pædagogisk leder og vil i løbet af de kommende måneder, få behov for flere både medhjælpere og pædagoger. Indenfor det første år, etableres forældreråd, TRIO og der bliver ansat en afdelingsleder til udflytterdelen. 
 Institutionen vil blive en del af den selvejende klynge ”LUMIX”, som udover denne nye institution, også består af 4 andre 0-6 års institutioner fordelt på 10 matrikler, samt 2 Fritidscentre fordelt på 6 matrikler. 
 Vi kan lide at grine sammen, at tage ansvar, at være nærværende i børnehøjde og at sparre med hinanden. Vi arbejder med indflydelse og medbestemmelse blandt voksne såvel som børn og lægger vægt på glæde, humor, tryghed, hygge, faglighed, stabilitet og fleksibilitet. 
 Vi forventer, at du:  
 
 har gode samarbejds- og kommunikationsevner. 
 har gåpåmod, gerne vil lære nyt og kan leve nye tanker, ideer og initiativer ud i livet 
 er indstillet på at rykke stue for en periode, hvis omstændighederne kræver det 
 
 Vi tilbyder dig: 
 
 mulighed for at være med til at opstarte og sætte dit præg på en helt ny institution – helt fra begyndelsen. 
 en arbejdsplads hvor vi vægter medarbejdertrivsel og arbejdsglæde højt 
 tilbud om relevante kurser. 
 
 Flere oplysninger: Flere oplysninger om stillingen kan indhentes ved at kontakte klyngeleder Rasmus Fredberg Knudsen på tlf.: 24940352 eller på mail:  rasknu@kk.dk . 
 Ansøgning:   Vi skal have din ansøgning  senest d. 7. februar 2025  og stillingen kan tiltrædes 1. marts 2025 eller snarest derefter.  (Vi er forberedt på at der sandsynligvis kan være tale om opsigelsesvarsel på anden arbejdsplads). 
 Det forventes at vi afholder løbende samtaler, i takt med at ansøgningerne tikker ind. 
 Ansøgningen sendes til klyngeleder Rasmus Fredberg Knudsen på mail:  rasknu@kk.dk . Har du erfaring fra tidligere pædagogisk arbejde eller er uddannet PAU, beder vi dig vedlægge dokumentation for dette, sammen med ansøgningen. 
 Løn- og ansættelsesforhold efter gældende overenskomst.",Høstgildevej 2,58,Danmark,101,København,4,"Hovedstaden, Sjælland og Bornholm",2300,,1,1,Fuldtid,None,None,1,,Pædagogmedhjælper,0,,0,0,False,"{'Email': 'rasknu@kk.dk', 'PersonName': 'Rasmus Fredberg Knudsen', 'FirstName': 'Rasmus', 'LastName': 'Fredberg Knudsen', 'PositionTitle': 'Klyngeleder', 'PhoneNumbers': [{'Number': '24940352', 'Type': 0, 'Description': 'Primary'}]}",2025-03-01T00:00:00+01:00,False,False,False,False,4,,,False,False,False,True,False,False,,,rasknu@kk.kk,,,False,2025-02-07T00:00:00+01:00,7,/CV/FindWork/GetLogo?JobAdId=721a0cb2-5cfe-432f-a7af-6bf7326edbf8&Organisation=31868076,"Høstgildevej 2,2300, ",True,False,"/CV/Jobseeking/JobLog/CreateJobSearch?JobnetJobPostingIdentifier=721a0cb2-5cfe-432f-a7af-6bf7326edbf8&Company.Name=Børnehuset Høstgildvej&SubmissionDeadlineDate=2025-2-7&Title=Pædagogmedhjælper(e) (eller PAU’ere) søges til Ny institution på Amager, med udflytterdel&WeeklyWorkTime=1",00000000-0000-0000-0000-000000000000,True,0,,,"Pædagogmedhjælper(e) (eller PAU’ere) søges til Ny institution på Amager, med udflytterdel",True,,True,1,,721a0cb2-5cfe-432f-a7af-6bf7326edbf8,,,False,False,,0,False,Børnehuset Høstgildvej,Høstgildevej 2,,,2300,False,False,False,,Rasmus Fredberg Knudsen,24940352,rasknu@kk.dk,,,,,False,,2025-02-07T00:00:00+01:00,,0,False,0,,,,,0,,,,False,False,,,False,False,,,,False,,False,,Dag,Arbejdspladsen ligger i København kommune,False,Børnehuset Høstgildvej,,None,,False,False,"Klyngen LUMIX udvider og søger derfor pædagogmedhjælpere/PAU’ere, (30-35 timer pr. uge), pr. 1. marts 2025 (eller snarest derefter). 
Har du lyst til at være med i opstarten af ny institution, sammen med os i den selvejende Klynge LUMIX, er det måske dig vi mangler😊!
Den 10. februar 2025 åbner vi dørene for de første børn og deres forældre, til vo","""Klyngen LUMIX udvider og søger derfor pædagogmedhjælpere/PAU’ere, (30-35 timer pr. uge), pr. 1. marts 2025 (eller snarest derefter). \nHar du lyst til at være med i opstarten af ny institution, sammen med os i den selvejende Klynge LUMIX, er det måske dig vi mangler😊!\nDen 10. februar 2025 åbner vi dørene for de første børn og deres forældre, til vo""","""Pædagogmedhjælper(e) (eller PAU’ere) søges til Ny institution på Amager, med udflytterdel""","https://www.google.dk/maps/dir//Høstgildevej+2,2300,+/","Klyngen LUMIX udvider og søger derfor pædagogmedhjælpere/PAU’ere, (30-35 timer pr. uge), pr. 1. marts 2025 (eller snarest derefter).  
 Har du lyst til at være med i opstarten af ny institution, sammen med os i den selvejende Klynge LUMIX, er det måske dig vi mangler😊! 
 Den 10. februar 2025 åbner vi dørene for de første børn og deres forældre, til vores nyopstartede institution med udflytterdel, på Høstgildevej 2 på Amager. 
 Institutionen på Høstgildevej har vi valgt, midlertidigt at kalde  ”Børnehuset Høstgildevej” , men det er meningen at vi finder på et sjovere og mere børnevenligt navn, inden længe. 
 Når institutionen er fuldt belagt, engang til sommer, vil den bestå af 3 vuggestuegrupper på Høstgildevej, samt 2 udflytter børnehavegrupper i Solrød Strand (Yderholmvej 25). Institutionen er fortrinsvis målrettet børn og forældre fra Ørestaden, men andre kan naturligvis også skrive sig op. 
 Vi starter op i februar på den ”faste adresse” på Høstgildevej, med en børnehavegruppe. Første marts starter vi op med en vuggestuegruppe og i takt med at institutionen vokser, vil vi så småt begynde at tage udflytterdelen i brug i Solrød Strand. Tidligt afleverede børnehavebørn, møder ind i Institutionen og Busopsamlingen vil være lige i nærheden. Vi starter den første stue op med 4 dygtige pædagoger, 1 pædagogisk leder og vil i løbet af de kommende måneder, få behov for flere både medhjælpere og pædagoger. Indenfor det første år, etableres forældreråd, TRIO og der bliver ansat en afdelingsleder til udflytterdelen. 
 Institutionen vil blive en del af den selvejende klynge ”LUMIX”, som udover denne nye institution, også består af 4 andre 0-6 års institutioner fordelt på 10 matrikler, samt 2 Fritidscentre fordelt på 6 matrikler. 
 Vi kan lide at grine sammen, at tage ansvar, at være nærværende i børnehøjde og at sparre med hinanden. Vi arbejder med indflydelse og medbestemmelse blandt voksne såvel som børn og lægger vægt på glæde, humor, tryghed, hygge, faglighed, stabilitet og fleksibilitet. 
 Vi forventer, at du:  
 
 har gode samarbejds- og kommunikationsevner. 
 har gåpåmod, gerne vil lære nyt og kan leve nye tanker, ideer og initiativer ud i livet 
 er indstillet på at rykke stue for en periode, hvis omstændighederne kræver det 
 
 Vi tilbyder dig: 
 
 mulighed for at være med til at opstarte og sætte dit præg på en helt ny institution – helt fra begyndelsen. 
 en arbejdsplads hvor vi vægter medarbejdertrivsel og arbejdsglæde højt 
 tilbud om relevante kurser. 
 
 Flere oplysninger: Flere oplysninger om stillingen kan indhentes ved at kontakte klyngeleder Rasmus Fredberg Knudsen på tlf.: 24940352 eller på mail:  rasknu@kk.dk . 
 Ansøgning:   Vi skal have din ansøgning  senest d. 7. februar 2025  og stillingen kan tiltrædes 1. marts 2025 eller snarest derefter.  (Vi er forberedt på at der sandsynligvis kan være tale om opsigelsesvarsel på anden arbejdsplads). 
 Det forventes at vi afholder løbende samtaler, i takt med at ansøgningerne tikker ind. 
 Ansøgningen sendes til klyngeleder Rasmus Fredberg Knudsen på mail:  rasknu@kk.dk . Har du erfaring fra tidligere pædagogisk arbejde eller er uddannet PAU, beder vi dig vedlægge dokumentation for dette, sammen med ansøgningen. 
 Løn- og ansættelsesforhold efter gældende overenskomst.","https://www.google.dk/maps/place/Høstgildevej+2,2300,+/",31868076,False,False,,False
