summary_AutomatchType,summary_Abroad,summary_Weight,summary_Title,summary_JobHeadline,summary_Presentation,summary_HiringOrgName,summary_WorkPlaceAddress,summary_WorkPlacePostalCode,summary_WorkPlaceCity,summary_WorkPlaceOtherAddress,summary_WorkPlaceAbroad,summary_WorkPlaceNotStatic,summary_UseWorkPlaceAddressForJoblog,summary_PostingCreated,summary_LastDateApplication,summary_FormattedLastDateApplication,summary_AssignmentStartDate,summary_IsHotjob,summary_IsExternal,summary_Url,summary_Region,summary_Municipality,summary_Country,summary_PostalCode,summary_PostalCodeName,summary_JobAnnouncementType,summary_EmploymentType,summary_WorkHours,summary_OccupationArea,summary_OccupationGroup,summary_Occupation,summary_Location_Latitude,summary_Location_Longitude,summary_JoblogWorkTime_WorkHour,summary_JoblogWorkTime_DailyWorkTime,summary_WorkplaceID,summary_OrganisationId,summary_HiringOrgCVR,summary_UserLoggedIn,summary_AnonymousEmployer,summary_ShareUrl,summary_DetailsUrl,summary_JobLogUrl,summary_HasLocationValues,summary_ID,summary_Latitude,summary_Longitude,details_WorkSchedule,details_WorkConditions,details_EmploymentTypes,details_WorkPlace_Name,details_WorkPlace_Address_AddressLine,details_WorkPlace_Address_Country_Id,details_WorkPlace_Address_Country_Name,details_WorkPlace_Address_Municipality_Id,details_WorkPlace_Address_Municipality_Name,details_WorkPlace_Address_Region_Id,details_WorkPlace_Address_Region_Name,details_WorkPlace_Address_PostalCode,details_WorkPlace_Address_City,details_WorkPlace_PhoneNumber_Number,details_WorkPlace_PhoneNumber_Type,details_WorkPlace_PhoneNumber_Description,details_WorkPlace_FaxNumber,details_WorkPlace_Email,details_WorkPlace_WebAddress,details_WorkPlace_Description,details_WorkPlace_Logo,details_WorkPlace_WorkPlaceOrganizationNumber,details_WorkPlace_OrganizationNumber,details_WorkPlace_OrganizationDescription,details_JobPositionPosting_Id,details_JobPositionPosting_HiringOrg_Name,details_JobPositionPosting_HiringOrg_Address_AddressLine,details_JobPositionPosting_HiringOrg_Address_Country_Id,details_JobPositionPosting_HiringOrg_Address_Country_Name,details_JobPositionPosting_HiringOrg_Address_Municipality_Id,details_JobPositionPosting_HiringOrg_Address_Municipality_Name,details_JobPositionPosting_HiringOrg_Address_Region_Id,details_JobPositionPosting_HiringOrg_Address_Region_Name,details_JobPositionPosting_HiringOrg_Address_PostalCode,details_JobPositionPosting_HiringOrg_Address_City,details_JobPositionPosting_HiringOrg_PhoneNumber_Number,details_JobPositionPosting_HiringOrg_PhoneNumber_Type,details_JobPositionPosting_HiringOrg_PhoneNumber_Description,details_JobPositionPosting_HiringOrg_FaxNumber,details_JobPositionPosting_HiringOrg_Email,details_JobPositionPosting_HiringOrg_WebAddress,details_JobPositionPosting_HiringOrg_Description,details_JobPositionPosting_HiringOrg_Logo,details_JobPositionPosting_HiringOrg_WorkPlaceOrganizationNumber,details_JobPositionPosting_HiringOrg_OrganizationNumber,details_JobPositionPosting_HiringOrg_OrganizationDescription,details_JobPositionPosting_RecruitingCompany,details_JobPositionPosting_PublicationStartDate,details_JobPositionPosting_PublicationEndDate,details_JobPositionPosting_JobPositionInformation_PositionTitle,details_JobPositionPosting_JobPositionInformation_Purpose,details_JobPositionPosting_JobPositionInformation_WorkLocation_AddressLine,details_JobPositionPosting_JobPositionInformation_WorkLocation_Country_Id,details_JobPositionPosting_JobPositionInformation_WorkLocation_Country_Name,details_JobPositionPosting_JobPositionInformation_WorkLocation_Municipality_Id,details_JobPositionPosting_JobPositionInformation_WorkLocation_Municipality_Name,details_JobPositionPosting_JobPositionInformation_WorkLocation_Region_Id,details_JobPositionPosting_JobPositionInformation_WorkLocation_Region_Name,details_JobPositionPosting_JobPositionInformation_WorkLocation_PostalCode,details_JobPositionPosting_JobPositionInformation_WorkLocation_City,details_JobPositionPosting_JobPositionInformation_EmploymentType,details_JobPositionPosting_JobPositionInformation_WeeklyWorkHours_TypeId,details_JobPositionPosting_JobPositionInformation_WeeklyWorkHours_TypeName,details_JobPositionPosting_JobPositionInformation_WeeklyWorkHours_Description,details_JobPositionPosting_JobPositionInformation_CompensationDescription,details_JobPositionPosting_JobPositionInformation_NumberToFill,details_JobPositionPosting_JobPositionInformation_DriverLicense,details_JobPositionPosting_JobPositionInformation_Occupation_Name,details_JobPositionPosting_JobPositionInformation_Occupation_DiscoWeb,details_JobPositionPosting_JobPositionInformation_Occupation_AlternateNames,details_JobPositionPosting_JobPositionInformation_Occupation_GroupId,details_JobPositionPosting_JobPositionInformation_Occupation_AreaId,details_JobPositionPosting_JobPositionInformation_IsGovernmentHiring,details_JobPositionPosting_JobPositionInformation_JppContacts,details_JobPositionPosting_JobPositionInformation_EmploymentDate,details_JobPositionPosting_IsRecruitmentOfForeignNationals,details_JobPositionPosting_IsWorkInDenmark,details_JobPositionPosting_IsAnonymousEmployer,details_JobPositionPosting_IsDisabilityFriendly,details_JobPositionPosting_JppType,details_JobPositionPosting_ApplicationDetails_WorkHourMax,details_JobPositionPosting_ApplicationDetails_WorkHourMin,details_JobPositionPosting_ApplicationDetails_DailyWorkTimeWeekend,details_JobPositionPosting_ApplicationDetails_DailyWorkTimeNight,details_JobPositionPosting_ApplicationDetails_DailyWorkTimeEvening,details_JobPositionPosting_ApplicationDetails_DailyWorkTimeDay,details_JobPositionPosting_ApplicationDetails_DailyWorkTimeMorning,details_JobPositionPosting_ApplicationDetails_DailyWorkTimeVarious,details_JobPositionPosting_ApplicationDetails_ReferenceText,details_JobPositionPosting_ApplicationDetails_RemarksToApplicant,details_JobPositionPosting_ApplicationDetails_ByEmail,details_JobPositionPosting_ApplicationDetails_ByPhone,details_JobPositionPosting_ApplicationDetails_ApplyViaUrl,details_JobPositionPosting_ApplicationDetails_ReplyInWriting,details_JobPositionPosting_ApplicationDetails_ApplicationDeadlineDate,details_JobPositionPosting_Status,details_LogoUrl,details_Address,details_ShowMap,details_ShowShareButtonJobLog,details_JobLogUrl,details_JobLogTemplateModel_Identifier,details_JobLogTemplateModel_UseWorkPlaceAddressForJoblog,details_JobLogTemplateModel_Category,details_JobLogTemplateModel_CvCustomerIdentifier,details_JobLogTemplateModel_JobSeekingStatus,details_JobLogTemplateModel_Title,details_JobLogTemplateModel_IsApplicationSourceRequired,details_JobLogTemplateModel_ApplicationSource,details_JobLogTemplateModel_IsWeeklyWorkTimeRequired,details_JobLogTemplateModel_WeeklyWorkTime,details_JobLogTemplateModel_HoursPerWeek,details_JobLogTemplateModel_JobnetJobPostingIdentifier,details_JobLogTemplateModel_JobAdDocument_Title,details_JobLogTemplateModel_JobAdDocument_Identifier,details_JobLogTemplateModel_JobAdDocument_IsDeletedBySystem,details_JobLogTemplateModel_JobAdDocument_IsDeletedByUser,details_JobLogTemplateModel_JobAdFile,details_JobLogTemplateModel_Company_JobLogEntryCategory,details_JobLogTemplateModel_Company_ShowAddressFieldsEvenIfEmpty,details_JobLogTemplateModel_Company_Name,details_JobLogTemplateModel_Company_Address,details_JobLogTemplateModel_Company_Country,details_JobLogTemplateModel_Company_EmploymentAreaID,details_JobLogTemplateModel_Company_PostCode,details_JobLogTemplateModel_Company_IsCountryAndTownAndPostCodeEmpty,details_JobLogTemplateModel_Company_IsTownAndPostCodeEmpty,details_JobLogTemplateModel_Company_IsCountryDanmark,details_JobLogTemplateModel_Company_Town,details_JobLogTemplateModel_Company_ContactPerson,details_JobLogTemplateModel_Company_Phone,details_JobLogTemplateModel_Company_Email,details_JobLogTemplateModel_Company_Latitude,details_JobLogTemplateModel_Company_Longitude,details_JobLogTemplateModel_Company_DailyTravelTimeInMinutes,details_JobLogTemplateModel_Company_DistanceToCompanyInMeters,details_JobLogTemplateModel_Company_IsCreateMode,details_JobLogTemplateModel_TypeOfSubmission,details_JobLogTemplateModel_SubmissionDate,details_JobLogTemplateModel_SubmissionDateFormatted,details_JobLogTemplateModel_SubmissionDateTiks,details_JobLogTemplateModel_IsSubmissionDateRequired,details_JobLogTemplateModel_Status,details_JobLogTemplateModel_DateCreatedFormatted,details_JobLogTemplateModel_DateCreated,details_JobLogTemplateModel_DateModifiedFormatted,details_JobLogTemplateModel_DateModified,details_JobLogTemplateModel_LastModifiedDateTiks,details_JobLogTemplateModel_DateClosed,details_JobLogTemplateModel_JobApplicationDocument_Title,details_JobLogTemplateModel_JobApplicationDocument_Identifier,details_JobLogTemplateModel_JobApplicationDocument_IsDeletedBySystem,details_JobLogTemplateModel_JobApplicationDocument_IsDeletedByUser,details_JobLogTemplateModel_CvDocument_Title,details_JobLogTemplateModel_CvDocument_Identifier,details_JobLogTemplateModel_CvDocument_IsDeletedBySystem,details_JobLogTemplateModel_CvDocument_IsDeletedByUser,details_JobLogTemplateModel_JobApplicationFile,details_JobLogTemplateModel_CvFile,details_JobLogTemplateModel_SubmissionDeadlineDate,details_JobLogTemplateModel_IsPersisted,details_JobLogTemplateModel_ServerValidationErrors,details_JobLogTemplateModel_HasServerValidationErrors,details_JoblogWorkTime_WorkHour,details_JoblogWorkTime_DailyWorkTime,details_Place,details_OpenPrintDialog,details_WorkPlaceInfoText,details_JobCenterContactDetails,details_WorkPlaceDescriptionText,details_FavoriteText,details_IsFavorite,details_ShowFavorite,details_MetaOgTextForSharing,details_DescriptionForSharing,details_TitleForSharing,details_RutePlan,details_FormattedPurpose,details_MapUrl,details_OrganizationNumber,details_ShowSearchJobButton,details_ShowPrint,details_BackToFindWorkButtonUrl,isExternal
0,False,1,Projektleder/udbudskonsulent med ansvar for IT udbud og kontraktstyring,Projektleder/udbudskonsulent med ansvar for IT udbud og kontraktstyring,"Motiveres du af at arbejde med projektledelse, udbudsprocesser og kontrakter, og kunne du tænke dig at blive en del af et fællesskab, der brænder for at effektivisere offentligt indkøb? Så ",Nyborg Kommune - Udbud og Indkøb,Torvet 1  ,5800,Nyborg,False,False,False,True,2025-01-14T10:27:27,2025-02-10T23:59:59,10. februar 2025,0001-01-01T00:00:00,False,False,https://job.jobnet.dk/CV/FindWork/Details/75d49d08-d02f-41a4-94f6-acb5b1cdeda0,Syddanmark,Nyborg,Danmark,5800,,Almindelige vilkår,Fastansættelse,Fuldtid,Ledelse,Øvrig ledelse,Projektleder,55.353,10.7979,,,1003314063,,29189722,False,False,https://job.jobnet.dk/CV/FindWork/DetailsSocialmedia/75d49d08-d02f-41a4-94f6-acb5b1cdeda0,https://job.jobnet.dk/CV/FindWork/Details/75d49d08-d02f-41a4-94f6-acb5b1cdeda0,https://job.jobnet.dk/CV/FindWork/Details/75d49d08-d02f-41a4-94f6-acb5b1cdeda0,True,75d49d08-d02f-41a4-94f6-acb5b1cdeda0,55.353,10.7979,"{'Id': 1, 'Name': 'Fuldtid'}, {'Id': 16, 'Name': 'Deltid'}","{'Id': 1, 'Name': 'Almindelige vilkår'}, {'Id': 2, 'Name': 'Fleksjob'}, {'Id': 3, 'Name': 'Skånejob'}, {'Id': 4, 'Name': 'Egnet til efterlønnere og seniorer'}, {'Id': 5, 'Name': 'Job med løntilskud'}, {'Id': 6, 'Name': 'Rotationsjob'}, {'Id': 7, 'Name': 'Virksomhedspraktik'}","{'Id': 1, 'Name': 'Fastansættelse'}, {'Id': 16, 'Name': 'Tidsbegrænset ansættelse'}",Nyborg Kommune - Udbud og Indkøb,Torvet 1,58,Danmark,450,Nyborg,3,Syddanmark,5800,Nyborg,,0,Primary,,,https://www.ofir.dk/resultat/Jobannonce.aspx?ofirId=82b1f7ad&action=sendApplicationUrl&utm_source=job.jobnet.dk&utm_medium=referral,None,,1003314063,29189722,None,75d49d08-d02f-41a4-94f6-acb5b1cdeda0,Nyborg Kommune - Udbud og Indkøb,Torvet 1,58,Danmark,450,Nyborg,3,Syddanmark,5800,Nyborg,,0,Primary,,,https://www.ofir.dk/resultat/Jobannonce.aspx?ofirId=82b1f7ad&action=sendApplicationUrl&utm_source=job.jobnet.dk&utm_medium=referral,None,,1003314063,29189722,None,,2025-01-14T10:27:27.0813989+01:00,2025-02-10T23:59:59+01:00,Projektleder/udbudskonsulent med ansvar for IT udbud og kontraktstyring,"Motiveres du af at arbejde med projektledelse, udbudsprocesser og kontrakter, og kunne du tænke dig at blive en del af et fællesskab, der brænder for at effektivisere offentligt indkøb? Så har vi en spændende stilling til dig som projektleder i Nyborg Kommune. Gennem udbud, tilbudsindhentning, kontraktstyring og e-handel bidrager indkøbsteamet i Udbud og Indkøb til at skabe mest mulig velfærd for kommunens borgere. Om os Udbud og Indkøb i Nyborg Kommune er en selvstændig enhed, der hører under Økonomi og Digitalisering. Enheden består af en daglig leder, to udbudskonsulenter, en kørsels- og logistikkoordinator,  en kontrakt- og analysekonsulent samt en studentermedhjælper, og nu også snart en projektleder med fokus på IT indkøb og kontraktstyring. Opgaverne i Udbud og Indkøb er forskelligartede, og omfatter bl.a. udbud sammen med vores indkøbsfællesskab KomUdbud, udarbejdelse af egne lokale udbud og tilbudsindhentninger, rådgivning og support af Nyborg Kommunes afdelinger i forhold til udbudsregler, samt vedligeholdelse af indkøbssystem og varekataloger, controlling opgaver samt kontraktstyring. Derudover har vi en rolle i at udvikle organisationen igennem indkøb og arbejder struktureret på at blive set som en værdifuld samarbejdspartner for de øvrige afdelinger. Udbud og Indkøb har stor berøringsflade i kommunen, samt et stort netværk blandt andre indkøbsafdelinger i Danmark, som vi ofte ses med til konferencer og andre netværksmøder.  Om stillingen Der er tale om en nyoprettet stilling, hvor du i høj grad får mulighed for selv at præge den måde, du vil løse opgaven med at få professionaliseret indkøb og kontraktstyring på IT opgaver. Struktur for opgaveløsning vil du skulle skabe i samarbejde med IT og Digitalisering samt vores udbudskonsulent, der i dag sidder med dele af opgaven. Ud over IT området, vil du også skulle have viden om, og kunne udføre andre typer af udbud, herunder udbud på teknisk område, men også for de øvrige afdelinger i Nyborg Kommune.  Hvis du har stor erfaring at byde ind med, vil det være muligt fra start at få titel som specialkonsulent.  Vi forestiller os at dine hovedopgaver i stillingen som projektleder vil omfatte: Skabe struktur for IT indkøb, der sikrer at de kontrakter der indgås, bliver indgået rettidigt, med fokus på den nødvendige kvalitet. Ofte vil indkøb ske via SKI’s IT aftaler. Skabe struktur for IT kontraktstyring, der sikrer at vi har et overblik over alle aftaler der indgås i kommunen, at vi får den kvalitet der betales for, og hvis ikke – at vi får styr på kvaliteten sammen med brugere og leverandør.  Projektledelse på udbud, herunder udarbejdelse af udbudsmateriale sammen med en brugergruppe. Både på IT området, men også på udbud for andre afdelinger i kommunen. Gennemførelse af behovs- og markedsanalyser og dialog med interne fagpersoner og markedsaktører. Indarbejdelse af grønne krav i udbud og tilbudsindhentninger ud fra målsætninger i Partnerskab for Offentlige Grønne Indkøb – herunder vurdering af, hvordan der opnås mest bæredygtighed for pengene. Bistå til den fortsatte udvikling i Udbud og Indkøb, herunder sparring, vidensdeling og optimering af processer. Samarbejde med vores kollegaer i KomUdbud, eksterne leverandører og samarbejdspartnere. Udarbejdelse af beslutningsoplæg til direktionen og det politiske niveau. Om dig Da der i stillingen vil være en stor berøringsflade med mange forskellige fagligheder samt eksterne samarbejdspartnere, vil det være en fordel, at du har et naturlig flair for at skabe gode rammer omkring samarbejdet. Du skal også have gode kommunikationsevner, da det er vigtigt at kunne formidle og indgå i konstruktiv dialog med fagafdelingerne og dermed skabe forståelsen af et fælles ansvar omkring de indgåede kontrakter. Du er selvledende og helhedsorienteret, ansvarlig og kvalitetsbevidst i din opgaveløsning og evner at dele ud af din viden og udvise fællesskabsånd i de opgaver, du udfører. Der kan være flere indgange til at kunne varetage stillingen, f.eks. kunne du have en juridisk baggrund, en it eller projektlederuddannelse kombineret med 5+ års erfaring. Det vigtigste er, at du har stor erfaring med projektledelse, gerne af IT indkøb. Det er en fordel, hvis du har godt kendskab til offentligt indkøb, og har evnen til at fordybe dig i et kompleks område, har mod på at tage de konflikter der kommer, og har evner til at samarbejde frem mod en god opfyldelse af opgaverne. Løn- og ansættelsesvilkår Ansættelse sker efter gældende overenskomst og efter principperne om lokal løndannelse med mulighed for forhandling af tillæg. For den rigtige profil, vil der kunne være tale om en stilling som specialkonsulent. Stillingen er på 37 timer ugentlig med forventet  tiltrædelse 1. april 2025  eller  1. maj 2025 .  Ved ansættelsessamtalen skal der forevises  straffeattest .  Yderligere oplysninger Fås på kommunens hjemmeside www.nyborg.dk eller du kan kontakte leder af Udbud og Indkøb Sandy Lützen på tlf.: 6333 7788 eller  sall@nyborg.dk   Ansøgning med bilag skal indsendes  senest 10. februar 2025 .  Ansættelsessamtaler forventes afholdt 19. februar 2025. Nyborg Kommune har indført røgfri arbejdstid. Politikken gælder alle ansatte og betyder, at det ikke er muligt at ryge i arbejdstiden. Rygepolitikken skal sikre, at alle ansatte i Nyborg Kommune kan færdes i et røgfrit arbejdsmiljø. 
 Denne jobannonce blev oprindeligt opslået på  https://www.ofir.dk/ 
 (Den originale annonce kan ses på:  https://www.ofir.dk/showojob?ofirid=82b1f7ad )",Torvet 1,58,Danmark,450,Nyborg,3,Syddanmark,5800,Nyborg,1,1,Fuldtid,None,None,1,,Projektleder,0,"Projektleder med ansvar for undervandsbyggerier, Projektchef, 5470, 5471, 5472, Project Director, Project Manager, PMO Manager",0,0,False,,,False,False,False,False,4,,,False,False,False,False,False,False,,,,,https://www.ofir.dk/resultat/Jobannonce.aspx?ofirId=82b1f7ad&action=sendApplicationUrl&utm_source=job.jobnet.dk&utm_medium=referral,False,2025-02-10T23:59:59+01:00,7,/CV/FindWork/GetLogo?JobAdId=75d49d08-d02f-41a4-94f6-acb5b1cdeda0&Organisation=29189722,"Torvet 1,5800, Nyborg",True,False,/CV/Jobseeking/JobLog/CreateJobSearch?JobnetJobPostingIdentifier=75d49d08-d02f-41a4-94f6-acb5b1cdeda0&Company.Name=Nyborg Kommune - Udbud og Indkøb&SubmissionDeadlineDate=2025-2-10&Title=Projektleder/udbudskonsulent med ansvar for IT udbud og kontraktstyring&WeeklyWorkTime=1,00000000-0000-0000-0000-000000000000,True,0,,,Projektleder/udbudskonsulent med ansvar for IT udbud og kontraktstyring,True,,True,1,,75d49d08-d02f-41a4-94f6-acb5b1cdeda0,,,False,False,,0,False,Nyborg Kommune - Udbud og Indkøb,Torvet 1,,,5800,False,False,False,Nyborg,,,,,,,,False,,2025-02-10T23:59:59+01:00,,0,False,0,,,,,0,,,,False,False,,,False,False,,,,False,,False,,,Arbejdspladsen ligger i Nyborg kommune,False,Nyborg Kommune - Udbud og Indkøb,,None,,False,False,"Motiveres du af at arbejde med projektledelse, udbudsprocesser og kontrakter, og kunne du tænke dig at blive en del af et fællesskab, der brænder for at effektivisere offentligt indkøb? Så har vi en spændende stilling til dig som projektleder i Nyborg Kommune.Gennem udbud, tilbudsindhentning, kontraktstyring og e-handel bidrager indkøbsteamet i Udb","""Motiveres du af at arbejde med projektledelse, udbudsprocesser og kontrakter, og kunne du tænke dig at blive en del af et fællesskab, der brænder for at effektivisere offentligt indkøb? Så har vi en spændende stilling til dig som projektleder i Nyborg Kommune.Gennem udbud, tilbudsindhentning, kontraktstyring og e-handel bidrager indkøbsteamet i Udb""","""Projektleder/udbudskonsulent med ansvar for IT udbud og kontraktstyring""","https://www.google.dk/maps/dir//Torvet+1,5800,+Nyborg/","Motiveres du af at arbejde med projektledelse, udbudsprocesser og kontrakter, og kunne du tænke dig at blive en del af et fællesskab, der brænder for at effektivisere offentligt indkøb? Så har vi en spændende stilling til dig som projektleder i Nyborg Kommune. Gennem udbud, tilbudsindhentning, kontraktstyring og e-handel bidrager indkøbsteamet i Udbud og Indkøb til at skabe mest mulig velfærd for kommunens borgere. Om os Udbud og Indkøb i Nyborg Kommune er en selvstændig enhed, der hører under Økonomi og Digitalisering. Enheden består af en daglig leder, to udbudskonsulenter, en kørsels- og logistikkoordinator,  en kontrakt- og analysekonsulent samt en studentermedhjælper, og nu også snart en projektleder med fokus på IT indkøb og kontraktstyring. Opgaverne i Udbud og Indkøb er forskelligartede, og omfatter bl.a. udbud sammen med vores indkøbsfællesskab KomUdbud, udarbejdelse af egne lokale udbud og tilbudsindhentninger, rådgivning og support af Nyborg Kommunes afdelinger i forhold til udbudsregler, samt vedligeholdelse af indkøbssystem og varekataloger, controlling opgaver samt kontraktstyring. Derudover har vi en rolle i at udvikle organisationen igennem indkøb og arbejder struktureret på at blive set som en værdifuld samarbejdspartner for de øvrige afdelinger. Udbud og Indkøb har stor berøringsflade i kommunen, samt et stort netværk blandt andre indkøbsafdelinger i Danmark, som vi ofte ses med til konferencer og andre netværksmøder.  Om stillingen Der er tale om en nyoprettet stilling, hvor du i høj grad får mulighed for selv at præge den måde, du vil løse opgaven med at få professionaliseret indkøb og kontraktstyring på IT opgaver. Struktur for opgaveløsning vil du skulle skabe i samarbejde med IT og Digitalisering samt vores udbudskonsulent, der i dag sidder med dele af opgaven. Ud over IT området, vil du også skulle have viden om, og kunne udføre andre typer af udbud, herunder udbud på teknisk område, men også for de øvrige afdelinger i Nyborg Kommune.  Hvis du har stor erfaring at byde ind med, vil det være muligt fra start at få titel som specialkonsulent.  Vi forestiller os at dine hovedopgaver i stillingen som projektleder vil omfatte: Skabe struktur for IT indkøb, der sikrer at de kontrakter der indgås, bliver indgået rettidigt, med fokus på den nødvendige kvalitet. Ofte vil indkøb ske via SKI’s IT aftaler. Skabe struktur for IT kontraktstyring, der sikrer at vi har et overblik over alle aftaler der indgås i kommunen, at vi får den kvalitet der betales for, og hvis ikke – at vi får styr på kvaliteten sammen med brugere og leverandør.  Projektledelse på udbud, herunder udarbejdelse af udbudsmateriale sammen med en brugergruppe. Både på IT området, men også på udbud for andre afdelinger i kommunen. Gennemførelse af behovs- og markedsanalyser og dialog med interne fagpersoner og markedsaktører. Indarbejdelse af grønne krav i udbud og tilbudsindhentninger ud fra målsætninger i Partnerskab for Offentlige Grønne Indkøb – herunder vurdering af, hvordan der opnås mest bæredygtighed for pengene. Bistå til den fortsatte udvikling i Udbud og Indkøb, herunder sparring, vidensdeling og optimering af processer. Samarbejde med vores kollegaer i KomUdbud, eksterne leverandører og samarbejdspartnere. Udarbejdelse af beslutningsoplæg til direktionen og det politiske niveau. Om dig Da der i stillingen vil være en stor berøringsflade med mange forskellige fagligheder samt eksterne samarbejdspartnere, vil det være en fordel, at du har et naturlig flair for at skabe gode rammer omkring samarbejdet. Du skal også have gode kommunikationsevner, da det er vigtigt at kunne formidle og indgå i konstruktiv dialog med fagafdelingerne og dermed skabe forståelsen af et fælles ansvar omkring de indgåede kontrakter. Du er selvledende og helhedsorienteret, ansvarlig og kvalitetsbevidst i din opgaveløsning og evner at dele ud af din viden og udvise fællesskabsånd i de opgaver, du udfører. Der kan være flere indgange til at kunne varetage stillingen, f.eks. kunne du have en juridisk baggrund, en it eller projektlederuddannelse kombineret med 5+ års erfaring. Det vigtigste er, at du har stor erfaring med projektledelse, gerne af IT indkøb. Det er en fordel, hvis du har godt kendskab til offentligt indkøb, og har evnen til at fordybe dig i et kompleks område, har mod på at tage de konflikter der kommer, og har evner til at samarbejde frem mod en god opfyldelse af opgaverne. Løn- og ansættelsesvilkår Ansættelse sker efter gældende overenskomst og efter principperne om lokal løndannelse med mulighed for forhandling af tillæg. For den rigtige profil, vil der kunne være tale om en stilling som specialkonsulent. Stillingen er på 37 timer ugentlig med forventet  tiltrædelse 1. april 2025  eller  1. maj 2025 .  Ved ansættelsessamtalen skal der forevises  straffeattest .  Yderligere oplysninger Fås på kommunens hjemmeside  www.nyborg.dk  eller du kan kontakte leder af Udbud og Indkøb Sandy Lützen på tlf.: 6333 7788 eller  sall@nyborg.dk   Ansøgning med bilag skal indsendes  senest 10. februar 2025 .  Ansættelsessamtaler forventes afholdt 19. februar 2025. Nyborg Kommune har indført røgfri arbejdstid. Politikken gælder alle ansatte og betyder, at det ikke er muligt at ryge i arbejdstiden. Rygepolitikken skal sikre, at alle ansatte i Nyborg Kommune kan færdes i et røgfrit arbejdsmiljø. 
 Denne jobannonce blev oprindeligt opslået på  https://www.ofir.dk/ 
 (Den originale annonce kan ses på:  https://www.ofir.dk/showojob?ofirid=82b1f7ad )","https://www.google.dk/maps/place/Torvet+1,5800,+Nyborg/",29189722,False,False,,False
