summary_AutomatchType,summary_Abroad,summary_Weight,summary_Title,summary_JobHeadline,summary_Presentation,summary_HiringOrgName,summary_WorkPlaceAddress,summary_WorkPlacePostalCode,summary_WorkPlaceCity,summary_WorkPlaceOtherAddress,summary_WorkPlaceAbroad,summary_WorkPlaceNotStatic,summary_UseWorkPlaceAddressForJoblog,summary_PostingCreated,summary_LastDateApplication,summary_FormattedLastDateApplication,summary_AssignmentStartDate,summary_IsHotjob,summary_IsExternal,summary_Url,summary_Region,summary_Municipality,summary_Country,summary_PostalCode,summary_PostalCodeName,summary_JobAnnouncementType,summary_EmploymentType,summary_WorkHours,summary_OccupationArea,summary_OccupationGroup,summary_Occupation,summary_Location_Latitude,summary_Location_Longitude,summary_JoblogWorkTime_WorkHour,summary_JoblogWorkTime_DailyWorkTime,summary_WorkplaceID,summary_OrganisationId,summary_HiringOrgCVR,summary_UserLoggedIn,summary_AnonymousEmployer,summary_ShareUrl,summary_DetailsUrl,summary_JobLogUrl,summary_HasLocationValues,summary_ID,summary_Latitude,summary_Longitude,details_WorkSchedule,details_WorkConditions,details_EmploymentTypes,details_WorkPlace_Name,details_WorkPlace_Address_AddressLine,details_WorkPlace_Address_Country_Id,details_WorkPlace_Address_Country_Name,details_WorkPlace_Address_Municipality_Id,details_WorkPlace_Address_Municipality_Name,details_WorkPlace_Address_Region_Id,details_WorkPlace_Address_Region_Name,details_WorkPlace_Address_PostalCode,details_WorkPlace_Address_City,details_WorkPlace_PhoneNumber_Number,details_WorkPlace_PhoneNumber_Type,details_WorkPlace_PhoneNumber_Description,details_WorkPlace_FaxNumber,details_WorkPlace_Email,details_WorkPlace_WebAddress,details_WorkPlace_Description,details_WorkPlace_Logo,details_WorkPlace_WorkPlaceOrganizationNumber,details_WorkPlace_OrganizationNumber,details_WorkPlace_OrganizationDescription,details_JobPositionPosting_Id,details_JobPositionPosting_HiringOrg_Name,details_JobPositionPosting_HiringOrg_Address_AddressLine,details_JobPositionPosting_HiringOrg_Address_Country_Id,details_JobPositionPosting_HiringOrg_Address_Country_Name,details_JobPositionPosting_HiringOrg_Address_Municipality_Id,details_JobPositionPosting_HiringOrg_Address_Municipality_Name,details_JobPositionPosting_HiringOrg_Address_Region_Id,details_JobPositionPosting_HiringOrg_Address_Region_Name,details_JobPositionPosting_HiringOrg_Address_PostalCode,details_JobPositionPosting_HiringOrg_Address_City,details_JobPositionPosting_HiringOrg_PhoneNumber_Number,details_JobPositionPosting_HiringOrg_PhoneNumber_Type,details_JobPositionPosting_HiringOrg_PhoneNumber_Description,details_JobPositionPosting_HiringOrg_FaxNumber,details_JobPositionPosting_HiringOrg_Email,details_JobPositionPosting_HiringOrg_WebAddress,details_JobPositionPosting_HiringOrg_Description,details_JobPositionPosting_HiringOrg_Logo,details_JobPositionPosting_HiringOrg_WorkPlaceOrganizationNumber,details_JobPositionPosting_HiringOrg_OrganizationNumber,details_JobPositionPosting_HiringOrg_OrganizationDescription,details_JobPositionPosting_RecruitingCompany,details_JobPositionPosting_PublicationStartDate,details_JobPositionPosting_PublicationEndDate,details_JobPositionPosting_JobPositionInformation_PositionTitle,details_JobPositionPosting_JobPositionInformation_Purpose,details_JobPositionPosting_JobPositionInformation_WorkLocation_AddressLine,details_JobPositionPosting_JobPositionInformation_WorkLocation_Country_Id,details_JobPositionPosting_JobPositionInformation_WorkLocation_Country_Name,details_JobPositionPosting_JobPositionInformation_WorkLocation_Municipality_Id,details_JobPositionPosting_JobPositionInformation_WorkLocation_Municipality_Name,details_JobPositionPosting_JobPositionInformation_WorkLocation_Region_Id,details_JobPositionPosting_JobPositionInformation_WorkLocation_Region_Name,details_JobPositionPosting_JobPositionInformation_WorkLocation_PostalCode,details_JobPositionPosting_JobPositionInformation_WorkLocation_City,details_JobPositionPosting_JobPositionInformation_EmploymentType,details_JobPositionPosting_JobPositionInformation_WeeklyWorkHours_TypeId,details_JobPositionPosting_JobPositionInformation_WeeklyWorkHours_TypeName,details_JobPositionPosting_JobPositionInformation_WeeklyWorkHours_Description,details_JobPositionPosting_JobPositionInformation_CompensationDescription,details_JobPositionPosting_JobPositionInformation_NumberToFill,details_JobPositionPosting_JobPositionInformation_DriverLicense,details_JobPositionPosting_JobPositionInformation_Occupation_Name,details_JobPositionPosting_JobPositionInformation_Occupation_DiscoWeb,details_JobPositionPosting_JobPositionInformation_Occupation_AlternateNames,details_JobPositionPosting_JobPositionInformation_Occupation_GroupId,details_JobPositionPosting_JobPositionInformation_Occupation_AreaId,details_JobPositionPosting_JobPositionInformation_IsGovernmentHiring,details_JobPositionPosting_JobPositionInformation_JppContacts,details_JobPositionPosting_JobPositionInformation_EmploymentDate,details_JobPositionPosting_IsRecruitmentOfForeignNationals,details_JobPositionPosting_IsWorkInDenmark,details_JobPositionPosting_IsAnonymousEmployer,details_JobPositionPosting_IsDisabilityFriendly,details_JobPositionPosting_JppType,details_JobPositionPosting_ApplicationDetails_WorkHourMax,details_JobPositionPosting_ApplicationDetails_WorkHourMin,details_JobPositionPosting_ApplicationDetails_DailyWorkTimeWeekend,details_JobPositionPosting_ApplicationDetails_DailyWorkTimeNight,details_JobPositionPosting_ApplicationDetails_DailyWorkTimeEvening,details_JobPositionPosting_ApplicationDetails_DailyWorkTimeDay,details_JobPositionPosting_ApplicationDetails_DailyWorkTimeMorning,details_JobPositionPosting_ApplicationDetails_DailyWorkTimeVarious,details_JobPositionPosting_ApplicationDetails_ReferenceText,details_JobPositionPosting_ApplicationDetails_RemarksToApplicant,details_JobPositionPosting_ApplicationDetails_ByEmail,details_JobPositionPosting_ApplicationDetails_ByPhone,details_JobPositionPosting_ApplicationDetails_ApplyViaUrl,details_JobPositionPosting_ApplicationDetails_ReplyInWriting,details_JobPositionPosting_ApplicationDetails_ApplicationDeadlineDate,details_JobPositionPosting_Status,details_LogoUrl,details_Address,details_ShowMap,details_ShowShareButtonJobLog,details_JobLogUrl,details_JobLogTemplateModel_Identifier,details_JobLogTemplateModel_UseWorkPlaceAddressForJoblog,details_JobLogTemplateModel_Category,details_JobLogTemplateModel_CvCustomerIdentifier,details_JobLogTemplateModel_JobSeekingStatus,details_JobLogTemplateModel_Title,details_JobLogTemplateModel_IsApplicationSourceRequired,details_JobLogTemplateModel_ApplicationSource,details_JobLogTemplateModel_IsWeeklyWorkTimeRequired,details_JobLogTemplateModel_WeeklyWorkTime,details_JobLogTemplateModel_HoursPerWeek,details_JobLogTemplateModel_JobnetJobPostingIdentifier,details_JobLogTemplateModel_JobAdDocument_Title,details_JobLogTemplateModel_JobAdDocument_Identifier,details_JobLogTemplateModel_JobAdDocument_IsDeletedBySystem,details_JobLogTemplateModel_JobAdDocument_IsDeletedByUser,details_JobLogTemplateModel_JobAdFile,details_JobLogTemplateModel_Company_JobLogEntryCategory,details_JobLogTemplateModel_Company_ShowAddressFieldsEvenIfEmpty,details_JobLogTemplateModel_Company_Name,details_JobLogTemplateModel_Company_Address,details_JobLogTemplateModel_Company_Country,details_JobLogTemplateModel_Company_EmploymentAreaID,details_JobLogTemplateModel_Company_PostCode,details_JobLogTemplateModel_Company_IsCountryAndTownAndPostCodeEmpty,details_JobLogTemplateModel_Company_IsTownAndPostCodeEmpty,details_JobLogTemplateModel_Company_IsCountryDanmark,details_JobLogTemplateModel_Company_Town,details_JobLogTemplateModel_Company_ContactPerson,details_JobLogTemplateModel_Company_Phone,details_JobLogTemplateModel_Company_Email,details_JobLogTemplateModel_Company_Latitude,details_JobLogTemplateModel_Company_Longitude,details_JobLogTemplateModel_Company_DailyTravelTimeInMinutes,details_JobLogTemplateModel_Company_DistanceToCompanyInMeters,details_JobLogTemplateModel_Company_IsCreateMode,details_JobLogTemplateModel_TypeOfSubmission,details_JobLogTemplateModel_SubmissionDate,details_JobLogTemplateModel_SubmissionDateFormatted,details_JobLogTemplateModel_SubmissionDateTiks,details_JobLogTemplateModel_IsSubmissionDateRequired,details_JobLogTemplateModel_Status,details_JobLogTemplateModel_DateCreatedFormatted,details_JobLogTemplateModel_DateCreated,details_JobLogTemplateModel_DateModifiedFormatted,details_JobLogTemplateModel_DateModified,details_JobLogTemplateModel_LastModifiedDateTiks,details_JobLogTemplateModel_DateClosed,details_JobLogTemplateModel_JobApplicationDocument_Title,details_JobLogTemplateModel_JobApplicationDocument_Identifier,details_JobLogTemplateModel_JobApplicationDocument_IsDeletedBySystem,details_JobLogTemplateModel_JobApplicationDocument_IsDeletedByUser,details_JobLogTemplateModel_CvDocument_Title,details_JobLogTemplateModel_CvDocument_Identifier,details_JobLogTemplateModel_CvDocument_IsDeletedBySystem,details_JobLogTemplateModel_CvDocument_IsDeletedByUser,details_JobLogTemplateModel_JobApplicationFile,details_JobLogTemplateModel_CvFile,details_JobLogTemplateModel_SubmissionDeadlineDate,details_JobLogTemplateModel_IsPersisted,details_JobLogTemplateModel_ServerValidationErrors,details_JobLogTemplateModel_HasServerValidationErrors,details_JoblogWorkTime_WorkHour,details_JoblogWorkTime_DailyWorkTime,details_Place,details_OpenPrintDialog,details_WorkPlaceInfoText,details_JobCenterContactDetails,details_WorkPlaceDescriptionText,details_FavoriteText,details_IsFavorite,details_ShowFavorite,details_MetaOgTextForSharing,details_DescriptionForSharing,details_TitleForSharing,details_RutePlan,details_FormattedPurpose,details_MapUrl,details_OrganizationNumber,details_ShowSearchJobButton,details_ShowPrint,details_BackToFindWorkButtonUrl,isExternal
0,False,1,2 medarbejdere til det psykosociale område,2 medarbejdere til det psykosociale område,"Om jobbet

Har du lyst til at arbejde i en spændende organisation med masser af faglig udvikling – så har vi måske jobbet til dig. Overordnet omfatter arbejdet socialpædagog",Rudersdal Kommune,Dronninggårds Alle 24-26  ,2840,Holte,False,False,False,True,2025-01-29T14:43:59,2025-02-19T23:59:00,19. februar 2025,0001-01-01T00:00:00,False,False,https://job.jobnet.dk/CV/FindWork/Details/780318e2-62d0-4953-b02e-b82982edcbb1,Hovedstaden og Bornholm,Rudersdal,Danmark,2840,,Almindelige vilkår,Fastansættelse,Fuldtid,"Pædagogisk, socialt og kirkeligt arbejde",Pædagogisk arbejde,Socialpædagog,55.8168,12.4864,,,1016394005,,29188378,False,False,https://job.jobnet.dk/CV/FindWork/DetailsSocialmedia/780318e2-62d0-4953-b02e-b82982edcbb1,https://job.jobnet.dk/CV/FindWork/Details/780318e2-62d0-4953-b02e-b82982edcbb1,https://job.jobnet.dk/CV/FindWork/Details/780318e2-62d0-4953-b02e-b82982edcbb1,True,780318e2-62d0-4953-b02e-b82982edcbb1,55.8168,12.4864,"{'Id': 1, 'Name': 'Fuldtid'}, {'Id': 16, 'Name': 'Deltid'}","{'Id': 1, 'Name': 'Almindelige vilkår'}, {'Id': 2, 'Name': 'Fleksjob'}, {'Id': 3, 'Name': 'Skånejob'}, {'Id': 4, 'Name': 'Egnet til efterlønnere og seniorer'}, {'Id': 5, 'Name': 'Job med løntilskud'}, {'Id': 6, 'Name': 'Rotationsjob'}, {'Id': 7, 'Name': 'Virksomhedspraktik'}","{'Id': 1, 'Name': 'Fastansættelse'}, {'Id': 16, 'Name': 'Tidsbegrænset ansættelse'}",Rudersdal Kommune,Dronninggårds Alle 24-26,58,Danmark,230,Rudersdal,4,"Hovedstaden, Sjælland og Bornholm",2840,Holte,,0,Primary,,,https://rudersdal.hr-on.com/show-job/237019?linkref=266677&locale=da_DK,None,,1016394005,29188378,None,780318e2-62d0-4953-b02e-b82982edcbb1,Rudersdal Kommune,Dronninggårds Alle 24-26,58,Danmark,230,Rudersdal,4,"Hovedstaden, Sjælland og Bornholm",2840,Holte,,0,Primary,,,https://rudersdal.hr-on.com/show-job/237019?linkref=266677&locale=da_DK,None,,1016394005,29188378,None,,2025-01-29T14:43:59+01:00,2025-02-19T23:59:00+01:00,2 medarbejdere til det psykosociale område,"Om jobbet 
 Har du lyst til at arbejde i en spændende organisation med masser af faglig udvikling – så har vi måske jobbet til dig. Overordnet omfatter arbejdet socialpædagogisk støtte i samarbejde med borgere med psykosociale vanskeligheder. Borgerne har en høj grad af indflydelse på hvem de primært samarbejder med af de ansatte og hvordan. 
 Ved Boligerne på Dronninggårds Allé arbejder vi i tværfaglige teams/cirkler. Den støtte, som tilbydes i boligerne, er recoveryorienteret psykosocial rehabilitering. 
 Vi arbejder med at skabe muligheder for udvikling af borgerens personlige og sociale kompetencer. Vi støtter borgerne i at finde motivation for forandringer og tro på at kunne finde egne ressourcer og se mulighederne for at skabe sig et selvstændigt og meningsfuldt liv. Borgerne har forskellige psykosociale vanskeligheder, som eksempelvis kan omfatte stemmehøring, angst, depression, skizofreni m.v. 
   
 Din profil 
 Du skal have en social- eller sundhedsfaglig grunduddannelse fx socialpædagog, socialrådgiver, ergoterapeut, fysioterapeut, psykolog, social- og sundhedsassistent/sygeplejerske mv. Erfaring indenfor det psykosociale område vil være en fordel. Du har forståelse for psykiske vanskeligheders betydning for mennesker og evnen til at opbygge relationer. 
 Du er i besiddelse af personlig modenhed, ansvarsbevidsthed, psykisk robusthed, gåpåmod og humor og har et inkluderende og positivt livssyn. Du har gode kommunikationsevner både mundtligt og skriftligt. 
   
 Derfor skal du vælge os 
 Socialpædagogisk Center er en organisation, der er præget af høj faglighed, høj personaletrivsel og spændende udviklingstiltag. 
 Vi har en arbejdskultur som er præget af hjælpsomhed og fælles ansvar, hvor faglig udvikling, sparring og refleksion vægtes meget højt. Vi har ekstern supervision, ligesom vi jævnligt er på fagligt udviklende kurser. 
 Din hverdag bliver alsidig med mange personlige og faglige udfordringer. Du får engagerede og fagligt velfunderede kolleger, som har en uformel omgangstone og et godt og rummeligt arbejdsmiljø. 
 I Rudersdal Kommune tror vi på, at vi kun lykkes i fællesskab. Derfor er det vores mål, at alle kommunens medarbejdere og ledere i alle opgaver - og i fællesskab - arbejder for at skabe bæredygtige løsninger, der giver værdi for borgerne, virksomheden og det samfund, vi er en del af. Se vores film om Rudersdal Kommunes strategi og værdier ”Vi lykkes kun i fællesskab”  HER 
 Ansættelsesvilkår 
 Stillingerne er faste på 37 timer om ugen og med start den 1. april og 1. maj 2025. 
 Der er skiftende arbejdstider mellem kl. 7.15 og 23.15 og weekendarbejde hver 3. weekend. Arbejdet ved Boligerne på Dronninggårds Allé er fleksibelt tilrettelagt og du har derfor indflydelse på din arbejdstid. 
 Ansættelse ved Boligerne på Dronninggårds Allé 24-26 er betinget af tilfredsstillende straffeattest. Løn og ansættelsesforhold efter gældende overenskomst. 
 Om os 
 Boligerne Dronninggårds Allé 24-26 er en enhed under organisationen SocialpædagogiskCenter, som hører under Social indsats i Rudersdal Kommune.  
 Boligerne Dronninggårds Allé 24 - 26 i Holte er et moderne byggeri og tilbud med 16 tværfagligt ansatte medarbejdere og en leder. Der er i alt 29 boliger. Boligerne er til borgere over 18 år. De fleste er under 40 år. 
   
 Ansøgning, samtale og kontakt 
 Du søger jobbet ved at klikke på knappen ”Søg stillingen” nedenfor. 
 Samtaler forventes afholdt fredag d. 21. Februar 
 Ansættelse er betinget af tilfredsstillende straffeattest og løn og ansættelsesforhold er efter gældende overenskomst. 
 Såfremt du har spørgsmål, er du velkommen til at kontakte 
 Tina Bruun Olsen",Dronninggårds Alle 24-26,58,Danmark,230,Rudersdal,4,"Hovedstaden, Sjælland og Bornholm",2840,Holte,1,1,Fuldtid,None,None,2,,Socialpædagog,0,"Socialpædagog på bosted for voksne, Socialpædagog ved ungdomsinstitution",0,0,False,"{'Email': 'tbol@rudersdal.dk', 'PersonName': 'Tina Olsen', 'FirstName': 'Tina', 'LastName': 'Olsen', 'PositionTitle': None, 'PhoneNumbers': [{'Number': '72 68 37 37', 'Type': 0, 'Description': 'Primary'}]}",,False,False,False,False,4,,,False,False,False,False,False,False,,,,,https://rudersdal.hr-on.com/show-job/237019?linkref=266677&locale=da_DK,False,2025-02-19T23:59:00+01:00,7,/CV/FindWork/GetLogo?JobAdId=780318e2-62d0-4953-b02e-b82982edcbb1&Organisation=29188378,"Dronninggårds Alle 24-26,2840, Holte",True,False,/CV/Jobseeking/JobLog/CreateJobSearch?JobnetJobPostingIdentifier=780318e2-62d0-4953-b02e-b82982edcbb1&Company.Name=Rudersdal Kommune&SubmissionDeadlineDate=2025-2-19&Title=2 medarbejdere til det psykosociale område&WeeklyWorkTime=1,00000000-0000-0000-0000-000000000000,True,0,,,2 medarbejdere til det psykosociale område,True,,True,1,,780318e2-62d0-4953-b02e-b82982edcbb1,,,False,False,,0,False,Rudersdal Kommune,Dronninggårds Alle 24-26,,,2840,False,False,False,Holte,Tina Olsen,72 68 37 37,tbol@rudersdal.dk,,,,,False,,2025-02-19T23:59:00+01:00,,0,False,0,,,,,0,,,,False,False,,,False,False,,,,False,,False,,,Arbejdspladsen ligger i Rudersdal kommune,False,Rudersdal Kommune,,None,,False,False,"Om jobbet

Har du lyst til at arbejde i en spændende organisation med masser af faglig udvikling – så har vi måske jobbet til dig. Overordnet omfatter arbejdet socialpædagogisk støtte i samarbejde med borgere med psykosociale vanskeligheder. Borgerne har en høj grad af indflydelse på hvem de primært samarbejder med af de ansatte og hvordan.

Ved Bo","""Om jobbet\n\nHar du lyst til at arbejde i en spændende organisation med masser af faglig udvikling – så har vi måske jobbet til dig. Overordnet omfatter arbejdet socialpædagogisk støtte i samarbejde med borgere med psykosociale vanskeligheder. Borgerne har en høj grad af indflydelse på hvem de primært samarbejder med af de ansatte og hvordan.\n\nVed Bo""","""2 medarbejdere til det psykosociale område""","https://www.google.dk/maps/dir//Dronninggårds+Alle+24-26,2840,+Holte/","Om jobbet 
 Har du lyst til at arbejde i en spændende organisation med masser af faglig udvikling – så har vi måske jobbet til dig. Overordnet omfatter arbejdet socialpædagogisk støtte i samarbejde med borgere med psykosociale vanskeligheder. Borgerne har en høj grad af indflydelse på hvem de primært samarbejder med af de ansatte og hvordan. 
 Ved Boligerne på Dronninggårds Allé arbejder vi i tværfaglige teams/cirkler. Den støtte, som tilbydes i boligerne, er recoveryorienteret psykosocial rehabilitering. 
 Vi arbejder med at skabe muligheder for udvikling af borgerens personlige og sociale kompetencer. Vi støtter borgerne i at finde motivation for forandringer og tro på at kunne finde egne ressourcer og se mulighederne for at skabe sig et selvstændigt og meningsfuldt liv. Borgerne har forskellige psykosociale vanskeligheder, som eksempelvis kan omfatte stemmehøring, angst, depression, skizofreni m.v. 
   
 Din profil 
 Du skal have en social- eller sundhedsfaglig grunduddannelse fx socialpædagog, socialrådgiver, ergoterapeut, fysioterapeut, psykolog, social- og sundhedsassistent/sygeplejerske mv. Erfaring indenfor det psykosociale område vil være en fordel. Du har forståelse for psykiske vanskeligheders betydning for mennesker og evnen til at opbygge relationer. 
 Du er i besiddelse af personlig modenhed, ansvarsbevidsthed, psykisk robusthed, gåpåmod og humor og har et inkluderende og positivt livssyn. Du har gode kommunikationsevner både mundtligt og skriftligt. 
   
 Derfor skal du vælge os 
 Socialpædagogisk Center er en organisation, der er præget af høj faglighed, høj personaletrivsel og spændende udviklingstiltag. 
 Vi har en arbejdskultur som er præget af hjælpsomhed og fælles ansvar, hvor faglig udvikling, sparring og refleksion vægtes meget højt. Vi har ekstern supervision, ligesom vi jævnligt er på fagligt udviklende kurser. 
 Din hverdag bliver alsidig med mange personlige og faglige udfordringer. Du får engagerede og fagligt velfunderede kolleger, som har en uformel omgangstone og et godt og rummeligt arbejdsmiljø. 
 I Rudersdal Kommune tror vi på, at vi kun lykkes i fællesskab. Derfor er det vores mål, at alle kommunens medarbejdere og ledere i alle opgaver - og i fællesskab - arbejder for at skabe bæredygtige løsninger, der giver værdi for borgerne, virksomheden og det samfund, vi er en del af. Se vores film om Rudersdal Kommunes strategi og værdier ”Vi lykkes kun i fællesskab”  HER 
 Ansættelsesvilkår 
 Stillingerne er faste på 37 timer om ugen og med start den 1. april og 1. maj 2025. 
 Der er skiftende arbejdstider mellem kl. 7.15 og 23.15 og weekendarbejde hver 3. weekend. Arbejdet ved Boligerne på Dronninggårds Allé er fleksibelt tilrettelagt og du har derfor indflydelse på din arbejdstid. 
 Ansættelse ved Boligerne på Dronninggårds Allé 24-26 er betinget af tilfredsstillende straffeattest. Løn og ansættelsesforhold efter gældende overenskomst. 
 Om os 
 Boligerne Dronninggårds Allé 24-26 er en enhed under organisationen SocialpædagogiskCenter, som hører under Social indsats i Rudersdal Kommune.  
 Boligerne Dronninggårds Allé 24 - 26 i Holte er et moderne byggeri og tilbud med 16 tværfagligt ansatte medarbejdere og en leder. Der er i alt 29 boliger. Boligerne er til borgere over 18 år. De fleste er under 40 år. 
   
 Ansøgning, samtale og kontakt 
 Du søger jobbet ved at klikke på knappen ”Søg stillingen” nedenfor. 
 Samtaler forventes afholdt fredag d. 21. Februar 
 Ansættelse er betinget af tilfredsstillende straffeattest og løn og ansættelsesforhold er efter gældende overenskomst. 
 Såfremt du har spørgsmål, er du velkommen til at kontakte 
 Tina Bruun Olsen","https://www.google.dk/maps/place/Dronninggårds+Alle+24-26,2840,+Holte/",29188378,False,False,,False
