summary_AutomatchType,summary_Abroad,summary_Weight,summary_Title,summary_JobHeadline,summary_Presentation,summary_HiringOrgName,summary_WorkPlaceAddress,summary_WorkPlacePostalCode,summary_WorkPlaceCity,summary_WorkPlaceOtherAddress,summary_WorkPlaceAbroad,summary_WorkPlaceNotStatic,summary_UseWorkPlaceAddressForJoblog,summary_PostingCreated,summary_LastDateApplication,summary_FormattedLastDateApplication,summary_AssignmentStartDate,summary_IsHotjob,summary_IsExternal,summary_Url,summary_Region,summary_Municipality,summary_Country,summary_PostalCode,summary_PostalCodeName,summary_JobAnnouncementType,summary_EmploymentType,summary_WorkHours,summary_OccupationArea,summary_OccupationGroup,summary_Occupation,summary_Location_Latitude,summary_Location_Longitude,summary_JoblogWorkTime_WorkHour,summary_JoblogWorkTime_DailyWorkTime,summary_WorkplaceID,summary_OrganisationId,summary_HiringOrgCVR,summary_UserLoggedIn,summary_AnonymousEmployer,summary_ShareUrl,summary_DetailsUrl,summary_JobLogUrl,summary_HasLocationValues,summary_ID,summary_Latitude,summary_Longitude,details_WorkSchedule,details_WorkConditions,details_EmploymentTypes,details_WorkPlace_Name,details_WorkPlace_Address_AddressLine,details_WorkPlace_Address_Country_Id,details_WorkPlace_Address_Country_Name,details_WorkPlace_Address_Municipality_Id,details_WorkPlace_Address_Municipality_Name,details_WorkPlace_Address_Region_Id,details_WorkPlace_Address_Region_Name,details_WorkPlace_Address_PostalCode,details_WorkPlace_Address_City,details_WorkPlace_PhoneNumber_Number,details_WorkPlace_PhoneNumber_Type,details_WorkPlace_PhoneNumber_Description,details_WorkPlace_FaxNumber,details_WorkPlace_Email,details_WorkPlace_WebAddress,details_WorkPlace_Description,details_WorkPlace_Logo,details_WorkPlace_WorkPlaceOrganizationNumber,details_WorkPlace_OrganizationNumber,details_WorkPlace_OrganizationDescription,details_JobPositionPosting_Id,details_JobPositionPosting_HiringOrg_Name,details_JobPositionPosting_HiringOrg_Address_AddressLine,details_JobPositionPosting_HiringOrg_Address_Country_Id,details_JobPositionPosting_HiringOrg_Address_Country_Name,details_JobPositionPosting_HiringOrg_Address_Municipality_Id,details_JobPositionPosting_HiringOrg_Address_Municipality_Name,details_JobPositionPosting_HiringOrg_Address_Region_Id,details_JobPositionPosting_HiringOrg_Address_Region_Name,details_JobPositionPosting_HiringOrg_Address_PostalCode,details_JobPositionPosting_HiringOrg_Address_City,details_JobPositionPosting_HiringOrg_PhoneNumber_Number,details_JobPositionPosting_HiringOrg_PhoneNumber_Type,details_JobPositionPosting_HiringOrg_PhoneNumber_Description,details_JobPositionPosting_HiringOrg_FaxNumber,details_JobPositionPosting_HiringOrg_Email,details_JobPositionPosting_HiringOrg_WebAddress,details_JobPositionPosting_HiringOrg_Description,details_JobPositionPosting_HiringOrg_Logo,details_JobPositionPosting_HiringOrg_WorkPlaceOrganizationNumber,details_JobPositionPosting_HiringOrg_OrganizationNumber,details_JobPositionPosting_HiringOrg_OrganizationDescription,details_JobPositionPosting_RecruitingCompany,details_JobPositionPosting_PublicationStartDate,details_JobPositionPosting_PublicationEndDate,details_JobPositionPosting_JobPositionInformation_PositionTitle,details_JobPositionPosting_JobPositionInformation_Purpose,details_JobPositionPosting_JobPositionInformation_WorkLocation_AddressLine,details_JobPositionPosting_JobPositionInformation_WorkLocation_Country_Id,details_JobPositionPosting_JobPositionInformation_WorkLocation_Country_Name,details_JobPositionPosting_JobPositionInformation_WorkLocation_Municipality_Id,details_JobPositionPosting_JobPositionInformation_WorkLocation_Municipality_Name,details_JobPositionPosting_JobPositionInformation_WorkLocation_Region_Id,details_JobPositionPosting_JobPositionInformation_WorkLocation_Region_Name,details_JobPositionPosting_JobPositionInformation_WorkLocation_PostalCode,details_JobPositionPosting_JobPositionInformation_WorkLocation_City,details_JobPositionPosting_JobPositionInformation_EmploymentType,details_JobPositionPosting_JobPositionInformation_WeeklyWorkHours_TypeId,details_JobPositionPosting_JobPositionInformation_WeeklyWorkHours_TypeName,details_JobPositionPosting_JobPositionInformation_WeeklyWorkHours_Description,details_JobPositionPosting_JobPositionInformation_CompensationDescription,details_JobPositionPosting_JobPositionInformation_NumberToFill,details_JobPositionPosting_JobPositionInformation_DriverLicense,details_JobPositionPosting_JobPositionInformation_Occupation_Name,details_JobPositionPosting_JobPositionInformation_Occupation_DiscoWeb,details_JobPositionPosting_JobPositionInformation_Occupation_AlternateNames,details_JobPositionPosting_JobPositionInformation_Occupation_GroupId,details_JobPositionPosting_JobPositionInformation_Occupation_AreaId,details_JobPositionPosting_JobPositionInformation_IsGovernmentHiring,details_JobPositionPosting_JobPositionInformation_JppContacts,details_JobPositionPosting_JobPositionInformation_EmploymentDate,details_JobPositionPosting_IsRecruitmentOfForeignNationals,details_JobPositionPosting_IsWorkInDenmark,details_JobPositionPosting_IsAnonymousEmployer,details_JobPositionPosting_IsDisabilityFriendly,details_JobPositionPosting_JppType,details_JobPositionPosting_ApplicationDetails_WorkHourMax,details_JobPositionPosting_ApplicationDetails_WorkHourMin,details_JobPositionPosting_ApplicationDetails_DailyWorkTimeWeekend,details_JobPositionPosting_ApplicationDetails_DailyWorkTimeNight,details_JobPositionPosting_ApplicationDetails_DailyWorkTimeEvening,details_JobPositionPosting_ApplicationDetails_DailyWorkTimeDay,details_JobPositionPosting_ApplicationDetails_DailyWorkTimeMorning,details_JobPositionPosting_ApplicationDetails_DailyWorkTimeVarious,details_JobPositionPosting_ApplicationDetails_ReferenceText,details_JobPositionPosting_ApplicationDetails_RemarksToApplicant,details_JobPositionPosting_ApplicationDetails_ByEmail,details_JobPositionPosting_ApplicationDetails_ByPhone,details_JobPositionPosting_ApplicationDetails_ApplyViaUrl,details_JobPositionPosting_ApplicationDetails_ReplyInWriting,details_JobPositionPosting_ApplicationDetails_ApplicationDeadlineDate,details_JobPositionPosting_Status,details_LogoUrl,details_Address,details_ShowMap,details_ShowShareButtonJobLog,details_JobLogUrl,details_JobLogTemplateModel_Identifier,details_JobLogTemplateModel_UseWorkPlaceAddressForJoblog,details_JobLogTemplateModel_Category,details_JobLogTemplateModel_CvCustomerIdentifier,details_JobLogTemplateModel_JobSeekingStatus,details_JobLogTemplateModel_Title,details_JobLogTemplateModel_IsApplicationSourceRequired,details_JobLogTemplateModel_ApplicationSource,details_JobLogTemplateModel_IsWeeklyWorkTimeRequired,details_JobLogTemplateModel_WeeklyWorkTime,details_JobLogTemplateModel_HoursPerWeek,details_JobLogTemplateModel_JobnetJobPostingIdentifier,details_JobLogTemplateModel_JobAdDocument_Title,details_JobLogTemplateModel_JobAdDocument_Identifier,details_JobLogTemplateModel_JobAdDocument_IsDeletedBySystem,details_JobLogTemplateModel_JobAdDocument_IsDeletedByUser,details_JobLogTemplateModel_JobAdFile,details_JobLogTemplateModel_Company_JobLogEntryCategory,details_JobLogTemplateModel_Company_ShowAddressFieldsEvenIfEmpty,details_JobLogTemplateModel_Company_Name,details_JobLogTemplateModel_Company_Address,details_JobLogTemplateModel_Company_Country,details_JobLogTemplateModel_Company_EmploymentAreaID,details_JobLogTemplateModel_Company_PostCode,details_JobLogTemplateModel_Company_IsCountryAndTownAndPostCodeEmpty,details_JobLogTemplateModel_Company_IsTownAndPostCodeEmpty,details_JobLogTemplateModel_Company_IsCountryDanmark,details_JobLogTemplateModel_Company_Town,details_JobLogTemplateModel_Company_ContactPerson,details_JobLogTemplateModel_Company_Phone,details_JobLogTemplateModel_Company_Email,details_JobLogTemplateModel_Company_Latitude,details_JobLogTemplateModel_Company_Longitude,details_JobLogTemplateModel_Company_DailyTravelTimeInMinutes,details_JobLogTemplateModel_Company_DistanceToCompanyInMeters,details_JobLogTemplateModel_Company_IsCreateMode,details_JobLogTemplateModel_TypeOfSubmission,details_JobLogTemplateModel_SubmissionDate,details_JobLogTemplateModel_SubmissionDateFormatted,details_JobLogTemplateModel_SubmissionDateTiks,details_JobLogTemplateModel_IsSubmissionDateRequired,details_JobLogTemplateModel_Status,details_JobLogTemplateModel_DateCreatedFormatted,details_JobLogTemplateModel_DateCreated,details_JobLogTemplateModel_DateModifiedFormatted,details_JobLogTemplateModel_DateModified,details_JobLogTemplateModel_LastModifiedDateTiks,details_JobLogTemplateModel_DateClosed,details_JobLogTemplateModel_JobApplicationDocument_Title,details_JobLogTemplateModel_JobApplicationDocument_Identifier,details_JobLogTemplateModel_JobApplicationDocument_IsDeletedBySystem,details_JobLogTemplateModel_JobApplicationDocument_IsDeletedByUser,details_JobLogTemplateModel_CvDocument_Title,details_JobLogTemplateModel_CvDocument_Identifier,details_JobLogTemplateModel_CvDocument_IsDeletedBySystem,details_JobLogTemplateModel_CvDocument_IsDeletedByUser,details_JobLogTemplateModel_JobApplicationFile,details_JobLogTemplateModel_CvFile,details_JobLogTemplateModel_SubmissionDeadlineDate,details_JobLogTemplateModel_IsPersisted,details_JobLogTemplateModel_ServerValidationErrors,details_JobLogTemplateModel_HasServerValidationErrors,details_JoblogWorkTime_WorkHour,details_JoblogWorkTime_DailyWorkTime,details_Place,details_OpenPrintDialog,details_WorkPlaceInfoText,details_JobCenterContactDetails,details_WorkPlaceDescriptionText,details_FavoriteText,details_IsFavorite,details_ShowFavorite,details_MetaOgTextForSharing,details_DescriptionForSharing,details_TitleForSharing,details_RutePlan,details_FormattedPurpose,details_MapUrl,details_OrganizationNumber,details_ShowSearchJobButton,details_ShowPrint,details_BackToFindWorkButtonUrl,isExternal
0,False,1,Fordi de første 1000 dage er noget særligt i et barns liv,Fordi de første 1000 dage er noget særligt i et barns liv,"Vi søger dig, som er uddannet pædagog og som ligesom os andre insisterer på,&nbsp;at naturen skal være en del af børnenes dagligdag - også når det regner.",Hvidovre Kommune - Børnehuset Vildmarken,Byvej 248A  ,2650,Hvidovre,False,False,False,True,2025-01-23T09:24:00,2025-02-16T00:00:00,16. februar 2025,0001-01-01T00:00:00,False,False,https://job.jobnet.dk/CV/FindWork/Details/964871cc-a003-4ac1-812e-058cb5dc992a,Hovedstaden og Bornholm,Hvidovre,Danmark,2650,,Almindelige vilkår,Fastansættelse,Fuldtid,"Pædagogisk, socialt og kirkeligt arbejde",Pædagogisk arbejde,Pædagog,55.5894,12.461,,,1003267810,,55606617,False,False,https://job.jobnet.dk/CV/FindWork/DetailsSocialmedia/964871cc-a003-4ac1-812e-058cb5dc992a,https://job.jobnet.dk/CV/FindWork/Details/964871cc-a003-4ac1-812e-058cb5dc992a,https://job.jobnet.dk/CV/FindWork/Details/964871cc-a003-4ac1-812e-058cb5dc992a,True,964871cc-a003-4ac1-812e-058cb5dc992a,55.5894,12.461,"{'Id': 1, 'Name': 'Fuldtid'}, {'Id': 16, 'Name': 'Deltid'}","{'Id': 1, 'Name': 'Almindelige vilkår'}, {'Id': 2, 'Name': 'Fleksjob'}, {'Id': 3, 'Name': 'Skånejob'}, {'Id': 4, 'Name': 'Egnet til efterlønnere og seniorer'}, {'Id': 5, 'Name': 'Job med løntilskud'}, {'Id': 6, 'Name': 'Rotationsjob'}, {'Id': 7, 'Name': 'Virksomhedspraktik'}","{'Id': 1, 'Name': 'Fastansættelse'}, {'Id': 16, 'Name': 'Tidsbegrænset ansættelse'}",Hvidovre Kommune - Børnehuset Vildmarken,Byvej 248A,58,Danmark,167,Hvidovre,4,"Hovedstaden, Sjælland og Bornholm",2650,Hvidovre,,0,Primary,,,https://www.ofir.dk/resultat/Jobannonce.aspx?ofirId=abfe9407&action=sendApplicationUrl&utm_source=job.jobnet.dk&utm_medium=referral,None,,1003267810,55606617,None,964871cc-a003-4ac1-812e-058cb5dc992a,Hvidovre Kommune - Børnehuset Vildmarken,Byvej 248A,58,Danmark,167,Hvidovre,4,"Hovedstaden, Sjælland og Bornholm",2650,Hvidovre,,0,Primary,,,https://www.ofir.dk/resultat/Jobannonce.aspx?ofirId=abfe9407&action=sendApplicationUrl&utm_source=job.jobnet.dk&utm_medium=referral,None,,1003267810,55606617,None,,2025-01-23T09:24:00+01:00,2025-02-16T23:59:00+01:00,Fordi de første 1000 dage er noget særligt i et barns liv,"Vi søger dig, som er uddannet pædagog og som ligesom os andre insisterer på,  at naturen skal være en del af børnenes dagligdag - også når det regner.   Vildmarken er en hyggelig integreret institution fordelt på tre selvstændige huse, med fire stuer i hvert hus. Uanset om det er med store motoriske udfoldelser, om det er til nærværet omkring dialogisk læsning eller noget helt tredje. Vores store legeplads går hele vejen rundt om institutionen og emmer af alverdens muligheder for leg og læring. I legehusenes lille bydel serveres sandkager og mudderkaffe, under træstubbene findes der kryb, på bakker og i træer afprøves musklerne, i gyngerne får man et sus i maven - især når den voksne hjælper med at skubbe. I køkkenhaverne får både børn og voksne jord under neglene, når der plantes, ordnes og høstes, og sanserne kommer i spil, når bålet tændes i vores bålhus.   Vi brænder for udelivet og derfor har vi siden marts 2023 været en del af Grønne Spirer, som er en grøn mærkningsordning gennem Friluftsrådet.   Vi lægger stor vægt på trivsel og arbejdsglæde, hvilket vi ser både i dagligdagens små øjeblikke, såsom små grin, fællesoplevelser, at hjælpe hinanden og at alle siger godmorgen til alle, samt i det store hele hvor vi prioriterer dialog, medbestemmelse blandt alle parter, teammøder, faglige aftener og sociale arrangementer. Vi forventer derfor, at du som vores kollega mødes med os både i professionelt øjemed, men også i et mere festligt kollegialt lag 3-4 gange om året. Som personalet siger:   ""Her er plads til medbestemmelse og man er med til at sætte et præg på dagligdagen.""   ""Fedt, at vi har fællesarrangementer i hele huset både for børn og personale. Man kan godt mærke, at vi er et lille hus og alle er tætte på hinanden og nemt kan hjælpe på kryds og tværs, fordi alle kender alle.""   Ud over grønne spirer så er vores mål også at blive en Marte Meo institution. Dette for både at skabe et fælles pædagogisk fodfæste i personalegruppen og for at sikre børnene det optimale institutionsliv. Hertil skal siges, at alle børn er forskellige, pædagogikken er i konstant udvikling og at vi derfor altid kan blive bedre. Derfor har vi brug for dig til at være med til at udvikle vores pædagogiske praksis og til at være nysgerrig sammen med os.   Ligeledes afholder ledelsen MUS- og trivselssamtaler, samt deltager i alle børnesager og i løbende møder for at være tæt på personalet og den pædagogiske praksis.   For at give plads til alt det ovenstående er vores hverdag bygget op på en struktur af fast mødeskema og forberedelsestiden er indlagt i medarbejdernes skema og er tid væk fra børnene og stuen, hvor du som pædagog kan fordybe og forberede dig fagligt til f.eks. morgendagens aktivitet, næste måneds nyhedsbrev eller et ekstra stuemøde.   Er du nysgerrig på mere, så kontakt leder Jonas Bjørch på tlf. 25449240. Vi vil også meget gerne give dig en rundvisning, så du kan mærke efter, om vi er det rigtige match for dig.   Vi glæder os til at høre fra dig.     I Hvidovre Kommune bygger vores samarbejde på en anerkendende og positiv kultur, hvor forskellighed er en styrke, og hvor engagement, nysgerrighed og arbejdsglæde fremmer de nye idéer og den gode service til borgere, virksomheder, kulturliv og samarbejdspartnere.   Hvidovre er en grøn forstad med en stærk historie; tæt ved vandet og hovedstaden og lige midt i Øresundsregionen.   Hvidovre Kommune ser mangfoldighed som en ressource, og ønsker at afspejle samfundet. Derfor opfordres kvinder og mænd uanset alder, religion, seksuel orientering, handicap/funktionsnedsættelse og etnisk baggrund til at søge.   
 Denne jobannonce blev oprindeligt opslået på  https://www.ofir.dk/ 
 (Den originale annonce kan ses på:  https://www.ofir.dk/showojob?ofirid=abfe9407 )",Byvej 248A,58,Danmark,167,Hvidovre,4,"Hovedstaden, Sjælland og Bornholm",2650,Hvidovre,1,1,Fuldtid,None,None,1,,Pædagog,0,"Rytmikpædagog, 854, 855, 856",0,0,False,,,False,False,False,False,4,,,False,False,False,False,False,False,,,,,https://www.ofir.dk/resultat/Jobannonce.aspx?ofirId=abfe9407&action=sendApplicationUrl&utm_source=job.jobnet.dk&utm_medium=referral,False,2025-02-16T00:00:00+01:00,7,/CV/FindWork/GetLogo?JobAdId=964871cc-a003-4ac1-812e-058cb5dc992a&Organisation=55606617,"Byvej 248A,2650, Hvidovre",True,False,/CV/Jobseeking/JobLog/CreateJobSearch?JobnetJobPostingIdentifier=964871cc-a003-4ac1-812e-058cb5dc992a&Company.Name=Hvidovre Kommune - Børnehuset Vildmarken&SubmissionDeadlineDate=2025-2-16&Title=Fordi de første 1000 dage er noget særligt i et barns liv&WeeklyWorkTime=1,00000000-0000-0000-0000-000000000000,True,0,,,Fordi de første 1000 dage er noget særligt i et barns liv,True,,True,1,,964871cc-a003-4ac1-812e-058cb5dc992a,,,False,False,,0,False,Hvidovre Kommune - Børnehuset Vildmarken,Byvej 248A,,,2650,False,False,False,Hvidovre,,,,,,,,False,,2025-02-16T00:00:00+01:00,,0,False,0,,,,,0,,,,False,False,,,False,False,,,,False,,False,,,Arbejdspladsen ligger i Hvidovre kommune,False,Hvidovre Kommune - Børnehuset Vildmarken,,None,,False,False,"Vi søger dig, som er uddannet pædagog og som ligesom os andre insisterer på,at naturen skal være en del af børnenes dagligdag - også når det regner. Vildmarken er en hyggelig integreret institution fordelt på tre selvstændige huse, med fire stuer i hvert hus. Uanset om det er med store motoriske udfoldelser, om det er til nærværet omkring dialogisk","""Vi søger dig, som er uddannet pædagog og som ligesom os andre insisterer på,at naturen skal være en del af børnenes dagligdag - også når det regner. Vildmarken er en hyggelig integreret institution fordelt på tre selvstændige huse, med fire stuer i hvert hus. Uanset om det er med store motoriske udfoldelser, om det er til nærværet omkring dialogisk""","""Fordi de første 1000 dage er noget særligt i et barns liv""","https://www.google.dk/maps/dir//Byvej+248A,2650,+Hvidovre/","Vi søger dig, som er uddannet pædagog og som ligesom os andre insisterer på,  at naturen skal være en del af børnenes dagligdag - også når det regner.   Vildmarken er en hyggelig integreret institution fordelt på tre selvstændige huse, med fire stuer i hvert hus. Uanset om det er med store motoriske udfoldelser, om det er til nærværet omkring dialogisk læsning eller noget helt tredje. Vores store legeplads går hele vejen rundt om institutionen og emmer af alverdens muligheder for leg og læring. I legehusenes lille bydel serveres sandkager og mudderkaffe, under træstubbene findes der kryb, på bakker og i træer afprøves musklerne, i gyngerne får man et sus i maven - især når den voksne hjælper med at skubbe. I køkkenhaverne får både børn og voksne jord under neglene, når der plantes, ordnes og høstes, og sanserne kommer i spil, når bålet tændes i vores bålhus.   Vi brænder for udelivet og derfor har vi siden marts 2023 været en del af Grønne Spirer, som er en grøn mærkningsordning gennem Friluftsrådet.   Vi lægger stor vægt på trivsel og arbejdsglæde, hvilket vi ser både i dagligdagens små øjeblikke, såsom små grin, fællesoplevelser, at hjælpe hinanden og at alle siger godmorgen til alle, samt i det store hele hvor vi prioriterer dialog, medbestemmelse blandt alle parter, teammøder, faglige aftener og sociale arrangementer. Vi forventer derfor, at du som vores kollega mødes med os både i professionelt øjemed, men også i et mere festligt kollegialt lag 3-4 gange om året. Som personalet siger:   ""Her er plads til medbestemmelse og man er med til at sætte et præg på dagligdagen.""   ""Fedt, at vi har fællesarrangementer i hele huset både for børn og personale. Man kan godt mærke, at vi er et lille hus og alle er tætte på hinanden og nemt kan hjælpe på kryds og tværs, fordi alle kender alle.""   Ud over grønne spirer så er vores mål også at blive en Marte Meo institution. Dette for både at skabe et fælles pædagogisk fodfæste i personalegruppen og for at sikre børnene det optimale institutionsliv. Hertil skal siges, at alle børn er forskellige, pædagogikken er i konstant udvikling og at vi derfor altid kan blive bedre. Derfor har vi brug for dig til at være med til at udvikle vores pædagogiske praksis og til at være nysgerrig sammen med os.   Ligeledes afholder ledelsen MUS- og trivselssamtaler, samt deltager i alle børnesager og i løbende møder for at være tæt på personalet og den pædagogiske praksis.   For at give plads til alt det ovenstående er vores hverdag bygget op på en struktur af fast mødeskema og forberedelsestiden er indlagt i medarbejdernes skema og er tid væk fra børnene og stuen, hvor du som pædagog kan fordybe og forberede dig fagligt til f.eks. morgendagens aktivitet, næste måneds nyhedsbrev eller et ekstra stuemøde.   Er du nysgerrig på mere, så kontakt leder Jonas Bjørch på tlf. 25449240. Vi vil også meget gerne give dig en rundvisning, så du kan mærke efter, om vi er det rigtige match for dig.   Vi glæder os til at høre fra dig.     I Hvidovre Kommune bygger vores samarbejde på en anerkendende og positiv kultur, hvor forskellighed er en styrke, og hvor engagement, nysgerrighed og arbejdsglæde fremmer de nye idéer og den gode service til borgere, virksomheder, kulturliv og samarbejdspartnere.   Hvidovre er en grøn forstad med en stærk historie; tæt ved vandet og hovedstaden og lige midt i Øresundsregionen.   Hvidovre Kommune ser mangfoldighed som en ressource, og ønsker at afspejle samfundet. Derfor opfordres kvinder og mænd uanset alder, religion, seksuel orientering, handicap/funktionsnedsættelse og etnisk baggrund til at søge.   
 Denne jobannonce blev oprindeligt opslået på  https://www.ofir.dk/ 
 (Den originale annonce kan ses på:  https://www.ofir.dk/showojob?ofirid=abfe9407 )","https://www.google.dk/maps/place/Byvej+248A,2650,+Hvidovre/",55606617,False,False,,False
