summary_AutomatchType,summary_Abroad,summary_Weight,summary_Title,summary_JobHeadline,summary_Presentation,summary_HiringOrgName,summary_WorkPlaceAddress,summary_WorkPlacePostalCode,summary_WorkPlaceCity,summary_WorkPlaceOtherAddress,summary_WorkPlaceAbroad,summary_WorkPlaceNotStatic,summary_UseWorkPlaceAddressForJoblog,summary_PostingCreated,summary_LastDateApplication,summary_FormattedLastDateApplication,summary_AssignmentStartDate,summary_IsHotjob,summary_IsExternal,summary_Url,summary_Region,summary_Municipality,summary_Country,summary_PostalCode,summary_PostalCodeName,summary_JobAnnouncementType,summary_EmploymentType,summary_WorkHours,summary_OccupationArea,summary_OccupationGroup,summary_Occupation,summary_Location_Latitude,summary_Location_Longitude,summary_JoblogWorkTime_WorkHour,summary_JoblogWorkTime_DailyWorkTime,summary_WorkplaceID,summary_OrganisationId,summary_HiringOrgCVR,summary_UserLoggedIn,summary_AnonymousEmployer,summary_ShareUrl,summary_DetailsUrl,summary_JobLogUrl,summary_HasLocationValues,summary_ID,summary_Latitude,summary_Longitude,details_WorkSchedule,details_WorkConditions,details_EmploymentTypes,details_WorkPlace_Name,details_WorkPlace_Address_AddressLine,details_WorkPlace_Address_Country_Id,details_WorkPlace_Address_Country_Name,details_WorkPlace_Address_Municipality_Id,details_WorkPlace_Address_Municipality_Name,details_WorkPlace_Address_Region_Id,details_WorkPlace_Address_Region_Name,details_WorkPlace_Address_PostalCode,details_WorkPlace_Address_City,details_WorkPlace_PhoneNumber_Number,details_WorkPlace_PhoneNumber_Type,details_WorkPlace_PhoneNumber_Description,details_WorkPlace_FaxNumber,details_WorkPlace_Email,details_WorkPlace_WebAddress,details_WorkPlace_Description,details_WorkPlace_Logo,details_WorkPlace_WorkPlaceOrganizationNumber,details_WorkPlace_OrganizationNumber,details_WorkPlace_OrganizationDescription,details_JobPositionPosting_Id,details_JobPositionPosting_HiringOrg_Name,details_JobPositionPosting_HiringOrg_Address_AddressLine,details_JobPositionPosting_HiringOrg_Address_Country_Id,details_JobPositionPosting_HiringOrg_Address_Country_Name,details_JobPositionPosting_HiringOrg_Address_Municipality_Id,details_JobPositionPosting_HiringOrg_Address_Municipality_Name,details_JobPositionPosting_HiringOrg_Address_Region_Id,details_JobPositionPosting_HiringOrg_Address_Region_Name,details_JobPositionPosting_HiringOrg_Address_PostalCode,details_JobPositionPosting_HiringOrg_Address_City,details_JobPositionPosting_HiringOrg_PhoneNumber_Number,details_JobPositionPosting_HiringOrg_PhoneNumber_Type,details_JobPositionPosting_HiringOrg_PhoneNumber_Description,details_JobPositionPosting_HiringOrg_FaxNumber,details_JobPositionPosting_HiringOrg_Email,details_JobPositionPosting_HiringOrg_WebAddress,details_JobPositionPosting_HiringOrg_Description,details_JobPositionPosting_HiringOrg_Logo,details_JobPositionPosting_HiringOrg_WorkPlaceOrganizationNumber,details_JobPositionPosting_HiringOrg_OrganizationNumber,details_JobPositionPosting_HiringOrg_OrganizationDescription,details_JobPositionPosting_RecruitingCompany,details_JobPositionPosting_PublicationStartDate,details_JobPositionPosting_PublicationEndDate,details_JobPositionPosting_JobPositionInformation_PositionTitle,details_JobPositionPosting_JobPositionInformation_Purpose,details_JobPositionPosting_JobPositionInformation_WorkLocation_AddressLine,details_JobPositionPosting_JobPositionInformation_WorkLocation_Country_Id,details_JobPositionPosting_JobPositionInformation_WorkLocation_Country_Name,details_JobPositionPosting_JobPositionInformation_WorkLocation_Municipality_Id,details_JobPositionPosting_JobPositionInformation_WorkLocation_Municipality_Name,details_JobPositionPosting_JobPositionInformation_WorkLocation_Region_Id,details_JobPositionPosting_JobPositionInformation_WorkLocation_Region_Name,details_JobPositionPosting_JobPositionInformation_WorkLocation_PostalCode,details_JobPositionPosting_JobPositionInformation_WorkLocation_City,details_JobPositionPosting_JobPositionInformation_EmploymentType,details_JobPositionPosting_JobPositionInformation_WeeklyWorkHours_TypeId,details_JobPositionPosting_JobPositionInformation_WeeklyWorkHours_TypeName,details_JobPositionPosting_JobPositionInformation_WeeklyWorkHours_Description,details_JobPositionPosting_JobPositionInformation_CompensationDescription,details_JobPositionPosting_JobPositionInformation_NumberToFill,details_JobPositionPosting_JobPositionInformation_DriverLicense,details_JobPositionPosting_JobPositionInformation_Occupation_Name,details_JobPositionPosting_JobPositionInformation_Occupation_DiscoWeb,details_JobPositionPosting_JobPositionInformation_Occupation_AlternateNames,details_JobPositionPosting_JobPositionInformation_Occupation_GroupId,details_JobPositionPosting_JobPositionInformation_Occupation_AreaId,details_JobPositionPosting_JobPositionInformation_IsGovernmentHiring,details_JobPositionPosting_JobPositionInformation_JppContacts,details_JobPositionPosting_JobPositionInformation_EmploymentDate,details_JobPositionPosting_IsRecruitmentOfForeignNationals,details_JobPositionPosting_IsWorkInDenmark,details_JobPositionPosting_IsAnonymousEmployer,details_JobPositionPosting_IsDisabilityFriendly,details_JobPositionPosting_JppType,details_JobPositionPosting_ApplicationDetails_WorkHourMax,details_JobPositionPosting_ApplicationDetails_WorkHourMin,details_JobPositionPosting_ApplicationDetails_DailyWorkTimeWeekend,details_JobPositionPosting_ApplicationDetails_DailyWorkTimeNight,details_JobPositionPosting_ApplicationDetails_DailyWorkTimeEvening,details_JobPositionPosting_ApplicationDetails_DailyWorkTimeDay,details_JobPositionPosting_ApplicationDetails_DailyWorkTimeMorning,details_JobPositionPosting_ApplicationDetails_DailyWorkTimeVarious,details_JobPositionPosting_ApplicationDetails_ReferenceText,details_JobPositionPosting_ApplicationDetails_RemarksToApplicant,details_JobPositionPosting_ApplicationDetails_ByEmail,details_JobPositionPosting_ApplicationDetails_ByPhone,details_JobPositionPosting_ApplicationDetails_ApplyViaUrl,details_JobPositionPosting_ApplicationDetails_ReplyInWriting,details_JobPositionPosting_ApplicationDetails_ApplicationDeadlineDate,details_JobPositionPosting_Status,details_LogoUrl,details_Address,details_ShowMap,details_ShowShareButtonJobLog,details_JobLogUrl,details_JobLogTemplateModel_Identifier,details_JobLogTemplateModel_UseWorkPlaceAddressForJoblog,details_JobLogTemplateModel_Category,details_JobLogTemplateModel_CvCustomerIdentifier,details_JobLogTemplateModel_JobSeekingStatus,details_JobLogTemplateModel_Title,details_JobLogTemplateModel_IsApplicationSourceRequired,details_JobLogTemplateModel_ApplicationSource,details_JobLogTemplateModel_IsWeeklyWorkTimeRequired,details_JobLogTemplateModel_WeeklyWorkTime,details_JobLogTemplateModel_HoursPerWeek,details_JobLogTemplateModel_JobnetJobPostingIdentifier,details_JobLogTemplateModel_JobAdDocument_Title,details_JobLogTemplateModel_JobAdDocument_Identifier,details_JobLogTemplateModel_JobAdDocument_IsDeletedBySystem,details_JobLogTemplateModel_JobAdDocument_IsDeletedByUser,details_JobLogTemplateModel_JobAdFile,details_JobLogTemplateModel_Company_JobLogEntryCategory,details_JobLogTemplateModel_Company_ShowAddressFieldsEvenIfEmpty,details_JobLogTemplateModel_Company_Name,details_JobLogTemplateModel_Company_Address,details_JobLogTemplateModel_Company_Country,details_JobLogTemplateModel_Company_EmploymentAreaID,details_JobLogTemplateModel_Company_PostCode,details_JobLogTemplateModel_Company_IsCountryAndTownAndPostCodeEmpty,details_JobLogTemplateModel_Company_IsTownAndPostCodeEmpty,details_JobLogTemplateModel_Company_IsCountryDanmark,details_JobLogTemplateModel_Company_Town,details_JobLogTemplateModel_Company_ContactPerson,details_JobLogTemplateModel_Company_Phone,details_JobLogTemplateModel_Company_Email,details_JobLogTemplateModel_Company_Latitude,details_JobLogTemplateModel_Company_Longitude,details_JobLogTemplateModel_Company_DailyTravelTimeInMinutes,details_JobLogTemplateModel_Company_DistanceToCompanyInMeters,details_JobLogTemplateModel_Company_IsCreateMode,details_JobLogTemplateModel_TypeOfSubmission,details_JobLogTemplateModel_SubmissionDate,details_JobLogTemplateModel_SubmissionDateFormatted,details_JobLogTemplateModel_SubmissionDateTiks,details_JobLogTemplateModel_IsSubmissionDateRequired,details_JobLogTemplateModel_Status,details_JobLogTemplateModel_DateCreatedFormatted,details_JobLogTemplateModel_DateCreated,details_JobLogTemplateModel_DateModifiedFormatted,details_JobLogTemplateModel_DateModified,details_JobLogTemplateModel_LastModifiedDateTiks,details_JobLogTemplateModel_DateClosed,details_JobLogTemplateModel_JobApplicationDocument_Title,details_JobLogTemplateModel_JobApplicationDocument_Identifier,details_JobLogTemplateModel_JobApplicationDocument_IsDeletedBySystem,details_JobLogTemplateModel_JobApplicationDocument_IsDeletedByUser,details_JobLogTemplateModel_CvDocument_Title,details_JobLogTemplateModel_CvDocument_Identifier,details_JobLogTemplateModel_CvDocument_IsDeletedBySystem,details_JobLogTemplateModel_CvDocument_IsDeletedByUser,details_JobLogTemplateModel_JobApplicationFile,details_JobLogTemplateModel_CvFile,details_JobLogTemplateModel_SubmissionDeadlineDate,details_JobLogTemplateModel_IsPersisted,details_JobLogTemplateModel_ServerValidationErrors,details_JobLogTemplateModel_HasServerValidationErrors,details_JoblogWorkTime_WorkHour,details_JoblogWorkTime_DailyWorkTime,details_Place,details_OpenPrintDialog,details_WorkPlaceInfoText,details_JobCenterContactDetails,details_WorkPlaceDescriptionText,details_FavoriteText,details_IsFavorite,details_ShowFavorite,details_MetaOgTextForSharing,details_DescriptionForSharing,details_TitleForSharing,details_RutePlan,details_FormattedPurpose,details_MapUrl,details_OrganizationNumber,details_ShowSearchJobButton,details_ShowPrint,details_BackToFindWorkButtonUrl,isExternal
0,False,1,Butiksassistent,Butiksassistent,"Er du smilende, selvstændig og fuld af energi? Har du en passion for detailhandel og ønsker at være en del af Danmarks største lavprisbyggemarked? Så er det måske dig, vi leder efter hos jem &amp; ",jem & fix - Butik,Kræmmergade 5  ,9240,Nibe,True,False,False,False,2025-01-23T13:57:39,2025-02-21T23:59:59,21. februar 2025,0001-01-01T00:00:00,False,False,https://job.jobnet.dk/CV/FindWork/Details/b73e897c-c19c-47de-b922-d741b338d21f,Nordjylland,Aalborg,Danmark,9240,,Almindelige vilkår,Fastansættelse,Fuldtid,"Salg, indkøb og markedsføring",Butiksekspedition,Butiksassistent,56.9488,9.5799,,,1022273465,,10360641,False,False,https://job.jobnet.dk/CV/FindWork/DetailsSocialmedia/b73e897c-c19c-47de-b922-d741b338d21f,https://job.jobnet.dk/CV/FindWork/Details/b73e897c-c19c-47de-b922-d741b338d21f,https://job.jobnet.dk/CV/FindWork/Details/b73e897c-c19c-47de-b922-d741b338d21f,True,b73e897c-c19c-47de-b922-d741b338d21f,56.9488,9.5799,"{'Id': 1, 'Name': 'Fuldtid'}, {'Id': 16, 'Name': 'Deltid'}","{'Id': 1, 'Name': 'Almindelige vilkår'}, {'Id': 2, 'Name': 'Fleksjob'}, {'Id': 3, 'Name': 'Skånejob'}, {'Id': 4, 'Name': 'Egnet til efterlønnere og seniorer'}, {'Id': 5, 'Name': 'Job med løntilskud'}, {'Id': 6, 'Name': 'Rotationsjob'}, {'Id': 7, 'Name': 'Virksomhedspraktik'}","{'Id': 1, 'Name': 'Fastansættelse'}, {'Id': 16, 'Name': 'Tidsbegrænset ansættelse'}",jem & fix - Butik,Kræmmergade 5,58,Danmark,851,Aalborg,1,Nordjylland,9240,Nibe,,0,Primary,,,https://www.ofir.dk/resultat/Jobannonce.aspx?ofirId=9ea6b815&action=sendApplicationUrl&utm_source=job.jobnet.dk&utm_medium=referral,None,,1022273465,10360641,None,b73e897c-c19c-47de-b922-d741b338d21f,jem & fix - Butik,Kræmmergade 5,58,Danmark,851,Aalborg,1,Nordjylland,9240,Nibe,,0,Primary,,,https://www.ofir.dk/resultat/Jobannonce.aspx?ofirId=9ea6b815&action=sendApplicationUrl&utm_source=job.jobnet.dk&utm_medium=referral,None,,1022273465,10360641,None,,2025-01-23T13:57:39.0467296+01:00,2025-02-21T23:59:59+01:00,Butiksassistent,"Er du smilende, selvstændig og fuld af energi? Har du en passion for detailhandel og ønsker at være en del af Danmarks største lavprisbyggemarked? Så er det måske dig, vi leder efter hos jem & fix! Om Jem & Fix: Jem & fix er Skandinaviens største lavprisbyggemarked med over 200 butikker i Danmark, Norge og Sverige. Vi tror på, at kunderne godt kan selv, og vores mål er at tilbyde byggematerialer til en lav pris. Vores dedikerede butikschefer arbejder hver dag på at udvikle selvstændige medarbejdere og skabe gode resultater, imødekommende butikker og holdånd. Arbejdsopgaver:   Du får ansvar for forskellige områder i butikken.   Du skal samarbejde i et stærkt team om driften af butikken.   Du er med til at præge butikken med vareopfyldning, kassebetjening, trimning af varer og rengøring.   Du bidrager til en indbydende butiksoplevelse for vores kunder.   Du får mulighed for vækst og faglig udvikling.   Kompetencer:   Evne til at skabe resultater i samarbejde med kollegaer.   Lyst til at dygtiggøre dig og arbejde struktureret.   Ansvarsbevidsthed og optimal udnyttelse af butikkens ressourcer.   Energi og trivsel i et højt tempo.   Åben og udadvendt med fokus på kundeservice.   Villig til at arbejde fuldtid og i weekender.   Truckkort og detailerfaring er en fordel, men ikke et krav.   Din adfærd:   Initiativrig og selvstændig.   Ansvarsfuld med fokus på egen udvikling.   Forståelse for kundens oplevelse som essentiel for succes.   Villig til at levere mere end forventet og bidrage til teamets positive udvikling.   Jem & Fix som arbejdsplads: Hos os er der en flad struktur og højt til loftet. Vi arbejder alle engageret for at udvikle os indenfor personlige kompetencemål, som er i tråd med vores koncept og vækstmål.  Du får en struktureret introduktion til jobbet som butiksassistent, og bliver tilknyttet en erfaren mentor under oplæring.  Hos jem & fix sætter vi en ære i at klæde dig ordentligt på til fremtidens udfordringer. Derfor har vi udviklet vores eget akademi, hvor vi med målrettet undervisning og kompetente undervisere skaber tryghed og udvikling i din stilling hos jem & fix. Derudover tilbyder vi dig en god lønpakke inklusiv bonusordning, Fritvalgslønkonto, pensionsordning og sundhedssikring fra dag et.   Der er mulighed for rabatkort med 20% på køb i alle kæder og butikker i Harald Nyborg koncernen samt mulighed for at deltage i sociale arrangementer både lokalt og sammen med over dine 2600 jem & fix kolleger. Vi håber at høre fra dig! 
 Denne jobannonce blev oprindeligt opslået på  https://www.ofir.dk/ 
 (Den originale annonce kan ses på:  https://www.ofir.dk/showojob?ofirid=9ea6b815 )",Kræmmergade 5,58,Danmark,851,Aalborg,1,Nordjylland,9240,Nibe,1,1,Fuldtid,None,None,1,,Butiksassistent,0,"Bagerekspedient, Våbenhandler, Sælger af telekommunikationsudstyr, Sælger af sportsudstyr, Sælger af husholdningsapparater, Sælger af drikkevarer, Sælger af computerspil, multimedieprodukter og software, Sælger af computere og computerudstyr, Sælger af audiologisk udstyr, Sælger af audio- og videoudstyr, Specialiseret sælger, Salgsassistent - konfekture, Salgsassistent, Postekspedient, Personlig shopper, Parfumesælger, Markedssælger, Detailhandler, Chokolade- og konfektureassistent",0,0,False,,,False,False,False,False,4,,,False,False,False,False,False,False,,,,,https://www.ofir.dk/resultat/Jobannonce.aspx?ofirId=9ea6b815&action=sendApplicationUrl&utm_source=job.jobnet.dk&utm_medium=referral,False,2025-02-21T23:59:59+01:00,7,/CV/FindWork/GetLogo?JobAdId=b73e897c-c19c-47de-b922-d741b338d21f&Organisation=10360641,"Kræmmergade 5,9240, Nibe",True,False,/CV/Jobseeking/JobLog/CreateJobSearch?JobnetJobPostingIdentifier=b73e897c-c19c-47de-b922-d741b338d21f&Company.Name=jem & fix - Butik&SubmissionDeadlineDate=2025-2-21&Title=Butiksassistent&WeeklyWorkTime=1,00000000-0000-0000-0000-000000000000,False,0,,,Butiksassistent,True,,True,1,,b73e897c-c19c-47de-b922-d741b338d21f,,,False,False,,0,False,jem & fix - Butik,Kræmmergade 5,,,9240,False,False,False,Nibe,,,,,,,,False,,2025-02-21T23:59:59+01:00,,0,False,0,,,,,0,,,,False,False,,,False,False,,,,False,,False,,,Arbejdspladsen ligger i Aalborg kommune,False,jem & fix - Butik,,None,,False,False,"Er du smilende, selvstændig og fuld af energi? Har du en passion for detailhandel og ønsker at være en del af Danmarks største lavprisbyggemarked? Så er det måske dig, vi leder efter hos jem  fix!Om Jem  Fix:Jem  fix er Skandinaviens største lavprisbyggemarked med over 200 butikker i Danmark, Norge og Sverige.Vi tror på, at kunderne godt kan selv, ","""Er du smilende, selvstændig og fuld af energi? Har du en passion for detailhandel og ønsker at være en del af Danmarks største lavprisbyggemarked? Så er det måske dig, vi leder efter hos jem  fix!Om Jem  Fix:Jem  fix er Skandinaviens største lavprisbyggemarked med over 200 butikker i Danmark, Norge og Sverige.Vi tror på, at kunderne godt kan selv, ""","""Butiksassistent""","https://www.google.dk/maps/dir//Kræmmergade+5,9240,+Nibe/","Er du smilende, selvstændig og fuld af energi? Har du en passion for detailhandel og ønsker at være en del af Danmarks største lavprisbyggemarked? Så er det måske dig, vi leder efter hos jem & fix! Om Jem & Fix: Jem & fix er Skandinaviens største lavprisbyggemarked med over 200 butikker i Danmark, Norge og Sverige. Vi tror på, at kunderne godt kan selv, og vores mål er at tilbyde byggematerialer til en lav pris. Vores dedikerede butikschefer arbejder hver dag på at udvikle selvstændige medarbejdere og skabe gode resultater, imødekommende butikker og holdånd. Arbejdsopgaver:   Du får ansvar for forskellige områder i butikken.   Du skal samarbejde i et stærkt team om driften af butikken.   Du er med til at præge butikken med vareopfyldning, kassebetjening, trimning af varer og rengøring.   Du bidrager til en indbydende butiksoplevelse for vores kunder.   Du får mulighed for vækst og faglig udvikling.   Kompetencer:   Evne til at skabe resultater i samarbejde med kollegaer.   Lyst til at dygtiggøre dig og arbejde struktureret.   Ansvarsbevidsthed og optimal udnyttelse af butikkens ressourcer.   Energi og trivsel i et højt tempo.   Åben og udadvendt med fokus på kundeservice.   Villig til at arbejde fuldtid og i weekender.   Truckkort og detailerfaring er en fordel, men ikke et krav.   Din adfærd:   Initiativrig og selvstændig.   Ansvarsfuld med fokus på egen udvikling.   Forståelse for kundens oplevelse som essentiel for succes.   Villig til at levere mere end forventet og bidrage til teamets positive udvikling.   Jem & Fix som arbejdsplads: Hos os er der en flad struktur og højt til loftet. Vi arbejder alle engageret for at udvikle os indenfor personlige kompetencemål, som er i tråd med vores koncept og vækstmål.  Du får en struktureret introduktion til jobbet som butiksassistent, og bliver tilknyttet en erfaren mentor under oplæring.  Hos jem & fix sætter vi en ære i at klæde dig ordentligt på til fremtidens udfordringer. Derfor har vi udviklet vores eget akademi, hvor vi med målrettet undervisning og kompetente undervisere skaber tryghed og udvikling i din stilling hos jem & fix. Derudover tilbyder vi dig en god lønpakke inklusiv bonusordning, Fritvalgslønkonto, pensionsordning og sundhedssikring fra dag et.   Der er mulighed for rabatkort med 20% på køb i alle kæder og butikker i Harald Nyborg koncernen samt mulighed for at deltage i sociale arrangementer både lokalt og sammen med over dine 2600 jem & fix kolleger. Vi håber at høre fra dig! 
 Denne jobannonce blev oprindeligt opslået på  https://www.ofir.dk/ 
 (Den originale annonce kan ses på:  https://www.ofir.dk/showojob?ofirid=9ea6b815 )","https://www.google.dk/maps/place/Kræmmergade+5,9240,+Nibe/",10360641,False,False,,False
