summary_AutomatchType,summary_Abroad,summary_Weight,summary_Title,summary_JobHeadline,summary_Presentation,summary_HiringOrgName,summary_WorkPlaceAddress,summary_WorkPlacePostalCode,summary_WorkPlaceCity,summary_WorkPlaceOtherAddress,summary_WorkPlaceAbroad,summary_WorkPlaceNotStatic,summary_UseWorkPlaceAddressForJoblog,summary_PostingCreated,summary_LastDateApplication,summary_FormattedLastDateApplication,summary_AssignmentStartDate,summary_IsHotjob,summary_IsExternal,summary_Url,summary_Region,summary_Municipality,summary_Country,summary_PostalCode,summary_PostalCodeName,summary_JobAnnouncementType,summary_EmploymentType,summary_WorkHours,summary_OccupationArea,summary_OccupationGroup,summary_Occupation,summary_Location,summary_JoblogWorkTime_WorkHour,summary_JoblogWorkTime_DailyWorkTime,summary_WorkplaceID,summary_OrganisationId,summary_HiringOrgCVR,summary_UserLoggedIn,summary_AnonymousEmployer,summary_ShareUrl,summary_DetailsUrl,summary_JobLogUrl,summary_HasLocationValues,summary_ID,summary_Latitude,summary_Longitude,details_WorkSchedule,details_WorkConditions,details_EmploymentTypes,details_WorkPlace_Name,details_WorkPlace_Address_AddressLine,details_WorkPlace_Address_Country_Id,details_WorkPlace_Address_Country_Name,details_WorkPlace_Address_Municipality_Id,details_WorkPlace_Address_Municipality_Name,details_WorkPlace_Address_Region_Id,details_WorkPlace_Address_Region_Name,details_WorkPlace_Address_PostalCode,details_WorkPlace_Address_City,details_WorkPlace_PhoneNumber_Number,details_WorkPlace_PhoneNumber_Type,details_WorkPlace_PhoneNumber_Description,details_WorkPlace_FaxNumber,details_WorkPlace_Email,details_WorkPlace_WebAddress,details_WorkPlace_Description,details_WorkPlace_Logo,details_WorkPlace_WorkPlaceOrganizationNumber,details_WorkPlace_OrganizationNumber,details_WorkPlace_OrganizationDescription,details_JobPositionPosting_Id,details_JobPositionPosting_HiringOrg_Name,details_JobPositionPosting_HiringOrg_Address_AddressLine,details_JobPositionPosting_HiringOrg_Address_Country_Id,details_JobPositionPosting_HiringOrg_Address_Country_Name,details_JobPositionPosting_HiringOrg_Address_Municipality_Id,details_JobPositionPosting_HiringOrg_Address_Municipality_Name,details_JobPositionPosting_HiringOrg_Address_Region_Id,details_JobPositionPosting_HiringOrg_Address_Region_Name,details_JobPositionPosting_HiringOrg_Address_PostalCode,details_JobPositionPosting_HiringOrg_Address_City,details_JobPositionPosting_HiringOrg_PhoneNumber_Number,details_JobPositionPosting_HiringOrg_PhoneNumber_Type,details_JobPositionPosting_HiringOrg_PhoneNumber_Description,details_JobPositionPosting_HiringOrg_FaxNumber,details_JobPositionPosting_HiringOrg_Email,details_JobPositionPosting_HiringOrg_WebAddress,details_JobPositionPosting_HiringOrg_Description,details_JobPositionPosting_HiringOrg_Logo,details_JobPositionPosting_HiringOrg_WorkPlaceOrganizationNumber,details_JobPositionPosting_HiringOrg_OrganizationNumber,details_JobPositionPosting_HiringOrg_OrganizationDescription,details_JobPositionPosting_RecruitingCompany,details_JobPositionPosting_PublicationStartDate,details_JobPositionPosting_PublicationEndDate,details_JobPositionPosting_JobPositionInformation_PositionTitle,details_JobPositionPosting_JobPositionInformation_Purpose,details_JobPositionPosting_JobPositionInformation_WorkLocation_AddressLine,details_JobPositionPosting_JobPositionInformation_WorkLocation_Country_Id,details_JobPositionPosting_JobPositionInformation_WorkLocation_Country_Name,details_JobPositionPosting_JobPositionInformation_WorkLocation_Municipality_Id,details_JobPositionPosting_JobPositionInformation_WorkLocation_Municipality_Name,details_JobPositionPosting_JobPositionInformation_WorkLocation_Region_Id,details_JobPositionPosting_JobPositionInformation_WorkLocation_Region_Name,details_JobPositionPosting_JobPositionInformation_WorkLocation_PostalCode,details_JobPositionPosting_JobPositionInformation_WorkLocation_City,details_JobPositionPosting_JobPositionInformation_EmploymentType,details_JobPositionPosting_JobPositionInformation_WeeklyWorkHours_TypeId,details_JobPositionPosting_JobPositionInformation_WeeklyWorkHours_TypeName,details_JobPositionPosting_JobPositionInformation_WeeklyWorkHours_Description,details_JobPositionPosting_JobPositionInformation_CompensationDescription,details_JobPositionPosting_JobPositionInformation_NumberToFill,details_JobPositionPosting_JobPositionInformation_DriverLicense,details_JobPositionPosting_JobPositionInformation_Occupation_Name,details_JobPositionPosting_JobPositionInformation_Occupation_DiscoWeb,details_JobPositionPosting_JobPositionInformation_Occupation_AlternateNames,details_JobPositionPosting_JobPositionInformation_Occupation_GroupId,details_JobPositionPosting_JobPositionInformation_Occupation_AreaId,details_JobPositionPosting_JobPositionInformation_IsGovernmentHiring,details_JobPositionPosting_JobPositionInformation_JppContacts,details_JobPositionPosting_JobPositionInformation_EmploymentDate,details_JobPositionPosting_IsRecruitmentOfForeignNationals,details_JobPositionPosting_IsWorkInDenmark,details_JobPositionPosting_IsAnonymousEmployer,details_JobPositionPosting_IsDisabilityFriendly,details_JobPositionPosting_JppType,details_JobPositionPosting_ApplicationDetails_WorkHourMax,details_JobPositionPosting_ApplicationDetails_WorkHourMin,details_JobPositionPosting_ApplicationDetails_DailyWorkTimeWeekend,details_JobPositionPosting_ApplicationDetails_DailyWorkTimeNight,details_JobPositionPosting_ApplicationDetails_DailyWorkTimeEvening,details_JobPositionPosting_ApplicationDetails_DailyWorkTimeDay,details_JobPositionPosting_ApplicationDetails_DailyWorkTimeMorning,details_JobPositionPosting_ApplicationDetails_DailyWorkTimeVarious,details_JobPositionPosting_ApplicationDetails_ReferenceText,details_JobPositionPosting_ApplicationDetails_RemarksToApplicant,details_JobPositionPosting_ApplicationDetails_ByEmail,details_JobPositionPosting_ApplicationDetails_ByPhone,details_JobPositionPosting_ApplicationDetails_ApplyViaUrl,details_JobPositionPosting_ApplicationDetails_ReplyInWriting,details_JobPositionPosting_ApplicationDetails_ApplicationDeadlineDate,details_JobPositionPosting_Status,details_LogoUrl,details_Address,details_ShowMap,details_ShowShareButtonJobLog,details_JobLogUrl,details_JobLogTemplateModel_Identifier,details_JobLogTemplateModel_UseWorkPlaceAddressForJoblog,details_JobLogTemplateModel_Category,details_JobLogTemplateModel_CvCustomerIdentifier,details_JobLogTemplateModel_JobSeekingStatus,details_JobLogTemplateModel_Title,details_JobLogTemplateModel_IsApplicationSourceRequired,details_JobLogTemplateModel_ApplicationSource,details_JobLogTemplateModel_IsWeeklyWorkTimeRequired,details_JobLogTemplateModel_WeeklyWorkTime,details_JobLogTemplateModel_HoursPerWeek,details_JobLogTemplateModel_JobnetJobPostingIdentifier,details_JobLogTemplateModel_JobAdDocument_Title,details_JobLogTemplateModel_JobAdDocument_Identifier,details_JobLogTemplateModel_JobAdDocument_IsDeletedBySystem,details_JobLogTemplateModel_JobAdDocument_IsDeletedByUser,details_JobLogTemplateModel_JobAdFile,details_JobLogTemplateModel_Company_JobLogEntryCategory,details_JobLogTemplateModel_Company_ShowAddressFieldsEvenIfEmpty,details_JobLogTemplateModel_Company_Name,details_JobLogTemplateModel_Company_Address,details_JobLogTemplateModel_Company_Country,details_JobLogTemplateModel_Company_EmploymentAreaID,details_JobLogTemplateModel_Company_PostCode,details_JobLogTemplateModel_Company_IsCountryAndTownAndPostCodeEmpty,details_JobLogTemplateModel_Company_IsTownAndPostCodeEmpty,details_JobLogTemplateModel_Company_IsCountryDanmark,details_JobLogTemplateModel_Company_Town,details_JobLogTemplateModel_Company_ContactPerson,details_JobLogTemplateModel_Company_Phone,details_JobLogTemplateModel_Company_Email,details_JobLogTemplateModel_Company_Latitude,details_JobLogTemplateModel_Company_Longitude,details_JobLogTemplateModel_Company_DailyTravelTimeInMinutes,details_JobLogTemplateModel_Company_DistanceToCompanyInMeters,details_JobLogTemplateModel_Company_IsCreateMode,details_JobLogTemplateModel_TypeOfSubmission,details_JobLogTemplateModel_SubmissionDate,details_JobLogTemplateModel_SubmissionDateFormatted,details_JobLogTemplateModel_SubmissionDateTiks,details_JobLogTemplateModel_IsSubmissionDateRequired,details_JobLogTemplateModel_Status,details_JobLogTemplateModel_DateCreatedFormatted,details_JobLogTemplateModel_DateCreated,details_JobLogTemplateModel_DateModifiedFormatted,details_JobLogTemplateModel_DateModified,details_JobLogTemplateModel_LastModifiedDateTiks,details_JobLogTemplateModel_DateClosed,details_JobLogTemplateModel_JobApplicationDocument_Title,details_JobLogTemplateModel_JobApplicationDocument_Identifier,details_JobLogTemplateModel_JobApplicationDocument_IsDeletedBySystem,details_JobLogTemplateModel_JobApplicationDocument_IsDeletedByUser,details_JobLogTemplateModel_CvDocument_Title,details_JobLogTemplateModel_CvDocument_Identifier,details_JobLogTemplateModel_CvDocument_IsDeletedBySystem,details_JobLogTemplateModel_CvDocument_IsDeletedByUser,details_JobLogTemplateModel_JobApplicationFile,details_JobLogTemplateModel_CvFile,details_JobLogTemplateModel_SubmissionDeadlineDate,details_JobLogTemplateModel_IsPersisted,details_JobLogTemplateModel_ServerValidationErrors,details_JobLogTemplateModel_HasServerValidationErrors,details_JoblogWorkTime_WorkHour,details_JoblogWorkTime_DailyWorkTime,details_Place,details_OpenPrintDialog,details_WorkPlaceInfoText,details_JobCenterContactDetails,details_WorkPlaceDescriptionText,details_FavoriteText,details_IsFavorite,details_ShowFavorite,details_MetaOgTextForSharing,details_DescriptionForSharing,details_TitleForSharing,details_RutePlan,details_FormattedPurpose,details_MapUrl,details_OrganizationNumber,details_ShowSearchJobButton,details_ShowPrint,details_BackToFindWorkButtonUrl,isExternal
0,False,1,Frontend Developer - Payment Solutions,Frontend Developer - Payment Solutions,"Help shape the future of Nordic e-commerce by building robust payment solutions in a fast-moving, autonomous team.
About&nbsp;the job
You will be joining th",team.blue Denmark A/S,   ,,,True,False,True,False,2025-01-16T00:00:00,2025-03-13T00:00:00,13. marts 2025,0001-01-01T00:00:00,False,False,https://job.jobnet.dk/CV/FindWork/Details/cbdd9bdc-939c-4003-b79b-3a1c64f1fda0,,,Danmark,,,Almindelige vilkår,Fastansættelse,Fuldtid,It og teleteknik,"Systemudvikling, programmering og design",Programmør og systemudvikler,,,,1012111106,,29412006,False,False,https://job.jobnet.dk/CV/FindWork/DetailsSocialmedia/cbdd9bdc-939c-4003-b79b-3a1c64f1fda0,https://job.jobnet.dk/CV/FindWork/Details/cbdd9bdc-939c-4003-b79b-3a1c64f1fda0,https://job.jobnet.dk/CV/FindWork/Details/cbdd9bdc-939c-4003-b79b-3a1c64f1fda0,False,cbdd9bdc-939c-4003-b79b-3a1c64f1fda0,0,0,"{'Id': 1, 'Name': 'Fuldtid'}, {'Id': 16, 'Name': 'Deltid'}","{'Id': 1, 'Name': 'Almindelige vilkår'}, {'Id': 2, 'Name': 'Fleksjob'}, {'Id': 3, 'Name': 'Skånejob'}, {'Id': 4, 'Name': 'Egnet til efterlønnere og seniorer'}, {'Id': 5, 'Name': 'Job med løntilskud'}, {'Id': 6, 'Name': 'Rotationsjob'}, {'Id': 7, 'Name': 'Virksomhedspraktik'}","{'Id': 1, 'Name': 'Fastansættelse'}, {'Id': 16, 'Name': 'Tidsbegrænset ansættelse'}",team.blue Denmark A/S,,58,Danmark,0,,0,,,,,0,Primary,,,https://careers.team.blue/jobs/5438561-frontend-developer-payment-solutions,None,,1012111106,29412006,None,cbdd9bdc-939c-4003-b79b-3a1c64f1fda0,team.blue Denmark A/S,,58,Danmark,0,,0,,,,,0,Primary,,,https://careers.team.blue/jobs/5438561-frontend-developer-payment-solutions,None,,1012111106,29412006,None,,2025-01-16T00:00:00+01:00,2025-03-13T09:31:12.55+01:00,Frontend Developer - Payment Solutions,"Help shape the future of Nordic e-commerce by building robust payment solutions in a fast-moving, autonomous team.
 About   the job 
 You will be joining the OnPay team, developing a leading payment solution that serves e-commerce customers across the Nordics. Online payments are becoming more prevalent every day and our mission is to support our growing merchants by remaining at the forefront of product offerings and reliability. This is where you come in. 
 We're seeking someone to accelerate our frontend & plugin development, focusing on ensuring our customer facing portals and interfaces stay up to date with our backend API’s. 
 This may include projects like: 
 
 Implementing our new fee surcharge interface for our WooCommerce merchants 
 
 
 Keeping our frontend libraries up to date 
 
 
 Ensuring a consistent user experience throughout the application 
 
   
 You'll have significant responsibility for delivering high-quality software, deploying frequently, and working within our Scrum framework. 
 As a team, we collaborate on the entire software development lifecycle where security and compliance are fundamental to OnPay’s success and require high attention to detail to ensure that the millions of transactions we process every month remain secure and seamless. 
   
 Your   profile 
 We are looking for someone that is passionate about online payments and the surrounding software ecosystem. There are many different backgrounds that could be successful in this role, so we encourage you to apply even if you don’t meet all the requirements below. 
 Requirements:  
 
 Experience writing maintainable JavaScript and SCSS/CSS 
 
 
 Well versed in object-oriented code, and willingness to work with PHP and Symfony 
 
 
 Interest in user experience best practices 
 
 
 Great communication skills (our team language is English) 
 
 
 Structured, proactive, and with an eye for detail 
 
 
 Knowledgeable about security as it relates to software 
 
 
 Passionate about technology and staying up to date 
 
 
 Linux and command line experience 
 
 
 Version control workflows (we use Git & GitLab) 
 
 
 Resident of the EU or UK 
 
 
 Ability to travel to Denmark a few times a year 
 
   
 Nice to have: 
 
 Payment industry experience 
 
 
 E-commerce experience (WooCommerce, Shopify, Magento, etc) 
 
 
 Experience working within the PCI-DSS or another audited environment 
 
 
 Knowledge of Scrum 
 
   
 What  we offer 
 You will be joining a high-impact team where your ideas matter. At OnPay, we combine the agility of a small team with the resources and opportunities of being a part of team.blue. Our flat structure means ideas go from concept to production, with minimal bureaucracy in the way. 
 We believe great work happens when talented people are given the space to focus. That's why we minimize meetings and protect deep work time, allowing you to craft exceptional solutions for our customers. 
 Working with us, you will get: 
 
 A safe and flexible working environment 
 
 
 Professional development opportunities, including courses and certifications 
 
 
 Collaboration with skilled colleagues in the industry 
 
 
 A healthy work-life balance 
 
 
 Possibility to work either remote or from  our offices in Europe 
 
   
 How to  apply 
 Any questions about the position can be sent to Software Team Lead, Keenan Linsly, at  keenan.linsly@team.blue 
 If you would like to apply for the position, use the button “Apply for this job”  
 We evaluate and interview candidates on an ongoing basis, so please apply as soon as possible if the job sounds like a good match. 
 Place of  work : Fully remote, or one of our offices either partially remote or full-time office 
 Start:  As soon as possible",,58,Danmark,0,,0,,,,1,1,Fuldtid,None,None,1,,Programmør og systemudvikler,0,"Analytiker af ikt-systemer, Udvikler af mobilapps, Udvikler af integrerede systemer, Udvikler af integrerede softwaresystemer, Udvikler af ikt-systemer, Udvikler af e-læring, Udvikler af digitale spil, Udvikler af brugergrænseflader, Softwareudvikler inden for mobilt udstyr, Softwareudvikler af ikt-applikationer, Softwarearkitekt, Softwareanalytiker, Programmør til numeriske værktøjer og processer, Ikt-applikationskonfigurator, Ekspert i søgemaskineoptimering, Designer af instruktionsmaterialer, Designer af digitale spil, Arkitekt inden for e-læring, Computerspiludvikler, 6057, 6058, 6059, 6060, 6061, 6062, BI konsulent, Devops tekniker, Devops Ingeniør",0,0,False,"{'Email': 'anne.noergaard@team.blue', 'PersonName': 'Anne Nørgaard', 'FirstName': 'Anne', 'LastName': 'Nørgaard', 'PositionTitle': 'Talent Acquisition Specialist', 'PhoneNumbers': [{'Number': '70400000', 'Type': 0, 'Description': 'Primary'}]}",,False,False,False,False,4,,,False,False,False,False,False,False,,,,,https://careers.team.blue/jobs/5438561-frontend-developer-payment-solutions,False,2025-03-13T00:00:00+01:00,7,/CV/FindWork/GetLogo?JobAdId=cbdd9bdc-939c-4003-b79b-3a1c64f1fda0&Organisation=29412006,",, ",False,False,/CV/Jobseeking/JobLog/CreateJobSearch?JobnetJobPostingIdentifier=cbdd9bdc-939c-4003-b79b-3a1c64f1fda0&Company.Name=team.blue Denmark A/S&SubmissionDeadlineDate=2025-3-13&Title=Frontend Developer - Payment Solutions&WeeklyWorkTime=1,00000000-0000-0000-0000-000000000000,False,0,,,Frontend Developer - Payment Solutions,True,,True,1,,cbdd9bdc-939c-4003-b79b-3a1c64f1fda0,,,False,False,,0,False,team.blue Denmark A/S,,,,,True,True,False,,Anne Nørgaard,70400000,anne.noergaard@team.blue,,,,,False,,2025-03-13T00:00:00+01:00,,0,False,0,,,,,0,,,,False,False,,,False,False,,,,False,,False,,,Arbejdspladsen ligger i Danmark,False,team.blue Denmark A/S,,None,,False,False,"Help shape the future of Nordic e-commerce by building robust payment solutions in a fast-moving, autonomous team.
Aboutthe job
You will be joining the OnPay team, developing a leading payment solution that serves e-commerce customers across the Nordics. Online payments are becoming more prevalent every day and our mission is to support our growing","""Help shape the future of Nordic e-commerce by building robust payment solutions in a fast-moving, autonomous team.\nAboutthe job\nYou will be joining the OnPay team, developing a leading payment solution that serves e-commerce customers across the Nordics. Online payments are becoming more prevalent every day and our mission is to support our growing""","""Frontend Developer - Payment Solutions""","https://www.google.dk/maps/dir//,,+/","Help shape the future of Nordic e-commerce by building robust payment solutions in a fast-moving, autonomous team.
 About   the job 
 You will be joining the OnPay team, developing a leading payment solution that serves e-commerce customers across the Nordics. Online payments are becoming more prevalent every day and our mission is to support our growing merchants by remaining at the forefront of product offerings and reliability. This is where you come in. 
 We're seeking someone to accelerate our frontend & plugin development, focusing on ensuring our customer facing portals and interfaces stay up to date with our backend API’s. 
 This may include projects like: 
 
 Implementing our new fee surcharge interface for our WooCommerce merchants 
 
 
 Keeping our frontend libraries up to date 
 
 
 Ensuring a consistent user experience throughout the application 
 
   
 You'll have significant responsibility for delivering high-quality software, deploying frequently, and working within our Scrum framework. 
 As a team, we collaborate on the entire software development lifecycle where security and compliance are fundamental to OnPay’s success and require high attention to detail to ensure that the millions of transactions we process every month remain secure and seamless. 
   
 Your   profile 
 We are looking for someone that is passionate about online payments and the surrounding software ecosystem. There are many different backgrounds that could be successful in this role, so we encourage you to apply even if you don’t meet all the requirements below. 
 Requirements:  
 
 Experience writing maintainable JavaScript and SCSS/CSS 
 
 
 Well versed in object-oriented code, and willingness to work with PHP and Symfony 
 
 
 Interest in user experience best practices 
 
 
 Great communication skills (our team language is English) 
 
 
 Structured, proactive, and with an eye for detail 
 
 
 Knowledgeable about security as it relates to software 
 
 
 Passionate about technology and staying up to date 
 
 
 Linux and command line experience 
 
 
 Version control workflows (we use Git & GitLab) 
 
 
 Resident of the EU or UK 
 
 
 Ability to travel to Denmark a few times a year 
 
   
 Nice to have: 
 
 Payment industry experience 
 
 
 E-commerce experience (WooCommerce, Shopify, Magento, etc) 
 
 
 Experience working within the PCI-DSS or another audited environment 
 
 
 Knowledge of Scrum 
 
   
 What  we offer 
 You will be joining a high-impact team where your ideas matter. At OnPay, we combine the agility of a small team with the resources and opportunities of being a part of team.blue. Our flat structure means ideas go from concept to production, with minimal bureaucracy in the way. 
 We believe great work happens when talented people are given the space to focus. That's why we minimize meetings and protect deep work time, allowing you to craft exceptional solutions for our customers. 
 Working with us, you will get: 
 
 A safe and flexible working environment 
 
 
 Professional development opportunities, including courses and certifications 
 
 
 Collaboration with skilled colleagues in the industry 
 
 
 A healthy work-life balance 
 
 
 Possibility to work either remote or from  our offices in Europe 
 
   
 How to  apply 
 Any questions about the position can be sent to Software Team Lead, Keenan Linsly, at  keenan.linsly@team.blue 
 If you would like to apply for the position, use the button “Apply for this job”  
 We evaluate and interview candidates on an ongoing basis, so please apply as soon as possible if the job sounds like a good match. 
 Place of  work : Fully remote, or one of our offices either partially remote or full-time office 
 Start:  As soon as possible","https://www.google.dk/maps/place/,,+/",29412006,False,False,,False
