summary_AutomatchType,summary_Abroad,summary_Weight,summary_Title,summary_JobHeadline,summary_Presentation,summary_HiringOrgName,summary_WorkPlaceAddress,summary_WorkPlacePostalCode,summary_WorkPlaceCity,summary_WorkPlaceOtherAddress,summary_WorkPlaceAbroad,summary_WorkPlaceNotStatic,summary_UseWorkPlaceAddressForJoblog,summary_PostingCreated,summary_LastDateApplication,summary_FormattedLastDateApplication,summary_AssignmentStartDate,summary_IsHotjob,summary_IsExternal,summary_Url,summary_Region,summary_Municipality,summary_Country,summary_PostalCode,summary_PostalCodeName,summary_JobAnnouncementType,summary_EmploymentType,summary_WorkHours,summary_OccupationArea,summary_OccupationGroup,summary_Occupation,summary_Location_Latitude,summary_Location_Longitude,summary_JoblogWorkTime_WorkHour,summary_JoblogWorkTime_DailyWorkTime,summary_WorkplaceID,summary_OrganisationId,summary_HiringOrgCVR,summary_UserLoggedIn,summary_AnonymousEmployer,summary_ShareUrl,summary_DetailsUrl,summary_JobLogUrl,summary_HasLocationValues,summary_ID,summary_Latitude,summary_Longitude,details_WorkSchedule,details_WorkConditions,details_EmploymentTypes,details_WorkPlace_Name,details_WorkPlace_Address_AddressLine,details_WorkPlace_Address_Country_Id,details_WorkPlace_Address_Country_Name,details_WorkPlace_Address_Municipality_Id,details_WorkPlace_Address_Municipality_Name,details_WorkPlace_Address_Region_Id,details_WorkPlace_Address_Region_Name,details_WorkPlace_Address_PostalCode,details_WorkPlace_Address_City,details_WorkPlace_PhoneNumber_Number,details_WorkPlace_PhoneNumber_Type,details_WorkPlace_PhoneNumber_Description,details_WorkPlace_FaxNumber,details_WorkPlace_Email,details_WorkPlace_WebAddress,details_WorkPlace_Description,details_WorkPlace_Logo,details_WorkPlace_WorkPlaceOrganizationNumber,details_WorkPlace_OrganizationNumber,details_WorkPlace_OrganizationDescription,details_JobPositionPosting_Id,details_JobPositionPosting_HiringOrg_Name,details_JobPositionPosting_HiringOrg_Address_AddressLine,details_JobPositionPosting_HiringOrg_Address_Country_Id,details_JobPositionPosting_HiringOrg_Address_Country_Name,details_JobPositionPosting_HiringOrg_Address_Municipality_Id,details_JobPositionPosting_HiringOrg_Address_Municipality_Name,details_JobPositionPosting_HiringOrg_Address_Region_Id,details_JobPositionPosting_HiringOrg_Address_Region_Name,details_JobPositionPosting_HiringOrg_Address_PostalCode,details_JobPositionPosting_HiringOrg_Address_City,details_JobPositionPosting_HiringOrg_PhoneNumber_Number,details_JobPositionPosting_HiringOrg_PhoneNumber_Type,details_JobPositionPosting_HiringOrg_PhoneNumber_Description,details_JobPositionPosting_HiringOrg_FaxNumber,details_JobPositionPosting_HiringOrg_Email,details_JobPositionPosting_HiringOrg_WebAddress,details_JobPositionPosting_HiringOrg_Description,details_JobPositionPosting_HiringOrg_Logo,details_JobPositionPosting_HiringOrg_WorkPlaceOrganizationNumber,details_JobPositionPosting_HiringOrg_OrganizationNumber,details_JobPositionPosting_HiringOrg_OrganizationDescription,details_JobPositionPosting_RecruitingCompany,details_JobPositionPosting_PublicationStartDate,details_JobPositionPosting_PublicationEndDate,details_JobPositionPosting_JobPositionInformation_PositionTitle,details_JobPositionPosting_JobPositionInformation_Purpose,details_JobPositionPosting_JobPositionInformation_WorkLocation_AddressLine,details_JobPositionPosting_JobPositionInformation_WorkLocation_Country_Id,details_JobPositionPosting_JobPositionInformation_WorkLocation_Country_Name,details_JobPositionPosting_JobPositionInformation_WorkLocation_Municipality_Id,details_JobPositionPosting_JobPositionInformation_WorkLocation_Municipality_Name,details_JobPositionPosting_JobPositionInformation_WorkLocation_Region_Id,details_JobPositionPosting_JobPositionInformation_WorkLocation_Region_Name,details_JobPositionPosting_JobPositionInformation_WorkLocation_PostalCode,details_JobPositionPosting_JobPositionInformation_WorkLocation_City,details_JobPositionPosting_JobPositionInformation_EmploymentType,details_JobPositionPosting_JobPositionInformation_WeeklyWorkHours_TypeId,details_JobPositionPosting_JobPositionInformation_WeeklyWorkHours_TypeName,details_JobPositionPosting_JobPositionInformation_WeeklyWorkHours_Description,details_JobPositionPosting_JobPositionInformation_CompensationDescription,details_JobPositionPosting_JobPositionInformation_NumberToFill,details_JobPositionPosting_JobPositionInformation_DriverLicense,details_JobPositionPosting_JobPositionInformation_Occupation_Name,details_JobPositionPosting_JobPositionInformation_Occupation_DiscoWeb,details_JobPositionPosting_JobPositionInformation_Occupation_AlternateNames,details_JobPositionPosting_JobPositionInformation_Occupation_GroupId,details_JobPositionPosting_JobPositionInformation_Occupation_AreaId,details_JobPositionPosting_JobPositionInformation_IsGovernmentHiring,details_JobPositionPosting_JobPositionInformation_JppContacts,details_JobPositionPosting_JobPositionInformation_EmploymentDate,details_JobPositionPosting_IsRecruitmentOfForeignNationals,details_JobPositionPosting_IsWorkInDenmark,details_JobPositionPosting_IsAnonymousEmployer,details_JobPositionPosting_IsDisabilityFriendly,details_JobPositionPosting_JppType,details_JobPositionPosting_ApplicationDetails_WorkHourMax,details_JobPositionPosting_ApplicationDetails_WorkHourMin,details_JobPositionPosting_ApplicationDetails_DailyWorkTimeWeekend,details_JobPositionPosting_ApplicationDetails_DailyWorkTimeNight,details_JobPositionPosting_ApplicationDetails_DailyWorkTimeEvening,details_JobPositionPosting_ApplicationDetails_DailyWorkTimeDay,details_JobPositionPosting_ApplicationDetails_DailyWorkTimeMorning,details_JobPositionPosting_ApplicationDetails_DailyWorkTimeVarious,details_JobPositionPosting_ApplicationDetails_ReferenceText,details_JobPositionPosting_ApplicationDetails_RemarksToApplicant,details_JobPositionPosting_ApplicationDetails_ByEmail,details_JobPositionPosting_ApplicationDetails_ByPhone,details_JobPositionPosting_ApplicationDetails_ApplyViaUrl,details_JobPositionPosting_ApplicationDetails_ReplyInWriting,details_JobPositionPosting_ApplicationDetails_ApplicationDeadlineDate,details_JobPositionPosting_Status,details_LogoUrl,details_Address,details_ShowMap,details_ShowShareButtonJobLog,details_JobLogUrl,details_JobLogTemplateModel_Identifier,details_JobLogTemplateModel_UseWorkPlaceAddressForJoblog,details_JobLogTemplateModel_Category,details_JobLogTemplateModel_CvCustomerIdentifier,details_JobLogTemplateModel_JobSeekingStatus,details_JobLogTemplateModel_Title,details_JobLogTemplateModel_IsApplicationSourceRequired,details_JobLogTemplateModel_ApplicationSource,details_JobLogTemplateModel_IsWeeklyWorkTimeRequired,details_JobLogTemplateModel_WeeklyWorkTime,details_JobLogTemplateModel_HoursPerWeek,details_JobLogTemplateModel_JobnetJobPostingIdentifier,details_JobLogTemplateModel_JobAdDocument_Title,details_JobLogTemplateModel_JobAdDocument_Identifier,details_JobLogTemplateModel_JobAdDocument_IsDeletedBySystem,details_JobLogTemplateModel_JobAdDocument_IsDeletedByUser,details_JobLogTemplateModel_JobAdFile,details_JobLogTemplateModel_Company_JobLogEntryCategory,details_JobLogTemplateModel_Company_ShowAddressFieldsEvenIfEmpty,details_JobLogTemplateModel_Company_Name,details_JobLogTemplateModel_Company_Address,details_JobLogTemplateModel_Company_Country,details_JobLogTemplateModel_Company_EmploymentAreaID,details_JobLogTemplateModel_Company_PostCode,details_JobLogTemplateModel_Company_IsCountryAndTownAndPostCodeEmpty,details_JobLogTemplateModel_Company_IsTownAndPostCodeEmpty,details_JobLogTemplateModel_Company_IsCountryDanmark,details_JobLogTemplateModel_Company_Town,details_JobLogTemplateModel_Company_ContactPerson,details_JobLogTemplateModel_Company_Phone,details_JobLogTemplateModel_Company_Email,details_JobLogTemplateModel_Company_Latitude,details_JobLogTemplateModel_Company_Longitude,details_JobLogTemplateModel_Company_DailyTravelTimeInMinutes,details_JobLogTemplateModel_Company_DistanceToCompanyInMeters,details_JobLogTemplateModel_Company_IsCreateMode,details_JobLogTemplateModel_TypeOfSubmission,details_JobLogTemplateModel_SubmissionDate,details_JobLogTemplateModel_SubmissionDateFormatted,details_JobLogTemplateModel_SubmissionDateTiks,details_JobLogTemplateModel_IsSubmissionDateRequired,details_JobLogTemplateModel_Status,details_JobLogTemplateModel_DateCreatedFormatted,details_JobLogTemplateModel_DateCreated,details_JobLogTemplateModel_DateModifiedFormatted,details_JobLogTemplateModel_DateModified,details_JobLogTemplateModel_LastModifiedDateTiks,details_JobLogTemplateModel_DateClosed,details_JobLogTemplateModel_JobApplicationDocument_Title,details_JobLogTemplateModel_JobApplicationDocument_Identifier,details_JobLogTemplateModel_JobApplicationDocument_IsDeletedBySystem,details_JobLogTemplateModel_JobApplicationDocument_IsDeletedByUser,details_JobLogTemplateModel_CvDocument_Title,details_JobLogTemplateModel_CvDocument_Identifier,details_JobLogTemplateModel_CvDocument_IsDeletedBySystem,details_JobLogTemplateModel_CvDocument_IsDeletedByUser,details_JobLogTemplateModel_JobApplicationFile,details_JobLogTemplateModel_CvFile,details_JobLogTemplateModel_SubmissionDeadlineDate,details_JobLogTemplateModel_IsPersisted,details_JobLogTemplateModel_ServerValidationErrors,details_JobLogTemplateModel_HasServerValidationErrors,details_JoblogWorkTime_WorkHour,details_JoblogWorkTime_DailyWorkTime,details_Place,details_OpenPrintDialog,details_WorkPlaceInfoText,details_JobCenterContactDetails,details_WorkPlaceDescriptionText,details_FavoriteText,details_IsFavorite,details_ShowFavorite,details_MetaOgTextForSharing,details_DescriptionForSharing,details_TitleForSharing,details_RutePlan,details_FormattedPurpose,details_MapUrl,details_OrganizationNumber,details_ShowSearchJobButton,details_ShowPrint,details_BackToFindWorkButtonUrl,isExternal
0,False,1,Social- og sundhedsassistent søges til aftenvagt i Team A,Social- og sundhedsassistent søges til aftenvagt i Team A,"Er du passioneret omkring at skabe de bedste rammer for vores beboere med fokus på hygge og aktiviteter? Ønsker du at arbejde ud fra et personcentreret omsorgsperspektiv? Så læs videre!

Vi ",Lejre Kommune,Bøgebakken 1  ,4320,Lejre,False,False,False,True,2025-01-20T09:38:18,2025-03-17T09:38:18,17. marts 2025,0001-01-01T00:00:00,False,False,https://job.jobnet.dk/CV/FindWork/Details/e4d5e8e0-2af4-4825-8983-10d2399655f8,Øvrige Sjælland,Lejre,Danmark,4320,,Almindelige vilkår,Fastansættelse,Deltid,"Sundhed, omsorg og personlig pleje",Pleje og omsorg,Social- og sundhedsassistent,55.5946,11.957,(28 timer ugentligt),,1003284858,,29188548,False,False,https://job.jobnet.dk/CV/FindWork/DetailsSocialmedia/e4d5e8e0-2af4-4825-8983-10d2399655f8,https://job.jobnet.dk/CV/FindWork/Details/e4d5e8e0-2af4-4825-8983-10d2399655f8,https://job.jobnet.dk/CV/FindWork/Details/e4d5e8e0-2af4-4825-8983-10d2399655f8,True,e4d5e8e0-2af4-4825-8983-10d2399655f8,55.5946,11.957,"{'Id': 1, 'Name': 'Fuldtid'}, {'Id': 16, 'Name': 'Deltid'}","{'Id': 1, 'Name': 'Almindelige vilkår'}, {'Id': 2, 'Name': 'Fleksjob'}, {'Id': 3, 'Name': 'Skånejob'}, {'Id': 4, 'Name': 'Egnet til efterlønnere og seniorer'}, {'Id': 5, 'Name': 'Job med løntilskud'}, {'Id': 6, 'Name': 'Rotationsjob'}, {'Id': 7, 'Name': 'Virksomhedspraktik'}","{'Id': 1, 'Name': 'Fastansættelse'}, {'Id': 16, 'Name': 'Tidsbegrænset ansættelse'}",Lejre Kommune,Bøgebakken 1,58,Danmark,350,Lejre,4,"Hovedstaden, Sjælland og Bornholm",4320,Lejre,,0,Primary,,,https://www.lejre.dk/ledige-job/ledige-job/?hr=show-job/235433&linkref=263060&locale=da_DK,None,,1003284858,29188548,None,e4d5e8e0-2af4-4825-8983-10d2399655f8,Lejre Kommune,Bøgebakken 1,58,Danmark,350,Lejre,4,"Hovedstaden, Sjælland og Bornholm",4320,Lejre,,0,Primary,,,https://www.lejre.dk/ledige-job/ledige-job/?hr=show-job/235433&linkref=263060&locale=da_DK,None,,1003284858,29188548,None,,2025-01-20T09:38:18+01:00,2025-03-17T09:38:18+01:00,Social- og sundhedsassistent søges til aftenvagt i Team A,"Er du passioneret omkring at skabe de bedste rammer for vores beboere med fokus på hygge og aktiviteter? Ønsker du at arbejde ud fra et personcentreret omsorgsperspektiv? Så læs videre! 
 Vi søger en engageret og faglig kollega, der vil medvirke til at Bøgebakken forbliver et godt sted at bo for vores beboere og tager medansvar for at skabe en faglig og hyggelig arbejdsplads. . 
 Om jobbet 
 Bøgebakken er bygget op omkring plejeprincipperne i Leve- og Bo-konceptet, hvor beboernes hverdag er i centrum med udgangspunkt i den enkeltes behov og ressourcer. 
 Din aftenvagt vil byde på hygge, nærvær, personlig pleje samt praktiske opgaver. Vi og beboerne elsker for eksempel duften af hjemmelavet mad, hvorfor vi selv tilbereder det varme måltid i enheden ud fra en menu planlagt i samarbejde med beboerne og med støtte fra vores ernæringsfaglige konsulent. 
 Vi arbejder med personcentreret omsorg og stræber efter høj faglig kvalitet med fokus på sparring og læring på tværs af plejehjemmets huse. Bøgebakken består af flere faggrupper, herunder social- og sundhedshjælpere, social- og sundhedsassistenter, sygeplejersker, en farmakonom samt en ernæringsfaglig konsulent. Dette bidrager til et stærkt tværfagligt fællesskab, som kommer både beboere og ansatte til gode. 
 Vi prioriterer kompetenceudvikling højt, og du vil opleve, at alle dine kompetencer bliver anvendt, både inden for det sundhedsfaglige og socialpædagogiske felt. Udover daglige sparringer på morgen- og triagemøder har vi månedlige SSA/sygeplejerske- møder med faste emner i et årshjul. Derudover har vi et tæt samarbejde med kommunens demenskoordinatorer og forflytningskoordinator. 
 Om dig 
 Faglige kvalifikationer: 
 
 Uddannet social- og sundhedsassistent Viden, erfaring og interesse for almen somatik, gerontologi og demens er en fordel. 
 Kendskab til at arbejde med beboere gennem en socialpædagogisk tilgang, så de kan leve et værdigt liv i trygge omgivelser. 
 Evne til at indgå i professionelle relationer med beboere og deres pårørende og skabe en oplevelse af nærvær. 
 Gode kommunikationsevner til at formidle viden og erfaringer til kollegaer. 
 Ønske om at prioritere tværfagligt samarbejde, så tilgangen til beboerne afhænger af deres behov. 
 Rollemodel for elever og kollegaer ved at styrke fællesskabet omkring opgaver. 
 
  Personlige kvalifikationer: 
 
 Overblik og medmenneskelighed, som udtrykkes gennem din faglighed både overfor beboere og pårørende. 
 Kreativ og fleksibel tilgang til at skabe en god hverdag for vores beboere. 
 Bringer godt humør til teamet og beboerne. 
 Gode samarbejdsevner 
 
 Om os 
 Bøgebakken er et nyere plejehjem beliggende i naturskønne omgivelser i Allerslev, Lejre Kommune, tæt på Lejre Station (10 minutters gang). 10 minutter i bil fra Roskilde, 27 minutter i bil fra Holbæk, 20 minutter i bil fra Høje-Taastrup. Bøgebakken har 7 huse fordelt på matriklen. 2 af husene er skærmede enheder, og 3 af husene rummer også midlertidige pladser. 
 
Du vil blive ansat i et team med 14 permanente boliger og 5 midlertidige pladser men vil primært være tilknyttet et hus med 7 permanente boliger og 3 midligertidige pladser.  
 Løn og ansættelse 
  Lyder det som noget for dig, så tøv ikke med at ansøge. Du er også velkommen til at ringe eller komme ud og besøge os, vi viser gerne vores skønne arbejdsplads frem. 
 Ansættelse pr. 01.03.2025. Stillingen er på 28 timer om ugen med weekendvagt hver 2. weekend. Vi afholder samtaler løbende og ansætter, når vi finder det rette match. 
 Du vil blive ansat efter gældende overenskomst og principperne i ”ny løn”. 
 Har du spørgsmål omkring stillingen, er du velkommen til at kontakte teamleder Sofia Østenby på telefon 23601596.",Bøgebakken 1,58,Danmark,350,Lejre,4,"Hovedstaden, Sjælland og Bornholm",4320,Lejre,1,16,Deltid,None,None,1,,Social- og sundhedsassistent,0,"Lokal sundhedsassistent, Sundhedsarbejder, Social- og sundhedsassistent på et botilbud, Social- og sundhedsassistent inden for ældreplejen, Social- og sundhedsassistent inden for sygehusvæsenet, Omsorgshjælper, Social- og sundhedsassistent inden for psykiatrien, 5995, 5996, 5997, 5998",0,0,False,"{'Email': 'sobos@lejre.dk', 'PersonName': 'Sofia Østenby', 'FirstName': 'Sofia', 'LastName': 'Østenby', 'PositionTitle': None, 'PhoneNumbers': [{'Number': '23601596', 'Type': 0, 'Description': 'Primary'}]}",,False,False,False,False,4,28,28,False,False,False,False,False,False,,,,,https://www.lejre.dk/ledige-job/ledige-job/?hr=show-job/235433&linkref=263060&locale=da_DK,False,2025-03-17T09:38:18+01:00,7,/CV/FindWork/GetLogo?JobAdId=e4d5e8e0-2af4-4825-8983-10d2399655f8&Organisation=29188548,"Bøgebakken 1,4320, Lejre",True,False,/CV/Jobseeking/JobLog/CreateJobSearch?JobnetJobPostingIdentifier=e4d5e8e0-2af4-4825-8983-10d2399655f8&Company.Name=Lejre Kommune&SubmissionDeadlineDate=2025-3-17&Title=Social- og sundhedsassistent søges til aftenvagt i Team A&WeeklyWorkTime=2,00000000-0000-0000-0000-000000000000,True,0,,,Social- og sundhedsassistent søges til aftenvagt i Team A,True,,True,2,,e4d5e8e0-2af4-4825-8983-10d2399655f8,,,False,False,,0,False,Lejre Kommune,Bøgebakken 1,,,4320,False,False,False,Lejre,Sofia Østenby,23601596,sobos@lejre.dk,,,,,False,,2025-03-17T09:38:18+01:00,,0,False,0,,,,,0,,,,False,False,,,False,False,,,,False,,False,(28 timer ugentligt),,Arbejdspladsen ligger i Lejre kommune,False,Lejre Kommune,,None,,False,False,"Er du passioneret omkring at skabe de bedste rammer for vores beboere med fokus på hygge og aktiviteter? Ønsker du at arbejde ud fra et personcentreret omsorgsperspektiv? Så læs videre!

Vi søger en engageret og faglig kollega, der vil medvirke til at Bøgebakken forbliver et godt sted at bo for vores beboere og tager medansvar for at skabe en fagli","""Er du passioneret omkring at skabe de bedste rammer for vores beboere med fokus på hygge og aktiviteter? Ønsker du at arbejde ud fra et personcentreret omsorgsperspektiv? Så læs videre!\n\nVi søger en engageret og faglig kollega, der vil medvirke til at Bøgebakken forbliver et godt sted at bo for vores beboere og tager medansvar for at skabe en fagli""","""Social- og sundhedsassistent søges til aftenvagt i Team A""","https://www.google.dk/maps/dir//Bøgebakken+1,4320,+Lejre/","Er du passioneret omkring at skabe de bedste rammer for vores beboere med fokus på hygge og aktiviteter? Ønsker du at arbejde ud fra et personcentreret omsorgsperspektiv? Så læs videre! 
 Vi søger en engageret og faglig kollega, der vil medvirke til at Bøgebakken forbliver et godt sted at bo for vores beboere og tager medansvar for at skabe en faglig og hyggelig arbejdsplads. . 
 Om jobbet 
 Bøgebakken er bygget op omkring plejeprincipperne i Leve- og Bo-konceptet, hvor beboernes hverdag er i centrum med udgangspunkt i den enkeltes behov og ressourcer. 
 Din aftenvagt vil byde på hygge, nærvær, personlig pleje samt praktiske opgaver. Vi og beboerne elsker for eksempel duften af hjemmelavet mad, hvorfor vi selv tilbereder det varme måltid i enheden ud fra en menu planlagt i samarbejde med beboerne og med støtte fra vores ernæringsfaglige konsulent. 
 Vi arbejder med personcentreret omsorg og stræber efter høj faglig kvalitet med fokus på sparring og læring på tværs af plejehjemmets huse. Bøgebakken består af flere faggrupper, herunder social- og sundhedshjælpere, social- og sundhedsassistenter, sygeplejersker, en farmakonom samt en ernæringsfaglig konsulent. Dette bidrager til et stærkt tværfagligt fællesskab, som kommer både beboere og ansatte til gode. 
 Vi prioriterer kompetenceudvikling højt, og du vil opleve, at alle dine kompetencer bliver anvendt, både inden for det sundhedsfaglige og socialpædagogiske felt. Udover daglige sparringer på morgen- og triagemøder har vi månedlige SSA/sygeplejerske- møder med faste emner i et årshjul. Derudover har vi et tæt samarbejde med kommunens demenskoordinatorer og forflytningskoordinator. 
 Om dig 
 Faglige kvalifikationer: 
 
 Uddannet social- og sundhedsassistent Viden, erfaring og interesse for almen somatik, gerontologi og demens er en fordel. 
 Kendskab til at arbejde med beboere gennem en socialpædagogisk tilgang, så de kan leve et værdigt liv i trygge omgivelser. 
 Evne til at indgå i professionelle relationer med beboere og deres pårørende og skabe en oplevelse af nærvær. 
 Gode kommunikationsevner til at formidle viden og erfaringer til kollegaer. 
 Ønske om at prioritere tværfagligt samarbejde, så tilgangen til beboerne afhænger af deres behov. 
 Rollemodel for elever og kollegaer ved at styrke fællesskabet omkring opgaver. 
 
  Personlige kvalifikationer: 
 
 Overblik og medmenneskelighed, som udtrykkes gennem din faglighed både overfor beboere og pårørende. 
 Kreativ og fleksibel tilgang til at skabe en god hverdag for vores beboere. 
 Bringer godt humør til teamet og beboerne. 
 Gode samarbejdsevner 
 
 Om os 
 Bøgebakken er et nyere plejehjem beliggende i naturskønne omgivelser i Allerslev, Lejre Kommune, tæt på Lejre Station (10 minutters gang). 10 minutter i bil fra Roskilde, 27 minutter i bil fra Holbæk, 20 minutter i bil fra Høje-Taastrup. Bøgebakken har 7 huse fordelt på matriklen. 2 af husene er skærmede enheder, og 3 af husene rummer også midlertidige pladser. 
 
Du vil blive ansat i et team med 14 permanente boliger og 5 midlertidige pladser men vil primært være tilknyttet et hus med 7 permanente boliger og 3 midligertidige pladser.  
 Løn og ansættelse 
  Lyder det som noget for dig, så tøv ikke med at ansøge. Du er også velkommen til at ringe eller komme ud og besøge os, vi viser gerne vores skønne arbejdsplads frem. 
 Ansættelse pr. 01.03.2025. Stillingen er på 28 timer om ugen med weekendvagt hver 2. weekend. Vi afholder samtaler løbende og ansætter, når vi finder det rette match. 
 Du vil blive ansat efter gældende overenskomst og principperne i ”ny løn”. 
 Har du spørgsmål omkring stillingen, er du velkommen til at kontakte teamleder Sofia Østenby på telefon 23601596.","https://www.google.dk/maps/place/Bøgebakken+1,4320,+Lejre/",29188548,False,False,,False
