summary_AutomatchType,summary_Abroad,summary_Weight,summary_Title,summary_JobHeadline,summary_Presentation,summary_HiringOrgName,summary_WorkPlaceAddress,summary_WorkPlacePostalCode,summary_WorkPlaceCity,summary_WorkPlaceOtherAddress,summary_WorkPlaceAbroad,summary_WorkPlaceNotStatic,summary_UseWorkPlaceAddressForJoblog,summary_PostingCreated,summary_LastDateApplication,summary_FormattedLastDateApplication,summary_AssignmentStartDate,summary_IsHotjob,summary_IsExternal,summary_Url,summary_Region,summary_Municipality,summary_Country,summary_PostalCode,summary_PostalCodeName,summary_JobAnnouncementType,summary_EmploymentType,summary_WorkHours,summary_OccupationArea,summary_OccupationGroup,summary_Occupation,summary_Location_Latitude,summary_Location_Longitude,summary_JoblogWorkTime_WorkHour,summary_JoblogWorkTime_DailyWorkTime,summary_WorkplaceID,summary_OrganisationId,summary_HiringOrgCVR,summary_UserLoggedIn,summary_AnonymousEmployer,summary_ShareUrl,summary_DetailsUrl,summary_JobLogUrl,summary_HasLocationValues,summary_ID,summary_Latitude,summary_Longitude,details_WorkSchedule,details_WorkConditions,details_EmploymentTypes,details_WorkPlace_Name,details_WorkPlace_Address_AddressLine,details_WorkPlace_Address_Country_Id,details_WorkPlace_Address_Country_Name,details_WorkPlace_Address_Municipality_Id,details_WorkPlace_Address_Municipality_Name,details_WorkPlace_Address_Region_Id,details_WorkPlace_Address_Region_Name,details_WorkPlace_Address_PostalCode,details_WorkPlace_Address_City,details_WorkPlace_PhoneNumber_Number,details_WorkPlace_PhoneNumber_Type,details_WorkPlace_PhoneNumber_Description,details_WorkPlace_FaxNumber,details_WorkPlace_Email,details_WorkPlace_WebAddress,details_WorkPlace_Description,details_WorkPlace_Logo,details_WorkPlace_WorkPlaceOrganizationNumber,details_WorkPlace_OrganizationNumber,details_WorkPlace_OrganizationDescription,details_JobPositionPosting_Id,details_JobPositionPosting_HiringOrg_Name,details_JobPositionPosting_HiringOrg_Address_AddressLine,details_JobPositionPosting_HiringOrg_Address_Country_Id,details_JobPositionPosting_HiringOrg_Address_Country_Name,details_JobPositionPosting_HiringOrg_Address_Municipality_Id,details_JobPositionPosting_HiringOrg_Address_Municipality_Name,details_JobPositionPosting_HiringOrg_Address_Region_Id,details_JobPositionPosting_HiringOrg_Address_Region_Name,details_JobPositionPosting_HiringOrg_Address_PostalCode,details_JobPositionPosting_HiringOrg_Address_City,details_JobPositionPosting_HiringOrg_PhoneNumber_Number,details_JobPositionPosting_HiringOrg_PhoneNumber_Type,details_JobPositionPosting_HiringOrg_PhoneNumber_Description,details_JobPositionPosting_HiringOrg_FaxNumber,details_JobPositionPosting_HiringOrg_Email,details_JobPositionPosting_HiringOrg_WebAddress,details_JobPositionPosting_HiringOrg_Description,details_JobPositionPosting_HiringOrg_Logo,details_JobPositionPosting_HiringOrg_WorkPlaceOrganizationNumber,details_JobPositionPosting_HiringOrg_OrganizationNumber,details_JobPositionPosting_HiringOrg_OrganizationDescription,details_JobPositionPosting_RecruitingCompany,details_JobPositionPosting_PublicationStartDate,details_JobPositionPosting_PublicationEndDate,details_JobPositionPosting_JobPositionInformation_PositionTitle,details_JobPositionPosting_JobPositionInformation_Purpose,details_JobPositionPosting_JobPositionInformation_WorkLocation_AddressLine,details_JobPositionPosting_JobPositionInformation_WorkLocation_Country_Id,details_JobPositionPosting_JobPositionInformation_WorkLocation_Country_Name,details_JobPositionPosting_JobPositionInformation_WorkLocation_Municipality_Id,details_JobPositionPosting_JobPositionInformation_WorkLocation_Municipality_Name,details_JobPositionPosting_JobPositionInformation_WorkLocation_Region_Id,details_JobPositionPosting_JobPositionInformation_WorkLocation_Region_Name,details_JobPositionPosting_JobPositionInformation_WorkLocation_PostalCode,details_JobPositionPosting_JobPositionInformation_WorkLocation_City,details_JobPositionPosting_JobPositionInformation_EmploymentType,details_JobPositionPosting_JobPositionInformation_WeeklyWorkHours_TypeId,details_JobPositionPosting_JobPositionInformation_WeeklyWorkHours_TypeName,details_JobPositionPosting_JobPositionInformation_WeeklyWorkHours_Description,details_JobPositionPosting_JobPositionInformation_CompensationDescription,details_JobPositionPosting_JobPositionInformation_NumberToFill,details_JobPositionPosting_JobPositionInformation_DriverLicense,details_JobPositionPosting_JobPositionInformation_Occupation_Name,details_JobPositionPosting_JobPositionInformation_Occupation_DiscoWeb,details_JobPositionPosting_JobPositionInformation_Occupation_AlternateNames,details_JobPositionPosting_JobPositionInformation_Occupation_GroupId,details_JobPositionPosting_JobPositionInformation_Occupation_AreaId,details_JobPositionPosting_JobPositionInformation_IsGovernmentHiring,details_JobPositionPosting_JobPositionInformation_JppContacts,details_JobPositionPosting_JobPositionInformation_EmploymentDate,details_JobPositionPosting_IsRecruitmentOfForeignNationals,details_JobPositionPosting_IsWorkInDenmark,details_JobPositionPosting_IsAnonymousEmployer,details_JobPositionPosting_IsDisabilityFriendly,details_JobPositionPosting_JppType,details_JobPositionPosting_ApplicationDetails_WorkHourMax,details_JobPositionPosting_ApplicationDetails_WorkHourMin,details_JobPositionPosting_ApplicationDetails_DailyWorkTimeWeekend,details_JobPositionPosting_ApplicationDetails_DailyWorkTimeNight,details_JobPositionPosting_ApplicationDetails_DailyWorkTimeEvening,details_JobPositionPosting_ApplicationDetails_DailyWorkTimeDay,details_JobPositionPosting_ApplicationDetails_DailyWorkTimeMorning,details_JobPositionPosting_ApplicationDetails_DailyWorkTimeVarious,details_JobPositionPosting_ApplicationDetails_ReferenceText,details_JobPositionPosting_ApplicationDetails_RemarksToApplicant,details_JobPositionPosting_ApplicationDetails_ByEmail,details_JobPositionPosting_ApplicationDetails_ByPhone,details_JobPositionPosting_ApplicationDetails_ApplyViaUrl,details_JobPositionPosting_ApplicationDetails_ReplyInWriting,details_JobPositionPosting_ApplicationDetails_ApplicationDeadlineDate,details_JobPositionPosting_Status,details_LogoUrl,details_Address,details_ShowMap,details_ShowShareButtonJobLog,details_JobLogUrl,details_JobLogTemplateModel_Identifier,details_JobLogTemplateModel_UseWorkPlaceAddressForJoblog,details_JobLogTemplateModel_Category,details_JobLogTemplateModel_CvCustomerIdentifier,details_JobLogTemplateModel_JobSeekingStatus,details_JobLogTemplateModel_Title,details_JobLogTemplateModel_IsApplicationSourceRequired,details_JobLogTemplateModel_ApplicationSource,details_JobLogTemplateModel_IsWeeklyWorkTimeRequired,details_JobLogTemplateModel_WeeklyWorkTime,details_JobLogTemplateModel_HoursPerWeek,details_JobLogTemplateModel_JobnetJobPostingIdentifier,details_JobLogTemplateModel_JobAdDocument_Title,details_JobLogTemplateModel_JobAdDocument_Identifier,details_JobLogTemplateModel_JobAdDocument_IsDeletedBySystem,details_JobLogTemplateModel_JobAdDocument_IsDeletedByUser,details_JobLogTemplateModel_JobAdFile,details_JobLogTemplateModel_Company_JobLogEntryCategory,details_JobLogTemplateModel_Company_ShowAddressFieldsEvenIfEmpty,details_JobLogTemplateModel_Company_Name,details_JobLogTemplateModel_Company_Address,details_JobLogTemplateModel_Company_Country,details_JobLogTemplateModel_Company_EmploymentAreaID,details_JobLogTemplateModel_Company_PostCode,details_JobLogTemplateModel_Company_IsCountryAndTownAndPostCodeEmpty,details_JobLogTemplateModel_Company_IsTownAndPostCodeEmpty,details_JobLogTemplateModel_Company_IsCountryDanmark,details_JobLogTemplateModel_Company_Town,details_JobLogTemplateModel_Company_ContactPerson,details_JobLogTemplateModel_Company_Phone,details_JobLogTemplateModel_Company_Email,details_JobLogTemplateModel_Company_Latitude,details_JobLogTemplateModel_Company_Longitude,details_JobLogTemplateModel_Company_DailyTravelTimeInMinutes,details_JobLogTemplateModel_Company_DistanceToCompanyInMeters,details_JobLogTemplateModel_Company_IsCreateMode,details_JobLogTemplateModel_TypeOfSubmission,details_JobLogTemplateModel_SubmissionDate,details_JobLogTemplateModel_SubmissionDateFormatted,details_JobLogTemplateModel_SubmissionDateTiks,details_JobLogTemplateModel_IsSubmissionDateRequired,details_JobLogTemplateModel_Status,details_JobLogTemplateModel_DateCreatedFormatted,details_JobLogTemplateModel_DateCreated,details_JobLogTemplateModel_DateModifiedFormatted,details_JobLogTemplateModel_DateModified,details_JobLogTemplateModel_LastModifiedDateTiks,details_JobLogTemplateModel_DateClosed,details_JobLogTemplateModel_JobApplicationDocument_Title,details_JobLogTemplateModel_JobApplicationDocument_Identifier,details_JobLogTemplateModel_JobApplicationDocument_IsDeletedBySystem,details_JobLogTemplateModel_JobApplicationDocument_IsDeletedByUser,details_JobLogTemplateModel_CvDocument_Title,details_JobLogTemplateModel_CvDocument_Identifier,details_JobLogTemplateModel_CvDocument_IsDeletedBySystem,details_JobLogTemplateModel_CvDocument_IsDeletedByUser,details_JobLogTemplateModel_JobApplicationFile,details_JobLogTemplateModel_CvFile,details_JobLogTemplateModel_SubmissionDeadlineDate,details_JobLogTemplateModel_IsPersisted,details_JobLogTemplateModel_ServerValidationErrors,details_JobLogTemplateModel_HasServerValidationErrors,details_JoblogWorkTime_WorkHour,details_JoblogWorkTime_DailyWorkTime,details_Place,details_OpenPrintDialog,details_WorkPlaceInfoText,details_JobCenterContactDetails,details_WorkPlaceDescriptionText,details_FavoriteText,details_IsFavorite,details_ShowFavorite,details_MetaOgTextForSharing,details_DescriptionForSharing,details_TitleForSharing,details_RutePlan,details_FormattedPurpose,details_MapUrl,details_OrganizationNumber,details_ShowSearchJobButton,details_ShowPrint,details_BackToFindWorkButtonUrl,isExternal
0,False,1,Systems Engineer (Systems Engineering),Systems Engineer (Systems Engineering),"This role is based in Allerød.
&nbsp;
About UNEEG Medical
UNEEG medical A/S is a dynamic and pioneering company in the field of medical technology. The company is committed to improvi",CAPAX RECRUITMENT ApS,Borupvang 2  ,3450,Allerød,True,False,False,False,2024-12-20T00:00:00,2025-02-14T00:00:00,14. februar 2025,0001-01-01T00:00:00,False,False,https://job.jobnet.dk/CV/FindWork/Details/eab461e6-6a52-48e0-a648-4a3cbba3187e,Hovedstaden og Bornholm,Allerød,Danmark,3450,,Almindelige vilkår,Fastansættelse,Fuldtid,Akademisk arbejde,Ingeniørarbejde,Civilingeniør,55.8661,12.3366,,,1016251875,,33079974,False,False,https://job.jobnet.dk/CV/FindWork/DetailsSocialmedia/eab461e6-6a52-48e0-a648-4a3cbba3187e,https://job.jobnet.dk/CV/FindWork/Details/eab461e6-6a52-48e0-a648-4a3cbba3187e,https://job.jobnet.dk/CV/FindWork/Details/eab461e6-6a52-48e0-a648-4a3cbba3187e,True,eab461e6-6a52-48e0-a648-4a3cbba3187e,55.8661,12.3366,"{'Id': 1, 'Name': 'Fuldtid'}, {'Id': 16, 'Name': 'Deltid'}","{'Id': 1, 'Name': 'Almindelige vilkår'}, {'Id': 2, 'Name': 'Fleksjob'}, {'Id': 3, 'Name': 'Skånejob'}, {'Id': 4, 'Name': 'Egnet til efterlønnere og seniorer'}, {'Id': 5, 'Name': 'Job med løntilskud'}, {'Id': 6, 'Name': 'Rotationsjob'}, {'Id': 7, 'Name': 'Virksomhedspraktik'}","{'Id': 1, 'Name': 'Fastansættelse'}, {'Id': 16, 'Name': 'Tidsbegrænset ansættelse'}",CAPAX RECRUITMENT ApS,Borupvang 2,58,Danmark,201,Allerød,4,"Hovedstaden, Sjælland og Bornholm",3450,Allerød,,0,Primary,,,https://capaxrecruitment.dk/project/systems-engineer-systems-engineering/,None,,1016251875,33079974,None,eab461e6-6a52-48e0-a648-4a3cbba3187e,CAPAX RECRUITMENT ApS,Borupvang 2,58,Danmark,201,Allerød,4,"Hovedstaden, Sjælland og Bornholm",3450,Allerød,,0,Primary,,,https://capaxrecruitment.dk/project/systems-engineer-systems-engineering/,None,,1016251875,33079974,None,,2024-12-20T00:00:00+01:00,2025-02-14T11:09:00+01:00,Systems Engineer (Systems Engineering),"This role is based in Allerød. 
   
About UNEEG Medical
 UNEEG medical A/S is a dynamic and pioneering company in the field of medical technology. The company is committed to improving the quality of life for epilepsy patients through innovative solutions that revolutionize epilepsy treatment. 
 UNEEG medical’s mission is to enable continuous measurement and collection of EEG data 24/7, providing patients and healthcare professionals with deeper insights into the brain. These insights can enhance patient care by optimizing the treatment and management of epileptic seizures. UNEEG medical is at the forefront of cognitive technologies for monitoring and analyzing EEG data, with a strong presence in the European market and preparations for expansion into the USA. 
 With headquarters in Allerød, Denmark, UNEEG medical employs around 70 dedicated professionals across Europe. As part of this family-owned company, you’ll have the opportunity to contribute to the development and marketing of groundbreaking solutions for epilepsy patients while being part of a unique and innovative culture. 
About the department
 As a Systems Engineer at UNEEG, you will be part of the Systems Engineering team, focusing on product-level engineering. The team consists of three Systems Engineers, and you will play a key role in driving decisions and developments within the department. You will collaborate with various internal stakeholders, including regulatory affairs, software/hardware engineers, project managers, and clinical affairs. The role is truly cross-functional, and you will be involved in multiple projects while contributing to the team’s efforts to achieve FDA approval and expand into the U.S. market. Your structured, holistic mindset will be key to maintaining high standards and well-organized processes. 
About the position
 UNEEG medical is looking for a Systems Engineer to take a broad, central role in medical device projects at the product level. Depending on your specific competencies, you will be responsible for various aspects of the product development process, such as creating key product documentation, including design inputs/outputs, verification plans, design validation, and risk management files. The Systems Engineering team is responsible for the design control process, and you will support internal stakeholders in applying these principles effectively. This role offers an exciting opportunity to work across multiple product lines and contribute to both the development and maintenance of cutting-edge medical technology solutions. 
Responsibilities
 
 Product Documentation:  Develop and manage product documentation such as design input/outputs, verification and validation plans, tests, and risk management files. 
 Design Control:  Ensure compliance with design control processes while supporting internal stakeholders in adhering to these principles throughout product development. 
 FDA Approval:  Play a key role in the effort to obtain FDA approval for UNEEG’s systems. Ensure that the necessary documentation, tests, usability tests, and protocols are in place to meet FDA requirements. 
 Cross-Functional Collaboration:  Collaborate closely with internal teams, supporting product development and ensuring that the systems meet both technical and regulatory requirements. 
 Continuous Improvement:  Contribute to maintaining and improving existing systems to ensure that UNEEG’s solutions remain at the forefront of medical technology. 
 
Qualifications
 
 Proven experience in systems engineering within the medical device industry. 
 Strong understanding of medical device lifecycle management and technical documentation. 
 Familiarity with creating and managing product documentation such as design inputs/outputs, verification and validation plans, and risk management files. 
 Experience in working towards FDA approval and understanding the necessary processes and requirements. 
 Ability to support internal stakeholders in applying design control principles effectively. 
 A collaborative, proactive mindset with a focus on finding practical solutions to technical challenges. 
 
 Are you ready to join a pioneering company that is transforming epilepsy treatment and improving patient care? 
 Join the UNEEG Team 
 If you are interested in this opportunity and to contribute to the development of cutting-edge medical technology and make an impact in the lives of epilepsy patients, UNEEG medical offers a dynamic and supportive environment for you to thrive.  
 Apply today to take the next step in your career as a Systems Engineer at UNEEG medical. 
 Capax Recruitment is assisting UNEEG Medical in this recruitment. For further information please contact Vjollca Muaremi vmu@capax.dk.",Borupvang 2,58,Danmark,201,Allerød,4,"Hovedstaden, Sjælland og Bornholm",3450,Allerød,1,1,Fuldtid,None,None,1,,Civilingeniør,0,"Sikkerheds- og risikostyringsingeniør, Robotingeniør, Patentingeniør, Optikingeniør, Lydingeniør, Logistikingeniør, Kontraktingeniør, Idriftsættelsesingeniør, Geoteknisk ingeniør, Forskningsingeniør, Designingeniør, Civilingeniør i bæredygtig energi, Boreingeniør, Bioingeniør, Beregningsingeniør, Atomkraftingeniør, Applikationsingeniør, Vindenergiingeniør, Vedligeholdelsesingeniør, Termodynamikingeniør, Systemingeniør inden for energiforsyning, Ingeniør, design og innovation, 1066, 1067, 1068, 1069, 1070, 1071",0,0,False,,,True,True,False,False,4,,,False,False,False,False,False,False,,,,,https://capaxrecruitment.dk/project/systems-engineer-systems-engineering/,False,2025-02-14T00:00:00+01:00,7,/CV/FindWork/GetLogo?JobAdId=eab461e6-6a52-48e0-a648-4a3cbba3187e&Organisation=33079974,"Borupvang 2,3450, Allerød",True,False,/CV/Jobseeking/JobLog/CreateJobSearch?JobnetJobPostingIdentifier=eab461e6-6a52-48e0-a648-4a3cbba3187e&Company.Name=CAPAX RECRUITMENT ApS&SubmissionDeadlineDate=2025-2-14&Title=Systems Engineer (Systems Engineering)&WeeklyWorkTime=1,00000000-0000-0000-0000-000000000000,False,0,,,Systems Engineer (Systems Engineering),True,,True,1,,eab461e6-6a52-48e0-a648-4a3cbba3187e,,,False,False,,0,False,CAPAX RECRUITMENT ApS,Borupvang 2,,,3450,False,False,False,Allerød,,,,,,,,False,,2025-02-14T00:00:00+01:00,,0,False,0,,,,,0,,,,False,False,,,False,False,,,,False,,False,,,Arbejdspladsen ligger i Allerød kommune,False,CAPAX RECRUITMENT ApS,,None,,False,False,"This role is based in Allerød.

About UNEEG Medical
UNEEG medical A/S is a dynamic and pioneering company in the field of medical technology. The company is committed to improving the quality of life for epilepsy patients through innovative solutions that revolutionize epilepsy treatment.
UNEEG medical’s mission is to enable continuous measurement ","""This role is based in Allerød.\n\nAbout UNEEG Medical\nUNEEG medical A/S is a dynamic and pioneering company in the field of medical technology. The company is committed to improving the quality of life for epilepsy patients through innovative solutions that revolutionize epilepsy treatment.\nUNEEG medical’s mission is to enable continuous measurement ""","""Systems Engineer (Systems Engineering)""","https://www.google.dk/maps/dir//Borupvang+2,3450,+Allerød/","This role is based in Allerød. 
   
About UNEEG Medical
 UNEEG medical A/S is a dynamic and pioneering company in the field of medical technology. The company is committed to improving the quality of life for epilepsy patients through innovative solutions that revolutionize epilepsy treatment. 
 UNEEG medical’s mission is to enable continuous measurement and collection of EEG data 24/7, providing patients and healthcare professionals with deeper insights into the brain. These insights can enhance patient care by optimizing the treatment and management of epileptic seizures. UNEEG medical is at the forefront of cognitive technologies for monitoring and analyzing EEG data, with a strong presence in the European market and preparations for expansion into the USA. 
 With headquarters in Allerød, Denmark, UNEEG medical employs around 70 dedicated professionals across Europe. As part of this family-owned company, you’ll have the opportunity to contribute to the development and marketing of groundbreaking solutions for epilepsy patients while being part of a unique and innovative culture. 
About the department
 As a Systems Engineer at UNEEG, you will be part of the Systems Engineering team, focusing on product-level engineering. The team consists of three Systems Engineers, and you will play a key role in driving decisions and developments within the department. You will collaborate with various internal stakeholders, including regulatory affairs, software/hardware engineers, project managers, and clinical affairs. The role is truly cross-functional, and you will be involved in multiple projects while contributing to the team’s efforts to achieve FDA approval and expand into the U.S. market. Your structured, holistic mindset will be key to maintaining high standards and well-organized processes. 
About the position
 UNEEG medical is looking for a Systems Engineer to take a broad, central role in medical device projects at the product level. Depending on your specific competencies, you will be responsible for various aspects of the product development process, such as creating key product documentation, including design inputs/outputs, verification plans, design validation, and risk management files. The Systems Engineering team is responsible for the design control process, and you will support internal stakeholders in applying these principles effectively. This role offers an exciting opportunity to work across multiple product lines and contribute to both the development and maintenance of cutting-edge medical technology solutions. 
Responsibilities
 
 Product Documentation:  Develop and manage product documentation such as design input/outputs, verification and validation plans, tests, and risk management files. 
 Design Control:  Ensure compliance with design control processes while supporting internal stakeholders in adhering to these principles throughout product development. 
 FDA Approval:  Play a key role in the effort to obtain FDA approval for UNEEG’s systems. Ensure that the necessary documentation, tests, usability tests, and protocols are in place to meet FDA requirements. 
 Cross-Functional Collaboration:  Collaborate closely with internal teams, supporting product development and ensuring that the systems meet both technical and regulatory requirements. 
 Continuous Improvement:  Contribute to maintaining and improving existing systems to ensure that UNEEG’s solutions remain at the forefront of medical technology. 
 
Qualifications
 
 Proven experience in systems engineering within the medical device industry. 
 Strong understanding of medical device lifecycle management and technical documentation. 
 Familiarity with creating and managing product documentation such as design inputs/outputs, verification and validation plans, and risk management files. 
 Experience in working towards FDA approval and understanding the necessary processes and requirements. 
 Ability to support internal stakeholders in applying design control principles effectively. 
 A collaborative, proactive mindset with a focus on finding practical solutions to technical challenges. 
 
 Are you ready to join a pioneering company that is transforming epilepsy treatment and improving patient care? 
 Join the UNEEG Team 
 If you are interested in this opportunity and to contribute to the development of cutting-edge medical technology and make an impact in the lives of epilepsy patients, UNEEG medical offers a dynamic and supportive environment for you to thrive.  
 Apply today to take the next step in your career as a Systems Engineer at UNEEG medical. 
 Capax Recruitment is assisting UNEEG Medical in this recruitment. For further information please contact Vjollca Muaremi vmu@capax.dk.","https://www.google.dk/maps/place/Borupvang+2,3450,+Allerød/",33079974,False,False,,False
