summary_AutomatchType,summary_Abroad,summary_Weight,summary_Title,summary_JobHeadline,summary_Presentation,summary_HiringOrgName,summary_WorkPlaceAddress,summary_WorkPlacePostalCode,summary_WorkPlaceCity,summary_WorkPlaceOtherAddress,summary_WorkPlaceAbroad,summary_WorkPlaceNotStatic,summary_UseWorkPlaceAddressForJoblog,summary_PostingCreated,summary_LastDateApplication,summary_FormattedLastDateApplication,summary_AssignmentStartDate,summary_IsHotjob,summary_IsExternal,summary_Url,summary_Region,summary_Municipality,summary_Country,summary_PostalCode,summary_PostalCodeName,summary_JobAnnouncementType,summary_EmploymentType,summary_WorkHours,summary_OccupationArea,summary_OccupationGroup,summary_Occupation,summary_Location_Latitude,summary_Location_Longitude,summary_JoblogWorkTime_WorkHour,summary_JoblogWorkTime_DailyWorkTime,summary_WorkplaceID,summary_OrganisationId,summary_HiringOrgCVR,summary_UserLoggedIn,summary_AnonymousEmployer,summary_ShareUrl,summary_DetailsUrl,summary_JobLogUrl,summary_HasLocationValues,summary_ID,summary_Latitude,summary_Longitude,details_WorkSchedule,details_WorkConditions,details_EmploymentTypes,details_WorkPlace_Name,details_WorkPlace_Address_AddressLine,details_WorkPlace_Address_Country_Id,details_WorkPlace_Address_Country_Name,details_WorkPlace_Address_Municipality_Id,details_WorkPlace_Address_Municipality_Name,details_WorkPlace_Address_Region_Id,details_WorkPlace_Address_Region_Name,details_WorkPlace_Address_PostalCode,details_WorkPlace_Address_City,details_WorkPlace_PhoneNumber_Number,details_WorkPlace_PhoneNumber_Type,details_WorkPlace_PhoneNumber_Description,details_WorkPlace_FaxNumber,details_WorkPlace_Email,details_WorkPlace_WebAddress,details_WorkPlace_Description,details_WorkPlace_Logo,details_WorkPlace_WorkPlaceOrganizationNumber,details_WorkPlace_OrganizationNumber,details_WorkPlace_OrganizationDescription,details_JobPositionPosting_Id,details_JobPositionPosting_HiringOrg_Name,details_JobPositionPosting_HiringOrg_Address_AddressLine,details_JobPositionPosting_HiringOrg_Address_Country_Id,details_JobPositionPosting_HiringOrg_Address_Country_Name,details_JobPositionPosting_HiringOrg_Address_Municipality_Id,details_JobPositionPosting_HiringOrg_Address_Municipality_Name,details_JobPositionPosting_HiringOrg_Address_Region_Id,details_JobPositionPosting_HiringOrg_Address_Region_Name,details_JobPositionPosting_HiringOrg_Address_PostalCode,details_JobPositionPosting_HiringOrg_Address_City,details_JobPositionPosting_HiringOrg_PhoneNumber_Number,details_JobPositionPosting_HiringOrg_PhoneNumber_Type,details_JobPositionPosting_HiringOrg_PhoneNumber_Description,details_JobPositionPosting_HiringOrg_FaxNumber,details_JobPositionPosting_HiringOrg_Email,details_JobPositionPosting_HiringOrg_WebAddress,details_JobPositionPosting_HiringOrg_Description,details_JobPositionPosting_HiringOrg_Logo,details_JobPositionPosting_HiringOrg_WorkPlaceOrganizationNumber,details_JobPositionPosting_HiringOrg_OrganizationNumber,details_JobPositionPosting_HiringOrg_OrganizationDescription,details_JobPositionPosting_RecruitingCompany,details_JobPositionPosting_PublicationStartDate,details_JobPositionPosting_PublicationEndDate,details_JobPositionPosting_JobPositionInformation_PositionTitle,details_JobPositionPosting_JobPositionInformation_Purpose,details_JobPositionPosting_JobPositionInformation_WorkLocation_AddressLine,details_JobPositionPosting_JobPositionInformation_WorkLocation_Country_Id,details_JobPositionPosting_JobPositionInformation_WorkLocation_Country_Name,details_JobPositionPosting_JobPositionInformation_WorkLocation_Municipality_Id,details_JobPositionPosting_JobPositionInformation_WorkLocation_Municipality_Name,details_JobPositionPosting_JobPositionInformation_WorkLocation_Region_Id,details_JobPositionPosting_JobPositionInformation_WorkLocation_Region_Name,details_JobPositionPosting_JobPositionInformation_WorkLocation_PostalCode,details_JobPositionPosting_JobPositionInformation_WorkLocation_City,details_JobPositionPosting_JobPositionInformation_EmploymentType,details_JobPositionPosting_JobPositionInformation_WeeklyWorkHours_TypeId,details_JobPositionPosting_JobPositionInformation_WeeklyWorkHours_TypeName,details_JobPositionPosting_JobPositionInformation_WeeklyWorkHours_Description,details_JobPositionPosting_JobPositionInformation_CompensationDescription,details_JobPositionPosting_JobPositionInformation_NumberToFill,details_JobPositionPosting_JobPositionInformation_DriverLicense,details_JobPositionPosting_JobPositionInformation_Occupation_Name,details_JobPositionPosting_JobPositionInformation_Occupation_DiscoWeb,details_JobPositionPosting_JobPositionInformation_Occupation_AlternateNames,details_JobPositionPosting_JobPositionInformation_Occupation_GroupId,details_JobPositionPosting_JobPositionInformation_Occupation_AreaId,details_JobPositionPosting_JobPositionInformation_IsGovernmentHiring,details_JobPositionPosting_JobPositionInformation_JppContacts,details_JobPositionPosting_JobPositionInformation_EmploymentDate,details_JobPositionPosting_IsRecruitmentOfForeignNationals,details_JobPositionPosting_IsWorkInDenmark,details_JobPositionPosting_IsAnonymousEmployer,details_JobPositionPosting_IsDisabilityFriendly,details_JobPositionPosting_JppType,details_JobPositionPosting_ApplicationDetails_WorkHourMax,details_JobPositionPosting_ApplicationDetails_WorkHourMin,details_JobPositionPosting_ApplicationDetails_DailyWorkTimeWeekend,details_JobPositionPosting_ApplicationDetails_DailyWorkTimeNight,details_JobPositionPosting_ApplicationDetails_DailyWorkTimeEvening,details_JobPositionPosting_ApplicationDetails_DailyWorkTimeDay,details_JobPositionPosting_ApplicationDetails_DailyWorkTimeMorning,details_JobPositionPosting_ApplicationDetails_DailyWorkTimeVarious,details_JobPositionPosting_ApplicationDetails_ReferenceText,details_JobPositionPosting_ApplicationDetails_RemarksToApplicant,details_JobPositionPosting_ApplicationDetails_ByEmail,details_JobPositionPosting_ApplicationDetails_ByPhone,details_JobPositionPosting_ApplicationDetails_ApplyViaUrl,details_JobPositionPosting_ApplicationDetails_ReplyInWriting,details_JobPositionPosting_ApplicationDetails_ApplicationDeadlineDate,details_JobPositionPosting_Status,details_LogoUrl,details_Address,details_ShowMap,details_ShowShareButtonJobLog,details_JobLogUrl,details_JobLogTemplateModel_Identifier,details_JobLogTemplateModel_UseWorkPlaceAddressForJoblog,details_JobLogTemplateModel_Category,details_JobLogTemplateModel_CvCustomerIdentifier,details_JobLogTemplateModel_JobSeekingStatus,details_JobLogTemplateModel_Title,details_JobLogTemplateModel_IsApplicationSourceRequired,details_JobLogTemplateModel_ApplicationSource,details_JobLogTemplateModel_IsWeeklyWorkTimeRequired,details_JobLogTemplateModel_WeeklyWorkTime,details_JobLogTemplateModel_HoursPerWeek,details_JobLogTemplateModel_JobnetJobPostingIdentifier,details_JobLogTemplateModel_JobAdDocument_Title,details_JobLogTemplateModel_JobAdDocument_Identifier,details_JobLogTemplateModel_JobAdDocument_IsDeletedBySystem,details_JobLogTemplateModel_JobAdDocument_IsDeletedByUser,details_JobLogTemplateModel_JobAdFile,details_JobLogTemplateModel_Company_JobLogEntryCategory,details_JobLogTemplateModel_Company_ShowAddressFieldsEvenIfEmpty,details_JobLogTemplateModel_Company_Name,details_JobLogTemplateModel_Company_Address,details_JobLogTemplateModel_Company_Country,details_JobLogTemplateModel_Company_EmploymentAreaID,details_JobLogTemplateModel_Company_PostCode,details_JobLogTemplateModel_Company_IsCountryAndTownAndPostCodeEmpty,details_JobLogTemplateModel_Company_IsTownAndPostCodeEmpty,details_JobLogTemplateModel_Company_IsCountryDanmark,details_JobLogTemplateModel_Company_Town,details_JobLogTemplateModel_Company_ContactPerson,details_JobLogTemplateModel_Company_Phone,details_JobLogTemplateModel_Company_Email,details_JobLogTemplateModel_Company_Latitude,details_JobLogTemplateModel_Company_Longitude,details_JobLogTemplateModel_Company_DailyTravelTimeInMinutes,details_JobLogTemplateModel_Company_DistanceToCompanyInMeters,details_JobLogTemplateModel_Company_IsCreateMode,details_JobLogTemplateModel_TypeOfSubmission,details_JobLogTemplateModel_SubmissionDate,details_JobLogTemplateModel_SubmissionDateFormatted,details_JobLogTemplateModel_SubmissionDateTiks,details_JobLogTemplateModel_IsSubmissionDateRequired,details_JobLogTemplateModel_Status,details_JobLogTemplateModel_DateCreatedFormatted,details_JobLogTemplateModel_DateCreated,details_JobLogTemplateModel_DateModifiedFormatted,details_JobLogTemplateModel_DateModified,details_JobLogTemplateModel_LastModifiedDateTiks,details_JobLogTemplateModel_DateClosed,details_JobLogTemplateModel_JobApplicationDocument_Title,details_JobLogTemplateModel_JobApplicationDocument_Identifier,details_JobLogTemplateModel_JobApplicationDocument_IsDeletedBySystem,details_JobLogTemplateModel_JobApplicationDocument_IsDeletedByUser,details_JobLogTemplateModel_CvDocument_Title,details_JobLogTemplateModel_CvDocument_Identifier,details_JobLogTemplateModel_CvDocument_IsDeletedBySystem,details_JobLogTemplateModel_CvDocument_IsDeletedByUser,details_JobLogTemplateModel_JobApplicationFile,details_JobLogTemplateModel_CvFile,details_JobLogTemplateModel_SubmissionDeadlineDate,details_JobLogTemplateModel_IsPersisted,details_JobLogTemplateModel_ServerValidationErrors,details_JobLogTemplateModel_HasServerValidationErrors,details_JoblogWorkTime_WorkHour,details_JoblogWorkTime_DailyWorkTime,details_Place,details_OpenPrintDialog,details_WorkPlaceInfoText,details_JobCenterContactDetails,details_WorkPlaceDescriptionText,details_FavoriteText,details_IsFavorite,details_ShowFavorite,details_MetaOgTextForSharing,details_DescriptionForSharing,details_TitleForSharing,details_RutePlan,details_FormattedPurpose,details_MapUrl,details_OrganizationNumber,details_ShowSearchJobButton,details_ShowPrint,details_BackToFindWorkButtonUrl,isExternal
0,False,1,Faste timelærere til socialrådgiveruddannelsen,Faste timelærere til socialrådgiveruddannelsen,Vi søger flere timelærere til socialrådgiveruddannelsen på Professionshøjskolen Absalon. Har du juridisk erfaring fra den socialfaglige praksis og indsigt i socialrådgiveruddannelsens opbygning? Så er,"Professionshøjskolen Absalon, Campus Slagelse",Sdr.Stationsvej 30  ,4000,Roskilde,True,False,False,False,2025-02-06T09:52:24,2025-02-20T23:59:59,20. februar 2025,0001-01-01T00:00:00,False,False,https://job.jobnet.dk/CV/FindWork/Details/eac3bf30-9f62-4578-b24d-be090277b254,Øvrige Sjælland,Roskilde,Danmark,4000,,Almindelige vilkår,Fastansættelse,Fuldtid,Akademisk arbejde,Juridisk arbejde,Jurist,55.6565,12.0637,,,1013714653,,30874323,False,False,https://job.jobnet.dk/CV/FindWork/DetailsSocialmedia/eac3bf30-9f62-4578-b24d-be090277b254,https://job.jobnet.dk/CV/FindWork/Details/eac3bf30-9f62-4578-b24d-be090277b254,https://job.jobnet.dk/CV/FindWork/Details/eac3bf30-9f62-4578-b24d-be090277b254,True,eac3bf30-9f62-4578-b24d-be090277b254,55.6565,12.0637,"{'Id': 1, 'Name': 'Fuldtid'}, {'Id': 16, 'Name': 'Deltid'}","{'Id': 1, 'Name': 'Almindelige vilkår'}, {'Id': 2, 'Name': 'Fleksjob'}, {'Id': 3, 'Name': 'Skånejob'}, {'Id': 4, 'Name': 'Egnet til efterlønnere og seniorer'}, {'Id': 5, 'Name': 'Job med løntilskud'}, {'Id': 6, 'Name': 'Rotationsjob'}, {'Id': 7, 'Name': 'Virksomhedspraktik'}","{'Id': 1, 'Name': 'Fastansættelse'}, {'Id': 16, 'Name': 'Tidsbegrænset ansættelse'}","Professionshøjskolen Absalon, Campus Slagelse",Sdr.Stationsvej 30,58,Danmark,265,Roskilde,4,"Hovedstaden, Sjælland og Bornholm",4000,Roskilde,,0,Primary,,,https://candidate.hr-manager.net/ApplicationForm/SinglePageApplicationForm.aspx?cid=5001&departmentId=7794&ProjectId=186445&MediaId=5,None,,1013714653,30874323,None,eac3bf30-9f62-4578-b24d-be090277b254,"Professionshøjskolen Absalon, Campus Slagelse",Sdr.Stationsvej 30,58,Danmark,265,Roskilde,4,"Hovedstaden, Sjælland og Bornholm",4000,Roskilde,,0,Primary,,,https://candidate.hr-manager.net/ApplicationForm/SinglePageApplicationForm.aspx?cid=5001&departmentId=7794&ProjectId=186445&MediaId=5,None,,1013714653,30874323,None,,2025-02-06T09:52:24+01:00,2025-02-20T23:59:59+01:00,Faste timelærere til socialrådgiveruddannelsen,"Vi søger flere timelærere til socialrådgiveruddannelsen på Professionshøjskolen Absalon. Har du juridisk erfaring fra den socialfaglige praksis og indsigt i socialrådgiveruddannelsens opbygning? Så er det måske dig, vi søger til Center for Socialt Arbejde.  
 
 På Professionshøjskolen Absalon er det vores ambition, at de studerende oplever en fagligt og socialt inkluderende studiestart, hvor de med det samme kan mærke deres kommende profession, uddannelse og studieliv. De bliver trænet i en professionel tilgang til arbejdet i studiegrupper, så de bliver bedst muligt rustet til deres kommende arbejdsliv. Vi ønsker at tilrettelægge et uddannelsesforløb, der giver de studerende de bedste forudsætninger og det bedste vidensgrundlag. Derfor er vi meget optaget af at finde dygtige og motiverende undervisere, som både har teoretisk og praktisk erfaring med det sociale arbejde.  
 
 Læs mere om Absalons vision, mission og uddannelsesambition her (https://chrome-extension/efaidnbmnnnibpcajpcglclefindmkaj/https:/a-net.pha.dk/system/files/2022-01/strategi-2025.pdf).  
 
 Din profil 
 
 Du er opdateret inden for det juridiske felt i relation til socialt arbejde og har flere års praksiserfaring, som du er god til at anvende via kobling mellem teori og praksis i din undervisning. Derudover er det vigtigt, at du kan genkende dig selv i følgende:  
 
 Praksiserfaring. 
 Du kommer måske fra beskæftigelsesområdet eller det specialiserede voksenområde, fx som juridisk ekspert/ borgerrådgiver i kommunalt regi, og så har du stort kendskab og erfaring med de retssikkerhedsmæssige og forvaltningsmæssige lovområder i praksis.  
 
 Du er samarbejdsdygtig. 
 Dit positive humør smitter af på dine omgivelser, også i travle perioder. Du er god til at samarbejde og sparre med dine kolleger, og du har et åbent og imødekommende syn på din arbejdsplads, dine kolleger og dine arbejdsopgaver.  
 
 Som underviser kan du få dine budskaber ud til alle de studerende, både mundtligt og skriftligt. Du er tålmodig og forstående som menneske og er klar på at udvikle og forandre eventuelle processer eller undervisning.  
 
 Du evner at have mange bolde i luften. 
 Du formår at holde hovedet koldt i situationer, hvor der er mange opgaver, og når der opstår uforudsete ændringer. Du er samtidig klar til at komme med et bud på, hvordan en given situation kan løses bedst muligt.  
 
 Derudover forventer vi os, at du: 
 
 er uddannet jurist eller cand.soc.jur.  
 
 
 Dine arbejdsopgaver 
 
 Din primære opgave er at undervise fremtidens socialrådgivere. Nærmere bestemt består dine arbejdsopgaver af:  
 
 At udvikle, planlægge og undervise på grunduddannelsen i det juridiske område.  
 Det sker i tæt sammenspil med dine teamkolleger, studerende og i samarbejde med såvel interne som eksterne partnere og aftagere. 
 
 At bidrage til et aktivt og spændende studiesocialt miljø. 
 Vi lægger vægt på, at vores studiemiljøer er præget af socialt liv og af glade og engagerede studerende, der kan få kompetent sparring og støtte både i studiegrupper og fra deres vejledere. I din rolle som timelærer bidrager du aktivt til, at de studerende oplever vores studiemiljøer som levende og som mere end et uddannelsessted. 
 
 Dine kolleger 
 
 Socialrådgiveruddannelsen udbydes i Roskilde, Slagelse og Nykøbing F, og vi er en del af Center for Socialt Arbejde. Undervisningsopgaverne kan være placeret på både Campus Slagelse, Nykøbing F. og Roskilde, og dit primære ansættelsessted aftaler vi.  
 
 Du bliver en del af Center for Socialt Arbejde, hvor vi er 45 engagerede medarbejdere. Vi sætter pris på medarbejdere, der er glade for at samarbejde og har en respektfuld og uformel tone i et seriøst samarbejde, hvor vi har store ambitioner for uddannelsens udvikling.  
 
 Vi er en social og fagligt funderet medarbejdergruppe, hvor vi påskønner faglig sparring og udvikling i fællesskabet. Vi er derfor meget til stede på vores campus. Hjemmearbejde er en mulighed, men kun i det omfang, hvor det er muligt ift. arbejdsopgaverne. Derudover har vi en frokostordning med sund og varieret kost.  
 
 Sådan ansøger du 
 
 Ansættelse sker efter gældende overenskomst på statens område.  
 Stillingen er med et varierende timeantal som aftales forud for hvert semester, og vi vil gerne have, at du begynder snarest muligt.  
 Hvis du har nogle spørgsmål til stillingen, kan du kontakte uddannelsesleder Ann-Britt Lærkedahl på abld@pha.dk eller mobil 7248 2974 eller uddannelsesleder Christina Kjellerup Nielsen på ckni@pha.dk eller mobil 7248 2818.  
 Ansøgning og relevante bilag sendes via vores rekrutteringssystem her (https://phabsalon.dk/job-i-absalon/ledige-stillinger) eller ved at klikke på ”Søg stillingen” til højre på denne side senest d. 20. februar 2025.  
 Vi afholder ansættelsessamtaler løbende.  
 
 
 Vi ønsker, at medarbejderstaben afspejler det omgivende samfund, og vi opfordrer derfor alle interesserede uanset køn, kulturel og etnisk baggrund til at søge stillingen.  
 
 Om Absalon 
 
 Professionshøjskolen Absalon er Region Sjællands største uddannelsesinstitution, hvor vi med vores 13 uddannelser uddanner samfundets professionelle til både erhvervslivet og den offentlige sektor. Vi er fordelt på i alt syv campus.  
 
 Vores ambition er at bidrage til øget velfærd og vækst i Region Sjælland gennem fremragende uddannelser og rollen som regional udviklingspartner. Vores studerende og samarbejdspartnere er det ubestridte centrum for vores arbejde, lige som vi lægger vægt på at være en rigtig god, fællesskabsbaseret og udviklende arbejdsplads.  
 
 Vi er 800 medarbejdere, vi har 9.000 studerende på vores grunduddannelser og vi efter- og videreuddanner 3.500 kursister hvert år.",Sdr.Stationsvej 30,58,Danmark,265,Roskilde,4,"Hovedstaden, Sjælland og Bornholm",4000,Roskilde,1,1,Fuldtid,None,None,2,,Jurist,0,"Ekspert i levnedsmiddellovgivning, Virksomhedsjurist, Rådgiver inden for forbrugerret, Regulatory affairs manager, Ombudsmand, Notarmedarbejder, Mægler, Menneskerettighedskonsulent, Konkursforvalter, Forvalter af udgivelsesrettigheder, 3035, 3036, Notar",0,0,True,"{'Email': 'abld@pha.dk', 'PersonName': 'Ann-Britt Lærkedahl', 'FirstName': 'Ann-Britt', 'LastName': 'Lærkedahl', 'PositionTitle': 'Uddannelsesleder', 'PhoneNumbers': [{'Number': '7248 2974', 'Type': 0, 'Description': 'Primary'}]}, {'Email': 'ckni@pha.dk', 'PersonName': 'Christina Kjellerup Nielsen', 'FirstName': 'Christina Kjellerup', 'LastName': 'Nielsen', 'PositionTitle': 'Uddannelsesleder', 'PhoneNumbers': [{'Number': '7248 2818', 'Type': 0, 'Description': 'Primary'}]}",,True,False,False,False,4,,,False,False,False,False,False,False,,,,,https://candidate.hr-manager.net/ApplicationForm/SinglePageApplicationForm.aspx?cid=5001&departmentId=7794&ProjectId=186445&MediaId=5,False,2025-02-20T23:59:59+01:00,7,/CV/FindWork/GetLogo?JobAdId=eac3bf30-9f62-4578-b24d-be090277b254&Organisation=30874323,"Sdr.Stationsvej 30,4000, Roskilde",True,False,"/CV/Jobseeking/JobLog/CreateJobSearch?JobnetJobPostingIdentifier=eac3bf30-9f62-4578-b24d-be090277b254&Company.Name=Professionshøjskolen Absalon, Campus Slagelse&SubmissionDeadlineDate=2025-2-20&Title=Faste timelærere til socialrådgiveruddannelsen&WeeklyWorkTime=1",00000000-0000-0000-0000-000000000000,False,0,,,Faste timelærere til socialrådgiveruddannelsen,True,,True,1,,eac3bf30-9f62-4578-b24d-be090277b254,,,False,False,,0,False,"Professionshøjskolen Absalon, Campus Slagelse",Sdr.Stationsvej 30,,,4000,False,False,False,Roskilde,Ann-Britt Lærkedahl,7248 2974,abld@pha.dk,,,,,False,,2025-02-20T23:59:59+01:00,,0,False,0,,,,,0,,,,False,False,,,False,False,,,,False,,False,,,Arbejdspladsen ligger i Roskilde kommune,False,"Professionshøjskolen Absalon, Campus Slagelse",,None,,False,False,"Vi søger flere timelærere til socialrådgiveruddannelsen på Professionshøjskolen Absalon. Har du juridisk erfaring fra den socialfaglige praksis og indsigt i socialrådgiveruddannelsens opbygning? Så er det måske dig, vi søger til Center for Socialt Arbejde. 

 På Professionshøjskolen Absalon er det vores ambition, at de studerende oplever en fagligt","""Vi søger flere timelærere til socialrådgiveruddannelsen på Professionshøjskolen Absalon. Har du juridisk erfaring fra den socialfaglige praksis og indsigt i socialrådgiveruddannelsens opbygning? Så er det måske dig, vi søger til Center for Socialt Arbejde. \n\n På Professionshøjskolen Absalon er det vores ambition, at de studerende oplever en fagligt""","""Faste timelærere til socialrådgiveruddannelsen""","https://www.google.dk/maps/dir//Sdr.Stationsvej+30,4000,+Roskilde/","Vi søger flere timelærere til socialrådgiveruddannelsen på Professionshøjskolen Absalon. Har du juridisk erfaring fra den socialfaglige praksis og indsigt i socialrådgiveruddannelsens opbygning? Så er det måske dig, vi søger til Center for Socialt Arbejde.  
 
 På Professionshøjskolen Absalon er det vores ambition, at de studerende oplever en fagligt og socialt inkluderende studiestart, hvor de med det samme kan mærke deres kommende profession, uddannelse og studieliv. De bliver trænet i en professionel tilgang til arbejdet i studiegrupper, så de bliver bedst muligt rustet til deres kommende arbejdsliv. Vi ønsker at tilrettelægge et uddannelsesforløb, der giver de studerende de bedste forudsætninger og det bedste vidensgrundlag. Derfor er vi meget optaget af at finde dygtige og motiverende undervisere, som både har teoretisk og praktisk erfaring med det sociale arbejde.  
 
 Læs mere om Absalons vision, mission og uddannelsesambition her (https://chrome-extension/efaidnbmnnnibpcajpcglclefindmkaj/https:/a-net.pha.dk/system/files/2022-01/strategi-2025.pdf).  
 
 Din profil 
 
 Du er opdateret inden for det juridiske felt i relation til socialt arbejde og har flere års praksiserfaring, som du er god til at anvende via kobling mellem teori og praksis i din undervisning. Derudover er det vigtigt, at du kan genkende dig selv i følgende:  
 
 Praksiserfaring. 
 Du kommer måske fra beskæftigelsesområdet eller det specialiserede voksenområde, fx som juridisk ekspert/ borgerrådgiver i kommunalt regi, og så har du stort kendskab og erfaring med de retssikkerhedsmæssige og forvaltningsmæssige lovområder i praksis.  
 
 Du er samarbejdsdygtig. 
 Dit positive humør smitter af på dine omgivelser, også i travle perioder. Du er god til at samarbejde og sparre med dine kolleger, og du har et åbent og imødekommende syn på din arbejdsplads, dine kolleger og dine arbejdsopgaver.  
 
 Som underviser kan du få dine budskaber ud til alle de studerende, både mundtligt og skriftligt. Du er tålmodig og forstående som menneske og er klar på at udvikle og forandre eventuelle processer eller undervisning.  
 
 Du evner at have mange bolde i luften. 
 Du formår at holde hovedet koldt i situationer, hvor der er mange opgaver, og når der opstår uforudsete ændringer. Du er samtidig klar til at komme med et bud på, hvordan en given situation kan løses bedst muligt.  
 
 Derudover forventer vi os, at du: 
 
 er uddannet jurist eller cand.soc.jur.  
 
 
 Dine arbejdsopgaver 
 
 Din primære opgave er at undervise fremtidens socialrådgivere. Nærmere bestemt består dine arbejdsopgaver af:  
 
 At udvikle, planlægge og undervise på grunduddannelsen i det juridiske område.  
 Det sker i tæt sammenspil med dine teamkolleger, studerende og i samarbejde med såvel interne som eksterne partnere og aftagere. 
 
 At bidrage til et aktivt og spændende studiesocialt miljø. 
 Vi lægger vægt på, at vores studiemiljøer er præget af socialt liv og af glade og engagerede studerende, der kan få kompetent sparring og støtte både i studiegrupper og fra deres vejledere. I din rolle som timelærer bidrager du aktivt til, at de studerende oplever vores studiemiljøer som levende og som mere end et uddannelsessted. 
 
 Dine kolleger 
 
 Socialrådgiveruddannelsen udbydes i Roskilde, Slagelse og Nykøbing F, og vi er en del af Center for Socialt Arbejde. Undervisningsopgaverne kan være placeret på både Campus Slagelse, Nykøbing F. og Roskilde, og dit primære ansættelsessted aftaler vi.  
 
 Du bliver en del af Center for Socialt Arbejde, hvor vi er 45 engagerede medarbejdere. Vi sætter pris på medarbejdere, der er glade for at samarbejde og har en respektfuld og uformel tone i et seriøst samarbejde, hvor vi har store ambitioner for uddannelsens udvikling.  
 
 Vi er en social og fagligt funderet medarbejdergruppe, hvor vi påskønner faglig sparring og udvikling i fællesskabet. Vi er derfor meget til stede på vores campus. Hjemmearbejde er en mulighed, men kun i det omfang, hvor det er muligt ift. arbejdsopgaverne. Derudover har vi en frokostordning med sund og varieret kost.  
 
 Sådan ansøger du 
 
 Ansættelse sker efter gældende overenskomst på statens område.  
 Stillingen er med et varierende timeantal som aftales forud for hvert semester, og vi vil gerne have, at du begynder snarest muligt.  
 Hvis du har nogle spørgsmål til stillingen, kan du kontakte uddannelsesleder Ann-Britt Lærkedahl på abld@pha.dk eller mobil 7248 2974 eller uddannelsesleder Christina Kjellerup Nielsen på ckni@pha.dk eller mobil 7248 2818.  
 Ansøgning og relevante bilag sendes via vores rekrutteringssystem her (https://phabsalon.dk/job-i-absalon/ledige-stillinger) eller ved at klikke på ”Søg stillingen” til højre på denne side senest d. 20. februar 2025.  
 Vi afholder ansættelsessamtaler løbende.  
 
 
 Vi ønsker, at medarbejderstaben afspejler det omgivende samfund, og vi opfordrer derfor alle interesserede uanset køn, kulturel og etnisk baggrund til at søge stillingen.  
 
 Om Absalon 
 
 Professionshøjskolen Absalon er Region Sjællands største uddannelsesinstitution, hvor vi med vores 13 uddannelser uddanner samfundets professionelle til både erhvervslivet og den offentlige sektor. Vi er fordelt på i alt syv campus.  
 
 Vores ambition er at bidrage til øget velfærd og vækst i Region Sjælland gennem fremragende uddannelser og rollen som regional udviklingspartner. Vores studerende og samarbejdspartnere er det ubestridte centrum for vores arbejde, lige som vi lægger vægt på at være en rigtig god, fællesskabsbaseret og udviklende arbejdsplads.  
 
 Vi er 800 medarbejdere, vi har 9.000 studerende på vores grunduddannelser og vi efter- og videreuddanner 3.500 kursister hvert år.","https://www.google.dk/maps/place/Sdr.Stationsvej+30,4000,+Roskilde/",30874323,False,False,,False
