summary_AutomatchType,summary_Abroad,summary_Weight,summary_Title,summary_JobHeadline,summary_Presentation,summary_HiringOrgName,summary_WorkPlaceAddress,summary_WorkPlacePostalCode,summary_WorkPlaceCity,summary_WorkPlaceOtherAddress,summary_WorkPlaceAbroad,summary_WorkPlaceNotStatic,summary_UseWorkPlaceAddressForJoblog,summary_PostingCreated,summary_LastDateApplication,summary_FormattedLastDateApplication,summary_AssignmentStartDate,summary_IsHotjob,summary_IsExternal,summary_Url,summary_Region,summary_Municipality,summary_Country,summary_PostalCode,summary_PostalCodeName,summary_JobAnnouncementType,summary_EmploymentType,summary_WorkHours,summary_OccupationArea,summary_OccupationGroup,summary_Occupation,summary_Location_Latitude,summary_Location_Longitude,summary_JoblogWorkTime_WorkHour,summary_JoblogWorkTime_DailyWorkTime,summary_WorkplaceID,summary_OrganisationId,summary_HiringOrgCVR,summary_UserLoggedIn,summary_AnonymousEmployer,summary_ShareUrl,summary_DetailsUrl,summary_JobLogUrl,summary_HasLocationValues,summary_ID,summary_Latitude,summary_Longitude,details_WorkSchedule,details_WorkConditions,details_EmploymentTypes,details_WorkPlace_Name,details_WorkPlace_Address_AddressLine,details_WorkPlace_Address_Country_Id,details_WorkPlace_Address_Country_Name,details_WorkPlace_Address_Municipality_Id,details_WorkPlace_Address_Municipality_Name,details_WorkPlace_Address_Region_Id,details_WorkPlace_Address_Region_Name,details_WorkPlace_Address_PostalCode,details_WorkPlace_Address_City,details_WorkPlace_PhoneNumber_Number,details_WorkPlace_PhoneNumber_Type,details_WorkPlace_PhoneNumber_Description,details_WorkPlace_FaxNumber,details_WorkPlace_Email,details_WorkPlace_WebAddress,details_WorkPlace_Description,details_WorkPlace_Logo,details_WorkPlace_WorkPlaceOrganizationNumber,details_WorkPlace_OrganizationNumber,details_WorkPlace_OrganizationDescription,details_JobPositionPosting_Id,details_JobPositionPosting_HiringOrg_Name,details_JobPositionPosting_HiringOrg_Address_AddressLine,details_JobPositionPosting_HiringOrg_Address_Country_Id,details_JobPositionPosting_HiringOrg_Address_Country_Name,details_JobPositionPosting_HiringOrg_Address_Municipality_Id,details_JobPositionPosting_HiringOrg_Address_Municipality_Name,details_JobPositionPosting_HiringOrg_Address_Region_Id,details_JobPositionPosting_HiringOrg_Address_Region_Name,details_JobPositionPosting_HiringOrg_Address_PostalCode,details_JobPositionPosting_HiringOrg_Address_City,details_JobPositionPosting_HiringOrg_PhoneNumber_Number,details_JobPositionPosting_HiringOrg_PhoneNumber_Type,details_JobPositionPosting_HiringOrg_PhoneNumber_Description,details_JobPositionPosting_HiringOrg_FaxNumber,details_JobPositionPosting_HiringOrg_Email,details_JobPositionPosting_HiringOrg_WebAddress,details_JobPositionPosting_HiringOrg_Description,details_JobPositionPosting_HiringOrg_Logo,details_JobPositionPosting_HiringOrg_WorkPlaceOrganizationNumber,details_JobPositionPosting_HiringOrg_OrganizationNumber,details_JobPositionPosting_HiringOrg_OrganizationDescription,details_JobPositionPosting_RecruitingCompany,details_JobPositionPosting_PublicationStartDate,details_JobPositionPosting_PublicationEndDate,details_JobPositionPosting_JobPositionInformation_PositionTitle,details_JobPositionPosting_JobPositionInformation_Purpose,details_JobPositionPosting_JobPositionInformation_WorkLocation_AddressLine,details_JobPositionPosting_JobPositionInformation_WorkLocation_Country_Id,details_JobPositionPosting_JobPositionInformation_WorkLocation_Country_Name,details_JobPositionPosting_JobPositionInformation_WorkLocation_Municipality_Id,details_JobPositionPosting_JobPositionInformation_WorkLocation_Municipality_Name,details_JobPositionPosting_JobPositionInformation_WorkLocation_Region_Id,details_JobPositionPosting_JobPositionInformation_WorkLocation_Region_Name,details_JobPositionPosting_JobPositionInformation_WorkLocation_PostalCode,details_JobPositionPosting_JobPositionInformation_WorkLocation_City,details_JobPositionPosting_JobPositionInformation_EmploymentType,details_JobPositionPosting_JobPositionInformation_WeeklyWorkHours_TypeId,details_JobPositionPosting_JobPositionInformation_WeeklyWorkHours_TypeName,details_JobPositionPosting_JobPositionInformation_WeeklyWorkHours_Description,details_JobPositionPosting_JobPositionInformation_CompensationDescription,details_JobPositionPosting_JobPositionInformation_NumberToFill,details_JobPositionPosting_JobPositionInformation_DriverLicense,details_JobPositionPosting_JobPositionInformation_Occupation_Name,details_JobPositionPosting_JobPositionInformation_Occupation_DiscoWeb,details_JobPositionPosting_JobPositionInformation_Occupation_AlternateNames,details_JobPositionPosting_JobPositionInformation_Occupation_GroupId,details_JobPositionPosting_JobPositionInformation_Occupation_AreaId,details_JobPositionPosting_JobPositionInformation_IsGovernmentHiring,details_JobPositionPosting_JobPositionInformation_JppContacts,details_JobPositionPosting_JobPositionInformation_EmploymentDate,details_JobPositionPosting_IsRecruitmentOfForeignNationals,details_JobPositionPosting_IsWorkInDenmark,details_JobPositionPosting_IsAnonymousEmployer,details_JobPositionPosting_IsDisabilityFriendly,details_JobPositionPosting_JppType,details_JobPositionPosting_ApplicationDetails_WorkHourMax,details_JobPositionPosting_ApplicationDetails_WorkHourMin,details_JobPositionPosting_ApplicationDetails_DailyWorkTimeWeekend,details_JobPositionPosting_ApplicationDetails_DailyWorkTimeNight,details_JobPositionPosting_ApplicationDetails_DailyWorkTimeEvening,details_JobPositionPosting_ApplicationDetails_DailyWorkTimeDay,details_JobPositionPosting_ApplicationDetails_DailyWorkTimeMorning,details_JobPositionPosting_ApplicationDetails_DailyWorkTimeVarious,details_JobPositionPosting_ApplicationDetails_ReferenceText,details_JobPositionPosting_ApplicationDetails_RemarksToApplicant,details_JobPositionPosting_ApplicationDetails_ByEmail,details_JobPositionPosting_ApplicationDetails_ByPhone,details_JobPositionPosting_ApplicationDetails_ApplyViaUrl,details_JobPositionPosting_ApplicationDetails_ReplyInWriting,details_JobPositionPosting_ApplicationDetails_ApplicationDeadlineDate,details_JobPositionPosting_Status,details_LogoUrl,details_Address,details_ShowMap,details_ShowShareButtonJobLog,details_JobLogUrl,details_JobLogTemplateModel_Identifier,details_JobLogTemplateModel_UseWorkPlaceAddressForJoblog,details_JobLogTemplateModel_Category,details_JobLogTemplateModel_CvCustomerIdentifier,details_JobLogTemplateModel_JobSeekingStatus,details_JobLogTemplateModel_Title,details_JobLogTemplateModel_IsApplicationSourceRequired,details_JobLogTemplateModel_ApplicationSource,details_JobLogTemplateModel_IsWeeklyWorkTimeRequired,details_JobLogTemplateModel_WeeklyWorkTime,details_JobLogTemplateModel_HoursPerWeek,details_JobLogTemplateModel_JobnetJobPostingIdentifier,details_JobLogTemplateModel_JobAdDocument_Title,details_JobLogTemplateModel_JobAdDocument_Identifier,details_JobLogTemplateModel_JobAdDocument_IsDeletedBySystem,details_JobLogTemplateModel_JobAdDocument_IsDeletedByUser,details_JobLogTemplateModel_JobAdFile,details_JobLogTemplateModel_Company_JobLogEntryCategory,details_JobLogTemplateModel_Company_ShowAddressFieldsEvenIfEmpty,details_JobLogTemplateModel_Company_Name,details_JobLogTemplateModel_Company_Address,details_JobLogTemplateModel_Company_Country,details_JobLogTemplateModel_Company_EmploymentAreaID,details_JobLogTemplateModel_Company_PostCode,details_JobLogTemplateModel_Company_IsCountryAndTownAndPostCodeEmpty,details_JobLogTemplateModel_Company_IsTownAndPostCodeEmpty,details_JobLogTemplateModel_Company_IsCountryDanmark,details_JobLogTemplateModel_Company_Town,details_JobLogTemplateModel_Company_ContactPerson,details_JobLogTemplateModel_Company_Phone,details_JobLogTemplateModel_Company_Email,details_JobLogTemplateModel_Company_Latitude,details_JobLogTemplateModel_Company_Longitude,details_JobLogTemplateModel_Company_DailyTravelTimeInMinutes,details_JobLogTemplateModel_Company_DistanceToCompanyInMeters,details_JobLogTemplateModel_Company_IsCreateMode,details_JobLogTemplateModel_TypeOfSubmission,details_JobLogTemplateModel_SubmissionDate,details_JobLogTemplateModel_SubmissionDateFormatted,details_JobLogTemplateModel_SubmissionDateTiks,details_JobLogTemplateModel_IsSubmissionDateRequired,details_JobLogTemplateModel_Status,details_JobLogTemplateModel_DateCreatedFormatted,details_JobLogTemplateModel_DateCreated,details_JobLogTemplateModel_DateModifiedFormatted,details_JobLogTemplateModel_DateModified,details_JobLogTemplateModel_LastModifiedDateTiks,details_JobLogTemplateModel_DateClosed,details_JobLogTemplateModel_JobApplicationDocument_Title,details_JobLogTemplateModel_JobApplicationDocument_Identifier,details_JobLogTemplateModel_JobApplicationDocument_IsDeletedBySystem,details_JobLogTemplateModel_JobApplicationDocument_IsDeletedByUser,details_JobLogTemplateModel_CvDocument_Title,details_JobLogTemplateModel_CvDocument_Identifier,details_JobLogTemplateModel_CvDocument_IsDeletedBySystem,details_JobLogTemplateModel_CvDocument_IsDeletedByUser,details_JobLogTemplateModel_JobApplicationFile,details_JobLogTemplateModel_CvFile,details_JobLogTemplateModel_SubmissionDeadlineDate,details_JobLogTemplateModel_IsPersisted,details_JobLogTemplateModel_ServerValidationErrors,details_JobLogTemplateModel_HasServerValidationErrors,details_JoblogWorkTime_WorkHour,details_JoblogWorkTime_DailyWorkTime,details_Place,details_OpenPrintDialog,details_WorkPlaceInfoText,details_JobCenterContactDetails,details_WorkPlaceDescriptionText,details_FavoriteText,details_IsFavorite,details_ShowFavorite,details_MetaOgTextForSharing,details_DescriptionForSharing,details_TitleForSharing,details_RutePlan,details_FormattedPurpose,details_MapUrl,details_OrganizationNumber,details_ShowSearchJobButton,details_ShowPrint,details_BackToFindWorkButtonUrl,isExternal
0,False,1,"Har du kompetencer inden for risikostyring, revision eller compliance? Vi søger en bred profil til vores interne revision","Har du kompetencer inden for risikostyring, revision eller compliance? Vi søger en bred profil til vores interne revision","Vil du være del af en værdiskabende intern revision, der har til formål at sikre velfungerende og effektive processer i Andel, og bidrage til, at den grønne omstilling kommer godt derudad. ",Finans,   ,4100,Ringsted,True,False,False,False,2025-01-22T00:00:00,2025-02-12T23:59:00,12. februar 2025,0001-01-01T00:00:00,False,False,https://job.jobnet.dk/CV/FindWork/Details/f7af029b-42ed-4f46-8405-6fa410d72c03,Øvrige Sjælland,Ringsted,Danmark,4100,,Almindelige vilkår,Fastansættelse,Fuldtid,Akademisk arbejde,Økonomi og revision,Revisor,55.4305,11.8281,,,1003170503,,25784413,False,False,https://job.jobnet.dk/CV/FindWork/DetailsSocialmedia/f7af029b-42ed-4f46-8405-6fa410d72c03,https://job.jobnet.dk/CV/FindWork/Details/f7af029b-42ed-4f46-8405-6fa410d72c03,https://job.jobnet.dk/CV/FindWork/Details/f7af029b-42ed-4f46-8405-6fa410d72c03,True,f7af029b-42ed-4f46-8405-6fa410d72c03,55.4305,11.8281,"{'Id': 1, 'Name': 'Fuldtid'}, {'Id': 16, 'Name': 'Deltid'}","{'Id': 1, 'Name': 'Almindelige vilkår'}, {'Id': 2, 'Name': 'Fleksjob'}, {'Id': 3, 'Name': 'Skånejob'}, {'Id': 4, 'Name': 'Egnet til efterlønnere og seniorer'}, {'Id': 5, 'Name': 'Job med løntilskud'}, {'Id': 6, 'Name': 'Rotationsjob'}, {'Id': 7, 'Name': 'Virksomhedspraktik'}","{'Id': 1, 'Name': 'Fastansættelse'}, {'Id': 16, 'Name': 'Tidsbegrænset ansættelse'}",Finans,,58,Danmark,329,Ringsted,4,"Hovedstaden, Sjælland og Bornholm",4100,,,0,Primary,,,https://www.ofir.dk/resultat/Jobannonce.aspx?ofirId=da8409bf&action=sendApplicationUrl&utm_source=job.jobnet.dk&utm_medium=referral,None,,1003170503,25784413,None,f7af029b-42ed-4f46-8405-6fa410d72c03,Finans,,58,Danmark,329,Ringsted,4,"Hovedstaden, Sjælland og Bornholm",4100,,,0,Primary,,,https://www.ofir.dk/resultat/Jobannonce.aspx?ofirId=da8409bf&action=sendApplicationUrl&utm_source=job.jobnet.dk&utm_medium=referral,None,,1003170503,25784413,None,,2025-01-22T00:00:00+01:00,2025-02-12T23:59:00+01:00,"Har du kompetencer inden for risikostyring, revision eller compliance? Vi søger en bred profil til vores interne revision","Vil du være del af en værdiskabende intern revision, der har til formål at sikre velfungerende og effektive processer i Andel, og bidrage til, at den grønne omstilling kommer godt derudad. Og er du motiveret af en hverdag, hvor du får en god balance mellem arbejde og fritid?   ""Du kommer til at understøtte Andel koncernens fortsatte udvikling gennem værdiskabende revisionsopgaver. Det vil være bl.a. være dig og dine nærmeste kollegaers observationer og anbefalinger, der bidrager til, at Andel har effektive processer, der samtidig understøtter koncernens grønne ambitioner "",  fortæller din kommende afdelingsleder Linda Tanggaard.   Andel - et andelsselskab, der er med til at skabe en grønnere fremtid, og hvor energi er mere end blot en leverance   Vi har i Andel sat os langsigtede mål indenfor den grønne omstilling og tager ansvar for det samfund, vi er en del af. Som medarbejder i Andel er du med til at realisere og bringe os tættere på det mål hver dag. Du vil være en del af en stor finansafdeling på godt 85 kollegaer, og i specifikt Intern Revision får du 3 nærmeste kolleger. Vi udfører både opgaver individuelt og i fællesskab, og vi er altid i tæt, løbende dialog med hinanden.   Din base vil være i Svinninge, der ligger 40 minutter fra Roskilde - 1 time fra København (dog den helt rigtige vej i forhold til trafikken). Vi har flere lokationer, så når du besøger dine kolleger i både Virum, Ballerup og Haslev, får du masser af afveksling.   Du har stor indflydelse på at sammensætte din egen hverdag, og derfor vil der være mulighed for at arbejde hjemme et par gange om ugen.   Revisionsopgaver og forbedringsinitativer   Som en del af vores opgaver i Intern Revision kommer du rundt til alle vores forskellige forretningsenheder. Vi står for interne revision i alle forretningsområder på tværs af hele Andel (og datterselskaber). Her skaber du tætte relationer på tværs af koncernen, når du har dialog med ledelsen og dine kolleger i forbindelse med revisionsbesøgene.   Hvis du er nysgerrig på hvilke forretningsenheder, du kommer til at arbejde med, så er kan du få et overblik i vores selskabsopbygning her:  Selskabsstruktur – Andel   Vi leverer skriftligt materiale til f.eks. forskellige udvalg samt til direktørerne i koncernen. Én af dine vigtigste opgaver bliver at formidle vores fælles observationer og anbefalinger fra f.eks. vores revisionsrapporter i et sprog der både er korrekt og let forståeligt til forskellige modtagere.   Derudover er du løbende med til at bidrage med nye forbedringsforslag til koncernens kontroller og de processer, vi arbejder med.   Du kommer til at:     bidrage til den årlige revisionsplan   forberede og udføre revisionsbesøg samt udarbejde revisionsrapporter   følge op med forretningsområderne   ansvarlig for et revisionsområde og kommunikation med stakeholders   bidrage til den løbene udvikling af den intern revision     God til mennesker og risikostyring, revision eller compliance   Du har typisk en baggrund som revisor, riskmanager, analytiker eller inden for compliance, og mindst 3 års erfaring.   Din evne til at tale med alle slags mennesker er lige så veludviklet som din flair for at sætte dig ind i forskellige forretningsområder. For du har en god forståelse for andres anliggender og for vigtigheden af at være opmærksom – hvad end det er direktøren eller eleven, du taler med.   Vi forestiller os, at du:     er uddannet på kandidatniveau - det er ikke et krav om at være uddannet revisor   har erfaring med intern/ekstern revision eller har anden relevant erfaring inden for risikostyring og compliance   har indsigt i dataanalyse eller kendskab til IT-revision    mestrer skriftlig formidling og er god til at finde de vigtigste pointer i en tekst, med evnen til at formidle dem i et let forståeligt sprog   trives i at have flere opgaver kørende sideløbende   kan arbejde selvstændigt og proaktivt.     Vi kombinerer formål, faglighed og fællesskab   Du bliver en del af en arbejdsplads, der arbejder midt i den grønne omstilling, hvor forandringer er en naturlig del af vores spændende fælles rejse og hverdag.   Vi tager os godt af vores kolleger og har fokus på din personlige og faglige udvikling. Du kommer til at deltage i fælles onboarding-dage, hvor du bl.a. hører om vores bæredygtighedsstrategi og møder andre nye kolleger fra hele koncernen. Hos os får du desuden fleksible arbejdstider, forsikringsordninger, adgang til motionsrum,   betalt mobiltelefon og internetadgang samt mulighed for en APV-godkendt hjemmearbejdsplads. Løn gives efter kvalifikationer.   Et andelsselskab i bevægelse – vil du med på rejsen?   Lyder stillingen som noget for dig, så send din ansøgning og dit CV hurtigst muligt via annoncen her. Hvis du har spørgsmål, er du velkommen til at kontakte afdelingsleder Linda Tanggaard på 20 49 30 74.   Samtalerne afholdes løbende, og vi ansætter, når vi har fundet den rette kandidat. Sidste frist for ansøgning er den 12. februar 2025.   Vi glæder os til at høre fra dig!   For at sikre gældende GDPR-lovgivning modtager vi kun ansøgninger via jobannoncen. 
 Denne jobannonce blev oprindeligt opslået på  https://www.ofir.dk/ 
 (Den originale annonce kan ses på:  https://www.ofir.dk/showojob?ofirid=da8409bf )",,58,Danmark,329,Ringsted,4,"Hovedstaden, Sjælland og Bornholm",4100,,1,1,Fuldtid,None,None,1,,Revisor,0,"Revisor inden for offentlig forvaltning, 5662",0,0,False,,,False,False,False,False,4,,,False,False,False,False,False,False,,,,,https://www.ofir.dk/resultat/Jobannonce.aspx?ofirId=da8409bf&action=sendApplicationUrl&utm_source=job.jobnet.dk&utm_medium=referral,False,2025-02-12T23:59:00+01:00,7,/CV/FindWork/GetLogo?JobAdId=f7af029b-42ed-4f46-8405-6fa410d72c03&Organisation=25784413,",4100, ",False,False,"/CV/Jobseeking/JobLog/CreateJobSearch?JobnetJobPostingIdentifier=f7af029b-42ed-4f46-8405-6fa410d72c03&Company.Name=Finans&SubmissionDeadlineDate=2025-2-12&Title=Har du kompetencer inden for risikostyring, revision eller compliance? Vi søger en bred profil til vores interne revision&WeeklyWorkTime=1",00000000-0000-0000-0000-000000000000,False,0,,,"Har du kompetencer inden for risikostyring, revision eller compliance? Vi søger en bred profil til vores interne revision",True,,True,1,,f7af029b-42ed-4f46-8405-6fa410d72c03,,,False,False,,0,False,Finans,,,,4100,False,False,False,,,,,,,,,False,,2025-02-12T23:59:00+01:00,,0,False,0,,,,,0,,,,False,False,,,False,False,,,,False,,False,,,Arbejdspladsen ligger i Ringsted kommune,False,Finans,,None,,False,False,"Vil du være del af en værdiskabende intern revision, der har til formål at sikre velfungerende og effektive processer i Andel, og bidrage til, at den grønne omstilling kommer godt derudad. Og er du motiveret af en hverdag, hvor du får en god balance mellem arbejde og fritid?  Du kommer til at understøtte Andel koncernens fortsatte udvikling gennem ","""Vil du være del af en værdiskabende intern revision, der har til formål at sikre velfungerende og effektive processer i Andel, og bidrage til, at den grønne omstilling kommer godt derudad. Og er du motiveret af en hverdag, hvor du får en god balance mellem arbejde og fritid?  Du kommer til at understøtte Andel koncernens fortsatte udvikling gennem ""","""Har du kompetencer inden for risikostyring, revision eller compliance? Vi søger en bred profil til vores interne revision""","https://www.google.dk/maps/dir//,4100,+/","Vil du være del af en værdiskabende intern revision, der har til formål at sikre velfungerende og effektive processer i Andel, og bidrage til, at den grønne omstilling kommer godt derudad. Og er du motiveret af en hverdag, hvor du får en god balance mellem arbejde og fritid?   ""Du kommer til at understøtte Andel koncernens fortsatte udvikling gennem værdiskabende revisionsopgaver. Det vil være bl.a. være dig og dine nærmeste kollegaers observationer og anbefalinger, der bidrager til, at Andel har effektive processer, der samtidig understøtter koncernens grønne ambitioner "",  fortæller din kommende afdelingsleder Linda Tanggaard.   Andel - et andelsselskab, der er med til at skabe en grønnere fremtid, og hvor energi er mere end blot en leverance   Vi har i Andel sat os langsigtede mål indenfor den grønne omstilling og tager ansvar for det samfund, vi er en del af. Som medarbejder i Andel er du med til at realisere og bringe os tættere på det mål hver dag. Du vil være en del af en stor finansafdeling på godt 85 kollegaer, og i specifikt Intern Revision får du 3 nærmeste kolleger. Vi udfører både opgaver individuelt og i fællesskab, og vi er altid i tæt, løbende dialog med hinanden.   Din base vil være i Svinninge, der ligger 40 minutter fra Roskilde - 1 time fra København (dog den helt rigtige vej i forhold til trafikken). Vi har flere lokationer, så når du besøger dine kolleger i både Virum, Ballerup og Haslev, får du masser af afveksling.   Du har stor indflydelse på at sammensætte din egen hverdag, og derfor vil der være mulighed for at arbejde hjemme et par gange om ugen.   Revisionsopgaver og forbedringsinitativer   Som en del af vores opgaver i Intern Revision kommer du rundt til alle vores forskellige forretningsenheder. Vi står for interne revision i alle forretningsområder på tværs af hele Andel (og datterselskaber). Her skaber du tætte relationer på tværs af koncernen, når du har dialog med ledelsen og dine kolleger i forbindelse med revisionsbesøgene.   Hvis du er nysgerrig på hvilke forretningsenheder, du kommer til at arbejde med, så er kan du få et overblik i vores selskabsopbygning her:  Selskabsstruktur – Andel   Vi leverer skriftligt materiale til f.eks. forskellige udvalg samt til direktørerne i koncernen. Én af dine vigtigste opgaver bliver at formidle vores fælles observationer og anbefalinger fra f.eks. vores revisionsrapporter i et sprog der både er korrekt og let forståeligt til forskellige modtagere.   Derudover er du løbende med til at bidrage med nye forbedringsforslag til koncernens kontroller og de processer, vi arbejder med.   Du kommer til at:     bidrage til den årlige revisionsplan   forberede og udføre revisionsbesøg samt udarbejde revisionsrapporter   følge op med forretningsområderne   ansvarlig for et revisionsområde og kommunikation med stakeholders   bidrage til den løbene udvikling af den intern revision     God til mennesker og risikostyring, revision eller compliance   Du har typisk en baggrund som revisor, riskmanager, analytiker eller inden for compliance, og mindst 3 års erfaring.   Din evne til at tale med alle slags mennesker er lige så veludviklet som din flair for at sætte dig ind i forskellige forretningsområder. For du har en god forståelse for andres anliggender og for vigtigheden af at være opmærksom – hvad end det er direktøren eller eleven, du taler med.   Vi forestiller os, at du:     er uddannet på kandidatniveau - det er ikke et krav om at være uddannet revisor   har erfaring med intern/ekstern revision eller har anden relevant erfaring inden for risikostyring og compliance   har indsigt i dataanalyse eller kendskab til IT-revision    mestrer skriftlig formidling og er god til at finde de vigtigste pointer i en tekst, med evnen til at formidle dem i et let forståeligt sprog   trives i at have flere opgaver kørende sideløbende   kan arbejde selvstændigt og proaktivt.     Vi kombinerer formål, faglighed og fællesskab   Du bliver en del af en arbejdsplads, der arbejder midt i den grønne omstilling, hvor forandringer er en naturlig del af vores spændende fælles rejse og hverdag.   Vi tager os godt af vores kolleger og har fokus på din personlige og faglige udvikling. Du kommer til at deltage i fælles onboarding-dage, hvor du bl.a. hører om vores bæredygtighedsstrategi og møder andre nye kolleger fra hele koncernen. Hos os får du desuden fleksible arbejdstider, forsikringsordninger, adgang til motionsrum,   betalt mobiltelefon og internetadgang samt mulighed for en APV-godkendt hjemmearbejdsplads. Løn gives efter kvalifikationer.   Et andelsselskab i bevægelse – vil du med på rejsen?   Lyder stillingen som noget for dig, så send din ansøgning og dit CV hurtigst muligt via annoncen her. Hvis du har spørgsmål, er du velkommen til at kontakte afdelingsleder Linda Tanggaard på 20 49 30 74.   Samtalerne afholdes løbende, og vi ansætter, når vi har fundet den rette kandidat. Sidste frist for ansøgning er den 12. februar 2025.   Vi glæder os til at høre fra dig!   For at sikre gældende GDPR-lovgivning modtager vi kun ansøgninger via jobannoncen. 
 Denne jobannonce blev oprindeligt opslået på  https://www.ofir.dk/ 
 (Den originale annonce kan ses på:  https://www.ofir.dk/showojob?ofirid=da8409bf )","https://www.google.dk/maps/place/,4100,+/",25784413,False,False,,False
